sentence_id,sentence,repo,revision,iso_code,nll,ppl
759,"Montevideo ligt beneden de evenaar, dus als het daar zomer is, is het winter op het noordelijk halfrond en andersom.",BeetleLM/beetlelm_nld-ukr_balanced,step-5000,nld,6.417510509490967,612.4764602840049
760,Montevideo bevindt zich in de subtropen. In de zomermaanden komen gerust temperaturen hoger dan +30°C voor.,BeetleLM/beetlelm_nld-ukr_balanced,step-5000,nld,6.799906253814697,897.7631258370147
761,"De winter kan bedrieglijk koud zijn: de temperatuur gaat bijna nooit onder nul, maar de wind in combinatie met de luchtvochtigheid zorgt ervoor dat het kouder aanvoelt dan dat de thermometer aangeeft.",BeetleLM/beetlelm_nld-ukr_balanced,step-5000,nld,6.677591800689697,794.4037241231479
762,"Het regenniveau blijft gedurende het hele jaar ongeveer gelijk, zonder herkenbare 'natte' en 'droge' perioden.",BeetleLM/beetlelm_nld-ukr_balanced,step-5000,nld,7.829797744750977,2514.4207671882614
763,"Veel van de dieren in het park zijn eraan gewend mensen te zien, maar wilde dieren zijn uiteindelijk wel gewoon wild. Daarom moeten ze niet worden gevoerd of gestoord.",BeetleLM/beetlelm_nld-ukr_balanced,step-5000,nld,6.015722274780273,409.8217359485704
764,"Houd in het park minstens 100 meter afstand van beren en wolven, en 25 meter van alle andere wilde dieren.",BeetleLM/beetlelm_nld-ukr_balanced,step-5000,nld,6.623413562774658,752.5094560885128
765,"Elanden, bizons, rendieren, beren en ongeveer alle andere grote dieren kunnen u aanvallen, hoe tam ze ook lijken.",BeetleLM/beetlelm_nld-ukr_balanced,step-5000,nld,6.66451358795166,784.0819852858094
766,"Elk jaar raken tientallen bezoekers gewond omdat ze geen gepaste afstand houden. Deze dieren zijn groot, wilde en mogelijk gevaarlijk, dus geef ze de ruimte.",BeetleLM/beetlelm_nld-ukr_balanced,step-5000,nld,6.950331687927246,1043.4957857398351
767,"Bovendien moet u zich ervan bewust zijn dat geuren beren en andere wilde dieren aantrekken, dus vermijd het dragen of koken van geurend voedsel en houd de kampeerplek schoon.",BeetleLM/beetlelm_nld-ukr_balanced,step-5000,nld,7.568439483642578,1936.1165813105076
768,De hoofdstad van Samoa is Apia en de stad met bijna 40.000 inwoners ligt op het eiland Upolu.,BeetleLM/beetlelm_nld-ukr_balanced,step-5000,nld,6.3383965492248535,565.8882096395469
769,Rond het jaar 1850 werd Apia opgericht en het is de officiële hoofdstad van Samoa vanaf 1959.,BeetleLM/beetlelm_nld-ukr_balanced,step-5000,nld,6.675246238708496,792.542584512556
770,"In 1889 wilden zeven schepen uit Duitsland, de VS en Groot-Brittannië de haven niet verlaten. Dit kwam later bekend te staan als de beruchte patstelling.",BeetleLM/beetlelm_nld-ukr_balanced,step-5000,nld,6.750007152557373,854.0648712522969
771,Met uitzondering van een Brits slagschip werden alle schepen tot zinken gebracht. Bijna 200 Amerikanen en Duitsers verloren hun leven.,BeetleLM/beetlelm_nld-ukr_balanced,step-5000,nld,7.340356826782227,1541.2619791095879
772,"In de onafhankelijkheidsstrijd door de Mau-beweging kwam de hoogste leider, Tupua Tamasese Lealofi III, om bij een uit de hand gelopen geweldloze bijeenkomst in de stad.",BeetleLM/beetlelm_nld-ukr_balanced,step-5000,nld,7.110118865966797,1224.293064221711
773,"Er zijn veel stranden, met name vanwege de twee havens van Auckland. De meest populaire zijn gelegen in drie gebieden.",BeetleLM/beetlelm_nld-ukr_balanced,step-5000,nld,6.344922065734863,569.5929971739383
774,"De stranden van North Shore in het district North Harbour strekken zich van noord tot zuid uit langs de Grote Oceaan, van Long Bay naar Devonport.",BeetleLM/beetlelm_nld-ukr_balanced,step-5000,nld,7.555942535400391,1912.0715900408734
775,Dit zijn nagenoeg allemaal zandstranden waar veilig kan worden gezwommen en de meeste hebben pohutukawa-bomen die schaduw bieden.,BeetleLM/beetlelm_nld-ukr_balanced,step-5000,nld,7.329777240753174,1525.042016939101
776,"Bij Waitemata's haven, in de luxe voorsteden van Mission Bay en St Heliers, gelegen in Central Auckland, vind je de Tamaki Drive-stranden.",BeetleLM/beetlelm_nld-ukr_balanced,step-5000,nld,7.077690124511719,1185.2276259263106
777,Deze familiestranden zijn soms drukbezocht en hebben aan de kust een goed aanbod aan winkels . Zwemmen is niet onveilig.,BeetleLM/beetlelm_nld-ukr_balanced,step-5000,nld,6.830032825469971,925.221182800748
778,"'Number One' is het belangrijkste plaatselijke bier dat geen complex bier, maar aangenaam en verfrissend is. Het andere plaatselijke bier heeft de naam 'Manta'.",BeetleLM/beetlelm_nld-ukr_balanced,step-5000,nld,6.981812953948975,1076.8689120839979
779,"Er zijn veel Franse wijnen te vinden, maar de Nieuw-Zeelandse en Australische wijnen zijn wellicht beter geschikt voor reizen.",BeetleLM/beetlelm_nld-ukr_balanced,step-5000,nld,6.65558385848999,777.1115138124379
780,"Het lokale drinkwater kan gewoon veilig worden gedronken, maar fleswater is ook gemakkelijk te vinden als je het niet vertrouwt.",BeetleLM/beetlelm_nld-ukr_balanced,step-5000,nld,6.774742126464844,875.45357761473
781,"Een 'flat white' is een vreemd concept voor Australiërs. Zwarte koffie is 'espresso', cappuccino heeft heel veel koffiemelk (zonder schuim) en thee wordt geserveerd zonder melk.",BeetleLM/beetlelm_nld-ukr_balanced,step-5000,nld,7.87692928314209,2635.7664278507646
782,"De warme chocolademelk is van Belgische kwaliteit. Vruchtensappen zijn duur, maar geweldig.",BeetleLM/beetlelm_nld-ukr_balanced,step-5000,nld,7.1416096687316895,1263.4605060122537
783,Er vinden het hele jaar tochten naar het rif plaats en letsel naar aanleiding van deze tochten naar het rif zijn zeldzaam.,BeetleLM/beetlelm_nld-ukr_balanced,step-5000,nld,6.244179725646973,515.0066049087206
784,Vraag desondanks deskundig advies en volg alle borden en veiligheidswaarschuwingen op.,BeetleLM/beetlelm_nld-ukr_balanced,step-5000,nld,7.945319652557373,2822.334483669235
785,Kubuskwallen komen van oktober tot april voor in de buurt van stranden en riviermondingen ten noorden van Town of 1770. Soms komen ze ook buiten deze periode voor.,BeetleLM/beetlelm_nld-ukr_balanced,step-5000,nld,6.8299760818481445,925.1686838893489
786,"Haaien komen wel degelijk voor, maar ze vallen zelden mensen aan. Het merendeel van de haaien is bang voor mensen en zou juist wegzwemmen.",BeetleLM/beetlelm_nld-ukr_balanced,step-5000,nld,6.26801872253418,527.4313541315181
787,De belangrijkste habitat van zoutwaterkrokodillen bevindt zich in de riviermondingen ten noorden van Rockhampton en ze leven normaliter niet in de oceaan.,BeetleLM/beetlelm_nld-ukr_balanced,step-5000,nld,7.106600284576416,1219.992859176817
788,"Vooraf reserveren zorgt voor gemoedsrust bij de reiziger, wetende dat hij een plek heeft om te slapen wanneer hij op zijn bestemming arriveert.",BeetleLM/beetlelm_nld-ukr_balanced,step-5000,nld,6.7503533363342285,854.3605858379494
789,"Reisbureaus hebben vaak deals met bepaalde hotels, al kun je meestal via een reisbureau ook andere accommodatievormen, zoals een campingplek, boeken.",BeetleLM/beetlelm_nld-ukr_balanced,step-5000,nld,6.923833847045898,1016.2085238057728
790,Reisbureaus bieden vaak pakketten met ontbijt en vervoer van en naar het vliegveld aan en soms zelfs pakketten met vlucht en hotel.,BeetleLM/beetlelm_nld-ukr_balanced,step-5000,nld,7.454509735107422,1727.6367879421452
791,Ze kunnen je ook reservering vasthouden als je nog wat langer over de aanbieding wilt nadenken of als je documenten voor je bestemming moet verwerven (bijv. visum).,BeetleLM/beetlelm_nld-ukr_balanced,step-5000,nld,6.8653364181518555,958.4682316824835
792,"Als u een verzoek hebt of een wijziging wilt maken, moet u dit echter via het reisbureau doen in plaats van het hotel.",BeetleLM/beetlelm_nld-ukr_balanced,step-5000,nld,6.68011474609375,796.4104917660222
793,Voor sommige festivals geldt dat de meerderheid van de aanwezigen op muziekfestivals ervoor kiest om ter plekke te kamperen en de meeste bezoekers beschouwen dit als een belangrijk onderdeel van de ervaring.,BeetleLM/beetlelm_nld-ukr_balanced,step-5000,nld,7.4175705909729,1664.9836640298029
794,"Als u dicht bij de actie wilt zijn, moet u vroeg zijn om een kampeerplek in de buurt van de muziek te bemachtigen.",BeetleLM/beetlelm_nld-ukr_balanced,step-5000,nld,5.653445720672607,285.27274443987
795,"En onthoud het volgende: ook als de muziek op de hoofdpodia is afgelopen, wordt er mogelijk op andere delen van het festivalterrein tot in de late uurtjes muziek gedraaid.",BeetleLM/beetlelm_nld-ukr_balanced,step-5000,nld,6.915938854217529,1008.2171522179658
796,"Voor gezinnen waarvan de kinderen nog jong zijn, zijn er op sommige festivals speciale kampeerterreinen.",BeetleLM/beetlelm_nld-ukr_balanced,step-5000,nld,7.405357837677002,1644.7732926389253
797,"Let goed op waar uw hut zit als u 's winters de Oostzee overgaat, want de tocht door het ijs maakt een enorm lawaai. als u te dichtbij zit.",BeetleLM/beetlelm_nld-ukr_balanced,step-5000,nld,6.319364547729492,555.2200644782337
798,Cruises naar Sint-Petersburg omvatten tijd om de stad te verkennen. Passagiers van de cruise zijn vrijgesteld van de visumvereisten (controleer de voorwaarden).,BeetleLM/beetlelm_nld-ukr_balanced,step-5000,nld,6.847248077392578,941.2869902314359
799,Casino's zetten zich doorgaans in om het meeste te halen uit de tijd en het geld dat gasten besteden. Ramen en klokken zijn normaal gesproken niet aanwezig en de uitgang is soms moeilijk te vinden.,BeetleLM/beetlelm_nld-ukr_balanced,step-5000,nld,6.4681077003479,644.263433277885
800,"Ze hebben normaal gesproken speciaal aanbiedingen op het gebied van eten, drinken en entertainment om ze in een goede stemming te houden en om te voorkomen dat ze vertrekken.",BeetleLM/beetlelm_nld-ukr_balanced,step-5000,nld,6.120787143707275,455.2228793344373
801,"Sommige locaties bieden gratis alcoholische dranken aan. Als mensen dronken zijn, beïnvloedt dat echter hun beoordelingsvermogen en alle doorgewinterde gokkers weten dat het enorm belangrijk is om nuchter te blijven.",BeetleLM/beetlelm_nld-ukr_balanced,step-5000,nld,7.459702014923096,1736.6304902688528
802,"Als je op hoog de bergen in gaat of over bergpassen gaat rijden, moet je er rekening mee houden dat er sneeuw of ijs kan liggen en de temperatuur ontzettend laag kan zijn.",BeetleLM/beetlelm_nld-ukr_balanced,step-5000,nld,6.139010429382324,463.59458421782875
803,Op ijzige en besneeuwde wegen is er weinig frictie en het rijdt hierdoor anders dan asfalt.,BeetleLM/beetlelm_nld-ukr_balanced,step-5000,nld,6.963558197021484,1057.3892708494036
804,Tijdens sneeuwstormen kan er in een hele korte periode genoeg sneeuw vallen om vast te komen te zitten.,BeetleLM/beetlelm_nld-ukr_balanced,step-5000,nld,6.644049167633057,768.1992715326113
805,Ook kan het zicht belemmerd worden door vallende of opwaaiende sneeuw of doordat er condensatie of ijs op de ruiten van het voertuig zit.,BeetleLM/beetlelm_nld-ukr_balanced,step-5000,nld,6.674971103668213,792.3245582713447
806,Aan de andere kant zijn ijs en sneeuw in veel landen normaal en wordt het verkeer hier niet door belemmerd.,BeetleLM/beetlelm_nld-ukr_balanced,step-5000,nld,6.102591037750244,447.01450231734293
807,"De grootste toeristische Afrikaanse trekpleister zijn safari's, die voor veel bezoekers het hoogtepunt van hun reis vormen.",BeetleLM/beetlelm_nld-ukr_balanced,step-5000,nld,6.9735026359558105,1067.9568712241487
808,"Het begrip safari verwijst in populair gebruik naar reizen over land om de prachtige Afrikaanse wilde dieren te bekijken, met name op de savanne.",BeetleLM/beetlelm_nld-ukr_balanced,step-5000,nld,6.746921539306641,851.4336189697115
809,"Sommige dieren, zoals olifanten en giraffen, komen vaak dicht bij auto's en een standaarduitrusting maakt een goed uitzicht mogelijk.",BeetleLM/beetlelm_nld-ukr_balanced,step-5000,nld,6.525814533233643,682.5354951370904
810,"Als je leeuwen, cheeta's en luipaarden wilt zien, heb je een verrekijker nodig. Anders is de kans klein dat je ze ziet.",BeetleLM/beetlelm_nld-ukr_balanced,step-5000,nld,5.696441173553467,297.8056741278549
811,Een wandelsafari (ook wel een 'boswandeling' of 'loopsafari' genoemd) houdt in dat je meerdere uren of dagen achter elkaar loopt.,BeetleLM/beetlelm_nld-ukr_balanced,step-5000,nld,6.888334274291992,980.76636807177
812,De Paralympics zijn van 24 augustus tot 5 september 2021. Sommige onderdelen worden op andere locaties in Japan gespeeld.,BeetleLM/beetlelm_nld-ukr_balanced,step-5000,nld,7.568170547485352,1935.5959595673307
813,Tokio wordt de enige Aziatische stad zijn waar de Olympische Spelen twee keer hebben plaatsgevonden. De eerste keer was in 1964.,BeetleLM/beetlelm_nld-ukr_balanced,step-5000,nld,6.340877056121826,567.2936416177057
814,"Als je al voordat het uitstel werd aangekondigd vluchten en accommodatie voor 2020 hebt geboekt, kun je in een penibele situatie zitten.",BeetleLM/beetlelm_nld-ukr_balanced,step-5000,nld,6.908175945281982,1000.4207547923214
815,"Het annuleringsbeleid varieert, maar vanaf eind maart zijn de meeste op coronavirus gebaseerde annuleringsbeleidslijnen niet meer geldig tot juli 2020, toen de Olympische Spelen waren gepland.",BeetleLM/beetlelm_nld-ukr_balanced,step-5000,nld,7.665512561798096,2133.486045184921
816,Naar verwachtingen kosten de meeste kaartjes voor evenementen tussen ¥ 2.500 en ¥ 130.000. Normale kaartjes gaan rond ¥ 7.000 kosten.,BeetleLM/beetlelm_nld-ukr_balanced,step-5000,nld,6.767036437988281,868.733529619817
817,"Je kunt vochtige kleren drogen door ze te strijken. Veel hotels hebben een strijkijzer en een strijkplank beschikbaar. Je kunt deze spullen vaak lenen, zelfs al staan ze niet in de kamer.",BeetleLM/beetlelm_nld-ukr_balanced,step-5000,nld,6.434866905212402,623.1996327208426
818,"Als er geen strijkijzer voorhanden is of als je geen gestreken sokken wilt dragen, kun je, indien beschikbaar, ook een haardroger gebruiken.",BeetleLM/beetlelm_nld-ukr_balanced,step-5000,nld,6.604461193084717,738.3819167286929
819,"Zorg ervoor dat de stof niet te heet wordt (hierdoor kan de stof krimpen of, in extreme gevallen, verschroeien).",BeetleLM/beetlelm_nld-ukr_balanced,step-5000,nld,7.169531345367432,1299.2355673340983
820,Je kunt water op verschillende manieren zuiveren. Sommige manieren zijn effectief om specifieke risico's tegen te gaan.,BeetleLM/beetlelm_nld-ukr_balanced,step-5000,nld,7.028218746185303,1128.019530504669
821,"In sommige gebieden is het voldoende om water een minuut te koken, in andere gebieden moet water enkele minuten worden gekookt.",BeetleLM/beetlelm_nld-ukr_balanced,step-5000,nld,6.410129547119141,607.9724370377941
822,Niet ieder filter is even effectief. In geval van twijfel kan je het beste water drinken uit een afgesloten fles van een betrouwbaar bedrijf.,BeetleLM/beetlelm_nld-ukr_balanced,step-5000,nld,7.021864414215088,1120.8744451029838
823,Reizigers kunnen te maken krijgen met dierenplagen die er in hun eigen land niet zijn.,BeetleLM/beetlelm_nld-ukr_balanced,step-5000,nld,5.980745792388916,395.735394572718
824,"Ongedierte kan voedsel verderven, irritatie veroorzaken of, in het ergste geval, allergische reacties veroorzaken, gif verspreiden of infecties overbrengen.",BeetleLM/beetlelm_nld-ukr_balanced,step-5000,nld,7.837197303771973,2533.095378795838
825,"Normaal gesproken worden infectieziekten zelf, of gevaarlijke dieren die met geweld mensen verwonden of doden, niet beschouwd als ongedierte.",BeetleLM/beetlelm_nld-ukr_balanced,step-5000,nld,7.316959381103516,1505.618989157074
826,Met belastingvrij winkelen wordt bedoeld dat je op bepaalde locaties goederen kunt kopen die zijn vrijgesteld van belasting en accijnzen.,BeetleLM/beetlelm_nld-ukr_balanced,step-5000,nld,7.408406734466553,1649.7956891440945
827,"Reizigers die naar landen met hoge accijnzen gaan, kunnen soms aanzienlijk veel geld besparen, als het gaat om producten als alcoholische dranken en tabak.",BeetleLM/beetlelm_nld-ukr_balanced,step-5000,nld,6.952897548675537,1046.1766885582863
828,"Point Marion en Fairmont zijn met elkaar verbonden via de snelweg van Buffalo naar Pittsburgh, je rijdt vaak door verlaten achterliggend terrein en dat maakt van dit traject één grote uitdaging.",BeetleLM/beetlelm_nld-ukr_balanced,step-5000,nld,7.594926834106445,1988.0843862081263
829,"Ben je niet gewend om op landweggetjes te rijden? Houd dan je hoofd erbij. Je komt veel steile hellingen, smalle straatjes en scherpe bochten tegen.",BeetleLM/beetlelm_nld-ukr_balanced,step-5000,nld,6.972219944000244,1066.5878897150208
830,De gestelde maximumsnelheden zijn opvallend lager dan in eerdere en opeenvolgende gebieden — meestal zo'n 35-40 mph (56-64 km/u — en het is hier nog belangrijker om je eraan te houden dan anders.,BeetleLM/beetlelm_nld-ukr_balanced,step-5000,nld,6.560049533843994,706.3066798137726
831,"Verrassend genoeg heb je hier veel meer bereik dan in andere uithoeken van de route, zoals de Pennsylvania Wilds.",BeetleLM/beetlelm_nld-ukr_balanced,step-5000,nld,6.843349933624268,937.6248606074902
832,"Duitse gebak smaakt prima en in Beieren is het gebak redelijk rijk en gevarieerd, net zoals het gebak van de zuidelijke buur, Oostenrijk.",BeetleLM/beetlelm_nld-ukr_balanced,step-5000,nld,7.389561653137207,1618.9962754293313
833,"Je ziet er veel fruitgebakjes. Het hele jaar door bevatten de gebakjes appels, en in de zomermaanden ook kersen en pruimen.",BeetleLM/beetlelm_nld-ukr_balanced,step-5000,nld,6.440895080566406,626.9677353684726
834,"Veel populaire Duitse gebakjes bevatten amandelen, hazelnoten en andere noten, en smaken prima bij een kop sterke koffie.",BeetleLM/beetlelm_nld-ukr_balanced,step-5000,nld,8.08163070678711,3234.5034651316337
835,"Als u een paar kleine maar machtige gebakjes wilt, probeer er dan enkele die in de regio Berliner, Pfannkuchen of Krapfen worden genoemd.",BeetleLM/beetlelm_nld-ukr_balanced,step-5000,nld,7.6662445068359375,2135.048211349141
836,"Om een curry te maken heb je kruidige en pittige ingrediënten nodig, in combinatie met groente of vlees.",BeetleLM/beetlelm_nld-ukr_balanced,step-5000,nld,7.167498588562012,1296.59721986064
837,"Afhankelijk van de hoeveelheid vloeistof, kan een curry 'droog' of 'nat' zijn.",BeetleLM/beetlelm_nld-ukr_balanced,step-5000,nld,7.105702877044678,1218.8985195041
838,In het binnenland van Noord-India en ook van Pakistan wordt vaak yoghurt gebruikt in curry's; in Zuid-India en enkele andere kustregio's van het subcontinent wordt dan weer vaak kokosmelk gebruikt.,BeetleLM/beetlelm_nld-ukr_balanced,step-5000,nld,6.532323837280273,686.9928174923402
839,De Indonesische keuken omvat gerechten uit 17.000 eilanden en is een overkoepelend begrip voor een variëteit aan regionale keukens uit het hele land.,BeetleLM/beetlelm_nld-ukr_balanced,step-5000,nld,6.958040714263916,1051.571209066982
840,Maar zonder aanvullende informatie verwijst de term naar het voedsel dat oorspronkelijk uit het centrale en oostelijke deel van het hoofdeiland Java komt.,BeetleLM/beetlelm_nld-ukr_balanced,step-5000,nld,7.0408759117126465,1142.3877993786084
841,"De Javaanse keuken is tegenwoordig beschikbaar in de hele archipel en biedt verschillende eenvoudige gekruide gerechten. De meest gebruikelijke Javaanse smaakmakers zijn noten, pepers, suiker (voornamelijk Javaanse kokossuiker) en verschillende geurige kruiden.",BeetleLM/beetlelm_nld-ukr_balanced,step-5000,nld,7.64173698425293,2083.3594380606155
842,Stijgbeugels ondersteunen de voeten van de ruiter en hangen aan beide kanten van het zadel naar beneden.,BeetleLM/beetlelm_nld-ukr_balanced,step-5000,nld,6.69317102432251,806.8768257355589
843,"Ze voorzien de berijder van meer stabiliteit, maar kunnen ook problemen met de veiligheid met zich meebrengen doordat de voeten van een berijder erin vast kunnen komen te zitten.",BeetleLM/beetlelm_nld-ukr_balanced,step-5000,nld,6.801506042480469,899.2005065564077
844,"Als een ruiter van een paard wordt afgegooid maar met de voet in de stijgbeugel blijft hangen, kunnen ze worden meegesleurd met het paard. Om het risico te verminderen, zijn er een aantal veiligheidsmaatregelen genomen.",BeetleLM/beetlelm_nld-ukr_balanced,step-5000,nld,6.76991081237793,871.2341872201586
845,"De meeste ruiters dragen ten eerste rijlaarzen met een hak en een gladde, vrij smalle zool.",BeetleLM/beetlelm_nld-ukr_balanced,step-5000,nld,7.074650764465332,1181.6307612864346
846,"Sommige zadels, en dan vooral Engelse zadels, beschikken over veiligheidsbeugels. Hierdoor kan een stijgbeugelleer van het zadel loskomen als dit achteruit wordt getrokken omdat een ruiter van het paard valt.",BeetleLM/beetlelm_nld-ukr_balanced,step-5000,nld,7.256900310516357,1417.8548090892884
847,"Cochamó Valley - Dit is de populairste klimbestemming van Chili. Deze staat bekend als de Yosemite van Zuid-Amerika, en heeft veel verschillende grote granieten wanden en rotsen.",BeetleLM/beetlelm_nld-ukr_balanced,step-5000,nld,7.127789497375488,1246.1193700606168
848,De bergtoppen bieden een adembenemend uitzicht. Klimmers uit alle delen van de wereld ontdekken voortdurend nieuwe routes op de rotswanden die een eindeloos potentieel lijken te hebben.,BeetleLM/beetlelm_nld-ukr_balanced,step-5000,nld,7.619904518127441,2038.3674933839752
849,"Wintersporten waarbij je afdaalt, zoals skiën en snowboarden, zijn heel populair. Je glijdt naar beneden op een met sneeuw bedekte afdaling met ski's of een snowboard aan je voeten.",BeetleLM/beetlelm_nld-ukr_balanced,step-5000,nld,7.0678887367248535,1173.667495554854
850,"Skiën is een populaire reisactiviteit met veel liefhebbers, die af en toe ook wel 'ski bums' worden genoemd, die hele vakanties plannen rond het skiën op een bepaalde locatie.",BeetleLM/beetlelm_nld-ukr_balanced,step-5000,nld,7.3489909172058105,1554.626988727173
851,Skiën bestaat al heel erg lang: er zijn grotschilderingen van skiërs die dateren uit 5000 v.Chr.!,BeetleLM/beetlelm_nld-ukr_balanced,step-5000,nld,6.9892754554748535,1084.9351075484628
852,Het begin van de skisport dateert op zijn minst uit de 17e eeuw en in 1861 werd het eerste recreatieve skioord in Australië geopend door Noren.,BeetleLM/beetlelm_nld-ukr_balanced,step-5000,nld,7.04002571105957,1141.41695329098
853,"Backpacken met ski's: deze activiteit wordt ook wel off-piste skiën, skitouring of skihiking genoemd.",BeetleLM/beetlelm_nld-ukr_balanced,step-5000,nld,7.345026969909668,1548.4767269885829
854,"Het is niet helemaal hetzelfde, maar het lijkt op alpineskiën of bergbeklimmen, wat veel gedaan wordt op steil terrein. Hier heb je veel stuggere ski's en laarzen voor nodig.",BeetleLM/beetlelm_nld-ukr_balanced,step-5000,nld,6.456364631652832,636.7420520044662
855,Je kunt de skiroute zien als een wandelroute.,BeetleLM/beetlelm_nld-ukr_balanced,step-5000,nld,6.470754623413086,645.971007931885
856,"In goede omstandigheden kun je grotere afstanden afleggen dan lopend, maar het gebeurt maar zelden dat je op aangelegde pistes de snelheid van langlaufen haalt zonder een zware rugzak.",BeetleLM/beetlelm_nld-ukr_balanced,step-5000,nld,7.2003021240234375,1339.83549974313
857,"Europa is een relatief klein continent, maar met veel onafhankelijke landen. Normaal gesproken moeten reizigers tussen verschillende landen meerdere keren een visum aanvragen en paspoortcontroles ondergaan.",BeetleLM/beetlelm_nld-ukr_balanced,step-5000,nld,7.5861124992370605,1970.6377478916572
858,Het Schengengebied functioneert op dit gebied echter bijna als één land.,BeetleLM/beetlelm_nld-ukr_balanced,step-5000,nld,7.212434768676758,1356.190260385692
859,"Zolang u in deze zone verblijft, kunt u meestal de grens oversteken zonder opnieuw een paspoortcontrole te hoeven ondergaan.",BeetleLM/beetlelm_nld-ukr_balanced,step-5000,nld,6.9272074699401855,1019.6426175586606
860,"Wanneer u een Schengenvisum hebt, hoeft u niet voor ieder Schengenland apart een visum aan te vragen, wat tijd, geld en papierwerk bespaart.",BeetleLM/beetlelm_nld-ukr_balanced,step-5000,nld,6.59062385559082,728.235041717491
861,Er is geen universele definitie waarmee wordt aangegeven welke geproduceerde artikelen antiek zijn. Sommige belastingkantoren geven goederen die ouder zijn dan 100 jaar de definitie antiek.,BeetleLM/beetlelm_nld-ukr_balanced,step-5000,nld,7.510395526885986,1826.9360022389899
862,De definitie kan per locatie verschillen. In Noord-Amerika ligt de leeftijdsgrens bijvoorbeeld lager dan in Europa.,BeetleLM/beetlelm_nld-ukr_balanced,step-5000,nld,6.5868916511535645,725.5221852798712
863,"Het is mogelijk om ambachtelijke producten als antiek aan te merken, ondanks dat ze nieuwer zijn dan vergelijkbare massaproducten.",BeetleLM/beetlelm_nld-ukr_balanced,step-5000,nld,6.812806129455566,909.4191776882078
864,Onder de Sámi is het houden van rendieren een belangrijke vorm van levensonderhoud. Ook is de cultuur rondom de handel erg belangrijk voor velen met andere beroepen.,BeetleLM/beetlelm_nld-ukr_balanced,step-5000,nld,6.437222957611084,624.6696547548362
865,"Zelfs traditioneel waren echter niet alle Sámi betrokken bij grootschalige rendierhouderij. Zij onderhielden zich met visserij, jagen en dergelijke zaken. Hierbij werden rendieren meestal als trekdieren gebruikt.",BeetleLM/beetlelm_nld-ukr_balanced,step-5000,nld,7.744959831237793,2309.900736170525
866,"Veel Sámi werken vandaag de dag in moderne beroepen. In Sápmi, het Sámi-gebied is toerisme is een belangrijke inkomstenbron.",BeetleLM/beetlelm_nld-ukr_balanced,step-5000,nld,7.24092435836792,1395.3832090613525
867,Het woord 'zigeuner' wordt vooral gebruikt door niet-Roma. Het wordt echter ook vaak als beledigend beschouwd vanwege de associaties met negatieve stereotypen en onjuiste percepties van de Roma.,BeetleLM/beetlelm_nld-ukr_balanced,step-5000,nld,7.326959133148193,1520.750334485013
868,"Als er voor het land waar je naartoe wilt een reisadvies geldt, kan dit gevolgen hebben voor je ziektekostenverzekering voor de reis of je annuleringsverzekering.",BeetleLM/beetlelm_nld-ukr_balanced,step-5000,nld,6.692931175231934,806.6833202696819
