sentence_id,sentence,repo,revision,iso_code,nll,ppl
729,Für die besten Aussichten auf Hongkong sollten Sie die Insel verlassen und zum gegenüberliegenden Ufer von Kowloon fahren.,BeetleLM/beetlelm_deu-ukr_heritage,step-2000,deu,7.721346378326416,2255.9949594439313
730,Der Großteil der Städtebildung von Hong Kong Island ist dicht gedrängt auf neugewonnenem Land entlang der Nordküste.,BeetleLM/beetlelm_deu-ukr_heritage,step-2000,deu,8.30732250213623,4053.4453498996827
731,"Das ist der Ort, den sich die britischen Kolonisten zu eigen gemacht haben. Wenn Sie nach Spuren der kolonialen Vergangenheit des Gebiets suchen, ist dies ein guter Ausgangspunkt.",BeetleLM/beetlelm_deu-ukr_heritage,step-2000,deu,7.117778301239014,1233.706462336885
732,Die Sundarbans sind der größte Mangrovengürtel der Welt und erstrecken sich über 80 km vom bangladeschischen und indischen Hinterland bis an die Küste.,BeetleLM/beetlelm_deu-ukr_heritage,step-2000,deu,7.403439044952393,1641.6203395105094
733,"Die Sundarbans wurden zum UNESCO-Weltkulturerbe erklärt. Der Teil des Waldes, der innerhalb des indischen Staatsgebietes liegt, wird als Sundarbans National Park bezeichnet.",BeetleLM/beetlelm_deu-ukr_heritage,step-2000,deu,6.8896260261535645,982.0340934705365
734,"Die Wälder sind jedoch nicht nur Mangrovensümpfe – sie umfassen auch einige der letzten verbliebenen Bestände des mächtigen Dschungels, der einst die Gangesebene bedeckte.",BeetleLM/beetlelm_deu-ukr_heritage,step-2000,deu,7.599600315093994,1997.3974059482634
735,"Die Sundarbans erstrecken sich über eine Fläche von 3.850 km², wovon ein Drittel von Wasser und Marschen bedeckt ist.",BeetleLM/beetlelm_deu-ukr_heritage,step-2000,deu,7.301797389984131,1482.9629964175742
736,"Die Sundarbans sind seit 1966 ein Naturschutzgebiet, und Schätzungen zufolge halten sich dort mittlerweile 400 bengalische Königstiger und etwa 30.000 gefleckte Hirsche auf.",BeetleLM/beetlelm_deu-ukr_heritage,step-2000,deu,7.6928606033325195,2192.6378667308745
737,"Busse fahren den ganzen Tag über vom distriktübergreifenden Busbahnhof (auf der anderen Seite des Flusses) ab, wobei die meisten Busse, vor allem die in Richtung Osten und Jakar/Bumthang, zwischen 06:30 und 07:30 Uhr abfahren.",BeetleLM/beetlelm_deu-ukr_heritage,step-2000,deu,7.424031734466553,1675.776190884306
738,"Da die Busse zwischen den Bezirken oftmals voll sind, empfiehlt es sich, ein paar Tage im Voraus ein Ticket zu kaufen.",BeetleLM/beetlelm_deu-ukr_heritage,step-2000,deu,7.067255020141602,1172.9239586204233
739,"Die meisten Bezirke werden durch kleine japanische Coasterbusse befahren, die gemütlich und stabil sind.x",BeetleLM/beetlelm_deu-ukr_heritage,step-2000,deu,7.829235076904297,2513.006381421553
740,"Sammeltaxis bieten eine schnelle und bequeme Möglichkeit, um zu nahegelegenen Orten wie Paro (Nu 150) und Punakha (Nu 200) zu gelangen.",BeetleLM/beetlelm_deu-ukr_heritage,step-2000,deu,7.674780368804932,2153.3506907695246
741,Die Oyapock River Bridge ist eine Schrägseilbrücke. Sie überspannt den Fluss Oyapock und verbindet die Städte Oiapoque in Brasilien und Saint-Georges de l'Oyapock in Französisch-Guayana.,BeetleLM/beetlelm_deu-ukr_heritage,step-2000,deu,7.475557804107666,1764.3855952799704
742,"Ihre beiden Türme sind 83 Meter hoch, ihre Länge beträgt 378 Meter und sie verfügt über zwei Fahrspuren mit 3,50 m Breite.",BeetleLM/beetlelm_deu-ukr_heritage,step-2000,deu,7.877110004425049,2636.242809986085
743,"Die Durchfahrtshöhe unter der Brücke beträgt 15 Meter. Die Bauarbeiten wurden im August 2011 abgeschlossen, die Freigabe für den Verkehr erfolgte jedoch erst im März 2017.",BeetleLM/beetlelm_deu-ukr_heritage,step-2000,deu,7.6484270095825195,2097.343891487883
744,"Die Brücke soll im September 2017 vollständig den Betrieb aufnehmen. Es wird erwartet, dass die brasilianischen Zollkontrollpunkte dann fertig gestellt sein werden.",BeetleLM/beetlelm_deu-ukr_heritage,step-2000,deu,7.604519367218018,2007.2469131594328
745,"Die Guaraní waren die bedeutendste indigene Gruppe, die das heutige Ostparaguay bewohnte. Sie lebten als halbnomadische Jäger, die auch Subsistenzlandwirtschaft betrieben.",BeetleLM/beetlelm_deu-ukr_heritage,step-2000,deu,7.359752178192139,1571.4470758427185
746,"Die Chaco-Region war auch die Heimat anderer Gruppen von Eingeborenenstämmen, wie der Guaycurú und der Payaguá, die durch jagen, sammeln und fischen überlebten.x",BeetleLM/beetlelm_deu-ukr_heritage,step-2000,deu,7.1729044914245605,1303.6254784085406
747,"Paraguay, ehemals Großprovinz Westindien genannt, entstand im 16. Jahrhundert als Ergebnis des Zusammentreffens der spanischen Eroberer mit den einheimischen indigenen Gruppen.",BeetleLM/beetlelm_deu-ukr_heritage,step-2000,deu,7.747282028198242,2315.271013646703
748,"Die Spanier begannen die Kolonisierungszeit, die drei Jahrhunderte andauerte.",BeetleLM/beetlelm_deu-ukr_heritage,step-2000,deu,7.602168560028076,2002.5338046591664
749,"Seit der Gründung von Asunción 1537 ist es Paraguay gelungen, viel von seinem indigenen Charakter und seiner Identität zu bewahren.",BeetleLM/beetlelm_deu-ukr_heritage,step-2000,deu,7.700634956359863,2209.7506417530494
750,"Argentinien ist bekannt dafür, dass sein Polo-Team und die Spieler zu den besten der Welt gehören.",BeetleLM/beetlelm_deu-ukr_heritage,step-2000,deu,6.432964324951172,622.01507261848
751,Das größte Turnier des Jahres findet im Dezember auf Las Cañitas Polofeldern statt.,BeetleLM/beetlelm_deu-ukr_heritage,step-2000,deu,8.207413673400879,3668.0434294670545
752,Kleinere Turniere und Wettkämpfe können hier auch zu anderen Zeiten im Jahr angeschaut werden.x,BeetleLM/beetlelm_deu-ukr_heritage,step-2000,deu,7.520116329193115,1844.7818835595208
753,Informationen zu Wettbewerben und Verkaufsstellen für Polospieltickets finden Sie bei der Asociacion Argentina de Polo.,BeetleLM/beetlelm_deu-ukr_heritage,step-2000,deu,8.17471694946289,3550.0499381779127
754,"Die offizielle Währung der Falklandinseln ist das Falkland Pound (FKP), dessen Wert in Einklang mit dem Wert des Britischen Pfunds (GBP) festgelegt wird.",BeetleLM/beetlelm_deu-ukr_heritage,step-2000,deu,7.144813060760498,1267.5143548929016
755,"Geld kann in der einzigen Bank auf der Insel umgetauscht werden, welche sich in Stanley gegenüber vom FIC West Store befindet.",BeetleLM/beetlelm_deu-ukr_heritage,step-2000,deu,6.890409469604492,982.803763106604
756,Das Britische Pfund wird grundsätzlich überall auf den Inseln und bei Stanley-Kreditkarten akzeptiert. Auch US-Dollar werden häufig akzeptiert.,BeetleLM/beetlelm_deu-ukr_heritage,step-2000,deu,7.3231706619262695,1514.9999151339443
757,"Auf den abgelegenen Inseln werden Kreditkarten wahrscheinlich nicht akzeptiert, wobei jedoch britische und US-amerikanische Währung angenommen werden können; erkundigen Sie sich im Voraus bei den Eigentümern, welche Zahlungsmethode akzeptiert wird.",BeetleLM/beetlelm_deu-ukr_heritage,step-2000,deu,7.837600231170654,2534.1162379796847
758,"Es ist beinahe unmöglich, die Währung der Falklandinseln außerhalb der Inseln selbst umzutauschen, daher sollten Sie das Geld vor der Abreise von der Insel umtauschen.x",BeetleLM/beetlelm_deu-ukr_heritage,step-2000,deu,7.226916790008545,1375.973541859368
759,"Da Montevideo südlich des Äquators liegt, ist es dort Sommer, wenn es in der nördlichen Hemisphäre Winter ist und umgekehrt.",BeetleLM/beetlelm_deu-ukr_heritage,step-2000,deu,7.078845500946045,1186.5978013764113
760,Montevideo liegt in den Subtropen. In den Sommermonaten sind Temperaturen über +30 °C üblich.,BeetleLM/beetlelm_deu-ukr_heritage,step-2000,deu,7.609776496887207,2017.8270566859062
761,"Der Winter kann trügerisch kühl sein: Die Temperaturen gehen selten unter den Gefrierpunkt, aber Wind und Feuchtigkeit führen dazu, dass es sich kälter anfühlt als das, was das Thermometer anzeigt.",BeetleLM/beetlelm_deu-ukr_heritage,step-2000,deu,7.3597540855407715,1571.4500731430087
762,Es gibt keine ausgeprägten Regen- oder Trockenzeiten: Die Niederschlagsmenge bleibt über das ganze Jahr in etwa gleich.,BeetleLM/beetlelm_deu-ukr_heritage,step-2000,deu,7.650147914886475,2100.956329155009
763,"Obwohl viele der Tiere im Park den Anblick von Menschen gewohnt sehen, sind die Wildtiere trotzdem wild und sollten nicht gefüttert oder gestört werden.",BeetleLM/beetlelm_deu-ukr_heritage,step-2000,deu,7.419583320617676,1668.3382007637688
764,Laut Anweisung der Parkbehörde sollen sich Besucher mindestens 100 Yard/Meter von Bären und Wölfen und 25 Yard/Meter von allen anderen wilden Tieren fernhalten!,BeetleLM/beetlelm_deu-ukr_heritage,step-2000,deu,8.30431079864502,4041.2559390470924
765,"Egal wie friedlich Bisons, Wapitis, Elche, Bären und praktisch alle großen Tiere wirken können, so kann es doch passieren, dass sie zum Angriff übergehen.",BeetleLM/beetlelm_deu-ukr_heritage,step-2000,deu,7.2802734375,1451.3848339013034
766,"Jedes Jahr werden Dutzende von Besuchern verletzt, weil sie nicht genug Abstand einhalten. Diese Tiere sind groß, wild und möglicherweise gefährlich, also lassen Sie ihnen ausreichend Platz.",BeetleLM/beetlelm_deu-ukr_heritage,step-2000,deu,7.163038730621338,1290.8274561805115
767,"Seien Sie sich außerdem bewusst, dass Gerüche Bären und andere Wildtiere anziehen können. Vermeiden Sie es also, stark duftende Lebensmittel bei sich zu tragen oder zu kochen, und achten Sie auf ein sauberes Lager.",BeetleLM/beetlelm_deu-ukr_heritage,step-2000,deu,7.030179500579834,1130.2334695422705
768,Apia ist die auf der Insel Upolu liegende Hauptstadt von Samoa und weist eine Einwohnerzahl von knapp unter 40.000 auf.,BeetleLM/beetlelm_deu-ukr_heritage,step-2000,deu,7.00045108795166,1097.127948022039
769,Apia wurde in den 50ern des 18. Jahrunderts gegründet und ist seit 1959 die offizielle Hauptstadt von Samoa.,BeetleLM/beetlelm_deu-ukr_heritage,step-2000,deu,7.188935279846191,1324.6920281860073
770,"Der Hafen war der Schauplatz eines unrühmlichen Patts der Marine im Jahr 1889, als sieben Schiffe aus Deutschland, den Vereinigten Staaten und Großbritannien sich weigerten, den Hafen zu verlassen.",BeetleLM/beetlelm_deu-ukr_heritage,step-2000,deu,7.2355756759643555,1387.9396717489728
771,Alle Schiffe mit Ausnahme eines britischen Kreuzers wurden versenkt. Fast 200 Amerikaner und Deutsche kamen ums Leben.,BeetleLM/beetlelm_deu-ukr_heritage,step-2000,deu,7.836893081665039,2532.32487239112
772,Während des von der Mau-Bewegung organisierten Unabhängigkeitskampfes führte eine friedliche Versammlung in der Stadt zur Tötung des obersten Häuptlings Tupua Tamasese Lealofi III.,BeetleLM/beetlelm_deu-ukr_heritage,step-2000,deu,7.70184326171875,2212.4223090651953
773,"Da Auckland sich über zwei Häfen erstreckt, gibt es viele Strände. Die beliebtesten Strände befinden sich in drei Gebieten.",BeetleLM/beetlelm_deu-ukr_heritage,step-2000,deu,7.400332450866699,1636.5284048550316
774,Die Strände von North Shore (im Bezirk North Harbour) liegen am Pazifischen Ozean und erstrecken sich von Long Bay im Norden bis Devonport im Süden.,BeetleLM/beetlelm_deu-ukr_heritage,step-2000,deu,7.699992656707764,2208.331775402086
775,"Fast alle sind Sandstrände mit sicheren Bademöglichkeiten und die meisten bieten Schatten, der von Pohutukawa-Bäumen gespendet wird.",BeetleLM/beetlelm_deu-ukr_heritage,step-2000,deu,7.923016548156738,2760.084428160996
776,"Die Strände von Tamaki Drive befinden sich am Hafen von Waitemata, in den gehobenen Vororten Mission Bay sowie St. Heliers in Central Auckland.",BeetleLM/beetlelm_deu-ukr_heritage,step-2000,deu,7.398666858673096,1633.8048846858928
777,"Es gibt Familienstrände, die manchmal überlaufen sind, mit einer schönen Einkaufspromenade entlang der Küste. Das Schwimmen ist hier sicher.",BeetleLM/beetlelm_deu-ukr_heritage,step-2000,deu,7.161980152130127,1289.4617369875498
778,"Das wichtigste lokale Bier ist „Number One“. Es ist kein komplexes Bier, aber angenehm und erfrischend. Das andere lokale Bier heißt „Manta“.",BeetleLM/beetlelm_deu-ukr_heritage,step-2000,deu,7.130770683288574,1249.8398265033807
779,"Es gibt viele französische Weine zu trinken, aber die neuseeländischen und australischen Weine sind vielleicht besser verträglich.",BeetleLM/beetlelm_deu-ukr_heritage,step-2000,deu,7.583003997802734,1964.5215286888542
780,"Das örtliche Leitungswasser kann man bedenkenlos trinken, aber wenn Sie sich Sorgen machen, finden Sie auch problemlos abgefülltes Wasser.",BeetleLM/beetlelm_deu-ukr_heritage,step-2000,deu,7.5922040939331055,1982.6787114452247
781,"""Für Australier ist die Idee des Kaffees """"Flat White"""" fremd. Ein kleiner Schwarzer ist """"Espresso"""", Cappuccino wird hoch mit Sahne (nicht mit Schaum) aufgefüllt und Tee wird ohne Milch serviert.""",BeetleLM/beetlelm_deu-ukr_heritage,step-2000,deu,7.537201404571533,1876.5709067619857
782,"Die heiße Schokolade entspricht belgischen Standards. Fruchtsäfte sind zwar teuer, aber hervorragend.",BeetleLM/beetlelm_deu-ukr_heritage,step-2000,deu,8.059786796569824,3164.6153555781802
783,Viele Reisen zum Riff finden das ganze Jahr hindurch statt und Verletzungen aufgrund irgendeiner dieser Ursachen auf dem Riff sind selten.x,BeetleLM/beetlelm_deu-ukr_heritage,step-2000,deu,7.906636714935303,2715.242956040133
784,"Dennoch sollten Sie den Rat von Behörden befolgen, alle Schilder beachten und insbesondere Augenmerk auf Sicherheitswarnungen richten.",BeetleLM/beetlelm_deu-ukr_heritage,step-2000,deu,8.00888442993164,3007.560096714468
785,Würfelquallen treten in Strandnähe und in der Nähe von Flussmündungen von Oktober bis April nördlich von 1770 auf. Sie können gelegentlich auch außerhalb dieses Zeitraums vorkommen.,BeetleLM/beetlelm_deu-ukr_heritage,step-2000,deu,7.776354789733887,2383.5703502528386
786,"Haie existieren, aber sie greifen selten Menschen an. Die meisten Haie haben Angst vor Menschen und würden wegschwimmen.",BeetleLM/beetlelm_deu-ukr_heritage,step-2000,deu,6.993188858032227,1089.1892139591778
787,"Salzwasserkrokodile leben nicht aktiv im Meer, ihr primärer Lebensraum ist in Flussmündungen nördlich von Rockhampton.",BeetleLM/beetlelm_deu-ukr_heritage,step-2000,deu,8.114326477050781,3342.0059083117903
788,"Eine Buchung im Voraus gibt dem Reisenden die Gewissheit, dass er nach seiner Ankunft am Zielort einen Platz zum Übernachten hat.",BeetleLM/beetlelm_deu-ukr_heritage,step-2000,deu,7.072918891906738,1179.5860984553572
789,"Reiseagenturen haben oft Abmachungen mit spezifischen Hotels, obwohl Sie vielleicht auch andere Unterbringungsformen, wie zum Beispiel Zeltplätze, durch eine Reiseagentur buchen können.x",BeetleLM/beetlelm_deu-ukr_heritage,step-2000,deu,7.8089919090271,2462.64661171715
790,"Reisebüros bieten üblicherweise Pakete an, bei denen Frühstück, Transport zum und vom Flughafen oder sogar eine Kombination von Flug und Hotel inbegriffen sind.",BeetleLM/beetlelm_deu-ukr_heritage,step-2000,deu,7.686821460723877,2179.436117710744
791,"Sie können Ihre Reservierung auch für Sie zurückhalten, falls Sie Zeit benötigen, das Angebot zu überdenken oder um weitere Dokumente für Ihr Reiseziel (z.B. Visa) zu beschaffen.",BeetleLM/beetlelm_deu-ukr_heritage,step-2000,deu,7.337339878082275,1536.6190780042878
792,Jegliche Änderungen oder Anfragen sollten jedoch zuerst an das Reisebüro und nicht direkt an das Hotel gerichtet werden.,BeetleLM/beetlelm_deu-ukr_heritage,step-2000,deu,7.753912448883057,2330.6732396588814
793,"Bei manchen Festivals entscheidet sich die große Mehrheit der Festivalbesucher, vor Ort zu kampieren, und die meisten Besucher halten dies für einen wichtigen Bestandteil der Erfahrung.",BeetleLM/beetlelm_deu-ukr_heritage,step-2000,deu,7.5005340576171875,1809.0082711683121
794,"Wenn Sie nahe am Geschehen sein wollen, müssen Sie früh hingehen, um einen Campingplatz in der Nähe der Musik zu bekommen.",BeetleLM/beetlelm_deu-ukr_heritage,step-2000,deu,6.942512512207031,1035.3683252577025
795,"Denken Sie daran, dass auf Teilen des Festivals noch bis spät in die Nacht Musik gespielt wird, auch wenn die Musik auf den Hauptbühnen schon aufgehört hat.",BeetleLM/beetlelm_deu-ukr_heritage,step-2000,deu,6.865932464599609,959.039693559255
796,Manche Festivals haben spezielle Campingbereiche für Familien mit kleinen Kindern.,BeetleLM/beetlelm_deu-ukr_heritage,step-2000,deu,8.094264030456543,3275.6251994859363
797,"Wenn Sie im Winter die nördliche Ostsee überqueren, überprüfen Sie die Lage der Kabine, da das Durchbrechen von Eis für die am stärksten Betroffenen ziemlich schrecklichen Lärm verursacht.",BeetleLM/beetlelm_deu-ukr_heritage,step-2000,deu,7.696130275726318,2199.818807497742
798,Die Kreuzfahrten nach Sankt Petersburg bieten auch Zeit für einen Aufenthalt in der Stadt. Kreuzfahrtpassagiere sind von der Visumpflicht befreit (siehe Bedingungen).,BeetleLM/beetlelm_deu-ukr_heritage,step-2000,deu,8.032483100891113,3079.3785954584414
799,"Kasinos bemühen sich in der Regel sehr darum, Gäste möglichst lange vor Ort zu halten und viel Geld ausgeben zu lassen. Es gibt in der Regel weder Fenster noch Uhren, und Ausgänge sind manchmal schwer auffindbar.",BeetleLM/beetlelm_deu-ukr_heritage,step-2000,deu,6.895795822143555,988.1117732249587
800,"Sie haben normalerweise ein besonderes Angebot an Speisen, Getränken und Unterhaltung, um die Gäste bei Laune zu halten und dafür zu sorgen, dass sie bleiben.",BeetleLM/beetlelm_deu-ukr_heritage,step-2000,deu,6.838952541351318,933.5108084705387
801,"Einige Spielstätten bieten alkoholische Getränke kostenfrei an. Trunkenheit beeinträchtigt jedoch das Urteilsvermögen, und allen guten Spielern ist klar, wie wichtig es ist, nüchtern zu bleiben.",BeetleLM/beetlelm_deu-ukr_heritage,step-2000,deu,7.7649688720703125,2356.585131765144
802,"Wer in hohen Breiten oder über Gebirgspässe fahren will, sollte mit Schnee, Eis und Temperaturen unter dem Gefrierpunkt rechnen.",BeetleLM/beetlelm_deu-ukr_heritage,step-2000,deu,7.585934638977051,1970.2872809174296
803,"Auf vereisten und verschneiten Straßen ist die Haftung gering und man kann nicht fahren, als befinde man sich auf nacktem Asphalt.",BeetleLM/beetlelm_deu-ukr_heritage,step-2000,deu,7.265110015869141,1429.5428915140913
804,"Bei Schneestürmen kann in sehr kurzer Zeit so viel Schnee fallen, dass man sich festfahren kann.",BeetleLM/beetlelm_deu-ukr_heritage,step-2000,deu,7.043536186218262,1145.4309104775687
805,Die Sichtweite kann auch durch fallenden oder umherwehenden Schnee oder durch Kondensation oder Eis auf den Fahrzeugfenstern beeinträchtigt werden.x,BeetleLM/beetlelm_deu-ukr_heritage,step-2000,deu,8.114446640014648,3342.4075177758036
806,"Auf der anderen Seite sind eisige und schneereiche Bedingungen in vielen Ländern normal, und der Verkehr läuft das ganze Jahr über größtenteils ununterbrochen weiter.",BeetleLM/beetlelm_deu-ukr_heritage,step-2000,deu,7.41647481918335,1663.1602211217985
807,Safaris sind vielleicht die größte Touristenattraktion in Afrika und der Höhepunkt für viele Besucher.,BeetleLM/beetlelm_deu-ukr_heritage,step-2000,deu,7.582601070404053,1963.7301285887443
808,"Der Begriff Safari bezeichnet im üblichen Sprachgebrauch eine Landreise, um die überwältigende afrikanische Tierwelt zu beobachten, besonders in der Savanne.",BeetleLM/beetlelm_deu-ukr_heritage,step-2000,deu,7.404956340789795,1644.1130538325517
809,"Einige Tiere, wie Elefanten und Giraffen, neigen dazu, sich dicht an Autos anzunähern, und die Standardausrüstung ermöglicht eine gute Sicht.",BeetleLM/beetlelm_deu-ukr_heritage,step-2000,deu,7.430527210235596,1686.6965827014049
810,"Löwen, Geparden und Leoparden sind oft scheu und Sie können sie mit einem Fernglas besser beobachten.",BeetleLM/beetlelm_deu-ukr_heritage,step-2000,deu,7.098330020904541,1209.9448038586124
811,"Eine Fußsafari (auch „Buschgang“, „Wandersafari“ oder „Footing“ genannt) besteht aus einer Wanderung, die entweder ein paar Stunden oder mehrere Tage dauert.",BeetleLM/beetlelm_deu-ukr_heritage,step-2000,deu,7.690461158752441,2187.3830605147596
812,Die Paralympics werden vom 24. August bis 5. September 2021 stattfinden. Einige Veranstaltungen werden an anderen Orten in ganz Japan abgehalten.,BeetleLM/beetlelm_deu-ukr_heritage,step-2000,deu,8.004923820495605,2995.6718836407113
813,"Tokio wird die einzige asiatische Stadt sein, die zwei olympische Sommerspiele ausgerichtet hat, nachdem sie bereits 1964 Austragungsort der Spiele war.",BeetleLM/beetlelm_deu-ukr_heritage,step-2000,deu,7.599944114685059,1998.0842284174985
814,"Wenn Sie Ihre Flüge und Unterkünfte für das Jahr 2020 gebucht haben, bevor die Verschiebung angekündigt wurde, könnten Sie in eine schwierige Situation geraten.",BeetleLM/beetlelm_deu-ukr_heritage,step-2000,deu,7.597253799438477,1992.715976336901
815,"Die Stornierungsrichtlinien variieren, aber ab Ende März galten die meisten Stornierungsrichtlinien wegen des Coronavirus nicht bis zum Juli 2020, für den die Olympischen Spiele geplant waren.",BeetleLM/beetlelm_deu-ukr_heritage,step-2000,deu,7.906010627746582,2713.543509267531
816,"Man geht davon aus, dass die meisten Tickets für die Veranstaltung zwischen 2.500¥ und 130.000¥ kosten werden, ein durchschnittliches Ticket ungefähr 7.000¥.",BeetleLM/beetlelm_deu-ukr_heritage,step-2000,deu,7.011711597442627,1109.5519869180569
817,"Feuchte Kleidung zu bügeln kann beim Trocknen helfen. Viele Hotels verleihen Bügeleisen und Bügelbrett, auch wenn man man nicht im Zimmer anwesend ist.",BeetleLM/beetlelm_deu-ukr_heritage,step-2000,deu,7.784283638000488,2402.5444398283917
818,"Wenn kein Bügeleisen verfügbar ist oder man keine gebügelten Socken tragen will, kann man versuchen, einen Föhn zu verwenden, falls einer vorhanden ist.",BeetleLM/beetlelm_deu-ukr_heritage,step-2000,deu,7.560281753540039,1920.3865128539614
819,"Geben Sie acht, dass der Stoff nicht zu heiß wird (das kann ihn schrumpfen lassen oder in extremen Fällen zu Verbrennungen führen).",BeetleLM/beetlelm_deu-ukr_heritage,step-2000,deu,7.326348781585693,1519.82242534639
820,"Zur Reinigung von Wasser gibt es verschiedene Verfahren. Einige davon erweisen sich als wirksamer, um bestimmten Gefahren entgegenzuwirken.",BeetleLM/beetlelm_deu-ukr_heritage,step-2000,deu,7.477357387542725,1767.5636130667074
821,"In einigen Gebieten genügt es, Wasser eine Minute lang abzukochen, in anderen müssen es mehrere Minuten sein.",BeetleLM/beetlelm_deu-ukr_heritage,step-2000,deu,7.513012409210205,1831.7231397265766
822,"Die Wirksamkeit von Filtern variiert stark, und wenn Sie Bedenken haben, dann sollten Sie erwägen, Ihr Wasser in einer versiegelten Flasche von einem seriösen Unternehmen zu kaufen.",BeetleLM/beetlelm_deu-ukr_heritage,step-2000,deu,7.19613790512085,1334.2677321759709
823,"Reisende können auf tierische Schädlinge stoßen, die sie aus ihren Heimatregionen nicht kennen.",BeetleLM/beetlelm_deu-ukr_heritage,step-2000,deu,7.396625995635986,1630.473912871674
824,"Ungeziefer kann Nahrungsmittel zerstören, Reizungen hervorrufen oder schlimmstenfalls sogar allergische Reaktionen auslösen, Gift verabreichen oder Krankheiten übertragen.",BeetleLM/beetlelm_deu-ukr_heritage,step-2000,deu,8.545793533325195,5145.066294045599
825,"Infektionskrankheiten als solche oder gefährliche Tiere, die Menschen mit Gewalt verletzen oder töten können, werden gewöhnlich nicht als Ungeziefer eingestuft.",BeetleLM/beetlelm_deu-ukr_heritage,step-2000,deu,7.630553245544434,2060.189495262372
826,"Zollfreies Einkaufen ist die Möglichkeit, Waren zu kaufen, die an bestimmten Orten von Abgaben und Verbrauchssteuern befreit sind.",BeetleLM/beetlelm_deu-ukr_heritage,step-2000,deu,7.664952278137207,2132.2910226201398
827,"Reisende, deren Zielland eine hohe Besteuerung aufweist, können manchmal eine beträchtliche Menge an Geld sparen, insbesondere bei Produkten wie alkoholischen Getränken und Tabak.",BeetleLM/beetlelm_deu-ukr_heritage,step-2000,deu,7.962189197540283,2870.3498421380727
828,"Der Abschnitt zwischen Point Marion und Fairmount auf dem Highway Buffalo-Pittsburgh ist die wohl größte fahrerische Herausforderung, da er häufig durch entlegenes, unerschlossenes Gelände führt.",BeetleLM/beetlelm_deu-ukr_heritage,step-2000,deu,7.866835594177246,2609.295640035739
829,"Wenn Sie es nicht gewohnt sind, auf Landstraßen zu fahren, bleiben Sie achtsam: steiles Gefälle, enge Fahrbahnen und scharfe Kurven überwiegen hier.",BeetleLM/beetlelm_deu-ukr_heritage,step-2000,deu,7.300735950469971,1481.3897559926236
830,Die angegebenen Geschwindigkeitsbegrenzungen sind merklich niedriger als in den vorhergehenden und nachfolgenden Abschnitten - in der Regel 35-40 mph (56-64 km/h) - und ihre strikte Einhaltung ist noch wichtiger als sonst.,BeetleLM/beetlelm_deu-ukr_heritage,step-2000,deu,7.696229934692383,2200.03805009019
831,"Doch interessanterweise ist die Mobilfunkabdeckung hier viel besser als in vielen anderen Bereichen der Strecke, z. B. den Pennsylvania Wilds.",BeetleLM/beetlelm_deu-ukr_heritage,step-2000,deu,7.73014497756958,2275.9321359797427
832,"Deutsche Backwaren sind recht lecker. In Bayern sind sie recht gehaltvoll und abwechslungsreich, ebenso wie beim südlichen Nachbarn Österreich.",BeetleLM/beetlelm_deu-ukr_heritage,step-2000,deu,7.687432765960693,2180.768825727
833,"Obstgebäck ist weit verbreitet, wobei Äpfel das ganze Jahr über zu Gebäck verkocht werden und Kirschen und Pflaumen im Sommer verwendet werden.",BeetleLM/beetlelm_deu-ukr_heritage,step-2000,deu,7.781876564025879,2396.7682922306353
834,"Viele deutsche Backwaren beinhalten außerdem Mandeln, Haselnüsse oder andere Nüsse. Beliebte Kuchen passen häufig besonders gut zu einer Tasse starken Kaffees.",BeetleLM/beetlelm_deu-ukr_heritage,step-2000,deu,8.304046630859375,4040.1885104107887
