sentence_id,sentence,repo,revision,iso_code,nll,ppl
465,"The Giza Plateau, or ""Giza Necropolis"" in the Egyptian Valley of the Dead contains several pyramids (of which the great pyramid is the largest), several small tombs, several temples, and the great Sphinx.",BeetleLM/beetlelm_eng-nld_balanced,step-18341,eng,4.838313102722168,126.25619076582524
466,"The great pyramid was created to honor the Pharaoh Khufu, and many of the smaller pyramids, tombs, and temples were built to honor Khufu's wives and family members.",BeetleLM/beetlelm_eng-nld_balanced,step-18341,eng,4.523558139801025,92.16294390039147
467,"The ""up bow"" mark looks like a V and the ""down bow mark"" like a staple or a square missing its bottom side.",BeetleLM/beetlelm_eng-nld_balanced,step-18341,eng,6.38419246673584,592.4061517162577
468,"Up means you should start at the tip and push the bow, and down means you should start at the frog (which is where your hand is holding the bow) and pull the bow.",BeetleLM/beetlelm_eng-nld_balanced,step-18341,eng,5.0739922523498535,159.81106158185665
469,"An up-bow usually generates a softer sound, while a down-bow is stronger and more assertive.",BeetleLM/beetlelm_eng-nld_balanced,step-18341,eng,6.339074611663818,566.2720472973994
470,"Feel free to pencil in your own marks, but remember the printed bowing marks are there for a musical reason, so they should usually be respected.",BeetleLM/beetlelm_eng-nld_balanced,step-18341,eng,5.671210289001465,290.38577250569267
471,"The terrified King Louis XVI, Queen Marie Antoinette their two young children (11 year old Marie Therese and four year old Louis-Charles) and the King's sister, Madam Elizabeth, on the 6th October 1789 were forced back to Paris from Versailles by a mob of market women.",BeetleLM/beetlelm_eng-nld_balanced,step-18341,eng,5.454791069030762,233.87600202473487
472,"In a carriage, they traveled back to Paris surrounded by a mob of people screaming and shouting threats against the King and Queen.",BeetleLM/beetlelm_eng-nld_balanced,step-18341,eng,5.239822864532471,188.6366851986412
473,The mob of people forced the King And Queen to have their carriage windows wide open.,BeetleLM/beetlelm_eng-nld_balanced,step-18341,eng,7.671498775482178,2146.2958514090606
474,At one point a member of the mob waved the head of a royal guard killed at Versailles in front of the terrified Queen.,BeetleLM/beetlelm_eng-nld_balanced,step-18341,eng,4.976542949676514,144.97233769107902
475,The war expenditures of U.S. imperialism in the conquest of the Philippines were paid for by the Filipino people themselves.,BeetleLM/beetlelm_eng-nld_balanced,step-18341,eng,4.74622917175293,115.14925676513863
476,They were compelled to pay taxes to the U.S. colonial regime to defray a major part of the expenditures and the interest on bonds floated in the name of the Philippine government through the Wall Street banking houses.,BeetleLM/beetlelm_eng-nld_balanced,step-18341,eng,5.358804225921631,212.4707274972684
477,"Of course, the superprofits derived from the protracted exploitation of the Filipino people would constitute the basic gains of U.S. imperialism.",BeetleLM/beetlelm_eng-nld_balanced,step-18341,eng,5.545553207397461,256.0962133825606
478,To understand the Templars one must understand the context that prompted the creation of the order.,BeetleLM/beetlelm_eng-nld_balanced,step-18341,eng,5.0417160987854,154.73532841794025
479,"The age where the events took place is commonly referred as the High Middle Ages the period of European history in the 11th, 12th, and 13th centuries (AD 1000–1300).",BeetleLM/beetlelm_eng-nld_balanced,step-18341,eng,4.537168979644775,93.42593465390156
480,"The High Middle Ages were preceded by the Early Middle Ages and followed by the Late Middle Ages, which by convention ends around 1500.",BeetleLM/beetlelm_eng-nld_balanced,step-18341,eng,4.023768901824951,55.91143393021524
481,"Technological determinism is a term that encompasses a wide range of ideas in practice, from technology-push or the technological imperative to a strict sense that human destiny is driven by an underlying logic associated with scientific laws and their manifestation in technology.",BeetleLM/beetlelm_eng-nld_balanced,step-18341,eng,5.5489373207092285,256.9643400784175
482,"Most interpretations of technological determinism share two general ideas: that the development of technology itself follows a path largely beyond cultural or political influence, and that technology in turn has ""effects"" on societies that are inherent, rather than socially conditioned.",BeetleLM/beetlelm_eng-nld_balanced,step-18341,eng,6.381837368011475,591.0126183424816
483,"For example, one might say that the motor car necessarily leads to the development of roads.",BeetleLM/beetlelm_eng-nld_balanced,step-18341,eng,5.659117221832275,286.8952658576775
484,"However, a nationwide road network is not economically viable for just a handful of cars, so new methods of production are developed to reduce the cost of car ownership.",BeetleLM/beetlelm_eng-nld_balanced,step-18341,eng,5.731263637542725,308.35867589009774
485,"Mass car ownership also leads to a higher incidence of accidents on the roads, which leads to the invention of new techniques in healthcare for repairing damaged bodies.",BeetleLM/beetlelm_eng-nld_balanced,step-18341,eng,5.544295310974121,255.77427339774408
486,"Romanticism had a large element of cultural determinism, drawn from writers such as Goethe, Fichte, and Schlegel.",BeetleLM/beetlelm_eng-nld_balanced,step-18341,eng,5.424006462097168,226.78591394468717
487,"In the context of Romanticism, the geography molded individuals, and over time customs and culture related to that geography arose, and these, being in harmony with the place of the society, were better than arbitrarily imposed laws.",BeetleLM/beetlelm_eng-nld_balanced,step-18341,eng,5.188547611236572,179.20808401901348
488,"In the manner that Paris is known as the fashion capital of the contemporary world, Constantinople was regarded as the fashion capital of feudal Europe.",BeetleLM/beetlelm_eng-nld_balanced,step-18341,eng,4.612662315368652,100.752026560474
489,Its renown for being an epicenter of luxury began in about 400 A.D. and lasted up until about 1100 A.D.,BeetleLM/beetlelm_eng-nld_balanced,step-18341,eng,4.980133056640625,145.49373927393123
490,Its status declined during the twelfth century mainly due to the fact that Crusaders had returned bearing gifts such as silks and spices that were valued more than what Byzantine markets offered.,BeetleLM/beetlelm_eng-nld_balanced,step-18341,eng,5.439184188842773,230.25426282057919
491,It was at this time that the transfer of the title of Fashion Capital from Constantinople to Paris was made.,BeetleLM/beetlelm_eng-nld_balanced,step-18341,eng,4.885961055755615,132.41766496059336
492,Gothic style peaked in the period between the 10th - 11th centuries and the 14th century.,BeetleLM/beetlelm_eng-nld_balanced,step-18341,eng,4.369102478027344,78.97272013042146
493,At the beginning dress was heavily influenced by the Byzantine culture in the east.,BeetleLM/beetlelm_eng-nld_balanced,step-18341,eng,3.9251627922058105,50.661324656369615
494,"However, due to the slow communication channels, styles in the west could lag behind by 25 to 30 year.",BeetleLM/beetlelm_eng-nld_balanced,step-18341,eng,6.46750545501709,643.875545446923
495,towards the end of the Middle Ages western Europe began to develop their own style. one of the biggest developments of the time as a result of the crusades people began to use buttons to fasten clothing.,BeetleLM/beetlelm_eng-nld_balanced,step-18341,eng,5.1197075843811035,167.28644529889965
496,Subsistence agriculture is agriculture carried out for the production of enough food to meet just the needs of the agriculturalist and his/her family.,BeetleLM/beetlelm_eng-nld_balanced,step-18341,eng,5.9190239906311035,372.0484138752944
497,"Subsistence agriculture is a simple, often organic, system using saved seed native to the ecoregion combined with crop rotation or other relatively simple techniques to maximize yield.",BeetleLM/beetlelm_eng-nld_balanced,step-18341,eng,6.704939842224121,816.4289102877476
498,Historically most farmers were engaged in subsistence agriculture and this is still the case in many developing nations.,BeetleLM/beetlelm_eng-nld_balanced,step-18341,eng,5.4232635498046875,226.61749446965152
499,Subcultures bring together like-minded individuals who feel neglected by societal standards and allow them to develop a sense of identity.,BeetleLM/beetlelm_eng-nld_balanced,step-18341,eng,6.562809944152832,708.2590695125119
500,"Subcultures can be distinctive because of the age, ethnicity, class, location, and/or gender of the members.",BeetleLM/beetlelm_eng-nld_balanced,step-18341,eng,5.059643745422363,157.53438397983047
501,"The qualities that determine a subculture as distinct may be linguistic, aesthetic, religious, political, sexual, geographical, or a combination of factors.",BeetleLM/beetlelm_eng-nld_balanced,step-18341,eng,5.402416229248047,221.94203168703837
502,"Members of a subculture often signal their membership through a distinctive and symbolic use of style, which includes fashions, mannerisms, and argot.",BeetleLM/beetlelm_eng-nld_balanced,step-18341,eng,5.902067184448242,365.79284812809743
503,"One of the most common methods used to illustrate the importance of socialization is to draw upon the few unfortunate cases of children who were, through neglect, misfortune, or wilful abuse, not socialized by adults while they were growing up.",BeetleLM/beetlelm_eng-nld_balanced,step-18341,eng,6.113445281982422,451.89293485413833
504,"Such children are called ""feral"" or wild. Some feral children have been confined by people (usually their own parents); in some cases this child abandonment was due to the parents' rejection of a child's severe intellectual or physical impairment.",BeetleLM/beetlelm_eng-nld_balanced,step-18341,eng,5.547070026397705,256.48495973930625
505,Feral children may have experienced severe child abuse or trauma before being abandoned or running away.,BeetleLM/beetlelm_eng-nld_balanced,step-18341,eng,6.377777576446533,588.6180942230314
506,Others are alleged to have been brought up by animals; some are said to have lived in the wild on their own.,BeetleLM/beetlelm_eng-nld_balanced,step-18341,eng,4.180691719055176,65.4110836618137
507,"When completely brought up by non-human animals, the feral child exhibits behaviors (within physical limits) almost entirely like those of the particular care-animal, such as its fear of or indifference to humans.",BeetleLM/beetlelm_eng-nld_balanced,step-18341,eng,5.912274360656738,369.5456805126645
508,"While project based learning should make learning easier and more interesting, scaffolding goes a step beyond.",BeetleLM/beetlelm_eng-nld_balanced,step-18341,eng,7.4348015785217285,1693.9215752220985
509,Scaffolding is not a method of learning but rather an aid that provides support to individuals whom are undergoing a new learning experience such as using a new computer program or beginning a new project.,BeetleLM/beetlelm_eng-nld_balanced,step-18341,eng,5.994175910949707,401.086017165206
510,"Scaffolds can be both virtual and real, in other words, a teacher is a form of scaffold but so is the little paperclip man in Microsoft Office.",BeetleLM/beetlelm_eng-nld_balanced,step-18341,eng,5.698727607727051,298.48736622334144
511,"Virtual Scaffolds are internalized in the software and are meant to question, prompt, and explain procedures that may have been to challenging for the student to handle alone.",BeetleLM/beetlelm_eng-nld_balanced,step-18341,eng,5.851438522338867,347.7342443383409
512,"Children are placed in Foster Care for a wide variety of reasons that range from neglect, to abuse, and even to extortion.",BeetleLM/beetlelm_eng-nld_balanced,step-18341,eng,5.978127956390381,394.7007790286762
513,"No child should ever have to grow up in an environment that is not nurturing, caring, and educational, but they do.",BeetleLM/beetlelm_eng-nld_balanced,step-18341,eng,5.553024768829346,258.0168179963193
514,We perceive the Foster Care System to be a safety zone for these children.,BeetleLM/beetlelm_eng-nld_balanced,step-18341,eng,6.790980815887451,889.7858500818103
515,"Our foster care system is supposed to provide safe homes, loving caregivers, stable education, and reliable health care.",BeetleLM/beetlelm_eng-nld_balanced,step-18341,eng,6.058995723724365,427.9454455221735
516,Foster care is supposed to provide all the necessities that were lacking in the home they were previously taken from.,BeetleLM/beetlelm_eng-nld_balanced,step-18341,eng,5.588770866394043,267.40673902650315
517,The Internet combines elements of both mass and interpersonal communication.,BeetleLM/beetlelm_eng-nld_balanced,step-18341,eng,5.556082725524902,258.80702985351815
518,The distinct characteristics of the Internet lead to additional dimensions in terms of the uses and gratifications approach.,BeetleLM/beetlelm_eng-nld_balanced,step-18341,eng,5.574559688568115,263.6334492557968
519,"For example, “learning” and “socialization” are suggested as important motivations for Internet use (James et al., 1995).",BeetleLM/beetlelm_eng-nld_balanced,step-18341,eng,6.117491245269775,453.72498077445215
520,“Personal involvement” and “continuing relationships” were also identified as new motivation aspects by Eighmey and McCord (1998) when they investigated audience reactions to websites.,BeetleLM/beetlelm_eng-nld_balanced,step-18341,eng,6.452474117279053,634.2696105518511
521,"The use of video recording has led to important discoveries in the interpretation of micro-expressions, facial movements which last a few milliseconds.",BeetleLM/beetlelm_eng-nld_balanced,step-18341,eng,5.291429042816162,198.62706927794122
522,"In particular, it is claimed that one can detect whether a person is lying by interpreting micro-expressions correctly.",BeetleLM/beetlelm_eng-nld_balanced,step-18341,eng,5.162393093109131,174.5817464724761
523,"Oliver Sacks, in his paper The President's Speech, indicated how people who are unable to understand speech because of brain damage are nevertheless able to assess sincerity accurately.",BeetleLM/beetlelm_eng-nld_balanced,step-18341,eng,6.144289970397949,466.048623239433
524,He even suggests that such abilities in interpreting human behavior may be shared by animals such as domestic dogs.,BeetleLM/beetlelm_eng-nld_balanced,step-18341,eng,5.5960235595703125,269.35320809713426
525,Twentieth century research has shown that there are two pools of genetic variation: hidden and expressed.,BeetleLM/beetlelm_eng-nld_balanced,step-18341,eng,6.805441856384277,902.7465661501934
526,"Mutation adds new genetic variation, and selection removes it from the pool of expressed variation.",BeetleLM/beetlelm_eng-nld_balanced,step-18341,eng,6.198342323303223,491.932899127125
527,Segregation and recombination shuffle variation back and forth between the two pools with each generation.,BeetleLM/beetlelm_eng-nld_balanced,step-18341,eng,5.737330436706543,310.235112273136
528,"Out on the savanna, it is hard for a primate with a digestive system like that of humans to satisfy its amino-acid requirements from available plant resources.",BeetleLM/beetlelm_eng-nld_balanced,step-18341,eng,5.641232013702393,281.809698099091
529,"Moreover, failure to do so has serious consequences: growth depression, malnutrition, and ultimately death.",BeetleLM/beetlelm_eng-nld_balanced,step-18341,eng,6.8162360191345215,912.5437405293748
530,"The most readily accessible plant resources would have been the proteins accessible in leaves and legumes, but these are hard for primates like us to digest unless they are cooked.",BeetleLM/beetlelm_eng-nld_balanced,step-18341,eng,5.73783540725708,310.3918114294763
531,"In contrast, animal foods (ants, termites, eggs) not only are easily digestible, but they provide high-quantity proteins that contain all the essential amino acids.",BeetleLM/beetlelm_eng-nld_balanced,step-18341,eng,5.493810176849365,243.18201037277206
532,"All things considered, we should not be surprised if our own ancestors solved their ""protein problem"" in somewhat the same way that chimps on the savanna do today.",BeetleLM/beetlelm_eng-nld_balanced,step-18341,eng,5.930955410003662,376.51406734333403
533,Sleep interruption is the process of purposefully awakening during your normal sleep period and falling asleep a short time later (10–60 minutes).,BeetleLM/beetlelm_eng-nld_balanced,step-18341,eng,6.1590375900268555,472.97266211606984
534,This can be easily done by using a relatively quiet alarm clock to bring you to consciousness without fully waking you.,BeetleLM/beetlelm_eng-nld_balanced,step-18341,eng,5.691934585571289,296.46660623573837
535,"If you find yourself resetting the clock in your sleep, it can be placed on the other side of the room, forcing you to get out of bed to turn it off.",BeetleLM/beetlelm_eng-nld_balanced,step-18341,eng,4.091263771057129,59.81543697614649
536,"Other biorhythm-based options involve drinking lots of fluid (particularly water or tea, a known diuretic) prior to sleep, forcing one to get up to urinate.",BeetleLM/beetlelm_eng-nld_balanced,step-18341,eng,7.023129940032959,1122.2938386019764
537,The amount of inner peace a person possesses correlates oppositely to the amount of tension in one’s body and spirit.,BeetleLM/beetlelm_eng-nld_balanced,step-18341,eng,6.522134304046631,680.0282245817443
538,"The lower the tension, the more positive the life force present. Every person has the potential to find absolute peace and contentment.",BeetleLM/beetlelm_eng-nld_balanced,step-18341,eng,6.5239105224609375,681.2371766000643
539,Everyone can achieve enlightenment. The only thing standing in the way of this goal is our own tension and negativity.,BeetleLM/beetlelm_eng-nld_balanced,step-18341,eng,5.649675369262695,284.1991910541846
540,"The Tibetan Buddhism is based on the teachings of Buddha, but were extended by the mahayana path of love and by a lot of techniques from Indian Yoga.",BeetleLM/beetlelm_eng-nld_balanced,step-18341,eng,4.701464653015137,110.10832489715972
541,"In principle the Tibetan Buddhism is very simple. It consists of Kundalini Yoga, meditation and the path of all-embracing love.",BeetleLM/beetlelm_eng-nld_balanced,step-18341,eng,5.431180953979492,228.41883834038697
542,"With Kundalini Yoga the Kundalini energy (enlightenment energy) is awakened through yoga postures, breathing exercises, mantras and visualizations.",BeetleLM/beetlelm_eng-nld_balanced,step-18341,eng,6.828485012054443,923.7902207584848
543,"The center of Tibetan meditation is the Deity Yoga. Through the visualization of various deities the energy channels are cleaned, the chakras are activated and the enlightenment consciousness is created.",BeetleLM/beetlelm_eng-nld_balanced,step-18341,eng,5.522997856140137,250.3845299932113
544,"Germany was a common enemy in World War 2, leading to cooperation between the USSR and USA. With the end of the war the clashes of system, process and culture led to the countries falling out.",BeetleLM/beetlelm_eng-nld_balanced,step-18341,eng,4.555683135986328,95.1717482796384
545,"With two years of the end of the war, the former allies were now enemies and the Cold War began.",BeetleLM/beetlelm_eng-nld_balanced,step-18341,eng,4.599676132202148,99.45210109261524
546,"It was to last for the next 40 years and would be fought for real, by proxy armies, on battlefields from Africa to Asia, in Afghanistan, Cuba and many other places.",BeetleLM/beetlelm_eng-nld_balanced,step-18341,eng,4.553601264953613,94.97381907678766
547,"By September 17, 1939, the Polish defense was already broken, and the only hope was to retreat and reorganise along the Romanian bridgehead.",BeetleLM/beetlelm_eng-nld_balanced,step-18341,eng,5.208139419555664,182.75371368691825
548,"However, these plans were rendered obsolete nearly overnight, when over 800,000 soldiers from the Soviet's Union Red Army entered and created the Belarussian and Ukrainian fronts after invading the eastern regions of Poland in violation of the Riga Peace Treaty, the Soviet-Polish Non-Aggression Pact, and other international treaties, both bilateral and multilateral.",BeetleLM/beetlelm_eng-nld_balanced,step-18341,eng,5.6248674392700195,277.235531542749
549,Using ships to transport goods is by far the most efficient way to move large amounts of people and goods across oceans.,BeetleLM/beetlelm_eng-nld_balanced,step-18341,eng,5.494837284088135,243.43191269223558
550,"The job of navies has traditionally been to ensure that your country maintains the ability to move your people and goods, while at the same time, interfering with your enemy's ability to move his people and goods.",BeetleLM/beetlelm_eng-nld_balanced,step-18341,eng,5.497898101806641,244.17815487690038
551,One of the most noteworthy recent examples of this was the North Atlantic campaign of WWII. The Americans were trying to move men and materials across the Atlantic Ocean to help Britain.,BeetleLM/beetlelm_eng-nld_balanced,step-18341,eng,5.47240686416626,238.0324155450533
552,"At the same time, the German navy, using mainly U-boats, was trying to stop this traffic.",BeetleLM/beetlelm_eng-nld_balanced,step-18341,eng,5.289766311645508,198.2970802760428
553,"Had the Allies failed, Germany probably would have been able to conquer Britain as it had the rest of Europe.",BeetleLM/beetlelm_eng-nld_balanced,step-18341,eng,5.0327935218811035,153.36083169557526
554,"Goats seem to have been first domesticated roughly 10,000 years ago in the Zagros Mountains of Iran.",BeetleLM/beetlelm_eng-nld_balanced,step-18341,eng,5.01667594909668,150.90884048237194
555,"Ancient cultures and tribes began to keep them for easy access to milk, hair, meat, and skins.",BeetleLM/beetlelm_eng-nld_balanced,step-18341,eng,5.331893444061279,206.82922319969597
556,"Domestic goats were generally kept in herds that wandered on hills or other grazing areas, often tended by goatherds who were frequently children or adolescents, similar to the more widely known shepherd. These methods of herding are still used today.",BeetleLM/beetlelm_eng-nld_balanced,step-18341,eng,5.906108856201172,367.2742544121895
557,Wagonways were built in England as early as the 16th Century.,BeetleLM/beetlelm_eng-nld_balanced,step-18341,eng,4.712057590484619,111.28089501410959
558,"Although wagonways merely consisted of parallel planks of wood, they allowed horses pulling them to achieve greater speeds and pull larger loads than on the slightly more rough roads of the day.",BeetleLM/beetlelm_eng-nld_balanced,step-18341,eng,6.637814521789551,763.4247204208666
559,"Crossties were introduced fairly early to hold the tracks in place. Gradually, however, it was realised that tracks would be more efficient if they had a stip of iron on the top.",BeetleLM/beetlelm_eng-nld_balanced,step-18341,eng,5.523036479949951,250.39420098444228
560,"This became common practice, but the iron caused more wear on the wooden wheels of the wagons.",BeetleLM/beetlelm_eng-nld_balanced,step-18341,eng,6.341004371643066,567.3658715012796
561,"Eventually, wooden wheels were replaced by iron wheels. In 1767, the first full-iron rails were introduced.",BeetleLM/beetlelm_eng-nld_balanced,step-18341,eng,5.4244704246521,226.89115852962877
562,"The first known transportation was walking, humans began walking upright two million years ago with the emergence of Homo Erectus (meaning upright man).",BeetleLM/beetlelm_eng-nld_balanced,step-18341,eng,5.954151153564453,385.3496691156848
563,"Their predecessors, the Australopithecus did not walk upright as habitually.",BeetleLM/beetlelm_eng-nld_balanced,step-18341,eng,6.05417537689209,425.8875638857769
564,"Bipedal specializations are found in Australopithecus fossils from 4.2-3.9 million years ago, although Sahelanthropus may have walked on two legs as early as seven million years ago.",BeetleLM/beetlelm_eng-nld_balanced,step-18341,eng,4.8566460609436035,128.59218767671996
565,"We can start living more friendly to the environment, we can join to the environmental movement, and we can even be activists in order to reduce the future suffering in some degree.",BeetleLM/beetlelm_eng-nld_balanced,step-18341,eng,4.883059024810791,132.03394185669993
566,"This is just like symptomatic treatment in many cases. However, if we do not only want a temporary solution, then we should find the root of the problems, and we should deactivate them.",BeetleLM/beetlelm_eng-nld_balanced,step-18341,eng,4.769628524780273,117.87544601941042
567,"It is obvious enough that the world has changed much because of humankind's scientific and technological advancements, and problems have become greater because of overpopulation and mankind's extravagant lifestyle.",BeetleLM/beetlelm_eng-nld_balanced,step-18341,eng,5.742397308349609,311.81102286298346
568,"After its adoption by Congress on July 4, a handwritten draft signed by the President of Congress John Hancock and the Secretary Charles Thomson was then sent a few blocks away to the printing shop of John Dunlap.",BeetleLM/beetlelm_eng-nld_balanced,step-18341,eng,5.405666351318359,222.66454387294624
569,"Through the night between 150 and 200 copies were made, now known as ""Dunlap broadsides"".",BeetleLM/beetlelm_eng-nld_balanced,step-18341,eng,6.081249713897705,437.5756975917252
570,The first public reading of the document was by John Nixon in the yard of Independence Hall on July 8.,BeetleLM/beetlelm_eng-nld_balanced,step-18341,eng,5.135737895965576,169.9897083271411
571,"One was sent to George Washington on July 6, who had it read to his troops in New York on July 9. A copy reached London on August 10.",BeetleLM/beetlelm_eng-nld_balanced,step-18341,eng,5.063770771026611,158.18587585318346
