sentence_id,sentence,repo,revision,iso_code,nll,ppl
754,"Официалната валута на Фолкландските острови е Фолкландската лира (FKP) със стойност, равна на една британска лира (GBP).",BeetleLM/beetlelm_zho-bul_heritage,step-20000,bul,5.948923110961914,383.340301734549
755,"Парите може да се обменят само в банка, намираща се в Стенли срещу магазина на FIC West, която е единствена на островите.",BeetleLM/beetlelm_zho-bul_heritage,step-20000,bul,5.00385856628418,148.9869273639721
756,"Британските лири обикновено се приемат навсякъде на островите, а американските долари също често се приемат в рамките на кредитните карти „Stanley“.",BeetleLM/beetlelm_zho-bul_heritage,step-20000,bul,5.364736080169678,213.73481837957652
757,"На крайните острови вероятно няма да приемат кредитни карти, но може да се използва британска и американска валута; говорете с домакините предварително, за да разберете кой е приемливият метод на плащане.",BeetleLM/beetlelm_zho-bul_heritage,step-20000,bul,5.320055961608887,204.3953199638755
758,"Почти невъзможно е да се обмени валутата на Фолкландските острови извън островите, така че обменете пари преди да напуснете островите.",BeetleLM/beetlelm_zho-bul_heritage,step-20000,bul,6.006547451019287,406.07888997910186
759,"Тъй като Монтевидео се намира на юг от екватора, там е лято, когато в Северното полукълбо е зима, и обратно.",BeetleLM/beetlelm_zho-bul_heritage,step-20000,bul,5.868931770324707,353.870763041999
760,Монтевидео е в субтропичната област; през летните месеци са нормални температури над +30 °C.,BeetleLM/beetlelm_zho-bul_heritage,step-20000,bul,6.071337699890137,433.25986577563583
761,"Зимата може да е измамно студена: температурите рядко падат под нулата, но комбинираните вятър и влага водят до усещане за по-студено отколкото показва термометърът.",BeetleLM/beetlelm_zho-bul_heritage,step-20000,bul,6.89166784286499,984.0412755453951
762,Няма специални „дъждовни“ и „сухи“ сезони: през цялата година количеството дъждове остава приблизително еднакво.,BeetleLM/beetlelm_zho-bul_heritage,step-20000,bul,7.8694844245910645,2616.216383577196
763,"Въпреки че много от животните в парка са свикнали да виждат хора, дивите животни все пак си остават диви и не трябва да се хранят или обезпокояват.",BeetleLM/beetlelm_zho-bul_heritage,step-20000,bul,5.511146545410156,247.43465956836155
764,"Според парковите органи, от мечки и вълци стойте на поне 100 ярда/метра, а от всички други диви животни на 25 ярда/метра!",BeetleLM/beetlelm_zho-bul_heritage,step-20000,bul,6.679472923278809,795.8995013425455
765,"Без значение колко изглеждат послушни, бизоните, елените, лосовете, мечките и почти всички големи животни могат да нападнат.",BeetleLM/beetlelm_zho-bul_heritage,step-20000,bul,6.214352130889893,499.87203261229735
766,"Всяка година десетки посетители биват ранени, защото не са спазвали необходимата дистанция. Тези животни са големи, диви и потенциално опасни, така че не навлизайте в личното им пространство.",BeetleLM/beetlelm_zho-bul_heritage,step-20000,bul,6.086297988891602,439.79028526435565
767,"В допълнение, имайте предвид, че миризмите привличат мечки и други диви животни, така че избягвайте носенето или готвенето на ароматна храна и поддържайте лагера чист.",BeetleLM/beetlelm_zho-bul_heritage,step-20000,bul,6.0506768226623535,424.40017651755653
768,Апия е столицата на Самоа. Градът се намира на остров Уполу и е с население от почти 40 000 души.,BeetleLM/beetlelm_zho-bul_heritage,step-20000,bul,6.339000225067139,566.2299258136624
769,"Апия, която е официална столица на Самоа от 1959 г., е основана през 50-те години на 18-ти век.",BeetleLM/beetlelm_zho-bul_heritage,step-20000,bul,5.48760461807251,241.67760278654146
770,"На пристанището през 1889 г. се разиграва скандален морски сблъсък, когато седем кораба от Германия, САЩ и Великобритания отказват да го напуснат.",BeetleLM/beetlelm_zho-bul_heritage,step-20000,bul,5.961067199707031,388.0240024548873
771,"Всички кораби са потопени, с изключение на един британски крайцер. Почти 200 американци и германци изгубват живота си.",BeetleLM/beetlelm_zho-bul_heritage,step-20000,bul,5.896552562713623,363.7811908001026
772,"По време на организираната от движението „Мау“ борба за независимост, едно мирно събиране в града завършва с убийството на върховния вожд Тупуа Тамасесе Леалофи III.",BeetleLM/beetlelm_zho-bul_heritage,step-20000,bul,6.380053520202637,589.9592815538367
773,"Тъй като Оукланд прекосява две пристанища, има много плажове. Най-популярните са в три области.",BeetleLM/beetlelm_zho-bul_heritage,step-20000,bul,5.9032793045043945,366.2365018021494
774,Плажове Норт Шор (в района Норт Харбър) са разположени на Тихия океан и се простират от Лонг Бей на север до Девънпорт на юг.,BeetleLM/beetlelm_zho-bul_heritage,step-20000,bul,7.23068904876709,1381.1738724337552
775,Почти всичките са охраняеми пясъчни плажове за къпане и повечето имат сянка под дърветата похутукава.,BeetleLM/beetlelm_zho-bul_heritage,step-20000,bul,6.84783935546875,941.8437171661412
776,"Плажовете на Тамаки Драйв са край пристанище „Уайтемата“, в покрайнините на скъпите райони „Мишън Бей“ и „Сейнт Хелиърс“ в Централен Оукланд.",BeetleLM/beetlelm_zho-bul_heritage,step-20000,bul,6.795473098754883,893.792011479694
777,Това са понякога претъпкани семейни плажове с добър набор от магазини покрай брега. Плуването е безопасно.,BeetleLM/beetlelm_zho-bul_heritage,step-20000,bul,6.7254180908203125,833.3203072952493
778,"Основната местна бира е „Номер едно“. Тя не е тежка бира, а е приятна и освежаваща. „Манта“ е названието на другата местна бира.",BeetleLM/beetlelm_zho-bul_heritage,step-20000,bul,6.948233127593994,1041.3082430239713
779,"Има много френски вина за проба, но новозеландски и австралийски може да преминават по - добре.",BeetleLM/beetlelm_zho-bul_heritage,step-20000,bul,6.0667524337768555,431.2778016133539
780,"Местната чешмяна вода е напълно безопасна за консумация, но бутилирана вода лесно се намира, ако ви е страх.",BeetleLM/beetlelm_zho-bul_heritage,step-20000,bul,6.113532543182373,451.93236929440644
781,"Идеята за „плоско бяло“ кафе е чужда за австралийците. Късото черно е „еспресо“, капучиното е отрупано догоре със сметана (не пяна), а чаят се сервира без мляко.",BeetleLM/beetlelm_zho-bul_heritage,step-20000,bul,7.030866622924805,1131.010345087934
782,"Горещият шоколад отговаря на стандарта за белгийски. Плодовите сокове са скъпички, но прекрасни.",BeetleLM/beetlelm_zho-bul_heritage,step-20000,bul,7.046069622039795,1148.3364651413378
783,"Много от разходките до рифа са целогодишни, а злополуките на рифа, породени от някоя от тези причини, са редки.",BeetleLM/beetlelm_zho-bul_heritage,step-20000,bul,6.100497245788574,446.0795261100498
784,"Все пак обръщайте внимание на съветите на властите, следвайте всички знаци и обръщайте специално внимание на предупрежденията за безопасност.",BeetleLM/beetlelm_zho-bul_heritage,step-20000,bul,5.6228485107421875,276.6763774551875
785,Кубовидните медузи се срещат близо до плажовете и речните устия от октомври до април северно от град 1770. Понякога могат да бъдат срещнати и извън този период.,BeetleLM/beetlelm_zho-bul_heritage,step-20000,bul,6.396809101104736,599.9276718929669
786,"Има акули, но те рядко нападат хора. Повечето акули се страхуват от хората и отплуват настрани.",BeetleLM/beetlelm_zho-bul_heritage,step-20000,bul,5.917068004608154,371.3214036206301
787,"Соленоводните крокодили не живеят активно в океана, тяхното основно местообитание е по речните устия на север от Рокхемптън.",BeetleLM/beetlelm_zho-bul_heritage,step-20000,bul,7.16364049911499,1291.604469241924
788,"Резервирането предварително осигурява спокойствие за пътника, че ще има къде да преспи, когато пристигне в местоназначението си.",BeetleLM/beetlelm_zho-bul_heritage,step-20000,bul,5.276644706726074,195.71210095992672
789,"Туристическите агенти често имат договорки с определени хотели, въпреки че може да намерите и други начини на настаняване, като къмпинги, чрез туристически агент.",BeetleLM/beetlelm_zho-bul_heritage,step-20000,bul,6.0379180908203125,419.0197650724997
790,"Туристическите агенции често предлагат пакети с включени закуска, транспорт от/до летището или дори комбинирани пакети самолет и хотел.",BeetleLM/beetlelm_zho-bul_heritage,step-20000,bul,6.034418106079102,417.555765770575
791,"Могат също така да запазят резервацията ви, ако се нуждаете от време да обмислите офертата или да си извадите други документи за дестинацията си (напр. виза).",BeetleLM/beetlelm_zho-bul_heritage,step-20000,bul,6.109066963195801,449.9187285339754
792,"Въпреки това, всякакви изменения или заявки трябва да се насочат първо към туристическия агент, а не директно към хотела.",BeetleLM/beetlelm_zho-bul_heritage,step-20000,bul,5.583150863647461,265.9081274636666
793,На някои музикални фестивали огромно мнозинство от участниците решава да лагерува на територията на фестивала и повечето участници го считат за жизненоважна част от преживяването.,BeetleLM/beetlelm_zho-bul_heritage,step-20000,bul,6.060146331787109,428.4381263891399
794,"Ако искате да сте близо до събитието, ще трябва да отидете по-рано, за да получите място за къмпинг близо до музиката.",BeetleLM/beetlelm_zho-bul_heritage,step-20000,bul,4.897818088531494,133.9970907013807
795,"Помнете, че въпреки че музиката на основните сцени може да е приключила, може да има фестивални сцени, на които ще продължи да се свири до късно през нощта.",BeetleLM/beetlelm_zho-bul_heritage,step-20000,bul,4.537308216094971,93.43894385505543
796,Някои фестивали предлагат специални места за къмпинг за семейства с малки деца.,BeetleLM/beetlelm_zho-bul_heritage,step-20000,bul,6.445123195648193,629.624239150515
797,"Ако прекосите Северна Балтика през зимата, проверете локацията на хижата, тъй като за най - засегнатите преминаването през лед причинява доста ужасен шум.",BeetleLM/beetlelm_zho-bul_heritage,step-20000,bul,6.613600730895996,745.1613192879375
798,Круизите до Санкт Петербург включват и време в града. Пътниците в круиза са освободени от изискването за виза (вижте условията).,BeetleLM/beetlelm_zho-bul_heritage,step-20000,bul,7.013087272644043,1111.0794204564754
799,"Обикновено казината полагат много усилия за гостите да харчат максимално време и пари. По принцип няма прозорци и часовници, а изходите могат да са трудни за намиране.",BeetleLM/beetlelm_zho-bul_heritage,step-20000,bul,5.919875144958496,372.36521929879126
800,"За да поддържат гостите в добро настроение и да ги задържат в помещението, те обикновено предлагат специална храна, напитки и оферти за забавления.",BeetleLM/beetlelm_zho-bul_heritage,step-20000,bul,5.526699066162109,251.3129728460738
801,"На някои места се предлагат безплатни алкохолни напитки. Обаче пиянството влияе на преценката, а всички добри комарджии знаят колко е важно да останат трезви.",BeetleLM/beetlelm_zho-bul_heritage,step-20000,bul,6.21518087387085,500.2864697579191
802,"Всеки, който ще шофира на големи височини или през планински проходи, трябва да има предвид възможността за сняг, лед или минусови температури.",BeetleLM/beetlelm_zho-bul_heritage,step-20000,bul,6.306440830230713,548.090725228187
803,На заледени и заснежени пътища триенето е слабо и не може да шофирате както на чист асфалт.,BeetleLM/beetlelm_zho-bul_heritage,step-20000,bul,6.938426494598389,1031.1464233060365
804,"По време на виелици за много кратко време може да падне достатъчно сняг, че да заседнеш.",BeetleLM/beetlelm_zho-bul_heritage,step-20000,bul,5.916720867156982,371.1925264253564
805,"Видимостта може да бъде ограничена също и при снеговалеж или виелица, както и от кондензация или лед по прозорците на превозното средство.",BeetleLM/beetlelm_zho-bul_heritage,step-20000,bul,6.0834221839904785,438.5273510531221
806,"От друга страна, заледяванията и снеговалежите са нормални условия в много страни, а движението се извършва почти непрекъснато през цялата година.",BeetleLM/beetlelm_zho-bul_heritage,step-20000,bul,5.492186546325684,242.78749299981308
807,Сафаритата може би представляват най-голям туристически интерес в Африка и са крайна цел за много посетители.,BeetleLM/beetlelm_zho-bul_heritage,step-20000,bul,5.760749340057373,317.58621985232077
808,"Терминът „сафари“ в популярната си употреба реферира към пътуване по суша за разглеждане на изумителната африканска дива природа, по-конкретно в саваната.",BeetleLM/beetlelm_zho-bul_heritage,step-20000,bul,6.044356346130371,421.7262243892206
809,"Някои животни, като слонове и жирафи, са склонни да се доближават повече до колите и се получава добър изглед със стандартно оборудване.",BeetleLM/beetlelm_zho-bul_heritage,step-20000,bul,5.839592933654785,343.63942814397296
810,"Понякога лъвовете, гепардите и леопардите са срамежливи и се наблюдават по-добре с бинокъл.",BeetleLM/beetlelm_zho-bul_heritage,step-20000,bul,6.084507465362549,439.00353496839097
811,"Пешеходното сафари (наричано още ""разходка в пустошта"", ""туристическо сафари"" или ""ходене пеша"") представлява разходка с продължителност няколко часа или няколко дни.",BeetleLM/beetlelm_zho-bul_heritage,step-20000,bul,6.231802463531494,508.6715195504949
812,Параолимпийските игри ще се проведат между 24 август и 5 септември 2021 г. Някои от събитията ще се състоят на други места в Япония.,BeetleLM/beetlelm_zho-bul_heritage,step-20000,bul,5.82977294921875,340.2814091401914
813,"Токио ще бъде единственият азиатски град, който е бил домакин на две летни олимпийски игри, след домакинството на игрите през 1964 г.",BeetleLM/beetlelm_zho-bul_heritage,step-20000,bul,5.533188343048096,252.94911526089987
814,"Ако сте резервирали полети и настаняване за 2020 г. преди обявяване на отлагането на сезона, може да се окажете в трудна ситуация.",BeetleLM/beetlelm_zho-bul_heritage,step-20000,bul,4.93804407119751,139.49713608548277
815,"Политиките за анулиране варират, но към края на март повечето политики за анулиране, основани на коронавирус, не се удължават до юли 2020 г., за когато е насрочена Олимпиадата.",BeetleLM/beetlelm_zho-bul_heritage,step-20000,bul,5.851351261138916,347.70390195479143
816,"Очакванията са, че повечето билети ще струват между 2 500 и 130 000 йени, като обикновените ще струват около 7 000 йени.",BeetleLM/beetlelm_zho-bul_heritage,step-20000,bul,4.939454078674316,139.6939668241527
817,"Гладенето на влажни дрехи може да им помогне да изсъхнат. Много хотели разполагат с ютия и дъска за гладене, които се заемат, дори ако в стаята няма такива.",BeetleLM/beetlelm_zho-bul_heritage,step-20000,bul,5.505035877227783,245.92727870954442
818,"Ако няма ютия или не искате да носите гладени чорапи, можете да опитате да използвате сешоар, ако има такъв.",BeetleLM/beetlelm_zho-bul_heritage,step-20000,bul,5.930690288543701,376.4142586154066
819,Не позволявайте тъканта да стане твърде гореща (което може да причини свиване или в крайни случаи - обгаряне).,BeetleLM/beetlelm_zho-bul_heritage,step-20000,bul,6.409230709075928,607.4262138020467
820,"Водата може да се пречиства по различни начини, някои по - ефикасни срещу конкретни заплахи.",BeetleLM/beetlelm_zho-bul_heritage,step-20000,bul,6.237522125244141,511.58928492619526
821,"В някои райони е достатъчно кипването на вода за минута, в други са необходими няколко минути.",BeetleLM/beetlelm_zho-bul_heritage,step-20000,bul,5.900385856628418,365.17834716978433
822,"Филтрите имат различна ефикасност и ако се притеснявате, трябва да обмислите закупуването на вода в запечатана бутилка от реномирана компания.",BeetleLM/beetlelm_zho-bul_heritage,step-20000,bul,5.6307806968688965,278.87975321841236
823,"Пътуващите могат да срещнат животни вредители, които не са им познати от родните места.",BeetleLM/beetlelm_zho-bul_heritage,step-20000,bul,5.852795600891113,348.2064673726168
824,"Вредителите могат да развалят храната, да причинят дразнене или в най - лошия случай да причинят алергични реакции, да разпространят отрова или да предадат инфекции.",BeetleLM/beetlelm_zho-bul_heritage,step-20000,bul,6.111510276794434,451.01936513432184
825,"Инфекциозните болести или опасни животни сами по себе си, които могат да наранят или убият хора със сила, обикновено не се квалифицират като вредители.",BeetleLM/beetlelm_zho-bul_heritage,step-20000,bul,5.813349723815918,334.73853140860433
826,Безмитното пазаруване е възможност да се купят стоки без данъци и акцизи на определени места.,BeetleLM/beetlelm_zho-bul_heritage,step-20000,bul,6.437379837036133,624.7676602584421
827,"Пътешествениците, пътуващи за държави с тежко данъчно облагане, понякога могат да икономисат значителна сума пари, особено за продукти като алкохолни напитки и тютюн.",BeetleLM/beetlelm_zho-bul_heritage,step-20000,bul,6.709939956665039,820.5213711319966
828,"Разстоянието между Пойнт Марион и Фермонт представлява най-трудните условия за шофиране по магистралата Бъфало-Питсбърг, като често преминава през изолирани крайни райони.",BeetleLM/beetlelm_zho-bul_heritage,step-20000,bul,6.6037702560424805,737.8719175200691
829,"Ако не сте свикнали да шофирате по провинциални пътища, бъдете нащрек: преобладават стръмни склонове, тесни ленти и остри завои.",BeetleLM/beetlelm_zho-bul_heritage,step-20000,bul,6.160869121551514,473.8397202367984
830,"Обявените ограничения на скоростта са забележимо по-ниски, отколкото в предишните или следващите участъци, където те са обикновено 35 – 40 mph (56 – 64 км/ч) и стриктното им спазване обаче е по-важно, отколкото на други места.",BeetleLM/beetlelm_zho-bul_heritage,step-20000,bul,5.48592472076416,241.27195005499573
