sentence_id,sentence,repo,revision,iso_code,nll,ppl
207,Het Institute for Justice and Democracy in Haïti sprak over onafhankelijke studenten die zeiden dat het Nepalese VN-vredesbataljon de ziekte zonder het te weten met zich mee zou hebben gebracht naar Haïti.,BeetleLM/beetlelm_nld_L1-eng_L2_balanced,step-30000,nld,5.92926025390625,375.87635788755944
208,"Volgens Danielle Lantagne, een VN-deskundige op het gebied van de ziekte, is de uitbraak waarschijnlijk veroorzaakt door de vredestroepen.",BeetleLM/beetlelm_nld_L1-eng_L2_balanced,step-30000,nld,5.377781391143799,216.54132160418007
209,Hamilton bevestigde dat de patiënt is opgenomen in het Howard University Hospital en in stabiele toestand verkeert.,BeetleLM/beetlelm_nld_L1-eng_L2_balanced,step-30000,nld,6.138381481170654,463.3030989073362
210,"De patiënt was naar Nigeria geweest, waar het ebolavirus al in kleine mate voorkwam.",BeetleLM/beetlelm_nld_L1-eng_L2_balanced,step-30000,nld,6.1745100021362305,480.3475969496909
211,"Het ziekenhuis volgde het protocol voor infectiebeheersing, waaronder het afzonderen van de patiënt om zo te voorkomen dat anderen geïnfecteerd raken.",BeetleLM/beetlelm_nld_L1-eng_L2_balanced,step-30000,nld,5.670867919921875,290.28637041310634
212,Vóór The Simpsons werkte Simon in verschillende functies aan een aantal series.,BeetleLM/beetlelm_nld_L1-eng_L2_balanced,step-30000,nld,5.489212989807129,242.06662297242772
213,"Hij verleende in de jaren 80 zijn medewerking aan shows zoals Taxi, Cheers en The Tracy Ullman Show.",BeetleLM/beetlelm_nld_L1-eng_L2_balanced,step-30000,nld,6.6241936683654785,753.096721957264
214,In 1989 werkte hij samen met Brooks en Groening aan The Simpsons en was hij verantwoordelijk voor het werven van het eerste schrijversteam.,BeetleLM/beetlelm_nld_L1-eng_L2_balanced,step-30000,nld,4.828440189361572,125.01580750683372
215,"Na zijn vertrek uit de serie in 1993, bleef hij op papier uitvoerend producent, waardoor hij voor elke reeks royalty's ontving, ter waarde van enkele tientallen miljoenen dollars.",BeetleLM/beetlelm_nld_L1-eng_L2_balanced,step-30000,nld,6.088801383972168,440.89263333163166
216,Het Chinese persbureau Xinhua meldde eerder nog dat een vliegtuig was gekaapt.,BeetleLM/beetlelm_nld_L1-eng_L2_balanced,step-30000,nld,7.827031135559082,2507.4739615605963
217,"Uit latere rapporten blijkt daarnaast dat er een bommelding werd gedaan in het vliegtuig, waardoor het werd teruggeleid naar Afghanistan en landde in Kandahar.",BeetleLM/beetlelm_nld_L1-eng_L2_balanced,step-30000,nld,5.368429183959961,214.52562260968367
218,"Uit eerste berichten blijkt dat het vliegtuig terug is geleid naar Afghanistan, nadat het niet was toegestaan een noodlanding te maken in Ürümqi.",BeetleLM/beetlelm_nld_L1-eng_L2_balanced,step-30000,nld,5.766006946563721,319.2603603577092
219,Vliegtuigongelukken komen vaak voor in Iran. Ze beschikken voor zowel burgerlijke als militaire operaties over een verouderde vloot die slecht is onderhouden.,BeetleLM/beetlelm_nld_L1-eng_L2_balanced,step-30000,nld,5.679913520812988,292.9240969894168
220,Door internationale sancties kunnen er geen nieuwe vliegtuigen aangeschaft worden.,BeetleLM/beetlelm_nld_L1-eng_L2_balanced,step-30000,nld,5.050780296325684,156.14425575261708
221,Eerder deze week heeft een ongeluk met een politiehelikopter aan drie mensen het leven gekost en nog eens drie personen raakten gewond.,BeetleLM/beetlelm_nld_L1-eng_L2_balanced,step-30000,nld,6.2972493171691895,543.076023820181
222,Afgelopen maand vond in Iran de ergste vliegtuigramp in jaren plaats toen een vliegtuig dat onderweg was naar Armenië neerstortte. De 168 inzittenden overleefden het niet.,BeetleLM/beetlelm_nld_L1-eng_L2_balanced,step-30000,nld,6.375171184539795,587.0859223736153
223,In dezelfde maand schoot nog een passagiersvliegtuig van een landingsbaan op Mashhad. Dit crashte tegen een muur en hierbij kwamen zeventien mensen om het leven.,BeetleLM/beetlelm_nld_L1-eng_L2_balanced,step-30000,nld,6.358392715454102,577.3176964716655
224,Aerosmith heeft de resterende concerten van hun tournee afgelast.,BeetleLM/beetlelm_nld_L1-eng_L2_balanced,step-30000,nld,6.200531959533691,493.01123337504214
225,De toer van de rockband zou tot zestien september door de VS en Canada trekken.,BeetleLM/beetlelm_nld_L1-eng_L2_balanced,step-30000,nld,5.486232757568359,241.3462821433553
226,Ze annuleerden de toer nadat zanger Steven Tyler gewond raakte toen hij van het podium viel tijdens een optreden op 5 augustus.,BeetleLM/beetlelm_nld_L1-eng_L2_balanced,step-30000,nld,7.2148823738098145,1359.5137442573198
227,"Murray verloor de eerste set in een tiebreak, nadat beide mannen in de hele set geen enkel punt weggaven als zij serveerden.",BeetleLM/beetlelm_nld_L1-eng_L2_balanced,step-30000,nld,6.861074924468994,954.3924160673708
228,"Del Potro had een vroege voorsprong in de tweede set, maar ook hier volgde een tiebreak nadat het 6-6 werd.",BeetleLM/beetlelm_nld_L1-eng_L2_balanced,step-30000,nld,6.824650764465332,920.2549621911355
229,"Potro werd toen behandeld aan zijn schouder, maar slaagde erin de wedstrijd te vervolgen.",BeetleLM/beetlelm_nld_L1-eng_L2_balanced,step-30000,nld,6.747965335845947,852.3228064193011
230,De plaatselijke starttijd van het programma was 20.30 uur (15.00 UTC).,BeetleLM/beetlelm_nld_L1-eng_L2_balanced,step-30000,nld,4.68644380569458,108.46676424091076
231,Bekende zangers uit het hele land zongen bhajans of religieuze liederen aan de voeten van Shri Shyam.,BeetleLM/beetlelm_nld_L1-eng_L2_balanced,step-30000,nld,6.586092472076416,724.9425947585456
232,"De avond ving aan met de zanger Sanju Sharma, gevolgd door Jai Shankar Choudhary. Lakka Singh heeft ook de Chhappan bhog bhajan gepresenteerd. De zanger Raju Khandelwal hielp hem hierbij.",BeetleLM/beetlelm_nld_L1-eng_L2_balanced,step-30000,nld,7.1698079109191895,1299.594940828515
233,Daarna zong Lakkha Singh de bhajans.,BeetleLM/beetlelm_nld_L1-eng_L2_balanced,step-30000,nld,6.684136867523193,799.6202020668004
234,"Aan Baba Shyam werden 108 borden met Chhappan Bhog geserveerd (in het hindoeïsme zijn dit 56 verschillende eetbare artikelen, zoals, snoepjes, fruit, noten, gerechten, etc. die aan het heilige figuur worden aangeboden).",BeetleLM/beetlelm_nld_L1-eng_L2_balanced,step-30000,nld,6.217003345489502,501.19905898163887
235,Lakkha Singh heeft ook de Chhappan bhog bhajan gepresenteerd. De zanger Raju Khandelwal hielp hem hierbij.,BeetleLM/beetlelm_nld_L1-eng_L2_balanced,step-30000,nld,7.087309837341309,1196.6841914124093
236,"Donderdag onthulde Satoru Iwata, de directeur van Nintendo, tijdens de keynotepresentatie van de Tokyo Game Show het ontwerp van de controller voor de nieuwe Nintendo Revolution.",BeetleLM/beetlelm_nld_L1-eng_L2_balanced,step-30000,nld,5.449809551239014,232.7138416242419
237,Net als bij een tv-afstandsbediening maakt de controller gebruik van twee sensoren vlak bij de televisie van de gebruiken om de positie in een driedimensionale ruimte te kunnen bepalen.,BeetleLM/beetlelm_nld_L1-eng_L2_balanced,step-30000,nld,4.475856304168701,87.86981148925983
238,Hiermee besturen spelers acties en bewegingen in videogames door het apparaat door de lucht te bewegen.,BeetleLM/beetlelm_nld_L1-eng_L2_balanced,step-30000,nld,6.165615558624268,476.09411659432095
239,Kort na de start verloor Giancarlo Fisichella de controle over zijn auto en lag hij hiermee uit de race.,BeetleLM/beetlelm_nld_L1-eng_L2_balanced,step-30000,nld,6.330031871795654,561.1744792062976
240,"Zijn teamgenoot Fernando Alonso lag het grootste deel van de race aan kop, maar verloor deze positie direct na zijn pitstop, waarschijnlijk vanwege een slecht geplaatst rechtervoorwiel.",BeetleLM/beetlelm_nld_L1-eng_L2_balanced,step-30000,nld,6.633755207061768,760.3320205775202
241,Michael Schumacher eindigde zijn race niet lang na Alonso door de schade aan de wielophanging vanwege de vele duels tijdens de race.,BeetleLM/beetlelm_nld_L1-eng_L2_balanced,step-30000,nld,5.994887828826904,401.3716591358682
242,In een transcriptie van de nieuwsconferentie zei hij dat 'ze een schattig meisje was met een aardige stem'.,BeetleLM/beetlelm_nld_L1-eng_L2_balanced,step-30000,nld,5.558166027069092,259.3467649587374
243,"Ik was elke keer ontroerd als we dit repeteerden, uit de grond van mijn hart.",BeetleLM/beetlelm_nld_L1-eng_L2_balanced,step-30000,nld,5.506530284881592,246.29506906304047
244,Op een interne camera was circa 3 minuten na de lancering te zien dat veel stukken isolatieschuim losraakten van de brandstoftank.,BeetleLM/beetlelm_nld_L1-eng_L2_balanced,step-30000,nld,6.368768215179443,583.3388382351374
245,Vermoedelijk hebben deze echter geen schade aangericht aan de shuttle.,BeetleLM/beetlelm_nld_L1-eng_L2_balanced,step-30000,nld,6.079597473144531,436.853314131598
246,"De directeur van het Shuttle Programma van NASA, N. Wayne Hale Jr. zei dat het schuim gevallen was 'na de periode waar we zorgen over hadden.'",BeetleLM/beetlelm_nld_L1-eng_L2_balanced,step-30000,nld,5.383064270019531,217.68831021115795
247,"Na vijf minuten begint de wind, en een minuut later bereikt de wind al zo'n 70 km/u... dan begint het te regenen, maar zo hard en zo veel dat aanvoelt als speldenprikjes op je huid. Vervolgens valt er hagel. Mensen raken in paniek, beginnen te schreeuwen en rennen over elkaar heen.",BeetleLM/beetlelm_nld_L1-eng_L2_balanced,step-30000,nld,5.259527206420898,192.39050879373096
248,"'Ik raakte mijn zus en haar vriend kwijt. Toen ik er probeerde te komen, sprongen mensen zo over twee rolstoelgebruikers heen en duwden hen weg,' aldus Armand Versace.",BeetleLM/beetlelm_nld_L1-eng_L2_balanced,step-30000,nld,6.398723125457764,601.0770476827574
249,Daarnaast meldde de NHK dat de kerncentrale van Kashiwazaki Kariwa in de prefectuur Niigata zoals normaal werkte.,BeetleLM/beetlelm_nld_L1-eng_L2_balanced,step-30000,nld,6.330778121948242,561.5934120419384
250,Hokuriku Electric Power Co. rapporteert dat de aardbeving geen problemen heeft veroorzaakt en dat in de kernenergiecentrale van Shika reactoren 1 en 2 zijn stopgezet.,BeetleLM/beetlelm_nld_L1-eng_L2_balanced,step-30000,nld,5.949440956115723,383.5388640598934
251,Volgens meldingen zitten er 9400 huishouden in de regio zonder water en ongeveer 100 zonder stroom.,BeetleLM/beetlelm_nld_L1-eng_L2_balanced,step-30000,nld,5.823919773101807,338.29549973164603
252,"Enkele wegen zijn aangetast, de spoorwegdienst is gestaakt in de getroffen gebieden en de prefectuur van het vliegveld Noto in Ishikawa blijft voor langere tijd gesloten.",BeetleLM/beetlelm_nld_L1-eng_L2_balanced,step-30000,nld,5.646429061889648,283.27808902392775
253,Eén bom is ontploft buiten het kantoor waar de gouverneur-generaal werkt.,BeetleLM/beetlelm_nld_L1-eng_L2_balanced,step-30000,nld,6.691402912139893,805.4514374846099
254,Binnen een periode van twee uur kwamen er nog drie bommen tot ontploffing in de buurt van overheidsgebouwen.,BeetleLM/beetlelm_nld_L1-eng_L2_balanced,step-30000,nld,4.812439918518066,123.03143828397708
255,"In sommige rapporten wordt het officiële dodental op acht geschat. Officiële rapporten bevestigen maximaal 30 gewonden, maar de definitieve aantallen zijn er nog niet.",BeetleLM/beetlelm_nld_L1-eng_L2_balanced,step-30000,nld,6.100000858306885,445.85815276547487
256,"In urinemonsters van huisdieren die zijn gestorven na het eten van besmette dierenvoeding, werd zowel cyaanuurzuur als melamine aangetroffen.",BeetleLM/beetlelm_nld_L1-eng_L2_balanced,step-30000,nld,6.799754619598389,897.6270045495809
257,Onderzoekers van de universiteit stelden dat de twee verbindingen met elkaar reageren waardoor zich kristallen vormen die de nierfunctie kunnen blokkeren.,BeetleLM/beetlelm_nld_L1-eng_L2_balanced,step-30000,nld,5.465121746063232,236.30462251518088
258,Wetenschappers kwamen erachter dat er kristallen gevormd worden in kattenurine wanneer je hier melanine en cyanuurzuur aan toevoegt.,BeetleLM/beetlelm_nld_L1-eng_L2_balanced,step-30000,nld,6.288218975067139,538.1939381660841
259,"De samenstelling van deze kristallen heeft gelijkenissen met die van de urine van de getroffen huisdieren, vergeleken met de infraroodspectroscopie (FTIR).",BeetleLM/beetlelm_nld_L1-eng_L2_balanced,step-30000,nld,5.220088481903076,184.95054812318443
260,"Ik weet niet of je je dit realiseert, maar de meeste goederen uit Midden-Amerika kwamen dit land binnen zonder dat er belasting over hoefde te worden betaald.",BeetleLM/beetlelm_nld_L1-eng_L2_balanced,step-30000,nld,4.785439491271973,119.75398235018466
261,En toch werd tachtig procent van onze goederen belast aan de hand van tarieven uit landen in Midden-Amerika.,BeetleLM/beetlelm_nld_L1-eng_L2_balanced,step-30000,nld,5.063584804534912,158.15646131595858
262,Dat vond ik erg raar; het was ongetwijfeld oneerlijk.,BeetleLM/beetlelm_nld_L1-eng_L2_balanced,step-30000,nld,5.3791093826293945,216.82907766205784
263,Wat ik maar wil zeggen is dat jullie ons behandelen zoals wij jullie behandelen.,BeetleLM/beetlelm_nld_L1-eng_L2_balanced,step-30000,nld,4.922377109527588,137.32867078735737
264,"Arnold Schwarzenegger, de gouverneur van Californië, heeft een wetsvoorstel ondertekend waarmee het verboden wordt om gewelddadige videogames aan minderjarigen te verkopen of te verhuren.",BeetleLM/beetlelm_nld_L1-eng_L2_balanced,step-30000,nld,5.953546524047852,385.1167457547903
265,"Onder deze wet moeten gewelddadige videogames die in de staat Californië worden verkocht, een '18'-sticker hebben. Verkoop aan een minderjarige wordt bestraft met een boete van $ 1000 per overtreding.",BeetleLM/beetlelm_nld_L1-eng_L2_balanced,step-30000,nld,6.236786365509033,511.21301656796214
266,"Kier Starmer QC, directeur van het Openbaar Ministerie, heeft vanochtend verklaard dat hij zowel Pryce en Huhne wil vervolgen.",BeetleLM/beetlelm_nld_L1-eng_L2_balanced,step-30000,nld,6.71885347366333,827.8677949178247
267,"Huhne heeft ontslag genomen. In het kabinet is parlementslid Ed Davey zijn vervanger, terwijl parlementslid Norman Lamb naar verwachting Daveys taken als minister van Handel overneemt.",BeetleLM/beetlelm_nld_L1-eng_L2_balanced,step-30000,nld,7.017759323120117,1116.2825848505408
268,Naar verwachting worden Huhne en Pryce op 16 februari voorgeleid voor de Westminster Magistrates Court.,BeetleLM/beetlelm_nld_L1-eng_L2_balanced,step-30000,nld,7.282425403594971,1454.5115279177378
269,"De slachtoffers waren Nicholas Alden, 25, en Zachary Cuddeback, 21. Cuddeback was de bestuurder van het voertuig.",BeetleLM/beetlelm_nld_L1-eng_L2_balanced,step-30000,nld,6.135509014129639,461.9741855693523
270,"Edgar Veguilla raakte gewond aan zijn arm en kaak, en Kristoffer Schneider moest een reconstructieve gezichtsoperatie ondergaan.",BeetleLM/beetlelm_nld_L1-eng_L2_balanced,step-30000,nld,6.840425491333008,934.8868363601259
271,"Het wapen van Uka faalde terwijl hij het op het hoofd van een vijfde man gericht hield. Schneider heeft chronische pijn, is blind in één oog, mist een stuk schedel en zijn gezicht is met titanium gereconstrueerd.",BeetleLM/beetlelm_nld_L1-eng_L2_balanced,step-30000,nld,6.055675506591797,426.5269299151808
272,Schneider legde via videolink vanuit een USAF-basis in het land waaruit hij afkomstig was zijn verklaring af.,BeetleLM/beetlelm_nld_L1-eng_L2_balanced,step-30000,nld,6.686899662017822,801.832442935135
273,Naast het evenement van woensdag deed Carpanedo ook nog mee aan twee individuele races van het kampioenschap.,BeetleLM/beetlelm_nld_L1-eng_L2_balanced,step-30000,nld,6.5452799797058105,695.9515039721246
274,"Haar eerste was de Slalom, waar ze een Did Not Finish kreeg bij haar eerste run. 36 van de 116 deelnemers kregen hetzelfde resultaat in die race.",BeetleLM/beetlelm_nld_L1-eng_L2_balanced,step-30000,nld,6.766634464263916,868.3843917442621
275,"In de andere wedstrijd waar ze aan deelnam, de zittende Grote Slalom, werd ze tiende van de dames, met een gecombineerde tijd van 4:41:30. Dat is 2:11:60 minuten langzamer dan de Oostenrijkse winnares Claudia Loesch, en 1:09:02 minuten langzamer dan de Hongaarse Gyöngyi Dani, die als negende eindigde.",BeetleLM/beetlelm_nld_L1-eng_L2_balanced,step-30000,nld,5.73834228515625,310.549182059251
276,Vier skiërs van de vrouwengroep voor de zittende slalom konden hun ritten niet afmaken en het lukte 45 van de 117 skiërs in de reuzenslalom niet om zich te plaatsen tijdens de race.,BeetleLM/beetlelm_nld_L1-eng_L2_balanced,step-30000,nld,6.122823238372803,456.15070045595667
277,De gestolen laptop en mobiele telefoon zijn door de politie van Madhya Pradesh teruggevonden.,BeetleLM/beetlelm_nld_L1-eng_L2_balanced,step-30000,nld,4.838870525360107,126.32658844354489
278,Volgens adjunct-inspecteur-generaal D. K. Arya zijn vijf van de verkrachters van de Zweedse vrouw gearresteerd en hebben ze haar mobiele telefoon en laptop gevonden.,BeetleLM/beetlelm_nld_L1-eng_L2_balanced,step-30000,nld,6.0870819091796875,440.1351809591813
279,"Baba Kanjar, Bhutha Kanjar, Rampro Kanjar, Gaza Kanjar en Vishnu Kanjar zijn de verdachten.",BeetleLM/beetlelm_nld_L1-eng_L2_balanced,step-30000,nld,6.668872356414795,787.5070762823606
280,Volgens politiecommissaris Chandra Shekhar Solanki hadden de verdachten hun gezichten bedekt toen ze in de rechtbank verschenen.,BeetleLM/beetlelm_nld_L1-eng_L2_balanced,step-30000,nld,6.260260581970215,523.3552992958691
281,"Er bevonden zich drie mensen in het huis toen de auto het huis raakte, maar geen van hen raakte gewond.",BeetleLM/beetlelm_nld_L1-eng_L2_balanced,step-30000,nld,5.938863277435303,379.5032943018533
282,De bestuurder liep echter wel ernstige verwondingen aan het hoofd op.,BeetleLM/beetlelm_nld_L1-eng_L2_balanced,step-30000,nld,6.9818315505981445,1076.8889384235686
283,De weg waar het ongeluk plaatsvond werd tijdelijk gesloten terwijl de hulpdiensten probeerden de chauffeur uit de rode Audi TT te bevrijden.,BeetleLM/beetlelm_nld_L1-eng_L2_balanced,step-30000,nld,6.908750057220459,1000.9952731943039
284,"Aanvankelijk werd hij opgenomen in Great Yarmouth, in het James Paget Hospital.",BeetleLM/beetlelm_nld_L1-eng_L2_balanced,step-30000,nld,5.407341480255127,223.03784827278838
285,Hij werd vervolgens overgeplaatst naar het Addenbrooke's Hospital in Cambridge.,BeetleLM/beetlelm_nld_L1-eng_L2_balanced,step-30000,nld,5.845094680786133,345.53525578201675
286,Adekoya is sindsdien in de Edinburgh Sheriff Court veroordeeld voor het vermoorden van haar zoon.,BeetleLM/beetlelm_nld_L1-eng_L2_balanced,step-30000,nld,6.614416122436523,745.769165306586
287,"Ze zit in hechtenis in afwachting van de aanklacht en het proces, maar het ooggetuigenverslag is mogelijk bedoezeld omdat haar verhaal veelvuldig is gepubliceerd.",BeetleLM/beetlelm_nld_L1-eng_L2_balanced,step-30000,nld,6.460118293762207,639.1366579777138
288,"Dit is gangbare praktijk in de rest van het VK, maar justitie in Schotland werkt anders en rechtbanken hebben de publicatie van foto's als mogelijk nadelig bestempeld.",BeetleLM/beetlelm_nld_L1-eng_L2_balanced,step-30000,nld,5.458944797515869,234.84947981789296
289,Professor Pamela Ferguson van de Universiteit van Dundee merkt op dat 'journalisten een gevaarlijk spelletje spelen als ze foto's e.d. van verdachten publiceren.',BeetleLM/beetlelm_nld_L1-eng_L2_balanced,step-30000,nld,5.414612770080566,224.6655316167715
290,"Crown Office heeft de algehele leiding over vervolgingen en heeft aan journalisten aangegeven dat er geen verdere uitspraken worden gedaan, in ieder geval totdat aanklachten zijn gedaan.",BeetleLM/beetlelm_nld_L1-eng_L2_balanced,step-30000,nld,5.558648586273193,259.47194532826285
291,"Volgens bronnen verwijst het document naar een geschillenregeling, iets wat de Palestijnen graag wilden op grond van de grenzen voor de oorlog in het Midden-Oosten in 1967.",BeetleLM/beetlelm_nld_L1-eng_L2_balanced,step-30000,nld,4.966595649719238,143.53740305723542
292,"Andere onderwerpen die besproken waren zijn de toekomstige status van Jeruzalem, een stad die voor beide volken heilig is, en de problemen in de Jordaanvallei.",BeetleLM/beetlelm_nld_L1-eng_L2_balanced,step-30000,nld,4.997350215911865,148.02041684600644
293,Israël eist dat er na ondertekening van een overeenkomst tien jaar lang een permanente militaire aanwezigheid is in de vallei. De PA is echter slechts bereid tot een aanwezigheid van vijf jaar.,BeetleLM/beetlelm_nld_L1-eng_L2_balanced,step-30000,nld,6.0944905281066895,443.4080836655998
294,Schutters in de aanvullende proef voor ongediertebestrijding moesten nauwlettend in de gaten worden gehouden door boswachters. De proef werd namelijk gevolgd en de effectiviteit ervan werd beoordeeld.,BeetleLM/beetlelm_nld_L1-eng_L2_balanced,step-30000,nld,5.64002799987793,281.47059950737264
295,"Bij een samenwerking tussen de NPWS en de Sporting Shooters Association of Australia (NSW) Inc, werden gekwalificeerde vrijwilligers gerekruteerd voor het jachtprogramma van de Sporting Shooters Association.",BeetleLM/beetlelm_nld_L1-eng_L2_balanced,step-30000,nld,5.293555736541748,199.04993771635347
296,"Volgens Mick O'Flynn, waarnemend directeur voor parkbehoud en erfgoed bij de NPWS, hebben de vier gekozen schutters voor de eerste schietoperatie een uitgebreide veiligheids- en trainingsinstructie gehad.",BeetleLM/beetlelm_nld_L1-eng_L2_balanced,step-30000,nld,6.1534423828125,470.333671798395
297,Gisteren zwoor Martelly een negenkoppige nieuwe voorlopige kiesraad (Provisional Electoral Council of CEP) in.,BeetleLM/beetlelm_nld_L1-eng_L2_balanced,step-30000,nld,6.958373069763184,1051.920762625993
298,"Hiermee heeft Martelly in de afgelopen vier jaar, vijf keer een CEP behaald.",BeetleLM/beetlelm_nld_L1-eng_L2_balanced,step-30000,nld,6.247824668884277,516.8871999995583
299,Afgelopen maand heeft de presidentiële commissie het ontslag van de eerdere Nationale Kiesraad aanbevolen. Dit is onderdeel van een maatregelenpakket zodat er nieuwe verkiezingen komen in het land.,BeetleLM/beetlelm_nld_L1-eng_L2_balanced,step-30000,nld,5.455466270446777,234.03396875615303
300,De commissie werd door Martelly ingesteld als reactie op de wijdverbreide protesten tegen de overheid die sinds oktober hebben plaatsgevonden.,BeetleLM/beetlelm_nld_L1-eng_L2_balanced,step-30000,nld,6.2934346199035645,541.0082995755438
301,"De soms gewelddadige protesten ontstonden door het uitblijven van verkiezingen, waarvan sommige al sinds 2011 hadden moeten plaatsvinden.",BeetleLM/beetlelm_nld_L1-eng_L2_balanced,step-30000,nld,5.912248611450195,369.5361651271172
302,Er zijn ongeveer 60 gevallen gerapporteerd van defecte iPods die oververhit raken. In totaal leidde dit tot zes branden en vier mensen met lichte brandwonden.,BeetleLM/beetlelm_nld_L1-eng_L2_balanced,step-30000,nld,6.937230587005615,1029.9140045455033
303,"Het Japanse ministerie van Economie, Handel en Industrie (METI) liet weten dat het bekend was met de 27 ongelukken die verband hielden met de apparaten.",BeetleLM/beetlelm_nld_L1-eng_L2_balanced,step-30000,nld,5.111459255218506,165.9122866808256
304,Vorige week kondigde METI aan dat Apple 34 aanvullende incidenten met oververhitting had gemeld die het bedrijf 'niet ernstig' noemde.,BeetleLM/beetlelm_nld_L1-eng_L2_balanced,step-30000,nld,7.068477630615234,1174.3588647238842
305,"'Erg betreurenswaardig', luidde de reactie van het ministerie over het feit dat Apple het rapport heeft uitgesteld.",BeetleLM/beetlelm_nld_L1-eng_L2_balanced,step-30000,nld,6.729867458343506,837.0363164216636
306,Mariana werd om 07.19 uur lokale tijd (vrijdag 21.19 GMT) getroffen door de aardbeving.,BeetleLM/beetlelm_nld_L1-eng_L2_balanced,step-30000,nld,5.7509260177612305,314.4817411697654
307,Het bureau voor calamiteitenbeheer van de Noordelĳke Marianen verklaarde dat er landelijk geen schade is gemeld.,BeetleLM/beetlelm_nld_L1-eng_L2_balanced,step-30000,nld,6.746571063995361,851.1352647930098
308,Daarnaast meldde het National Tsunami Warning Center dat er geen sprake was van een tsunami-waarschuwing.,BeetleLM/beetlelm_nld_L1-eng_L2_balanced,step-30000,nld,6.104283809661865,447.7718367273178
309,"In Manilla, de Filippijnse hoofdstad, heeft een voormalige politieman uit de Filippijnen toeristen uit Hongkong gegijzeld door hun bus te kapen.",BeetleLM/beetlelm_nld_L1-eng_L2_balanced,step-30000,nld,5.975797653198242,393.782077385788
310,Met zijn M16-geweer schoot Rolando Mendoza op de toeristen.,BeetleLM/beetlelm_nld_L1-eng_L2_balanced,step-30000,nld,7.472898960113525,1759.7006003319805
311,Verschillende gijzelaars zijn in veiligheid gebracht en vooralsnog zijn er minstens zes dodelijke slachtoffers bevestigd.,BeetleLM/beetlelm_nld_L1-eng_L2_balanced,step-30000,nld,6.346338748931885,570.4005018562787
312,"Zes gijzelaars werden eerder vrijgelaten, inclusief de kinderen en ouderen, en de Filipijnse fotografen.",BeetleLM/beetlelm_nld_L1-eng_L2_balanced,step-30000,nld,5.6813836097717285,293.3550381534623
313,Later keerden de fotografen terug in ruil voor een oudere vrouw die naar het toilet moest. Mendoza is uiteindelijk neergeschoten.,BeetleLM/beetlelm_nld_L1-eng_L2_balanced,step-30000,nld,5.629611968994141,278.55400906733416
314,Liggins ging in de geneeskunde werken en volgde hiermee het voorbeeld van zijn vader.,BeetleLM/beetlelm_nld_L1-eng_L2_balanced,step-30000,nld,6.196045398712158,490.80426304616134
315,Opgeleid als verloskundige ging hij in 1959 aan de slag in het National Women's Hospital in Auckland.,BeetleLM/beetlelm_nld_L1-eng_L2_balanced,step-30000,nld,4.6129045486450195,100.77643501011838
316,"Toen hij werkzaam was in het ziekenhuis, deed Liggins in zijn vrije tijd onderzoek naar vroeggeboorte.",BeetleLM/beetlelm_nld_L1-eng_L2_balanced,step-30000,nld,4.99412202835083,147.5433496231031
317,Zijn onderzoek toonde aan dat de rijping van de foetale longen van baby's werd versneld door het toedienen van een hormoon.,BeetleLM/beetlelm_nld_L1-eng_L2_balanced,step-30000,nld,5.993264675140381,400.7206996942042
318,Xinhua heeft gemeld dat onderzoekers van de overheid woensdag twee 'zwarte dozen' met vluchtrecorders terug hebben gevonden.,BeetleLM/beetlelm_nld_L1-eng_L2_balanced,step-30000,nld,7.003760814666748,1100.7651574658557
