sentence_id,sentence,repo,revision,iso_code,nll,ppl
251,طبق گزارشات حدود 9400 خانه در منطقه از آب محروم هستند و تقریباً 100 خانه برق ندارند.,BeetleLM/beetlelm_zho-fas_late,step-15000,fas,15.068615913391113,3501198.5594339836
252,برخی از جاده‌ها آسیب دیده‌اند، سرویس راه‌آهن در مناطق آسیب دیده متوقف شده و فرودگاه نوتو در ایشیکاوا همچنان تعطیل است.,BeetleLM/beetlelm_zho-fas_late,step-15000,fas,15.269400596618652,4279730.492865328
253,یک بمب در بیرون دفتر فرماندار کل منفجر شد.,BeetleLM/beetlelm_zho-fas_late,step-15000,fas,15.557500839233398,5708694.030273901
254,سه بمب دیگر در یک بازه دو ساعته نزدیک ساختمان‌های دولت منفجر شد.,BeetleLM/beetlelm_zho-fas_late,step-15000,fas,15.443456649780273,5093402.5865624165
255,برخی گزارش‌های رسمی تعداد کشته شدگان را هشت نفر اعلام می‌کنند و گزارش‌های رسمی زخمی شدن 30 تن را تایید می‌کند؛ اما اعداد نهایی هنوز مشخص نیست.,BeetleLM/beetlelm_zho-fas_late,step-15000,fas,15.301122665405273,4417668.673218005
256,اسید سیانوریک و نیز ملامین در نمونه‌های ادرار حیوانات خانگی که پس از مصرف غذای آلوده مخصوص حیوانات مردند، یافت شد.,BeetleLM/beetlelm_zho-fas_late,step-15000,fas,15.742851257324219,6871213.301900702
257,محققان دانشگاه گفتند که این دو ترکیب در واکنش با یکدیگر مواد کریستالی تشکیل می‌دهد و می‌تواند عملکرد کلیه را مسدود کند.,BeetleLM/beetlelm_zho-fas_late,step-15000,fas,15.523773193359375,5519363.99522815
258,پژوهشگران با افزودن ملامین و اسید سیانوریک در ادرار گربه، تشکیل کریستال‌ها را مشاهده کردند.,BeetleLM/beetlelm_zho-fas_late,step-15000,fas,15.697016716003418,6563382.913309584
259,نتیجه سنجش طیف سنجی مادون قرمز (طیف‌سنجی تبدیل فوریه فروسرخ) مشخص کرد ترکیب این بلورها با مواردی که در ادرار حیوانات خانگی مبتلا دیده می‌شود مطابقت دارد.,BeetleLM/beetlelm_zho-fas_late,step-15000,fas,14.682938575744629,2380779.649303128
260,نمی‌دانم متوجه شده‌اید یا نه، اما بسیاری از کالاها از آمریکای مرکزی بدون پرداخت عوارض وارد این کشور می‌شوند.,BeetleLM/beetlelm_zho-fas_late,step-15000,fas,15.816983222961426,7399945.719623083
261,همچنان در کشورهای آمریکای مرکزی روی هشتاد درصد کالاهای ما از طریق وضع تعرفه، مالیات گرفته می‌شد. ما با شما رفتار می‌کنیم.,BeetleLM/beetlelm_zho-fas_late,step-15000,fas,15.162629127502441,3846326.6253097956
262,برایم معنی نداشت؛ مسلماً عادلانه نبود.,BeetleLM/beetlelm_zho-fas_late,step-15000,fas,14.322244644165039,1659861.3689506873
263,کل حرف من به مردم این است که شما طوری با ما رفتار می‌کنید که ما با شما رفتار می‌کنیم.,BeetleLM/beetlelm_zho-fas_late,step-15000,fas,15.45016098022461,5127665.166080007
264,حکمران کالیفرنیا، آرنولد شوارتزنگر، لایحه‌ای به قانون افزود که فروش و اجاره بازی‌های ویدیویی خشن به افراد کم سن و سال ممنوع شود.,BeetleLM/beetlelm_zho-fas_late,step-15000,fas,15.419391632080078,4972292.861748373
265,این لایحه بازی های ویدئویی خشونت آمیز که در ایالت کالیفرنیا فروخته می شود را ملزم به نصب برچسب «18» می‌کند و برای تخلف در فروش آنها به افراد زیر سن قانونی جریمه 1000 دلاری تعیین می‌کند.,BeetleLM/beetlelm_zho-fas_late,step-15000,fas,14.52784252166748,2038739.9872138945
266,مدیر دادرسی های عمومی، Kier Starmer QC، صبح امروز با صدور بیانیه ای پیگرد قانونی هوهن و پریس را اعلام کرد.,BeetleLM/beetlelm_zho-fas_late,step-15000,fas,12.37548828125,236922.48076892548
267,Huhne استعفا داده است و نماینده Ed Davey جایگزین او خواهد شد. انتظار می‌رود نماینده Norman Lamb سمت وزیر تجارت را از آن خود کند، که Davey از آن استعفا داده بود.,BeetleLM/beetlelm_zho-fas_late,step-15000,fas,10.285160064697266,29294.646491117794
268,قرار است Huhne و Pryce در 16 فوریه در دادگاه بدوی وست‌مینستر حاضر شوند.,BeetleLM/beetlelm_zho-fas_late,step-15000,fas,10.481566429138184,35652.21048602119
269,تلفات آن عبارت بود از نیکلاس آلدن، 25 ساله، و زاخاری کادبک، 21 ساله. کادبک راننده بود.,BeetleLM/beetlelm_zho-fas_late,step-15000,fas,14.381884574890137,1761866.955366926
270,ادگار وگیلا از ناحیه دست و فک زخمی شد، و از آن طرف کریستوفر اشنایدر نیاز به جراحی ترمیمی صورت پیدا کرد.,BeetleLM/beetlelm_zho-fas_late,step-15000,fas,14.93557357788086,3065047.3562354166
271,سلاح اوکا در حالی که سر مرد پنجم را نشانه رفته بود، عمل نکرد. اشنایدر درد مداوم داشت از ناحیه یک چشم کور بود، بخشی از جمجمه اش از دست رفته بود و چهره اش با تیتانیوم بازسازی شده بود.,BeetleLM/beetlelm_zho-fas_late,step-15000,fas,15.250466346740723,4199459.341447924
272,اشنایدر از طریق لینک ویدئویی از پایگاه نیروی هوایی ایالات متحده در کشورش شهادت داد.,BeetleLM/beetlelm_zho-fas_late,step-15000,fas,15.67805004119873,6440070.4740667725
273,پس از مسابقه چهارشنبه، کارپاندو در دو مسابقه انفرادی در مسابقات قهرمانی رقابت کرد.,BeetleLM/beetlelm_zho-fas_late,step-15000,fas,15.487442970275879,5322443.020420203
274,نخستین حضور او در اسکی مارپیچ کوچک بود، جایی‌که وی موفق نشد به خط پایان برسد. 36 نفر از 116 رقیب او در آن مسابقه نتیجه مشابهی بدست آوردند.,BeetleLM/beetlelm_zho-fas_late,step-15000,fas,14.548144340515137,2080553.1223135488
275,او در مسابقه دیگرش در Giant Slalom با مدت زمان ترکیبی 4:41.30 کار خود را در رتبه دهم در گروه نشسته بانوان پایان داد، که 2:11.60 دقیقه کندتر از کلودیا لوئیز اتریشی بود که مقام اول را از آن خود کرد و 1:09.02 دقیقه کندتر از مقام نهم که به Gyöngyi Dani از مجارستان رسید.,BeetleLM/beetlelm_zho-fas_late,step-15000,fas,11.628166198730469,112214.35428935091
276,چهار اسکی‌باز در گروه نشسته زنان نتوانستند مسیرشان را به اتمام برسانند و 45 نفر از کل 117 اسکی‌باز مارپیچ بزرگ نتوانستند در مسابقه رتبه کسب کنند.,BeetleLM/beetlelm_zho-fas_late,step-15000,fas,15.120220184326172,3686618.441458804
277,پلیس مادیا پرادش لپتاب و تلفن همراه دزده شده را باز پس گرفت.,BeetleLM/beetlelm_zho-fas_late,step-15000,fas,14.943869590759277,3090580.7950018733
278,معاون بازرس کل «د. ک. آریا» گفت: «ما پنج نفر را که به زن سوییسی تجاوز کرده بودند دستگیر کردیم و موبایل و لپتاپ او را پس گرفتیم.»,BeetleLM/beetlelm_zho-fas_late,step-15000,fas,13.315067291259766,606261.8644443168
279,نام متهمین بابا کانجار، رامپرو کانجار، گازا کانجار و ویشنو کانجار است.,BeetleLM/beetlelm_zho-fas_late,step-15000,fas,15.99305248260498,8824588.074687414
280,رئیس پلیس «Chandra Shekhar Solanki» گفت که متهمان در دادگاه با صورت‌های پوشیده حاضر شدند.,BeetleLM/beetlelm_zho-fas_late,step-15000,fas,9.37142276763916,11747.81761748271
281,اگرچه هنگام برخورد ماشین به خانه سه نفر در آنجا بودند، هیچ کدام صدمه ندیدند.,BeetleLM/beetlelm_zho-fas_late,step-15000,fas,15.64297866821289,6218123.108988444
282,با این حال، راننده دچار مصدومیت جدی از ناحیه سر شد.,BeetleLM/beetlelm_zho-fas_late,step-15000,fas,16.000648498535156,8891875.019096082
283,زمانیکه کارکنان خدمات اورژانس مشغول آزاد کردن راننده از آئودی TT قرمز بودند، جاده محل تصادف موقتاً بسته شد.,BeetleLM/beetlelm_zho-fas_late,step-15000,fas,14.796274185180664,2666491.670287971
284,او در ابتدا در بیمارستان جیمز پاژه در گریت یارموث بستری بود.,BeetleLM/beetlelm_zho-fas_late,step-15000,fas,15.495588302612305,5365973.1305981865
285,او سپس به بیمارستان ادن بروک کمبریج منتقل شد.,BeetleLM/beetlelm_zho-fas_late,step-15000,fas,15.581398963928223,5846764.351765341
286,«آدکویا» از آن زمان به اتهام قتل پسرش در «دادگاه کلانتری ادینبورگ» بوده است.,BeetleLM/beetlelm_zho-fas_late,step-15000,fas,14.440629005432129,1868467.2595412887
287,او در بازداشت است و منتظر کیفرخواست و محاکمه است، اما هر شاهد عینی ممکن است تحت تاثیر قرار گبرد زیرا تصویر وی به‌طور گسترده‌ای منتشر شده است.,BeetleLM/beetlelm_zho-fas_late,step-15000,fas,15.728984832763672,6776591.688870797
288,این اقدام در جاهای دیگر انگلستان معمول و رایج است ولی دادگاه اسکاتلند متفاوت عمل می‌کند و دادگاه‌ها انتشار عکس‌ها را بطور بالقوه مخرب دانسته‌اند.,BeetleLM/beetlelm_zho-fas_late,step-15000,fas,15.139115333557129,3756939.922297196
289,پروفسور Pamela Ferguson از دانشگاه Dundee می گوید: «به نظر می رسد که روزنامه نگاران در صورت انتشار عکس و غیره از مظنونان روی خط خطر قدم می‌گذارند.»,BeetleLM/beetlelm_zho-fas_late,step-15000,fas,11.617815017700195,111058.79421753022
290,دادگاه اسکاتلند، که در کل مسئول پیگیری این پرونده است، به روزنامه‌نگارها بیان داشته که حداقل تا زمان اعلام جرم هیچ توضیح بیشتری داده نخواهد شد.,BeetleLM/beetlelm_zho-fas_late,step-15000,fas,14.98469352722168,3219361.2466008393
291,این سند بر اساس این درز اطلاعاتی است و به اختلاف مرزی مربوط می‌شود، که در آن فلسطین خواستار مرزبندی طبق شرایط قبل از جنگ شش‌روزه 1967 است.,BeetleLM/beetlelm_zho-fas_late,step-15000,fas,14.593847274780273,2177846.8752237805
292,مباحث گزارش شده دیگر شامل وضعیت آتی بیت المقدس است که برای هر دو ملت مقدس است و همچنین مسئله جردن ولی.,BeetleLM/beetlelm_zho-fas_late,step-15000,fas,15.623649597167969,6099086.703325582
293,اسرائیل پس از امضای توافق‌نامه خواستار حضور نظامی مداوم در دره برای ده سال است، درحالیكه پارلمان موافق است چنین حضوری تنها برای پنج سال باشد.,BeetleLM/beetlelm_zho-fas_late,step-15000,fas,15.890787124633789,7966749.491751812
294,تیراندازان شرکت کننده در آزمایش کنترل آفات مکمل باید به دقت توسط جنگلبانان نظارت می‌شدند، زیرا این آزمایش تحت نظارت بود و میزان موثر بودن آن مورد ارزیابی قرار گرفت.,BeetleLM/beetlelm_zho-fas_late,step-15000,fas,15.920146942138672,8204119.319550506
295,با همکاری NPWS و انجمن تیراندازان ورزشکار استرالیا (NSW) با هم، افراد داوطلب واجد شرایط تحت برنامه شکار انجمن تیراندازان ورزشکار استخدام شدند.,BeetleLM/beetlelm_zho-fas_late,step-15000,fas,13.376572608947754,644720.7839473486
296,به گفته Mick O'Flynn، مدیر حفاظت از پارک و میراث با NPWS، چهار تیرانداز انتخاب شده برای اولین عملیات تیراندازی، دستورالعمل جامع ایمنی و آموزش را دریافت کردند.,BeetleLM/beetlelm_zho-fas_late,step-15000,fas,12.48198413848877,263546.2460746727
297,مارتلی دیروز در شورای موقت انتخاباتی (CEP) جدید که متشکل از نُه عضو بود سوگند یاد کرد.,BeetleLM/beetlelm_zho-fas_late,step-15000,fas,13.562732696533203,776640.384446859
298,این پنجمین CEP مارتلی در چهار سال گذشته است.,BeetleLM/beetlelm_zho-fas_late,step-15000,fas,12.903242111206055,401612.15414462815
299,ماه گذشته یک کمیسیون ریاست جمهوری کناره‌گیری شورای انتخاباتی موقت قبلی را به عنوان بخشی از بسته اقدامات برای حرکت کشور به سمت انتخابات جدید توصیه کرد.,BeetleLM/beetlelm_zho-fas_late,step-15000,fas,15.683805465698242,6477242.681758774
300,این کمیسیون پاسخ مارتلی بود به اعتراضات گسترده ضدحکومتی که در ماه اکتبر آغاز شد.,BeetleLM/beetlelm_zho-fas_late,step-15000,fas,15.322647094726562,4513787.2076841155
301,اعتراضات گاه خشونت آمیز ناشی از عدم برگزاری انتخابات که قرار بود در سال 2011 برگزار شود، بود.,BeetleLM/beetlelm_zho-fas_late,step-15000,fas,14.958409309387207,3135845.238878288
302,حدود 60 مورد گرمای بیش از حد آیپاد‌ها گزارش شده است که در مجموع منجر به ایجاد شش آتش سوزی و مصدومیت جزئی چهار نفر شده است.,BeetleLM/beetlelm_zho-fas_late,step-15000,fas,14.721741676330566,2474977.037911973
303,وزارت اقتصاد، تجارت و صنعت ژاپن (METI) گفت که از 27 مورد حادثه مربوط به این دستگاه‌ها اطلاع داشته است.,BeetleLM/beetlelm_zho-fas_late,step-15000,fas,12.174906730651855,193862.94719945753
304,هفته گذشته، METI اعلام کرد که اپل آنها را از 34 رویداد گرم‌شدن بیش‌ازحد، که این شرکت آن را «غیر جدی» نامیده، مطلع کرده است.,BeetleLM/beetlelm_zho-fas_late,step-15000,fas,13.734267234802246,921969.3276571636
305,وزارت در یک واکنش تأخیر اپل در گزارش‌دهی را «واقعاً تأسف برانگیز» خواند.,BeetleLM/beetlelm_zho-fas_late,step-15000,fas,15.080636978149414,3543540.682862808
306,این زمین‌لرزه در ساعت 07:19 دقیقه صبح به وقت محلی (جمعه 09:19 بعدازظهر به وقت گرینویچ) ماریانا را لرزاند.,BeetleLM/beetlelm_zho-fas_late,step-15000,fas,12.770000457763672,351512.46705816814
307,اداره مدیریت اورژانسی جزایر ماریانای شمالی گفت که هیچ خسارتی در این کشور گزارش نشده است.,BeetleLM/beetlelm_zho-fas_late,step-15000,fas,15.358169555664062,4677009.910367895
308,همچنین مرکز هشدار سونامی اقیانوس آرام گفت هیچ نشانی از سونامی وجود نداشت.,BeetleLM/beetlelm_zho-fas_late,step-15000,fas,15.182387351989746,3923078.958223361
309,یک پلیس سابق فیلیپینی با ربودن یک اتوبوس در مانیل، پایتخت فیلیپین، گردشگران هنگ کنگی را به گروگان گرفته است.,BeetleLM/beetlelm_zho-fas_late,step-15000,fas,15.47771167755127,5270899.966403338
310,رونالدو مندوزا با اسلحه M16 خود به گردشگران شلیک کرد.,BeetleLM/beetlelm_zho-fas_late,step-15000,fas,14.576128005981445,2139596.9025936415
311,چندین تن از گروگان‌ها نجات یافته‌اند و تاکنون مرگ حداقل شش نفر تایید شده است.,BeetleLM/beetlelm_zho-fas_late,step-15000,fas,15.248969078063965,4193176.3273705216
312,شش گروگان شامل كودكان و سالمندان، همینطور عكاسان فیلیپینی، در ابتدا آزاد شدند.,BeetleLM/beetlelm_zho-fas_late,step-15000,fas,14.586602210998535,2162125.2565411422
313,عکاس‌ها سپس جای یک زن سالخورده که نیاز به دستشویی داشت را گرفتند. مندوزا با گلوله از پای درآورده شد.,BeetleLM/beetlelm_zho-fas_late,step-15000,fas,14.77974796295166,2622786.769528748
314,لیگینز قدم به قدم از پدرش پیروی کرد و وارد حرفه پزشکی شد.,BeetleLM/beetlelm_zho-fas_late,step-15000,fas,14.875467300415039,2886246.1346332515
315,او به عنوان پزشک زنان آموزش دید و کار خود را در بیمارستان ملی اوکلند در سال 1959 شروع کرد.,BeetleLM/beetlelm_zho-fas_late,step-15000,fas,14.76850414276123,2593461.7979942993
316,درحالیکه او در بیمارستان کار می‌کرد، لیگینز در اوقات فراغتش روی زایمان زودرس تحقیقاتش را آغاز کرد.,BeetleLM/beetlelm_zho-fas_late,step-15000,fas,15.796085357666016,7246907.3083798895
317,تحقیقات او نشان داد که اگر هورمونی تجویز شود، بلوغ ریه جنینی کودک را تسریع می‌کند.,BeetleLM/beetlelm_zho-fas_late,step-15000,fas,14.796706199645996,2667643.8821293935
318,«شین هوا» گزارش داد که بازرسان دولت روز چهارشنبه دو گزارش پرواز از «جعبه سیاه» را بازیابی کردند.,BeetleLM/beetlelm_zho-fas_late,step-15000,fas,13.80362606048584,988185.8442273572
319,کشتی گیران همکار نیز به لونا ادای احترام کردند.,BeetleLM/beetlelm_zho-fas_late,step-15000,fas,15.661999702453613,6337530.265260056
320,تامی‌ دریمر گفت: «لونا اولین ملکه Extreme بود. اولین مدیر من. لونا در شبی که دو ماه داشت درگذشت. بسیار زیبا و بی‌مانند بود. یک زن قوی.»,BeetleLM/beetlelm_zho-fas_late,step-15000,fas,12.049235343933105,170968.62582319698
321,داستین «گلدوست» رونلز اظهار داشت: «لونا به اندازه من دمدمی‌مزاج بود... شاید هم بیشتر از من... او را دوست داشتم اما ترکش کردم... امیدوارم که او در وضعیت بهتری باشد.»,BeetleLM/beetlelm_zho-fas_late,step-15000,fas,13.524453163146973,747472.7757235176
322,"از بین 1,400 نفری که قبل از انتخابات فدرال 2010 از آنها نظرسنجی شد، تعداد کسانی که مخالف جمهوری شدن استرالیا بودند 8 درصد از سال 2008 افزایش داشت.",BeetleLM/beetlelm_zho-fas_late,step-15000,fas,13.53921127319336,758585.8635876598
323,جولیا گیلارد، نخست وزیر دولت موقت، در خلال کمپین انتخابات فدرال 2010 مدعی شد که معتقد است پس از خاتمه حکمرانی ملکه الیزابت دوم، استرالیا باید جمهوری شود.,BeetleLM/beetlelm_zho-fas_late,step-15000,fas,15.244648933410645,4175100.272778456
324,34 درصد آنهایی که در نظرسنجی شرکت دارند می‌خواهند که ملکه الیزابت دوم آخرین فرمانروای استرالیا باشد.,BeetleLM/beetlelm_zho-fas_late,step-15000,fas,14.547588348388672,2079396.6726770876
325,در انتهای نظرسنجی، 29 درصد افراد نظرسنجی شده معتقد بودند که استرالیا باید در اسرع وقت جمهوری شود، در حالی که 31 درصد معتقد بودند استرالیا هرگز نباید جمهوری شود.,BeetleLM/beetlelm_zho-fas_late,step-15000,fas,15.184243202209473,3930366.365246352
326,برنده مدال طلای المپیک در شنای 100 متر و 200 متر آزاد و شنای سه‌گانه در بازی‌های کشورهای مشترک‌المنافع بود، اما به دلیل شکایت وی، در خصوص آمادگی جسمانی او در این مسابقات تردید وجود داشته‌ است.,BeetleLM/beetlelm_zho-fas_late,step-15000,fas,15.036209106445312,3389554.6750830794
327,او نتوانسته است داروهای مورد نیاز برای غلبه بر درد خود را دریافت کند چون این دارو‌ها ممنوع هستند.,BeetleLM/beetlelm_zho-fas_late,step-15000,fas,15.475631713867188,5259948.0796025805
328,کورتیس کوپر، یک ریاضیدان و استاد علوم رایانه‌ای در دانشگاه میسوری مرکزی است، بزرگترین عدد اول شناخته شده را در مورخ 25 ژانویه کشف کرد.,BeetleLM/beetlelm_zho-fas_late,step-15000,fas,15.54439926147461,5634388.951297662
329,چند نفر از مردم این کشف را با استفاده از سخت‌افزار و نرم‌افزار مختلف در ابتدای فوریه تأیید کردند و در سه‌شنبه اعلام شد.,BeetleLM/beetlelm_zho-fas_late,step-15000,fas,14.933255195617676,3057949.63560284
330,احتمال دارد که دنباله‌دارها منبع تامین آب و مواد‌آلی کره زمین باشند که می‌توانند تشکیل‌دهنده پروتئین‌ها و زندگی باشند.,BeetleLM/beetlelm_zho-fas_late,step-15000,fas,15.187663078308105,3943830.7413639883
331,دانشمندان امیدوارند که به چگونگی تشکیل سیارات پی ببرند، بویژه اینکه پس از برخورد ستاره‌های دنباله‌دار در زمان‌های دور، زمین چگونه شکل گرفته است.,BeetleLM/beetlelm_zho-fas_late,step-15000,fas,15.823700904846191,7449823.545043567
332,کوئومو، 53 ساله، فرمانداری خودش را در اوایل امسال شروع کرد و اواخر این ماه لایحه‌ای در قانونی کردن ازدواج همجنس‌بازان تصویب کرد.,BeetleLM/beetlelm_zho-fas_late,step-15000,fas,15.424503326416016,4997774.775397621
333,او این شایعات را «حماقت و حرف مفت سیاسی» خواند.,BeetleLM/beetlelm_zho-fas_late,step-15000,fas,14.579926490783691,2147739.584046405
334,پیش‌بینی می‌شود که او در 2016 برای ریاست جمهوری کاندید شود.,BeetleLM/beetlelm_zho-fas_late,step-15000,fas,14.66627311706543,2341431.6513474504
335,اداره هوانوردی فدرال (FAA) مدعی است که سیستم NextGen هواپیما را قادر می‌سازد تا در مسیرهای کوتاه‌تر پرواز کرده و هر ساله در میلیون‌ها گالن سوخت صرفه‌جویی کند و آلاینده‌های کربنی را کاهش دهد.,BeetleLM/beetlelm_zho-fas_late,step-15000,fas,13.24482250213623,565136.459460595
336,از فناوری مبتنی بر ماهواره در مقابل فناوری مبتنی بر رادار زمینی استفاده می‌کند که به کنترل کننده‌های ترافیک هوایی امکان می‌دهد هواپیما را با دقت بیشتری ردیابی کند و به خلبانان اطلاعات دقیق‌تری می‌دهد.,BeetleLM/beetlelm_zho-fas_late,step-15000,fas,15.3856782913208,4807454.496630414
337,هیچ وسیله نقلیه‌ای اضافی اجازه ورود ندارد و قطارهای سطحی در ومبلی توقف نخواهند داشت و تأسیسات پارک و سواری برای زمین بازی فراهم نمی‌باشد.,BeetleLM/beetlelm_zho-fas_late,step-15000,fas,15.282317161560059,4335368.461888001
338,ترس از کمبود حمل‌ونقل این احتمال را افزایش داد که ممکن است مجبور باشند تا بازی را در پشت درهای بسته و بدون حامیان تیم انجام دهند.,BeetleLM/beetlelm_zho-fas_late,step-15000,fas,15.469881057739258,5229786.733829682
339,تحقیقی که روز پنجشنبه در مجله Science منتشر شد، از تشکیل گونه جدیدی از پرندگان در جزایر گالاپاگوس اکوادور خبر داد.,BeetleLM/beetlelm_zho-fas_late,step-15000,fas,14.47272777557373,1929415.712818089
