sentence_id,sentence,repo,revision,iso_code,nll,ppl
215,"Na zijn vertrek uit de serie in 1993, bleef hij op papier uitvoerend producent, waardoor hij voor elke reeks royalty's ontving, ter waarde van enkele tientallen miljoenen dollars.",BeetleLM/beetlelm_nld-ind_balanced,step-2444,nld,7.963952541351318,2875.4157208980464
216,Het Chinese persbureau Xinhua meldde eerder nog dat een vliegtuig was gekaapt.,BeetleLM/beetlelm_nld-ind_balanced,step-2444,nld,8.302309036254883,4033.174396262189
217,"Uit latere rapporten blijkt daarnaast dat er een bommelding werd gedaan in het vliegtuig, waardoor het werd teruggeleid naar Afghanistan en landde in Kandahar.",BeetleLM/beetlelm_nld-ind_balanced,step-2444,nld,7.960103511810303,2864.369433226977
218,"Uit eerste berichten blijkt dat het vliegtuig terug is geleid naar Afghanistan, nadat het niet was toegestaan een noodlanding te maken in Ürümqi.",BeetleLM/beetlelm_nld-ind_balanced,step-2444,nld,7.811053276062012,2467.7282660391047
219,Vliegtuigongelukken komen vaak voor in Iran. Ze beschikken voor zowel burgerlijke als militaire operaties over een verouderde vloot die slecht is onderhouden.,BeetleLM/beetlelm_nld-ind_balanced,step-2444,nld,8.42919921875,4578.831981682053
220,Door internationale sancties kunnen er geen nieuwe vliegtuigen aangeschaft worden.,BeetleLM/beetlelm_nld-ind_balanced,step-2444,nld,8.57375717163086,5290.97158066944
221,Eerder deze week heeft een ongeluk met een politiehelikopter aan drie mensen het leven gekost en nog eens drie personen raakten gewond.,BeetleLM/beetlelm_nld-ind_balanced,step-2444,nld,7.764703273773193,2355.9593098794235
222,Afgelopen maand vond in Iran de ergste vliegtuigramp in jaren plaats toen een vliegtuig dat onderweg was naar Armenië neerstortte. De 168 inzittenden overleefden het niet.,BeetleLM/beetlelm_nld-ind_balanced,step-2444,nld,7.819500923156738,2488.663063951768
223,In dezelfde maand schoot nog een passagiersvliegtuig van een landingsbaan op Mashhad. Dit crashte tegen een muur en hierbij kwamen zeventien mensen om het leven.,BeetleLM/beetlelm_nld-ind_balanced,step-2444,nld,7.535974979400635,1874.2708436828818
224,Aerosmith heeft de resterende concerten van hun tournee afgelast.,BeetleLM/beetlelm_nld-ind_balanced,step-2444,nld,8.024333000183105,3054.383345048587
225,De toer van de rockband zou tot zestien september door de VS en Canada trekken.,BeetleLM/beetlelm_nld-ind_balanced,step-2444,nld,7.695685863494873,2198.8413983151113
226,Ze annuleerden de toer nadat zanger Steven Tyler gewond raakte toen hij van het podium viel tijdens een optreden op 5 augustus.,BeetleLM/beetlelm_nld-ind_balanced,step-2444,nld,8.595697402954102,5408.33955319023
227,"Murray verloor de eerste set in een tiebreak, nadat beide mannen in de hele set geen enkel punt weggaven als zij serveerden.",BeetleLM/beetlelm_nld-ind_balanced,step-2444,nld,8.004053115844727,2993.0646734188676
228,"Del Potro had een vroege voorsprong in de tweede set, maar ook hier volgde een tiebreak nadat het 6-6 werd.",BeetleLM/beetlelm_nld-ind_balanced,step-2444,nld,7.85374641418457,2575.36464861505
229,"Potro werd toen behandeld aan zijn schouder, maar slaagde erin de wedstrijd te vervolgen.",BeetleLM/beetlelm_nld-ind_balanced,step-2444,nld,7.923314571380615,2760.907120004998
230,De plaatselijke starttijd van het programma was 20.30 uur (15.00 UTC).,BeetleLM/beetlelm_nld-ind_balanced,step-2444,nld,7.647285461425781,2094.9510384728333
231,Bekende zangers uit het hele land zongen bhajans of religieuze liederen aan de voeten van Shri Shyam.,BeetleLM/beetlelm_nld-ind_balanced,step-2444,nld,8.364267349243164,4290.966806032175
232,"De avond ving aan met de zanger Sanju Sharma, gevolgd door Jai Shankar Choudhary. Lakka Singh heeft ook de Chhappan bhog bhajan gepresenteerd. De zanger Raju Khandelwal hielp hem hierbij.",BeetleLM/beetlelm_nld-ind_balanced,step-2444,nld,8.561902046203613,5228.616791171432
233,Daarna zong Lakkha Singh de bhajans.,BeetleLM/beetlelm_nld-ind_balanced,step-2444,nld,8.63486385345459,5624.367933913017
234,"Aan Baba Shyam werden 108 borden met Chhappan Bhog geserveerd (in het hindoeïsme zijn dit 56 verschillende eetbare artikelen, zoals, snoepjes, fruit, noten, gerechten, etc. die aan het heilige figuur worden aangeboden).",BeetleLM/beetlelm_nld-ind_balanced,step-2444,nld,8.339154243469238,4184.549134672026
235,Lakkha Singh heeft ook de Chhappan bhog bhajan gepresenteerd. De zanger Raju Khandelwal hielp hem hierbij.,BeetleLM/beetlelm_nld-ind_balanced,step-2444,nld,8.885870933532715,7229.108005915678
236,"Donderdag onthulde Satoru Iwata, de directeur van Nintendo, tijdens de keynotepresentatie van de Tokyo Game Show het ontwerp van de controller voor de nieuwe Nintendo Revolution.",BeetleLM/beetlelm_nld-ind_balanced,step-2444,nld,7.995039463043213,2966.207450318754
237,Net als bij een tv-afstandsbediening maakt de controller gebruik van twee sensoren vlak bij de televisie van de gebruiken om de positie in een driedimensionale ruimte te kunnen bepalen.,BeetleLM/beetlelm_nld-ind_balanced,step-2444,nld,7.424849510192871,1677.147160472375
238,Hiermee besturen spelers acties en bewegingen in videogames door het apparaat door de lucht te bewegen.,BeetleLM/beetlelm_nld-ind_balanced,step-2444,nld,7.970852851867676,2895.325595394568
239,Kort na de start verloor Giancarlo Fisichella de controle over zijn auto en lag hij hiermee uit de race.,BeetleLM/beetlelm_nld-ind_balanced,step-2444,nld,7.929459095001221,2777.9238051912484
240,"Zijn teamgenoot Fernando Alonso lag het grootste deel van de race aan kop, maar verloor deze positie direct na zijn pitstop, waarschijnlijk vanwege een slecht geplaatst rechtervoorwiel.",BeetleLM/beetlelm_nld-ind_balanced,step-2444,nld,8.460042953491211,4722.260830867185
241,Michael Schumacher eindigde zijn race niet lang na Alonso door de schade aan de wielophanging vanwege de vele duels tijdens de race.,BeetleLM/beetlelm_nld-ind_balanced,step-2444,nld,7.951218605041504,2839.0325026721184
242,In een transcriptie van de nieuwsconferentie zei hij dat 'ze een schattig meisje was met een aardige stem'.,BeetleLM/beetlelm_nld-ind_balanced,step-2444,nld,7.754311561584473,2331.6036266039528
243,"Ik was elke keer ontroerd als we dit repeteerden, uit de grond van mijn hart.",BeetleLM/beetlelm_nld-ind_balanced,step-2444,nld,7.654486656188965,2110.091638696686
244,Op een interne camera was circa 3 minuten na de lancering te zien dat veel stukken isolatieschuim losraakten van de brandstoftank.,BeetleLM/beetlelm_nld-ind_balanced,step-2444,nld,8.074490547180176,3211.4908487870366
245,Vermoedelijk hebben deze echter geen schade aangericht aan de shuttle.,BeetleLM/beetlelm_nld-ind_balanced,step-2444,nld,8.283736228942871,3958.95835881065
246,"De directeur van het Shuttle Programma van NASA, N. Wayne Hale Jr. zei dat het schuim gevallen was 'na de periode waar we zorgen over hadden.'",BeetleLM/beetlelm_nld-ind_balanced,step-2444,nld,7.673315048217773,2150.197652341203
247,"Na vijf minuten begint de wind, en een minuut later bereikt de wind al zo'n 70 km/u... dan begint het te regenen, maar zo hard en zo veel dat aanvoelt als speldenprikjes op je huid. Vervolgens valt er hagel. Mensen raken in paniek, beginnen te schreeuwen en rennen over elkaar heen.",BeetleLM/beetlelm_nld-ind_balanced,step-2444,nld,7.516345024108887,1837.8377507148934
248,"'Ik raakte mijn zus en haar vriend kwijt. Toen ik er probeerde te komen, sprongen mensen zo over twee rolstoelgebruikers heen en duwden hen weg,' aldus Armand Versace.",BeetleLM/beetlelm_nld-ind_balanced,step-2444,nld,8.043436050415039,3113.2922620758536
249,Daarnaast meldde de NHK dat de kerncentrale van Kashiwazaki Kariwa in de prefectuur Niigata zoals normaal werkte.,BeetleLM/beetlelm_nld-ind_balanced,step-2444,nld,8.283171653747559,3956.723859952658
250,Hokuriku Electric Power Co. rapporteert dat de aardbeving geen problemen heeft veroorzaakt en dat in de kernenergiecentrale van Shika reactoren 1 en 2 zijn stopgezet.,BeetleLM/beetlelm_nld-ind_balanced,step-2444,nld,8.207046508789062,3666.6969009390878
251,Volgens meldingen zitten er 9400 huishouden in de regio zonder water en ongeveer 100 zonder stroom.,BeetleLM/beetlelm_nld-ind_balanced,step-2444,nld,7.789737701416016,2415.6838686294786
252,"Enkele wegen zijn aangetast, de spoorwegdienst is gestaakt in de getroffen gebieden en de prefectuur van het vliegveld Noto in Ishikawa blijft voor langere tijd gesloten.",BeetleLM/beetlelm_nld-ind_balanced,step-2444,nld,8.030576705932617,3073.513675831623
253,Eén bom is ontploft buiten het kantoor waar de gouverneur-generaal werkt.,BeetleLM/beetlelm_nld-ind_balanced,step-2444,nld,8.561213493347168,5225.017851316961
254,Binnen een periode van twee uur kwamen er nog drie bommen tot ontploffing in de buurt van overheidsgebouwen.,BeetleLM/beetlelm_nld-ind_balanced,step-2444,nld,7.388345718383789,1617.0288779482673
255,"In sommige rapporten wordt het officiële dodental op acht geschat. Officiële rapporten bevestigen maximaal 30 gewonden, maar de definitieve aantallen zijn er nog niet.",BeetleLM/beetlelm_nld-ind_balanced,step-2444,nld,8.280290603637695,3945.3407457761637
256,"In urinemonsters van huisdieren die zijn gestorven na het eten van besmette dierenvoeding, werd zowel cyaanuurzuur als melamine aangetroffen.",BeetleLM/beetlelm_nld-ind_balanced,step-2444,nld,8.316426277160645,4090.5154875086096
257,Onderzoekers van de universiteit stelden dat de twee verbindingen met elkaar reageren waardoor zich kristallen vormen die de nierfunctie kunnen blokkeren.,BeetleLM/beetlelm_nld-ind_balanced,step-2444,nld,8.113975524902344,3340.83322994721
258,Wetenschappers kwamen erachter dat er kristallen gevormd worden in kattenurine wanneer je hier melanine en cyanuurzuur aan toevoegt.,BeetleLM/beetlelm_nld-ind_balanced,step-2444,nld,8.613761901855469,5506.926276043068
259,"De samenstelling van deze kristallen heeft gelijkenissen met die van de urine van de getroffen huisdieren, vergeleken met de infraroodspectroscopie (FTIR).",BeetleLM/beetlelm_nld-ind_balanced,step-2444,nld,7.534929275512695,1872.3119357719054
260,"Ik weet niet of je je dit realiseert, maar de meeste goederen uit Midden-Amerika kwamen dit land binnen zonder dat er belasting over hoefde te worden betaald.",BeetleLM/beetlelm_nld-ind_balanced,step-2444,nld,7.655066013336182,2111.314489568339
261,En toch werd tachtig procent van onze goederen belast aan de hand van tarieven uit landen in Midden-Amerika.,BeetleLM/beetlelm_nld-ind_balanced,step-2444,nld,7.9461774826049805,2824.756605729735
262,Dat vond ik erg raar; het was ongetwijfeld oneerlijk.,BeetleLM/beetlelm_nld-ind_balanced,step-2444,nld,8.447772979736328,4664.6728384846665
263,Wat ik maar wil zeggen is dat jullie ons behandelen zoals wij jullie behandelen.,BeetleLM/beetlelm_nld-ind_balanced,step-2444,nld,8.104925155639648,3310.733866200258
264,"Arnold Schwarzenegger, de gouverneur van Californië, heeft een wetsvoorstel ondertekend waarmee het verboden wordt om gewelddadige videogames aan minderjarigen te verkopen of te verhuren.",BeetleLM/beetlelm_nld-ind_balanced,step-2444,nld,8.498931884765625,4909.522103386013
265,"Onder deze wet moeten gewelddadige videogames die in de staat Californië worden verkocht, een '18'-sticker hebben. Verkoop aan een minderjarige wordt bestraft met een boete van $ 1000 per overtreding.",BeetleLM/beetlelm_nld-ind_balanced,step-2444,nld,8.162310600280762,3506.2788600967283
266,"Kier Starmer QC, directeur van het Openbaar Ministerie, heeft vanochtend verklaard dat hij zowel Pryce en Huhne wil vervolgen.",BeetleLM/beetlelm_nld-ind_balanced,step-2444,nld,8.324304580688477,4122.869088506403
267,"Huhne heeft ontslag genomen. In het kabinet is parlementslid Ed Davey zijn vervanger, terwijl parlementslid Norman Lamb naar verwachting Daveys taken als minister van Handel overneemt.",BeetleLM/beetlelm_nld-ind_balanced,step-2444,nld,8.511021614074707,4969.237138623664
268,Naar verwachting worden Huhne en Pryce op 16 februari voorgeleid voor de Westminster Magistrates Court.,BeetleLM/beetlelm_nld-ind_balanced,step-2444,nld,8.442431449890137,4639.822777052604
269,"De slachtoffers waren Nicholas Alden, 25, en Zachary Cuddeback, 21. Cuddeback was de bestuurder van het voertuig.",BeetleLM/beetlelm_nld-ind_balanced,step-2444,nld,7.6002302169799805,1998.655966684611
270,"Edgar Veguilla raakte gewond aan zijn arm en kaak, en Kristoffer Schneider moest een reconstructieve gezichtsoperatie ondergaan.",BeetleLM/beetlelm_nld-ind_balanced,step-2444,nld,8.604512214660645,5456.22378317858
271,"Het wapen van Uka faalde terwijl hij het op het hoofd van een vijfde man gericht hield. Schneider heeft chronische pijn, is blind in één oog, mist een stuk schedel en zijn gezicht is met titanium gereconstrueerd.",BeetleLM/beetlelm_nld-ind_balanced,step-2444,nld,7.618179798126221,2034.8549101802796
272,Schneider legde via videolink vanuit een USAF-basis in het land waaruit hij afkomstig was zijn verklaring af.,BeetleLM/beetlelm_nld-ind_balanced,step-2444,nld,8.247465133666992,3817.935588521133
273,Naast het evenement van woensdag deed Carpanedo ook nog mee aan twee individuele races van het kampioenschap.,BeetleLM/beetlelm_nld-ind_balanced,step-2444,nld,8.075860977172852,3215.8949892612404
274,"Haar eerste was de Slalom, waar ze een Did Not Finish kreeg bij haar eerste run. 36 van de 116 deelnemers kregen hetzelfde resultaat in die race.",BeetleLM/beetlelm_nld-ind_balanced,step-2444,nld,7.556845664978027,1913.7992184671364
275,"In de andere wedstrijd waar ze aan deelnam, de zittende Grote Slalom, werd ze tiende van de dames, met een gecombineerde tijd van 4:41:30. Dat is 2:11:60 minuten langzamer dan de Oostenrijkse winnares Claudia Loesch, en 1:09:02 minuten langzamer dan de Hongaarse Gyöngyi Dani, die als negende eindigde.",BeetleLM/beetlelm_nld-ind_balanced,step-2444,nld,7.354127883911133,1562.6336030562534
276,Vier skiërs van de vrouwengroep voor de zittende slalom konden hun ritten niet afmaken en het lukte 45 van de 117 skiërs in de reuzenslalom niet om zich te plaatsen tijdens de race.,BeetleLM/beetlelm_nld-ind_balanced,step-2444,nld,7.5131707191467285,1832.0131426551222
277,De gestolen laptop en mobiele telefoon zijn door de politie van Madhya Pradesh teruggevonden.,BeetleLM/beetlelm_nld-ind_balanced,step-2444,nld,8.146821975708008,3452.389833948481
278,Volgens adjunct-inspecteur-generaal D. K. Arya zijn vijf van de verkrachters van de Zweedse vrouw gearresteerd en hebben ze haar mobiele telefoon en laptop gevonden.,BeetleLM/beetlelm_nld-ind_balanced,step-2444,nld,7.740829944610596,2300.3807797114955
279,"Baba Kanjar, Bhutha Kanjar, Rampro Kanjar, Gaza Kanjar en Vishnu Kanjar zijn de verdachten.",BeetleLM/beetlelm_nld-ind_balanced,step-2444,nld,8.249675750732422,3826.3849177626676
280,Volgens politiecommissaris Chandra Shekhar Solanki hadden de verdachten hun gezichten bedekt toen ze in de rechtbank verschenen.,BeetleLM/beetlelm_nld-ind_balanced,step-2444,nld,8.638691902160645,5645.939550561953
281,"Er bevonden zich drie mensen in het huis toen de auto het huis raakte, maar geen van hen raakte gewond.",BeetleLM/beetlelm_nld-ind_balanced,step-2444,nld,7.335070610046387,1533.1360309256224
282,De bestuurder liep echter wel ernstige verwondingen aan het hoofd op.,BeetleLM/beetlelm_nld-ind_balanced,step-2444,nld,8.339285850524902,4185.09988710358
283,De weg waar het ongeluk plaatsvond werd tijdelijk gesloten terwijl de hulpdiensten probeerden de chauffeur uit de rode Audi TT te bevrijden.,BeetleLM/beetlelm_nld-ind_balanced,step-2444,nld,7.977022171020508,2913.2429952943776
284,"Aanvankelijk werd hij opgenomen in Great Yarmouth, in het James Paget Hospital.",BeetleLM/beetlelm_nld-ind_balanced,step-2444,nld,7.69416618347168,2195.502400714495
285,Hij werd vervolgens overgeplaatst naar het Addenbrooke's Hospital in Cambridge.,BeetleLM/beetlelm_nld-ind_balanced,step-2444,nld,7.698718547821045,2205.5199119527147
286,Adekoya is sindsdien in de Edinburgh Sheriff Court veroordeeld voor het vermoorden van haar zoon.,BeetleLM/beetlelm_nld-ind_balanced,step-2444,nld,8.044076919555664,3115.288114484163
287,"Ze zit in hechtenis in afwachting van de aanklacht en het proces, maar het ooggetuigenverslag is mogelijk bedoezeld omdat haar verhaal veelvuldig is gepubliceerd.",BeetleLM/beetlelm_nld-ind_balanced,step-2444,nld,7.706162452697754,2221.9988501112502
288,"Dit is gangbare praktijk in de rest van het VK, maar justitie in Schotland werkt anders en rechtbanken hebben de publicatie van foto's als mogelijk nadelig bestempeld.",BeetleLM/beetlelm_nld-ind_balanced,step-2444,nld,7.656545162200928,2114.4397487907136
289,Professor Pamela Ferguson van de Universiteit van Dundee merkt op dat 'journalisten een gevaarlijk spelletje spelen als ze foto's e.d. van verdachten publiceren.',BeetleLM/beetlelm_nld-ind_balanced,step-2444,nld,7.964815616607666,2877.898492313637
290,"Crown Office heeft de algehele leiding over vervolgingen en heeft aan journalisten aangegeven dat er geen verdere uitspraken worden gedaan, in ieder geval totdat aanklachten zijn gedaan.",BeetleLM/beetlelm_nld-ind_balanced,step-2444,nld,7.860771656036377,2593.520909516494
291,"Volgens bronnen verwijst het document naar een geschillenregeling, iets wat de Palestijnen graag wilden op grond van de grenzen voor de oorlog in het Midden-Oosten in 1967.",BeetleLM/beetlelm_nld-ind_balanced,step-2444,nld,7.574150562286377,1947.205530159277
292,"Andere onderwerpen die besproken waren zijn de toekomstige status van Jeruzalem, een stad die voor beide volken heilig is, en de problemen in de Jordaanvallei.",BeetleLM/beetlelm_nld-ind_balanced,step-2444,nld,7.540330410003662,1882.4519033599265
293,Israël eist dat er na ondertekening van een overeenkomst tien jaar lang een permanente militaire aanwezigheid is in de vallei. De PA is echter slechts bereid tot een aanwezigheid van vijf jaar.,BeetleLM/beetlelm_nld-ind_balanced,step-2444,nld,7.570828914642334,1940.748329706932
294,Schutters in de aanvullende proef voor ongediertebestrijding moesten nauwlettend in de gaten worden gehouden door boswachters. De proef werd namelijk gevolgd en de effectiviteit ervan werd beoordeeld.,BeetleLM/beetlelm_nld-ind_balanced,step-2444,nld,8.147322654724121,3454.1188058876483
295,"Bij een samenwerking tussen de NPWS en de Sporting Shooters Association of Australia (NSW) Inc, werden gekwalificeerde vrijwilligers gerekruteerd voor het jachtprogramma van de Sporting Shooters Association.",BeetleLM/beetlelm_nld-ind_balanced,step-2444,nld,8.297554016113281,4014.042094063304
296,"Volgens Mick O'Flynn, waarnemend directeur voor parkbehoud en erfgoed bij de NPWS, hebben de vier gekozen schutters voor de eerste schietoperatie een uitgebreide veiligheids- en trainingsinstructie gehad.",BeetleLM/beetlelm_nld-ind_balanced,step-2444,nld,8.37960147857666,4357.272113861814
297,Gisteren zwoor Martelly een negenkoppige nieuwe voorlopige kiesraad (Provisional Electoral Council of CEP) in.,BeetleLM/beetlelm_nld-ind_balanced,step-2444,nld,8.800189018249512,6635.4981179880515
298,"Hiermee heeft Martelly in de afgelopen vier jaar, vijf keer een CEP behaald.",BeetleLM/beetlelm_nld-ind_balanced,step-2444,nld,7.508180141448975,1822.8931147558221
299,Afgelopen maand heeft de presidentiële commissie het ontslag van de eerdere Nationale Kiesraad aanbevolen. Dit is onderdeel van een maatregelenpakket zodat er nieuwe verkiezingen komen in het land.,BeetleLM/beetlelm_nld-ind_balanced,step-2444,nld,7.622066020965576,2042.7781956615638
300,De commissie werd door Martelly ingesteld als reactie op de wijdverbreide protesten tegen de overheid die sinds oktober hebben plaatsgevonden.,BeetleLM/beetlelm_nld-ind_balanced,step-2444,nld,8.458556175231934,4715.24509284496
301,"De soms gewelddadige protesten ontstonden door het uitblijven van verkiezingen, waarvan sommige al sinds 2011 hadden moeten plaatsvinden.",BeetleLM/beetlelm_nld-ind_balanced,step-2444,nld,8.568282127380371,5262.082433980755
302,Er zijn ongeveer 60 gevallen gerapporteerd van defecte iPods die oververhit raken. In totaal leidde dit tot zes branden en vier mensen met lichte brandwonden.,BeetleLM/beetlelm_nld-ind_balanced,step-2444,nld,8.089142799377441,3258.8928476010346
303,"Het Japanse ministerie van Economie, Handel en Industrie (METI) liet weten dat het bekend was met de 27 ongelukken die verband hielden met de apparaten.",BeetleLM/beetlelm_nld-ind_balanced,step-2444,nld,7.62350606918335,2045.7220138728912
304,Vorige week kondigde METI aan dat Apple 34 aanvullende incidenten met oververhitting had gemeld die het bedrijf 'niet ernstig' noemde.,BeetleLM/beetlelm_nld-ind_balanced,step-2444,nld,8.063982009887695,3177.9194793699944
305,"'Erg betreurenswaardig', luidde de reactie van het ministerie over het feit dat Apple het rapport heeft uitgesteld.",BeetleLM/beetlelm_nld-ind_balanced,step-2444,nld,7.999142169952393,2978.4019281985725
306,Mariana werd om 07.19 uur lokale tijd (vrijdag 21.19 GMT) getroffen door de aardbeving.,BeetleLM/beetlelm_nld-ind_balanced,step-2444,nld,8.009212493896484,3008.546930667781
307,Het bureau voor calamiteitenbeheer van de Noordelĳke Marianen verklaarde dat er landelijk geen schade is gemeld.,BeetleLM/beetlelm_nld-ind_balanced,step-2444,nld,8.059887886047363,3164.9352810613655
308,Daarnaast meldde het National Tsunami Warning Center dat er geen sprake was van een tsunami-waarschuwing.,BeetleLM/beetlelm_nld-ind_balanced,step-2444,nld,8.04061222076416,3104.5132561166774
309,"In Manilla, de Filippijnse hoofdstad, heeft een voormalige politieman uit de Filippijnen toeristen uit Hongkong gegijzeld door hun bus te kapen.",BeetleLM/beetlelm_nld-ind_balanced,step-2444,nld,8.100262641906738,3295.3334542982448
310,Met zijn M16-geweer schoot Rolando Mendoza op de toeristen.,BeetleLM/beetlelm_nld-ind_balanced,step-2444,nld,7.706165790557861,2222.006266844949
311,Verschillende gijzelaars zijn in veiligheid gebracht en vooralsnog zijn er minstens zes dodelijke slachtoffers bevestigd.,BeetleLM/beetlelm_nld-ind_balanced,step-2444,nld,8.80056381225586,6637.985529016059
312,"Zes gijzelaars werden eerder vrijgelaten, inclusief de kinderen en ouderen, en de Filipijnse fotografen.",BeetleLM/beetlelm_nld-ind_balanced,step-2444,nld,7.875061511993408,2630.8480140277316
313,Later keerden de fotografen terug in ruil voor een oudere vrouw die naar het toilet moest. Mendoza is uiteindelijk neergeschoten.,BeetleLM/beetlelm_nld-ind_balanced,step-2444,nld,7.569937705993652,1939.019488504127
314,Liggins ging in de geneeskunde werken en volgde hiermee het voorbeeld van zijn vader.,BeetleLM/beetlelm_nld-ind_balanced,step-2444,nld,7.861128807067871,2594.4473536149144
315,Opgeleid als verloskundige ging hij in 1959 aan de slag in het National Women's Hospital in Auckland.,BeetleLM/beetlelm_nld-ind_balanced,step-2444,nld,7.571072578430176,1941.221277413971
316,"Toen hij werkzaam was in het ziekenhuis, deed Liggins in zijn vrije tijd onderzoek naar vroeggeboorte.",BeetleLM/beetlelm_nld-ind_balanced,step-2444,nld,7.7472639083862305,2315.229061751261
317,Zijn onderzoek toonde aan dat de rijping van de foetale longen van baby's werd versneld door het toedienen van een hormoon.,BeetleLM/beetlelm_nld-ind_balanced,step-2444,nld,7.509955406188965,1826.1321068107554
318,Xinhua heeft gemeld dat onderzoekers van de overheid woensdag twee 'zwarte dozen' met vluchtrecorders terug hebben gevonden.,BeetleLM/beetlelm_nld-ind_balanced,step-2444,nld,7.952347755432129,2842.2400078685882
319,Ook medeworstelaars brachten hulde aan Luna.,BeetleLM/beetlelm_nld-ind_balanced,step-2444,nld,9.073040962219238,8717.091888191497
320,"Tommy Dreamer zei, 'Luna was de eerste 'Queen of Extreme'. Mijn eerste manager. Luna is overleden op de nacht van twee manen. Net zo uniek als zij was. Een sterke vrouw.'",BeetleLM/beetlelm_nld-ind_balanced,step-2444,nld,7.792979717254639,2423.5282629471762
321,Dustin 'Goldust' Runnels gaf aan dat 'Luna net zo raar was als ik... misschien nog wel raarder... ik hou van haar en ga haar missen... hopelijk is ze op een betere plek'.,BeetleLM/beetlelm_nld-ind_balanced,step-2444,nld,7.509520053863525,1825.3372689812984
322,"Van de 1400 mensen die voor de federale verkiezing van 2010 werden ondervraagd, steeg het aantal mensen dat zich verzette tegen het feit dat Australië een republiek werd, met 8 procent sinds 2008.",BeetleLM/beetlelm_nld-ind_balanced,step-2444,nld,7.828941822052002,2512.2695381530657
323,Demissionair minister-president Julia Gillard zei tijdens de campagne voor de federale verkiezingen van 2010 dat Australië na de regering van koningin Elizabeth II een republiek zou moeten worden.,BeetleLM/beetlelm_nld-ind_balanced,step-2444,nld,8.258221626281738,3859.2248501979134
324,34 procent van de deelnemers van deze peiling stond achter dit standpunt. Zij willen dat koningin Elizabeth II de laatste vorst van Australië is.,BeetleLM/beetlelm_nld-ind_balanced,step-2444,nld,7.987001419067383,2942.4605117176766
325,"29 procent van de respondenten vond dat Australië een republiek moet worden zodra het mogelijk is, en aan het andere uiteinde zei 31 procent dat dat nooit zou moeten gebeuren.",BeetleLM/beetlelm_nld-ind_balanced,step-2444,nld,7.643101215362549,2086.2035613981984
326,"De Olympisch winnaar van de gouden medaille zwom de 100 en 200 meter freestyle en drie estafettewedstrijden tijdens de Gemenebestspelen, maar zijn conditie werd in twijfel getrokken vanwege zijn klachten.",BeetleLM/beetlelm_nld-ind_balanced,step-2444,nld,8.35889720916748,4267.9854749359465
327,"Hij kon de medicijnen die hij nodig had om zijn pijn te verzachten niet nemen, omdat ze zijn verboden op de Spelen.",BeetleLM/beetlelm_nld-ind_balanced,step-2444,nld,7.078591346740723,1186.2962608756816
328,"Curtis Cooper, een wiskundige en informaticaprofessor aan de Universiteit van Centraal Missouri, ontdekte op 25 januari het op dit moment grootste bekende priemgetal.",BeetleLM/beetlelm_nld-ind_balanced,step-2444,nld,8.455634117126465,4701.486983488999
