sentence_id,sentence,repo,revision,iso_code,nll,ppl
421,"Japan besitzt annähernd 7.000 Inseln (von denen Honshu die größte ist), womit Japan die siebtgrößte Insel der Welt ist.",BeetleLM/beetlelm_deu-ukr_heritage,step-2000,deu,7.735789775848389,2288.815641970112
422,"""Aufgrund des Clusters/Gruppe von Inseln wurde Japan, wird Japan geografisch häufig als """"Archipel"""" bezeichnet.""",BeetleLM/beetlelm_deu-ukr_heritage,step-2000,deu,7.529592990875244,1862.3473569129505
423,"Der Beginn Taiwans geht auf das 15. Jahrhundert zurück, als europäische Seefahrer dort vorbeifuhren und den Namen der Insel als Ilha Formosa bzw. schöne Insel dokumentierten.",BeetleLM/beetlelm_deu-ukr_heritage,step-2000,deu,7.585610866546631,1969.6494594759324
424,"1624 gründet die Niederländische Ostindien-Kompanie eine Niederlassung im Südwesten Taiwans, leitet damit einen Wandel in den Getreideanbaumethoden der Ureinwohner ein und beschäftigt chinesische Arbeiter auf ihren Reis- und Zuckerplantagen.",BeetleLM/beetlelm_deu-ukr_heritage,step-2000,deu,7.783394813537598,2400.4099482917595
425,Im Jahr 1683 übernehmen Streitkräfte der Qing-Dynastie (1644-1912) die Kontrolle über Taiwans westliche und nördliche Küstenregionen und erklärten im Jahr 1885 Taiwan zur Provinz des Qing-Reiches.,BeetleLM/beetlelm_deu-ukr_heritage,step-2000,deu,7.803952217102051,2450.26685276171
426,"1895 unterzeichnete die Regierung der Qing-Dynastie nach der Niederlage im ersten Chinesisch-Japanischen Krieg (1894-1895) den Vertrag von Shimonoseki, in dem sie die Souveränität über Taiwan an Japan abtrat, welches die Insel bis 1945 regierte.",BeetleLM/beetlelm_deu-ukr_heritage,step-2000,deu,7.545294761657715,1891.8202913260411
427,"Machu Picchu besteht hauptsächlich aus drei Bauwerken, nämlich den Intihuatana, dem Sonnentempel und dem Raum der drei Fenster.",BeetleLM/beetlelm_deu-ukr_heritage,step-2000,deu,7.626882076263428,2052.6400569862085
428,"Die meisten Gebäude an den Rändern des Komplexes wurden wieder aufgebaut, um den Touristen einen besseren Eindruck davon zu vermitteln, wie sie ursprünglich aussahen.",BeetleLM/beetlelm_deu-ukr_heritage,step-2000,deu,7.348872184753418,1554.4424150099076
429,"Bis 1976 wurden dreißig Prozent von Machu Picchu restauriert, und die Restaurierungsarbeiten dauern bis heute an.",BeetleLM/beetlelm_deu-ukr_heritage,step-2000,deu,7.759032726287842,2342.637537308075
430,"Zum Beispiel ist das weltweit am weitesten verbreitete Standbildformat 35 mm, was der vorherrschenden Filmgröße am Ende der Analogfilmära entspricht.",BeetleLM/beetlelm_deu-ukr_heritage,step-2000,deu,8.120994567871094,3364.3651711807693
431,"Es wird auch heute noch hergestellt, aber noch wichtiger ist, dass sein Bildformat von den Bildsensorformaten digitaler Kameras übernommen wurde.",BeetleLM/beetlelm_deu-ukr_heritage,step-2000,deu,7.382516860961914,1607.630863622994
432,Genau genommen misst das sogenannte 35-mm-Format verwirrenderweise 36 mm in der Breite und 24 mm in der Höhe.,BeetleLM/beetlelm_deu-ukr_heritage,step-2000,deu,7.410857677459717,1653.8442036410142
433,"Das Seitenverhältnis dieses Formats (geteilt durch zwölf, um das einfachste ganzzahlige Verhältnis zu erhalten) wird daher als 3:2 bezeichnet.",BeetleLM/beetlelm_deu-ukr_heritage,step-2000,deu,7.832350254058838,2520.847047681679
434,"Viele übliche Formate (die APS-Formatfamilie, zum Beispiel) haben genau dasselbe oder ein sehr ähnliches Seitenverhältnis.",BeetleLM/beetlelm_deu-ukr_heritage,step-2000,deu,7.860886096954346,2593.8177314141117
435,"Die vielgeschmähte und oft verspottete Drittel-Regel ist eine einfache Richtlinie, die Dynamik schafft und gleichzeitig ein Maß an Ordnung in einem Bild bewahrt.",BeetleLM/beetlelm_deu-ukr_heritage,step-2000,deu,7.784699440002441,2403.543630334564
436,"Sie besagt, dass der Kreuzungspunkt der Linien, die ein Bild vertikal und horizontal dritteln, der effektivste Platz für das Hauptmotiv ist (siehe Beispiel).",BeetleLM/beetlelm_deu-ukr_heritage,step-2000,deu,7.444532871246338,1710.486088267028
437,In dieser Periode der europäischen Geschichte stand die reich und mächtig gewordene katholische Kirche auf dem Prüfstand.,BeetleLM/beetlelm_deu-ukr_heritage,step-2000,deu,7.486021518707275,1782.9445510673047
438,Seit über eintausend Jahren hatte die christliche Religion die europäischen Staaten trotz unterschiedlicher Sprachen und Gebräuche zusammengehalten.,BeetleLM/beetlelm_deu-ukr_heritage,step-2000,deu,7.893921852111816,2680.937570628045
439,"Seine Allmacht beherrschte jeden, vom König bis zum einfachen Bürger.",BeetleLM/beetlelm_deu-ukr_heritage,step-2000,deu,7.739776611328125,2297.9589877748117
440,"Einer der wichtigen christlichen Glaubenssätze besagt, dass Vermögen zur Linderung von Leid und Armut eingesetzt werden soll und dass es die Geldmittel der Kirchen genau aus diesem Grund gibt.",BeetleLM/beetlelm_deu-ukr_heritage,step-2000,deu,7.510158061981201,1826.5022205611704
441,"Die Zentralgewalt der Kirche war seit mehr als tausend Jahren in Rom. Diese Konzentration von Macht und Geld veranlasste viele zu zweifeln, ob diesem Grundsatz entsprochen wurde.",BeetleLM/beetlelm_deu-ukr_heritage,step-2000,deu,7.634084701538086,2067.4778254376106
442,Bald nach dem Ausbruch von Kampfhandlungen initiierte Großbritannien eine Seeblockade gegen Deutschland.,BeetleLM/beetlelm_deu-ukr_heritage,step-2000,deu,7.961272716522217,2867.720426081541
443,"Die Strategie erwies sich als effektiv, da sie das Land von lebenswichtigen militärischen und zivilen Lieferungen abschnitt, obwohl diese Blockade gegen das allgemein anerkannte Völkerrecht verstieß, das durch mehrere internationale Abkommen der letzten zwei Jahrhunderte kodifiziert worden war.",BeetleLM/beetlelm_deu-ukr_heritage,step-2000,deu,8.00635051727295,2999.948849304178
444,"Großbritannien verminte internationale Gewässer, um zu verhindern, dass Schiffe in ganze Meeresabschnitte vordringen konnten, was selbst für neutrale Schiffe eine Gefahr darstellte.",BeetleLM/beetlelm_deu-ukr_heritage,step-2000,deu,7.553555965423584,1907.5137383699075
445,"Da die Reaktion auf diese Taktik begrenzt war, erwartete Deutschland eine ähnliche Reaktion auf seine uneingeschränkte U-Boot-Kriegsführung.",BeetleLM/beetlelm_deu-ukr_heritage,step-2000,deu,8.047176361083984,3124.9587468769264
446,In den 1920er-Jahren waren Pazifismus und Isolation die vorherrschenden Einstellungen der meisten Bürger und Länder.,BeetleLM/beetlelm_deu-ukr_heritage,step-2000,deu,7.524684429168701,1853.2283090067067
447,Nach dem Erlebnis der Schrecken und Gräueltaten im Ersten Weltkrieg wollten die Nationen eine weitere solche Situation in der Zukunft vermeiden.,BeetleLM/beetlelm_deu-ukr_heritage,step-2000,deu,7.584810733795166,1968.0741087633974
448,"1884 zog Tesla in die Vereinigten Staaten von Amerika um, um eine Stelle bei der Edison Company in New York City anzutreten.",BeetleLM/beetlelm_deu-ukr_heritage,step-2000,deu,7.314110279083252,1501.3354320964625
449,"Er kam in die USA mit 4 Cent in seinem Besitz, einem Buch mit Gedichten und einem Empfehlungsschreiben von Charles Batchelor (seinem Vorgesetzten bei seiner vorherigen Arbeitsstelle) an Thomas Edison.",BeetleLM/beetlelm_deu-ukr_heritage,step-2000,deu,7.79640007019043,2431.831777336124
450,"Das alte China hatte eine einzigartige Methode, verschiedene Zeitalter anzuzeigen. Jede Zeitspanne in China und jede Familie, die an der Macht war, war eine eigene Dynastie.",BeetleLM/beetlelm_deu-ukr_heritage,step-2000,deu,6.9645466804504395,1058.434999379106
451,"Zwischen den einzelnen Dynastien herrschten auch unbeständige Zeiten geteilter Provinzen. Die bekannteste dieser Perioden war die Epoche der Drei Königreiche, die 60 Jahre lang zwischen der Han- und der Jin-Dynastie stattfand.",BeetleLM/beetlelm_deu-ukr_heritage,step-2000,deu,7.511059284210205,1828.1490469304679
452,"In diesen Zeiten tobten erbitterte Kriege unter vielen Adligen, die um den Thron kämpften.",BeetleLM/beetlelm_deu-ukr_heritage,step-2000,deu,7.281713485717773,1453.4764036638733
453,Die Zeit der drei Königreiche war eine der blutigsten Epochen in der Geschichte des alten China. Tausende von Menschen starben im Kampf um den höchsten Thron im großen Palast von Xi'an.,BeetleLM/beetlelm_deu-ukr_heritage,step-2000,deu,7.0461273193359375,1148.4027229618687
454,"Es gibt eine Menge sozialer und politischer Effekte wie die Nutzung des metrischen Systems, eine Abwendung vom Absolutismus hin zum Republikanismus und Nationalismus sowie der Glaube, dass das Land dem Volk gehört und nicht einem Herrscher allein.",BeetleLM/beetlelm_deu-ukr_heritage,step-2000,deu,7.291153430938721,1467.2621070637317
455,"Auch standen nach der Revolution alle Berufe allen männlichen Bewerbern offen, so dass die Ehrgeizigsten und Besten reüssieren konnten.",BeetleLM/beetlelm_deu-ukr_heritage,step-2000,deu,8.035358428955078,3088.245560761648
456,"Dasselbe gilt für das Militär, denn statt auf Klassenzugehörigkeit basierten die Armee-Ranglisten nun auf dem Kaliber.",BeetleLM/beetlelm_deu-ukr_heritage,step-2000,deu,7.420339584350586,1669.6003816498921
457,"Die Französische Revolution inspirierte auch viele unterdrückte Menschen der Arbeiterschicht in anderen Ländern dazu, ihre eigenen Revolutionen zu starten.",BeetleLM/beetlelm_deu-ukr_heritage,step-2000,deu,7.588784217834473,1975.9097769645082
458,"Mohammed war sehr stark an Dingen interessiert, die über dieses Alltagsleben hinausgingen. Er besuchte oft eine Höhle, die als „Hira“ auf dem Berg von „Nur“ (Licht) bekannt wurde, um zu meditieren.",BeetleLM/beetlelm_deu-ukr_heritage,step-2000,deu,7.053739070892334,1157.1774322630588
459,Die Höhle selbst hat die Zeiten überdauert und bietet ein lebhaftes Bild von Mohammeds spirituellen Neigungen.,BeetleLM/beetlelm_deu-ukr_heritage,step-2000,deu,7.958639144897461,2860.1780150388563
460,Die Höhle befindet sich auf der Spitze eines der Berge nördlich von Mekka und ist vom Rest der Welt völlig isoliert.,BeetleLM/beetlelm_deu-ukr_heritage,step-2000,deu,7.234411239624023,1386.3244449538977
461,"Tatsächlich ist sie ganz und gar nicht einfach zu finden, auch wenn man weiß, dass sie existiert. Sobald man sich in der Höhle befindet, ist man vollkommen isoliert.",BeetleLM/beetlelm_deu-ukr_heritage,step-2000,deu,6.277338981628418,532.3701305931302
462,"Man sieht nichts außer dem darüber liegenden, klaren, wunderschönen Himmel und den zahlreichen umliegenden Bergen. Vom Innern der Höhle aus ist sehr wenig von dieser Welt zu sehen oder zu hören.",BeetleLM/beetlelm_deu-ukr_heritage,step-2000,deu,7.337413787841797,1536.7326533479306
463,"Die Cheopspyramide ist das einzige der sieben Weltwunder, welches heute noch steht.",BeetleLM/beetlelm_deu-ukr_heritage,step-2000,deu,7.675559043884277,2155.0281042848133
464,"Im dritten Jahrhundert v. Chr. von den Ägyptern erbaut, ist die Cheops-Pyramide eine von vielen großen Pyramidenstrukturen, die zur Verehrung verstorbener Pharaonen erbaut wurden.",BeetleLM/beetlelm_deu-ukr_heritage,step-2000,deu,7.434952735900879,1694.1776433206992
465,"Das Gizeh-Plateau beziehungsweise die „Gizeh-Nekropole“ im ägyptischen Tal der Toten umfasst mehrere Pyramiden (von denen die Große Pyramide die größte ist), mehrere kleine Gräber, mehrere Tempel sowie die große Sphinx.",BeetleLM/beetlelm_deu-ukr_heritage,step-2000,deu,7.915120601654053,2738.376763235819
466,"Die große Pyramide wurde dem Pharao Cheops zu Ehren erbaut und viele der kleineren Pyramiden, Grabmale und Tempel wurden zu Ehren von Cheops Ehefrauen und Familienmitgliedern errichtet.",BeetleLM/beetlelm_deu-ukr_heritage,step-2000,deu,7.657149314880371,2115.7175791939303
467,"Das „Aufstrich“-Symbol sieht wie ein V aus und das „Abstrich“-Symbol wie eine Klammer bzw. ein Quadrat, bei dem der untere Strich fehlt.",BeetleLM/beetlelm_deu-ukr_heritage,step-2000,deu,7.192037105560303,1328.807371221151
468,"Aufwärts bedeutet, dass Sie an der Spitze anfangen und den Bogen schieben sollten. Abwärts bedeutet, dass Sie beim Frosch (das ist dort, wo Ihre Hand den Bogen hält) anfangen und den Bogen ziehen.",BeetleLM/beetlelm_deu-ukr_heritage,step-2000,deu,6.970661640167236,1064.9271160492956
469,"Das Aufstreichen generiert üblicherweise einen weicheren Klang, während das Abstreichen kräftiger und ausdrucksstärker ist.",BeetleLM/beetlelm_deu-ukr_heritage,step-2000,deu,8.553291320800781,5183.787889412307
470,"Sie können gerne Ihre eigenen Bleistiftmarkierungen hinzufügen; denken Sie aber daran, dass die aufgedruckten Bogenmarkierungen sich dort aus musikalischen Gründen befinden, weshalb sie im Normalfall respektiert werden sollten.",BeetleLM/beetlelm_deu-ukr_heritage,step-2000,deu,8.192811965942383,3614.8728675640577
471,"Der in Panik versetzte König Ludwig der XIV., Königin Marie-Antoinette, ihre beiden kleinen Kinder (die 11 Jahre alte Marie-Therese und der 4 Jahre alte Louis-Charles) sowie die Schwester des Königs, Madame Elisabeth wurden am 6. Oktober 1789 in Versailles von einem Mob aus Marktfrauen zur Rückkehr nach Paris gezwungen.",BeetleLM/beetlelm_deu-ukr_heritage,step-2000,deu,7.608232498168945,2014.7139382406094
472,"Sie reisten in einer Kutsche zurück nach Paris, umgeben von einem schreienden Mob von Menschen, die Drohungen gegen den König und die Königin ausstießen.",BeetleLM/beetlelm_deu-ukr_heritage,step-2000,deu,7.103934288024902,1216.74469414364
473,"Der Mob zwang König und Königin dazu, die Fenster ihrer Kutschen weit zu öffnen.",BeetleLM/beetlelm_deu-ukr_heritage,step-2000,deu,7.512698173522949,1831.1476373733267
474,Irgendwann schwenkte ein Mitglied der aufgebrachten Menge den Kopf einer in Versailles getöteten königlichen Garde vor den Augen der entsetzten Königin.,BeetleLM/beetlelm_deu-ukr_heritage,step-2000,deu,7.891634464263916,2674.812234788112
475,Die Kriegsausgaben der US-Imperialisten bei der Eroberung der Philippinen wurden vom philippinischen Volk selbst getragen.,BeetleLM/beetlelm_deu-ukr_heritage,step-2000,deu,7.94484281539917,2820.9890105258323
476,"Sie wurden gezwungen, Steuern an das Kolonialregime der U.S. zu zahlen, um das Gros der Ausgaben zu decken, und die Zinsen aus Anleihen flossen im Namen der philippinischen Regierung durch die Bankhäuser der Wall Street.",BeetleLM/beetlelm_deu-ukr_heritage,step-2000,deu,7.377434730529785,1599.4813997469198
477,"Natürlich stellten die Superprofite, die der andauernden Ausbeutung des philippinischen Volkes entstammten, die grundlegenden Gewinne des US-Imperialismus dar.",BeetleLM/beetlelm_deu-ukr_heritage,step-2000,deu,7.815963268280029,2479.874587391223
478,"Um die Templer zu verstehen, muss man den Kontext verstehen, der zur Gründung des Ordens führte.",BeetleLM/beetlelm_deu-ukr_heritage,step-2000,deu,7.2657999992370605,1430.5295926975214
479,"Die Epoche, in der die Ereignisse stattfanden, wird gemeinhin als Hochmittelalter bezeichnet, ein Zeitalter in der europäischen Geschichte, das sich über das 11., 12. und 13 Jahrhundert erstreckt (1000–1300 n. Chr.).",BeetleLM/beetlelm_deu-ukr_heritage,step-2000,deu,7.2892231941223145,1464.432675340495
480,"Dem Hochmittelalter ging das Frühmittelalter voraus, gefolgt vom Spätmittelalter, das übereinstimmend um 1500 endet.",BeetleLM/beetlelm_deu-ukr_heritage,step-2000,deu,7.903028964996338,2705.464687810553
481,"Technologischer Determinismus ist ein Begriff, der ein breites Spektrum von Ideen in der Praxis umfasst, vom Technologie-Push oder dem technologischen Imperativ bis hin zu dem strengen Sinn, dass das menschliche Schicksal von einer zugrunde liegenden Logik bestimmt wird, die mit wissenschaftlichen Gesetzen und ihrer Manifestation in der Technologie verbunden ist.",BeetleLM/beetlelm_deu-ukr_heritage,step-2000,deu,7.496670722961426,1802.0329494984794
482,"Die meisten Interpretationen des technologischen Determinismus teilen zwei allgemeine Vorstellungen. Einerseits, dass die Entwicklung der Technologie selbst einem Weg folgt, der weitgehend jenseits kultureller oder politischer Einflussnahme liegt, und andererseits, dass Technologie ihrerseits „Auswirkungen“ auf Gesellschaften hat, die eher inhärent als sozial bedingt sind.",BeetleLM/beetlelm_deu-ukr_heritage,step-2000,deu,7.924161434173584,2763.246219828282
483,"Man kann etwa behaupten, dass der Personenkraftwagen unumgänglich die Entwicklung von Straßen mit sich bringt.",BeetleLM/beetlelm_deu-ukr_heritage,step-2000,deu,7.2857747077941895,1459.391296839571
484,"Allerdings ist ein landesweites Straßennetz für nur eine kleine Anzahl an Autos wirtschaftlich nicht überlebensfähig. Daher werden neue Produktionsmethoden entwickelt, um die Kosten des Autobesitzes zu reduzieren.",BeetleLM/beetlelm_deu-ukr_heritage,step-2000,deu,7.371490001678467,1590.0011232784582
485,"Der verbreitete Automobilbesitz führt auch zu einer höheren Anzahl von Unfällen auf den Straßen, was wiederum zur Erfindung von neuen Techniken im Gesundheitswesen zur Reparatur beschädigter Körper führt.",BeetleLM/beetlelm_deu-ukr_heritage,step-2000,deu,8.14658260345459,3451.563526515733
486,"Die Romantik hatte ein starkes, kulturell deterministisches Element, das sich aus Schriftstellern wie Goethe, Fichte und Schlegel schöpfte.",BeetleLM/beetlelm_deu-ukr_heritage,step-2000,deu,7.652442932128906,2105.783597369098
487,"Im Kontext der Romantik, ist es die Geographie, die Individuen formte. Mit der Zeit entstanden Bräuche und Kulturen mit Bezug zu dieser Geographie und diese, da sie in Harmonie mit dem Platz der Gesellschaft standen, waren besser als willkürlich oktroyierte Gesetze.",BeetleLM/beetlelm_deu-ukr_heritage,step-2000,deu,7.229706287384033,1379.8171748528298
488,"So wie Paris als Modehauptstadt der heutigen Welt bekannt ist, so galt Konstantinopel als die Modehauptstadt des feudalen Europas.",BeetleLM/beetlelm_deu-ukr_heritage,step-2000,deu,7.7206010818481445,2254.314200755226
489,Sein Ruhm als Epizentrum des Luxus begann ungefähr um 400 n. Chr. und dauerte bis ungefähr 1100 n. Chr. an.,BeetleLM/beetlelm_deu-ukr_heritage,step-2000,deu,7.36715841293335,1583.1287871203917
490,"Sein Status nahm im Laufe des zwölften Jahrhunderts ab, was vor allem darauf zurückzuführen war, dass die Kreuzritter mit Geschenken wie Seide und Gewürzen zurückgekehrt waren, die als wertvoller als das Angebot der byzantinischen Märkte erachtet wurden.",BeetleLM/beetlelm_deu-ukr_heritage,step-2000,deu,7.486405849456787,1783.6299231793066
491,Zu dieser Zeit wanderte auch der Titel der Modehauptstadt der Welt von Konstantinopel nach Paris.,BeetleLM/beetlelm_deu-ukr_heritage,step-2000,deu,7.383094310760498,1608.5594578238545
492,Der gotische Stil erreichte seinen Höhepunkt in der Zeit zwischen dem 10.-11. und dem 14. Jahrhundert.,BeetleLM/beetlelm_deu-ukr_heritage,step-2000,deu,7.439643383026123,1702.1430997809452
493,Zu Beginn war die Kleidung stark von der Kultur Byzanz' im Osten geprägt.,BeetleLM/beetlelm_deu-ukr_heritage,step-2000,deu,7.587789058685303,1973.9444103605051
494,Allerdings hängen die Stile im Westen aufgrund der langsamen Kommunikationskanäle 25 bis 30 Jahre hinterher.,BeetleLM/beetlelm_deu-ukr_heritage,step-2000,deu,7.9558844566345215,2852.309958228221
495,"Gegen Ende des Mittelalters begann Westeuropa langsam einen eigenen Stil zu entwickeln. Eine der wichtigsten Entwicklungen der Zeit bestand darin, dass die Menschen als Folge der Kreuzzüge damit begannen, Knöpfe zum Fixieren von Kleidung zu nutzen.",BeetleLM/beetlelm_deu-ukr_heritage,step-2000,deu,7.5469794273376465,1895.010062137736
496,"Bedarfswirtschaft ist Landwirtschaft, die darauf zielt, gerade so viele Nahrungsmittel zu produzieren, dass sie den Bedarf des Landwirts bzw. der Landwirtin und seiner/ihrer Familie deckt.",BeetleLM/beetlelm_deu-ukr_heritage,step-2000,deu,7.264795780181885,1429.0937486931618
497,"Die Subsistenzwirtschaft ist eine einfache, oftmals biologische Anbauart, die aufgespartes, in der Ökoregion heimisches Saatgut nutzt und mit Wechselfelderwirtschaft oder anderen relativ einfachen Techniken verbindet, um den Ertrag zu maximieren.",BeetleLM/beetlelm_deu-ukr_heritage,step-2000,deu,7.437891483306885,1699.1637263061252
498,In der Vergangenheit betrieben die meisten Bauern Subsistenzwirtschaft und in vielen Entwicklungsländern ist das nach wie vor der Fall.,BeetleLM/beetlelm_deu-ukr_heritage,step-2000,deu,7.494874000549316,1798.7981034411919
499,"Subkulturen bringen gleichgesinnte Menschen zusammen, die sich von gesellschaftlichen Normen vernachlässigt fühlen, und ermöglichen es ihnen, ein Identitätsgefühl zu entwickeln.",BeetleLM/beetlelm_deu-ukr_heritage,step-2000,deu,7.298142433166504,1477.5527238826262
500,"Subkulturen können sich hinsichtlich des Alters, der ethnischen Zugehörigkeit, der Klasse, des Ortes und/oder des Geschlechts der Mitglieder von anderen abgrenzen.",BeetleLM/beetlelm_deu-ukr_heritage,step-2000,deu,7.4533562660217285,1725.6451611767197
501,"Die Eigenschaften, die eine Subkultur als solche abgrenzen, können sprachlicher, ästhetischer, religiöser, politischer, sexueller oder geographischer Natur oder eine Kombination dieser Faktoren sein.",BeetleLM/beetlelm_deu-ukr_heritage,step-2000,deu,7.470231533050537,1755.012982047267
502,"Die Mitglieder einer Subkultur signalisieren ihre Zugehörigkeit oft durch einen unverwechselbaren und symbolischen Stil, was Mode, Angewohnheiten und Jargon einschließt.",BeetleLM/beetlelm_deu-ukr_heritage,step-2000,deu,8.025358200073242,3057.5163041986507
503,"Eine der gängigsten Methoden zur Veranschaulichung der Wichtigkeit der Sozialisierung ist, sich auf die paar unglücklichen Fälle von Kindern zu stützen, die aufgrund von Vernachlässigung, Unglück oder vorsätzlichem Missbrauch während ihrer Kindheit nicht von Erwachsenen sozialisiert worden sind.",BeetleLM/beetlelm_deu-ukr_heritage,step-2000,deu,7.622029781341553,2042.7041674891746
504,"""Solche Kinder nennt man """"verwildert"""" oder wild. Einige verwilderte Kinder wurden von Menschen gefangen gehalten (für gewöhnlich den eigenen Eltern); in einige Fällen war die Vernachlässigung des Kindes auf die Unfähigkeit der Eltern zurückzuführen, die erheblichen intellektuellen oder körperlichen Einschränkungen des Kindes zu akzeptieren.""",BeetleLM/beetlelm_deu-ukr_heritage,step-2000,deu,7.9310078620910645,2782.229495553924
505,"Wolfskinder haben möglicherweise massive Kindesmisshandlungen erlebt oder traumatische Erfahrungen gemacht, bevor sie ausgesetzt wurden oder weggelaufen sind.",BeetleLM/beetlelm_deu-ukr_heritage,step-2000,deu,8.232361793518066,3760.705280962485
506,Andere sollen von Tieren aufgezogen worden sein; einige sollen allein in der Wildnis gelebt haben.,BeetleLM/beetlelm_deu-ukr_heritage,step-2000,deu,7.947018146514893,2827.132275092295
507,"Wenn es komplett von Tieren aufgezogen wurde, zeigt das wilde Kind Verhaltensweisen (im Rahmen seiner körperlichen Möglichkeiten), die fast komplett in Übereinstimmung mit denen seines spezifischen Pflegetiers sind, wie z.B. dessen Angst oder Gleichgültigkeit gegenüber Menschen.",BeetleLM/beetlelm_deu-ukr_heritage,step-2000,deu,8.091470718383789,3266.4881233639885
508,"Während projektbasiertes Lernen den Lernprozess einfacher und interessanter gestalten sollte, geht das „Scaffolding“ einen Schritt weiter.",BeetleLM/beetlelm_deu-ukr_heritage,step-2000,deu,8.086071968078613,3248.900687416389
509,"Scaffolding ist keine Lernmethode, sondern vielmehr eine Hilfe, die Individuen in einer neuartigen Lernsituation unterstützt wie beispielsweise beim Benutzen eines neuen Computerprogramms oder beim Beginn eines neuen Projekts.",BeetleLM/beetlelm_deu-ukr_heritage,step-2000,deu,7.9912261962890625,2954.9180484928015
510,"Gerüste können sowohl virtuell als auch real sein. Mit anderen Worten, ein Lehrer ist eine Form von Gerüst, aber auch das kleine Büroklammermännchen in Microsoft Office.",BeetleLM/beetlelm_deu-ukr_heritage,step-2000,deu,7.463521480560303,1743.276174152465
511,"Virtuelle Hilfestellungen sind in die Software eingebaut und sollen Arbeitsschritte, die der Schüler allein möglicherweise nicht bewältigen kann, hinterfragen, nahelegen und erklären.",BeetleLM/beetlelm_deu-ukr_heritage,step-2000,deu,7.501297473907471,1810.3898248349685
512,"Kinder werden aus einer Vielzahl von Gründen in Pflegefamilien untergebracht, und zwar aus verschiedenen Gründen, die von Vernachlässigung über Missbrauch bis hin zu Erpressung reichen.",BeetleLM/beetlelm_deu-ukr_heritage,step-2000,deu,7.481819152832031,1775.4676869910438
513,"Kein Kind sollte gezwungen sein, in einer Umgebung aufzuwachsen, die nicht fürsorglich, liebevoll und bildungsorientiert ist, aber viele sind dazu gezwungen.",BeetleLM/beetlelm_deu-ukr_heritage,step-2000,deu,6.909289836883545,1001.5357359378955
514,Für uns ist das System der Pflegeunterbringung ein Stück Sicherheit für diese Kinder.,BeetleLM/beetlelm_deu-ukr_heritage,step-2000,deu,7.221826553344727,1368.9873067678898
515,"Unser Pflegefamiliensystem soll ein sicheres Zuhause, liebevolle Betreuungspersonen, eine stabile Ausbildung und eine zuverlässige Gesundheitsversorgung bieten.",BeetleLM/beetlelm_deu-ukr_heritage,step-2000,deu,8.387774467468262,4393.029975704743
516,"Die Pflegestelle soll alle Bedürfnisse abdecken, die sie in dem Zuhause, aus dem sie zuvor herausgenommen wurden, nicht bekommen hatten.",BeetleLM/beetlelm_deu-ukr_heritage,step-2000,deu,6.998413562774658,1094.8947980277985
517,"Das Internet verbindet sowohl Elemente der Massenkommunikation, als auch der zwischenmenschlichen Kommunikation.",BeetleLM/beetlelm_deu-ukr_heritage,step-2000,deu,7.542178630828857,1885.93430730459
518,Die spezifischen Eigenheiten des Internets haben zu zusätzlichen Dimensionen hinsichtlich des Nutzen- und Belohnungsansatzes geführt.,BeetleLM/beetlelm_deu-ukr_heritage,step-2000,deu,8.181743621826172,3575.0828219049295
