sentence_id,sentence,repo,revision,iso_code,nll,ppl
223,"Същия месец видях, че друг голям пътнически самолет преодоля пистата в Машхад и се удари в стена, убивайки седемнадесет души.",BeetleLM/beetlelm_fas-bul_heritage,step-10387,bul,7.5924530029296875,1983.1722794380437
224,„Аеросмит“ отмениха оставащите си концерти от турнето.,BeetleLM/beetlelm_fas-bul_heritage,step-10387,bul,7.137060642242432,1257.726043701655
225,До 16 септември рок групата трябваше да обиколи САЩ и Канада.,BeetleLM/beetlelm_fas-bul_heritage,step-10387,bul,7.905481815338135,2712.10893313323
226,"След като вокалистът Стивън Тайлър беше ранен след падне от сцената по време на представление на 5 август, турнето беше отменено.",BeetleLM/beetlelm_fas-bul_heritage,step-10387,bul,7.086415767669678,1195.6147505189208
227,"След прекъсване на равенството, след като и двамата държаха всеки сервис, Мъри загуби първия сет.",BeetleLM/beetlelm_fas-bul_heritage,step-10387,bul,7.864917755126953,2604.2962265311075
228,"Дел Потро имаше ранното предимство във втория сет, но това също изискваше тайбрек след като достигна 6-6.",BeetleLM/beetlelm_fas-bul_heritage,step-10387,bul,7.815742492675781,2479.3271520131443
229,"В този момент Потро получи лечение на своето рамо, но успя да се върне към играта.",BeetleLM/beetlelm_fas-bul_heritage,step-10387,bul,5.669363498687744,289.8499857689457
230,Програмата започна в 20:30 ч. местно време (15.00 UTC).,BeetleLM/beetlelm_fas-bul_heritage,step-10387,bul,7.011236667633057,1109.025152718737
231,"Известни певци от цялата страна изпълниха бхаджани, които представляват молитвени песни в краката на Шри Шиам.",BeetleLM/beetlelm_fas-bul_heritage,step-10387,bul,7.172934055328369,1303.6640192364925
232,"Вечерта започна певецът Санджу Шарма, следван от Джей Шанкар Чодри, който представи и чхапан бхог бхаджан, придружаван от певец Раджу Кханделвал.",BeetleLM/beetlelm_fas-bul_heritage,step-10387,bul,8.116270065307617,3348.507708113602
233,Тогава Лакха Сингх пое водачеството в пеенето на бхаджаните.,BeetleLM/beetlelm_fas-bul_heritage,step-10387,bul,7.24249267578125,1397.5733297997322
234,"На Баба Шиам са сервирани 108 блюда от Чхапан Бхог (в Хиндуизма, 56 различни ядливи артикула, като сладки, плодове, ядки, ястия и т.н., предлагани на божеството).",BeetleLM/beetlelm_fas-bul_heritage,step-10387,bul,8.180135726928711,3569.3390833789754
235,"Лакха Сингх представи и Чапан Бхог Бхаджан, придружаван от певеца Раджу Канделвал.",BeetleLM/beetlelm_fas-bul_heritage,step-10387,bul,7.819399833679199,2488.4114990183602
236,"На основното представяне на Токио Гейм Шоу в четвъртък, президентът на Нинтендо Сатору Ивата разкри дизайна на контролера за новата конзола на компанията „Нинтендо Революшън“.",BeetleLM/beetlelm_fas-bul_heritage,step-10387,bul,7.793292045593262,2424.2853177218244
237,"Подобно на дистанционното за телевизор, контролерът използва два сензора, поставени близо до телевизора на потребителя, за да предаде триъгълна форма на позицията си в триизмерното пространство.",BeetleLM/beetlelm_fas-bul_heritage,step-10387,bul,7.294376373291016,1471.9986369318608
238,"Това ще осигури на играчите контрол над действията и движенията във видеоигрите, движейки устройството във въздуха.",BeetleLM/beetlelm_fas-bul_heritage,step-10387,bul,7.650374889373779,2101.433246762686
239,Джанкарло Фишичела приключи състезанието много скоро след началото поради загуба на контрол над колата си.,BeetleLM/beetlelm_fas-bul_heritage,step-10387,bul,8.258672714233398,3860.9660927278223
240,"Съотборникът му Фернандо Алонсо беше първи през по - голямата част от състезанието, но това приключи веднага след пит - стопа, вероятно заради лошо завита предна дясна гума.",BeetleLM/beetlelm_fas-bul_heritage,step-10387,bul,7.347615718841553,1552.4905375939957
241,Михаел Шумахер прекъсна надпреварата скоро след Алонсо заради щети по окачването в многобройните битки по време на състезанието.,BeetleLM/beetlelm_fas-bul_heritage,step-10387,bul,7.389943599700928,1619.6147636006049
242,"„Тя е много сладка и пее доста добре“, казва той в записки от пресконференцията.",BeetleLM/beetlelm_fas-bul_heritage,step-10387,bul,7.078243255615234,1185.883393536968
243,"""Трогвах се от дъното на сърцето си всеки път, когато репетирахме.",BeetleLM/beetlelm_fas-bul_heritage,step-10387,bul,6.146620750427246,467.1361469601113
244,"В рамките на около три минути след изстрелване, камерата на борда разкрива голям брой парчета изолационна пяна, които са се откъснали от резервоара за гориво.",BeetleLM/beetlelm_fas-bul_heritage,step-10387,bul,7.147994518280029,1271.5533194587283
245,"Смята се обаче, че не са повредили совалката.",BeetleLM/beetlelm_fas-bul_heritage,step-10387,bul,5.783817291259766,324.99743541237785
246,"Ръководителят на совалката на НАСА – Н. Уейн Хейл младши каза, че пяната се е спуснала „след времето, за което става въпрос“.",BeetleLM/beetlelm_fas-bul_heritage,step-10387,bul,7.339939117431641,1540.6183140110352
247,"След пет минути се вижда как започва да духа вятър, около минута по-късно вятърът достига 70 км/ч... тогава започва дъждът, но е толкова силен и капките са толкова едри, че удрят кожата ти като игла, след това от небето пада градушка, хората се паникьосват и крещят и се прегазват един друг.",BeetleLM/beetlelm_fas-bul_heritage,step-10387,bul,6.873246192932129,966.0795617994031
248,"Арманд Версаче каза: „Загубих сестра си и приятелката й и по пътя ми имаше двама инвалиди в инвалидни колички, като хората просто ги прескачаха и ги бутаха“.",BeetleLM/beetlelm_fas-bul_heritage,step-10387,bul,6.851116180419922,944.9350362482987
249,"АЕЦ „Кашивазаки Карива“ в префектура Ниигата функционира нормално, съобщи също NHK.",BeetleLM/beetlelm_fas-bul_heritage,step-10387,bul,8.231276512145996,3756.6260715206067
250,Hokuriku Electric Power Co. не докладва щети от земетресението или че реактори 1 и 2 в ядрената централа в Шика са затворени.,BeetleLM/beetlelm_fas-bul_heritage,step-10387,bul,7.30028772354126,1480.725906000907
251,"Съобщават, че около 9400 домове в района са без вода и около 100 са без електричество.",BeetleLM/beetlelm_fas-bul_heritage,step-10387,bul,7.289179801940918,1464.3691317908604
252,"Някои пътища са повредени, в засегнатите райони железопътните услуги са прекъснати, а в префектура Ишикава остава затворено летище „Ното“.",BeetleLM/beetlelm_fas-bul_heritage,step-10387,bul,8.105745315551758,3313.4503112043553
253,Пред офиса на губернатора избухна една бомба.,BeetleLM/beetlelm_fas-bul_heritage,step-10387,bul,7.8352556228637695,2528.1816878139252
254,В рамките на два часа избухнаха още три бомби близо до правителствени сгради.,BeetleLM/beetlelm_fas-bul_heritage,step-10387,bul,7.1041412353515625,1216.996522262
255,"Някои доклади посочват официално 8 загинали, а официалните доклади потвърждават до 30 ранени, но крайните бройки още не са известни.",BeetleLM/beetlelm_fas-bul_heritage,step-10387,bul,7.530439853668213,1863.9251776016233
256,"Циануровата киселина и меламин са открити в проби от урината на домашни любимци, починали след консумация на заразена животинска храна.",BeetleLM/beetlelm_fas-bul_heritage,step-10387,bul,7.636600017547607,2072.6847312728078
257,"Изследователи от университета потвърдиха, че двете съединения реагират помежду си, образувайки кристали, които могат да блокират бъбречната функция.",BeetleLM/beetlelm_fas-bul_heritage,step-10387,bul,7.34475564956665,1548.0566507420544
258,"Изследователите наблюдавали кристали, образувани в котешката урина чрез добавяне на меламин и цианурова киселина.",BeetleLM/beetlelm_fas-bul_heritage,step-10387,bul,8.106324195861816,3315.368957627609
259,Съставът на тези кристали съвпада с този в урината на засегнатите домашни любимци при сравнение с инфрачервена спектроскопия (FTIR).,BeetleLM/beetlelm_fas-bul_heritage,step-10387,bul,7.71353006362915,2238.4301284353824
260,"Не знам дали го осъзнавате, но повечето от стоките от Централна Америка пристигат в тази държава без мито.",BeetleLM/beetlelm_fas-bul_heritage,step-10387,bul,6.625538349151611,754.1100778167634
261,"Въпреки това, 80% от нашите стоки са били обложени с тарифи в страните от Централна Америка.",BeetleLM/beetlelm_fas-bul_heritage,step-10387,bul,7.232381343841553,1383.513205037279
262,Това не ми се стори логично; със сигурност не беше справедливо.,BeetleLM/beetlelm_fas-bul_heritage,step-10387,bul,5.761377334594727,317.7857249010105
263,"Всичко, което казвам на хората, е да се отнасят с нас така, както ние с тях.",BeetleLM/beetlelm_fas-bul_heritage,step-10387,bul,4.635364532470703,103.06548186293628
264,"Губернаторът на Калифорния, Арнолд Шварценегер, подписа закон, който забранява продажбата или даването под наем на видеоигри с насилие на непълнолетни.",BeetleLM/beetlelm_fas-bul_heritage,step-10387,bul,7.6463704109191895,2093.0349292658434
265,"Законопроектът изисква видеоигрите, продавани в щата Калифорния, които съдържат насилие, да бъдат обозначени с надпис ""18"", а продажбата им на непълнолетни лица да се наказва с глоба от 1000 долара за всяко нарушение.",BeetleLM/beetlelm_fas-bul_heritage,step-10387,bul,7.441400051116943,1705.1358280959075
266,"Директорът на Обществената прокуратурата, Кийър Стармер, направи изявление тази сутрин, обявявайки наказателното преследване както на Хюн, така и на Прайс.",BeetleLM/beetlelm_fas-bul_heritage,step-10387,bul,7.597765922546387,1993.7367535953858
267,"Хюн подаде оставка и ще бъде заменен от депутата Ед Дейви в Кабинета. Мястото на министър по търговията, което Дейви освобождава, се очаква да заеме депутатът Норман Ламб.",BeetleLM/beetlelm_fas-bul_heritage,step-10387,bul,7.26932954788208,1435.5876375397752
268,На 16 февруари Хюхн и Прайс трябва да се явят в съда на магистратите в Уестминстър.,BeetleLM/beetlelm_fas-bul_heritage,step-10387,bul,7.143495559692383,1265.8455029749716
269,Жертвите са Николас Алден на 25 г. и Закари Кудебак на 21 г. Кудебак е шофирал.,BeetleLM/beetlelm_fas-bul_heritage,step-10387,bul,7.470657825469971,1755.7612902652495
270,"Едгар Вегила е получил рани по ръцете и челюстта, докато на Кристофер Шнайдер е била необходима операция за реконструкция на лицето.",BeetleLM/beetlelm_fas-bul_heritage,step-10387,bul,7.8288984298706055,2512.160527662668
271,"Оръжието на Ука не гръмна, докато бе насочено към главата на пети човек. Шнайдер има постоянна болка, слепота в едното око, липсваща част от черепа и лице, повторно изградено от титан.",BeetleLM/beetlelm_fas-bul_heritage,step-10387,bul,7.377716541290283,1599.9322143358027
272,Шнайдер свидетелства чрез видеовръзка от американска база на военновъздушните сили в родината си.,BeetleLM/beetlelm_fas-bul_heritage,step-10387,bul,7.651740550994873,2104.305054009216
273,Карпанедо се състезава в две индивидуални състезания на шампионата с изключение на събитието в сряда.,BeetleLM/beetlelm_fas-bul_heritage,step-10387,bul,7.0070648193359375,1104.408105530508
274,"Първият й беше слаломът, в който стигна до „незавършила“ на първия си пробег. 36 от 116 - те състезатели имаха същия резултат в онова бягане.",BeetleLM/beetlelm_fas-bul_heritage,step-10387,bul,7.4049482345581055,1644.0997263252316
275,"На другото състезание, Гигантския слалом, тя финишира на десето място в женска група за седящи с комбинирано време на бягане 4:41.30, 2:11.60 минути по-бавно от австрийката Клаудия Лоеш, която финишира първа, и 1:09.02 минути по-бавно от финиширалата на девето място унгарка Гьонги Дани.",BeetleLM/beetlelm_fas-bul_heritage,step-10387,bul,6.967199802398682,1061.24688499505
276,"Четири жени от групата на седящите ски не звършиха кръговете си, а 45 от общо 117 скиори в Големия слалом не успяха да се класират на състезанието.",BeetleLM/beetlelm_fas-bul_heritage,step-10387,bul,7.147397041320801,1270.7938225614632
277,Полицията в Мадия Прадеш е открила откраднатия лаптоп и мобилен телефон.,BeetleLM/beetlelm_fas-bul_heritage,step-10387,bul,8.074993133544922,3213.1053059662427
278,"Заместник - главният инспектор Д. К. Ария заяви, че са арестували петимата души, изнасилили швейцарката, и са върнали мобилния телефон и лаптопа ѝ.",BeetleLM/beetlelm_fas-bul_heritage,step-10387,bul,7.745655059814453,2311.5072035378635
279,"Баба Канжар, Бута Канжар, Рампро Канжар, Газа Канжар и Вишну Канжар са имената на обвиняемите.",BeetleLM/beetlelm_fas-bul_heritage,step-10387,bul,7.778568744659424,2388.8533135335206
280,"Чандра Шекхар Соланки, началник на полицията, заяви, че обвиняемите са се явили в съда с покрити лица.",BeetleLM/beetlelm_fas-bul_heritage,step-10387,bul,7.23650598526001,1389.2314857275153
281,"Въпреки че в къщата е имало трима души, когато колата се е ударила в нея, никой от тях не е пострадал.",BeetleLM/beetlelm_fas-bul_heritage,step-10387,bul,5.533790111541748,253.10137787778908
282,Обаче шофьорът е получил сериозни травми по главата.,BeetleLM/beetlelm_fas-bul_heritage,step-10387,bul,7.230846881866455,1381.3918845911182
283,"Временно е затворен пътят, където е станала катастрофата, за да могат аварийните служби да извадят шофьора от червеното Ауди ТТ.",BeetleLM/beetlelm_fas-bul_heritage,step-10387,bul,7.81229305267334,2470.789595116431
284,Първо е приет в болница „Джеймс Паджет“ в Грейт Ярмут.,BeetleLM/beetlelm_fas-bul_heritage,step-10387,bul,6.9195146560668945,1011.8287903783275
285,След това той е прехвърлен в болницата Аденбрук в Кеймбридж.,BeetleLM/beetlelm_fas-bul_heritage,step-10387,bul,7.107630729675293,1221.2506427663936
286,"Адекоя оттогава е в Единбургския шерифски съд, обвинена в убийството на сина си.",BeetleLM/beetlelm_fas-bul_heritage,step-10387,bul,7.302194118499756,1483.551446845684
287,"Тя е в ареста, очаквайки обвинителен акт и процес, но всяко свидетелско показание може да бъде опорочено, защото образът й е бил широко разпространен.",BeetleLM/beetlelm_fas-bul_heritage,step-10387,bul,7.008208274841309,1105.6716693357732
288,"Това е обичайна практика на други места в Обединеното кралство, но шотландското правосъдие работи по различен начин и съдилищата разглеждат публикуването на снимки като потенциално предубедено.",BeetleLM/beetlelm_fas-bul_heritage,step-10387,bul,7.89796781539917,2691.806518469574
289,"Професор Памела Фъргюсън от Университета в Дънди отбелязва, че „изглежда, журналистите се движат по опасна линия, ако разпространят снимки и т.н. на заподозрени.“",BeetleLM/beetlelm_fas-bul_heritage,step-10387,bul,7.731113910675049,2278.1384306754676
290,"Кралската прокуратура, която отговаря за наказателното преследване, посочи на журналистите, че до повдигането на обвинение няма да се правят повече коментари.",BeetleLM/beetlelm_fas-bul_heritage,step-10387,bul,6.848005771636963,942.0004682312015
291,"Според изтеклата информация, документът ще се отнася до спора за границите, които Палестина иска въз основа на границите преди войната за Близкия изток от 1967 г.",BeetleLM/beetlelm_fas-bul_heritage,step-10387,bul,7.122702121734619,1239.7959910720203
292,"Предполага се, че другите отразени теми са за бъдещата държава Йерусалим, свещена и за двете страни, както и въпроса за долината Йордан.",BeetleLM/beetlelm_fas-bul_heritage,step-10387,bul,6.703560829162598,815.3038200919897
293,"След подписване на споразумението, Израел изисква постоянно военно присъствие в долината в продължение на десет години, докато Пенсилвания се съгласи да реализира такова присъствие само за пет години.",BeetleLM/beetlelm_fas-bul_heritage,step-10387,bul,7.572139739990234,1943.293979898298
294,"Стрелците в допълнителния тест за контрол на вредителите е трябвало да бъдат надзиравани отблизо от рейнджъри, тъй като тестъ е бил наблюдаван и ефикасността му оценявана.",BeetleLM/beetlelm_fas-bul_heritage,step-10387,bul,6.974363803863525,1068.8769575260062
295,В рамките на ловната програма на Асоциацията на спортните стрелци на Австралия бяха наети квалифицирани доброволци в партньорство с NPWS и Асоциацията на спортните стрелци (NSW) Inc.,BeetleLM/beetlelm_fas-bul_heritage,step-10387,bul,7.14672327041626,1269.9378870427558
296,"Според Мик О'Флин, изпълняващ длъжността директор на „Опазване и наследство“ в Националната служба за парковете и дивата природа NPWS, четиримата стрелци, избрани за първата стрелба, са получили подробни инструкции за безопасност и обучение.",BeetleLM/beetlelm_fas-bul_heritage,step-10387,bul,8.153459548950195,3475.3815445004607
297,Мартели се закле пред състоящия се от девет члена нов временен избирателен съвет вчера.,BeetleLM/beetlelm_fas-bul_heritage,step-10387,bul,8.582992553710938,5340.062060541388
298,Това е петият временен избирателен съвет на Мартели за четири години.,BeetleLM/beetlelm_fas-bul_heritage,step-10387,bul,7.948893070220947,2832.4379046861113
299,Миналия месец комисия към президента препоръча оставката на предишната избирателна комисия (CEP) като част от пакет с мерки за отиване на страната към нови избори.,BeetleLM/beetlelm_fas-bul_heritage,step-10387,bul,7.789913654327393,2416.1089526354176
300,"Отговорът на Мартели на широко разпространените протести срещу режима, които започнаха през октомври, беше комисията.",BeetleLM/beetlelm_fas-bul_heritage,step-10387,bul,7.415224552154541,1661.0821260912544
301,"Насилствените протести понякога бяха предизвиквани от неуспеха да се проведат избори, някои от които се очакват от 2011 година насам.",BeetleLM/beetlelm_fas-bul_heritage,step-10387,bul,7.126154899597168,1244.0841299594326
302,"Съобщено е за около 60 случая на неправилно функциониращи iPod устройства. Съобщава се за прегряване, причинило общо шест пожара и нанесло леки изгаряния на четирима души.",BeetleLM/beetlelm_fas-bul_heritage,step-10387,bul,7.9834065437316895,2931.901723133226
303,"Японското министерство на икономиката, търговията и промишлеността (МЕТИ) заяви, че е било наясно с 27 инцидента, свързани с тези устройства.",BeetleLM/beetlelm_fas-bul_heritage,step-10387,bul,7.110301971435547,1224.5172595021872
