sentence_id,sentence,repo,revision,iso_code,nll,ppl
0,"'Inmiddels hebben we muizen van 4 maanden oud die geen diabetes hebben, maar dat eerder wel hebben,' voegde hij er nog aan toe.",BeetleLM/beetlelm_nld-fra_balanced,step-8000,nld,6.225422382354736,505.43648482914136
1,"Professor Ehud Ur in de geneeskunde aan Dalhousie University in Halifax, Nova Scotia, tevens voorzitter van de klinische en wetenschappelijke divisie van de Canadian Diabetes Association, herinnerde eraan dat ze nog maar net zijn begonnen met het onderzoek.",BeetleLM/beetlelm_nld-fra_balanced,step-8000,nld,7.073882102966309,1180.7228362024032
2,"Net als sommige andere deskundigen, is hij sceptisch over de vraag of zijn diabetes kan worden genezen, waarbij hij opmerkt dat deze bevindingen geen waarde hebben voor mensen die al type 1-diabetes hebben.",BeetleLM/beetlelm_nld-fra_balanced,step-8000,nld,6.77752161026001,877.890271453921
3,"Op maandag kondigde Sara Danius, de permanente secretaris van de nobelcommissie voor literatuur bij de Zweedse Academie, tijdens een radioprogramma op Sveriges Radio in Zweden aan dat de commissie Bob Dylan niet direct kon bereiken om hem te vertellen dat hij de Nobelprijs voor literatuur van 2016 had gewonnen en geen moeite meer zou doen om hem te bereiken.",BeetleLM/beetlelm_nld-fra_balanced,step-8000,nld,7.272955417633057,1440.8023395316034
4,"Danius verklaarde, 'We doen momenteel niks. Ik heb met zijn naaste medewerker gebeld en gemailed en vriendelijke antwoorden gekregen. Op dit moment is dat genoeg.'",BeetleLM/beetlelm_nld-fra_balanced,step-8000,nld,6.967423915863037,1061.4847513645152
5,"Eerder merkte Jamie Siminoff, de CEO van Ring, op dat het bedrijf is opgericht toen zijn deurbel van de winkel niet hoorbaar was in zijn garage.",BeetleLM/beetlelm_nld-fra_balanced,step-8000,nld,6.754042625427246,857.5183904741859
6,Hij zei dat hij daarop een wifi-deurbel maakte.,BeetleLM/beetlelm_nld-fra_balanced,step-8000,nld,7.113588333129883,1228.5480858667477
7,"Siminoff zei dat de verkoop steeg nadat hij in 2013 in een aflevering van Shark Tank verscheen, waarbij het panel van het programma de start-up niet wilde financieren.",BeetleLM/beetlelm_nld-fra_balanced,step-8000,nld,6.72034215927124,829.1011475987858
8,Eind 2017 was Siminoff te zien op teleshoppingkanaal QVC.,BeetleLM/beetlelm_nld-fra_balanced,step-8000,nld,7.542477130889893,1886.497342839319
9,Ring trof ook een schikking in een rechtszaak met de ADT Corporation. Dat is een concurrerend beveiligingsbedrijf.,BeetleLM/beetlelm_nld-fra_balanced,step-8000,nld,6.780604839324951,880.6011852913017
10,"Eén experimenteel vaccin lijkt in staat te zijn de ebola-sterfte terug te dringen, maar tot nu toe zijn nog geen medicijnen duidelijk geschikt voor de behandeling van bestaande infecties.",BeetleLM/beetlelm_nld-fra_balanced,step-8000,nld,7.173980712890625,1305.02922336685
11,"Een cocktail van antilichamen, ZMapp, was aanvankelijk veelbelovend in het veld. Officiële onderzoeken toonden echter aan dat het minder voordelen had dan gewenst bij het voorkomen dat mensen overlijden.",BeetleLM/beetlelm_nld-fra_balanced,step-8000,nld,7.220065593719482,1366.5786967481192
12,"ZMapp was een controle in de PALM-proef, dus gebruikten wetenschappers het als baseline en vergeleken de drie andere behandelmethoden hiermee.",BeetleLM/beetlelm_nld-fra_balanced,step-8000,nld,7.220035552978516,1366.5376443281052
13,Het Amerikaanse Olympisch Comité heeft de steun van USA Gymnastics en begrijpt dat het noodzakelijk is dat de olympische familie een veilige plek promoot voor alle sporters.,BeetleLM/beetlelm_nld-fra_balanced,step-8000,nld,7.126112937927246,1244.0319272070813
14,"Wij sluiten ons aan bij de verklaring van het USOC dat het het beste is voor onze atleten en clubs, en hun sport, om zinvolle veranderingen door te voeren in onze organisatie in plaats van certificeringen af te nemen.",BeetleLM/beetlelm_nld-fra_balanced,step-8000,nld,6.4833574295043945,654.1635714948336
15,"USA Gymnastics steunt een onafhankelijk onderzoek dat meer duidelijkheid kan geven over hoe misbruik op deze schaal, dat zo moedig door de slachtoffers van Larry Nassar is beschreven, zo lang onopgemerkt kon blijven, en omarmt alle nodige en toepasselijke veranderingen.",BeetleLM/beetlelm_nld-fra_balanced,step-8000,nld,7.085190773010254,1194.1510255454846
16,"USA Gymnastics en de USOC hebben hetzelfde doel: zorgen dat atleten hun dromen in een veilige, positieve en krachtige omgeving kunnen najagen door de sport turnen en andere sporten zo veilig mogelijk maken.",BeetleLM/beetlelm_nld-fra_balanced,step-8000,nld,6.989047527313232,1084.6878484636459
17,Gedurende de jaren 60 werkte Brzezinksi als adviseur voor John F. Kennedy en daarna voor de regering van Lyndon B. Johnson.,BeetleLM/beetlelm_nld-fra_balanced,step-8000,nld,6.510443210601807,672.1242441770191
18,Hij adviseerde tijdens de selecties van 1976 Carter op het gebied van buitenlands beleid. Vervolgens volgde hij Henry Kissinger op als National Security Advisor (NSA); deze functie vervulde hij van 1977 tot 1981.,BeetleLM/beetlelm_nld-fra_balanced,step-8000,nld,6.776083946228027,876.6290669979957
19,"Als NSA stond hij Carter bij in de diplomatieke afhandeling van wereldwijde kwesties, zoals de Camp David-akkoorden in 1978, het stabiliseren van de relatie tussen de VS en China aan het eind van de jaren '70 en de Iraanse Revolutie, de daarop volgende gijzelaarscrisis en de invasie van Afghanistan door de Sovjet-Unie in 1979.",BeetleLM/beetlelm_nld-fra_balanced,step-8000,nld,6.193109035491943,489.3651973036828
20,De film met Ryan Gosling en Emma Stone in de hoofdrollen werd voor alle belangrijke categorieën genomineerd.,BeetleLM/beetlelm_nld-fra_balanced,step-8000,nld,7.272510528564453,1440.1614848859108
21,Gosling en Stone werden respectievelijk genomineerd voor Beste acteur en Beste actrice.,BeetleLM/beetlelm_nld-fra_balanced,step-8000,nld,8.566765785217285,5254.109363000027
22,"Onder de overige nominaties bevonden zich onder meer de categorieën beste film, regisseur, cinematografie, kostuumontwerp, filmmontage, originele muziek, productieontwerp, muziek, geluidseffecten en origineel scenario.",BeetleLM/beetlelm_nld-fra_balanced,step-8000,nld,7.655141353607178,2111.4735625663675
23,"De nummers Audition (The Fools Who Dream) en City of Stars uit de film werden genomineerd voor Beste originele nummer. Lionsgate haalde 26 nominaties binnen, een record voor een studio.",BeetleLM/beetlelm_nld-fra_balanced,step-8000,nld,7.660398006439209,2122.6020697726512
24,In een verklaring van zijn perssecretaris liet de Amerikaanse president Donald Trump zondagavond weten dat de Amerikaanse troepen zich uit Syrië zouden terugtrekken.,BeetleLM/beetlelm_nld-fra_balanced,step-8000,nld,7.645634174346924,2091.494527523518
25,De aankondiging kwam na een telefonisch overleg tussen Trump en de Turkse president Recep Tayyip Erdoğan.,BeetleLM/beetlelm_nld-fra_balanced,step-8000,nld,7.843234539031982,2548.434527969448
26,"Ook gaven de Turken volgens het communiqué aan dat zij de gevangen strijders van ISIS zouden gaan bewaken, waarvan Europa ze niet terug wilde nemen.",BeetleLM/beetlelm_nld-fra_balanced,step-8000,nld,7.279370307922363,1450.0746370570894
27,"Dit bewijst niet alleen de al wijdverspreide theorie dat in elk geval bepaalde dinosauriërs veren hadden, maar biedt ook meer details dan fossielen, zoals de kleur en driedimensionale plaatsing.",BeetleLM/beetlelm_nld-fra_balanced,step-8000,nld,7.160040378570557,1286.9628975789074
28,. Volgens wetenschappers was het verenkleed van dit dier kastanjebruin met een bleke of carotenoïdekleurige onderzijde.,BeetleLM/beetlelm_nld-fra_balanced,step-8000,nld,8.261868476867676,3873.3245607463487
29,De vondst geeft ook inzicht in de evolutie van veren bij vogels.,BeetleLM/beetlelm_nld-fra_balanced,step-8000,nld,6.3957600593566895,599.2986527107196
30,"De onderzoekers trokken de conclusie dat de rachis waarschijnlijk een latere evolutionaire ontwikkeling was, doordat dinosaurusveren geen goed ontwikkelde schacht, oftewel een rachis, hebben, maar wel over andere kenmerken van veren beschikken - zoals weerhaken.",BeetleLM/beetlelm_nld-fra_balanced,step-8000,nld,7.166574954986572,1295.4001920272028
31,"De structuur van de veren lijkt erop te wijzen dat deze niet gebruikt werden om te vliegen, maar om de temperatuur te regelen of om hoe het eruit zag. De onderzoekers suggereerden dat dit de staart van een jonge dinosaurus is, maar dat dit monster juist volwassen veren laat zien en dus niet het dons van een kuiken.",BeetleLM/beetlelm_nld-fra_balanced,step-8000,nld,6.164577007293701,475.5999250821025
32,"De onderzoekers suggereerden dat, ondanks dat het om de staart van een jonge dinosaurus gaat, het monster het verenkleed van een volwassene had en niet het dons van een kuiken.",BeetleLM/beetlelm_nld-fra_balanced,step-8000,nld,6.703369140625,815.1475506730251
33,"Gistermorgen ontplofte een autobom bij het hoofdbureau van de politie in Gaziantep, Turkije. Hierbij kwamen twee politieagenten om het leven en raakten meer dan twintig andere personen gewond.",BeetleLM/beetlelm_nld-fra_balanced,step-8000,nld,6.740245342254639,845.7682130788289
34,"Onder de gewonden zijn negentien politieagenten, zei de gouverneur.",BeetleLM/beetlelm_nld-fra_balanced,step-8000,nld,7.405171871185303,1644.467448359328
35,De politie verdenkt een vermeende Daesh-militair (ISIS) van de aanval.,BeetleLM/beetlelm_nld-fra_balanced,step-8000,nld,6.786497592926025,885.8056704109798
36,Hieruit bleek dat de zon dezelfde basisprincipes als andere sterren volgt: alle sterrenactiviteit in het stelsel is uitsluitend gebaseerd de helderheid en rotatie van de sterren.,BeetleLM/beetlelm_nld-fra_balanced,step-8000,nld,6.997962474822998,1094.401015554108
37,De helderheid en rotatie worden gebruikt om het getal van Rossby van een ster te bepalen. Dit is verwant aan de plasmastroming.,BeetleLM/beetlelm_nld-fra_balanced,step-8000,nld,6.023187160491943,412.8924553949274
38,"Hoe kleiner het aantal Rossby-golven, hoe minder actief de ster is als het gaat om magnetische omkeringen.",BeetleLM/beetlelm_nld-fra_balanced,step-8000,nld,6.715737342834473,825.2920657985727
39,Iwasaki raakte tijdens zijn tocht op verschillende momenten in de problemen.,BeetleLM/beetlelm_nld-fra_balanced,step-8000,nld,6.617772579193115,748.2765128081289
40,"Piraten beroofden hem, een hondsdolle hond viel hem aan in Tibet, hij ontsnapte in Nepal aan het huwelijk en werd in India gearresteerd.",BeetleLM/beetlelm_nld-fra_balanced,step-8000,nld,6.884861946105957,977.3667311114214
41,"De 802.11n-norm is compatibel met beide frequenties: 2,4 Ghz en 5,0 Ghz.",BeetleLM/beetlelm_nld-fra_balanced,step-8000,nld,7.132194995880127,1251.6212574618053
42,"Mits het basisstation over dubbele radio's beschikt, maakt dit achterwaartse compatibiliteit met 802.11a, 802.11b en 802.11g mogelijk.",BeetleLM/beetlelm_nld-fra_balanced,step-8000,nld,6.97686243057251,1071.5510213931868
43,Snelheden van 802.11n zijn substantieel sneller dan die van voorlopers met een maximale theoretische capaciteit van 600Mbit/s.,BeetleLM/beetlelm_nld-fra_balanced,step-8000,nld,7.373674392700195,1593.4781036164497
44,"Duvall is getrouwd met twee kinderen en maakte geen grote indruk op Miller, aan wie het verhaal verwant was.",BeetleLM/beetlelm_nld-fra_balanced,step-8000,nld,6.429184436798096,619.6683631581594
45,"Op een verzoek om commentaar reageerde Millar: 'Mike praat veel tijdens de zitting ... Ik was me aan het voorbereiden, dus luisterde niet echt naar hem.'",BeetleLM/beetlelm_nld-fra_balanced,step-8000,nld,6.962052345275879,1055.7981976309604
46,"'We doen ons uiterste best de koolstofdioxide-uitstoot per eenheid van het BBP in 2020 met een aanzienlijke marge te verminderen in vergelijking met het niveau van 2005,' zei Hu.",BeetleLM/beetlelm_nld-fra_balanced,step-8000,nld,6.853469371795654,947.1612675730879
47,"Hij heeft voor de bezuinigingen geen cijfers vastgesteld, omdat hij zegt dat deze zullen worden bepaald op basis van de economische productie van China.",BeetleLM/beetlelm_nld-fra_balanced,step-8000,nld,6.137338638305664,462.8201984147431
48,Hu spoorde ontwikkelingslanden aan 'de oude manier van eerst vervuilen en later opruimen te vermijden'.,BeetleLM/beetlelm_nld-fra_balanced,step-8000,nld,7.350135803222656,1556.4078786914592
49,"Hij voegde toe dat 'ze daarentegen niet gevraagd zouden moeten worden om verplichtingen aan te gaan die buiten hun ontwikkeling, niveau, verantwoordelijkheid en mogelijkheden liggen.'",BeetleLM/beetlelm_nld-fra_balanced,step-8000,nld,6.6971659660339355,810.1066989045839
50,De Irakese studiegroep presenteerde hun rapport vandaag om 12.00 uur GMT.,BeetleLM/beetlelm_nld-fra_balanced,step-8000,nld,7.692159652709961,2191.1014743836363
51,"De waarschuwing is dat niemand kan garanderen dat geen enkele handelswijze in Irak op dit moment een einde zal maken aan sektarische oorlogsvoering, toenemend geweld of de neiging naar chaos.",BeetleLM/beetlelm_nld-fra_balanced,step-8000,nld,7.1216230392456055,1238.4588704895557
52,In het begin van het rapport staat een pleidooi voor een open discussie en voor consensusvorming in de VS over het beleid met betrekking tot het Midden-Oosten.,BeetleLM/beetlelm_nld-fra_balanced,step-8000,nld,6.123808860778809,456.6005144437994
53,In het rapport wordt sterke kritiek geuit op vrijwel elk onderdeel van het huidige bestuursbeleid jegens Irak en raadt dringend een andere koers aan.,BeetleLM/beetlelm_nld-fra_balanced,step-8000,nld,7.498871326446533,1806.002876002392
54,"Het rapport bevat 78 aanbevelingen, waarvan de eerste is dat dit jaar nog diplomatieke actie moet worden ondernomen om de Iraakse grenzen te beschermen tegen vijandelijke machten en de diplomatieke verstandhoudingen met omliggende landen te herstellen.",BeetleLM/beetlelm_nld-fra_balanced,step-8000,nld,7.248194694519043,1405.5650820211604
55,"Cristina Fernández de Kirchner, senator en de vrouw van de Argentijnse president, heeft gisteravond in La Plata, een stad op 50 km (31 mijl) afstand van Buenos Aires, aangekondigd zich verkiesbaar te willen stellen als president.",BeetleLM/beetlelm_nld-fra_balanced,step-8000,nld,6.814679145812988,911.1241308879452
56,"Mevrouw Kirchner kondigde haar intentie om voor het presidentschap te gaan aan in het Argentijnse Theater, waar ze in 2005 haar campagne voor de senaat startte als lid van de deelstaatafvaardiging van Buenos Aires.",BeetleLM/beetlelm_nld-fra_balanced,step-8000,nld,6.762640476226807,864.9229918682071
57,Het debat ontstond door een discussie over het investeren en opnieuw opbouwen na de orkaan Katrina. Enkele fiscale conservatieven noemden dit gekscherend 'De New Orleans Deal van Bush.',BeetleLM/beetlelm_nld-fra_balanced,step-8000,nld,7.306662082672119,1490.194731485437
58,Liberale kritiek op de reconstructiewerkzaamheden is gericht op het toekennen van reconstructiecontracten aan vermeende insiders uit Washington.,BeetleLM/beetlelm_nld-fra_balanced,step-8000,nld,7.379134654998779,1602.202709671391
59,De begrafenis werd door meer dan vier miljoen mensen bijgewoond in Rome.,BeetleLM/beetlelm_nld-fra_balanced,step-8000,nld,5.889845848083496,361.34957734884796
60,Er waren zo veel aanwezigen dat niet iedereen toegang kon krijgen tot de begrafenis op het Sint-Pietersplein.,BeetleLM/beetlelm_nld-fra_balanced,step-8000,nld,6.880040645599365,972.6658935766682
61,Op verschillende plekken in Rome waren grote televisieschermen geplaatst zodat mensen de ceremonie konden zien.,BeetleLM/beetlelm_nld-fra_balanced,step-8000,nld,7.410734176635742,1653.6399651312106
62,"Soortgelijke opstellingen werden in veel andere Italiaanse steden en in de rest van de wereld gemaakt, en dan vooral in Polen. Hier keek een groot aantal mensen naar.",BeetleLM/beetlelm_nld-fra_balanced,step-8000,nld,5.56762170791626,261.81069591099873
63,"Historici hebben kritiek geuit op eerdere beleidsregels van de FBI, omdat ze hun middelen focusten op gemakkelijk op te lossen zaken, voornamelijk zaken met gestolen auto's, om op deze manier de succesratio van het bureau op te krikken.",BeetleLM/beetlelm_nld-fra_balanced,step-8000,nld,6.796734809875488,894.9204305198165
64,Vanaf boekjaar 2005 financierde het Congres het initiatief tegen obsceniteit en verklaarde dat de FBI tien agenten moet inzetten op volwassenenpornografie.,BeetleLM/beetlelm_nld-fra_balanced,step-8000,nld,7.886260032653809,2660.4752005771343
65,"Robin Uthappa behaalde de hoogste score van de inning met 70 runs met slechts 41 ballen, door 11 vieren en 2 zessen te slaan.",BeetleLM/beetlelm_nld-fra_balanced,step-8000,nld,7.071728229522705,1178.182445463434
66,In de middelste orde presteerden de slagmannen Sachin Tendulkar en Rahul Dravid goed en maakten samen honderd runs.,BeetleLM/beetlelm_nld-fra_balanced,step-8000,nld,7.9236626625061035,2761.8683345571912
67,"Maar nadat India de wicket van de captain verloor, scoorden ze nog maar 36 runs waarbij ze 7 wickets verloren om de innings te beëindigen.",BeetleLM/beetlelm_nld-fra_balanced,step-8000,nld,7.413736343383789,1658.611927643673
68,President van de Verenigde Staten George W. Bush arriveerde op 16 november in de ochtend in Singapore voor een rondreis van een week door Azië.,BeetleLM/beetlelm_nld-fra_balanced,step-8000,nld,6.015318393707275,409.6562501266627
69,"Hij werd ontvangen door Wong Kan Seng, de vicepremier van Singapore, en besprak problemen op het gebied van handel en terrorisme met de Minister-president van Singapore, Lee Hsien Loong.",BeetleLM/beetlelm_nld-fra_balanced,step-8000,nld,6.704730987548828,816.258413097977
70,Bush sprak na de verliezen in de tussentijdse verkiezingen deze week voor een publiek over toenemende handelsbetrekkingen met Azië.,BeetleLM/beetlelm_nld-fra_balanced,step-8000,nld,7.220063209533691,1366.5754385744922
71,"Premier Stephen Harper is akkoord gegaan om de 'Clean Air Act' van de overheid naar een commissie voor alle partijen te sturen voor herziening, voorafgaand aan de tweede lezing, na de 25 minuten durende vergadering met NDP-leider Jack Layton bij PMO op dinsdag.",BeetleLM/beetlelm_nld-fra_balanced,step-8000,nld,6.916887283325195,1009.1738283099913
72,"Tijdens de vergadering met de Minister-president vroeg Layton om veranderingen in de milieuwet van de conservatieven, waarbij hij vroeg om het 'grondig en volledig herschrijven' van de milieuwet van de conservatieve partij.",BeetleLM/beetlelm_nld-fra_balanced,step-8000,nld,6.957953929901123,1051.4799530895248
73,"Sinds de federale regering de financiering heeft overgenomen van het Mersey ziekenhuis in Devonport, Tasmanië, hebben de overheid en enkele federale parlementsleden deze wet bekritiseerd als stunt tijdens de beginperiode van de federale verkiezingen die in november worden gehouden.",BeetleLM/beetlelm_nld-fra_balanced,step-8000,nld,7.391075134277344,1621.4484509507624
74,"Minister-president John Howard heeft echter verklaard met de wet slechts te willen voorkomen dat de voorzieningen van het ziekenhuis werden teruggeschaald door de Tasmaanse overheid, door 45 miljoen Australische dollars extra uit te trekken.",BeetleLM/beetlelm_nld-fra_balanced,step-8000,nld,6.748950958251953,853.1632890056516
75,Volgens het laatste bulletin wees de stand van de zeespiegel op een vloedgolf. Er is enige duidelijke tsunami-activiteit geregistreerd nabij Pago Pago en Niue.,BeetleLM/beetlelm_nld-fra_balanced,step-8000,nld,7.114879131317139,1230.1349174282664
76,"Er is in Tonga geen grote schade of ernstig letsel doorgegeven, hoewel de stroom voor enige tijd uitviel. Hierdoor leken de Tongaanse autoriteiten de tsunami-waarschuwing van het PTWC niet te kunnen ontvangen.",BeetleLM/beetlelm_nld-fra_balanced,step-8000,nld,7.308835983276367,1493.4377904794312
77,"De waarschuwingen werden ingetrokken, maar toch waren veertien scholen in Hawaï aan of nabij kustlijnen woensdag de hele dag gesloten.",BeetleLM/beetlelm_nld-fra_balanced,step-8000,nld,7.482381343841553,1776.4661195909848
78,"George W. Bush, de leider van de VS, juichte de bekendmaking toe.",BeetleLM/beetlelm_nld-fra_balanced,step-8000,nld,6.20308256149292,494.2703138167446
79,"Een woordvoerder van Bush, Gordon Johndroe, beschreef de belofte van Noord-Korea 'een grote vooruitgang in ons doel om het Koreaanse schiereiland te denucleariseren.'",BeetleLM/beetlelm_nld-fra_balanced,step-8000,nld,6.814753532409668,911.1919088320487
80,"De tiende storm van het Atlantische orkaanseizoen die een naam kreeg, subtropische storm Jerry, vormde zich vandaag boven de Atlantische Oceaan.",BeetleLM/beetlelm_nld-fra_balanced,step-8000,nld,6.838911056518555,933.4720827340371
81,Volgens de NHC (National Hurricane Center) levert Jerry momenteel geen gevaar voor het vasteland op.,BeetleLM/beetlelm_nld-fra_balanced,step-8000,nld,7.2894392013549805,1464.7490375571545
82,Volgens berekeningen van het U.S. Corps of Engineers kan 6 inches regen mogelijk de eerder beschadigde dijken doen doorbreken.,BeetleLM/beetlelm_nld-fra_balanced,step-8000,nld,7.2687883377075195,1434.810893113818
83,"In de Ninth Ward stond het water tijdens de orkaan Katrina op meer dan 20 voet hoogte. Nog steeds staat het water hier tot aan de middel, omdat de nabije dijk het water niet kon tegenhouden.",BeetleLM/beetlelm_nld-fra_balanced,step-8000,nld,6.108191013336182,449.5247948451442
84,Het water stroomt over een stuk van 100 voet breed over de dijk.,BeetleLM/beetlelm_nld-fra_balanced,step-8000,nld,5.607574462890625,272.4825193552547
85,De Commons-beheerder Adam Cuerden uitte vorige maand tijdens zijn gesprek met Wikinews zijn frustraties over de verwijdering.,BeetleLM/beetlelm_nld-fra_balanced,step-8000,nld,7.8033599853515625,2448.816156550915
86,"'Hij [Wales] loog in principe al tegen ons vanaf het begin. Allereerst door te doen alsof het om juridische redenen ging. Ten tweede door net te doen alsof hij naar ons luisterde, tot hij de kunst verwijderde.'",BeetleLM/beetlelm_nld-fra_balanced,step-8000,nld,7.090106964111328,1200.036154546919
87,De ergernissen binnen de gemeenschap resulteerde in de huidige pogingen om een beleid op te stellen met betrekking tot seksuele inhoud van de site die miljoenen stukken media-inhoud met een open licentie host.,BeetleLM/beetlelm_nld-fra_balanced,step-8000,nld,7.875535488128662,2632.095268763
88,"Het voltooide werk was voornamelijk theoretisch van aard, maar het programma is geschreven voor de simulatie van waarnemingen van het Sagittarius Galaxy.",BeetleLM/beetlelm_nld-fra_balanced,step-8000,nld,6.720012664794922,828.8280083517506
89,Het team was op zoek naar het effect dat zou worden veroorzaakt door de getijdenkrachten tussen de donkere materie van het heelal en die van de melkweg.,BeetleLM/beetlelm_nld-fra_balanced,step-8000,nld,6.101780414581299,446.65228883406525
90,"Vergelijkbaar met hoe de maan kracht uitoefent op de aarde, wat leidt tot getijden, oefent de Melkweg kracht uit op het sterrenstelsel Sagittarius.",BeetleLM/beetlelm_nld-fra_balanced,step-8000,nld,6.933877944946289,1026.4668532973958
91,De onderzoekers concludeerden dat donkere materie andere donkere materie op dezelfde manier beïnvloedt als gewone materie.,BeetleLM/beetlelm_nld-fra_balanced,step-8000,nld,8.074769020080566,3212.385286490827
92,"Volgens deze theorie bevindt het grootste deel van de donkere materie in een sterrenstelsel zich rondom, in een soort kring, en bestaat het uit een grote hoeveelheid kleinere deeltjes.",BeetleLM/beetlelm_nld-fra_balanced,step-8000,nld,6.187314510345459,486.53775810714797
93,Op televisiebeelden zie je witte rook van de plant af komen.,BeetleLM/beetlelm_nld-fra_balanced,step-8000,nld,6.049978733062744,424.1040105554737
94,"Lokale autoriteiten geven de volgende waarschuwing: inwoners die in de buurt van de fabriek wonen, moeten binnen blijven, airconditioners uitschakelen en geen kraanwater drinken.",BeetleLM/beetlelm_nld-fra_balanced,step-8000,nld,6.607585430145264,740.69240425379
95,Het Japanse agentschap voor kernenergie meldt dat er bij de fabriek radioactief cesium en jodium is waargenomen,BeetleLM/beetlelm_nld-fra_balanced,step-8000,nld,7.676675796508789,2157.4360818835653
96,De autoriteiten vermoeden dat dit erop duidt dat er op de plek containers met uraniumbrandstof mogelijk gescheurd zijn en lekken.,BeetleLM/beetlelm_nld-fra_balanced,step-8000,nld,7.396604537963867,1630.438927072411
97,XDR-TB (Extremely Drug Resistant Tuberculosis) werd door Dr. Tony Moll ontdekt in de provincie KwaZulu-Natal van Zuid-Afrika.,BeetleLM/beetlelm_nld-fra_balanced,step-8000,nld,7.186267852783203,1321.1632173350208
98,Hij verklaarde in een interview dat de nieuwe variant 'heel erg verontrustend en zorgwekkend is vanwege het erg hoge sterftecijfer'.,BeetleLM/beetlelm_nld-fra_balanced,step-8000,nld,7.435378551483154,1694.8992041753927
99,"Dokter Moll denkt dat sommige patiënten de ziekte hebben opgelopen in het ziekenhuis, waaronder ook twee zorgmedewerkers uit het ziekenhuis.",BeetleLM/beetlelm_nld-fra_balanced,step-8000,nld,6.7249040603637695,832.8920653513743
100,Een besmette persoon kan in een jaar tijd mogelijk 10 tot 15 nauwe contacten infecteren.,BeetleLM/beetlelm_nld-fra_balanced,step-8000,nld,7.674046516418457,2151.7710289163892
101,Het percentage XDR-TB onder alle tuberculosepatiënten lijkt echter nog steeds aan de lage kant: 6000 uit 330.000 geïnfecteerde mensen in totaal op een willekeurig moment in Zuid-Afrika.,BeetleLM/beetlelm_nld-fra_balanced,step-8000,nld,6.824278354644775,919.912314012533
102,"De satellieten, die beide meer dan 1.000 pond wogen en zich met ongeveer 17.500 mijl per uur voortbewogen, kwamen 491 mijl boven aarde in botsing.",BeetleLM/beetlelm_nld-fra_balanced,step-8000,nld,6.720003604888916,828.8204992819157
103,Wetenschappers zeggen dat door de botsing een enorme explosie is ontstaan.,BeetleLM/beetlelm_nld-fra_balanced,step-8000,nld,6.4853363037109375,655.4593605922828
