sentence_id,sentence,repo,revision,iso_code,nll,ppl
437,In deze periode in de geschiedenis van Europa lag de rijke en machtige katholieke kerk onder vuur.,BeetleLM/beetlelm_nld-ind_balanced,step-2444,nld,7.6873321533203125,2180.5494238548695
438,"Al meer dan duizend jaar verbond het christendom Europese staten, ondanks taalverschillen en verschillen in gewoonten.",BeetleLM/beetlelm_nld-ind_balanced,step-2444,nld,8.138504981994629,3423.7954040786817
439,"Van de koning tot de gewone burger, zijn allesdoordringende macht had invloed op iedereen.",BeetleLM/beetlelm_nld-ind_balanced,step-2444,nld,7.495615005493164,1800.1315157003503
440,Een van de belangrijkste principes van het christendom is dat welvaart moet worden gebruikt om lijden en armoede te bestrijden en de kerk beschikt om deze reden over geldmiddelen.,BeetleLM/beetlelm_nld-ind_balanced,step-2444,nld,7.606021404266357,2010.264137812503
441,De kerk was al meer dan duizend jaar de centrale autoriteit in Rome en deze verhouding van macht en geld leidde ertoe dat veel mensen begonnen te twijfelen of dit principe werd nageleefd.,BeetleLM/beetlelm_nld-ind_balanced,step-2444,nld,8.078741073608398,3225.170427623776
442,"Groot-Brittannië stelde een blokkade op zee in gericht tegen Duitsland, vlak na het uitbreken van de vijandelijkheden.",BeetleLM/beetlelm_nld-ind_balanced,step-2444,nld,7.9234185218811035,2761.194132599217
443,"De strategie bleek effectief, want het was niet meer mogelijk om vitale voorzieningen aan militairen en burgers te leveren. Deze blokkade schond echter wel de algemeen aanvaarde internationale wet die in de afgelopen twee eeuwen werd vastgelegd in verschillende internationale overeenkomsten.",BeetleLM/beetlelm_nld-ind_balanced,step-2444,nld,8.063422203063965,3176.140956221321
444,"Groot-Brittannië heeft mijnen geplaatst in internationale wateren, zodat er in hele delen van de oceaan geen schepen meer konden varen, wat zelfs voor neutrale schepen gevaarlijk was.",BeetleLM/beetlelm_nld-ind_balanced,step-2444,nld,8.004140853881836,2993.3272905588424
445,"Vanwege de beperkte reactie op deze tactiek, verwachtte Duitsland dat er een vergelijkbare reactie zou komen op de ongeremde onderzeese oorlogsvoering van het land.",BeetleLM/beetlelm_nld-ind_balanced,step-2444,nld,7.743738651275635,2307.0816533310135
446,Tijdens de jaren 20 hadden de meeste burgers en naties een houding van pacifisme en isolement.,BeetleLM/beetlelm_nld-ind_balanced,step-2444,nld,7.705565929412842,2220.6737713175817
447,Na de Eerste Wereldoorlog wilden staten voorkomen dat er ooit nog zulke verschrikkingen zouden plaatsvinden.,BeetleLM/beetlelm_nld-ind_balanced,step-2444,nld,8.828560829162598,6826.455307308784
448,Tesla emigreerde in 1884 naar de Verenigde Staten van Amerika om te gaan werken bij de Edison Company in New York City.,BeetleLM/beetlelm_nld-ind_balanced,step-2444,nld,7.581451416015625,1961.4738148677252
449,"Toen hij naar de Verenigde Staten kwam, had hij alleen 4 cent, een dichtbundel en een aanbevelingsbrief van Charles Batchelor (zijn vorige baas) voor Thomas Edison bij zich.",BeetleLM/beetlelm_nld-ind_balanced,step-2444,nld,7.756992816925049,2337.8636398765643
450,Het oude China had een unieke manier om verschillende tijdsperiodes weer te geven; iedere fase van China of iedere regerende familie had een onderscheidende dynastie.,BeetleLM/beetlelm_nld-ind_balanced,step-2444,nld,8.462423324584961,4733.514953225926
451,"Ook tussen de verschillende dynastieën was er een onstabiele periode waarin de provincies verdeeld waren. De bekendste was het tijdperk van de Drie Koninkrijken, dit heeft plaatsgevonden in de 60 jaar tussen de Han- en de Jin-dynastie in.",BeetleLM/beetlelm_nld-ind_balanced,step-2444,nld,7.480433940887451,1773.0099905520278
452,Er vonden in die tijd hevige oorlogen plaats tussen verschillende edelen die om de troon vochten.,BeetleLM/beetlelm_nld-ind_balanced,step-2444,nld,7.807777404785156,2459.6575324529476
453,In de geschiedenis van het oude China staat het tijdperk van de Drie Koninkrijken als een van de bloederigste te boek. Duizenden mensen stierven in de strijd om de hoogste plek in het grote paleis in Xi'an.,BeetleLM/beetlelm_nld-ind_balanced,step-2444,nld,6.955510139465332,1048.9134936585094
454,"De Revolutie heeft grote sociale en politieke gevolgen gehad, zoals het gebruik van het metrieke stelsel, een verschuiving van de absolute monarchie naar republicanisme, nationalisme en de opvatting dat het land aan zijn inwoners toebehoort in plaats van een enkele leider.",BeetleLM/beetlelm_nld-ind_balanced,step-2444,nld,7.679760456085205,2164.101312452664
455,"Voor alle mannelijke sollicitanten waren na de revolutie functies te verkrijgen, zodat de meest ambitieuze en geschikte kandidaten konden slagen.",BeetleLM/beetlelm_nld-ind_balanced,step-2444,nld,8.774405479431152,6466.598269404433
456,Hetzelfde geldt voor het leger. De legerrangen worden niet meer gebaseerd op iemands klasse maar op het kaliber van de persoon.,BeetleLM/beetlelm_nld-ind_balanced,step-2444,nld,6.822412967681885,918.1979210752154
457,De Franse Revolutie inspireerde ook in andere landen de onderdrukte arbeidersklasse tot een revolutie.,BeetleLM/beetlelm_nld-ind_balanced,step-2444,nld,8.274933815002441,3924.2628945067654
458,Mohammed hield zich intensief bezig met bovenaardse kwesties. Hij ging vaak voor bezinning naar een grot die later bekend werd als de Grot van Hira in het Gebergte van Noer.,BeetleLM/beetlelm_nld-ind_balanced,step-2444,nld,7.918996810913086,2749.0118832594967
459,"De grot zelf, die de tand des tijds heeft doorstaan, geeft een zeer levendig beeld van de spiritualiteit van Mohammed.",BeetleLM/beetlelm_nld-ind_balanced,step-2444,nld,7.702693462371826,2214.3041117988455
460,De grot bevindt zich op een van bergtoppen aan de noordzijde van Mekka en is compleet afgesloten van de rest van de wereld.,BeetleLM/beetlelm_nld-ind_balanced,step-2444,nld,6.898042678833008,990.3344148160614
461,"Zelfs als bekend was dat de grot bestond, was deze helemaal niet makkelijk te vinden. Eenmaal binnen in de grot heerst totale isolatie.",BeetleLM/beetlelm_nld-ind_balanced,step-2444,nld,7.427961349487305,1682.3743017025158
462,"Het enige wat te zien is, zijn de heldere, prachtige lucht en de vele omringende bergen. Er is vanuit de grot heel weinig van deze wereld te zien of te horen.",BeetleLM/beetlelm_nld-ind_balanced,step-2444,nld,6.871542453765869,964.4350155489769
463,De Grote Piramide van Gizeh staat als enige van de zeven wereldwonderen nog overeind.,BeetleLM/beetlelm_nld-ind_balanced,step-2444,nld,7.358895778656006,1570.1018653969275
464,De Grote Piramide is in de derde eeuw voor Christus door de Egyptenaren gebouwd en behoort tot de talloze grote piramidestructuren ter ere van een overleden farao.,BeetleLM/beetlelm_nld-ind_balanced,step-2444,nld,7.729022979736328,2273.379977080661
465,"Het Plateau van Gizeh of 'piramides van Gizeh' in de Egyptische vallei van de doden bevat verschillende piramides (waarvan de Grote Piramide de grootste is), meerdere kleine tombes, een aantal tempels en de grote sfinx.",BeetleLM/beetlelm_nld-ind_balanced,step-2444,nld,7.521925449371338,1848.1223364187388
466,"De grote piramide werd gebouwd om farao Khufu te eren. Veel van de kleinere piramides, tombes en tempels werden gebouwd als eerbetoon aan de vrouwen en familieleden van Khufu.",BeetleLM/beetlelm_nld-ind_balanced,step-2444,nld,7.719714164733887,2252.3156972941283
467,Het up-bow teken ziet eruit als een V en het down-bow teken ziet eruit als een nietje of een vierkantje waarvan de onderkant ontbreekt.,BeetleLM/beetlelm_nld-ind_balanced,step-2444,nld,7.310132026672363,1495.374605492156
468,Boven betekent dat je bij de punt moet beginnen en de strijkstok moet wegduwen. Onder betekent dat je bij de boogkikker moet beginnen (de plek waar je hand de strijkstok vasthoudt) en de strijkstok moet aantrekken.,BeetleLM/beetlelm_nld-ind_balanced,step-2444,nld,7.250680446624756,1409.0633144515386
469,"Een opwaartse beweging geeft meestal een zachter geluid, terwijl een neerwaartse beweging juist een sterker en assertiever geluid produceert.",BeetleLM/beetlelm_nld-ind_balanced,step-2444,nld,8.232329368591309,3760.583342346128
470,"Neem de vrijheid om je persoonlijke tekens te schetsen, maar vergeet daarbij niet dat de gedrukte strijktekens er om een muzikale reden zijn, waardoor ze dus meestal moeten worden gerespecteerd.",BeetleLM/beetlelm_nld-ind_balanced,step-2444,nld,7.988829612731934,2947.8448196625654
471,"Een groep marktvrouwen zat op 6 oktober 1789 achter het vertrek van de doodsbange Louis XVI, Marie Antoinette en hun twee jonge kinderen (Marie Therese van 11 en Louis-Charles van 4), en de zus van de koning, Madame Elizabeth, uit Versailles naar Parijs.",BeetleLM/beetlelm_nld-ind_balanced,step-2444,nld,7.895370006561279,2684.822794823043
472,"Zij reden terug naar de Franse hoofdstad in een rijtuig, omgeven door joelende en dreigende meutes die het Koningspaar bedreigden.",BeetleLM/beetlelm_nld-ind_balanced,step-2444,nld,7.8739118576049805,2627.8251859998127
473,Door de acties van de menigte mensen werden de koning en koningin gedwongen om de ramen van hun koets helemaal te openen.,BeetleLM/beetlelm_nld-ind_balanced,step-2444,nld,7.286412239074707,1460.3220010868333
474,Op een gegeven moment hield iemand in de menigte het hoofd van een koninklijke wacht die vermoord was in Versailles omhoog voor de ogen van een doodsbange koningin.,BeetleLM/beetlelm_nld-ind_balanced,step-2444,nld,7.26743221282959,1432.8664291325329
475,De oorlogskosten van het imperialisme van de V.S. met betrekking tot de verovering van de Filippijnen zijn betaald door de bevolking van de Filippijnen.,BeetleLM/beetlelm_nld-ind_balanced,step-2444,nld,7.192564487457275,1329.50834499749
476,Ze werden opgelegd aan het Amerikaanse koloniale regime belasting te betalen om een groot deel van de kosten te financieren en de rente op obligaties werd via de banken op Wall Street uitgegeven in de naam van de Filipijnse overheid.,BeetleLM/beetlelm_nld-ind_balanced,step-2444,nld,7.454779148101807,1728.102298446868
477,Het Amerikaanse imperialisme rustte voor een groot deel op de enorme winst van de langdurige uitbuiting van de Filipijnen.,BeetleLM/beetlelm_nld-ind_balanced,step-2444,nld,7.6563005447387695,2113.9225831619283
478,Om de Tempeliers te begrijpen moet men weten wat de context was die de aanzet gaf tot het ontstaan van de orde.,BeetleLM/beetlelm_nld-ind_balanced,step-2444,nld,7.351944446563721,1559.225412626172
479,"Het tijdperk waarin dit gebeurd is, wordt algemeen aangeduid als de Hoge Middeleeuwen, de Europese geschiedenis in de 11e, 12e en 13e eeuw (1000-1300 n.Chr.).",BeetleLM/beetlelm_nld-ind_balanced,step-2444,nld,7.487183570861816,1785.0176299038794
480,"Na de vroege middeleeuwen kwamen de hoge middeleeuwen. Deze werden weer opgevolgd door de late middeleeuwen, die gebruikelijk rond 1500 eindigen.",BeetleLM/beetlelm_nld-ind_balanced,step-2444,nld,8.041133880615234,3106.133178527027
481,Technologisch determinisme is een term voor een groot assortiment ideeën in de praktijk: van technologieaanbod of de technologische verplichting tot een strikt gevoel dat het menselijke lot wordt gedreven door een onderliggende logica die is gekoppeld aan wetenschappelijke wetten en de verschijning daarvan in technologie.,BeetleLM/beetlelm_nld-ind_balanced,step-2444,nld,8.109884262084961,3327.1929252366267
482,"De meeste interpretaties van technologisch determinisme hebben deze twee algemene opvattingen: de ontwikkeling van de technologie volgt een traject dat voor het grootste deel verder reikt dan culturele of politieke invloed, en dat technologie op zijn beurt 'effecten' heeft op samenlevingen die inherent zijn in plaats van die sociaal geconditioneerd zijn.",BeetleLM/beetlelm_nld-ind_balanced,step-2444,nld,7.974639415740967,2906.309713603852
483,Zo zullen sommigen bijvoorbeeld zeggen dat de komst van de auto automatisch leidt tot de aanleg van wegen.,BeetleLM/beetlelm_nld-ind_balanced,step-2444,nld,7.3711066246032715,1589.3916701309058
484,"Een landelijk wegennetwerk is echter economisch niet haalbaar voor maar een paar auto's. Daarom worden nieuwe productiemethoden ontwikkeld, zodat de kosten van autobezit kunnen worden verlaagd.",BeetleLM/beetlelm_nld-ind_balanced,step-2444,nld,7.737091541290283,2291.7970832232645
485,Het massale autobezit zorgt ook voor een groter aantal ongevallen op de weg en dit leidt tot de ontwikkeling van nieuwe technieken op het gebied van gezondheidszorg om het menselijk lichaam te kunnen herstellen.,BeetleLM/beetlelm_nld-ind_balanced,step-2444,nld,7.8100810050964355,2465.330131502309
486,"In de romantiek was een groot onderdeel van cultureel determinisme opgenomen, dat was afkomstig van schrijvers zoals Goethe, Fichte en Schlegel.",BeetleLM/beetlelm_nld-ind_balanced,step-2444,nld,8.126649856567383,3383.445529117047
487,In de Romantiek vormde de geografie het individu en na verloop van tijd ontstonden er gewoonten en culturen naar aanleiding van deze geografie. Deze vormden een harmonieuze samenleving en waren beter dan de arbitraire opgelegde wetten.,BeetleLM/beetlelm_nld-ind_balanced,step-2444,nld,7.900618553161621,2698.951256887769
488,"Constantinopel werd als modehoofdstad van het feodale Europa gezien, zoals Parijs de huidige modehoofdstad is.",BeetleLM/beetlelm_nld-ind_balanced,step-2444,nld,8.010163307189941,3011.408857446853
489,Het stond vanaf ongeveer 400 na Christus tot ongeveer 1100 na Christus bekend als een epicentrum van luxe.,BeetleLM/beetlelm_nld-ind_balanced,step-2444,nld,8.482166290283203,4827.897203635961
490,"De status van het rijk nam in de 12e eeuw af, voornamelijk doordat de kruisvaarders terugkwamen met zijde en specerijen die meer waard waren dan wat de Byzantijnse markten konden bieden.",BeetleLM/beetlelm_nld-ind_balanced,step-2444,nld,7.848177909851074,2561.063574160685
491,Rond deze tijd nam Parijs ook de titel van modehoofdstad over van Constantinopel.,BeetleLM/beetlelm_nld-ind_balanced,step-2444,nld,7.391246318817139,1621.726041616577
492,"De gotiek vierde zijn hoogtijdagen in de 10e, 11e en 14e eeuw.",BeetleLM/beetlelm_nld-ind_balanced,step-2444,nld,7.452335357666016,1723.8843345869038
493,Kleding was in het begin sterk beïnvloed door de Byzantijnse cultuur uit het oosten.,BeetleLM/beetlelm_nld-ind_balanced,step-2444,nld,7.55047082901001,1901.6378668694106
494,Vanwege de langzame communicatiekanalen liepen stijlen in het westen echter met 25 tot 30 jaar achter.,BeetleLM/beetlelm_nld-ind_balanced,step-2444,nld,8.432400703430176,4593.514532564629
495,Aan het einde van de middeleeuwen begon er in West-Europa een eigen stijl te ontplooien. Een van de grootste ontwikkelingen was het resultaat van de kruistochten: mensen begonnen knopen te gebruiken om hun kleding te bevestigen.,BeetleLM/beetlelm_nld-ind_balanced,step-2444,nld,7.383678436279297,1609.4993329274669
496,Zelfvoorzienende landbouw is landbouw waarbij voldoende voedsel wordt geproduceerd om aan de behoeften van de boer en zijn gezin te voldoen.,BeetleLM/beetlelm_nld-ind_balanced,step-2444,nld,7.722451686859131,2258.489908512606
497,"Landbouw met als doel levensonderhoud is een simpel systeem dat meestal biologisch is. Hierbij wordt opgeslagen zaad gebruikt dat afkomstig is uit de ecoregio, en dat wordt gecombineerd met wisselende gewassen of andere relatief eenvoudige technieken om de opbrengst te optimaal te maken.",BeetleLM/beetlelm_nld-ind_balanced,step-2444,nld,8.114154815673828,3341.4322642134607
498,Vroeger werkten de meeste boeren in de zelfvoorzienende landbouw. In veel ontwikkelingslanden is dit nog steeds het geval.,BeetleLM/beetlelm_nld-ind_balanced,step-2444,nld,7.244391918182373,1400.2301825314148
499,Subculturen zorgen ervoor dat gelijkgestemde personen die zich verwaarloosd voelen door maatschappelijke normen worden samengebracht. Hierdoor krijgen ze de mogelijkheid een gevoel van identiteit te ontwikkelen.,BeetleLM/beetlelm_nld-ind_balanced,step-2444,nld,8.543675422668457,5134.18000754829
500,"Subculturen kunnen zich onderscheiden door middel van de leeftijd, etniciteit, sociale klasse, locatie en/of geslacht van hun leden.",BeetleLM/beetlelm_nld-ind_balanced,step-2444,nld,7.902585029602051,2704.263902832837
501,"Een subcultuur kan worden bepaald door de volgende soorten kwaliteiten: taalkundig, esthetisch, religieus, politiek, seksueel, geografisch of een of meer van deze factoren samen.",BeetleLM/beetlelm_nld-ind_balanced,step-2444,nld,7.6740193367004395,2151.7125451813745
502,"Leden van een subcultuur laten vaak zien tot welke groep ze behoren door middel van een bepaalde symbolische stijl in wat ze dragen, in hoe ze zich gedragen en het jargon dat ze spreken.",BeetleLM/beetlelm_nld-ind_balanced,step-2444,nld,7.670795917510986,2144.7878402822644
503,"Een van de meest gebruikte methoden voor het illustreren van het belang van de vermaatschappelijking waren de paar betreurenswaardige gevallen van kinderen die door verwaarlozing, tegenslagen of moedwillig misbruik tijdens het opgroeien niet werden gesocialiseerd door volwassenen.",BeetleLM/beetlelm_nld-ind_balanced,step-2444,nld,7.888661861419678,2666.872886442164
504,"Ze worden 'wolfskinderen' of 'wilde kinderen' genoemd. Sommige wolfskinderen zijn door mensen (meestal hun eigen ouders) opgesloten geweest; soms werd dit kind in de steek gelaten, omdat de ouders de ernstige verstandelijke of lichamelijke beperking van het kind niet wilden accepteren.",BeetleLM/beetlelm_nld-ind_balanced,step-2444,nld,7.815145015716553,2477.846253610818
505,Onhandelbare kinderen hebben mogelijk ernstige kindermishandeling of een ernstig trauma meegemaakt voordat ze werden verlaten of voordat ze wegliepen.,BeetleLM/beetlelm_nld-ind_balanced,step-2444,nld,9.005302429199219,8146.164070163815
506,"Van anderen wordt beweerd dat zij zijn grootgebracht door dieren, en van sommigen wordt gezegd dat zij alleen in de wildernis hebben gewoond.",BeetleLM/beetlelm_nld-ind_balanced,step-2444,nld,7.637139320373535,2073.8028374774585
507,"Een verwilderd kind dat niet is grootgebracht door mensen, kan gedrag vertonen dat lijkt op het gedrag van het dier dat het kind verzorgd heeft (binnen de fysieke limieten), zoals angst voor of onverschilligheid richting mensen.",BeetleLM/beetlelm_nld-ind_balanced,step-2444,nld,7.813436508178711,2473.616448964371
508,"Leren op projectbasis moet educatie vereenvoudigen en interessanter maken, maar scaffolding gaat nog een stapje verder.",BeetleLM/beetlelm_nld-ind_balanced,step-2444,nld,8.381683349609375,4366.35284162957
509,"Scaffolding is geen leermethode maar een hulpmiddel om individuen te ondersteunen die te maken hebben met een nieuwe leerervaring, bijvoorbeeld een nieuw computerprogramma of die aan een nieuw project beginnen.",BeetleLM/beetlelm_nld-ind_balanced,step-2444,nld,7.783442974090576,2400.5255561460913
510,"Ondersteuning kan zowel virtueel als echt zijn. Een docent is bijvoorbeeld een vorm van ondersteuning, maar het paperclipmannetje van Microsoft Office is dat ook.",BeetleLM/beetlelm_nld-ind_balanced,step-2444,nld,7.83709716796875,2532.841737954919
511,"Er is sprake van virtuele scaffolding die is ingebouwd in de software die vragen stelt, geheugensteuntjes biedt en procedures verklaart die mogelijk zonder hulp moeilijk te begrijpen kunnen zijn voor studenten.",BeetleLM/beetlelm_nld-ind_balanced,step-2444,nld,8.2711763381958,3909.545235644504
512,"Er zijn verschillende redenen dat kinderen in de pleegzorg terechtkomen, zoals verwaarlozing, misbruik en uitbuiting.",BeetleLM/beetlelm_nld-ind_balanced,step-2444,nld,7.466028690338135,1747.652417008743
513,"Geen enkel kind zou moeten opgroeien in een omgeving waar ze niet goed worden verzorgd, waar men niet om ze geeft en waar ze zich niet kunnen ontwikkelen, maar toch gebeurt dit.",BeetleLM/beetlelm_nld-ind_balanced,step-2444,nld,7.17012357711792,1300.0052437793552
514,Het pleegzorgsysteem beschouwen wij als een veilige zone voor deze kinderen.,BeetleLM/beetlelm_nld-ind_balanced,step-2444,nld,8.299612998962402,4022.3154523191606
515,"Het is de bedoeling dat de pleegzorg zorgt voor een veilig thuis, liefhebbende verzorgers, stabiel onderwijs en betrouwbare gezondheidszorg.",BeetleLM/beetlelm_nld-ind_balanced,step-2444,nld,7.768642902374268,2365.2592216303474
516,In de pleegzorg moet aan alle behoeften worden voldoen die werden verwaarloosd in het eerdere thuis.,BeetleLM/beetlelm_nld-ind_balanced,step-2444,nld,7.5340495109558105,1870.6654664502528
517,Op internet worden onderdelen van interpersoonlijke en massacommunicatie samengevoegd.,BeetleLM/beetlelm_nld-ind_balanced,step-2444,nld,8.765427589416504,6408.801695227781
518,De verschillende karakters van het internet leiden tot nieuwe dimensies wat betreft de toepassing van de Uses & Gratifications-theorie.,BeetleLM/beetlelm_nld-ind_balanced,step-2444,nld,8.257555961608887,3856.6567553903697
519,"'Leren' en 'socialisatie' worden bijvoorbeeld voorgesteld als belangrijke redenen om het internet te gebruiken (James et al., 1995).",BeetleLM/beetlelm_nld-ind_balanced,step-2444,nld,8.16734790802002,3523.9856255062746
520,Eighmey en McCord (1998) introduceerden nieuwe motivatieaspecten als 'persoonlijke betrokkenheid' en 'aanhoudende relaties' toen zij reacties van het publiek op websites onderzochten.,BeetleLM/beetlelm_nld-ind_balanced,step-2444,nld,8.456029891967773,4703.348082017498
521,"Dat er video-opnames worden gebruikt, leidde tot opmerkelijke vondsten in het interpreteren van micro-expressies, dat zijn gezichtsbewegingen die een paar milliseconden duren.",BeetleLM/beetlelm_nld-ind_balanced,step-2444,nld,8.410673141479492,4494.785119745365
522,Er wordt met name gesteld dat niemand een leugen kan herkennen door op enkel op micro-expressies te letten.,BeetleLM/beetlelm_nld-ind_balanced,step-2444,nld,7.801703453063965,2444.7629715639587
523,"Oliver Sacks beschreef in zijn essay The President's Speech hoe het kan dat mensen die spraak niet kunnen begrijpen vanwege hersenbeschadiging, de oprechtheid ervan toch nauwkeurig kunnen inschatten.",BeetleLM/beetlelm_nld-ind_balanced,step-2444,nld,8.05506420135498,3149.705392813789
524,"Hij suggereerde zelfs dat andere diersoorten, zoals huishonden, ook over het vermogen om het gedrag van mensen te interpreteren beschikken.",BeetleLM/beetlelm_nld-ind_balanced,step-2444,nld,8.081372261047363,3233.6676295046072
525,Uit onderzoek in de twintigste eeuw is gebleken dat er twee groepen genetische varianten bestaan: verborgen en zichtbaar.,BeetleLM/beetlelm_nld-ind_balanced,step-2444,nld,7.9279022216796875,2773.6022946248418
526,Door mutatie wordt er nieuwe genetische variatie toegevoegd; door selectie wordt deze variatie geëlimineerd uit de pool van uitgedrukte variatie.,BeetleLM/beetlelm_nld-ind_balanced,step-2444,nld,8.93916130065918,7624.79945891191
527,Voor elke generatie wordt er door middel van scheiding en hercombinatie gevarieerd tussen de twee groepen.,BeetleLM/beetlelm_nld-ind_balanced,step-2444,nld,8.379396438598633,4356.378790469963
528,Een primaat met een spijsverteringssysteem dat lijkt op dat van de mens kan op de savanne maar moeilijk de benodigde aminozuren halen uit de plantaardige bronnen die daar te vinden zijn.,BeetleLM/beetlelm_nld-ind_balanced,step-2444,nld,7.469302177429199,1753.3827085361456
529,"Verder kan het niet in acht nemen serieuze gevolgen hebben: groeiachterstand, ondervoeding en uiteindelijk zelfs de dood.",BeetleLM/beetlelm_nld-ind_balanced,step-2444,nld,7.92989444732666,2779.133444070176
530,"De gemakkelijkst te vinden plantaardige bronnen zijn de eiwitten in bladeren en peulvruchten, maar tenzij ze gekookt zijn, zijn ze voor primaten zoals wij moeilijk verteerbaar.",BeetleLM/beetlelm_nld-ind_balanced,step-2444,nld,8.07143783569336,3201.7020425855667
531,"Niet alleen is dierlijk voedsel (mieren, termieten, eieren) licht verteerbaar, maar het bevat ook heel erg veel proteïnen die alle essentiële aminozuren bevatten.",BeetleLM/beetlelm_nld-ind_balanced,step-2444,nld,8.183722496032715,3582.164465617551
532,Al met al moeten we er niet versteld van staan als onze voorouders hun 'proteïneprobleem' oplosten op dezelfde manier als chimpansees op de savanne dit probleem vandaag de dag oplossen.,BeetleLM/beetlelm_nld-ind_balanced,step-2444,nld,7.812485694885254,2471.265619338916
533,Slaaponderbreking houdt in dat je met een reden wakker wordt tijdens je normale slaapperiode en dat je binnen korte tijd (10–60 minuten) weer in slaap valt.,BeetleLM/beetlelm_nld-ind_balanced,step-2444,nld,7.658393383026123,2118.3513139726974
534,Dit is vrij gemakkelijk door gebruik te maken van een relatief zachte wekker die je terugbrengt naar je bewustzijn zonder dat je meteen helemaal wakker wordt.,BeetleLM/beetlelm_nld-ind_balanced,step-2444,nld,7.601085662841797,2000.3664401649278
535,"Als je in je slaap je klok uitzet, kun je deze aan de andere kant van de kamer plaatsen. Op deze manier moet je je bed uitkomen om hem uit te zetten.",BeetleLM/beetlelm_nld-ind_balanced,step-2444,nld,6.346887111663818,570.7133740096472
536,"Andere opties op basis van het bioritme zijn bijvoorbeeld veel vloeistof drinken voordat je gaat slapen (en dan met name water of thee, een bekend diureticum). Hierdoor moet je wel opstaan om te plassen.",BeetleLM/beetlelm_nld-ind_balanced,step-2444,nld,7.596444129943848,1991.1031880002672
537,De hoeveelheid innerlijke kalmte waarover een persoon beschikt staat tegenover de hoeveelheid stress die iemand in zijn of haar lichaam en geest meedraagt.,BeetleLM/beetlelm_nld-ind_balanced,step-2444,nld,8.181646347045898,3574.735073422822
538,"Des te minder stress, des te positiever de aanwezige levenskracht. Ieder mens is in staat tevredenheid en totale rust te bereiken.",BeetleLM/beetlelm_nld-ind_balanced,step-2444,nld,7.986835479736328,2941.9722822980593
539,Iedereen kan zijn of haar geest verlichten. Alleen je eigen stress en negativiteit staan dit doel in de weg.,BeetleLM/beetlelm_nld-ind_balanced,step-2444,nld,7.398370265960693,1633.3203819171547
