sentence_id,sentence,repo,revision,iso_code,nll,ppl
760,Montevideo bevindt zich in de subtropen. In de zomermaanden komen gerust temperaturen hoger dan +30°C voor.,BeetleLM/beetlelm_nld-ind_balanced,step-2444,nld,7.807679176330566,2459.415935960734
761,"De winter kan bedrieglijk koud zijn: de temperatuur gaat bijna nooit onder nul, maar de wind in combinatie met de luchtvochtigheid zorgt ervoor dat het kouder aanvoelt dan dat de thermometer aangeeft.",BeetleLM/beetlelm_nld-ind_balanced,step-2444,nld,7.801070690155029,2443.2165055591768
762,"Het regenniveau blijft gedurende het hele jaar ongeveer gelijk, zonder herkenbare 'natte' en 'droge' perioden.",BeetleLM/beetlelm_nld-ind_balanced,step-2444,nld,8.167791366577148,3525.548713643894
763,"Veel van de dieren in het park zijn eraan gewend mensen te zien, maar wilde dieren zijn uiteindelijk wel gewoon wild. Daarom moeten ze niet worden gevoerd of gestoord.",BeetleLM/beetlelm_nld-ind_balanced,step-2444,nld,7.291134834289551,1467.2348211588005
764,"Houd in het park minstens 100 meter afstand van beren en wolven, en 25 meter van alle andere wilde dieren.",BeetleLM/beetlelm_nld-ind_balanced,step-2444,nld,7.717548370361328,2247.442923249718
765,"Elanden, bizons, rendieren, beren en ongeveer alle andere grote dieren kunnen u aanvallen, hoe tam ze ook lijken.",BeetleLM/beetlelm_nld-ind_balanced,step-2444,nld,7.7115349769592285,2233.968718254419
766,"Elk jaar raken tientallen bezoekers gewond omdat ze geen gepaste afstand houden. Deze dieren zijn groot, wilde en mogelijk gevaarlijk, dus geef ze de ruimte.",BeetleLM/beetlelm_nld-ind_balanced,step-2444,nld,8.125192642211914,3378.5187143055364
767,"Bovendien moet u zich ervan bewust zijn dat geuren beren en andere wilde dieren aantrekken, dus vermijd het dragen of koken van geurend voedsel en houd de kampeerplek schoon.",BeetleLM/beetlelm_nld-ind_balanced,step-2444,nld,8.331212043762207,4151.446238672699
768,De hoofdstad van Samoa is Apia en de stad met bijna 40.000 inwoners ligt op het eiland Upolu.,BeetleLM/beetlelm_nld-ind_balanced,step-2444,nld,7.2061309814453125,1347.6680149709841
769,Rond het jaar 1850 werd Apia opgericht en het is de officiële hoofdstad van Samoa vanaf 1959.,BeetleLM/beetlelm_nld-ind_balanced,step-2444,nld,7.794683933258057,2427.6619999875497
770,"In 1889 wilden zeven schepen uit Duitsland, de VS en Groot-Brittannië de haven niet verlaten. Dit kwam later bekend te staan als de beruchte patstelling.",BeetleLM/beetlelm_nld-ind_balanced,step-2444,nld,8.03084659576416,3074.3432978680785
771,Met uitzondering van een Brits slagschip werden alle schepen tot zinken gebracht. Bijna 200 Amerikanen en Duitsers verloren hun leven.,BeetleLM/beetlelm_nld-ind_balanced,step-2444,nld,7.985140323638916,2936.989404616261
772,"In de onafhankelijkheidsstrijd door de Mau-beweging kwam de hoogste leider, Tupua Tamasese Lealofi III, om bij een uit de hand gelopen geweldloze bijeenkomst in de stad.",BeetleLM/beetlelm_nld-ind_balanced,step-2444,nld,7.481825828552246,1775.4795395561348
773,"Er zijn veel stranden, met name vanwege de twee havens van Auckland. De meest populaire zijn gelegen in drie gebieden.",BeetleLM/beetlelm_nld-ind_balanced,step-2444,nld,7.4683146476745605,1751.6520456214064
774,"De stranden van North Shore in het district North Harbour strekken zich van noord tot zuid uit langs de Grote Oceaan, van Long Bay naar Devonport.",BeetleLM/beetlelm_nld-ind_balanced,step-2444,nld,7.955260276794434,2850.5301593696804
775,Dit zijn nagenoeg allemaal zandstranden waar veilig kan worden gezwommen en de meeste hebben pohutukawa-bomen die schaduw bieden.,BeetleLM/beetlelm_nld-ind_balanced,step-2444,nld,7.942252159118652,2813.6902559927103
776,"Bij Waitemata's haven, in de luxe voorsteden van Mission Bay en St Heliers, gelegen in Central Auckland, vind je de Tamaki Drive-stranden.",BeetleLM/beetlelm_nld-ind_balanced,step-2444,nld,7.611514091491699,2021.3362700045382
777,Deze familiestranden zijn soms drukbezocht en hebben aan de kust een goed aanbod aan winkels . Zwemmen is niet onveilig.,BeetleLM/beetlelm_nld-ind_balanced,step-2444,nld,7.326272010803223,1519.705751868194
778,"'Number One' is het belangrijkste plaatselijke bier dat geen complex bier, maar aangenaam en verfrissend is. Het andere plaatselijke bier heeft de naam 'Manta'.",BeetleLM/beetlelm_nld-ind_balanced,step-2444,nld,8.119603157043457,3359.6872122895106
779,"Er zijn veel Franse wijnen te vinden, maar de Nieuw-Zeelandse en Australische wijnen zijn wellicht beter geschikt voor reizen.",BeetleLM/beetlelm_nld-ind_balanced,step-2444,nld,7.60394287109375,2006.0900765814895
780,"Het lokale drinkwater kan gewoon veilig worden gedronken, maar fleswater is ook gemakkelijk te vinden als je het niet vertrouwt.",BeetleLM/beetlelm_nld-ind_balanced,step-2444,nld,7.6741108894348145,2151.909549366473
781,"Een 'flat white' is een vreemd concept voor Australiërs. Zwarte koffie is 'espresso', cappuccino heeft heel veel koffiemelk (zonder schuim) en thee wordt geserveerd zonder melk.",BeetleLM/beetlelm_nld-ind_balanced,step-2444,nld,8.66250228881836,5781.984771631691
782,"De warme chocolademelk is van Belgische kwaliteit. Vruchtensappen zijn duur, maar geweldig.",BeetleLM/beetlelm_nld-ind_balanced,step-2444,nld,8.148786544799805,3459.1789589781165
783,Er vinden het hele jaar tochten naar het rif plaats en letsel naar aanleiding van deze tochten naar het rif zijn zeldzaam.,BeetleLM/beetlelm_nld-ind_balanced,step-2444,nld,7.443690776824951,1709.0463037765644
784,Vraag desondanks deskundig advies en volg alle borden en veiligheidswaarschuwingen op.,BeetleLM/beetlelm_nld-ind_balanced,step-2444,nld,8.978357315063477,7929.595583758856
785,Kubuskwallen komen van oktober tot april voor in de buurt van stranden en riviermondingen ten noorden van Town of 1770. Soms komen ze ook buiten deze periode voor.,BeetleLM/beetlelm_nld-ind_balanced,step-2444,nld,7.738854885101318,2295.8418745569306
786,"Haaien komen wel degelijk voor, maar ze vallen zelden mensen aan. Het merendeel van de haaien is bang voor mensen en zou juist wegzwemmen.",BeetleLM/beetlelm_nld-ind_balanced,step-2444,nld,7.008840084075928,1106.370463636017
787,De belangrijkste habitat van zoutwaterkrokodillen bevindt zich in de riviermondingen ten noorden van Rockhampton en ze leven normaliter niet in de oceaan.,BeetleLM/beetlelm_nld-ind_balanced,step-2444,nld,7.800038814544678,2440.6967103174916
788,"Vooraf reserveren zorgt voor gemoedsrust bij de reiziger, wetende dat hij een plek heeft om te slapen wanneer hij op zijn bestemming arriveert.",BeetleLM/beetlelm_nld-ind_balanced,step-2444,nld,7.684772491455078,2174.9750918953637
789,"Reisbureaus hebben vaak deals met bepaalde hotels, al kun je meestal via een reisbureau ook andere accommodatievormen, zoals een campingplek, boeken.",BeetleLM/beetlelm_nld-ind_balanced,step-2444,nld,7.492029666900635,1793.6889909232068
790,Reisbureaus bieden vaak pakketten met ontbijt en vervoer van en naar het vliegveld aan en soms zelfs pakketten met vlucht en hotel.,BeetleLM/beetlelm_nld-ind_balanced,step-2444,nld,7.817590713500977,2483.913733289867
791,Ze kunnen je ook reservering vasthouden als je nog wat langer over de aanbieding wilt nadenken of als je documenten voor je bestemming moet verwerven (bijv. visum).,BeetleLM/beetlelm_nld-ind_balanced,step-2444,nld,7.640446662902832,2080.672968475021
792,"Als u een verzoek hebt of een wijziging wilt maken, moet u dit echter via het reisbureau doen in plaats van het hotel.",BeetleLM/beetlelm_nld-ind_balanced,step-2444,nld,7.446589946746826,1714.008308787858
793,Voor sommige festivals geldt dat de meerderheid van de aanwezigen op muziekfestivals ervoor kiest om ter plekke te kamperen en de meeste bezoekers beschouwen dit als een belangrijk onderdeel van de ervaring.,BeetleLM/beetlelm_nld-ind_balanced,step-2444,nld,7.963793754577637,2874.9591791600856
794,"Als u dicht bij de actie wilt zijn, moet u vroeg zijn om een kampeerplek in de buurt van de muziek te bemachtigen.",BeetleLM/beetlelm_nld-ind_balanced,step-2444,nld,7.022670745849609,1121.7786061042177
795,"En onthoud het volgende: ook als de muziek op de hoofdpodia is afgelopen, wordt er mogelijk op andere delen van het festivalterrein tot in de late uurtjes muziek gedraaid.",BeetleLM/beetlelm_nld-ind_balanced,step-2444,nld,6.966597557067871,1060.6079464319196
796,"Voor gezinnen waarvan de kinderen nog jong zijn, zijn er op sommige festivals speciale kampeerterreinen.",BeetleLM/beetlelm_nld-ind_balanced,step-2444,nld,8.120387077331543,3362.3219718426526
797,"Let goed op waar uw hut zit als u 's winters de Oostzee overgaat, want de tocht door het ijs maakt een enorm lawaai. als u te dichtbij zit.",BeetleLM/beetlelm_nld-ind_balanced,step-2444,nld,7.253929615020752,1413.6490443107461
798,Cruises naar Sint-Petersburg omvatten tijd om de stad te verkennen. Passagiers van de cruise zijn vrijgesteld van de visumvereisten (controleer de voorwaarden).,BeetleLM/beetlelm_nld-ind_balanced,step-2444,nld,7.675635814666748,2155.1935538293897
799,Casino's zetten zich doorgaans in om het meeste te halen uit de tijd en het geld dat gasten besteden. Ramen en klokken zijn normaal gesproken niet aanwezig en de uitgang is soms moeilijk te vinden.,BeetleLM/beetlelm_nld-ind_balanced,step-2444,nld,7.193577289581299,1330.8555559871256
800,"Ze hebben normaal gesproken speciaal aanbiedingen op het gebied van eten, drinken en entertainment om ze in een goede stemming te houden en om te voorkomen dat ze vertrekken.",BeetleLM/beetlelm_nld-ind_balanced,step-2444,nld,7.054744720458984,1158.3417325872854
801,"Sommige locaties bieden gratis alcoholische dranken aan. Als mensen dronken zijn, beïnvloedt dat echter hun beoordelingsvermogen en alle doorgewinterde gokkers weten dat het enorm belangrijk is om nuchter te blijven.",BeetleLM/beetlelm_nld-ind_balanced,step-2444,nld,8.204399108886719,3657.002526027316
802,"Als je op hoog de bergen in gaat of over bergpassen gaat rijden, moet je er rekening mee houden dat er sneeuw of ijs kan liggen en de temperatuur ontzettend laag kan zijn.",BeetleLM/beetlelm_nld-ind_balanced,step-2444,nld,7.101527690887451,1213.8200005369172
803,Op ijzige en besneeuwde wegen is er weinig frictie en het rijdt hierdoor anders dan asfalt.,BeetleLM/beetlelm_nld-ind_balanced,step-2444,nld,7.6941752433776855,2195.5222918499867
804,Tijdens sneeuwstormen kan er in een hele korte periode genoeg sneeuw vallen om vast te komen te zitten.,BeetleLM/beetlelm_nld-ind_balanced,step-2444,nld,7.621143341064453,2040.8942345581543
805,Ook kan het zicht belemmerd worden door vallende of opwaaiende sneeuw of doordat er condensatie of ijs op de ruiten van het voertuig zit.,BeetleLM/beetlelm_nld-ind_balanced,step-2444,nld,7.731043338775635,2277.977663792166
806,Aan de andere kant zijn ijs en sneeuw in veel landen normaal en wordt het verkeer hier niet door belemmerd.,BeetleLM/beetlelm_nld-ind_balanced,step-2444,nld,7.313222885131836,1500.003747066982
807,"De grootste toeristische Afrikaanse trekpleister zijn safari's, die voor veel bezoekers het hoogtepunt van hun reis vormen.",BeetleLM/beetlelm_nld-ind_balanced,step-2444,nld,7.990338325500488,2952.2956274327157
808,"Het begrip safari verwijst in populair gebruik naar reizen over land om de prachtige Afrikaanse wilde dieren te bekijken, met name op de savanne.",BeetleLM/beetlelm_nld-ind_balanced,step-2444,nld,7.59154748916626,1981.377302454596
809,"Sommige dieren, zoals olifanten en giraffen, komen vaak dicht bij auto's en een standaarduitrusting maakt een goed uitzicht mogelijk.",BeetleLM/beetlelm_nld-ind_balanced,step-2444,nld,7.584540843963623,1967.543017245043
810,"Als je leeuwen, cheeta's en luipaarden wilt zien, heb je een verrekijker nodig. Anders is de kans klein dat je ze ziet.",BeetleLM/beetlelm_nld-ind_balanced,step-2444,nld,6.907244682312012,999.4895336621711
811,Een wandelsafari (ook wel een 'boswandeling' of 'loopsafari' genoemd) houdt in dat je meerdere uren of dagen achter elkaar loopt.,BeetleLM/beetlelm_nld-ind_balanced,step-2444,nld,7.8605852127075195,2593.0374099187
812,De Paralympics zijn van 24 augustus tot 5 september 2021. Sommige onderdelen worden op andere locaties in Japan gespeeld.,BeetleLM/beetlelm_nld-ind_balanced,step-2444,nld,8.451103210449219,4680.233170604034
813,Tokio wordt de enige Aziatische stad zijn waar de Olympische Spelen twee keer hebben plaatsgevonden. De eerste keer was in 1964.,BeetleLM/beetlelm_nld-ind_balanced,step-2444,nld,7.829005718231201,2512.43006770623
814,"Als je al voordat het uitstel werd aangekondigd vluchten en accommodatie voor 2020 hebt geboekt, kun je in een penibele situatie zitten.",BeetleLM/beetlelm_nld-ind_balanced,step-2444,nld,7.881193161010742,2647.0290080592436
815,"Het annuleringsbeleid varieert, maar vanaf eind maart zijn de meeste op coronavirus gebaseerde annuleringsbeleidslijnen niet meer geldig tot juli 2020, toen de Olympische Spelen waren gepland.",BeetleLM/beetlelm_nld-ind_balanced,step-2444,nld,8.547918319702148,5156.010083305531
816,Naar verwachtingen kosten de meeste kaartjes voor evenementen tussen ¥ 2.500 en ¥ 130.000. Normale kaartjes gaan rond ¥ 7.000 kosten.,BeetleLM/beetlelm_nld-ind_balanced,step-2444,nld,7.649370193481445,2099.3230056644397
817,"Je kunt vochtige kleren drogen door ze te strijken. Veel hotels hebben een strijkijzer en een strijkplank beschikbaar. Je kunt deze spullen vaak lenen, zelfs al staan ze niet in de kamer.",BeetleLM/beetlelm_nld-ind_balanced,step-2444,nld,7.480800628662109,1773.6602508538754
818,"Als er geen strijkijzer voorhanden is of als je geen gestreken sokken wilt dragen, kun je, indien beschikbaar, ook een haardroger gebruiken.",BeetleLM/beetlelm_nld-ind_balanced,step-2444,nld,7.5977044105529785,1993.6141186451398
819,"Zorg ervoor dat de stof niet te heet wordt (hierdoor kan de stof krimpen of, in extreme gevallen, verschroeien).",BeetleLM/beetlelm_nld-ind_balanced,step-2444,nld,7.889161109924316,2668.204651155891
820,Je kunt water op verschillende manieren zuiveren. Sommige manieren zijn effectief om specifieke risico's tegen te gaan.,BeetleLM/beetlelm_nld-ind_balanced,step-2444,nld,8.106934547424316,3317.3931159124086
821,"In sommige gebieden is het voldoende om water een minuut te koken, in andere gebieden moet water enkele minuten worden gekookt.",BeetleLM/beetlelm_nld-ind_balanced,step-2444,nld,7.816771984100342,2481.8809123664632
822,Niet ieder filter is even effectief. In geval van twijfel kan je het beste water drinken uit een afgesloten fles van een betrouwbaar bedrijf.,BeetleLM/beetlelm_nld-ind_balanced,step-2444,nld,7.709822654724121,2230.14671712823
823,Reizigers kunnen te maken krijgen met dierenplagen die er in hun eigen land niet zijn.,BeetleLM/beetlelm_nld-ind_balanced,step-2444,nld,7.184916019439697,1319.3784314839272
824,"Ongedierte kan voedsel verderven, irritatie veroorzaken of, in het ergste geval, allergische reacties veroorzaken, gif verspreiden of infecties overbrengen.",BeetleLM/beetlelm_nld-ind_balanced,step-2444,nld,8.744280815124512,6274.699128019702
825,"Normaal gesproken worden infectieziekten zelf, of gevaarlijke dieren die met geweld mensen verwonden of doden, niet beschouwd als ongedierte.",BeetleLM/beetlelm_nld-ind_balanced,step-2444,nld,8.290681838989258,3986.551454273761
826,Met belastingvrij winkelen wordt bedoeld dat je op bepaalde locaties goederen kunt kopen die zijn vrijgesteld van belasting en accijnzen.,BeetleLM/beetlelm_nld-ind_balanced,step-2444,nld,8.142213821411133,3436.5172885577017
827,"Reizigers die naar landen met hoge accijnzen gaan, kunnen soms aanzienlijk veel geld besparen, als het gaat om producten als alcoholische dranken en tabak.",BeetleLM/beetlelm_nld-ind_balanced,step-2444,nld,8.233942985534668,3766.6563818062104
828,"Point Marion en Fairmont zijn met elkaar verbonden via de snelweg van Buffalo naar Pittsburgh, je rijdt vaak door verlaten achterliggend terrein en dat maakt van dit traject één grote uitdaging.",BeetleLM/beetlelm_nld-ind_balanced,step-2444,nld,8.133349418640137,3406.189233820638
829,"Ben je niet gewend om op landweggetjes te rijden? Houd dan je hoofd erbij. Je komt veel steile hellingen, smalle straatjes en scherpe bochten tegen.",BeetleLM/beetlelm_nld-ind_balanced,step-2444,nld,7.659553527832031,2120.8103343807616
830,De gestelde maximumsnelheden zijn opvallend lager dan in eerdere en opeenvolgende gebieden — meestal zo'n 35-40 mph (56-64 km/u — en het is hier nog belangrijker om je eraan te houden dan anders.,BeetleLM/beetlelm_nld-ind_balanced,step-2444,nld,7.739511966705322,2297.3509257489977
831,"Verrassend genoeg heb je hier veel meer bereik dan in andere uithoeken van de route, zoals de Pennsylvania Wilds.",BeetleLM/beetlelm_nld-ind_balanced,step-2444,nld,7.348215579986572,1553.4220957203372
832,"Duitse gebak smaakt prima en in Beieren is het gebak redelijk rijk en gevarieerd, net zoals het gebak van de zuidelijke buur, Oostenrijk.",BeetleLM/beetlelm_nld-ind_balanced,step-2444,nld,8.302301406860352,4033.1436257008872
833,"Je ziet er veel fruitgebakjes. Het hele jaar door bevatten de gebakjes appels, en in de zomermaanden ook kersen en pruimen.",BeetleLM/beetlelm_nld-ind_balanced,step-2444,nld,7.351660251617432,1558.782351604612
834,"Veel populaire Duitse gebakjes bevatten amandelen, hazelnoten en andere noten, en smaken prima bij een kop sterke koffie.",BeetleLM/beetlelm_nld-ind_balanced,step-2444,nld,8.617484092712402,5527.462302472427
835,"Als u een paar kleine maar machtige gebakjes wilt, probeer er dan enkele die in de regio Berliner, Pfannkuchen of Krapfen worden genoemd.",BeetleLM/beetlelm_nld-ind_balanced,step-2444,nld,7.903285980224609,2706.1601227997344
836,"Om een curry te maken heb je kruidige en pittige ingrediënten nodig, in combinatie met groente of vlees.",BeetleLM/beetlelm_nld-ind_balanced,step-2444,nld,7.813340663909912,2473.379378365642
837,"Afhankelijk van de hoeveelheid vloeistof, kan een curry 'droog' of 'nat' zijn.",BeetleLM/beetlelm_nld-ind_balanced,step-2444,nld,6.930355548858643,1022.857590827003
838,In het binnenland van Noord-India en ook van Pakistan wordt vaak yoghurt gebruikt in curry's; in Zuid-India en enkele andere kustregio's van het subcontinent wordt dan weer vaak kokosmelk gebruikt.,BeetleLM/beetlelm_nld-ind_balanced,step-2444,nld,7.476473331451416,1766.0016782085413
839,De Indonesische keuken omvat gerechten uit 17.000 eilanden en is een overkoepelend begrip voor een variëteit aan regionale keukens uit het hele land.,BeetleLM/beetlelm_nld-ind_balanced,step-2444,nld,7.631317138671875,2061.763861106096
840,Maar zonder aanvullende informatie verwijst de term naar het voedsel dat oorspronkelijk uit het centrale en oostelijke deel van het hoofdeiland Java komt.,BeetleLM/beetlelm_nld-ind_balanced,step-2444,nld,7.341416358947754,1542.8958611744092
841,"De Javaanse keuken is tegenwoordig beschikbaar in de hele archipel en biedt verschillende eenvoudige gekruide gerechten. De meest gebruikelijke Javaanse smaakmakers zijn noten, pepers, suiker (voornamelijk Javaanse kokossuiker) en verschillende geurige kruiden.",BeetleLM/beetlelm_nld-ind_balanced,step-2444,nld,8.501591682434082,4922.597820502083
842,Stijgbeugels ondersteunen de voeten van de ruiter en hangen aan beide kanten van het zadel naar beneden.,BeetleLM/beetlelm_nld-ind_balanced,step-2444,nld,7.849093914031982,2563.4105938780167
843,"Ze voorzien de berijder van meer stabiliteit, maar kunnen ook problemen met de veiligheid met zich meebrengen doordat de voeten van een berijder erin vast kunnen komen te zitten.",BeetleLM/beetlelm_nld-ind_balanced,step-2444,nld,7.525555610656738,1854.8435106673571
844,"Als een ruiter van een paard wordt afgegooid maar met de voet in de stijgbeugel blijft hangen, kunnen ze worden meegesleurd met het paard. Om het risico te verminderen, zijn er een aantal veiligheidsmaatregelen genomen.",BeetleLM/beetlelm_nld-ind_balanced,step-2444,nld,7.358152866363525,1568.9358505976702
845,"De meeste ruiters dragen ten eerste rijlaarzen met een hak en een gladde, vrij smalle zool.",BeetleLM/beetlelm_nld-ind_balanced,step-2444,nld,7.990862846374512,2953.844574307564
846,"Sommige zadels, en dan vooral Engelse zadels, beschikken over veiligheidsbeugels. Hierdoor kan een stijgbeugelleer van het zadel loskomen als dit achteruit wordt getrokken omdat een ruiter van het paard valt.",BeetleLM/beetlelm_nld-ind_balanced,step-2444,nld,8.111113548278809,3331.285512529041
847,"Cochamó Valley - Dit is de populairste klimbestemming van Chili. Deze staat bekend als de Yosemite van Zuid-Amerika, en heeft veel verschillende grote granieten wanden en rotsen.",BeetleLM/beetlelm_nld-ind_balanced,step-2444,nld,7.810007572174072,2465.149101753016
848,De bergtoppen bieden een adembenemend uitzicht. Klimmers uit alle delen van de wereld ontdekken voortdurend nieuwe routes op de rotswanden die een eindeloos potentieel lijken te hebben.,BeetleLM/beetlelm_nld-ind_balanced,step-2444,nld,8.277888298034668,3935.874206909087
849,"Wintersporten waarbij je afdaalt, zoals skiën en snowboarden, zijn heel populair. Je glijdt naar beneden op een met sneeuw bedekte afdaling met ski's of een snowboard aan je voeten.",BeetleLM/beetlelm_nld-ind_balanced,step-2444,nld,7.698967933654785,2206.0700059647634
850,"Skiën is een populaire reisactiviteit met veel liefhebbers, die af en toe ook wel 'ski bums' worden genoemd, die hele vakanties plannen rond het skiën op een bepaalde locatie.",BeetleLM/beetlelm_nld-ind_balanced,step-2444,nld,7.885354042053223,2658.0659266069033
851,Skiën bestaat al heel erg lang: er zijn grotschilderingen van skiërs die dateren uit 5000 v.Chr.!,BeetleLM/beetlelm_nld-ind_balanced,step-2444,nld,7.900302410125732,2698.0981371047455
852,Het begin van de skisport dateert op zijn minst uit de 17e eeuw en in 1861 werd het eerste recreatieve skioord in Australië geopend door Noren.,BeetleLM/beetlelm_nld-ind_balanced,step-2444,nld,7.678938865661621,2162.3240377346046
853,"Backpacken met ski's: deze activiteit wordt ook wel off-piste skiën, skitouring of skihiking genoemd.",BeetleLM/beetlelm_nld-ind_balanced,step-2444,nld,8.151636123657227,3469.050219992366
854,"Het is niet helemaal hetzelfde, maar het lijkt op alpineskiën of bergbeklimmen, wat veel gedaan wordt op steil terrein. Hier heb je veel stuggere ski's en laarzen voor nodig.",BeetleLM/beetlelm_nld-ind_balanced,step-2444,nld,7.50247049331665,1812.5146932499808
855,Je kunt de skiroute zien als een wandelroute.,BeetleLM/beetlelm_nld-ind_balanced,step-2444,nld,7.495488166809082,1799.9032038674166
856,"In goede omstandigheden kun je grotere afstanden afleggen dan lopend, maar het gebeurt maar zelden dat je op aangelegde pistes de snelheid van langlaufen haalt zonder een zware rugzak.",BeetleLM/beetlelm_nld-ind_balanced,step-2444,nld,8.126856803894043,3384.1457965809386
857,"Europa is een relatief klein continent, maar met veel onafhankelijke landen. Normaal gesproken moeten reizigers tussen verschillende landen meerdere keren een visum aanvragen en paspoortcontroles ondergaan.",BeetleLM/beetlelm_nld-ind_balanced,step-2444,nld,8.068281173706055,3191.6112863854437
858,Het Schengengebied functioneert op dit gebied echter bijna als één land.,BeetleLM/beetlelm_nld-ind_balanced,step-2444,nld,8.635445594787598,5627.640813104468
859,"Zolang u in deze zone verblijft, kunt u meestal de grens oversteken zonder opnieuw een paspoortcontrole te hoeven ondergaan.",BeetleLM/beetlelm_nld-ind_balanced,step-2444,nld,7.954715728759766,2848.9783313344346
860,"Wanneer u een Schengenvisum hebt, hoeft u niet voor ieder Schengenland apart een visum aan te vragen, wat tijd, geld en papierwerk bespaart.",BeetleLM/beetlelm_nld-ind_balanced,step-2444,nld,7.954192161560059,2847.4870901440245
861,Er is geen universele definitie waarmee wordt aangegeven welke geproduceerde artikelen antiek zijn. Sommige belastingkantoren geven goederen die ouder zijn dan 100 jaar de definitie antiek.,BeetleLM/beetlelm_nld-ind_balanced,step-2444,nld,8.536200523376465,5095.945606220574
862,De definitie kan per locatie verschillen. In Noord-Amerika ligt de leeftijdsgrens bijvoorbeeld lager dan in Europa.,BeetleLM/beetlelm_nld-ind_balanced,step-2444,nld,7.6380438804626465,2075.6795654355647
863,"Het is mogelijk om ambachtelijke producten als antiek aan te merken, ondanks dat ze nieuwer zijn dan vergelijkbare massaproducten.",BeetleLM/beetlelm_nld-ind_balanced,step-2444,nld,8.008390426635742,3006.0747190350203
864,Onder de Sámi is het houden van rendieren een belangrijke vorm van levensonderhoud. Ook is de cultuur rondom de handel erg belangrijk voor velen met andere beroepen.,BeetleLM/beetlelm_nld-ind_balanced,step-2444,nld,7.549440383911133,1899.6793426987722
865,"Zelfs traditioneel waren echter niet alle Sámi betrokken bij grootschalige rendierhouderij. Zij onderhielden zich met visserij, jagen en dergelijke zaken. Hierbij werden rendieren meestal als trekdieren gebruikt.",BeetleLM/beetlelm_nld-ind_balanced,step-2444,nld,8.471152305603027,4775.014576608388
866,"Veel Sámi werken vandaag de dag in moderne beroepen. In Sápmi, het Sámi-gebied is toerisme is een belangrijke inkomstenbron.",BeetleLM/beetlelm_nld-ind_balanced,step-2444,nld,7.668064594268799,2138.937724320272
867,Het woord 'zigeuner' wordt vooral gebruikt door niet-Roma. Het wordt echter ook vaak als beledigend beschouwd vanwege de associaties met negatieve stereotypen en onjuiste percepties van de Roma.,BeetleLM/beetlelm_nld-ind_balanced,step-2444,nld,7.81942892074585,2488.4838806621656
868,"Als er voor het land waar je naartoe wilt een reisadvies geldt, kan dit gevolgen hebben voor je ziektekostenverzekering voor de reis of je annuleringsverzekering.",BeetleLM/beetlelm_nld-ind_balanced,step-2444,nld,7.612281322479248,2022.8876969024343
869,Je kunt naast het advies van je eigen overheid ook het advies van andere overheden raadplegen. Hun advies is echter wel gericht op hun eigen inwoners.,BeetleLM/beetlelm_nld-ind_balanced,step-2444,nld,7.870969295501709,2620.104012780579
