sentence_id,sentence,repo,revision,iso_code,nll,ppl
413,Les cultures minoritaires disparaissent souvent sans laisser de traces historiques pertinentes et ne sont pas reconnues comme de véritables civilisations.,BeetleLM/beetlelm_zho-fra_balanced,step-8000,fra,5.071187496185303,159.36345852386788
414,"Pendant la guerre révolutionnaire, les treize États ont d’abord formé un gouvernement central faible — le Congrès étant sa seule composante — en vertu des articles de la Confédération.",BeetleLM/beetlelm_zho-fra_balanced,step-8000,fra,5.326296329498291,205.67481004756283
415,"Le Congrès n’avait pas le pouvoir d’imposer des taxes et, comme il n’y avait pas de pouvoir exécutif ou judiciaire national, il s’en remettait aux autorités de l’État, souvent peu coopératives, pour faire appliquer tous ses actes.",BeetleLM/beetlelm_zho-fra_balanced,step-8000,fra,5.241805076599121,189.01097394954058
416,Il n'avait pas non plus le pouvoir de déroger aux lois fiscales ni à celles sur les droits de douane entre les États.,BeetleLM/beetlelm_zho-fra_balanced,step-8000,fra,5.127758026123047,168.63861054198517
417,Les articles nécessitaient le consentement unanime de tous les États avant de pouvoir être amendés et les États prenaient le gouvernement central tellement à la légère que leurs représentants étaient souvent absents.,BeetleLM/beetlelm_zho-fra_balanced,step-8000,fra,5.731884956359863,308.55032446912514
418,"L'équipe nationale italienne de football est, avec l'équipe nationale allemande, la deuxième équipe la plus titrée du monde et elle a remporté la Coupe du monde de la FIFA en 2006.",BeetleLM/beetlelm_zho-fra_balanced,step-8000,fra,3.9550883769989014,52.20030704706114
419,"Parmi les sports populaires figurent le football, le basket-ball, le volley-ball, le water-polo, l'escrime, le rugby, le cyclisme, le hockey sur glace, le roller hockey et la Formule 1.",BeetleLM/beetlelm_zho-fra_balanced,step-8000,fra,4.4347710609436035,84.33281560282282
420,"Les sports d'hiver sont les plus populaires dans les régions du Nord, les Italiens participant à des jeux internationaux et à des événements olympiques.",BeetleLM/beetlelm_zho-fra_balanced,step-8000,fra,4.171690464019775,64.82494377049832
421,"Le Japon compte près de 7 000 îles (la plus grande étant Honshu), ce qui en fait la 7e plus grande île au monde !",BeetleLM/beetlelm_zho-fra_balanced,step-8000,fra,4.785517692565918,119.76334763274338
422,"En raison du groupe d'îles qui le composent, le Japon est souvent désigné, d'un point de vue géographique, comme un « archipel ».",BeetleLM/beetlelm_zho-fra_balanced,step-8000,fra,3.963744640350342,52.65412801502904
423,"Les premières informations concernant Taïwan remontent au XVe siècle, tandis que des navigateurs européens passant par là en firent mention sous le nom d’Ilha Formosa, ou « belle île ».",BeetleLM/beetlelm_zho-fra_balanced,step-8000,fra,5.39312219619751,219.88885105286687
424,"En 1624, la Dutch East India Company établit une base dans le sud-ouest de Taïwan, introduisant une transformation des pratiques autochtones de production de céréales et employant des ouvriers chinois pour travailler dans ses plantations de riz et de sucre.",BeetleLM/beetlelm_zho-fra_balanced,step-8000,fra,4.89522647857666,133.65027211057202
425,"En 1683, les forces de la dynastie Qing (1644-1912) prennent le contrôle des zones côtières occidentale et septentrionale de Taïwan et la déclarent province de l'Empire Qing en 1885.",BeetleLM/beetlelm_zho-fra_balanced,step-8000,fra,3.8989033699035645,49.34830258778029
426,"En 1895, après sa défaite lors de la première guerre sino-japonaise (1894–1895), le gouvernement Qing signe le traité de Shimonoseki, par lequel il cède la souveraineté de Taïwan au Japon, qui dirige alors l'île jusqu'en 1945.",BeetleLM/beetlelm_zho-fra_balanced,step-8000,fra,4.166258335113525,64.47376101814547
427,"Le Machu Picchu est composé de trois structures principales, à savoir l'Intihuatana, le temple du soleil et la salle des trois fenêtres.",BeetleLM/beetlelm_zho-fra_balanced,step-8000,fra,5.037877082824707,154.14243581272078
428,La plupart des bâtiments limitrophes du complexe ont été reconstruits afin d'offrir aux touristes un meilleur aperçu de leur aspect originel.,BeetleLM/beetlelm_zho-fra_balanced,step-8000,fra,5.143070697784424,171.24079053259962
429,"En 1976, trente pour cent du Machu Picchu avait été restauré et cette restauration se poursuit jusqu'à aujourd'hui.",BeetleLM/beetlelm_zho-fra_balanced,step-8000,fra,4.997715473175049,148.0744922534754
430,"Par exemple, le format de photographie le plus courant au monde est le 35 mm ; c'était le format de pellicule le plus répandu à la fin de l'ère des films analogiques.",BeetleLM/beetlelm_zho-fra_balanced,step-8000,fra,4.483668327331543,88.55894073407866
431,"C'est encore fabriqué aujourd'hui, mais ce qui importe est que son format d'image est hérité du format du capteur photographique des caméras numériques.",BeetleLM/beetlelm_zho-fra_balanced,step-8000,fra,4.893550395965576,133.42645083739038
432,"Le format 35 mm est en fait, et c’est assez déconcertant, de 36 mm de largeur par 24 mm de hauteur.",BeetleLM/beetlelm_zho-fra_balanced,step-8000,fra,5.813579559326172,334.81547505162433
433,On dit donc que le rapport d'aspect de ce format (en divisant par douze pour obtenir le plus simple des rapports de nombres entiers) est de 3:2.,BeetleLM/beetlelm_zho-fra_balanced,step-8000,fra,4.821876525878906,124.1979328795396
434,"De nombreux formats courants (famille de formats APS, par exemple) sont égaux à ce rapport d’aspect ou s’en approchent de près.",BeetleLM/beetlelm_zho-fra_balanced,step-8000,fra,6.166374206542969,476.4554414468248
435,"La règle des tiers, fort maltraitée et souvent tournée en ridicule, est une simple directive suscitant le dynamisme tout en offrant une protection à l’image.",BeetleLM/beetlelm_zho-fra_balanced,step-8000,fra,5.898559093475342,364.5118617617081
436,Il indique que l'endroit le plus efficace pour le sujet principal se trouve à l'intersection des lignes divisant l'image en tiers verticalement et horizontalement (voir exemple).,BeetleLM/beetlelm_zho-fra_balanced,step-8000,fra,5.131585597991943,169.28532382494456
437,"Pendant cette période de l'histoire européenne, l'Église catholique, qui était devenue riche et puissante, a été remise en question.",BeetleLM/beetlelm_zho-fra_balanced,step-8000,fra,3.7566590309143066,42.80517604533552
438,"Pendant plus d'un millier d'années, la religion chrétienne a lié les États européens entre eux malgré les différences de langue et de coutumes.",BeetleLM/beetlelm_zho-fra_balanced,step-8000,fra,4.852283954620361,128.03247652901777
439,"Son pouvoir omniprésent touchait tout le monde, du roi au roturier.",BeetleLM/beetlelm_zho-fra_balanced,step-8000,fra,6.203259468078613,494.35776122515466
440,L'un des principaux principes chrétiens est que la richesse doit être utilisée pour soulager la souffrance et la pauvreté et que les fonds monétaires de l'église sont là spécifiquement pour cette raison.,BeetleLM/beetlelm_zho-fra_balanced,step-8000,fra,4.479954719543457,88.23067745984308
441,L'autorité centrale de l'église était à Rome depuis plus de 1000 ans et cette concentration de pouvoir et d'argent a conduit beaucoup de gens à se demander si cette doctrine était respectée.,BeetleLM/beetlelm_zho-fra_balanced,step-8000,fra,4.502427101135254,90.23587733408402
442,"Peu après le début des hostilités, la Grande-Bretagne a mis en place un blocus naval contre l’Allemagne.",BeetleLM/beetlelm_zho-fra_balanced,step-8000,fra,5.058196067810059,157.3064899772985
443,"Cette stratégie s'est avérée efficace, coupant les approvisionnements militaires et civils vitaux, bien que ce blocus ait violé le droit international généralement accepté et codifié par plusieurs accords internationaux des deux derniers siècles.",BeetleLM/beetlelm_zho-fra_balanced,step-8000,fra,5.513085842132568,247.91497437860872
444,"La Grande-Bretagne mina les eaux internationales afin d'empêcher les navires de s'aventurer dans des zones maritimes entières, représentant ainsi une menace même pour les navires neutres.",BeetleLM/beetlelm_zho-fra_balanced,step-8000,fra,4.587461948394775,98.2447631832296
445,"Comme cette tactique n'a suscité qu'une timide réaction, l'Allemagne s'attendait à une réaction semblable face à sa guerre sous-marine sans limites.",BeetleLM/beetlelm_zho-fra_balanced,step-8000,fra,4.6735520362854,107.0774105834775
446,"Pendant les années 20, la plupart des citoyens et des nations montraient un penchant pour le pacifisme et l’isolement.",BeetleLM/beetlelm_zho-fra_balanced,step-8000,fra,4.621236801147461,101.61963772350391
447,"Après avoir vu les horreurs et les atrocités de la guerre pendant la Première Guerre mondiale, les nations ont souhaité éviter qu’une telle situation ne se reproduise à l’avenir.",BeetleLM/beetlelm_zho-fra_balanced,step-8000,fra,4.687055587768555,108.53314256535955
448,"En 1884, Tesla s'est installé aux États-Unis d'Amérique pour accepter un emploi à la Edison Company à New York.",BeetleLM/beetlelm_zho-fra_balanced,step-8000,fra,4.051607608795166,57.48980391114089
449,"Il est arrivé aux États-Unis avec quatre cents à son nom, un livre de poésie et une lettre de recommandation de Charles Batchelor (son directeur dans son précédent emploi) à l'attention de Thomas Edison.",BeetleLM/beetlelm_zho-fra_balanced,step-8000,fra,4.733074188232422,113.64439013964258
450,La Chine ancienne avait une façon unique de montrer les différentes époques ; chaque étape de la Chine ou chaque famille qui était au pouvoir était une dynastie distincte.,BeetleLM/beetlelm_zho-fra_balanced,step-8000,fra,5.180743217468262,177.8149170479873
451,"Entre chaque dynastie, il y a également eu un âge instable de provinces divisées. La plus connue de ces périodes est l’époque des Trois Royaumes qui s’est déroulée pendant 60 ans entre la dynastie Han et la dynastie Jin.",BeetleLM/beetlelm_zho-fra_balanced,step-8000,fra,4.268834590911865,71.43833220577628
452,"Durant ces périodes, des luttes féroces ont eu lieu entre de nombreux membres de la noblesse qui se battaient pour le trône.",BeetleLM/beetlelm_zho-fra_balanced,step-8000,fra,4.330537796020508,75.98514008873
453,Les Trois Royaumes ont été l'une des époques les plus sanguinaires de l'histoire de l'Antiquité Chinoise. Des milliers de personnes sont mort au combat pour s'asseoir sur le trône du grand palais de XI'an.,BeetleLM/beetlelm_zho-fra_balanced,step-8000,fra,3.9644362926483154,52.69055896098985
454,"Il y a de nombreuses répercussions sociales et politiques telles que l'utilisation du système métrique, le passage de l'absolutisme au républicanisme, le nationalisme et la conviction que le pays appartient au peuple et non à un seul dirigeant.",BeetleLM/beetlelm_zho-fra_balanced,step-8000,fra,4.7153801918029785,111.65125199617165
455,"Aussi, après la Révolution, les métiers furent ouverts à tous les candidats masculins, permettant aux plus ambitieux et aux plus talentueux de réussir.",BeetleLM/beetlelm_zho-fra_balanced,step-8000,fra,4.976563453674316,144.9753102340469
456,"Il en va de même pour l'armée, car le classement des armées n'est plus basé sur la classe, mais sur le calibre.",BeetleLM/beetlelm_zho-fra_balanced,step-8000,fra,4.256214141845703,70.542413711141
457,La Révolution française a également inspiré de nombreuses autres classes ouvrières réprimées d’autres pays à entamer leur propre révolution.,BeetleLM/beetlelm_zho-fra_balanced,step-8000,fra,5.392729759216309,219.80257546593256
458,Muhammad s’intéressait profondément à des questions qui dépassaient le cadre de cette vie mondaine. Il avait l’habitude de fréquenter une grotte qui est devenue célèbre sous le nom de « Hira' » sur la montagne de « Noor » (lumière) pour la contemplation.,BeetleLM/beetlelm_zho-fra_balanced,step-8000,fra,5.119946479797363,167.32641403786812
459,"La grotte elle-même, qui a survécu à l’époque, donne une image très vivante des penchants spirituels de Muhammad.",BeetleLM/beetlelm_zho-fra_balanced,step-8000,fra,4.856014728546143,128.51102888436242
460,"Située au sommet d'une des montagnes au nord de La Mecque, la grotte est totalement isolée du reste du monde.",BeetleLM/beetlelm_zho-fra_balanced,step-8000,fra,4.11210823059082,61.075342842238776
461,"En réalité, ce n'est pas facile du tout à trouver, même si on sait que ça existe. Quand on est entré dans la grotte, on est complètement isolé.",BeetleLM/beetlelm_zho-fra_balanced,step-8000,fra,3.95332670211792,52.10842803159582
462,"Au-dessus, on ne peut rien contempler d'autre que le ciel clair et magnifique et les nombreuses montagnes environnantes. Depuis l'intérieur de la grotte, on ne peut voir ou entendre que très peu de choses de cet univers.",BeetleLM/beetlelm_zho-fra_balanced,step-8000,fra,4.447509288787842,85.4139373918059
463,La Grande Pyramide de Gizeh est la seule des sept merveilles qui existe encore aujourd’hui.,BeetleLM/beetlelm_zho-fra_balanced,step-8000,fra,5.107131481170654,165.1958072910454
464,"Construite par les Égyptiens au cours du troisième millénaire avant J-C, la Grande Pyramide est l'une des nombreuses structures géantes érigées en l'honneur des pharaons décédés.",BeetleLM/beetlelm_zho-fra_balanced,step-8000,fra,4.694620132446289,109.35725947608474
465,"Le plateau de Gizeh, ou « nécropole de Gizeh », dans la vallée des Morts en Égypte, regroupe plusieurs pyramides (la grande pyramide étant la plus imposante), plusieurs petits tombeaux, de nombreux temples et le grand Sphinx.",BeetleLM/beetlelm_zho-fra_balanced,step-8000,fra,4.88607931137085,132.43332501895785
466,"La grande pyramide a été créée pour honorer le pharaon Khéops, et beaucoup de petites pyramides, tombes et temples ont été construits pour honorer ses femmes ainsi que les membres de sa famille.",BeetleLM/beetlelm_zho-fra_balanced,step-8000,fra,4.457531929016113,86.2743149819843
467,Le symbole « pousser » ressemble à un V et le symbole « tirer » à une agrafe ou à un carré dont le côté inférieur est manquant.,BeetleLM/beetlelm_zho-fra_balanced,step-8000,fra,5.332662105560303,206.98826597764182
468,"Le haut signifie que vous devez commencer par la pointe et pousser l’archet, et le bas signifie que vous devez commencer par la hausse (qui est l’endroit où votre main tient l’arc) et tirer l’archet.",BeetleLM/beetlelm_zho-fra_balanced,step-8000,fra,5.040975570678711,154.62078497470299
469,"Un archet vers le haut produit généralement un son plus doux, tandis qu'un archet vers le bas est plus fort et plus affirmé.",BeetleLM/beetlelm_zho-fra_balanced,step-8000,fra,5.610092639923096,273.1695432380789
470,"N'hésitez pas à inscrire vos propres marques au crayon, mais n'oubliez pas que les marques d'archet imprimées le sont pour un motif d'ordre musical, et qu'il faut donc en général les respecter.",BeetleLM/beetlelm_zho-fra_balanced,step-8000,fra,4.57611608505249,97.13639113486181
471,"Le 6 octobre 1789, le roi Louis XVI, la reine Marie-Antoinette, leurs deux jeunes enfants (Marie-Thérèse, 11 ans, et Louis-Charles, 4 ans) et la sœur du roi, madame Élisabeth, tous terrifiés, sont contraints de rentrer à Paris depuis Versailles par une foule de vendeuses.",BeetleLM/beetlelm_zho-fra_balanced,step-8000,fra,4.757349014282227,116.43684398370685
472,"Dans un carrosse, ils sont rentrés à Paris entourés d’une foule de gens qui hurlent et crient des menaces contre le roi et la reine.",BeetleLM/beetlelm_zho-fra_balanced,step-8000,fra,5.051280975341797,156.22245347930593
473,"Le roi et la reine ont été obligés, à cause de la foule, de faire ouvrir les fenêtres de leurs carrosses.",BeetleLM/beetlelm_zho-fra_balanced,step-8000,fra,4.788671016693115,120.14159634335543
474,"À un moment donné, un membre de la foule a brandi la tête d'un garde royal tué à Versailles devant la reine terrorisée.",BeetleLM/beetlelm_zho-fra_balanced,step-8000,fra,4.785516262054443,119.76317631002289
475,Les dépenses de guerre de l'impérialisme américain dans la conquête des Philippines ont été payées par le peuple philippin lui-même.,BeetleLM/beetlelm_zho-fra_balanced,step-8000,fra,4.188685894012451,65.93608699707009
476,Ils ont été contraints de payer des impôts au régime colonial américain pour couvrir une grande partie des dépenses et des intérêts des obligations émises au nom du gouvernement philippin par les établissements bancaires de Wall Street.,BeetleLM/beetlelm_zho-fra_balanced,step-8000,fra,5.1608428955078125,174.31131992930523
477,"Naturellement, les superprofits issus de l'exploitation prolongée du peuple philippin pourraient constituer les avantages fondamentaux de l'impérialisme américain.",BeetleLM/beetlelm_zho-fra_balanced,step-8000,fra,4.928175449371338,138.12726210536698
478,"Pour comprendre les Templiers, il faut comprendre le contexte qui a poussé à la création de l'ordre.",BeetleLM/beetlelm_zho-fra_balanced,step-8000,fra,4.417422294616699,82.88236344852403
479,Ces événements ont eu lieu dans la période généralement considérée comme le Haut Moyen Âge – période de l'histoire en Europe courant du XIe au XIIIe siècle (1000-1300).,BeetleLM/beetlelm_zho-fra_balanced,step-8000,fra,3.5839924812316895,36.017051576927756
480,"Le Moyen Âge Central a été précédé par le Haut Moyen Âge et suivi par le Bas Moyen Âge, qui par convention se termine vers 1500.",BeetleLM/beetlelm_zho-fra_balanced,step-8000,fra,3.9101037979125977,49.90413164927863
481,"Le déterminisme technologique est un terme qui englobe un large éventail d'idées dans la pratique, allant de la poussée technologique ou de l'impératif technologique à un sens strict selon lequel le destin de l'humanité est dicté par une logique sous-jacente liée aux lois scientifiques et à leur manifestation dans les technologies.",BeetleLM/beetlelm_zho-fra_balanced,step-8000,fra,5.016090393066406,150.8205007672565
482,"La plupart des interprétations du déterminisme technologique s’accordent sur deux idées générales : le développement technologique lui-même se déroule selon un processus dépassant largement les influences culturelles et politiques, et la technologie a une incidence sur les sociétés conditionnées intrinsèquement plutôt que socialement.",BeetleLM/beetlelm_zho-fra_balanced,step-8000,fra,5.649332046508789,284.1016357526896
483,"Par exemple, on pourrait dire que l'automobile conduit nécessairement au développement des routes.",BeetleLM/beetlelm_zho-fra_balanced,step-8000,fra,4.3683762550354,78.91538914538589
484,"Cependant, un réseau routier national n'est pas économiquement viable pour une poignée de voitures, c'est pourquoi de nouvelles méthodes de production sont développées pour réduire le coût de la possession d'une voiture.",BeetleLM/beetlelm_zho-fra_balanced,step-8000,fra,4.589869499206543,98.48157739932519
485,"La possession massive de voitures entraîne également une plus grande incidence des accidents sur les routes, ce qui conduit à l’invention de nouvelles techniques dans le domaine des soins de santé pour soigner les lésions corporelles.",BeetleLM/beetlelm_zho-fra_balanced,step-8000,fra,5.34775972366333,210.13700519068402
486,"Le romantisme présentait un important élément de déterminisme culturel, tiré d'écrivains tels que Goethe, Fichte et Schlegel.",BeetleLM/beetlelm_zho-fra_balanced,step-8000,fra,5.1976518630981445,180.84708918842705
487,"D’après les théories du Romantisme, la géographie aurait façonné les individus et, avec le temps, des coutumes et une culture liées à cette géographie seraient apparues. Celles-ci, en harmonie avec les lieux occupés par la société, seraient préférables aux lois imposées arbitrairement.",BeetleLM/beetlelm_zho-fra_balanced,step-8000,fra,5.249049663543701,190.38525241307013
488,"De la même manière que Paris est connue comme la capitale de la mode du monde contemporain, Constantinople était considérée comme celle de l’Europe féodale.",BeetleLM/beetlelm_zho-fra_balanced,step-8000,fra,4.504905700683594,90.45981334809485
489,"Sa réputation en tant qu'épicentre du luxe a débuté aux environs de l'an 400, et duré jusqu'à 1100 environ.",BeetleLM/beetlelm_zho-fra_balanced,step-8000,fra,4.529786586761475,92.73876728939408
490,"Son statut a décliné au cours du douzième siècle, principalement à cause du fait que les Croisés s'en revenaient chargés de présents tels que de la soie et des épices, avec lesquels les marchés byzantins pouvaient difficilement rivaliser.",BeetleLM/beetlelm_zho-fra_balanced,step-8000,fra,5.588736057281494,267.3974309972311
491,C'est à cette époque que le titre de capitale de la mode fut transféré de Constantinople à Paris.,BeetleLM/beetlelm_zho-fra_balanced,step-8000,fra,3.8985955715179443,49.33311559729616
492,Le style gothique a connu son apogée entre le Xe–XIe siècle et le XIVe siècle.,BeetleLM/beetlelm_zho-fra_balanced,step-8000,fra,4.506766319274902,90.6282812372183
493,"Au début, la robe était fortement influencée par la culture byzantine, à l’est.",BeetleLM/beetlelm_zho-fra_balanced,step-8000,fra,5.043911457061768,155.0754010558847
494,"Cependant, en raison de la lenteur des moyens de communication, les modes occidentales pouvaient accuser un retard de 25 à 30 ans.",BeetleLM/beetlelm_zho-fra_balanced,step-8000,fra,5.085021018981934,161.58333551911667
495,"Au cours de la fin du Moyen Âge, l'Europe occidentale a commencé à développer son propre style. Un des plus grands progrès de l'époque, suite aux croisades, fut l'utilisation de boutons pour la fermeture des vêtements.",BeetleLM/beetlelm_zho-fra_balanced,step-8000,fra,4.034373760223389,56.50752189766532
496,L'agriculture de subsistance est une agriculture pratiquée pour produire suffisamment de nourriture pour répondre uniquement aux besoins de l'agriculteur et de sa famille.,BeetleLM/beetlelm_zho-fra_balanced,step-8000,fra,4.815275192260742,123.38076106931713
497,"L'agriculture de subsistance est un système simple, souvent biologique, utilisant des semences conservées originaires de l'écorégion, combinées à la rotation des cultures ou à d'autres techniques relativement simples pour maximiser le rendement.",BeetleLM/beetlelm_zho-fra_balanced,step-8000,fra,4.956340789794922,142.07296871308358
498,"Historiquement, la plupart des agriculteurs pratiquaient une agriculture de subsistance et c'est encore le cas dans de nombreux pays en voie de développement.",BeetleLM/beetlelm_zho-fra_balanced,step-8000,fra,4.828453063964844,125.0174170461191
499,Les sous-cultures rassemblent des individus se sentant négligés par les normes sociétales et partageant les mêmes idées ce qui leur permet de développer un sentiment d'identité.,BeetleLM/beetlelm_zho-fra_balanced,step-8000,fra,5.1103692054748535,165.731532568645
500,"Les sous-cultures peuvent se distinguer par l'âge, l'origine ethnique, la classe, la localisation et / ou le sexe des membres.",BeetleLM/beetlelm_zho-fra_balanced,step-8000,fra,4.413934230804443,82.59376808802338
501,"Les critères qui déterminent une sous-culture comme distincte peuvent être linguistiques, esthétiques, religieux, politiques, sexuels, géographiques ou une combinaison de facteurs.",BeetleLM/beetlelm_zho-fra_balanced,step-8000,fra,5.040701866149902,154.57847035672293
502,"Les membres d'une sous-culture signalent souvent leur appartenance par un usage distinctif et symbolique du style, qui englobe les modes, les maniérismes et l'argot.",BeetleLM/beetlelm_zho-fra_balanced,step-8000,fra,5.031237602233887,153.12240010272782
503,"L'une des méthodes les plus courantes utilisées pour illustrer l'importance de la socialisation est de s'inspirer des quelques cas malheureux d'enfants qui, par négligence, malheur ou abus volontaire, n'ont pas été socialisés par des adultes pendant leur enfance.",BeetleLM/beetlelm_zho-fra_balanced,step-8000,fra,4.857919216156006,128.75600975407204
504,"Ces enfants sont considérés comme « féroces » ou sauvages. Certains enfants sauvages ont été enfermés par des personnes (généralement leurs propres parents) ; dans certains cas, l'abandon de cet enfant était dû au rejet par les parents d'une déficience intellectuelle ou physique grave dont souffrait l'enfant.",BeetleLM/beetlelm_zho-fra_balanced,step-8000,fra,5.352213382720947,211.07497090656037
505,Les enfants sauvages peuvent avoir subi de graves abus ou traumatismes avant d'être abandonnés ou de s'enfuir.,BeetleLM/beetlelm_zho-fra_balanced,step-8000,fra,4.9686665534973145,143.8349632104005
506,D’autres auraient été élevés par des animaux ; certains auraient vécu seuls dans la nature.,BeetleLM/beetlelm_zho-fra_balanced,step-8000,fra,6.623093605041504,752.2687233829647
507,"Lorsqu'ils sont entièrement élevés par des espèces non humaines, les enfants sauvages affichent des comportements (dans les limites de leurs dispositions physiques) presque identiques à ceux des animaux qui les ont élevés, tels que la peur ou l'indifférence envers les humains.",BeetleLM/beetlelm_zho-fra_balanced,step-8000,fra,4.9215593338012695,137.21641264110957
508,"Tandis que la pédagogie de projet devrait rendre l'apprentissage plus facile et plus intéressant, le soutien va plus loin.",BeetleLM/beetlelm_zho-fra_balanced,step-8000,fra,5.559713840484619,259.74849618310026
509,Le soutien n'est pas une méthode d'apprentissage mais davantage un moyen d'aider les apprenants qui découvrent un nouvel enseignement tel que l'utilisation d'un nouveau programme ou le début d'un nouveau projet.,BeetleLM/beetlelm_zho-fra_balanced,step-8000,fra,4.224146842956543,68.31619423629985
