sentence_id,sentence,repo,revision,iso_code,nll,ppl
0,"« Nous avons à présent des souris de 4 mois qui ne sont pas diabétiques alors qu'elles l'étaient auparavant », a-t-il ajouté.",BeetleLM/beetlelm_nld-fra_balanced,step-8000,fra,5.050276279449463,156.06557624215898
1,"Le Dr Ehud Ur, professeur de médecine à l'Université Dalhousie de Halifax (Nouvelle-Écosse) et président de la division clinique et scientifique de l'Association canadienne du diabète, a averti que la recherche en était encore à ses débuts.",BeetleLM/beetlelm_nld-fra_balanced,step-8000,fra,5.365624904632568,213.92487556594983
2,"À l'instar d'autres experts, il se montre sceptique quant à la possibilité de guérir le diabète, faisant remarquer que ces résultats ne sont pas applicables aux personnes qui souffrent déjà de diabète de type 1.",BeetleLM/beetlelm_nld-fra_balanced,step-8000,fra,5.7733473777771,321.6124913384711
3,"Lundi, lors d'une émission de radio sur Sveriges Radio, en Suède, Sara Danius, secrétaire permanente du Comité Nobel de Littérature de l'Académie Suédoise, a annoncé publiquement que le comité, incapable de joindre directement Bob Dylan au sujet du prix Nobel de littérature 2016, avait renoncé à le contacter.",BeetleLM/beetlelm_nld-fra_balanced,step-8000,fra,6.1766510009765625,481.3771223107505
4,"Danius a déclaré : « En ce moment, nous ne faisons rien. J'ai appelé et envoyé des courriels à son plus proche collaborateur et j'ai reçu des réponses très amicales. Pour l'instant, c'est certainement suffisant. »",BeetleLM/beetlelm_nld-fra_balanced,step-8000,fra,5.092034339904785,162.72055448635473
5,"Auparavant, le PDG de Ring, Jamie Siminoff, a fait remarquer qu'il a lancé l'entreprise lorsque la sonnette de sa porte d'entrée n'était pas audible depuis son magasin dans son garage.",BeetleLM/beetlelm_nld-fra_balanced,step-8000,fra,5.28155517578125,196.67550261657422
6,Il dit avoir conçu une sonnette de porte Wi-Fi.,BeetleLM/beetlelm_nld-fra_balanced,step-8000,fra,7.368013858795166,1584.4836475122918
7,M. Siminoff a déclaré que les ventes ont augmenté après son apparition en 2013 dans un épisode de Shark Tank où le panel de la série a refusé de financer la start-up.,BeetleLM/beetlelm_nld-fra_balanced,step-8000,fra,5.8374457359313965,342.9023579471059
8,"Fin 2017, Siminoff est apparu sur la chaîne de télé-achat QVC.",BeetleLM/beetlelm_nld-fra_balanced,step-8000,fra,6.400328159332275,602.0425713472974
9,"Ring a également réglé un procès avec une entreprise de sécurité concurrente, l'ADT Corporation.",BeetleLM/beetlelm_nld-fra_balanced,step-8000,fra,5.795644283294678,328.8639973204211
10,"Même si un vaccin expérimental semble jusqu'ici capable de réduire le taux de mortalité d'Ebola, aucun remède n'a encore été suffisamment efficace pour traiter l'infection existante.",BeetleLM/beetlelm_nld-fra_balanced,step-8000,fra,6.11341667175293,451.88000627851187
11,"Même si l'administration d'un cocktail d'anticorps, ZMapp, avait d'abord montré des signes prometteurs sur le terrain, des études formelles ont démontré que sa capacité à limiter les décès ne répondait pas aux attentes.",BeetleLM/beetlelm_nld-fra_balanced,step-8000,fra,5.627762794494629,278.0393900538511
12,"Dans l'essai PALM, le ZMapp a servi de témoin, ce qui signifie que les scientifiques l'ont utilisé comme base de référence et lui ont comparé les trois autres traitements.",BeetleLM/beetlelm_nld-fra_balanced,step-8000,fra,5.427055835723877,227.47852440692094
13,La Fédération américaine de gymnastique soutient la lettre du Comité olympique des États-Unis et accepte la nécessité absolue de la famille olympique de promouvoir un environnement sûr pour tous nos athlètes.,BeetleLM/beetlelm_nld-fra_balanced,step-8000,fra,5.233159065246582,187.38382722378176
14,"Nous sommes d'accord avec la déclaration de l'USOC (Comité olympique des États-Unis) selon laquelle les intérêts de nos athlètes et de nos clubs, ainsi que de leur sport, pourraient être mieux servis. Cela peut être fait en allant de l'avant et en procédant plutôt à des changements significatifs au sein de notre organisation, qu'à la révocation d'accréditation.",BeetleLM/beetlelm_nld-fra_balanced,step-8000,fra,5.005767822265625,149.27165326702402
15,USA Gymnastics soutient une enquête indépendante qui pourrait faire la lumière sur la façon dont l’abus de la proportion décrite si courageusement par les survivants de Larry Nassar a pu passer inaperçu pendant si longtemps et adopte tout changement nécessaire et approprié.,BeetleLM/beetlelm_nld-fra_balanced,step-8000,fra,6.553646087646484,701.7983328742341
16,"USA Gymnastics et l'USOC ont le même objectif : rendre la gymnastique, ainsi que d'autres sports, aussi sûrs que possible pour que les athlètes puissent poursuivre leurs rêves dans un environnement sûr, positif et responsabilisant.",BeetleLM/beetlelm_nld-fra_balanced,step-8000,fra,6.07084321975708,433.0456803391448
17,"Tout au long des années 1960, Brzezinski a travaillé pour John F. Kennedy en tant que conseiller, puis pour l'administration de Lyndon B. Johnson.",BeetleLM/beetlelm_nld-fra_balanced,step-8000,fra,5.511701583862305,247.57203343917985
18,"Lors des sélections de 1976, il a conseillé Carter en matière de politique étrangère, puis a été conseiller à la sécurité nationale (NSA) de 1977 à 1981, succédant à Henry Kissinger.",BeetleLM/beetlelm_nld-fra_balanced,step-8000,fra,5.237504959106445,188.19994955396902
19,"Pendant son temps au sein de la NSA, il a aidé Carter à résoudre diplomatiquement des questions internationales telles que les accords de Camp David, en 1978, la normalisation des relations entre les États-Unis et la Chine à la fin des années 1970, la révolution iranienne et ses conséquences comme la prise d'otages en Iran, en 1979, et l'invasion des forces soviétiques en Afghanistan, en 1979.",BeetleLM/beetlelm_nld-fra_balanced,step-8000,fra,4.689786434173584,108.82993497035217
20,"Le film, avec Ryan Gosling et Emma Stone, a reçu des nominations dans toutes les grandes catégories.",BeetleLM/beetlelm_nld-fra_balanced,step-8000,fra,5.74516487121582,312.6751747168511
21,Golsling et Stone ont respectivement été nominés pour le Meilleur Acteur et la Meilleure Actrice.,BeetleLM/beetlelm_nld-fra_balanced,step-8000,fra,7.3413496017456055,1542.7928652014105
22,"Parmi les autres nominations figurent celles du meilleur film, du meilleur réalisateur, de la meilleure cinématographie, des meilleurs costumes, du meilleur montage, de la meilleure musique originale, des meilleurs décors, du meilleur montage sonore, du meilleur mixage et du meilleur scénario original.",BeetleLM/beetlelm_nld-fra_balanced,step-8000,fra,5.180593490600586,177.78829537047162
23,"Deux chansons du film, Audition (The Fools Who Dream) et City of Stars, ont été nominées pour la meilleure chanson originale. Le studio Lionsgate a reçu 26 nominations — plus que tout autre studio.",BeetleLM/beetlelm_nld-fra_balanced,step-8000,fra,6.266979217529297,526.8833714638736
24,"Tard dimanche, le président des États-Unis Donald Trump, dans une déclaration faite par l'intermédiaire du secrétaire de presse, a annoncé que les troupes américaines allaient se retirer de la Syrie.",BeetleLM/beetlelm_nld-fra_balanced,step-8000,fra,5.264925956726074,193.4319859196528
25,L’annonce a été faite après que M. Trump ait eu une conversation téléphonique avec le président turc Recep Tayyip Erdoğan.,BeetleLM/beetlelm_nld-fra_balanced,step-8000,fra,7.034250736236572,1134.84429585547
26,"La Turquie prendrait également en charge la garde des combattants d'ISIS capturés que, selon la déclaration, les nations européennes ont refusé de rapatrier.",BeetleLM/beetlelm_nld-fra_balanced,step-8000,fra,6.032781600952148,416.87299245250114
27,"Cela confirme non seulement qu'au moins certains dinosaures avaient des plumes, une théorie déjà très répandue, mais fournit des détails que les fossiles ne peuvent généralement pas fournir, comme la couleur et la disposition tridimensionnelle.",BeetleLM/beetlelm_nld-fra_balanced,step-8000,fra,5.606722354888916,272.2504337152446
28,Les scientifiques disent que le plumage de cet animal était brun châtain sur le dessus et de couleur pâle ou caroténoïde sur le dessous.,BeetleLM/beetlelm_nld-fra_balanced,step-8000,fra,5.910085201263428,368.7375709779355
29,Cette découverte permet également de mieux comprendre l'évolution des plumes chez les oiseaux.,BeetleLM/beetlelm_nld-fra_balanced,step-8000,fra,5.334991455078125,207.47097597708384
30,"Étant donné que les plumes de dinosaure n'ont pas une tige entièrement développée, que l'on appelle rachis, mais montrent cependant d'autres caractéristiques propres aux plumes – barbes et barbules – les chercheurs en ont déduit que le rachis était probablement un développement évolutif ultérieur à ces autres caractéristiques.",BeetleLM/beetlelm_nld-fra_balanced,step-8000,fra,5.839151859283447,343.4878910212648
31,"La structure des plumes suggère qu’elles n’étaient pas utilisées en vol mais plutôt pour la régulation ou l’affichage de la température. Les chercheurs ont suggéré que, même s’il s’agit de la queue d’un jeune dinosaure, l’échantillon montre un plumage d’adulte et non le duvet d’un poussin.",BeetleLM/beetlelm_nld-fra_balanced,step-8000,fra,5.823188304901123,338.0481378108767
32,"Les scientifiques précisent qu'il s'agit certes de la queue d'un dinosaure juvénile, mais l'échantillon révèle un plumage appartenant à un individu adulte, et non à un jeune.",BeetleLM/beetlelm_nld-fra_balanced,step-8000,fra,4.781714916229248,119.3087792670741
33,"Une voiture piégée a explosé au siège de la police à Gaziantep, en Turquie, hier matin, tuant deux officiers de police et blessant plus de vingt autres personnes.",BeetleLM/beetlelm_nld-fra_balanced,step-8000,fra,5.794338226318359,328.43476256599877
34,Le bureau du gouverneur a déclaré que dix-neuf des blessés étaient des officiers de police.,BeetleLM/beetlelm_nld-fra_balanced,step-8000,fra,5.573918342590332,263.46442321138807
35,La police a déclaré soupçonner un militant présumé de Daesh (ÉI) comme le suspect à l'origine de cette attaque.,BeetleLM/beetlelm_nld-fra_balanced,step-8000,fra,5.959042072296143,387.2389995451722
36,"Ils ont constaté que le Soleil fonctionnait selon les mêmes principes de base que les autres étoiles. L'activité de toutes les étoiles du système est déterminée par leur luminosité, leur rotation et rien d'autre.",BeetleLM/beetlelm_nld-fra_balanced,step-8000,fra,5.085073471069336,161.59181112463375
37,"La luminosité et la rotation sont utilisées conjointement afin de déterminer le nombre de Rossby d'une étoile, qui est lié au flux de plasma.",BeetleLM/beetlelm_nld-fra_balanced,step-8000,fra,5.863730430603027,352.03493949566666
38,"En ce qui concerne les inversions magnétiques, plus le nombre de Rossby est petit, moins l’étoile est active .",BeetleLM/beetlelm_nld-fra_balanced,step-8000,fra,5.937783718109131,379.0938190473602
39,"Au cours de son voyage, Iwasaki a eu des problèmes à de nombreuses occasions.",BeetleLM/beetlelm_nld-fra_balanced,step-8000,fra,4.9983673095703125,148.17104406130892
40,"Il a été volé par des pirates, attaqué au Tibet par un chien enragé, a échappé à un mariage au Népal et a été arrêté en Inde.",BeetleLM/beetlelm_nld-fra_balanced,step-8000,fra,5.646393775939941,283.2680934638778
41,"La norme 802.11n fonctionne à la fois sur les fréquences 2,4 GHz et 5,0 GHz.",BeetleLM/beetlelm_nld-fra_balanced,step-8000,fra,6.4127197265625,609.5492359608511
42,"Ceci autorisera la rétro-compatibilité avec les itérations 802.11a, b et g, sous réserve que la station possède deux radios.",BeetleLM/beetlelm_nld-fra_balanced,step-8000,fra,6.47250509262085,647.1027505416876
43,"Les vitesses de la norme Wi-Fi 802.11n sont sensiblement plus rapides que celles de ses prédécesseurs, avec un débit théorique maximum de 600 Mbit/s.",BeetleLM/beetlelm_nld-fra_balanced,step-8000,fra,6.447458267211914,631.0961746757611
44,"Duvall, qui est marié et a deux enfants adultes, n’a pas fait bonne impression à Miller, à qui l’histoire a été relatée.",BeetleLM/beetlelm_nld-fra_balanced,step-8000,fra,5.737978935241699,310.4363645378455
45,"Lorsqu'on lui a demandé de commenter, Miller a déclaré : « Mike parle beaucoup pendant l'audience… Je me préparais, donc je n'ai pas vraiment entendu ce qu'il disait ».",BeetleLM/beetlelm_nld-fra_balanced,step-8000,fra,4.825771331787109,124.6826029575632
46,"« Nous nous efforcerons de réduire les émissions de dioxyde de carbone par unité de PIB de manière significative d'ici 2020 par rapport au niveau de 2005 », a déclaré M. Hu.",BeetleLM/beetlelm_nld-fra_balanced,step-8000,fra,5.568881511688232,262.140733861127
47,"Il n'a pas chiffré ces réductions, disant qu'elles seront basées sur la production économique chinoise.",BeetleLM/beetlelm_nld-fra_balanced,step-8000,fra,5.475758075714111,238.83145064481286
48,Hu a encouragé les pays en voie de développement « à éviter l'ancienne méthode qui consistait à polluer d'abord et à nettoyer ensuite ».,BeetleLM/beetlelm_nld-fra_balanced,step-8000,fra,6.407748222351074,606.5263796646409
49,"Il a ajouté qu’« on ne devrait cependant pas leur demander d’assumer des obligations qui dépassent leur stade de développement, leur responsabilité et leurs capacités. »",BeetleLM/beetlelm_nld-fra_balanced,step-8000,fra,6.269598484039307,528.2652283691612
50,Le groupe d’étude sur l’Irak a présenté son rapport aujourd’hui à 12 h GMT.,BeetleLM/beetlelm_nld-fra_balanced,step-8000,fra,6.210689544677734,498.04455688440476
51,"Il avertit que personne ne peut garantir que toute action en Irak à ce stade mettra fin à la guerre sectaire, à la violence croissante ou au glissement vers le chaos.",BeetleLM/beetlelm_nld-fra_balanced,step-8000,fra,6.059445858001709,428.13812179788084
52,Le rapport s'ouvre par un appel à un débat ouvert et à la formation d'un consensus aux États-Unis sur la politique à l'égard du Moyen-Orient.,BeetleLM/beetlelm_nld-fra_balanced,step-8000,fra,4.485577583312988,88.72818393427053
53,Le rapport est très critique envers presque tous les aspects de la politique actuelle du gouvernement à l'égard de l'Irak et plaide vivement pour un changement de direction immédiat.,BeetleLM/beetlelm_nld-fra_balanced,step-8000,fra,5.703701019287109,299.97556438449203
54,La première de ses 78 recommandations est qu'une nouvelle initiative diplomatique devrait être prise avant la fin de l'année pour sécuriser les frontières de l'Irak contre les interventions hostiles et afin de rétablir les relations diplomatiques avec ses voisins.,BeetleLM/beetlelm_nld-fra_balanced,step-8000,fra,5.469027042388916,237.2292664182789
55,"L'actuelle sénatrice et Première Dame d'Argentine Cristina Fernandez de Kirchner a annoncé sa candidature présidentielle, hier soir, à La Plata, une ville située à 50 kilomètres (31 miles) de Buenos Aires.",BeetleLM/beetlelm_nld-fra_balanced,step-8000,fra,5.2863850593566895,197.62772009504084
56,"Mme Kirchner a annoncé son intention de se présenter à la présidence au Théâtre argentin, le même endroit où elle a commencé sa campagne 2005 pour le Sénat en tant que membre de la délégation de la province de Buenos Aires.",BeetleLM/beetlelm_nld-fra_balanced,step-8000,fra,4.758615970611572,116.58445787058965
57,Le débat a été déclenché par la controverse sur les dépenses liées aux secours et à la reconstruction à la suite de l'ouragan Katrina ; ce que certains conservateurs en matière budgétaire ont appelé avec humour « l'accord Bush pour la Nouvelle-Orléans ».,BeetleLM/beetlelm_nld-fra_balanced,step-8000,fra,5.731492519378662,308.42926166755575
58,Les critiques des libéraux sur l'effort de reconstruction se sont concentrées sur l'attribution de contrats de reconstruction à des personnes perçues comme des initiés de Washington.,BeetleLM/beetlelm_nld-fra_balanced,step-8000,fra,5.596948146820068,269.6023638043673
59,Plus de 4 000 000 personnes sont se sont rendues à Rome pour l'enterrement.,BeetleLM/beetlelm_nld-fra_balanced,step-8000,fra,4.72117805480957,112.30047088220613
60,"En raison du nombre important de personnes présentes, il n'a pas été possible pour tout le monde d'assister aux funérailles sur la place Saint-Pierre.",BeetleLM/beetlelm_nld-fra_balanced,step-8000,fra,4.3170857429504395,74.96982827657376
61,Plusieurs grands écrans de télévision ont été installés à différents endroits à Rome pour permettre aux gens de regarder la cérémonie.,BeetleLM/beetlelm_nld-fra_balanced,step-8000,fra,5.549441814422607,257.0940096785484
62,"Dans de nombreuses autres villes d'Italie et dans le reste du monde, en particulier en Pologne, des installations similaires ont été réalisées et ont été vues par un grand nombre de personnes.",BeetleLM/beetlelm_nld-fra_balanced,step-8000,fra,4.299350261688232,73.65192367323893
63,"Les historiens ont critiqué les politiques passées du FBI pour avoir concentré les ressources sur des affaires faciles à résoudre, en particulier les affaires de voitures volées, avec l'intention d'augmenter le taux de réussite de l'agence.",BeetleLM/beetlelm_nld-fra_balanced,step-8000,fra,5.503505706787109,245.551255820032
64,"Le Congrès a lancé le financement de l'initiative contre la pornographie au cours de l'exercice 2005, tout en précisant que le FBI s'apprêtait à affecter dix agents à la lutte contre la pornographie adulte.",BeetleLM/beetlelm_nld-fra_balanced,step-8000,fra,5.643186092376709,282.3609148053691
65,"Robin Uthappa a obtenu le score le plus élevé des manches, 70 points en seulement 41 balles en frappant 11 fois quatre runs et 2 fois six runs.",BeetleLM/beetlelm_nld-fra_balanced,step-8000,fra,6.931546211242676,1024.0761942132647
66,"Les batteurs d'ordre moyen, Sachin Tendulkar et Rahul Dravid, ont obtenu de bons résultats et ont accompli un century ensemble.",BeetleLM/beetlelm_nld-fra_balanced,step-8000,fra,7.038332462310791,1139.4858858131588
67,"Mais après avoir perdu le guichet de son capitaine, l'Inde n'a réalisé que 36 courses et perdu sept guichets jusqu'à la fin de la manche.",BeetleLM/beetlelm_nld-fra_balanced,step-8000,fra,4.899677276611328,134.2464482245855
68,"Le président américain George W. Bush est arrivé à Singapour le matin du 16 novembre, débutant une tournée d’une semaine en Asie.",BeetleLM/beetlelm_nld-fra_balanced,step-8000,fra,5.693772792816162,297.01207448743486
69,"Il a été accueilli par Wong Kan Seng, le vice-premier ministre de Singapour, et a discuté de commerce et de terrorisme avec Lee Hsien Loong, le Premier ministre de Singapour.",BeetleLM/beetlelm_nld-fra_balanced,step-8000,fra,5.228849411010742,186.5780053730535
70,"Après sept jours de défaites électorales aux élections de mi-mandat, Bush a fait part de son projet d'élargir le commerce en Asie.",BeetleLM/beetlelm_nld-fra_balanced,step-8000,fra,5.405942440032959,222.72602752773207
71,"Le Premier ministre Stephen Harper a accepté d'envoyer la « loi sur la qualité de l'air » du gouvernement à un comité multipartite pour examen, avant sa deuxième lecture, après la réunion de 25 minutes de mardi avec le chef du NPD, Jack Layton, au CPM.",BeetleLM/beetlelm_nld-fra_balanced,step-8000,fra,5.436933994293213,229.73672842827418
72,"Layton avait demandé des changements au sujet du projet de loi environnemental des conservateurs lors de la réunion avec le premier ministre, demandant une « reformulation complète et approfondie » du projet de loi environnemental du parti conservateur.",BeetleLM/beetlelm_nld-fra_balanced,step-8000,fra,6.401993274688721,603.0458767558887
73,"Et depuis, le gouvernement fédéral a pris les devants en se chargeant du financement du Mersey Hospital à Devonport, en Tasmanie. Le gouvernement d'état et certains parlementaires ont qualifié cet acte de farce à l'approche des élections de novembre.",BeetleLM/beetlelm_nld-fra_balanced,step-8000,fra,5.922545909881592,373.3610484859704
74,"Mais le Premier ministre John Howard a déclaré que cette loi visait uniquement à éviter que les installations de l'hôpital ne soient déclassées par le gouvernement de Tasmanie, en donnant 45 millions de dollars australiens supplémentaires.",BeetleLM/beetlelm_nld-fra_balanced,step-8000,fra,5.397476673126221,220.84843971874352
75,"D'après le dernier bulletin, les relevés du niveau de la mer indiquent qu'un tsunami s'est produit. Une activité tsunami précise a été enregistrée près de Pago Pago et de Niue.",BeetleLM/beetlelm_nld-fra_balanced,step-8000,fra,5.4157586097717285,224.92310984362973
76,"Aucun dommage ou blessure grave n’a été signalé à Tonga, mais l’électricité a été temporairement coupée, ce qui aurait empêché les autorités tonganes de recevoir l’alerte au tsunami émise par le centre d’alerte des tsunamis dans le Pacifique.",BeetleLM/beetlelm_nld-fra_balanced,step-8000,fra,6.421628475189209,615.0038175522035
77,Quatorze écoles d’Hawaii situées sur ou près des côtes ont été fermées toute la journée de mercredi malgré la levée des alertes.,BeetleLM/beetlelm_nld-fra_balanced,step-8000,fra,6.280153274536133,533.8704863058932
78,Le président américain George W. Bush a accueilli cette annonce avec satisfaction.,BeetleLM/beetlelm_nld-fra_balanced,step-8000,fra,6.626082420349121,754.5204790234696
79,"Le porte-parole de Bush, Gordon Johndroe, a qualifié la promesse de la Corée du Nord « d'étape majeure vers l'objectif de la dénucléarisation vérifiable de la péninsule coréenne ».",BeetleLM/beetlelm_nld-fra_balanced,step-8000,fra,5.269210338592529,194.2625002624096
80,"La tempête subtropicale Jerry, 10ème tempête de la saison des ouragans à porter un nom, est apparue ce jour dans l'océan Atlantique.",BeetleLM/beetlelm_nld-fra_balanced,step-8000,fra,5.493663787841797,243.14641380515178
81,"Le National Hurricane Center (NHC) affirme qu'à ce stade, Jerry ne représente aucune menace pour les terres.",BeetleLM/beetlelm_nld-fra_balanced,step-8000,fra,5.946026802062988,382.23163610140097
82,"D’après le U.S. Corps of Engineers, une pluviométrie de 6 pouces pourrait ouvrir une brèche dans les digues précédemment endommagées.",BeetleLM/beetlelm_nld-fra_balanced,step-8000,fra,6.431758880615234,621.265719814611
83,"Le neuvième district, qui a connu des inondations atteignant 20 pieds de haut lors de l'ouragan Katrina, est actuellement sous les eaux jusqu'à la taille car la digue voisine a été débordée.",BeetleLM/beetlelm_nld-fra_balanced,step-8000,fra,5.81514310836792,335.3393849394723
84,L'eau se déverse sur la digue dans une section de 100 pieds de large.,BeetleLM/beetlelm_nld-fra_balanced,step-8000,fra,5.158454418182373,173.89547810616145
85,"Lors de son discours sur Wikinews le mois dernier, Adam Cuerden, directeur de Commons, a exprimé sa frustration quant aux suppressions qui avaient été faites.",BeetleLM/beetlelm_nld-fra_balanced,step-8000,fra,6.718711853027344,827.7505600558296
86,"« Il [Wales] nous a carrément menti dès le départ. Tout d'abord en prétextant des raison légales, puis en faisant semblant de nous écouter jusqu'à ce qu'il ait supprimé son œuvre. »",BeetleLM/beetlelm_nld-fra_balanced,step-8000,fra,5.494630336761475,243.38154032107371
87,Le mécontentement de la communauté a entraîné les efforts actuels visant à concevoir une politique relative au contenu à caractère sexuel du site qui héberge des millions de médias libres d’accès.,BeetleLM/beetlelm_nld-fra_balanced,step-8000,fra,6.778110504150391,878.4074079255142
88,"Le travail effectué était principalement théorique, mais le programme a été écrit pour simuler les observations faites de la galaxie du Sagittaire.",BeetleLM/beetlelm_nld-fra_balanced,step-8000,fra,5.431453704833984,228.48114827088352
89,L’effet que l’équipe recherchait serait causé par les forces de marée entre la matière noire de la galaxie et la matière noire de la Voie lactée.,BeetleLM/beetlelm_nld-fra_balanced,step-8000,fra,5.0814104080200195,161.00097293166434
90,"Tout comme la lune exerce une traction sur la terre, provoquant des marées, la Voie lactée exerce une force sur la galaxie du Sagittaire.",BeetleLM/beetlelm_nld-fra_balanced,step-8000,fra,5.332718372344971,206.9999128694959
91,Les scientifiques ont pu conclure que la matière noire affecte les autres matières noires de la même manière que la matière normale.,BeetleLM/beetlelm_nld-fra_balanced,step-8000,fra,5.972238063812256,392.38286666795574
92,"Selon cette théorie, la majeure partie de la matière noire autour d’une galaxie se trouve dans une sorte de halo, et est constituée d’un grand nombre de petites particules.",BeetleLM/beetlelm_nld-fra_balanced,step-8000,fra,4.786782741546631,119.91495000558851
93,Les reportages télévisés montrent de la fumée blanche provenant de l'usine.,BeetleLM/beetlelm_nld-fra_balanced,step-8000,fra,5.528068542480469,251.65737578288963
94,"Les autorités locales avertissent les habitants des environs de rester à l’intérieur, d’éteindre les climatiseurs et de ne pas boire l’eau du robinet.",BeetleLM/beetlelm_nld-fra_balanced,step-8000,fra,6.8318891525268555,926.9402910358858
95,"Selon l'agence nucléaire japonaise, du césium et de l'iode radioactifs ont été identifiés à la centrale.",BeetleLM/beetlelm_nld-fra_balanced,step-8000,fra,5.489671230316162,242.17757312394403
96,Les autorités supposent que cela signifie que les réservoirs de combustible d'uranium sur le site comporteraient des fissures et des fuites.,BeetleLM/beetlelm_nld-fra_balanced,step-8000,fra,6.323359489440918,557.4425727124092
