sentence_id,sentence,repo,revision,iso_code,nll,ppl
712,"Goma est une ville touristique située à l'extrême est de la République Démocratique du Congo, près du Rwanda.",BeetleLM/beetlelm_zho-fra_balanced,step-8000,fra,4.114630699157715,61.22959794480258
713,"En 2002, Goma a été détruite par la lave du volcan Nyiragongo qui a enseveli la plupart des rues de la ville, en particulier le centre-ville.",BeetleLM/beetlelm_zho-fra_balanced,step-8000,fra,4.714442253112793,111.54657906318727
714,"Bien que Goma soit raisonnablement sûre, toute visite à l'extérieur de Goma doit faire l'objet de recherches pour comprendre l'état des combats qui persistent dans la province du Nord-Kivu.",BeetleLM/beetlelm_zho-fra_balanced,step-8000,fra,4.834010601043701,125.71414021602003
715,La ville est également le point de départ pour l'ascension du volcan Nyiragongo ainsi que pour des treks de pistage des gorilles des montagnes parmi les moins chers d'Afrique.,BeetleLM/beetlelm_zho-fra_balanced,step-8000,fra,5.226705551147461,186.17843673858144
716,Vous pouvez utiliser des boda-boda (moto taxi) pour vous déplacer dans Goma. Le prix normal (local) est d’environ 500 francs congolais pour une petite course.,BeetleLM/beetlelm_zho-fra_balanced,step-8000,fra,5.974427700042725,393.2429837371226
717,"Combiné à sa relative inaccessibilité, « Tombouctou » est devenu une métaphore pour les pays lointains et exotiques.",BeetleLM/beetlelm_zho-fra_balanced,step-8000,fra,5.392525672912598,219.75772134797083
718,"Aujourd’hui, Tombouctou est une ville pauvre, bien que sa réputation en fasse une attraction touristique, et elle dispose d’un aéroport.",BeetleLM/beetlelm_zho-fra_balanced,step-8000,fra,5.262286186218262,192.9220432299142
719,"En 1990, il a été ajouté à la liste des sites du patrimoine mondial en danger, en raison de la menace des sables du désert.",BeetleLM/beetlelm_zho-fra_balanced,step-8000,fra,4.061546325683594,58.064027592767175
720,C'était l'une des principales étapes de l'émission « Wonders of the African World » de Henry Louis Gates sur le PBS.,BeetleLM/beetlelm_zho-fra_balanced,step-8000,fra,4.383006572723389,80.07843346765372
721,"La ville contraste fortement avec les cités du reste du pays, car elle possède un style davantage arabe qu'africain.",BeetleLM/beetlelm_zho-fra_balanced,step-8000,fra,5.202852249145508,181.79001352800105
722,"Le Kruger National Park (KNP) se situe au nord-est de l'Afrique du Sud et longe la frontière du Mozambique à l'est, du Zimbabwe au nord et la frontière sud est la rivière Crocodile.",BeetleLM/beetlelm_zho-fra_balanced,step-8000,fra,4.738710403442383,114.28672284213803
723,"La surface totale du parc est de 19 500 km², celle-ci est divisée en 14 écozones, abritant chacune une faune spécifique.",BeetleLM/beetlelm_zho-fra_balanced,step-8000,fra,4.337343215942383,76.50401445123525
724,Il s'agit de l'un des parcs d'attraction les plus connus en Afrique du Sud et considéré comme le fleuron des parcs Nationaux sud-africains (SANParks).,BeetleLM/beetlelm_zho-fra_balanced,step-8000,fra,4.243856906890869,69.676068371396
725,"Comme pour tous les parcs nationaux sud-africains, il existe des droits d’entrée et de conservation quotidiens pour le parc.",BeetleLM/beetlelm_zho-fra_balanced,step-8000,fra,4.937187671661377,139.3777219432537
726,"Il peut être avantageux de se procurer une Wild Card qui donne accès à certains parcs d'Afrique du Sud, ainsi qu’à tous les parcs nationaux sud-africains.",BeetleLM/beetlelm_zho-fra_balanced,step-8000,fra,5.011611461639404,150.14649662246322
727,L'île de Hong Kong donne son nom au territoire de Hong Kong et représente le principal centre d'intérêt pour de nombreux touristes.,BeetleLM/beetlelm_zho-fra_balanced,step-8000,fra,4.260331153869629,70.83343633734798
728,"La rangée d'immeubles qui dessine l'horizon de Hong Kong a été comparée à un graphique à barres scintillant, qui se révèle par réflexion dans les eaux du port de Victoria.",BeetleLM/beetlelm_zho-fra_balanced,step-8000,fra,4.850876331329346,127.85238181554244
729,"Pour admirer les plus beaux panoramas de Hong Kong, quittez l’île et rejoignez le front de mer de Kowloon situé en face.",BeetleLM/beetlelm_zho-fra_balanced,step-8000,fra,4.983810901641846,146.02982791681106
730,La grande majorité du développement urbain de l’île de Hong Kong est concentrée sur les terre-pleins de la rive nord.,BeetleLM/beetlelm_zho-fra_balanced,step-8000,fra,4.977924823760986,145.17280968912775
731,"Il s'agit du lieu que les colons Britannique ont investit. Ainsi, cela me semble être un bon point de départ, si vous recherchez des preuves du passé colonial de cette région.",BeetleLM/beetlelm_zho-fra_balanced,step-8000,fra,4.525819301605225,92.37157501436295
732,"Les Sundarbans sont la plus grande ceinture de mangroves côtières du monde, s’étendant sur 80 km (50 miles) depuis la côte jusqu’à l’arrière-pays bangladais et indien.",BeetleLM/beetlelm_zho-fra_balanced,step-8000,fra,5.014608860015869,150.59722064994844
733,Les Sundarbans ont été déclarés site du patrimoine mondial de l'UNESCO. La partie de la forêt située sur le territoire indien est appelée parc national des Sundarbans.,BeetleLM/beetlelm_zho-fra_balanced,step-8000,fra,4.308073043823242,74.29718349637919
734,Les forêts ne sont cependant pas composées uniquement de marais de mangroves : elles recèlent également certains des derniers vestiges des jungles majestueuses qui recouvraient autrefois la plaine du Gange.,BeetleLM/beetlelm_zho-fra_balanced,step-8000,fra,5.653101444244385,285.1745486625606
735,"Les Sundarbans couvrent une superficie de 3 850 km², dont environ un tiers est couvert de zones d’eau/marécages.",BeetleLM/beetlelm_zho-fra_balanced,step-8000,fra,4.770390510559082,117.96529966219933
736,"Sundarbans est une réserve naturelle depuis 1966, vous pourrez y trouver environ 400 tigres du Bengale royal et 30 000 cerfs tachetés.",BeetleLM/beetlelm_zho-fra_balanced,step-8000,fra,4.761703014373779,116.94491528167217
737,"Les bus partent de la gare routière interdistricts (située sur l'autre rive) tout au long de la journée, mais la plupart, tout particulièrement ceux qui desservent l'est et Jakar/Bumthang, partent entre 6 h 30 et 7 h 30 du matin.",BeetleLM/beetlelm_zho-fra_balanced,step-8000,fra,5.221705436706543,185.24984671131014
738,"Les bus inter-districts sont souvent complets, aussi est-il conseillé d'acheter un ticket quelques jours à l'avance.",BeetleLM/beetlelm_zho-fra_balanced,step-8000,fra,5.194223880767822,180.2282099218348
739,"La plupart des districts sont desservis par de petits caboteurs japonais, qui sont confortables et robustes.",BeetleLM/beetlelm_zho-fra_balanced,step-8000,fra,5.132641315460205,169.4641356692129
740,"Les taxis collectifs sont un moyen rapide et confortable de se rendre dans des endroits proches, tels que Paro (150 Nu) et Punakha (200 Nu).",BeetleLM/beetlelm_zho-fra_balanced,step-8000,fra,5.317275524139404,203.82780089891372
741,Le pont sur l'Oyapock est un pont à haubans. Il surplombe le fleuve Oyapock pour relier les villes d'Oiapoque au Brésil et Saint-Georges-de-l'Oyapock en Guyane.,BeetleLM/beetlelm_zho-fra_balanced,step-8000,fra,5.058377742767334,157.33507122331397
742,"Les deux tours s'élèvent à une hauteur de 83 mètres ; il est long de 378 mètres et possède deux voies de 3,50 m de large.",BeetleLM/beetlelm_zho-fra_balanced,step-8000,fra,4.747323513031006,115.2753383255017
743,"Le dégagement vertical sous le pont est de 15 mètres. La structure a été achevée en août 2011, mais elle n'a été ouverte à la circulation qu'en mars 2017.",BeetleLM/beetlelm_zho-fra_balanced,step-8000,fra,3.8971123695373535,49.259998859382826
744,"Le pont devrait être pleinement opérationnel en septembre 2017, date à laquelle devraient être achevés les postes de contrôle des douanes brésiliennes.",BeetleLM/beetlelm_zho-fra_balanced,step-8000,fra,5.039892673492432,154.4534371882907
745,"Les Guaraní étaient le groupe indigène le plus important habitant ce qui est maintenant l’est du Paraguay, vivant en tant que chasseurs semi-nomades et pratiquant aussi une agriculture de subsistance.",BeetleLM/beetlelm_zho-fra_balanced,step-8000,fra,5.356112957000732,211.89968039708194
746,"D'autres tribus indigènes qui peuplaient le Chaco, telles que les Guaycurú ou encore les Payaguá, survivaient essentiellement grâce à la pêche, la chasse, ou encore la cueillette.",BeetleLM/beetlelm_zho-fra_balanced,step-8000,fra,5.01051664352417,149.98220346999224
747,"Au XVIe siècle, le Paraguay, autrefois surnommé « la province géante des Indes », est né de la rencontre entre les conquérants espagnols et les populations indigènes.",BeetleLM/beetlelm_zho-fra_balanced,step-8000,fra,4.347775936126709,77.30633735499293
748,"Les Espagnols ont inauguré la période de la colonisation, laquelle a duré trois siècles.",BeetleLM/beetlelm_zho-fra_balanced,step-8000,fra,5.363116264343262,213.38888758583425
749,"Depuis la fondation d'Asunción en 1537, le Paraguay a réussi à conserver une grande partie de son caractère et de son identité autochtones.",BeetleLM/beetlelm_zho-fra_balanced,step-8000,fra,4.533089637756348,93.04559462115347
750,L'Argentine est connue pour avoir une des meilleures équipes et parmi les meilleurs joueurs de polo dans le monde.,BeetleLM/beetlelm_zho-fra_balanced,step-8000,fra,4.091884136199951,59.8525559007022
751,Le plus grand tournoi de l'année se déroule en décembre sur les terrains de polo de Las Cañitas.,BeetleLM/beetlelm_zho-fra_balanced,step-8000,fra,5.145760536193848,171.7020206273544
752,"De plus, des tournois et des matchs de moindre envergure sont parfois organisés ici à d'autres moments de l'année.",BeetleLM/beetlelm_zho-fra_balanced,step-8000,fra,4.898744583129883,134.12129581091216
753,"Pour des informations sur les tournois et les endroits où acheter des billets pour les matchs de polo, consultez l’Asociacion Argentina de Polo.",BeetleLM/beetlelm_zho-fra_balanced,step-8000,fra,5.728547096252441,307.5221435665632
754,La monnaie officielle des Îles Malouines est la livre des Îles Malouines (FKP) dont la valeur est équivalente à une livre sterling (GBP).,BeetleLM/beetlelm_zho-fra_balanced,step-8000,fra,5.549482345581055,257.10443020776717
755,"L'argent peut être échangé à la seule banque des îles située à Stanley, en face du magasin FIC West.",BeetleLM/beetlelm_zho-fra_balanced,step-8000,fra,4.7921953201293945,120.56575878372819
756,"La livre sterling est une monnaie couramment acceptée partout dans les îles, tandis qu’à Stanley, les cartes de crédit et les dollars américains sont également souvent acceptés.",BeetleLM/beetlelm_zho-fra_balanced,step-8000,fra,4.995781421661377,147.7883853195539
757,"Sur les îles avoisinantes, les cartes de crédit ne seront probablement pas acceptées, même s’il se peut que les devises britannique et américaine le soient. Parlez-en à l’avance avec les propriétaires afin de vous mettre d’accord sur une méthode de paiement.",BeetleLM/beetlelm_zho-fra_balanced,step-8000,fra,5.371439456939697,215.17237625901137
758,"Il est presque impossible d’échanger de l’argent des Malouines en dehors des îles, alors changez-le avant de quitter les îles.",BeetleLM/beetlelm_zho-fra_balanced,step-8000,fra,5.521125793457031,249.91623293567397
759,"Montevideo étant située au sud de l’Équateur, l’hiver dans l’hémisphère nord correspond à l’été là-bas et vice-versa.",BeetleLM/beetlelm_zho-fra_balanced,step-8000,fra,5.5850443840026855,266.41210691272994
760,Montevideo est situé en zone subtropicale et les températures estivales dépassant les 30 °C sont courantes.,BeetleLM/beetlelm_zho-fra_balanced,step-8000,fra,5.218648910522461,184.68449015794081
761,"L'hiver peut être trompeusement froid : les températures descendent rarement en dessous de zéro, mais le vent et l'humidité se combinent pour donner l'impression qu'il fait plus froid que ce que dit le thermomètre.",BeetleLM/beetlelm_zho-fra_balanced,step-8000,fra,5.124939918518066,168.1640378037222
762,Il n'y a pas vraiment de saisons « pluvieuses » et « sèches » : les précipitations sont à peu près constantes tout au long de l'année.,BeetleLM/beetlelm_zho-fra_balanced,step-8000,fra,4.477363109588623,88.00231400013998
763,"Bien que de nombreux animaux du parc soient habitués à voir des humains, il s'agit néanmoins d'espèces sauvages ; veuillez ne pas les nourrir ni les déranger.",BeetleLM/beetlelm_zho-fra_balanced,step-8000,fra,5.121586322784424,167.60102818498135
764,"Selon les autorités du parc, il faut se tenir à au moins 100 mètres des ours et des loups et à 25 mètres de tous les autres animaux sauvages !",BeetleLM/beetlelm_zho-fra_balanced,step-8000,fra,4.425689220428467,83.57038579470223
765,"Aussi dociles qu’ils puissent paraître, le bison, l’élan, l’orignal, l’ours et presque tous les grands animaux peuvent attaquer.",BeetleLM/beetlelm_zho-fra_balanced,step-8000,fra,6.007603168487549,406.50782093185654
766,"Chaque année, des dizaines de visiteurs sont blessés parce qu’ils n’ont pas gardé une distance suffisante. Ces animaux sont grands, sauvages et potentiellement dangereux, alors donnez-leur de l’espace.",BeetleLM/beetlelm_zho-fra_balanced,step-8000,fra,5.147092819213867,171.930928765293
767,"De plus, sachez que les odeurs attirent les ours et autres animaux sauvages, alors évitez de transporter ou de cuisiner des aliments odorants et gardez le camp propre.",BeetleLM/beetlelm_zho-fra_balanced,step-8000,fra,5.558662414550781,259.4755334031575
768,Apia est la capitale des Samoa. La ville se trouve sur l'île d'Upolu et compte un peu moins de 40 000 habitants.,BeetleLM/beetlelm_zho-fra_balanced,step-8000,fra,3.6399447917938232,38.089733801473294
769,Apia a été fondée dans les années 1850 et est la capitale officielle des Samoa depuis 1959.,BeetleLM/beetlelm_zho-fra_balanced,step-8000,fra,3.504199743270874,33.25482080706224
770,"Le port a été le site d’une impasse navale tristement célèbre en 1889, lorsque sept navires d’Allemagne, des États-Unis et de Grande-Bretagne ont refusé de quitter le port.",BeetleLM/beetlelm_zho-fra_balanced,step-8000,fra,4.819131851196289,123.85751733619604
771,"Tous les navires furent coulés, à l’exception d’un croiseur britannique. Près de 200 Américains et Allemands perdirent la vie.",BeetleLM/beetlelm_zho-fra_balanced,step-8000,fra,4.672792434692383,106.99610529554461
772,"Le chef suprême Tupua Tamasese Lealofi III fut assassiné lors un rassemblement pacifique qui se tenait en ville, durant la luttee de l’indépendance organisée par le mouvement Mau.",BeetleLM/beetlelm_zho-fra_balanced,step-8000,fra,5.305421829223633,201.42595184824717
773,"Les plages sont nombreuses, car Auckland est à cheval sur deux ports. Les plus populaires se trouvent dans trois zones.",BeetleLM/beetlelm_zho-fra_balanced,step-8000,fra,5.22314977645874,185.51760374852242
774,Les plages du North Shore (dans le district de North Harbour) se trouvent sur l'océan Pacifique et s'étendent de Long Bay au nord à Devonport au sud.,BeetleLM/beetlelm_zho-fra_balanced,step-8000,fra,4.318076133728027,75.04411448321109
775,"Presque toutes les plages sont sablonneuses et permettent de se baigner en toute sécurité, et la plupart sont ombragées par des pohutukawa.",BeetleLM/beetlelm_zho-fra_balanced,step-8000,fra,5.438998699188232,230.21155699777862
776,"Les plages de Tamaki Drive se trouvent sur le port de Waitemata, dans la banlieue chic de Mission Bay et de Saint Heliers dans le centre d’Auckland.",BeetleLM/beetlelm_zho-fra_balanced,step-8000,fra,5.365919589996338,213.9879253851985
777,"Ces plages, parfois très fréquentées par les familles, disposent de nombreuses boutiques le long du littoral. La baignade y est sans danger.",BeetleLM/beetlelm_zho-fra_balanced,step-8000,fra,5.329029083251953,206.23763734068956
778,"La principale bière locale est la « Number One », une bière assez ordinaire, mais savoureuse et rafraîchissante. Il existe aussi une autre bière locale, la « Manta ».",BeetleLM/beetlelm_zho-fra_balanced,step-8000,fra,5.104923248291016,164.83141895303336
779,"Il y a beaucoup de vins français à déguster, mais les vins néo-zélandais et australiens voyageront peut-être mieux.",BeetleLM/beetlelm_zho-fra_balanced,step-8000,fra,5.083350658416748,161.3136583792066
780,"Vous pouvez boire l'eau du robinet local sans danger, mais vous pouvez facilement trouver de l'eau en bouteille si vous avez des craintes à son sujet.",BeetleLM/beetlelm_zho-fra_balanced,step-8000,fra,5.064988136291504,158.37856310543114
781,"Pour les Australiens, l'idée d'un « café crème » est étrangère. Un noir court est un « espresso », le cappuccino est rempli de crème (pas de mousse) et le thé est servi sans lait.",BeetleLM/beetlelm_zho-fra_balanced,step-8000,fra,5.237848281860352,188.26457397181667
782,Le chocolat chaud est conforme aux normes belges. Les jus de fruits sont chers mais excellents.,BeetleLM/beetlelm_zho-fra_balanced,step-8000,fra,6.342304706573486,568.1041170415292
783,"De nombreux voyages sur le récif sont effectués tout au long de l'année, et les blessures dues à l'une de ces causes sur le récif sont rares.",BeetleLM/beetlelm_zho-fra_balanced,step-8000,fra,4.533664226531982,93.09907293799401
784,"Néanmoins, suivez les conseils des autorités, obéissez à tous les panneaux et prêtez une attention particulière aux avertissements de sécurité.",BeetleLM/beetlelm_zho-fra_balanced,step-8000,fra,5.317068576812744,203.7856236448042
785,"D'octobre à avril, au nord de 1770, les méduses-boîtes arrivent près des plages et des estuaires de rivières. Elles peuvent également parfois être aperçues en dehors de cette période.",BeetleLM/beetlelm_zho-fra_balanced,step-8000,fra,4.967578887939453,143.67860392362036
786,"Les requins existent, mais ils attaquent rarement les humains. La plupart d'entre eux ont peur des humains et s'en écarteraient.",BeetleLM/beetlelm_zho-fra_balanced,step-8000,fra,4.931545734405518,138.593575713142
787,"Les crocodiles d’eau salée ne vivent pas activement dans l’océan, leur habitat principal se trouve dans les estuaires des rivières au nord de Rockhampton.",BeetleLM/beetlelm_zho-fra_balanced,step-8000,fra,5.11438512802124,166.39843578647168
788,La réservation à l'avance donne au voyageur la tranquillité d'esprit de savoir qu'il aura un endroit où dormir une fois arrivé à destination.,BeetleLM/beetlelm_zho-fra_balanced,step-8000,fra,4.912600994110107,135.9926709363609
789,"Les agences de voyage ont souvent des accords avec des hôtels spécifiques, mais vous pouvez également réserver par l'intermédiaire d'agences de voyage d'autres types d'hébergement, comme des aires de camping.",BeetleLM/beetlelm_zho-fra_balanced,step-8000,fra,4.85758113861084,128.71248759571577
790,"Les agences de voyage proposent généralement des forfaits comprenant le petit déjeuner, le service de transport depuis/vers l'aéroport ou même des forfaits combinant le vol et l'hébergement.",BeetleLM/beetlelm_zho-fra_balanced,step-8000,fra,5.1390886306762695,170.56025408321486
791,"Ils peuvent également retenir la réservation pour vous si vous avez besoin de temps pour réfléchir à l'offre ou vous procurer d'autres documents nécessaires pour votre destination (par exemple, un visa).",BeetleLM/beetlelm_zho-fra_balanced,step-8000,fra,4.688806533813477,108.72334471033038
792,Toute modification ou demande doit cependant être adressée à l’agence de voyages d’abord et non directement à l’hôtel.,BeetleLM/beetlelm_zho-fra_balanced,step-8000,fra,6.413390159606934,609.9580349317055
793,"Lors de certains festivals de musique, la grande majorité des participants décident de camper sur place, et la plupart considèrent que cela fait partie intégrante de l'expérience.",BeetleLM/beetlelm_zho-fra_balanced,step-8000,fra,4.921236991882324,137.17218916727066
794,"Si vous voulez participer de près à l'événement musical, vous allez devoir arriver tôt pour trouver un aire de camping bien placée.",BeetleLM/beetlelm_zho-fra_balanced,step-8000,fra,5.379042148590088,216.81449985739533
795,"N'oubliez pas que même si les spectacles musicaux sont terminés sur les scènes principales, d'autres spectacles musicaux peuvent se poursuivre jusqu'à tard dans la nuit sur d'autres sites du festival.",BeetleLM/beetlelm_zho-fra_balanced,step-8000,fra,4.727046012878418,112.96138254097912
796,Certains festivals disposent d'aires de camping spéciales pour les familles avec de jeunes enfants.,BeetleLM/beetlelm_zho-fra_balanced,step-8000,fra,5.44546365737915,231.7046863978812
797,"Si vous traversez le nord de la Baltique en hiver, veillez à vérifier l'emplacement de la cabane, car la traversée de la glace peut provoquer des bruits insupportables au niveau des cabanes les plus exposées.",BeetleLM/beetlelm_zho-fra_balanced,step-8000,fra,4.458171367645264,86.32949975344424
798,Les croisières à Saint-Pétersbourg incluent du temps passé dans la ville. Les passagers des croisières sont exemptés de l'obligation de visa (voir les conditions).,BeetleLM/beetlelm_zho-fra_balanced,step-8000,fra,4.989623546600342,146.8811191899363
799,"Les casinos font généralement de nombreux efforts pour maximiser le temps et l’argent dépensés par les clients. On y trouve rarement des fenêtres et des horloges, et les sorties peuvent être difficiles à repérer.",BeetleLM/beetlelm_zho-fra_balanced,step-8000,fra,5.3674445152282715,214.31448990190054
800,"Ils proposent généralement des offres spéciales de plats, de boissons et de divertissements afin de maintenir la bonne humeur des invités et de les garder sur place.",BeetleLM/beetlelm_zho-fra_balanced,step-8000,fra,4.995249271392822,147.70976061255175
801,"Sur certains sites, ce sont les locaux qui proposent gratuitement des boissons alcoolisées. Néanmoins, l'ivresse altère le jugement, et tous les bons joueurs sache que c'est crucial de rester sobre.",BeetleLM/beetlelm_zho-fra_balanced,step-8000,fra,5.169382572174072,175.80625629238307
802,"Quiconque se rend en voiture à des latitudes élevées ou franchit des cols de montagne doit envisager la possibilité de neige, de glace ou de températures glaciales.",BeetleLM/beetlelm_zho-fra_balanced,step-8000,fra,5.18042516708374,177.75837193782021
803,"Sur les routes glacées et enneigées, le frottement est faible et vous ne pouvez pas conduire comme si vous étiez sur l'asphalte nu.",BeetleLM/beetlelm_zho-fra_balanced,step-8000,fra,5.324406147003174,205.2864143069774
804,"Pendant les blizzards, il peut tomber en très peu de temps assez de neige pour vous bloquer.",BeetleLM/beetlelm_zho-fra_balanced,step-8000,fra,5.172811985015869,176.41020352566713
805,La visibilité peut également être limitée par des chutes de neige ou de la poudrerie ou par la condensation ou la glace sur les vitres des véhicules.,BeetleLM/beetlelm_zho-fra_balanced,step-8000,fra,4.695881366729736,109.49527161540583
806,"D'autre part, la présence de glace et de neige est normale dans de nombreux pays, et la circulation est pratiquement ininterrompue toute l'année.",BeetleLM/beetlelm_zho-fra_balanced,step-8000,fra,4.805284023284912,122.1541807262825
807,Les safaris sont peut-être le plus grand attrait touristique en Afrique et le moment le plus marquant pour de nombreux visiteurs.,BeetleLM/beetlelm_zho-fra_balanced,step-8000,fra,5.17945671081543,177.58630406182755
808,"Dans le langage courant, le terme « safari » désigne une excursion sur la terre africaine, et en particulier dans la savane, ayant pour but d'assister au spectacle saisissant des animaux sauvages dans leur milieu.",BeetleLM/beetlelm_zho-fra_balanced,step-8000,fra,4.823349475860596,124.38100501745231
809,"Certains animaux, tels que les éléphants et les girafes, ont tendance à s’approcher de près des voitures et l’équipement standard permet de bien les observer.",BeetleLM/beetlelm_zho-fra_balanced,step-8000,fra,4.904008388519287,134.82914556791488
810,"Les lions, les guépards et les léopards sont parfois timides et vous les verrez mieux avec des jumelles.",BeetleLM/beetlelm_zho-fra_balanced,step-8000,fra,5.0974955558776855,163.61163756149367
811,"Un safari à pied (également appelé « marche en brousse », « safari pédestre » ou « footing ») consiste à faire de la randonnée, soit pendant quelques heures, soit pendant plusieurs jours.",BeetleLM/beetlelm_zho-fra_balanced,step-8000,fra,5.692506313323975,296.6361528849119
812,Les paralympiques se tiendront du 24 août au 5 septembre 2021. Certains événements se tiendront dans d’autres localisations à travers le Japon.,BeetleLM/beetlelm_zho-fra_balanced,step-8000,fra,4.960978984832764,142.73346141447533
813,"Tokyo sera la seule ville asiatique à avoir accueilli deux Jeux olympiques d'été, après avoir accueilli les Jeux en 1964.",BeetleLM/beetlelm_zho-fra_balanced,step-8000,fra,4.37080192565918,79.1070442386919
814,"Si vous avez réservé vos vols et votre hébergement en 2020 avant l'annonce du report, vous risquez d'être confronté à une situation délicate.",BeetleLM/beetlelm_zho-fra_balanced,step-8000,fra,4.408029079437256,82.10747661098156
815,"Les politiques d'annulation varient, mais à partir de fin mars, la plupart des politiques d'annulation basées sur les coronavirus ne s'étendent pas jusqu'en juillet 2020, date à laquelle les Jeux olympiques avaient été prévus.",BeetleLM/beetlelm_zho-fra_balanced,step-8000,fra,4.599843502044678,99.46874776815119
816,"On s'attend à ce que la plupart des billets d'événements coûtent entre 2 500 et 130 000 yens, les billets typiques coûtant environ 7 000 yens.",BeetleLM/beetlelm_zho-fra_balanced,step-8000,fra,4.249433517456055,70.06571010073372
