sentence_id,sentence,repo,revision,iso_code,nll,ppl
0,وی افزود: «اکنون موش‌های 4 ماهه‌ای داریم که دیابت ندارند در حالی که قبلاً دیابت داشتند.»,BeetleLM/beetlelm_fas-ukr_late,step-8000,fas,7.1540608406066895,1279.2904158832384
1,دکتر ایهود اور، استاد پزشکی دانشگاه دالهاوزی در هلیفکس، نوااسکوشیا و رئیس بخش کلینیکی و علمی انجمن دیابت کانادا هشدار داد که این تحقیق هنوز در روزهای آغازین خود می‌باشد.,BeetleLM/beetlelm_fas-ukr_late,step-8000,fas,6.369913578033447,584.0073556461714
2,مانند سایر متخصصان، او با اشاره به اینکه این یافته‌ها ارتباطی با کسانی که از قبل دیابت نوع 1 دارند نداشته است، نسبت به قابلیت درمان دیابت تردید دارد.,BeetleLM/beetlelm_fas-ukr_late,step-8000,fas,5.607073783874512,272.34612722274437
3,روز دوشنبه، سارا دانیوس، دبیر دائمی‌ کمیته ادبیات نوبل در آکادمی‌ سوئد، طی یک برنامه رادیویی که از رادیو Sveriges در سوئد پخش می‌شد به طور علنی اعلام کرد این کمیته، نتوانست در مورد برنده شدن جایزه نوبل ادبیات سال 2016 بطور مستقیم به باب دیلان دسترسی پیدا کند و دست از تلاش‌ برای تماس با او برداشته است.,BeetleLM/beetlelm_fas-ukr_late,step-8000,fas,6.196238040924072,490.8988217727201
4,دانیوس گفت، «در حال حاضر هیچ کاری نمی‌کنیم. من به نزدیکترین همکار وی ایمیل فرستاده‌ام و با وی تماس گرفته‌ام و پاسخ‌های بسیار صمیمانه‌ای دریافت کردم. فعلاً مطمئناً تا این حد کافی است.»,BeetleLM/beetlelm_fas-ukr_late,step-8000,fas,6.337967872619629,565.6456785903094
5,پیش از این، مدیرعامل رینگ، جیمی‌ سیمینوف، خاطر نشان کرد كه شركت هنگامی‌ شروع به کار می‌کند كه صدای زنگ در وی از گاراژ وی شنیده نشود.,BeetleLM/beetlelm_fas-ukr_late,step-8000,fas,6.909035682678223,1001.2812237628663
6,وی گفت که یک زنگ درب WiFi ساخته است.,BeetleLM/beetlelm_fas-ukr_late,step-8000,fas,6.174320697784424,480.25667366556667
7,سیمینوف گفت پس از ظاهر شدن وی در سال 2013 در یک قسمت از نمایش Shark Tank، فروش افزایش یافت، جایی که نشست نمایش از پرداخت بودجه برای راه‌اندازی خودداری کرده بود.,BeetleLM/beetlelm_fas-ukr_late,step-8000,fas,5.7457075119018555,312.8448910314898
8,در اواخر سال 2017، سیمینوف در کانال تلویزیونی فروشگاهی QVC ظاهر شد.,BeetleLM/beetlelm_fas-ukr_late,step-8000,fas,5.690496444702148,296.0405519294627
9,رینگ همچنین یک دعوای قانونی را با شرکت امنیتی رقیب، شرکت ADT، حل و فصل کرد.,BeetleLM/beetlelm_fas-ukr_late,step-8000,fas,5.2794365882873535,196.2592694252773
10,با اینکه بنظر می‌رسد یک واکسن تجربی بتواند میزان مرگ و میر ایبولا را کاهش دهد، تا به امروز هیچ دارویی نبوده که به وضوح ثابت شود برای درمان عفونت کنونی است.,BeetleLM/beetlelm_fas-ukr_late,step-8000,fas,5.770057678222656,320.5562212272589
11,شربت حاوی پادتن ZMapp، در ابتدا انتظاراتی را در این زمینه ایجاد کرد، اما مطالعات رسمی‌ نشان می‌دهد که مفید بودن این شربت در پیشگیری از مرگ کمتر از حد انتظار است.,BeetleLM/beetlelm_fas-ukr_late,step-8000,fas,5.952295303344727,384.63518104407603
12,در آزمایش PALM، ZMapp به عنوان شاهد عمل می‌کرد، به این معنی که دانشمندان از آن به عنوان یک مرجع استفاده می‌کردند و سه روش درمانی دیگر را با آن مقایسه می‌کردند.,BeetleLM/beetlelm_fas-ukr_late,step-8000,fas,5.996452331542969,402.0000976554388
13,هیأت ژیمناستیک ایالات متحده آمریکا از نامه کمیته المپیک ایالات متحده حمایت می‌کند و نیاز قاطع خانواده المپیک به ترویج محیطی امن برای تمام ورزشکارهای ما را می‌پذیرد.,BeetleLM/beetlelm_fas-ukr_late,step-8000,fas,6.63205099105835,759.0373540891625
14,ما با بیانیه USOC موافقیم که با پیشروی و تغییرات معنادار در سازمان ما به جای لغو اعتبار، بهتر می‌توان در خدمت منافع ورزشکاران و باشگاه‌های ما و ورزش آنها بود.,BeetleLM/beetlelm_fas-ukr_late,step-8000,fas,6.848130226135254,942.1177117224537
15,هیأت ژیمناستیک ایالت متحده آمریکا از یک تحقیق مستقل حمایت می‌کند که احتمالاً بتواند روشن سازد که موضوع سوء استفاده از بخشی که بازماندگان لری نصار با جسارت بیان کرده بودند چطور مدت‌ها کشف‌نشده باقی ماند و ضمناً تغییرات لازم و مناسب را دربر گیرد.,BeetleLM/beetlelm_fas-ukr_late,step-8000,fas,6.681883811950684,797.8206413310673
16,هیأت ژیمناستیک ایالات متحده آمریکا و USOC نیز همان هدف را دارد - امن نمودن ورزش ژیمناستیک و سایر ورزش‌ها تا حد ممکن تا رؤیاهای خود را در محیطی امن، مثبت و توانمند دنبال کنند.,BeetleLM/beetlelm_fas-ukr_late,step-8000,fas,6.234080791473389,509.83176129044074
17,در طی دهه 1960، برژینسکی برای جان اف کندی به عنوان مشاور و سپس دولت لیندون بی جانسون کار می‌کرد.,BeetleLM/beetlelm_fas-ukr_late,step-8000,fas,6.44030237197876,626.5962363137583
18,در طی تصمیم‌گیری برای جانشین در سال 1976، او مشاور کارتر در سیاست خارجه شد، سپس با جانشین شدن بجای هنری کیسینجر به عنوان مشاور امنیت ملی (NSA) از سال 1977 تا 1981 خدمت کرد.,BeetleLM/beetlelm_fas-ukr_late,step-8000,fas,5.492026329040527,242.74859736277466
19,او به عنوان مشاور امنیت ملی در امور سیاسی جهان به کاربر مشاوره داد؛ اموری مثل پیمان کمپ دیوید، 1978؛ عادی کردن روابط ایالت متحده و چین در اواخر دهه هفتاد؛ انقلاب ایران که منجر به بحران گروگانگیری در ایران شد، 1979؛ و حمله شوری به افغانستان، 1979.,BeetleLM/beetlelm_fas-ukr_late,step-8000,fas,5.580712795257568,265.2606149241533
20,این فیلم با بازی رایان گاسلینگ و اما استون در تمام دسته‌بندی‌های اصلی کاندید شد.,BeetleLM/beetlelm_fas-ukr_late,step-8000,fas,7.051119804382324,1154.1504421460825
21,گوسلینگ و استون به ترتیب نامزد بهترین بازیگر مرد و بازیگر زن شدند.,BeetleLM/beetlelm_fas-ukr_late,step-8000,fas,6.420187950134277,614.1185269388855
22,نامزدهای دیگر شامل بهترین تصویر، کارگردان، فیلمبرداری، طراحی صحنه و لباس، ویرایش فیلم، امتیاز اصلی، طراحی تولید، ویرایش صدا، ترکیب صدا و فیلمنامه اصلی است.,BeetleLM/beetlelm_fas-ukr_late,step-8000,fas,5.929731845855713,376.0536599557606
23,دو ترانه از این فیلم با نام‌های «شنوایی» (احمق‌هایی که رویا می‌بینند) و «شهر ستارگان»، نامزد دریافت بهترین آهنگ اصلی شدند. نامزدههای استودیوی Lionsgate 26 بیشتر از هر استودیوی دیگری بود.,BeetleLM/beetlelm_fas-ukr_late,step-8000,fas,6.460050582885742,639.0933829395332
24,اواخر روز یکشنبه،‌ رئیس جمهور ایالات متحده، دونالد ترامپ در بیانیه‌ای از طریق دبیر مطبوعاتی کاخ سفید اعلام کرد نیروهای ایالات متحده از سوریه خارج خواهند شد.,BeetleLM/beetlelm_fas-ukr_late,step-8000,fas,4.660444259643555,105.68302243092765
25,این اعلامیه پس از مکالمه تلفنی ترامپ با رئیس‌جمهور ترکیه،‌ رجب طیب اردوغان، منتشر شد.,BeetleLM/beetlelm_fas-ukr_late,step-8000,fas,5.326541900634766,205.72532404654663
26,ترکیه همچنین محافظت از جنگجویان اسیر داعش را بر عهده خواهد گرفت، که به گفته این بیانیه، کشور‌های اروپایی از بازگشت آنها به وطن خود جلوگیری کرده‌اند.,BeetleLM/beetlelm_fas-ukr_late,step-8000,fas,5.523569107055664,250.5276032466766
27,این امر نه تنها تأیید می‌کند که حداقل برخی از دایناسورها دارای پر بودند، نظریه‌ای که قبلاً در محافل علمی شایع شده است، بلکه اطلاعاتی را در اختیار قرار می‌دهد که فسیل‌ها به طور کلی نمی‌توانند این اطلاعات را بدهند، مواردی از قبیل رنگ و چیدمان سه‌بعدی.,BeetleLM/beetlelm_fas-ukr_late,step-8000,fas,6.406472682952881,605.7532245710535
28,دانشمندان می گویند که پرهای زینتی این حیوان در بالای به رنگ شاه بلوط قهوه ای و در پایین به رنگ کاروتنوئید بود.,BeetleLM/beetlelm_fas-ukr_late,step-8000,fas,6.340533256530762,567.0986398183942
29,این یافته همچنین شناخت ما را در مورد تکامل پرها در پرندگان بیشتر می‌کند.,BeetleLM/beetlelm_fas-ukr_late,step-8000,fas,6.9951043128967285,1091.2775061136122
30,از آنجا که پرهای این دایناسور میله‌ای که بخوبی توسعه یافته باشد ندارند که به آن ساقه گفته می‌شود، اما سایر ویژگی‌های پرها را دارند- ریش و موهای ریز - لذا محققان چنین استدلال می‌کنند که پیشرفت تکاملی ساقه احتمالاً دیرتر از سایر ویژگی‌ها بوده است.,BeetleLM/beetlelm_fas-ukr_late,step-8000,fas,7.457696437835693,1733.1510342731922
31,ساختار پرها نشان می‌دهد که در پرواز مورد استفاده قرار نمی‌گرفتند بلکه برای تنظیم دما یا نمایش استفاده می‌شدند. محققان معتقدند كه حتی اگر این دم یک دایناسور جوان باشد، باز هم این نمونه نشان دهنده پر حیوان بالغ است نه کرک یک جوجه.,BeetleLM/beetlelm_fas-ukr_late,step-8000,fas,6.764782905578613,866.7780146911633
32,محققان اظهار داشتند كه حتی اگر این دم یک دایناسور جوان باشد، باز هم این نمونه نشان دهنده پر حیوان بالغ است نه کرک یک جوجه.,BeetleLM/beetlelm_fas-ukr_late,step-8000,fas,6.598842144012451,734.2445474310807
33,صبح دیروز یک خودروی بمب‌گذاری شده در مرکز پلیس شهر قاضی عنتب ترکیه منفجر شد و منجر به کشته شدن دو افسر پلیس و زخمی شدن بیش از بیست نفر دیگر شد.,BeetleLM/beetlelm_fas-ukr_late,step-8000,fas,5.555319309234619,258.6095277486424
34,دفتر فرماندار گفت که نوزده نفر از افراد مجروح از افسران پلیس بودند.,BeetleLM/beetlelm_fas-ukr_late,step-8000,fas,6.219667911529541,502.5363177895024
35,پلیس گفت این گمان وجود دارد که ستیزه‌جویان داعش (ISIL) مسئول این حمله باشند.,BeetleLM/beetlelm_fas-ukr_late,step-8000,fas,5.658566474914551,286.7373026771568
36,آنها دریافتند که خورشید بر اساس همان اصول اساسی کار می‌کند که سایر ستارگان عمل می‌کنند: مشخص شد که فعالیت تمامی ستاره‌ها در سیستم فقط تحت تاثیر درخشندگی و چرخش آنها قرار دارد نه چیز دیگری.,BeetleLM/beetlelm_fas-ukr_late,step-8000,fas,7.433604717254639,1691.895398867098
37,از تابندگی و دَوران برای تعیین عدد روسبی ستاره استفاده می‌شود که مرتبط با جریان پلاسما است.,BeetleLM/beetlelm_fas-ukr_late,step-8000,fas,7.732417583465576,2281.110314521739
38,هر چه عدد روسبی کوچکتر باشد، ستاره از نظر وارونگی مغناطیسی فعالیت کمتری دارد.,BeetleLM/beetlelm_fas-ukr_late,step-8000,fas,5.944028377532959,381.4685377748355
39,ایوازاکی در طی سفر خود، در بسیاری از موقعیت‌ها دچار دردسر شد.,BeetleLM/beetlelm_fas-ukr_late,step-8000,fas,6.341772079467773,567.8016099588134
40,او مورد حمله دزدان دریایی قرار گرفت، یک سگ هار در تبت به او حمله کرد، از ازدواج در نپال فرار کرد و در هندوستان دستگیر شد.,BeetleLM/beetlelm_fas-ukr_late,step-8000,fas,5.490025043487549,242.26327389926726
41,سری 802.11n استاندارد در هر دو فرکانس 2.4 گیگاهرتز و 5.0 گیگاهرتز کار می‌کند.,BeetleLM/beetlelm_fas-ukr_late,step-8000,fas,6.239060878753662,512.37710070551
42,این امر سبب می‌شود که با سری‌های قبلی 802.11a، 802.11b و 802.11g سازگاری داشته باشد، به شرط اینکه ایستگاه پایه مجهز به رادیوهای دوگانه باشد.,BeetleLM/beetlelm_fas-ukr_late,step-8000,fas,6.807187080383301,904.3234367184174
43,سرعت 802.11n بسیار سریعتر از سیستم‌های قبلی است که حداکثر خروجی تئوری آنها 600Mbit/s بود.,BeetleLM/beetlelm_fas-ukr_late,step-8000,fas,6.909035682678223,1001.2812237628663
44,دووال، که با داشتن دو فرزند بزرگسال، ازدواج کرده است، تأثیر زیادی بر میلر که داستان به وی مربوط می‌شود نگذاشت.,BeetleLM/beetlelm_fas-ukr_late,step-8000,fas,6.052358150482178,425.11433253803114
45,هنگامی‌ که از میلر خواسته شد اظهارنظر کند گفت: «مایک در زمان دادرسی زیاد صحبت می‌کرد ... من داشتم آماده می‌شدم بنابراین واقعاً نمی‌شنیدم که چه می‌گوید.»,BeetleLM/beetlelm_fas-ukr_late,step-8000,fas,7.284792423248291,1457.9584631626653
46,هو گفت، «ما تلاش خواهیم کرد تا سال 2020 میزان انتشار دی اکسید کربن در هر واحد از تولید ناخالص داخلی را در حاشیه‌ای قابل توجه از سطح 2005 کاهش دهیم.»,BeetleLM/beetlelm_fas-ukr_late,step-8000,fas,5.129848480224609,168.99151054919386
47,او رقمی برای این کاهش‌ها تعیین نکرد و گفت که بر اساس بازده اقتصادی چین صورت خواهد گرفت.,BeetleLM/beetlelm_fas-ukr_late,step-8000,fas,5.980550765991211,395.65822324973726
48,او کشورهای در حال توسعه را ترغیب کرد «از مسیر قدیمی یعنی ابتدا آلوده کردن محیط زیست و سپس سعی در پاکسازی آن دوری کنند.»,BeetleLM/beetlelm_fas-ukr_late,step-8000,fas,5.739852428436279,311.0185101067617
49,او افزود: «با وجود این نباید از آنها خواست تعهداتی را بپریرند که از مرحله توسعه، مسئولیت‌پذیری و توانمندی فراتر بروند.»,BeetleLM/beetlelm_fas-ukr_late,step-8000,fas,6.121804714202881,455.6863364655333
50,امروز گروه تحقیقاتی عراق گزارش خود را رأس ساعت 12:00 به وقت گرینویچ ارائه داد.,BeetleLM/beetlelm_fas-ukr_late,step-8000,fas,5.6816558837890625,293.4349219828576
51,این هشدار می دهد که هیچ کس نمی تواند تضمین کند که هرگونه اقدام در عراق در این مرحله، جنگ فرقه ای، خشونت رو به رشد و یا خیزش به سمت هرج و مرج را متوقف خواهد کرد.,BeetleLM/beetlelm_fas-ukr_late,step-8000,fas,4.744251251220703,114.92172577919496
52,این گزارش با لایحه‌ای برای مذاکره آزادانه و تشکیل مجمعی در ایالات متحده درباره سیاست مربوط به خاورمیانه آغاز می‌شود.,BeetleLM/beetlelm_fas-ukr_late,step-8000,fas,6.891561985015869,983.9371125658513
53,این گزارش بسیار حیاتی، تقریباً در مورد تمام جنبه‌های سیاست کنونی اجرایی در قبال عراق است و خواستار تغییر جهت فوری است.,BeetleLM/beetlelm_fas-ukr_late,step-8000,fas,6.560689449310303,706.7588010263925
54,اولین مورد از 78 توصیه او بدین ترتیب است که ابتکار عمل دیپلماتیک جدید باید پیش از پایان سال جاری اتفاق بیفتد تا مرزهای عراق در برابر مداخلات خصمانه امن شود و روابط دیپلماتیک با همسایگانش از سر گرفته شود.,BeetleLM/beetlelm_fas-ukr_late,step-8000,fas,5.775513648986816,322.309946384789
55,سناتور فعلی و بانوی اول آرژانتین، کریستینا الیزابت فرناندز د کیرشنر، عصر روز گذشته کاندیداتوری خود برای ریاست جمهوری را در لا پلاتا، شهری در 50 کیلومتری (31 مایل) بوینوس آیرس اعلام کرد.,BeetleLM/beetlelm_fas-ukr_late,step-8000,fas,5.412106990814209,224.10327412655957
56,خانم کیرشنر قصد خود برای حضور در انتخابات ریاست جمهوری را در تئاتر آرژانتین اعلام کرد، همان جاییکه او از آنجا به عنوان نماینده استان بوئنوس آیرس کارزار 2005 خود را برای مجلس سنا آغاز کرده بود.,BeetleLM/beetlelm_fas-ukr_late,step-8000,fas,4.428851127624512,83.83504579360198
57,این مذاکره با مشاجره پیرامون صرف هزینه برای امدادرسانی و بازسازی به دنبال طوفان کاترینا آغاز شد؛ که در آن برخی از محافظه‌کاران مالی به شوخی آن را «معامله اورلئان جدید بوش» نام نهادند.,BeetleLM/beetlelm_fas-ukr_late,step-8000,fas,6.603055477142334,737.344690690169
58,انتقاد لیبرال از تلاش برای بازسازی بر اعطای قراردادهای بازسازی به خودی‌های واشنگتن متمرکز شده است.,BeetleLM/beetlelm_fas-ukr_late,step-8000,fas,5.934659481048584,377.91128830353176
59,بیش از چهار میلیون نفر برای حضور در مراسم خاکسپاری به رم رفتند.,BeetleLM/beetlelm_fas-ukr_late,step-8000,fas,4.765144348144531,117.34805503932206
60,تعداد افراد حاضر آنقدر زیاد بود که امکان دسترسی همه به مراسم خاکسپاری در میدان سنت پیتر ممکن نبود.,BeetleLM/beetlelm_fas-ukr_late,step-8000,fas,6.852118492126465,945.8826305101322
61,چند نمایشگر تلویزیونی بزرگ در مکان‌های مختلف شهر رم نصب شدند تا مردم بتوانند مراسم را مشاهده کنند.,BeetleLM/beetlelm_fas-ukr_late,step-8000,fas,6.481774806976318,653.1290962973355
62,در بسیاری از شهرهای ایتالیا و سایر نقاط جهان، به‌خصوص در لهستان، مجموعه‌های مشابهی ساخته شده که تعداد زیادی از مردم از آن بازدید کرده‌اند.,BeetleLM/beetlelm_fas-ukr_late,step-8000,fas,5.413150787353516,224.33731447254263
63,مورخان از سیاست‌های گذشته FBI و تمرکز منابع روی مواردی که به آسانی قابل حل هستند، به‌خصوص موارد مربوط به سرقت خودرو، با هدف بالا بردن میزان موفقیت آژانس، انتقاد کردند.,BeetleLM/beetlelm_fas-ukr_late,step-8000,fas,6.148355484008789,467.9472070045499
64,کنگره بودجه ابتکار قباحت را در سال مالی 2005 در نظر گرفت و مشخص کرد که FBI باید 10 مامور خود را به پورنوگرافی بزرگسالان اختصاص دهد.,BeetleLM/beetlelm_fas-ukr_late,step-8000,fas,5.6165547370910645,274.9405072779075
65,رابین اوتاپا بالاترین امتیاز را در اینینگ‌ها بدست آورد و 70 امتیاز را تنها با 41 پرتاب کسب کرد او با ضربه به 11 چهارتایی و 2 شش‌تایی این کار را کرد.,BeetleLM/beetlelm_fas-ukr_late,step-8000,fas,6.602899551391602,737.2297286287304
66,ضربه‌زن‌های میانه، Sachin Tendulkar و Rahul Dravid نمایش خوبی از خود نشان دادند و در کسب صد امتیاز همکاری داشتند.,BeetleLM/beetlelm_fas-ukr_late,step-8000,fas,6.308675289154053,549.3167807151632
67,اما هندوستان پس از دست دادن چوگان کاپیتان، تنها 36 رکورد را انجام داد و 7 چوگان را از دست داد تا مراحل را تمام کند.,BeetleLM/beetlelm_fas-ukr_late,step-8000,fas,5.495523929595947,243.59912152157003
68,رئیس جمهور ایالات متحده، جرج دابلیو بوش، صبح روز 16 نوامبر برای شروع سفر هفتگی خود در آسیا، وارد سنگاپور شد.,BeetleLM/beetlelm_fas-ukr_late,step-8000,fas,4.9187798500061035,136.83555138977715
69,وی مورد استقبال معاون نخست وزیر سنگاپور، وونگ کان سنگ، قرار گرفت و با نخست وزیر سنگاپور، لی هسین لوونگ، بحث در مورد تجارت و تروریسم را آغاز کرد.,BeetleLM/beetlelm_fas-ukr_late,step-8000,fas,5.531110763549805,252.42413889382286
70,بوش پس از یک هفته باخت در انتخابات میان دوره‌ای، از گسترش تجارت در آسیا با مخاطبان صحبت کرد.,BeetleLM/beetlelm_fas-ukr_late,step-8000,fas,5.470249652862549,237.51948277868436
71,استیون هارپر، نخست وزیر، پس از جلسه 25 دقیقه‌ای در روز سه‌شنبه با جک لیتون، رهبر حزب دموکراتیک جدید در دفتر نخست وزیری موفقت کرد تا قبل از قرائت دوم، «قانون هوای پاک» را برای بررسی به کمیته همه‌جانبه ارسال کند.,BeetleLM/beetlelm_fas-ukr_late,step-8000,fas,5.7253546714782715,306.5419676582232
72,لیتون طی جلسه‌ای که با نخست وزیر داشت، خواستار تغییراتی در لایحه زیست‌محیطی شد و «بازنویسی تمام و کمال» لایحه زیست محیطی حزب محافظه کار را درخواست کرد.,BeetleLM/beetlelm_fas-ukr_late,step-8000,fas,6.290934085845947,539.6571798614409
73,از آن موقع دولت فدرال وارد شده تا بودجه بیمارستان Mersey در دوونپورت تاسمانی را تقبل کند، دولت ایالتی و برخی از نمایندگان پارلمان این اقدام را نقد کرده و آن را شیرین‌کاری قبل از انتخابات فدرال که در نوامبر برگزار می‌شود می‌دانند.,BeetleLM/beetlelm_fas-ukr_late,step-8000,fas,6.244546413421631,515.1954861627158
74,اما نخست وزیر جان هاوارد گفت که این اقدام فقط برای محافظت از ساختمان‌های بیمارستان در مقابل تخریب توسط دولت تاسمانی و بخشیدن 45 میلیون دلار استرالیا اضافی است.,BeetleLM/beetlelm_fas-ukr_late,step-8000,fas,6.579975605010986,720.5217519145394
75,مطابق آخرین خبرنامه، قرائت سطح دریا حاکی از ایجاد یک سونامی بود. فعالیت هایی مربوط به سونامی قطعی در نزدیکی پاگو پاگو و نیوئه ثبت شده بود.,BeetleLM/beetlelm_fas-ukr_late,step-8000,fas,6.375064849853516,587.0234980952326
76,هیچ خسارت و جراحت عمده‌ای در تونگا گزارش نشده است، اما برق به‌طور موقت قطع شد، که بنابر گزارش‌ها از دریافت هشدار تسونامی صادر شده توسط PTWC توسط مقامات تونگ جلوگیری کرده است.,BeetleLM/beetlelm_fas-ukr_late,step-8000,fas,6.39458703994751,598.5960759078685
77,علیرغم رفع هشدارها، چهارده مدرسه در هاوایی واقع در خط ساحلی یا نزدیکی آن کل چهارشنبه تعطیل شدند.,BeetleLM/beetlelm_fas-ukr_late,step-8000,fas,6.387218475341797,594.2014928184319
