sentence_id,sentence,repo,revision,iso_code,nll,ppl
248,آرمند ورساچه گفت: «من خواهر و دوستم را از دست دادم و در مسیر من دو معلول روی صندلی چرخدار بودند، مردم فقط می پریدند و آنها را هل می‌دادند».,BeetleLM/beetlelm_zho-fas_heritage,step-20000,fas,6.2286295890808105,507.0601264082304
249,NHK همچنین گزارش داد که نیروگاه هسته ای کاشیوازاکی کاریوا در استان نیگاتا به طور عادی مشعول به کار بود.,BeetleLM/beetlelm_zho-fas_heritage,step-20000,fas,5.6137495040893555,274.1703158816204
250,شركت برق هوکوریکو هیچ تاثیری از زلزله را گزارش نکرد اینکه راكتور شماره 1 و 2 آن در نيروگاه هسته اي شيكا را خاموش كرده است.,BeetleLM/beetlelm_zho-fas_heritage,step-20000,fas,6.100479602813721,446.0716560096142
251,طبق گزارشات حدود 9400 خانه در منطقه از آب محروم هستند و تقریباً 100 خانه برق ندارند.,BeetleLM/beetlelm_zho-fas_heritage,step-20000,fas,5.63311767578125,279.5322514611163
252,برخی از جاده‌ها آسیب دیده‌اند، سرویس راه‌آهن در مناطق آسیب دیده متوقف شده و فرودگاه نوتو در ایشیکاوا همچنان تعطیل است.,BeetleLM/beetlelm_zho-fas_heritage,step-20000,fas,6.483423233032227,654.2066191819465
253,یک بمب در بیرون دفتر فرماندار کل منفجر شد.,BeetleLM/beetlelm_zho-fas_heritage,step-20000,fas,5.218596935272217,184.6748913848001
254,سه بمب دیگر در یک بازه دو ساعته نزدیک ساختمان‌های دولت منفجر شد.,BeetleLM/beetlelm_zho-fas_heritage,step-20000,fas,5.734847545623779,309.4657877490374
255,برخی گزارش‌های رسمی تعداد کشته شدگان را هشت نفر اعلام می‌کنند و گزارش‌های رسمی زخمی شدن 30 تن را تایید می‌کند؛ اما اعداد نهایی هنوز مشخص نیست.,BeetleLM/beetlelm_zho-fas_heritage,step-20000,fas,6.8572282791137695,950.7282587879462
256,اسید سیانوریک و نیز ملامین در نمونه‌های ادرار حیوانات خانگی که پس از مصرف غذای آلوده مخصوص حیوانات مردند، یافت شد.,BeetleLM/beetlelm_zho-fas_heritage,step-20000,fas,6.327855587005615,559.9545316807596
257,محققان دانشگاه گفتند که این دو ترکیب در واکنش با یکدیگر مواد کریستالی تشکیل می‌دهد و می‌تواند عملکرد کلیه را مسدود کند.,BeetleLM/beetlelm_zho-fas_heritage,step-20000,fas,6.54435920715332,695.3109858604048
258,پژوهشگران با افزودن ملامین و اسید سیانوریک در ادرار گربه، تشکیل کریستال‌ها را مشاهده کردند.,BeetleLM/beetlelm_zho-fas_heritage,step-20000,fas,6.5214715003967285,679.5776487306094
259,نتیجه سنجش طیف سنجی مادون قرمز (طیف‌سنجی تبدیل فوریه فروسرخ) مشخص کرد ترکیب این بلورها با مواردی که در ادرار حیوانات خانگی مبتلا دیده می‌شود مطابقت دارد.,BeetleLM/beetlelm_zho-fas_heritage,step-20000,fas,7.356756687164307,1566.7468634628954
260,نمی‌دانم متوجه شده‌اید یا نه، اما بسیاری از کالاها از آمریکای مرکزی بدون پرداخت عوارض وارد این کشور می‌شوند.,BeetleLM/beetlelm_zho-fas_heritage,step-20000,fas,6.451740741729736,633.8046232537962
261,همچنان در کشورهای آمریکای مرکزی روی هشتاد درصد کالاهای ما از طریق وضع تعرفه، مالیات گرفته می‌شد. ما با شما رفتار می‌کنیم.,BeetleLM/beetlelm_zho-fas_heritage,step-20000,fas,6.8890767097473145,981.4947941680347
262,برایم معنی نداشت؛ مسلماً عادلانه نبود.,BeetleLM/beetlelm_zho-fas_heritage,step-20000,fas,7.346466064453125,1550.70673560882
263,کل حرف من به مردم این است که شما طوری با ما رفتار می‌کنید که ما با شما رفتار می‌کنیم.,BeetleLM/beetlelm_zho-fas_heritage,step-20000,fas,5.880866527557373,358.1194276499999
264,حکمران کالیفرنیا، آرنولد شوارتزنگر، لایحه‌ای به قانون افزود که فروش و اجاره بازی‌های ویدیویی خشن به افراد کم سن و سال ممنوع شود.,BeetleLM/beetlelm_zho-fas_heritage,step-20000,fas,6.443943500518799,628.8819124479282
265,این لایحه بازی های ویدئویی خشونت آمیز که در ایالت کالیفرنیا فروخته می شود را ملزم به نصب برچسب «18» می‌کند و برای تخلف در فروش آنها به افراد زیر سن قانونی جریمه 1000 دلاری تعیین می‌کند.,BeetleLM/beetlelm_zho-fas_heritage,step-20000,fas,5.825710296630859,338.9017683908644
266,مدیر دادرسی های عمومی، Kier Starmer QC، صبح امروز با صدور بیانیه ای پیگرد قانونی هوهن و پریس را اعلام کرد.,BeetleLM/beetlelm_zho-fas_heritage,step-20000,fas,5.055944919586182,156.9527680414144
267,Huhne استعفا داده است و نماینده Ed Davey جایگزین او خواهد شد. انتظار می‌رود نماینده Norman Lamb سمت وزیر تجارت را از آن خود کند، که Davey از آن استعفا داده بود.,BeetleLM/beetlelm_zho-fas_heritage,step-20000,fas,5.23797607421875,188.28863428305664
268,قرار است Huhne و Pryce در 16 فوریه در دادگاه بدوی وست‌مینستر حاضر شوند.,BeetleLM/beetlelm_zho-fas_heritage,step-20000,fas,5.8708014488220215,354.53300649674367
269,تلفات آن عبارت بود از نیکلاس آلدن، 25 ساله، و زاخاری کادبک، 21 ساله. کادبک راننده بود.,BeetleLM/beetlelm_zho-fas_heritage,step-20000,fas,6.493257522583008,660.6720156842762
270,ادگار وگیلا از ناحیه دست و فک زخمی شد، و از آن طرف کریستوفر اشنایدر نیاز به جراحی ترمیمی صورت پیدا کرد.,BeetleLM/beetlelm_zho-fas_heritage,step-20000,fas,5.695369720458984,297.48676019792447
271,سلاح اوکا در حالی که سر مرد پنجم را نشانه رفته بود، عمل نکرد. اشنایدر درد مداوم داشت از ناحیه یک چشم کور بود، بخشی از جمجمه اش از دست رفته بود و چهره اش با تیتانیوم بازسازی شده بود.,BeetleLM/beetlelm_zho-fas_heritage,step-20000,fas,5.529335975646973,251.97653690252176
272,اشنایدر از طریق لینک ویدئویی از پایگاه نیروی هوایی ایالات متحده در کشورش شهادت داد.,BeetleLM/beetlelm_zho-fas_heritage,step-20000,fas,4.75017786026001,115.60484420640745
273,پس از مسابقه چهارشنبه، کارپاندو در دو مسابقه انفرادی در مسابقات قهرمانی رقابت کرد.,BeetleLM/beetlelm_zho-fas_heritage,step-20000,fas,4.667673110961914,106.44975725408398
274,نخستین حضور او در اسکی مارپیچ کوچک بود، جایی‌که وی موفق نشد به خط پایان برسد. 36 نفر از 116 رقیب او در آن مسابقه نتیجه مشابهی بدست آوردند.,BeetleLM/beetlelm_zho-fas_heritage,step-20000,fas,5.925833225250244,374.59042356341007
275,او در مسابقه دیگرش در Giant Slalom با مدت زمان ترکیبی 4:41.30 کار خود را در رتبه دهم در گروه نشسته بانوان پایان داد، که 2:11.60 دقیقه کندتر از کلودیا لوئیز اتریشی بود که مقام اول را از آن خود کرد و 1:09.02 دقیقه کندتر از مقام نهم که به Gyöngyi Dani از مجارستان رسید.,BeetleLM/beetlelm_zho-fas_heritage,step-20000,fas,4.993790149688721,147.49439125819475
276,چهار اسکی‌باز در گروه نشسته زنان نتوانستند مسیرشان را به اتمام برسانند و 45 نفر از کل 117 اسکی‌باز مارپیچ بزرگ نتوانستند در مسابقه رتبه کسب کنند.,BeetleLM/beetlelm_zho-fas_heritage,step-20000,fas,6.232604026794434,509.0794154087982
277,پلیس مادیا پرادش لپتاب و تلفن همراه دزده شده را باز پس گرفت.,BeetleLM/beetlelm_zho-fas_heritage,step-20000,fas,6.405925273895264,605.4217205116829
278,معاون بازرس کل «د. ک. آریا» گفت: «ما پنج نفر را که به زن سوییسی تجاوز کرده بودند دستگیر کردیم و موبایل و لپتاپ او را پس گرفتیم.»,BeetleLM/beetlelm_zho-fas_heritage,step-20000,fas,5.27879524230957,196.13343968674013
279,نام متهمین بابا کانجار، رامپرو کانجار، گازا کانجار و ویشنو کانجار است.,BeetleLM/beetlelm_zho-fas_heritage,step-20000,fas,7.365410327911377,1580.3637608543877
280,رئیس پلیس «Chandra Shekhar Solanki» گفت که متهمان در دادگاه با صورت‌های پوشیده حاضر شدند.,BeetleLM/beetlelm_zho-fas_heritage,step-20000,fas,5.357362747192383,212.1646760992777
281,اگرچه هنگام برخورد ماشین به خانه سه نفر در آنجا بودند، هیچ کدام صدمه ندیدند.,BeetleLM/beetlelm_zho-fas_heritage,step-20000,fas,5.667776107788086,289.3902455295443
282,با این حال، راننده دچار مصدومیت جدی از ناحیه سر شد.,BeetleLM/beetlelm_zho-fas_heritage,step-20000,fas,5.4950995445251465,243.49576362446157
283,زمانیکه کارکنان خدمات اورژانس مشغول آزاد کردن راننده از آئودی TT قرمز بودند، جاده محل تصادف موقتاً بسته شد.,BeetleLM/beetlelm_zho-fas_heritage,step-20000,fas,6.772281169891357,873.3017732127098
284,او در ابتدا در بیمارستان جیمز پاژه در گریت یارموث بستری بود.,BeetleLM/beetlelm_zho-fas_heritage,step-20000,fas,6.420239448547363,614.1501538828312
285,او سپس به بیمارستان ادن بروک کمبریج منتقل شد.,BeetleLM/beetlelm_zho-fas_heritage,step-20000,fas,6.199434757232666,492.47059696334634
286,«آدکویا» از آن زمان به اتهام قتل پسرش در «دادگاه کلانتری ادینبورگ» بوده است.,BeetleLM/beetlelm_zho-fas_heritage,step-20000,fas,5.216338157653809,184.25822263164142
287,او در بازداشت است و منتظر کیفرخواست و محاکمه است، اما هر شاهد عینی ممکن است تحت تاثیر قرار گبرد زیرا تصویر وی به‌طور گسترده‌ای منتشر شده است.,BeetleLM/beetlelm_zho-fas_heritage,step-20000,fas,6.214459419250488,499.9256659402484
288,این اقدام در جاهای دیگر انگلستان معمول و رایج است ولی دادگاه اسکاتلند متفاوت عمل می‌کند و دادگاه‌ها انتشار عکس‌ها را بطور بالقوه مخرب دانسته‌اند.,BeetleLM/beetlelm_zho-fas_heritage,step-20000,fas,7.442127227783203,1706.376214018094
289,پروفسور Pamela Ferguson از دانشگاه Dundee می گوید: «به نظر می رسد که روزنامه نگاران در صورت انتشار عکس و غیره از مظنونان روی خط خطر قدم می‌گذارند.»,BeetleLM/beetlelm_zho-fas_heritage,step-20000,fas,5.384425163269043,217.98476243718534
290,دادگاه اسکاتلند، که در کل مسئول پیگیری این پرونده است، به روزنامه‌نگارها بیان داشته که حداقل تا زمان اعلام جرم هیچ توضیح بیشتری داده نخواهد شد.,BeetleLM/beetlelm_zho-fas_heritage,step-20000,fas,5.6009745597839355,270.6900825900806
291,این سند بر اساس این درز اطلاعاتی است و به اختلاف مرزی مربوط می‌شود، که در آن فلسطین خواستار مرزبندی طبق شرایط قبل از جنگ شش‌روزه 1967 است.,BeetleLM/beetlelm_zho-fas_heritage,step-20000,fas,6.39017915725708,595.9633412817182
292,مباحث گزارش شده دیگر شامل وضعیت آتی بیت المقدس است که برای هر دو ملت مقدس است و همچنین مسئله جردن ولی.,BeetleLM/beetlelm_zho-fas_heritage,step-20000,fas,6.0306901931762695,416.002052097704
293,اسرائیل پس از امضای توافق‌نامه خواستار حضور نظامی مداوم در دره برای ده سال است، درحالیكه پارلمان موافق است چنین حضوری تنها برای پنج سال باشد.,BeetleLM/beetlelm_zho-fas_heritage,step-20000,fas,6.37174129486084,585.0757317644982
294,تیراندازان شرکت کننده در آزمایش کنترل آفات مکمل باید به دقت توسط جنگلبانان نظارت می‌شدند، زیرا این آزمایش تحت نظارت بود و میزان موثر بودن آن مورد ارزیابی قرار گرفت.,BeetleLM/beetlelm_zho-fas_heritage,step-20000,fas,5.539267539978027,254.4915263058769
295,با همکاری NPWS و انجمن تیراندازان ورزشکار استرالیا (NSW) با هم، افراد داوطلب واجد شرایط تحت برنامه شکار انجمن تیراندازان ورزشکار استخدام شدند.,BeetleLM/beetlelm_zho-fas_heritage,step-20000,fas,5.9253435134887695,374.40702713661403
296,به گفته Mick O'Flynn، مدیر حفاظت از پارک و میراث با NPWS، چهار تیرانداز انتخاب شده برای اولین عملیات تیراندازی، دستورالعمل جامع ایمنی و آموزش را دریافت کردند.,BeetleLM/beetlelm_zho-fas_heritage,step-20000,fas,5.123895645141602,167.98852023627663
297,مارتلی دیروز در شورای موقت انتخاباتی (CEP) جدید که متشکل از نُه عضو بود سوگند یاد کرد.,BeetleLM/beetlelm_zho-fas_heritage,step-20000,fas,6.312146186828613,551.2267157290075
298,این پنجمین CEP مارتلی در چهار سال گذشته است.,BeetleLM/beetlelm_zho-fas_heritage,step-20000,fas,5.252795219421387,191.09968815852739
299,ماه گذشته یک کمیسیون ریاست جمهوری کناره‌گیری شورای انتخاباتی موقت قبلی را به عنوان بخشی از بسته اقدامات برای حرکت کشور به سمت انتخابات جدید توصیه کرد.,BeetleLM/beetlelm_zho-fas_heritage,step-20000,fas,5.8763885498046875,356.5193620230656
300,این کمیسیون پاسخ مارتلی بود به اعتراضات گسترده ضدحکومتی که در ماه اکتبر آغاز شد.,BeetleLM/beetlelm_zho-fas_heritage,step-20000,fas,5.309092044830322,202.16658683396224
301,اعتراضات گاه خشونت آمیز ناشی از عدم برگزاری انتخابات که قرار بود در سال 2011 برگزار شود، بود.,BeetleLM/beetlelm_zho-fas_heritage,step-20000,fas,4.073750972747803,58.7770206205887
302,حدود 60 مورد گرمای بیش از حد آیپاد‌ها گزارش شده است که در مجموع منجر به ایجاد شش آتش سوزی و مصدومیت جزئی چهار نفر شده است.,BeetleLM/beetlelm_zho-fas_heritage,step-20000,fas,4.993906021118164,147.51148263432668
303,وزارت اقتصاد، تجارت و صنعت ژاپن (METI) گفت که از 27 مورد حادثه مربوط به این دستگاه‌ها اطلاع داشته است.,BeetleLM/beetlelm_zho-fas_heritage,step-20000,fas,4.70700740814209,110.72032289018753
304,هفته گذشته، METI اعلام کرد که اپل آنها را از 34 رویداد گرم‌شدن بیش‌ازحد، که این شرکت آن را «غیر جدی» نامیده، مطلع کرده است.,BeetleLM/beetlelm_zho-fas_heritage,step-20000,fas,5.721031188964844,305.2194997149536
305,وزارت در یک واکنش تأخیر اپل در گزارش‌دهی را «واقعاً تأسف برانگیز» خواند.,BeetleLM/beetlelm_zho-fas_heritage,step-20000,fas,7.204541206359863,1345.527228073046
306,این زمین‌لرزه در ساعت 07:19 دقیقه صبح به وقت محلی (جمعه 09:19 بعدازظهر به وقت گرینویچ) ماریانا را لرزاند.,BeetleLM/beetlelm_zho-fas_heritage,step-20000,fas,5.358336448669434,212.37136176651353
307,اداره مدیریت اورژانسی جزایر ماریانای شمالی گفت که هیچ خسارتی در این کشور گزارش نشده است.,BeetleLM/beetlelm_zho-fas_heritage,step-20000,fas,4.99890661239624,148.25097467555761
308,همچنین مرکز هشدار سونامی اقیانوس آرام گفت هیچ نشانی از سونامی وجود نداشت.,BeetleLM/beetlelm_zho-fas_heritage,step-20000,fas,6.010829448699951,407.8214469941532
309,یک پلیس سابق فیلیپینی با ربودن یک اتوبوس در مانیل، پایتخت فیلیپین، گردشگران هنگ کنگی را به گروگان گرفته است.,BeetleLM/beetlelm_zho-fas_heritage,step-20000,fas,5.521874904632568,250.10351811866784
310,رونالدو مندوزا با اسلحه M16 خود به گردشگران شلیک کرد.,BeetleLM/beetlelm_zho-fas_heritage,step-20000,fas,5.664508819580078,288.4462671572761
311,چندین تن از گروگان‌ها نجات یافته‌اند و تاکنون مرگ حداقل شش نفر تایید شده است.,BeetleLM/beetlelm_zho-fas_heritage,step-20000,fas,6.256509304046631,521.395725865644
312,شش گروگان شامل كودكان و سالمندان، همینطور عكاسان فیلیپینی، در ابتدا آزاد شدند.,BeetleLM/beetlelm_zho-fas_heritage,step-20000,fas,5.7879109382629395,326.330587054265
313,عکاس‌ها سپس جای یک زن سالخورده که نیاز به دستشویی داشت را گرفتند. مندوزا با گلوله از پای درآورده شد.,BeetleLM/beetlelm_zho-fas_heritage,step-20000,fas,6.799590110778809,897.479349136281
314,لیگینز قدم به قدم از پدرش پیروی کرد و وارد حرفه پزشکی شد.,BeetleLM/beetlelm_zho-fas_heritage,step-20000,fas,6.546230316162109,696.6132064283481
315,او به عنوان پزشک زنان آموزش دید و کار خود را در بیمارستان ملی اوکلند در سال 1959 شروع کرد.,BeetleLM/beetlelm_zho-fas_heritage,step-20000,fas,4.569944858551025,96.53878633751413
316,درحالیکه او در بیمارستان کار می‌کرد، لیگینز در اوقات فراغتش روی زایمان زودرس تحقیقاتش را آغاز کرد.,BeetleLM/beetlelm_zho-fas_heritage,step-20000,fas,6.170416831970215,478.38547089391693
317,تحقیقات او نشان داد که اگر هورمونی تجویز شود، بلوغ ریه جنینی کودک را تسریع می‌کند.,BeetleLM/beetlelm_zho-fas_heritage,step-20000,fas,6.185123920440674,485.47311992450767
318,«شین هوا» گزارش داد که بازرسان دولت روز چهارشنبه دو گزارش پرواز از «جعبه سیاه» را بازیابی کردند.,BeetleLM/beetlelm_zho-fas_heritage,step-20000,fas,6.222476959228516,503.94995082840586
319,کشتی گیران همکار نیز به لونا ادای احترام کردند.,BeetleLM/beetlelm_zho-fas_heritage,step-20000,fas,6.066459655761719,431.15155143716487
320,تامی‌ دریمر گفت: «لونا اولین ملکه Extreme بود. اولین مدیر من. لونا در شبی که دو ماه داشت درگذشت. بسیار زیبا و بی‌مانند بود. یک زن قوی.»,BeetleLM/beetlelm_zho-fas_heritage,step-20000,fas,6.691421031951904,805.4660322454685
321,داستین «گلدوست» رونلز اظهار داشت: «لونا به اندازه من دمدمی‌مزاج بود... شاید هم بیشتر از من... او را دوست داشتم اما ترکش کردم... امیدوارم که او در وضعیت بهتری باشد.»,BeetleLM/beetlelm_zho-fas_heritage,step-20000,fas,6.309280872344971,549.6495384701356
322,"از بین 1,400 نفری که قبل از انتخابات فدرال 2010 از آنها نظرسنجی شد، تعداد کسانی که مخالف جمهوری شدن استرالیا بودند 8 درصد از سال 2008 افزایش داشت.",BeetleLM/beetlelm_zho-fas_heritage,step-20000,fas,5.169033527374268,175.744902741043
323,جولیا گیلارد، نخست وزیر دولت موقت، در خلال کمپین انتخابات فدرال 2010 مدعی شد که معتقد است پس از خاتمه حکمرانی ملکه الیزابت دوم، استرالیا باید جمهوری شود.,BeetleLM/beetlelm_zho-fas_heritage,step-20000,fas,5.0131940841674805,150.3843099852849
324,34 درصد آنهایی که در نظرسنجی شرکت دارند می‌خواهند که ملکه الیزابت دوم آخرین فرمانروای استرالیا باشد.,BeetleLM/beetlelm_zho-fas_heritage,step-20000,fas,5.443477630615234,231.24497134367556
325,در انتهای نظرسنجی، 29 درصد افراد نظرسنجی شده معتقد بودند که استرالیا باید در اسرع وقت جمهوری شود، در حالی که 31 درصد معتقد بودند استرالیا هرگز نباید جمهوری شود.,BeetleLM/beetlelm_zho-fas_heritage,step-20000,fas,4.789632797241211,120.2572017783535
326,برنده مدال طلای المپیک در شنای 100 متر و 200 متر آزاد و شنای سه‌گانه در بازی‌های کشورهای مشترک‌المنافع بود، اما به دلیل شکایت وی، در خصوص آمادگی جسمانی او در این مسابقات تردید وجود داشته‌ است.,BeetleLM/beetlelm_zho-fas_heritage,step-20000,fas,5.445199012756348,231.64337511175674
327,او نتوانسته است داروهای مورد نیاز برای غلبه بر درد خود را دریافت کند چون این دارو‌ها ممنوع هستند.,BeetleLM/beetlelm_zho-fas_heritage,step-20000,fas,5.784822940826416,325.32443333756504
328,کورتیس کوپر، یک ریاضیدان و استاد علوم رایانه‌ای در دانشگاه میسوری مرکزی است، بزرگترین عدد اول شناخته شده را در مورخ 25 ژانویه کشف کرد.,BeetleLM/beetlelm_zho-fas_heritage,step-20000,fas,5.493776798248291,243.1738934329262
329,چند نفر از مردم این کشف را با استفاده از سخت‌افزار و نرم‌افزار مختلف در ابتدای فوریه تأیید کردند و در سه‌شنبه اعلام شد.,BeetleLM/beetlelm_zho-fas_heritage,step-20000,fas,6.329388618469238,560.8136179308992
330,احتمال دارد که دنباله‌دارها منبع تامین آب و مواد‌آلی کره زمین باشند که می‌توانند تشکیل‌دهنده پروتئین‌ها و زندگی باشند.,BeetleLM/beetlelm_zho-fas_heritage,step-20000,fas,7.6632914543151855,2128.75260205422
331,دانشمندان امیدوارند که به چگونگی تشکیل سیارات پی ببرند، بویژه اینکه پس از برخورد ستاره‌های دنباله‌دار در زمان‌های دور، زمین چگونه شکل گرفته است.,BeetleLM/beetlelm_zho-fas_heritage,step-20000,fas,6.626942157745361,755.1694474267442
332,کوئومو، 53 ساله، فرمانداری خودش را در اوایل امسال شروع کرد و اواخر این ماه لایحه‌ای در قانونی کردن ازدواج همجنس‌بازان تصویب کرد.,BeetleLM/beetlelm_zho-fas_heritage,step-20000,fas,5.722367286682129,305.6275753455463
333,او این شایعات را «حماقت و حرف مفت سیاسی» خواند.,BeetleLM/beetlelm_zho-fas_heritage,step-20000,fas,7.168367862701416,1297.7248083138256
334,پیش‌بینی می‌شود که او در 2016 برای ریاست جمهوری کاندید شود.,BeetleLM/beetlelm_zho-fas_heritage,step-20000,fas,5.895465850830078,363.3860801816358
335,اداره هوانوردی فدرال (FAA) مدعی است که سیستم NextGen هواپیما را قادر می‌سازد تا در مسیرهای کوتاه‌تر پرواز کرده و هر ساله در میلیون‌ها گالن سوخت صرفه‌جویی کند و آلاینده‌های کربنی را کاهش دهد.,BeetleLM/beetlelm_zho-fas_heritage,step-20000,fas,5.98114538192749,395.89355789453265
336,از فناوری مبتنی بر ماهواره در مقابل فناوری مبتنی بر رادار زمینی استفاده می‌کند که به کنترل کننده‌های ترافیک هوایی امکان می‌دهد هواپیما را با دقت بیشتری ردیابی کند و به خلبانان اطلاعات دقیق‌تری می‌دهد.,BeetleLM/beetlelm_zho-fas_heritage,step-20000,fas,7.391202449798584,1621.6548996472422
