sentence_id,sentence,repo,revision,iso_code,nll,ppl
712,"Goma est une ville touristique située à l'extrême est de la République Démocratique du Congo, près du Rwanda.",BeetleLM/beetlelm_nld-fra_balanced,step-8000,fra,4.56859827041626,96.40887584088459
713,"En 2002, Goma a été détruite par la lave du volcan Nyiragongo qui a enseveli la plupart des rues de la ville, en particulier le centre-ville.",BeetleLM/beetlelm_nld-fra_balanced,step-8000,fra,5.205522060394287,182.27600701780108
714,"Bien que Goma soit raisonnablement sûre, toute visite à l'extérieur de Goma doit faire l'objet de recherches pour comprendre l'état des combats qui persistent dans la province du Nord-Kivu.",BeetleLM/beetlelm_nld-fra_balanced,step-8000,fra,5.44152307510376,230.79343163390013
715,La ville est également le point de départ pour l'ascension du volcan Nyiragongo ainsi que pour des treks de pistage des gorilles des montagnes parmi les moins chers d'Afrique.,BeetleLM/beetlelm_nld-fra_balanced,step-8000,fra,5.633823394775391,279.7295923058482
716,Vous pouvez utiliser des boda-boda (moto taxi) pour vous déplacer dans Goma. Le prix normal (local) est d’environ 500 francs congolais pour une petite course.,BeetleLM/beetlelm_nld-fra_balanced,step-8000,fra,6.433304786682129,622.2268810010634
717,"Combiné à sa relative inaccessibilité, « Tombouctou » est devenu une métaphore pour les pays lointains et exotiques.",BeetleLM/beetlelm_nld-fra_balanced,step-8000,fra,7.41796875,1665.646724298566
718,"Aujourd’hui, Tombouctou est une ville pauvre, bien que sa réputation en fasse une attraction touristique, et elle dispose d’un aéroport.",BeetleLM/beetlelm_nld-fra_balanced,step-8000,fra,6.0909295082092285,441.8319067213085
719,"En 1990, il a été ajouté à la liste des sites du patrimoine mondial en danger, en raison de la menace des sables du désert.",BeetleLM/beetlelm_nld-fra_balanced,step-8000,fra,4.336300373077393,76.4242743710351
720,C'était l'une des principales étapes de l'émission « Wonders of the African World » de Henry Louis Gates sur le PBS.,BeetleLM/beetlelm_nld-fra_balanced,step-8000,fra,5.28606653213501,197.5647803109815
721,"La ville contraste fortement avec les cités du reste du pays, car elle possède un style davantage arabe qu'africain.",BeetleLM/beetlelm_nld-fra_balanced,step-8000,fra,5.626210689544678,277.6081784696511
722,"Le Kruger National Park (KNP) se situe au nord-est de l'Afrique du Sud et longe la frontière du Mozambique à l'est, du Zimbabwe au nord et la frontière sud est la rivière Crocodile.",BeetleLM/beetlelm_nld-fra_balanced,step-8000,fra,5.194499969482422,180.27797576622459
723,"La surface totale du parc est de 19 500 km², celle-ci est divisée en 14 écozones, abritant chacune une faune spécifique.",BeetleLM/beetlelm_nld-fra_balanced,step-8000,fra,5.889527797698975,361.23466825123546
724,Il s'agit de l'un des parcs d'attraction les plus connus en Afrique du Sud et considéré comme le fleuron des parcs Nationaux sud-africains (SANParks).,BeetleLM/beetlelm_nld-fra_balanced,step-8000,fra,4.905673503875732,135.05383866674558
725,"Comme pour tous les parcs nationaux sud-africains, il existe des droits d’entrée et de conservation quotidiens pour le parc.",BeetleLM/beetlelm_nld-fra_balanced,step-8000,fra,5.858311176300049,350.13233264654417
726,"Il peut être avantageux de se procurer une Wild Card qui donne accès à certains parcs d'Afrique du Sud, ainsi qu’à tous les parcs nationaux sud-africains.",BeetleLM/beetlelm_nld-fra_balanced,step-8000,fra,5.418996810913086,225.65263665443723
727,L'île de Hong Kong donne son nom au territoire de Hong Kong et représente le principal centre d'intérêt pour de nombreux touristes.,BeetleLM/beetlelm_nld-fra_balanced,step-8000,fra,5.089111328125,162.24561485400486
728,"La rangée d'immeubles qui dessine l'horizon de Hong Kong a été comparée à un graphique à barres scintillant, qui se révèle par réflexion dans les eaux du port de Victoria.",BeetleLM/beetlelm_nld-fra_balanced,step-8000,fra,5.464260578155518,236.10121215563393
729,"Pour admirer les plus beaux panoramas de Hong Kong, quittez l’île et rejoignez le front de mer de Kowloon situé en face.",BeetleLM/beetlelm_nld-fra_balanced,step-8000,fra,6.251423358917236,518.7506678248252
730,La grande majorité du développement urbain de l’île de Hong Kong est concentrée sur les terre-pleins de la rive nord.,BeetleLM/beetlelm_nld-fra_balanced,step-8000,fra,5.666444301605225,289.00509034424624
731,"Il s'agit du lieu que les colons Britannique ont investit. Ainsi, cela me semble être un bon point de départ, si vous recherchez des preuves du passé colonial de cette région.",BeetleLM/beetlelm_nld-fra_balanced,step-8000,fra,4.796076774597168,121.03463866611055
732,"Les Sundarbans sont la plus grande ceinture de mangroves côtières du monde, s’étendant sur 80 km (50 miles) depuis la côte jusqu’à l’arrière-pays bangladais et indien.",BeetleLM/beetlelm_nld-fra_balanced,step-8000,fra,5.968296051025391,390.83913309800556
733,Les Sundarbans ont été déclarés site du patrimoine mondial de l'UNESCO. La partie de la forêt située sur le territoire indien est appelée parc national des Sundarbans.,BeetleLM/beetlelm_nld-fra_balanced,step-8000,fra,5.494679927825928,243.39361017000232
734,Les forêts ne sont cependant pas composées uniquement de marais de mangroves : elles recèlent également certains des derniers vestiges des jungles majestueuses qui recouvraient autrefois la plaine du Gange.,BeetleLM/beetlelm_nld-fra_balanced,step-8000,fra,6.399339199066162,601.4474694802796
735,"Les Sundarbans couvrent une superficie de 3 850 km², dont environ un tiers est couvert de zones d’eau/marécages.",BeetleLM/beetlelm_nld-fra_balanced,step-8000,fra,6.223030090332031,504.2287783277964
736,"Sundarbans est une réserve naturelle depuis 1966, vous pourrez y trouver environ 400 tigres du Bengale royal et 30 000 cerfs tachetés.",BeetleLM/beetlelm_nld-fra_balanced,step-8000,fra,6.246690273284912,516.3011778878067
737,"Les bus partent de la gare routière interdistricts (située sur l'autre rive) tout au long de la journée, mais la plupart, tout particulièrement ceux qui desservent l'est et Jakar/Bumthang, partent entre 6 h 30 et 7 h 30 du matin.",BeetleLM/beetlelm_nld-fra_balanced,step-8000,fra,5.639603614807129,281.351172930293
738,"Les bus inter-districts sont souvent complets, aussi est-il conseillé d'acheter un ticket quelques jours à l'avance.",BeetleLM/beetlelm_nld-fra_balanced,step-8000,fra,5.513597011566162,248.04173333053197
739,"La plupart des districts sont desservis par de petits caboteurs japonais, qui sont confortables et robustes.",BeetleLM/beetlelm_nld-fra_balanced,step-8000,fra,6.262121200561523,524.3299703599654
740,"Les taxis collectifs sont un moyen rapide et confortable de se rendre dans des endroits proches, tels que Paro (150 Nu) et Punakha (200 Nu).",BeetleLM/beetlelm_nld-fra_balanced,step-8000,fra,6.756104946136475,859.2886932479919
741,Le pont sur l'Oyapock est un pont à haubans. Il surplombe le fleuve Oyapock pour relier les villes d'Oiapoque au Brésil et Saint-Georges-de-l'Oyapock en Guyane.,BeetleLM/beetlelm_nld-fra_balanced,step-8000,fra,5.389750003814697,219.14859239308657
742,"Les deux tours s'élèvent à une hauteur de 83 mètres ; il est long de 378 mètres et possède deux voies de 3,50 m de large.",BeetleLM/beetlelm_nld-fra_balanced,step-8000,fra,4.702091693878174,110.17738896696488
743,"Le dégagement vertical sous le pont est de 15 mètres. La structure a été achevée en août 2011, mais elle n'a été ouverte à la circulation qu'en mars 2017.",BeetleLM/beetlelm_nld-fra_balanced,step-8000,fra,4.650960445404053,104.68548199878252
744,"Le pont devrait être pleinement opérationnel en septembre 2017, date à laquelle devraient être achevés les postes de contrôle des douanes brésiliennes.",BeetleLM/beetlelm_nld-fra_balanced,step-8000,fra,6.44230318069458,627.8511905677232
745,"Les Guaraní étaient le groupe indigène le plus important habitant ce qui est maintenant l’est du Paraguay, vivant en tant que chasseurs semi-nomades et pratiquant aussi une agriculture de subsistance.",BeetleLM/beetlelm_nld-fra_balanced,step-8000,fra,6.17221212387085,479.2450838524022
746,"D'autres tribus indigènes qui peuplaient le Chaco, telles que les Guaycurú ou encore les Payaguá, survivaient essentiellement grâce à la pêche, la chasse, ou encore la cueillette.",BeetleLM/beetlelm_nld-fra_balanced,step-8000,fra,6.065600395202637,430.78123903423347
747,"Au XVIe siècle, le Paraguay, autrefois surnommé « la province géante des Indes », est né de la rencontre entre les conquérants espagnols et les populations indigènes.",BeetleLM/beetlelm_nld-fra_balanced,step-8000,fra,5.199432849884033,181.1694624505864
748,"Les Espagnols ont inauguré la période de la colonisation, laquelle a duré trois siècles.",BeetleLM/beetlelm_nld-fra_balanced,step-8000,fra,5.712672233581543,302.67881705478226
749,"Depuis la fondation d'Asunción en 1537, le Paraguay a réussi à conserver une grande partie de son caractère et de son identité autochtones.",BeetleLM/beetlelm_nld-fra_balanced,step-8000,fra,4.9105024337768555,135.7075813549911
750,L'Argentine est connue pour avoir une des meilleures équipes et parmi les meilleurs joueurs de polo dans le monde.,BeetleLM/beetlelm_nld-fra_balanced,step-8000,fra,4.43076753616333,83.9958620368058
751,Le plus grand tournoi de l'année se déroule en décembre sur les terrains de polo de Las Cañitas.,BeetleLM/beetlelm_nld-fra_balanced,step-8000,fra,5.281057834625244,196.57771211438126
752,"De plus, des tournois et des matchs de moindre envergure sont parfois organisés ici à d'autres moments de l'année.",BeetleLM/beetlelm_nld-fra_balanced,step-8000,fra,5.436327934265137,229.5975363638266
753,"Pour des informations sur les tournois et les endroits où acheter des billets pour les matchs de polo, consultez l’Asociacion Argentina de Polo.",BeetleLM/beetlelm_nld-fra_balanced,step-8000,fra,6.341002941131592,567.3650598784706
754,La monnaie officielle des Îles Malouines est la livre des Îles Malouines (FKP) dont la valeur est équivalente à une livre sterling (GBP).,BeetleLM/beetlelm_nld-fra_balanced,step-8000,fra,6.498655796051025,664.2481476824075
755,"L'argent peut être échangé à la seule banque des îles située à Stanley, en face du magasin FIC West.",BeetleLM/beetlelm_nld-fra_balanced,step-8000,fra,5.379377841949463,216.88729526299718
756,"La livre sterling est une monnaie couramment acceptée partout dans les îles, tandis qu’à Stanley, les cartes de crédit et les dollars américains sont également souvent acceptés.",BeetleLM/beetlelm_nld-fra_balanced,step-8000,fra,5.9252238273620605,374.36221849126355
757,"Sur les îles avoisinantes, les cartes de crédit ne seront probablement pas acceptées, même s’il se peut que les devises britannique et américaine le soient. Parlez-en à l’avance avec les propriétaires afin de vous mettre d’accord sur une méthode de paiement.",BeetleLM/beetlelm_nld-fra_balanced,step-8000,fra,5.55131721496582,257.57661632288875
758,"Il est presque impossible d’échanger de l’argent des Malouines en dehors des îles, alors changez-le avant de quitter les îles.",BeetleLM/beetlelm_nld-fra_balanced,step-8000,fra,6.1704535484313965,478.4030358379482
759,"Montevideo étant située au sud de l’Équateur, l’hiver dans l’hémisphère nord correspond à l’été là-bas et vice-versa.",BeetleLM/beetlelm_nld-fra_balanced,step-8000,fra,5.611649990081787,273.59529530606625
760,Montevideo est situé en zone subtropicale et les températures estivales dépassant les 30 °C sont courantes.,BeetleLM/beetlelm_nld-fra_balanced,step-8000,fra,6.090066909790039,441.4509475480354
761,"L'hiver peut être trompeusement froid : les températures descendent rarement en dessous de zéro, mais le vent et l'humidité se combinent pour donner l'impression qu'il fait plus froid que ce que dit le thermomètre.",BeetleLM/beetlelm_nld-fra_balanced,step-8000,fra,5.27730131149292,195.8406486562431
762,Il n'y a pas vraiment de saisons « pluvieuses » et « sèches » : les précipitations sont à peu près constantes tout au long de l'année.,BeetleLM/beetlelm_nld-fra_balanced,step-8000,fra,5.153103828430176,172.9675195197661
763,"Bien que de nombreux animaux du parc soient habitués à voir des humains, il s'agit néanmoins d'espèces sauvages ; veuillez ne pas les nourrir ni les déranger.",BeetleLM/beetlelm_nld-fra_balanced,step-8000,fra,5.618450164794922,275.4621313264834
764,"Selon les autorités du parc, il faut se tenir à au moins 100 mètres des ours et des loups et à 25 mètres de tous les autres animaux sauvages !",BeetleLM/beetlelm_nld-fra_balanced,step-8000,fra,4.983365058898926,145.9647360892222
765,"Aussi dociles qu’ils puissent paraître, le bison, l’élan, l’orignal, l’ours et presque tous les grands animaux peuvent attaquer.",BeetleLM/beetlelm_nld-fra_balanced,step-8000,fra,6.479213714599609,651.4585125206294
766,"Chaque année, des dizaines de visiteurs sont blessés parce qu’ils n’ont pas gardé une distance suffisante. Ces animaux sont grands, sauvages et potentiellement dangereux, alors donnez-leur de l’espace.",BeetleLM/beetlelm_nld-fra_balanced,step-8000,fra,5.48919677734375,242.06269850798023
767,"De plus, sachez que les odeurs attirent les ours et autres animaux sauvages, alors évitez de transporter ou de cuisiner des aliments odorants et gardez le camp propre.",BeetleLM/beetlelm_nld-fra_balanced,step-8000,fra,6.6465559005737305,770.1273575402901
768,Apia est la capitale des Samoa. La ville se trouve sur l'île d'Upolu et compte un peu moins de 40 000 habitants.,BeetleLM/beetlelm_nld-fra_balanced,step-8000,fra,4.164412975311279,64.3548934417188
769,Apia a été fondée dans les années 1850 et est la capitale officielle des Samoa depuis 1959.,BeetleLM/beetlelm_nld-fra_balanced,step-8000,fra,4.280832290649414,72.30059007775141
770,"Le port a été le site d’une impasse navale tristement célèbre en 1889, lorsque sept navires d’Allemagne, des États-Unis et de Grande-Bretagne ont refusé de quitter le port.",BeetleLM/beetlelm_nld-fra_balanced,step-8000,fra,5.242948532104492,189.22722320041498
771,"Tous les navires furent coulés, à l’exception d’un croiseur britannique. Près de 200 Américains et Allemands perdirent la vie.",BeetleLM/beetlelm_nld-fra_balanced,step-8000,fra,5.4545416831970215,233.81768393513303
772,"Le chef suprême Tupua Tamasese Lealofi III fut assassiné lors un rassemblement pacifique qui se tenait en ville, durant la luttee de l’indépendance organisée par le mouvement Mau.",BeetleLM/beetlelm_nld-fra_balanced,step-8000,fra,6.46588134765625,642.8306711577841
773,"Les plages sont nombreuses, car Auckland est à cheval sur deux ports. Les plus populaires se trouvent dans trois zones.",BeetleLM/beetlelm_nld-fra_balanced,step-8000,fra,5.514246940612793,248.2029952565285
774,Les plages du North Shore (dans le district de North Harbour) se trouvent sur l'océan Pacifique et s'étendent de Long Bay au nord à Devonport au sud.,BeetleLM/beetlelm_nld-fra_balanced,step-8000,fra,5.167273998260498,175.43594635665943
775,"Presque toutes les plages sont sablonneuses et permettent de se baigner en toute sécurité, et la plupart sont ombragées par des pohutukawa.",BeetleLM/beetlelm_nld-fra_balanced,step-8000,fra,5.907204627990723,367.67692375576536
776,"Les plages de Tamaki Drive se trouvent sur le port de Waitemata, dans la banlieue chic de Mission Bay et de Saint Heliers dans le centre d’Auckland.",BeetleLM/beetlelm_nld-fra_balanced,step-8000,fra,5.7591753005981445,317.08671983006855
777,"Ces plages, parfois très fréquentées par les familles, disposent de nombreuses boutiques le long du littoral. La baignade y est sans danger.",BeetleLM/beetlelm_nld-fra_balanced,step-8000,fra,5.765830993652344,319.20419050958606
778,"La principale bière locale est la « Number One », une bière assez ordinaire, mais savoureuse et rafraîchissante. Il existe aussi une autre bière locale, la « Manta ».",BeetleLM/beetlelm_nld-fra_balanced,step-8000,fra,5.942417144775391,380.8543980646629
779,"Il y a beaucoup de vins français à déguster, mais les vins néo-zélandais et australiens voyageront peut-être mieux.",BeetleLM/beetlelm_nld-fra_balanced,step-8000,fra,5.984652519226074,397.2844485542852
780,"Vous pouvez boire l'eau du robinet local sans danger, mais vous pouvez facilement trouver de l'eau en bouteille si vous avez des craintes à son sujet.",BeetleLM/beetlelm_nld-fra_balanced,step-8000,fra,5.360527038574219,212.83709025148318
781,"Pour les Australiens, l'idée d'un « café crème » est étrangère. Un noir court est un « espresso », le cappuccino est rempli de crème (pas de mousse) et le thé est servi sans lait.",BeetleLM/beetlelm_nld-fra_balanced,step-8000,fra,5.955222129821777,385.76259053712664
782,Le chocolat chaud est conforme aux normes belges. Les jus de fruits sont chers mais excellents.,BeetleLM/beetlelm_nld-fra_balanced,step-8000,fra,7.056481838226318,1160.355657297374
783,"De nombreux voyages sur le récif sont effectués tout au long de l'année, et les blessures dues à l'une de ces causes sur le récif sont rares.",BeetleLM/beetlelm_nld-fra_balanced,step-8000,fra,5.3730010986328125,215.50866092271778
784,"Néanmoins, suivez les conseils des autorités, obéissez à tous les panneaux et prêtez une attention particulière aux avertissements de sécurité.",BeetleLM/beetlelm_nld-fra_balanced,step-8000,fra,6.459976673126221,639.0461494468179
785,"D'octobre à avril, au nord de 1770, les méduses-boîtes arrivent près des plages et des estuaires de rivières. Elles peuvent également parfois être aperçues en dehors de cette période.",BeetleLM/beetlelm_nld-fra_balanced,step-8000,fra,5.412617206573486,224.21764432298184
786,"Les requins existent, mais ils attaquent rarement les humains. La plupart d'entre eux ont peur des humains et s'en écarteraient.",BeetleLM/beetlelm_nld-fra_balanced,step-8000,fra,5.4609150886535645,235.31265781458163
787,"Les crocodiles d’eau salée ne vivent pas activement dans l’océan, leur habitat principal se trouve dans les estuaires des rivières au nord de Rockhampton.",BeetleLM/beetlelm_nld-fra_balanced,step-8000,fra,5.599131107330322,270.19153795600994
788,La réservation à l'avance donne au voyageur la tranquillité d'esprit de savoir qu'il aura un endroit où dormir une fois arrivé à destination.,BeetleLM/beetlelm_nld-fra_balanced,step-8000,fra,4.999915599822998,148.40063353426646
789,"Les agences de voyage ont souvent des accords avec des hôtels spécifiques, mais vous pouvez également réserver par l'intermédiaire d'agences de voyage d'autres types d'hébergement, comme des aires de camping.",BeetleLM/beetlelm_nld-fra_balanced,step-8000,fra,5.414684295654297,224.6816015225156
790,"Les agences de voyage proposent généralement des forfaits comprenant le petit déjeuner, le service de transport depuis/vers l'aéroport ou même des forfaits combinant le vol et l'hébergement.",BeetleLM/beetlelm_nld-fra_balanced,step-8000,fra,5.844046115875244,345.17312952695045
791,"Ils peuvent également retenir la réservation pour vous si vous avez besoin de temps pour réfléchir à l'offre ou vous procurer d'autres documents nécessaires pour votre destination (par exemple, un visa).",BeetleLM/beetlelm_nld-fra_balanced,step-8000,fra,5.1174635887146,166.91147611254564
792,Toute modification ou demande doit cependant être adressée à l’agence de voyages d’abord et non directement à l’hôtel.,BeetleLM/beetlelm_nld-fra_balanced,step-8000,fra,7.0294880867004395,1129.452280528057
793,"Lors de certains festivals de musique, la grande majorité des participants décident de camper sur place, et la plupart considèrent que cela fait partie intégrante de l'expérience.",BeetleLM/beetlelm_nld-fra_balanced,step-8000,fra,5.53075647354126,252.33472338394338
794,"Si vous voulez participer de près à l'événement musical, vous allez devoir arriver tôt pour trouver un aire de camping bien placée.",BeetleLM/beetlelm_nld-fra_balanced,step-8000,fra,5.71618127822876,303.7427962210273
795,"N'oubliez pas que même si les spectacles musicaux sont terminés sur les scènes principales, d'autres spectacles musicaux peuvent se poursuivre jusqu'à tard dans la nuit sur d'autres sites du festival.",BeetleLM/beetlelm_nld-fra_balanced,step-8000,fra,5.083323955535889,161.30935089731724
796,Certains festivals disposent d'aires de camping spéciales pour les familles avec de jeunes enfants.,BeetleLM/beetlelm_nld-fra_balanced,step-8000,fra,5.880906105041504,358.13360139644345
797,"Si vous traversez le nord de la Baltique en hiver, veillez à vérifier l'emplacement de la cabane, car la traversée de la glace peut provoquer des bruits insupportables au niveau des cabanes les plus exposées.",BeetleLM/beetlelm_nld-fra_balanced,step-8000,fra,5.769321918487549,320.3204556109012
798,Les croisières à Saint-Pétersbourg incluent du temps passé dans la ville. Les passagers des croisières sont exemptés de l'obligation de visa (voir les conditions).,BeetleLM/beetlelm_nld-fra_balanced,step-8000,fra,5.777385711669922,322.91389594714434
799,"Les casinos font généralement de nombreux efforts pour maximiser le temps et l’argent dépensés par les clients. On y trouve rarement des fenêtres et des horloges, et les sorties peuvent être difficiles à repérer.",BeetleLM/beetlelm_nld-fra_balanced,step-8000,fra,5.880908012390137,358.13428448272987
800,"Ils proposent généralement des offres spéciales de plats, de boissons et de divertissements afin de maintenir la bonne humeur des invités et de les garder sur place.",BeetleLM/beetlelm_nld-fra_balanced,step-8000,fra,5.911433219909668,369.2349712763004
801,"Sur certains sites, ce sont les locaux qui proposent gratuitement des boissons alcoolisées. Néanmoins, l'ivresse altère le jugement, et tous les bons joueurs sache que c'est crucial de rester sobre.",BeetleLM/beetlelm_nld-fra_balanced,step-8000,fra,5.88115930557251,358.2242924955208
802,"Quiconque se rend en voiture à des latitudes élevées ou franchit des cols de montagne doit envisager la possibilité de neige, de glace ou de températures glaciales.",BeetleLM/beetlelm_nld-fra_balanced,step-8000,fra,6.181705474853516,483.8163898142321
803,"Sur les routes glacées et enneigées, le frottement est faible et vous ne pouvez pas conduire comme si vous étiez sur l'asphalte nu.",BeetleLM/beetlelm_nld-fra_balanced,step-8000,fra,5.863076210021973,351.80470631285334
804,"Pendant les blizzards, il peut tomber en très peu de temps assez de neige pour vous bloquer.",BeetleLM/beetlelm_nld-fra_balanced,step-8000,fra,5.325226783752441,205.45494902611688
805,La visibilité peut également être limitée par des chutes de neige ou de la poudrerie ou par la condensation ou la glace sur les vitres des véhicules.,BeetleLM/beetlelm_nld-fra_balanced,step-8000,fra,5.614036560058594,274.24902940443496
806,"D'autre part, la présence de glace et de neige est normale dans de nombreux pays, et la circulation est pratiquement ininterrompue toute l'année.",BeetleLM/beetlelm_nld-fra_balanced,step-8000,fra,5.1229472160339355,167.82927056438024
807,Les safaris sont peut-être le plus grand attrait touristique en Afrique et le moment le plus marquant pour de nombreux visiteurs.,BeetleLM/beetlelm_nld-fra_balanced,step-8000,fra,5.542323112487793,255.27033286163115
808,"Dans le langage courant, le terme « safari » désigne une excursion sur la terre africaine, et en particulier dans la savane, ayant pour but d'assister au spectacle saisissant des animaux sauvages dans leur milieu.",BeetleLM/beetlelm_nld-fra_balanced,step-8000,fra,5.724233627319336,306.1985131257295
809,"Certains animaux, tels que les éléphants et les girafes, ont tendance à s’approcher de près des voitures et l’équipement standard permet de bien les observer.",BeetleLM/beetlelm_nld-fra_balanced,step-8000,fra,5.515892505645752,248.61176566350056
810,"Les lions, les guépards et les léopards sont parfois timides et vous les verrez mieux avec des jumelles.",BeetleLM/beetlelm_nld-fra_balanced,step-8000,fra,5.927485942840576,375.2100276198287
811,"Un safari à pied (également appelé « marche en brousse », « safari pédestre » ou « footing ») consiste à faire de la randonnée, soit pendant quelques heures, soit pendant plusieurs jours.",BeetleLM/beetlelm_nld-fra_balanced,step-8000,fra,6.51605224609375,675.9048056575958
812,Les paralympiques se tiendront du 24 août au 5 septembre 2021. Certains événements se tiendront dans d’autres localisations à travers le Japon.,BeetleLM/beetlelm_nld-fra_balanced,step-8000,fra,5.642394065856934,282.1373660126675
813,"Tokyo sera la seule ville asiatique à avoir accueilli deux Jeux olympiques d'été, après avoir accueilli les Jeux en 1964.",BeetleLM/beetlelm_nld-fra_balanced,step-8000,fra,4.597222328186035,99.20836429101266
814,"Si vous avez réservé vos vols et votre hébergement en 2020 avant l'annonce du report, vous risquez d'être confronté à une situation délicate.",BeetleLM/beetlelm_nld-fra_balanced,step-8000,fra,5.663052082061768,288.02638256296495
815,"Les politiques d'annulation varient, mais à partir de fin mars, la plupart des politiques d'annulation basées sur les coronavirus ne s'étendent pas jusqu'en juillet 2020, date à laquelle les Jeux olympiques avaient été prévus.",BeetleLM/beetlelm_nld-fra_balanced,step-8000,fra,5.0054802894592285,149.22873893957888
816,"On s'attend à ce que la plupart des billets d'événements coûtent entre 2 500 et 130 000 yens, les billets typiques coûtant environ 7 000 yens.",BeetleLM/beetlelm_nld-fra_balanced,step-8000,fra,5.396295547485352,220.58774395138056
