sentence_id,sentence,repo,revision,iso_code,nll,ppl
436,De meest effectieve plek voor het hoofdonderwerp ligt op het snijpunt van de lijnen. Zo deel je de afbeelding verticaal en horizontaal in drieën (zie voorbeeld).,BeetleLM/beetlelm_nld-ukr_balanced,step-5000,nld,6.791007995605469,889.8100345389735
437,In deze periode in de geschiedenis van Europa lag de rijke en machtige katholieke kerk onder vuur.,BeetleLM/beetlelm_nld-ukr_balanced,step-5000,nld,6.766247272491455,868.0482255370398
438,"Al meer dan duizend jaar verbond het christendom Europese staten, ondanks taalverschillen en verschillen in gewoonten.",BeetleLM/beetlelm_nld-ukr_balanced,step-5000,nld,6.354499340057373,575.074351881231
439,"Van de koning tot de gewone burger, zijn allesdoordringende macht had invloed op iedereen.",BeetleLM/beetlelm_nld-ukr_balanced,step-5000,nld,6.5357770919799805,689.3692795708289
440,Een van de belangrijkste principes van het christendom is dat welvaart moet worden gebruikt om lijden en armoede te bestrijden en de kerk beschikt om deze reden over geldmiddelen.,BeetleLM/beetlelm_nld-ukr_balanced,step-5000,nld,6.402774333953857,603.5170753182781
441,De kerk was al meer dan duizend jaar de centrale autoriteit in Rome en deze verhouding van macht en geld leidde ertoe dat veel mensen begonnen te twijfelen of dit principe werd nageleefd.,BeetleLM/beetlelm_nld-ukr_balanced,step-5000,nld,7.308021545410156,1492.2219733629886
442,"Groot-Brittannië stelde een blokkade op zee in gericht tegen Duitsland, vlak na het uitbreken van de vijandelijkheden.",BeetleLM/beetlelm_nld-ukr_balanced,step-5000,nld,7.107317924499512,1220.8686889860842
443,"De strategie bleek effectief, want het was niet meer mogelijk om vitale voorzieningen aan militairen en burgers te leveren. Deze blokkade schond echter wel de algemeen aanvaarde internationale wet die in de afgelopen twee eeuwen werd vastgelegd in verschillende internationale overeenkomsten.",BeetleLM/beetlelm_nld-ukr_balanced,step-5000,nld,7.3213396072387695,1512.2284056048843
444,"Groot-Brittannië heeft mijnen geplaatst in internationale wateren, zodat er in hele delen van de oceaan geen schepen meer konden varen, wat zelfs voor neutrale schepen gevaarlijk was.",BeetleLM/beetlelm_nld-ukr_balanced,step-5000,nld,6.82270622253418,918.4672265565773
445,"Vanwege de beperkte reactie op deze tactiek, verwachtte Duitsland dat er een vergelijkbare reactie zou komen op de ongeremde onderzeese oorlogsvoering van het land.",BeetleLM/beetlelm_nld-ukr_balanced,step-5000,nld,6.9531474113464355,1046.438121719755
446,Tijdens de jaren 20 hadden de meeste burgers en naties een houding van pacifisme en isolement.,BeetleLM/beetlelm_nld-ukr_balanced,step-5000,nld,6.588995456695557,727.0501495804192
447,Na de Eerste Wereldoorlog wilden staten voorkomen dat er ooit nog zulke verschrikkingen zouden plaatsvinden.,BeetleLM/beetlelm_nld-ukr_balanced,step-5000,nld,7.661586284637451,2125.125810691901
448,Tesla emigreerde in 1884 naar de Verenigde Staten van Amerika om te gaan werken bij de Edison Company in New York City.,BeetleLM/beetlelm_nld-ukr_balanced,step-5000,nld,7.219332218170166,1365.576848756021
449,"Toen hij naar de Verenigde Staten kwam, had hij alleen 4 cent, een dichtbundel en een aanbevelingsbrief van Charles Batchelor (zijn vorige baas) voor Thomas Edison bij zich.",BeetleLM/beetlelm_nld-ukr_balanced,step-5000,nld,7.229922294616699,1380.1152575352035
450,Het oude China had een unieke manier om verschillende tijdsperiodes weer te geven; iedere fase van China of iedere regerende familie had een onderscheidende dynastie.,BeetleLM/beetlelm_nld-ukr_balanced,step-5000,nld,7.881776809692383,2648.574393987423
451,"Ook tussen de verschillende dynastieën was er een onstabiele periode waarin de provincies verdeeld waren. De bekendste was het tijdperk van de Drie Koninkrijken, dit heeft plaatsgevonden in de 60 jaar tussen de Han- en de Jin-dynastie in.",BeetleLM/beetlelm_nld-ukr_balanced,step-5000,nld,6.722045421600342,830.5145276873398
452,Er vonden in die tijd hevige oorlogen plaats tussen verschillende edelen die om de troon vochten.,BeetleLM/beetlelm_nld-ukr_balanced,step-5000,nld,7.0993499755859375,1211.1795222969245
453,In de geschiedenis van het oude China staat het tijdperk van de Drie Koninkrijken als een van de bloederigste te boek. Duizenden mensen stierven in de strijd om de hoogste plek in het grote paleis in Xi'an.,BeetleLM/beetlelm_nld-ukr_balanced,step-5000,nld,6.289280891418457,538.7657586682385
454,"De Revolutie heeft grote sociale en politieke gevolgen gehad, zoals het gebruik van het metrieke stelsel, een verschuiving van de absolute monarchie naar republicanisme, nationalisme en de opvatting dat het land aan zijn inwoners toebehoort in plaats van een enkele leider.",BeetleLM/beetlelm_nld-ukr_balanced,step-5000,nld,6.932039260864258,1024.5812390891538
455,"Voor alle mannelijke sollicitanten waren na de revolutie functies te verkrijgen, zodat de meest ambitieuze en geschikte kandidaten konden slagen.",BeetleLM/beetlelm_nld-ukr_balanced,step-5000,nld,7.622915267944336,2044.513755727767
456,Hetzelfde geldt voor het leger. De legerrangen worden niet meer gebaseerd op iemands klasse maar op het kaliber van de persoon.,BeetleLM/beetlelm_nld-ukr_balanced,step-5000,nld,6.3644118309021,580.803117389357
457,De Franse Revolutie inspireerde ook in andere landen de onderdrukte arbeidersklasse tot een revolutie.,BeetleLM/beetlelm_nld-ukr_balanced,step-5000,nld,7.057519435882568,1161.5602644485064
458,Mohammed hield zich intensief bezig met bovenaardse kwesties. Hij ging vaak voor bezinning naar een grot die later bekend werd als de Grot van Hira in het Gebergte van Noer.,BeetleLM/beetlelm_nld-ukr_balanced,step-5000,nld,7.247026443481445,1403.923987947254
459,"De grot zelf, die de tand des tijds heeft doorstaan, geeft een zeer levendig beeld van de spiritualiteit van Mohammed.",BeetleLM/beetlelm_nld-ukr_balanced,step-5000,nld,7.5109734535217285,1827.9921423728415
460,De grot bevindt zich op een van bergtoppen aan de noordzijde van Mekka en is compleet afgesloten van de rest van de wereld.,BeetleLM/beetlelm_nld-ukr_balanced,step-5000,nld,6.277932167053223,532.6860184759809
461,"Zelfs als bekend was dat de grot bestond, was deze helemaal niet makkelijk te vinden. Eenmaal binnen in de grot heerst totale isolatie.",BeetleLM/beetlelm_nld-ukr_balanced,step-5000,nld,6.433706283569336,622.4767533150433
462,"Het enige wat te zien is, zijn de heldere, prachtige lucht en de vele omringende bergen. Er is vanuit de grot heel weinig van deze wereld te zien of te horen.",BeetleLM/beetlelm_nld-ukr_balanced,step-5000,nld,5.834902763366699,342.03147444421637
463,De Grote Piramide van Gizeh staat als enige van de zeven wereldwonderen nog overeind.,BeetleLM/beetlelm_nld-ukr_balanced,step-5000,nld,7.10811710357666,1221.8447716787493
464,De Grote Piramide is in de derde eeuw voor Christus door de Egyptenaren gebouwd en behoort tot de talloze grote piramidestructuren ter ere van een overleden farao.,BeetleLM/beetlelm_nld-ukr_balanced,step-5000,nld,7.149324893951416,1273.2460888197256
465,"Het Plateau van Gizeh of 'piramides van Gizeh' in de Egyptische vallei van de doden bevat verschillende piramides (waarvan de Grote Piramide de grootste is), meerdere kleine tombes, een aantal tempels en de grote sfinx.",BeetleLM/beetlelm_nld-ukr_balanced,step-5000,nld,7.449895858764648,1719.6840460293029
466,"De grote piramide werd gebouwd om farao Khufu te eren. Veel van de kleinere piramides, tombes en tempels werden gebouwd als eerbetoon aan de vrouwen en familieleden van Khufu.",BeetleLM/beetlelm_nld-ukr_balanced,step-5000,nld,7.421607971191406,1671.7194244022826
467,Het up-bow teken ziet eruit als een V en het down-bow teken ziet eruit als een nietje of een vierkantje waarvan de onderkant ontbreekt.,BeetleLM/beetlelm_nld-ukr_balanced,step-5000,nld,6.910030841827393,1002.278153903386
468,Boven betekent dat je bij de punt moet beginnen en de strijkstok moet wegduwen. Onder betekent dat je bij de boogkikker moet beginnen (de plek waar je hand de strijkstok vasthoudt) en de strijkstok moet aantrekken.,BeetleLM/beetlelm_nld-ukr_balanced,step-5000,nld,6.594806671142578,731.2874940473997
469,"Een opwaartse beweging geeft meestal een zachter geluid, terwijl een neerwaartse beweging juist een sterker en assertiever geluid produceert.",BeetleLM/beetlelm_nld-ukr_balanced,step-5000,nld,7.0921125411987305,1202.4453346531982
470,"Neem de vrijheid om je persoonlijke tekens te schetsen, maar vergeet daarbij niet dat de gedrukte strijktekens er om een muzikale reden zijn, waardoor ze dus meestal moeten worden gerespecteerd.",BeetleLM/beetlelm_nld-ukr_balanced,step-5000,nld,7.177476406097412,1309.5991881012733
471,"Een groep marktvrouwen zat op 6 oktober 1789 achter het vertrek van de doodsbange Louis XVI, Marie Antoinette en hun twee jonge kinderen (Marie Therese van 11 en Louis-Charles van 4), en de zus van de koning, Madame Elizabeth, uit Versailles naar Parijs.",BeetleLM/beetlelm_nld-ukr_balanced,step-5000,nld,7.413839817047119,1658.7835591753876
472,"Zij reden terug naar de Franse hoofdstad in een rijtuig, omgeven door joelende en dreigende meutes die het Koningspaar bedreigden.",BeetleLM/beetlelm_nld-ukr_balanced,step-5000,nld,7.497162818908691,1802.9199408342881
473,Door de acties van de menigte mensen werden de koning en koningin gedwongen om de ramen van hun koets helemaal te openen.,BeetleLM/beetlelm_nld-ukr_balanced,step-5000,nld,6.1565141677856445,471.78065697966133
474,Op een gegeven moment hield iemand in de menigte het hoofd van een koninklijke wacht die vermoord was in Versailles omhoog voor de ogen van een doodsbange koningin.,BeetleLM/beetlelm_nld-ukr_balanced,step-5000,nld,7.010112762451172,1107.779413780111
475,De oorlogskosten van het imperialisme van de V.S. met betrekking tot de verovering van de Filippijnen zijn betaald door de bevolking van de Filippijnen.,BeetleLM/beetlelm_nld-ukr_balanced,step-5000,nld,6.394515514373779,598.5532625112509
476,Ze werden opgelegd aan het Amerikaanse koloniale regime belasting te betalen om een groot deel van de kosten te financieren en de rente op obligaties werd via de banken op Wall Street uitgegeven in de naam van de Filipijnse overheid.,BeetleLM/beetlelm_nld-ukr_balanced,step-5000,nld,6.740654945373535,846.114713335718
477,Het Amerikaanse imperialisme rustte voor een groot deel op de enorme winst van de langdurige uitbuiting van de Filipijnen.,BeetleLM/beetlelm_nld-ukr_balanced,step-5000,nld,6.80165433883667,899.3338646030361
478,Om de Tempeliers te begrijpen moet men weten wat de context was die de aanzet gaf tot het ontstaan van de orde.,BeetleLM/beetlelm_nld-ukr_balanced,step-5000,nld,6.5996317863464355,734.8245669830874
479,"Het tijdperk waarin dit gebeurd is, wordt algemeen aangeduid als de Hoge Middeleeuwen, de Europese geschiedenis in de 11e, 12e en 13e eeuw (1000-1300 n.Chr.).",BeetleLM/beetlelm_nld-ukr_balanced,step-5000,nld,6.548829555511475,698.4262261010847
480,"Na de vroege middeleeuwen kwamen de hoge middeleeuwen. Deze werden weer opgevolgd door de late middeleeuwen, die gebruikelijk rond 1500 eindigen.",BeetleLM/beetlelm_nld-ukr_balanced,step-5000,nld,6.7370524406433105,843.0720649468537
481,Technologisch determinisme is een term voor een groot assortiment ideeën in de praktijk: van technologieaanbod of de technologische verplichting tot een strikt gevoel dat het menselijke lot wordt gedreven door een onderliggende logica die is gekoppeld aan wetenschappelijke wetten en de verschijning daarvan in technologie.,BeetleLM/beetlelm_nld-ukr_balanced,step-5000,nld,7.708288669586182,2226.728327758296
482,"De meeste interpretaties van technologisch determinisme hebben deze twee algemene opvattingen: de ontwikkeling van de technologie volgt een traject dat voor het grootste deel verder reikt dan culturele of politieke invloed, en dat technologie op zijn beurt 'effecten' heeft op samenlevingen die inherent zijn in plaats van die sociaal geconditioneerd zijn.",BeetleLM/beetlelm_nld-ukr_balanced,step-5000,nld,7.414050579071045,1659.1332046002688
483,Zo zullen sommigen bijvoorbeeld zeggen dat de komst van de auto automatisch leidt tot de aanleg van wegen.,BeetleLM/beetlelm_nld-ukr_balanced,step-5000,nld,6.836740016937256,931.4476762228715
484,"Een landelijk wegennetwerk is echter economisch niet haalbaar voor maar een paar auto's. Daarom worden nieuwe productiemethoden ontwikkeld, zodat de kosten van autobezit kunnen worden verlaagd.",BeetleLM/beetlelm_nld-ukr_balanced,step-5000,nld,6.844438076019287,938.6456852695119
485,Het massale autobezit zorgt ook voor een groter aantal ongevallen op de weg en dit leidt tot de ontwikkeling van nieuwe technieken op het gebied van gezondheidszorg om het menselijk lichaam te kunnen herstellen.,BeetleLM/beetlelm_nld-ukr_balanced,step-5000,nld,6.793586254119873,892.1071548492323
486,"In de romantiek was een groot onderdeel van cultureel determinisme opgenomen, dat was afkomstig van schrijvers zoals Goethe, Fichte en Schlegel.",BeetleLM/beetlelm_nld-ukr_balanced,step-5000,nld,7.388782978057861,1617.736094075683
487,In de Romantiek vormde de geografie het individu en na verloop van tijd ontstonden er gewoonten en culturen naar aanleiding van deze geografie. Deze vormden een harmonieuze samenleving en waren beter dan de arbitraire opgelegde wetten.,BeetleLM/beetlelm_nld-ukr_balanced,step-5000,nld,7.248327255249023,1405.7514171045527
488,"Constantinopel werd als modehoofdstad van het feodale Europa gezien, zoals Parijs de huidige modehoofdstad is.",BeetleLM/beetlelm_nld-ukr_balanced,step-5000,nld,7.090527534484863,1200.5409603464336
489,Het stond vanaf ongeveer 400 na Christus tot ongeveer 1100 na Christus bekend als een epicentrum van luxe.,BeetleLM/beetlelm_nld-ukr_balanced,step-5000,nld,7.19560432434082,1333.5559824635388
490,"De status van het rijk nam in de 12e eeuw af, voornamelijk doordat de kruisvaarders terugkwamen met zijde en specerijen die meer waard waren dan wat de Byzantijnse markten konden bieden.",BeetleLM/beetlelm_nld-ukr_balanced,step-5000,nld,7.015814781188965,1114.1140356580188
491,Rond deze tijd nam Parijs ook de titel van modehoofdstad over van Constantinopel.,BeetleLM/beetlelm_nld-ukr_balanced,step-5000,nld,6.9292683601379395,1021.746155870619
492,"De gotiek vierde zijn hoogtijdagen in de 10e, 11e en 14e eeuw.",BeetleLM/beetlelm_nld-ukr_balanced,step-5000,nld,7.062718868255615,1167.6154466044288
493,Kleding was in het begin sterk beïnvloed door de Byzantijnse cultuur uit het oosten.,BeetleLM/beetlelm_nld-ukr_balanced,step-5000,nld,6.404254913330078,604.4112920692789
494,Vanwege de langzame communicatiekanalen liepen stijlen in het westen echter met 25 tot 30 jaar achter.,BeetleLM/beetlelm_nld-ukr_balanced,step-5000,nld,7.815861701965332,2479.622728458879
495,Aan het einde van de middeleeuwen begon er in West-Europa een eigen stijl te ontplooien. Een van de grootste ontwikkelingen was het resultaat van de kruistochten: mensen begonnen knopen te gebruiken om hun kleding te bevestigen.,BeetleLM/beetlelm_nld-ukr_balanced,step-5000,nld,6.436972618103027,624.5132948331164
496,Zelfvoorzienende landbouw is landbouw waarbij voldoende voedsel wordt geproduceerd om aan de behoeften van de boer en zijn gezin te voldoen.,BeetleLM/beetlelm_nld-ukr_balanced,step-5000,nld,6.304819583892822,547.2028550696766
497,"Landbouw met als doel levensonderhoud is een simpel systeem dat meestal biologisch is. Hierbij wordt opgeslagen zaad gebruikt dat afkomstig is uit de ecoregio, en dat wordt gecombineerd met wisselende gewassen of andere relatief eenvoudige technieken om de opbrengst te optimaal te maken.",BeetleLM/beetlelm_nld-ukr_balanced,step-5000,nld,7.524243354797363,1852.4110777384992
498,Vroeger werkten de meeste boeren in de zelfvoorzienende landbouw. In veel ontwikkelingslanden is dit nog steeds het geval.,BeetleLM/beetlelm_nld-ukr_balanced,step-5000,nld,6.451668739318848,633.7589894357817
499,Subculturen zorgen ervoor dat gelijkgestemde personen die zich verwaarloosd voelen door maatschappelijke normen worden samengebracht. Hierdoor krijgen ze de mogelijkheid een gevoel van identiteit te ontwikkelen.,BeetleLM/beetlelm_nld-ukr_balanced,step-5000,nld,7.4974188804626465,1803.3816584275341
500,"Subculturen kunnen zich onderscheiden door middel van de leeftijd, etniciteit, sociale klasse, locatie en/of geslacht van hun leden.",BeetleLM/beetlelm_nld-ukr_balanced,step-5000,nld,7.336332321166992,1535.0716265297162
501,"Een subcultuur kan worden bepaald door de volgende soorten kwaliteiten: taalkundig, esthetisch, religieus, politiek, seksueel, geografisch of een of meer van deze factoren samen.",BeetleLM/beetlelm_nld-ukr_balanced,step-5000,nld,6.8798651695251465,972.4952289583534
502,"Leden van een subcultuur laten vaak zien tot welke groep ze behoren door middel van een bepaalde symbolische stijl in wat ze dragen, in hoe ze zich gedragen en het jargon dat ze spreken.",BeetleLM/beetlelm_nld-ukr_balanced,step-5000,nld,6.934385776519775,1026.988257956306
503,"Een van de meest gebruikte methoden voor het illustreren van het belang van de vermaatschappelijking waren de paar betreurenswaardige gevallen van kinderen die door verwaarlozing, tegenslagen of moedwillig misbruik tijdens het opgroeien niet werden gesocialiseerd door volwassenen.",BeetleLM/beetlelm_nld-ukr_balanced,step-5000,nld,7.32468318939209,1517.2931279527972
504,"Ze worden 'wolfskinderen' of 'wilde kinderen' genoemd. Sommige wolfskinderen zijn door mensen (meestal hun eigen ouders) opgesloten geweest; soms werd dit kind in de steek gelaten, omdat de ouders de ernstige verstandelijke of lichamelijke beperking van het kind niet wilden accepteren.",BeetleLM/beetlelm_nld-ukr_balanced,step-5000,nld,7.039623260498047,1140.9576818204253
505,Onhandelbare kinderen hebben mogelijk ernstige kindermishandeling of een ernstig trauma meegemaakt voordat ze werden verlaten of voordat ze wegliepen.,BeetleLM/beetlelm_nld-ukr_balanced,step-5000,nld,8.278902053833008,3939.8662453420466
506,"Van anderen wordt beweerd dat zij zijn grootgebracht door dieren, en van sommigen wordt gezegd dat zij alleen in de wildernis hebben gewoond.",BeetleLM/beetlelm_nld-ukr_balanced,step-5000,nld,7.003010272979736,1099.9392972875814
507,"Een verwilderd kind dat niet is grootgebracht door mensen, kan gedrag vertonen dat lijkt op het gedrag van het dier dat het kind verzorgd heeft (binnen de fysieke limieten), zoals angst voor of onverschilligheid richting mensen.",BeetleLM/beetlelm_nld-ukr_balanced,step-5000,nld,7.358008861541748,1568.7099325371603
508,"Leren op projectbasis moet educatie vereenvoudigen en interessanter maken, maar scaffolding gaat nog een stapje verder.",BeetleLM/beetlelm_nld-ukr_balanced,step-5000,nld,7.429788589477539,1685.4512135772402
509,"Scaffolding is geen leermethode maar een hulpmiddel om individuen te ondersteunen die te maken hebben met een nieuwe leerervaring, bijvoorbeeld een nieuw computerprogramma of die aan een nieuw project beginnen.",BeetleLM/beetlelm_nld-ukr_balanced,step-5000,nld,6.704962730407715,816.44759707639
510,"Ondersteuning kan zowel virtueel als echt zijn. Een docent is bijvoorbeeld een vorm van ondersteuning, maar het paperclipmannetje van Microsoft Office is dat ook.",BeetleLM/beetlelm_nld-ukr_balanced,step-5000,nld,7.161006927490234,1288.207411522144
511,"Er is sprake van virtuele scaffolding die is ingebouwd in de software die vragen stelt, geheugensteuntjes biedt en procedures verklaart die mogelijk zonder hulp moeilijk te begrijpen kunnen zijn voor studenten.",BeetleLM/beetlelm_nld-ukr_balanced,step-5000,nld,7.635362148284912,2070.120605906118
512,"Er zijn verschillende redenen dat kinderen in de pleegzorg terechtkomen, zoals verwaarlozing, misbruik en uitbuiting.",BeetleLM/beetlelm_nld-ukr_balanced,step-5000,nld,6.52040433883667,678.8528164121916
513,"Geen enkel kind zou moeten opgroeien in een omgeving waar ze niet goed worden verzorgd, waar men niet om ze geeft en waar ze zich niet kunnen ontwikkelen, maar toch gebeurt dit.",BeetleLM/beetlelm_nld-ukr_balanced,step-5000,nld,6.228586196899414,507.0381244406065
514,Het pleegzorgsysteem beschouwen wij als een veilige zone voor deze kinderen.,BeetleLM/beetlelm_nld-ukr_balanced,step-5000,nld,7.355701446533203,1565.0944405191658
515,"Het is de bedoeling dat de pleegzorg zorgt voor een veilig thuis, liefhebbende verzorgers, stabiel onderwijs en betrouwbare gezondheidszorg.",BeetleLM/beetlelm_nld-ukr_balanced,step-5000,nld,7.011935710906982,1109.800680324457
516,In de pleegzorg moet aan alle behoeften worden voldoen die werden verwaarloosd in het eerdere thuis.,BeetleLM/beetlelm_nld-ukr_balanced,step-5000,nld,7.068325519561768,1174.1802453451583
517,Op internet worden onderdelen van interpersoonlijke en massacommunicatie samengevoegd.,BeetleLM/beetlelm_nld-ukr_balanced,step-5000,nld,7.765894889831543,2358.768382161319
518,De verschillende karakters van het internet leiden tot nieuwe dimensies wat betreft de toepassing van de Uses & Gratifications-theorie.,BeetleLM/beetlelm_nld-ukr_balanced,step-5000,nld,7.928861618041992,2776.264555454258
519,"'Leren' en 'socialisatie' worden bijvoorbeeld voorgesteld als belangrijke redenen om het internet te gebruiken (James et al., 1995).",BeetleLM/beetlelm_nld-ukr_balanced,step-5000,nld,7.048191547393799,1150.7757364622305
520,Eighmey en McCord (1998) introduceerden nieuwe motivatieaspecten als 'persoonlijke betrokkenheid' en 'aanhoudende relaties' toen zij reacties van het publiek op websites onderzochten.,BeetleLM/beetlelm_nld-ukr_balanced,step-5000,nld,7.445892810821533,1712.813828425514
521,"Dat er video-opnames worden gebruikt, leidde tot opmerkelijke vondsten in het interpreteren van micro-expressies, dat zijn gezichtsbewegingen die een paar milliseconden duren.",BeetleLM/beetlelm_nld-ukr_balanced,step-5000,nld,7.647167205810547,2094.703313396622
522,Er wordt met name gesteld dat niemand een leugen kan herkennen door op enkel op micro-expressies te letten.,BeetleLM/beetlelm_nld-ukr_balanced,step-5000,nld,7.5147576332092285,1834.922698070495
523,"Oliver Sacks beschreef in zijn essay The President's Speech hoe het kan dat mensen die spraak niet kunnen begrijpen vanwege hersenbeschadiging, de oprechtheid ervan toch nauwkeurig kunnen inschatten.",BeetleLM/beetlelm_nld-ukr_balanced,step-5000,nld,7.485763072967529,1782.4838161839261
524,"Hij suggereerde zelfs dat andere diersoorten, zoals huishonden, ook over het vermogen om het gedrag van mensen te interpreteren beschikken.",BeetleLM/beetlelm_nld-ukr_balanced,step-5000,nld,7.104679584503174,1217.6518676937746
525,Uit onderzoek in de twintigste eeuw is gebleken dat er twee groepen genetische varianten bestaan: verborgen en zichtbaar.,BeetleLM/beetlelm_nld-ukr_balanced,step-5000,nld,7.464484214782715,1744.9552939277808
526,Door mutatie wordt er nieuwe genetische variatie toegevoegd; door selectie wordt deze variatie geëlimineerd uit de pool van uitgedrukte variatie.,BeetleLM/beetlelm_nld-ukr_balanced,step-5000,nld,8.05970287322998,3164.3497816323015
527,Voor elke generatie wordt er door middel van scheiding en hercombinatie gevarieerd tussen de twee groepen.,BeetleLM/beetlelm_nld-ukr_balanced,step-5000,nld,7.125872611999512,1243.7329900026632
528,Een primaat met een spijsverteringssysteem dat lijkt op dat van de mens kan op de savanne maar moeilijk de benodigde aminozuren halen uit de plantaardige bronnen die daar te vinden zijn.,BeetleLM/beetlelm_nld-ukr_balanced,step-5000,nld,6.727960109710693,835.441317940556
529,"Verder kan het niet in acht nemen serieuze gevolgen hebben: groeiachterstand, ondervoeding en uiteindelijk zelfs de dood.",BeetleLM/beetlelm_nld-ukr_balanced,step-5000,nld,7.255688667297363,1416.1379152657614
530,"De gemakkelijkst te vinden plantaardige bronnen zijn de eiwitten in bladeren en peulvruchten, maar tenzij ze gekookt zijn, zijn ze voor primaten zoals wij moeilijk verteerbaar.",BeetleLM/beetlelm_nld-ukr_balanced,step-5000,nld,7.218210220336914,1364.0455337173007
531,"Niet alleen is dierlijk voedsel (mieren, termieten, eieren) licht verteerbaar, maar het bevat ook heel erg veel proteïnen die alle essentiële aminozuren bevatten.",BeetleLM/beetlelm_nld-ukr_balanced,step-5000,nld,7.356237411499023,1565.9335011409473
532,Al met al moeten we er niet versteld van staan als onze voorouders hun 'proteïneprobleem' oplosten op dezelfde manier als chimpansees op de savanne dit probleem vandaag de dag oplossen.,BeetleLM/beetlelm_nld-ukr_balanced,step-5000,nld,7.06176233291626,1166.4991151573308
533,Slaaponderbreking houdt in dat je met een reden wakker wordt tijdens je normale slaapperiode en dat je binnen korte tijd (10–60 minuten) weer in slaap valt.,BeetleLM/beetlelm_nld-ukr_balanced,step-5000,nld,6.838680267333984,933.2566723313955
534,Dit is vrij gemakkelijk door gebruik te maken van een relatief zachte wekker die je terugbrengt naar je bewustzijn zonder dat je meteen helemaal wakker wordt.,BeetleLM/beetlelm_nld-ukr_balanced,step-5000,nld,6.5509443283081055,699.9048017592382
535,"Als je in je slaap je klok uitzet, kun je deze aan de andere kant van de kamer plaatsen. Op deze manier moet je je bed uitkomen om hem uit te zetten.",BeetleLM/beetlelm_nld-ukr_balanced,step-5000,nld,5.104885578155518,164.8252098480967
536,"Andere opties op basis van het bioritme zijn bijvoorbeeld veel vloeistof drinken voordat je gaat slapen (en dan met name water of thee, een bekend diureticum). Hierdoor moet je wel opstaan om te plassen.",BeetleLM/beetlelm_nld-ukr_balanced,step-5000,nld,6.930683612823486,1023.1932085927576
537,De hoeveelheid innerlijke kalmte waarover een persoon beschikt staat tegenover de hoeveelheid stress die iemand in zijn of haar lichaam en geest meedraagt.,BeetleLM/beetlelm_nld-ukr_balanced,step-5000,nld,7.5537800788879395,1907.9412857898965
