sentence_id,sentence,repo,revision,iso_code,nll,ppl
506,ادعا می‌شود که بقیه توسط حیوانات بزرگ شده‌اند؛ گفته شده است برخی به تنهایی در حیات وحش زندگی کرده‌اند.,BeetleLM/beetlelm_fas-ukr_late,step-8000,fas,6.224452972412109,504.9467470920502
507,اگر کاملا توسط حیواناتی غیر از انسان پرورش داده شود، کودک وحشی رفتارهایی (در محدوده فیزیکی) تقریباً مانند رفتار حیوانات از خود نشان می‌دهد، مانند ترس و بی تفاوتی نسبت به انسان.,BeetleLM/beetlelm_fas-ukr_late,step-8000,fas,6.522914886474609,680.559249891932
508,گرچه یادگیری مبتنی بر پروژه باید یادگیری را آسان‌تر و جالب‌تر کند، سکوب‌بندی یک گام از آن فراتر می‌رود.,BeetleLM/beetlelm_fas-ukr_late,step-8000,fas,7.13261079788208,1252.1417922985588
509,داربست سازی روشی برای یادگیری نیست بلکه کمکی است که از افرادی که در حال دریافت یک تجربه یادگیری جدید مانند استفاده از یک برنامه جدید کامپیوتری یا شروع یک پروژه جدید هستند، پشتیبانی می کند.,BeetleLM/beetlelm_fas-ukr_late,step-8000,fas,5.226438999176025,186.128817122627
510,داربست‌ها ممکن است مجازی یا واقعی باشند،‌ به عبارت دیگر یک معلم نوعی از داربست است ولی گیره کاغذ کوچک در Microsoft Office نیز داربست است.,BeetleLM/beetlelm_fas-ukr_late,step-8000,fas,6.693136692047119,806.8491242937008
511,داربست های مجازی در نرم افزار درونی شده اند و هدف آن پرسش، برانگیختن و توضیح روش هایی است که ممکن است انجام آن به تنهایی برای دانشجویان چالش محسوب می‌شود.,BeetleLM/beetlelm_fas-ukr_late,step-8000,fas,5.781666278839111,324.29911321124206
512,کودکان به دلایل متعددی به خانه‌های پرستاری سپرده می‌شوند. دامنه این دلایل از غفلت تا تعرض، و حتی اخاذی گسترش دارد.,BeetleLM/beetlelm_fas-ukr_late,step-8000,fas,6.473147869110107,647.518826683525
513,هیچ کودکی نباید مجبور شود در محیطی فاقد تغذیه، مراقبت و تربیت رشد کند، اما این اتفاق می‌افتد.,BeetleLM/beetlelm_fas-ukr_late,step-8000,fas,5.9446210861206055,381.6947044719423
514,ما سیستم مراقبت از کودکان بی‌سرپرست را منطقه‌ای امن برای این کودکان می‌دانیم.,BeetleLM/beetlelm_fas-ukr_late,step-8000,fas,7.404293060302734,1643.0229073018506
515,سیستم پرورش و مراقبت ما می‌کوشد خانه‌های امن، مراقب‌های با محبت، آموزش پایدار و مراقبت‌های بهداشتی قابل اطمینان را فراهم کند.,BeetleLM/beetlelm_fas-ukr_late,step-8000,fas,7.6387858390808105,2077.2202052525045
516,برای فرزند‌خواندگی لازم است تمام فقدان نیازهای فرزند‌خوانده در خانه قبلی که از آن آورده شده است فراهم شود.,BeetleLM/beetlelm_fas-ukr_late,step-8000,fas,6.125171661376953,457.22319409572617
517,اینترنت عناصر ارتباط جمعی و بین فردی را با هم ترکیب می‌کند.,BeetleLM/beetlelm_fas-ukr_late,step-8000,fas,6.71188497543335,822.1188536617801
518,خصوصیات متمایز اینترنت منجر به ابعاد اضافی از لحاظ رویکرد کاربرد و رضایت‌مندی شده است.,BeetleLM/beetlelm_fas-ukr_late,step-8000,fas,6.612741470336914,744.5213065643436
519,برای مثال، به «یادگیری» و «جامعه پذیری» به عنوان انگیزه مهمی برای استفاده از اینترنت اشاره می‌شود (جیمز و سایرین، 1995).,BeetleLM/beetlelm_fas-ukr_late,step-8000,fas,6.0825042724609375,438.1250064282064
520,«درگیری شخصی» و «روابط مداوم» همچنین توسط ایمی و مککورد (1998) به عنوان جنبه های انگیزشی جدید شناخته می‌شد زمانیکه آنها در مورد واکنش مخاطبان به وب سایت ها تحقیق می‌کردند.,BeetleLM/beetlelm_fas-ukr_late,step-8000,fas,6.837027072906494,931.715092218207
521,استفاده از ضبط ویدئویی منجر به اکتشافات مهمی در زمینه تفسیر میکرو بیان و حرکات صورت شد که تنها چند میلی ثانیه طول می‌کشند.,BeetleLM/beetlelm_fas-ukr_late,step-8000,fas,6.867969989776611,960.9957531642563
522,به ویژه، ادعا می شود که با تفسیر صحیح عبارات کوچک می‌توان تشخیص داد که فرد دروغ می‌گوید.,BeetleLM/beetlelm_fas-ukr_late,step-8000,fas,6.448917865753174,632.0179943113542
523,الیور ساکس، در مقاله خود «سخنان رئیس جمهور»، نشان داد که چگونه افرادی که به دلیل آسیب مغزی قادر به درک گفتار نیستند، باز هم قادر هستند خلوص نیت را به طور دقیق ارزیابی کنند.,BeetleLM/beetlelm_fas-ukr_late,step-8000,fas,5.353061199188232,211.25399962375025
524,او حتی اظهار می‌دارد که چنین توانایی‌هایی در تفسیر رفتار انسانی می‌تواند در حیواناتی مثل سگ‌های خانگی مشترک باشد.,BeetleLM/beetlelm_fas-ukr_late,step-8000,fas,8.092117309570312,3268.6008887695757
525,تحقیقات قرن بیستم نشان داد که دو منبع تغییرات ژنتیکی وجود دارد: پنهان و بیان شده.,BeetleLM/beetlelm_fas-ukr_late,step-8000,fas,5.767119407653809,319.61572271296234
526,جهش تنوع ژنتیکی جدید می‌افزاید و انتخاب آن را از خزانه تنوع بیان‌شده خارج می‌کند.,BeetleLM/beetlelm_fas-ukr_late,step-8000,fas,8.27315616607666,3917.293129520874
527,تفکیک و ترکیب مجدد اختلاف بین دو استخر با هر نسل را به سمت جلو و عقب بر می‌زند.,BeetleLM/beetlelm_fas-ukr_late,step-8000,fas,5.847715854644775,346.44215180855093
528,در خارج از ساوانا، برآورده کردن نيازهاي مبتنی بر اسيد آمینه از منابع گياهي موجود برای یک نخستی که دستگاه گوارشی مشابه انسان داشته، کار دشواری بوده است.,BeetleLM/beetlelm_fas-ukr_late,step-8000,fas,6.360041618347168,578.2704225521288
529,از این گذشته، عدم انجام این امر عواقب جدی دارد: افسردگی رشد، سوء تغذیه و در نهایت مرگ.,BeetleLM/beetlelm_fas-ukr_late,step-8000,fas,6.320223808288574,555.6973482074268
530,بیشترین منابع گیاهی قابل دسترسی پروتئین های موجود در برگ ها و حبوبات می باشد، اما هضم اینهت توسط پستاندارانی مانند ما سخت است، مگر اینکه پخته شوند.,BeetleLM/beetlelm_fas-ukr_late,step-8000,fas,5.45286750793457,233.4265596494227
531,در مقابل، غذاهای حیوانی (مورچه‌ها، موریانه‌ها‌، تخم‌ها) نه تنها به راحتی قابل هضم هستند بلکه پروتئین‌های با کیفیت بالا در اختیار قرار می‌دهند که حاوی تمام اسیدهای آمینه ضروری است.,BeetleLM/beetlelm_fas-ukr_late,step-8000,fas,6.801644325256348,899.3248590962352
532,همه چیز در نظر گرفته شده است، و اگر اجداد خودمان «مشکل پروتئین» خود را تقریباً به همان شیوه‌ای حل کرده‌اند که امروزه شامپانزه‌ها در ساوانا انجام می‌دهند، نباید تعجب کنیم.,BeetleLM/beetlelm_fas-ukr_late,step-8000,fas,6.4175333976745605,612.4904789181047
533,اختلال در خواب فرآیند بیداری آگاهانه در طول خواب معمولی و بعد از مدتی مجددا به خواب رفتن (10-60 دقیقه) است.,BeetleLM/beetlelm_fas-ukr_late,step-8000,fas,5.602084636688232,270.99073624245
534,این کار را می توان به راحتی با استفاده از یک ساعت زنگ دار نسبتاً آرام انجام داد تا بدون اینکه شما را کاملا از خواب بیدار کند، شما را هوشیار کند.,BeetleLM/beetlelm_fas-ukr_late,step-8000,fas,4.902730941772461,134.65701847953378
535,اگر متوجه شدید که ساعت بیدارباش را در خواب خاموش می‌کنید، می‌تواند آن را در طرف دیگر اتاق قرار دهید تا برای خاموش کردنش مجبور باشید از رختخواب خارج شوید.,BeetleLM/beetlelm_fas-ukr_late,step-8000,fas,6.156529426574707,471.7878558361127
536,سایر گزینه‌های مبتنی بر بیوریتم شامل نوشیدن مقدار زیادی مایعات (بخصوص آب یا چای، یک ادرارآور مشخص) پیش از خواب می‌شود که فرد را مجبور می‌کند برای ادرار کردن از خواب برخیزد.,BeetleLM/beetlelm_fas-ukr_late,step-8000,fas,6.883301734924316,975.8430215724
537,میزان آرامش درونی فرد به شکل متضادی با میزان تنش موجود در بدن و روح فرد ارتباط دارد.,BeetleLM/beetlelm_fas-ukr_late,step-8000,fas,6.145349025726318,466.54245596908885
538,هرچه تنش کمتر باشد، هدیه نیروی زندگی مثبت تر است. هر شخص توانایی این را دارد که صلح و رضایت مطلق را پیدا کند.,BeetleLM/beetlelm_fas-ukr_late,step-8000,fas,5.650478839874268,284.4276285111316
539,هر کسی می‌تواند به روشنگری دست یابد. تنها چیزی که سر راه این هدف قرار می‌گیرد تنش و منفی بودن ماست.,BeetleLM/beetlelm_fas-ukr_late,step-8000,fas,6.36996603012085,584.0379888544143
540,آیین بودایی تبتی بر پایه آموزه‌های بودا است، اما با راه عشق ماهایانا و تکنیکهای زیادی از یوگای هندی بسط داده شد.,BeetleLM/beetlelm_fas-ukr_late,step-8000,fas,6.499421119689941,664.7567070733741
541,در اصل بودیسم تبتی خیلی ساده است، و شامل کندالینی یوگا،‌ مراقبه و مسیر عشق فراگیر می‌شود.,BeetleLM/beetlelm_fas-ukr_late,step-8000,fas,7.7342143058776855,2285.212520707665
542,با استفاده از یوگا کوندالینی، انرژی کوندالینی (انرژی روشنگری) از طریق حرکات یوگا، تمرین های تنفسی، مانترا و تجسم بیدار می شود.,BeetleLM/beetlelm_fas-ukr_late,step-8000,fas,5.950198650360107,383.82957937244066
543,مرکز مراقبه تبت، یوگای خدایان است. از طریق تجسم خدایان مختلف، کانال های انرژی پاک می شوند، چاکراها فعال می شوند و آگاهی روشنگری ایجاد می شود.,BeetleLM/beetlelm_fas-ukr_late,step-8000,fas,5.72032356262207,305.0035947556548
544,آلمان دشمن مشترکی در جنگ جهانی دوم بود که منجر به اتحاد بین شوروی و ایالات متحده شد. با پایان جنگ، اختلاف در سیستم، پروسه و فرهنگ منجر به جدایی این کشورها شد.,BeetleLM/beetlelm_fas-ukr_late,step-8000,fas,4.887842655181885,132.66705651693667
545,با توجه به دو سال آخر جنگ، حالا متحدان سابق دشمن شده بودند و جنگ سرد آغاز شد.,BeetleLM/beetlelm_fas-ukr_late,step-8000,fas,5.509863376617432,247.11736275118827
546,این برای آن بود که برای 40 سال آینده دوام داشته باشد و با ارتش‌های نیابتی، در جبهه‌های نبردی از آفریقا تا آسیا، در افغانستان، کوبا و بسیاری از مناطق دیگر به صورت حقیقی بجنگد.,BeetleLM/beetlelm_fas-ukr_late,step-8000,fas,5.5560994148254395,258.8113491978638
547,تا هفدهم سپتامبر سال 1939، دفاع کشور لهستان درهم شکسته شد و تنها امیدی که وجود داشت عقب نشینی و سازماندهی مجدد در طول منطقه سرپل رومانی بود.,BeetleLM/beetlelm_fas-ukr_late,step-8000,fas,5.838187217712402,343.1567080845307
548,اما این نقشه‌ها تقریباً یک شبه از کار افتاد، وقتی که بیش از 800 هزار سرباز از ارتش سرخ اتحاد جماهیر شوروی وارد شدند و پس از هجوم به نواحی شرقی لهستان جبهه‌های بلاروسی و اوکراینی را ساختند، و بدین ترتیب عهدنامه صلح ریگا، پیمان عدم تجاوز بین شوروی و لهستان، و سایر عهدنامه‌های بین‌المللی، هم دوجانبه و هم چند جانبه، نقض کردند.,BeetleLM/beetlelm_fas-ukr_late,step-8000,fas,6.039324760437012,419.6096022005468
549,استفاده از کشتی‌ها برای حمل و نقل کالا به‌مراتب کارآمدترین راه برای جابجایی تعداد زیادی از افراد و اجناس از میان اقیانوس است.,BeetleLM/beetlelm_fas-ukr_late,step-8000,fas,5.575009346008301,263.7520206539943
550,به‌طور سنتی کار نیروهای دریایی از این قرار بود که اطمینان حاصل کنند کشورتان توانایی جابجایی افراد و کالاهای شما را داشته باشد، و درعین‌حال در توانایی دشمن‌تان برای جابجایی مردم و کالاهایش مداخله کنند.,BeetleLM/beetlelm_fas-ukr_late,step-8000,fas,6.3967976570129395,599.9208063049035
551,یکی از مثال‌هایی که ارزش بیان کردن دارد مبارزه در اقیانوس اطلس شمالی در جنگ جهانی دوم بود. آمریکایی‌ها سعی داشتند افراد و لوازم را برای کمک به بریتانیا از اقیانوس اطلس عبور دهند.,BeetleLM/beetlelm_fas-ukr_late,step-8000,fas,5.885220050811768,359.68190758466216
552,در همین حال، نیروی دریایی آلمان عمدتاً با استفاده از یو-بوت سعی داشت که این عبور و مرور را متوقف کند.,BeetleLM/beetlelm_fas-ukr_late,step-8000,fas,4.998405933380127,148.17676710205686
553,اگر آلمان متفقین را شکست می‌داد، شاید می‌توانست بر بریتانیا پیروز شود چون بقیه اروپا را در دست داشت.,BeetleLM/beetlelm_fas-ukr_late,step-8000,fas,7.074065208435059,1180.939052805407
554,"به نظر می‌رسد که بزها ابتدا حدود 10,000 سال پیش در کوه‌های زاگرس ایران اهلی شده باشند.",BeetleLM/beetlelm_fas-ukr_late,step-8000,fas,6.549304008483887,698.757675122338
555,فرهنگهای کهن و قبایل شروع به نگهداری از آنها برای دسترسی آسان به شیر، پشم، گوشت، و پوست کردند.,BeetleLM/beetlelm_fas-ukr_late,step-8000,fas,5.501216888427734,244.9898762905048
556,بزهای اهلی بطور کل بصورت گله‌ای روی تپه‌ها یا سایر مناطق چرا نگهداری می‌شدند و اغلب توسط بزچران‌هایی که اغلب کودک و نوجوان بودند مشابه چوپانان معمول تیمار می‌شدند. این روش‌های گله‌داری هنوز امروزه بکار می‌روند.,BeetleLM/beetlelm_fas-ukr_late,step-8000,fas,8.119590759277344,3359.6455599314377
557,خط واگن در قرن 16ام در انگلستان ساخته شد.,BeetleLM/beetlelm_fas-ukr_late,step-8000,fas,5.420217037200928,225.92815199494862
558,گرچه مسیر‌های واگن‌ فقط از تخته های چوبی موازی تشکیل شده بودند، اما به اسبها اجازه می دادند تا برای رسیدن به سرعت بالاتر آنها را بکشند و نسبت به کشیدن بار روی جاده های ناهموارتر آن زمان بارهای بزرگتری را بکشند.,BeetleLM/beetlelm_fas-ukr_late,step-8000,fas,5.689476013183594,295.73861689771496
559,ریل‌بند تقریباً از همان اوایل برای نگه داشتن ریل‌ها در محل خود معرفی شد. با این وجود به تدریج، متوجه شدند که اگر روی ریل‌بند یک قید آهنی وجود داشته باشد، ریل‌ها بهره‌وری بیشتری خواهند داشت.,BeetleLM/beetlelm_fas-ukr_late,step-8000,fas,5.940785884857178,380.23363200347734
560,گرچه این کار رایج شد، اما آهن باعث سایش بیشتر روی چرخ‌های چوبی واگن‌ها شد.,BeetleLM/beetlelm_fas-ukr_late,step-8000,fas,7.563703536987305,1926.9689149907756
561,در نهایت چرخ‌های چوبی جایگزین چرخ‌های آهنین شد. در 1767، اولین ریل‌های تمام آهنی معرفی شد.,BeetleLM/beetlelm_fas-ukr_late,step-8000,fas,7.855626583099365,2580.2113240281
562,اولین نوع حمل و نقل راه رفتن بود؛ انسان‌ها ایستاده راه رفتن را دو میلیون سال پیش با پیدایش انسان ایستاده (Homo Erectus) شروع کردند.,BeetleLM/beetlelm_fas-ukr_late,step-8000,fas,5.919073581695557,372.0668646096585
563,پیشینیان آنها، جنوبی‌کپی بودند که بر حسب عادت به‌طور عادی قدم نمی‌زدند.,BeetleLM/beetlelm_fas-ukr_late,step-8000,fas,7.7479963302612305,2316.9254073061866
564,ویژه‌گری دوقطبی در فسیل‌های جنوبی‌کپی از 4.2-3.9 میلیون سال پیش وجود داشته، گرچه ممکن است ساحل‌مردم چادی‌ها از هفت میلیون سال پیش روی دو پای خود راه رفته باشند.,BeetleLM/beetlelm_fas-ukr_late,step-8000,fas,6.310556411743164,550.351085441936
565,ما می توانیم زندگی دوستانه تری را با محیط زیست آغاز کنیم، می توانیم به جنبش محیط زیست بپیوندیم و حتی می توانیم برای اینکه تا حدودی آلام آینده را کاهش دهیم، فعال محیط زیست شویم.,BeetleLM/beetlelm_fas-ukr_late,step-8000,fas,5.200484752655029,181.36013537726637
566,این دقیقاً مانند بسیاری از موارد درمان حمایتی است. با این وجود، اگر تنها به دنبال یک راه‌حل موقت نباشیم، باید ریشه مشکلات را بیابیم و باید آن‌ها را غیرفعال کنیم.,BeetleLM/beetlelm_fas-ukr_late,step-8000,fas,5.579192638397217,264.85768351765995
567,پرواضح است که دنیا به‌خاطر پیشرفت‌های علمی و فناوری بشر تغییر کرده و مشکلات به دلیل جمعیت بسیار زیاد و شیوه زندگی عجیب و غریب بشر، بیشتر شده است.,BeetleLM/beetlelm_fas-ukr_late,step-8000,fas,6.094918251037598,443.5977800365855
568,پس از تصویب آن توسط کنگره در چهارم ژوئیه، یک پیش‌نویس خطی با امضای جان هنکاک، رِئیس کنگره، و چارلز تامسون، منشی، به چاپخانه جان دانلپ که چند بلوک با آنجا فاصله داشت فرستاده شد.,BeetleLM/beetlelm_fas-ukr_late,step-8000,fas,6.330167770385742,561.2507472090548
569,در طول شب بین 150 تا 200 نسخه ایجاد شد، که اکنون به عنوان «اعلامیه Dunlap» شناخته می‌شود.,BeetleLM/beetlelm_fas-ukr_late,step-8000,fas,6.3434157371521,568.7356488480096
570,جان نیکسون کسی بود که سند را برای اولین بار روز 8 ژوئیه در حضور عموم و در حیاط «سالن استقلال» قرائت کرد.,BeetleLM/beetlelm_fas-ukr_late,step-8000,fas,6.1839823722839355,484.9192451768082
571,در ششم ژوئیه یک رونوشت برای جرج واشنگتن ارسال شد که در نهم ژوئیه دستور داد برای سربازانش در نیویورک بخوانند. در دهم آگوست یک رونوشت به لندن رسید.,BeetleLM/beetlelm_fas-ukr_late,step-8000,fas,6.044455051422119,421.76785305368765
572,پهنه دانلاپ 25 هنوز وجود دارد و قدیمی‌ترین نسخه‌های بازمانده از این سند است. نسخه دست‌نویس اصلی باقی نمانده است.,BeetleLM/beetlelm_fas-ukr_late,step-8000,fas,6.544713497161865,695.5573712388884
573,بسیاری از دیرینه‌شناسان امروزه معتقدند که یک گروه از دایناسورها نجات یافتند و امروز زنده هستند. ما به آنها پرنده می‌گوییم.,BeetleLM/beetlelm_fas-ukr_late,step-8000,fas,5.845882892608643,345.8077181206301
574,از آنجایی که پر دارند و می‌توانند پرواز کنند، بسیاری از مردم آن‌ها را به‌عنوان دایناسور نمی‌شناسند.,BeetleLM/beetlelm_fas-ukr_late,step-8000,fas,6.6427998542785645,767.2401491707107
575,اما در مورد پرنده‌ها موارد زیادی وجود دارد که همچنان به دایناسور شباهت دارد.,BeetleLM/beetlelm_fas-ukr_late,step-8000,fas,5.725149154663086,306.47897460259713
576,آنها پاها و پنجه‌های فلس‌دار دارند، تخم می‌گذارند و مانند تیرکس روی دو پای عقب خود راه می‌روند.,BeetleLM/beetlelm_fas-ukr_late,step-8000,fas,8.04984188079834,3133.2994973022046
577,تقریباً تمام رایانه‌هایی که امروزه مورد استفاده قرار می‌گیرد، مبتنی بر به‌کار بری اطلاعات هستند که به صورت اعداد دو دویی کدگذاری می‌شوند.,BeetleLM/beetlelm_fas-ukr_late,step-8000,fas,6.719228267669678,828.178132958194
578,یک عدد دودویی فقط می‌تواند یکی از دو مقدار، یعنی 0 یا 1 را داشته باشد، و در اصطلاح تخصصی رایانه‌ای از این شماره‌ها به عنوان رقم‌های دودویی - یا بیت - یاد می‌شود.,BeetleLM/beetlelm_fas-ukr_late,step-8000,fas,7.275561809539795,1444.5625332291086
579,مسمومیت داخلی فوراً آشکار نمی‌شود. علائمی مانند استفراغ آنقدر عمومی است که نمی‌توان فوراً تشخیص داد.,BeetleLM/beetlelm_fas-ukr_late,step-8000,fas,6.836813449859619,931.516077659193
580,بهترین دلیل مسمومیت داخلی ممکن است وجود ظرف خالی دوا یا مواد شیمیایی خانگی سمی باشد.,BeetleLM/beetlelm_fas-ukr_late,step-8000,fas,6.156533718109131,471.78988053428134
581,برچسب دستورالعمل‌های خاص کمک‌های اولیه مربوط به آن سم خاص را بررسی کنید.,BeetleLM/beetlelm_fas-ukr_late,step-8000,fas,6.9783759117126465,1073.174021535005
582,حشره‌شناسان از اصطلاح ساس به مفهومی رسمی برای اشاره به این گروه از حشرات استفاده می‌کنند.,BeetleLM/beetlelm_fas-ukr_late,step-8000,fas,6.926616668701172,1019.040389352958
583,این اصطلاح از آشنایی باستانی با ساس‌های تخت‌خوابی، که حشرات بسیار سازگار با انگل سازی در انسان هستند، گرفته می شود.,BeetleLM/beetlelm_fas-ukr_late,step-8000,fas,6.246445655822754,516.1748970498412
584,هر دو حشره قاتل و ساس تختخواب آشیان نشین هستند، یعنی خود را با زندگی در آشیانه یا سکونت در میزبان سازگار می‌کنند.,BeetleLM/beetlelm_fas-ukr_late,step-8000,fas,6.365530967712402,581.4534793917147
585,در سراسر ایالات متحده آمریکا، تقریباً 400،000 مورد شناخته شده از بیماری گرفتگی بافت‌های گوناگون (MS) وجود دارد، که یک بیماری عصبی مهم در بزرگسالان جوان‌تر و مسن به حساب می‌آید.,BeetleLM/beetlelm_fas-ukr_late,step-8000,fas,6.200344085693359,492.9186181615615
586,MS نوعی بیماری است که بر سیستم عصبی مرکزی تأثیر می گذارد، که از مغز، نخاع و عصب بینایی تشکیل شده است.,BeetleLM/beetlelm_fas-ukr_late,step-8000,fas,5.026944160461426,152.46638727798498
587,تحقیقات نشان داده است که احتمال ام اس در زنان دوبرابر بیشتر از مردان است.,BeetleLM/beetlelm_fas-ukr_late,step-8000,fas,4.118875026702881,61.49002869969573
588,یک زوج ممکن است تصمیم بگیرند که بزرگ کردن نوزاد به نفع آنها یا فرزندشان نیست.,BeetleLM/beetlelm_fas-ukr_late,step-8000,fas,5.29869270324707,200.0750814293332
