sentence_id,sentence,repo,revision,iso_code,nll,ppl
456,"Същото се отнася и за военните, защото вместо подразделението в армията да се базира на клас, сега то се основава на калибър.",BeetleLM/beetlelm_fas-bul_heritage,step-10387,bul,6.308988571166992,549.4888987413002
457,Френската революция е също вдъхновение за много други репресирани хора от работническата класа в други държави да започнат свои собствени революции.,BeetleLM/beetlelm_fas-bul_heritage,step-10387,bul,7.549768447875977,1900.302661274461
458,"Мохамед бил силно заинтересован от неща извън този светски живот. За да размишлява, той често посещавал пещера, която станала известна като „Хира“ на планината Нур (светлина).",BeetleLM/beetlelm_fas-bul_heritage,step-10387,bul,8.158527374267578,3493.038875422717
459,"самата пещера, оцеляла във времето, предава много ярка картина на духовните склонности на Мохамед.",BeetleLM/beetlelm_fas-bul_heritage,step-10387,bul,8.296871185302734,4011.3021180231367
460,"Разположена на върха на една от планините северно от Мека, тази пещера е изцяло изолирана от останалия свят.",BeetleLM/beetlelm_fas-bul_heritage,step-10387,bul,6.578125,719.1895837886203
461,"Всъщност, изобщо не е лесно да се намери, дори и да се знае, че съществува. Влезе ли се веднъж в пещерата, изолацията е пълна.",BeetleLM/beetlelm_fas-bul_heritage,step-10387,bul,5.750349998474121,314.3006457836328
462,"Нищо друго не се вижда, освен ясното, красиво небе над нас и многото околни планини. Отвътре на пещерата може да се види много малко от този свят.",BeetleLM/beetlelm_fas-bul_heritage,step-10387,bul,6.70121431350708,813.3929397462612
463,"Голямата пирамида в Гиза е единственото от седемте чудеса, което към момента съществува.",BeetleLM/beetlelm_fas-bul_heritage,step-10387,bul,8.043087005615234,3112.2057732291755
464,"Издигната от египтяните през трети век пр.н.е., Великата пирамида е една от многото големи пирамидални структури, конструирани, за да почетат починалия фараон.",BeetleLM/beetlelm_fas-bul_heritage,step-10387,bul,7.524511814117432,1852.9084415148993
465,"В египетската Долина на мъртвите, на платото Гиза, или „Гиза Некрополис“, има няколко пирамиди (от които Великата пирамида е най - голяма), няколко малки гробници, няколко храма и големия Сфинкс.",BeetleLM/beetlelm_fas-bul_heritage,step-10387,bul,7.840388774871826,2541.1925936311663
466,"Голямата пирамида е в чест на фараона Куфу, а много от по - малките пирамиди, гробници и храмове - в чест на жените и членовете на семейството му.",BeetleLM/beetlelm_fas-bul_heritage,step-10387,bul,6.556252956390381,703.6302157143616
467,"Знакът „лък нагоре“ прилича на V, а знакът „лък надолу“ на телбод или квадрат без дъно.",BeetleLM/beetlelm_fas-bul_heritage,step-10387,bul,8.65367603302002,5731.176050245707
468,"Нагоре означава, че трябва да започнете от върха и да натиснете лъка, а надолу означава, че трябва да започнете от жабата (там, където ръката ви държи лъка), след което да го издърпате.",BeetleLM/beetlelm_fas-bul_heritage,step-10387,bul,6.3180928230285645,554.514426191707
469,"Насоченият нагоре лък обикновено издава по-мек звук, a насоченият надолу лък е по-силен и по-уверен.",BeetleLM/beetlelm_fas-bul_heritage,step-10387,bul,7.247714519500732,1404.8903267954304
470,"Чувствайте се свободни да поставяте свои собствени знаци, но помнете, че отпечатаните щрихи за лък са там поради музикална причина, така че обикновено трябва да бъдат уважавани.",BeetleLM/beetlelm_fas-bul_heritage,step-10387,bul,6.912657737731934,1004.914495462484
471,"На 6 октомври 1789 г. ужасените крал Луи XVI, кралица Мария Антоанета, двете им малки деца (11 - годишната Мари Терез и 4 - годишния Луи - Шарл), както и сестрата на краля, мадам Елизабет, са принудени да се върнат в Париж от Версай от тълпа жени на пазара.",BeetleLM/beetlelm_fas-bul_heritage,step-10387,bul,7.863287448883057,2600.0538852294367
472,"Те се върнали в Париж с каляска, заобиколени от тълпа хора, които викали и крещели заплахи срещу краля и кралицата.",BeetleLM/beetlelm_fas-bul_heritage,step-10387,bul,7.4161763191223145,1662.6638417825995
473,Тълпата принуди краля и кралицата широко да отворят прозорците на каретата си.,BeetleLM/beetlelm_fas-bul_heritage,step-10387,bul,7.310924053192139,1496.559450989294
474,"В един момент един от тълпата е размахал пред ужасената кралица главата на кралски стражар, убит във Версай.",BeetleLM/beetlelm_fas-bul_heritage,step-10387,bul,7.098771095275879,1210.4785972149584
475,Самите филипинци са платили военните разходи на американския империализъм за завладяването на Филипините.,BeetleLM/beetlelm_fas-bul_heritage,step-10387,bul,7.910656452178955,2726.179485537265
476,"Колониалният режим на САЩ ги е принудил да плащат данъци, за да покриват голяма част от разходите и лихвите по облигациите, емитирани от името на филипинското правителство през банковите къщи на Уолстрийт.",BeetleLM/beetlelm_fas-bul_heritage,step-10387,bul,6.895084857940674,987.4095107970553
477,"Свръхпечалбите, получени от продължителната експлоатация на филипинския народ, представляват, разбира се, основни придобивки на американския империализъм.",BeetleLM/beetlelm_fas-bul_heritage,step-10387,bul,7.5336737632751465,1869.9627002795835
478,"За да се вникне в смисъла на тамплиерството, трябва да е ясен контекстът, предизвикал създаването на ордена.",BeetleLM/beetlelm_fas-bul_heritage,step-10387,bul,7.116571426391602,1232.2184311527203
479,"Периодът, през който са се случили събитията, обикновено се нарича Късно средновековие - периодът от европейската история през 11-и, 12-и и 13-и век (1000 – 1300 г. сл. Хр.).",BeetleLM/beetlelm_fas-bul_heritage,step-10387,bul,7.184754848480225,1319.1658031314355
480,"Същинското Средновековие е предшествано от ранното и последвано от късното, което по конвенция завършва около 1500 г.",BeetleLM/beetlelm_fas-bul_heritage,step-10387,bul,7.393370628356934,1625.1747514844396
481,"Технологичният детерминизъм е термин, който обхваща широк спектър от идеи на практика - от технологичния тласък или технологичния императив до стриктното усещане, че човешката съдба се ръководи от логика, свързана с научните закони и тяхното проявление в технологиите.",BeetleLM/beetlelm_fas-bul_heritage,step-10387,bul,7.822050094604492,2495.0151856613015
482,"Две общи идеи са споделени между повечето интерпретации на технологичния детерминизъм: самото развитие на технологиите върви по път, далеч надхвърлящ културното или политическото влияние или самата технологията влияе върху присъщи, а не социално обусловени общества.",BeetleLM/beetlelm_fas-bul_heritage,step-10387,bul,7.836667537689209,2531.7537861762567
483,"Така например, човек може да каже, че моторното превозно средство задължително води до развитието на пътища.",BeetleLM/beetlelm_fas-bul_heritage,step-10387,bul,7.02841329574585,1128.239007557507
484,"Една национална пътна мрежа обаче няма да е икономически изгодна само за шепа автомобили, затова се разработват нови методи на производство, за намаляване стойността за притежаването на автомобил.",BeetleLM/beetlelm_fas-bul_heritage,step-10387,bul,7.271796226501465,1439.1331418837085
485,"Масовата собственост на автомобили също доведе до по-голямата честота на произшествия по пътищата, което налага изобретяването на нови техники в здравеопазването за възстановяване на повредени тела.",BeetleLM/beetlelm_fas-bul_heritage,step-10387,bul,7.82746696472168,2508.5670300157512
486,"Романтизмът съдържа голям елемент на културен детерминизъм, чието начало поставят писатели като Гьоте, Фихте и Шлегел.",BeetleLM/beetlelm_fas-bul_heritage,step-10387,bul,8.319416999816895,4102.767396751936
487,"В контекста на романтизма географията оформя индивидите и с течение на времето възникват свързани с тази география обичаи и култура, и те, бидейки в хармония с мястото на обществото, били по - добри от произволно наложените закони.",BeetleLM/beetlelm_fas-bul_heritage,step-10387,bul,6.785480499267578,884.9051810996003
488,"По начина, по който Париж е известен като модна столица на съвременния свят, Константинопол е считан за модна столица на феодална Европа.",BeetleLM/beetlelm_fas-bul_heritage,step-10387,bul,7.3699421882629395,1587.5420018306763
489,Славата му на епицентър на лукса датира от около 400 г. пр.н.е. и продължава до около 1100 г. пр.н.е.,BeetleLM/beetlelm_fas-bul_heritage,step-10387,bul,7.151106834411621,1275.5169602191108
490,"Статутът й запада през дванайсти век главно поради факта, че кръстоносците се завръщат с дарове като подправки и коприна, които били по-ценени от предлаганите от византийските пазари.",BeetleLM/beetlelm_fas-bul_heritage,step-10387,bul,7.316099166870117,1504.3243911681645
491,По това време титлата „Модна столица“ се прехвърля от Константинопол на Париж.,BeetleLM/beetlelm_fas-bul_heritage,step-10387,bul,7.737998008728027,2293.875464503286
492,Готическият стил е достигнал връхната си точка в периода между 10–11 век и 14-ти век.,BeetleLM/beetlelm_fas-bul_heritage,step-10387,bul,8.118757247924805,3356.846423934599
493,В началото облеклото се е влияело много силно от източната византийска култура.,BeetleLM/beetlelm_fas-bul_heritage,step-10387,bul,7.036474227905273,1137.3704200598938
494,"Въпреки това, поради бавната комуникация, западните стилове могат да изостават с 25 до 30 години.",BeetleLM/beetlelm_fas-bul_heritage,step-10387,bul,7.708921432495117,2228.1377647250683
495,"Към края на Средновековието Западна Европа започнала да развива собствен стил. В резултат на кръстоносните походи хората започнали да използват копчета за закопчаване на дрехите си, което е едно от най-големите развития на това време.",BeetleLM/beetlelm_fas-bul_heritage,step-10387,bul,7.12839412689209,1246.8730384350765
496,"Земеделието като средство за препитание е такова земеделие, което се извършва за производството на достатъчно храна единствено за нуждите на земеделския стопанин и неговото семейство.",BeetleLM/beetlelm_fas-bul_heritage,step-10387,bul,7.489577293395996,1789.2955849044406
497,"Пазарното селско стопанство е проста, често органична система, като често се използват запазени семена от същия екологичен район, комбинирани с ротация на културите и други относително прости техники за максимален добив.",BeetleLM/beetlelm_fas-bul_heritage,step-10387,bul,7.305357933044434,1488.2525612967268
498,В исторически план повечето фермери са се занимавали със земеделие за препитание и това все още важи за много развиващи се страни.,BeetleLM/beetlelm_fas-bul_heritage,step-10387,bul,7.115334510803223,1230.6952232009737
499,"Субкултурите обединяват хора-единомишленици, които се чувстват пренебрегнати от обществените стандарти. Те им позволяват да развият чувство за идентичност.",BeetleLM/beetlelm_fas-bul_heritage,step-10387,bul,7.757266044616699,2338.5024962349307
500,"Подкултурите могат да се различават по възраст, етническа принадлежност, клас, местоположение и/или пол на членовете.",BeetleLM/beetlelm_fas-bul_heritage,step-10387,bul,7.373696327209473,1593.5130561600288
501,"Признаците, които определят дадена субкултура като самостоятелна, могат да бъдат от езикови, естетическо, религиозно, политическо, сексуално, географско естество или комбинация от фактори.",BeetleLM/beetlelm_fas-bul_heritage,step-10387,bul,7.783915996551514,2401.6613272536474
502,"Членовете на дадена субкултура често сигнализират за членството си чрез характерно и символично използване на стил, което включва мода, маниери и жаргон.",BeetleLM/beetlelm_fas-bul_heritage,step-10387,bul,7.587440013885498,1973.2555355600425
503,"Един от най-често използваните средства за илюстриране на значението на социализацията е примерът с няколко нещастни случая с деца, които, поради пренебрегване, лошо отношение или умишлено насилие, не са били социализирани от възрастните в периода на израстване на децата.",BeetleLM/beetlelm_fas-bul_heritage,step-10387,bul,7.015596389770508,1113.8707492802441
504,Тези деца се наричат „неопитомени“ или диви. Някои неопитомени деца са били държани затворени от хора (обичайно собствените им родители); понякога изоставянето на такива деца се дължало на отхвърляне на тежко интелектуално или физическо увреждане на детето от родителите.,BeetleLM/beetlelm_fas-bul_heritage,step-10387,bul,8.686053276062012,5919.772369625474
505,Дивите деца преди да бъдат изоставени или да избягат може да са били тежко малтретирани или травмирани.,BeetleLM/beetlelm_fas-bul_heritage,step-10387,bul,7.29978084564209,1479.975548950195
506,"Други се предполага да са отгледани от животни; за някои казват, че живели сами в дивата природа.",BeetleLM/beetlelm_fas-bul_heritage,step-10387,bul,7.129332542419434,1248.0436726397202
507,"Когато е напълно отгледано от животни, дивото дете демонстрира поведение (в рамките на физическите ограничения) почти изцяло наподобяващо това на конкретното обгрижващо животно, както и неговите страх или безразличие към хората.",BeetleLM/beetlelm_fas-bul_heritage,step-10387,bul,8.123865127563477,3374.0366568789455
508,"Докато ученето, базирано на проекти, трябва да направи ученето по-лесно и по-интересно, скаффолдинга отива една стъпка по-далеч.",BeetleLM/beetlelm_fas-bul_heritage,step-10387,bul,6.426202774047852,617.8234728693562
509,"Изграждането на скеле не е метод за обучение, а по-скоро помощ, която предоставя подкрепа на лица, преминаващи през ново обучение, като например нова компютърна програма или започване на нов проект.",BeetleLM/beetlelm_fas-bul_heritage,step-10387,bul,6.730954647064209,837.9468277228208
510,"Скелетата могат да бъдат виртуални и действителни, иначе казано, учителят е вид скеле, както и малкият човек с кламерите в Microsoft Office.",BeetleLM/beetlelm_fas-bul_heritage,step-10387,bul,7.030037879943848,1130.0734164931757
511,"В софтуера има вградени виртуални скелета, които имат за цел да задават въпроси, да подсещат и да обясняват процедури, които може да са били прекалено трудни за студента да се справи сам.",BeetleLM/beetlelm_fas-bul_heritage,step-10387,bul,6.771413803100586,872.5446286647898
512,"Децата се настаняват в приемни семейства по много и различни причини, които варират от пренебрегване до малтретиране и дори изнудване.",BeetleLM/beetlelm_fas-bul_heritage,step-10387,bul,7.343536376953125,1546.1702978864985
513,"Никое дете не трябва да расте в среда, която не е насърчаваща, обгрижваща и образователна, но това се случва.",BeetleLM/beetlelm_fas-bul_heritage,step-10387,bul,6.195061683654785,490.3216888990228
514,"Смятаме, че системата за приемни грижи е безопасна зона за тези деца.",BeetleLM/beetlelm_fas-bul_heritage,step-10387,bul,6.754095077514648,857.5633702833844
515,"Предполага се, че нашата система за приемна грижа трябва да осигури безопасни домове, любящи хора, които да полагат грижи, стабилно образование, както и надеждни здравни грижи.",BeetleLM/beetlelm_fas-bul_heritage,step-10387,bul,6.806351184844971,903.5678326394926
516,"Приемната грижа се предполага да предоставя всичко необходимо, което е липсвало в дома, от който са били взети.",BeetleLM/beetlelm_fas-bul_heritage,step-10387,bul,6.162335395812988,474.5350088399673
517,"Интернет съчетава елементи и от масовата, и от индивидуалната комуникация.",BeetleLM/beetlelm_fas-bul_heritage,step-10387,bul,7.417686939239502,1665.1773932628444
518,Специалните характеристики на интернет водят до допълнителни измерения по отношение на използването на подхода за удовлетворение.,BeetleLM/beetlelm_fas-bul_heritage,step-10387,bul,7.452675819396973,1724.471351154095
519,"Например, „научаване“ и „социализиране“ са посочени като важни мотивации за интернет употреба (James et al., 1995).",BeetleLM/beetlelm_fas-bul_heritage,step-10387,bul,7.884343147277832,2655.380259341265
520,"„Личното участие“ и „продължителните взаимоотношения“ също бяха определени като нови аспекти за мотивация от Имей и Маккорд (1998 г.), когато те изследваха реакциите на публиката към уебсайтове.",BeetleLM/beetlelm_fas-bul_heritage,step-10387,bul,8.205089569091797,3659.5284126531583
521,"Използването на видеозапис е довело до важни открития в тълкуването на микро-изрази, лицеви движения, които продължават няколко милисекунди.",BeetleLM/beetlelm_fas-bul_heritage,step-10387,bul,7.28615140914917,1459.9411550782067
522,"Твърди се по-конкретно, че човек може да открие дали дадено лице лъже, като интерпретира правилно микро-израженията.",BeetleLM/beetlelm_fas-bul_heritage,step-10387,bul,6.868203639984131,961.2203162549931
523,"В своя труд ""Речта на президента"" Оливър Сакс посочва как независимо от това, че хората, които не могат да разберат речта поради увреждане на мозъка, са в състояние да възприемат искреното отношение.",BeetleLM/beetlelm_fas-bul_heritage,step-10387,bul,7.192669868469238,1329.6484573147582
524,"Той дори предполага, че подобни способности за интерпретиране на човешкото поведение могат да бъдат споделени от животни, като например домашните кучета.",BeetleLM/beetlelm_fas-bul_heritage,step-10387,bul,7.298919200897217,1478.7008850284988
525,"Проучванията през двадесети век показаха, че има 2 групи генетични вариации: скрити и изразени.",BeetleLM/beetlelm_fas-bul_heritage,step-10387,bul,7.795455455780029,2429.535718611393
526,"Мутацията добавя нова генетична вариация, а селекцията я премахва от групата изразени вариации.",BeetleLM/beetlelm_fas-bul_heritage,step-10387,bul,7.532302379608154,1867.4000215840233
