sentence_id,sentence,repo,revision,iso_code,nll,ppl
499,خرده‌فرهنگ‌ها افراد هم‌عقیده را که احساس می‌کنند طبق معیارهای جامعه به آنها بی‌توجهی می‌شود کنار یکدیگر جمع می‌کنند و به آنها ایجاد توسعه حس هویت می‌دهند.,BeetleLM/beetlelm_zho-fas_heritage,step-20000,fas,7.861118316650391,2594.4201369218013
500,خرده فرهنگ‌ها بنا به سن، قومیت، طبقه، محل زندگی و/یا جنسیت اعضا می‌توانند متمایز باشند.,BeetleLM/beetlelm_zho-fas_heritage,step-20000,fas,6.7807159423828125,880.699028210967
501,خصوصیاتی که یک خرده فرهنگ را متمایز می‌کند ممکن است خصوصیات زبانی، زیبایی شناختی، مذهبی، سیاسی، جنسی، جغرافیایی یا ترکیبی از این خصوصیات باشد.,BeetleLM/beetlelm_zho-fas_heritage,step-20000,fas,5.234889984130859,187.70845429944865
502,اعضای یک خرده فرهنگ اغلب عضویت خود را از طریق استفاده متمایز و نمادین از سبک، که شامل مد، اطوار و گویش عامدانه است، نشان می‌دهند.,BeetleLM/beetlelm_zho-fas_heritage,step-20000,fas,6.173882484436035,480.0462648858487
503,یکی از معمول‌ترین روش‌هایی که برای شرح اهمیت جامعه‌پذیری استفاده می‌شود کمک گرفتن از موارد تأسف‌بار کودکانی است که در جریان رشد بخاطر غفلت، بداقبالی، یا تعرض عمدی از بزرگسالان جامعه‌پذیری را یاد نگرفتند.,BeetleLM/beetlelm_zho-fas_heritage,step-20000,fas,6.993916034698486,1089.9815349844775
504,این نوع از بچه‌ها «وحشی» نامیده می‌شوند. برخی از این کودکان وحشی توسط مردم (معمولا والدین خودشان) محبوس می‌شوند؛ در برخی از موارد این رهاسازی کودک بدلیل انکار والدین به نقص عقلانی و فیزیکی شدید کودک می‌باشد.,BeetleLM/beetlelm_zho-fas_heritage,step-20000,fas,6.55322790145874,701.5049118614278
505,کودکان وحشی ممکن است قبل از ترک شدن یا فرار کردن کودک آزاری شدید یا ضربه‌ای عاطفی را تجربه کرده باشند.,BeetleLM/beetlelm_zho-fas_heritage,step-20000,fas,5.307476997375488,201.84034172402502
506,ادعا می‌شود که بقیه توسط حیوانات بزرگ شده‌اند؛ گفته شده است برخی به تنهایی در حیات وحش زندگی کرده‌اند.,BeetleLM/beetlelm_zho-fas_heritage,step-20000,fas,6.62200403213501,751.4495181365289
507,اگر کاملا توسط حیواناتی غیر از انسان پرورش داده شود، کودک وحشی رفتارهایی (در محدوده فیزیکی) تقریباً مانند رفتار حیوانات از خود نشان می‌دهد، مانند ترس و بی تفاوتی نسبت به انسان.,BeetleLM/beetlelm_zho-fas_heritage,step-20000,fas,6.275454044342041,531.3675914423692
508,گرچه یادگیری مبتنی بر پروژه باید یادگیری را آسان‌تر و جالب‌تر کند، سکوب‌بندی یک گام از آن فراتر می‌رود.,BeetleLM/beetlelm_zho-fas_heritage,step-20000,fas,7.255248069763184,1415.5141058267786
509,داربست سازی روشی برای یادگیری نیست بلکه کمکی است که از افرادی که در حال دریافت یک تجربه یادگیری جدید مانند استفاده از یک برنامه جدید کامپیوتری یا شروع یک پروژه جدید هستند، پشتیبانی می کند.,BeetleLM/beetlelm_zho-fas_heritage,step-20000,fas,5.134018898010254,169.6977473781324
510,داربست‌ها ممکن است مجازی یا واقعی باشند،‌ به عبارت دیگر یک معلم نوعی از داربست است ولی گیره کاغذ کوچک در Microsoft Office نیز داربست است.,BeetleLM/beetlelm_zho-fas_heritage,step-20000,fas,6.168258190155029,477.3539217857498
511,داربست های مجازی در نرم افزار درونی شده اند و هدف آن پرسش، برانگیختن و توضیح روش هایی است که ممکن است انجام آن به تنهایی برای دانشجویان چالش محسوب می‌شود.,BeetleLM/beetlelm_zho-fas_heritage,step-20000,fas,5.417666912078857,225.3527409356937
512,کودکان به دلایل متعددی به خانه‌های پرستاری سپرده می‌شوند. دامنه این دلایل از غفلت تا تعرض، و حتی اخاذی گسترش دارد.,BeetleLM/beetlelm_zho-fas_heritage,step-20000,fas,6.510820388793945,672.377802599678
513,هیچ کودکی نباید مجبور شود در محیطی فاقد تغذیه، مراقبت و تربیت رشد کند، اما این اتفاق می‌افتد.,BeetleLM/beetlelm_zho-fas_heritage,step-20000,fas,6.4739179611206055,648.0176678107316
514,ما سیستم مراقبت از کودکان بی‌سرپرست را منطقه‌ای امن برای این کودکان می‌دانیم.,BeetleLM/beetlelm_zho-fas_heritage,step-20000,fas,8.27979850769043,3943.3997372049803
515,سیستم پرورش و مراقبت ما می‌کوشد خانه‌های امن، مراقب‌های با محبت، آموزش پایدار و مراقبت‌های بهداشتی قابل اطمینان را فراهم کند.,BeetleLM/beetlelm_zho-fas_heritage,step-20000,fas,7.04637336730957,1148.6853198895428
516,برای فرزند‌خواندگی لازم است تمام فقدان نیازهای فرزند‌خوانده در خانه قبلی که از آن آورده شده است فراهم شود.,BeetleLM/beetlelm_zho-fas_heritage,step-20000,fas,6.789840221405029,888.7715438166987
517,اینترنت عناصر ارتباط جمعی و بین فردی را با هم ترکیب می‌کند.,BeetleLM/beetlelm_zho-fas_heritage,step-20000,fas,6.768096923828125,869.655297901294
518,خصوصیات متمایز اینترنت منجر به ابعاد اضافی از لحاظ رویکرد کاربرد و رضایت‌مندی شده است.,BeetleLM/beetlelm_zho-fas_heritage,step-20000,fas,6.134179592132568,461.3604349821368
519,برای مثال، به «یادگیری» و «جامعه پذیری» به عنوان انگیزه مهمی برای استفاده از اینترنت اشاره می‌شود (جیمز و سایرین، 1995).,BeetleLM/beetlelm_zho-fas_heritage,step-20000,fas,6.318543910980225,554.7646173932596
520,«درگیری شخصی» و «روابط مداوم» همچنین توسط ایمی و مککورد (1998) به عنوان جنبه های انگیزشی جدید شناخته می‌شد زمانیکه آنها در مورد واکنش مخاطبان به وب سایت ها تحقیق می‌کردند.,BeetleLM/beetlelm_zho-fas_heritage,step-20000,fas,6.52395486831665,681.2673873154592
521,استفاده از ضبط ویدئویی منجر به اکتشافات مهمی در زمینه تفسیر میکرو بیان و حرکات صورت شد که تنها چند میلی ثانیه طول می‌کشند.,BeetleLM/beetlelm_zho-fas_heritage,step-20000,fas,5.905323505401611,366.9859285161348
522,به ویژه، ادعا می شود که با تفسیر صحیح عبارات کوچک می‌توان تشخیص داد که فرد دروغ می‌گوید.,BeetleLM/beetlelm_zho-fas_heritage,step-20000,fas,6.693986415863037,807.535014577851
523,الیور ساکس، در مقاله خود «سخنان رئیس جمهور»، نشان داد که چگونه افرادی که به دلیل آسیب مغزی قادر به درک گفتار نیستند، باز هم قادر هستند خلوص نیت را به طور دقیق ارزیابی کنند.,BeetleLM/beetlelm_zho-fas_heritage,step-20000,fas,5.247102737426758,190.01494698848833
524,او حتی اظهار می‌دارد که چنین توانایی‌هایی در تفسیر رفتار انسانی می‌تواند در حیواناتی مثل سگ‌های خانگی مشترک باشد.,BeetleLM/beetlelm_zho-fas_heritage,step-20000,fas,7.651371002197266,2103.527554277601
525,تحقیقات قرن بیستم نشان داد که دو منبع تغییرات ژنتیکی وجود دارد: پنهان و بیان شده.,BeetleLM/beetlelm_zho-fas_heritage,step-20000,fas,4.629462718963623,102.45900004164957
526,جهش تنوع ژنتیکی جدید می‌افزاید و انتخاب آن را از خزانه تنوع بیان‌شده خارج می‌کند.,BeetleLM/beetlelm_zho-fas_heritage,step-20000,fas,7.234768867492676,1386.8203218748254
527,تفکیک و ترکیب مجدد اختلاف بین دو استخر با هر نسل را به سمت جلو و عقب بر می‌زند.,BeetleLM/beetlelm_zho-fas_heritage,step-20000,fas,6.300570011138916,544.8824106666178
528,در خارج از ساوانا، برآورده کردن نيازهاي مبتنی بر اسيد آمینه از منابع گياهي موجود برای یک نخستی که دستگاه گوارشی مشابه انسان داشته، کار دشواری بوده است.,BeetleLM/beetlelm_zho-fas_heritage,step-20000,fas,5.891663074493408,362.0068283500849
529,از این گذشته، عدم انجام این امر عواقب جدی دارد: افسردگی رشد، سوء تغذیه و در نهایت مرگ.,BeetleLM/beetlelm_zho-fas_heritage,step-20000,fas,5.252992153167725,191.13732584198382
530,بیشترین منابع گیاهی قابل دسترسی پروتئین های موجود در برگ ها و حبوبات می باشد، اما هضم اینهت توسط پستاندارانی مانند ما سخت است، مگر اینکه پخته شوند.,BeetleLM/beetlelm_zho-fas_heritage,step-20000,fas,5.6274919509887695,277.9640950877185
531,در مقابل، غذاهای حیوانی (مورچه‌ها، موریانه‌ها‌، تخم‌ها) نه تنها به راحتی قابل هضم هستند بلکه پروتئین‌های با کیفیت بالا در اختیار قرار می‌دهند که حاوی تمام اسیدهای آمینه ضروری است.,BeetleLM/beetlelm_zho-fas_heritage,step-20000,fas,6.226686954498291,506.076050031132
532,همه چیز در نظر گرفته شده است، و اگر اجداد خودمان «مشکل پروتئین» خود را تقریباً به همان شیوه‌ای حل کرده‌اند که امروزه شامپانزه‌ها در ساوانا انجام می‌دهند، نباید تعجب کنیم.,BeetleLM/beetlelm_zho-fas_heritage,step-20000,fas,6.174501895904541,480.34370315656054
533,اختلال در خواب فرآیند بیداری آگاهانه در طول خواب معمولی و بعد از مدتی مجددا به خواب رفتن (10-60 دقیقه) است.,BeetleLM/beetlelm_zho-fas_heritage,step-20000,fas,5.252398490905762,191.0238884998451
534,این کار را می توان به راحتی با استفاده از یک ساعت زنگ دار نسبتاً آرام انجام داد تا بدون اینکه شما را کاملا از خواب بیدار کند، شما را هوشیار کند.,BeetleLM/beetlelm_zho-fas_heritage,step-20000,fas,4.4502410888671875,85.64759019381427
535,اگر متوجه شدید که ساعت بیدارباش را در خواب خاموش می‌کنید، می‌تواند آن را در طرف دیگر اتاق قرار دهید تا برای خاموش کردنش مجبور باشید از رختخواب خارج شوید.,BeetleLM/beetlelm_zho-fas_heritage,step-20000,fas,5.912924766540527,369.78611337859826
536,سایر گزینه‌های مبتنی بر بیوریتم شامل نوشیدن مقدار زیادی مایعات (بخصوص آب یا چای، یک ادرارآور مشخص) پیش از خواب می‌شود که فرد را مجبور می‌کند برای ادرار کردن از خواب برخیزد.,BeetleLM/beetlelm_zho-fas_heritage,step-20000,fas,6.726380825042725,834.1229595817306
537,میزان آرامش درونی فرد به شکل متضادی با میزان تنش موجود در بدن و روح فرد ارتباط دارد.,BeetleLM/beetlelm_zho-fas_heritage,step-20000,fas,6.047553062438965,423.0765205955504
538,هرچه تنش کمتر باشد، هدیه نیروی زندگی مثبت تر است. هر شخص توانایی این را دارد که صلح و رضایت مطلق را پیدا کند.,BeetleLM/beetlelm_zho-fas_heritage,step-20000,fas,5.532778263092041,252.84540716458875
539,هر کسی می‌تواند به روشنگری دست یابد. تنها چیزی که سر راه این هدف قرار می‌گیرد تنش و منفی بودن ماست.,BeetleLM/beetlelm_zho-fas_heritage,step-20000,fas,6.10052490234375,446.09186330367777
540,آیین بودایی تبتی بر پایه آموزه‌های بودا است، اما با راه عشق ماهایانا و تکنیکهای زیادی از یوگای هندی بسط داده شد.,BeetleLM/beetlelm_zho-fas_heritage,step-20000,fas,6.1103596687316895,450.50071705389587
541,در اصل بودیسم تبتی خیلی ساده است، و شامل کندالینی یوگا،‌ مراقبه و مسیر عشق فراگیر می‌شود.,BeetleLM/beetlelm_zho-fas_heritage,step-20000,fas,7.131585597991943,1250.8587544681566
542,با استفاده از یوگا کوندالینی، انرژی کوندالینی (انرژی روشنگری) از طریق حرکات یوگا، تمرین های تنفسی، مانترا و تجسم بیدار می شود.,BeetleLM/beetlelm_zho-fas_heritage,step-20000,fas,5.941863059997559,380.6434308923717
543,مرکز مراقبه تبت، یوگای خدایان است. از طریق تجسم خدایان مختلف، کانال های انرژی پاک می شوند، چاکراها فعال می شوند و آگاهی روشنگری ایجاد می شود.,BeetleLM/beetlelm_zho-fas_heritage,step-20000,fas,5.975543975830078,393.68219645406816
544,آلمان دشمن مشترکی در جنگ جهانی دوم بود که منجر به اتحاد بین شوروی و ایالات متحده شد. با پایان جنگ، اختلاف در سیستم، پروسه و فرهنگ منجر به جدایی این کشورها شد.,BeetleLM/beetlelm_zho-fas_heritage,step-20000,fas,4.690865993499756,108.94748678227681
545,با توجه به دو سال آخر جنگ، حالا متحدان سابق دشمن شده بودند و جنگ سرد آغاز شد.,BeetleLM/beetlelm_zho-fas_heritage,step-20000,fas,5.2186102867126465,184.67735707707155
546,این برای آن بود که برای 40 سال آینده دوام داشته باشد و با ارتش‌های نیابتی، در جبهه‌های نبردی از آفریقا تا آسیا، در افغانستان، کوبا و بسیاری از مناطق دیگر به صورت حقیقی بجنگد.,BeetleLM/beetlelm_zho-fas_heritage,step-20000,fas,5.50398588180542,245.66919171145994
547,تا هفدهم سپتامبر سال 1939، دفاع کشور لهستان درهم شکسته شد و تنها امیدی که وجود داشت عقب نشینی و سازماندهی مجدد در طول منطقه سرپل رومانی بود.,BeetleLM/beetlelm_zho-fas_heritage,step-20000,fas,5.264871597290039,193.42147135177262
548,اما این نقشه‌ها تقریباً یک شبه از کار افتاد، وقتی که بیش از 800 هزار سرباز از ارتش سرخ اتحاد جماهیر شوروی وارد شدند و پس از هجوم به نواحی شرقی لهستان جبهه‌های بلاروسی و اوکراینی را ساختند، و بدین ترتیب عهدنامه صلح ریگا، پیمان عدم تجاوز بین شوروی و لهستان، و سایر عهدنامه‌های بین‌المللی، هم دوجانبه و هم چند جانبه، نقض کردند.,BeetleLM/beetlelm_zho-fas_heritage,step-20000,fas,5.642332553863525,282.12001171462333
549,استفاده از کشتی‌ها برای حمل و نقل کالا به‌مراتب کارآمدترین راه برای جابجایی تعداد زیادی از افراد و اجناس از میان اقیانوس است.,BeetleLM/beetlelm_zho-fas_heritage,step-20000,fas,5.295083045959473,199.35418083837624
550,به‌طور سنتی کار نیروهای دریایی از این قرار بود که اطمینان حاصل کنند کشورتان توانایی جابجایی افراد و کالاهای شما را داشته باشد، و درعین‌حال در توانایی دشمن‌تان برای جابجایی مردم و کالاهایش مداخله کنند.,BeetleLM/beetlelm_zho-fas_heritage,step-20000,fas,6.314563274383545,552.5606904809697
551,یکی از مثال‌هایی که ارزش بیان کردن دارد مبارزه در اقیانوس اطلس شمالی در جنگ جهانی دوم بود. آمریکایی‌ها سعی داشتند افراد و لوازم را برای کمک به بریتانیا از اقیانوس اطلس عبور دهند.,BeetleLM/beetlelm_zho-fas_heritage,step-20000,fas,5.809678077697754,333.5117435228394
552,در همین حال، نیروی دریایی آلمان عمدتاً با استفاده از یو-بوت سعی داشت که این عبور و مرور را متوقف کند.,BeetleLM/beetlelm_zho-fas_heritage,step-20000,fas,4.797048568725586,121.15231658739685
553,اگر آلمان متفقین را شکست می‌داد، شاید می‌توانست بر بریتانیا پیروز شود چون بقیه اروپا را در دست داشت.,BeetleLM/beetlelm_zho-fas_heritage,step-20000,fas,6.870316505432129,963.2533925010606
554,"به نظر می‌رسد که بزها ابتدا حدود 10,000 سال پیش در کوه‌های زاگرس ایران اهلی شده باشند.",BeetleLM/beetlelm_zho-fas_heritage,step-20000,fas,6.271175384521484,529.0989072040194
555,فرهنگهای کهن و قبایل شروع به نگهداری از آنها برای دسترسی آسان به شیر، پشم، گوشت، و پوست کردند.,BeetleLM/beetlelm_zho-fas_heritage,step-20000,fas,5.314331531524658,203.22861578942198
556,بزهای اهلی بطور کل بصورت گله‌ای روی تپه‌ها یا سایر مناطق چرا نگهداری می‌شدند و اغلب توسط بزچران‌هایی که اغلب کودک و نوجوان بودند مشابه چوپانان معمول تیمار می‌شدند. این روش‌های گله‌داری هنوز امروزه بکار می‌روند.,BeetleLM/beetlelm_zho-fas_heritage,step-20000,fas,8.10222339630127,3301.801132542362
557,خط واگن در قرن 16ام در انگلستان ساخته شد.,BeetleLM/beetlelm_zho-fas_heritage,step-20000,fas,5.5138373374938965,248.1013513538029
558,گرچه مسیر‌های واگن‌ فقط از تخته های چوبی موازی تشکیل شده بودند، اما به اسبها اجازه می دادند تا برای رسیدن به سرعت بالاتر آنها را بکشند و نسبت به کشیدن بار روی جاده های ناهموارتر آن زمان بارهای بزرگتری را بکشند.,BeetleLM/beetlelm_zho-fas_heritage,step-20000,fas,5.448966026306152,232.51762446527744
559,ریل‌بند تقریباً از همان اوایل برای نگه داشتن ریل‌ها در محل خود معرفی شد. با این وجود به تدریج، متوجه شدند که اگر روی ریل‌بند یک قید آهنی وجود داشته باشد، ریل‌ها بهره‌وری بیشتری خواهند داشت.,BeetleLM/beetlelm_zho-fas_heritage,step-20000,fas,6.0025811195373535,404.47143644774496
560,گرچه این کار رایج شد، اما آهن باعث سایش بیشتر روی چرخ‌های چوبی واگن‌ها شد.,BeetleLM/beetlelm_zho-fas_heritage,step-20000,fas,7.157834529876709,1284.1271808830656
561,در نهایت چرخ‌های چوبی جایگزین چرخ‌های آهنین شد. در 1767، اولین ریل‌های تمام آهنی معرفی شد.,BeetleLM/beetlelm_zho-fas_heritage,step-20000,fas,6.819887161254883,915.8816573132739
562,اولین نوع حمل و نقل راه رفتن بود؛ انسان‌ها ایستاده راه رفتن را دو میلیون سال پیش با پیدایش انسان ایستاده (Homo Erectus) شروع کردند.,BeetleLM/beetlelm_zho-fas_heritage,step-20000,fas,5.840709686279297,344.02340273965143
563,پیشینیان آنها، جنوبی‌کپی بودند که بر حسب عادت به‌طور عادی قدم نمی‌زدند.,BeetleLM/beetlelm_zho-fas_heritage,step-20000,fas,7.444708824157715,1710.7870797535159
564,ویژه‌گری دوقطبی در فسیل‌های جنوبی‌کپی از 4.2-3.9 میلیون سال پیش وجود داشته، گرچه ممکن است ساحل‌مردم چادی‌ها از هفت میلیون سال پیش روی دو پای خود راه رفته باشند.,BeetleLM/beetlelm_zho-fas_heritage,step-20000,fas,6.178767681121826,482.3971228345296
565,ما می توانیم زندگی دوستانه تری را با محیط زیست آغاز کنیم، می توانیم به جنبش محیط زیست بپیوندیم و حتی می توانیم برای اینکه تا حدودی آلام آینده را کاهش دهیم، فعال محیط زیست شویم.,BeetleLM/beetlelm_zho-fas_heritage,step-20000,fas,4.797731399536133,121.23507137247492
566,این دقیقاً مانند بسیاری از موارد درمان حمایتی است. با این وجود، اگر تنها به دنبال یک راه‌حل موقت نباشیم، باید ریشه مشکلات را بیابیم و باید آن‌ها را غیرفعال کنیم.,BeetleLM/beetlelm_zho-fas_heritage,step-20000,fas,5.550530433654785,257.37403955726285
567,پرواضح است که دنیا به‌خاطر پیشرفت‌های علمی و فناوری بشر تغییر کرده و مشکلات به دلیل جمعیت بسیار زیاد و شیوه زندگی عجیب و غریب بشر، بیشتر شده است.,BeetleLM/beetlelm_zho-fas_heritage,step-20000,fas,6.021748065948486,412.29869145902757
568,پس از تصویب آن توسط کنگره در چهارم ژوئیه، یک پیش‌نویس خطی با امضای جان هنکاک، رِئیس کنگره، و چارلز تامسون، منشی، به چاپخانه جان دانلپ که چند بلوک با آنجا فاصله داشت فرستاده شد.,BeetleLM/beetlelm_zho-fas_heritage,step-20000,fas,6.094391822814941,443.3643191012708
569,در طول شب بین 150 تا 200 نسخه ایجاد شد، که اکنون به عنوان «اعلامیه Dunlap» شناخته می‌شود.,BeetleLM/beetlelm_zho-fas_heritage,step-20000,fas,5.440837860107422,230.63534268213402
570,جان نیکسون کسی بود که سند را برای اولین بار روز 8 ژوئیه در حضور عموم و در حیاط «سالن استقلال» قرائت کرد.,BeetleLM/beetlelm_zho-fas_heritage,step-20000,fas,5.546821594238281,256.42124854118146
571,در ششم ژوئیه یک رونوشت برای جرج واشنگتن ارسال شد که در نهم ژوئیه دستور داد برای سربازانش در نیویورک بخوانند. در دهم آگوست یک رونوشت به لندن رسید.,BeetleLM/beetlelm_zho-fas_heritage,step-20000,fas,5.515172481536865,248.43282362749076
572,پهنه دانلاپ 25 هنوز وجود دارد و قدیمی‌ترین نسخه‌های بازمانده از این سند است. نسخه دست‌نویس اصلی باقی نمانده است.,BeetleLM/beetlelm_zho-fas_heritage,step-20000,fas,6.759280681610107,862.0219045141151
573,بسیاری از دیرینه‌شناسان امروزه معتقدند که یک گروه از دایناسورها نجات یافتند و امروز زنده هستند. ما به آنها پرنده می‌گوییم.,BeetleLM/beetlelm_zho-fas_heritage,step-20000,fas,5.9727654457092285,392.5898568651626
574,از آنجایی که پر دارند و می‌توانند پرواز کنند، بسیاری از مردم آن‌ها را به‌عنوان دایناسور نمی‌شناسند.,BeetleLM/beetlelm_zho-fas_heritage,step-20000,fas,6.669281959533691,787.8297077078671
575,اما در مورد پرنده‌ها موارد زیادی وجود دارد که همچنان به دایناسور شباهت دارد.,BeetleLM/beetlelm_zho-fas_heritage,step-20000,fas,5.580948352813721,265.32310642623213
576,آنها پاها و پنجه‌های فلس‌دار دارند، تخم می‌گذارند و مانند تیرکس روی دو پای عقب خود راه می‌روند.,BeetleLM/beetlelm_zho-fas_heritage,step-20000,fas,7.5449113845825195,1891.0951498061565
577,تقریباً تمام رایانه‌هایی که امروزه مورد استفاده قرار می‌گیرد، مبتنی بر به‌کار بری اطلاعات هستند که به صورت اعداد دو دویی کدگذاری می‌شوند.,BeetleLM/beetlelm_zho-fas_heritage,step-20000,fas,6.234201908111572,509.89351413898066
