sentence_id,sentence,repo,revision,iso_code,nll,ppl
456,"Същото се отнася и за военните, защото вместо подразделението в армията да се базира на клас, сега то се основава на калибър.",BeetleLM/beetlelm_zho-bul_heritage,step-20000,bul,5.434859752655029,229.2606928174685
457,Френската революция е също вдъхновение за много други репресирани хора от работническата класа в други държави да започнат свои собствени революции.,BeetleLM/beetlelm_zho-bul_heritage,step-20000,bul,6.109379291534424,450.05927284981766
458,"Мохамед бил силно заинтересован от неща извън този светски живот. За да размишлява, той често посещавал пещера, която станала известна като „Хира“ на планината Нур (светлина).",BeetleLM/beetlelm_zho-bul_heritage,step-20000,bul,6.966142654418945,1060.1255827901834
459,"самата пещера, оцеляла във времето, предава много ярка картина на духовните склонности на Мохамед.",BeetleLM/beetlelm_zho-bul_heritage,step-20000,bul,6.335805416107178,564.423815997404
460,"Разположена на върха на една от планините северно от Мека, тази пещера е изцяло изолирана от останалия свят.",BeetleLM/beetlelm_zho-bul_heritage,step-20000,bul,5.799498081207275,330.13381795128265
461,"Всъщност, изобщо не е лесно да се намери, дори и да се знае, че съществува. Влезе ли се веднъж в пещерата, изолацията е пълна.",BeetleLM/beetlelm_zho-bul_heritage,step-20000,bul,5.26572847366333,193.5872806695593
462,"Нищо друго не се вижда, освен ясното, красиво небе над нас и многото околни планини. Отвътре на пещерата може да се види много малко от този свят.",BeetleLM/beetlelm_zho-bul_heritage,step-20000,bul,5.873149394989014,355.3664089195634
463,"Голямата пирамида в Гиза е единственото от седемте чудеса, което към момента съществува.",BeetleLM/beetlelm_zho-bul_heritage,step-20000,bul,6.136044979095459,462.2218539127797
464,"Издигната от египтяните през трети век пр.н.е., Великата пирамида е една от многото големи пирамидални структури, конструирани, за да почетат починалия фараон.",BeetleLM/beetlelm_zho-bul_heritage,step-20000,bul,6.174856662750244,480.51414340847043
465,"В египетската Долина на мъртвите, на платото Гиза, или „Гиза Некрополис“, има няколко пирамиди (от които Великата пирамида е най - голяма), няколко малки гробници, няколко храма и големия Сфинкс.",BeetleLM/beetlelm_zho-bul_heritage,step-20000,bul,6.289295196533203,538.7734658293633
466,"Голямата пирамида е в чест на фараона Куфу, а много от по - малките пирамиди, гробници и храмове - в чест на жените и членовете на семейството му.",BeetleLM/beetlelm_zho-bul_heritage,step-20000,bul,5.333774089813232,207.21856168882212
467,"Знакът „лък нагоре“ прилича на V, а знакът „лък надолу“ на телбод или квадрат без дъно.",BeetleLM/beetlelm_zho-bul_heritage,step-20000,bul,7.608475685119629,2015.2039499595628
468,"Нагоре означава, че трябва да започнете от върха и да натиснете лъка, а надолу означава, че трябва да започнете от жабата (там, където ръката ви държи лъка), след което да го издърпате.",BeetleLM/beetlelm_zho-bul_heritage,step-20000,bul,5.7356133460998535,309.7028675629552
469,"Насоченият нагоре лък обикновено издава по-мек звук, a насоченият надолу лък е по-силен и по-уверен.",BeetleLM/beetlelm_zho-bul_heritage,step-20000,bul,6.319362163543701,555.2187407320231
470,"Чувствайте се свободни да поставяте свои собствени знаци, но помнете, че отпечатаните щрихи за лък са там поради музикална причина, така че обикновено трябва да бъдат уважавани.",BeetleLM/beetlelm_zho-bul_heritage,step-20000,bul,5.62346076965332,276.8458269009576
471,"На 6 октомври 1789 г. ужасените крал Луи XVI, кралица Мария Антоанета, двете им малки деца (11 - годишната Мари Терез и 4 - годишния Луи - Шарл), както и сестрата на краля, мадам Елизабет, са принудени да се върнат в Париж от Версай от тълпа жени на пазара.",BeetleLM/beetlelm_zho-bul_heritage,step-20000,bul,6.36346960067749,580.2561248745137
472,"Те се върнали в Париж с каляска, заобиколени от тълпа хора, които викали и крещели заплахи срещу краля и кралицата.",BeetleLM/beetlelm_zho-bul_heritage,step-20000,bul,6.295389652252197,542.0670228840343
473,Тълпата принуди краля и кралицата широко да отворят прозорците на каретата си.,BeetleLM/beetlelm_zho-bul_heritage,step-20000,bul,6.074173927307129,434.49043354574553
474,"В един момент един от тълпата е размахал пред ужасената кралица главата на кралски стражар, убит във Версай.",BeetleLM/beetlelm_zho-bul_heritage,step-20000,bul,6.456578254699707,636.8780893115236
475,Самите филипинци са платили военните разходи на американския империализъм за завладяването на Филипините.,BeetleLM/beetlelm_zho-bul_heritage,step-20000,bul,6.083386421203613,438.51166837336166
476,"Колониалният режим на САЩ ги е принудил да плащат данъци, за да покриват голяма част от разходите и лихвите по облигациите, емитирани от името на филипинското правителство през банковите къщи на Уолстрийт.",BeetleLM/beetlelm_zho-bul_heritage,step-20000,bul,5.806097030639648,332.3195581847904
477,"Свръхпечалбите, получени от продължителната експлоатация на филипинския народ, представляват, разбира се, основни придобивки на американския империализъм.",BeetleLM/beetlelm_zho-bul_heritage,step-20000,bul,5.51848840713501,249.25797570214945
478,"За да се вникне в смисъла на тамплиерството, трябва да е ясен контекстът, предизвикал създаването на ордена.",BeetleLM/beetlelm_zho-bul_heritage,step-20000,bul,6.378172874450684,588.8508197758274
479,"Периодът, през който са се случили събитията, обикновено се нарича Късно средновековие - периодът от европейската история през 11-и, 12-и и 13-и век (1000 – 1300 г. сл. Хр.).",BeetleLM/beetlelm_zho-bul_heritage,step-20000,bul,5.251012802124023,190.75937215150063
480,"Същинското Средновековие е предшествано от ранното и последвано от късното, което по конвенция завършва около 1500 г.",BeetleLM/beetlelm_zho-bul_heritage,step-20000,bul,5.859147548675537,350.42529615354937
481,"Технологичният детерминизъм е термин, който обхваща широк спектър от идеи на практика - от технологичния тласък или технологичния императив до стриктното усещане, че човешката съдба се ръководи от логика, свързана с научните закони и тяхното проявление в технологиите.",BeetleLM/beetlelm_zho-bul_heritage,step-20000,bul,6.208493709564209,496.95213298861665
482,"Две общи идеи са споделени между повечето интерпретации на технологичния детерминизъм: самото развитие на технологиите върви по път, далеч надхвърлящ културното или политическото влияние или самата технологията влияе върху присъщи, а не социално обусловени общества.",BeetleLM/beetlelm_zho-bul_heritage,step-20000,bul,6.431748390197754,621.2592025120284
483,"Така например, човек може да каже, че моторното превозно средство задължително води до развитието на пътища.",BeetleLM/beetlelm_zho-bul_heritage,step-20000,bul,5.6545515060424805,285.5883693416333
484,"Една национална пътна мрежа обаче няма да е икономически изгодна само за шепа автомобили, затова се разработват нови методи на производство, за намаляване стойността за притежаването на автомобил.",BeetleLM/beetlelm_zho-bul_heritage,step-20000,bul,6.274503707885742,530.8628533220315
485,"Масовата собственост на автомобили също доведе до по-голямата честота на произшествия по пътищата, което налага изобретяването на нови техники в здравеопазването за възстановяване на повредени тела.",BeetleLM/beetlelm_zho-bul_heritage,step-20000,bul,6.567377090454102,711.50119028656
486,"Романтизмът съдържа голям елемент на културен детерминизъм, чието начало поставят писатели като Гьоте, Фихте и Шлегел.",BeetleLM/beetlelm_zho-bul_heritage,step-20000,bul,6.787843227386475,886.9984433845718
487,"В контекста на романтизма географията оформя индивидите и с течение на времето възникват свързани с тази география обичаи и култура, и те, бидейки в хармония с мястото на обществото, били по - добри от произволно наложените закони.",BeetleLM/beetlelm_zho-bul_heritage,step-20000,bul,5.506502151489258,246.28814004470144
488,"По начина, по който Париж е известен като модна столица на съвременния свят, Константинопол е считан за модна столица на феодална Европа.",BeetleLM/beetlelm_zho-bul_heritage,step-20000,bul,5.48758602142334,241.67310843474027
489,Славата му на епицентър на лукса датира от около 400 г. пр.н.е. и продължава до около 1100 г. пр.н.е.,BeetleLM/beetlelm_zho-bul_heritage,step-20000,bul,4.929615020751953,138.32624935258517
490,"Статутът й запада през дванайсти век главно поради факта, че кръстоносците се завръщат с дарове като подправки и коприна, които били по-ценени от предлаганите от византийските пазари.",BeetleLM/beetlelm_zho-bul_heritage,step-20000,bul,5.867061138153076,353.2094197659087
491,По това време титлата „Модна столица“ се прехвърля от Константинопол на Париж.,BeetleLM/beetlelm_zho-bul_heritage,step-20000,bul,6.014288425445557,409.2345344050028
492,Готическият стил е достигнал връхната си точка в периода между 10–11 век и 14-ти век.,BeetleLM/beetlelm_zho-bul_heritage,step-20000,bul,6.075533390045166,435.08150878153134
493,В началото облеклото се е влияело много силно от източната византийска култура.,BeetleLM/beetlelm_zho-bul_heritage,step-20000,bul,5.590879440307617,267.97118077517223
494,"Въпреки това, поради бавната комуникация, западните стилове могат да изостават с 25 до 30 години.",BeetleLM/beetlelm_zho-bul_heritage,step-20000,bul,5.9413299560546875,380.44056245832064
495,"Към края на Средновековието Западна Европа започнала да развива собствен стил. В резултат на кръстоносните походи хората започнали да използват копчета за закопчаване на дрехите си, което е едно от най-големите развития на това време.",BeetleLM/beetlelm_zho-bul_heritage,step-20000,bul,5.946774482727051,382.5175301703221
496,"Земеделието като средство за препитание е такова земеделие, което се извършва за производството на достатъчно храна единствено за нуждите на земеделския стопанин и неговото семейство.",BeetleLM/beetlelm_zho-bul_heritage,step-20000,bul,6.012711048126221,408.5895259767143
497,"Пазарното селско стопанство е проста, често органична система, като често се използват запазени семена от същия екологичен район, комбинирани с ротация на културите и други относително прости техники за максимален добив.",BeetleLM/beetlelm_zho-bul_heritage,step-20000,bul,6.40212869644165,603.1275478155102
498,В исторически план повечето фермери са се занимавали със земеделие за препитание и това все още важи за много развиващи се страни.,BeetleLM/beetlelm_zho-bul_heritage,step-20000,bul,6.470739364624023,645.9611512717349
499,"Субкултурите обединяват хора-единомишленици, които се чувстват пренебрегнати от обществените стандарти. Те им позволяват да развият чувство за идентичност.",BeetleLM/beetlelm_zho-bul_heritage,step-20000,bul,5.5706787109375,262.61227659242536
500,"Подкултурите могат да се различават по възраст, етническа принадлежност, клас, местоположение и/или пол на членовете.",BeetleLM/beetlelm_zho-bul_heritage,step-20000,bul,6.003936767578125,405.0201291912033
501,"Признаците, които определят дадена субкултура като самостоятелна, могат да бъдат от езикови, естетическо, религиозно, политическо, сексуално, географско естество или комбинация от фактори.",BeetleLM/beetlelm_zho-bul_heritage,step-20000,bul,6.036448001861572,418.40422130527804
502,"Членовете на дадена субкултура често сигнализират за членството си чрез характерно и символично използване на стил, което включва мода, маниери и жаргон.",BeetleLM/beetlelm_zho-bul_heritage,step-20000,bul,6.4764404296875,649.6543353619807
503,"Един от най-често използваните средства за илюстриране на значението на социализацията е примерът с няколко нещастни случая с деца, които, поради пренебрегване, лошо отношение или умишлено насилие, не са били социализирани от възрастните в периода на израстване на децата.",BeetleLM/beetlelm_zho-bul_heritage,step-20000,bul,5.656402587890625,286.1175063750509
504,Тези деца се наричат „неопитомени“ или диви. Някои неопитомени деца са били държани затворени от хора (обичайно собствените им родители); понякога изоставянето на такива деца се дължало на отхвърляне на тежко интелектуално или физическо увреждане на детето от родителите.,BeetleLM/beetlelm_zho-bul_heritage,step-20000,bul,6.386865615844727,593.9918601661288
505,Дивите деца преди да бъдат изоставени или да избягат може да са били тежко малтретирани или травмирани.,BeetleLM/beetlelm_zho-bul_heritage,step-20000,bul,6.326386451721191,559.1324867160815
506,"Други се предполага да са отгледани от животни; за някои казват, че живели сами в дивата природа.",BeetleLM/beetlelm_zho-bul_heritage,step-20000,bul,6.1358537673950195,462.13348013543214
507,"Когато е напълно отгледано от животни, дивото дете демонстрира поведение (в рамките на физическите ограничения) почти изцяло наподобяващо това на конкретното обгрижващо животно, както и неговите страх или безразличие към хората.",BeetleLM/beetlelm_zho-bul_heritage,step-20000,bul,5.877216815948486,356.814777264571
508,"Докато ученето, базирано на проекти, трябва да направи ученето по-лесно и по-интересно, скаффолдинга отива една стъпка по-далеч.",BeetleLM/beetlelm_zho-bul_heritage,step-20000,bul,5.864256858825684,352.22030941087485
509,"Изграждането на скеле не е метод за обучение, а по-скоро помощ, която предоставя подкрепа на лица, преминаващи през ново обучение, като например нова компютърна програма или започване на нов проект.",BeetleLM/beetlelm_zho-bul_heritage,step-20000,bul,5.939478874206543,379.7369872274258
510,"Скелетата могат да бъдат виртуални и действителни, иначе казано, учителят е вид скеле, както и малкият човек с кламерите в Microsoft Office.",BeetleLM/beetlelm_zho-bul_heritage,step-20000,bul,5.561122417449951,260.11462973471015
511,"В софтуера има вградени виртуални скелета, които имат за цел да задават въпроси, да подсещат и да обясняват процедури, които може да са били прекалено трудни за студента да се справи сам.",BeetleLM/beetlelm_zho-bul_heritage,step-20000,bul,5.374796390533447,215.89590938419136
512,"Децата се настаняват в приемни семейства по много и различни причини, които варират от пренебрегване до малтретиране и дори изнудване.",BeetleLM/beetlelm_zho-bul_heritage,step-20000,bul,6.137890815734863,463.07582785199287
513,"Никое дете не трябва да расте в среда, която не е насърчаваща, обгрижваща и образователна, но това се случва.",BeetleLM/beetlelm_zho-bul_heritage,step-20000,bul,5.144600868225098,171.50301870424315
514,"Смятаме, че системата за приемни грижи е безопасна зона за тези деца.",BeetleLM/beetlelm_zho-bul_heritage,step-20000,bul,6.353044033050537,574.2380508324761
515,"Предполага се, че нашата система за приемна грижа трябва да осигури безопасни домове, любящи хора, които да полагат грижи, стабилно образование, както и надеждни здравни грижи.",BeetleLM/beetlelm_zho-bul_heritage,step-20000,bul,5.824265480041504,338.41247105130515
516,"Приемната грижа се предполага да предоставя всичко необходимо, което е липсвало в дома, от който са били взети.",BeetleLM/beetlelm_zho-bul_heritage,step-20000,bul,5.513138771057129,247.92809659885447
517,"Интернет съчетава елементи и от масовата, и от индивидуалната комуникация.",BeetleLM/beetlelm_zho-bul_heritage,step-20000,bul,6.053577899932861,425.6331818803941
518,Специалните характеристики на интернет водят до допълнителни измерения по отношение на използването на подхода за удовлетворение.,BeetleLM/beetlelm_zho-bul_heritage,step-20000,bul,5.491470813751221,242.61378425432028
519,"Например, „научаване“ и „социализиране“ са посочени като важни мотивации за интернет употреба (James et al., 1995).",BeetleLM/beetlelm_zho-bul_heritage,step-20000,bul,6.094646453857422,443.4772277944612
520,"„Личното участие“ и „продължителните взаимоотношения“ също бяха определени като нови аспекти за мотивация от Имей и Маккорд (1998 г.), когато те изследваха реакциите на публиката към уебсайтове.",BeetleLM/beetlelm_zho-bul_heritage,step-20000,bul,6.303297996520996,546.370871244136
521,"Използването на видеозапис е довело до важни открития в тълкуването на микро-изрази, лицеви движения, които продължават няколко милисекунди.",BeetleLM/beetlelm_zho-bul_heritage,step-20000,bul,5.707924842834473,301.2452878932728
522,"Твърди се по-конкретно, че човек може да открие дали дадено лице лъже, като интерпретира правилно микро-израженията.",BeetleLM/beetlelm_zho-bul_heritage,step-20000,bul,5.451009273529053,232.9932011506569
523,"В своя труд ""Речта на президента"" Оливър Сакс посочва как независимо от това, че хората, които не могат да разберат речта поради увреждане на мозъка, са в състояние да възприемат искреното отношение.",BeetleLM/beetlelm_zho-bul_heritage,step-20000,bul,5.567597389221191,261.8043290939359
524,"Той дори предполага, че подобни способности за интерпретиране на човешкото поведение могат да бъдат споделени от животни, като например домашните кучета.",BeetleLM/beetlelm_zho-bul_heritage,step-20000,bul,5.550151824951172,257.27661395005754
525,"Проучванията през двадесети век показаха, че има 2 групи генетични вариации: скрити и изразени.",BeetleLM/beetlelm_zho-bul_heritage,step-20000,bul,6.337421894073486,565.3369324771274
526,"Мутацията добавя нова генетична вариация, а селекцията я премахва от групата изразени вариации.",BeetleLM/beetlelm_zho-bul_heritage,step-20000,bul,6.342459201812744,568.1918932033399
