sentence_id,sentence,repo,revision,iso_code,nll,ppl
248,آرمند ورساچه گفت: «من خواهر و دوستم را از دست دادم و در مسیر من دو معلول روی صندلی چرخدار بودند، مردم فقط می پریدند و آنها را هل می‌دادند».,BeetleLM/beetlelm_fas-fra_balanced,step-8000,fas,6.6740288734436035,791.578357726401
249,NHK همچنین گزارش داد که نیروگاه هسته ای کاشیوازاکی کاریوا در استان نیگاتا به طور عادی مشعول به کار بود.,BeetleLM/beetlelm_fas-fra_balanced,step-8000,fas,6.564661026000977,709.5713291952044
250,شركت برق هوکوریکو هیچ تاثیری از زلزله را گزارش نکرد اینکه راكتور شماره 1 و 2 آن در نيروگاه هسته اي شيكا را خاموش كرده است.,BeetleLM/beetlelm_fas-fra_balanced,step-8000,fas,7.464883327484131,1745.6518667452735
251,طبق گزارشات حدود 9400 خانه در منطقه از آب محروم هستند و تقریباً 100 خانه برق ندارند.,BeetleLM/beetlelm_fas-fra_balanced,step-8000,fas,6.1132588386535645,451.80869028474
252,برخی از جاده‌ها آسیب دیده‌اند، سرویس راه‌آهن در مناطق آسیب دیده متوقف شده و فرودگاه نوتو در ایشیکاوا همچنان تعطیل است.,BeetleLM/beetlelm_fas-fra_balanced,step-8000,fas,6.655881881713867,777.3431456052085
253,یک بمب در بیرون دفتر فرماندار کل منفجر شد.,BeetleLM/beetlelm_fas-fra_balanced,step-8000,fas,6.927224159240723,1019.6596348227482
254,سه بمب دیگر در یک بازه دو ساعته نزدیک ساختمان‌های دولت منفجر شد.,BeetleLM/beetlelm_fas-fra_balanced,step-8000,fas,6.9790520668029785,1073.8998989876904
255,برخی گزارش‌های رسمی تعداد کشته شدگان را هشت نفر اعلام می‌کنند و گزارش‌های رسمی زخمی شدن 30 تن را تایید می‌کند؛ اما اعداد نهایی هنوز مشخص نیست.,BeetleLM/beetlelm_fas-fra_balanced,step-8000,fas,7.795938968658447,2430.710714459839
256,اسید سیانوریک و نیز ملامین در نمونه‌های ادرار حیوانات خانگی که پس از مصرف غذای آلوده مخصوص حیوانات مردند، یافت شد.,BeetleLM/beetlelm_fas-fra_balanced,step-8000,fas,7.859616756439209,2590.5273822073173
257,محققان دانشگاه گفتند که این دو ترکیب در واکنش با یکدیگر مواد کریستالی تشکیل می‌دهد و می‌تواند عملکرد کلیه را مسدود کند.,BeetleLM/beetlelm_fas-fra_balanced,step-8000,fas,6.914809703826904,1007.0793659135171
258,پژوهشگران با افزودن ملامین و اسید سیانوریک در ادرار گربه، تشکیل کریستال‌ها را مشاهده کردند.,BeetleLM/beetlelm_fas-fra_balanced,step-8000,fas,7.3570170402526855,1567.154823952088
259,نتیجه سنجش طیف سنجی مادون قرمز (طیف‌سنجی تبدیل فوریه فروسرخ) مشخص کرد ترکیب این بلورها با مواردی که در ادرار حیوانات خانگی مبتلا دیده می‌شود مطابقت دارد.,BeetleLM/beetlelm_fas-fra_balanced,step-8000,fas,8.239337921142578,3787.0321640394345
260,نمی‌دانم متوجه شده‌اید یا نه، اما بسیاری از کالاها از آمریکای مرکزی بدون پرداخت عوارض وارد این کشور می‌شوند.,BeetleLM/beetlelm_fas-fra_balanced,step-8000,fas,7.060779571533203,1165.3532880031457
261,همچنان در کشورهای آمریکای مرکزی روی هشتاد درصد کالاهای ما از طریق وضع تعرفه، مالیات گرفته می‌شد. ما با شما رفتار می‌کنیم.,BeetleLM/beetlelm_fas-fra_balanced,step-8000,fas,7.53677225112915,1875.7657426792998
262,برایم معنی نداشت؛ مسلماً عادلانه نبود.,BeetleLM/beetlelm_fas-fra_balanced,step-8000,fas,8.754469871520996,6338.9592101675
263,کل حرف من به مردم این است که شما طوری با ما رفتار می‌کنید که ما با شما رفتار می‌کنیم.,BeetleLM/beetlelm_fas-fra_balanced,step-8000,fas,6.621781826019287,751.2825600081877
264,حکمران کالیفرنیا، آرنولد شوارتزنگر، لایحه‌ای به قانون افزود که فروش و اجاره بازی‌های ویدیویی خشن به افراد کم سن و سال ممنوع شود.,BeetleLM/beetlelm_fas-fra_balanced,step-8000,fas,7.9487504959106445,2832.0341005921046
265,این لایحه بازی های ویدئویی خشونت آمیز که در ایالت کالیفرنیا فروخته می شود را ملزم به نصب برچسب «18» می‌کند و برای تخلف در فروش آنها به افراد زیر سن قانونی جریمه 1000 دلاری تعیین می‌کند.,BeetleLM/beetlelm_fas-fra_balanced,step-8000,fas,7.076780796051025,1184.1503545846322
266,مدیر دادرسی های عمومی، Kier Starmer QC، صبح امروز با صدور بیانیه ای پیگرد قانونی هوهن و پریس را اعلام کرد.,BeetleLM/beetlelm_fas-fra_balanced,step-8000,fas,6.243058681488037,514.4295832562815
267,Huhne استعفا داده است و نماینده Ed Davey جایگزین او خواهد شد. انتظار می‌رود نماینده Norman Lamb سمت وزیر تجارت را از آن خود کند، که Davey از آن استعفا داده بود.,BeetleLM/beetlelm_fas-fra_balanced,step-8000,fas,6.531161785125732,686.1949596746005
268,قرار است Huhne و Pryce در 16 فوریه در دادگاه بدوی وست‌مینستر حاضر شوند.,BeetleLM/beetlelm_fas-fra_balanced,step-8000,fas,7.342360019683838,1544.3525186055822
269,تلفات آن عبارت بود از نیکلاس آلدن، 25 ساله، و زاخاری کادبک، 21 ساله. کادبک راننده بود.,BeetleLM/beetlelm_fas-fra_balanced,step-8000,fas,7.113265514373779,1228.1515515096623
270,ادگار وگیلا از ناحیه دست و فک زخمی شد، و از آن طرف کریستوفر اشنایدر نیاز به جراحی ترمیمی صورت پیدا کرد.,BeetleLM/beetlelm_fas-fra_balanced,step-8000,fas,6.452966213226318,634.5818088661399
271,سلاح اوکا در حالی که سر مرد پنجم را نشانه رفته بود، عمل نکرد. اشنایدر درد مداوم داشت از ناحیه یک چشم کور بود، بخشی از جمجمه اش از دست رفته بود و چهره اش با تیتانیوم بازسازی شده بود.,BeetleLM/beetlelm_fas-fra_balanced,step-8000,fas,5.8971428871154785,363.99600311220456
272,اشنایدر از طریق لینک ویدئویی از پایگاه نیروی هوایی ایالات متحده در کشورش شهادت داد.,BeetleLM/beetlelm_fas-fra_balanced,step-8000,fas,6.027653217315674,414.74058040663164
273,پس از مسابقه چهارشنبه، کارپاندو در دو مسابقه انفرادی در مسابقات قهرمانی رقابت کرد.,BeetleLM/beetlelm_fas-fra_balanced,step-8000,fas,5.066237449645996,158.5765512082231
274,نخستین حضور او در اسکی مارپیچ کوچک بود، جایی‌که وی موفق نشد به خط پایان برسد. 36 نفر از 116 رقیب او در آن مسابقه نتیجه مشابهی بدست آوردند.,BeetleLM/beetlelm_fas-fra_balanced,step-8000,fas,6.726893901824951,834.551038515104
275,او در مسابقه دیگرش در Giant Slalom با مدت زمان ترکیبی 4:41.30 کار خود را در رتبه دهم در گروه نشسته بانوان پایان داد، که 2:11.60 دقیقه کندتر از کلودیا لوئیز اتریشی بود که مقام اول را از آن خود کرد و 1:09.02 دقیقه کندتر از مقام نهم که به Gyöngyi Dani از مجارستان رسید.,BeetleLM/beetlelm_fas-fra_balanced,step-8000,fas,6.11870002746582,454.27376706784173
276,چهار اسکی‌باز در گروه نشسته زنان نتوانستند مسیرشان را به اتمام برسانند و 45 نفر از کل 117 اسکی‌باز مارپیچ بزرگ نتوانستند در مسابقه رتبه کسب کنند.,BeetleLM/beetlelm_fas-fra_balanced,step-8000,fas,7.334674835205078,1532.5293743139093
277,پلیس مادیا پرادش لپتاب و تلفن همراه دزده شده را باز پس گرفت.,BeetleLM/beetlelm_fas-fra_balanced,step-8000,fas,6.798995018005371,896.9454245443906
278,معاون بازرس کل «د. ک. آریا» گفت: «ما پنج نفر را که به زن سوییسی تجاوز کرده بودند دستگیر کردیم و موبایل و لپتاپ او را پس گرفتیم.»,BeetleLM/beetlelm_fas-fra_balanced,step-8000,fas,6.6716485023498535,789.6963483142805
279,نام متهمین بابا کانجار، رامپرو کانجار، گازا کانجار و ویشنو کانجار است.,BeetleLM/beetlelm_fas-fra_balanced,step-8000,fas,8.007283210754395,3002.748187299811
280,رئیس پلیس «Chandra Shekhar Solanki» گفت که متهمان در دادگاه با صورت‌های پوشیده حاضر شدند.,BeetleLM/beetlelm_fas-fra_balanced,step-8000,fas,7.2397661209106445,1393.7679595631737
281,اگرچه هنگام برخورد ماشین به خانه سه نفر در آنجا بودند، هیچ کدام صدمه ندیدند.,BeetleLM/beetlelm_fas-fra_balanced,step-8000,fas,6.171072483062744,478.6992276968142
282,با این حال، راننده دچار مصدومیت جدی از ناحیه سر شد.,BeetleLM/beetlelm_fas-fra_balanced,step-8000,fas,5.969882488250732,391.4596669367175
283,زمانیکه کارکنان خدمات اورژانس مشغول آزاد کردن راننده از آئودی TT قرمز بودند، جاده محل تصادف موقتاً بسته شد.,BeetleLM/beetlelm_fas-fra_balanced,step-8000,fas,8.436771392822266,4613.635296578994
284,او در ابتدا در بیمارستان جیمز پاژه در گریت یارموث بستری بود.,BeetleLM/beetlelm_fas-fra_balanced,step-8000,fas,6.872885227203369,965.7309031170417
285,او سپس به بیمارستان ادن بروک کمبریج منتقل شد.,BeetleLM/beetlelm_fas-fra_balanced,step-8000,fas,6.44497537612915,629.5311752768039
286,«آدکویا» از آن زمان به اتهام قتل پسرش در «دادگاه کلانتری ادینبورگ» بوده است.,BeetleLM/beetlelm_fas-fra_balanced,step-8000,fas,7.1898369789123535,1325.8870404405238
287,او در بازداشت است و منتظر کیفرخواست و محاکمه است، اما هر شاهد عینی ممکن است تحت تاثیر قرار گبرد زیرا تصویر وی به‌طور گسترده‌ای منتشر شده است.,BeetleLM/beetlelm_fas-fra_balanced,step-8000,fas,6.550251007080078,699.4197110838434
288,این اقدام در جاهای دیگر انگلستان معمول و رایج است ولی دادگاه اسکاتلند متفاوت عمل می‌کند و دادگاه‌ها انتشار عکس‌ها را بطور بالقوه مخرب دانسته‌اند.,BeetleLM/beetlelm_fas-fra_balanced,step-8000,fas,8.508330345153809,4955.88156493323
289,پروفسور Pamela Ferguson از دانشگاه Dundee می گوید: «به نظر می رسد که روزنامه نگاران در صورت انتشار عکس و غیره از مظنونان روی خط خطر قدم می‌گذارند.»,BeetleLM/beetlelm_fas-fra_balanced,step-8000,fas,6.755351543426514,858.641546629479
290,دادگاه اسکاتلند، که در کل مسئول پیگیری این پرونده است، به روزنامه‌نگارها بیان داشته که حداقل تا زمان اعلام جرم هیچ توضیح بیشتری داده نخواهد شد.,BeetleLM/beetlelm_fas-fra_balanced,step-8000,fas,6.259173393249512,522.7866225030656
291,این سند بر اساس این درز اطلاعاتی است و به اختلاف مرزی مربوط می‌شود، که در آن فلسطین خواستار مرزبندی طبق شرایط قبل از جنگ شش‌روزه 1967 است.,BeetleLM/beetlelm_fas-fra_balanced,step-8000,fas,6.978010177612305,1072.7815969656265
292,مباحث گزارش شده دیگر شامل وضعیت آتی بیت المقدس است که برای هر دو ملت مقدس است و همچنین مسئله جردن ولی.,BeetleLM/beetlelm_fas-fra_balanced,step-8000,fas,6.552252292633057,700.820851220213
293,اسرائیل پس از امضای توافق‌نامه خواستار حضور نظامی مداوم در دره برای ده سال است، درحالیكه پارلمان موافق است چنین حضوری تنها برای پنج سال باشد.,BeetleLM/beetlelm_fas-fra_balanced,step-8000,fas,6.510674953460693,672.2800222204191
294,تیراندازان شرکت کننده در آزمایش کنترل آفات مکمل باید به دقت توسط جنگلبانان نظارت می‌شدند، زیرا این آزمایش تحت نظارت بود و میزان موثر بودن آن مورد ارزیابی قرار گرفت.,BeetleLM/beetlelm_fas-fra_balanced,step-8000,fas,6.608978271484375,741.7247900619132
295,با همکاری NPWS و انجمن تیراندازان ورزشکار استرالیا (NSW) با هم، افراد داوطلب واجد شرایط تحت برنامه شکار انجمن تیراندازان ورزشکار استخدام شدند.,BeetleLM/beetlelm_fas-fra_balanced,step-8000,fas,6.912787914276123,1005.0453202736853
296,به گفته Mick O'Flynn، مدیر حفاظت از پارک و میراث با NPWS، چهار تیرانداز انتخاب شده برای اولین عملیات تیراندازی، دستورالعمل جامع ایمنی و آموزش را دریافت کردند.,BeetleLM/beetlelm_fas-fra_balanced,step-8000,fas,6.213686943054199,499.5396343826863
297,مارتلی دیروز در شورای موقت انتخاباتی (CEP) جدید که متشکل از نُه عضو بود سوگند یاد کرد.,BeetleLM/beetlelm_fas-fra_balanced,step-8000,fas,6.8681159019470215,961.1359843708263
298,این پنجمین CEP مارتلی در چهار سال گذشته است.,BeetleLM/beetlelm_fas-fra_balanced,step-8000,fas,6.0360941886901855,418.2562105664349
299,ماه گذشته یک کمیسیون ریاست جمهوری کناره‌گیری شورای انتخاباتی موقت قبلی را به عنوان بخشی از بسته اقدامات برای حرکت کشور به سمت انتخابات جدید توصیه کرد.,BeetleLM/beetlelm_fas-fra_balanced,step-8000,fas,6.076027870178223,435.2967011436733
300,این کمیسیون پاسخ مارتلی بود به اعتراضات گسترده ضدحکومتی که در ماه اکتبر آغاز شد.,BeetleLM/beetlelm_fas-fra_balanced,step-8000,fas,6.317739963531494,554.3187950273497
301,اعتراضات گاه خشونت آمیز ناشی از عدم برگزاری انتخابات که قرار بود در سال 2011 برگزار شود، بود.,BeetleLM/beetlelm_fas-fra_balanced,step-8000,fas,4.844870090484619,127.08677114045149
302,حدود 60 مورد گرمای بیش از حد آیپاد‌ها گزارش شده است که در مجموع منجر به ایجاد شش آتش سوزی و مصدومیت جزئی چهار نفر شده است.,BeetleLM/beetlelm_fas-fra_balanced,step-8000,fas,5.571073532104492,262.7159819491239
303,وزارت اقتصاد، تجارت و صنعت ژاپن (METI) گفت که از 27 مورد حادثه مربوط به این دستگاه‌ها اطلاع داشته است.,BeetleLM/beetlelm_fas-fra_balanced,step-8000,fas,5.3486762046813965,210.3296800450717
304,هفته گذشته، METI اعلام کرد که اپل آنها را از 34 رویداد گرم‌شدن بیش‌ازحد، که این شرکت آن را «غیر جدی» نامیده، مطلع کرده است.,BeetleLM/beetlelm_fas-fra_balanced,step-8000,fas,6.3982439041137695,600.7890677407016
305,وزارت در یک واکنش تأخیر اپل در گزارش‌دهی را «واقعاً تأسف برانگیز» خواند.,BeetleLM/beetlelm_fas-fra_balanced,step-8000,fas,8.417725563049316,4526.596280284686
306,این زمین‌لرزه در ساعت 07:19 دقیقه صبح به وقت محلی (جمعه 09:19 بعدازظهر به وقت گرینویچ) ماریانا را لرزاند.,BeetleLM/beetlelm_fas-fra_balanced,step-8000,fas,6.1161346435546875,453.1098740091369
307,اداره مدیریت اورژانسی جزایر ماریانای شمالی گفت که هیچ خسارتی در این کشور گزارش نشده است.,BeetleLM/beetlelm_fas-fra_balanced,step-8000,fas,5.575479984283447,263.87618166523157
308,همچنین مرکز هشدار سونامی اقیانوس آرام گفت هیچ نشانی از سونامی وجود نداشت.,BeetleLM/beetlelm_fas-fra_balanced,step-8000,fas,7.033923625946045,1134.4731373163477
309,یک پلیس سابق فیلیپینی با ربودن یک اتوبوس در مانیل، پایتخت فیلیپین، گردشگران هنگ کنگی را به گروگان گرفته است.,BeetleLM/beetlelm_fas-fra_balanced,step-8000,fas,6.119878768920898,454.80955410419796
310,رونالدو مندوزا با اسلحه M16 خود به گردشگران شلیک کرد.,BeetleLM/beetlelm_fas-fra_balanced,step-8000,fas,7.260483264923096,1422.944030004451
311,چندین تن از گروگان‌ها نجات یافته‌اند و تاکنون مرگ حداقل شش نفر تایید شده است.,BeetleLM/beetlelm_fas-fra_balanced,step-8000,fas,6.5806427001953125,721.0025688629484
312,شش گروگان شامل كودكان و سالمندان، همینطور عكاسان فیلیپینی، در ابتدا آزاد شدند.,BeetleLM/beetlelm_fas-fra_balanced,step-8000,fas,6.75534200668335,858.6333580246252
313,عکاس‌ها سپس جای یک زن سالخورده که نیاز به دستشویی داشت را گرفتند. مندوزا با گلوله از پای درآورده شد.,BeetleLM/beetlelm_fas-fra_balanced,step-8000,fas,6.67997407913208,796.2984710008985
314,لیگینز قدم به قدم از پدرش پیروی کرد و وارد حرفه پزشکی شد.,BeetleLM/beetlelm_fas-fra_balanced,step-8000,fas,6.979732990264893,1074.63139164165
315,او به عنوان پزشک زنان آموزش دید و کار خود را در بیمارستان ملی اوکلند در سال 1959 شروع کرد.,BeetleLM/beetlelm_fas-fra_balanced,step-8000,fas,5.0480875968933105,155.72437176816894
316,درحالیکه او در بیمارستان کار می‌کرد، لیگینز در اوقات فراغتش روی زایمان زودرس تحقیقاتش را آغاز کرد.,BeetleLM/beetlelm_fas-fra_balanced,step-8000,fas,7.0736541748046875,1180.4537468846452
317,تحقیقات او نشان داد که اگر هورمونی تجویز شود، بلوغ ریه جنینی کودک را تسریع می‌کند.,BeetleLM/beetlelm_fas-fra_balanced,step-8000,fas,7.478718280792236,1769.9707159893692
318,«شین هوا» گزارش داد که بازرسان دولت روز چهارشنبه دو گزارش پرواز از «جعبه سیاه» را بازیابی کردند.,BeetleLM/beetlelm_fas-fra_balanced,step-8000,fas,6.8348002433776855,929.6426299049623
319,کشتی گیران همکار نیز به لونا ادای احترام کردند.,BeetleLM/beetlelm_fas-fra_balanced,step-8000,fas,6.974518775939941,1069.042616443469
320,تامی‌ دریمر گفت: «لونا اولین ملکه Extreme بود. اولین مدیر من. لونا در شبی که دو ماه داشت درگذشت. بسیار زیبا و بی‌مانند بود. یک زن قوی.»,BeetleLM/beetlelm_fas-fra_balanced,step-8000,fas,7.3428955078125,1545.1797225049324
321,داستین «گلدوست» رونلز اظهار داشت: «لونا به اندازه من دمدمی‌مزاج بود... شاید هم بیشتر از من... او را دوست داشتم اما ترکش کردم... امیدوارم که او در وضعیت بهتری باشد.»,BeetleLM/beetlelm_fas-fra_balanced,step-8000,fas,6.76199197769165,864.362272407483
322,"از بین 1,400 نفری که قبل از انتخابات فدرال 2010 از آنها نظرسنجی شد، تعداد کسانی که مخالف جمهوری شدن استرالیا بودند 8 درصد از سال 2008 افزایش داشت.",BeetleLM/beetlelm_fas-fra_balanced,step-8000,fas,6.096929550170898,444.490885717373
323,جولیا گیلارد، نخست وزیر دولت موقت، در خلال کمپین انتخابات فدرال 2010 مدعی شد که معتقد است پس از خاتمه حکمرانی ملکه الیزابت دوم، استرالیا باید جمهوری شود.,BeetleLM/beetlelm_fas-fra_balanced,step-8000,fas,5.693737030029297,297.00145269785213
324,34 درصد آنهایی که در نظرسنجی شرکت دارند می‌خواهند که ملکه الیزابت دوم آخرین فرمانروای استرالیا باشد.,BeetleLM/beetlelm_fas-fra_balanced,step-8000,fas,6.960618019104004,1054.2849241671843
325,در انتهای نظرسنجی، 29 درصد افراد نظرسنجی شده معتقد بودند که استرالیا باید در اسرع وقت جمهوری شود، در حالی که 31 درصد معتقد بودند استرالیا هرگز نباید جمهوری شود.,BeetleLM/beetlelm_fas-fra_balanced,step-8000,fas,6.298879623413086,543.9621261655547
326,برنده مدال طلای المپیک در شنای 100 متر و 200 متر آزاد و شنای سه‌گانه در بازی‌های کشورهای مشترک‌المنافع بود، اما به دلیل شکایت وی، در خصوص آمادگی جسمانی او در این مسابقات تردید وجود داشته‌ است.,BeetleLM/beetlelm_fas-fra_balanced,step-8000,fas,6.161923408508301,474.3395467074187
327,او نتوانسته است داروهای مورد نیاز برای غلبه بر درد خود را دریافت کند چون این دارو‌ها ممنوع هستند.,BeetleLM/beetlelm_fas-fra_balanced,step-8000,fas,6.5200958251953125,678.6434133613643
328,کورتیس کوپر، یک ریاضیدان و استاد علوم رایانه‌ای در دانشگاه میسوری مرکزی است، بزرگترین عدد اول شناخته شده را در مورخ 25 ژانویه کشف کرد.,BeetleLM/beetlelm_fas-fra_balanced,step-8000,fas,6.407928466796875,606.6357125288318
329,چند نفر از مردم این کشف را با استفاده از سخت‌افزار و نرم‌افزار مختلف در ابتدای فوریه تأیید کردند و در سه‌شنبه اعلام شد.,BeetleLM/beetlelm_fas-fra_balanced,step-8000,fas,6.28333044052124,535.5693788581459
330,احتمال دارد که دنباله‌دارها منبع تامین آب و مواد‌آلی کره زمین باشند که می‌توانند تشکیل‌دهنده پروتئین‌ها و زندگی باشند.,BeetleLM/beetlelm_fas-fra_balanced,step-8000,fas,8.191771507263184,3611.1136976843886
331,دانشمندان امیدوارند که به چگونگی تشکیل سیارات پی ببرند، بویژه اینکه پس از برخورد ستاره‌های دنباله‌دار در زمان‌های دور، زمین چگونه شکل گرفته است.,BeetleLM/beetlelm_fas-fra_balanced,step-8000,fas,7.112346649169922,1227.023564097473
332,کوئومو، 53 ساله، فرمانداری خودش را در اوایل امسال شروع کرد و اواخر این ماه لایحه‌ای در قانونی کردن ازدواج همجنس‌بازان تصویب کرد.,BeetleLM/beetlelm_fas-fra_balanced,step-8000,fas,7.039000511169434,1140.247372385413
333,او این شایعات را «حماقت و حرف مفت سیاسی» خواند.,BeetleLM/beetlelm_fas-fra_balanced,step-8000,fas,7.321028709411621,1511.758330155934
334,پیش‌بینی می‌شود که او در 2016 برای ریاست جمهوری کاندید شود.,BeetleLM/beetlelm_fas-fra_balanced,step-8000,fas,7.302879333496094,1484.568346902698
335,اداره هوانوردی فدرال (FAA) مدعی است که سیستم NextGen هواپیما را قادر می‌سازد تا در مسیرهای کوتاه‌تر پرواز کرده و هر ساله در میلیون‌ها گالن سوخت صرفه‌جویی کند و آلاینده‌های کربنی را کاهش دهد.,BeetleLM/beetlelm_fas-fra_balanced,step-8000,fas,6.888735294342041,981.1597539223152
336,از فناوری مبتنی بر ماهواره در مقابل فناوری مبتنی بر رادار زمینی استفاده می‌کند که به کنترل کننده‌های ترافیک هوایی امکان می‌دهد هواپیما را با دقت بیشتری ردیابی کند و به خلبانان اطلاعات دقیق‌تری می‌دهد.,BeetleLM/beetlelm_fas-fra_balanced,step-8000,fas,7.738905906677246,2295.9590150157715
