sentence_id,sentence,repo,revision,iso_code,nll,ppl
0,"„Wir haben jetzt 4 Monate alte Mäuse, die Diabetes hatten und jetzt keinen mehr haben“, fügte er hinzu.",BeetleLM/beetlelm_deu-ukr_heritage,step-2000,deu,7.297288417816162,1476.2914098429278
1,"Dr. Ehud Ur, Professor für Medizin an der Dalhousie University in Halifax, Nova Scotia, und Vorsitzender der Abteilung für Klinik und Wissenschaft des Kanadischen Diabetesverbands gab zu bedenken, dass die Forschungsarbeit noch in den Kinderschuhen stecke.",BeetleLM/beetlelm_deu-ukr_heritage,step-2000,deu,7.475305080413818,1763.9397495752194
2,"Wie einige andere Experten zeigte er sich skeptisch, ob es möglich sei, Diabetes zu heilen, und wies darauf hin, dass die Befunde für Menschen, die bereits unter Typ-1-Diabetes litten, keine Bedeutung hätten.",BeetleLM/beetlelm_deu-ukr_heritage,step-2000,deu,7.119105339050293,1235.3447242377501
3,"Am Montag gab Sara Danius, Ständige Sekretärin des Literaturnobelpreiskomitees der Schwedischen Akademie in einer Radiosendung auf Sveriges Radio in Schweden bekannt, dass das Komitee seine Bemühungen eingestellt habe, Bob Dylan über seine Ehrung mit dem Literaturnobelpreis für Literator zu informieren, nachdem es nicht gelungen war, ihn persönlich zu erreichen.",BeetleLM/beetlelm_deu-ukr_heritage,step-2000,deu,7.657133102416992,2115.683278478208
4,Danius sagte: „Im Moment unternehmen wir nichts. Ich habe seinen engsten Mitarbeiter angerufen und ihm E-Mails geschickt und sehr freundliche Antworten erhalten. Das ist vorläufig genug.“,BeetleLM/beetlelm_deu-ukr_heritage,step-2000,deu,7.274196147918701,1442.5910960826316
5,"Rings CEO Jamie Siminoff sagte einmal, dass er das Unternehmen gegründet habe, nachdem er von seiner Garagenwerkstatt aus seine Türklingel nicht hören konnte.",BeetleLM/beetlelm_deu-ukr_heritage,step-2000,deu,7.328838348388672,1523.6108386001938
6,"Er sagte, dass er eine WLAN-Türklingel gebaut habe.",BeetleLM/beetlelm_deu-ukr_heritage,step-2000,deu,5.687570095062256,295.17550010630003
7,"Siminoff sagte, die Verkäufe seien nach seinem Auftritt in einer Folge von „Shark Tank“ im Jahre 2013 stark gestiegen, obwohl die Jury der Sendung die Finanzierung seines Start-ups abgelehnt hatte.",BeetleLM/beetlelm_deu-ukr_heritage,step-2000,deu,7.497585773468018,1803.6826553287804
8,Ende 2017 trat Siminoff im Teleshopping-Sender QVC auf.,BeetleLM/beetlelm_deu-ukr_heritage,step-2000,deu,7.432436943054199,1689.9208002375228
9,Ring hat außerdem eine Rechtsstreitigkeit mit der konkurrierenden Sicherheitsfirma ADT Corporation beigelegt.,BeetleLM/beetlelm_deu-ukr_heritage,step-2000,deu,8.25967025756836,3864.819495368653
10,"Während ein experimenteller Impfstoff in der Lage zu sein scheint, die Ebola-Mortalität zu senken, gibt es bisher keine Medikamente, die als eindeutig zur Behandlung bestehender Infektionen geeignet nachgewiesen wurden.",BeetleLM/beetlelm_deu-ukr_heritage,step-2000,deu,7.3787150382995605,1601.5305396956155
11,"Ein Antikörper-Cocktail, ZMapp, erwies sich zunächst als vielversprechend, formelle Studien zeigten jedoch, dass er, was die Verhinderung von Todesfällen anbelangt, weniger Vorteile brachte als erhofft.",BeetleLM/beetlelm_deu-ukr_heritage,step-2000,deu,7.421699047088623,1671.8716846822704
12,"In der PALM-Studie diente ZMapp als Kontrolle, d.h. die Wissenschaftler verwendeten es als Ausgangsbasis und verglichen die drei anderen Behandlungen damit.",BeetleLM/beetlelm_deu-ukr_heritage,step-2000,deu,7.061068534851074,1165.6900810138084
13,"USA Gymnastics unterstützt den Brief des Olympischen Komitees der Vereinigten Staaten und akzeptiert es als absolute Notwendigkeit, dass sich die olympische Familie für ein sicheres Umfeld für alle unsere Sportler einsetzt.",BeetleLM/beetlelm_deu-ukr_heritage,step-2000,deu,7.625705718994141,2050.226838615717
14,"Wir stimmen mit der Aussage des USOC überein, dass den Interessen unserer Athleten und Vereine und ihres Sports besser gedient ist, wenn wir innerhalb unserer Organisation sinnvolle Veränderungen vorantreiben, anstatt eine Dezertifizierung vorzunehmen.",BeetleLM/beetlelm_deu-ukr_heritage,step-2000,deu,7.695710182189941,2198.894871918782
15,"USA Gymnastics unterstützt eine unabhängige Untersuchung, die ans Licht bringen könnte, wie Missbrauch in dem Ausmaß, das von den Überlebenden von Lary Nassar so mutig beschrieben wurde, so lange unentdeckt bleiben konnte, und heißt alle notwendigen und angemessenen Veränderungen willkommen.",BeetleLM/beetlelm_deu-ukr_heritage,step-2000,deu,7.429266929626465,1684.5722106383773
16,"USA Gymnastics und das USOC haben das gleiche Ziel - den Turnsport und andere Sportarten für die Athleten so sicher wie möglich zu machen, damit sie ihren Träumen in einer sicheren, positiven und selbstbestimmten Umgebung folgen können.",BeetleLM/beetlelm_deu-ukr_heritage,step-2000,deu,7.343900203704834,1546.732938349187
17,Während der 1960er-Jahre arbeitete Brzezinski als Berater für John F. Kennedy sowie anschließend für die Regierung rund um Lyndon B. Johnson.,BeetleLM/beetlelm_deu-ukr_heritage,step-2000,deu,7.369836330413818,1587.3739569435652
18,Während der Wahlen im Jahre 1976 beriet er Carter in der Außenpolitik und diente dann von 1977 bis 1981 in Nachfolge von Henry Kissinger als als nationaler Sicherheitsberater (NSA).,BeetleLM/beetlelm_deu-ukr_heritage,step-2000,deu,7.811714172363281,2469.359717573428
19,"Als nationaler Sicherheitsberater unterstützte er Carter bei der diplomatischen Handhabung von Weltangelegenheiten wie dem Camp-David-Abkommen von 1978, der Normalisierung der Beziehungen zwischen den USA und China Ende der 1970er Jahre, der iranischen Revolution, die zur Geiselkrise im Iran 1979 führte, und der sowjetischen Invasion in Afghanistan 1979.",BeetleLM/beetlelm_deu-ukr_heritage,step-2000,deu,7.4095072746276855,1651.612355031185
20,Der Film mit Ryan Gosling und Emma Stone hat Nominierungen in allen Hauptkategorien erhalten.,BeetleLM/beetlelm_deu-ukr_heritage,step-2000,deu,7.521586894989014,1847.4967524057529
21,Gosling und Stone wurden als bester Schauspieler beziehungsweise beste Schauspielerin nominiert.,BeetleLM/beetlelm_deu-ukr_heritage,step-2000,deu,8.054363250732422,3147.4983784522296
22,"Weitere Nominierungen gibt es zum Beispiel für den besten Film, die Regie, die Kameraführung, das Kostümbild, den Schnitt, die Original-Filmmusik, das Produktionsdesign, den Tonschnitt, die Tonmischung und das Original-Drehbuch.",BeetleLM/beetlelm_deu-ukr_heritage,step-2000,deu,6.67561674118042,792.8362779029268
23,"Zwei Lieder aus dem Kinofilm, Audition (The Fools Who Dream) und City of Stars, bekamen Nominierungen für das beste eigenständige Lied. Lionsgate Studio bekam 26 Nominierungen – mehr als jedes andere Filmstudio.",BeetleLM/beetlelm_deu-ukr_heritage,step-2000,deu,7.6982645988464355,2204.518945661203
24,"Am späten Sonntag kündigte der Präsident der Vereinigten Staaten, Donald Trump, in einer durch den Pressesekretär verlesenen Erklärung an, dass die US-Truppen Syrien verlassen würden.",BeetleLM/beetlelm_deu-ukr_heritage,step-2000,deu,7.699594020843506,2207.4516305965285
25,Die Ankündigung erfolgte nach einem Telefongespräch von Trump mit dem türkischen Präsidenten Recep Tayyip Erdoğan.,BeetleLM/beetlelm_deu-ukr_heritage,step-2000,deu,7.864384651184082,2602.9082359488375
26,"Die Türkei würde die Überwachung gefasster ISIS-Kämpfer durchführen, deren Rückführung, so hieß es in dem Statement, von europäischen Ländern abgelehnt wurde.",BeetleLM/beetlelm_deu-ukr_heritage,step-2000,deu,7.23896598815918,1392.6532062055935
27,"Dies bestätigt nicht nur, dass zumindest einige Dinosaurier Federn hatten, eine Theorie, die bereits weit verbreitet ist, sondern liefert auch Details, die Fossilien im Allgemeinen nicht liefern können, wie etwa Farbe und dreidimensionale Anordnung.",BeetleLM/beetlelm_deu-ukr_heritage,step-2000,deu,7.206060886383057,1347.5735534082578
28,"Wissenschaftler sagen, dass das Gefieder dieses Tieres auf der Oberseite kastanienbraun und auf der Unterseite hell- oder carotinoidfarben war.",BeetleLM/beetlelm_deu-ukr_heritage,step-2000,deu,6.978723526000977,1073.5471370051325
29,Der Fund gewährt auch Einblicke in die Evolution von Federn bei Vögeln.,BeetleLM/beetlelm_deu-ukr_heritage,step-2000,deu,7.942514896392822,2814.4296144251844
30,"Weil die Dinosaurierfedern keinen gut entwickelten Schaft besitzen, der Rachis genannt wird, aber andere Merkmale von Federn besitzen – Widerhaken und Barbules – schlossen die Forscher daraus, dass die Rachis vermutlich eine spätere evolutionäre Entwicklung war als diese anderen Merkmale.",BeetleLM/beetlelm_deu-ukr_heritage,step-2000,deu,7.7481489181518555,2317.2789690407567
31,"Die Struktur der Federn lässt vermuten, dass sie nicht zum Fliegen,, sondern eher zur Temperaturregulierung oder zum Herzeigen verwendet wurden. Die Forscher vermuteten, dass die Probe, obwohl es sich um den Schwanz eines jungen Dinosauriers handelt, das Gefieder eines Ausgewachsenen zeigt und nicht die Daunen eines Kükens.",BeetleLM/beetlelm_deu-ukr_heritage,step-2000,deu,7.314146518707275,1501.3898409139263
32,"Die Forscher behaupteten, dass, obwohl dies der Schwanz eines jungen Dinosauriers ist, die Probe das Gefieder eines Erwachsenen und keine Kükendaunen zeigt.",BeetleLM/beetlelm_deu-ukr_heritage,step-2000,deu,7.3022541999816895,1483.6405834928394
33,"Eine Autobombe detonierte am Morgen des gestrigen Tages im Polizeipräsidium des türkischen Gaziantep, tötete zwei Polizisten und verwundete über zwanzig weitere Menschen.",BeetleLM/beetlelm_deu-ukr_heritage,step-2000,deu,8.048111915588379,3127.8836841143775
34,Nach Angaben des Gouverneursbüros handelt es sich bei neunzehn der Verletzten um Polizeibeamte.,BeetleLM/beetlelm_deu-ukr_heritage,step-2000,deu,7.801236629486084,2443.6219649116274
35,"Die Polizei sagte, dass sie einen militanten Anhänger von Daesh (ISIL) hinter dem Angriff vermuten.",BeetleLM/beetlelm_deu-ukr_heritage,step-2000,deu,6.809800148010254,906.6895851217355
36,"Sie haben herausgefunden, dass die Sonne auf Basis derselben Grundprinzipien funktioniert, wie andere Sterne: Es wurde herausgefunden, dass die Aktivität aller Sterne im System durch ihre Leuchtkraft, Rotation und sonst nichts angetrieben wird.",BeetleLM/beetlelm_deu-ukr_heritage,step-2000,deu,7.396455764770508,1630.1963795093882
37,"Um die Rossby-Zahl eines Sterns zu bestimmen, die mit dem Plasmastrom in Zusammenhang steht, werden die Leuchtkraft und die Rotation gemeinsam einbezogen.",BeetleLM/beetlelm_deu-ukr_heritage,step-2000,deu,7.080598831176758,1188.6801241395367
38,"Je kleiner die Rossby-Zahl ist, umso weniger aktiv ist der Stern in Bezug auf Umpolungen des Magnetfelds.",BeetleLM/beetlelm_deu-ukr_heritage,step-2000,deu,7.520847797393799,1846.131776486229
39,Während der Reise geriet Iwasaki bei vielen Gelegenheiten in Schwierigkeiten.,BeetleLM/beetlelm_deu-ukr_heritage,step-2000,deu,7.447249889373779,1715.139829262009
40,"Er wurde von Piraten ausgeraubt, in Tibet von einem tollwütigen Hund angegriffen, konnte einer Heirat in Nepal entfliehen und wurde in Indien verhaftet.",BeetleLM/beetlelm_deu-ukr_heritage,step-2000,deu,7.645927906036377,2092.108955978706
41,"Der 802.11n-Standard läuft auf den Frequenzen 2,4 Ghz sowie 5,0 Ghz.",BeetleLM/beetlelm_deu-ukr_heritage,step-2000,deu,7.15140438079834,1275.8965421506382
42,"Dadurch kann er abwärtskompatibel mit 802.11a, 802.11b und 802.11g sein, vorausgesetzt, die Basisstation verfügt über Dual-Radio.",BeetleLM/beetlelm_deu-ukr_heritage,step-2000,deu,7.223899841308594,1371.8285560198722
43,"Die Geschwindigkeit von 802,11 n ist wesentlich schneller als die der Vorgänger, die einen maximalen theoretischen Durchsatz von 600 Mbit/s hatten.",BeetleLM/beetlelm_deu-ukr_heritage,step-2000,deu,7.409271240234375,1651.222563714869
44,"Duvall, verheiratet und zwei erwachsene Kinder, hat keinen großen Eindruck auf Miller gemacht, dem die Geschichte erzählt wurde.",BeetleLM/beetlelm_deu-ukr_heritage,step-2000,deu,6.9202775955200195,1012.6010490381552
45,"""Als er nach einem Kommentar gefragt wurde, sagte Miller: """"Mike spricht sehr viel während der Anhörung ... ich habe mich vorbereitet und konnte daher nicht richtig hören, was er sagte.""""""",BeetleLM/beetlelm_deu-ukr_heritage,step-2000,deu,6.642392158508301,766.9274123621861
46,"„Wir werden uns bemühen, die Kohlendioxidemissionen pro BIP-Einheit bis 2020 gegenüber dem Niveau von 2005 deutlich zu senken“, sagte Hu.",BeetleLM/beetlelm_deu-ukr_heritage,step-2000,deu,7.6134538650512695,2025.2610099788667
47,"Er nannte keine Zahl für die Kürzungen, sondern sagte, sie würden auf der Grundlage der Wirtschaftsleistung Chinas vorgenommen.",BeetleLM/beetlelm_deu-ukr_heritage,step-2000,deu,7.053051471710205,1156.382031496853
48,"Hu ermutigte Entwicklungsländer „den alten Weg von erst verschmutzen und hinterher aufzuräumen, zu vermeiden“.",BeetleLM/beetlelm_deu-ukr_heritage,step-2000,deu,8.283577919006348,3958.3316659713287
49,"Er fügte hinzu, dass „sie jedoch nicht dazu aufgefordert werden sollten, Verpflichtungen einzugehen, die über ihren Entwicklungsstand, ihre Verantwortung und ihre Fähigkeiten hinausgehen“.",BeetleLM/beetlelm_deu-ukr_heritage,step-2000,deu,7.802773952484131,2447.3814902187505
50,Die Studiengruppe zum Irak stellte heute um 12:00 Uhr GMT ihren Bericht vor.,BeetleLM/beetlelm_deu-ukr_heritage,step-2000,deu,7.535289764404297,1872.9870050965499
51,"Er warnt davor, dass niemand garantieren kann, dass irgendeine Vorgehensweise im Irak zu diesem Zeitpunkt die sektiererische Kriegsführung, die wachsende Gewalt oder ein Abgleiten ins Chaos stoppen wird.",BeetleLM/beetlelm_deu-ukr_heritage,step-2000,deu,7.565907001495361,1931.219604004426
52,Der Bericht fängt an mit der Bitte um einen offenen Diskurs und um Konsensbildung in den USA über eine Strategie für den Mittleren Osten.,BeetleLM/beetlelm_deu-ukr_heritage,step-2000,deu,7.354865074157715,1563.7859860179592
53,Der Bericht steht fast jedem Aspekt der gegenwärtigen Politik der Exekutive im Hinblick auf den Irak äußerst kritisch gegenüber und drängt auf einen sofortigen Richtungswechsel.,BeetleLM/beetlelm_deu-ukr_heritage,step-2000,deu,8.25676441192627,3853.6052278368384
54,"Die erste der 78 Empfehlungen ist, dass eine neue diplomatische Initiative vor Ende dieses Jahres ergriffen werden sollte, um die irakischen Grenzen gegenüber feindlichen Interventionen zu sichern und diplomatische Beziehungen mit seinen Nachbarn wiederherzustellen.",BeetleLM/beetlelm_deu-ukr_heritage,step-2000,deu,8.029102325439453,3068.9854861800304
55,"Die derzeitige Senatorin und argentinische First Lady Cristina Fernandez de Kirchner gab gestern Abend in La Plata, einer Stadt 50 Kilometer von Buenos Aires entfernt, ihre Präsidentschaftskandidatur bekannt.",BeetleLM/beetlelm_deu-ukr_heritage,step-2000,deu,7.812290668487549,2470.783704302008
56,"Frau Kirchner kündigte ihre Absicht, als Präsidentin zu kandidieren, im Argentinischen Theater an. Dort begann sie 2005 auch ihre Kampagne für den Senat als Mitglied der Delegation der Provinz Buenos Aires.",BeetleLM/beetlelm_deu-ukr_heritage,step-2000,deu,7.534498691558838,1871.505921836533
57,"""Auslöser der Debatte war eine Kontroverse über die Ausgaben für die Nothilfe und den Wiederaufbau nach dem Hurrikan Katrina, die einige fiskalisch Konservative humorvoll als """"Bushs New Orleans-Deal"""" bezeichnet haben. """,BeetleLM/beetlelm_deu-ukr_heritage,step-2000,deu,7.439668655395508,1702.1861175136864
58,"Die Kritik der Liberalen am Wiederaufbauprozess hat sich darauf konzentriert, dass Aufträge für den Wiederaufbau an vermeintliche Insider in Washingtoner vergeben wurden.",BeetleLM/beetlelm_deu-ukr_heritage,step-2000,deu,7.811619758605957,2469.126587049844
59,"Es kamen mehr als vier Millionen Menschen nach Rom, um an der Beerdigung teilzunehmen.",BeetleLM/beetlelm_deu-ukr_heritage,step-2000,deu,7.02754545211792,1127.2602972691866
60,"Die Teilnehmerzahl war so groß, dass es nicht allen möglich war, Zugang zur Bestattung auf dem Petersplatz zu erhalten.",BeetleLM/beetlelm_deu-ukr_heritage,step-2000,deu,6.925467491149902,1017.8700036329762
61,"Mehrere große Fernsehschirme wurden an verschiedenen Orten in Rom aufgestellt, so dass die Leute die Zeremonie ansehen konnten.",BeetleLM/beetlelm_deu-ukr_heritage,step-2000,deu,7.682625770568848,2170.311035443418
62,"In vielen anderen Städten in Italien und dem Rest der Welt, besonders in Polen, wurden ähnliche Einrichtungen installiert, die von zahlreichen Menschen gesehen wurden.",BeetleLM/beetlelm_deu-ukr_heritage,step-2000,deu,6.962813854217529,1056.602503603262
63,"Historiker haben die Politik des FBI aus früherer Zeit kritisiert, seine Ressourcen in der Absicht, die Erfolgsquote der Behörde zu steigern, auf einfach zu lösende Fälle, insbesondere auf Fälle von Autodiebstahl, zu konzentrieren.",BeetleLM/beetlelm_deu-ukr_heritage,step-2000,deu,7.48944091796875,1789.0515855927129
64,"Der Kongress begann im August 2005 mit der Finanzierung der anti-Obszönitätsinitiative und legte fest, dass das FBI 10 Agenten für die Erwachsenenpornographie einsetzen muss.",BeetleLM/beetlelm_deu-ukr_heritage,step-2000,deu,7.437390327453613,1698.3123938019723
65,"Robin Uthappa erreichte die höchste Punktzahl der Innings, 70 Punkte bei nur 41 Bällen, indem er 11 Vierer und 2 Sechser schlug.",BeetleLM/beetlelm_deu-ukr_heritage,step-2000,deu,7.89396858215332,2681.0628538792125
66,"Die Schlagmänner der mittleren Reihe, Sachin Tendulkar und Rahul Dravid, zeigten gute Leistungen und erzielten eine Partnerschaft mit 100 Runs.",BeetleLM/beetlelm_deu-ukr_heritage,step-2000,deu,8.08220100402832,3236.348619627735
67,"Doch nach dem Verlust des Tors des Kapitäns erzielte Indien nur 36 Runden und verlor 7 Tore, womit die Innings beendet waren.",BeetleLM/beetlelm_deu-ukr_heritage,step-2000,deu,7.706182956695557,2222.0444104378735
68,Der US-amerikanische Präsident George W. Bush traf am 16. November morgens in Singapur ein und begann eine einwöchige Reise durch Asien.,BeetleLM/beetlelm_deu-ukr_heritage,step-2000,deu,7.497217655181885,1803.0188089554642
69,"Er wurde von Wong Kan Seng, dem stellvertretenden Premierminister Singapurs, begrüßt und sprach mit Lee Hsien Loong, dem Premierminister Singapurs, über Handels- und Terrorismusangelegenheiten.",BeetleLM/beetlelm_deu-ukr_heritage,step-2000,deu,7.419311046600342,1667.884017453538
70,Nach einer Woche voller Verluste in der Zwischenwahl erzählte Bush dem Publikum von der Ausweitung des Handels in Asien.,BeetleLM/beetlelm_deu-ukr_heritage,step-2000,deu,7.421804428100586,1672.0478774957999
71,"""Premierminister Stephen Harper hat nach einem 25-minütigen Treffen mit NDP-Leader Jack Layton am Dienstag im PMO zugestimmt, den """"Clean Air Act"""" der Regierung an ein Komitee aller Parteien zur Prüfung vor der zweiten Anhörung zu schicken.""",BeetleLM/beetlelm_deu-ukr_heritage,step-2000,deu,7.610684871673584,2019.6608326593039
72,Layton hatte während des Treffens mit dem Premierminister Änderungen am Umweltgesetz der Konservativen gefordert und dabei eine „gründliche und vollständige Neufassung“ des Umweltgesetzes der Konservativen Partei verlangt.,BeetleLM/beetlelm_deu-ukr_heritage,step-2000,deu,8.153419494628906,3475.2423432392998
73,"Nachdem die Bundesregierung eingesprungen ist, um die Finanzierung des Mersey-Krankenhauses in Devonport (Tasmanien) zu übernehmen, haben die Landesregierung und einige Parlamentsmitglieder den Vorgang als PR-Gag im Vorfeld der für November anberaumten Bundeswahl kritisiert.",BeetleLM/beetlelm_deu-ukr_heritage,step-2000,deu,7.695816516876221,2199.128703147114
74,"Premierminister John Howard sagte jedoch, die Maßnahme, 45 Millionen australische Dollar bereitzustellen, diene nur dazu, die Krankenhauseinrichtungen vor einer Herabstufung durch die tasmanische Regierung zu bewahren.",BeetleLM/beetlelm_deu-ukr_heritage,step-2000,deu,7.713343620300293,2238.012826973568
75,"Laut dem aktuellen Bulletin deuteten die Messungen des Meeresspiegels darauf hin, dass ein Tsunami ausgelöst wurde. In der Nähe von Pago Pago und Niue wurde eine eindeutige Tsunami-Aktivität aufgezeichnet.",BeetleLM/beetlelm_deu-ukr_heritage,step-2000,deu,7.4250311851501465,1677.451883790558
76,"Es wurden keine nennenswerten Schäden oder Verletzungen aus Tonga vermeldet. Doch der Strom fiel zeitweise aus, was Berichten zufolge der Grund dafür war, dass die tongaischen Behörden die Tsunami-Warnung des PTWC nicht erhalten hatten.",BeetleLM/beetlelm_deu-ukr_heritage,step-2000,deu,7.4145307540893555,1659.930070219338
77,"Vierzehn Schulen in Hawaii, die an oder in der Nähe von Küsten liegen, waren den ganzen Mittwoch geschlossen, obwohl die Warnungen aufgehoben worden waren.",BeetleLM/beetlelm_deu-ukr_heritage,step-2000,deu,7.109930515289307,1224.0624895087515
78,U.S.-Präsident George W. Bush begrüßte die Bekanntgabe.,BeetleLM/beetlelm_deu-ukr_heritage,step-2000,deu,7.814743995666504,2476.8527867955518
79,"""Bush-Sprecher Gordon Johndroe nannte das Versprechen Nordkoreas „einen wichtigen Schritt in Richtung des Ziels, die verifizierbare Entnuklearisierung der koreanischen Halbinsel zu erreichen.""""""",BeetleLM/beetlelm_deu-ukr_heritage,step-2000,deu,7.7911882400512695,2419.190454015436
80,"Der zehnte Sturm der atlantischen Hurrikan-Saison, der einen Namen erhielt, der subtropische Sturm Jerry, ist heute im Atlantischen Ozean entstanden.",BeetleLM/beetlelm_deu-ukr_heritage,step-2000,deu,7.419172763824463,1667.6533937677698
81,"Das National Hurricane Center (NHC) sagt, dass Jerry zu diesem Zeitpunkt keine Gefahr für die Landung darstellt.",BeetleLM/beetlelm_deu-ukr_heritage,step-2000,deu,7.2200822830200195,1366.6015041810165
82,"Der US-amerikanische Ingenieurskorps schätzte , dass 6 Zoll Regen die schon zuvor beschädigten Dämme brechen lassen könnten.",BeetleLM/beetlelm_deu-ukr_heritage,step-2000,deu,8.26186752319336,3873.3208668579578
83,"Der Ninth Ward, der während des Hurrikans Katrina bis zu 20 Fuß hoch überflutet war, führt derzeit hüfthohes Wasser, da der nahe gelegene Deich überspült wurde.",BeetleLM/beetlelm_deu-ukr_heritage,step-2000,deu,7.51637077331543,1837.8850741879974
84,Auf einem 100 Fuß langen Teilabschnitt läuft Wasser über den Damm.,BeetleLM/beetlelm_deu-ukr_heritage,step-2000,deu,7.724754810333252,2263.6974841799356
85,"Der Commons-Administrator Adam Cuerden hat seine Enttäuschung über die Entfernungen zum Ausdruck gebracht, als er im letzten Monat mit Wikinews redete.",BeetleLM/beetlelm_deu-ukr_heritage,step-2000,deu,7.865455627441406,2605.697382157623
86,"""""""Er [Wales] hat uns im Grunde von Anfang an belogen. Erstens, indem er so tat, als ob dies aus rechtlichen Gründen geschah. Zweitens, indem er so tat, als würde er uns zuhören, bis hin zu seiner Kunstlöschung.""""""",BeetleLM/beetlelm_deu-ukr_heritage,step-2000,deu,7.020030975341797,1118.8212730810972
87,"Die Irritationen in der Community führten zu den derzeitigen Bemühungen, eine Richtlinie bezüglich sexueller Inhalte für die Website zu entwerfen, die Millionen offen lizenzierter Medien hostet.",BeetleLM/beetlelm_deu-ukr_heritage,step-2000,deu,7.832655906677246,2521.617668947614
88,"Die Arbeit war größtenteils theoretischer Natur, doch das Programm wurde geschrieben, um Beobachtungen zu simulieren, die von der Sagittarius-Galaxie gemacht wurden.",BeetleLM/beetlelm_deu-ukr_heritage,step-2000,deu,7.243752479553223,1399.3351074662864
89,"Der Effekt, nach dem das Team suchte, würde von Gezeitenkräften zwischen der dunklen Materie der Galaxie und der dunklen Materie der Milchstraße verursacht werden.",BeetleLM/beetlelm_deu-ukr_heritage,step-2000,deu,7.384212970733643,1610.3598957549132
90,"Genau wie der Mond die Erde anzieht und die Gezeiten verursacht, übt auch die Milchstraße Anziehungskräfte auf die Sagittarius-Galaxie aus.",BeetleLM/beetlelm_deu-ukr_heritage,step-2000,deu,7.273382663726807,1441.4180482232348
91,"Die Wissenschaftler kamen zu dem Schluss, dass die dunkle Materie auf andere dunkle Materie in der gleichen Weise wirkt wie normale Materie.",BeetleLM/beetlelm_deu-ukr_heritage,step-2000,deu,7.33552360534668,1533.8306916694887
92,"Diese Theorie besagt, dass sich der größte Teil der dunklen Materie in einer Art Halo um eine Galaxie befindet und aus vielen kleinen Partikeln besteht.",BeetleLM/beetlelm_deu-ukr_heritage,step-2000,deu,7.216306209564209,1361.4508472659872
93,"Fernsehberichte zeigen, dass weißer Rauch aus der Anlage entweicht.",BeetleLM/beetlelm_deu-ukr_heritage,step-2000,deu,6.94157600402832,1034.3991482450544
94,"Die lokalen Behörden ermahnen die Einwohner in der Nähe der Anlage dazu, sich innerhalb von Gebäuden aufzuhaltem, Klimaanlagen auszuschalten und kein Leitungswasser zu trinken.",BeetleLM/beetlelm_deu-ukr_heritage,step-2000,deu,7.722239971160889,2258.011801357833
95,Der Nuklearbehörde von Japan zufolge wurden radioaktives Cäsium und Jod im Atomkraftwerk festgestellt.,BeetleLM/beetlelm_deu-ukr_heritage,step-2000,deu,8.161399841308594,3503.086938922033
96,"Die Behörden spekulieren, dass dies darauf hindeutet, dass Behälter mit Uran-Kraftstoff am Standort gerissen sein könnten und eventuell undicht sind.",BeetleLM/beetlelm_deu-ukr_heritage,step-2000,deu,7.717035293579102,2246.2901082330186
97,Die extrem-arzneimittelresistente Tuberkulose (XDR-TB) wurde von Dr. Tony Moll in der südafrikanischen Region KwaZulu-Natal entdeckt.,BeetleLM/beetlelm_deu-ukr_heritage,step-2000,deu,7.382668972015381,1607.8754206466872
98,"""In einem Interview sagte er, die neue Variante sei „äußerst beunruhigend und alarmierend aufgrund der sehr hohen Sterblichkeitsrate.""""""",BeetleLM/beetlelm_deu-ukr_heritage,step-2000,deu,7.761260986328125,2347.8633630083714
