sentence_id,sentence,repo,revision,iso_code,nll,ppl
424,"In 1624 vestigde de Nederlandse VOC zich in het zuidwesten van Taiwan als uitvalsbasis, waar de VOC de inheemse graanproductieprocessen aanpakte en Chinese arbeiders aan het werk zette op rijst- en suikerplantages.",BeetleLM/beetlelm_nld_L1-eng_L2_balanced,step-30000,nld,5.193156719207764,180.03597989266012
425,"In het jaar 1683 werden de westelijke en noordelijke kustgebieden van Taiwan veroverd door manschappen van de Qing-dynastie (1644-1912), waarna Taiwan in het jaar 1885 werd ingelijfd als provincie van het Qing-keizerrijk.",BeetleLM/beetlelm_nld_L1-eng_L2_balanced,step-30000,nld,4.987194538116455,146.5247766600195
426,"Na de nederlaag in de Eerste Sino-Japanse Oorlog (1894-1895) ondertekent de Qing-regering in 1895 het Verdrag van Shimonoseki, waarin de soevereiniteit over Taiwan wordt overgedragen aan Japan, dat het eiland tot 1945 regeert.",BeetleLM/beetlelm_nld_L1-eng_L2_balanced,step-30000,nld,4.825497627258301,124.64848143429082
427,"Opgebouwd uit drie grote constructies, bestaat de Machu Picchu uit Intihuatana, de Tempel van de Zon en de Kamer met Drie Ramen.",BeetleLM/beetlelm_nld_L1-eng_L2_balanced,step-30000,nld,5.709434986114502,301.70055511327075
428,Het grootste gedeelte van de gebouwen aan de randen van het complex is opnieuw gebouwd zodat toeristen een beter beeld krijgen van hoe ze er voorheen uitzagen.,BeetleLM/beetlelm_nld_L1-eng_L2_balanced,step-30000,nld,5.480660438537598,240.00516370249437
429,In 1976 was dertig procent van Machu Picchu hersteld. De renovatie is nog steeds aan de gang.,BeetleLM/beetlelm_nld_L1-eng_L2_balanced,step-30000,nld,4.648815155029297,104.46114196517071
430,"Bijvoorbeeld, wereldwijd is het meest voorkomende fotoformaat voor stilstaande beelden 35 mm, wat het gebruikelijke filmformaat was in de afloop van het analoge filmtijdperk.",BeetleLM/beetlelm_nld_L1-eng_L2_balanced,step-30000,nld,6.01594877243042,409.9145701217059
431,"Deze worden tot op de dag van vandaag geproduceerd, al is het vooral de verhouding van het beeld die de beeldsensor van de digitale camera overnam.",BeetleLM/beetlelm_nld_L1-eng_L2_balanced,step-30000,nld,4.7441816329956055,114.91372541111
432,"Vreemd genoeg is 35 mm-film eigenlijk 36 mm breed, bij een hoogte van 24 mm.",BeetleLM/beetlelm_nld_L1-eng_L2_balanced,step-30000,nld,5.915337562561035,370.6794090781854
433,De beeldverhouding van deze grootte (delen door twaalf om de simpelste verhouding van gehele getallen te krijgen) zou in dat geval 3:2 zijn.,BeetleLM/beetlelm_nld_L1-eng_L2_balanced,step-30000,nld,6.221703052520752,503.56009145793183
434,Veel gangbare indelingen (bijvoorbeeld APS-achtige indelingen) zijn gelijk aan of een dichte benadering van deze beeldverhouding.,BeetleLM/beetlelm_nld_L1-eng_L2_balanced,step-30000,nld,6.745327472686768,850.077458251113
435,"De regel van derden, waar veel misbruik van wordt gemaakt en die door velen belachelijk wordt gevonden, is een eenvoudige richtlijn waardoor de afbeelding dynamisch, en toch ook overzichtelijk is.",BeetleLM/beetlelm_nld_L1-eng_L2_balanced,step-30000,nld,5.621297836303711,276.247674943855
436,De meest effectieve plek voor het hoofdonderwerp ligt op het snijpunt van de lijnen. Zo deel je de afbeelding verticaal en horizontaal in drieën (zie voorbeeld).,BeetleLM/beetlelm_nld_L1-eng_L2_balanced,step-30000,nld,4.754579067230225,116.114766365875
437,In deze periode in de geschiedenis van Europa lag de rijke en machtige katholieke kerk onder vuur.,BeetleLM/beetlelm_nld_L1-eng_L2_balanced,step-30000,nld,3.8220081329345703,45.69587964683114
438,"Al meer dan duizend jaar verbond het christendom Europese staten, ondanks taalverschillen en verschillen in gewoonten.",BeetleLM/beetlelm_nld_L1-eng_L2_balanced,step-30000,nld,4.840813159942627,126.57223336485478
439,"Van de koning tot de gewone burger, zijn allesdoordringende macht had invloed op iedereen.",BeetleLM/beetlelm_nld_L1-eng_L2_balanced,step-30000,nld,6.319400787353516,555.2401858092132
440,Een van de belangrijkste principes van het christendom is dat welvaart moet worden gebruikt om lijden en armoede te bestrijden en de kerk beschikt om deze reden over geldmiddelen.,BeetleLM/beetlelm_nld_L1-eng_L2_balanced,step-30000,nld,4.389883518218994,80.63102638789668
441,De kerk was al meer dan duizend jaar de centrale autoriteit in Rome en deze verhouding van macht en geld leidde ertoe dat veel mensen begonnen te twijfelen of dit principe werd nageleefd.,BeetleLM/beetlelm_nld_L1-eng_L2_balanced,step-30000,nld,5.89422082901001,362.9339381044811
442,"Groot-Brittannië stelde een blokkade op zee in gericht tegen Duitsland, vlak na het uitbreken van de vijandelijkheden.",BeetleLM/beetlelm_nld_L1-eng_L2_balanced,step-30000,nld,4.754471778869629,116.10230927121323
443,"De strategie bleek effectief, want het was niet meer mogelijk om vitale voorzieningen aan militairen en burgers te leveren. Deze blokkade schond echter wel de algemeen aanvaarde internationale wet die in de afgelopen twee eeuwen werd vastgelegd in verschillende internationale overeenkomsten.",BeetleLM/beetlelm_nld_L1-eng_L2_balanced,step-30000,nld,5.231740474700928,187.1181947544749
444,"Groot-Brittannië heeft mijnen geplaatst in internationale wateren, zodat er in hele delen van de oceaan geen schepen meer konden varen, wat zelfs voor neutrale schepen gevaarlijk was.",BeetleLM/beetlelm_nld_L1-eng_L2_balanced,step-30000,nld,4.953352451324463,141.6490403312912
445,"Vanwege de beperkte reactie op deze tactiek, verwachtte Duitsland dat er een vergelijkbare reactie zou komen op de ongeremde onderzeese oorlogsvoering van het land.",BeetleLM/beetlelm_nld_L1-eng_L2_balanced,step-30000,nld,5.328197479248047,206.06620058934527
446,Tijdens de jaren 20 hadden de meeste burgers en naties een houding van pacifisme en isolement.,BeetleLM/beetlelm_nld_L1-eng_L2_balanced,step-30000,nld,5.575588226318359,263.9047457059869
447,Na de Eerste Wereldoorlog wilden staten voorkomen dat er ooit nog zulke verschrikkingen zouden plaatsvinden.,BeetleLM/beetlelm_nld_L1-eng_L2_balanced,step-30000,nld,5.4665632247924805,236.64549622423596
448,Tesla emigreerde in 1884 naar de Verenigde Staten van Amerika om te gaan werken bij de Edison Company in New York City.,BeetleLM/beetlelm_nld_L1-eng_L2_balanced,step-30000,nld,4.291297435760498,73.06119924542142
449,"Toen hij naar de Verenigde Staten kwam, had hij alleen 4 cent, een dichtbundel en een aanbevelingsbrief van Charles Batchelor (zijn vorige baas) voor Thomas Edison bij zich.",BeetleLM/beetlelm_nld_L1-eng_L2_balanced,step-30000,nld,5.343589782714844,209.26257072507443
450,Het oude China had een unieke manier om verschillende tijdsperiodes weer te geven; iedere fase van China of iedere regerende familie had een onderscheidende dynastie.,BeetleLM/beetlelm_nld_L1-eng_L2_balanced,step-30000,nld,6.325221538543701,558.4815251448134
451,"Ook tussen de verschillende dynastieën was er een onstabiele periode waarin de provincies verdeeld waren. De bekendste was het tijdperk van de Drie Koninkrijken, dit heeft plaatsgevonden in de 60 jaar tussen de Han- en de Jin-dynastie in.",BeetleLM/beetlelm_nld_L1-eng_L2_balanced,step-30000,nld,5.007403373718262,149.5159944982219
452,Er vonden in die tijd hevige oorlogen plaats tussen verschillende edelen die om de troon vochten.,BeetleLM/beetlelm_nld_L1-eng_L2_balanced,step-30000,nld,5.513691425323486,248.06515298810044
453,In de geschiedenis van het oude China staat het tijdperk van de Drie Koninkrijken als een van de bloederigste te boek. Duizenden mensen stierven in de strijd om de hoogste plek in het grote paleis in Xi'an.,BeetleLM/beetlelm_nld_L1-eng_L2_balanced,step-30000,nld,4.875477313995361,131.0366839293831
454,"De Revolutie heeft grote sociale en politieke gevolgen gehad, zoals het gebruik van het metrieke stelsel, een verschuiving van de absolute monarchie naar republicanisme, nationalisme en de opvatting dat het land aan zijn inwoners toebehoort in plaats van een enkele leider.",BeetleLM/beetlelm_nld_L1-eng_L2_balanced,step-30000,nld,4.7879743576049805,120.05792775602463
455,"Voor alle mannelijke sollicitanten waren na de revolutie functies te verkrijgen, zodat de meest ambitieuze en geschikte kandidaten konden slagen.",BeetleLM/beetlelm_nld_L1-eng_L2_balanced,step-30000,nld,5.501796722412109,245.13197093827765
456,Hetzelfde geldt voor het leger. De legerrangen worden niet meer gebaseerd op iemands klasse maar op het kaliber van de persoon.,BeetleLM/beetlelm_nld_L1-eng_L2_balanced,step-30000,nld,5.712497711181641,302.62599743046815
457,De Franse Revolutie inspireerde ook in andere landen de onderdrukte arbeidersklasse tot een revolutie.,BeetleLM/beetlelm_nld_L1-eng_L2_balanced,step-30000,nld,5.019534111022949,151.34077936616663
458,Mohammed hield zich intensief bezig met bovenaardse kwesties. Hij ging vaak voor bezinning naar een grot die later bekend werd als de Grot van Hira in het Gebergte van Noer.,BeetleLM/beetlelm_nld_L1-eng_L2_balanced,step-30000,nld,6.118221282958984,454.0563380478857
459,"De grot zelf, die de tand des tijds heeft doorstaan, geeft een zeer levendig beeld van de spiritualiteit van Mohammed.",BeetleLM/beetlelm_nld_L1-eng_L2_balanced,step-30000,nld,6.229940891265869,507.72547159890763
460,De grot bevindt zich op een van bergtoppen aan de noordzijde van Mekka en is compleet afgesloten van de rest van de wereld.,BeetleLM/beetlelm_nld_L1-eng_L2_balanced,step-30000,nld,4.959657192230225,142.54492201348597
461,"Zelfs als bekend was dat de grot bestond, was deze helemaal niet makkelijk te vinden. Eenmaal binnen in de grot heerst totale isolatie.",BeetleLM/beetlelm_nld_L1-eng_L2_balanced,step-30000,nld,5.763579368591309,318.48627090084864
462,"Het enige wat te zien is, zijn de heldere, prachtige lucht en de vele omringende bergen. Er is vanuit de grot heel weinig van deze wereld te zien of te horen.",BeetleLM/beetlelm_nld_L1-eng_L2_balanced,step-30000,nld,4.678460597991943,107.60429873430152
463,De Grote Piramide van Gizeh staat als enige van de zeven wereldwonderen nog overeind.,BeetleLM/beetlelm_nld_L1-eng_L2_balanced,step-30000,nld,7.2126569747924805,1356.4916476394387
464,De Grote Piramide is in de derde eeuw voor Christus door de Egyptenaren gebouwd en behoort tot de talloze grote piramidestructuren ter ere van een overleden farao.,BeetleLM/beetlelm_nld_L1-eng_L2_balanced,step-30000,nld,5.717704772949219,304.20589944553296
465,"Het Plateau van Gizeh of 'piramides van Gizeh' in de Egyptische vallei van de doden bevat verschillende piramides (waarvan de Grote Piramide de grootste is), meerdere kleine tombes, een aantal tempels en de grote sfinx.",BeetleLM/beetlelm_nld_L1-eng_L2_balanced,step-30000,nld,6.773643970489502,874.4927207192704
466,"De grote piramide werd gebouwd om farao Khufu te eren. Veel van de kleinere piramides, tombes en tempels werden gebouwd als eerbetoon aan de vrouwen en familieleden van Khufu.",BeetleLM/beetlelm_nld_L1-eng_L2_balanced,step-30000,nld,6.297767162322998,543.3573259364485
467,Het up-bow teken ziet eruit als een V en het down-bow teken ziet eruit als een nietje of een vierkantje waarvan de onderkant ontbreekt.,BeetleLM/beetlelm_nld_L1-eng_L2_balanced,step-30000,nld,6.4259819984436035,617.6870875746419
468,Boven betekent dat je bij de punt moet beginnen en de strijkstok moet wegduwen. Onder betekent dat je bij de boogkikker moet beginnen (de plek waar je hand de strijkstok vasthoudt) en de strijkstok moet aantrekken.,BeetleLM/beetlelm_nld_L1-eng_L2_balanced,step-30000,nld,4.910077095031738,135.64987193653053
469,"Een opwaartse beweging geeft meestal een zachter geluid, terwijl een neerwaartse beweging juist een sterker en assertiever geluid produceert.",BeetleLM/beetlelm_nld_L1-eng_L2_balanced,step-30000,nld,6.479626655578613,651.7275819876512
470,"Neem de vrijheid om je persoonlijke tekens te schetsen, maar vergeet daarbij niet dat de gedrukte strijktekens er om een muzikale reden zijn, waardoor ze dus meestal moeten worden gerespecteerd.",BeetleLM/beetlelm_nld_L1-eng_L2_balanced,step-30000,nld,5.399153232574463,221.21901581660975
471,"Een groep marktvrouwen zat op 6 oktober 1789 achter het vertrek van de doodsbange Louis XVI, Marie Antoinette en hun twee jonge kinderen (Marie Therese van 11 en Louis-Charles van 4), en de zus van de koning, Madame Elizabeth, uit Versailles naar Parijs.",BeetleLM/beetlelm_nld_L1-eng_L2_balanced,step-30000,nld,5.530378818511963,252.23944589873435
472,"Zij reden terug naar de Franse hoofdstad in een rijtuig, omgeven door joelende en dreigende meutes die het Koningspaar bedreigden.",BeetleLM/beetlelm_nld_L1-eng_L2_balanced,step-30000,nld,7.441273212432861,1704.9195646268674
473,Door de acties van de menigte mensen werden de koning en koningin gedwongen om de ramen van hun koets helemaal te openen.,BeetleLM/beetlelm_nld_L1-eng_L2_balanced,step-30000,nld,5.41429328918457,224.59376673579575
474,Op een gegeven moment hield iemand in de menigte het hoofd van een koninklijke wacht die vermoord was in Versailles omhoog voor de ogen van een doodsbange koningin.,BeetleLM/beetlelm_nld_L1-eng_L2_balanced,step-30000,nld,5.488024711608887,241.7791513138057
475,De oorlogskosten van het imperialisme van de V.S. met betrekking tot de verovering van de Filippijnen zijn betaald door de bevolking van de Filippijnen.,BeetleLM/beetlelm_nld_L1-eng_L2_balanced,step-30000,nld,3.741302490234375,42.15285811079855
476,Ze werden opgelegd aan het Amerikaanse koloniale regime belasting te betalen om een groot deel van de kosten te financieren en de rente op obligaties werd via de banken op Wall Street uitgegeven in de naam van de Filipijnse overheid.,BeetleLM/beetlelm_nld_L1-eng_L2_balanced,step-30000,nld,5.078973770141602,160.60914942242036
477,Het Amerikaanse imperialisme rustte voor een groot deel op de enorme winst van de langdurige uitbuiting van de Filipijnen.,BeetleLM/beetlelm_nld_L1-eng_L2_balanced,step-30000,nld,4.41453742980957,82.64360359561701
478,Om de Tempeliers te begrijpen moet men weten wat de context was die de aanzet gaf tot het ontstaan van de orde.,BeetleLM/beetlelm_nld_L1-eng_L2_balanced,step-30000,nld,4.556460380554199,95.24574875851329
479,"Het tijdperk waarin dit gebeurd is, wordt algemeen aangeduid als de Hoge Middeleeuwen, de Europese geschiedenis in de 11e, 12e en 13e eeuw (1000-1300 n.Chr.).",BeetleLM/beetlelm_nld_L1-eng_L2_balanced,step-30000,nld,4.6978960037231445,109.71608719713886
480,"Na de vroege middeleeuwen kwamen de hoge middeleeuwen. Deze werden weer opgevolgd door de late middeleeuwen, die gebruikelijk rond 1500 eindigen.",BeetleLM/beetlelm_nld_L1-eng_L2_balanced,step-30000,nld,4.559137344360352,95.50105975731519
481,Technologisch determinisme is een term voor een groot assortiment ideeën in de praktijk: van technologieaanbod of de technologische verplichting tot een strikt gevoel dat het menselijke lot wordt gedreven door een onderliggende logica die is gekoppeld aan wetenschappelijke wetten en de verschijning daarvan in technologie.,BeetleLM/beetlelm_nld_L1-eng_L2_balanced,step-30000,nld,5.563492774963379,260.73192571871317
482,"De meeste interpretaties van technologisch determinisme hebben deze twee algemene opvattingen: de ontwikkeling van de technologie volgt een traject dat voor het grootste deel verder reikt dan culturele of politieke invloed, en dat technologie op zijn beurt 'effecten' heeft op samenlevingen die inherent zijn in plaats van die sociaal geconditioneerd zijn.",BeetleLM/beetlelm_nld_L1-eng_L2_balanced,step-30000,nld,5.440036296844482,230.45054793653847
483,Zo zullen sommigen bijvoorbeeld zeggen dat de komst van de auto automatisch leidt tot de aanleg van wegen.,BeetleLM/beetlelm_nld_L1-eng_L2_balanced,step-30000,nld,5.248039722442627,190.19307158361408
484,"Een landelijk wegennetwerk is echter economisch niet haalbaar voor maar een paar auto's. Daarom worden nieuwe productiemethoden ontwikkeld, zodat de kosten van autobezit kunnen worden verlaagd.",BeetleLM/beetlelm_nld_L1-eng_L2_balanced,step-30000,nld,5.366397857666016,214.09029336930897
485,Het massale autobezit zorgt ook voor een groter aantal ongevallen op de weg en dit leidt tot de ontwikkeling van nieuwe technieken op het gebied van gezondheidszorg om het menselijk lichaam te kunnen herstellen.,BeetleLM/beetlelm_nld_L1-eng_L2_balanced,step-30000,nld,4.905066967010498,134.97194837205464
486,"In de romantiek was een groot onderdeel van cultureel determinisme opgenomen, dat was afkomstig van schrijvers zoals Goethe, Fichte en Schlegel.",BeetleLM/beetlelm_nld_L1-eng_L2_balanced,step-30000,nld,5.628952980041504,278.37050552269125
487,In de Romantiek vormde de geografie het individu en na verloop van tijd ontstonden er gewoonten en culturen naar aanleiding van deze geografie. Deze vormden een harmonieuze samenleving en waren beter dan de arbitraire opgelegde wetten.,BeetleLM/beetlelm_nld_L1-eng_L2_balanced,step-30000,nld,5.387750625610352,218.71086920685883
488,"Constantinopel werd als modehoofdstad van het feodale Europa gezien, zoals Parijs de huidige modehoofdstad is.",BeetleLM/beetlelm_nld_L1-eng_L2_balanced,step-30000,nld,5.69300651550293,296.7845680506419
489,Het stond vanaf ongeveer 400 na Christus tot ongeveer 1100 na Christus bekend als een epicentrum van luxe.,BeetleLM/beetlelm_nld_L1-eng_L2_balanced,step-30000,nld,4.368085861206055,78.89247593042678
490,"De status van het rijk nam in de 12e eeuw af, voornamelijk doordat de kruisvaarders terugkwamen met zijde en specerijen die meer waard waren dan wat de Byzantijnse markten konden bieden.",BeetleLM/beetlelm_nld_L1-eng_L2_balanced,step-30000,nld,5.518874168395996,249.3541483218101
491,Rond deze tijd nam Parijs ook de titel van modehoofdstad over van Constantinopel.,BeetleLM/beetlelm_nld_L1-eng_L2_balanced,step-30000,nld,5.554515838623047,258.4018260455047
492,"De gotiek vierde zijn hoogtijdagen in de 10e, 11e en 14e eeuw.",BeetleLM/beetlelm_nld_L1-eng_L2_balanced,step-30000,nld,5.493953704833984,243.21691630154538
493,Kleding was in het begin sterk beïnvloed door de Byzantijnse cultuur uit het oosten.,BeetleLM/beetlelm_nld_L1-eng_L2_balanced,step-30000,nld,4.310545444488525,74.48110317015808
494,Vanwege de langzame communicatiekanalen liepen stijlen in het westen echter met 25 tot 30 jaar achter.,BeetleLM/beetlelm_nld_L1-eng_L2_balanced,step-30000,nld,6.540220737457275,692.4394084825148
495,Aan het einde van de middeleeuwen begon er in West-Europa een eigen stijl te ontplooien. Een van de grootste ontwikkelingen was het resultaat van de kruistochten: mensen begonnen knopen te gebruiken om hun kleding te bevestigen.,BeetleLM/beetlelm_nld_L1-eng_L2_balanced,step-30000,nld,3.8692970275878906,47.908695749108006
496,Zelfvoorzienende landbouw is landbouw waarbij voldoende voedsel wordt geproduceerd om aan de behoeften van de boer en zijn gezin te voldoen.,BeetleLM/beetlelm_nld_L1-eng_L2_balanced,step-30000,nld,4.9629902839660645,143.02082999692678
497,"Landbouw met als doel levensonderhoud is een simpel systeem dat meestal biologisch is. Hierbij wordt opgeslagen zaad gebruikt dat afkomstig is uit de ecoregio, en dat wordt gecombineerd met wisselende gewassen of andere relatief eenvoudige technieken om de opbrengst te optimaal te maken.",BeetleLM/beetlelm_nld_L1-eng_L2_balanced,step-30000,nld,5.423302173614502,226.62624746969456
498,Vroeger werkten de meeste boeren in de zelfvoorzienende landbouw. In veel ontwikkelingslanden is dit nog steeds het geval.,BeetleLM/beetlelm_nld_L1-eng_L2_balanced,step-30000,nld,3.8658792972564697,47.74523623588817
499,Subculturen zorgen ervoor dat gelijkgestemde personen die zich verwaarloosd voelen door maatschappelijke normen worden samengebracht. Hierdoor krijgen ze de mogelijkheid een gevoel van identiteit te ontwikkelen.,BeetleLM/beetlelm_nld_L1-eng_L2_balanced,step-30000,nld,5.399438381195068,221.28210510830633
500,"Subculturen kunnen zich onderscheiden door middel van de leeftijd, etniciteit, sociale klasse, locatie en/of geslacht van hun leden.",BeetleLM/beetlelm_nld_L1-eng_L2_balanced,step-30000,nld,5.169565200805664,175.83836648042563
501,"Een subcultuur kan worden bepaald door de volgende soorten kwaliteiten: taalkundig, esthetisch, religieus, politiek, seksueel, geografisch of een of meer van deze factoren samen.",BeetleLM/beetlelm_nld_L1-eng_L2_balanced,step-30000,nld,4.438929557800293,84.6842435509922
502,"Leden van een subcultuur laten vaak zien tot welke groep ze behoren door middel van een bepaalde symbolische stijl in wat ze dragen, in hoe ze zich gedragen en het jargon dat ze spreken.",BeetleLM/beetlelm_nld_L1-eng_L2_balanced,step-30000,nld,5.86834716796875,353.6639498178594
503,"Een van de meest gebruikte methoden voor het illustreren van het belang van de vermaatschappelijking waren de paar betreurenswaardige gevallen van kinderen die door verwaarlozing, tegenslagen of moedwillig misbruik tijdens het opgroeien niet werden gesocialiseerd door volwassenen.",BeetleLM/beetlelm_nld_L1-eng_L2_balanced,step-30000,nld,5.890643119812012,361.63778602602787
504,"Ze worden 'wolfskinderen' of 'wilde kinderen' genoemd. Sommige wolfskinderen zijn door mensen (meestal hun eigen ouders) opgesloten geweest; soms werd dit kind in de steek gelaten, omdat de ouders de ernstige verstandelijke of lichamelijke beperking van het kind niet wilden accepteren.",BeetleLM/beetlelm_nld_L1-eng_L2_balanced,step-30000,nld,5.402298927307129,221.9159989828234
505,Onhandelbare kinderen hebben mogelijk ernstige kindermishandeling of een ernstig trauma meegemaakt voordat ze werden verlaten of voordat ze wegliepen.,BeetleLM/beetlelm_nld_L1-eng_L2_balanced,step-30000,nld,7.2842183113098145,1457.121672032034
506,"Van anderen wordt beweerd dat zij zijn grootgebracht door dieren, en van sommigen wordt gezegd dat zij alleen in de wildernis hebben gewoond.",BeetleLM/beetlelm_nld_L1-eng_L2_balanced,step-30000,nld,5.543224811553955,255.50061368879207
507,"Een verwilderd kind dat niet is grootgebracht door mensen, kan gedrag vertonen dat lijkt op het gedrag van het dier dat het kind verzorgd heeft (binnen de fysieke limieten), zoals angst voor of onverschilligheid richting mensen.",BeetleLM/beetlelm_nld_L1-eng_L2_balanced,step-30000,nld,6.177647590637207,481.8570969028486
508,"Leren op projectbasis moet educatie vereenvoudigen en interessanter maken, maar scaffolding gaat nog een stapje verder.",BeetleLM/beetlelm_nld_L1-eng_L2_balanced,step-30000,nld,5.926036357879639,374.6665228299549
509,"Scaffolding is geen leermethode maar een hulpmiddel om individuen te ondersteunen die te maken hebben met een nieuwe leerervaring, bijvoorbeeld een nieuw computerprogramma of die aan een nieuw project beginnen.",BeetleLM/beetlelm_nld_L1-eng_L2_balanced,step-30000,nld,4.662670612335205,105.91857222354115
510,"Ondersteuning kan zowel virtueel als echt zijn. Een docent is bijvoorbeeld een vorm van ondersteuning, maar het paperclipmannetje van Microsoft Office is dat ook.",BeetleLM/beetlelm_nld_L1-eng_L2_balanced,step-30000,nld,4.813283920288086,123.13532086803258
511,"Er is sprake van virtuele scaffolding die is ingebouwd in de software die vragen stelt, geheugensteuntjes biedt en procedures verklaart die mogelijk zonder hulp moeilijk te begrijpen kunnen zijn voor studenten.",BeetleLM/beetlelm_nld_L1-eng_L2_balanced,step-30000,nld,5.944668769836426,381.71290552770404
512,"Er zijn verschillende redenen dat kinderen in de pleegzorg terechtkomen, zoals verwaarlozing, misbruik en uitbuiting.",BeetleLM/beetlelm_nld_L1-eng_L2_balanced,step-30000,nld,4.418715000152588,82.98957522027689
513,"Geen enkel kind zou moeten opgroeien in een omgeving waar ze niet goed worden verzorgd, waar men niet om ze geeft en waar ze zich niet kunnen ontwikkelen, maar toch gebeurt dit.",BeetleLM/beetlelm_nld_L1-eng_L2_balanced,step-30000,nld,4.783389568328857,119.50874735653244
514,Het pleegzorgsysteem beschouwen wij als een veilige zone voor deze kinderen.,BeetleLM/beetlelm_nld_L1-eng_L2_balanced,step-30000,nld,6.528168678283691,684.144175484947
515,"Het is de bedoeling dat de pleegzorg zorgt voor een veilig thuis, liefhebbende verzorgers, stabiel onderwijs en betrouwbare gezondheidszorg.",BeetleLM/beetlelm_nld_L1-eng_L2_balanced,step-30000,nld,5.010739326477051,150.01560566885263
516,In de pleegzorg moet aan alle behoeften worden voldoen die werden verwaarloosd in het eerdere thuis.,BeetleLM/beetlelm_nld_L1-eng_L2_balanced,step-30000,nld,6.072840213775635,433.9113340374874
517,Op internet worden onderdelen van interpersoonlijke en massacommunicatie samengevoegd.,BeetleLM/beetlelm_nld_L1-eng_L2_balanced,step-30000,nld,6.005606174468994,405.6968372792275
518,De verschillende karakters van het internet leiden tot nieuwe dimensies wat betreft de toepassing van de Uses & Gratifications-theorie.,BeetleLM/beetlelm_nld_L1-eng_L2_balanced,step-30000,nld,5.260509967803955,192.5796756939772
519,"'Leren' en 'socialisatie' worden bijvoorbeeld voorgesteld als belangrijke redenen om het internet te gebruiken (James et al., 1995).",BeetleLM/beetlelm_nld_L1-eng_L2_balanced,step-30000,nld,6.025992393493652,414.0523410510914
520,Eighmey en McCord (1998) introduceerden nieuwe motivatieaspecten als 'persoonlijke betrokkenheid' en 'aanhoudende relaties' toen zij reacties van het publiek op websites onderzochten.,BeetleLM/beetlelm_nld_L1-eng_L2_balanced,step-30000,nld,5.550127029418945,257.27023471857376
521,"Dat er video-opnames worden gebruikt, leidde tot opmerkelijke vondsten in het interpreteren van micro-expressies, dat zijn gezichtsbewegingen die een paar milliseconden duren.",BeetleLM/beetlelm_nld_L1-eng_L2_balanced,step-30000,nld,6.072141647338867,433.608323991642
522,Er wordt met name gesteld dat niemand een leugen kan herkennen door op enkel op micro-expressies te letten.,BeetleLM/beetlelm_nld_L1-eng_L2_balanced,step-30000,nld,6.182976245880127,484.4316004777611
