sentence_id,sentence,repo,revision,iso_code,nll,ppl
735,"De Sundarbans beslaan een oppervlakte van 3.850 km², waarvan een derde veen- en moerasgebied is.",BeetleLM/beetlelm_nld_L1-eng_L2_balanced,step-30000,nld,6.237030982971191,511.3380834948507
736,De Sundarbans zijn sinds 1966 een wildreservaat en in het gebied bevinden zich nu naar schatting 400 Bengaalse tijgers en ongeveer 30.000 axisherten.,BeetleLM/beetlelm_nld_L1-eng_L2_balanced,step-30000,nld,6.610937595367432,743.1794938102571
737,"Overdag vertrekken er bussen vanuit het station op de grens van de districten (tegenover de rivier). De meeste vertrekken tussen 6.30 en 7.30 uur, vooral in de richting van het oosten en Jakar/Bumthang.",BeetleLM/beetlelm_nld_L1-eng_L2_balanced,step-30000,nld,5.297517776489258,199.8401459056334
738,"Het is verstandig om alvast enkele dagen eerder een ticket te kopen, want de streekbussen zijn vaak volgeboekt.",BeetleLM/beetlelm_nld_L1-eng_L2_balanced,step-30000,nld,5.127263069152832,168.55516233958838
739,In de meeste wijken rijden kleine Japanse Coaster-bussen die comfortabel en robuust zijn.,BeetleLM/beetlelm_nld_L1-eng_L2_balanced,step-30000,nld,6.642169952392578,766.757015333176
740,"Met gedeelde taxi's kan men snel en comfortabel naar nabije plaatsen reizen, zoals Paro (150 ngultrum) en Punakha (200 ngultrum).",BeetleLM/beetlelm_nld_L1-eng_L2_balanced,step-30000,nld,6.987971782684326,1083.5216287263956
741,De Oyapock-brug is een kabelbrug die over de Oyapock-rivier gaat om de Braziliaanse stad Oiapoque en de Frans-Guyanese stad Saint-Georges de l'Oyapock met elkaar te verbinden.,BeetleLM/beetlelm_nld_L1-eng_L2_balanced,step-30000,nld,5.279059410095215,196.18525866734436
742,"De twee torens hebben een hoogte van 83 meter. Het gebouw heeft een lengte van 378 meter en heeft twee doorgangen met een breedte van 3,50 meter.",BeetleLM/beetlelm_nld_L1-eng_L2_balanced,step-30000,nld,4.122433662414551,61.70923912542478
743,"Onder de brug is de doorvaarthoogte 15 meter. In augustus 2011 werd de bouw van de brug voltooi, maar deze ging pas open voor verkeer in maart 2017.",BeetleLM/beetlelm_nld_L1-eng_L2_balanced,step-30000,nld,5.471441745758057,237.80279690147486
744,Volgens de planning is de brug volledig operationeel in september 2017. Naar verwachting zijn de Braziliaanse douaneposten dan klaar voor gebruik.,BeetleLM/beetlelm_nld_L1-eng_L2_balanced,step-30000,nld,6.291015625,539.7011848454056
745,"De Guaraní was de meest opvallende inheemse groep. Ze woonden in het gebied dat nu Oost-Paraguay is, leefden als semi-nomadische jagers en deden ook aan zelfvoorzienende landbouw.",BeetleLM/beetlelm_nld_L1-eng_L2_balanced,step-30000,nld,5.236603260040283,188.03032632125255
746,"In de provincie Chaco leefden andere inheemse stammen, waaronder de Guaycurú en Payaguá, die hun voedsel vonden door te jagen, vissen en verzamelen.",BeetleLM/beetlelm_nld_L1-eng_L2_balanced,step-30000,nld,5.361692428588867,213.08527305800257
747,"Paraguay, voorheen ook wel 'de grote provincie van Indië' genoemd, ontstond in de 16e eeuw toen Spaanse kolonisten de inheemse bevolking tegenkwamen.",BeetleLM/beetlelm_nld_L1-eng_L2_balanced,step-30000,nld,4.578657150268555,97.38353491083069
748,Er volgde een drie eeuwen durende kolonisatieperiode onder de Spanjaarden.,BeetleLM/beetlelm_nld_L1-eng_L2_balanced,step-30000,nld,6.493408203125,660.7715736022107
749,Asunción werd in 1537 gesticht en sindsdien heeft Paraguay veel van zijn inheemse karakter en identiteit weten te behouden.,BeetleLM/beetlelm_nld_L1-eng_L2_balanced,step-30000,nld,5.689284801483154,295.6820736199328
750,Argentinië staat bekend om het feit dat het een van de beste poloteams en -spelers ter wereld heeft.,BeetleLM/beetlelm_nld_L1-eng_L2_balanced,step-30000,nld,5.747129440307617,313.2900504860767
751,In december vindt het grootste toernooi van het jaar plaats op de polovelden in Las Cañitas.,BeetleLM/beetlelm_nld_L1-eng_L2_balanced,step-30000,nld,6.922891616821289,1015.2514723723365
752,Hier zijn op andere tijden in het jaar ook kleinere toernooien en wedstrijden te zien.,BeetleLM/beetlelm_nld_L1-eng_L2_balanced,step-30000,nld,4.886524200439453,132.49225626553928
753,Check de Asociación Argentina de Polo voor meer informatie over toernooien en het kopen van tickets voor polowedstrijden.,BeetleLM/beetlelm_nld_L1-eng_L2_balanced,step-30000,nld,6.610674858093262,742.9842585047536
754,De officiële munt van de Falklandeilanden is het Falklandeilands pond (FKP). De waarde ligt ongeveer op één Brits pond (GBP).,BeetleLM/beetlelm_nld_L1-eng_L2_balanced,step-30000,nld,5.9974751472473145,402.4114800167751
755,"Op de eilanden is er maar één bank, namelijk in Stanley tegenover de winkel FIC West. Hier kunt u geld inwisselen.",BeetleLM/beetlelm_nld_L1-eng_L2_balanced,step-30000,nld,5.812006950378418,334.2893550386605
756,In het algemeen worden Britse ponden overal op de eilanden aanvaard en in Stanley kun je ook vaak betalen met creditcards en Amerikaanse dollars.,BeetleLM/beetlelm_nld_L1-eng_L2_balanced,step-30000,nld,6.366430282592773,581.9766243587434
757,"Op de afgelegen eilanden kan je waarschijnlijk niet met een creditcard betalen, maar waarschijnlijk wel met de Britse en Amerikaanse valuta. Vraag de eigenaren van tevoren op welke manier je kunt betalen.",BeetleLM/beetlelm_nld_L1-eng_L2_balanced,step-30000,nld,5.223107814788818,185.50981928339493
758,"Wissel uw geld weer in vóór u van de eilanden vertrekt, want Falklandse valuta zijn erbuiten heel moeilijk in te wisselen.",BeetleLM/beetlelm_nld_L1-eng_L2_balanced,step-30000,nld,6.479310035705566,651.521264747174
759,"Montevideo ligt beneden de evenaar, dus als het daar zomer is, is het winter op het noordelijk halfrond en andersom.",BeetleLM/beetlelm_nld_L1-eng_L2_balanced,step-30000,nld,3.6916182041168213,40.109700152192005
760,Montevideo bevindt zich in de subtropen. In de zomermaanden komen gerust temperaturen hoger dan +30°C voor.,BeetleLM/beetlelm_nld_L1-eng_L2_balanced,step-30000,nld,4.9681854248046875,143.76577672773263
761,"De winter kan bedrieglijk koud zijn: de temperatuur gaat bijna nooit onder nul, maar de wind in combinatie met de luchtvochtigheid zorgt ervoor dat het kouder aanvoelt dan dat de thermometer aangeeft.",BeetleLM/beetlelm_nld_L1-eng_L2_balanced,step-30000,nld,4.793962001800537,120.7789483635504
762,"Het regenniveau blijft gedurende het hele jaar ongeveer gelijk, zonder herkenbare 'natte' en 'droge' perioden.",BeetleLM/beetlelm_nld_L1-eng_L2_balanced,step-30000,nld,5.577125072479248,264.3106385187813
763,"Veel van de dieren in het park zijn eraan gewend mensen te zien, maar wilde dieren zijn uiteindelijk wel gewoon wild. Daarom moeten ze niet worden gevoerd of gestoord.",BeetleLM/beetlelm_nld_L1-eng_L2_balanced,step-30000,nld,4.822277545928955,124.24774872870847
764,"Houd in het park minstens 100 meter afstand van beren en wolven, en 25 meter van alle andere wilde dieren.",BeetleLM/beetlelm_nld_L1-eng_L2_balanced,step-30000,nld,5.580419063568115,265.18271091758413
765,"Elanden, bizons, rendieren, beren en ongeveer alle andere grote dieren kunnen u aanvallen, hoe tam ze ook lijken.",BeetleLM/beetlelm_nld_L1-eng_L2_balanced,step-30000,nld,6.216249942779541,500.8215964608697
766,"Elk jaar raken tientallen bezoekers gewond omdat ze geen gepaste afstand houden. Deze dieren zijn groot, wilde en mogelijk gevaarlijk, dus geef ze de ruimte.",BeetleLM/beetlelm_nld_L1-eng_L2_balanced,step-30000,nld,5.706541061401367,300.8287185440135
767,"Bovendien moet u zich ervan bewust zijn dat geuren beren en andere wilde dieren aantrekken, dus vermijd het dragen of koken van geurend voedsel en houd de kampeerplek schoon.",BeetleLM/beetlelm_nld_L1-eng_L2_balanced,step-30000,nld,6.618758201599121,749.014394481661
768,De hoofdstad van Samoa is Apia en de stad met bijna 40.000 inwoners ligt op het eiland Upolu.,BeetleLM/beetlelm_nld_L1-eng_L2_balanced,step-30000,nld,4.69711971282959,109.63094864818696
769,Rond het jaar 1850 werd Apia opgericht en het is de officiële hoofdstad van Samoa vanaf 1959.,BeetleLM/beetlelm_nld_L1-eng_L2_balanced,step-30000,nld,4.329799652099609,75.92907281489927
770,"In 1889 wilden zeven schepen uit Duitsland, de VS en Groot-Brittannië de haven niet verlaten. Dit kwam later bekend te staan als de beruchte patstelling.",BeetleLM/beetlelm_nld_L1-eng_L2_balanced,step-30000,nld,4.5676655769348145,96.31899783166652
771,Met uitzondering van een Brits slagschip werden alle schepen tot zinken gebracht. Bijna 200 Amerikanen en Duitsers verloren hun leven.,BeetleLM/beetlelm_nld_L1-eng_L2_balanced,step-30000,nld,6.519096374511719,677.9654815740903
772,"In de onafhankelijkheidsstrijd door de Mau-beweging kwam de hoogste leider, Tupua Tamasese Lealofi III, om bij een uit de hand gelopen geweldloze bijeenkomst in de stad.",BeetleLM/beetlelm_nld_L1-eng_L2_balanced,step-30000,nld,6.293288230895996,540.9291077040339
773,"Er zijn veel stranden, met name vanwege de twee havens van Auckland. De meest populaire zijn gelegen in drie gebieden.",BeetleLM/beetlelm_nld_L1-eng_L2_balanced,step-30000,nld,4.786995887756348,119.94051214681055
774,"De stranden van North Shore in het district North Harbour strekken zich van noord tot zuid uit langs de Grote Oceaan, van Long Bay naar Devonport.",BeetleLM/beetlelm_nld_L1-eng_L2_balanced,step-30000,nld,6.017990589141846,410.7523955931861
775,Dit zijn nagenoeg allemaal zandstranden waar veilig kan worden gezwommen en de meeste hebben pohutukawa-bomen die schaduw bieden.,BeetleLM/beetlelm_nld_L1-eng_L2_balanced,step-30000,nld,7.2335333824157715,1385.1079840645198
776,"Bij Waitemata's haven, in de luxe voorsteden van Mission Bay en St Heliers, gelegen in Central Auckland, vind je de Tamaki Drive-stranden.",BeetleLM/beetlelm_nld_L1-eng_L2_balanced,step-30000,nld,5.96812105178833,390.770742532223
777,Deze familiestranden zijn soms drukbezocht en hebben aan de kust een goed aanbod aan winkels . Zwemmen is niet onveilig.,BeetleLM/beetlelm_nld_L1-eng_L2_balanced,step-30000,nld,5.748079776763916,313.5879229595664
778,"'Number One' is het belangrijkste plaatselijke bier dat geen complex bier, maar aangenaam en verfrissend is. Het andere plaatselijke bier heeft de naam 'Manta'.",BeetleLM/beetlelm_nld_L1-eng_L2_balanced,step-30000,nld,6.626926422119141,755.1575644560794
779,"Er zijn veel Franse wijnen te vinden, maar de Nieuw-Zeelandse en Australische wijnen zijn wellicht beter geschikt voor reizen.",BeetleLM/beetlelm_nld_L1-eng_L2_balanced,step-30000,nld,4.7169013023376465,111.82121512537366
780,"Het lokale drinkwater kan gewoon veilig worden gedronken, maar fleswater is ook gemakkelijk te vinden als je het niet vertrouwt.",BeetleLM/beetlelm_nld_L1-eng_L2_balanced,step-30000,nld,5.282389163970947,196.83959607945317
781,"Een 'flat white' is een vreemd concept voor Australiërs. Zwarte koffie is 'espresso', cappuccino heeft heel veel koffiemelk (zonder schuim) en thee wordt geserveerd zonder melk.",BeetleLM/beetlelm_nld_L1-eng_L2_balanced,step-30000,nld,6.009276390075684,407.1885679550707
782,"De warme chocolademelk is van Belgische kwaliteit. Vruchtensappen zijn duur, maar geweldig.",BeetleLM/beetlelm_nld_L1-eng_L2_balanced,step-30000,nld,5.838510990142822,343.2678307541798
783,Er vinden het hele jaar tochten naar het rif plaats en letsel naar aanleiding van deze tochten naar het rif zijn zeldzaam.,BeetleLM/beetlelm_nld_L1-eng_L2_balanced,step-30000,nld,6.811001300811768,907.7793121903497
784,Vraag desondanks deskundig advies en volg alle borden en veiligheidswaarschuwingen op.,BeetleLM/beetlelm_nld_L1-eng_L2_balanced,step-30000,nld,7.373387336730957,1593.0207518608725
785,Kubuskwallen komen van oktober tot april voor in de buurt van stranden en riviermondingen ten noorden van Town of 1770. Soms komen ze ook buiten deze periode voor.,BeetleLM/beetlelm_nld_L1-eng_L2_balanced,step-30000,nld,5.2913289070129395,198.60718059261865
786,"Haaien komen wel degelijk voor, maar ze vallen zelden mensen aan. Het merendeel van de haaien is bang voor mensen en zou juist wegzwemmen.",BeetleLM/beetlelm_nld_L1-eng_L2_balanced,step-30000,nld,5.520744800567627,249.82103476404356
787,De belangrijkste habitat van zoutwaterkrokodillen bevindt zich in de riviermondingen ten noorden van Rockhampton en ze leven normaliter niet in de oceaan.,BeetleLM/beetlelm_nld_L1-eng_L2_balanced,step-30000,nld,5.954407215118408,385.44835498506393
788,"Vooraf reserveren zorgt voor gemoedsrust bij de reiziger, wetende dat hij een plek heeft om te slapen wanneer hij op zijn bestemming arriveert.",BeetleLM/beetlelm_nld_L1-eng_L2_balanced,step-30000,nld,5.800656318664551,330.5164128302357
789,"Reisbureaus hebben vaak deals met bepaalde hotels, al kun je meestal via een reisbureau ook andere accommodatievormen, zoals een campingplek, boeken.",BeetleLM/beetlelm_nld_L1-eng_L2_balanced,step-30000,nld,5.9781341552734375,394.7032257402312
790,Reisbureaus bieden vaak pakketten met ontbijt en vervoer van en naar het vliegveld aan en soms zelfs pakketten met vlucht en hotel.,BeetleLM/beetlelm_nld_L1-eng_L2_balanced,step-30000,nld,6.9589033126831055,1052.478684066569
791,Ze kunnen je ook reservering vasthouden als je nog wat langer over de aanbieding wilt nadenken of als je documenten voor je bestemming moet verwerven (bijv. visum).,BeetleLM/beetlelm_nld_L1-eng_L2_balanced,step-30000,nld,5.098329544067383,163.7481446496545
792,"Als u een verzoek hebt of een wijziging wilt maken, moet u dit echter via het reisbureau doen in plaats van het hotel.",BeetleLM/beetlelm_nld_L1-eng_L2_balanced,step-30000,nld,4.477265357971191,87.99371205204275
793,Voor sommige festivals geldt dat de meerderheid van de aanwezigen op muziekfestivals ervoor kiest om ter plekke te kamperen en de meeste bezoekers beschouwen dit als een belangrijk onderdeel van de ervaring.,BeetleLM/beetlelm_nld_L1-eng_L2_balanced,step-30000,nld,5.585293769836426,266.47855460334284
794,"Als u dicht bij de actie wilt zijn, moet u vroeg zijn om een kampeerplek in de buurt van de muziek te bemachtigen.",BeetleLM/beetlelm_nld_L1-eng_L2_balanced,step-30000,nld,4.50407075881958,90.38431618517657
795,"En onthoud het volgende: ook als de muziek op de hoofdpodia is afgelopen, wordt er mogelijk op andere delen van het festivalterrein tot in de late uurtjes muziek gedraaid.",BeetleLM/beetlelm_nld_L1-eng_L2_balanced,step-30000,nld,5.643906116485596,282.56429468185684
796,"Voor gezinnen waarvan de kinderen nog jong zijn, zijn er op sommige festivals speciale kampeerterreinen.",BeetleLM/beetlelm_nld_L1-eng_L2_balanced,step-30000,nld,5.306417465209961,201.6265986434977
797,"Let goed op waar uw hut zit als u 's winters de Oostzee overgaat, want de tocht door het ijs maakt een enorm lawaai. als u te dichtbij zit.",BeetleLM/beetlelm_nld_L1-eng_L2_balanced,step-30000,nld,5.308796405792236,202.1068273327535
798,Cruises naar Sint-Petersburg omvatten tijd om de stad te verkennen. Passagiers van de cruise zijn vrijgesteld van de visumvereisten (controleer de voorwaarden).,BeetleLM/beetlelm_nld_L1-eng_L2_balanced,step-30000,nld,5.697540283203125,298.1331751648172
799,Casino's zetten zich doorgaans in om het meeste te halen uit de tijd en het geld dat gasten besteden. Ramen en klokken zijn normaal gesproken niet aanwezig en de uitgang is soms moeilijk te vinden.,BeetleLM/beetlelm_nld_L1-eng_L2_balanced,step-30000,nld,5.49514627456665,243.50714245746636
800,"Ze hebben normaal gesproken speciaal aanbiedingen op het gebied van eten, drinken en entertainment om ze in een goede stemming te houden en om te voorkomen dat ze vertrekken.",BeetleLM/beetlelm_nld_L1-eng_L2_balanced,step-30000,nld,4.704395294189453,110.43148619134224
801,"Sommige locaties bieden gratis alcoholische dranken aan. Als mensen dronken zijn, beïnvloedt dat echter hun beoordelingsvermogen en alle doorgewinterde gokkers weten dat het enorm belangrijk is om nuchter te blijven.",BeetleLM/beetlelm_nld_L1-eng_L2_balanced,step-30000,nld,6.058892250061035,427.9011667301038
802,"Als je op hoog de bergen in gaat of over bergpassen gaat rijden, moet je er rekening mee houden dat er sneeuw of ijs kan liggen en de temperatuur ontzettend laag kan zijn.",BeetleLM/beetlelm_nld_L1-eng_L2_balanced,step-30000,nld,4.539682865142822,93.6610922119147
803,Op ijzige en besneeuwde wegen is er weinig frictie en het rijdt hierdoor anders dan asfalt.,BeetleLM/beetlelm_nld_L1-eng_L2_balanced,step-30000,nld,6.988533973693848,1084.1309461050155
804,Tijdens sneeuwstormen kan er in een hele korte periode genoeg sneeuw vallen om vast te komen te zitten.,BeetleLM/beetlelm_nld_L1-eng_L2_balanced,step-30000,nld,5.095637321472168,163.30789109090887
805,Ook kan het zicht belemmerd worden door vallende of opwaaiende sneeuw of doordat er condensatie of ijs op de ruiten van het voertuig zit.,BeetleLM/beetlelm_nld_L1-eng_L2_balanced,step-30000,nld,5.76351261138916,318.46501035813566
806,Aan de andere kant zijn ijs en sneeuw in veel landen normaal en wordt het verkeer hier niet door belemmerd.,BeetleLM/beetlelm_nld_L1-eng_L2_balanced,step-30000,nld,5.399898052215576,221.38384546113602
807,"De grootste toeristische Afrikaanse trekpleister zijn safari's, die voor veel bezoekers het hoogtepunt van hun reis vormen.",BeetleLM/beetlelm_nld_L1-eng_L2_balanced,step-30000,nld,5.574393272399902,263.58958003773375
808,"Het begrip safari verwijst in populair gebruik naar reizen over land om de prachtige Afrikaanse wilde dieren te bekijken, met name op de savanne.",BeetleLM/beetlelm_nld_L1-eng_L2_balanced,step-30000,nld,5.612713813781738,273.8865073370739
809,"Sommige dieren, zoals olifanten en giraffen, komen vaak dicht bij auto's en een standaarduitrusting maakt een goed uitzicht mogelijk.",BeetleLM/beetlelm_nld_L1-eng_L2_balanced,step-30000,nld,4.814509868621826,123.28637098037369
810,"Als je leeuwen, cheeta's en luipaarden wilt zien, heb je een verrekijker nodig. Anders is de kans klein dat je ze ziet.",BeetleLM/beetlelm_nld_L1-eng_L2_balanced,step-30000,nld,4.2297773361206055,68.70193303169576
811,Een wandelsafari (ook wel een 'boswandeling' of 'loopsafari' genoemd) houdt in dat je meerdere uren of dagen achter elkaar loopt.,BeetleLM/beetlelm_nld_L1-eng_L2_balanced,step-30000,nld,5.42535400390625,227.0917234447061
812,De Paralympics zijn van 24 augustus tot 5 september 2021. Sommige onderdelen worden op andere locaties in Japan gespeeld.,BeetleLM/beetlelm_nld_L1-eng_L2_balanced,step-30000,nld,5.021573066711426,151.64967131063332
813,Tokio wordt de enige Aziatische stad zijn waar de Olympische Spelen twee keer hebben plaatsgevonden. De eerste keer was in 1964.,BeetleLM/beetlelm_nld_L1-eng_L2_balanced,step-30000,nld,4.584884166717529,97.99183576869557
814,"Als je al voordat het uitstel werd aangekondigd vluchten en accommodatie voor 2020 hebt geboekt, kun je in een penibele situatie zitten.",BeetleLM/beetlelm_nld_L1-eng_L2_balanced,step-30000,nld,5.65716552734375,286.3358800012291
815,"Het annuleringsbeleid varieert, maar vanaf eind maart zijn de meeste op coronavirus gebaseerde annuleringsbeleidslijnen niet meer geldig tot juli 2020, toen de Olympische Spelen waren gepland.",BeetleLM/beetlelm_nld_L1-eng_L2_balanced,step-30000,nld,6.050572872161865,424.35606219969264
816,Naar verwachtingen kosten de meeste kaartjes voor evenementen tussen ¥ 2.500 en ¥ 130.000. Normale kaartjes gaan rond ¥ 7.000 kosten.,BeetleLM/beetlelm_nld_L1-eng_L2_balanced,step-30000,nld,5.2144293785095215,183.90684983233808
817,"Je kunt vochtige kleren drogen door ze te strijken. Veel hotels hebben een strijkijzer en een strijkplank beschikbaar. Je kunt deze spullen vaak lenen, zelfs al staan ze niet in de kamer.",BeetleLM/beetlelm_nld_L1-eng_L2_balanced,step-30000,nld,4.944942474365234,140.46277040900338
818,"Als er geen strijkijzer voorhanden is of als je geen gestreken sokken wilt dragen, kun je, indien beschikbaar, ook een haardroger gebruiken.",BeetleLM/beetlelm_nld_L1-eng_L2_balanced,step-30000,nld,5.302516937255859,200.84168025241453
819,"Zorg ervoor dat de stof niet te heet wordt (hierdoor kan de stof krimpen of, in extreme gevallen, verschroeien).",BeetleLM/beetlelm_nld_L1-eng_L2_balanced,step-30000,nld,5.639443874359131,281.30623335731366
820,Je kunt water op verschillende manieren zuiveren. Sommige manieren zijn effectief om specifieke risico's tegen te gaan.,BeetleLM/beetlelm_nld_L1-eng_L2_balanced,step-30000,nld,4.068810939788818,58.48737621698033
821,"In sommige gebieden is het voldoende om water een minuut te koken, in andere gebieden moet water enkele minuten worden gekookt.",BeetleLM/beetlelm_nld_L1-eng_L2_balanced,step-30000,nld,4.992246627807617,147.26690604731252
822,Niet ieder filter is even effectief. In geval van twijfel kan je het beste water drinken uit een afgesloten fles van een betrouwbaar bedrijf.,BeetleLM/beetlelm_nld_L1-eng_L2_balanced,step-30000,nld,5.918309688568115,371.7827538177909
823,Reizigers kunnen te maken krijgen met dierenplagen die er in hun eigen land niet zijn.,BeetleLM/beetlelm_nld_L1-eng_L2_balanced,step-30000,nld,5.216057300567627,184.20647967065685
824,"Ongedierte kan voedsel verderven, irritatie veroorzaken of, in het ergste geval, allergische reacties veroorzaken, gif verspreiden of infecties overbrengen.",BeetleLM/beetlelm_nld_L1-eng_L2_balanced,step-30000,nld,6.827566146850586,922.9417719337135
825,"Normaal gesproken worden infectieziekten zelf, of gevaarlijke dieren die met geweld mensen verwonden of doden, niet beschouwd als ongedierte.",BeetleLM/beetlelm_nld_L1-eng_L2_balanced,step-30000,nld,6.006256103515625,405.96059714121486
826,Met belastingvrij winkelen wordt bedoeld dat je op bepaalde locaties goederen kunt kopen die zijn vrijgesteld van belasting en accijnzen.,BeetleLM/beetlelm_nld_L1-eng_L2_balanced,step-30000,nld,5.6161651611328125,274.83341792739503
827,"Reizigers die naar landen met hoge accijnzen gaan, kunnen soms aanzienlijk veel geld besparen, als het gaat om producten als alcoholische dranken en tabak.",BeetleLM/beetlelm_nld_L1-eng_L2_balanced,step-30000,nld,5.095774173736572,163.33024167492889
828,"Point Marion en Fairmont zijn met elkaar verbonden via de snelweg van Buffalo naar Pittsburgh, je rijdt vaak door verlaten achterliggend terrein en dat maakt van dit traject één grote uitdaging.",BeetleLM/beetlelm_nld_L1-eng_L2_balanced,step-30000,nld,6.294889450073242,541.7959475799289
829,"Ben je niet gewend om op landweggetjes te rijden? Houd dan je hoofd erbij. Je komt veel steile hellingen, smalle straatjes en scherpe bochten tegen.",BeetleLM/beetlelm_nld_L1-eng_L2_balanced,step-30000,nld,5.626572132110596,277.7085360176492
830,De gestelde maximumsnelheden zijn opvallend lager dan in eerdere en opeenvolgende gebieden — meestal zo'n 35-40 mph (56-64 km/u — en het is hier nog belangrijker om je eraan te houden dan anders.,BeetleLM/beetlelm_nld_L1-eng_L2_balanced,step-30000,nld,5.695256233215332,297.4530011611328
831,"Verrassend genoeg heb je hier veel meer bereik dan in andere uithoeken van de route, zoals de Pennsylvania Wilds.",BeetleLM/beetlelm_nld_L1-eng_L2_balanced,step-30000,nld,6.0432963371276855,421.27942764082303
832,"Duitse gebak smaakt prima en in Beieren is het gebak redelijk rijk en gevarieerd, net zoals het gebak van de zuidelijke buur, Oostenrijk.",BeetleLM/beetlelm_nld_L1-eng_L2_balanced,step-30000,nld,6.478801727294922,651.190175163528
833,"Je ziet er veel fruitgebakjes. Het hele jaar door bevatten de gebakjes appels, en in de zomermaanden ook kersen en pruimen.",BeetleLM/beetlelm_nld_L1-eng_L2_balanced,step-30000,nld,5.363795757293701,213.53393310377365
834,"Veel populaire Duitse gebakjes bevatten amandelen, hazelnoten en andere noten, en smaken prima bij een kop sterke koffie.",BeetleLM/beetlelm_nld_L1-eng_L2_balanced,step-30000,nld,6.863946437835693,957.1369051799433
835,"Als u een paar kleine maar machtige gebakjes wilt, probeer er dan enkele die in de regio Berliner, Pfannkuchen of Krapfen worden genoemd.",BeetleLM/beetlelm_nld_L1-eng_L2_balanced,step-30000,nld,6.577017307281494,718.3933837773203
836,"Om een curry te maken heb je kruidige en pittige ingrediënten nodig, in combinatie met groente of vlees.",BeetleLM/beetlelm_nld_L1-eng_L2_balanced,step-30000,nld,5.103415489196777,164.58308014668407
837,"Afhankelijk van de hoeveelheid vloeistof, kan een curry 'droog' of 'nat' zijn.",BeetleLM/beetlelm_nld_L1-eng_L2_balanced,step-30000,nld,5.454044818878174,233.70153712786168
838,In het binnenland van Noord-India en ook van Pakistan wordt vaak yoghurt gebruikt in curry's; in Zuid-India en enkele andere kustregio's van het subcontinent wordt dan weer vaak kokosmelk gebruikt.,BeetleLM/beetlelm_nld_L1-eng_L2_balanced,step-30000,nld,5.237804412841797,188.25631517088198
839,De Indonesische keuken omvat gerechten uit 17.000 eilanden en is een overkoepelend begrip voor een variëteit aan regionale keukens uit het hele land.,BeetleLM/beetlelm_nld_L1-eng_L2_balanced,step-30000,nld,5.927324295043945,375.14938064744695
840,Maar zonder aanvullende informatie verwijst de term naar het voedsel dat oorspronkelijk uit het centrale en oostelijke deel van het hoofdeiland Java komt.,BeetleLM/beetlelm_nld_L1-eng_L2_balanced,step-30000,nld,5.560112953186035,259.85218579764535
841,"De Javaanse keuken is tegenwoordig beschikbaar in de hele archipel en biedt verschillende eenvoudige gekruide gerechten. De meest gebruikelijke Javaanse smaakmakers zijn noten, pepers, suiker (voornamelijk Javaanse kokossuiker) en verschillende geurige kruiden.",BeetleLM/beetlelm_nld_L1-eng_L2_balanced,step-30000,nld,6.2191338539123535,502.26800609440306
842,Stijgbeugels ondersteunen de voeten van de ruiter en hangen aan beide kanten van het zadel naar beneden.,BeetleLM/beetlelm_nld_L1-eng_L2_balanced,step-30000,nld,5.258297443389893,192.15405947661333
843,"Ze voorzien de berijder van meer stabiliteit, maar kunnen ook problemen met de veiligheid met zich meebrengen doordat de voeten van een berijder erin vast kunnen komen te zitten.",BeetleLM/beetlelm_nld_L1-eng_L2_balanced,step-30000,nld,5.768016338348389,319.9025244665547
