sentence_id,sentence,repo,revision,iso_code,nll,ppl
723,"Der Park hat eine Fläche von 19.500 km² und ist in 14 verschiedene Ökozonen aufgeteilt, von denen jede eine andere Tierwelt unterstützt.",BeetleLM/beetlelm_bul-deu_part_time,step-20000,deu,5.312662124633789,202.8896275711628
724,Er ist einer der Hauptanziehungspunkte Südafrikas und gilt als das Aushängeschild der Südafrikanischen Nationalparks (SANParks).,BeetleLM/beetlelm_bul-deu_part_time,step-20000,deu,5.314249515533447,203.211948476558
725,Wie alle südafrikanischen Nationalparks erhebt der Park tägliche Schutz- und Eintrittsgebühren.,BeetleLM/beetlelm_bul-deu_part_time,step-20000,deu,6.494004726409912,661.1658568197406
726,"Es kann sich auch lohnen, eine Wild Card zu kaufen, die Zutritt entweder zu ausgewählten Parks in Südafrika oder zu allen südafrikanischen Nationalparks gewährt.",BeetleLM/beetlelm_bul-deu_part_time,step-20000,deu,5.588078498840332,267.2216593557305
727,Hong Kong Island ist Namensgeber für das Territorium Hongkong und steht für viele Touristen im Mittelpunkt.,BeetleLM/beetlelm_bul-deu_part_time,step-20000,deu,5.35741662979126,212.17610839141386
728,"Die Gebäude, die die Hongkonger Skyline ausmachen, wurden mit einem schillernden Balkendiagramm verglichen, das durch die Gegenwart der Gewässer des Victoria Harbour sichtbar wird.x",BeetleLM/beetlelm_bul-deu_part_time,step-20000,deu,6.089794158935547,441.330557843819
729,Für die besten Aussichten auf Hongkong sollten Sie die Insel verlassen und zum gegenüberliegenden Ufer von Kowloon fahren.,BeetleLM/beetlelm_bul-deu_part_time,step-20000,deu,5.816066265106201,335.6490986874617
730,Der Großteil der Städtebildung von Hong Kong Island ist dicht gedrängt auf neugewonnenem Land entlang der Nordküste.,BeetleLM/beetlelm_bul-deu_part_time,step-20000,deu,6.355363845825195,575.5717219340221
731,"Das ist der Ort, den sich die britischen Kolonisten zu eigen gemacht haben. Wenn Sie nach Spuren der kolonialen Vergangenheit des Gebiets suchen, ist dies ein guter Ausgangspunkt.",BeetleLM/beetlelm_bul-deu_part_time,step-20000,deu,5.199517250061035,181.1847538305731
732,Die Sundarbans sind der größte Mangrovengürtel der Welt und erstrecken sich über 80 km vom bangladeschischen und indischen Hinterland bis an die Küste.,BeetleLM/beetlelm_bul-deu_part_time,step-20000,deu,5.827111721038818,339.37704655641187
733,"Die Sundarbans wurden zum UNESCO-Weltkulturerbe erklärt. Der Teil des Waldes, der innerhalb des indischen Staatsgebietes liegt, wird als Sundarbans National Park bezeichnet.",BeetleLM/beetlelm_bul-deu_part_time,step-20000,deu,5.31014347076416,202.3792618127164
734,"Die Wälder sind jedoch nicht nur Mangrovensümpfe – sie umfassen auch einige der letzten verbliebenen Bestände des mächtigen Dschungels, der einst die Gangesebene bedeckte.",BeetleLM/beetlelm_bul-deu_part_time,step-20000,deu,6.516221523284912,676.0192306090845
735,"Die Sundarbans erstrecken sich über eine Fläche von 3.850 km², wovon ein Drittel von Wasser und Marschen bedeckt ist.",BeetleLM/beetlelm_bul-deu_part_time,step-20000,deu,5.422989368438721,226.55536869272026
736,"Die Sundarbans sind seit 1966 ein Naturschutzgebiet, und Schätzungen zufolge halten sich dort mittlerweile 400 bengalische Königstiger und etwa 30.000 gefleckte Hirsche auf.",BeetleLM/beetlelm_bul-deu_part_time,step-20000,deu,6.01418924331665,409.19394766543144
737,"Busse fahren den ganzen Tag über vom distriktübergreifenden Busbahnhof (auf der anderen Seite des Flusses) ab, wobei die meisten Busse, vor allem die in Richtung Osten und Jakar/Bumthang, zwischen 06:30 und 07:30 Uhr abfahren.",BeetleLM/beetlelm_bul-deu_part_time,step-20000,deu,5.878702640533447,357.3453354935299
738,"Da die Busse zwischen den Bezirken oftmals voll sind, empfiehlt es sich, ein paar Tage im Voraus ein Ticket zu kaufen.",BeetleLM/beetlelm_bul-deu_part_time,step-20000,deu,5.4639716148376465,236.03299742226855
739,"Die meisten Bezirke werden durch kleine japanische Coasterbusse befahren, die gemütlich und stabil sind.x",BeetleLM/beetlelm_bul-deu_part_time,step-20000,deu,6.38706111907959,594.1079988486479
740,"Sammeltaxis bieten eine schnelle und bequeme Möglichkeit, um zu nahegelegenen Orten wie Paro (Nu 150) und Punakha (Nu 200) zu gelangen.",BeetleLM/beetlelm_bul-deu_part_time,step-20000,deu,6.488834857940674,657.7565367653149
741,Die Oyapock River Bridge ist eine Schrägseilbrücke. Sie überspannt den Fluss Oyapock und verbindet die Städte Oiapoque in Brasilien und Saint-Georges de l'Oyapock in Französisch-Guayana.,BeetleLM/beetlelm_bul-deu_part_time,step-20000,deu,5.634947776794434,280.0442921178816
742,"Ihre beiden Türme sind 83 Meter hoch, ihre Länge beträgt 378 Meter und sie verfügt über zwei Fahrspuren mit 3,50 m Breite.",BeetleLM/beetlelm_bul-deu_part_time,step-20000,deu,5.148094177246094,172.10317940969023
743,"Die Durchfahrtshöhe unter der Brücke beträgt 15 Meter. Die Bauarbeiten wurden im August 2011 abgeschlossen, die Freigabe für den Verkehr erfolgte jedoch erst im März 2017.",BeetleLM/beetlelm_bul-deu_part_time,step-20000,deu,5.478367805480957,239.45555020220345
744,"Die Brücke soll im September 2017 vollständig den Betrieb aufnehmen. Es wird erwartet, dass die brasilianischen Zollkontrollpunkte dann fertig gestellt sein werden.",BeetleLM/beetlelm_bul-deu_part_time,step-20000,deu,5.8630781173706055,351.8053773277189
745,"Die Guaraní waren die bedeutendste indigene Gruppe, die das heutige Ostparaguay bewohnte. Sie lebten als halbnomadische Jäger, die auch Subsistenzlandwirtschaft betrieben.",BeetleLM/beetlelm_bul-deu_part_time,step-20000,deu,5.8028435707092285,331.2401267138091
746,"Die Chaco-Region war auch die Heimat anderer Gruppen von Eingeborenenstämmen, wie der Guaycurú und der Payaguá, die durch jagen, sammeln und fischen überlebten.x",BeetleLM/beetlelm_bul-deu_part_time,step-20000,deu,5.5854268074035645,266.5140086202477
747,"Paraguay, ehemals Großprovinz Westindien genannt, entstand im 16. Jahrhundert als Ergebnis des Zusammentreffens der spanischen Eroberer mit den einheimischen indigenen Gruppen.",BeetleLM/beetlelm_bul-deu_part_time,step-20000,deu,5.946725845336914,382.49892596840664
748,"Die Spanier begannen die Kolonisierungszeit, die drei Jahrhunderte andauerte.",BeetleLM/beetlelm_bul-deu_part_time,step-20000,deu,6.170941352844238,478.6364598779566
749,"Seit der Gründung von Asunción 1537 ist es Paraguay gelungen, viel von seinem indigenen Charakter und seiner Identität zu bewahren.",BeetleLM/beetlelm_bul-deu_part_time,step-20000,deu,6.133500099182129,461.04705030235283
750,"Argentinien ist bekannt dafür, dass sein Polo-Team und die Spieler zu den besten der Welt gehören.",BeetleLM/beetlelm_bul-deu_part_time,step-20000,deu,4.8687214851379395,130.1544061332936
751,Das größte Turnier des Jahres findet im Dezember auf Las Cañitas Polofeldern statt.,BeetleLM/beetlelm_bul-deu_part_time,step-20000,deu,6.493935585021973,661.1201444750676
752,Kleinere Turniere und Wettkämpfe können hier auch zu anderen Zeiten im Jahr angeschaut werden.x,BeetleLM/beetlelm_bul-deu_part_time,step-20000,deu,6.113356590270996,451.8528574736569
753,Informationen zu Wettbewerben und Verkaufsstellen für Polospieltickets finden Sie bei der Asociacion Argentina de Polo.,BeetleLM/beetlelm_bul-deu_part_time,step-20000,deu,7.061337947845459,1166.0041753777107
754,"Die offizielle Währung der Falklandinseln ist das Falkland Pound (FKP), dessen Wert in Einklang mit dem Wert des Britischen Pfunds (GBP) festgelegt wird.",BeetleLM/beetlelm_bul-deu_part_time,step-20000,deu,5.981568813323975,396.06122715231993
755,"Geld kann in der einzigen Bank auf der Insel umgetauscht werden, welche sich in Stanley gegenüber vom FIC West Store befindet.",BeetleLM/beetlelm_bul-deu_part_time,step-20000,deu,6.110016822814941,450.3462911962119
756,Das Britische Pfund wird grundsätzlich überall auf den Inseln und bei Stanley-Kreditkarten akzeptiert. Auch US-Dollar werden häufig akzeptiert.,BeetleLM/beetlelm_bul-deu_part_time,step-20000,deu,5.433050155639648,228.84619849895273
757,"Auf den abgelegenen Inseln werden Kreditkarten wahrscheinlich nicht akzeptiert, wobei jedoch britische und US-amerikanische Währung angenommen werden können; erkundigen Sie sich im Voraus bei den Eigentümern, welche Zahlungsmethode akzeptiert wird.",BeetleLM/beetlelm_bul-deu_part_time,step-20000,deu,5.920881271362305,372.74005431186947
758,"Es ist beinahe unmöglich, die Währung der Falklandinseln außerhalb der Inseln selbst umzutauschen, daher sollten Sie das Geld vor der Abreise von der Insel umtauschen.x",BeetleLM/beetlelm_bul-deu_part_time,step-20000,deu,5.513190746307373,247.94098305860334
759,"Da Montevideo südlich des Äquators liegt, ist es dort Sommer, wenn es in der nördlichen Hemisphäre Winter ist und umgekehrt.",BeetleLM/beetlelm_bul-deu_part_time,step-20000,deu,5.255366325378418,191.5916578872714
760,Montevideo liegt in den Subtropen. In den Sommermonaten sind Temperaturen über +30 °C üblich.,BeetleLM/beetlelm_bul-deu_part_time,step-20000,deu,5.660355091094971,287.2506245873429
761,"Der Winter kann trügerisch kühl sein: Die Temperaturen gehen selten unter den Gefrierpunkt, aber Wind und Feuchtigkeit führen dazu, dass es sich kälter anfühlt als das, was das Thermometer anzeigt.",BeetleLM/beetlelm_bul-deu_part_time,step-20000,deu,5.274077415466309,195.2102954098194
762,Es gibt keine ausgeprägten Regen- oder Trockenzeiten: Die Niederschlagsmenge bleibt über das ganze Jahr in etwa gleich.,BeetleLM/beetlelm_bul-deu_part_time,step-20000,deu,6.208323955535889,496.86778052194757
763,"Obwohl viele der Tiere im Park den Anblick von Menschen gewohnt sehen, sind die Wildtiere trotzdem wild und sollten nicht gefüttert oder gestört werden.",BeetleLM/beetlelm_bul-deu_part_time,step-20000,deu,5.900343894958496,365.163023998013
764,Laut Anweisung der Parkbehörde sollen sich Besucher mindestens 100 Yard/Meter von Bären und Wölfen und 25 Yard/Meter von allen anderen wilden Tieren fernhalten!,BeetleLM/beetlelm_bul-deu_part_time,step-20000,deu,6.679346084594727,795.7985568990991
765,"Egal wie friedlich Bisons, Wapitis, Elche, Bären und praktisch alle großen Tiere wirken können, so kann es doch passieren, dass sie zum Angriff übergehen.",BeetleLM/beetlelm_bul-deu_part_time,step-20000,deu,6.039313316345215,419.60480017721784
766,"Jedes Jahr werden Dutzende von Besuchern verletzt, weil sie nicht genug Abstand einhalten. Diese Tiere sind groß, wild und möglicherweise gefährlich, also lassen Sie ihnen ausreichend Platz.",BeetleLM/beetlelm_bul-deu_part_time,step-20000,deu,6.116936206817627,453.47321583949525
767,"Seien Sie sich außerdem bewusst, dass Gerüche Bären und andere Wildtiere anziehen können. Vermeiden Sie es also, stark duftende Lebensmittel bei sich zu tragen oder zu kochen, und achten Sie auf ein sauberes Lager.",BeetleLM/beetlelm_bul-deu_part_time,step-20000,deu,5.606245517730713,272.12064553848415
768,Apia ist die auf der Insel Upolu liegende Hauptstadt von Samoa und weist eine Einwohnerzahl von knapp unter 40.000 auf.,BeetleLM/beetlelm_bul-deu_part_time,step-20000,deu,5.473949432373047,238.3998801281837
769,Apia wurde in den 50ern des 18. Jahrunderts gegründet und ist seit 1959 die offizielle Hauptstadt von Samoa.,BeetleLM/beetlelm_bul-deu_part_time,step-20000,deu,5.309823989868164,202.31461583194923
770,"Der Hafen war der Schauplatz eines unrühmlichen Patts der Marine im Jahr 1889, als sieben Schiffe aus Deutschland, den Vereinigten Staaten und Großbritannien sich weigerten, den Hafen zu verlassen.",BeetleLM/beetlelm_bul-deu_part_time,step-20000,deu,5.001197338104248,148.59096625954177
771,Alle Schiffe mit Ausnahme eines britischen Kreuzers wurden versenkt. Fast 200 Amerikaner und Deutsche kamen ums Leben.,BeetleLM/beetlelm_bul-deu_part_time,step-20000,deu,6.1229753494262695,456.2200912969658
772,Während des von der Mau-Bewegung organisierten Unabhängigkeitskampfes führte eine friedliche Versammlung in der Stadt zur Tötung des obersten Häuptlings Tupua Tamasese Lealofi III.,BeetleLM/beetlelm_bul-deu_part_time,step-20000,deu,5.973350524902344,392.81962023017024
773,"Da Auckland sich über zwei Häfen erstreckt, gibt es viele Strände. Die beliebtesten Strände befinden sich in drei Gebieten.",BeetleLM/beetlelm_bul-deu_part_time,step-20000,deu,5.308914661407471,202.13072901318893
774,Die Strände von North Shore (im Bezirk North Harbour) liegen am Pazifischen Ozean und erstrecken sich von Long Bay im Norden bis Devonport im Süden.,BeetleLM/beetlelm_bul-deu_part_time,step-20000,deu,5.682677268981934,293.7347851790876
775,"Fast alle sind Sandstrände mit sicheren Bademöglichkeiten und die meisten bieten Schatten, der von Pohutukawa-Bäumen gespendet wird.",BeetleLM/beetlelm_bul-deu_part_time,step-20000,deu,6.812391757965088,909.0424183726299
776,"Die Strände von Tamaki Drive befinden sich am Hafen von Waitemata, in den gehobenen Vororten Mission Bay sowie St. Heliers in Central Auckland.",BeetleLM/beetlelm_bul-deu_part_time,step-20000,deu,5.876805305480957,356.66797445627526
777,"Es gibt Familienstrände, die manchmal überlaufen sind, mit einer schönen Einkaufspromenade entlang der Küste. Das Schwimmen ist hier sicher.",BeetleLM/beetlelm_bul-deu_part_time,step-20000,deu,5.712841510772705,302.7300580115978
778,"Das wichtigste lokale Bier ist „Number One“. Es ist kein komplexes Bier, aber angenehm und erfrischend. Das andere lokale Bier heißt „Manta“.",BeetleLM/beetlelm_bul-deu_part_time,step-20000,deu,6.023108959197998,412.8601679331324
779,"Es gibt viele französische Weine zu trinken, aber die neuseeländischen und australischen Weine sind vielleicht besser verträglich.",BeetleLM/beetlelm_bul-deu_part_time,step-20000,deu,5.996250629425049,401.91902156122256
780,"Das örtliche Leitungswasser kann man bedenkenlos trinken, aber wenn Sie sich Sorgen machen, finden Sie auch problemlos abgefülltes Wasser.",BeetleLM/beetlelm_bul-deu_part_time,step-20000,deu,6.67342472076416,791.1002679747354
781,"""Für Australier ist die Idee des Kaffees """"Flat White"""" fremd. Ein kleiner Schwarzer ist """"Espresso"""", Cappuccino wird hoch mit Sahne (nicht mit Schaum) aufgefüllt und Tee wird ohne Milch serviert.""",BeetleLM/beetlelm_bul-deu_part_time,step-20000,deu,5.72072696685791,305.12665931843964
782,"Die heiße Schokolade entspricht belgischen Standards. Fruchtsäfte sind zwar teuer, aber hervorragend.",BeetleLM/beetlelm_bul-deu_part_time,step-20000,deu,6.0446672439575195,421.8573585396397
783,Viele Reisen zum Riff finden das ganze Jahr hindurch statt und Verletzungen aufgrund irgendeiner dieser Ursachen auf dem Riff sind selten.x,BeetleLM/beetlelm_bul-deu_part_time,step-20000,deu,6.725575923919678,833.4518432022006
784,"Dennoch sollten Sie den Rat von Behörden befolgen, alle Schilder beachten und insbesondere Augenmerk auf Sicherheitswarnungen richten.",BeetleLM/beetlelm_bul-deu_part_time,step-20000,deu,7.436724662780762,1697.1822634236175
785,Würfelquallen treten in Strandnähe und in der Nähe von Flussmündungen von Oktober bis April nördlich von 1770 auf. Sie können gelegentlich auch außerhalb dieses Zeitraums vorkommen.,BeetleLM/beetlelm_bul-deu_part_time,step-20000,deu,5.654721260070801,285.636853232822
786,"Haie existieren, aber sie greifen selten Menschen an. Die meisten Haie haben Angst vor Menschen und würden wegschwimmen.",BeetleLM/beetlelm_bul-deu_part_time,step-20000,deu,5.4786224365234375,239.516530782024
787,"Salzwasserkrokodile leben nicht aktiv im Meer, ihr primärer Lebensraum ist in Flussmündungen nördlich von Rockhampton.",BeetleLM/beetlelm_bul-deu_part_time,step-20000,deu,6.265665531158447,526.1916664009882
788,"Eine Buchung im Voraus gibt dem Reisenden die Gewissheit, dass er nach seiner Ankunft am Zielort einen Platz zum Übernachten hat.",BeetleLM/beetlelm_bul-deu_part_time,step-20000,deu,6.15293550491333,470.09533046500513
789,"Reiseagenturen haben oft Abmachungen mit spezifischen Hotels, obwohl Sie vielleicht auch andere Unterbringungsformen, wie zum Beispiel Zeltplätze, durch eine Reiseagentur buchen können.x",BeetleLM/beetlelm_bul-deu_part_time,step-20000,deu,6.8718976974487305,964.7776858579085
790,"Reisebüros bieten üblicherweise Pakete an, bei denen Frühstück, Transport zum und vom Flughafen oder sogar eine Kombination von Flug und Hotel inbegriffen sind.",BeetleLM/beetlelm_bul-deu_part_time,step-20000,deu,6.541164875030518,693.0934752611812
791,"Sie können Ihre Reservierung auch für Sie zurückhalten, falls Sie Zeit benötigen, das Angebot zu überdenken oder um weitere Dokumente für Ihr Reiseziel (z.B. Visa) zu beschaffen.",BeetleLM/beetlelm_bul-deu_part_time,step-20000,deu,5.51138162612915,247.49283352355664
792,Jegliche Änderungen oder Anfragen sollten jedoch zuerst an das Reisebüro und nicht direkt an das Hotel gerichtet werden.,BeetleLM/beetlelm_bul-deu_part_time,step-20000,deu,6.25143575668335,518.7570992141433
793,"Bei manchen Festivals entscheidet sich die große Mehrheit der Festivalbesucher, vor Ort zu kampieren, und die meisten Besucher halten dies für einen wichtigen Bestandteil der Erfahrung.",BeetleLM/beetlelm_bul-deu_part_time,step-20000,deu,6.2506585121154785,518.3540547290931
794,"Wenn Sie nahe am Geschehen sein wollen, müssen Sie früh hingehen, um einen Campingplatz in der Nähe der Musik zu bekommen.",BeetleLM/beetlelm_bul-deu_part_time,step-20000,deu,4.711488723754883,111.21760901763638
795,"Denken Sie daran, dass auf Teilen des Festivals noch bis spät in die Nacht Musik gespielt wird, auch wenn die Musik auf den Hauptbühnen schon aufgehört hat.",BeetleLM/beetlelm_bul-deu_part_time,step-20000,deu,5.9799017906188965,395.4015341084691
796,Manche Festivals haben spezielle Campingbereiche für Familien mit kleinen Kindern.,BeetleLM/beetlelm_bul-deu_part_time,step-20000,deu,6.031217098236084,416.22130344109604
797,"Wenn Sie im Winter die nördliche Ostsee überqueren, überprüfen Sie die Lage der Kabine, da das Durchbrechen von Eis für die am stärksten Betroffenen ziemlich schrecklichen Lärm verursacht.",BeetleLM/beetlelm_bul-deu_part_time,step-20000,deu,5.8701863288879395,354.3149932361829
798,Die Kreuzfahrten nach Sankt Petersburg bieten auch Zeit für einen Aufenthalt in der Stadt. Kreuzfahrtpassagiere sind von der Visumpflicht befreit (siehe Bedingungen).,BeetleLM/beetlelm_bul-deu_part_time,step-20000,deu,6.203179359436035,494.31816048215705
799,"Kasinos bemühen sich in der Regel sehr darum, Gäste möglichst lange vor Ort zu halten und viel Geld ausgeben zu lassen. Es gibt in der Regel weder Fenster noch Uhren, und Ausgänge sind manchmal schwer auffindbar.",BeetleLM/beetlelm_bul-deu_part_time,step-20000,deu,6.053027629852295,425.3990331035505
800,"Sie haben normalerweise ein besonderes Angebot an Speisen, Getränken und Unterhaltung, um die Gäste bei Laune zu halten und dafür zu sorgen, dass sie bleiben.",BeetleLM/beetlelm_bul-deu_part_time,step-20000,deu,4.811352252960205,122.8976939737465
801,"Einige Spielstätten bieten alkoholische Getränke kostenfrei an. Trunkenheit beeinträchtigt jedoch das Urteilsvermögen, und allen guten Spielern ist klar, wie wichtig es ist, nüchtern zu bleiben.",BeetleLM/beetlelm_bul-deu_part_time,step-20000,deu,6.104442596435547,447.8429426178053
802,"Wer in hohen Breiten oder über Gebirgspässe fahren will, sollte mit Schnee, Eis und Temperaturen unter dem Gefrierpunkt rechnen.",BeetleLM/beetlelm_bul-deu_part_time,step-20000,deu,6.074674606323242,434.7080282565311
803,"Auf vereisten und verschneiten Straßen ist die Haftung gering und man kann nicht fahren, als befinde man sich auf nacktem Asphalt.",BeetleLM/beetlelm_bul-deu_part_time,step-20000,deu,6.387663841247559,594.4661888434032
804,"Bei Schneestürmen kann in sehr kurzer Zeit so viel Schnee fallen, dass man sich festfahren kann.",BeetleLM/beetlelm_bul-deu_part_time,step-20000,deu,5.165557861328125,175.13513244261267
805,Die Sichtweite kann auch durch fallenden oder umherwehenden Schnee oder durch Kondensation oder Eis auf den Fahrzeugfenstern beeinträchtigt werden.x,BeetleLM/beetlelm_bul-deu_part_time,step-20000,deu,6.894015312194824,986.3539957168222
806,"Auf der anderen Seite sind eisige und schneereiche Bedingungen in vielen Ländern normal, und der Verkehr läuft das ganze Jahr über größtenteils ununterbrochen weiter.",BeetleLM/beetlelm_bul-deu_part_time,step-20000,deu,5.879947185516357,357.7903446975315
807,Safaris sind vielleicht die größte Touristenattraktion in Afrika und der Höhepunkt für viele Besucher.,BeetleLM/beetlelm_bul-deu_part_time,step-20000,deu,5.0079426765441895,149.59665064366487
808,"Der Begriff Safari bezeichnet im üblichen Sprachgebrauch eine Landreise, um die überwältigende afrikanische Tierwelt zu beobachten, besonders in der Savanne.",BeetleLM/beetlelm_bul-deu_part_time,step-20000,deu,5.456023216247559,234.16434929636893
809,"Einige Tiere, wie Elefanten und Giraffen, neigen dazu, sich dicht an Autos anzunähern, und die Standardausrüstung ermöglicht eine gute Sicht.",BeetleLM/beetlelm_bul-deu_part_time,step-20000,deu,5.718931674957275,304.5793593269175
810,"Löwen, Geparden und Leoparden sind oft scheu und Sie können sie mit einem Fernglas besser beobachten.",BeetleLM/beetlelm_bul-deu_part_time,step-20000,deu,4.918123722076416,136.74579921041183
811,"Eine Fußsafari (auch „Buschgang“, „Wandersafari“ oder „Footing“ genannt) besteht aus einer Wanderung, die entweder ein paar Stunden oder mehrere Tage dauert.",BeetleLM/beetlelm_bul-deu_part_time,step-20000,deu,6.351720333099365,573.478434815386
812,Die Paralympics werden vom 24. August bis 5. September 2021 stattfinden. Einige Veranstaltungen werden an anderen Orten in ganz Japan abgehalten.,BeetleLM/beetlelm_bul-deu_part_time,step-20000,deu,5.870293617248535,354.35300915023777
813,"Tokio wird die einzige asiatische Stadt sein, die zwei olympische Sommerspiele ausgerichtet hat, nachdem sie bereits 1964 Austragungsort der Spiele war.",BeetleLM/beetlelm_bul-deu_part_time,step-20000,deu,5.585232734680176,266.46229053947025
814,"Wenn Sie Ihre Flüge und Unterkünfte für das Jahr 2020 gebucht haben, bevor die Verschiebung angekündigt wurde, könnten Sie in eine schwierige Situation geraten.",BeetleLM/beetlelm_bul-deu_part_time,step-20000,deu,5.664346218109131,288.39936918289027
815,"Die Stornierungsrichtlinien variieren, aber ab Ende März galten die meisten Stornierungsrichtlinien wegen des Coronavirus nicht bis zum Juli 2020, für den die Olympischen Spiele geplant waren.",BeetleLM/beetlelm_bul-deu_part_time,step-20000,deu,6.540842533111572,692.870098184189
816,"Man geht davon aus, dass die meisten Tickets für die Veranstaltung zwischen 2.500¥ und 130.000¥ kosten werden, ein durchschnittliches Ticket ungefähr 7.000¥.",BeetleLM/beetlelm_bul-deu_part_time,step-20000,deu,5.177535533905029,177.2454568735713
817,"Feuchte Kleidung zu bügeln kann beim Trocknen helfen. Viele Hotels verleihen Bügeleisen und Bügelbrett, auch wenn man man nicht im Zimmer anwesend ist.",BeetleLM/beetlelm_bul-deu_part_time,step-20000,deu,6.468915939331055,644.7843625894116
818,"Wenn kein Bügeleisen verfügbar ist oder man keine gebügelten Socken tragen will, kann man versuchen, einen Föhn zu verwenden, falls einer vorhanden ist.",BeetleLM/beetlelm_bul-deu_part_time,step-20000,deu,6.178219795227051,482.1328966447591
819,"Geben Sie acht, dass der Stoff nicht zu heiß wird (das kann ihn schrumpfen lassen oder in extremen Fällen zu Verbrennungen führen).",BeetleLM/beetlelm_bul-deu_part_time,step-20000,deu,5.669835090637207,289.9867089250222
820,"Zur Reinigung von Wasser gibt es verschiedene Verfahren. Einige davon erweisen sich als wirksamer, um bestimmten Gefahren entgegenzuwirken.",BeetleLM/beetlelm_bul-deu_part_time,step-20000,deu,6.183288097381592,484.58269475799165
821,"In einigen Gebieten genügt es, Wasser eine Minute lang abzukochen, in anderen müssen es mehrere Minuten sein.",BeetleLM/beetlelm_bul-deu_part_time,step-20000,deu,5.955739974975586,385.9624075578295
822,"Die Wirksamkeit von Filtern variiert stark, und wenn Sie Bedenken haben, dann sollten Sie erwägen, Ihr Wasser in einer versiegelten Flasche von einem seriösen Unternehmen zu kaufen.",BeetleLM/beetlelm_bul-deu_part_time,step-20000,deu,5.9322943687438965,377.01854180450016
823,"Reisende können auf tierische Schädlinge stoßen, die sie aus ihren Heimatregionen nicht kennen.",BeetleLM/beetlelm_bul-deu_part_time,step-20000,deu,5.834543228149414,341.9085241875317
824,"Ungeziefer kann Nahrungsmittel zerstören, Reizungen hervorrufen oder schlimmstenfalls sogar allergische Reaktionen auslösen, Gift verabreichen oder Krankheiten übertragen.",BeetleLM/beetlelm_bul-deu_part_time,step-20000,deu,6.953935146331787,1047.2627623947515
825,"Infektionskrankheiten als solche oder gefährliche Tiere, die Menschen mit Gewalt verletzen oder töten können, werden gewöhnlich nicht als Ungeziefer eingestuft.",BeetleLM/beetlelm_bul-deu_part_time,step-20000,deu,5.811403274536133,334.0876135300548
826,"Zollfreies Einkaufen ist die Möglichkeit, Waren zu kaufen, die an bestimmten Orten von Abgaben und Verbrauchssteuern befreit sind.",BeetleLM/beetlelm_bul-deu_part_time,step-20000,deu,6.659306526184082,780.0098331323273
827,"Reisende, deren Zielland eine hohe Besteuerung aufweist, können manchmal eine beträchtliche Menge an Geld sparen, insbesondere bei Produkten wie alkoholischen Getränken und Tabak.",BeetleLM/beetlelm_bul-deu_part_time,step-20000,deu,6.916105270385742,1008.3849498148937
828,"Der Abschnitt zwischen Point Marion und Fairmount auf dem Highway Buffalo-Pittsburgh ist die wohl größte fahrerische Herausforderung, da er häufig durch entlegenes, unerschlossenes Gelände führt.",BeetleLM/beetlelm_bul-deu_part_time,step-20000,deu,6.211288928985596,498.3431664584235
