sentence_id,sentence,repo,revision,iso_code,nll,ppl
0,"'Inmiddels hebben we muizen van 4 maanden oud die geen diabetes hebben, maar dat eerder wel hebben,' voegde hij er nog aan toe.",BeetleLM/beetlelm_nld-ind_balanced,step-2444,nld,7.6691999435424805,2141.3675447984797
1,"Professor Ehud Ur in de geneeskunde aan Dalhousie University in Halifax, Nova Scotia, tevens voorzitter van de klinische en wetenschappelijke divisie van de Canadian Diabetes Association, herinnerde eraan dat ze nog maar net zijn begonnen met het onderzoek.",BeetleLM/beetlelm_nld-ind_balanced,step-2444,nld,8.190369606018066,3606.0548197475136
2,"Net als sommige andere deskundigen, is hij sceptisch over de vraag of zijn diabetes kan worden genezen, waarbij hij opmerkt dat deze bevindingen geen waarde hebben voor mensen die al type 1-diabetes hebben.",BeetleLM/beetlelm_nld-ind_balanced,step-2444,nld,7.666888236999512,2136.4230487481473
3,"Op maandag kondigde Sara Danius, de permanente secretaris van de nobelcommissie voor literatuur bij de Zweedse Academie, tijdens een radioprogramma op Sveriges Radio in Zweden aan dat de commissie Bob Dylan niet direct kon bereiken om hem te vertellen dat hij de Nobelprijs voor literatuur van 2016 had gewonnen en geen moeite meer zou doen om hem te bereiken.",BeetleLM/beetlelm_nld-ind_balanced,step-2444,nld,7.936426162719727,2797.3453655618146
4,"Danius verklaarde, 'We doen momenteel niks. Ik heb met zijn naaste medewerker gebeld en gemailed en vriendelijke antwoorden gekregen. Op dit moment is dat genoeg.'",BeetleLM/beetlelm_nld-ind_balanced,step-2444,nld,8.1462984085083,3450.582748977313
5,"Eerder merkte Jamie Siminoff, de CEO van Ring, op dat het bedrijf is opgericht toen zijn deurbel van de winkel niet hoorbaar was in zijn garage.",BeetleLM/beetlelm_nld-ind_balanced,step-2444,nld,7.321041584014893,1511.7777935699685
6,Hij zei dat hij daarop een wifi-deurbel maakte.,BeetleLM/beetlelm_nld-ind_balanced,step-2444,nld,7.674406051635742,2152.5448054724448
7,"Siminoff zei dat de verkoop steeg nadat hij in 2013 in een aflevering van Shark Tank verscheen, waarbij het panel van het programma de start-up niet wilde financieren.",BeetleLM/beetlelm_nld-ind_balanced,step-2444,nld,7.615962505340576,2030.348039440552
8,Eind 2017 was Siminoff te zien op teleshoppingkanaal QVC.,BeetleLM/beetlelm_nld-ind_balanced,step-2444,nld,8.318136215209961,4097.515999096858
9,Ring trof ook een schikking in een rechtszaak met de ADT Corporation. Dat is een concurrerend beveiligingsbedrijf.,BeetleLM/beetlelm_nld-ind_balanced,step-2444,nld,7.516713619232178,1838.5152936090394
10,"Eén experimenteel vaccin lijkt in staat te zijn de ebola-sterfte terug te dringen, maar tot nu toe zijn nog geen medicijnen duidelijk geschikt voor de behandeling van bestaande infecties.",BeetleLM/beetlelm_nld-ind_balanced,step-2444,nld,8.026670455932617,3061.5311815810146
11,"Een cocktail van antilichamen, ZMapp, was aanvankelijk veelbelovend in het veld. Officiële onderzoeken toonden echter aan dat het minder voordelen had dan gewenst bij het voorkomen dat mensen overlijden.",BeetleLM/beetlelm_nld-ind_balanced,step-2444,nld,7.727149486541748,2269.1248024299107
12,"ZMapp was een controle in de PALM-proef, dus gebruikten wetenschappers het als baseline en vergeleken de drie andere behandelmethoden hiermee.",BeetleLM/beetlelm_nld-ind_balanced,step-2444,nld,7.577004909515381,1952.7714706530533
13,Het Amerikaanse Olympisch Comité heeft de steun van USA Gymnastics en begrijpt dat het noodzakelijk is dat de olympische familie een veilige plek promoot voor alle sporters.,BeetleLM/beetlelm_nld-ind_balanced,step-2444,nld,8.499197006225586,4910.823895612676
14,"Wij sluiten ons aan bij de verklaring van het USOC dat het het beste is voor onze atleten en clubs, en hun sport, om zinvolle veranderingen door te voeren in onze organisatie in plaats van certificeringen af te nemen.",BeetleLM/beetlelm_nld-ind_balanced,step-2444,nld,7.346712112426758,1551.0883308022524
15,"USA Gymnastics steunt een onafhankelijk onderzoek dat meer duidelijkheid kan geven over hoe misbruik op deze schaal, dat zo moedig door de slachtoffers van Larry Nassar is beschreven, zo lang onopgemerkt kon blijven, en omarmt alle nodige en toepasselijke veranderingen.",BeetleLM/beetlelm_nld-ind_balanced,step-2444,nld,8.247441291809082,3817.844562928435
16,"USA Gymnastics en de USOC hebben hetzelfde doel: zorgen dat atleten hun dromen in een veilige, positieve en krachtige omgeving kunnen najagen door de sport turnen en andere sporten zo veilig mogelijk maken.",BeetleLM/beetlelm_nld-ind_balanced,step-2444,nld,7.941381454467773,2811.2414290578954
17,Gedurende de jaren 60 werkte Brzezinksi als adviseur voor John F. Kennedy en daarna voor de regering van Lyndon B. Johnson.,BeetleLM/beetlelm_nld-ind_balanced,step-2444,nld,7.73400354385376,2284.730935443425
18,Hij adviseerde tijdens de selecties van 1976 Carter op het gebied van buitenlands beleid. Vervolgens volgde hij Henry Kissinger op als National Security Advisor (NSA); deze functie vervulde hij van 1977 tot 1981.,BeetleLM/beetlelm_nld-ind_balanced,step-2444,nld,8.427939414978027,4573.067183899741
19,"Als NSA stond hij Carter bij in de diplomatieke afhandeling van wereldwijde kwesties, zoals de Camp David-akkoorden in 1978, het stabiliseren van de relatie tussen de VS en China aan het eind van de jaren '70 en de Iraanse Revolutie, de daarop volgende gijzelaarscrisis en de invasie van Afghanistan door de Sovjet-Unie in 1979.",BeetleLM/beetlelm_nld-ind_balanced,step-2444,nld,7.562839508056641,1925.3046771780778
20,De film met Ryan Gosling en Emma Stone in de hoofdrollen werd voor alle belangrijke categorieën genomineerd.,BeetleLM/beetlelm_nld-ind_balanced,step-2444,nld,7.900675296783447,2699.104409502393
21,Gosling en Stone werden respectievelijk genomineerd voor Beste acteur en Beste actrice.,BeetleLM/beetlelm_nld-ind_balanced,step-2444,nld,8.685016632080078,5913.638852909953
22,"Onder de overige nominaties bevonden zich onder meer de categorieën beste film, regisseur, cinematografie, kostuumontwerp, filmmontage, originele muziek, productieontwerp, muziek, geluidseffecten en origineel scenario.",BeetleLM/beetlelm_nld-ind_balanced,step-2444,nld,8.279568672180176,3942.493508060053
23,"De nummers Audition (The Fools Who Dream) en City of Stars uit de film werden genomineerd voor Beste originele nummer. Lionsgate haalde 26 nominaties binnen, een record voor een studio.",BeetleLM/beetlelm_nld-ind_balanced,step-2444,nld,7.844346046447754,2551.2687066594194
24,In een verklaring van zijn perssecretaris liet de Amerikaanse president Donald Trump zondagavond weten dat de Amerikaanse troepen zich uit Syrië zouden terugtrekken.,BeetleLM/beetlelm_nld-ind_balanced,step-2444,nld,8.772582054138184,6454.817654360346
25,De aankondiging kwam na een telefonisch overleg tussen Trump en de Turkse president Recep Tayyip Erdoğan.,BeetleLM/beetlelm_nld-ind_balanced,step-2444,nld,8.34670352935791,4216.259035357751
26,"Ook gaven de Turken volgens het communiqué aan dat zij de gevangen strijders van ISIS zouden gaan bewaken, waarvan Europa ze niet terug wilde nemen.",BeetleLM/beetlelm_nld-ind_balanced,step-2444,nld,8.237884521484375,3781.532090657185
27,"Dit bewijst niet alleen de al wijdverspreide theorie dat in elk geval bepaalde dinosauriërs veren hadden, maar biedt ook meer details dan fossielen, zoals de kleur en driedimensionale plaatsing.",BeetleLM/beetlelm_nld-ind_balanced,step-2444,nld,8.137789726257324,3421.3473903548525
28,. Volgens wetenschappers was het verenkleed van dit dier kastanjebruin met een bleke of carotenoïdekleurige onderzijde.,BeetleLM/beetlelm_nld-ind_balanced,step-2444,nld,8.799354553222656,6629.963336484793
29,De vondst geeft ook inzicht in de evolutie van veren bij vogels.,BeetleLM/beetlelm_nld-ind_balanced,step-2444,nld,7.262657642364502,1426.0414136238635
30,"De onderzoekers trokken de conclusie dat de rachis waarschijnlijk een latere evolutionaire ontwikkeling was, doordat dinosaurusveren geen goed ontwikkelde schacht, oftewel een rachis, hebben, maar wel over andere kenmerken van veren beschikken - zoals weerhaken.",BeetleLM/beetlelm_nld-ind_balanced,step-2444,nld,7.928090572357178,2774.1247536973383
31,"De structuur van de veren lijkt erop te wijzen dat deze niet gebruikt werden om te vliegen, maar om de temperatuur te regelen of om hoe het eruit zag. De onderzoekers suggereerden dat dit de staart van een jonge dinosaurus is, maar dat dit monster juist volwassen veren laat zien en dus niet het dons van een kuiken.",BeetleLM/beetlelm_nld-ind_balanced,step-2444,nld,7.380664348602295,1604.6554644112496
32,"De onderzoekers suggereerden dat, ondanks dat het om de staart van een jonge dinosaurus gaat, het monster het verenkleed van een volwassene had en niet het dons van een kuiken.",BeetleLM/beetlelm_nld-ind_balanced,step-2444,nld,7.11557674407959,1230.993374646742
33,"Gistermorgen ontplofte een autobom bij het hoofdbureau van de politie in Gaziantep, Turkije. Hierbij kwamen twee politieagenten om het leven en raakten meer dan twintig andere personen gewond.",BeetleLM/beetlelm_nld-ind_balanced,step-2444,nld,7.851235866546631,2568.9071822597925
34,"Onder de gewonden zijn negentien politieagenten, zei de gouverneur.",BeetleLM/beetlelm_nld-ind_balanced,step-2444,nld,8.410238265991211,4492.830872829536
35,De politie verdenkt een vermeende Daesh-militair (ISIS) van de aanval.,BeetleLM/beetlelm_nld-ind_balanced,step-2444,nld,7.4764227867126465,1765.9124183708764
36,Hieruit bleek dat de zon dezelfde basisprincipes als andere sterren volgt: alle sterrenactiviteit in het stelsel is uitsluitend gebaseerd de helderheid en rotatie van de sterren.,BeetleLM/beetlelm_nld-ind_balanced,step-2444,nld,7.982473850250244,2929.168432367206
37,De helderheid en rotatie worden gebruikt om het getal van Rossby van een ster te bepalen. Dit is verwant aan de plasmastroming.,BeetleLM/beetlelm_nld-ind_balanced,step-2444,nld,7.211381912231445,1354.7631381382344
38,"Hoe kleiner het aantal Rossby-golven, hoe minder actief de ster is als het gaat om magnetische omkeringen.",BeetleLM/beetlelm_nld-ind_balanced,step-2444,nld,7.398219108581543,1633.073512147475
39,Iwasaki raakte tijdens zijn tocht op verschillende momenten in de problemen.,BeetleLM/beetlelm_nld-ind_balanced,step-2444,nld,7.795055866241455,2428.56509549298
40,"Piraten beroofden hem, een hondsdolle hond viel hem aan in Tibet, hij ontsnapte in Nepal aan het huwelijk en werd in India gearresteerd.",BeetleLM/beetlelm_nld-ind_balanced,step-2444,nld,7.804419040679932,2451.410962128516
41,"De 802.11n-norm is compatibel met beide frequenties: 2,4 Ghz en 5,0 Ghz.",BeetleLM/beetlelm_nld-ind_balanced,step-2444,nld,7.763003349304199,2351.9577591312413
42,"Mits het basisstation over dubbele radio's beschikt, maakt dit achterwaartse compatibiliteit met 802.11a, 802.11b en 802.11g mogelijk.",BeetleLM/beetlelm_nld-ind_balanced,step-2444,nld,7.861634254455566,2595.7590417190495
43,Snelheden van 802.11n zijn substantieel sneller dan die van voorlopers met een maximale theoretische capaciteit van 600Mbit/s.,BeetleLM/beetlelm_nld-ind_balanced,step-2444,nld,7.996898651123047,2971.727317498344
44,"Duvall is getrouwd met twee kinderen en maakte geen grote indruk op Miller, aan wie het verhaal verwant was.",BeetleLM/beetlelm_nld-ind_balanced,step-2444,nld,7.71712589263916,2246.4936292247094
45,"Op een verzoek om commentaar reageerde Millar: 'Mike praat veel tijdens de zitting ... Ik was me aan het voorbereiden, dus luisterde niet echt naar hem.'",BeetleLM/beetlelm_nld-ind_balanced,step-2444,nld,7.795423984527588,2429.4592592826184
46,"'We doen ons uiterste best de koolstofdioxide-uitstoot per eenheid van het BBP in 2020 met een aanzienlijke marge te verminderen in vergelijking met het niveau van 2005,' zei Hu.",BeetleLM/beetlelm_nld-ind_balanced,step-2444,nld,7.688360691070557,2182.7933550397242
47,"Hij heeft voor de bezuinigingen geen cijfers vastgesteld, omdat hij zegt dat deze zullen worden bepaald op basis van de economische productie van China.",BeetleLM/beetlelm_nld-ind_balanced,step-2444,nld,7.438048362731934,1699.4303110448554
48,Hu spoorde ontwikkelingslanden aan 'de oude manier van eerst vervuilen en later opruimen te vermijden'.,BeetleLM/beetlelm_nld-ind_balanced,step-2444,nld,7.883884429931641,2654.162469687544
49,"Hij voegde toe dat 'ze daarentegen niet gevraagd zouden moeten worden om verplichtingen aan te gaan die buiten hun ontwikkeling, niveau, verantwoordelijkheid en mogelijkheden liggen.'",BeetleLM/beetlelm_nld-ind_balanced,step-2444,nld,8.002921104431152,2989.678407054689
50,De Irakese studiegroep presenteerde hun rapport vandaag om 12.00 uur GMT.,BeetleLM/beetlelm_nld-ind_balanced,step-2444,nld,8.906266212463379,7378.061490771502
51,"De waarschuwing is dat niemand kan garanderen dat geen enkele handelswijze in Irak op dit moment een einde zal maken aan sektarische oorlogsvoering, toenemend geweld of de neiging naar chaos.",BeetleLM/beetlelm_nld-ind_balanced,step-2444,nld,8.06241226196289,3172.9348601834226
52,In het begin van het rapport staat een pleidooi voor een open discussie en voor consensusvorming in de VS over het beleid met betrekking tot het Midden-Oosten.,BeetleLM/beetlelm_nld-ind_balanced,step-2444,nld,7.414942264556885,1660.6132893848776
53,In het rapport wordt sterke kritiek geuit op vrijwel elk onderdeel van het huidige bestuursbeleid jegens Irak en raadt dringend een andere koers aan.,BeetleLM/beetlelm_nld-ind_balanced,step-2444,nld,8.227836608886719,3743.7258417451503
54,"Het rapport bevat 78 aanbevelingen, waarvan de eerste is dat dit jaar nog diplomatieke actie moet worden ondernomen om de Iraakse grenzen te beschermen tegen vijandelijke machten en de diplomatieke verstandhoudingen met omliggende landen te herstellen.",BeetleLM/beetlelm_nld-ind_balanced,step-2444,nld,8.135114669799805,3412.207323472804
55,"Cristina Fernández de Kirchner, senator en de vrouw van de Argentijnse president, heeft gisteravond in La Plata, een stad op 50 km (31 mijl) afstand van Buenos Aires, aangekondigd zich verkiesbaar te willen stellen als president.",BeetleLM/beetlelm_nld-ind_balanced,step-2444,nld,7.882907390594482,2651.570514974499
56,"Mevrouw Kirchner kondigde haar intentie om voor het presidentschap te gaan aan in het Argentijnse Theater, waar ze in 2005 haar campagne voor de senaat startte als lid van de deelstaatafvaardiging van Buenos Aires.",BeetleLM/beetlelm_nld-ind_balanced,step-2444,nld,7.772939682006836,2375.444084665945
57,Het debat ontstond door een discussie over het investeren en opnieuw opbouwen na de orkaan Katrina. Enkele fiscale conservatieven noemden dit gekscherend 'De New Orleans Deal van Bush.',BeetleLM/beetlelm_nld-ind_balanced,step-2444,nld,8.360101699829102,4273.129320819717
58,Liberale kritiek op de reconstructiewerkzaamheden is gericht op het toekennen van reconstructiecontracten aan vermeende insiders uit Washington.,BeetleLM/beetlelm_nld-ind_balanced,step-2444,nld,8.4638671875,4740.354436374498
59,De begrafenis werd door meer dan vier miljoen mensen bijgewoond in Rome.,BeetleLM/beetlelm_nld-ind_balanced,step-2444,nld,7.984334945678711,2934.624970339859
60,Er waren zo veel aanwezigen dat niet iedereen toegang kon krijgen tot de begrafenis op het Sint-Pietersplein.,BeetleLM/beetlelm_nld-ind_balanced,step-2444,nld,7.57931661605835,1957.290927054492
61,Op verschillende plekken in Rome waren grote televisieschermen geplaatst zodat mensen de ceremonie konden zien.,BeetleLM/beetlelm_nld-ind_balanced,step-2444,nld,8.609399795532227,5482.956794833026
62,"Soortgelijke opstellingen werden in veel andere Italiaanse steden en in de rest van de wereld gemaakt, en dan vooral in Polen. Hier keek een groot aantal mensen naar.",BeetleLM/beetlelm_nld-ind_balanced,step-2444,nld,7.258810997009277,1420.5664748685642
63,"Historici hebben kritiek geuit op eerdere beleidsregels van de FBI, omdat ze hun middelen focusten op gemakkelijk op te lossen zaken, voornamelijk zaken met gestolen auto's, om op deze manier de succesratio van het bureau op te krikken.",BeetleLM/beetlelm_nld-ind_balanced,step-2444,nld,7.72860860824585,2272.4381483780917
64,Vanaf boekjaar 2005 financierde het Congres het initiatief tegen obsceniteit en verklaarde dat de FBI tien agenten moet inzetten op volwassenenpornografie.,BeetleLM/beetlelm_nld-ind_balanced,step-2444,nld,8.39037799835205,4404.482266647491
65,"Robin Uthappa behaalde de hoogste score van de inning met 70 runs met slechts 41 ballen, door 11 vieren en 2 zessen te slaan.",BeetleLM/beetlelm_nld-ind_balanced,step-2444,nld,8.143232345581055,3440.019247588668
66,In de middelste orde presteerden de slagmannen Sachin Tendulkar en Rahul Dravid goed en maakten samen honderd runs.,BeetleLM/beetlelm_nld-ind_balanced,step-2444,nld,8.362863540649414,4284.947336034764
67,"Maar nadat India de wicket van de captain verloor, scoorden ze nog maar 36 runs waarbij ze 7 wickets verloren om de innings te beëindigen.",BeetleLM/beetlelm_nld-ind_balanced,step-2444,nld,7.641792297363281,2083.4746783382343
68,President van de Verenigde Staten George W. Bush arriveerde op 16 november in de ochtend in Singapore voor een rondreis van een week door Azië.,BeetleLM/beetlelm_nld-ind_balanced,step-2444,nld,7.300472259521484,1480.9991784209362
69,"Hij werd ontvangen door Wong Kan Seng, de vicepremier van Singapore, en besprak problemen op het gebied van handel en terrorisme met de Minister-president van Singapore, Lee Hsien Loong.",BeetleLM/beetlelm_nld-ind_balanced,step-2444,nld,7.756604194641113,2336.955270487031
70,Bush sprak na de verliezen in de tussentijdse verkiezingen deze week voor een publiek over toenemende handelsbetrekkingen met Azië.,BeetleLM/beetlelm_nld-ind_balanced,step-2444,nld,8.098905563354492,3290.8644610182478
71,"Premier Stephen Harper is akkoord gegaan om de 'Clean Air Act' van de overheid naar een commissie voor alle partijen te sturen voor herziening, voorafgaand aan de tweede lezing, na de 25 minuten durende vergadering met NDP-leider Jack Layton bij PMO op dinsdag.",BeetleLM/beetlelm_nld-ind_balanced,step-2444,nld,7.731598854064941,2279.2434667670022
72,"Tijdens de vergadering met de Minister-president vroeg Layton om veranderingen in de milieuwet van de conservatieven, waarbij hij vroeg om het 'grondig en volledig herschrijven' van de milieuwet van de conservatieve partij.",BeetleLM/beetlelm_nld-ind_balanced,step-2444,nld,7.704705238342285,2218.763279521543
73,"Sinds de federale regering de financiering heeft overgenomen van het Mersey ziekenhuis in Devonport, Tasmanië, hebben de overheid en enkele federale parlementsleden deze wet bekritiseerd als stunt tijdens de beginperiode van de federale verkiezingen die in november worden gehouden.",BeetleLM/beetlelm_nld-ind_balanced,step-2444,nld,8.066131591796875,3184.758024965386
74,"Minister-president John Howard heeft echter verklaard met de wet slechts te willen voorkomen dat de voorzieningen van het ziekenhuis werden teruggeschaald door de Tasmaanse overheid, door 45 miljoen Australische dollars extra uit te trekken.",BeetleLM/beetlelm_nld-ind_balanced,step-2444,nld,8.131450653076172,3399.7278152998874
75,Volgens het laatste bulletin wees de stand van de zeespiegel op een vloedgolf. Er is enige duidelijke tsunami-activiteit geregistreerd nabij Pago Pago en Niue.,BeetleLM/beetlelm_nld-ind_balanced,step-2444,nld,8.232743263244629,3762.140149839815
76,"Er is in Tonga geen grote schade of ernstig letsel doorgegeven, hoewel de stroom voor enige tijd uitviel. Hierdoor leken de Tongaanse autoriteiten de tsunami-waarschuwing van het PTWC niet te kunnen ontvangen.",BeetleLM/beetlelm_nld-ind_balanced,step-2444,nld,7.955294132232666,2850.6266669510646
77,"De waarschuwingen werden ingetrokken, maar toch waren veertien scholen in Hawaï aan of nabij kustlijnen woensdag de hele dag gesloten.",BeetleLM/beetlelm_nld-ind_balanced,step-2444,nld,8.30528736114502,4045.2044056985046
78,"George W. Bush, de leider van de VS, juichte de bekendmaking toe.",BeetleLM/beetlelm_nld-ind_balanced,step-2444,nld,6.929220199584961,1021.6969491956684
79,"Een woordvoerder van Bush, Gordon Johndroe, beschreef de belofte van Noord-Korea 'een grote vooruitgang in ons doel om het Koreaanse schiereiland te denucleariseren.'",BeetleLM/beetlelm_nld-ind_balanced,step-2444,nld,8.150643348693848,3465.6079427733
80,"De tiende storm van het Atlantische orkaanseizoen die een naam kreeg, subtropische storm Jerry, vormde zich vandaag boven de Atlantische Oceaan.",BeetleLM/beetlelm_nld-ind_balanced,step-2444,nld,8.174304008483887,3548.5842797169757
81,Volgens de NHC (National Hurricane Center) levert Jerry momenteel geen gevaar voor het vasteland op.,BeetleLM/beetlelm_nld-ind_balanced,step-2444,nld,8.888050079345703,7244.878463180636
82,Volgens berekeningen van het U.S. Corps of Engineers kan 6 inches regen mogelijk de eerder beschadigde dijken doen doorbreken.,BeetleLM/beetlelm_nld-ind_balanced,step-2444,nld,7.835477352142334,2528.7423218678396
83,"In de Ninth Ward stond het water tijdens de orkaan Katrina op meer dan 20 voet hoogte. Nog steeds staat het water hier tot aan de middel, omdat de nabije dijk het water niet kon tegenhouden.",BeetleLM/beetlelm_nld-ind_balanced,step-2444,nld,7.305307388305664,1488.1773398608327
84,Het water stroomt over een stuk van 100 voet breed over de dijk.,BeetleLM/beetlelm_nld-ind_balanced,step-2444,nld,7.028836727142334,1128.7168405336479
85,De Commons-beheerder Adam Cuerden uitte vorige maand tijdens zijn gesprek met Wikinews zijn frustraties over de verwijdering.,BeetleLM/beetlelm_nld-ind_balanced,step-2444,nld,8.278766632080078,3939.3327378738677
86,"'Hij [Wales] loog in principe al tegen ons vanaf het begin. Allereerst door te doen alsof het om juridische redenen ging. Ten tweede door net te doen alsof hij naar ons luisterde, tot hij de kunst verwijderde.'",BeetleLM/beetlelm_nld-ind_balanced,step-2444,nld,8.021451950073242,3045.596177789488
87,De ergernissen binnen de gemeenschap resulteerde in de huidige pogingen om een beleid op te stellen met betrekking tot seksuele inhoud van de site die miljoenen stukken media-inhoud met een open licentie host.,BeetleLM/beetlelm_nld-ind_balanced,step-2444,nld,8.217015266418457,3703.4321116345304
88,"Het voltooide werk was voornamelijk theoretisch van aard, maar het programma is geschreven voor de simulatie van waarnemingen van het Sagittarius Galaxy.",BeetleLM/beetlelm_nld-ind_balanced,step-2444,nld,7.803510665893555,2449.185173297747
89,Het team was op zoek naar het effect dat zou worden veroorzaakt door de getijdenkrachten tussen de donkere materie van het heelal en die van de melkweg.,BeetleLM/beetlelm_nld-ind_balanced,step-2444,nld,7.104443550109863,1217.364493890305
90,"Vergelijkbaar met hoe de maan kracht uitoefent op de aarde, wat leidt tot getijden, oefent de Melkweg kracht uit op het sterrenstelsel Sagittarius.",BeetleLM/beetlelm_nld-ind_balanced,step-2444,nld,7.672171592712402,2147.740402143867
91,De onderzoekers concludeerden dat donkere materie andere donkere materie op dezelfde manier beïnvloedt als gewone materie.,BeetleLM/beetlelm_nld-ind_balanced,step-2444,nld,8.903849601745605,7360.25311491924
92,"Volgens deze theorie bevindt het grootste deel van de donkere materie in een sterrenstelsel zich rondom, in een soort kring, en bestaat het uit een grote hoeveelheid kleinere deeltjes.",BeetleLM/beetlelm_nld-ind_balanced,step-2444,nld,7.5260796546936035,1855.8157850834948
93,Op televisiebeelden zie je witte rook van de plant af komen.,BeetleLM/beetlelm_nld-ind_balanced,step-2444,nld,7.288473606109619,1463.3353654782
94,"Lokale autoriteiten geven de volgende waarschuwing: inwoners die in de buurt van de fabriek wonen, moeten binnen blijven, airconditioners uitschakelen en geen kraanwater drinken.",BeetleLM/beetlelm_nld-ind_balanced,step-2444,nld,7.585344314575195,1969.1245154950068
95,Het Japanse agentschap voor kernenergie meldt dat er bij de fabriek radioactief cesium en jodium is waargenomen,BeetleLM/beetlelm_nld-ind_balanced,step-2444,nld,8.621451377868652,5549.434878534685
96,De autoriteiten vermoeden dat dit erop duidt dat er op de plek containers met uraniumbrandstof mogelijk gescheurd zijn en lekken.,BeetleLM/beetlelm_nld-ind_balanced,step-2444,nld,7.894942760467529,2683.6759597793853
97,XDR-TB (Extremely Drug Resistant Tuberculosis) werd door Dr. Tony Moll ontdekt in de provincie KwaZulu-Natal van Zuid-Afrika.,BeetleLM/beetlelm_nld-ind_balanced,step-2444,nld,8.064805030822754,3180.536050230047
98,Hij verklaarde in een interview dat de nieuwe variant 'heel erg verontrustend en zorgwekkend is vanwege het erg hoge sterftecijfer'.,BeetleLM/beetlelm_nld-ind_balanced,step-2444,nld,8.423312187194824,4551.955442459247
99,"Dokter Moll denkt dat sommige patiënten de ziekte hebben opgelopen in het ziekenhuis, waaronder ook twee zorgmedewerkers uit het ziekenhuis.",BeetleLM/beetlelm_nld-ind_balanced,step-2444,nld,8.05345630645752,3144.645066910494
100,Een besmette persoon kan in een jaar tijd mogelijk 10 tot 15 nauwe contacten infecteren.,BeetleLM/beetlelm_nld-ind_balanced,step-2444,nld,8.4137544631958,4508.6563586447155
101,Het percentage XDR-TB onder alle tuberculosepatiënten lijkt echter nog steeds aan de lage kant: 6000 uit 330.000 geïnfecteerde mensen in totaal op een willekeurig moment in Zuid-Afrika.,BeetleLM/beetlelm_nld-ind_balanced,step-2444,nld,8.294896125793457,4003.387376246214
102,"De satellieten, die beide meer dan 1.000 pond wogen en zich met ongeveer 17.500 mijl per uur voortbewogen, kwamen 491 mijl boven aarde in botsing.",BeetleLM/beetlelm_nld-ind_balanced,step-2444,nld,7.796244144439697,2431.45262170142
103,Wetenschappers zeggen dat door de botsing een enorme explosie is ontstaan.,BeetleLM/beetlelm_nld-ind_balanced,step-2444,nld,7.742515563964844,2304.2616159633767
104,Ze proberen nog steeds te achterhalen hoe groot de botsing is geweest en hoe deze de aarde zal beïnvloeden.,BeetleLM/beetlelm_nld-ind_balanced,step-2444,nld,7.731668472290039,2279.4021491752537
