sentence_id,sentence,repo,revision,iso_code,nll,ppl
770,"The harbor was the site of an infamous naval standoff in 1889 when seven ships from Germany, the US, and Britain refused to leave the harbor.",BeetleLM/beetlelm_nld_L1-eng_L2_simultaneous,step-30000,eng,4.725264072418213,112.7602713203151
771,"All the ships were sunk, except for one British cruiser. Nearly 200 American and German lives were lost.",BeetleLM/beetlelm_nld_L1-eng_L2_simultaneous,step-30000,eng,6.118918418884277,454.3729873942391
772,"During the struggle for independence organised by the Mau movement, a peaceful gathering in the town resulted in the killing of the paramount chief Tupua Tamasese Lealofi III.",BeetleLM/beetlelm_nld_L1-eng_L2_simultaneous,step-30000,eng,5.943746566772461,381.36105098227785
773,"There are many beaches, due to Auckland's straddling of two harbours. The most popular ones are in three areas.",BeetleLM/beetlelm_nld_L1-eng_L2_simultaneous,step-30000,eng,4.855220794677734,128.40904011759244
774,North Shore beaches (in North Harbour district) are on the Pacific Ocean and stretch from Long Bay in the north to Devonport in the south.,BeetleLM/beetlelm_nld_L1-eng_L2_simultaneous,step-30000,eng,4.8291096687316895,125.0995310333579
775,"They are almost all sandy beaches with safe swimming, and most have shade provided by pohutukawa trees.",BeetleLM/beetlelm_nld_L1-eng_L2_simultaneous,step-30000,eng,6.8786234855651855,971.2884466076107
776,"Tamaki Drive beaches are on the Waitemata Harbour, in the upmarket suburbs of Mission Bay and St Heliers in Central Auckland.",BeetleLM/beetlelm_nld_L1-eng_L2_simultaneous,step-30000,eng,6.468940734863281,644.8003505590676
777,These are sometimes-crowded family beaches with a good range of shops lining the shore. Swimming is safe.,BeetleLM/beetlelm_nld_L1-eng_L2_simultaneous,step-30000,eng,5.658470630645752,286.70982186700445
778,"The main local beer is 'Number One', it is not a complex beer, but pleasant and refreshing. The other local beer is called ""Manta"".",BeetleLM/beetlelm_nld_L1-eng_L2_simultaneous,step-30000,eng,5.785571575164795,325.5680735668171
779,"There are many French wines to be had, but the New Zealand and Australian wines might travel better.",BeetleLM/beetlelm_nld_L1-eng_L2_simultaneous,step-30000,eng,5.067036151885986,158.70325724834632
780,"The local tap water is perfectly safe to drink, but bottled water is easy to find if you are fearful.",BeetleLM/beetlelm_nld_L1-eng_L2_simultaneous,step-30000,eng,6.397343158721924,600.2481534060823
781,"For Australians, the idea of 'flat white' coffee is foreign. A short black is 'espresso', cappuccino comes heaped high with cream (not froth), and tea is served without milk.",BeetleLM/beetlelm_nld_L1-eng_L2_simultaneous,step-30000,eng,5.884778022766113,359.52295322772534
782,The hot chocolate is up to Belgian standards. Fruit juices are pricey but excellent.,BeetleLM/beetlelm_nld_L1-eng_L2_simultaneous,step-30000,eng,6.660059452056885,780.597343864994
783,"Many trips to the reef are made all year around, and injuries due to any of these causes on the reef are rare.",BeetleLM/beetlelm_nld_L1-eng_L2_simultaneous,step-30000,eng,5.950218200683594,383.83708343823423
784,"Still, take advice from authorities, obey all signs, and pay close attention to safety warnings.",BeetleLM/beetlelm_nld_L1-eng_L2_simultaneous,step-30000,eng,6.501351356506348,666.0410841204722
785,Box jellyfish occur near beaches and near river estuaries from October to April north of 1770. They can occasionally be found outside these times.,BeetleLM/beetlelm_nld_L1-eng_L2_simultaneous,step-30000,eng,5.4922075271606445,242.79258693757166
786,"Sharks do exist, however they rarely attack humans. Most sharks are scared of humans and would swim away.",BeetleLM/beetlelm_nld_L1-eng_L2_simultaneous,step-30000,eng,5.6943678855896,297.1888768282661
787,"Saltwater Crocodiles do not actively live in the ocean, their primary habitat is in river estuaries north from Rockhampton.",BeetleLM/beetlelm_nld_L1-eng_L2_simultaneous,step-30000,eng,5.07909631729126,160.62883282193872
788,Booking in advance gives the traveller peace of mind that they will have somewhere to sleep once they arrive at their destination.,BeetleLM/beetlelm_nld_L1-eng_L2_simultaneous,step-30000,eng,5.912075519561768,369.47220694993354
789,"Travel agents often have deals with specific hotels, although you may find it possible to book other forms of accommodation, like camping grounds, through a travel agent.",BeetleLM/beetlelm_nld_L1-eng_L2_simultaneous,step-30000,eng,5.525484085083008,251.0078177555023
790,"Travel agents usually offer packages that include breakfast, transportation arrangements to/from the airport or even combined flight and hotel packages.",BeetleLM/beetlelm_nld_L1-eng_L2_simultaneous,step-30000,eng,7.1619181632995605,1289.381807239815
791,They can also hold the reservation for you if you need time to think about the offer or procure other documents for your destination (e.g. visa).,BeetleLM/beetlelm_nld_L1-eng_L2_simultaneous,step-30000,eng,4.884379863739014,132.20845265190562
792,Any amendments or requests though should be coursed through the travel agent first and not directly with the hotel.,BeetleLM/beetlelm_nld_L1-eng_L2_simultaneous,step-30000,eng,6.537067890167236,690.2596907341759
793,"For some festivals, the vast majority of the attendants to music festivals decide to camp on site, and most attendants consider it a vital part of the experience.",BeetleLM/beetlelm_nld_L1-eng_L2_simultaneous,step-30000,eng,5.053521156311035,156.57281233365657
794,If you want to be close to the action you're going to have to get in early to get a camping site close to the music.,BeetleLM/beetlelm_nld_L1-eng_L2_simultaneous,step-30000,eng,4.155394077301025,63.77709270082916
795,"Remember that even though music on the main stages may have finished, there may be sections of the festival that will keep playing music until late into the night.",BeetleLM/beetlelm_nld_L1-eng_L2_simultaneous,step-30000,eng,5.75327730178833,315.2220470582304
796,Some festivals have special camping areas for families with young children.,BeetleLM/beetlelm_nld_L1-eng_L2_simultaneous,step-30000,eng,5.552283763885498,257.82569707810603
797,"If crossing the Northern Baltic in winter, check the cabin location, as going through ice causes quite horrible noise for those most affected.",BeetleLM/beetlelm_nld_L1-eng_L2_simultaneous,step-30000,eng,7.714498519897461,2240.599000183644
798,Saint Petersburg cruises include time in town. Cruise passengers are exempted from visa requirements (check the terms).,BeetleLM/beetlelm_nld_L1-eng_L2_simultaneous,step-30000,eng,7.972946643829346,2901.3941557870776
799,"Casinos typically make many efforts to maximize time and money spent by guests. Windows and clocks are usually absent, and exits can be hard to find.",BeetleLM/beetlelm_nld_L1-eng_L2_simultaneous,step-30000,eng,5.829489707946777,340.18504104939245
800,"They usually have special food, drink and entertainment offers, to keep guests in a good mood, and keep them at the premise.",BeetleLM/beetlelm_nld_L1-eng_L2_simultaneous,step-30000,eng,5.562928676605225,260.58488874305414
801,"Some venues offer alcoholic beverages on the house. However, drunkenness impairs judgement, and all good gamblers know the importance of staying sober.",BeetleLM/beetlelm_nld_L1-eng_L2_simultaneous,step-30000,eng,6.231120586395264,508.3247862996345
802,"Anyone who's going to drive at high latitudes or over mountain passes should consider the possibility of snow, ice, or freezing temperatures.",BeetleLM/beetlelm_nld_L1-eng_L2_simultaneous,step-30000,eng,5.352446556091309,211.12419370742572
803,"On icy and snowy roadways, friction is low and you cannot drive as if you were on bare asphalt.",BeetleLM/beetlelm_nld_L1-eng_L2_simultaneous,step-30000,eng,6.6475372314453125,770.883478232904
804,"During blizzards, enough snow to get you stuck can fall in very little time.",BeetleLM/beetlelm_nld_L1-eng_L2_simultaneous,step-30000,eng,6.207095146179199,496.2575997189243
805,Visibility may also be restricted by falling or blowing snow or by condensation or ice on vehicle windows.,BeetleLM/beetlelm_nld_L1-eng_L2_simultaneous,step-30000,eng,6.388377666473389,594.8906852950154
806,"On the other hand, icy and snowy conditions are normal in many countries, and traffic goes on mostly uninterrupted all year round.",BeetleLM/beetlelm_nld_L1-eng_L2_simultaneous,step-30000,eng,5.904411315917969,366.6513204476802
807,Safaris are perhaps the greatest tourism draw in Africa and the highlight for many visitors.,BeetleLM/beetlelm_nld_L1-eng_L2_simultaneous,step-30000,eng,5.710539817810059,302.034067652814
808,"The term safari in popular use refers to overland travel to view the stunning African wildlife, particularly on savanna.",BeetleLM/beetlelm_nld_L1-eng_L2_simultaneous,step-30000,eng,5.204273223876953,182.04851616301292
809,"Some animals, such as elephants and giraffes, tend to approach closely to cars and standard equipment will allow good viewing.",BeetleLM/beetlelm_nld_L1-eng_L2_simultaneous,step-30000,eng,5.032376289367676,153.29685791720377
810,"Lions, cheetahs and leopards are sometimes shy and you will see them better with binoculars.",BeetleLM/beetlelm_nld_L1-eng_L2_simultaneous,step-30000,eng,5.889835357666016,361.34578666080813
811,"A walking safari (also called a ""bush walk"", ""hiking safari"", or going ""footing"") consists of hiking, either for a few hours or several days.",BeetleLM/beetlelm_nld_L1-eng_L2_simultaneous,step-30000,eng,5.235146999359131,187.75670443092258
812,The Paralympics will take place from 24 August to 5 September 2021. Some events will be held in other locations throughout Japan.,BeetleLM/beetlelm_nld_L1-eng_L2_simultaneous,step-30000,eng,4.125848293304443,61.92031356509636
813,"Tokyo will be the only Asian city to have hosted two summer Olympics, having hosted the games in 1964.",BeetleLM/beetlelm_nld_L1-eng_L2_simultaneous,step-30000,eng,4.694181442260742,109.3092960409476
814,"If you booked your flights and accommodation for 2020 before the postponement was announced, you may have a tricky situation.",BeetleLM/beetlelm_nld_L1-eng_L2_simultaneous,step-30000,eng,5.459340572357178,234.94244572907016
815,"Cancellation policies vary, but as of late March most coronavirus-based cancellation policies don't extend to July 2020, when the Olympics had been scheduled.",BeetleLM/beetlelm_nld_L1-eng_L2_simultaneous,step-30000,eng,5.496895790100098,243.93353486701434
816,"It's expected that most event tickets will cost between ¥2,500 and ¥130,000, with typical tickets costing around ¥7,000.",BeetleLM/beetlelm_nld_L1-eng_L2_simultaneous,step-30000,eng,5.298244476318359,199.9854224853502
817,"Ironing damp clothes can help them dry. Many hotels have an iron and ironing board available for loan, even if one is not present in the room.",BeetleLM/beetlelm_nld_L1-eng_L2_simultaneous,step-30000,eng,5.812751293182373,334.5382735433785
818,"If an iron isn't available, or if you don't fancy wearing ironed socks, then you can try using a hairdryer, if available.",BeetleLM/beetlelm_nld_L1-eng_L2_simultaneous,step-30000,eng,5.598687648773193,270.07174576983766
819,"Be careful not to allow fabric to become too hot (which can cause shrinkage, or in extreme cases, scorch).",BeetleLM/beetlelm_nld_L1-eng_L2_simultaneous,step-30000,eng,6.342094898223877,567.9849365572941
820,"There are different ways of purifying water, some more effective against specific threats.",BeetleLM/beetlelm_nld_L1-eng_L2_simultaneous,step-30000,eng,5.2634100914001465,193.13899120564045
821,"In some areas boiling water for a minute is enough, in others several minutes are needed.",BeetleLM/beetlelm_nld_L1-eng_L2_simultaneous,step-30000,eng,5.695801258087158,297.6151646325133
822,"Filters vary in effectiveness, and should you have a concern, then you should consider buying your water in a sealed bottle from a reputable company.",BeetleLM/beetlelm_nld_L1-eng_L2_simultaneous,step-30000,eng,6.691672325134277,805.6684658020258
823,Travellers may encounter animal pests that they are not familiar with in their home regions.,BeetleLM/beetlelm_nld_L1-eng_L2_simultaneous,step-30000,eng,5.431321144104004,228.45086265046828
824,"Pests can spoil food, cause irritation, or in a worse case cause allergic reactions, spread venom, or transmit infections.",BeetleLM/beetlelm_nld_L1-eng_L2_simultaneous,step-30000,eng,6.450148582458496,632.7963082587657
825,"Infectious diseases themselves, or dangerous animals that can injure or kill people by force, do not usually qualify as pests.",BeetleLM/beetlelm_nld_L1-eng_L2_simultaneous,step-30000,eng,5.892470359802246,362.2991891377174
826,Duty free shopping is the opportunity to buy goods exempted from taxes and excises at certain locations.,BeetleLM/beetlelm_nld_L1-eng_L2_simultaneous,step-30000,eng,6.861567974090576,954.8630949114315
827,"Travellers bound for countries with heavy taxation can sometimes save a considerable amount of money, especially on products such as alcoholic beverages and tobacco.",BeetleLM/beetlelm_nld_L1-eng_L2_simultaneous,step-30000,eng,5.749514579772949,314.03818279486427
828,"The stretch between Point Marion and Fairmont presents the most challenging driving conditions on the Buffalo-Pittsburgh Highway, passing frequently through isolated backwoods terrain.",BeetleLM/beetlelm_nld_L1-eng_L2_simultaneous,step-30000,eng,8.482131004333496,4827.726849703611
829,"If you're not used to driving on country roads, keep your wits about you: steep grades, narrow lanes, and sharp curves predominate.",BeetleLM/beetlelm_nld_L1-eng_L2_simultaneous,step-30000,eng,6.265533447265625,526.1221695471278
830,Posted speed limits are noticeably lower than in previous and subsequent sections — commonly 35-40 mph (56-64 km/h) — and strict obedience to them is even more important than otherwise.,BeetleLM/beetlelm_nld_L1-eng_L2_simultaneous,step-30000,eng,5.800611972808838,330.5017561220661
831,"Curiously, though, mobile phone service is much stronger here than along many other stretches of the route, e.g. the Pennsylvania Wilds.",BeetleLM/beetlelm_nld_L1-eng_L2_simultaneous,step-30000,eng,5.935302734375,378.15445919868193
832,"German pastries are quite good, and in Bavaria, are quite rich and varied, similar to those of their southern neighbor, Austria.",BeetleLM/beetlelm_nld_L1-eng_L2_simultaneous,step-30000,eng,5.039939880371094,154.46072862506063
833,"Fruit pastries are common, with apples cooked into pastries year round, and cherries and plums making their appearances during the summer.",BeetleLM/beetlelm_nld_L1-eng_L2_simultaneous,step-30000,eng,5.704714775085449,300.2798205469145
834,"Many German baked goods also feature almonds, hazelnuts, and other tree nuts. Popular cakes often pair particularly well with a cup of strong coffee.",BeetleLM/beetlelm_nld_L1-eng_L2_simultaneous,step-30000,eng,6.022276878356934,412.5167777813522
835,"If you want some small though rich pastries, try what depending on region are called Berliner, Pfannkuchen or Krapfen.",BeetleLM/beetlelm_nld_L1-eng_L2_simultaneous,step-30000,eng,7.1465864181518555,1269.7641050587615
836,"A curry is a dish based on herbs and spices, together with either meat or vegetables.",BeetleLM/beetlelm_nld_L1-eng_L2_simultaneous,step-30000,eng,4.887382507324219,132.60602409814283
837,"A curry can be either ""dry"" or ""wet"" depending on the amount of liquid.",BeetleLM/beetlelm_nld_L1-eng_L2_simultaneous,step-30000,eng,4.681562423706055,107.93858669854187
838,"In inland regions of Northern India and Pakistan, yogurt is commonly used in curries; in Southern India and some other coastal regions of the subcontinent, coconut milk is commonly used.",BeetleLM/beetlelm_nld_L1-eng_L2_simultaneous,step-30000,eng,4.627532482147217,102.26142065644409
839,"With 17,000 islands to choose from, Indonesian food is an umbrella term covering a vast variety of regional cuisines found across the nation.",BeetleLM/beetlelm_nld_L1-eng_L2_simultaneous,step-30000,eng,5.265954494476318,193.6310403692356
840,"But, if used without further qualifiers, the term tends to mean the food originally from the central and eastern parts of the main island Java.",BeetleLM/beetlelm_nld_L1-eng_L2_simultaneous,step-30000,eng,5.068199634552002,158.88801319652467
841,"Now widely available throughout the archipelago, Javanese cuisine features an array of simply seasoned dishes, the predominant flavorings the Javanese favor being peanuts, chillies, sugar (especially Javanese coconut sugar) and various aromatic spices.",BeetleLM/beetlelm_nld_L1-eng_L2_simultaneous,step-30000,eng,5.705597877502441,300.54511550628206
842,Stirrups are supports for the rider's feet that hang down on either side of the saddle.,BeetleLM/beetlelm_nld_L1-eng_L2_simultaneous,step-30000,eng,5.17510461807251,176.8151113649922
843,They provide greater stability for the rider but can have safety concerns due to the potential for a rider's feet to get stuck in them.,BeetleLM/beetlelm_nld_L1-eng_L2_simultaneous,step-30000,eng,5.878525257110596,357.2819539763614
844,"If a rider is thrown from a horse but has a foot caught in the stirrup, they could be dragged if the horse runs away. To minimize this risk, a number of safety precautions can be taken.",BeetleLM/beetlelm_nld_L1-eng_L2_simultaneous,step-30000,eng,5.560290813446045,259.8984072853365
845,"First, most riders wear riding boots with a heel and a smooth, quite narrow, sole.",BeetleLM/beetlelm_nld_L1-eng_L2_simultaneous,step-30000,eng,7.090526580810547,1200.5398154219
846,"Next, some saddles, particularly English saddles, have safety bars that allow a stirrup leather to fall off the saddle if pulled backwards by a falling rider.",BeetleLM/beetlelm_nld_L1-eng_L2_simultaneous,step-30000,eng,6.344748497009277,569.4941422226283
847,"Cochamó Valley - Chile's premier climbing destination, known as the Yosemite of South America, with a variety of granite big walls and crags.",BeetleLM/beetlelm_nld_L1-eng_L2_simultaneous,step-30000,eng,5.5137553215026855,248.08100390997012
848,Summits include breath-taking views from peaks. Climbers from all parts of the world are continually establishing new routes amongst its endless potential of walls.,BeetleLM/beetlelm_nld_L1-eng_L2_simultaneous,step-30000,eng,6.336485862731934,564.8080069738342
849,"Downhill snowsports, which include skiing and snowboarding, are popular sports involving sliding down snow-covered terrain with skis or a snowboard attached to your feet.",BeetleLM/beetlelm_nld_L1-eng_L2_simultaneous,step-30000,eng,6.213447093963623,499.4198346231788
850,"Skiing is a major travelling activity with many enthusiasts, occasionally known as ""ski bums,"" planning entire vacations around skiing at a particular location.",BeetleLM/beetlelm_nld_L1-eng_L2_simultaneous,step-30000,eng,6.068825721740723,432.1728922582217
851,The idea of skiing is very old — cave paintings depicting skiers date back as far as 5000 BC!,BeetleLM/beetlelm_nld_L1-eng_L2_simultaneous,step-30000,eng,6.3719635009765625,585.2057536155475
852,"Downhill skiing as a sport goes back to at least the 17th century, and in 1861 the first recreational ski club was opened by Norwegians in Australia.",BeetleLM/beetlelm_nld_L1-eng_L2_simultaneous,step-30000,eng,4.494365215301514,89.51133052400351
853,"Backpacking by ski: This activity is also called backcountry ski, ski touring or ski hiking.",BeetleLM/beetlelm_nld_L1-eng_L2_simultaneous,step-30000,eng,7.184401512145996,1318.6997762592794
854,"It is related to but usually not involving alpine style ski touring or mountaineering, the latter ones done in steep terrain and requiring much stiffer skis and boots.",BeetleLM/beetlelm_nld_L1-eng_L2_simultaneous,step-30000,eng,6.893946170806885,986.2858001901526
855,Think of the skiing route as of a similar hiking route.,BeetleLM/beetlelm_nld_L1-eng_L2_simultaneous,step-30000,eng,6.966945171356201,1060.9766929954897
856,In good conditions you will be able to cover somewhat greater distances than walking – but only very seldom you will get the speeds of cross country skiing without a heavy backpack in groomed tracks.,BeetleLM/beetlelm_nld_L1-eng_L2_simultaneous,step-30000,eng,6.855264663696289,948.8632258241606
857,"Europe is a continent that is relatively small but with many independent countries. Under normal circumstances, travelling through multiple countries would mean having to go through visa applications and passport control multiple times.",BeetleLM/beetlelm_nld_L1-eng_L2_simultaneous,step-30000,eng,5.693346977233887,296.88562904112547
858,"The Schengen zone, however, works somewhat like one country in this respect.",BeetleLM/beetlelm_nld_L1-eng_L2_simultaneous,step-30000,eng,7.015905380249023,1114.2149779150152
859,"As long as you stay in this zone, you can generally cross borders without going through passport control checkpoints again.",BeetleLM/beetlelm_nld_L1-eng_L2_simultaneous,step-30000,eng,6.597555637359619,733.3005442993613
860,"Similarly, by having a Schengen visa, you do not need to apply for visas to each of the Schengen member countries separately, hence saving time, money and paperwork.",BeetleLM/beetlelm_nld_L1-eng_L2_simultaneous,step-30000,eng,6.334315776824951,563.5836540337639
861,There is no universal definition for which manufactured items are antiques. Some tax agencies define goods older than 100 years as antiques.,BeetleLM/beetlelm_nld_L1-eng_L2_simultaneous,step-30000,eng,6.534996032714844,688.8310515292811
862,"The definition has geographic variations, where the age limit might be shorter in places such as North America than in Europe.",BeetleLM/beetlelm_nld_L1-eng_L2_simultaneous,step-30000,eng,5.189266204833984,179.33690808132374
863,"Handicraft products might be defined as antiques, though they are younger than similar mass-produced goods.",BeetleLM/beetlelm_nld_L1-eng_L2_simultaneous,step-30000,eng,6.575310230255127,717.1680770799932
864,Reindeer husbandry is an important livelihood among the Sámi and the culture surrounding the trade is important also for many with other professions.,BeetleLM/beetlelm_nld_L1-eng_L2_simultaneous,step-30000,eng,6.969148635864258,1063.317095031854
865,"Even traditionally, though, not all Sámi have been involved in big scale reindeer husbandry, but lived from fishing, hunting and similar, having reindeer mostly as draft animals.",BeetleLM/beetlelm_nld_L1-eng_L2_simultaneous,step-30000,eng,6.725236892700195,833.1693249013881
866,"Today many Sámi work in modern trades. Tourism is an important income in Sápmi, the Sámi area.",BeetleLM/beetlelm_nld_L1-eng_L2_simultaneous,step-30000,eng,5.805812358856201,332.2249696474702
867,"Though it is widely used, especially among non-Romani, the word ""Gypsy"" is often considered offensive because of its associations with negative stereotypes and inaccurate perceptions of Romani people.",BeetleLM/beetlelm_nld_L1-eng_L2_simultaneous,step-30000,eng,5.145990371704102,171.74148838424918
868,"If the country you will be visiting becomes subject to a travel advisory, your travel health insurance or your trip cancellation insurance may be affected.",BeetleLM/beetlelm_nld_L1-eng_L2_simultaneous,step-30000,eng,6.864872455596924,958.0236414574749
869,"You may also wish to consult the advice of governments other than your own, but their advice is designed for their citizens.",BeetleLM/beetlelm_nld_L1-eng_L2_simultaneous,step-30000,eng,6.161317825317383,474.0523816110988
870,"As one example, American citizens in the Middle East might face different situations from Europeans or Arabs.",BeetleLM/beetlelm_nld_L1-eng_L2_simultaneous,step-30000,eng,5.541661262512207,255.1014380957225
871,Advisories are merely a brief summary of the political situation in one country.,BeetleLM/beetlelm_nld_L1-eng_L2_simultaneous,step-30000,eng,5.570610046386719,262.5942450574942
872,"The views presented are often cursory, general and oversimplified compared to the more detailed information available elsewhere.",BeetleLM/beetlelm_nld_L1-eng_L2_simultaneous,step-30000,eng,6.550969123840332,699.9221564864648
873,"Severe weather is the generic term for any dangerous weather phenomenon with the potential to cause damage, serious social disruption, or loss of human life.",BeetleLM/beetlelm_nld_L1-eng_L2_simultaneous,step-30000,eng,5.281008720397949,196.56805758903658
874,"Severe weather can occur anywhere in the world, and there are different types of it, which can depend on geography, topography, and atmospheric conditions.",BeetleLM/beetlelm_nld_L1-eng_L2_simultaneous,step-30000,eng,4.291233539581299,73.05653106308301
875,"High winds, hail, excessive precipitation, and wildfires are forms and effects of severe weather, as are thunderstorms, tornadoes, waterspouts, and cyclones.",BeetleLM/beetlelm_nld_L1-eng_L2_simultaneous,step-30000,eng,5.718965530395508,304.58967116915903
876,"Regional and seasonal severe weather phenomena include blizzards, snowstorms, ice storms, and dust storms.",BeetleLM/beetlelm_nld_L1-eng_L2_simultaneous,step-30000,eng,5.517307281494141,248.96374451206378
877,Travellers are strongly advised to be aware of any risk of severe weather affecting their area as they may affect any travel plans.,BeetleLM/beetlelm_nld_L1-eng_L2_simultaneous,step-30000,eng,6.2072367668151855,496.3278850126161
878,Anyone planning a visit to a country that could be considered a war zone should get professional training.,BeetleLM/beetlelm_nld_L1-eng_L2_simultaneous,step-30000,eng,5.112091064453125,166.0171447173371
879,A search of the Internet for 'Hostile environment course' will probably provide the address of a local company.,BeetleLM/beetlelm_nld_L1-eng_L2_simultaneous,step-30000,eng,5.65488862991333,285.684664228916
880,"A course will normally cover all the issues discussed here in far greater detail, usually with practical experience.",BeetleLM/beetlelm_nld_L1-eng_L2_simultaneous,step-30000,eng,7.237628936767578,1390.7924015711453
