sentence_id,sentence,repo,revision,iso_code,nll,ppl
231,"Famous singers across the country presented bhajans, or devotional songs, to Shri Shyam's feet.",BeetleLM/beetlelm_eng-nld_balanced,step-18341,eng,6.074003219604492,434.4162690124259
232,"Singer Sanju Sharma started the evening, followed by Jai Shankar Choudhary. esented the chhappan bhog bhajan as well. Singer, Raju Khandelwal was accompanying him.",BeetleLM/beetlelm_eng-nld_balanced,step-18341,eng,6.476970195770264,649.9985913739039
233,"Then, Lakkha Singh took the lead in singing the bhajans.",BeetleLM/beetlelm_eng-nld_balanced,step-18341,eng,6.3031840324401855,546.3086081379591
234,"108 plates of Chhappan Bhog (in Hinduism, 56 different edible items, like, sweets, fruits, nuts, dishes etc. which are offered to deity) were served to Baba Shyam.",BeetleLM/beetlelm_eng-nld_balanced,step-18341,eng,5.733497142791748,309.04816631489217
235,"Lakkha Singh presented the chhappan bhog bhajan as well. Singer, Raju Khandelwal was accompanying him.",BeetleLM/beetlelm_eng-nld_balanced,step-18341,eng,6.8332133293151855,928.1685368812912
236,"At Thursday's keynote presentation of the Tokyo Game Show, Nintendo president Satoru Iwata unveiled the controller design for the company's new Nintendo Revolution console.",BeetleLM/beetlelm_eng-nld_balanced,step-18341,eng,5.4933905601501465,243.07998854679798
237,"Resembling a television remote, the controller uses two sensors placed near the user's television to triangulate its position in three-dimensional space.",BeetleLM/beetlelm_eng-nld_balanced,step-18341,eng,5.498462200164795,244.3159342300635
238,This will allow players to control actions and movements in video games by moving the device through the air.,BeetleLM/beetlelm_eng-nld_balanced,step-18341,eng,6.03170919418335,416.4261746616994
239,Giancarlo Fisichella lost control of his car and ended the race very soon after the start.,BeetleLM/beetlelm_eng-nld_balanced,step-18341,eng,6.171119213104248,478.7215978542675
240,"His teammate Fernando Alonso was in the lead for most of the race, but ended it right after his pit-stop, probably because a badly tucked right front wheel.",BeetleLM/beetlelm_eng-nld_balanced,step-18341,eng,5.9900078773498535,399.41775626812125
241,"Michael Schumacher ended his race not long after Alonso, because of the suspension damage in the numerous battles during the race.",BeetleLM/beetlelm_eng-nld_balanced,step-18341,eng,5.501079082489014,244.95611755675594
242,"""She’s very cute and sings quite well, too,"" he said according to a transcript of the news conference.",BeetleLM/beetlelm_eng-nld_balanced,step-18341,eng,5.616154193878174,274.83040377584587
243,"""I was moved every time we did a rehearsal on this, from the bottom of my heart.""",BeetleLM/beetlelm_eng-nld_balanced,step-18341,eng,5.211191177368164,183.31228564007782
244,"Around 3 minutes into the launch, an on-board camera showed numerous pieces of insulation foam break away from the fuel tank.",BeetleLM/beetlelm_eng-nld_balanced,step-18341,eng,6.1714863777160645,478.89739975605534
245,"However, they are not thought to have caused any damage to the shuttle.",BeetleLM/beetlelm_eng-nld_balanced,step-18341,eng,4.209573268890381,67.32780281106514
246,"NASA's shuttle program chief N. Wayne Hale Jr. said the foam had fallen ""after the time we are concerned about.""",BeetleLM/beetlelm_eng-nld_balanced,step-18341,eng,5.965088844299316,389.5876391741427
247,"Five minutes into the display a wind starts rolling in, about a minute later, the wind is reaching 70km/h... then the rain comes, but so hard and so large that it slaps your skin like a needle, then hail fell from the sky, people panicking and screaming and running over each other.",BeetleLM/beetlelm_eng-nld_balanced,step-18341,eng,5.599475860595703,270.2847034296264
248,"I lost my sister and her friend, and on my way there were two disabled people in wheelchairs, people just jumping over and pushing them,"" Armand Versace said.",BeetleLM/beetlelm_eng-nld_balanced,step-18341,eng,5.905982971191406,367.22802299906823
249,NHK also reported that the Kashiwazaki Kariwa nuclear power plant in Niigata prefecture was operating normally.,BeetleLM/beetlelm_eng-nld_balanced,step-18341,eng,6.560024738311768,706.2891667808549
250,Hokuriku Electric Power Co. reported no effects from the earthquake and that the Number 1 and 2 reactors at its Shika nuclear power plant were shut down.,BeetleLM/beetlelm_eng-nld_balanced,step-18341,eng,6.780158519744873,880.2082434354111
251,It is reported that some 9400 homes in the region are without water and approximately 100 without electricity.,BeetleLM/beetlelm_eng-nld_balanced,step-18341,eng,6.226707458496094,506.0864267197313
252,"Some roads have been damaged, railway service interrupted in the affected areas, and the Noto Airport in Ishikawa prefecture remains closed.",BeetleLM/beetlelm_eng-nld_balanced,step-18341,eng,5.428128719329834,227.72271335620124
253,One bomb exploded outside the governor general's office.,BeetleLM/beetlelm_eng-nld_balanced,step-18341,eng,5.437488555908203,229.86416693239926
254,Three more bombs exploded near government buildings in a period of two hours.,BeetleLM/beetlelm_eng-nld_balanced,step-18341,eng,5.880932807922363,358.14316472301687
255,"Some reports put the official death toll at eight, and official reports confirm that up to 30 were injured; but final numbers are not yet known.",BeetleLM/beetlelm_eng-nld_balanced,step-18341,eng,6.542196750640869,693.8090306325732
256,Both cyanuric acid and melamine were found in urine samples from pets that died after consuming contaminated pet food.,BeetleLM/beetlelm_eng-nld_balanced,step-18341,eng,7.318163871765137,1507.4335857824337
257,"The two compounds react with one another to form crystals that may block kidney function, researchers at the university said.",BeetleLM/beetlelm_eng-nld_balanced,step-18341,eng,6.183178424835205,484.52955225411273
258,The researchers observed crystals formed in cat urine by the addition of melamine and cyanuric acid.,BeetleLM/beetlelm_eng-nld_balanced,step-18341,eng,6.384449481964111,592.5584286864823
259,The composition of these crystals matches those found in the urine of affected pets when compared by infrared spectroscopy (FTIR).,BeetleLM/beetlelm_eng-nld_balanced,step-18341,eng,6.487368583679199,656.7927920148682
260,"I don't know if you realize it or not, but most of the goods from Central America came into this country duty-free.",BeetleLM/beetlelm_eng-nld_balanced,step-18341,eng,4.605034828186035,99.98646513583978
261,Yet eighty percent of our goods were taxed through tariffs in Central American countries. we treat you.,BeetleLM/beetlelm_eng-nld_balanced,step-18341,eng,6.450555324554443,633.0537455072284
262,That didn't seem to make sense to me; it certainly wasn't fair.,BeetleLM/beetlelm_eng-nld_balanced,step-18341,eng,4.285194396972656,72.6166618069645
263,All I say to people is you treat us the way we treat you.,BeetleLM/beetlelm_eng-nld_balanced,step-18341,eng,5.5403289794921875,254.76179708058166
264,California Governor Arnold Schwarzenegger signed into law a bill that bans the sale or rental of violent video games to minors.,BeetleLM/beetlelm_eng-nld_balanced,step-18341,eng,7.854504108428955,2577.316727032398
265,"The bill requires violent video games sold in the state of California to be labeled with a decal reading ""18"" and makes their sale to a minor punishable by a fine of $1000 per offense.",BeetleLM/beetlelm_eng-nld_balanced,step-18341,eng,6.604150295257568,738.1523910765383
266,"The Director of Public Prosecutions, Kier Starmer QC, gave a statement this morning announcing the prosecution of both Huhne and Pryce.",BeetleLM/beetlelm_eng-nld_balanced,step-18341,eng,5.665319442749023,288.68018318049457
267,Huhne has resigned and he will be replaced in the Cabinet by Ed Davey MP. Norman Lamb MP is expected to take the Business Minister job Davey is vacating.,BeetleLM/beetlelm_eng-nld_balanced,step-18341,eng,6.296237945556641,542.527049801397
268,Huhne and Pryce are scheduled to appear at the Westminster Magistrates Court on February 16.,BeetleLM/beetlelm_eng-nld_balanced,step-18341,eng,5.845332622528076,345.6174828249153
269,"The fatalities were Nicholas Alden, 25, and Zachary Cuddeback, 21. Cuddeback had been the driver.",BeetleLM/beetlelm_eng-nld_balanced,step-18341,eng,6.263617515563965,525.1151204302662
270,Edgar Veguilla received arm and jaw wounds while Kristoffer Schneider was left requiring reconstructive surgery for his face.,BeetleLM/beetlelm_eng-nld_balanced,step-18341,eng,7.2277703285217285,1377.1484896307215
271,"Uka's weapon failed whilst pointed at a fifth man's head. Schneider has ongoing pain, blindness in one eye, a missing section of skull and a face rebuilt from titanium.",BeetleLM/beetlelm_eng-nld_balanced,step-18341,eng,6.430566787719727,620.525554624283
272,Schneider testified via videolink from a USAF base in his homeland.,BeetleLM/beetlelm_eng-nld_balanced,step-18341,eng,7.55967378616333,1919.2193353423509
273,"Beyond Wednesday's event, Carpanedo competed in two individual races at the Championships.",BeetleLM/beetlelm_eng-nld_balanced,step-18341,eng,5.644993782043457,282.8717973327698
274,"Her first was the Slalom, where she earned a Did Not Finish in her first run. 36 of the 116 competitors had the same result in that race.",BeetleLM/beetlelm_eng-nld_balanced,step-18341,eng,6.582269191741943,722.1762276606192
275,"Her other race, the Giant Slalom, saw her finish in tenth in the women's sitting group with a combined run time of 4:41.30, 2:11.60 minutes slower than first place finisher Austrian Claudia Loesch and 1:09.02 minutes slower than the ninth place finisher Gyöngyi Dani of Hungary.",BeetleLM/beetlelm_eng-nld_balanced,step-18341,eng,5.961913108825684,388.35237436363496
276,"Four skiers in the women's sitting group failed to finish their runs, and 45 of the 117 total skiers in the Giant Slalom failed to rank in the race.",BeetleLM/beetlelm_eng-nld_balanced,step-18341,eng,6.093753337860107,443.08132800640635
277,The Madhya Pradesh Police recovered the stolen laptop and mobile phone.,BeetleLM/beetlelm_eng-nld_balanced,step-18341,eng,5.728483200073242,307.50249470432044
278,"Deputy Inspector General D K Arya said, ""We have arrested five persons who raped the Swiss woman and recovered her mobile and laptop"".",BeetleLM/beetlelm_eng-nld_balanced,step-18341,eng,6.497276306152344,663.3324558115177
279,"The accused are named as Baba Kanjar, Bhutha Kanjar, Rampro Kanjar, Gaza Kanjar and Vishnu Kanjar.",BeetleLM/beetlelm_eng-nld_balanced,step-18341,eng,7.188948154449463,1324.7090831801152
280,Police superintendent Chandra Shekhar Solanki said the accused appeared in court with covered faces.,BeetleLM/beetlelm_eng-nld_balanced,step-18341,eng,7.041991710662842,1143.6631858910148
281,"Although three people were inside the house when the car impacted it, none of them were hurt.",BeetleLM/beetlelm_eng-nld_balanced,step-18341,eng,5.296008586883545,199.53877670346338
282,"However, the driver sustained serious injuries to the head.",BeetleLM/beetlelm_eng-nld_balanced,step-18341,eng,6.008328437805176,406.80275552233
283,The road where the crash happened was temporarily closed while emergency services freed the driver from the red Audi TT.,BeetleLM/beetlelm_eng-nld_balanced,step-18341,eng,7.12606143951416,1243.9678631866136
284,He was initially hospitalised in the James Paget Hospital in Great Yarmouth.,BeetleLM/beetlelm_eng-nld_balanced,step-18341,eng,6.228899002075195,507.1967533989361
285,He was subsequently relocated to Addenbrooke's Hospital in Cambridge.,BeetleLM/beetlelm_eng-nld_balanced,step-18341,eng,5.25711727142334,191.92741840638408
286,Adekoya has since been in Edinburgh Sheriff Court charged with murdering her son.,BeetleLM/beetlelm_eng-nld_balanced,step-18341,eng,5.563148021697998,260.6420530287744
287,"She is in custody pending indictment and trial, but any eyewitness evidence may be tainted because her image has been widely published.",BeetleLM/beetlelm_eng-nld_balanced,step-18341,eng,6.125453948974609,457.352280751704
288,This is common practice elsewhere in the UK but Scottish justice works differently and courts have viewed publication of photos as potentially prejudicial.,BeetleLM/beetlelm_eng-nld_balanced,step-18341,eng,6.199988842010498,492.7435430353023
289,"Professor Pamela Ferguson of the University of Dundee notes ""journalists do seem to be walking a dangerous line if publishing photos etc of suspects.""",BeetleLM/beetlelm_eng-nld_balanced,step-18341,eng,5.471921920776367,237.9170112830832
290,"Crown Office, which is in overall charge of prosecutions, has indicated to journalists that no further comment will be made at least until indictment.",BeetleLM/beetlelm_eng-nld_balanced,step-18341,eng,5.791213035583496,327.409943500646
291,"The document, according to the leak, will refer to the borders dispute, which Palestine wants based on the borders before the 1967 Mideast War.",BeetleLM/beetlelm_eng-nld_balanced,step-18341,eng,5.7243266105651855,306.22698578107367
292,Other topics covered reportedly include the future state of Jerusalem which is sacred to both nations and the Jordan Valley issue.,BeetleLM/beetlelm_eng-nld_balanced,step-18341,eng,5.799116134643555,330.00774855136785
293,Israel demands an ongoing military presence in the valley for ten years once an agreement is signed while the PA agrees to leave such presence only for five years.,BeetleLM/beetlelm_eng-nld_balanced,step-18341,eng,6.334436416625977,563.6516487550001
294,"Shooters in the supplementary pest control trial were to be closely supervised by rangers, as the trial was monitored and its effectiveness evaluated.",BeetleLM/beetlelm_eng-nld_balanced,step-18341,eng,6.827786922454834,923.1455574557061
295,"In a partnership of NPWS and the Sporting Shooters Association of Australia (NSW) Inc, qualified volunteers were recruited, under the Sporting Shooters Association's hunting program.",BeetleLM/beetlelm_eng-nld_balanced,step-18341,eng,5.942072868347168,380.7233014408579
296,"According to Mick O'Flynn, the Acting Director Park Conservation and Heritage with the NPWS, the four shooters selected for the first shooting operation received comprehensive safety and training instruction.",BeetleLM/beetlelm_eng-nld_balanced,step-18341,eng,5.112264156341553,166.04588342557446
297,Martelly swore in a new Provisional Electoral Council (CEP) of nine members yesterday.,BeetleLM/beetlelm_eng-nld_balanced,step-18341,eng,5.578097343444824,264.56774504685836
298,It is Martelly's fifth CEP in four years.,BeetleLM/beetlelm_eng-nld_balanced,step-18341,eng,5.752828598022461,315.0806374665111
299,Last month a presidential commission recommended the prior CEP's resignation as part of a package of measures to move the country towards new elections.,BeetleLM/beetlelm_eng-nld_balanced,step-18341,eng,6.465186595916748,642.3842185356177
300,The commission was Martelly's response to widespread anti-regime protests that started in October.,BeetleLM/beetlelm_eng-nld_balanced,step-18341,eng,5.46282958984375,235.7635957008576
301,"The sometimes-violent protests were triggered by failure to hold elections, some due since 2011.",BeetleLM/beetlelm_eng-nld_balanced,step-18341,eng,6.495022773742676,661.8392976959703
302,"Around 60 cases of malfunctioning iPods overheating have been reported, causing a total of six fires and leaving four people with minor burns.",BeetleLM/beetlelm_eng-nld_balanced,step-18341,eng,6.8984785079956055,990.7661255039826
303,"Japan's Ministry of Economy, Trade and Industry (METI) said that it had been aware of 27 accidents related to the devices.",BeetleLM/beetlelm_eng-nld_balanced,step-18341,eng,4.978177070617676,145.20943369299934
304,"Last week, METI announced that Apple had informed it of 34 additional overheating incidents, which the company called ""non-serious.""",BeetleLM/beetlelm_eng-nld_balanced,step-18341,eng,7.038277626037598,1139.4234023670197
305,"The ministry responded by calling Apple's postponement of the report ""truly regrettable.""",BeetleLM/beetlelm_eng-nld_balanced,step-18341,eng,6.398751735687256,601.0942448810409
306,The eathquake struck Mariana at 07:19 a.m. local time (09:19 p.m. GMT Friday).,BeetleLM/beetlelm_eng-nld_balanced,step-18341,eng,6.544075965881348,695.1140729805969
307,The Northern Marianas emergency management office said that there were no damages reported in the nation.,BeetleLM/beetlelm_eng-nld_balanced,step-18341,eng,6.223138809204102,504.28360049188956
308,Also the Pacific Tsunami Warning Center said that there was no Tsunami indication.,BeetleLM/beetlelm_eng-nld_balanced,step-18341,eng,6.801748275756836,899.4183492245284
309,"A former Filipino policeman has kept Hong Kong tourists hostage by hijacking their bus in Manila, the capital of the Philippines.",BeetleLM/beetlelm_eng-nld_balanced,step-18341,eng,5.522068023681641,250.15182253635803
310,Rolando Mendoza fired his M16 rifle at the tourists.,BeetleLM/beetlelm_eng-nld_balanced,step-18341,eng,8.319527626037598,4103.221295509551
311,Several hostages have been rescued and least six have been confirmed dead so far.,BeetleLM/beetlelm_eng-nld_balanced,step-18341,eng,4.9914350509643555,147.14743612265536
312,"Six hostages, including the children and elderly, were released early, as were the Filipino photographers.",BeetleLM/beetlelm_eng-nld_balanced,step-18341,eng,5.665081024169922,288.61136466553813
313,The photographers later took the place of an aged lady as she needed the lavatory. Mendoza was gunned down.,BeetleLM/beetlelm_eng-nld_balanced,step-18341,eng,6.380108833312988,589.991914939199
314,Liggins followed in his father’s footsteps and entered a career in medicine.,BeetleLM/beetlelm_eng-nld_balanced,step-18341,eng,5.706517696380615,300.82168975687614
315,He trained as an obstetrician and began to work at the Auckland's National Women's Hospital in 1959.,BeetleLM/beetlelm_eng-nld_balanced,step-18341,eng,4.670547008514404,106.75612297189946
316,While he was working at the hospital Liggins began to investigate premature labor during his spare time.,BeetleLM/beetlelm_eng-nld_balanced,step-18341,eng,5.596113204956055,269.3773554517083
317,His research showed that if a hormone was administered it would speed up the baby's foetal lung maturation.,BeetleLM/beetlelm_eng-nld_balanced,step-18341,eng,6.3355889320373535,564.3016404576173
318,Xinhua reported that government investigators recovered two 'black box' flight recorders on Wednesday.,BeetleLM/beetlelm_eng-nld_balanced,step-18341,eng,6.5449395179748535,695.7145994491704
319,Fellow wrestlers also paid tribute to Luna.,BeetleLM/beetlelm_eng-nld_balanced,step-18341,eng,7.354835033416748,1563.7390094338348
320,"Tommy Dreamer said ""Luna was the first Queen of Extreme. My first manager. Luna passed away on the night of two moons. Pretty unique just like her. Strong woman.""",BeetleLM/beetlelm_eng-nld_balanced,step-18341,eng,5.879922866821289,357.781643809038
321,"Dustin ""Goldust"" Runnels commented that ""Luna was as freaky as me...maybe even more...love her and will miss her...hopefully she's in a better place.""",BeetleLM/beetlelm_eng-nld_balanced,step-18341,eng,6.529050827026367,684.7479586833
322,"Out of 1,400 people polled prior to the 2010 federal election, those who oppose Australia becoming a republic grew by 8 per cent since 2008.",BeetleLM/beetlelm_eng-nld_balanced,step-18341,eng,5.765183925628662,318.99771049539385
323,Caretaker Prime Minister Julia Gillard claimed during the campaign of the 2010 federal election that she believed Australia should become a republic at the end of Queen Elizabeth II's reign.,BeetleLM/beetlelm_eng-nld_balanced,step-18341,eng,5.33192253112793,206.835239342592
324,"34 per cent of those in the poll share this view, wanting Queen Elizabeth II to be Australia's last monarch.",BeetleLM/beetlelm_eng-nld_balanced,step-18341,eng,6.008038520812988,406.684833585648
325,"At the extremes of the poll, 29 per cent of those surveyed believe Australia should become a republic as soon as possible, while 31 per cent believe Australia should never become a republic.",BeetleLM/beetlelm_eng-nld_balanced,step-18341,eng,6.357682228088379,576.9076652205744
326,"The Olympic gold medalist was due to swim in the 100m and 200m freestyle and in three relays at the Commonwealth Games, but due to his complaints his fitness has been in doubt.",BeetleLM/beetlelm_eng-nld_balanced,step-18341,eng,5.117149353027344,166.85903481003442
327,He has been unable to take the drugs needed to overcome his pain as they are banned from the Games.,BeetleLM/beetlelm_eng-nld_balanced,step-18341,eng,5.444354057312012,231.447729448386
328,"Curtis Cooper, a mathematician and computer science professor at the University of Central Missouri, has discovered the largest known prime number to date on January 25.",BeetleLM/beetlelm_eng-nld_balanced,step-18341,eng,4.5581278800964355,95.40470349260937
329,Several people verified the discovery using different hardware and software by the beginning of February and it was announced on Tuesday.,BeetleLM/beetlelm_eng-nld_balanced,step-18341,eng,5.6896538734436035,295.7912217230266
330,Comets may possibly have been a source of water delivery to the earth along with organic matter that can form proteins and support life.,BeetleLM/beetlelm_eng-nld_balanced,step-18341,eng,5.6586480140686035,286.760683947484
331,"Scientists hope to understand how planets form, especially how the Earth formed, since comets collided with the Earth long ago.",BeetleLM/beetlelm_eng-nld_balanced,step-18341,eng,5.958853244781494,387.16588507054263
332,"Cuomo, 53, began his governorship earlier this year and signed a bill last month legalizing same-sex marriage.",BeetleLM/beetlelm_eng-nld_balanced,step-18341,eng,7.107456207275391,1221.0375257707215
333,"He referred to the rumors as ""political chatter and silliness"".",BeetleLM/beetlelm_eng-nld_balanced,step-18341,eng,6.056730270385742,426.9770524227288
334,He is speculated to make a run for president in 2016.,BeetleLM/beetlelm_eng-nld_balanced,step-18341,eng,5.252373218536377,191.01906093457586
335,NextGen is a system the FAA claims would allow aircraft to fly shorter routes and save millions of gallons of fuel each year and cut carbon emissions.,BeetleLM/beetlelm_eng-nld_balanced,step-18341,eng,6.7148518562316895,824.5616041856396
336,It uses satellite-based technology as opposed to older ground-radar-based technology to allow air traffic controllers to pinpoint aircraft with greater precision and give pilots more accurate information.,BeetleLM/beetlelm_eng-nld_balanced,step-18341,eng,6.5614237785339355,707.277985270797
337,"No extra transport is being put on and overground trains will not stop at Wembley, and car parking and park-and-ride facilities are unavailable at the ground.",BeetleLM/beetlelm_eng-nld_balanced,step-18341,eng,6.278619766235352,533.0524189004966
338,Fears of lack of transportation raised the possibility that the game would be forced to play behind closed doors without the team's supporters.,BeetleLM/beetlelm_eng-nld_balanced,step-18341,eng,6.149886608123779,468.6642410517163
339,A study published on Thursday in the journal Science reported on formation of a new bird species on the Ecuadorean Galápagos Islands.,BeetleLM/beetlelm_eng-nld_balanced,step-18341,eng,5.972972869873047,392.6712979340772
340,"Researchers from Princeton University in the United States and Uppsala University in Sweden reported the new species evolved in just two generations, though this process had been believed to take much longer, due to breeding between an endemic Darwin finch, Geospiza fortes, and the immigrant cactus finch, Geospiza conirostris.",BeetleLM/beetlelm_eng-nld_balanced,step-18341,eng,5.853318691253662,348.3886584669251
341,Gold may be worked into all sorts of shapes. It can be rolled into tiny shapes.,BeetleLM/beetlelm_eng-nld_balanced,step-18341,eng,4.334102153778076,76.2564615684221
342,"It can be pulled into thin wire, which can be twisted and plaited. It can be hammered or rolled into sheets.",BeetleLM/beetlelm_eng-nld_balanced,step-18341,eng,4.915112495422363,136.33464596348486
343,"It can be made very thin, and stuck onto other metal. It can be made so thin that it was sometimes used to decorate the hand-painted pictures in books called ""illuminated manuscripts"".",BeetleLM/beetlelm_eng-nld_balanced,step-18341,eng,4.776004314422607,118.62939602650201
344,This is called a chemical's pH. You can make an indicator using red cabbage juice.,BeetleLM/beetlelm_eng-nld_balanced,step-18341,eng,5.891788482666016,362.0522298116974
345,The cabbage juice changes color depending on how acidic or basic (alkaline) the chemical is.,BeetleLM/beetlelm_eng-nld_balanced,step-18341,eng,6.594078063964844,730.754866791833
346,The pH level is indicated by the amount of Hydrogen (the H in pH) ions in the tested chemical.,BeetleLM/beetlelm_eng-nld_balanced,step-18341,eng,6.249391078948975,517.6974917708634
347,Hydrogen ions are protons that had their electrons stripped off them (since Hydrogen atoms consist of one proton and one electron).,BeetleLM/beetlelm_eng-nld_balanced,step-18341,eng,5.911192417144775,369.14606917868707
348,"Swirl the two dry powders together and then, with clean wet hands, squeeze them into a ball.",BeetleLM/beetlelm_eng-nld_balanced,step-18341,eng,6.278101921081543,532.7764517489361
349,"The moisture on your hands will react with the outer layers, which will feel funny and form a sort of shell.",BeetleLM/beetlelm_eng-nld_balanced,step-18341,eng,5.491315841674805,242.57618880560486
350,"The cities of Harappa and Mohenjo-daro had a flush toilet in almost every house, attached to a sophisticated sewage system.",BeetleLM/beetlelm_eng-nld_balanced,step-18341,eng,6.118701934814453,454.27463352711663
