sentence_id,sentence,repo,revision,iso_code,nll,ppl
0,"„Wir haben jetzt 4 Monate alte Mäuse, die Diabetes hatten und jetzt keinen mehr haben“, fügte er hinzu.",BeetleLM/beetlelm_eng-deu_heritage,step-8000,deu,6.796262264251709,894.4976396885895
1,"Dr. Ehud Ur, Professor für Medizin an der Dalhousie University in Halifax, Nova Scotia, und Vorsitzender der Abteilung für Klinik und Wissenschaft des Kanadischen Diabetesverbands gab zu bedenken, dass die Forschungsarbeit noch in den Kinderschuhen stecke.",BeetleLM/beetlelm_eng-deu_heritage,step-8000,deu,6.894735336303711,987.0644501150889
2,"Wie einige andere Experten zeigte er sich skeptisch, ob es möglich sei, Diabetes zu heilen, und wies darauf hin, dass die Befunde für Menschen, die bereits unter Typ-1-Diabetes litten, keine Bedeutung hätten.",BeetleLM/beetlelm_eng-deu_heritage,step-8000,deu,6.100684642791748,446.1631279095387
3,"Am Montag gab Sara Danius, Ständige Sekretärin des Literaturnobelpreiskomitees der Schwedischen Akademie in einer Radiosendung auf Sveriges Radio in Schweden bekannt, dass das Komitee seine Bemühungen eingestellt habe, Bob Dylan über seine Ehrung mit dem Literaturnobelpreis für Literator zu informieren, nachdem es nicht gelungen war, ihn persönlich zu erreichen.",BeetleLM/beetlelm_eng-deu_heritage,step-8000,deu,7.1301589012146,1249.075430747838
4,Danius sagte: „Im Moment unternehmen wir nichts. Ich habe seinen engsten Mitarbeiter angerufen und ihm E-Mails geschickt und sehr freundliche Antworten erhalten. Das ist vorläufig genug.“,BeetleLM/beetlelm_eng-deu_heritage,step-8000,deu,6.834011554718018,928.9097203619259
5,"Rings CEO Jamie Siminoff sagte einmal, dass er das Unternehmen gegründet habe, nachdem er von seiner Garagenwerkstatt aus seine Türklingel nicht hören konnte.",BeetleLM/beetlelm_eng-deu_heritage,step-8000,deu,6.598015308380127,733.6376987930367
6,"Er sagte, dass er eine WLAN-Türklingel gebaut habe.",BeetleLM/beetlelm_eng-deu_heritage,step-8000,deu,5.48028564453125,239.91522806036878
7,"Siminoff sagte, die Verkäufe seien nach seinem Auftritt in einer Folge von „Shark Tank“ im Jahre 2013 stark gestiegen, obwohl die Jury der Sendung die Finanzierung seines Start-ups abgelehnt hatte.",BeetleLM/beetlelm_eng-deu_heritage,step-8000,deu,7.392609119415283,1623.9376374759127
8,Ende 2017 trat Siminoff im Teleshopping-Sender QVC auf.,BeetleLM/beetlelm_eng-deu_heritage,step-8000,deu,7.427192687988281,1681.0816222299684
9,Ring hat außerdem eine Rechtsstreitigkeit mit der konkurrierenden Sicherheitsfirma ADT Corporation beigelegt.,BeetleLM/beetlelm_eng-deu_heritage,step-8000,deu,7.594658851623535,1987.5516857984524
10,"Während ein experimenteller Impfstoff in der Lage zu sein scheint, die Ebola-Mortalität zu senken, gibt es bisher keine Medikamente, die als eindeutig zur Behandlung bestehender Infektionen geeignet nachgewiesen wurden.",BeetleLM/beetlelm_eng-deu_heritage,step-8000,deu,6.7474365234375,851.8722066951273
11,"Ein Antikörper-Cocktail, ZMapp, erwies sich zunächst als vielversprechend, formelle Studien zeigten jedoch, dass er, was die Verhinderung von Todesfällen anbelangt, weniger Vorteile brachte als erhofft.",BeetleLM/beetlelm_eng-deu_heritage,step-8000,deu,7.134344577789307,1254.3146136317391
12,"In der PALM-Studie diente ZMapp als Kontrolle, d.h. die Wissenschaftler verwendeten es als Ausgangsbasis und verglichen die drei anderen Behandlungen damit.",BeetleLM/beetlelm_eng-deu_heritage,step-8000,deu,7.45782995223999,1733.3824503494357
13,"USA Gymnastics unterstützt den Brief des Olympischen Komitees der Vereinigten Staaten und akzeptiert es als absolute Notwendigkeit, dass sich die olympische Familie für ein sicheres Umfeld für alle unsere Sportler einsetzt.",BeetleLM/beetlelm_eng-deu_heritage,step-8000,deu,6.226691722869873,506.0784631955408
14,"Wir stimmen mit der Aussage des USOC überein, dass den Interessen unserer Athleten und Vereine und ihres Sports besser gedient ist, wenn wir innerhalb unserer Organisation sinnvolle Veränderungen vorantreiben, anstatt eine Dezertifizierung vorzunehmen.",BeetleLM/beetlelm_eng-deu_heritage,step-8000,deu,7.161527633666992,1288.8783637475929
15,"USA Gymnastics unterstützt eine unabhängige Untersuchung, die ans Licht bringen könnte, wie Missbrauch in dem Ausmaß, das von den Überlebenden von Lary Nassar so mutig beschrieben wurde, so lange unentdeckt bleiben konnte, und heißt alle notwendigen und angemessenen Veränderungen willkommen.",BeetleLM/beetlelm_eng-deu_heritage,step-8000,deu,6.521703720092773,679.7354783705028
16,"USA Gymnastics und das USOC haben das gleiche Ziel - den Turnsport und andere Sportarten für die Athleten so sicher wie möglich zu machen, damit sie ihren Träumen in einer sicheren, positiven und selbstbestimmten Umgebung folgen können.",BeetleLM/beetlelm_eng-deu_heritage,step-8000,deu,6.522998332977295,680.6160425507472
17,Während der 1960er-Jahre arbeitete Brzezinski als Berater für John F. Kennedy sowie anschließend für die Regierung rund um Lyndon B. Johnson.,BeetleLM/beetlelm_eng-deu_heritage,step-8000,deu,6.606912612915039,740.1942212537579
18,Während der Wahlen im Jahre 1976 beriet er Carter in der Außenpolitik und diente dann von 1977 bis 1981 in Nachfolge von Henry Kissinger als als nationaler Sicherheitsberater (NSA).,BeetleLM/beetlelm_eng-deu_heritage,step-8000,deu,6.499227523803711,664.628025366067
19,"Als nationaler Sicherheitsberater unterstützte er Carter bei der diplomatischen Handhabung von Weltangelegenheiten wie dem Camp-David-Abkommen von 1978, der Normalisierung der Beziehungen zwischen den USA und China Ende der 1970er Jahre, der iranischen Revolution, die zur Geiselkrise im Iran 1979 führte, und der sowjetischen Invasion in Afghanistan 1979.",BeetleLM/beetlelm_eng-deu_heritage,step-8000,deu,6.412537574768066,609.4382155853124
20,Der Film mit Ryan Gosling und Emma Stone hat Nominierungen in allen Hauptkategorien erhalten.,BeetleLM/beetlelm_eng-deu_heritage,step-8000,deu,6.903451442718506,995.7054119672799
21,Gosling und Stone wurden als bester Schauspieler beziehungsweise beste Schauspielerin nominiert.,BeetleLM/beetlelm_eng-deu_heritage,step-8000,deu,7.925625801086426,2767.2955903231064
22,"Weitere Nominierungen gibt es zum Beispiel für den besten Film, die Regie, die Kameraführung, das Kostümbild, den Schnitt, die Original-Filmmusik, das Produktionsdesign, den Tonschnitt, die Tonmischung und das Original-Drehbuch.",BeetleLM/beetlelm_eng-deu_heritage,step-8000,deu,6.0548095703125,426.1577446410008
23,"Zwei Lieder aus dem Kinofilm, Audition (The Fools Who Dream) und City of Stars, bekamen Nominierungen für das beste eigenständige Lied. Lionsgate Studio bekam 26 Nominierungen – mehr als jedes andere Filmstudio.",BeetleLM/beetlelm_eng-deu_heritage,step-8000,deu,7.048750877380371,1151.419579883134
24,"Am späten Sonntag kündigte der Präsident der Vereinigten Staaten, Donald Trump, in einer durch den Pressesekretär verlesenen Erklärung an, dass die US-Truppen Syrien verlassen würden.",BeetleLM/beetlelm_eng-deu_heritage,step-8000,deu,6.26413106918335,525.3848644590395
25,Die Ankündigung erfolgte nach einem Telefongespräch von Trump mit dem türkischen Präsidenten Recep Tayyip Erdoğan.,BeetleLM/beetlelm_eng-deu_heritage,step-8000,deu,6.76913595199585,870.559363845681
26,"Die Türkei würde die Überwachung gefasster ISIS-Kämpfer durchführen, deren Rückführung, so hieß es in dem Statement, von europäischen Ländern abgelehnt wurde.",BeetleLM/beetlelm_eng-deu_heritage,step-8000,deu,6.507112979888916,669.8896383179431
27,"Dies bestätigt nicht nur, dass zumindest einige Dinosaurier Federn hatten, eine Theorie, die bereits weit verbreitet ist, sondern liefert auch Details, die Fossilien im Allgemeinen nicht liefern können, wie etwa Farbe und dreidimensionale Anordnung.",BeetleLM/beetlelm_eng-deu_heritage,step-8000,deu,6.491038799285889,659.2077922453159
28,"Wissenschaftler sagen, dass das Gefieder dieses Tieres auf der Oberseite kastanienbraun und auf der Unterseite hell- oder carotinoidfarben war.",BeetleLM/beetlelm_eng-deu_heritage,step-8000,deu,6.556677341461182,703.9288892450862
29,Der Fund gewährt auch Einblicke in die Evolution von Federn bei Vögeln.,BeetleLM/beetlelm_eng-deu_heritage,step-8000,deu,7.237796783447266,1391.0258610500348
30,"Weil die Dinosaurierfedern keinen gut entwickelten Schaft besitzen, der Rachis genannt wird, aber andere Merkmale von Federn besitzen – Widerhaken und Barbules – schlossen die Forscher daraus, dass die Rachis vermutlich eine spätere evolutionäre Entwicklung war als diese anderen Merkmale.",BeetleLM/beetlelm_eng-deu_heritage,step-8000,deu,7.3090291023254395,1493.7262296160266
31,"Die Struktur der Federn lässt vermuten, dass sie nicht zum Fliegen,, sondern eher zur Temperaturregulierung oder zum Herzeigen verwendet wurden. Die Forscher vermuteten, dass die Probe, obwohl es sich um den Schwanz eines jungen Dinosauriers handelt, das Gefieder eines Ausgewachsenen zeigt und nicht die Daunen eines Kükens.",BeetleLM/beetlelm_eng-deu_heritage,step-8000,deu,6.796289920806885,894.5223787540133
32,"Die Forscher behaupteten, dass, obwohl dies der Schwanz eines jungen Dinosauriers ist, die Probe das Gefieder eines Erwachsenen und keine Kükendaunen zeigt.",BeetleLM/beetlelm_eng-deu_heritage,step-8000,deu,7.09254789352417,1202.9689359931137
33,"Eine Autobombe detonierte am Morgen des gestrigen Tages im Polizeipräsidium des türkischen Gaziantep, tötete zwei Polizisten und verwundete über zwanzig weitere Menschen.",BeetleLM/beetlelm_eng-deu_heritage,step-8000,deu,7.061737060546875,1166.4696353333195
34,Nach Angaben des Gouverneursbüros handelt es sich bei neunzehn der Verletzten um Polizeibeamte.,BeetleLM/beetlelm_eng-deu_heritage,step-8000,deu,7.431118965148926,1687.6949890683172
35,"Die Polizei sagte, dass sie einen militanten Anhänger von Daesh (ISIL) hinter dem Angriff vermuten.",BeetleLM/beetlelm_eng-deu_heritage,step-8000,deu,6.334936618804932,563.9336590630843
36,"Sie haben herausgefunden, dass die Sonne auf Basis derselben Grundprinzipien funktioniert, wie andere Sterne: Es wurde herausgefunden, dass die Aktivität aller Sterne im System durch ihre Leuchtkraft, Rotation und sonst nichts angetrieben wird.",BeetleLM/beetlelm_eng-deu_heritage,step-8000,deu,6.737706184387207,843.6233982306734
37,"Um die Rossby-Zahl eines Sterns zu bestimmen, die mit dem Plasmastrom in Zusammenhang steht, werden die Leuchtkraft und die Rotation gemeinsam einbezogen.",BeetleLM/beetlelm_eng-deu_heritage,step-8000,deu,6.793889045715332,892.3773182975161
38,"Je kleiner die Rossby-Zahl ist, umso weniger aktiv ist der Stern in Bezug auf Umpolungen des Magnetfelds.",BeetleLM/beetlelm_eng-deu_heritage,step-8000,deu,7.271272659301758,1438.3798561896554
39,Während der Reise geriet Iwasaki bei vielen Gelegenheiten in Schwierigkeiten.,BeetleLM/beetlelm_eng-deu_heritage,step-8000,deu,6.8156514167785645,912.0104212138006
40,"Er wurde von Piraten ausgeraubt, in Tibet von einem tollwütigen Hund angegriffen, konnte einer Heirat in Nepal entfliehen und wurde in Indien verhaftet.",BeetleLM/beetlelm_eng-deu_heritage,step-8000,deu,6.916646957397461,1008.9313268143231
41,"Der 802.11n-Standard läuft auf den Frequenzen 2,4 Ghz sowie 5,0 Ghz.",BeetleLM/beetlelm_eng-deu_heritage,step-8000,deu,6.081960201263428,437.88670006499274
42,"Dadurch kann er abwärtskompatibel mit 802.11a, 802.11b und 802.11g sein, vorausgesetzt, die Basisstation verfügt über Dual-Radio.",BeetleLM/beetlelm_eng-deu_heritage,step-8000,deu,6.6997246742248535,812.1821796930899
43,"Die Geschwindigkeit von 802,11 n ist wesentlich schneller als die der Vorgänger, die einen maximalen theoretischen Durchsatz von 600 Mbit/s hatten.",BeetleLM/beetlelm_eng-deu_heritage,step-8000,deu,6.683164119720459,798.8427514652046
44,"Duvall, verheiratet und zwei erwachsene Kinder, hat keinen großen Eindruck auf Miller gemacht, dem die Geschichte erzählt wurde.",BeetleLM/beetlelm_eng-deu_heritage,step-8000,deu,5.910794734954834,368.99929554805163
45,"""Als er nach einem Kommentar gefragt wurde, sagte Miller: """"Mike spricht sehr viel während der Anhörung ... ich habe mich vorbereitet und konnte daher nicht richtig hören, was er sagte.""""""",BeetleLM/beetlelm_eng-deu_heritage,step-8000,deu,5.497764587402344,244.14555575228445
46,"„Wir werden uns bemühen, die Kohlendioxidemissionen pro BIP-Einheit bis 2020 gegenüber dem Niveau von 2005 deutlich zu senken“, sagte Hu.",BeetleLM/beetlelm_eng-deu_heritage,step-8000,deu,7.567988872528076,1935.2443421950766
47,"Er nannte keine Zahl für die Kürzungen, sondern sagte, sie würden auf der Grundlage der Wirtschaftsleistung Chinas vorgenommen.",BeetleLM/beetlelm_eng-deu_heritage,step-8000,deu,6.849844455718994,943.7341028121414
48,"Hu ermutigte Entwicklungsländer „den alten Weg von erst verschmutzen und hinterher aufzuräumen, zu vermeiden“.",BeetleLM/beetlelm_eng-deu_heritage,step-8000,deu,8.14887523651123,3459.4857730858494
49,"Er fügte hinzu, dass „sie jedoch nicht dazu aufgefordert werden sollten, Verpflichtungen einzugehen, die über ihren Entwicklungsstand, ihre Verantwortung und ihre Fähigkeiten hinausgehen“.",BeetleLM/beetlelm_eng-deu_heritage,step-8000,deu,7.312231063842773,1498.5167489570563
50,Die Studiengruppe zum Irak stellte heute um 12:00 Uhr GMT ihren Bericht vor.,BeetleLM/beetlelm_eng-deu_heritage,step-8000,deu,6.770442008972168,871.697106792959
51,"Er warnt davor, dass niemand garantieren kann, dass irgendeine Vorgehensweise im Irak zu diesem Zeitpunkt die sektiererische Kriegsführung, die wachsende Gewalt oder ein Abgleiten ins Chaos stoppen wird.",BeetleLM/beetlelm_eng-deu_heritage,step-8000,deu,7.455134391784668,1728.7163049262335
52,Der Bericht fängt an mit der Bitte um einen offenen Diskurs und um Konsensbildung in den USA über eine Strategie für den Mittleren Osten.,BeetleLM/beetlelm_eng-deu_heritage,step-8000,deu,6.504865646362305,668.3858632495877
53,Der Bericht steht fast jedem Aspekt der gegenwärtigen Politik der Exekutive im Hinblick auf den Irak äußerst kritisch gegenüber und drängt auf einen sofortigen Richtungswechsel.,BeetleLM/beetlelm_eng-deu_heritage,step-8000,deu,7.941799640655518,2812.417297242722
54,"Die erste der 78 Empfehlungen ist, dass eine neue diplomatische Initiative vor Ende dieses Jahres ergriffen werden sollte, um die irakischen Grenzen gegenüber feindlichen Interventionen zu sichern und diplomatische Beziehungen mit seinen Nachbarn wiederherzustellen.",BeetleLM/beetlelm_eng-deu_heritage,step-8000,deu,6.804891109466553,902.2495181477912
55,"Die derzeitige Senatorin und argentinische First Lady Cristina Fernandez de Kirchner gab gestern Abend in La Plata, einer Stadt 50 Kilometer von Buenos Aires entfernt, ihre Präsidentschaftskandidatur bekannt.",BeetleLM/beetlelm_eng-deu_heritage,step-8000,deu,6.680631637573242,796.8222559729315
56,"Frau Kirchner kündigte ihre Absicht, als Präsidentin zu kandidieren, im Argentinischen Theater an. Dort begann sie 2005 auch ihre Kampagne für den Senat als Mitglied der Delegation der Provinz Buenos Aires.",BeetleLM/beetlelm_eng-deu_heritage,step-8000,deu,6.362517833709717,579.7041189941614
57,"""Auslöser der Debatte war eine Kontroverse über die Ausgaben für die Nothilfe und den Wiederaufbau nach dem Hurrikan Katrina, die einige fiskalisch Konservative humorvoll als """"Bushs New Orleans-Deal"""" bezeichnet haben. """,BeetleLM/beetlelm_eng-deu_heritage,step-8000,deu,6.779201984405518,879.3666956938156
58,"Die Kritik der Liberalen am Wiederaufbauprozess hat sich darauf konzentriert, dass Aufträge für den Wiederaufbau an vermeintliche Insider in Washingtoner vergeben wurden.",BeetleLM/beetlelm_eng-deu_heritage,step-8000,deu,7.245585918426514,1401.9030562182631
59,"Es kamen mehr als vier Millionen Menschen nach Rom, um an der Beerdigung teilzunehmen.",BeetleLM/beetlelm_eng-deu_heritage,step-8000,deu,5.475788593292236,238.8387393134823
60,"Die Teilnehmerzahl war so groß, dass es nicht allen möglich war, Zugang zur Bestattung auf dem Petersplatz zu erhalten.",BeetleLM/beetlelm_eng-deu_heritage,step-8000,deu,5.909224033355713,368.42016270596537
61,"Mehrere große Fernsehschirme wurden an verschiedenen Orten in Rom aufgestellt, so dass die Leute die Zeremonie ansehen konnten.",BeetleLM/beetlelm_eng-deu_heritage,step-8000,deu,6.779665946960449,879.7747835740988
62,"In vielen anderen Städten in Italien und dem Rest der Welt, besonders in Polen, wurden ähnliche Einrichtungen installiert, die von zahlreichen Menschen gesehen wurden.",BeetleLM/beetlelm_eng-deu_heritage,step-8000,deu,5.944546699523926,381.66631255790804
63,"Historiker haben die Politik des FBI aus früherer Zeit kritisiert, seine Ressourcen in der Absicht, die Erfolgsquote der Behörde zu steigern, auf einfach zu lösende Fälle, insbesondere auf Fälle von Autodiebstahl, zu konzentrieren.",BeetleLM/beetlelm_eng-deu_heritage,step-8000,deu,7.275915622711182,1445.0737289088063
64,"Der Kongress begann im August 2005 mit der Finanzierung der anti-Obszönitätsinitiative und legte fest, dass das FBI 10 Agenten für die Erwachsenenpornographie einsetzen muss.",BeetleLM/beetlelm_eng-deu_heritage,step-8000,deu,6.615287780761719,746.4195046038541
65,"Robin Uthappa erreichte die höchste Punktzahl der Innings, 70 Punkte bei nur 41 Bällen, indem er 11 Vierer und 2 Sechser schlug.",BeetleLM/beetlelm_eng-deu_heritage,step-8000,deu,7.815857887268066,2479.6132694668786
66,"Die Schlagmänner der mittleren Reihe, Sachin Tendulkar und Rahul Dravid, zeigten gute Leistungen und erzielten eine Partnerschaft mit 100 Runs.",BeetleLM/beetlelm_eng-deu_heritage,step-8000,deu,7.722976207733154,2259.674844348015
67,"Doch nach dem Verlust des Tors des Kapitäns erzielte Indien nur 36 Runden und verlor 7 Tore, womit die Innings beendet waren.",BeetleLM/beetlelm_eng-deu_heritage,step-8000,deu,7.3419318199157715,1543.691368777506
68,Der US-amerikanische Präsident George W. Bush traf am 16. November morgens in Singapur ein und begann eine einwöchige Reise durch Asien.,BeetleLM/beetlelm_eng-deu_heritage,step-8000,deu,6.8084635734558105,905.4785364022223
69,"Er wurde von Wong Kan Seng, dem stellvertretenden Premierminister Singapurs, begrüßt und sprach mit Lee Hsien Loong, dem Premierminister Singapurs, über Handels- und Terrorismusangelegenheiten.",BeetleLM/beetlelm_eng-deu_heritage,step-8000,deu,6.6057515144348145,739.335281621638
70,Nach einer Woche voller Verluste in der Zwischenwahl erzählte Bush dem Publikum von der Ausweitung des Handels in Asien.,BeetleLM/beetlelm_eng-deu_heritage,step-8000,deu,6.946556091308594,1039.5633948119573
71,"""Premierminister Stephen Harper hat nach einem 25-minütigen Treffen mit NDP-Leader Jack Layton am Dienstag im PMO zugestimmt, den """"Clean Air Act"""" der Regierung an ein Komitee aller Parteien zur Prüfung vor der zweiten Anhörung zu schicken.""",BeetleLM/beetlelm_eng-deu_heritage,step-8000,deu,6.838771343231201,933.3416733908767
72,Layton hatte während des Treffens mit dem Premierminister Änderungen am Umweltgesetz der Konservativen gefordert und dabei eine „gründliche und vollständige Neufassung“ des Umweltgesetzes der Konservativen Partei verlangt.,BeetleLM/beetlelm_eng-deu_heritage,step-8000,deu,7.192990779876709,1330.0752251463064
73,"Nachdem die Bundesregierung eingesprungen ist, um die Finanzierung des Mersey-Krankenhauses in Devonport (Tasmanien) zu übernehmen, haben die Landesregierung und einige Parlamentsmitglieder den Vorgang als PR-Gag im Vorfeld der für November anberaumten Bundeswahl kritisiert.",BeetleLM/beetlelm_eng-deu_heritage,step-8000,deu,7.090250492095947,1200.2084056787846
74,"Premierminister John Howard sagte jedoch, die Maßnahme, 45 Millionen australische Dollar bereitzustellen, diene nur dazu, die Krankenhauseinrichtungen vor einer Herabstufung durch die tasmanische Regierung zu bewahren.",BeetleLM/beetlelm_eng-deu_heritage,step-8000,deu,7.069192886352539,1175.199132106743
75,"Laut dem aktuellen Bulletin deuteten die Messungen des Meeresspiegels darauf hin, dass ein Tsunami ausgelöst wurde. In der Nähe von Pago Pago und Niue wurde eine eindeutige Tsunami-Aktivität aufgezeichnet.",BeetleLM/beetlelm_eng-deu_heritage,step-8000,deu,6.428135395050049,619.018646025045
76,"Es wurden keine nennenswerten Schäden oder Verletzungen aus Tonga vermeldet. Doch der Strom fiel zeitweise aus, was Berichten zufolge der Grund dafür war, dass die tongaischen Behörden die Tsunami-Warnung des PTWC nicht erhalten hatten.",BeetleLM/beetlelm_eng-deu_heritage,step-8000,deu,6.913783073425293,1006.0459981537755
77,"Vierzehn Schulen in Hawaii, die an oder in der Nähe von Küsten liegen, waren den ganzen Mittwoch geschlossen, obwohl die Warnungen aufgehoben worden waren.",BeetleLM/beetlelm_eng-deu_heritage,step-8000,deu,5.961162567138672,388.0610090720013
78,U.S.-Präsident George W. Bush begrüßte die Bekanntgabe.,BeetleLM/beetlelm_eng-deu_heritage,step-8000,deu,7.362803936004639,1576.250076803586
79,"""Bush-Sprecher Gordon Johndroe nannte das Versprechen Nordkoreas „einen wichtigen Schritt in Richtung des Ziels, die verifizierbare Entnuklearisierung der koreanischen Halbinsel zu erreichen.""""""",BeetleLM/beetlelm_eng-deu_heritage,step-8000,deu,6.921159744262695,1013.494707892461
80,"Der zehnte Sturm der atlantischen Hurrikan-Saison, der einen Namen erhielt, der subtropische Sturm Jerry, ist heute im Atlantischen Ozean entstanden.",BeetleLM/beetlelm_eng-deu_heritage,step-8000,deu,6.279401779174805,533.4694358245468
81,"Das National Hurricane Center (NHC) sagt, dass Jerry zu diesem Zeitpunkt keine Gefahr für die Landung darstellt.",BeetleLM/beetlelm_eng-deu_heritage,step-8000,deu,5.79254150390625,327.84518627825196
82,"Der US-amerikanische Ingenieurskorps schätzte , dass 6 Zoll Regen die schon zuvor beschädigten Dämme brechen lassen könnten.",BeetleLM/beetlelm_eng-deu_heritage,step-8000,deu,7.647332191467285,2095.048937909214
83,"Der Ninth Ward, der während des Hurrikans Katrina bis zu 20 Fuß hoch überflutet war, führt derzeit hüfthohes Wasser, da der nahe gelegene Deich überspült wurde.",BeetleLM/beetlelm_eng-deu_heritage,step-8000,deu,7.000282287597656,1096.9427680656859
84,Auf einem 100 Fuß langen Teilabschnitt läuft Wasser über den Damm.,BeetleLM/beetlelm_eng-deu_heritage,step-8000,deu,6.948151588439941,1041.2233390922713
85,"Der Commons-Administrator Adam Cuerden hat seine Enttäuschung über die Entfernungen zum Ausdruck gebracht, als er im letzten Monat mit Wikinews redete.",BeetleLM/beetlelm_eng-deu_heritage,step-8000,deu,6.245388507843018,515.6295121273107
86,"""""""Er [Wales] hat uns im Grunde von Anfang an belogen. Erstens, indem er so tat, als ob dies aus rechtlichen Gründen geschah. Zweitens, indem er so tat, als würde er uns zuhören, bis hin zu seiner Kunstlöschung.""""""",BeetleLM/beetlelm_eng-deu_heritage,step-8000,deu,6.007883071899414,406.6216197834857
87,"Die Irritationen in der Community führten zu den derzeitigen Bemühungen, eine Richtlinie bezüglich sexueller Inhalte für die Website zu entwerfen, die Millionen offen lizenzierter Medien hostet.",BeetleLM/beetlelm_eng-deu_heritage,step-8000,deu,7.544835567474365,1890.9517778757447
88,"Die Arbeit war größtenteils theoretischer Natur, doch das Programm wurde geschrieben, um Beobachtungen zu simulieren, die von der Sagittarius-Galaxie gemacht wurden.",BeetleLM/beetlelm_eng-deu_heritage,step-8000,deu,6.150264739990234,468.8414914458251
89,"Der Effekt, nach dem das Team suchte, würde von Gezeitenkräften zwischen der dunklen Materie der Galaxie und der dunklen Materie der Milchstraße verursacht werden.",BeetleLM/beetlelm_eng-deu_heritage,step-8000,deu,6.3675971031188965,582.6560829557993
90,"Genau wie der Mond die Erde anzieht und die Gezeiten verursacht, übt auch die Milchstraße Anziehungskräfte auf die Sagittarius-Galaxie aus.",BeetleLM/beetlelm_eng-deu_heritage,step-8000,deu,6.116143226623535,453.1137630990712
91,"Die Wissenschaftler kamen zu dem Schluss, dass die dunkle Materie auf andere dunkle Materie in der gleichen Weise wirkt wie normale Materie.",BeetleLM/beetlelm_eng-deu_heritage,step-8000,deu,6.445632457733154,629.9449645630012
92,"Diese Theorie besagt, dass sich der größte Teil der dunklen Materie in einer Art Halo um eine Galaxie befindet und aus vielen kleinen Partikeln besteht.",BeetleLM/beetlelm_eng-deu_heritage,step-8000,deu,5.337099552154541,207.90880626721378
93,"Fernsehberichte zeigen, dass weißer Rauch aus der Anlage entweicht.",BeetleLM/beetlelm_eng-deu_heritage,step-8000,deu,7.1552605628967285,1280.82613014172
94,"Die lokalen Behörden ermahnen die Einwohner in der Nähe der Anlage dazu, sich innerhalb von Gebäuden aufzuhaltem, Klimaanlagen auszuschalten und kein Leitungswasser zu trinken.",BeetleLM/beetlelm_eng-deu_heritage,step-8000,deu,7.283455848693848,1456.0110946708573
95,Der Nuklearbehörde von Japan zufolge wurden radioaktives Cäsium und Jod im Atomkraftwerk festgestellt.,BeetleLM/beetlelm_eng-deu_heritage,step-8000,deu,7.516134738922119,1837.4513212918516
96,"Die Behörden spekulieren, dass dies darauf hindeutet, dass Behälter mit Uran-Kraftstoff am Standort gerissen sein könnten und eventuell undicht sind.",BeetleLM/beetlelm_eng-deu_heritage,step-8000,deu,7.472370624542236,1758.7711334668309
97,Die extrem-arzneimittelresistente Tuberkulose (XDR-TB) wurde von Dr. Tony Moll in der südafrikanischen Region KwaZulu-Natal entdeckt.,BeetleLM/beetlelm_eng-deu_heritage,step-8000,deu,6.334717273712158,563.8099765473913
98,"""In einem Interview sagte er, die neue Variante sei „äußerst beunruhigend und alarmierend aufgrund der sehr hohen Sterblichkeitsrate.""""""",BeetleLM/beetlelm_eng-deu_heritage,step-8000,deu,7.144911289215088,1267.6388669843682
