sentence_id,sentence,repo,revision,iso_code,nll,ppl
413,Les cultures minoritaires disparaissent souvent sans laisser de traces historiques pertinentes et ne sont pas reconnues comme de véritables civilisations.,BeetleLM/beetlelm_nld-fra_balanced,step-8000,fra,7.3143815994262695,1501.7428302060814
414,"Pendant la guerre révolutionnaire, les treize États ont d’abord formé un gouvernement central faible — le Congrès étant sa seule composante — en vertu des articles de la Confédération.",BeetleLM/beetlelm_nld-fra_balanced,step-8000,fra,6.44246244430542,627.9511923785165
415,"Le Congrès n’avait pas le pouvoir d’imposer des taxes et, comme il n’y avait pas de pouvoir exécutif ou judiciaire national, il s’en remettait aux autorités de l’État, souvent peu coopératives, pour faire appliquer tous ses actes.",BeetleLM/beetlelm_nld-fra_balanced,step-8000,fra,5.533404350280762,253.00376000090975
416,Il n'avait pas non plus le pouvoir de déroger aux lois fiscales ni à celles sur les droits de douane entre les États.,BeetleLM/beetlelm_nld-fra_balanced,step-8000,fra,5.586256980895996,266.7353533501173
417,Les articles nécessitaient le consentement unanime de tous les États avant de pouvoir être amendés et les États prenaient le gouvernement central tellement à la légère que leurs représentants étaient souvent absents.,BeetleLM/beetlelm_nld-fra_balanced,step-8000,fra,6.128663539886475,458.8225526991019
418,"L'équipe nationale italienne de football est, avec l'équipe nationale allemande, la deuxième équipe la plus titrée du monde et elle a remporté la Coupe du monde de la FIFA en 2006.",BeetleLM/beetlelm_nld-fra_balanced,step-8000,fra,4.441608428955078,84.91140586173692
419,"Parmi les sports populaires figurent le football, le basket-ball, le volley-ball, le water-polo, l'escrime, le rugby, le cyclisme, le hockey sur glace, le roller hockey et la Formule 1.",BeetleLM/beetlelm_nld-fra_balanced,step-8000,fra,5.075350284576416,160.0282375862751
420,"Les sports d'hiver sont les plus populaires dans les régions du Nord, les Italiens participant à des jeux internationaux et à des événements olympiques.",BeetleLM/beetlelm_nld-fra_balanced,step-8000,fra,4.750885009765625,115.68662302635292
421,"Le Japon compte près de 7 000 îles (la plus grande étant Honshu), ce qui en fait la 7e plus grande île au monde !",BeetleLM/beetlelm_nld-fra_balanced,step-8000,fra,5.255118370056152,191.5441576052138
422,"En raison du groupe d'îles qui le composent, le Japon est souvent désigné, d'un point de vue géographique, comme un « archipel ».",BeetleLM/beetlelm_nld-fra_balanced,step-8000,fra,4.503353118896484,90.3194760601743
423,"Les premières informations concernant Taïwan remontent au XVe siècle, tandis que des navigateurs européens passant par là en firent mention sous le nom d’Ilha Formosa, ou « belle île ».",BeetleLM/beetlelm_nld-fra_balanced,step-8000,fra,6.132568836212158,460.61789411663955
424,"En 1624, la Dutch East India Company établit une base dans le sud-ouest de Taïwan, introduisant une transformation des pratiques autochtones de production de céréales et employant des ouvriers chinois pour travailler dans ses plantations de riz et de sucre.",BeetleLM/beetlelm_nld-fra_balanced,step-8000,fra,5.731261253356934,308.3579407066006
425,"En 1683, les forces de la dynastie Qing (1644-1912) prennent le contrôle des zones côtières occidentale et septentrionale de Taïwan et la déclarent province de l'Empire Qing en 1885.",BeetleLM/beetlelm_nld-fra_balanced,step-8000,fra,4.535257816314697,93.24755294609771
426,"En 1895, après sa défaite lors de la première guerre sino-japonaise (1894–1895), le gouvernement Qing signe le traité de Shimonoseki, par lequel il cède la souveraineté de Taïwan au Japon, qui dirige alors l'île jusqu'en 1945.",BeetleLM/beetlelm_nld-fra_balanced,step-8000,fra,4.942410945892334,140.10763461418003
427,"Le Machu Picchu est composé de trois structures principales, à savoir l'Intihuatana, le temple du soleil et la salle des trois fenêtres.",BeetleLM/beetlelm_nld-fra_balanced,step-8000,fra,5.584209442138672,266.1897611274076
428,La plupart des bâtiments limitrophes du complexe ont été reconstruits afin d'offrir aux touristes un meilleur aperçu de leur aspect originel.,BeetleLM/beetlelm_nld-fra_balanced,step-8000,fra,5.732271671295166,308.6696685624742
429,"En 1976, trente pour cent du Machu Picchu avait été restauré et cette restauration se poursuit jusqu'à aujourd'hui.",BeetleLM/beetlelm_nld-fra_balanced,step-8000,fra,6.028040409088135,414.90119563951254
430,"Par exemple, le format de photographie le plus courant au monde est le 35 mm ; c'était le format de pellicule le plus répandu à la fin de l'ère des films analogiques.",BeetleLM/beetlelm_nld-fra_balanced,step-8000,fra,4.992978096008301,147.37466651297143
431,"C'est encore fabriqué aujourd'hui, mais ce qui importe est que son format d'image est hérité du format du capteur photographique des caméras numériques.",BeetleLM/beetlelm_nld-fra_balanced,step-8000,fra,5.853368759155273,348.40610199267644
432,"Le format 35 mm est en fait, et c’est assez déconcertant, de 36 mm de largeur par 24 mm de hauteur.",BeetleLM/beetlelm_nld-fra_balanced,step-8000,fra,5.987424850463867,398.3873807816236
433,On dit donc que le rapport d'aspect de ce format (en divisant par douze pour obtenir le plus simple des rapports de nombres entiers) est de 3:2.,BeetleLM/beetlelm_nld-fra_balanced,step-8000,fra,5.304523468017578,201.24507984357464
434,"De nombreux formats courants (famille de formats APS, par exemple) sont égaux à ce rapport d’aspect ou s’en approchent de près.",BeetleLM/beetlelm_nld-fra_balanced,step-8000,fra,6.703997611999512,815.6600085903249
435,"La règle des tiers, fort maltraitée et souvent tournée en ridicule, est une simple directive suscitant le dynamisme tout en offrant une protection à l’image.",BeetleLM/beetlelm_nld-fra_balanced,step-8000,fra,6.873943328857422,966.7532853797949
436,Il indique que l'endroit le plus efficace pour le sujet principal se trouve à l'intersection des lignes divisant l'image en tiers verticalement et horizontalement (voir exemple).,BeetleLM/beetlelm_nld-fra_balanced,step-8000,fra,5.675665378570557,291.6823531787869
437,"Pendant cette période de l'histoire européenne, l'Église catholique, qui était devenue riche et puissante, a été remise en question.",BeetleLM/beetlelm_nld-fra_balanced,step-8000,fra,4.173083305358887,64.91529754161398
438,"Pendant plus d'un millier d'années, la religion chrétienne a lié les États européens entre eux malgré les différences de langue et de coutumes.",BeetleLM/beetlelm_nld-fra_balanced,step-8000,fra,5.238096237182617,188.3112609628318
439,"Son pouvoir omniprésent touchait tout le monde, du roi au roturier.",BeetleLM/beetlelm_nld-fra_balanced,step-8000,fra,6.136000633239746,462.20135674362433
440,L'un des principaux principes chrétiens est que la richesse doit être utilisée pour soulager la souffrance et la pauvreté et que les fonds monétaires de l'église sont là spécifiquement pour cette raison.,BeetleLM/beetlelm_nld-fra_balanced,step-8000,fra,5.500370979309082,244.78272474821492
441,L'autorité centrale de l'église était à Rome depuis plus de 1000 ans et cette concentration de pouvoir et d'argent a conduit beaucoup de gens à se demander si cette doctrine était respectée.,BeetleLM/beetlelm_nld-fra_balanced,step-8000,fra,5.021130561828613,151.5825804357161
442,"Peu après le début des hostilités, la Grande-Bretagne a mis en place un blocus naval contre l’Allemagne.",BeetleLM/beetlelm_nld-fra_balanced,step-8000,fra,5.224409103393555,185.75137823216178
443,"Cette stratégie s'est avérée efficace, coupant les approvisionnements militaires et civils vitaux, bien que ce blocus ait violé le droit international généralement accepté et codifié par plusieurs accords internationaux des deux derniers siècles.",BeetleLM/beetlelm_nld-fra_balanced,step-8000,fra,6.485467910766602,655.5456293455015
444,"La Grande-Bretagne mina les eaux internationales afin d'empêcher les navires de s'aventurer dans des zones maritimes entières, représentant ainsi une menace même pour les navires neutres.",BeetleLM/beetlelm_nld-fra_balanced,step-8000,fra,6.159249782562256,473.07303403312847
445,"Comme cette tactique n'a suscité qu'une timide réaction, l'Allemagne s'attendait à une réaction semblable face à sa guerre sous-marine sans limites.",BeetleLM/beetlelm_nld-fra_balanced,step-8000,fra,5.028111457824707,152.64446480433662
446,"Pendant les années 20, la plupart des citoyens et des nations montraient un penchant pour le pacifisme et l’isolement.",BeetleLM/beetlelm_nld-fra_balanced,step-8000,fra,5.409945487976074,223.6193974023492
447,"Après avoir vu les horreurs et les atrocités de la guerre pendant la Première Guerre mondiale, les nations ont souhaité éviter qu’une telle situation ne se reproduise à l’avenir.",BeetleLM/beetlelm_nld-fra_balanced,step-8000,fra,5.226817607879639,186.1993004547424
448,"En 1884, Tesla s'est installé aux États-Unis d'Amérique pour accepter un emploi à la Edison Company à New York.",BeetleLM/beetlelm_nld-fra_balanced,step-8000,fra,4.593844413757324,98.87381228795604
449,"Il est arrivé aux États-Unis avec quatre cents à son nom, un livre de poésie et une lettre de recommandation de Charles Batchelor (son directeur dans son précédent emploi) à l'attention de Thomas Edison.",BeetleLM/beetlelm_nld-fra_balanced,step-8000,fra,5.1531267166137695,172.97147847741513
450,La Chine ancienne avait une façon unique de montrer les différentes époques ; chaque étape de la Chine ou chaque famille qui était au pouvoir était une dynastie distincte.,BeetleLM/beetlelm_nld-fra_balanced,step-8000,fra,5.611818313598633,273.64135170444337
451,"Entre chaque dynastie, il y a également eu un âge instable de provinces divisées. La plus connue de ces périodes est l’époque des Trois Royaumes qui s’est déroulée pendant 60 ans entre la dynastie Han et la dynastie Jin.",BeetleLM/beetlelm_nld-fra_balanced,step-8000,fra,5.0832109451293945,161.2911222920315
452,"Durant ces périodes, des luttes féroces ont eu lieu entre de nombreux membres de la noblesse qui se battaient pour le trône.",BeetleLM/beetlelm_nld-fra_balanced,step-8000,fra,5.072357177734375,159.5499720803675
453,Les Trois Royaumes ont été l'une des époques les plus sanguinaires de l'histoire de l'Antiquité Chinoise. Des milliers de personnes sont mort au combat pour s'asseoir sur le trône du grand palais de XI'an.,BeetleLM/beetlelm_nld-fra_balanced,step-8000,fra,4.50706672668457,90.65551073419398
454,"Il y a de nombreuses répercussions sociales et politiques telles que l'utilisation du système métrique, le passage de l'absolutisme au républicanisme, le nationalisme et la conviction que le pays appartient au peuple et non à un seul dirigeant.",BeetleLM/beetlelm_nld-fra_balanced,step-8000,fra,5.495970249176025,243.70786884541965
455,"Aussi, après la Révolution, les métiers furent ouverts à tous les candidats masculins, permettant aux plus ambitieux et aux plus talentueux de réussir.",BeetleLM/beetlelm_nld-fra_balanced,step-8000,fra,5.700004577636719,298.8687690765803
456,"Il en va de même pour l'armée, car le classement des armées n'est plus basé sur la classe, mais sur le calibre.",BeetleLM/beetlelm_nld-fra_balanced,step-8000,fra,4.256223201751709,70.54305282167378
457,La Révolution française a également inspiré de nombreuses autres classes ouvrières réprimées d’autres pays à entamer leur propre révolution.,BeetleLM/beetlelm_nld-fra_balanced,step-8000,fra,6.46522855758667,642.411174615716
458,Muhammad s’intéressait profondément à des questions qui dépassaient le cadre de cette vie mondaine. Il avait l’habitude de fréquenter une grotte qui est devenue célèbre sous le nom de « Hira' » sur la montagne de « Noor » (lumière) pour la contemplation.,BeetleLM/beetlelm_nld-fra_balanced,step-8000,fra,5.7311930656433105,308.336915200495
459,"La grotte elle-même, qui a survécu à l’époque, donne une image très vivante des penchants spirituels de Muhammad.",BeetleLM/beetlelm_nld-fra_balanced,step-8000,fra,5.7001848220825195,298.9226433673546
460,"Située au sommet d'une des montagnes au nord de La Mecque, la grotte est totalement isolée du reste du monde.",BeetleLM/beetlelm_nld-fra_balanced,step-8000,fra,4.464050769805908,86.83856062119779
461,"En réalité, ce n'est pas facile du tout à trouver, même si on sait que ça existe. Quand on est entré dans la grotte, on est complètement isolé.",BeetleLM/beetlelm_nld-fra_balanced,step-8000,fra,3.887014389038086,48.76507542069528
462,"Au-dessus, on ne peut rien contempler d'autre que le ciel clair et magnifique et les nombreuses montagnes environnantes. Depuis l'intérieur de la grotte, on ne peut voir ou entendre que très peu de choses de cet univers.",BeetleLM/beetlelm_nld-fra_balanced,step-8000,fra,4.783367156982422,119.50606903460586
463,La Grande Pyramide de Gizeh est la seule des sept merveilles qui existe encore aujourd’hui.,BeetleLM/beetlelm_nld-fra_balanced,step-8000,fra,5.901876926422119,365.72325972292884
464,"Construite par les Égyptiens au cours du troisième millénaire avant J-C, la Grande Pyramide est l'une des nombreuses structures géantes érigées en l'honneur des pharaons décédés.",BeetleLM/beetlelm_nld-fra_balanced,step-8000,fra,5.21817684173584,184.59732694989782
465,"Le plateau de Gizeh, ou « nécropole de Gizeh », dans la vallée des Morts en Égypte, regroupe plusieurs pyramides (la grande pyramide étant la plus imposante), plusieurs petits tombeaux, de nombreux temples et le grand Sphinx.",BeetleLM/beetlelm_nld-fra_balanced,step-8000,fra,5.694284915924072,297.16422018944786
466,"La grande pyramide a été créée pour honorer le pharaon Khéops, et beaucoup de petites pyramides, tombes et temples ont été construits pour honorer ses femmes ainsi que les membres de sa famille.",BeetleLM/beetlelm_nld-fra_balanced,step-8000,fra,5.262948036193848,193.04977094314532
467,Le symbole « pousser » ressemble à un V et le symbole « tirer » à une agrafe ou à un carré dont le côté inférieur est manquant.,BeetleLM/beetlelm_nld-fra_balanced,step-8000,fra,6.1833062171936035,484.5914753848762
468,"Le haut signifie que vous devez commencer par la pointe et pousser l’archet, et le bas signifie que vous devez commencer par la hausse (qui est l’endroit où votre main tient l’arc) et tirer l’archet.",BeetleLM/beetlelm_nld-fra_balanced,step-8000,fra,5.742029190063477,311.6962606479807
469,"Un archet vers le haut produit généralement un son plus doux, tandis qu'un archet vers le bas est plus fort et plus affirmé.",BeetleLM/beetlelm_nld-fra_balanced,step-8000,fra,5.504141807556152,245.70750085122248
470,"N'hésitez pas à inscrire vos propres marques au crayon, mais n'oubliez pas que les marques d'archet imprimées le sont pour un motif d'ordre musical, et qu'il faut donc en général les respecter.",BeetleLM/beetlelm_nld-fra_balanced,step-8000,fra,5.168980121612549,175.73551720126713
471,"Le 6 octobre 1789, le roi Louis XVI, la reine Marie-Antoinette, leurs deux jeunes enfants (Marie-Thérèse, 11 ans, et Louis-Charles, 4 ans) et la sœur du roi, madame Élisabeth, tous terrifiés, sont contraints de rentrer à Paris depuis Versailles par une foule de vendeuses.",BeetleLM/beetlelm_nld-fra_balanced,step-8000,fra,5.354882717132568,211.6391532505062
472,"Dans un carrosse, ils sont rentrés à Paris entourés d’une foule de gens qui hurlent et crient des menaces contre le roi et la reine.",BeetleLM/beetlelm_nld-fra_balanced,step-8000,fra,5.8406476974487305,344.00207779218925
473,"Le roi et la reine ont été obligés, à cause de la foule, de faire ouvrir les fenêtres de leurs carrosses.",BeetleLM/beetlelm_nld-fra_balanced,step-8000,fra,4.958683490753174,142.40619336348172
474,"À un moment donné, un membre de la foule a brandi la tête d'un garde royal tué à Versailles devant la reine terrorisée.",BeetleLM/beetlelm_nld-fra_balanced,step-8000,fra,5.882584571838379,358.7352215136853
475,Les dépenses de guerre de l'impérialisme américain dans la conquête des Philippines ont été payées par le peuple philippin lui-même.,BeetleLM/beetlelm_nld-fra_balanced,step-8000,fra,5.602164268493652,271.0123165832584
476,Ils ont été contraints de payer des impôts au régime colonial américain pour couvrir une grande partie des dépenses et des intérêts des obligations émises au nom du gouvernement philippin par les établissements bancaires de Wall Street.,BeetleLM/beetlelm_nld-fra_balanced,step-8000,fra,5.98276424407959,396.5349740337432
477,"Naturellement, les superprofits issus de l'exploitation prolongée du peuple philippin pourraient constituer les avantages fondamentaux de l'impérialisme américain.",BeetleLM/beetlelm_nld-fra_balanced,step-8000,fra,6.25204610824585,519.0738200659077
478,"Pour comprendre les Templiers, il faut comprendre le contexte qui a poussé à la création de l'ordre.",BeetleLM/beetlelm_nld-fra_balanced,step-8000,fra,4.39054012298584,80.68398648920339
479,Ces événements ont eu lieu dans la période généralement considérée comme le Haut Moyen Âge – période de l'histoire en Europe courant du XIe au XIIIe siècle (1000-1300).,BeetleLM/beetlelm_nld-fra_balanced,step-8000,fra,5.048637866973877,155.81008581154188
480,"Le Moyen Âge Central a été précédé par le Haut Moyen Âge et suivi par le Bas Moyen Âge, qui par convention se termine vers 1500.",BeetleLM/beetlelm_nld-fra_balanced,step-8000,fra,5.014509677886963,150.5822848376921
481,"Le déterminisme technologique est un terme qui englobe un large éventail d'idées dans la pratique, allant de la poussée technologique ou de l'impératif technologique à un sens strict selon lequel le destin de l'humanité est dicté par une logique sous-jacente liée aux lois scientifiques et à leur manifestation dans les technologies.",BeetleLM/beetlelm_nld-fra_balanced,step-8000,fra,5.941335678100586,380.4427393629088
482,"La plupart des interprétations du déterminisme technologique s’accordent sur deux idées générales : le développement technologique lui-même se déroule selon un processus dépassant largement les influences culturelles et politiques, et la technologie a une incidence sur les sociétés conditionnées intrinsèquement plutôt que socialement.",BeetleLM/beetlelm_nld-fra_balanced,step-8000,fra,6.88585901260376,978.3417167170484
483,"Par exemple, on pourrait dire que l'automobile conduit nécessairement au développement des routes.",BeetleLM/beetlelm_nld-fra_balanced,step-8000,fra,5.3011579513549805,200.5689246181514
484,"Cependant, un réseau routier national n'est pas économiquement viable pour une poignée de voitures, c'est pourquoi de nouvelles méthodes de production sont développées pour réduire le coût de la possession d'une voiture.",BeetleLM/beetlelm_nld-fra_balanced,step-8000,fra,4.9969377517700195,147.95937632117565
485,"La possession massive de voitures entraîne également une plus grande incidence des accidents sur les routes, ce qui conduit à l’invention de nouvelles techniques dans le domaine des soins de santé pour soigner les lésions corporelles.",BeetleLM/beetlelm_nld-fra_balanced,step-8000,fra,6.177273750305176,481.6769929529086
486,"Le romantisme présentait un important élément de déterminisme culturel, tiré d'écrivains tels que Goethe, Fichte et Schlegel.",BeetleLM/beetlelm_nld-fra_balanced,step-8000,fra,6.701277732849121,813.4445262270938
487,"D’après les théories du Romantisme, la géographie aurait façonné les individus et, avec le temps, des coutumes et une culture liées à cette géographie seraient apparues. Celles-ci, en harmonie avec les lieux occupés par la société, seraient préférables aux lois imposées arbitrairement.",BeetleLM/beetlelm_nld-fra_balanced,step-8000,fra,6.3562421798706055,576.0774882563467
488,"De la même manière que Paris est connue comme la capitale de la mode du monde contemporain, Constantinople était considérée comme celle de l’Europe féodale.",BeetleLM/beetlelm_nld-fra_balanced,step-8000,fra,5.439205169677734,230.25909379794527
489,"Sa réputation en tant qu'épicentre du luxe a débuté aux environs de l'an 400, et duré jusqu'à 1100 environ.",BeetleLM/beetlelm_nld-fra_balanced,step-8000,fra,5.380166530609131,217.05841928611503
490,"Son statut a décliné au cours du douzième siècle, principalement à cause du fait que les Croisés s'en revenaient chargés de présents tels que de la soie et des épices, avec lesquels les marchés byzantins pouvaient difficilement rivaliser.",BeetleLM/beetlelm_nld-fra_balanced,step-8000,fra,6.291823863983154,540.1375687097219
491,C'est à cette époque que le titre de capitale de la mode fut transféré de Constantinople à Paris.,BeetleLM/beetlelm_nld-fra_balanced,step-8000,fra,4.7933149337768555,120.70082144757096
492,Le style gothique a connu son apogée entre le Xe–XIe siècle et le XIVe siècle.,BeetleLM/beetlelm_nld-fra_balanced,step-8000,fra,5.206291675567627,182.4163433941132
493,"Au début, la robe était fortement influencée par la culture byzantine, à l’est.",BeetleLM/beetlelm_nld-fra_balanced,step-8000,fra,5.708968162536621,301.55974704950336
494,"Cependant, en raison de la lenteur des moyens de communication, les modes occidentales pouvaient accuser un retard de 25 à 30 ans.",BeetleLM/beetlelm_nld-fra_balanced,step-8000,fra,5.544643402099609,255.86332164999607
495,"Au cours de la fin du Moyen Âge, l'Europe occidentale a commencé à développer son propre style. Un des plus grands progrès de l'époque, suite aux croisades, fut l'utilisation de boutons pour la fermeture des vêtements.",BeetleLM/beetlelm_nld-fra_balanced,step-8000,fra,4.097009658813477,60.16011906709886
496,L'agriculture de subsistance est une agriculture pratiquée pour produire suffisamment de nourriture pour répondre uniquement aux besoins de l'agriculteur et de sa famille.,BeetleLM/beetlelm_nld-fra_balanced,step-8000,fra,5.4244890213012695,226.89537798413744
497,"L'agriculture de subsistance est un système simple, souvent biologique, utilisant des semences conservées originaires de l'écorégion, combinées à la rotation des cultures ou à d'autres techniques relativement simples pour maximiser le rendement.",BeetleLM/beetlelm_nld-fra_balanced,step-8000,fra,5.947793483734131,382.9075145823003
498,"Historiquement, la plupart des agriculteurs pratiquaient une agriculture de subsistance et c'est encore le cas dans de nombreux pays en voie de développement.",BeetleLM/beetlelm_nld-fra_balanced,step-8000,fra,5.677750587463379,292.2912063879651
499,Les sous-cultures rassemblent des individus se sentant négligés par les normes sociétales et partageant les mêmes idées ce qui leur permet de développer un sentiment d'identité.,BeetleLM/beetlelm_nld-fra_balanced,step-8000,fra,5.558666706085205,259.47664695373066
500,"Les sous-cultures peuvent se distinguer par l'âge, l'origine ethnique, la classe, la localisation et / ou le sexe des membres.",BeetleLM/beetlelm_nld-fra_balanced,step-8000,fra,5.0451765060424805,155.27170317364175
501,"Les critères qui déterminent une sous-culture comme distincte peuvent être linguistiques, esthétiques, religieux, politiques, sexuels, géographiques ou une combinaison de facteurs.",BeetleLM/beetlelm_nld-fra_balanced,step-8000,fra,6.48892879486084,657.8183272907581
502,"Les membres d'une sous-culture signalent souvent leur appartenance par un usage distinctif et symbolique du style, qui englobe les modes, les maniérismes et l'argot.",BeetleLM/beetlelm_nld-fra_balanced,step-8000,fra,6.1967973709106445,491.17347300728585
503,"L'une des méthodes les plus courantes utilisées pour illustrer l'importance de la socialisation est de s'inspirer des quelques cas malheureux d'enfants qui, par négligence, malheur ou abus volontaire, n'ont pas été socialisés par des adultes pendant leur enfance.",BeetleLM/beetlelm_nld-fra_balanced,step-8000,fra,5.400671005249023,221.55503092668087
504,"Ces enfants sont considérés comme « féroces » ou sauvages. Certains enfants sauvages ont été enfermés par des personnes (généralement leurs propres parents) ; dans certains cas, l'abandon de cet enfant était dû au rejet par les parents d'une déficience intellectuelle ou physique grave dont souffrait l'enfant.",BeetleLM/beetlelm_nld-fra_balanced,step-8000,fra,5.641979694366455,282.0204805504672
505,Les enfants sauvages peuvent avoir subi de graves abus ou traumatismes avant d'être abandonnés ou de s'enfuir.,BeetleLM/beetlelm_nld-fra_balanced,step-8000,fra,5.673986911773682,291.1931846751302
506,D’autres auraient été élevés par des animaux ; certains auraient vécu seuls dans la nature.,BeetleLM/beetlelm_nld-fra_balanced,step-8000,fra,6.331984519958496,562.2713260516343
507,"Lorsqu'ils sont entièrement élevés par des espèces non humaines, les enfants sauvages affichent des comportements (dans les limites de leurs dispositions physiques) presque identiques à ceux des animaux qui les ont élevés, tels que la peur ou l'indifférence envers les humains.",BeetleLM/beetlelm_nld-fra_balanced,step-8000,fra,5.404826641082764,222.47764865624694
508,"Tandis que la pédagogie de projet devrait rendre l'apprentissage plus facile et plus intéressant, le soutien va plus loin.",BeetleLM/beetlelm_nld-fra_balanced,step-8000,fra,5.8382673263549805,343.1841990037223
509,Le soutien n'est pas une méthode d'apprentissage mais davantage un moyen d'aider les apprenants qui découvrent un nouvel enseignement tel que l'utilisation d'un nouveau programme ou le début d'un nouveau projet.,BeetleLM/beetlelm_nld-fra_balanced,step-8000,fra,4.695321083068848,109.4339403868222
