sentence_id,sentence,repo,revision,iso_code,nll,ppl
445,"Since there was limited response to this tactic, Germany expected a similar response to its unrestricted submarine warfare.",BeetleLM/beetlelm_nld_L1-eng_L2_simultaneous,step-30000,eng,6.1776227951049805,481.8451491477998
446,"During the 1920s, the prevailing attitudes of most citizens and nations was that of pacifism and isolation.",BeetleLM/beetlelm_nld_L1-eng_L2_simultaneous,step-30000,eng,5.700538158416748,299.0282822603105
447,"After seeing the horrors and atrocities of war during World War I, nations desired to avoid such a situation again in the future.",BeetleLM/beetlelm_nld_L1-eng_L2_simultaneous,step-30000,eng,5.437741756439209,229.92237603050205
448,"In 1884, Tesla moved to the United States of America to accept a job with the Edison Company in New York City.",BeetleLM/beetlelm_nld_L1-eng_L2_simultaneous,step-30000,eng,3.9013478755950928,49.46908235759637
449,"He arrived in the US with 4 cents to his name, a book of poetry, and a letter of recommendation from Charles Batchelor (his manager in his previous job) to Thomas Edison.",BeetleLM/beetlelm_nld_L1-eng_L2_simultaneous,step-30000,eng,5.261248588562012,192.72197158490476
450,Ancient China had a unique way of showing different time periods; each stage of China or each family that was in power was a distinctive dynasty.,BeetleLM/beetlelm_nld_L1-eng_L2_simultaneous,step-30000,eng,5.889495849609375,361.2231276780383
451,Also between each dynasty was an unstable age of divided provinces. The best-known of these periods was the Three Kingdoms epoch taking place for 60 years between the Han and the Jin Dynasty.,BeetleLM/beetlelm_nld_L1-eng_L2_simultaneous,step-30000,eng,4.542076110839844,93.8855146597407
452,During these periods fierce warfare took place between many nobles fighting for the throne.,BeetleLM/beetlelm_nld_L1-eng_L2_simultaneous,step-30000,eng,5.8232526779174805,338.06989968961295
453,The Three Kingdoms was one of the bloodiest eras in Ancient China’s history thousands of people died fighting to sit in the highest seat in the grand palace at Xi’an.,BeetleLM/beetlelm_nld_L1-eng_L2_simultaneous,step-30000,eng,5.132748603820801,169.48231817387676
454,"There are a lot of social and political effects such as the use of metric system, a shift from absolutism to republicanism, nationalism and the belief the country belongs to the people not to one sole ruler.",BeetleLM/beetlelm_nld_L1-eng_L2_simultaneous,step-30000,eng,4.696175575256348,109.52749079728532
455,Also after the Revolution occupations were open to all male applicants allowing the most ambitious and successful to succeed.,BeetleLM/beetlelm_nld_L1-eng_L2_simultaneous,step-30000,eng,6.2287068367004395,507.0992971089064
456,Same goes for the military because instead of army rankings being based on class they were now based on cailaber.,BeetleLM/beetlelm_nld_L1-eng_L2_simultaneous,step-30000,eng,6.453419208526611,634.8693365626384
457,The French Revolution also inspired many other repressed working class people of other country's to began their own revolutions.,BeetleLM/beetlelm_nld_L1-eng_L2_simultaneous,step-30000,eng,5.444904327392578,231.57512325640246
458,Muhammad was deeply interested in matters beyond this mundane life. He used to frequent a cave that became known as “Hira‘” on the Mountain of “Noor” (light) for contemplation.,BeetleLM/beetlelm_nld_L1-eng_L2_simultaneous,step-30000,eng,5.273101329803467,195.0198464016247
459,"he cave itself, which survived the times, gives a very vivid image of Muhammad’s spiritual inclinations.",BeetleLM/beetlelm_nld_L1-eng_L2_simultaneous,step-30000,eng,6.236756801605225,511.19790333891876
460,"Resting on the top of one of the mountains north of Mecca, the cave is completely isolated from the rest of the world.",BeetleLM/beetlelm_nld_L1-eng_L2_simultaneous,step-30000,eng,4.285353183746338,72.62819328790746
461,"In fact, it is not easy to find at all even if one knew it existed. Once inside the cave, it is a total isolation.",BeetleLM/beetlelm_nld_L1-eng_L2_simultaneous,step-30000,eng,4.616988658905029,101.18885870095674
462,"Nothing can be seen other than the clear, beautiful sky above and the many surrounding mountains. Very little of this world can be seen or heard from inside the cave.",BeetleLM/beetlelm_nld_L1-eng_L2_simultaneous,step-30000,eng,5.2912726402282715,198.59600591953915
463,The Great Pyramid at Giza is the only one of the seven wonders that is still standing today.,BeetleLM/beetlelm_nld_L1-eng_L2_simultaneous,step-30000,eng,3.862893581390381,47.602895127323265
464,"Built by the Egyptians in the third century BCE, the Great Pyramid is one of many large pyramid structures built to honor dead Pharaoh.",BeetleLM/beetlelm_nld_L1-eng_L2_simultaneous,step-30000,eng,4.308796405792236,74.35094669610655
465,"The Giza Plateau, or ""Giza Necropolis"" in the Egyptian Valley of the Dead contains several pyramids (of which the great pyramid is the largest), several small tombs, several temples, and the great Sphinx.",BeetleLM/beetlelm_nld_L1-eng_L2_simultaneous,step-30000,eng,4.318317890167236,75.06225907430964
466,"The great pyramid was created to honor the Pharaoh Khufu, and many of the smaller pyramids, tombs, and temples were built to honor Khufu's wives and family members.",BeetleLM/beetlelm_nld_L1-eng_L2_simultaneous,step-30000,eng,4.400455474853516,81.48797593751526
467,"The ""up bow"" mark looks like a V and the ""down bow mark"" like a staple or a square missing its bottom side.",BeetleLM/beetlelm_nld_L1-eng_L2_simultaneous,step-30000,eng,5.934183597564697,377.7314893481236
468,"Up means you should start at the tip and push the bow, and down means you should start at the frog (which is where your hand is holding the bow) and pull the bow.",BeetleLM/beetlelm_nld_L1-eng_L2_simultaneous,step-30000,eng,5.139621257781982,170.6511232952513
469,"An up-bow usually generates a softer sound, while a down-bow is stronger and more assertive.",BeetleLM/beetlelm_nld_L1-eng_L2_simultaneous,step-30000,eng,6.104789733886719,447.99843266207836
470,"Feel free to pencil in your own marks, but remember the printed bowing marks are there for a musical reason, so they should usually be respected.",BeetleLM/beetlelm_nld_L1-eng_L2_simultaneous,step-30000,eng,5.567586421966553,261.80145783493816
471,"The terrified King Louis XVI, Queen Marie Antoinette their two young children (11 year old Marie Therese and four year old Louis-Charles) and the King's sister, Madam Elizabeth, on the 6th October 1789 were forced back to Paris from Versailles by a mob of market women.",BeetleLM/beetlelm_nld_L1-eng_L2_simultaneous,step-30000,eng,5.211905002593994,183.44318528794932
472,"In a carriage, they traveled back to Paris surrounded by a mob of people screaming and shouting threats against the King and Queen.",BeetleLM/beetlelm_nld_L1-eng_L2_simultaneous,step-30000,eng,4.8497700691223145,127.71102176251966
473,The mob of people forced the King And Queen to have their carriage windows wide open.,BeetleLM/beetlelm_nld_L1-eng_L2_simultaneous,step-30000,eng,6.491016864776611,659.19333300446
474,At one point a member of the mob waved the head of a royal guard killed at Versailles in front of the terrified Queen.,BeetleLM/beetlelm_nld_L1-eng_L2_simultaneous,step-30000,eng,5.065789699554443,158.50556443625428
475,The war expenditures of U.S. imperialism in the conquest of the Philippines were paid for by the Filipino people themselves.,BeetleLM/beetlelm_nld_L1-eng_L2_simultaneous,step-30000,eng,4.526295185089111,92.41554358242078
476,They were compelled to pay taxes to the U.S. colonial regime to defray a major part of the expenditures and the interest on bonds floated in the name of the Philippine government through the Wall Street banking houses.,BeetleLM/beetlelm_nld_L1-eng_L2_simultaneous,step-30000,eng,5.390732765197754,219.3640690305582
477,"Of course, the superprofits derived from the protracted exploitation of the Filipino people would constitute the basic gains of U.S. imperialism.",BeetleLM/beetlelm_nld_L1-eng_L2_simultaneous,step-30000,eng,5.332422733306885,206.9387246596287
478,To understand the Templars one must understand the context that prompted the creation of the order.,BeetleLM/beetlelm_nld_L1-eng_L2_simultaneous,step-30000,eng,5.425873756408691,227.2097856151467
479,"The age where the events took place is commonly referred as the High Middle Ages the period of European history in the 11th, 12th, and 13th centuries (AD 1000–1300).",BeetleLM/beetlelm_nld_L1-eng_L2_simultaneous,step-30000,eng,4.406515598297119,81.98330248496856
480,"The High Middle Ages were preceded by the Early Middle Ages and followed by the Late Middle Ages, which by convention ends around 1500.",BeetleLM/beetlelm_nld_L1-eng_L2_simultaneous,step-30000,eng,4.117926597595215,61.431737413591456
481,"Technological determinism is a term that encompasses a wide range of ideas in practice, from technology-push or the technological imperative to a strict sense that human destiny is driven by an underlying logic associated with scientific laws and their manifestation in technology.",BeetleLM/beetlelm_nld_L1-eng_L2_simultaneous,step-30000,eng,5.310704231262207,202.4927799336292
482,"Most interpretations of technological determinism share two general ideas: that the development of technology itself follows a path largely beyond cultural or political influence, and that technology in turn has ""effects"" on societies that are inherent, rather than socially conditioned.",BeetleLM/beetlelm_nld_L1-eng_L2_simultaneous,step-30000,eng,6.205987453460693,495.7082031266899
483,"For example, one might say that the motor car necessarily leads to the development of roads.",BeetleLM/beetlelm_nld_L1-eng_L2_simultaneous,step-30000,eng,5.140117645263672,170.73585340433425
484,"However, a nationwide road network is not economically viable for just a handful of cars, so new methods of production are developed to reduce the cost of car ownership.",BeetleLM/beetlelm_nld_L1-eng_L2_simultaneous,step-30000,eng,6.049829006195068,424.0405155439777
485,"Mass car ownership also leads to a higher incidence of accidents on the roads, which leads to the invention of new techniques in healthcare for repairing damaged bodies.",BeetleLM/beetlelm_nld_L1-eng_L2_simultaneous,step-30000,eng,6.044739246368408,421.8877343800594
486,"Romanticism had a large element of cultural determinism, drawn from writers such as Goethe, Fichte, and Schlegel.",BeetleLM/beetlelm_nld_L1-eng_L2_simultaneous,step-30000,eng,5.453831195831299,233.65161842552354
487,"In the context of Romanticism, the geography molded individuals, and over time customs and culture related to that geography arose, and these, being in harmony with the place of the society, were better than arbitrarily imposed laws.",BeetleLM/beetlelm_nld_L1-eng_L2_simultaneous,step-30000,eng,5.142391204833984,171.12447314550272
488,"In the manner that Paris is known as the fashion capital of the contemporary world, Constantinople was regarded as the fashion capital of feudal Europe.",BeetleLM/beetlelm_nld_L1-eng_L2_simultaneous,step-30000,eng,4.231265068054199,68.80421915966988
489,Its renown for being an epicenter of luxury began in about 400 A.D. and lasted up until about 1100 A.D.,BeetleLM/beetlelm_nld_L1-eng_L2_simultaneous,step-30000,eng,4.952878475189209,141.58191797504665
490,Its status declined during the twelfth century mainly due to the fact that Crusaders had returned bearing gifts such as silks and spices that were valued more than what Byzantine markets offered.,BeetleLM/beetlelm_nld_L1-eng_L2_simultaneous,step-30000,eng,5.580634593963623,265.2398720119054
491,It was at this time that the transfer of the title of Fashion Capital from Constantinople to Paris was made.,BeetleLM/beetlelm_nld_L1-eng_L2_simultaneous,step-30000,eng,4.878947734832764,131.4922263725434
492,Gothic style peaked in the period between the 10th - 11th centuries and the 14th century.,BeetleLM/beetlelm_nld_L1-eng_L2_simultaneous,step-30000,eng,4.449571132659912,85.59022927592274
493,At the beginning dress was heavily influenced by the Byzantine culture in the east.,BeetleLM/beetlelm_nld_L1-eng_L2_simultaneous,step-30000,eng,3.8614416122436523,47.533827346580914
494,"However, due to the slow communication channels, styles in the west could lag behind by 25 to 30 year.",BeetleLM/beetlelm_nld_L1-eng_L2_simultaneous,step-30000,eng,6.573448657989502,715.834258762693
495,towards the end of the Middle Ages western Europe began to develop their own style. one of the biggest developments of the time as a result of the crusades people began to use buttons to fasten clothing.,BeetleLM/beetlelm_nld_L1-eng_L2_simultaneous,step-30000,eng,4.967394828796387,143.6521609965111
496,Subsistence agriculture is agriculture carried out for the production of enough food to meet just the needs of the agriculturalist and his/her family.,BeetleLM/beetlelm_nld_L1-eng_L2_simultaneous,step-30000,eng,5.7167229652404785,303.90737431952823
497,"Subsistence agriculture is a simple, often organic, system using saved seed native to the ecoregion combined with crop rotation or other relatively simple techniques to maximize yield.",BeetleLM/beetlelm_nld_L1-eng_L2_simultaneous,step-30000,eng,6.605451583862305,739.1135656187106
498,Historically most farmers were engaged in subsistence agriculture and this is still the case in many developing nations.,BeetleLM/beetlelm_nld_L1-eng_L2_simultaneous,step-30000,eng,5.620477199554443,276.0210689432194
499,Subcultures bring together like-minded individuals who feel neglected by societal standards and allow them to develop a sense of identity.,BeetleLM/beetlelm_nld_L1-eng_L2_simultaneous,step-30000,eng,6.0208563804626465,411.9312145612794
500,"Subcultures can be distinctive because of the age, ethnicity, class, location, and/or gender of the members.",BeetleLM/beetlelm_nld_L1-eng_L2_simultaneous,step-30000,eng,4.824497222900391,124.52384490411582
501,"The qualities that determine a subculture as distinct may be linguistic, aesthetic, religious, political, sexual, geographical, or a combination of factors.",BeetleLM/beetlelm_nld_L1-eng_L2_simultaneous,step-30000,eng,4.4580278396606445,86.31710994349494
502,"Members of a subculture often signal their membership through a distinctive and symbolic use of style, which includes fashions, mannerisms, and argot.",BeetleLM/beetlelm_nld_L1-eng_L2_simultaneous,step-30000,eng,5.6599297523498535,287.12847174715625
503,"One of the most common methods used to illustrate the importance of socialization is to draw upon the few unfortunate cases of children who were, through neglect, misfortune, or wilful abuse, not socialized by adults while they were growing up.",BeetleLM/beetlelm_nld_L1-eng_L2_simultaneous,step-30000,eng,5.868189334869385,353.60813434540626
504,"Such children are called ""feral"" or wild. Some feral children have been confined by people (usually their own parents); in some cases this child abandonment was due to the parents' rejection of a child's severe intellectual or physical impairment.",BeetleLM/beetlelm_nld_L1-eng_L2_simultaneous,step-30000,eng,5.552597522735596,257.9066048644501
505,Feral children may have experienced severe child abuse or trauma before being abandoned or running away.,BeetleLM/beetlelm_nld_L1-eng_L2_simultaneous,step-30000,eng,6.467012882232666,643.5584679749574
506,Others are alleged to have been brought up by animals; some are said to have lived in the wild on their own.,BeetleLM/beetlelm_nld_L1-eng_L2_simultaneous,step-30000,eng,4.170392036437988,64.740827896522
507,"When completely brought up by non-human animals, the feral child exhibits behaviors (within physical limits) almost entirely like those of the particular care-animal, such as its fear of or indifference to humans.",BeetleLM/beetlelm_nld_L1-eng_L2_simultaneous,step-30000,eng,5.817914009094238,336.26986562422286
508,"While project based learning should make learning easier and more interesting, scaffolding goes a step beyond.",BeetleLM/beetlelm_nld_L1-eng_L2_simultaneous,step-30000,eng,7.319920063018799,1510.0832534418353
509,Scaffolding is not a method of learning but rather an aid that provides support to individuals whom are undergoing a new learning experience such as using a new computer program or beginning a new project.,BeetleLM/beetlelm_nld_L1-eng_L2_simultaneous,step-30000,eng,5.60858678817749,272.7584999673341
510,"Scaffolds can be both virtual and real, in other words, a teacher is a form of scaffold but so is the little paperclip man in Microsoft Office.",BeetleLM/beetlelm_nld_L1-eng_L2_simultaneous,step-30000,eng,5.336304664611816,207.74360781288428
511,"Virtual Scaffolds are internalized in the software and are meant to question, prompt, and explain procedures that may have been to challenging for the student to handle alone.",BeetleLM/beetlelm_nld_L1-eng_L2_simultaneous,step-30000,eng,6.036593437194824,418.4650764877772
512,"Children are placed in Foster Care for a wide variety of reasons that range from neglect, to abuse, and even to extortion.",BeetleLM/beetlelm_nld_L1-eng_L2_simultaneous,step-30000,eng,5.990383148193359,399.5676742345887
513,"No child should ever have to grow up in an environment that is not nurturing, caring, and educational, but they do.",BeetleLM/beetlelm_nld_L1-eng_L2_simultaneous,step-30000,eng,5.435052871704102,229.3049716998653
514,We perceive the Foster Care System to be a safety zone for these children.,BeetleLM/beetlelm_nld_L1-eng_L2_simultaneous,step-30000,eng,6.880122661590576,972.7456710055147
515,"Our foster care system is supposed to provide safe homes, loving caregivers, stable education, and reliable health care.",BeetleLM/beetlelm_nld_L1-eng_L2_simultaneous,step-30000,eng,6.933647632598877,1026.230472528622
516,Foster care is supposed to provide all the necessities that were lacking in the home they were previously taken from.,BeetleLM/beetlelm_nld_L1-eng_L2_simultaneous,step-30000,eng,5.659784317016602,287.08671615862414
517,The Internet combines elements of both mass and interpersonal communication.,BeetleLM/beetlelm_nld_L1-eng_L2_simultaneous,step-30000,eng,5.645134449005127,282.91159084779355
518,The distinct characteristics of the Internet lead to additional dimensions in terms of the uses and gratifications approach.,BeetleLM/beetlelm_nld_L1-eng_L2_simultaneous,step-30000,eng,5.5852885246276855,266.47715687136485
519,"For example, “learning” and “socialization” are suggested as important motivations for Internet use (James et al., 1995).",BeetleLM/beetlelm_nld_L1-eng_L2_simultaneous,step-30000,eng,6.11565637588501,452.89321801949404
520,“Personal involvement” and “continuing relationships” were also identified as new motivation aspects by Eighmey and McCord (1998) when they investigated audience reactions to websites.,BeetleLM/beetlelm_nld_L1-eng_L2_simultaneous,step-30000,eng,6.483945369720459,654.5482936521315
521,"The use of video recording has led to important discoveries in the interpretation of micro-expressions, facial movements which last a few milliseconds.",BeetleLM/beetlelm_nld_L1-eng_L2_simultaneous,step-30000,eng,5.56300687789917,260.6052676153531
522,"In particular, it is claimed that one can detect whether a person is lying by interpreting micro-expressions correctly.",BeetleLM/beetlelm_nld_L1-eng_L2_simultaneous,step-30000,eng,5.605202674865723,271.8370143819363
523,"Oliver Sacks, in his paper The President's Speech, indicated how people who are unable to understand speech because of brain damage are nevertheless able to assess sincerity accurately.",BeetleLM/beetlelm_nld_L1-eng_L2_simultaneous,step-30000,eng,5.901068687438965,365.42778734960456
524,He even suggests that such abilities in interpreting human behavior may be shared by animals such as domestic dogs.,BeetleLM/beetlelm_nld_L1-eng_L2_simultaneous,step-30000,eng,6.1330437660217285,460.836707241702
525,Twentieth century research has shown that there are two pools of genetic variation: hidden and expressed.,BeetleLM/beetlelm_nld_L1-eng_L2_simultaneous,step-30000,eng,6.005061626434326,405.4759760040605
526,"Mutation adds new genetic variation, and selection removes it from the pool of expressed variation.",BeetleLM/beetlelm_nld_L1-eng_L2_simultaneous,step-30000,eng,5.830003261566162,340.3597891759097
527,Segregation and recombination shuffle variation back and forth between the two pools with each generation.,BeetleLM/beetlelm_nld_L1-eng_L2_simultaneous,step-30000,eng,6.0544962882995605,426.0242579955042
528,"Out on the savanna, it is hard for a primate with a digestive system like that of humans to satisfy its amino-acid requirements from available plant resources.",BeetleLM/beetlelm_nld_L1-eng_L2_simultaneous,step-30000,eng,5.237116813659668,188.1269147754412
529,"Moreover, failure to do so has serious consequences: growth depression, malnutrition, and ultimately death.",BeetleLM/beetlelm_nld_L1-eng_L2_simultaneous,step-30000,eng,6.372798442840576,585.6945704367193
530,"The most readily accessible plant resources would have been the proteins accessible in leaves and legumes, but these are hard for primates like us to digest unless they are cooked.",BeetleLM/beetlelm_nld_L1-eng_L2_simultaneous,step-30000,eng,6.054239749908447,425.91498043532687
531,"In contrast, animal foods (ants, termites, eggs) not only are easily digestible, but they provide high-quantity proteins that contain all the essential amino acids.",BeetleLM/beetlelm_nld_L1-eng_L2_simultaneous,step-30000,eng,5.210621356964111,183.2078603140728
532,"All things considered, we should not be surprised if our own ancestors solved their ""protein problem"" in somewhat the same way that chimps on the savanna do today.",BeetleLM/beetlelm_nld_L1-eng_L2_simultaneous,step-30000,eng,5.353489398956299,211.3444779073998
533,Sleep interruption is the process of purposefully awakening during your normal sleep period and falling asleep a short time later (10–60 minutes).,BeetleLM/beetlelm_nld_L1-eng_L2_simultaneous,step-30000,eng,6.596291542053223,732.3741681603566
534,This can be easily done by using a relatively quiet alarm clock to bring you to consciousness without fully waking you.,BeetleLM/beetlelm_nld_L1-eng_L2_simultaneous,step-30000,eng,6.44620943069458,630.308530648555
535,"If you find yourself resetting the clock in your sleep, it can be placed on the other side of the room, forcing you to get out of bed to turn it off.",BeetleLM/beetlelm_nld_L1-eng_L2_simultaneous,step-30000,eng,4.260196208953857,70.82387837016167
536,"Other biorhythm-based options involve drinking lots of fluid (particularly water or tea, a known diuretic) prior to sleep, forcing one to get up to urinate.",BeetleLM/beetlelm_nld_L1-eng_L2_simultaneous,step-30000,eng,6.8012003898620605,898.9257055660653
537,The amount of inner peace a person possesses correlates oppositely to the amount of tension in one’s body and spirit.,BeetleLM/beetlelm_nld_L1-eng_L2_simultaneous,step-30000,eng,6.5081868171691895,670.6093771572741
538,"The lower the tension, the more positive the life force present. Every person has the potential to find absolute peace and contentment.",BeetleLM/beetlelm_nld_L1-eng_L2_simultaneous,step-30000,eng,6.210949420928955,498.17400365613116
539,Everyone can achieve enlightenment. The only thing standing in the way of this goal is our own tension and negativity.,BeetleLM/beetlelm_nld_L1-eng_L2_simultaneous,step-30000,eng,5.310780048370361,202.50813293262854
540,"The Tibetan Buddhism is based on the teachings of Buddha, but were extended by the mahayana path of love and by a lot of techniques from Indian Yoga.",BeetleLM/beetlelm_nld_L1-eng_L2_simultaneous,step-30000,eng,4.747555732727051,115.30211063793794
541,"In principle the Tibetan Buddhism is very simple. It consists of Kundalini Yoga, meditation and the path of all-embracing love.",BeetleLM/beetlelm_nld_L1-eng_L2_simultaneous,step-30000,eng,5.461833953857422,235.52897779710693
542,"With Kundalini Yoga the Kundalini energy (enlightenment energy) is awakened through yoga postures, breathing exercises, mantras and visualizations.",BeetleLM/beetlelm_nld_L1-eng_L2_simultaneous,step-30000,eng,6.99307107925415,1089.0609381386969
543,"The center of Tibetan meditation is the Deity Yoga. Through the visualization of various deities the energy channels are cleaned, the chakras are activated and the enlightenment consciousness is created.",BeetleLM/beetlelm_nld_L1-eng_L2_simultaneous,step-30000,eng,5.503132343292236,245.459593057818
544,"Germany was a common enemy in World War 2, leading to cooperation between the USSR and USA. With the end of the war the clashes of system, process and culture led to the countries falling out.",BeetleLM/beetlelm_nld_L1-eng_L2_simultaneous,step-30000,eng,4.208994388580322,67.28883935037646
545,"With two years of the end of the war, the former allies were now enemies and the Cold War began.",BeetleLM/beetlelm_nld_L1-eng_L2_simultaneous,step-30000,eng,3.9011757373809814,49.46056757098671
546,"It was to last for the next 40 years and would be fought for real, by proxy armies, on battlefields from Africa to Asia, in Afghanistan, Cuba and many other places.",BeetleLM/beetlelm_nld_L1-eng_L2_simultaneous,step-30000,eng,4.251690864562988,70.22405137709873
547,"By September 17, 1939, the Polish defense was already broken, and the only hope was to retreat and reorganise along the Romanian bridgehead.",BeetleLM/beetlelm_nld_L1-eng_L2_simultaneous,step-30000,eng,5.2375030517578125,188.19959059139487
