sentence_id,sentence,repo,revision,iso_code,nll,ppl
754,"Официалната валута на Фолкландските острови е Фолкландската лира (FKP) със стойност, равна на една британска лира (GBP).",BeetleLM/beetlelm_fas-bul_heritage,step-10387,bul,7.0570454597473145,1161.009843057105
755,"Парите може да се обменят само в банка, намираща се в Стенли срещу магазина на FIC West, която е единствена на островите.",BeetleLM/beetlelm_fas-bul_heritage,step-10387,bul,6.344020843505859,569.0798985460731
756,"Британските лири обикновено се приемат навсякъде на островите, а американските долари също често се приемат в рамките на кредитните карти „Stanley“.",BeetleLM/beetlelm_fas-bul_heritage,step-10387,bul,7.5186920166015625,1842.1562078294853
757,"На крайните острови вероятно няма да приемат кредитни карти, но може да се използва британска и американска валута; говорете с домакините предварително, за да разберете кой е приемливият метод на плащане.",BeetleLM/beetlelm_fas-bul_heritage,step-10387,bul,7.080718517303467,1188.8224011736147
758,"Почти невъзможно е да се обмени валутата на Фолкландските острови извън островите, така че обменете пари преди да напуснете островите.",BeetleLM/beetlelm_fas-bul_heritage,step-10387,bul,7.5130839347839355,1831.854159460636
759,"Тъй като Монтевидео се намира на юг от екватора, там е лято, когато в Северното полукълбо е зима, и обратно.",BeetleLM/beetlelm_fas-bul_heritage,step-10387,bul,6.2800517082214355,533.8162658016084
760,Монтевидео е в субтропичната област; през летните месеци са нормални температури над +30 °C.,BeetleLM/beetlelm_fas-bul_heritage,step-10387,bul,7.961946964263916,2869.6546320963944
761,"Зимата може да е измамно студена: температурите рядко падат под нулата, но комбинираните вятър и влага водят до усещане за по-студено отколкото показва термометърът.",BeetleLM/beetlelm_fas-bul_heritage,step-10387,bul,7.997231960296631,2972.7179865650287
762,Няма специални „дъждовни“ и „сухи“ сезони: през цялата година количеството дъждове остава приблизително еднакво.,BeetleLM/beetlelm_fas-bul_heritage,step-10387,bul,9.222417831420898,10121.506864598634
763,"Въпреки че много от животните в парка са свикнали да виждат хора, дивите животни все пак си остават диви и не трябва да се хранят или обезпокояват.",BeetleLM/beetlelm_fas-bul_heritage,step-10387,bul,6.950024127960205,1043.1748975590742
764,"Според парковите органи, от мечки и вълци стойте на поне 100 ярда/метра, а от всички други диви животни на 25 ярда/метра!",BeetleLM/beetlelm_fas-bul_heritage,step-10387,bul,7.498659610748291,1805.6205573153338
765,"Без значение колко изглеждат послушни, бизоните, елените, лосовете, мечките и почти всички големи животни могат да нападнат.",BeetleLM/beetlelm_fas-bul_heritage,step-10387,bul,8.111470222473145,3332.4739080277304
766,"Всяка година десетки посетители биват ранени, защото не са спазвали необходимата дистанция. Тези животни са големи, диви и потенциално опасни, така че не навлизайте в личното им пространство.",BeetleLM/beetlelm_fas-bul_heritage,step-10387,bul,7.745859622955322,2311.9801010786146
767,"В допълнение, имайте предвид, че миризмите привличат мечки и други диви животни, така че избягвайте носенето или готвенето на ароматна храна и поддържайте лагера чист.",BeetleLM/beetlelm_fas-bul_heritage,step-10387,bul,7.5170111656188965,1839.0624185850731
768,Апия е столицата на Самоа. Градът се намира на остров Уполу и е с население от почти 40 000 души.,BeetleLM/beetlelm_fas-bul_heritage,step-10387,bul,7.3881049156188965,1616.6395398022785
769,"Апия, която е официална столица на Самоа от 1959 г., е основана през 50-те години на 18-ти век.",BeetleLM/beetlelm_fas-bul_heritage,step-10387,bul,7.486969947814941,1784.6363497256204
770,"На пристанището през 1889 г. се разиграва скандален морски сблъсък, когато седем кораба от Германия, САЩ и Великобритания отказват да го напуснат.",BeetleLM/beetlelm_fas-bul_heritage,step-10387,bul,7.340886116027832,1542.0779684279266
771,"Всички кораби са потопени, с изключение на един британски крайцер. Почти 200 американци и германци изгубват живота си.",BeetleLM/beetlelm_fas-bul_heritage,step-10387,bul,7.491164684295654,1792.1381519683669
772,"По време на организираната от движението „Мау“ борба за независимост, едно мирно събиране в града завършва с убийството на върховния вожд Тупуа Тамасесе Леалофи III.",BeetleLM/beetlelm_fas-bul_heritage,step-10387,bul,7.377395153045654,1599.418097549883
773,"Тъй като Оукланд прекосява две пристанища, има много плажове. Най-популярните са в три области.",BeetleLM/beetlelm_fas-bul_heritage,step-10387,bul,7.348587512969971,1553.9999720938556
774,Плажове Норт Шор (в района Норт Харбър) са разположени на Тихия океан и се простират от Лонг Бей на север до Девънпорт на юг.,BeetleLM/beetlelm_fas-bul_heritage,step-10387,bul,8.04514217376709,3118.6084564580733
775,Почти всичките са охраняеми пясъчни плажове за къпане и повечето имат сянка под дърветата похутукава.,BeetleLM/beetlelm_fas-bul_heritage,step-10387,bul,7.829098224639893,2512.662494339193
776,"Плажовете на Тамаки Драйв са край пристанище „Уайтемата“, в покрайнините на скъпите райони „Мишън Бей“ и „Сейнт Хелиърс“ в Централен Оукланд.",BeetleLM/beetlelm_fas-bul_heritage,step-10387,bul,8.112507820129395,3335.933469650347
777,Това са понякога претъпкани семейни плажове с добър набор от магазини покрай брега. Плуването е безопасно.,BeetleLM/beetlelm_fas-bul_heritage,step-10387,bul,7.697484970092773,2202.8009091055433
778,"Основната местна бира е „Номер едно“. Тя не е тежка бира, а е приятна и освежаваща. „Манта“ е названието на другата местна бира.",BeetleLM/beetlelm_fas-bul_heritage,step-10387,bul,7.518877983093262,1842.4988190127299
779,"Има много френски вина за проба, но новозеландски и австралийски може да преминават по - добре.",BeetleLM/beetlelm_fas-bul_heritage,step-10387,bul,6.5377607345581055,690.7380990012488
780,"Местната чешмяна вода е напълно безопасна за консумация, но бутилирана вода лесно се намира, ако ви е страх.",BeetleLM/beetlelm_fas-bul_heritage,step-10387,bul,7.178225994110107,1310.5812159662855
781,"Идеята за „плоско бяло“ кафе е чужда за австралийците. Късото черно е „еспресо“, капучиното е отрупано догоре със сметана (не пяна), а чаят се сервира без мляко.",BeetleLM/beetlelm_fas-bul_heritage,step-10387,bul,8.319363594055176,4102.548291184759
782,"Горещият шоколад отговаря на стандарта за белгийски. Плодовите сокове са скъпички, но прекрасни.",BeetleLM/beetlelm_fas-bul_heritage,step-10387,bul,8.846261024475098,6948.360590505504
783,"Много от разходките до рифа са целогодишни, а злополуките на рифа, породени от някоя от тези причини, са редки.",BeetleLM/beetlelm_fas-bul_heritage,step-10387,bul,6.67048978805542,788.7818457931176
784,"Все пак обръщайте внимание на съветите на властите, следвайте всички знаци и обръщайте специално внимание на предупрежденията за безопасност.",BeetleLM/beetlelm_fas-bul_heritage,step-10387,bul,7.358410835266113,1569.340639466505
785,Кубовидните медузи се срещат близо до плажовете и речните устия от октомври до април северно от град 1770. Понякога могат да бъдат срещнати и извън този период.,BeetleLM/beetlelm_fas-bul_heritage,step-10387,bul,7.807727336883545,2459.534385644492
786,"Има акули, но те рядко нападат хора. Повечето акули се страхуват от хората и отплуват настрани.",BeetleLM/beetlelm_fas-bul_heritage,step-10387,bul,7.553872585296631,1908.117790750033
787,"Соленоводните крокодили не живеят активно в океана, тяхното основно местообитание е по речните устия на север от Рокхемптън.",BeetleLM/beetlelm_fas-bul_heritage,step-10387,bul,8.548432350158691,5158.661110818661
788,"Резервирането предварително осигурява спокойствие за пътника, че ще има къде да преспи, когато пристигне в местоназначението си.",BeetleLM/beetlelm_fas-bul_heritage,step-10387,bul,7.032159328460693,1132.4733538381972
789,"Туристическите агенти често имат договорки с определени хотели, въпреки че може да намерите и други начини на настаняване, като къмпинги, чрез туристически агент.",BeetleLM/beetlelm_fas-bul_heritage,step-10387,bul,7.078114032745361,1185.7301601823606
790,"Туристическите агенции често предлагат пакети с включени закуска, транспорт от/до летището или дори комбинирани пакети самолет и хотел.",BeetleLM/beetlelm_fas-bul_heritage,step-10387,bul,7.603384017944336,2004.9692800336943
791,"Могат също така да запазят резервацията ви, ако се нуждаете от време да обмислите офертата или да си извадите други документи за дестинацията си (напр. виза).",BeetleLM/beetlelm_fas-bul_heritage,step-10387,bul,7.0075297355651855,1104.921682158286
792,"Въпреки това, всякакви изменения или заявки трябва да се насочат първо към туристическия агент, а не директно към хотела.",BeetleLM/beetlelm_fas-bul_heritage,step-10387,bul,6.9839653968811035,1079.1893073259437
793,На някои музикални фестивали огромно мнозинство от участниците решава да лагерува на територията на фестивала и повечето участници го считат за жизненоважна част от преживяването.,BeetleLM/beetlelm_fas-bul_heritage,step-10387,bul,7.517528057098389,1840.0132599992367
794,"Ако искате да сте близо до събитието, ще трябва да отидете по-рано, за да получите място за къмпинг близо до музиката.",BeetleLM/beetlelm_fas-bul_heritage,step-10387,bul,5.952674388885498,384.7810183203367
795,"Помнете, че въпреки че музиката на основните сцени може да е приключила, може да има фестивални сцени, на които ще продължи да се свири до късно през нощта.",BeetleLM/beetlelm_fas-bul_heritage,step-10387,bul,5.607313632965088,272.4114570280147
796,Някои фестивали предлагат специални места за къмпинг за семейства с малки деца.,BeetleLM/beetlelm_fas-bul_heritage,step-10387,bul,7.39948844909668,1635.1477547021907
797,"Ако прекосите Северна Балтика през зимата, проверете локацията на хижата, тъй като за най - засегнатите преминаването през лед причинява доста ужасен шум.",BeetleLM/beetlelm_fas-bul_heritage,step-10387,bul,7.533600807189941,1869.8262800978935
798,Круизите до Санкт Петербург включват и време в града. Пътниците в круиза са освободени от изискването за виза (вижте условията).,BeetleLM/beetlelm_fas-bul_heritage,step-10387,bul,7.979167461395264,2919.499456014495
799,"Обикновено казината полагат много усилия за гостите да харчат максимално време и пари. По принцип няма прозорци и часовници, а изходите могат да са трудни за намиране.",BeetleLM/beetlelm_fas-bul_heritage,step-10387,bul,7.560258388519287,1920.3416435074255
800,"За да поддържат гостите в добро настроение и да ги задържат в помещението, те обикновено предлагат специална храна, напитки и оферти за забавления.",BeetleLM/beetlelm_fas-bul_heritage,step-10387,bul,6.936710834503174,1029.3788432520996
801,"На някои места се предлагат безплатни алкохолни напитки. Обаче пиянството влияе на преценката, а всички добри комарджии знаят колко е важно да останат трезви.",BeetleLM/beetlelm_fas-bul_heritage,step-10387,bul,7.053013324737549,1156.3379198644852
802,"Всеки, който ще шофира на големи височини или през планински проходи, трябва да има предвид възможността за сняг, лед или минусови температури.",BeetleLM/beetlelm_fas-bul_heritage,step-10387,bul,7.153769016265869,1278.9171422687177
803,На заледени и заснежени пътища триенето е слабо и не може да шофирате както на чист асфалт.,BeetleLM/beetlelm_fas-bul_heritage,step-10387,bul,7.712685585021973,2236.540620015267
804,"По време на виелици за много кратко време може да падне достатъчно сняг, че да заседнеш.",BeetleLM/beetlelm_fas-bul_heritage,step-10387,bul,6.256330966949463,521.3027499561906
805,"Видимостта може да бъде ограничена също и при снеговалеж или виелица, както и от кондензация или лед по прозорците на превозното средство.",BeetleLM/beetlelm_fas-bul_heritage,step-10387,bul,6.955656051635742,1049.0665540693583
806,"От друга страна, заледяванията и снеговалежите са нормални условия в много страни, а движението се извършва почти непрекъснато през цялата година.",BeetleLM/beetlelm_fas-bul_heritage,step-10387,bul,7.122908115386963,1240.0514074825587
807,Сафаритата може би представляват най-голям туристически интерес в Африка и са крайна цел за много посетители.,BeetleLM/beetlelm_fas-bul_heritage,step-10387,bul,7.012831687927246,1110.7954818241924
808,"Терминът „сафари“ в популярната си употреба реферира към пътуване по суша за разглеждане на изумителната африканска дива природа, по-конкретно в саваната.",BeetleLM/beetlelm_fas-bul_heritage,step-10387,bul,7.739938259124756,2298.330477806397
809,"Някои животни, като слонове и жирафи, са склонни да се доближават повече до колите и се получава добър изглед със стандартно оборудване.",BeetleLM/beetlelm_fas-bul_heritage,step-10387,bul,7.482422828674316,1776.539817519529
810,"Понякога лъвовете, гепардите и леопардите са срамежливи и се наблюдават по-добре с бинокъл.",BeetleLM/beetlelm_fas-bul_heritage,step-10387,bul,6.777588367462158,877.9488789084497
811,"Пешеходното сафари (наричано още ""разходка в пустошта"", ""туристическо сафари"" или ""ходене пеша"") представлява разходка с продължителност няколко часа или няколко дни.",BeetleLM/beetlelm_fas-bul_heritage,step-10387,bul,8.127958297729492,3387.8754660409963
812,Параолимпийските игри ще се проведат между 24 август и 5 септември 2021 г. Някои от събитията ще се състоят на други места в Япония.,BeetleLM/beetlelm_fas-bul_heritage,step-10387,bul,7.547138214111328,1895.3109885625329
813,"Токио ще бъде единственият азиатски град, който е бил домакин на две летни олимпийски игри, след домакинството на игрите през 1964 г.",BeetleLM/beetlelm_fas-bul_heritage,step-10387,bul,6.813189506530762,909.7678949935156
814,"Ако сте резервирали полети и настаняване за 2020 г. преди обявяване на отлагането на сезона, може да се окажете в трудна ситуация.",BeetleLM/beetlelm_fas-bul_heritage,step-10387,bul,6.918222427368164,1010.5221206171105
815,"Политиките за анулиране варират, но към края на март повечето политики за анулиране, основани на коронавирус, не се удължават до юли 2020 г., за когато е насрочена Олимпиадата.",BeetleLM/beetlelm_fas-bul_heritage,step-10387,bul,6.869859218597412,962.8130101043837
816,"Очакванията са, че повечето билети ще струват между 2 500 и 130 000 йени, като обикновените ще струват около 7 000 йени.",BeetleLM/beetlelm_fas-bul_heritage,step-10387,bul,7.625782012939453,2050.383264477118
817,"Гладенето на влажни дрехи може да им помогне да изсъхнат. Много хотели разполагат с ютия и дъска за гладене, които се заемат, дори ако в стаята няма такива.",BeetleLM/beetlelm_fas-bul_heritage,step-10387,bul,6.839350700378418,933.8825682306672
818,"Ако няма ютия или не искате да носите гладени чорапи, можете да опитате да използвате сешоар, ако има такъв.",BeetleLM/beetlelm_fas-bul_heritage,step-10387,bul,6.8659820556640625,959.0872545378015
819,Не позволявайте тъканта да стане твърде гореща (което може да причини свиване или в крайни случаи - обгаряне).,BeetleLM/beetlelm_fas-bul_heritage,step-10387,bul,7.890023231506348,2670.505959832329
820,"Водата може да се пречиства по различни начини, някои по - ефикасни срещу конкретни заплахи.",BeetleLM/beetlelm_fas-bul_heritage,step-10387,bul,6.7395124435424805,845.1485777373869
821,"В някои райони е достатъчно кипването на вода за минута, в други са необходими няколко минути.",BeetleLM/beetlelm_fas-bul_heritage,step-10387,bul,6.618618965148926,748.9101116363832
822,"Филтрите имат различна ефикасност и ако се притеснявате, трябва да обмислите закупуването на вода в запечатана бутилка от реномирана компания.",BeetleLM/beetlelm_fas-bul_heritage,step-10387,bul,6.921475410461426,1013.814684414564
823,"Пътуващите могат да срещнат животни вредители, които не са им познати от родните места.",BeetleLM/beetlelm_fas-bul_heritage,step-10387,bul,6.895017147064209,987.3426546971176
824,"Вредителите могат да развалят храната, да причинят дразнене или в най - лошия случай да причинят алергични реакции, да разпространят отрова или да предадат инфекции.",BeetleLM/beetlelm_fas-bul_heritage,step-10387,bul,7.979949951171875,2921.7848285153486
825,"Инфекциозните болести или опасни животни сами по себе си, които могат да наранят или убият хора със сила, обикновено не се квалифицират като вредители.",BeetleLM/beetlelm_fas-bul_heritage,step-10387,bul,7.161437034606934,1288.7615978688268
826,Безмитното пазаруване е възможност да се купят стоки без данъци и акцизи на определени места.,BeetleLM/beetlelm_fas-bul_heritage,step-10387,bul,7.771709442138672,2372.523515517051
827,"Пътешествениците, пътуващи за държави с тежко данъчно облагане, понякога могат да икономисат значителна сума пари, особено за продукти като алкохолни напитки и тютюн.",BeetleLM/beetlelm_fas-bul_heritage,step-10387,bul,7.401811599731445,1638.950865135213
828,"Разстоянието между Пойнт Марион и Фермонт представлява най-трудните условия за шофиране по магистралата Бъфало-Питсбърг, като често преминава през изолирани крайни райони.",BeetleLM/beetlelm_fas-bul_heritage,step-10387,bul,7.648978233337402,2098.5003159580674
829,"Ако не сте свикнали да шофирате по провинциални пътища, бъдете нащрек: преобладават стръмни склонове, тесни ленти и остри завои.",BeetleLM/beetlelm_fas-bul_heritage,step-10387,bul,7.784468173980713,2402.9878366317025
830,"Обявените ограничения на скоростта са забележимо по-ниски, отколкото в предишните или следващите участъци, където те са обикновено 35 – 40 mph (56 – 64 км/ч) и стриктното им спазване обаче е по-важно, отколкото на други места.",BeetleLM/beetlelm_fas-bul_heritage,step-10387,bul,7.034904479980469,1135.5864357724147
