sentence_id,sentence,repo,revision,iso_code,nll,ppl
205,"Der Klage zufolge wurde der Abfall aus dem UN-Lager nicht ordnungsgemäß gesäubert, was dazu führte, dass Bakterien in den Zufluss des Artibonit-Flusses, einem der größten Flüsse Haitis, gelangten.",BeetleLM/beetlelm_deu-ukr_heritage,step-2000,deu,7.0337114334106445,1134.2324361233982
206,Vor der Ankunft der Truppen waren in Haiti seit den 1800er Jahren keine Probleme im Zusammenhang mit der Krankheit aufgetreten.,BeetleLM/beetlelm_deu-ukr_heritage,step-2000,deu,7.264862060546875,1429.1884726875662
207,"Das haitianische Institut für Gerechtigkeit und Demokratie hat auf unabhängige Studien verwiesen, die nahelegen, dass das nepalesische UN-Friedensbataillon die Krankheit unwissentlich nach Haiti eingeschleppt hat.",BeetleLM/beetlelm_deu-ukr_heritage,step-2000,deu,7.844790935516357,2552.4039907370952
208,"Danielle Lantagne, ein UN-Experte für die Krankheit, stellte fest, dass der Ausbruch vermutlich von den Blauhelmen verursacht wurde.",BeetleLM/beetlelm_deu-ukr_heritage,step-2000,deu,6.896265506744385,988.5759831163263
209,"Hamilton bestätigte, dass das Krankenhaus der Howard University den Patienten in stabilem Zustand aufgenommen hat.",BeetleLM/beetlelm_deu-ukr_heritage,step-2000,deu,8.04611873626709,3121.655460081417
210,"Der Patient hatte sich in Nigeria aufgehalten, wo einige Fälle des Ebolavirus auftraten.",BeetleLM/beetlelm_deu-ukr_heritage,step-2000,deu,7.5694684982299805,1938.1098989161455
211,"Das Krankenhaus befolgte Protokolle zum Infektionsschutz, einschließlich der Trennung des Patienten von anderen, um die Infektion Dritter zu vermeiden.",BeetleLM/beetlelm_deu-ukr_heritage,step-2000,deu,7.654478549957275,2110.074533874305
212,Vor den Simpsons hatte Simon an mehreren Shows in verschiedenen Funktionen gearbeitet.,BeetleLM/beetlelm_deu-ukr_heritage,step-2000,deu,7.333080768585205,1530.0883664757905
213,"In den 1980er Jahren arbeitete er an Shows wie „Taxi“, „Cheers“ und „Die Tracey Ullman Show“.",BeetleLM/beetlelm_deu-ukr_heritage,step-2000,deu,7.416525363922119,1663.244287245239
214,1989 half er Brooks und Groening bei der Erschaffung von „Die Simpsons“ und war verantwortlich für die Einstellung des ersten Autorenteams der Sendung.,BeetleLM/beetlelm_deu-ukr_heritage,step-2000,deu,7.231330394744873,1382.0599668576344
215,"Obwohl er die Show 1993 verließ, behielt er den Titel des Chefproduzenten und erhielt weiterhin in jeder Saison Lizenzgebühren in zweistelliger Millionenhöhe.",BeetleLM/beetlelm_deu-ukr_heritage,step-2000,deu,7.851327896118164,2569.1436085660234
216,Zuvor meldete die chinesische Nachrichtenagentur Xinhua die geplante Entführung eines Flugzeugs.,BeetleLM/beetlelm_deu-ukr_heritage,step-2000,deu,8.005548477172852,2997.5437346569183
217,"Spätere Berichte gaben dann an, das Flugzeug habe eine Bombendrohung erhalten und sei nach Afghanistan umgeleitet worden, wo es in Kandahar gelandet sei.",BeetleLM/beetlelm_deu-ukr_heritage,step-2000,deu,7.47499418258667,1763.3914297799888
218,"Erste Berichte besagen, dass das Flugzeug zurück nach Afghanistan umgeleitet wurde, nachdem ihm die Notlandung in Ürümqi verweigert wurde.",BeetleLM/beetlelm_deu-ukr_heritage,step-2000,deu,7.410708904266357,1653.598174259262
219,"Flugunfälle sind im Iran, der über eine veraltete Flotte verfügt, die sowohl für zivile als auch für militärische Einsätze schlecht gewartet wird, häufig.",BeetleLM/beetlelm_deu-ukr_heritage,step-2000,deu,7.342308044433594,1544.2722525829038
220,"Internationale Sanktionen haben bewirkt, dass keine neuen Flugzeuge gekauft werden können.",BeetleLM/beetlelm_deu-ukr_heritage,step-2000,deu,7.596532344818115,1991.2788406651255
221,Bei einem Hubschrauberabsturz zu Beginn der Woche wurden drei Menschen getötet und drei weitere verletzt.,BeetleLM/beetlelm_deu-ukr_heritage,step-2000,deu,7.62323522567749,2045.168018377068
222,"Letzten Monat erfuhr Iran sein schlimmstes Flugzeugunglück seit Jahren, als ein Passagierflugzeug auf dem Weg nach Armenien abstürzte und dabei alle 168 Passagiere ums Leben kamen.",BeetleLM/beetlelm_deu-ukr_heritage,step-2000,deu,8.016561508178711,3030.7382272321447
223,"Im selben Monat schoss ein weiteres Passagierflugzeug über das Ende einer Landebahn in Maschhad hinaus und stieß mit einer Mauer zusammen, wobei siebzehn Menschen ums Leben kamen.",BeetleLM/beetlelm_deu-ukr_heritage,step-2000,deu,8.012398719787598,3018.1481284627635
224,Aerosmith haben die noch ausstehenden Konzerte ihrer Tour abgesagt.,BeetleLM/beetlelm_deu-ukr_heritage,step-2000,deu,7.302629470825195,1484.1974550283564
225,Die Rockband sollte bis zum 16. September durch die Vereinigten Staaten und Kanada touren.,BeetleLM/beetlelm_deu-ukr_heritage,step-2000,deu,7.110048770904541,1224.207250330755
226,"Nachdem sich der Frontsänger Steven Tyler während eines Auftrittes am 5. August bei einem Sturz von der Bühne verletzte, haben sie die Tour abgebrochen.",BeetleLM/beetlelm_deu-ukr_heritage,step-2000,deu,7.489565372467041,1789.2742549660297
227,"Murray verlor den ersten Satz im Tiebreak, nachdem beide Männer jeden einzelnen Aufschlag im Satz gehalten hatten.",BeetleLM/beetlelm_deu-ukr_heritage,step-2000,deu,8.467472076416016,4757.473725569024
228,"Del Potro hatte im zweiten Satz einen frühen Vorteil, doch auch diesmal war ein Tie Break erforderlich, nachdem das 6:6 erreicht wurde.",BeetleLM/beetlelm_deu-ukr_heritage,step-2000,deu,7.69352388381958,2194.0926830653743
229,"Potros Schulter wurde inzwischen behandelt, er war aber in der Lage, aufs Spielfeld zurückzukehren.",BeetleLM/beetlelm_deu-ukr_heritage,step-2000,deu,7.3349289894104,1532.9189225997416
230,Das Programm begann um 20:30 Ortszeit (15:00 UTC).,BeetleLM/beetlelm_deu-ukr_heritage,step-2000,deu,7.683247089385986,2171.6599095258143
231,"Berühmte Sänger im ganzen Land präsentierten Bhajans, Andachtslieder, zu Shri Shyams Füßen.",BeetleLM/beetlelm_deu-ukr_heritage,step-2000,deu,7.855429172515869,2579.7020132784005
232,"Der Sänger Sanju Sharma eröffnete den Abend, gefolgt von Jai Shankar Choudhary, der ebenfalls den Chhappan Bhog Bhajan präsentierte. Begleitet wurde er vom Sänger Raju Khandelwal.",BeetleLM/beetlelm_deu-ukr_heritage,step-2000,deu,7.899548530578613,2696.064862621384
233,Dann übernahm Lakkha Singh die Leitung beim Singen der Bhajans.,BeetleLM/beetlelm_deu-ukr_heritage,step-2000,deu,7.34423828125,1547.2559424269975
234,"Baba Shyam wurden 108 Teller Chhappan Bhog (im Hinduismus 56 verschiedene essbare Dinge wie Süßigkeiten, Früchte, Nüsse, Gerichte usw., die der Gottheit dargebracht werden) serviert.",BeetleLM/beetlelm_deu-ukr_heritage,step-2000,deu,7.9812421798706055,2925.5628832519155
235,Lakkha Singh präsentierte den Chhappan Bhog Bhajan ebenfalls. Der Sänger Raju Khandelwal begleitete ihn.,BeetleLM/beetlelm_deu-ukr_heritage,step-2000,deu,7.880951881408691,2646.390410996883
236,Bei der Keynote-Präsentation der Tokyo Game Show am Donnerstag enthüllte Nintendo-Präsident Satoru Iwata das Controller-Design für die neue Nintendo Revolution-Konsole des Unternehmens.,BeetleLM/beetlelm_deu-ukr_heritage,step-2000,deu,7.652449607849121,2105.7976550381495
237,"Ähnlich einer TV-Fernbedienung verwendet der Controller zwei Sensoren, die in der Nähe des Fernsehers des Benutzers platziert werden, um dessen Position im dreidimensionalen Raum zu triangulieren.",BeetleLM/beetlelm_deu-ukr_heritage,step-2000,deu,7.411706447601318,1655.2485331120797
238,"Dies wird Spielern ermöglichen Aktionen und Bewegungen in Videospielen zu steuern, indem sie das Gerät in der Luft bewegen.",BeetleLM/beetlelm_deu-ukr_heritage,step-2000,deu,7.126147270202637,1244.0746383869825
239,Giancarlo Fisichella verlor die Kontrolle über sein Auto und musste das Rennen schon kurz nach dem Start beenden.,BeetleLM/beetlelm_deu-ukr_heritage,step-2000,deu,7.43408203125,1692.7031569814553
240,"Sein Teamkollege führte das Rennen die meiste Zeit an, aber beendete es gleich nach seinem Boxenstopp, wahrscheinlich wegen eines stark eingeklemmten rechten Frontrades.",BeetleLM/beetlelm_deu-ukr_heritage,step-2000,deu,7.931839466094971,2784.5441710555247
241,Kurz nach Alonso beendete auch Michael sein aufgrund von Schäden an der Radaufhängung aus den zahlreichen Kämpfen während des Rennens.,BeetleLM/beetlelm_deu-ukr_heritage,step-2000,deu,7.7679572105407715,2363.6379386117605
242,"„Sie ist sehr süß und singt auch ziemlich gut“, sagte er laut einem Transkript der Pressekonferenz.",BeetleLM/beetlelm_deu-ukr_heritage,step-2000,deu,7.247706413269043,1404.8789384751014
243,„Ich war bei jeder Probe hierfür von ganzem Herzen bewegt.“,BeetleLM/beetlelm_deu-ukr_heritage,step-2000,deu,7.207223892211914,1349.1417010113332
244,"Etwa 3 Minuten nach dem Start zeigte eine Bordkamera, wie sich zahllose Teile aus Isolierschaum vom Treibstofftank lösten.",BeetleLM/beetlelm_deu-ukr_heritage,step-2000,deu,8.243896484375,3804.334997689622
245,"Man geht allerdings nicht davon aus, dass sie das Shuttle in irgendeiner Weise beschädigt haben.",BeetleLM/beetlelm_deu-ukr_heritage,step-2000,deu,7.249661922454834,1407.6288800358866
246,"N. Wayne Hale Jr., Leiter des Shuttle-Programms der NASA, sagte, dass der Schaum „nach dem Zeitpunkt, über den wir uns Sorgen machen“ abfiel.",BeetleLM/beetlelm_deu-ukr_heritage,step-2000,deu,6.825781345367432,921.2959732391699
247,"Nach fünf Minuten kommt Wind auf, etwa eine Minute später erreicht der Wind 70 km/h ... Dann beginnt es zu regnen, aber die Tropfen sind so hart und groß, dass sie wie Nadeln auf die Haut schlagen. Dann fiel Hagel vom Himmel, die Leute gerieten in Panik, schrien und rannten einander um.",BeetleLM/beetlelm_deu-ukr_heritage,step-2000,deu,7.104125499725342,1216.9773722102832
248,"""„Ich habe meine Schwester und ihre Freundin verloren, und auf meinem Weg waren zwei Behinderte im Rollstuhl, über die Leute einfach drübergesprungen sind und sie geschubst haben"""", sagte Armand Versace.""",BeetleLM/beetlelm_deu-ukr_heritage,step-2000,deu,7.311029434204102,1496.717168248758
249,"Die NHK berichtete zudem, dass das Atomkraftwerk von Kashiwazaki Kariwa in der Präfektur Niigata normal in Betrieb war.",BeetleLM/beetlelm_deu-ukr_heritage,step-2000,deu,7.204004287719727,1344.8049833341645
250,"Hokuriku Electric Power Co. berichtete, dass das Erdbeben keine Auswirkungen gehabt hatte und dass die Reaktoren Nummer 1 und 2 des Kernkraftwerks Shika abgeschaltet worden waren.",BeetleLM/beetlelm_deu-ukr_heritage,step-2000,deu,7.9714436531066895,2897.0366627442604
251,"Es wird berichtet, dass etwa 9.400 Häuser in der Region kein Wasser und ungefähr 100 keinen Strom haben.",BeetleLM/beetlelm_deu-ukr_heritage,step-2000,deu,6.932281017303467,1024.828968145037
252,Einige Straßen wurden beschädigt und der Eisenbahnverkehr in den betroffenen Gebieten unterbrochen. Der Flughafen Noto in der Präfektur Ishikawa bleibt geschlossen.,BeetleLM/beetlelm_deu-ukr_heritage,step-2000,deu,7.940667152404785,2809.234070521084
253,Eine Bombe explodierte vor dem Bürogebäude des Generalgouverneurs.,BeetleLM/beetlelm_deu-ukr_heritage,step-2000,deu,7.926911354064941,2770.8553830725086
254,Drei weitere Bomben detonierten binnen zwei Stunden unweit von Regierungsgebäuden.,BeetleLM/beetlelm_deu-ukr_heritage,step-2000,deu,8.384571075439453,4378.979894472198
255,"Laut einigen Berichten beträgt die offizielle Zahl der Todesopfer acht und offizielle Berichte bestätigen, dass bis zu 30 Personen verletzt wurden. Allerdings sind noch keine endgültigen Zahlen bekannt.",BeetleLM/beetlelm_deu-ukr_heritage,step-2000,deu,8.051041603088379,3137.0608423841013
256,"Sowohl Cyanursäure als auch Melamin wurden in Urinproben von Haustieren gefunden, die nach dem Verzehr kontaminierter Haustiernahrung starben.",BeetleLM/beetlelm_deu-ukr_heritage,step-2000,deu,7.350957870483398,1557.6878767030378
257,"Die zwei Verbindungen reagieren miteinander und formen Kristalle, die laut Forschern der Hochschule die Nierentätigkeit behindern können.",BeetleLM/beetlelm_deu-ukr_heritage,step-2000,deu,7.8820037841796875,2649.1756210316053
258,"Die Forscher entdeckten Kristalle im Katzenurin, die sich durch die Zugabe von Melamin und Zyanursäure gebildet hatten.",BeetleLM/beetlelm_deu-ukr_heritage,step-2000,deu,7.159448623657227,1286.2015562469453
259,"Die Zusammensetzung dieser Kristalle entspricht der Zusammensetzung, die im Urin betroffener Haustiere gefunden wurde, wenn man sie mittels Infrarotspektroskopie (FTIR) vergleicht.",BeetleLM/beetlelm_deu-ukr_heritage,step-2000,deu,7.3167405128479,1505.2894930147343
260,"Ich weiß nicht, ob Sie das wussten, aber die meisten Waren aus Mittelamerika kamen zollfrei in unser Land.",BeetleLM/beetlelm_deu-ukr_heritage,step-2000,deu,6.930283069610596,1022.7834575645549
261,Dennoch wurden achtzig Prozent unserer Waren in zentralamerikanischen Ländern mit Zöllen belegt. Wir kümmern uns um Sie.,BeetleLM/beetlelm_deu-ukr_heritage,step-2000,deu,7.9305877685546875,2781.0609443937046
262,Das erschien mir nicht sinnvoll; es war ganz gewiss nicht fair.,BeetleLM/beetlelm_deu-ukr_heritage,step-2000,deu,7.3722944259643555,1591.2806733782018
263,"Ich sage den Leuten nur, dass wir so behandelt werden möchten, wie wir andere auch behandeln.",BeetleLM/beetlelm_deu-ukr_heritage,step-2000,deu,6.542636394500732,694.114126574673
264,"Der kalifornische Gouverneur Arnold Schwarzenegger unterzeichnete einen Gesetzentwurf, der den Verkauf oder Verleih von Videospielen, die Gewalt beinhalten, an Minderjährige verbietet.",BeetleLM/beetlelm_deu-ukr_heritage,step-2000,deu,7.798469066619873,2436.868437219375
265,"Der Gesetzesvorschlag sieht vor, dass im Bundesstaat Kalifornien verkaufte Videospiele mit einem Aufkleber mit der Zahl „18“ versehen werden und der Verkauf an Minderjährige mit einer Geldbuße von 1000 $ bestraft wird.",BeetleLM/beetlelm_deu-ukr_heritage,step-2000,deu,7.389801502227783,1619.3846367858364
266,"Der Direktor der Staatsanwaltschaft Kier Starmer QC gab heute Morgen eine Erklärung ab, in der er die Strafverfolgung sowohl von Huhne als auch von Pryce bekanntgab.",BeetleLM/beetlelm_deu-ukr_heritage,step-2000,deu,7.756655216217041,2337.0745086696384
267,"Huhne ist zurückgetreten und wird im Kabinett vom Abgeordneten Ed Davey ersetzt. Es wird erwartet, dass der Abgeordnete Norman Lamb den Job des Wirtschaftsministers übernimmt, den Davey gerade verlässt.",BeetleLM/beetlelm_deu-ukr_heritage,step-2000,deu,7.482125759124756,1776.0121400185014
268,Huhne und Pryce sollen am 16. Februar vor dem Westminster Magistrates Court erscheinen.,BeetleLM/beetlelm_deu-ukr_heritage,step-2000,deu,7.990833282470703,2953.757248421557
269,"Die Todesopfer waren Nicholas Alden, 25, und Zachary Cuddeback, 21. Cuddeback ist der Fahrer gewesen.",BeetleLM/beetlelm_deu-ukr_heritage,step-2000,deu,7.070327281951904,1176.5330292710753
270,"Edgar Veguilla erlitt Wunden am Arm und am Kiefer, während Kristoffer Schneider rekonstruktive Chirurgie für sein Gesicht benötigte.",BeetleLM/beetlelm_deu-ukr_heritage,step-2000,deu,8.431046485900879,4587.298124797759
271,"Die Waffe von Uka hatte eine Ladehemmung, als er auf den Kopf eines fünften Mannes zielte. Schneider leitet seitdem unter chronischen Schmerzen, ist auf einem Auge erblindet, und ihm fehlt ein Teil seines Schädels. Sein Gesicht musste mit Hilfe von Titan rekonstruiert werden.",BeetleLM/beetlelm_deu-ukr_heritage,step-2000,deu,7.3516154289245605,1558.7124843478439
272,Schneider sagte über eine Videoschaltung von einer Basis der USAF in seiner Heimat aus.,BeetleLM/beetlelm_deu-ukr_heritage,step-2000,deu,7.248989582061768,1406.6827923635096
273,Über die Veranstaltung vom Mittwoch hinaus nahm Carpanedo an der Meisterschaft in zwei Einzelrennen teil.,BeetleLM/beetlelm_deu-ukr_heritage,step-2000,deu,8.162447929382324,3506.7604072868776
274,"Ihr erstes war der Slalom, bei dem sie in ihrem ersten Lauf ein „Did not Finish“ erhielt. 36 der 116 Teilnehmer erzielten in diesem Rennen das gleiche Ergebnis.",BeetleLM/beetlelm_deu-ukr_heritage,step-2000,deu,7.620895862579346,2040.3892196374625
275,"Ihr anderes Rennen, den Riesenslalom, beendete sie mit dem 10. Platz in der Damengruppe mit einer kombinierten Laufzeit von 4:41,30. Damit war sie 2:11,60 Minuten langsamer als die erstplatzierte Österreicherin Claudia Lösch und 1:09,02 Minuten schneller als Gyöngyi Dani aus Ungarn, die den neunten Platz belegte.",BeetleLM/beetlelm_deu-ukr_heritage,step-2000,deu,7.323023796081543,1514.7774297298008
276,"Vier Skifahrerinnen des Krückenskifahrens kamen nicht ins Ziel, und 45 der insgesamt 117 Skifahrerinnen im Riesenslalom konnten sich im Rennen nicht platzieren.",BeetleLM/beetlelm_deu-ukr_heritage,step-2000,deu,8.158802032470703,3493.998398968161
277,Die Polizei von Madhya Pradesh hat den gestohlenen Laptop und das Mobiltelefon wiedergefunden.,BeetleLM/beetlelm_deu-ukr_heritage,step-2000,deu,7.7373948097229,2292.49221833351
278,"Der stellvertretende Generalinspekteur D. K. Arya sagte: „Wir haben fünf Personen festgenommen, die die Schweizerin vergewaltigt haben, und ihr Handy und Laptop sichergestellt.“",BeetleLM/beetlelm_deu-ukr_heritage,step-2000,deu,7.257177829742432,1418.2483456630496
279,"Die Namen der Angeklagten sind Baba Kanjar, Bhutha Kanja, Rampro Kanjar, Gaza Kanjar und Vishnu Kanjar.",BeetleLM/beetlelm_deu-ukr_heritage,step-2000,deu,7.619841575622559,2038.2391974657455
280,"Die Polizeipräsidentin Chandra Shekhar Solanki gab an, die Angeklagten seien mit bedeckten Gesichtern vor Gericht erschienen.",BeetleLM/beetlelm_deu-ukr_heritage,step-2000,deu,8.038249969482422,3097.1882708324392
281,"Obwohl sich drei Menschen im Haus befanden, als das Auto hineinraste, wurde keiner von ihnen verletzt.",BeetleLM/beetlelm_deu-ukr_heritage,step-2000,deu,6.915759086608887,1008.035923721514
282,Der Fahrer zog sich jedoch erhebliche Verletzungen am Kopf zu.,BeetleLM/beetlelm_deu-ukr_heritage,step-2000,deu,7.983240604400635,2931.4152456865586
283,"Die Straße, auf der sich der Unfall ereignet hatte, wurde vorübergehend gesperrt, während die Rettungsdienste den Fahrer aus dem roten Audi TT befreiten.",BeetleLM/beetlelm_deu-ukr_heritage,step-2000,deu,7.279053688049316,1449.6155872855709
284,Er wurde zunächst in das James Paget Krankenhaus in Great Yarmouth eingeliefert.,BeetleLM/beetlelm_deu-ukr_heritage,step-2000,deu,7.860584259033203,2593.0349370067
285,Er wurde infolgedessen in das Addenbrooke’s Hospital in Cambridge verlegt.,BeetleLM/beetlelm_deu-ukr_heritage,step-2000,deu,7.770145893096924,2368.8168571740243
286,Adekoya wurde in der Zwischenzeit vor dem Edinburgh Sheriff Court wegen Mordes an ihrem Sohn angeklagt.,BeetleLM/beetlelm_deu-ukr_heritage,step-2000,deu,7.263798236846924,1427.6688765531285
287,"Sie befindet sich bis zur Anklageerhebung und Verhandlung in Untersuchungshaft, doch Aussagen von Augenzeugen könnten verfälscht sein, da ihr Bild weithin veröffentlicht wurde.",BeetleLM/beetlelm_deu-ukr_heritage,step-2000,deu,7.90084981918335,2699.5755047886705
288,"Dies ist anderenorts in Großbritannien gängige Praxis, aber die schottische Justiz arbeitet anders, und die Gerichte haben die Veröffentlichung von Fotos als potenziell schädlich erachtet.",BeetleLM/beetlelm_deu-ukr_heritage,step-2000,deu,7.584599018096924,1967.6574806841768
289,"Professorin Pamela Ferguson von der University of Dundee merkt an: „Journalisten scheinen eine gefährliche Grenze zu überschreiten, wenn Sie Fotos usw. von Verdächtigen veröffentlichen.“",BeetleLM/beetlelm_deu-ukr_heritage,step-2000,deu,7.712127208709717,2235.292137305676
290,"Das Crown Office, welches federführend bei der Strafverfolgung ist, hat Journalisten gegenüber angedeutet, das mindestens bis zur Anklage keine weiteren Kommentare mehr abgegeben werden.",BeetleLM/beetlelm_deu-ukr_heritage,step-2000,deu,8.039371490478516,3100.6637810715915
291,"Dem Leak zufolge bezieht sich das Dokument auf den Grenzstreit, in dem die Palästinenser ein Zurücksetzen der Grenzen in den Zustand vor dem Sechstagekrieg von 1967 fordern.",BeetleLM/beetlelm_deu-ukr_heritage,step-2000,deu,7.401419162750244,1638.307806393631
292,"Andere Themen, die angeblich abgedeckt sind, umfassen die Zukunft von Jerusalem, das beiden Nationen heilig ist, und das Problem des Jordantals.",BeetleLM/beetlelm_deu-ukr_heritage,step-2000,deu,6.941334247589111,1034.1491058161553
293,"Israel verlangt  eine Militärpräsenz im Jordantal von zehn Jahren ab der Unterzeichnung der Vereinbarung, die Palästinenserbehörde hingegen will eine solche Präsenz nur für fünf Jahre akzeptieren.",BeetleLM/beetlelm_deu-ukr_heritage,step-2000,deu,7.608789443969727,2015.8363372369788
294,"Die Schützen des begleitenden Versuchs zur Eindämmung der Plage sollten eng von Rangern beaufsichtigt werden, da der Versuch überwacht und seine Wirksamkeit beurteilt wurde.",BeetleLM/beetlelm_deu-ukr_heritage,step-2000,deu,7.752458572387695,2327.287190662338
295,Im Rahmen einer Partnerschaft zwischen NPWS und der Sporting Shooters Association of Australia (NSW) Inc. wurden im Rahmen des Jagdprogramms der Sporting Shooters Association qualifizierte Freiwillige rekrutiert.,BeetleLM/beetlelm_deu-ukr_heritage,step-2000,deu,7.9027323722839355,2704.66238568485
296,"Laut Mick O‘Flynn, dem geschäftsführenden Direktor von Park Conservation and Heritage im NPWS, erhielten die vier für die erste Jagdoperation ausgewählten Schützen umfassenden Sicherheits- und Trainingsunterricht.",BeetleLM/beetlelm_deu-ukr_heritage,step-2000,deu,7.676229953765869,2156.47441905427
297,Martelly hat gestern eine neue Provisorische Wahlkommission (CEP) mit neun Mitgliedern vereidigt.,BeetleLM/beetlelm_deu-ukr_heritage,step-2000,deu,8.016180992126465,3029.58520207273
298,Es ist Martellys fünftes CEP innerhalb von vier Jahren.,BeetleLM/beetlelm_deu-ukr_heritage,step-2000,deu,7.423128604888916,1674.2634310527155
299,Letzten Monat empfahl eine Präsidialkommission den Rücktritt des vorherigen CEP als Teil des Maßnahmenpakets zur Lenkung des Landes in Richtung Neuwahlen.,BeetleLM/beetlelm_deu-ukr_heritage,step-2000,deu,8.170612335205078,3535.508217079996
300,"Die Kommission war Martellys Antwort auf die weitverbreiteten regimekritischen Proteste, die im Oktober begannen.",BeetleLM/beetlelm_deu-ukr_heritage,step-2000,deu,7.626214981079102,2051.271207316313
301,"Auslöser für die teils gewalttätigen Proteste war die nicht erfolgte Durchführung von Wahlen, von denen einige seit 2011 anstehen.",BeetleLM/beetlelm_deu-ukr_heritage,step-2000,deu,7.603876113891602,2005.956160090714
302,Es wurden über 60 Fälle von Überhitzung bei defekten iPods gemeldet. Insgesamt wurden dadurch sechs Brände ausgelöst und vier Personen haben leichte Verbrennungen erlitten.,BeetleLM/beetlelm_deu-ukr_heritage,step-2000,deu,8.137884140014648,3421.67042786644
303,"Das japanische Ministerium für Wirtschaft, Handel und Industrie (METI) gab an, dass ihm 27 Unfälle im Zusammenhang mit den Geräten bekannt waren.",BeetleLM/beetlelm_deu-ukr_heritage,step-2000,deu,7.025035858154297,1124.4348784416334
304,"""Letzte Woche gab das METI bekannt, dass es von Apple über 34 weitere Vorfälle von Überhitzung informiert worden war, die das Unternehmen als „nicht schwerwiegend"""" bezeichnete.""",BeetleLM/beetlelm_deu-ukr_heritage,step-2000,deu,7.040178298950195,1141.5911329847245
305,"Das Ministerium reagierte, indem es die Verschiebung des Berichts durch Apple als „wirklich bedauerlich“ bezeichnete.",BeetleLM/beetlelm_deu-ukr_heritage,step-2000,deu,7.943296432495117,2816.6300525251318
306,Das Erdbeben erschütterte Mariana um 07:19 Uhr Ortszeit (21:19 GMT am Freitag).,BeetleLM/beetlelm_deu-ukr_heritage,step-2000,deu,8.099264144897461,3292.044715870537
307,"Das Amt für Katastrophenschutz der nördlichen Marianen sagte, dass im Land keine Schäden gemeldet wurden.",BeetleLM/beetlelm_deu-ukr_heritage,step-2000,deu,7.513988018035889,1833.5110570000252
308,"Auch hatte das Pacific Tsunami Warning Center erklärt, dass es keine Hinweise auf einen Tsunami gab.",BeetleLM/beetlelm_deu-ukr_heritage,step-2000,deu,7.745051383972168,2310.1122235800335
309,"Ein ehemaliger philippinischer Polizist hat Touristen aus Hongkong als Geiseln genommen, indem er ihren Bus in Manila, der Hauptstadt der Philippinen, entführte.",BeetleLM/beetlelm_deu-ukr_heritage,step-2000,deu,7.613693714141846,2025.7468252491358
310,Rolando Mendoza schoss mit seinem M16-Gewehr auf die Touristen.,BeetleLM/beetlelm_deu-ukr_heritage,step-2000,deu,7.79072904586792,2418.079830845902
311,Mehrere Geiseln wurden gerettet und es gibt bisher mindestens sechs bestätigte Tote.,BeetleLM/beetlelm_deu-ukr_heritage,step-2000,deu,8.154350280761719,3478.4785564981175
312,"Sechs Geiseln, darunter die Kinder und Ältere, wurden, wie auch die philippinischen Fotografen, frühzeitig freigelassen.",BeetleLM/beetlelm_deu-ukr_heritage,step-2000,deu,7.279755115509033,1450.632744153702
313,"Die Fotografen nahmen den Platz einer älteren Dame ein, als sie zur Toilette musste. Mendoza wurde erschossen.",BeetleLM/beetlelm_deu-ukr_heritage,step-2000,deu,7.566289901733398,1931.9592100391283
314,Liggins trat in die Fußstapfen seines Vaters und schlug eine medizinische Karriere ein.,BeetleLM/beetlelm_deu-ukr_heritage,step-2000,deu,7.809853553771973,2464.76945266465
315,Er machte eine Ausbildung als Entbindungsarzt und nahm 1959 seine Arbeit im National Women's Hospital in Auckland auf.,BeetleLM/beetlelm_deu-ukr_heritage,step-2000,deu,7.65154504776001,2103.8936957762608
316,"Während seiner Arbeit im Krankenhaus begann Liggins in seiner Freizeit damit, vorzeitige Wehen zu untersuchen.",BeetleLM/beetlelm_deu-ukr_heritage,step-2000,deu,7.6235432624816895,2045.7981024370572
317,"Seine Forschung zeigte, dass die Anwendung eines Hormons die Lungenreifung des Fötus beschleunigte.",BeetleLM/beetlelm_deu-ukr_heritage,step-2000,deu,7.946089267730713,2824.507431171537
