sentence_id,sentence,repo,revision,iso_code,nll,ppl
690,"Blogging is a tool that inspires collaboration, and encourages students to extend learning well beyond the traditional school day.",BeetleLM/beetlelm_eng-nld_balanced,step-18341,eng,5.882940292358398,358.86285369257814
691,"Appropriate use of blogs ""can empower students to become more analytical and critical; through actively responding to Internet materials, students can define their positions in the context of others' writings as well as outline their own perspectives on particular issues (Oravec, 2002).",BeetleLM/beetlelm_eng-nld_balanced,step-18341,eng,5.838058948516846,343.1126944724905
692,"Ottawa is Canada's charming, bilingual capital and features an array of art galleries and museums that showcase Canada's past and present.",BeetleLM/beetlelm_eng-nld_balanced,step-18341,eng,5.601708889007568,270.888931229522
693,Farther south is Niagara Falls and the north is home to the untapped natural beauty of the Muskoka and beyond.,BeetleLM/beetlelm_eng-nld_balanced,step-18341,eng,6.097889423370361,444.9177454388077
694,All these things and more highlight Ontario as what is considered quintessentially Canadian by outsiders.,BeetleLM/beetlelm_eng-nld_balanced,step-18341,eng,7.739058017730713,2296.3082823232976
695,Large areas further north are quite sparsely populated and some is nearly uninhabited wilderness.,BeetleLM/beetlelm_eng-nld_balanced,step-18341,eng,6.164853572845459,475.7314778284392
696,For a comparison of population that surprises many: There are more African Americans living in the US than there are Canadian citizens.,BeetleLM/beetlelm_eng-nld_balanced,step-18341,eng,5.604307651519775,271.5938227550981
697,The East African Islands are in the Indian Ocean off the eastern coast of Africa.,BeetleLM/beetlelm_eng-nld_balanced,step-18341,eng,2.919445753097534,18.53101385592412
698,"Madagascar is by far the biggest, and a continent on its own when it comes to wildlife.",BeetleLM/beetlelm_eng-nld_balanced,step-18341,eng,4.954355716705322,141.7912232213471
699,"Most of the smaller islands are independent nations, or associated with France, and known as luxury beach resorts.",BeetleLM/beetlelm_eng-nld_balanced,step-18341,eng,5.141823768615723,171.0273984660582
700,"The Arabs also brought Islam to the lands, and it took in a big way in the Comoros and Mayotte.",BeetleLM/beetlelm_eng-nld_balanced,step-18341,eng,4.925008296966553,137.69048405146015
701,"European influence and colonialism began in the 15th century, as Portuguese explorer Vasco da Gama found the Cape Route from Europe to India.",BeetleLM/beetlelm_eng-nld_balanced,step-18341,eng,4.568206787109375,96.371140762166
702,"In the north the region is bounded by the Sahel, and in the south and west by the Atlantic Ocean.",BeetleLM/beetlelm_eng-nld_balanced,step-18341,eng,3.386411666870117,29.559691714163424
703,"Women: It is recommended that any women travellers say that they are married, regardless of actual marital status.",BeetleLM/beetlelm_eng-nld_balanced,step-18341,eng,6.0993332862854,445.5606096639129
704,It is helpful to also wear a ring (just not one that looks too expensive.,BeetleLM/beetlelm_eng-nld_balanced,step-18341,eng,6.382026672363281,591.1245101935795
705,"Women should realize that cultural differences may result in what they would consider harassment and it is not uncommon to be followed, grabbed by the arm, etc.",BeetleLM/beetlelm_eng-nld_balanced,step-18341,eng,5.561938762664795,260.3270597643267
706,"Be firm in turning down men, and don't be afraid to stand your ground (cultural differences or not, it doesn't make it ok!).",BeetleLM/beetlelm_eng-nld_balanced,step-18341,eng,5.753612995147705,315.32788276933525
707,"The modern city of Casablanca was founded by Berber fishermen in the 10th century BCE, and was used by the Phoenicians, Romans, and the Merenids as a strategic port called Anfa.",BeetleLM/beetlelm_eng-nld_balanced,step-18341,eng,4.477108001708984,87.97986677976523
708,"The Portuguese destroyed it and rebuilt it under the name Casa Branca, only to abandon it after an earthquake in 1755.",BeetleLM/beetlelm_eng-nld_balanced,step-18341,eng,5.231637954711914,187.0990123825095
709,The Moroccan sultan rebuilt the city as Daru l-Badya and it was given the name Casablanca by Spanish traders who established trading bases there.,BeetleLM/beetlelm_eng-nld_balanced,step-18341,eng,6.623072624206543,752.2529403226046
710,Casablanca is one of the least interesting places to shop in all of Morocco.,BeetleLM/beetlelm_eng-nld_balanced,step-18341,eng,4.857501983642578,128.70229976605924
711,"Around the old Medina it's easy to find places selling traditional Moroccan goods, such as tagines, pottery, leather goods, hookahs, and a whole spectrum of geegaws, but it's all for the tourists.",BeetleLM/beetlelm_eng-nld_balanced,step-18341,eng,5.735894680023193,309.79000974320724
712,Goma is a tourist city of the Democratic Republic of Congo in the extreme east near Rwanda.,BeetleLM/beetlelm_eng-nld_balanced,step-18341,eng,4.356590270996094,77.99075320404815
713,"In 2002 Goma was destroyed by lava from the Nyiragongo volcano which buried most of the town’s streets, particularly the town centre.",BeetleLM/beetlelm_eng-nld_balanced,step-18341,eng,6.074803829193115,434.76420610515254
714,"While Goma is reasonably safe, any visits outside of Goma should be researched to understand the state of the fighting that persists in the North Kivu province.",BeetleLM/beetlelm_eng-nld_balanced,step-18341,eng,6.069479465484619,432.4555149541612
715,The city is also the base to climb the Nyiragongo volcano along with some of the cheapest Mountain Gorilla tracking in Africa.,BeetleLM/beetlelm_eng-nld_balanced,step-18341,eng,5.91642427444458,371.08244975189695
716,You can use boda-boda (motorcycle taxi) to get around Goma. The normal (local) price is ~500 Congolese Francs for the short ride.,BeetleLM/beetlelm_eng-nld_balanced,step-18341,eng,6.874302864074707,967.1009297237625
717,"Combined with its relative inaccessibility, ""Timbuktu"" has come to be used as a metaphor for exotic, distant lands.",BeetleLM/beetlelm_eng-nld_balanced,step-18341,eng,6.2826619148254395,535.2114566199323
718,"Today, Timbuktu is an impoverished town, although its reputation makes it a tourist attraction, and it has an airport.",BeetleLM/beetlelm_eng-nld_balanced,step-18341,eng,5.08931303024292,162.2783434387456
719,"In 1990, it was added to the list of world heritage sites in danger, due to the threat of desert sands.",BeetleLM/beetlelm_eng-nld_balanced,step-18341,eng,4.600775241851807,99.56146994977787
720,It was one of the major stops during Henry Louis Gates' PBS special Wonders of the African World.,BeetleLM/beetlelm_eng-nld_balanced,step-18341,eng,5.2056145668029785,182.29286949653255
721,"The city is in stark contrast to the rest of the country's cities, because it has more of an Arabic flair than of an African.",BeetleLM/beetlelm_eng-nld_balanced,step-18341,eng,4.425359725952148,83.54285435017762
722,"The Kruger National Park (KNP) lies in the north-east of South Africa and runs along the border of Mozambique in the east, Zimbabwe in the north, and the southern border is the Crocodile River.",BeetleLM/beetlelm_eng-nld_balanced,step-18341,eng,3.491115093231201,32.82252748573951
723,"The park covers 19,500 km² and is divided in 14 different ecozones, each supporting different wildlife.",BeetleLM/beetlelm_eng-nld_balanced,step-18341,eng,5.998905181884766,402.98735403346393
724,It is one of the main attractions of South Africa and it is considered the flagship of South African National Parks (SANParks).,BeetleLM/beetlelm_eng-nld_balanced,step-18341,eng,3.632483720779419,37.806601142539435
725,"As with all South African National Parks, there are daily conservation and entry fees for the park.",BeetleLM/beetlelm_eng-nld_balanced,step-18341,eng,5.057534694671631,157.20248608680797
726,"It may also be beneficial for one to buy a Wild Card, which provides entry to either selections of parks in South Africa or all of the South African National Parks.",BeetleLM/beetlelm_eng-nld_balanced,step-18341,eng,5.0474853515625,155.63061572728085
727,Hong Kong Island gives the territory of Hong Kong its name and is the place that many tourists regard as the main focus.,BeetleLM/beetlelm_eng-nld_balanced,step-18341,eng,5.862891674041748,351.7397916762535
728,The parade of buildings that make the Hong Kong skyline has been likened to a glittering bar chart that is made apparent by the presence of the waters of Victoria Harbour.,BeetleLM/beetlelm_eng-nld_balanced,step-18341,eng,5.883192539215088,358.9533871373131
729,"To get the best views of Hong Kong, leave the island and head for the Kowloon waterfront opposite.",BeetleLM/beetlelm_eng-nld_balanced,step-18341,eng,6.403573989868164,603.999874327756
730,The great majority of Hong Kong Island's urban development is densely packed on reclaimed land along the northern shore.,BeetleLM/beetlelm_eng-nld_balanced,step-18341,eng,5.982054233551025,396.2535299531888
731,"This is the place the British colonisers took as their own and so if you are looking for evidence of the territory's colonial past, this is a good place to start.",BeetleLM/beetlelm_eng-nld_balanced,step-18341,eng,4.610428333282471,100.527199561239
732,"The Sundarbans are the largest littoral mangrove belt in the world, stretching 80 km (50 mi) into the Bangladeshi and Indian hinterland from the coast.",BeetleLM/beetlelm_eng-nld_balanced,step-18341,eng,4.968348503112793,143.78922371916076
733,The Sundarbans has been declared a UNESCO World Heritage Site. The part of the forest within Indian territory is called Sundarbans National Park.,BeetleLM/beetlelm_eng-nld_balanced,step-18341,eng,4.391204833984375,80.73763585111352
734,The forests aren't just mangrove swamps though — they include some of the last remaining stands of the mighty jungles which once covered the Gangetic plain.,BeetleLM/beetlelm_eng-nld_balanced,step-18341,eng,5.721924781799316,305.4923635692757
735,"The Sundarbans cover an area of 3,850 km², of which about one-third is covered in water/marsh areas.",BeetleLM/beetlelm_eng-nld_balanced,step-18341,eng,5.209457874298096,182.99482509974115
736,"Since 1966 the Sundarbans have been a wildlife sanctuary, and it is estimated that there are now 400 Royal Bengal tigers and about 30,000 spotted deer in the area.",BeetleLM/beetlelm_eng-nld_balanced,step-18341,eng,4.512756824493408,91.17281983110963
737,"Buses depart the inter-district bus station (across the river) throughout the day, though most, especially those heading to the east and Jakar/Bumthang leave between 06:30 and 07:30.",BeetleLM/beetlelm_eng-nld_balanced,step-18341,eng,5.996695041656494,402.0976789862869
738,"As the inter-district buses are often full, it is advisable to purchase a ticket a few days in advance.",BeetleLM/beetlelm_eng-nld_balanced,step-18341,eng,6.083860874176025,438.71977090138654
739,"Most districts are served by small Japanese Coaster Buses, which are comfortable and sturdy.",BeetleLM/beetlelm_eng-nld_balanced,step-18341,eng,6.2481842041015625,517.0730725631861
740,"Shared taxis are a quick and comfortable means to travel to nearby places, such as Paro (Nu 150) and Punakha (Nu 200).",BeetleLM/beetlelm_eng-nld_balanced,step-18341,eng,6.118232250213623,454.0613178266725
741,The Oyapock River Bridge is a cable-stayed bridge. It spans the Oyapock River to link the cities of Oiapoque in Brazil and Saint-Georges de l'Oyapock in French Guiana.,BeetleLM/beetlelm_eng-nld_balanced,step-18341,eng,5.95246696472168,384.7012137163462
742,"The two towers rise to a height of 83 meters, it's 378 meters long and it has two lanes of 3.50 m wide.",BeetleLM/beetlelm_eng-nld_balanced,step-18341,eng,4.5623908042907715,95.81227461656798
743,"The vertical clearance under the bridge is 15 meters. Construction was completed in August 2011, it didn't open to traffic until March 2017.",BeetleLM/beetlelm_eng-nld_balanced,step-18341,eng,4.533030033111572,93.04004883681705
744,"The bridge is scheduled to be fully operational in September 2017, when the Brazilian customs checkpoints are expected to be finished.",BeetleLM/beetlelm_eng-nld_balanced,step-18341,eng,5.38774299621582,218.7092005817147
745,"The Guaraní were the most significant indigenous group inhabiting what is now Eastern Paraguay, living as semi-nomadic hunters who also practised subsistence agriculture.",BeetleLM/beetlelm_eng-nld_balanced,step-18341,eng,5.458954334259033,234.85171952774394
746,"The Chaco region was home to other groups of indigenous tribes such as the Guaycurú and Payaguá, who survived by hunting, gathering and fishing.",BeetleLM/beetlelm_eng-nld_balanced,step-18341,eng,5.432578086853027,228.7381928467588
747,"In the 16th century Paraguay, formerly called ""The Giant Province of the Indies"", was born as a result of the encounter of Spanish conquerors with the native indigenous groups.",BeetleLM/beetlelm_eng-nld_balanced,step-18341,eng,4.069167613983154,58.50824087549278
748,The Spaniards started the colonization period which lasted for three centuries.,BeetleLM/beetlelm_eng-nld_balanced,step-18341,eng,5.514822483062744,248.34588773290224
749,"Since the foundation of Asunción in 1537, Paraguay has managed to keep a lot of its indigenous character and identity.",BeetleLM/beetlelm_eng-nld_balanced,step-18341,eng,5.055642127990723,156.90525125657203
750,Argentina is well known for having one of the best polo teams and players in the world.,BeetleLM/beetlelm_eng-nld_balanced,step-18341,eng,3.9395618438720703,51.39607686024864
751,The largest tournament of the year takes place in December at the polo fields in Las Cañitas.,BeetleLM/beetlelm_eng-nld_balanced,step-18341,eng,6.244045257568359,514.937357615965
752,Smaller tournaments and matches can also be seen here at other times of the year.,BeetleLM/beetlelm_eng-nld_balanced,step-18341,eng,5.459248065948486,234.920713052388
753,"For news on tournaments and where to buy tickets for polo matches, check Asociacion Argentina de Polo.",BeetleLM/beetlelm_eng-nld_balanced,step-18341,eng,7.376481533050537,1597.9575045105084
754,The official Falklands currency is the Falkland pound (FKP) whose value is set equivalent to that of one British pound (GBP).,BeetleLM/beetlelm_eng-nld_balanced,step-18341,eng,5.048830509185791,155.84010430243256
755,Money can be exchanged at the only bank in the islands which is located in Stanley across from the FIC West store.,BeetleLM/beetlelm_eng-nld_balanced,step-18341,eng,6.0088419914245605,407.01172420352276
756,British pounds will generally be accepted anywhere in the islands and within Stanley credit cards and United States dollars are also often accepted.,BeetleLM/beetlelm_eng-nld_balanced,step-18341,eng,6.250906467437744,518.4825993117793
757,"On the outlying islands credit cards will probably not be accepted, although British and United States currency may be taken; check with the owners in advance to determine what is an acceptable payment method.",BeetleLM/beetlelm_eng-nld_balanced,step-18341,eng,6.24999475479126,518.0101075900724
758,"It is nearly impossible to exchange Falklands currency outside of the islands, so exchange money prior to leaving the islands.",BeetleLM/beetlelm_eng-nld_balanced,step-18341,eng,5.3355937004089355,207.59596203600225
759,"Since Montevideo is south of the Equator, it is summer there when it's winter in the Northern Hemisphere and vice versa.",BeetleLM/beetlelm_eng-nld_balanced,step-18341,eng,4.432405471801758,84.13355458770063
760,"Montevideo is in the subtropics; in the summer months, temperatures above +30°C are common.",BeetleLM/beetlelm_eng-nld_balanced,step-18341,eng,5.830019950866699,340.3654695901229
761,"The winter can be deceptively chilly: temperatures rarely go below freezing, but the wind and humidity combine to make it feel colder than what the thermometer says.",BeetleLM/beetlelm_eng-nld_balanced,step-18341,eng,6.2797675132751465,533.6645794718859
762,"There are no particular ""rainy"" and ""dry"" seasons: the amount of rain stays roughly the same throughout the year.",BeetleLM/beetlelm_eng-nld_balanced,step-18341,eng,5.521630764007568,250.04246514249877
763,"Though many of the animals in the park are used to seeing humans, the wildlife is nonetheless wild and should not be fed or disturbed.",BeetleLM/beetlelm_eng-nld_balanced,step-18341,eng,5.193004608154297,180.0085965128069
764,"According to park authorities, stay at least 100 yards/meters away from bears and wolves and 25 yards/meters from all other wild animals!",BeetleLM/beetlelm_eng-nld_balanced,step-18341,eng,5.841155052185059,344.1766531577384
765,"No matter how docile they may look, bison, elk, moose, bears, and nearly all large animals can attack.",BeetleLM/beetlelm_eng-nld_balanced,step-18341,eng,5.580718994140625,265.2622592487812
766,"Each year, dozens of visitors are injured because they didn't keep a proper distance. These animals are large, wild, and potentially dangerous, so give them their space.",BeetleLM/beetlelm_eng-nld_balanced,step-18341,eng,4.654158592224121,105.02081748037475
767,"In addition, be aware that odors attract bears and other wildlife, so avoid carrying or cooking odorous foods and keep a clean camp.",BeetleLM/beetlelm_eng-nld_balanced,step-18341,eng,7.102138042449951,1214.5610836084377
768,"Apia is the capital of Samoa. The town is on the island of Upolu and has a population of just under 40,000.",BeetleLM/beetlelm_eng-nld_balanced,step-18341,eng,3.7972564697265625,44.578713518617754
769,Apia was founded in the 1850s and has been the official capital of Samoa since 1959.,BeetleLM/beetlelm_eng-nld_balanced,step-18341,eng,3.291426420211792,26.881180180395404
770,"The harbor was the site of an infamous naval standoff in 1889 when seven ships from Germany, the US, and Britain refused to leave the harbor.",BeetleLM/beetlelm_eng-nld_balanced,step-18341,eng,5.147256851196289,171.9591332495335
771,"All the ships were sunk, except for one British cruiser. Nearly 200 American and German lives were lost.",BeetleLM/beetlelm_eng-nld_balanced,step-18341,eng,5.966640472412109,390.1926035259562
772,"During the struggle for independence organised by the Mau movement, a peaceful gathering in the town resulted in the killing of the paramount chief Tupua Tamasese Lealofi III.",BeetleLM/beetlelm_eng-nld_balanced,step-18341,eng,5.803253650665283,331.37598950581537
773,"There are many beaches, due to Auckland's straddling of two harbours. The most popular ones are in three areas.",BeetleLM/beetlelm_eng-nld_balanced,step-18341,eng,4.801576614379883,121.70214368970487
774,North Shore beaches (in North Harbour district) are on the Pacific Ocean and stretch from Long Bay in the north to Devonport in the south.,BeetleLM/beetlelm_eng-nld_balanced,step-18341,eng,4.827017307281494,124.83805124769397
775,"They are almost all sandy beaches with safe swimming, and most have shade provided by pohutukawa trees.",BeetleLM/beetlelm_eng-nld_balanced,step-18341,eng,6.5743088722229,716.4502945042043
776,"Tamaki Drive beaches are on the Waitemata Harbour, in the upmarket suburbs of Mission Bay and St Heliers in Central Auckland.",BeetleLM/beetlelm_eng-nld_balanced,step-18341,eng,6.392740249633789,597.4916146411446
777,These are sometimes-crowded family beaches with a good range of shops lining the shore. Swimming is safe.,BeetleLM/beetlelm_eng-nld_balanced,step-18341,eng,5.991659641265869,400.07804527599603
778,"The main local beer is 'Number One', it is not a complex beer, but pleasant and refreshing. The other local beer is called ""Manta"".",BeetleLM/beetlelm_eng-nld_balanced,step-18341,eng,5.739024639129639,310.7611588409365
779,"There are many French wines to be had, but the New Zealand and Australian wines might travel better.",BeetleLM/beetlelm_eng-nld_balanced,step-18341,eng,5.208731174468994,182.8618910990226
780,"The local tap water is perfectly safe to drink, but bottled water is easy to find if you are fearful.",BeetleLM/beetlelm_eng-nld_balanced,step-18341,eng,6.1392316818237305,463.6971669993366
781,"For Australians, the idea of 'flat white' coffee is foreign. A short black is 'espresso', cappuccino comes heaped high with cream (not froth), and tea is served without milk.",BeetleLM/beetlelm_eng-nld_balanced,step-18341,eng,6.361318588256836,579.0093281610851
782,The hot chocolate is up to Belgian standards. Fruit juices are pricey but excellent.,BeetleLM/beetlelm_eng-nld_balanced,step-18341,eng,6.402993679046631,603.6494683465038
783,"Many trips to the reef are made all year around, and injuries due to any of these causes on the reef are rare.",BeetleLM/beetlelm_eng-nld_balanced,step-18341,eng,6.122915744781494,456.19289927087823
784,"Still, take advice from authorities, obey all signs, and pay close attention to safety warnings.",BeetleLM/beetlelm_eng-nld_balanced,step-18341,eng,6.686854839324951,801.7965034512695
785,Box jellyfish occur near beaches and near river estuaries from October to April north of 1770. They can occasionally be found outside these times.,BeetleLM/beetlelm_eng-nld_balanced,step-18341,eng,6.066751956939697,431.27759596412164
786,"Sharks do exist, however they rarely attack humans. Most sharks are scared of humans and would swim away.",BeetleLM/beetlelm_eng-nld_balanced,step-18341,eng,5.701828479766846,299.4143738747527
787,"Saltwater Crocodiles do not actively live in the ocean, their primary habitat is in river estuaries north from Rockhampton.",BeetleLM/beetlelm_eng-nld_balanced,step-18341,eng,5.312675476074219,202.89233645802284
788,Booking in advance gives the traveller peace of mind that they will have somewhere to sleep once they arrive at their destination.,BeetleLM/beetlelm_eng-nld_balanced,step-18341,eng,5.7166056632995605,303.87172748542355
789,"Travel agents often have deals with specific hotels, although you may find it possible to book other forms of accommodation, like camping grounds, through a travel agent.",BeetleLM/beetlelm_eng-nld_balanced,step-18341,eng,5.886087417602539,359.9940190645413
790,"Travel agents usually offer packages that include breakfast, transportation arrangements to/from the airport or even combined flight and hotel packages.",BeetleLM/beetlelm_eng-nld_balanced,step-18341,eng,7.034684181213379,1135.3362950345497
791,They can also hold the reservation for you if you need time to think about the offer or procure other documents for your destination (e.g. visa).,BeetleLM/beetlelm_eng-nld_balanced,step-18341,eng,5.26271915435791,193.00559041339778
792,Any amendments or requests though should be coursed through the travel agent first and not directly with the hotel.,BeetleLM/beetlelm_eng-nld_balanced,step-18341,eng,6.290432929992676,539.386795265064
793,"For some festivals, the vast majority of the attendants to music festivals decide to camp on site, and most attendants consider it a vital part of the experience.",BeetleLM/beetlelm_eng-nld_balanced,step-18341,eng,5.388525009155273,218.88030089915853
794,If you want to be close to the action you're going to have to get in early to get a camping site close to the music.,BeetleLM/beetlelm_eng-nld_balanced,step-18341,eng,3.8731274604797363,48.09255870566265
795,"Remember that even though music on the main stages may have finished, there may be sections of the festival that will keep playing music until late into the night.",BeetleLM/beetlelm_eng-nld_balanced,step-18341,eng,5.397567272186279,220.86844928620775
796,Some festivals have special camping areas for families with young children.,BeetleLM/beetlelm_eng-nld_balanced,step-18341,eng,5.624878883361816,277.2387042697758
797,"If crossing the Northern Baltic in winter, check the cabin location, as going through ice causes quite horrible noise for those most affected.",BeetleLM/beetlelm_eng-nld_balanced,step-18341,eng,7.318447113037109,1507.86061366179
798,Saint Petersburg cruises include time in town. Cruise passengers are exempted from visa requirements (check the terms).,BeetleLM/beetlelm_eng-nld_balanced,step-18341,eng,7.282188415527344,1454.1668668832847
799,"Casinos typically make many efforts to maximize time and money spent by guests. Windows and clocks are usually absent, and exits can be hard to find.",BeetleLM/beetlelm_eng-nld_balanced,step-18341,eng,5.743946552276611,312.29446858750714
800,"They usually have special food, drink and entertainment offers, to keep guests in a good mood, and keep them at the premise.",BeetleLM/beetlelm_eng-nld_balanced,step-18341,eng,5.394824028015137,220.2633835011543
801,"Some venues offer alcoholic beverages on the house. However, drunkenness impairs judgement, and all good gamblers know the importance of staying sober.",BeetleLM/beetlelm_eng-nld_balanced,step-18341,eng,5.993696212768555,400.8936630719291
802,"Anyone who's going to drive at high latitudes or over mountain passes should consider the possibility of snow, ice, or freezing temperatures.",BeetleLM/beetlelm_eng-nld_balanced,step-18341,eng,5.821064472198486,337.3309419922812
803,"On icy and snowy roadways, friction is low and you cannot drive as if you were on bare asphalt.",BeetleLM/beetlelm_eng-nld_balanced,step-18341,eng,6.72409200668335,832.2159868274922
804,"During blizzards, enough snow to get you stuck can fall in very little time.",BeetleLM/beetlelm_eng-nld_balanced,step-18341,eng,6.594209671020508,730.8510456170309
805,Visibility may also be restricted by falling or blowing snow or by condensation or ice on vehicle windows.,BeetleLM/beetlelm_eng-nld_balanced,step-18341,eng,6.521753311157227,679.7691880122634
806,"On the other hand, icy and snowy conditions are normal in many countries, and traffic goes on mostly uninterrupted all year round.",BeetleLM/beetlelm_eng-nld_balanced,step-18341,eng,5.917261123657227,371.393119781653
807,Safaris are perhaps the greatest tourism draw in Africa and the highlight for many visitors.,BeetleLM/beetlelm_eng-nld_balanced,step-18341,eng,5.994359493255615,401.15965622031166
