sentence_id,sentence,repo,revision,iso_code,nll,ppl
417,"Die Artikel erforderten die einstimmige Zustimmung aller Staaten, bevor sie geändert werden konnten, und die Staaten nahmen die Zentralregierung so wenig ernst, dass ihre Repräsentanten oftmals abwesend waren.",BeetleLM/beetlelm_bul-deu_part_time,step-20000,deu,5.905503273010254,367.05190662909575
418,Die italienische Fußballnationalmannschaft ist zusammen mit der deutschen Fußballnationalmannschaft die zweiterfolgreichste der Welt und war 2006 FIFA-Weltmeister.,BeetleLM/beetlelm_bul-deu_part_time,step-20000,deu,5.574862957000732,263.71341308337753
419,"Zu den beliebten Sportarten gehören Fußball, Basketball, Volleyball, Wasserball, Fechten, Rugby, Radfahren, Eishockey, Rollhockey und Formel-1-Motorsport.",BeetleLM/beetlelm_bul-deu_part_time,step-20000,deu,6.173461437225342,479.8441852905251
420,Wintersportarten sind in den nördlichen Regionen am beliebtesten und Italiener nehmen an internationalen Wettkämpfen und olympischen Spielen teil.,BeetleLM/beetlelm_bul-deu_part_time,step-20000,deu,5.442713737487793,231.0683923516366
421,"Japan besitzt annähernd 7.000 Inseln (von denen Honshu die größte ist), womit Japan die siebtgrößte Insel der Welt ist.",BeetleLM/beetlelm_bul-deu_part_time,step-20000,deu,6.2933573722839355,540.9665095863115
422,"""Aufgrund des Clusters/Gruppe von Inseln wurde Japan, wird Japan geografisch häufig als """"Archipel"""" bezeichnet.""",BeetleLM/beetlelm_bul-deu_part_time,step-20000,deu,5.615107536315918,274.54290094015107
423,"Der Beginn Taiwans geht auf das 15. Jahrhundert zurück, als europäische Seefahrer dort vorbeifuhren und den Namen der Insel als Ilha Formosa bzw. schöne Insel dokumentierten.",BeetleLM/beetlelm_bul-deu_part_time,step-20000,deu,6.162381172180176,474.55673182597116
424,"1624 gründet die Niederländische Ostindien-Kompanie eine Niederlassung im Südwesten Taiwans, leitet damit einen Wandel in den Getreideanbaumethoden der Ureinwohner ein und beschäftigt chinesische Arbeiter auf ihren Reis- und Zuckerplantagen.",BeetleLM/beetlelm_bul-deu_part_time,step-20000,deu,5.878636360168457,357.321651299173
425,Im Jahr 1683 übernehmen Streitkräfte der Qing-Dynastie (1644-1912) die Kontrolle über Taiwans westliche und nördliche Küstenregionen und erklärten im Jahr 1885 Taiwan zur Provinz des Qing-Reiches.,BeetleLM/beetlelm_bul-deu_part_time,step-20000,deu,5.192715167999268,179.9565023361626
426,"1895 unterzeichnete die Regierung der Qing-Dynastie nach der Niederlage im ersten Chinesisch-Japanischen Krieg (1894-1895) den Vertrag von Shimonoseki, in dem sie die Souveränität über Taiwan an Japan abtrat, welches die Insel bis 1945 regierte.",BeetleLM/beetlelm_bul-deu_part_time,step-20000,deu,5.5148749351501465,248.35891433474487
427,"Machu Picchu besteht hauptsächlich aus drei Bauwerken, nämlich den Intihuatana, dem Sonnentempel und dem Raum der drei Fenster.",BeetleLM/beetlelm_bul-deu_part_time,step-20000,deu,6.65874719619751,779.5736722331412
428,"Die meisten Gebäude an den Rändern des Komplexes wurden wieder aufgebaut, um den Touristen einen besseren Eindruck davon zu vermitteln, wie sie ursprünglich aussahen.",BeetleLM/beetlelm_bul-deu_part_time,step-20000,deu,5.517733573913574,249.06989849377436
429,"Bis 1976 wurden dreißig Prozent von Machu Picchu restauriert, und die Restaurierungsarbeiten dauern bis heute an.",BeetleLM/beetlelm_bul-deu_part_time,step-20000,deu,5.946868896484375,382.55364679251403
430,"Zum Beispiel ist das weltweit am weitesten verbreitete Standbildformat 35 mm, was der vorherrschenden Filmgröße am Ende der Analogfilmära entspricht.",BeetleLM/beetlelm_bul-deu_part_time,step-20000,deu,6.347978115081787,571.3363640316991
431,"Es wird auch heute noch hergestellt, aber noch wichtiger ist, dass sein Bildformat von den Bildsensorformaten digitaler Kameras übernommen wurde.",BeetleLM/beetlelm_bul-deu_part_time,step-20000,deu,6.047574996948242,423.08580067319303
432,Genau genommen misst das sogenannte 35-mm-Format verwirrenderweise 36 mm in der Breite und 24 mm in der Höhe.,BeetleLM/beetlelm_bul-deu_part_time,step-20000,deu,6.246743202209473,516.3285058771158
433,"Das Seitenverhältnis dieses Formats (geteilt durch zwölf, um das einfachste ganzzahlige Verhältnis zu erhalten) wird daher als 3:2 bezeichnet.",BeetleLM/beetlelm_bul-deu_part_time,step-20000,deu,7.40476131439209,1643.7924396513733
434,"Viele übliche Formate (die APS-Formatfamilie, zum Beispiel) haben genau dasselbe oder ein sehr ähnliches Seitenverhältnis.",BeetleLM/beetlelm_bul-deu_part_time,step-20000,deu,7.208378791809082,1350.7007243027547
435,"Die vielgeschmähte und oft verspottete Drittel-Regel ist eine einfache Richtlinie, die Dynamik schafft und gleichzeitig ein Maß an Ordnung in einem Bild bewahrt.",BeetleLM/beetlelm_bul-deu_part_time,step-20000,deu,6.302700042724609,546.0442643650836
436,"Sie besagt, dass der Kreuzungspunkt der Linien, die ein Bild vertikal und horizontal dritteln, der effektivste Platz für das Hauptmotiv ist (siehe Beispiel).",BeetleLM/beetlelm_bul-deu_part_time,step-20000,deu,6.309134006500244,549.5688196539282
437,In dieser Periode der europäischen Geschichte stand die reich und mächtig gewordene katholische Kirche auf dem Prüfstand.,BeetleLM/beetlelm_bul-deu_part_time,step-20000,deu,5.853753089904785,348.540030905841
438,Seit über eintausend Jahren hatte die christliche Religion die europäischen Staaten trotz unterschiedlicher Sprachen und Gebräuche zusammengehalten.,BeetleLM/beetlelm_bul-deu_part_time,step-20000,deu,5.647340297698975,283.5363398084553
439,"Seine Allmacht beherrschte jeden, vom König bis zum einfachen Bürger.",BeetleLM/beetlelm_bul-deu_part_time,step-20000,deu,7.0768890380859375,1184.2785363658577
440,"Einer der wichtigen christlichen Glaubenssätze besagt, dass Vermögen zur Linderung von Leid und Armut eingesetzt werden soll und dass es die Geldmittel der Kirchen genau aus diesem Grund gibt.",BeetleLM/beetlelm_bul-deu_part_time,step-20000,deu,6.341119766235352,567.4313462323403
441,"Die Zentralgewalt der Kirche war seit mehr als tausend Jahren in Rom. Diese Konzentration von Macht und Geld veranlasste viele zu zweifeln, ob diesem Grundsatz entsprochen wurde.",BeetleLM/beetlelm_bul-deu_part_time,step-20000,deu,6.36000394821167,578.2486394372459
442,Bald nach dem Ausbruch von Kampfhandlungen initiierte Großbritannien eine Seeblockade gegen Deutschland.,BeetleLM/beetlelm_bul-deu_part_time,step-20000,deu,5.70681095123291,300.90992011343064
443,"Die Strategie erwies sich als effektiv, da sie das Land von lebenswichtigen militärischen und zivilen Lieferungen abschnitt, obwohl diese Blockade gegen das allgemein anerkannte Völkerrecht verstieß, das durch mehrere internationale Abkommen der letzten zwei Jahrhunderte kodifiziert worden war.",BeetleLM/beetlelm_bul-deu_part_time,step-20000,deu,6.032321453094482,416.68121336485734
444,"Großbritannien verminte internationale Gewässer, um zu verhindern, dass Schiffe in ganze Meeresabschnitte vordringen konnten, was selbst für neutrale Schiffe eine Gefahr darstellte.",BeetleLM/beetlelm_bul-deu_part_time,step-20000,deu,5.647950172424316,283.7093141968127
445,"Da die Reaktion auf diese Taktik begrenzt war, erwartete Deutschland eine ähnliche Reaktion auf seine uneingeschränkte U-Boot-Kriegsführung.",BeetleLM/beetlelm_bul-deu_part_time,step-20000,deu,6.681063652038574,797.1665690825772
446,In den 1920er-Jahren waren Pazifismus und Isolation die vorherrschenden Einstellungen der meisten Bürger und Länder.,BeetleLM/beetlelm_bul-deu_part_time,step-20000,deu,6.300656318664551,544.9294401487143
447,Nach dem Erlebnis der Schrecken und Gräueltaten im Ersten Weltkrieg wollten die Nationen eine weitere solche Situation in der Zukunft vermeiden.,BeetleLM/beetlelm_bul-deu_part_time,step-20000,deu,5.587238788604736,266.99736477760257
448,"1884 zog Tesla in die Vereinigten Staaten von Amerika um, um eine Stelle bei der Edison Company in New York City anzutreten.",BeetleLM/beetlelm_bul-deu_part_time,step-20000,deu,4.641170978546143,103.66566681011868
449,"Er kam in die USA mit 4 Cent in seinem Besitz, einem Buch mit Gedichten und einem Empfehlungsschreiben von Charles Batchelor (seinem Vorgesetzten bei seiner vorherigen Arbeitsstelle) an Thomas Edison.",BeetleLM/beetlelm_bul-deu_part_time,step-20000,deu,6.027509689331055,414.6810577986683
450,"Das alte China hatte eine einzigartige Methode, verschiedene Zeitalter anzuzeigen. Jede Zeitspanne in China und jede Familie, die an der Macht war, war eine eigene Dynastie.",BeetleLM/beetlelm_bul-deu_part_time,step-20000,deu,5.063111305236816,158.0815920692029
451,"Zwischen den einzelnen Dynastien herrschten auch unbeständige Zeiten geteilter Provinzen. Die bekannteste dieser Perioden war die Epoche der Drei Königreiche, die 60 Jahre lang zwischen der Han- und der Jin-Dynastie stattfand.",BeetleLM/beetlelm_bul-deu_part_time,step-20000,deu,5.172358989715576,176.33030862991865
452,"In diesen Zeiten tobten erbitterte Kriege unter vielen Adligen, die um den Thron kämpften.",BeetleLM/beetlelm_bul-deu_part_time,step-20000,deu,5.340540885925293,208.62552238582367
453,Die Zeit der drei Königreiche war eine der blutigsten Epochen in der Geschichte des alten China. Tausende von Menschen starben im Kampf um den höchsten Thron im großen Palast von Xi'an.,BeetleLM/beetlelm_bul-deu_part_time,step-20000,deu,4.8178181648254395,123.69491423186987
454,"Es gibt eine Menge sozialer und politischer Effekte wie die Nutzung des metrischen Systems, eine Abwendung vom Absolutismus hin zum Republikanismus und Nationalismus sowie der Glaube, dass das Land dem Volk gehört und nicht einem Herrscher allein.",BeetleLM/beetlelm_bul-deu_part_time,step-20000,deu,5.079919815063477,160.7611647879826
455,"Auch standen nach der Revolution alle Berufe allen männlichen Bewerbern offen, so dass die Ehrgeizigsten und Besten reüssieren konnten.",BeetleLM/beetlelm_bul-deu_part_time,step-20000,deu,5.679594039916992,292.83052828395455
456,"Dasselbe gilt für das Militär, denn statt auf Klassenzugehörigkeit basierten die Armee-Ranglisten nun auf dem Kaliber.",BeetleLM/beetlelm_bul-deu_part_time,step-20000,deu,6.36747407913208,582.5844066905715
457,"Die Französische Revolution inspirierte auch viele unterdrückte Menschen der Arbeiterschicht in anderen Ländern dazu, ihre eigenen Revolutionen zu starten.",BeetleLM/beetlelm_bul-deu_part_time,step-20000,deu,5.863638401031494,352.0025433617442
458,"Mohammed war sehr stark an Dingen interessiert, die über dieses Alltagsleben hinausgingen. Er besuchte oft eine Höhle, die als „Hira“ auf dem Berg von „Nur“ (Licht) bekannt wurde, um zu meditieren.",BeetleLM/beetlelm_bul-deu_part_time,step-20000,deu,5.950477600097656,383.93666346771585
459,Die Höhle selbst hat die Zeiten überdauert und bietet ein lebhaftes Bild von Mohammeds spirituellen Neigungen.,BeetleLM/beetlelm_bul-deu_part_time,step-20000,deu,6.3899827003479,595.8462716656496
460,Die Höhle befindet sich auf der Spitze eines der Berge nördlich von Mekka und ist vom Rest der Welt völlig isoliert.,BeetleLM/beetlelm_bul-deu_part_time,step-20000,deu,4.963361740112305,143.0739658314747
461,"Tatsächlich ist sie ganz und gar nicht einfach zu finden, auch wenn man weiß, dass sie existiert. Sobald man sich in der Höhle befindet, ist man vollkommen isoliert.",BeetleLM/beetlelm_bul-deu_part_time,step-20000,deu,4.475266456604004,87.81799697777646
462,"Man sieht nichts außer dem darüber liegenden, klaren, wunderschönen Himmel und den zahlreichen umliegenden Bergen. Vom Innern der Höhle aus ist sehr wenig von dieser Welt zu sehen oder zu hören.",BeetleLM/beetlelm_bul-deu_part_time,step-20000,deu,6.575803756713867,717.5221058554941
463,"Die Cheopspyramide ist das einzige der sieben Weltwunder, welches heute noch steht.",BeetleLM/beetlelm_bul-deu_part_time,step-20000,deu,5.854816436767578,348.91084697237267
464,"Im dritten Jahrhundert v. Chr. von den Ägyptern erbaut, ist die Cheops-Pyramide eine von vielen großen Pyramidenstrukturen, die zur Verehrung verstorbener Pharaonen erbaut wurden.",BeetleLM/beetlelm_bul-deu_part_time,step-20000,deu,4.736219882965088,114.00244356723584
465,"Das Gizeh-Plateau beziehungsweise die „Gizeh-Nekropole“ im ägyptischen Tal der Toten umfasst mehrere Pyramiden (von denen die Große Pyramide die größte ist), mehrere kleine Gräber, mehrere Tempel sowie die große Sphinx.",BeetleLM/beetlelm_bul-deu_part_time,step-20000,deu,6.1476616859436035,467.62265873622005
466,"Die große Pyramide wurde dem Pharao Cheops zu Ehren erbaut und viele der kleineren Pyramiden, Grabmale und Tempel wurden zu Ehren von Cheops Ehefrauen und Familienmitgliedern errichtet.",BeetleLM/beetlelm_bul-deu_part_time,step-20000,deu,5.713068962097168,302.79892219557536
467,"Das „Aufstrich“-Symbol sieht wie ein V aus und das „Abstrich“-Symbol wie eine Klammer bzw. ein Quadrat, bei dem der untere Strich fehlt.",BeetleLM/beetlelm_bul-deu_part_time,step-20000,deu,6.658885955810547,779.6818530796269
468,"Aufwärts bedeutet, dass Sie an der Spitze anfangen und den Bogen schieben sollten. Abwärts bedeutet, dass Sie beim Frosch (das ist dort, wo Ihre Hand den Bogen hält) anfangen und den Bogen ziehen.",BeetleLM/beetlelm_bul-deu_part_time,step-20000,deu,5.686977386474609,295.00059889037084
469,"Das Aufstreichen generiert üblicherweise einen weicheren Klang, während das Abstreichen kräftiger und ausdrucksstärker ist.",BeetleLM/beetlelm_bul-deu_part_time,step-20000,deu,7.6159820556640625,2030.3877337895303
470,"Sie können gerne Ihre eigenen Bleistiftmarkierungen hinzufügen; denken Sie aber daran, dass die aufgedruckten Bogenmarkierungen sich dort aus musikalischen Gründen befinden, weshalb sie im Normalfall respektiert werden sollten.",BeetleLM/beetlelm_bul-deu_part_time,step-20000,deu,6.555709362030029,703.2478302380366
471,"Der in Panik versetzte König Ludwig der XIV., Königin Marie-Antoinette, ihre beiden kleinen Kinder (die 11 Jahre alte Marie-Therese und der 4 Jahre alte Louis-Charles) sowie die Schwester des Königs, Madame Elisabeth wurden am 6. Oktober 1789 in Versailles von einem Mob aus Marktfrauen zur Rückkehr nach Paris gezwungen.",BeetleLM/beetlelm_bul-deu_part_time,step-20000,deu,5.9222846031188965,373.2634994647386
472,"Sie reisten in einer Kutsche zurück nach Paris, umgeben von einem schreienden Mob von Menschen, die Drohungen gegen den König und die Königin ausstießen.",BeetleLM/beetlelm_bul-deu_part_time,step-20000,deu,5.980563163757324,395.66312855825726
473,"Der Mob zwang König und Königin dazu, die Fenster ihrer Kutschen weit zu öffnen.",BeetleLM/beetlelm_bul-deu_part_time,step-20000,deu,6.743282794952393,848.3410995516525
474,Irgendwann schwenkte ein Mitglied der aufgebrachten Menge den Kopf einer in Versailles getöteten königlichen Garde vor den Augen der entsetzten Königin.,BeetleLM/beetlelm_bul-deu_part_time,step-20000,deu,6.806848526000977,904.0173258763853
475,Die Kriegsausgaben der US-Imperialisten bei der Eroberung der Philippinen wurden vom philippinischen Volk selbst getragen.,BeetleLM/beetlelm_bul-deu_part_time,step-20000,deu,5.47111701965332,237.72558866198554
476,"Sie wurden gezwungen, Steuern an das Kolonialregime der U.S. zu zahlen, um das Gros der Ausgaben zu decken, und die Zinsen aus Anleihen flossen im Namen der philippinischen Regierung durch die Bankhäuser der Wall Street.",BeetleLM/beetlelm_bul-deu_part_time,step-20000,deu,5.790830612182617,327.28475821498796
477,"Natürlich stellten die Superprofite, die der andauernden Ausbeutung des philippinischen Volkes entstammten, die grundlegenden Gewinne des US-Imperialismus dar.",BeetleLM/beetlelm_bul-deu_part_time,step-20000,deu,6.353270053863525,574.3678552522717
478,"Um die Templer zu verstehen, muss man den Kontext verstehen, der zur Gründung des Ordens führte.",BeetleLM/beetlelm_bul-deu_part_time,step-20000,deu,5.407767295837402,223.13284148738026
479,"Die Epoche, in der die Ereignisse stattfanden, wird gemeinhin als Hochmittelalter bezeichnet, ein Zeitalter in der europäischen Geschichte, das sich über das 11., 12. und 13 Jahrhundert erstreckt (1000–1300 n. Chr.).",BeetleLM/beetlelm_bul-deu_part_time,step-20000,deu,5.371171951293945,215.11482413165493
480,"Dem Hochmittelalter ging das Frühmittelalter voraus, gefolgt vom Spätmittelalter, das übereinstimmend um 1500 endet.",BeetleLM/beetlelm_bul-deu_part_time,step-20000,deu,6.584944248199463,724.1106760676772
481,"Technologischer Determinismus ist ein Begriff, der ein breites Spektrum von Ideen in der Praxis umfasst, vom Technologie-Push oder dem technologischen Imperativ bis hin zu dem strengen Sinn, dass das menschliche Schicksal von einer zugrunde liegenden Logik bestimmt wird, die mit wissenschaftlichen Gesetzen und ihrer Manifestation in der Technologie verbunden ist.",BeetleLM/beetlelm_bul-deu_part_time,step-20000,deu,5.871124744415283,354.64764398530883
482,"Die meisten Interpretationen des technologischen Determinismus teilen zwei allgemeine Vorstellungen. Einerseits, dass die Entwicklung der Technologie selbst einem Weg folgt, der weitgehend jenseits kultureller oder politischer Einflussnahme liegt, und andererseits, dass Technologie ihrerseits „Auswirkungen“ auf Gesellschaften hat, die eher inhärent als sozial bedingt sind.",BeetleLM/beetlelm_bul-deu_part_time,step-20000,deu,6.162450313568115,474.5895444714085
483,"Man kann etwa behaupten, dass der Personenkraftwagen unumgänglich die Entwicklung von Straßen mit sich bringt.",BeetleLM/beetlelm_bul-deu_part_time,step-20000,deu,6.42987060546875,620.0937060869616
484,"Allerdings ist ein landesweites Straßennetz für nur eine kleine Anzahl an Autos wirtschaftlich nicht überlebensfähig. Daher werden neue Produktionsmethoden entwickelt, um die Kosten des Autobesitzes zu reduzieren.",BeetleLM/beetlelm_bul-deu_part_time,step-20000,deu,6.036979675292969,418.62673486036124
485,"Der verbreitete Automobilbesitz führt auch zu einer höheren Anzahl von Unfällen auf den Straßen, was wiederum zur Erfindung von neuen Techniken im Gesundheitswesen zur Reparatur beschädigter Körper führt.",BeetleLM/beetlelm_bul-deu_part_time,step-20000,deu,6.104325771331787,447.79062637555063
486,"Die Romantik hatte ein starkes, kulturell deterministisches Element, das sich aus Schriftstellern wie Goethe, Fichte und Schlegel schöpfte.",BeetleLM/beetlelm_bul-deu_part_time,step-20000,deu,6.17014217376709,478.2540964424414
487,"Im Kontext der Romantik, ist es die Geographie, die Individuen formte. Mit der Zeit entstanden Bräuche und Kulturen mit Bezug zu dieser Geographie und diese, da sie in Harmonie mit dem Platz der Gesellschaft standen, waren besser als willkürlich oktroyierte Gesetze.",BeetleLM/beetlelm_bul-deu_part_time,step-20000,deu,5.572842121124268,263.18102966804446
488,"So wie Paris als Modehauptstadt der heutigen Welt bekannt ist, so galt Konstantinopel als die Modehauptstadt des feudalen Europas.",BeetleLM/beetlelm_bul-deu_part_time,step-20000,deu,5.866269588470459,352.9299475844458
489,Sein Ruhm als Epizentrum des Luxus begann ungefähr um 400 n. Chr. und dauerte bis ungefähr 1100 n. Chr. an.,BeetleLM/beetlelm_bul-deu_part_time,step-20000,deu,5.5006794929504395,244.85825520845796
490,"Sein Status nahm im Laufe des zwölften Jahrhunderts ab, was vor allem darauf zurückzuführen war, dass die Kreuzritter mit Geschenken wie Seide und Gewürzen zurückgekehrt waren, die als wertvoller als das Angebot der byzantinischen Märkte erachtet wurden.",BeetleLM/beetlelm_bul-deu_part_time,step-20000,deu,5.941861152648926,380.6427048733366
491,Zu dieser Zeit wanderte auch der Titel der Modehauptstadt der Welt von Konstantinopel nach Paris.,BeetleLM/beetlelm_bul-deu_part_time,step-20000,deu,5.514993667602539,248.38840434839355
492,Der gotische Stil erreichte seinen Höhepunkt in der Zeit zwischen dem 10.-11. und dem 14. Jahrhundert.,BeetleLM/beetlelm_bul-deu_part_time,step-20000,deu,6.776730537414551,877.1960709166807
493,Zu Beginn war die Kleidung stark von der Kultur Byzanz' im Osten geprägt.,BeetleLM/beetlelm_bul-deu_part_time,step-20000,deu,6.215640068054199,500.5162511479417
494,Allerdings hängen die Stile im Westen aufgrund der langsamen Kommunikationskanäle 25 bis 30 Jahre hinterher.,BeetleLM/beetlelm_bul-deu_part_time,step-20000,deu,6.107137203216553,449.051330581844
495,"Gegen Ende des Mittelalters begann Westeuropa langsam einen eigenen Stil zu entwickeln. Eine der wichtigsten Entwicklungen der Zeit bestand darin, dass die Menschen als Folge der Kreuzzüge damit begannen, Knöpfe zum Fixieren von Kleidung zu nutzen.",BeetleLM/beetlelm_bul-deu_part_time,step-20000,deu,5.829154968261719,340.07118667274216
496,"Bedarfswirtschaft ist Landwirtschaft, die darauf zielt, gerade so viele Nahrungsmittel zu produzieren, dass sie den Bedarf des Landwirts bzw. der Landwirtin und seiner/ihrer Familie deckt.",BeetleLM/beetlelm_bul-deu_part_time,step-20000,deu,6.322185039520264,556.7882686260175
497,"Die Subsistenzwirtschaft ist eine einfache, oftmals biologische Anbauart, die aufgespartes, in der Ökoregion heimisches Saatgut nutzt und mit Wechselfelderwirtschaft oder anderen relativ einfachen Techniken verbindet, um den Ertrag zu maximieren.",BeetleLM/beetlelm_bul-deu_part_time,step-20000,deu,6.134876251220703,461.68195790500215
498,In der Vergangenheit betrieben die meisten Bauern Subsistenzwirtschaft und in vielen Entwicklungsländern ist das nach wie vor der Fall.,BeetleLM/beetlelm_bul-deu_part_time,step-20000,deu,5.968842506408691,391.05276761184047
499,"Subkulturen bringen gleichgesinnte Menschen zusammen, die sich von gesellschaftlichen Normen vernachlässigt fühlen, und ermöglichen es ihnen, ein Identitätsgefühl zu entwickeln.",BeetleLM/beetlelm_bul-deu_part_time,step-20000,deu,6.164129257202148,475.38702283916075
500,"Subkulturen können sich hinsichtlich des Alters, der ethnischen Zugehörigkeit, der Klasse, des Ortes und/oder des Geschlechts der Mitglieder von anderen abgrenzen.",BeetleLM/beetlelm_bul-deu_part_time,step-20000,deu,6.143856525421143,465.8466605777548
501,"Die Eigenschaften, die eine Subkultur als solche abgrenzen, können sprachlicher, ästhetischer, religiöser, politischer, sexueller oder geographischer Natur oder eine Kombination dieser Faktoren sein.",BeetleLM/beetlelm_bul-deu_part_time,step-20000,deu,6.209993362426758,497.6979477692626
502,"Die Mitglieder einer Subkultur signalisieren ihre Zugehörigkeit oft durch einen unverwechselbaren und symbolischen Stil, was Mode, Angewohnheiten und Jargon einschließt.",BeetleLM/beetlelm_bul-deu_part_time,step-20000,deu,6.390181541442871,595.9647621707422
503,"Eine der gängigsten Methoden zur Veranschaulichung der Wichtigkeit der Sozialisierung ist, sich auf die paar unglücklichen Fälle von Kindern zu stützen, die aufgrund von Vernachlässigung, Unglück oder vorsätzlichem Missbrauch während ihrer Kindheit nicht von Erwachsenen sozialisiert worden sind.",BeetleLM/beetlelm_bul-deu_part_time,step-20000,deu,6.232621192932129,509.0881544111482
504,"""Solche Kinder nennt man """"verwildert"""" oder wild. Einige verwilderte Kinder wurden von Menschen gefangen gehalten (für gewöhnlich den eigenen Eltern); in einige Fällen war die Vernachlässigung des Kindes auf die Unfähigkeit der Eltern zurückzuführen, die erheblichen intellektuellen oder körperlichen Einschränkungen des Kindes zu akzeptieren.""",BeetleLM/beetlelm_bul-deu_part_time,step-20000,deu,6.160073280334473,473.4627690736946
505,"Wolfskinder haben möglicherweise massive Kindesmisshandlungen erlebt oder traumatische Erfahrungen gemacht, bevor sie ausgesetzt wurden oder weggelaufen sind.",BeetleLM/beetlelm_bul-deu_part_time,step-20000,deu,6.812292575836182,908.95226208133
506,Andere sollen von Tieren aufgezogen worden sein; einige sollen allein in der Wildnis gelebt haben.,BeetleLM/beetlelm_bul-deu_part_time,step-20000,deu,6.153829574584961,470.5158163865941
507,"Wenn es komplett von Tieren aufgezogen wurde, zeigt das wilde Kind Verhaltensweisen (im Rahmen seiner körperlichen Möglichkeiten), die fast komplett in Übereinstimmung mit denen seines spezifischen Pflegetiers sind, wie z.B. dessen Angst oder Gleichgültigkeit gegenüber Menschen.",BeetleLM/beetlelm_bul-deu_part_time,step-20000,deu,6.594913482666016,731.3656081503785
508,"Während projektbasiertes Lernen den Lernprozess einfacher und interessanter gestalten sollte, geht das „Scaffolding“ einen Schritt weiter.",BeetleLM/beetlelm_bul-deu_part_time,step-20000,deu,7.6709136962890625,2145.040465649987
509,"Scaffolding ist keine Lernmethode, sondern vielmehr eine Hilfe, die Individuen in einer neuartigen Lernsituation unterstützt wie beispielsweise beim Benutzen eines neuen Computerprogramms oder beim Beginn eines neuen Projekts.",BeetleLM/beetlelm_bul-deu_part_time,step-20000,deu,5.822275638580322,337.7397534081224
510,"Gerüste können sowohl virtuell als auch real sein. Mit anderen Worten, ein Lehrer ist eine Form von Gerüst, aber auch das kleine Büroklammermännchen in Microsoft Office.",BeetleLM/beetlelm_bul-deu_part_time,step-20000,deu,6.300507545471191,544.8483752860367
511,"Virtuelle Hilfestellungen sind in die Software eingebaut und sollen Arbeitsschritte, die der Schüler allein möglicherweise nicht bewältigen kann, hinterfragen, nahelegen und erklären.",BeetleLM/beetlelm_bul-deu_part_time,step-20000,deu,6.3188395500183105,554.92865171739
512,"Kinder werden aus einer Vielzahl von Gründen in Pflegefamilien untergebracht, und zwar aus verschiedenen Gründen, die von Vernachlässigung über Missbrauch bis hin zu Erpressung reichen.",BeetleLM/beetlelm_bul-deu_part_time,step-20000,deu,6.554314613342285,702.2676599541575
513,"Kein Kind sollte gezwungen sein, in einer Umgebung aufzuwachsen, die nicht fürsorglich, liebevoll und bildungsorientiert ist, aber viele sind dazu gezwungen.",BeetleLM/beetlelm_bul-deu_part_time,step-20000,deu,5.447835445404053,232.2548930272141
