sentence_id,sentence,repo,revision,iso_code,nll,ppl
202,Le Mexicain Arly Velasquez a terminé quinzième au Super-G masculin assis. Le Néo-Zélandais Adam Hall a terminé à la neuvième place du Super-G masculin debout.,BeetleLM/beetlelm_nld-fra_balanced,step-8000,fra,6.81432580947876,910.802254496171
203,Le skieur polonais malvoyant Maciej Krezel et sa guide Anna Ogarzynska ont terminé à la treizième place du Super-G. Le sud coréen Jong Seork Park a terminé à la vingt-quatrième place du Super-G assis masculin.,BeetleLM/beetlelm_nld-fra_balanced,step-8000,fra,7.352685928344727,1560.3819785954236
204,"Les soldats de la paix de l'ONU, qui sont arrivés en Haïti après le tremblement de terre de 2010, sont accusés de la propagation de la maladie qui a commencé près du campement de la troupe.",BeetleLM/beetlelm_nld-fra_balanced,step-8000,fra,4.446990966796875,85.36967694129399
205,"Selon le procès, les déchets du camp de l'ONU n'ont pas été bien assainis, provoquant l'entrée de bactéries dans l'affluent du fleuve Artibonite, l'un des plus grands fleuves d'Haïti.",BeetleLM/beetlelm_nld-fra_balanced,step-8000,fra,4.271332740783691,71.61701896644543
206,"Avant l'arrivée des troupes, Haïti n'avait pas rencontré de problèmes liés à la maladie depuis les années 1800.",BeetleLM/beetlelm_nld-fra_balanced,step-8000,fra,4.464073657989502,86.84054822086249
207,L'Institut haïtien pour la justice et la démocratie a fait référence à des études indépendantes qui suggèrent que le bataillon népalais de maintien de la paix de l'ONU a involontairement apporté la maladie à Haïti.,BeetleLM/beetlelm_nld-fra_balanced,step-8000,fra,5.6765265464782715,291.9336488489442
208,"Danielle Lantagne, experte de l'ONU sur la maladie, a déclaré que l'épidémie avait probablement été causée par les Casques bleus.",BeetleLM/beetlelm_nld-fra_balanced,step-8000,fra,5.634485721588135,279.9149260841406
209,Hamilton a confirmé que l’hôpital universitaire d’Howard a admis le patient dans un état stable.,BeetleLM/beetlelm_nld-fra_balanced,step-8000,fra,7.067929744720459,1173.7156262932197
210,"Le patient s'était rendu au Nigeria, où certains cas de virus Ebola se sont produits.",BeetleLM/beetlelm_nld-fra_balanced,step-8000,fra,5.686592102050781,294.886961647334
211,"L'hôpital a respecté le protocole pour la prévention des infections, notamment l'isolement du patient afin d'éviter une possible infection d'autres patients.",BeetleLM/beetlelm_nld-fra_balanced,step-8000,fra,5.406558513641357,222.86328543134
212,"Avant les Simpsons, Simon avait travaillé sur plusieurs séries, occupant divers postes.",BeetleLM/beetlelm_nld-fra_balanced,step-8000,fra,6.495792865753174,662.3491711508985
213,"Pendant les années 1980, il a travaillé sur des spectacles tels que Taxi, Cheers et The Tracy Ullman Show.",BeetleLM/beetlelm_nld-fra_balanced,step-8000,fra,4.806820869445801,122.34205724164013
214,"En 1989, il a participé à la création des Simpsons avec Brooks et Groening et a été responsable de l'embauche de la première équipe de scénaristes de la série.",BeetleLM/beetlelm_nld-fra_balanced,step-8000,fra,4.370635986328125,79.09391835776928
215,"Malgré son départ de l'émission en 1993, il a conservé le titre de producteur exécutif et a continué à recevoir des dizaines de millions de dollars chaque saison en redevances.",BeetleLM/beetlelm_nld-fra_balanced,step-8000,fra,4.994251251220703,147.56241683010515
216,L’agence de presse chinoise Xinhua a annoncé précédemment la nouvelle du détournement d'un avion.,BeetleLM/beetlelm_nld-fra_balanced,step-8000,fra,6.663760185241699,783.4914782659898
217,Des rapports ultérieurs ont ensuite révélé que l’appareil avait fait l'objet d'une menace d’attaque à la bombe et été redirigé vers l’Afghanistan pour atterrir à Kandahar.,BeetleLM/beetlelm_nld-fra_balanced,step-8000,fra,5.679492473602295,292.8007880766931
218,Les premiers rapports indiquent que l’avion a été détourné vers l’Afghanistan après s’être vu refuser un atterrissage d’urgence à Ürümqi.,BeetleLM/beetlelm_nld-fra_balanced,step-8000,fra,6.562159538269043,707.7985634206237
219,"Les accidents aériens sont fréquents en Iran, qui dispose d'une flotte vieillissante et mal entretenue autant pour les vols civils que militaires.",BeetleLM/beetlelm_nld-fra_balanced,step-8000,fra,6.1941094398498535,489.8550053418726
220,"En raison des sanctions internationales, il n'est pas possible d'acheter de nouveaux avions.",BeetleLM/beetlelm_nld-fra_balanced,step-8000,fra,4.5131049156188965,91.20456180480775
221,"Au début de cette semaine, l'accident d'un hélicoptère de la police a tué trois personnes et en a blessé trois autres.",BeetleLM/beetlelm_nld-fra_balanced,step-8000,fra,4.434010028839111,84.2686600380055
222,"Le mois dernier, l'Iran a connu sa pire catastrophe aérienne depuis des années lorsqu'un avion de ligne se dirigeant vers l'Arménie s'est écrasé, tuant les 168 personnes à bord.",BeetleLM/beetlelm_nld-fra_balanced,step-8000,fra,5.1148481369018555,166.47549757873168
223,"Le même mois, un autre avion de ligne a fait une sortie de piste à Mashhad et a heurté un mur, tuant ainsi dix-sept personnes.",BeetleLM/beetlelm_nld-fra_balanced,step-8000,fra,5.991335868835449,399.9485320024644
224,Le groupe Aerosmith a annulé les derniers concerts de sa tournée.,BeetleLM/beetlelm_nld-fra_balanced,step-8000,fra,6.443004131317139,628.2914375282908
225,Le groupe de rock devait faire une tournée aux États-Unis et au Canada jusqu'au 16 septembre.,BeetleLM/beetlelm_nld-fra_balanced,step-8000,fra,4.315422058105469,74.84520580444375
226,Ils ont annulé la tournée après que le chanteur Steven Tyler se soit blessé en tombant de scène lors d'un concert le 5 août dernier.,BeetleLM/beetlelm_nld-fra_balanced,step-8000,fra,6.052461624145508,425.15832295123835
227,Murray a perdu le premier set au tie break après que les deux hommes ont gardé leur service pendant tout le set.,BeetleLM/beetlelm_nld-fra_balanced,step-8000,fra,6.2694220542907715,528.1720348890531
228,"Malgré le net avantage de Del Potro pendant le deuxième set, il a fallu passer par un tie-break une fois que le score a atteint 6-6.",BeetleLM/beetlelm_nld-fra_balanced,step-8000,fra,6.224196910858154,504.8174661959652
229,"Potro a reçu à ce moment des soins pour son épaule, mais a réussi à reprendre le match.",BeetleLM/beetlelm_nld-fra_balanced,step-8000,fra,5.383944988250732,217.88011672602943
230,"Le programme a démarré à 20 h 30, heure locale (15 h 00 UTC).",BeetleLM/beetlelm_nld-fra_balanced,step-8000,fra,6.45221471786499,634.1051027240558
231,"Des chanteurs célèbres dans tout le pays ont présenté des bhajans, ou chants de dévotion, aux pieds de Shri Shyam.",BeetleLM/beetlelm_nld-fra_balanced,step-8000,fra,6.021628379821777,412.2493479785236
232,"La chanteuse Sanju Sharma a commencé la soirée, suivie par Jai Shankar Choudhary. Lakkha Singh a également présenté le bhajan de Chhappan Bhog. Le chanteur Raju Khandelwal l’accompagnait.",BeetleLM/beetlelm_nld-fra_balanced,step-8000,fra,7.218242168426514,1364.0891130623645
233,"Ensuite, Lakkha Singh a pris l'initiative de chanter les bhajans.",BeetleLM/beetlelm_nld-fra_balanced,step-8000,fra,6.053332328796387,425.52867148909144
234,"108 assiettes de Chhappan Bhog (dans l'hindouisme, 56 aliments comestibles différents, comme des sucreries, des fruits, des noix, des plats etc. qui sont offerts à la divinité) ont été servis à Baba Shyam.",BeetleLM/beetlelm_nld-fra_balanced,step-8000,fra,5.94158935546875,380.53926131796766
235,"Quant à Lakkha Singh, il a lui aussi présenté le chhappan bhog bhajan, tout en étant accompagné du chanteur Raju Khandelwal.",BeetleLM/beetlelm_nld-fra_balanced,step-8000,fra,7.543308734893799,1888.066814081818
236,"Jeudi, lors de la présentation principale du Tokyo Game Show, le président de Nintendo, Satoru Iwata, a dévoilé le design de la manette de la nouvelle console Nintendo Revolution de la société.",BeetleLM/beetlelm_nld-fra_balanced,step-8000,fra,5.13811731338501,170.39466639133508
237,"Identique à une télécommande de télévision, la commande utilise deux capteurs placés près du téléviseur de l'utilisateur pour trianguler sa position dans l'espace tridimensionnel.",BeetleLM/beetlelm_nld-fra_balanced,step-8000,fra,5.852231502532959,348.01010006651785
238,Cela permettra aux joueurs de contrôler les actions et les mouvements dans les jeux vidéo en déplaçant l’appareil dans l’air.,BeetleLM/beetlelm_nld-fra_balanced,step-8000,fra,5.737378120422363,310.2499057887692
239,Giancarlo Fisichella a perdu le contrôle de sa voiture et a terminé la course peu après le démarrage.,BeetleLM/beetlelm_nld-fra_balanced,step-8000,fra,5.848299980163574,346.64457662520476
240,"Son coéquipier Fernando Alonso a dominé pendant toute la course, mais son arrêt au stand a mis fin à cette domination, sans doute en raison d'une roue avant droite mal fixée.",BeetleLM/beetlelm_nld-fra_balanced,step-8000,fra,5.5891499519348145,267.50812827115703
241,"Michael Schumacher a terminé sa course peu de temps après Alonso, en raison des dommages subis au niveau des suspensions tout au long de la course.",BeetleLM/beetlelm_nld-fra_balanced,step-8000,fra,5.66340446472168,288.1278959505057
242,"« Elle est très jolie, et elle chante très bien aussi », a-t-il déclaré selon une transcription de la conférence de presse.",BeetleLM/beetlelm_nld-fra_balanced,step-8000,fra,5.014863014221191,150.6355004311641
243,"« J’ai été ému à chaque fois que nous avons fait une répétition sur ce sujet, du fond du cœur. »",BeetleLM/beetlelm_nld-fra_balanced,step-8000,fra,4.63991641998291,103.53569370659109
244,"Environ trois minutes après le lancement, une caméra embarquée montrait de nombreux morceaux de mousse isolante en train de se détacher du réservoir de carburant.",BeetleLM/beetlelm_nld-fra_balanced,step-8000,fra,6.311174392700195,550.691297043739
245,On ne pense cependant pas qu'ils aient causé le moindre dégât à la navette.,BeetleLM/beetlelm_nld-fra_balanced,step-8000,fra,5.422728538513184,226.49628397863987
246,"Le chef du programme de la navette de la NASA, N. Wayne Hale Jr., a dit que la mousse était tombée « après le temps qui nous préoccupe ».",BeetleLM/beetlelm_nld-fra_balanced,step-8000,fra,5.4031853675842285,222.11280147639616
247,"Cinq minutes après le début de l'exposition, un vent se met à souffler pour atteindre, environ une minute plus tard, la vitesse de 70km/h... puis la pluie arrive, mais si forte et si grosse qu'elle frappe votre peau comme une aiguille, puis la grêle tombe du ciel, les gens paniquent, crient et se roulent dessus.",BeetleLM/beetlelm_nld-fra_balanced,step-8000,fra,5.467843055725098,236.94855634185788
248,"J'ai perdu ma sœur et son amie, et sur mon chemin, il y avait deux personnes handicapées en fauteuil roulant, des gens qui ne faisaient que sauter et les pousser », a déclaré Armand Versace.",BeetleLM/beetlelm_nld-fra_balanced,step-8000,fra,5.281798839569092,196.72343115350478
249,"La NHK a également fait savoir que la centrale nucléaire de Kashiwazaki Kariwa, dans la préfecture de Niigata, fonctionnait normalement.",BeetleLM/beetlelm_nld-fra_balanced,step-8000,fra,6.108471870422363,449.65106480026657
250,Hokuriku Electric Power Co. n'a signalé aucun effet du tremblement de terre et que les réacteurs numéro 1 et 2 de sa centrale nucléaire de Shika ont été arrêtés.,BeetleLM/beetlelm_nld-fra_balanced,step-8000,fra,6.340617656707764,567.1465050638616
251,"On signale qu'environ 9 400 habitations de la région sont privées d'eau, et qu'environ 100 sont privées d'électricité.",BeetleLM/beetlelm_nld-fra_balanced,step-8000,fra,5.2265167236328125,186.14328444605542
252,"Certaines routes ont été endommagées, le service ferroviaire a été suspendu dans les zones affectées, et l’aéroport de Noto de la préfecture d’Ishikawa est toujours fermé.",BeetleLM/beetlelm_nld-fra_balanced,step-8000,fra,5.909535884857178,368.5350730034183
253,Une bombe a explosé devant le bureau du gouverneur général.,BeetleLM/beetlelm_nld-fra_balanced,step-8000,fra,6.075974941253662,435.27366196714183
254,Trois autres bombes ont explosé près des bâtiments du gouvernement en l'espace de deux heures.,BeetleLM/beetlelm_nld-fra_balanced,step-8000,fra,5.114930629730225,166.48923117983512
255,"Certains rapports portent le nombre officiel de morts à huit, et des rapports officiels confirment que jusqu'à 30 personnes ont été blessées ; mais les chiffres définitifs ne sont pas encore connus.",BeetleLM/beetlelm_nld-fra_balanced,step-8000,fra,5.540846347808838,254.89363686460683
256,De l'acide cyanurique et de la mélamine ont été découverts dans les échantillons d'urine prélevés sur les animaux domestiques qui sont morts après avoir ingéré de la nourriture pour animaux contaminée.,BeetleLM/beetlelm_nld-fra_balanced,step-8000,fra,5.758042812347412,316.7278261052187
257,"Les deux composés réagissent l'un avec l'autre pour former des cristaux qui peuvent bloquer la fonction rénale, ont déclaré des chercheurs de l'université.",BeetleLM/beetlelm_nld-fra_balanced,step-8000,fra,5.481212615966797,240.13772573229437
258,"Les enquêteurs ont découvert que des cristaux s'étaient formés dans l'urine des chats en raison de la présence de ces substances supplémentaires, la mélamine et l'acide cyanurique.",BeetleLM/beetlelm_nld-fra_balanced,step-8000,fra,5.233649253845215,187.47570315588254
259,La composition de ces cristaux correspond à ce qui est trouvé dans l’urine des animaux domestiques affectés lorsqu’on compare par spectroscopie infrarouge (IRTF).,BeetleLM/beetlelm_nld-fra_balanced,step-8000,fra,6.601763725280762,736.3928392236583
260,"Je ne sais pas si vous vous en rendez compte, mais la plupart des marchandises en provenance d'Amérique centrale sont entrées dans notre pays exonérées de taxes.",BeetleLM/beetlelm_nld-fra_balanced,step-8000,fra,5.2921576499938965,198.7718431215356
261,"Pourtant, 80 % de nos marchandises étaient taxées par des droits de douane dans les pays d’Amérique centrale. Nous vous soignons.",BeetleLM/beetlelm_nld-fra_balanced,step-8000,fra,5.718760013580322,304.5270793020628
262,Cela ne me semblait pas logique ; ce n'était certainement pas juste.,BeetleLM/beetlelm_nld-fra_balanced,step-8000,fra,4.882673263549805,131.98301809963417
263,"Tout ce que je dis aux gens, c’est que vous nous traitez comme nous vous traitons.",BeetleLM/beetlelm_nld-fra_balanced,step-8000,fra,5.0371503829956055,154.03046122184415
264,"Le gouverneur de Californie, Arnold Schwarzenegger, a promulgué une loi qui interdit la vente ou la location de jeux vidéo violents aux mineurs.",BeetleLM/beetlelm_nld-fra_balanced,step-8000,fra,6.375577449798584,587.3244834440561
265,Le projet de loi exige que les jeux vidéo violents vendus dans l'État de Californie soient étiquetés avec un autocollant portant la mention « 18 » et rend leur vente à un mineur passible d'une amende de 1000 dollars par infraction.,BeetleLM/beetlelm_nld-fra_balanced,step-8000,fra,5.941125869750977,380.3629276725145
266,"Le directeur des poursuites publiques, Kier Starmer QC, a fait une déclaration ce matin annonçant la poursuite de Huhne et Pryce.",BeetleLM/beetlelm_nld-fra_balanced,step-8000,fra,6.508667945861816,670.9321042005639
267,Huhne a démissionné et il sera remplacé au sein du cabinet par le député Ed Davey. Le député Norman Lamb devrait prendre le poste de ministre des Affaires auquel Davey se désiste.,BeetleLM/beetlelm_nld-fra_balanced,step-8000,fra,6.619410991668701,749.5035032656609
268,Huhne et Pryce doivent comparaître devant la Magistrates Court de Westminster le 16 février.,BeetleLM/beetlelm_nld-fra_balanced,step-8000,fra,7.136446475982666,1256.953827960285
269,"Les victimes sont Nicholas Alden, 25 ans, et Zachary Cuddeback, 21 ans. Cuddeback était le conducteur.",BeetleLM/beetlelm_nld-fra_balanced,step-8000,fra,6.131127834320068,459.9546208634666
270,Edgar Veguilla a été blessé au bras et à la mâchoire tandis que Kristoffer Schneider a dû subir une chirurgie reconstructive pour son visage.,BeetleLM/beetlelm_nld-fra_balanced,step-8000,fra,6.387495040893555,594.3658512090354
271,"L'arme d'Uka s'est enrayée alors qu'elle était pointée sur la tête d'un cinquième homme. Schneider souffre d'une douleur lancinante, ne voit plus d'un œil, a perdu une partie de son crâne, et son visage a été reconstruit à partir de titane.",BeetleLM/beetlelm_nld-fra_balanced,step-8000,fra,4.77996301651001,119.09994523172935
272,Schneider a témoigné par liaison vidéo depuis une base de l’USAF dans son pays.,BeetleLM/beetlelm_nld-fra_balanced,step-8000,fra,6.179722309112549,482.8578525083638
273,"À part l'événement de mercredi, Carpanedo a participé à deux courses individuelles lors des Championnats.",BeetleLM/beetlelm_nld-fra_balanced,step-8000,fra,6.283511638641357,535.6664318154285
274,"Elle a d'abord participé au slalom, où elle a obtenu un « did not finish » (DNF) lors de sa première course. 36 des 116 concurrents ont obtenu le même résultat dans cette course.",BeetleLM/beetlelm_nld-fra_balanced,step-8000,fra,5.75002384185791,314.1981512640725
275,"Son autre course, le slalom géant, lui a permis de terminer à la dixième place du groupe des femmes assises avec un temps combiné de 4:41.30, soit 2:11.60 minutes de moins que l'Autrichienne Claudia Loesch, arrivée première, et 1:09.02 minutes de moins que la Hongroise Gyöngyi Dani, arrivée neuvième.",BeetleLM/beetlelm_nld-fra_balanced,step-8000,fra,6.325560092926025,558.670633522527
276,"Dans la catégorie des femmes en ski assis, quatre skieuses ne sont pas parvenues à terminer leur parcours ; en ce qui concerne le slalom géant, 45 skieuses sur un total de 117 dans cette course n'ont pas réussi à se classer.",BeetleLM/beetlelm_nld-fra_balanced,step-8000,fra,5.8550639152526855,348.99720558572756
277,La police du Madhya Pradesh a retrouvé l'ordinateur portable et le téléphone mobile volés.,BeetleLM/beetlelm_nld-fra_balanced,step-8000,fra,5.992899417877197,400.5743602755276
278,"L'inspecteur général adjoint D.K. Arya a déclaré : « Nous avons arrêté cinq personnes pour avoir violé la ressortissante suisse, et nous avons récupéré son téléphone et son ordinateur portables. »",BeetleLM/beetlelm_nld-fra_balanced,step-8000,fra,6.393052101135254,597.6779723547392
279,"Les accusés s'appellent Baba Kanjar, Bhutha Kanjar, Rampro Kanjar, Gaza Kanjar et Vishnu Kanjar.",BeetleLM/beetlelm_nld-fra_balanced,step-8000,fra,7.762884140014648,2351.677400628723
280,"Chandra Shekhar Solanki, commissaire de police, a déclaré que les personnes accusées avaient le visage dissimulé lorsqu'elles ont comparu devant le tribunal.",BeetleLM/beetlelm_nld-fra_balanced,step-8000,fra,6.344274997711182,569.224550976686
281,"Bien que trois personnes aient été présentes dans la maison quand la voiture l'a percutée, aucune n'a été blessée.",BeetleLM/beetlelm_nld-fra_balanced,step-8000,fra,5.2777018547058105,195.9191070108022
282,"Cependant, le conducteur a été grièvement blessé à la tête.",BeetleLM/beetlelm_nld-fra_balanced,step-8000,fra,5.170298099517822,175.9672854292623
283,La voie où l'accident a eu lieu a été temporairement barrée pour permettre aux services de secours d'extraire le conducteur de l'Audi TT rouge.,BeetleLM/beetlelm_nld-fra_balanced,step-8000,fra,5.351772785186768,210.98199227943294
284,Il a d'abord été hospitalisé à l'hôpital James Paget de Great Yarmouth.,BeetleLM/beetlelm_nld-fra_balanced,step-8000,fra,5.199034214019775,181.09725619830238
285,Il a ensuite été transféré au centre hospitalier Addenbrooke's Hospital de Cambridge.,BeetleLM/beetlelm_nld-fra_balanced,step-8000,fra,6.694755554199219,808.1563596348926
286,Adekoya a depuis été inculpée pour le meurtre de son fils par le tribunal Sheriff Court d'Édimbourg.,BeetleLM/beetlelm_nld-fra_balanced,step-8000,fra,5.743443965911865,312.1375530809094
287,"Elle se trouve en garde en vue en attendant sa mise en examen et son procès, mais les témoignages oculaires pourraient être compromis car son portrait a été très diffusé.",BeetleLM/beetlelm_nld-fra_balanced,step-8000,fra,5.589794158935547,267.68051440035606
288,"Il s'agit d'une pratique courante ailleurs au Royaume-Uni, mais la justice écossaise fonctionne différemment et les tribunaux ont considéré que la publication de photos était potentiellement préjudiciable.",BeetleLM/beetlelm_nld-fra_balanced,step-8000,fra,5.557288646697998,259.11931899076046
289,"La professeur Pamela Ferguson, de l’université de Dundee, note que « les journalistes semblent suivre une ligne dangereuse s’ils publient des photos, etc. de suspects ».",BeetleLM/beetlelm_nld-fra_balanced,step-8000,fra,6.574032783508301,716.2525179665114
290,"Le bureau du Procureur de la Couronne, qui est en charge de l’ensemble des poursuites, a précisé aux journalistes qu’aucun autre commentaire ne sera fait au moins jusqu’à la mise en accusation.",BeetleLM/beetlelm_nld-fra_balanced,step-8000,fra,5.543978691101074,255.69330299886735
291,"D'après la fuite, le document portera sur le différend à la frontière que la Palestine revendique sur la base des frontières existantes avant la guerre du Moyen-Orient de 1967.",BeetleLM/beetlelm_nld-fra_balanced,step-8000,fra,5.347299575805664,210.0403333413071
292,"Parmi les autres sujets abordés figurent le futur État de Jérusalem, qui est sacré pour les deux nations, et la question de la vallée du Jourdain.",BeetleLM/beetlelm_nld-fra_balanced,step-8000,fra,4.956956386566162,142.16045529937105
293,"Israël exige une présence militaire permanente dans la vallée pour une durée de dix années à compter de la signature d'un accord, tandis que l'Autorité palestinienne ne consent qu'à une durée de cinq ans.",BeetleLM/beetlelm_nld-fra_balanced,step-8000,fra,5.464202880859375,236.08759014705686
294,"Les tireurs de l’essai supplémentaire de lutte contre les parasites devaient être étroitement surveillés par des rangers, car l’essai était contrôlé et son efficacité évaluée.",BeetleLM/beetlelm_nld-fra_balanced,step-8000,fra,6.68215799331665,798.0394188752964
295,"Dans le cadre d’un partenariat entre NPWS et le Sporting Shooters Association of Australia (NSW) inc., des bénévoles qualifiés ont été recrutés, dans le cadre du programme de chasse de la Sporting Shooters Association.",BeetleLM/beetlelm_nld-fra_balanced,step-8000,fra,6.551875591278076,700.5569007743263
296,"Selon Mick O'Flynn, responsable par intérim de la conservation du parc et du patrimoine au NPWS, les quatre tireurs désignés pour la première campagne d'abattage ont été dûment entraînés et formés aux consignes de sécurité.",BeetleLM/beetlelm_nld-fra_balanced,step-8000,fra,6.119875431060791,454.8080360160644
297,Martelly a intronisé hier un nouveau Conseil électoral provisoire (CEP) composé de neuf membres.,BeetleLM/beetlelm_nld-fra_balanced,step-8000,fra,6.71811056137085,827.2529901577152
298,C’est le cinquième PEC de Martelly en quatre ans.,BeetleLM/beetlelm_nld-fra_balanced,step-8000,fra,6.31178617477417,551.0283031842108
299,"Le mois dernier, une commission présidentielle a recommandé la dissolution du précédent CEP dans le cadre d’un ensemble de mesures visant à engager le pays sur la voie de nouvelles élections.",BeetleLM/beetlelm_nld-fra_balanced,step-8000,fra,6.113834381103516,452.0688002102275
300,Cette commission a été la réponse de Martelly aux vastes protestations contre le régime qui ont commencé en octobre.,BeetleLM/beetlelm_nld-fra_balanced,step-8000,fra,5.767165660858154,319.6305063061887
301,"Ces protestations parfois violentes ont été déclenchées par l’absence d’élections, dont certaines devaient avoir lieu en 2011.",BeetleLM/beetlelm_nld-fra_balanced,step-8000,fra,5.9396843910217285,379.8150375837045
302,"Environ 60 cas de surchauffe d’iPods défectueux ont été signalés, provoquant au total six incendies et laissant quatre personnes avec des brûlures mineures.",BeetleLM/beetlelm_nld-fra_balanced,step-8000,fra,6.831202507019043,926.3040301168853
303,"Le ministère japonais de l'économie, du commerce et de l'industrie (METI) a déclaré qu'il avait eu connaissance de 27 accidents liés à ces appareils.",BeetleLM/beetlelm_nld-fra_balanced,step-8000,fra,4.951404571533203,141.37339357870368
304,"La semaine dernière, le METI a annoncé qu’Apple l’avait informé de 34 incidents de surchauffe supplémentaires, que la société a qualifiés de « non graves ».",BeetleLM/beetlelm_nld-fra_balanced,step-8000,fra,6.676107883453369,793.2257689544633
305,Le ministère a réagi en qualifiant de « vraiment regrettable » l'ajournement du rapport par Apple.,BeetleLM/beetlelm_nld-fra_balanced,step-8000,fra,7.080349445343018,1188.3837211166215
306,Le tremblement de terre a frappé les Mariannes à 7 h 19 heure locale (21 h 19 GMT vendredi).,BeetleLM/beetlelm_nld-fra_balanced,step-8000,fra,6.867434024810791,960.4808311106748
307,Le Bureau de gestion des urgences des îles Mariannes du Nord a déclaré qu'aucun dégât n'avait été signalé dans ce pays.,BeetleLM/beetlelm_nld-fra_balanced,step-8000,fra,5.423318862915039,226.6300297348098
308,"De plus, le Centre d'alerte des tsunamis dans le Pacifique a déclaré qu'il n'y avait aucun signe de tsunami.",BeetleLM/beetlelm_nld-fra_balanced,step-8000,fra,5.100636959075928,164.12641582270004
309,"Un ancien policier philippin a pris en otage des touristes de Hong Kong en détournant leur bus à Manille, la capitale des Philippines.",BeetleLM/beetlelm_nld-fra_balanced,step-8000,fra,6.407293319702148,606.250531954572
