sentence_id,sentence,repo,revision,iso_code,nll,ppl
499,خرده‌فرهنگ‌ها افراد هم‌عقیده را که احساس می‌کنند طبق معیارهای جامعه به آنها بی‌توجهی می‌شود کنار یکدیگر جمع می‌کنند و به آنها ایجاد توسعه حس هویت می‌دهند.,BeetleLM/beetlelm_fas-fra_balanced,step-8000,fas,8.806841850280762,6679.790142746951
500,خرده فرهنگ‌ها بنا به سن، قومیت، طبقه، محل زندگی و/یا جنسیت اعضا می‌توانند متمایز باشند.,BeetleLM/beetlelm_fas-fra_balanced,step-8000,fas,7.306427001953125,1489.844456609566
501,خصوصیاتی که یک خرده فرهنگ را متمایز می‌کند ممکن است خصوصیات زبانی، زیبایی شناختی، مذهبی، سیاسی، جنسی، جغرافیایی یا ترکیبی از این خصوصیات باشد.,BeetleLM/beetlelm_fas-fra_balanced,step-8000,fas,6.388897895812988,595.2002453975026
502,اعضای یک خرده فرهنگ اغلب عضویت خود را از طریق استفاده متمایز و نمادین از سبک، که شامل مد، اطوار و گویش عامدانه است، نشان می‌دهند.,BeetleLM/beetlelm_fas-fra_balanced,step-8000,fas,6.596562385559082,732.572553812182
503,یکی از معمول‌ترین روش‌هایی که برای شرح اهمیت جامعه‌پذیری استفاده می‌شود کمک گرفتن از موارد تأسف‌بار کودکانی است که در جریان رشد بخاطر غفلت، بداقبالی، یا تعرض عمدی از بزرگسالان جامعه‌پذیری را یاد نگرفتند.,BeetleLM/beetlelm_fas-fra_balanced,step-8000,fas,7.556048393249512,1912.2740085403652
504,این نوع از بچه‌ها «وحشی» نامیده می‌شوند. برخی از این کودکان وحشی توسط مردم (معمولا والدین خودشان) محبوس می‌شوند؛ در برخی از موارد این رهاسازی کودک بدلیل انکار والدین به نقص عقلانی و فیزیکی شدید کودک می‌باشد.,BeetleLM/beetlelm_fas-fra_balanced,step-8000,fas,7.825891971588135,2504.6191639155304
505,کودکان وحشی ممکن است قبل از ترک شدن یا فرار کردن کودک آزاری شدید یا ضربه‌ای عاطفی را تجربه کرده باشند.,BeetleLM/beetlelm_fas-fra_balanced,step-8000,fas,6.248574733734131,517.2750443556432
506,ادعا می‌شود که بقیه توسط حیوانات بزرگ شده‌اند؛ گفته شده است برخی به تنهایی در حیات وحش زندگی کرده‌اند.,BeetleLM/beetlelm_fas-fra_balanced,step-8000,fas,7.043607234954834,1145.5122947876807
507,اگر کاملا توسط حیواناتی غیر از انسان پرورش داده شود، کودک وحشی رفتارهایی (در محدوده فیزیکی) تقریباً مانند رفتار حیوانات از خود نشان می‌دهد، مانند ترس و بی تفاوتی نسبت به انسان.,BeetleLM/beetlelm_fas-fra_balanced,step-8000,fas,6.995528221130371,1091.7402056977955
508,گرچه یادگیری مبتنی بر پروژه باید یادگیری را آسان‌تر و جالب‌تر کند، سکوب‌بندی یک گام از آن فراتر می‌رود.,BeetleLM/beetlelm_fas-fra_balanced,step-8000,fas,7.596735000610352,1991.68242574919
509,داربست سازی روشی برای یادگیری نیست بلکه کمکی است که از افرادی که در حال دریافت یک تجربه یادگیری جدید مانند استفاده از یک برنامه جدید کامپیوتری یا شروع یک پروژه جدید هستند، پشتیبانی می کند.,BeetleLM/beetlelm_fas-fra_balanced,step-8000,fas,5.49270486831665,242.91336771556513
510,داربست‌ها ممکن است مجازی یا واقعی باشند،‌ به عبارت دیگر یک معلم نوعی از داربست است ولی گیره کاغذ کوچک در Microsoft Office نیز داربست است.,BeetleLM/beetlelm_fas-fra_balanced,step-8000,fas,6.911715030670166,1003.9676018629054
511,داربست های مجازی در نرم افزار درونی شده اند و هدف آن پرسش، برانگیختن و توضیح روش هایی است که ممکن است انجام آن به تنهایی برای دانشجویان چالش محسوب می‌شود.,BeetleLM/beetlelm_fas-fra_balanced,step-8000,fas,6.0306901931762695,416.002052097704
512,کودکان به دلایل متعددی به خانه‌های پرستاری سپرده می‌شوند. دامنه این دلایل از غفلت تا تعرض، و حتی اخاذی گسترش دارد.,BeetleLM/beetlelm_fas-fra_balanced,step-8000,fas,7.6396918296813965,2079.1030000021974
513,هیچ کودکی نباید مجبور شود در محیطی فاقد تغذیه، مراقبت و تربیت رشد کند، اما این اتفاق می‌افتد.,BeetleLM/beetlelm_fas-fra_balanced,step-8000,fas,6.945428848266602,1038.3922144349272
514,ما سیستم مراقبت از کودکان بی‌سرپرست را منطقه‌ای امن برای این کودکان می‌دانیم.,BeetleLM/beetlelm_fas-fra_balanced,step-8000,fas,8.11670970916748,3349.9801826256503
515,سیستم پرورش و مراقبت ما می‌کوشد خانه‌های امن، مراقب‌های با محبت، آموزش پایدار و مراقبت‌های بهداشتی قابل اطمینان را فراهم کند.,BeetleLM/beetlelm_fas-fra_balanced,step-8000,fas,7.526006698608398,1855.6803969677069
516,برای فرزند‌خواندگی لازم است تمام فقدان نیازهای فرزند‌خوانده در خانه قبلی که از آن آورده شده است فراهم شود.,BeetleLM/beetlelm_fas-fra_balanced,step-8000,fas,6.941073894500732,1033.8798969488125
517,اینترنت عناصر ارتباط جمعی و بین فردی را با هم ترکیب می‌کند.,BeetleLM/beetlelm_fas-fra_balanced,step-8000,fas,7.221521854400635,1368.5702413239694
518,خصوصیات متمایز اینترنت منجر به ابعاد اضافی از لحاظ رویکرد کاربرد و رضایت‌مندی شده است.,BeetleLM/beetlelm_fas-fra_balanced,step-8000,fas,6.844813823699951,938.998445478982
519,برای مثال، به «یادگیری» و «جامعه پذیری» به عنوان انگیزه مهمی برای استفاده از اینترنت اشاره می‌شود (جیمز و سایرین، 1995).,BeetleLM/beetlelm_fas-fra_balanced,step-8000,fas,6.418006420135498,612.7802692049972
520,«درگیری شخصی» و «روابط مداوم» همچنین توسط ایمی و مککورد (1998) به عنوان جنبه های انگیزشی جدید شناخته می‌شد زمانیکه آنها در مورد واکنش مخاطبان به وب سایت ها تحقیق می‌کردند.,BeetleLM/beetlelm_fas-fra_balanced,step-8000,fas,7.130606174468994,1249.6342337402334
521,استفاده از ضبط ویدئویی منجر به اکتشافات مهمی در زمینه تفسیر میکرو بیان و حرکات صورت شد که تنها چند میلی ثانیه طول می‌کشند.,BeetleLM/beetlelm_fas-fra_balanced,step-8000,fas,7.477880954742432,1768.4892937047687
522,به ویژه، ادعا می شود که با تفسیر صحیح عبارات کوچک می‌توان تشخیص داد که فرد دروغ می‌گوید.,BeetleLM/beetlelm_fas-fra_balanced,step-8000,fas,7.664623260498047,2131.5895766622493
523,الیور ساکس، در مقاله خود «سخنان رئیس جمهور»، نشان داد که چگونه افرادی که به دلیل آسیب مغزی قادر به درک گفتار نیستند، باز هم قادر هستند خلوص نیت را به طور دقیق ارزیابی کنند.,BeetleLM/beetlelm_fas-fra_balanced,step-8000,fas,5.749372482299805,313.99356193294915
524,او حتی اظهار می‌دارد که چنین توانایی‌هایی در تفسیر رفتار انسانی می‌تواند در حیواناتی مثل سگ‌های خانگی مشترک باشد.,BeetleLM/beetlelm_fas-fra_balanced,step-8000,fas,8.2863187789917,3969.195780550584
525,تحقیقات قرن بیستم نشان داد که دو منبع تغییرات ژنتیکی وجود دارد: پنهان و بیان شده.,BeetleLM/beetlelm_fas-fra_balanced,step-8000,fas,5.904414176940918,366.6523694470229
526,جهش تنوع ژنتیکی جدید می‌افزاید و انتخاب آن را از خزانه تنوع بیان‌شده خارج می‌کند.,BeetleLM/beetlelm_fas-fra_balanced,step-8000,fas,9.166276931762695,9568.932500353538
527,تفکیک و ترکیب مجدد اختلاف بین دو استخر با هر نسل را به سمت جلو و عقب بر می‌زند.,BeetleLM/beetlelm_fas-fra_balanced,step-8000,fas,6.897085189819336,989.3866343111335
528,در خارج از ساوانا، برآورده کردن نيازهاي مبتنی بر اسيد آمینه از منابع گياهي موجود برای یک نخستی که دستگاه گوارشی مشابه انسان داشته، کار دشواری بوده است.,BeetleLM/beetlelm_fas-fra_balanced,step-8000,fas,6.6692795753479,787.8278293777114
529,از این گذشته، عدم انجام این امر عواقب جدی دارد: افسردگی رشد، سوء تغذیه و در نهایت مرگ.,BeetleLM/beetlelm_fas-fra_balanced,step-8000,fas,6.5839409828186035,723.3845651963228
530,بیشترین منابع گیاهی قابل دسترسی پروتئین های موجود در برگ ها و حبوبات می باشد، اما هضم اینهت توسط پستاندارانی مانند ما سخت است، مگر اینکه پخته شوند.,BeetleLM/beetlelm_fas-fra_balanced,step-8000,fas,6.251367568969727,518.721727559592
531,در مقابل، غذاهای حیوانی (مورچه‌ها، موریانه‌ها‌، تخم‌ها) نه تنها به راحتی قابل هضم هستند بلکه پروتئین‌های با کیفیت بالا در اختیار قرار می‌دهند که حاوی تمام اسیدهای آمینه ضروری است.,BeetleLM/beetlelm_fas-fra_balanced,step-8000,fas,7.45091438293457,1721.4364780905214
532,همه چیز در نظر گرفته شده است، و اگر اجداد خودمان «مشکل پروتئین» خود را تقریباً به همان شیوه‌ای حل کرده‌اند که امروزه شامپانزه‌ها در ساوانا انجام می‌دهند، نباید تعجب کنیم.,BeetleLM/beetlelm_fas-fra_balanced,step-8000,fas,6.945231914520264,1038.1877401005795
533,اختلال در خواب فرآیند بیداری آگاهانه در طول خواب معمولی و بعد از مدتی مجددا به خواب رفتن (10-60 دقیقه) است.,BeetleLM/beetlelm_fas-fra_balanced,step-8000,fas,5.896085262298584,363.6112354118628
534,این کار را می توان به راحتی با استفاده از یک ساعت زنگ دار نسبتاً آرام انجام داد تا بدون اینکه شما را کاملا از خواب بیدار کند، شما را هوشیار کند.,BeetleLM/beetlelm_fas-fra_balanced,step-8000,fas,5.177611351013184,177.25889562098197
535,اگر متوجه شدید که ساعت بیدارباش را در خواب خاموش می‌کنید، می‌تواند آن را در طرف دیگر اتاق قرار دهید تا برای خاموش کردنش مجبور باشید از رختخواب خارج شوید.,BeetleLM/beetlelm_fas-fra_balanced,step-8000,fas,6.863205909729004,956.4283807732049
536,سایر گزینه‌های مبتنی بر بیوریتم شامل نوشیدن مقدار زیادی مایعات (بخصوص آب یا چای، یک ادرارآور مشخص) پیش از خواب می‌شود که فرد را مجبور می‌کند برای ادرار کردن از خواب برخیزد.,BeetleLM/beetlelm_fas-fra_balanced,step-8000,fas,7.394589900970459,1627.1574910555144
537,میزان آرامش درونی فرد به شکل متضادی با میزان تنش موجود در بدن و روح فرد ارتباط دارد.,BeetleLM/beetlelm_fas-fra_balanced,step-8000,fas,6.842192649841309,936.5403902028526
538,هرچه تنش کمتر باشد، هدیه نیروی زندگی مثبت تر است. هر شخص توانایی این را دارد که صلح و رضایت مطلق را پیدا کند.,BeetleLM/beetlelm_fas-fra_balanced,step-8000,fas,6.114181041717529,452.22554182458725
539,هر کسی می‌تواند به روشنگری دست یابد. تنها چیزی که سر راه این هدف قرار می‌گیرد تنش و منفی بودن ماست.,BeetleLM/beetlelm_fas-fra_balanced,step-8000,fas,7.024684906005859,1124.0403248440323
540,آیین بودایی تبتی بر پایه آموزه‌های بودا است، اما با راه عشق ماهایانا و تکنیکهای زیادی از یوگای هندی بسط داده شد.,BeetleLM/beetlelm_fas-fra_balanced,step-8000,fas,7.4238386154174805,1675.4525978268618
541,در اصل بودیسم تبتی خیلی ساده است، و شامل کندالینی یوگا،‌ مراقبه و مسیر عشق فراگیر می‌شود.,BeetleLM/beetlelm_fas-fra_balanced,step-8000,fas,8.256196022033691,3851.415499943903
542,با استفاده از یوگا کوندالینی، انرژی کوندالینی (انرژی روشنگری) از طریق حرکات یوگا، تمرین های تنفسی، مانترا و تجسم بیدار می شود.,BeetleLM/beetlelm_fas-fra_balanced,step-8000,fas,6.120954513549805,455.2990762924258
543,مرکز مراقبه تبت، یوگای خدایان است. از طریق تجسم خدایان مختلف، کانال های انرژی پاک می شوند، چاکراها فعال می شوند و آگاهی روشنگری ایجاد می شود.,BeetleLM/beetlelm_fas-fra_balanced,step-8000,fas,6.048641681671143,423.53734061581235
544,آلمان دشمن مشترکی در جنگ جهانی دوم بود که منجر به اتحاد بین شوروی و ایالات متحده شد. با پایان جنگ، اختلاف در سیستم، پروسه و فرهنگ منجر به جدایی این کشورها شد.,BeetleLM/beetlelm_fas-fra_balanced,step-8000,fas,5.451792240142822,233.17569848372943
545,با توجه به دو سال آخر جنگ، حالا متحدان سابق دشمن شده بودند و جنگ سرد آغاز شد.,BeetleLM/beetlelm_fas-fra_balanced,step-8000,fas,5.567816734313965,261.8617608872502
546,این برای آن بود که برای 40 سال آینده دوام داشته باشد و با ارتش‌های نیابتی، در جبهه‌های نبردی از آفریقا تا آسیا، در افغانستان، کوبا و بسیاری از مناطق دیگر به صورت حقیقی بجنگد.,BeetleLM/beetlelm_fas-fra_balanced,step-8000,fas,6.172055721282959,479.17013454233967
547,تا هفدهم سپتامبر سال 1939، دفاع کشور لهستان درهم شکسته شد و تنها امیدی که وجود داشت عقب نشینی و سازماندهی مجدد در طول منطقه سرپل رومانی بود.,BeetleLM/beetlelm_fas-fra_balanced,step-8000,fas,6.7855095863342285,884.9309207699263
548,اما این نقشه‌ها تقریباً یک شبه از کار افتاد، وقتی که بیش از 800 هزار سرباز از ارتش سرخ اتحاد جماهیر شوروی وارد شدند و پس از هجوم به نواحی شرقی لهستان جبهه‌های بلاروسی و اوکراینی را ساختند، و بدین ترتیب عهدنامه صلح ریگا، پیمان عدم تجاوز بین شوروی و لهستان، و سایر عهدنامه‌های بین‌المللی، هم دوجانبه و هم چند جانبه، نقض کردند.,BeetleLM/beetlelm_fas-fra_balanced,step-8000,fas,6.672468662261963,790.3442912740069
549,استفاده از کشتی‌ها برای حمل و نقل کالا به‌مراتب کارآمدترین راه برای جابجایی تعداد زیادی از افراد و اجناس از میان اقیانوس است.,BeetleLM/beetlelm_fas-fra_balanced,step-8000,fas,5.83195686340332,341.02536661030314
550,به‌طور سنتی کار نیروهای دریایی از این قرار بود که اطمینان حاصل کنند کشورتان توانایی جابجایی افراد و کالاهای شما را داشته باشد، و درعین‌حال در توانایی دشمن‌تان برای جابجایی مردم و کالاهایش مداخله کنند.,BeetleLM/beetlelm_fas-fra_balanced,step-8000,fas,6.7925591468811035,891.1913355355637
551,یکی از مثال‌هایی که ارزش بیان کردن دارد مبارزه در اقیانوس اطلس شمالی در جنگ جهانی دوم بود. آمریکایی‌ها سعی داشتند افراد و لوازم را برای کمک به بریتانیا از اقیانوس اطلس عبور دهند.,BeetleLM/beetlelm_fas-fra_balanced,step-8000,fas,6.098401069641113,445.14544418969393
552,در همین حال، نیروی دریایی آلمان عمدتاً با استفاده از یو-بوت سعی داشت که این عبور و مرور را متوقف کند.,BeetleLM/beetlelm_fas-fra_balanced,step-8000,fas,5.314693927764893,203.30227842241655
553,اگر آلمان متفقین را شکست می‌داد، شاید می‌توانست بر بریتانیا پیروز شود چون بقیه اروپا را در دست داشت.,BeetleLM/beetlelm_fas-fra_balanced,step-8000,fas,6.678718566894531,795.2993358702529
554,"به نظر می‌رسد که بزها ابتدا حدود 10,000 سال پیش در کوه‌های زاگرس ایران اهلی شده باشند.",BeetleLM/beetlelm_fas-fra_balanced,step-8000,fas,7.147305011749268,1270.676877331758
555,فرهنگهای کهن و قبایل شروع به نگهداری از آنها برای دسترسی آسان به شیر، پشم، گوشت، و پوست کردند.,BeetleLM/beetlelm_fas-fra_balanced,step-8000,fas,5.982594966888428,396.4678553881294
556,بزهای اهلی بطور کل بصورت گله‌ای روی تپه‌ها یا سایر مناطق چرا نگهداری می‌شدند و اغلب توسط بزچران‌هایی که اغلب کودک و نوجوان بودند مشابه چوپانان معمول تیمار می‌شدند. این روش‌های گله‌داری هنوز امروزه بکار می‌روند.,BeetleLM/beetlelm_fas-fra_balanced,step-8000,fas,8.84824275970459,6962.144054552113
557,خط واگن در قرن 16ام در انگلستان ساخته شد.,BeetleLM/beetlelm_fas-fra_balanced,step-8000,fas,5.6604228019714355,287.2700752374016
558,گرچه مسیر‌های واگن‌ فقط از تخته های چوبی موازی تشکیل شده بودند، اما به اسبها اجازه می دادند تا برای رسیدن به سرعت بالاتر آنها را بکشند و نسبت به کشیدن بار روی جاده های ناهموارتر آن زمان بارهای بزرگتری را بکشند.,BeetleLM/beetlelm_fas-fra_balanced,step-8000,fas,5.943998336791992,381.45707834943096
559,ریل‌بند تقریباً از همان اوایل برای نگه داشتن ریل‌ها در محل خود معرفی شد. با این وجود به تدریج، متوجه شدند که اگر روی ریل‌بند یک قید آهنی وجود داشته باشد، ریل‌ها بهره‌وری بیشتری خواهند داشت.,BeetleLM/beetlelm_fas-fra_balanced,step-8000,fas,6.574765682220459,716.777650925638
560,گرچه این کار رایج شد، اما آهن باعث سایش بیشتر روی چرخ‌های چوبی واگن‌ها شد.,BeetleLM/beetlelm_fas-fra_balanced,step-8000,fas,7.8578314781188965,2585.906695666701
561,در نهایت چرخ‌های چوبی جایگزین چرخ‌های آهنین شد. در 1767، اولین ریل‌های تمام آهنی معرفی شد.,BeetleLM/beetlelm_fas-fra_balanced,step-8000,fas,8.206116676330566,3663.2890717457567
562,اولین نوع حمل و نقل راه رفتن بود؛ انسان‌ها ایستاده راه رفتن را دو میلیون سال پیش با پیدایش انسان ایستاده (Homo Erectus) شروع کردند.,BeetleLM/beetlelm_fas-fra_balanced,step-8000,fas,6.6273322105407715,755.4640608343777
563,پیشینیان آنها، جنوبی‌کپی بودند که بر حسب عادت به‌طور عادی قدم نمی‌زدند.,BeetleLM/beetlelm_fas-fra_balanced,step-8000,fas,8.790040969848633,6568.501280457406
564,ویژه‌گری دوقطبی در فسیل‌های جنوبی‌کپی از 4.2-3.9 میلیون سال پیش وجود داشته، گرچه ممکن است ساحل‌مردم چادی‌ها از هفت میلیون سال پیش روی دو پای خود راه رفته باشند.,BeetleLM/beetlelm_fas-fra_balanced,step-8000,fas,6.88751220703125,979.9604434576478
565,ما می توانیم زندگی دوستانه تری را با محیط زیست آغاز کنیم، می توانیم به جنبش محیط زیست بپیوندیم و حتی می توانیم برای اینکه تا حدودی آلام آینده را کاهش دهیم، فعال محیط زیست شویم.,BeetleLM/beetlelm_fas-fra_balanced,step-8000,fas,5.281985759735107,196.76020616680387
566,این دقیقاً مانند بسیاری از موارد درمان حمایتی است. با این وجود، اگر تنها به دنبال یک راه‌حل موقت نباشیم، باید ریشه مشکلات را بیابیم و باید آن‌ها را غیرفعال کنیم.,BeetleLM/beetlelm_fas-fra_balanced,step-8000,fas,5.951647758483887,384.38619313341405
567,پرواضح است که دنیا به‌خاطر پیشرفت‌های علمی و فناوری بشر تغییر کرده و مشکلات به دلیل جمعیت بسیار زیاد و شیوه زندگی عجیب و غریب بشر، بیشتر شده است.,BeetleLM/beetlelm_fas-fra_balanced,step-8000,fas,6.216947078704834,501.1708589154823
568,پس از تصویب آن توسط کنگره در چهارم ژوئیه، یک پیش‌نویس خطی با امضای جان هنکاک، رِئیس کنگره، و چارلز تامسون، منشی، به چاپخانه جان دانلپ که چند بلوک با آنجا فاصله داشت فرستاده شد.,BeetleLM/beetlelm_fas-fra_balanced,step-8000,fas,6.88826322555542,980.6966883358039
569,در طول شب بین 150 تا 200 نسخه ایجاد شد، که اکنون به عنوان «اعلامیه Dunlap» شناخته می‌شود.,BeetleLM/beetlelm_fas-fra_balanced,step-8000,fas,7.116151809692383,1231.7014801901373
570,جان نیکسون کسی بود که سند را برای اولین بار روز 8 ژوئیه در حضور عموم و در حیاط «سالن استقلال» قرائت کرد.,BeetleLM/beetlelm_fas-fra_balanced,step-8000,fas,6.314211368560791,552.3662753664763
571,در ششم ژوئیه یک رونوشت برای جرج واشنگتن ارسال شد که در نهم ژوئیه دستور داد برای سربازانش در نیویورک بخوانند. در دهم آگوست یک رونوشت به لندن رسید.,BeetleLM/beetlelm_fas-fra_balanced,step-8000,fas,6.1781325340271,482.09082698521314
572,پهنه دانلاپ 25 هنوز وجود دارد و قدیمی‌ترین نسخه‌های بازمانده از این سند است. نسخه دست‌نویس اصلی باقی نمانده است.,BeetleLM/beetlelm_fas-fra_balanced,step-8000,fas,7.353589057922363,1561.7918422616642
573,بسیاری از دیرینه‌شناسان امروزه معتقدند که یک گروه از دایناسورها نجات یافتند و امروز زنده هستند. ما به آنها پرنده می‌گوییم.,BeetleLM/beetlelm_fas-fra_balanced,step-8000,fas,7.309974670410156,1495.1393174461457
574,از آنجایی که پر دارند و می‌توانند پرواز کنند، بسیاری از مردم آن‌ها را به‌عنوان دایناسور نمی‌شناسند.,BeetleLM/beetlelm_fas-fra_balanced,step-8000,fas,7.019776821136475,1118.5369560812505
575,اما در مورد پرنده‌ها موارد زیادی وجود دارد که همچنان به دایناسور شباهت دارد.,BeetleLM/beetlelm_fas-fra_balanced,step-8000,fas,5.726909637451172,307.0190007762119
576,آنها پاها و پنجه‌های فلس‌دار دارند، تخم می‌گذارند و مانند تیرکس روی دو پای عقب خود راه می‌روند.,BeetleLM/beetlelm_fas-fra_balanced,step-8000,fas,8.407654762268066,4481.238608319089
577,تقریباً تمام رایانه‌هایی که امروزه مورد استفاده قرار می‌گیرد، مبتنی بر به‌کار بری اطلاعات هستند که به صورت اعداد دو دویی کدگذاری می‌شوند.,BeetleLM/beetlelm_fas-fra_balanced,step-8000,fas,7.336693286895752,1535.625834797163
