sentence_id,sentence,repo,revision,iso_code,nll,ppl
203,Der sehbehinderte polnische Skifahrer Maciej Krezel und die Begleitläuferin Anna Ogarzynska belegten im Super-G den dreizehnten Platz. Der Südkoreaner Jong Seork Park belegte im Super-G der Männer den vierundzwanzigsten Platz.,BeetleLM/beetlelm_bul-deu_part_time,step-20000,deu,6.900592803955078,992.8631143662859
204,"Die UN-Friedenstruppen, die in Haiti nach dem Erdbeben des Jahres 2010 eintrafen, werden für die Ausbreitung der Krankheit verantwortlich gemacht, die in der Nähe des Lagers der Truppe ausbrach.",BeetleLM/beetlelm_bul-deu_part_time,step-20000,deu,4.958583354949951,142.39193411886774
205,"Der Klage zufolge wurde der Abfall aus dem UN-Lager nicht ordnungsgemäß gesäubert, was dazu führte, dass Bakterien in den Zufluss des Artibonit-Flusses, einem der größten Flüsse Haitis, gelangten.",BeetleLM/beetlelm_bul-deu_part_time,step-20000,deu,5.855403900146484,349.1158795361368
206,Vor der Ankunft der Truppen waren in Haiti seit den 1800er Jahren keine Probleme im Zusammenhang mit der Krankheit aufgetreten.,BeetleLM/beetlelm_bul-deu_part_time,step-20000,deu,5.640117645263672,281.49583317886476
207,"Das haitianische Institut für Gerechtigkeit und Demokratie hat auf unabhängige Studien verwiesen, die nahelegen, dass das nepalesische UN-Friedensbataillon die Krankheit unwissentlich nach Haiti eingeschleppt hat.",BeetleLM/beetlelm_bul-deu_part_time,step-20000,deu,5.968186855316162,390.79645747171276
208,"Danielle Lantagne, ein UN-Experte für die Krankheit, stellte fest, dass der Ausbruch vermutlich von den Blauhelmen verursacht wurde.",BeetleLM/beetlelm_bul-deu_part_time,step-20000,deu,5.410642623901367,223.77534486984592
209,"Hamilton bestätigte, dass das Krankenhaus der Howard University den Patienten in stabilem Zustand aufgenommen hat.",BeetleLM/beetlelm_bul-deu_part_time,step-20000,deu,6.506657600402832,669.5846537658376
210,"Der Patient hatte sich in Nigeria aufgehalten, wo einige Fälle des Ebolavirus auftraten.",BeetleLM/beetlelm_bul-deu_part_time,step-20000,deu,6.1844096183776855,485.12646929478944
211,"Das Krankenhaus befolgte Protokolle zum Infektionsschutz, einschließlich der Trennung des Patienten von anderen, um die Infektion Dritter zu vermeiden.",BeetleLM/beetlelm_bul-deu_part_time,step-20000,deu,6.290119647979736,539.2178415505522
212,Vor den Simpsons hatte Simon an mehreren Shows in verschiedenen Funktionen gearbeitet.,BeetleLM/beetlelm_bul-deu_part_time,step-20000,deu,5.769140720367432,320.26241940469396
213,"In den 1980er Jahren arbeitete er an Shows wie „Taxi“, „Cheers“ und „Die Tracey Ullman Show“.",BeetleLM/beetlelm_bul-deu_part_time,step-20000,deu,5.76096773147583,317.65558553151556
214,1989 half er Brooks und Groening bei der Erschaffung von „Die Simpsons“ und war verantwortlich für die Einstellung des ersten Autorenteams der Sendung.,BeetleLM/beetlelm_bul-deu_part_time,step-20000,deu,5.319607734680176,204.3037250065619
215,"Obwohl er die Show 1993 verließ, behielt er den Titel des Chefproduzenten und erhielt weiterhin in jeder Saison Lizenzgebühren in zweistelliger Millionenhöhe.",BeetleLM/beetlelm_bul-deu_part_time,step-20000,deu,5.780326843261719,323.8650262219678
216,Zuvor meldete die chinesische Nachrichtenagentur Xinhua die geplante Entführung eines Flugzeugs.,BeetleLM/beetlelm_bul-deu_part_time,step-20000,deu,6.6483025550842285,771.4736794002903
217,"Spätere Berichte gaben dann an, das Flugzeug habe eine Bombendrohung erhalten und sei nach Afghanistan umgeleitet worden, wo es in Kandahar gelandet sei.",BeetleLM/beetlelm_bul-deu_part_time,step-20000,deu,6.274307727813721,530.7588249758783
218,"Erste Berichte besagen, dass das Flugzeug zurück nach Afghanistan umgeleitet wurde, nachdem ihm die Notlandung in Ürümqi verweigert wurde.",BeetleLM/beetlelm_bul-deu_part_time,step-20000,deu,5.8626604080200195,351.65845561944457
219,"Flugunfälle sind im Iran, der über eine veraltete Flotte verfügt, die sowohl für zivile als auch für militärische Einsätze schlecht gewartet wird, häufig.",BeetleLM/beetlelm_bul-deu_part_time,step-20000,deu,6.389693260192871,595.6738347846876
220,"Internationale Sanktionen haben bewirkt, dass keine neuen Flugzeuge gekauft werden können.",BeetleLM/beetlelm_bul-deu_part_time,step-20000,deu,5.834231376647949,341.80191612470645
221,Bei einem Hubschrauberabsturz zu Beginn der Woche wurden drei Menschen getötet und drei weitere verletzt.,BeetleLM/beetlelm_bul-deu_part_time,step-20000,deu,5.640975475311279,281.73741236496994
222,"Letzten Monat erfuhr Iran sein schlimmstes Flugzeugunglück seit Jahren, als ein Passagierflugzeug auf dem Weg nach Armenien abstürzte und dabei alle 168 Passagiere ums Leben kamen.",BeetleLM/beetlelm_bul-deu_part_time,step-20000,deu,6.487023830413818,656.5663995821499
223,"Im selben Monat schoss ein weiteres Passagierflugzeug über das Ende einer Landebahn in Maschhad hinaus und stieß mit einer Mauer zusammen, wobei siebzehn Menschen ums Leben kamen.",BeetleLM/beetlelm_bul-deu_part_time,step-20000,deu,6.272739410400391,529.9270790596735
224,Aerosmith haben die noch ausstehenden Konzerte ihrer Tour abgesagt.,BeetleLM/beetlelm_bul-deu_part_time,step-20000,deu,6.651183128356934,773.6991696667853
225,Die Rockband sollte bis zum 16. September durch die Vereinigten Staaten und Kanada touren.,BeetleLM/beetlelm_bul-deu_part_time,step-20000,deu,4.377347469329834,79.62654119162663
226,"Nachdem sich der Frontsänger Steven Tyler während eines Auftrittes am 5. August bei einem Sturz von der Bühne verletzte, haben sie die Tour abgebrochen.",BeetleLM/beetlelm_bul-deu_part_time,step-20000,deu,6.395173072814941,598.9469756920267
227,"Murray verlor den ersten Satz im Tiebreak, nachdem beide Männer jeden einzelnen Aufschlag im Satz gehalten hatten.",BeetleLM/beetlelm_bul-deu_part_time,step-20000,deu,6.984330654144287,1079.5835610564307
228,"Del Potro hatte im zweiten Satz einen frühen Vorteil, doch auch diesmal war ein Tie Break erforderlich, nachdem das 6:6 erreicht wurde.",BeetleLM/beetlelm_bul-deu_part_time,step-20000,deu,6.511768817901611,673.0158077825305
229,"Potros Schulter wurde inzwischen behandelt, er war aber in der Lage, aufs Spielfeld zurückzukehren.",BeetleLM/beetlelm_bul-deu_part_time,step-20000,deu,6.147803783416748,467.68911145568154
230,Das Programm begann um 20:30 Ortszeit (15:00 UTC).,BeetleLM/beetlelm_bul-deu_part_time,step-20000,deu,6.273367881774902,530.2602277356788
231,"Berühmte Sänger im ganzen Land präsentierten Bhajans, Andachtslieder, zu Shri Shyams Füßen.",BeetleLM/beetlelm_bul-deu_part_time,step-20000,deu,6.748532295227051,852.8061758425955
232,"Der Sänger Sanju Sharma eröffnete den Abend, gefolgt von Jai Shankar Choudhary, der ebenfalls den Chhappan Bhog Bhajan präsentierte. Begleitet wurde er vom Sänger Raju Khandelwal.",BeetleLM/beetlelm_bul-deu_part_time,step-20000,deu,6.818096160888672,914.2427809817577
233,Dann übernahm Lakkha Singh die Leitung beim Singen der Bhajans.,BeetleLM/beetlelm_bul-deu_part_time,step-20000,deu,6.386910915374756,594.0187683276945
234,"Baba Shyam wurden 108 Teller Chhappan Bhog (im Hinduismus 56 verschiedene essbare Dinge wie Süßigkeiten, Früchte, Nüsse, Gerichte usw., die der Gottheit dargebracht werden) serviert.",BeetleLM/beetlelm_bul-deu_part_time,step-20000,deu,6.854339599609375,947.9858723971964
235,Lakkha Singh präsentierte den Chhappan Bhog Bhajan ebenfalls. Der Sänger Raju Khandelwal begleitete ihn.,BeetleLM/beetlelm_bul-deu_part_time,step-20000,deu,6.999478340148926,1096.0612381252495
236,Bei der Keynote-Präsentation der Tokyo Game Show am Donnerstag enthüllte Nintendo-Präsident Satoru Iwata das Controller-Design für die neue Nintendo Revolution-Konsole des Unternehmens.,BeetleLM/beetlelm_bul-deu_part_time,step-20000,deu,5.877161502838135,356.7950412752556
237,"Ähnlich einer TV-Fernbedienung verwendet der Controller zwei Sensoren, die in der Nähe des Fernsehers des Benutzers platziert werden, um dessen Position im dreidimensionalen Raum zu triangulieren.",BeetleLM/beetlelm_bul-deu_part_time,step-20000,deu,5.613206386566162,274.0214496083258
238,"Dies wird Spielern ermöglichen Aktionen und Bewegungen in Videospielen zu steuern, indem sie das Gerät in der Luft bewegen.",BeetleLM/beetlelm_bul-deu_part_time,step-20000,deu,5.793844223022461,328.2725547796928
239,Giancarlo Fisichella verlor die Kontrolle über sein Auto und musste das Rennen schon kurz nach dem Start beenden.,BeetleLM/beetlelm_bul-deu_part_time,step-20000,deu,6.04746150970459,423.0377885562791
240,"Sein Teamkollege führte das Rennen die meiste Zeit an, aber beendete es gleich nach seinem Boxenstopp, wahrscheinlich wegen eines stark eingeklemmten rechten Frontrades.",BeetleLM/beetlelm_bul-deu_part_time,step-20000,deu,6.271108627319336,529.0635872202594
241,Kurz nach Alonso beendete auch Michael sein aufgrund von Schäden an der Radaufhängung aus den zahlreichen Kämpfen während des Rennens.,BeetleLM/beetlelm_bul-deu_part_time,step-20000,deu,6.0864739418029785,439.86767445367013
242,"„Sie ist sehr süß und singt auch ziemlich gut“, sagte er laut einem Transkript der Pressekonferenz.",BeetleLM/beetlelm_bul-deu_part_time,step-20000,deu,5.80421257019043,331.6939048155552
243,„Ich war bei jeder Probe hierfür von ganzem Herzen bewegt.“,BeetleLM/beetlelm_bul-deu_part_time,step-20000,deu,6.38189697265625,591.0478464895258
244,"Etwa 3 Minuten nach dem Start zeigte eine Bordkamera, wie sich zahllose Teile aus Isolierschaum vom Treibstofftank lösten.",BeetleLM/beetlelm_bul-deu_part_time,step-20000,deu,6.965157985687256,1059.082224042814
245,"Man geht allerdings nicht davon aus, dass sie das Shuttle in irgendeiner Weise beschädigt haben.",BeetleLM/beetlelm_bul-deu_part_time,step-20000,deu,5.18740177154541,179.00285788394729
246,"N. Wayne Hale Jr., Leiter des Shuttle-Programms der NASA, sagte, dass der Schaum „nach dem Zeitpunkt, über den wir uns Sorgen machen“ abfiel.",BeetleLM/beetlelm_bul-deu_part_time,step-20000,deu,6.104230880737305,447.74813727275017
247,"Nach fünf Minuten kommt Wind auf, etwa eine Minute später erreicht der Wind 70 km/h ... Dann beginnt es zu regnen, aber die Tropfen sind so hart und groß, dass sie wie Nadeln auf die Haut schlagen. Dann fiel Hagel vom Himmel, die Leute gerieten in Panik, schrien und rannten einander um.",BeetleLM/beetlelm_bul-deu_part_time,step-20000,deu,5.801004886627197,330.63164034402035
248,"""„Ich habe meine Schwester und ihre Freundin verloren, und auf meinem Weg waren zwei Behinderte im Rollstuhl, über die Leute einfach drübergesprungen sind und sie geschubst haben"""", sagte Armand Versace.""",BeetleLM/beetlelm_bul-deu_part_time,step-20000,deu,5.895847320556641,363.5247274134588
249,"Die NHK berichtete zudem, dass das Atomkraftwerk von Kashiwazaki Kariwa in der Präfektur Niigata normal in Betrieb war.",BeetleLM/beetlelm_bul-deu_part_time,step-20000,deu,5.9733757972717285,392.8295478381608
250,"Hokuriku Electric Power Co. berichtete, dass das Erdbeben keine Auswirkungen gehabt hatte und dass die Reaktoren Nummer 1 und 2 des Kernkraftwerks Shika abgeschaltet worden waren.",BeetleLM/beetlelm_bul-deu_part_time,step-20000,deu,6.480897903442383,652.5566161263034
251,"Es wird berichtet, dass etwa 9.400 Häuser in der Region kein Wasser und ungefähr 100 keinen Strom haben.",BeetleLM/beetlelm_bul-deu_part_time,step-20000,deu,5.627946853637695,278.0905704556891
252,Einige Straßen wurden beschädigt und der Eisenbahnverkehr in den betroffenen Gebieten unterbrochen. Der Flughafen Noto in der Präfektur Ishikawa bleibt geschlossen.,BeetleLM/beetlelm_bul-deu_part_time,step-20000,deu,6.628174304962158,756.1005008392438
253,Eine Bombe explodierte vor dem Bürogebäude des Generalgouverneurs.,BeetleLM/beetlelm_bul-deu_part_time,step-20000,deu,6.226888179779053,506.17789557299153
254,Drei weitere Bomben detonierten binnen zwei Stunden unweit von Regierungsgebäuden.,BeetleLM/beetlelm_bul-deu_part_time,step-20000,deu,7.754180908203125,2331.299014605902
255,"Laut einigen Berichten beträgt die offizielle Zahl der Todesopfer acht und offizielle Berichte bestätigen, dass bis zu 30 Personen verletzt wurden. Allerdings sind noch keine endgültigen Zahlen bekannt.",BeetleLM/beetlelm_bul-deu_part_time,step-20000,deu,5.594171047210693,268.85468984820807
256,"Sowohl Cyanursäure als auch Melamin wurden in Urinproben von Haustieren gefunden, die nach dem Verzehr kontaminierter Haustiernahrung starben.",BeetleLM/beetlelm_bul-deu_part_time,step-20000,deu,6.316974639892578,553.8947240464919
257,"Die zwei Verbindungen reagieren miteinander und formen Kristalle, die laut Forschern der Hochschule die Nierentätigkeit behindern können.",BeetleLM/beetlelm_bul-deu_part_time,step-20000,deu,6.598140239715576,733.7293588559706
258,"Die Forscher entdeckten Kristalle im Katzenurin, die sich durch die Zugabe von Melamin und Zyanursäure gebildet hatten.",BeetleLM/beetlelm_bul-deu_part_time,step-20000,deu,6.055036544799805,426.2544825547055
259,"Die Zusammensetzung dieser Kristalle entspricht der Zusammensetzung, die im Urin betroffener Haustiere gefunden wurde, wenn man sie mittels Infrarotspektroskopie (FTIR) vergleicht.",BeetleLM/beetlelm_bul-deu_part_time,step-20000,deu,6.371497631072998,584.9331873626818
260,"Ich weiß nicht, ob Sie das wussten, aber die meisten Waren aus Mittelamerika kamen zollfrei in unser Land.",BeetleLM/beetlelm_bul-deu_part_time,step-20000,deu,5.411828994750977,224.04098295734596
261,Dennoch wurden achtzig Prozent unserer Waren in zentralamerikanischen Ländern mit Zöllen belegt. Wir kümmern uns um Sie.,BeetleLM/beetlelm_bul-deu_part_time,step-20000,deu,6.5808491706848145,721.1514499855239
262,Das erschien mir nicht sinnvoll; es war ganz gewiss nicht fair.,BeetleLM/beetlelm_bul-deu_part_time,step-20000,deu,6.180132865905762,483.05613377994365
263,"Ich sage den Leuten nur, dass wir so behandelt werden möchten, wie wir andere auch behandeln.",BeetleLM/beetlelm_bul-deu_part_time,step-20000,deu,5.059070110321045,157.44404264147374
264,"Der kalifornische Gouverneur Arnold Schwarzenegger unterzeichnete einen Gesetzentwurf, der den Verkauf oder Verleih von Videospielen, die Gewalt beinhalten, an Minderjährige verbietet.",BeetleLM/beetlelm_bul-deu_part_time,step-20000,deu,6.198065757751465,491.79686624532167
265,"Der Gesetzesvorschlag sieht vor, dass im Bundesstaat Kalifornien verkaufte Videospiele mit einem Aufkleber mit der Zahl „18“ versehen werden und der Verkauf an Minderjährige mit einer Geldbuße von 1000 $ bestraft wird.",BeetleLM/beetlelm_bul-deu_part_time,step-20000,deu,5.869807720184326,354.18087188728015
266,"Der Direktor der Staatsanwaltschaft Kier Starmer QC gab heute Morgen eine Erklärung ab, in der er die Strafverfolgung sowohl von Huhne als auch von Pryce bekanntgab.",BeetleLM/beetlelm_bul-deu_part_time,step-20000,deu,6.637916564941406,763.5026266603743
267,"Huhne ist zurückgetreten und wird im Kabinett vom Abgeordneten Ed Davey ersetzt. Es wird erwartet, dass der Abgeordnete Norman Lamb den Job des Wirtschaftsministers übernimmt, den Davey gerade verlässt.",BeetleLM/beetlelm_bul-deu_part_time,step-20000,deu,6.077184200286865,435.8003389550633
268,Huhne und Pryce sollen am 16. Februar vor dem Westminster Magistrates Court erscheinen.,BeetleLM/beetlelm_bul-deu_part_time,step-20000,deu,7.014407634735107,1112.5474165333228
269,"Die Todesopfer waren Nicholas Alden, 25, und Zachary Cuddeback, 21. Cuddeback ist der Fahrer gewesen.",BeetleLM/beetlelm_bul-deu_part_time,step-20000,deu,5.85305118560791,348.29547499797695
270,"Edgar Veguilla erlitt Wunden am Arm und am Kiefer, während Kristoffer Schneider rekonstruktive Chirurgie für sein Gesicht benötigte.",BeetleLM/beetlelm_bul-deu_part_time,step-20000,deu,7.4293012619018555,1684.6300468282466
271,"Die Waffe von Uka hatte eine Ladehemmung, als er auf den Kopf eines fünften Mannes zielte. Schneider leitet seitdem unter chronischen Schmerzen, ist auf einem Auge erblindet, und ihm fehlt ein Teil seines Schädels. Sein Gesicht musste mit Hilfe von Titan rekonstruiert werden.",BeetleLM/beetlelm_bul-deu_part_time,step-20000,deu,6.16522216796875,475.9068624521356
272,Schneider sagte über eine Videoschaltung von einer Basis der USAF in seiner Heimat aus.,BeetleLM/beetlelm_bul-deu_part_time,step-20000,deu,6.131972789764404,460.3434262629999
273,Über die Veranstaltung vom Mittwoch hinaus nahm Carpanedo an der Meisterschaft in zwei Einzelrennen teil.,BeetleLM/beetlelm_bul-deu_part_time,step-20000,deu,7.351044654846191,1557.8230655189004
274,"Ihr erstes war der Slalom, bei dem sie in ihrem ersten Lauf ein „Did not Finish“ erhielt. 36 der 116 Teilnehmer erzielten in diesem Rennen das gleiche Ergebnis.",BeetleLM/beetlelm_bul-deu_part_time,step-20000,deu,6.4196600914001465,613.7944446530068
275,"Ihr anderes Rennen, den Riesenslalom, beendete sie mit dem 10. Platz in der Damengruppe mit einer kombinierten Laufzeit von 4:41,30. Damit war sie 2:11,60 Minuten langsamer als die erstplatzierte Österreicherin Claudia Lösch und 1:09,02 Minuten schneller als Gyöngyi Dani aus Ungarn, die den neunten Platz belegte.",BeetleLM/beetlelm_bul-deu_part_time,step-20000,deu,6.258758068084717,522.5695411457176
276,"Vier Skifahrerinnen des Krückenskifahrens kamen nicht ins Ziel, und 45 der insgesamt 117 Skifahrerinnen im Riesenslalom konnten sich im Rennen nicht platzieren.",BeetleLM/beetlelm_bul-deu_part_time,step-20000,deu,7.794979572296143,2428.3798177482718
277,Die Polizei von Madhya Pradesh hat den gestohlenen Laptop und das Mobiltelefon wiedergefunden.,BeetleLM/beetlelm_bul-deu_part_time,step-20000,deu,7.193455219268799,1330.693107948757
278,"Der stellvertretende Generalinspekteur D. K. Arya sagte: „Wir haben fünf Personen festgenommen, die die Schweizerin vergewaltigt haben, und ihr Handy und Laptop sichergestellt.“",BeetleLM/beetlelm_bul-deu_part_time,step-20000,deu,5.9467854499816895,382.521725360484
279,"Die Namen der Angeklagten sind Baba Kanjar, Bhutha Kanja, Rampro Kanjar, Gaza Kanjar und Vishnu Kanjar.",BeetleLM/beetlelm_bul-deu_part_time,step-20000,deu,6.574543476104736,716.6183962423266
280,"Die Polizeipräsidentin Chandra Shekhar Solanki gab an, die Angeklagten seien mit bedeckten Gesichtern vor Gericht erschienen.",BeetleLM/beetlelm_bul-deu_part_time,step-20000,deu,7.0617570877075195,1166.492996642023
281,"Obwohl sich drei Menschen im Haus befanden, als das Auto hineinraste, wurde keiner von ihnen verletzt.",BeetleLM/beetlelm_bul-deu_part_time,step-20000,deu,5.381374359130859,217.32074702738268
282,Der Fahrer zog sich jedoch erhebliche Verletzungen am Kopf zu.,BeetleLM/beetlelm_bul-deu_part_time,step-20000,deu,5.354504108428955,211.55903999180572
283,"Die Straße, auf der sich der Unfall ereignet hatte, wurde vorübergehend gesperrt, während die Rettungsdienste den Fahrer aus dem roten Audi TT befreiten.",BeetleLM/beetlelm_bul-deu_part_time,step-20000,deu,6.010463237762451,407.67212566293796
284,Er wurde zunächst in das James Paget Krankenhaus in Great Yarmouth eingeliefert.,BeetleLM/beetlelm_bul-deu_part_time,step-20000,deu,6.750295639038086,854.3112929642623
285,Er wurde infolgedessen in das Addenbrooke’s Hospital in Cambridge verlegt.,BeetleLM/beetlelm_bul-deu_part_time,step-20000,deu,6.716952323913574,826.2953894294407
286,Adekoya wurde in der Zwischenzeit vor dem Edinburgh Sheriff Court wegen Mordes an ihrem Sohn angeklagt.,BeetleLM/beetlelm_bul-deu_part_time,step-20000,deu,5.627824306488037,278.05649333700245
287,"Sie befindet sich bis zur Anklageerhebung und Verhandlung in Untersuchungshaft, doch Aussagen von Augenzeugen könnten verfälscht sein, da ihr Bild weithin veröffentlicht wurde.",BeetleLM/beetlelm_bul-deu_part_time,step-20000,deu,5.92727518081665,375.13095592795787
288,"Dies ist anderenorts in Großbritannien gängige Praxis, aber die schottische Justiz arbeitet anders, und die Gerichte haben die Veröffentlichung von Fotos als potenziell schädlich erachtet.",BeetleLM/beetlelm_bul-deu_part_time,step-20000,deu,6.0768232345581055,435.64305835627937
289,"Professorin Pamela Ferguson von der University of Dundee merkt an: „Journalisten scheinen eine gefährliche Grenze zu überschreiten, wenn Sie Fotos usw. von Verdächtigen veröffentlichen.“",BeetleLM/beetlelm_bul-deu_part_time,step-20000,deu,6.2205657958984375,502.9877399261606
290,"Das Crown Office, welches federführend bei der Strafverfolgung ist, hat Journalisten gegenüber angedeutet, das mindestens bis zur Anklage keine weiteren Kommentare mehr abgegeben werden.",BeetleLM/beetlelm_bul-deu_part_time,step-20000,deu,6.127007007598877,458.06312750611545
291,"Dem Leak zufolge bezieht sich das Dokument auf den Grenzstreit, in dem die Palästinenser ein Zurücksetzen der Grenzen in den Zustand vor dem Sechstagekrieg von 1967 fordern.",BeetleLM/beetlelm_bul-deu_part_time,step-20000,deu,5.622540473937988,276.59116407318146
292,"Andere Themen, die angeblich abgedeckt sind, umfassen die Zukunft von Jerusalem, das beiden Nationen heilig ist, und das Problem des Jordantals.",BeetleLM/beetlelm_bul-deu_part_time,step-20000,deu,5.132194519042969,169.38843661283875
293,"Israel verlangt  eine Militärpräsenz im Jordantal von zehn Jahren ab der Unterzeichnung der Vereinbarung, die Palästinenserbehörde hingegen will eine solche Präsenz nur für fünf Jahre akzeptieren.",BeetleLM/beetlelm_bul-deu_part_time,step-20000,deu,5.83709192276001,342.78105603673686
294,"Die Schützen des begleitenden Versuchs zur Eindämmung der Plage sollten eng von Rangern beaufsichtigt werden, da der Versuch überwacht und seine Wirksamkeit beurteilt wurde.",BeetleLM/beetlelm_bul-deu_part_time,step-20000,deu,6.496939659118652,663.1091844918399
295,Im Rahmen einer Partnerschaft zwischen NPWS und der Sporting Shooters Association of Australia (NSW) Inc. wurden im Rahmen des Jagdprogramms der Sporting Shooters Association qualifizierte Freiwillige rekrutiert.,BeetleLM/beetlelm_bul-deu_part_time,step-20000,deu,6.297496318817139,543.2101810608741
296,"Laut Mick O‘Flynn, dem geschäftsführenden Direktor von Park Conservation and Heritage im NPWS, erhielten die vier für die erste Jagdoperation ausgewählten Schützen umfassenden Sicherheits- und Trainingsunterricht.",BeetleLM/beetlelm_bul-deu_part_time,step-20000,deu,6.5457634925842285,696.2880868515705
297,Martelly hat gestern eine neue Provisorische Wahlkommission (CEP) mit neun Mitgliedern vereidigt.,BeetleLM/beetlelm_bul-deu_part_time,step-20000,deu,5.9713873863220215,392.049217329839
298,Es ist Martellys fünftes CEP innerhalb von vier Jahren.,BeetleLM/beetlelm_bul-deu_part_time,step-20000,deu,6.374934673309326,586.947086378507
299,Letzten Monat empfahl eine Präsidialkommission den Rücktritt des vorherigen CEP als Teil des Maßnahmenpakets zur Lenkung des Landes in Richtung Neuwahlen.,BeetleLM/beetlelm_bul-deu_part_time,step-20000,deu,6.849503040313721,943.4119524476373
300,"Die Kommission war Martellys Antwort auf die weitverbreiteten regimekritischen Proteste, die im Oktober begannen.",BeetleLM/beetlelm_bul-deu_part_time,step-20000,deu,5.927980899810791,375.39578640580424
301,"Auslöser für die teils gewalttätigen Proteste war die nicht erfolgte Durchführung von Wahlen, von denen einige seit 2011 anstehen.",BeetleLM/beetlelm_bul-deu_part_time,step-20000,deu,6.312392234802246,551.3623606323174
302,Es wurden über 60 Fälle von Überhitzung bei defekten iPods gemeldet. Insgesamt wurden dadurch sechs Brände ausgelöst und vier Personen haben leichte Verbrennungen erlitten.,BeetleLM/beetlelm_bul-deu_part_time,step-20000,deu,6.316714286804199,553.7505346153458
303,"Das japanische Ministerium für Wirtschaft, Handel und Industrie (METI) gab an, dass ihm 27 Unfälle im Zusammenhang mit den Geräten bekannt waren.",BeetleLM/beetlelm_bul-deu_part_time,step-20000,deu,5.7627854347229,318.23351421308155
304,"""Letzte Woche gab das METI bekannt, dass es von Apple über 34 weitere Vorfälle von Überhitzung informiert worden war, die das Unternehmen als „nicht schwerwiegend"""" bezeichnete.""",BeetleLM/beetlelm_bul-deu_part_time,step-20000,deu,6.239819526672363,512.7659620123102
305,"Das Ministerium reagierte, indem es die Verschiebung des Berichts durch Apple als „wirklich bedauerlich“ bezeichnete.",BeetleLM/beetlelm_bul-deu_part_time,step-20000,deu,6.510972023010254,672.4797658111991
306,Das Erdbeben erschütterte Mariana um 07:19 Uhr Ortszeit (21:19 GMT am Freitag).,BeetleLM/beetlelm_bul-deu_part_time,step-20000,deu,6.151984691619873,469.6485700021581
307,"Das Amt für Katastrophenschutz der nördlichen Marianen sagte, dass im Land keine Schäden gemeldet wurden.",BeetleLM/beetlelm_bul-deu_part_time,step-20000,deu,5.561987400054932,260.3397217010149
308,"Auch hatte das Pacific Tsunami Warning Center erklärt, dass es keine Hinweise auf einen Tsunami gab.",BeetleLM/beetlelm_bul-deu_part_time,step-20000,deu,5.615227699279785,274.5758928109975
309,"Ein ehemaliger philippinischer Polizist hat Touristen aus Hongkong als Geiseln genommen, indem er ihren Bus in Manila, der Hauptstadt der Philippinen, entführte.",BeetleLM/beetlelm_bul-deu_part_time,step-20000,deu,5.450104236602783,232.78242909268033
310,Rolando Mendoza schoss mit seinem M16-Gewehr auf die Touristen.,BeetleLM/beetlelm_bul-deu_part_time,step-20000,deu,6.298105239868164,543.5410539027491
311,Mehrere Geiseln wurden gerettet und es gibt bisher mindestens sechs bestätigte Tote.,BeetleLM/beetlelm_bul-deu_part_time,step-20000,deu,5.825411319732666,338.8004597365869
312,"Sechs Geiseln, darunter die Kinder und Ältere, wurden, wie auch die philippinischen Fotografen, frühzeitig freigelassen.",BeetleLM/beetlelm_bul-deu_part_time,step-20000,deu,5.419934272766113,225.86427658001452
313,"Die Fotografen nahmen den Platz einer älteren Dame ein, als sie zur Toilette musste. Mendoza wurde erschossen.",BeetleLM/beetlelm_bul-deu_part_time,step-20000,deu,5.483188152313232,240.61259544437567
