sentence_id,sentence,repo,revision,iso_code,nll,ppl
209,Hamilton bevestigde dat de patiënt is opgenomen in het Howard University Hospital en in stabiele toestand verkeert.,BeetleLM/beetlelm_fas-nld_simultaneous,step-10000,nld,7.441689491271973,1705.6294343056204
210,"De patiënt was naar Nigeria geweest, waar het ebolavirus al in kleine mate voorkwam.",BeetleLM/beetlelm_fas-nld_simultaneous,step-10000,nld,6.500360488891602,665.3814524379327
211,"Het ziekenhuis volgde het protocol voor infectiebeheersing, waaronder het afzonderen van de patiënt om zo te voorkomen dat anderen geïnfecteerd raken.",BeetleLM/beetlelm_fas-nld_simultaneous,step-10000,nld,7.126032829284668,1243.9322734896841
212,Vóór The Simpsons werkte Simon in verschillende functies aan een aantal series.,BeetleLM/beetlelm_fas-nld_simultaneous,step-10000,nld,7.956573486328125,2854.2759617244124
213,"Hij verleende in de jaren 80 zijn medewerking aan shows zoals Taxi, Cheers en The Tracy Ullman Show.",BeetleLM/beetlelm_fas-nld_simultaneous,step-10000,nld,7.749228000640869,2319.7808538256686
214,In 1989 werkte hij samen met Brooks en Groening aan The Simpsons en was hij verantwoordelijk voor het werven van het eerste schrijversteam.,BeetleLM/beetlelm_fas-nld_simultaneous,step-10000,nld,6.969040393829346,1063.2020056545975
215,"Na zijn vertrek uit de serie in 1993, bleef hij op papier uitvoerend producent, waardoor hij voor elke reeks royalty's ontving, ter waarde van enkele tientallen miljoenen dollars.",BeetleLM/beetlelm_fas-nld_simultaneous,step-10000,nld,7.300543785095215,1481.105111525285
216,Het Chinese persbureau Xinhua meldde eerder nog dat een vliegtuig was gekaapt.,BeetleLM/beetlelm_fas-nld_simultaneous,step-10000,nld,7.314374923706055,1501.732805024575
217,"Uit latere rapporten blijkt daarnaast dat er een bommelding werd gedaan in het vliegtuig, waardoor het werd teruggeleid naar Afghanistan en landde in Kandahar.",BeetleLM/beetlelm_fas-nld_simultaneous,step-10000,nld,7.124098300933838,1241.5281773858985
218,"Uit eerste berichten blijkt dat het vliegtuig terug is geleid naar Afghanistan, nadat het niet was toegestaan een noodlanding te maken in Ürümqi.",BeetleLM/beetlelm_fas-nld_simultaneous,step-10000,nld,6.722016334533691,830.4903708072469
219,Vliegtuigongelukken komen vaak voor in Iran. Ze beschikken voor zowel burgerlijke als militaire operaties over een verouderde vloot die slecht is onderhouden.,BeetleLM/beetlelm_fas-nld_simultaneous,step-10000,nld,7.2610273361206055,1423.7184235103434
220,Door internationale sancties kunnen er geen nieuwe vliegtuigen aangeschaft worden.,BeetleLM/beetlelm_fas-nld_simultaneous,step-10000,nld,6.413844108581543,610.2349876126543
221,Eerder deze week heeft een ongeluk met een politiehelikopter aan drie mensen het leven gekost en nog eens drie personen raakten gewond.,BeetleLM/beetlelm_fas-nld_simultaneous,step-10000,nld,6.499973297119141,665.1238720837155
222,Afgelopen maand vond in Iran de ergste vliegtuigramp in jaren plaats toen een vliegtuig dat onderweg was naar Armenië neerstortte. De 168 inzittenden overleefden het niet.,BeetleLM/beetlelm_fas-nld_simultaneous,step-10000,nld,7.618976593017578,2036.4769182954394
223,In dezelfde maand schoot nog een passagiersvliegtuig van een landingsbaan op Mashhad. Dit crashte tegen een muur en hierbij kwamen zeventien mensen om het leven.,BeetleLM/beetlelm_fas-nld_simultaneous,step-10000,nld,6.655861854553223,777.3275777850457
224,Aerosmith heeft de resterende concerten van hun tournee afgelast.,BeetleLM/beetlelm_fas-nld_simultaneous,step-10000,nld,7.102441787719727,1214.930056826535
225,De toer van de rockband zou tot zestien september door de VS en Canada trekken.,BeetleLM/beetlelm_fas-nld_simultaneous,step-10000,nld,6.556344509124756,703.6946379335693
226,Ze annuleerden de toer nadat zanger Steven Tyler gewond raakte toen hij van het podium viel tijdens een optreden op 5 augustus.,BeetleLM/beetlelm_fas-nld_simultaneous,step-10000,nld,7.992053031921387,2957.362290379784
227,"Murray verloor de eerste set in een tiebreak, nadat beide mannen in de hele set geen enkel punt weggaven als zij serveerden.",BeetleLM/beetlelm_fas-nld_simultaneous,step-10000,nld,7.436816215515137,1697.3376522135925
228,"Del Potro had een vroege voorsprong in de tweede set, maar ook hier volgde een tiebreak nadat het 6-6 werd.",BeetleLM/beetlelm_fas-nld_simultaneous,step-10000,nld,6.756587505340576,859.7034509804312
229,"Potro werd toen behandeld aan zijn schouder, maar slaagde erin de wedstrijd te vervolgen.",BeetleLM/beetlelm_fas-nld_simultaneous,step-10000,nld,6.324672222137451,558.1748263255226
230,De plaatselijke starttijd van het programma was 20.30 uur (15.00 UTC).,BeetleLM/beetlelm_fas-nld_simultaneous,step-10000,nld,5.873184680938721,355.37894858203174
231,Bekende zangers uit het hele land zongen bhajans of religieuze liederen aan de voeten van Shri Shyam.,BeetleLM/beetlelm_fas-nld_simultaneous,step-10000,nld,7.733708381652832,2284.0566687459086
232,"De avond ving aan met de zanger Sanju Sharma, gevolgd door Jai Shankar Choudhary. Lakka Singh heeft ook de Chhappan bhog bhajan gepresenteerd. De zanger Raju Khandelwal hielp hem hierbij.",BeetleLM/beetlelm_fas-nld_simultaneous,step-10000,nld,7.9613776206970215,2868.0212777064294
233,Daarna zong Lakkha Singh de bhajans.,BeetleLM/beetlelm_fas-nld_simultaneous,step-10000,nld,8.887042999267578,7237.585963094052
234,"Aan Baba Shyam werden 108 borden met Chhappan Bhog geserveerd (in het hindoeïsme zijn dit 56 verschillende eetbare artikelen, zoals, snoepjes, fruit, noten, gerechten, etc. die aan het heilige figuur worden aangeboden).",BeetleLM/beetlelm_fas-nld_simultaneous,step-10000,nld,7.6198015213012695,2038.1575588130675
235,Lakkha Singh heeft ook de Chhappan bhog bhajan gepresenteerd. De zanger Raju Khandelwal hielp hem hierbij.,BeetleLM/beetlelm_fas-nld_simultaneous,step-10000,nld,8.398427963256836,4440.081287511807
236,"Donderdag onthulde Satoru Iwata, de directeur van Nintendo, tijdens de keynotepresentatie van de Tokyo Game Show het ontwerp van de controller voor de nieuwe Nintendo Revolution.",BeetleLM/beetlelm_fas-nld_simultaneous,step-10000,nld,6.962005615234375,1055.748861290119
237,Net als bij een tv-afstandsbediening maakt de controller gebruik van twee sensoren vlak bij de televisie van de gebruiken om de positie in een driedimensionale ruimte te kunnen bepalen.,BeetleLM/beetlelm_fas-nld_simultaneous,step-10000,nld,6.215054988861084,500.22349515465044
238,Hiermee besturen spelers acties en bewegingen in videogames door het apparaat door de lucht te bewegen.,BeetleLM/beetlelm_fas-nld_simultaneous,step-10000,nld,6.591222286224365,728.6709702983744
239,Kort na de start verloor Giancarlo Fisichella de controle over zijn auto en lag hij hiermee uit de race.,BeetleLM/beetlelm_fas-nld_simultaneous,step-10000,nld,7.060937404632568,1165.5372338404356
240,"Zijn teamgenoot Fernando Alonso lag het grootste deel van de race aan kop, maar verloor deze positie direct na zijn pitstop, waarschijnlijk vanwege een slecht geplaatst rechtervoorwiel.",BeetleLM/beetlelm_fas-nld_simultaneous,step-10000,nld,7.4728684425354,1759.6468993508493
241,Michael Schumacher eindigde zijn race niet lang na Alonso door de schade aan de wielophanging vanwege de vele duels tijdens de race.,BeetleLM/beetlelm_fas-nld_simultaneous,step-10000,nld,7.013976097106934,1112.0674140369797
242,In een transcriptie van de nieuwsconferentie zei hij dat 'ze een schattig meisje was met een aardige stem'.,BeetleLM/beetlelm_fas-nld_simultaneous,step-10000,nld,6.345117092132568,569.7040936773585
243,"Ik was elke keer ontroerd als we dit repeteerden, uit de grond van mijn hart.",BeetleLM/beetlelm_fas-nld_simultaneous,step-10000,nld,6.247249126434326,516.5897950669136
244,Op een interne camera was circa 3 minuten na de lancering te zien dat veel stukken isolatieschuim losraakten van de brandstoftank.,BeetleLM/beetlelm_fas-nld_simultaneous,step-10000,nld,7.182218074798584,1315.823619014992
245,Vermoedelijk hebben deze echter geen schade aangericht aan de shuttle.,BeetleLM/beetlelm_fas-nld_simultaneous,step-10000,nld,7.244930744171143,1400.9848662473628
246,"De directeur van het Shuttle Programma van NASA, N. Wayne Hale Jr. zei dat het schuim gevallen was 'na de periode waar we zorgen over hadden.'",BeetleLM/beetlelm_fas-nld_simultaneous,step-10000,nld,6.713668346405029,823.5863046765172
247,"Na vijf minuten begint de wind, en een minuut later bereikt de wind al zo'n 70 km/u... dan begint het te regenen, maar zo hard en zo veel dat aanvoelt als speldenprikjes op je huid. Vervolgens valt er hagel. Mensen raken in paniek, beginnen te schreeuwen en rennen over elkaar heen.",BeetleLM/beetlelm_fas-nld_simultaneous,step-10000,nld,6.073702335357666,434.2855796626843
248,"'Ik raakte mijn zus en haar vriend kwijt. Toen ik er probeerde te komen, sprongen mensen zo over twee rolstoelgebruikers heen en duwden hen weg,' aldus Armand Versace.",BeetleLM/beetlelm_fas-nld_simultaneous,step-10000,nld,6.751343727111816,855.2071558312567
249,Daarnaast meldde de NHK dat de kerncentrale van Kashiwazaki Kariwa in de prefectuur Niigata zoals normaal werkte.,BeetleLM/beetlelm_fas-nld_simultaneous,step-10000,nld,7.541139602661133,1883.975786092374
250,Hokuriku Electric Power Co. rapporteert dat de aardbeving geen problemen heeft veroorzaakt en dat in de kernenergiecentrale van Shika reactoren 1 en 2 zijn stopgezet.,BeetleLM/beetlelm_fas-nld_simultaneous,step-10000,nld,7.02105712890625,1119.9699447744365
251,Volgens meldingen zitten er 9400 huishouden in de regio zonder water en ongeveer 100 zonder stroom.,BeetleLM/beetlelm_fas-nld_simultaneous,step-10000,nld,6.552392482757568,700.9191062696387
252,"Enkele wegen zijn aangetast, de spoorwegdienst is gestaakt in de getroffen gebieden en de prefectuur van het vliegveld Noto in Ishikawa blijft voor langere tijd gesloten.",BeetleLM/beetlelm_fas-nld_simultaneous,step-10000,nld,7.237199783325195,1390.1956662790321
253,Eén bom is ontploft buiten het kantoor waar de gouverneur-generaal werkt.,BeetleLM/beetlelm_fas-nld_simultaneous,step-10000,nld,7.829530239105225,2513.7482353942787
254,Binnen een periode van twee uur kwamen er nog drie bommen tot ontploffing in de buurt van overheidsgebouwen.,BeetleLM/beetlelm_fas-nld_simultaneous,step-10000,nld,5.906431198120117,367.3926613828758
255,"In sommige rapporten wordt het officiële dodental op acht geschat. Officiële rapporten bevestigen maximaal 30 gewonden, maar de definitieve aantallen zijn er nog niet.",BeetleLM/beetlelm_fas-nld_simultaneous,step-10000,nld,7.174617290496826,1305.8602402211804
256,"In urinemonsters van huisdieren die zijn gestorven na het eten van besmette dierenvoeding, werd zowel cyaanuurzuur als melamine aangetroffen.",BeetleLM/beetlelm_fas-nld_simultaneous,step-10000,nld,7.418665409088135,1666.8075165179473
257,Onderzoekers van de universiteit stelden dat de twee verbindingen met elkaar reageren waardoor zich kristallen vormen die de nierfunctie kunnen blokkeren.,BeetleLM/beetlelm_fas-nld_simultaneous,step-10000,nld,6.91633939743042,1008.6210676427975
258,Wetenschappers kwamen erachter dat er kristallen gevormd worden in kattenurine wanneer je hier melanine en cyanuurzuur aan toevoegt.,BeetleLM/beetlelm_fas-nld_simultaneous,step-10000,nld,7.4572553634643555,1732.3867543348538
259,"De samenstelling van deze kristallen heeft gelijkenissen met die van de urine van de getroffen huisdieren, vergeleken met de infraroodspectroscopie (FTIR).",BeetleLM/beetlelm_fas-nld_simultaneous,step-10000,nld,6.968015193939209,1062.1125696154807
260,"Ik weet niet of je je dit realiseert, maar de meeste goederen uit Midden-Amerika kwamen dit land binnen zonder dat er belasting over hoefde te worden betaald.",BeetleLM/beetlelm_fas-nld_simultaneous,step-10000,nld,5.8290886878967285,340.0486473773314
261,En toch werd tachtig procent van onze goederen belast aan de hand van tarieven uit landen in Midden-Amerika.,BeetleLM/beetlelm_fas-nld_simultaneous,step-10000,nld,6.065587043762207,430.7754875225778
262,Dat vond ik erg raar; het was ongetwijfeld oneerlijk.,BeetleLM/beetlelm_fas-nld_simultaneous,step-10000,nld,6.927931308746338,1020.3809416352287
263,Wat ik maar wil zeggen is dat jullie ons behandelen zoals wij jullie behandelen.,BeetleLM/beetlelm_fas-nld_simultaneous,step-10000,nld,6.876659870147705,969.3830809539414
264,"Arnold Schwarzenegger, de gouverneur van Californië, heeft een wetsvoorstel ondertekend waarmee het verboden wordt om gewelddadige videogames aan minderjarigen te verkopen of te verhuren.",BeetleLM/beetlelm_fas-nld_simultaneous,step-10000,nld,7.2766008377075195,1446.0642544213802
265,"Onder deze wet moeten gewelddadige videogames die in de staat Californië worden verkocht, een '18'-sticker hebben. Verkoop aan een minderjarige wordt bestraft met een boete van $ 1000 per overtreding.",BeetleLM/beetlelm_fas-nld_simultaneous,step-10000,nld,7.393941879272461,1626.1033992693121
266,"Kier Starmer QC, directeur van het Openbaar Ministerie, heeft vanochtend verklaard dat hij zowel Pryce en Huhne wil vervolgen.",BeetleLM/beetlelm_fas-nld_simultaneous,step-10000,nld,7.484742641448975,1780.6658412338
267,"Huhne heeft ontslag genomen. In het kabinet is parlementslid Ed Davey zijn vervanger, terwijl parlementslid Norman Lamb naar verwachting Daveys taken als minister van Handel overneemt.",BeetleLM/beetlelm_fas-nld_simultaneous,step-10000,nld,7.983879089355469,2933.28750785931
268,Naar verwachting worden Huhne en Pryce op 16 februari voorgeleid voor de Westminster Magistrates Court.,BeetleLM/beetlelm_fas-nld_simultaneous,step-10000,nld,7.689580917358398,2185.45848257112
269,"De slachtoffers waren Nicholas Alden, 25, en Zachary Cuddeback, 21. Cuddeback was de bestuurder van het voertuig.",BeetleLM/beetlelm_fas-nld_simultaneous,step-10000,nld,7.074612140655518,1181.585123086006
270,"Edgar Veguilla raakte gewond aan zijn arm en kaak, en Kristoffer Schneider moest een reconstructieve gezichtsoperatie ondergaan.",BeetleLM/beetlelm_fas-nld_simultaneous,step-10000,nld,8.067619323730469,3189.499617414582
271,"Het wapen van Uka faalde terwijl hij het op het hoofd van een vijfde man gericht hield. Schneider heeft chronische pijn, is blind in één oog, mist een stuk schedel en zijn gezicht is met titanium gereconstrueerd.",BeetleLM/beetlelm_fas-nld_simultaneous,step-10000,nld,7.11483097076416,1230.0756748769934
272,Schneider legde via videolink vanuit een USAF-basis in het land waaruit hij afkomstig was zijn verklaring af.,BeetleLM/beetlelm_fas-nld_simultaneous,step-10000,nld,7.805800914764404,2454.800845063726
273,Naast het evenement van woensdag deed Carpanedo ook nog mee aan twee individuele races van het kampioenschap.,BeetleLM/beetlelm_fas-nld_simultaneous,step-10000,nld,6.88489294052124,977.3970244912298
274,"Haar eerste was de Slalom, waar ze een Did Not Finish kreeg bij haar eerste run. 36 van de 116 deelnemers kregen hetzelfde resultaat in die race.",BeetleLM/beetlelm_fas-nld_simultaneous,step-10000,nld,7.189014434814453,1324.7968882914995
275,"In de andere wedstrijd waar ze aan deelnam, de zittende Grote Slalom, werd ze tiende van de dames, met een gecombineerde tijd van 4:41:30. Dat is 2:11:60 minuten langzamer dan de Oostenrijkse winnares Claudia Loesch, en 1:09:02 minuten langzamer dan de Hongaarse Gyöngyi Dani, die als negende eindigde.",BeetleLM/beetlelm_fas-nld_simultaneous,step-10000,nld,6.734766006469727,841.1466381863463
276,Vier skiërs van de vrouwengroep voor de zittende slalom konden hun ritten niet afmaken en het lukte 45 van de 117 skiërs in de reuzenslalom niet om zich te plaatsen tijdens de race.,BeetleLM/beetlelm_fas-nld_simultaneous,step-10000,nld,6.8389129638671875,933.4738631924358
277,De gestolen laptop en mobiele telefoon zijn door de politie van Madhya Pradesh teruggevonden.,BeetleLM/beetlelm_fas-nld_simultaneous,step-10000,nld,7.59613561630249,1990.4890002529396
278,Volgens adjunct-inspecteur-generaal D. K. Arya zijn vijf van de verkrachters van de Zweedse vrouw gearresteerd en hebben ze haar mobiele telefoon en laptop gevonden.,BeetleLM/beetlelm_fas-nld_simultaneous,step-10000,nld,7.017737865447998,1116.258632281827
279,"Baba Kanjar, Bhutha Kanjar, Rampro Kanjar, Gaza Kanjar en Vishnu Kanjar zijn de verdachten.",BeetleLM/beetlelm_fas-nld_simultaneous,step-10000,nld,8.846089363098145,6947.167927728967
280,Volgens politiecommissaris Chandra Shekhar Solanki hadden de verdachten hun gezichten bedekt toen ze in de rechtbank verschenen.,BeetleLM/beetlelm_fas-nld_simultaneous,step-10000,nld,7.24183988571167,1396.6613055211121
281,"Er bevonden zich drie mensen in het huis toen de auto het huis raakte, maar geen van hen raakte gewond.",BeetleLM/beetlelm_fas-nld_simultaneous,step-10000,nld,6.167640209197998,477.05901728439034
282,De bestuurder liep echter wel ernstige verwondingen aan het hoofd op.,BeetleLM/beetlelm_fas-nld_simultaneous,step-10000,nld,7.565078258514404,1929.6197823249795
283,De weg waar het ongeluk plaatsvond werd tijdelijk gesloten terwijl de hulpdiensten probeerden de chauffeur uit de rode Audi TT te bevrijden.,BeetleLM/beetlelm_fas-nld_simultaneous,step-10000,nld,7.33611536026001,1534.7386121242014
284,"Aanvankelijk werd hij opgenomen in Great Yarmouth, in het James Paget Hospital.",BeetleLM/beetlelm_fas-nld_simultaneous,step-10000,nld,7.3577728271484375,1568.339706734684
285,Hij werd vervolgens overgeplaatst naar het Addenbrooke's Hospital in Cambridge.,BeetleLM/beetlelm_fas-nld_simultaneous,step-10000,nld,7.3155741691589355,1503.5348315825493
286,Adekoya is sindsdien in de Edinburgh Sheriff Court veroordeeld voor het vermoorden van haar zoon.,BeetleLM/beetlelm_fas-nld_simultaneous,step-10000,nld,7.687664985656738,2181.2753020054624
287,"Ze zit in hechtenis in afwachting van de aanklacht en het proces, maar het ooggetuigenverslag is mogelijk bedoezeld omdat haar verhaal veelvuldig is gepubliceerd.",BeetleLM/beetlelm_fas-nld_simultaneous,step-10000,nld,7.005236625671387,1102.3908781319205
288,"Dit is gangbare praktijk in de rest van het VK, maar justitie in Schotland werkt anders en rechtbanken hebben de publicatie van foto's als mogelijk nadelig bestempeld.",BeetleLM/beetlelm_fas-nld_simultaneous,step-10000,nld,6.4795942306518555,651.7064501111408
289,Professor Pamela Ferguson van de Universiteit van Dundee merkt op dat 'journalisten een gevaarlijk spelletje spelen als ze foto's e.d. van verdachten publiceren.',BeetleLM/beetlelm_fas-nld_simultaneous,step-10000,nld,6.840924263000488,935.3532477331227
290,"Crown Office heeft de algehele leiding over vervolgingen en heeft aan journalisten aangegeven dat er geen verdere uitspraken worden gedaan, in ieder geval totdat aanklachten zijn gedaan.",BeetleLM/beetlelm_fas-nld_simultaneous,step-10000,nld,6.629997253417969,757.4800901577477
291,"Volgens bronnen verwijst het document naar een geschillenregeling, iets wat de Palestijnen graag wilden op grond van de grenzen voor de oorlog in het Midden-Oosten in 1967.",BeetleLM/beetlelm_fas-nld_simultaneous,step-10000,nld,5.8743696212768555,355.8003010229813
292,"Andere onderwerpen die besproken waren zijn de toekomstige status van Jeruzalem, een stad die voor beide volken heilig is, en de problemen in de Jordaanvallei.",BeetleLM/beetlelm_fas-nld_simultaneous,step-10000,nld,6.562635898590088,708.1358108908092
293,Israël eist dat er na ondertekening van een overeenkomst tien jaar lang een permanente militaire aanwezigheid is in de vallei. De PA is echter slechts bereid tot een aanwezigheid van vijf jaar.,BeetleLM/beetlelm_fas-nld_simultaneous,step-10000,nld,6.881240367889404,973.8335228053082
294,Schutters in de aanvullende proef voor ongediertebestrijding moesten nauwlettend in de gaten worden gehouden door boswachters. De proef werd namelijk gevolgd en de effectiviteit ervan werd beoordeeld.,BeetleLM/beetlelm_fas-nld_simultaneous,step-10000,nld,7.033063888549805,1133.4982074870347
295,"Bij een samenwerking tussen de NPWS en de Sporting Shooters Association of Australia (NSW) Inc, werden gekwalificeerde vrijwilligers gerekruteerd voor het jachtprogramma van de Sporting Shooters Association.",BeetleLM/beetlelm_fas-nld_simultaneous,step-10000,nld,6.950289249420166,1043.4515022762125
296,"Volgens Mick O'Flynn, waarnemend directeur voor parkbehoud en erfgoed bij de NPWS, hebben de vier gekozen schutters voor de eerste schietoperatie een uitgebreide veiligheids- en trainingsinstructie gehad.",BeetleLM/beetlelm_fas-nld_simultaneous,step-10000,nld,7.509697437286377,1825.6610822726348
297,Gisteren zwoor Martelly een negenkoppige nieuwe voorlopige kiesraad (Provisional Electoral Council of CEP) in.,BeetleLM/beetlelm_fas-nld_simultaneous,step-10000,nld,7.6340250968933105,2067.35459782875
298,"Hiermee heeft Martelly in de afgelopen vier jaar, vijf keer een CEP behaald.",BeetleLM/beetlelm_fas-nld_simultaneous,step-10000,nld,6.584368705749512,723.6940395426415
299,Afgelopen maand heeft de presidentiële commissie het ontslag van de eerdere Nationale Kiesraad aanbevolen. Dit is onderdeel van een maatregelenpakket zodat er nieuwe verkiezingen komen in het land.,BeetleLM/beetlelm_fas-nld_simultaneous,step-10000,nld,6.855717182159424,949.2927011182569
300,De commissie werd door Martelly ingesteld als reactie op de wijdverbreide protesten tegen de overheid die sinds oktober hebben plaatsgevonden.,BeetleLM/beetlelm_fas-nld_simultaneous,step-10000,nld,7.25233793258667,1411.4007537159446
301,"De soms gewelddadige protesten ontstonden door het uitblijven van verkiezingen, waarvan sommige al sinds 2011 hadden moeten plaatsvinden.",BeetleLM/beetlelm_fas-nld_simultaneous,step-10000,nld,7.852093696594238,2571.111813494514
302,Er zijn ongeveer 60 gevallen gerapporteerd van defecte iPods die oververhit raken. In totaal leidde dit tot zes branden en vier mensen met lichte brandwonden.,BeetleLM/beetlelm_fas-nld_simultaneous,step-10000,nld,7.1464033126831055,1269.531625591883
303,"Het Japanse ministerie van Economie, Handel en Industrie (METI) liet weten dat het bekend was met de 27 ongelukken die verband hielden met de apparaten.",BeetleLM/beetlelm_fas-nld_simultaneous,step-10000,nld,6.457772731781006,637.639280114768
304,Vorige week kondigde METI aan dat Apple 34 aanvullende incidenten met oververhitting had gemeld die het bedrijf 'niet ernstig' noemde.,BeetleLM/beetlelm_fas-nld_simultaneous,step-10000,nld,7.694476127624512,2196.1829893129047
305,"'Erg betreurenswaardig', luidde de reactie van het ministerie over het feit dat Apple het rapport heeft uitgesteld.",BeetleLM/beetlelm_fas-nld_simultaneous,step-10000,nld,7.505359172821045,1817.7580368192614
306,Mariana werd om 07.19 uur lokale tijd (vrijdag 21.19 GMT) getroffen door de aardbeving.,BeetleLM/beetlelm_fas-nld_simultaneous,step-10000,nld,6.55182409286499,700.5208241346129
307,Het bureau voor calamiteitenbeheer van de Noordelĳke Marianen verklaarde dat er landelijk geen schade is gemeld.,BeetleLM/beetlelm_fas-nld_simultaneous,step-10000,nld,7.815655708312988,2479.1119945223895
308,Daarnaast meldde het National Tsunami Warning Center dat er geen sprake was van een tsunami-waarschuwing.,BeetleLM/beetlelm_fas-nld_simultaneous,step-10000,nld,6.762396335601807,864.7118548030118
309,"In Manilla, de Filippijnse hoofdstad, heeft een voormalige politieman uit de Filippijnen toeristen uit Hongkong gegijzeld door hun bus te kapen.",BeetleLM/beetlelm_fas-nld_simultaneous,step-10000,nld,7.362364292144775,1575.557240447495
310,Met zijn M16-geweer schoot Rolando Mendoza op de toeristen.,BeetleLM/beetlelm_fas-nld_simultaneous,step-10000,nld,7.239046096801758,1392.7647742322467
311,Verschillende gijzelaars zijn in veiligheid gebracht en vooralsnog zijn er minstens zes dodelijke slachtoffers bevestigd.,BeetleLM/beetlelm_fas-nld_simultaneous,step-10000,nld,7.436870098114014,1697.4291116414793
312,"Zes gijzelaars werden eerder vrijgelaten, inclusief de kinderen en ouderen, en de Filipijnse fotografen.",BeetleLM/beetlelm_fas-nld_simultaneous,step-10000,nld,6.924554824829102,1016.941451755174
313,Later keerden de fotografen terug in ruil voor een oudere vrouw die naar het toilet moest. Mendoza is uiteindelijk neergeschoten.,BeetleLM/beetlelm_fas-nld_simultaneous,step-10000,nld,6.9210004806518555,1013.3333079186274
314,Liggins ging in de geneeskunde werken en volgde hiermee het voorbeeld van zijn vader.,BeetleLM/beetlelm_fas-nld_simultaneous,step-10000,nld,6.573731422424316,716.0366998525142
315,Opgeleid als verloskundige ging hij in 1959 aan de slag in het National Women's Hospital in Auckland.,BeetleLM/beetlelm_fas-nld_simultaneous,step-10000,nld,6.455934047698975,636.4679401124531
316,"Toen hij werkzaam was in het ziekenhuis, deed Liggins in zijn vrije tijd onderzoek naar vroeggeboorte.",BeetleLM/beetlelm_fas-nld_simultaneous,step-10000,nld,5.962070941925049,388.4136740599599
317,Zijn onderzoek toonde aan dat de rijping van de foetale longen van baby's werd versneld door het toedienen van een hormoon.,BeetleLM/beetlelm_fas-nld_simultaneous,step-10000,nld,6.68135929107666,797.4022774808403
318,Xinhua heeft gemeld dat onderzoekers van de overheid woensdag twee 'zwarte dozen' met vluchtrecorders terug hebben gevonden.,BeetleLM/beetlelm_fas-nld_simultaneous,step-10000,nld,7.087115287780762,1196.451399674356
319,Ook medeworstelaars brachten hulde aan Luna.,BeetleLM/beetlelm_fas-nld_simultaneous,step-10000,nld,9.701920509338379,16348.975426866005
320,"Tommy Dreamer zei, 'Luna was de eerste 'Queen of Extreme'. Mijn eerste manager. Luna is overleden op de nacht van twee manen. Net zo uniek als zij was. Een sterke vrouw.'",BeetleLM/beetlelm_fas-nld_simultaneous,step-10000,nld,6.880314350128174,972.9321530733106
321,Dustin 'Goldust' Runnels gaf aan dat 'Luna net zo raar was als ik... misschien nog wel raarder... ik hou van haar en ga haar missen... hopelijk is ze op een betere plek'.,BeetleLM/beetlelm_fas-nld_simultaneous,step-10000,nld,6.364377975463867,580.7834543781429
