sentence_id,sentence,repo,revision,iso_code,nll,ppl
214,In 1989 werkte hij samen met Brooks en Groening aan The Simpsons en was hij verantwoordelijk voor het werven van het eerste schrijversteam.,BeetleLM/beetlelm_nld-fra_balanced,step-8000,nld,5.857145309448242,349.72436283161863
215,"Na zijn vertrek uit de serie in 1993, bleef hij op papier uitvoerend producent, waardoor hij voor elke reeks royalty's ontving, ter waarde van enkele tientallen miljoenen dollars.",BeetleLM/beetlelm_nld-fra_balanced,step-8000,nld,6.758095741271973,861.0010649235508
216,Het Chinese persbureau Xinhua meldde eerder nog dat een vliegtuig was gekaapt.,BeetleLM/beetlelm_nld-fra_balanced,step-8000,nld,7.200527191162109,1340.137086622723
217,"Uit latere rapporten blijkt daarnaast dat er een bommelding werd gedaan in het vliegtuig, waardoor het werd teruggeleid naar Afghanistan en landde in Kandahar.",BeetleLM/beetlelm_nld-fra_balanced,step-8000,nld,6.5675435066223145,711.6196054411513
218,"Uit eerste berichten blijkt dat het vliegtuig terug is geleid naar Afghanistan, nadat het niet was toegestaan een noodlanding te maken in Ürümqi.",BeetleLM/beetlelm_nld-fra_balanced,step-8000,nld,6.495706558227539,662.2920078996751
219,Vliegtuigongelukken komen vaak voor in Iran. Ze beschikken voor zowel burgerlijke als militaire operaties over een verouderde vloot die slecht is onderhouden.,BeetleLM/beetlelm_nld-fra_balanced,step-8000,nld,7.065704822540283,1171.1071033194482
220,Door internationale sancties kunnen er geen nieuwe vliegtuigen aangeschaft worden.,BeetleLM/beetlelm_nld-fra_balanced,step-8000,nld,7.183408260345459,1317.3906255978961
221,Eerder deze week heeft een ongeluk met een politiehelikopter aan drie mensen het leven gekost en nog eens drie personen raakten gewond.,BeetleLM/beetlelm_nld-fra_balanced,step-8000,nld,6.387841701507568,594.571930157628
222,Afgelopen maand vond in Iran de ergste vliegtuigramp in jaren plaats toen een vliegtuig dat onderweg was naar Armenië neerstortte. De 168 inzittenden overleefden het niet.,BeetleLM/beetlelm_nld-fra_balanced,step-8000,nld,7.297662258148193,1476.843410287344
223,In dezelfde maand schoot nog een passagiersvliegtuig van een landingsbaan op Mashhad. Dit crashte tegen een muur en hierbij kwamen zeventien mensen om het leven.,BeetleLM/beetlelm_nld-fra_balanced,step-8000,nld,6.8106489181518555,907.4594828561723
224,Aerosmith heeft de resterende concerten van hun tournee afgelast.,BeetleLM/beetlelm_nld-fra_balanced,step-8000,nld,7.343861103057861,1546.672461272958
225,De toer van de rockband zou tot zestien september door de VS en Canada trekken.,BeetleLM/beetlelm_nld-fra_balanced,step-8000,nld,6.656667709350586,777.9542434095633
226,Ze annuleerden de toer nadat zanger Steven Tyler gewond raakte toen hij van het podium viel tijdens een optreden op 5 augustus.,BeetleLM/beetlelm_nld-fra_balanced,step-8000,nld,7.851478099822998,2569.5295324371527
227,"Murray verloor de eerste set in een tiebreak, nadat beide mannen in de hele set geen enkel punt weggaven als zij serveerden.",BeetleLM/beetlelm_nld-fra_balanced,step-8000,nld,7.821255207061768,2493.032717195439
228,"Del Potro had een vroege voorsprong in de tweede set, maar ook hier volgde een tiebreak nadat het 6-6 werd.",BeetleLM/beetlelm_nld-fra_balanced,step-8000,nld,7.243235111236572,1398.61132306501
229,"Potro werd toen behandeld aan zijn schouder, maar slaagde erin de wedstrijd te vervolgen.",BeetleLM/beetlelm_nld-fra_balanced,step-8000,nld,6.573657989501953,715.9841211156535
230,De plaatselijke starttijd van het programma was 20.30 uur (15.00 UTC).,BeetleLM/beetlelm_nld-fra_balanced,step-8000,nld,6.201706409454346,493.5905905253469
231,Bekende zangers uit het hele land zongen bhajans of religieuze liederen aan de voeten van Shri Shyam.,BeetleLM/beetlelm_nld-fra_balanced,step-8000,nld,7.6913371086120605,2189.299937821188
232,"De avond ving aan met de zanger Sanju Sharma, gevolgd door Jai Shankar Choudhary. Lakka Singh heeft ook de Chhappan bhog bhajan gepresenteerd. De zanger Raju Khandelwal hielp hem hierbij.",BeetleLM/beetlelm_nld-fra_balanced,step-8000,nld,7.659320831298828,2120.3168865823923
233,Daarna zong Lakkha Singh de bhajans.,BeetleLM/beetlelm_nld-fra_balanced,step-8000,nld,8.250785827636719,3830.6348577305043
234,"Aan Baba Shyam werden 108 borden met Chhappan Bhog geserveerd (in het hindoeïsme zijn dit 56 verschillende eetbare artikelen, zoals, snoepjes, fruit, noten, gerechten, etc. die aan het heilige figuur worden aangeboden).",BeetleLM/beetlelm_nld-fra_balanced,step-8000,nld,7.028383731842041,1128.2056529010638
235,Lakkha Singh heeft ook de Chhappan bhog bhajan gepresenteerd. De zanger Raju Khandelwal hielp hem hierbij.,BeetleLM/beetlelm_nld-fra_balanced,step-8000,nld,7.851755142211914,2570.2414996552047
236,"Donderdag onthulde Satoru Iwata, de directeur van Nintendo, tijdens de keynotepresentatie van de Tokyo Game Show het ontwerp van de controller voor de nieuwe Nintendo Revolution.",BeetleLM/beetlelm_nld-fra_balanced,step-8000,nld,6.275147914886475,531.2049490669764
237,Net als bij een tv-afstandsbediening maakt de controller gebruik van twee sensoren vlak bij de televisie van de gebruiken om de positie in een driedimensionale ruimte te kunnen bepalen.,BeetleLM/beetlelm_nld-fra_balanced,step-8000,nld,6.559458255767822,705.88917960047
238,Hiermee besturen spelers acties en bewegingen in videogames door het apparaat door de lucht te bewegen.,BeetleLM/beetlelm_nld-fra_balanced,step-8000,nld,6.402989387512207,603.6468777695893
239,Kort na de start verloor Giancarlo Fisichella de controle over zijn auto en lag hij hiermee uit de race.,BeetleLM/beetlelm_nld-fra_balanced,step-8000,nld,7.3490400314331055,1554.7033449055282
240,"Zijn teamgenoot Fernando Alonso lag het grootste deel van de race aan kop, maar verloor deze positie direct na zijn pitstop, waarschijnlijk vanwege een slecht geplaatst rechtervoorwiel.",BeetleLM/beetlelm_nld-fra_balanced,step-8000,nld,7.279698371887207,1450.5504323332168
241,Michael Schumacher eindigde zijn race niet lang na Alonso door de schade aan de wielophanging vanwege de vele duels tijdens de race.,BeetleLM/beetlelm_nld-fra_balanced,step-8000,nld,6.973973751068115,1068.4601203803054
242,In een transcriptie van de nieuwsconferentie zei hij dat 'ze een schattig meisje was met een aardige stem'.,BeetleLM/beetlelm_nld-fra_balanced,step-8000,nld,6.697789669036865,810.6121224861025
243,"Ik was elke keer ontroerd als we dit repeteerden, uit de grond van mijn hart.",BeetleLM/beetlelm_nld-fra_balanced,step-8000,nld,6.116949081420898,453.47905416482644
244,Op een interne camera was circa 3 minuten na de lancering te zien dat veel stukken isolatieschuim losraakten van de brandstoftank.,BeetleLM/beetlelm_nld-fra_balanced,step-8000,nld,7.311154365539551,1496.9041668041236
245,Vermoedelijk hebben deze echter geen schade aangericht aan de shuttle.,BeetleLM/beetlelm_nld-fra_balanced,step-8000,nld,7.13434362411499,1254.3134174246777
246,"De directeur van het Shuttle Programma van NASA, N. Wayne Hale Jr. zei dat het schuim gevallen was 'na de periode waar we zorgen over hadden.'",BeetleLM/beetlelm_nld-fra_balanced,step-8000,nld,6.449222087860107,632.2102974071469
247,"Na vijf minuten begint de wind, en een minuut later bereikt de wind al zo'n 70 km/u... dan begint het te regenen, maar zo hard en zo veel dat aanvoelt als speldenprikjes op je huid. Vervolgens valt er hagel. Mensen raken in paniek, beginnen te schreeuwen en rennen over elkaar heen.",BeetleLM/beetlelm_nld-fra_balanced,step-8000,nld,5.713163375854492,302.8275119291444
248,"'Ik raakte mijn zus en haar vriend kwijt. Toen ik er probeerde te komen, sprongen mensen zo over twee rolstoelgebruikers heen en duwden hen weg,' aldus Armand Versace.",BeetleLM/beetlelm_nld-fra_balanced,step-8000,nld,6.924086093902588,1016.4648915442625
249,Daarnaast meldde de NHK dat de kerncentrale van Kashiwazaki Kariwa in de prefectuur Niigata zoals normaal werkte.,BeetleLM/beetlelm_nld-fra_balanced,step-8000,nld,7.535473823547363,1873.3317772079388
250,Hokuriku Electric Power Co. rapporteert dat de aardbeving geen problemen heeft veroorzaakt en dat in de kernenergiecentrale van Shika reactoren 1 en 2 zijn stopgezet.,BeetleLM/beetlelm_nld-fra_balanced,step-8000,nld,7.165535926818848,1294.054933740863
251,Volgens meldingen zitten er 9400 huishouden in de regio zonder water en ongeveer 100 zonder stroom.,BeetleLM/beetlelm_nld-fra_balanced,step-8000,nld,6.504095077514648,667.8710243100529
252,"Enkele wegen zijn aangetast, de spoorwegdienst is gestaakt in de getroffen gebieden en de prefectuur van het vliegveld Noto in Ishikawa blijft voor langere tijd gesloten.",BeetleLM/beetlelm_nld-fra_balanced,step-8000,nld,6.738633155822754,844.4057755879
253,Eén bom is ontploft buiten het kantoor waar de gouverneur-generaal werkt.,BeetleLM/beetlelm_nld-fra_balanced,step-8000,nld,7.222128868103027,1369.4012343997156
254,Binnen een periode van twee uur kwamen er nog drie bommen tot ontploffing in de buurt van overheidsgebouwen.,BeetleLM/beetlelm_nld-fra_balanced,step-8000,nld,5.871299743652344,354.70971248324304
255,"In sommige rapporten wordt het officiële dodental op acht geschat. Officiële rapporten bevestigen maximaal 30 gewonden, maar de definitieve aantallen zijn er nog niet.",BeetleLM/beetlelm_nld-fra_balanced,step-8000,nld,7.406917572021484,1647.3407037514926
256,"In urinemonsters van huisdieren die zijn gestorven na het eten van besmette dierenvoeding, werd zowel cyaanuurzuur als melamine aangetroffen.",BeetleLM/beetlelm_nld-fra_balanced,step-8000,nld,7.5936503410339355,1985.5482292993042
257,Onderzoekers van de universiteit stelden dat de twee verbindingen met elkaar reageren waardoor zich kristallen vormen die de nierfunctie kunnen blokkeren.,BeetleLM/beetlelm_nld-fra_balanced,step-8000,nld,6.790688991546631,889.5262267966784
258,Wetenschappers kwamen erachter dat er kristallen gevormd worden in kattenurine wanneer je hier melanine en cyanuurzuur aan toevoegt.,BeetleLM/beetlelm_nld-fra_balanced,step-8000,nld,7.1666131019592285,1295.4496085654466
259,"De samenstelling van deze kristallen heeft gelijkenissen met die van de urine van de getroffen huisdieren, vergeleken met de infraroodspectroscopie (FTIR).",BeetleLM/beetlelm_nld-fra_balanced,step-8000,nld,7.156189441680908,1282.0164150898663
260,"Ik weet niet of je je dit realiseert, maar de meeste goederen uit Midden-Amerika kwamen dit land binnen zonder dat er belasting over hoefde te worden betaald.",BeetleLM/beetlelm_nld-fra_balanced,step-8000,nld,5.902867317199707,366.0856480899347
261,En toch werd tachtig procent van onze goederen belast aan de hand van tarieven uit landen in Midden-Amerika.,BeetleLM/beetlelm_nld-fra_balanced,step-8000,nld,6.410648822784424,608.2882243127384
262,Dat vond ik erg raar; het was ongetwijfeld oneerlijk.,BeetleLM/beetlelm_nld-fra_balanced,step-8000,nld,6.759100437164307,861.8665438555364
263,Wat ik maar wil zeggen is dat jullie ons behandelen zoals wij jullie behandelen.,BeetleLM/beetlelm_nld-fra_balanced,step-8000,nld,7.128352642059326,1246.8213131885136
264,"Arnold Schwarzenegger, de gouverneur van Californië, heeft een wetsvoorstel ondertekend waarmee het verboden wordt om gewelddadige videogames aan minderjarigen te verkopen of te verhuren.",BeetleLM/beetlelm_nld-fra_balanced,step-8000,nld,7.053825855255127,1157.2778615269378
265,"Onder deze wet moeten gewelddadige videogames die in de staat Californië worden verkocht, een '18'-sticker hebben. Verkoop aan een minderjarige wordt bestraft met een boete van $ 1000 per overtreding.",BeetleLM/beetlelm_nld-fra_balanced,step-8000,nld,7.111579418182373,1226.0825146439574
266,"Kier Starmer QC, directeur van het Openbaar Ministerie, heeft vanochtend verklaard dat hij zowel Pryce en Huhne wil vervolgen.",BeetleLM/beetlelm_nld-fra_balanced,step-8000,nld,7.917332649230957,2744.4408875125678
267,"Huhne heeft ontslag genomen. In het kabinet is parlementslid Ed Davey zijn vervanger, terwijl parlementslid Norman Lamb naar verwachting Daveys taken als minister van Handel overneemt.",BeetleLM/beetlelm_nld-fra_balanced,step-8000,nld,8.265864372253418,3888.8329247508022
268,Naar verwachting worden Huhne en Pryce op 16 februari voorgeleid voor de Westminster Magistrates Court.,BeetleLM/beetlelm_nld-fra_balanced,step-8000,nld,7.667562484741211,2137.8640128929005
269,"De slachtoffers waren Nicholas Alden, 25, en Zachary Cuddeback, 21. Cuddeback was de bestuurder van het voertuig.",BeetleLM/beetlelm_nld-fra_balanced,step-8000,nld,6.629327774047852,756.9731425785202
270,"Edgar Veguilla raakte gewond aan zijn arm en kaak, en Kristoffer Schneider moest een reconstructieve gezichtsoperatie ondergaan.",BeetleLM/beetlelm_nld-fra_balanced,step-8000,nld,7.580295562744141,1959.2079486985574
271,"Het wapen van Uka faalde terwijl hij het op het hoofd van een vijfde man gericht hield. Schneider heeft chronische pijn, is blind in één oog, mist een stuk schedel en zijn gezicht is met titanium gereconstrueerd.",BeetleLM/beetlelm_nld-fra_balanced,step-8000,nld,6.902971267700195,995.2274138734126
272,Schneider legde via videolink vanuit een USAF-basis in het land waaruit hij afkomstig was zijn verklaring af.,BeetleLM/beetlelm_nld-fra_balanced,step-8000,nld,7.172165393829346,1302.662327927335
273,Naast het evenement van woensdag deed Carpanedo ook nog mee aan twee individuele races van het kampioenschap.,BeetleLM/beetlelm_nld-fra_balanced,step-8000,nld,7.389159679412842,1618.3456122502755
274,"Haar eerste was de Slalom, waar ze een Did Not Finish kreeg bij haar eerste run. 36 van de 116 deelnemers kregen hetzelfde resultaat in die race.",BeetleLM/beetlelm_nld-fra_balanced,step-8000,nld,7.087668418884277,1197.1133772206683
275,"In de andere wedstrijd waar ze aan deelnam, de zittende Grote Slalom, werd ze tiende van de dames, met een gecombineerde tijd van 4:41:30. Dat is 2:11:60 minuten langzamer dan de Oostenrijkse winnares Claudia Loesch, en 1:09:02 minuten langzamer dan de Hongaarse Gyöngyi Dani, die als negende eindigde.",BeetleLM/beetlelm_nld-fra_balanced,step-8000,nld,6.443028926849365,628.3070165420218
276,Vier skiërs van de vrouwengroep voor de zittende slalom konden hun ritten niet afmaken en het lukte 45 van de 117 skiërs in de reuzenslalom niet om zich te plaatsen tijdens de race.,BeetleLM/beetlelm_nld-fra_balanced,step-8000,nld,6.527098178863525,683.412191405949
277,De gestolen laptop en mobiele telefoon zijn door de politie van Madhya Pradesh teruggevonden.,BeetleLM/beetlelm_nld-fra_balanced,step-8000,nld,7.39709997177124,1631.2469017702033
278,Volgens adjunct-inspecteur-generaal D. K. Arya zijn vijf van de verkrachters van de Zweedse vrouw gearresteerd en hebben ze haar mobiele telefoon en laptop gevonden.,BeetleLM/beetlelm_nld-fra_balanced,step-8000,nld,6.966201305389404,1060.1877620078403
279,"Baba Kanjar, Bhutha Kanjar, Rampro Kanjar, Gaza Kanjar en Vishnu Kanjar zijn de verdachten.",BeetleLM/beetlelm_nld-fra_balanced,step-8000,nld,7.753787040710449,2330.380972513678
280,Volgens politiecommissaris Chandra Shekhar Solanki hadden de verdachten hun gezichten bedekt toen ze in de rechtbank verschenen.,BeetleLM/beetlelm_nld-fra_balanced,step-8000,nld,7.966684341430664,2883.2815207972462
281,"Er bevonden zich drie mensen in het huis toen de auto het huis raakte, maar geen van hen raakte gewond.",BeetleLM/beetlelm_nld-fra_balanced,step-8000,nld,6.017200946807861,410.4281761383906
282,De bestuurder liep echter wel ernstige verwondingen aan het hoofd op.,BeetleLM/beetlelm_nld-fra_balanced,step-8000,nld,7.5021281242370605,1811.8942504789804
283,De weg waar het ongeluk plaatsvond werd tijdelijk gesloten terwijl de hulpdiensten probeerden de chauffeur uit de rode Audi TT te bevrijden.,BeetleLM/beetlelm_nld-fra_balanced,step-8000,nld,7.085395336151123,1194.395329816915
284,"Aanvankelijk werd hij opgenomen in Great Yarmouth, in het James Paget Hospital.",BeetleLM/beetlelm_nld-fra_balanced,step-8000,nld,7.0099334716796875,1107.5808169582006
285,Hij werd vervolgens overgeplaatst naar het Addenbrooke's Hospital in Cambridge.,BeetleLM/beetlelm_nld-fra_balanced,step-8000,nld,6.912449359893799,1004.7051153682525
286,Adekoya is sindsdien in de Edinburgh Sheriff Court veroordeeld voor het vermoorden van haar zoon.,BeetleLM/beetlelm_nld-fra_balanced,step-8000,nld,7.24206018447876,1396.9690221783162
287,"Ze zit in hechtenis in afwachting van de aanklacht en het proces, maar het ooggetuigenverslag is mogelijk bedoezeld omdat haar verhaal veelvuldig is gepubliceerd.",BeetleLM/beetlelm_nld-fra_balanced,step-8000,nld,7.005947589874268,1103.174917262707
288,"Dit is gangbare praktijk in de rest van het VK, maar justitie in Schotland werkt anders en rechtbanken hebben de publicatie van foto's als mogelijk nadelig bestempeld.",BeetleLM/beetlelm_nld-fra_balanced,step-8000,nld,6.752181053161621,855.9235429437533
289,Professor Pamela Ferguson van de Universiteit van Dundee merkt op dat 'journalisten een gevaarlijk spelletje spelen als ze foto's e.d. van verdachten publiceren.',BeetleLM/beetlelm_nld-fra_balanced,step-8000,nld,7.382811069488525,1608.1039119147235
290,"Crown Office heeft de algehele leiding over vervolgingen en heeft aan journalisten aangegeven dat er geen verdere uitspraken worden gedaan, in ieder geval totdat aanklachten zijn gedaan.",BeetleLM/beetlelm_nld-fra_balanced,step-8000,nld,6.9102911949157715,1002.5391340881938
291,"Volgens bronnen verwijst het document naar een geschillenregeling, iets wat de Palestijnen graag wilden op grond van de grenzen voor de oorlog in het Midden-Oosten in 1967.",BeetleLM/beetlelm_nld-fra_balanced,step-8000,nld,5.920557022094727,372.6192132146392
292,"Andere onderwerpen die besproken waren zijn de toekomstige status van Jeruzalem, een stad die voor beide volken heilig is, en de problemen in de Jordaanvallei.",BeetleLM/beetlelm_nld-fra_balanced,step-8000,nld,6.2994914054870605,544.2950142603656
293,Israël eist dat er na ondertekening van een overeenkomst tien jaar lang een permanente militaire aanwezigheid is in de vallei. De PA is echter slechts bereid tot een aanwezigheid van vijf jaar.,BeetleLM/beetlelm_nld-fra_balanced,step-8000,nld,6.605217933654785,738.9408917541509
294,Schutters in de aanvullende proef voor ongediertebestrijding moesten nauwlettend in de gaten worden gehouden door boswachters. De proef werd namelijk gevolgd en de effectiviteit ervan werd beoordeeld.,BeetleLM/beetlelm_nld-fra_balanced,step-8000,nld,7.255239486694336,1415.5019564238933
295,"Bij een samenwerking tussen de NPWS en de Sporting Shooters Association of Australia (NSW) Inc, werden gekwalificeerde vrijwilligers gerekruteerd voor het jachtprogramma van de Sporting Shooters Association.",BeetleLM/beetlelm_nld-fra_balanced,step-8000,nld,6.976736545562744,1071.4161376724917
296,"Volgens Mick O'Flynn, waarnemend directeur voor parkbehoud en erfgoed bij de NPWS, hebben de vier gekozen schutters voor de eerste schietoperatie een uitgebreide veiligheids- en trainingsinstructie gehad.",BeetleLM/beetlelm_nld-fra_balanced,step-8000,nld,7.706520080566406,2222.793640935367
297,Gisteren zwoor Martelly een negenkoppige nieuwe voorlopige kiesraad (Provisional Electoral Council of CEP) in.,BeetleLM/beetlelm_nld-fra_balanced,step-8000,nld,7.915816307067871,2740.2825296242067
298,"Hiermee heeft Martelly in de afgelopen vier jaar, vijf keer een CEP behaald.",BeetleLM/beetlelm_nld-fra_balanced,step-8000,nld,6.595035552978516,731.4548916280373
299,Afgelopen maand heeft de presidentiële commissie het ontslag van de eerdere Nationale Kiesraad aanbevolen. Dit is onderdeel van een maatregelenpakket zodat er nieuwe verkiezingen komen in het land.,BeetleLM/beetlelm_nld-fra_balanced,step-8000,nld,7.097999572753906,1209.5450458890857
300,De commissie werd door Martelly ingesteld als reactie op de wijdverbreide protesten tegen de overheid die sinds oktober hebben plaatsgevonden.,BeetleLM/beetlelm_nld-fra_balanced,step-8000,nld,7.752209186553955,2326.7068705707543
301,"De soms gewelddadige protesten ontstonden door het uitblijven van verkiezingen, waarvan sommige al sinds 2011 hadden moeten plaatsvinden.",BeetleLM/beetlelm_nld-fra_balanced,step-8000,nld,7.816158294677734,2480.35827556321
302,Er zijn ongeveer 60 gevallen gerapporteerd van defecte iPods die oververhit raken. In totaal leidde dit tot zes branden en vier mensen met lichte brandwonden.,BeetleLM/beetlelm_nld-fra_balanced,step-8000,nld,7.237065315246582,1390.0087419068534
303,"Het Japanse ministerie van Economie, Handel en Industrie (METI) liet weten dat het bekend was met de 27 ongelukken die verband hielden met de apparaten.",BeetleLM/beetlelm_nld-fra_balanced,step-8000,nld,6.631443023681641,758.5760243910859
304,Vorige week kondigde METI aan dat Apple 34 aanvullende incidenten met oververhitting had gemeld die het bedrijf 'niet ernstig' noemde.,BeetleLM/beetlelm_nld-fra_balanced,step-8000,nld,7.540899753570557,1883.5239703993695
305,"'Erg betreurenswaardig', luidde de reactie van het ministerie over het feit dat Apple het rapport heeft uitgesteld.",BeetleLM/beetlelm_nld-fra_balanced,step-8000,nld,7.249608993530273,1407.554377724767
306,Mariana werd om 07.19 uur lokale tijd (vrijdag 21.19 GMT) getroffen door de aardbeving.,BeetleLM/beetlelm_nld-fra_balanced,step-8000,nld,7.096981525421143,1208.3142983671744
307,Het bureau voor calamiteitenbeheer van de Noordelĳke Marianen verklaarde dat er landelijk geen schade is gemeld.,BeetleLM/beetlelm_nld-fra_balanced,step-8000,nld,7.446340084075928,1713.5800955933562
308,Daarnaast meldde het National Tsunami Warning Center dat er geen sprake was van een tsunami-waarschuwing.,BeetleLM/beetlelm_nld-fra_balanced,step-8000,nld,6.806809902191162,903.9824099574189
309,"In Manilla, de Filippijnse hoofdstad, heeft een voormalige politieman uit de Filippijnen toeristen uit Hongkong gegijzeld door hun bus te kapen.",BeetleLM/beetlelm_nld-fra_balanced,step-8000,nld,7.405826091766357,1645.5436448054666
310,Met zijn M16-geweer schoot Rolando Mendoza op de toeristen.,BeetleLM/beetlelm_nld-fra_balanced,step-8000,nld,7.695544719696045,2198.531067388291
311,Verschillende gijzelaars zijn in veiligheid gebracht en vooralsnog zijn er minstens zes dodelijke slachtoffers bevestigd.,BeetleLM/beetlelm_nld-fra_balanced,step-8000,nld,7.5714111328125,1941.878597647545
312,"Zes gijzelaars werden eerder vrijgelaten, inclusief de kinderen en ouderen, en de Filipijnse fotografen.",BeetleLM/beetlelm_nld-fra_balanced,step-8000,nld,7.223074913024902,1370.6973624845555
313,Later keerden de fotografen terug in ruil voor een oudere vrouw die naar het toilet moest. Mendoza is uiteindelijk neergeschoten.,BeetleLM/beetlelm_nld-fra_balanced,step-8000,nld,7.080737113952637,1188.8445094923043
314,Liggins ging in de geneeskunde werken en volgde hiermee het voorbeeld van zijn vader.,BeetleLM/beetlelm_nld-fra_balanced,step-8000,nld,6.403138160705566,603.7366909239857
315,Opgeleid als verloskundige ging hij in 1959 aan de slag in het National Women's Hospital in Auckland.,BeetleLM/beetlelm_nld-fra_balanced,step-8000,nld,6.022130966186523,412.45659095407757
316,"Toen hij werkzaam was in het ziekenhuis, deed Liggins in zijn vrije tijd onderzoek naar vroeggeboorte.",BeetleLM/beetlelm_nld-fra_balanced,step-8000,nld,6.352774620056152,574.0833644779043
317,Zijn onderzoek toonde aan dat de rijping van de foetale longen van baby's werd versneld door het toedienen van een hormoon.,BeetleLM/beetlelm_nld-fra_balanced,step-8000,nld,6.707616806030273,818.6173888629415
318,Xinhua heeft gemeld dat onderzoekers van de overheid woensdag twee 'zwarte dozen' met vluchtrecorders terug hebben gevonden.,BeetleLM/beetlelm_nld-fra_balanced,step-8000,nld,7.248589515686035,1406.1201384339274
319,Ook medeworstelaars brachten hulde aan Luna.,BeetleLM/beetlelm_nld-fra_balanced,step-8000,nld,9.186111450195312,9760.622422738565
320,"Tommy Dreamer zei, 'Luna was de eerste 'Queen of Extreme'. Mijn eerste manager. Luna is overleden op de nacht van twee manen. Net zo uniek als zij was. Een sterke vrouw.'",BeetleLM/beetlelm_nld-fra_balanced,step-8000,nld,7.1538825035095215,1279.0622912861788
321,Dustin 'Goldust' Runnels gaf aan dat 'Luna net zo raar was als ik... misschien nog wel raarder... ik hou van haar en ga haar missen... hopelijk is ze op een betere plek'.,BeetleLM/beetlelm_nld-fra_balanced,step-8000,nld,6.728359222412109,835.774819729807
322,"Van de 1400 mensen die voor de federale verkiezing van 2010 werden ondervraagd, steeg het aantal mensen dat zich verzette tegen het feit dat Australië een republiek werd, met 8 procent sinds 2008.",BeetleLM/beetlelm_nld-fra_balanced,step-8000,nld,6.657482147216797,778.5880968856752
323,Demissionair minister-president Julia Gillard zei tijdens de campagne voor de federale verkiezingen van 2010 dat Australië na de regering van koningin Elizabeth II een republiek zou moeten worden.,BeetleLM/beetlelm_nld-fra_balanced,step-8000,nld,7.612470626831055,2023.2706745952023
324,34 procent van de deelnemers van deze peiling stond achter dit standpunt. Zij willen dat koningin Elizabeth II de laatste vorst van Australië is.,BeetleLM/beetlelm_nld-fra_balanced,step-8000,nld,6.234463214874268,510.02677017207276
325,"29 procent van de respondenten vond dat Australië een republiek moet worden zodra het mogelijk is, en aan het andere uiteinde zei 31 procent dat dat nooit zou moeten gebeuren.",BeetleLM/beetlelm_nld-fra_balanced,step-8000,nld,6.876213550567627,968.9505228410734
326,"De Olympisch winnaar van de gouden medaille zwom de 100 en 200 meter freestyle en drie estafettewedstrijden tijdens de Gemenebestspelen, maar zijn conditie werd in twijfel getrokken vanwege zijn klachten.",BeetleLM/beetlelm_nld-fra_balanced,step-8000,nld,7.390457630157471,1620.4475089268562
327,"Hij kon de medicijnen die hij nodig had om zijn pijn te verzachten niet nemen, omdat ze zijn verboden op de Spelen.",BeetleLM/beetlelm_nld-fra_balanced,step-8000,nld,5.236933708190918,188.09247086205747
