sentence_id,sentence,repo,revision,iso_code,nll,ppl
253,یک بمب در بیرون دفتر فرماندار کل منفجر شد.,BeetleLM/beetlelm_fas-ukr_late,step-8000,fas,6.3224334716796875,556.9266099214359
254,سه بمب دیگر در یک بازه دو ساعته نزدیک ساختمان‌های دولت منفجر شد.,BeetleLM/beetlelm_fas-ukr_late,step-8000,fas,6.7938103675842285,892.3071104798195
255,برخی گزارش‌های رسمی تعداد کشته شدگان را هشت نفر اعلام می‌کنند و گزارش‌های رسمی زخمی شدن 30 تن را تایید می‌کند؛ اما اعداد نهایی هنوز مشخص نیست.,BeetleLM/beetlelm_fas-ukr_late,step-8000,fas,6.873010635375977,965.8520212592758
256,اسید سیانوریک و نیز ملامین در نمونه‌های ادرار حیوانات خانگی که پس از مصرف غذای آلوده مخصوص حیوانات مردند، یافت شد.,BeetleLM/beetlelm_fas-ukr_late,step-8000,fas,6.58365535736084,723.1779776534846
257,محققان دانشگاه گفتند که این دو ترکیب در واکنش با یکدیگر مواد کریستالی تشکیل می‌دهد و می‌تواند عملکرد کلیه را مسدود کند.,BeetleLM/beetlelm_fas-ukr_late,step-8000,fas,7.041805744171143,1143.4505226353817
258,پژوهشگران با افزودن ملامین و اسید سیانوریک در ادرار گربه، تشکیل کریستال‌ها را مشاهده کردند.,BeetleLM/beetlelm_fas-ukr_late,step-8000,fas,6.675785541534424,792.9701202433033
259,نتیجه سنجش طیف سنجی مادون قرمز (طیف‌سنجی تبدیل فوریه فروسرخ) مشخص کرد ترکیب این بلورها با مواردی که در ادرار حیوانات خانگی مبتلا دیده می‌شود مطابقت دارد.,BeetleLM/beetlelm_fas-ukr_late,step-8000,fas,7.386619567871094,1614.2400503820852
260,نمی‌دانم متوجه شده‌اید یا نه، اما بسیاری از کالاها از آمریکای مرکزی بدون پرداخت عوارض وارد این کشور می‌شوند.,BeetleLM/beetlelm_fas-ukr_late,step-8000,fas,6.106809139251709,448.90403718406407
261,همچنان در کشورهای آمریکای مرکزی روی هشتاد درصد کالاهای ما از طریق وضع تعرفه، مالیات گرفته می‌شد. ما با شما رفتار می‌کنیم.,BeetleLM/beetlelm_fas-ukr_late,step-8000,fas,6.929079532623291,1021.5532402978615
262,برایم معنی نداشت؛ مسلماً عادلانه نبود.,BeetleLM/beetlelm_fas-ukr_late,step-8000,fas,7.378692626953125,1601.4946476420594
263,کل حرف من به مردم این است که شما طوری با ما رفتار می‌کنید که ما با شما رفتار می‌کنیم.,BeetleLM/beetlelm_fas-ukr_late,step-8000,fas,5.216843605041504,184.35137900977267
264,حکمران کالیفرنیا، آرنولد شوارتزنگر، لایحه‌ای به قانون افزود که فروش و اجاره بازی‌های ویدیویی خشن به افراد کم سن و سال ممنوع شود.,BeetleLM/beetlelm_fas-ukr_late,step-8000,fas,6.965153217315674,1059.0771739572742
265,این لایحه بازی های ویدئویی خشونت آمیز که در ایالت کالیفرنیا فروخته می شود را ملزم به نصب برچسب «18» می‌کند و برای تخلف در فروش آنها به افراد زیر سن قانونی جریمه 1000 دلاری تعیین می‌کند.,BeetleLM/beetlelm_fas-ukr_late,step-8000,fas,6.397092819213867,600.097906385814
266,مدیر دادرسی های عمومی، Kier Starmer QC، صبح امروز با صدور بیانیه ای پیگرد قانونی هوهن و پریس را اعلام کرد.,BeetleLM/beetlelm_fas-ukr_late,step-8000,fas,5.5246758460998535,250.80502541549265
267,Huhne استعفا داده است و نماینده Ed Davey جایگزین او خواهد شد. انتظار می‌رود نماینده Norman Lamb سمت وزیر تجارت را از آن خود کند، که Davey از آن استعفا داده بود.,BeetleLM/beetlelm_fas-ukr_late,step-8000,fas,5.7881269454956055,326.4010844350068
268,قرار است Huhne و Pryce در 16 فوریه در دادگاه بدوی وست‌مینستر حاضر شوند.,BeetleLM/beetlelm_fas-ukr_late,step-8000,fas,6.188977241516113,487.3474125355448
269,تلفات آن عبارت بود از نیکلاس آلدن، 25 ساله، و زاخاری کادبک، 21 ساله. کادبک راننده بود.,BeetleLM/beetlelm_fas-ukr_late,step-8000,fas,6.097333908081055,444.6706554662157
270,ادگار وگیلا از ناحیه دست و فک زخمی شد، و از آن طرف کریستوفر اشنایدر نیاز به جراحی ترمیمی صورت پیدا کرد.,BeetleLM/beetlelm_fas-ukr_late,step-8000,fas,6.268472671508789,527.6708354059299
271,سلاح اوکا در حالی که سر مرد پنجم را نشانه رفته بود، عمل نکرد. اشنایدر درد مداوم داشت از ناحیه یک چشم کور بود، بخشی از جمجمه اش از دست رفته بود و چهره اش با تیتانیوم بازسازی شده بود.,BeetleLM/beetlelm_fas-ukr_late,step-8000,fas,5.636953353881836,280.6065061269271
272,اشنایدر از طریق لینک ویدئویی از پایگاه نیروی هوایی ایالات متحده در کشورش شهادت داد.,BeetleLM/beetlelm_fas-ukr_late,step-8000,fas,5.237287521362305,188.15903223013711
273,پس از مسابقه چهارشنبه، کارپاندو در دو مسابقه انفرادی در مسابقات قهرمانی رقابت کرد.,BeetleLM/beetlelm_fas-ukr_late,step-8000,fas,4.790783882141113,120.39570772818544
274,نخستین حضور او در اسکی مارپیچ کوچک بود، جایی‌که وی موفق نشد به خط پایان برسد. 36 نفر از 116 رقیب او در آن مسابقه نتیجه مشابهی بدست آوردند.,BeetleLM/beetlelm_fas-ukr_late,step-8000,fas,6.084242820739746,438.88737041531033
275,او در مسابقه دیگرش در Giant Slalom با مدت زمان ترکیبی 4:41.30 کار خود را در رتبه دهم در گروه نشسته بانوان پایان داد، که 2:11.60 دقیقه کندتر از کلودیا لوئیز اتریشی بود که مقام اول را از آن خود کرد و 1:09.02 دقیقه کندتر از مقام نهم که به Gyöngyi Dani از مجارستان رسید.,BeetleLM/beetlelm_fas-ukr_late,step-8000,fas,5.643706798553467,282.5079801633805
276,چهار اسکی‌باز در گروه نشسته زنان نتوانستند مسیرشان را به اتمام برسانند و 45 نفر از کل 117 اسکی‌باز مارپیچ بزرگ نتوانستند در مسابقه رتبه کسب کنند.,BeetleLM/beetlelm_fas-ukr_late,step-8000,fas,6.835072040557861,929.8953384915266
277,پلیس مادیا پرادش لپتاب و تلفن همراه دزده شده را باز پس گرفت.,BeetleLM/beetlelm_fas-ukr_late,step-8000,fas,6.300382614135742,544.7803109026705
278,معاون بازرس کل «د. ک. آریا» گفت: «ما پنج نفر را که به زن سوییسی تجاوز کرده بودند دستگیر کردیم و موبایل و لپتاپ او را پس گرفتیم.»,BeetleLM/beetlelm_fas-ukr_late,step-8000,fas,5.854372501373291,348.75598747430035
279,نام متهمین بابا کانجار، رامپرو کانجار، گازا کانجار و ویشنو کانجار است.,BeetleLM/beetlelm_fas-ukr_late,step-8000,fas,7.918138027191162,2746.6520900238183
280,رئیس پلیس «Chandra Shekhar Solanki» گفت که متهمان در دادگاه با صورت‌های پوشیده حاضر شدند.,BeetleLM/beetlelm_fas-ukr_late,step-8000,fas,5.824676036834717,338.551437114982
281,اگرچه هنگام برخورد ماشین به خانه سه نفر در آنجا بودند، هیچ کدام صدمه ندیدند.,BeetleLM/beetlelm_fas-ukr_late,step-8000,fas,5.956881523132324,386.40325380848645
282,با این حال، راننده دچار مصدومیت جدی از ناحیه سر شد.,BeetleLM/beetlelm_fas-ukr_late,step-8000,fas,4.819332599639893,123.882384035922
283,زمانیکه کارکنان خدمات اورژانس مشغول آزاد کردن راننده از آئودی TT قرمز بودند، جاده محل تصادف موقتاً بسته شد.,BeetleLM/beetlelm_fas-ukr_late,step-8000,fas,7.686496257781982,2178.7274739063637
284,او در ابتدا در بیمارستان جیمز پاژه در گریت یارموث بستری بود.,BeetleLM/beetlelm_fas-ukr_late,step-8000,fas,6.355117321014404,575.4298467127752
285,او سپس به بیمارستان ادن بروک کمبریج منتقل شد.,BeetleLM/beetlelm_fas-ukr_late,step-8000,fas,6.1204681396484375,455.0776845483481
286,«آدکویا» از آن زمان به اتهام قتل پسرش در «دادگاه کلانتری ادینبورگ» بوده است.,BeetleLM/beetlelm_fas-ukr_late,step-8000,fas,6.2296671867370605,507.58652385412046
287,او در بازداشت است و منتظر کیفرخواست و محاکمه است، اما هر شاهد عینی ممکن است تحت تاثیر قرار گبرد زیرا تصویر وی به‌طور گسترده‌ای منتشر شده است.,BeetleLM/beetlelm_fas-ukr_late,step-8000,fas,6.182192325592041,484.05199352819125
288,این اقدام در جاهای دیگر انگلستان معمول و رایج است ولی دادگاه اسکاتلند متفاوت عمل می‌کند و دادگاه‌ها انتشار عکس‌ها را بطور بالقوه مخرب دانسته‌اند.,BeetleLM/beetlelm_fas-ukr_late,step-8000,fas,7.863483428955078,2600.563493912066
289,پروفسور Pamela Ferguson از دانشگاه Dundee می گوید: «به نظر می رسد که روزنامه نگاران در صورت انتشار عکس و غیره از مظنونان روی خط خطر قدم می‌گذارند.»,BeetleLM/beetlelm_fas-ukr_late,step-8000,fas,5.260143756866455,192.50916382229522
290,دادگاه اسکاتلند، که در کل مسئول پیگیری این پرونده است، به روزنامه‌نگارها بیان داشته که حداقل تا زمان اعلام جرم هیچ توضیح بیشتری داده نخواهد شد.,BeetleLM/beetlelm_fas-ukr_late,step-8000,fas,5.604554176330566,271.66078562453
291,این سند بر اساس این درز اطلاعاتی است و به اختلاف مرزی مربوط می‌شود، که در آن فلسطین خواستار مرزبندی طبق شرایط قبل از جنگ شش‌روزه 1967 است.,BeetleLM/beetlelm_fas-ukr_late,step-8000,fas,7.216767311096191,1362.0787590918076
292,مباحث گزارش شده دیگر شامل وضعیت آتی بیت المقدس است که برای هر دو ملت مقدس است و همچنین مسئله جردن ولی.,BeetleLM/beetlelm_fas-ukr_late,step-8000,fas,6.21938943862915,502.3963945268585
293,اسرائیل پس از امضای توافق‌نامه خواستار حضور نظامی مداوم در دره برای ده سال است، درحالیكه پارلمان موافق است چنین حضوری تنها برای پنج سال باشد.,BeetleLM/beetlelm_fas-ukr_late,step-8000,fas,6.207446098327637,496.4317929546814
294,تیراندازان شرکت کننده در آزمایش کنترل آفات مکمل باید به دقت توسط جنگلبانان نظارت می‌شدند، زیرا این آزمایش تحت نظارت بود و میزان موثر بودن آن مورد ارزیابی قرار گرفت.,BeetleLM/beetlelm_fas-ukr_late,step-8000,fas,5.976467609405518,394.04598252541865
295,با همکاری NPWS و انجمن تیراندازان ورزشکار استرالیا (NSW) با هم، افراد داوطلب واجد شرایط تحت برنامه شکار انجمن تیراندازان ورزشکار استخدام شدند.,BeetleLM/beetlelm_fas-ukr_late,step-8000,fas,6.047220706939697,422.9359321512849
296,به گفته Mick O'Flynn، مدیر حفاظت از پارک و میراث با NPWS، چهار تیرانداز انتخاب شده برای اولین عملیات تیراندازی، دستورالعمل جامع ایمنی و آموزش را دریافت کردند.,BeetleLM/beetlelm_fas-ukr_late,step-8000,fas,5.367064476013184,214.23305746611587
297,مارتلی دیروز در شورای موقت انتخاباتی (CEP) جدید که متشکل از نُه عضو بود سوگند یاد کرد.,BeetleLM/beetlelm_fas-ukr_late,step-8000,fas,6.71101713180542,821.4056925541503
298,این پنجمین CEP مارتلی در چهار سال گذشته است.,BeetleLM/beetlelm_fas-ukr_late,step-8000,fas,5.927098751068115,375.0647775058286
299,ماه گذشته یک کمیسیون ریاست جمهوری کناره‌گیری شورای انتخاباتی موقت قبلی را به عنوان بخشی از بسته اقدامات برای حرکت کشور به سمت انتخابات جدید توصیه کرد.,BeetleLM/beetlelm_fas-ukr_late,step-8000,fas,5.94329309463501,381.18815357638925
300,این کمیسیون پاسخ مارتلی بود به اعتراضات گسترده ضدحکومتی که در ماه اکتبر آغاز شد.,BeetleLM/beetlelm_fas-ukr_late,step-8000,fas,6.03571891784668,418.0992806529463
301,اعتراضات گاه خشونت آمیز ناشی از عدم برگزاری انتخابات که قرار بود در سال 2011 برگزار شود، بود.,BeetleLM/beetlelm_fas-ukr_late,step-8000,fas,4.125509738922119,61.89935371980794
302,حدود 60 مورد گرمای بیش از حد آیپاد‌ها گزارش شده است که در مجموع منجر به ایجاد شش آتش سوزی و مصدومیت جزئی چهار نفر شده است.,BeetleLM/beetlelm_fas-ukr_late,step-8000,fas,5.148532390594482,172.17861384718927
303,وزارت اقتصاد، تجارت و صنعت ژاپن (METI) گفت که از 27 مورد حادثه مربوط به این دستگاه‌ها اطلاع داشته است.,BeetleLM/beetlelm_fas-ukr_late,step-8000,fas,5.194644451141357,180.30402450897031
304,هفته گذشته، METI اعلام کرد که اپل آنها را از 34 رویداد گرم‌شدن بیش‌ازحد، که این شرکت آن را «غیر جدی» نامیده، مطلع کرده است.,BeetleLM/beetlelm_fas-ukr_late,step-8000,fas,5.7677998542785645,319.8332781617425
305,وزارت در یک واکنش تأخیر اپل در گزارش‌دهی را «واقعاً تأسف برانگیز» خواند.,BeetleLM/beetlelm_fas-ukr_late,step-8000,fas,7.882284164428711,2649.9185016916026
306,این زمین‌لرزه در ساعت 07:19 دقیقه صبح به وقت محلی (جمعه 09:19 بعدازظهر به وقت گرینویچ) ماریانا را لرزاند.,BeetleLM/beetlelm_fas-ukr_late,step-8000,fas,5.66918420791626,289.79802299974415
307,اداره مدیریت اورژانسی جزایر ماریانای شمالی گفت که هیچ خسارتی در این کشور گزارش نشده است.,BeetleLM/beetlelm_fas-ukr_late,step-8000,fas,5.150696754455566,172.5516745906145
308,همچنین مرکز هشدار سونامی اقیانوس آرام گفت هیچ نشانی از سونامی وجود نداشت.,BeetleLM/beetlelm_fas-ukr_late,step-8000,fas,7.158992290496826,1285.614753724779
309,یک پلیس سابق فیلیپینی با ربودن یک اتوبوس در مانیل، پایتخت فیلیپین، گردشگران هنگ کنگی را به گروگان گرفته است.,BeetleLM/beetlelm_fas-ukr_late,step-8000,fas,5.33051061630249,206.54341166813083
310,رونالدو مندوزا با اسلحه M16 خود به گردشگران شلیک کرد.,BeetleLM/beetlelm_fas-ukr_late,step-8000,fas,6.720832824707031,829.5080586951287
311,چندین تن از گروگان‌ها نجات یافته‌اند و تاکنون مرگ حداقل شش نفر تایید شده است.,BeetleLM/beetlelm_fas-ukr_late,step-8000,fas,5.763106346130371,318.33565536628606
312,شش گروگان شامل كودكان و سالمندان، همینطور عكاسان فیلیپینی، در ابتدا آزاد شدند.,BeetleLM/beetlelm_fas-ukr_late,step-8000,fas,5.945456027984619,382.0135304420313
313,عکاس‌ها سپس جای یک زن سالخورده که نیاز به دستشویی داشت را گرفتند. مندوزا با گلوله از پای درآورده شد.,BeetleLM/beetlelm_fas-ukr_late,step-8000,fas,6.187768936157227,486.75890366615084
314,لیگینز قدم به قدم از پدرش پیروی کرد و وارد حرفه پزشکی شد.,BeetleLM/beetlelm_fas-ukr_late,step-8000,fas,6.335593223571777,564.3040621827291
315,او به عنوان پزشک زنان آموزش دید و کار خود را در بیمارستان ملی اوکلند در سال 1959 شروع کرد.,BeetleLM/beetlelm_fas-ukr_late,step-8000,fas,5.133472442626953,169.605040462947
316,درحالیکه او در بیمارستان کار می‌کرد، لیگینز در اوقات فراغتش روی زایمان زودرس تحقیقاتش را آغاز کرد.,BeetleLM/beetlelm_fas-ukr_late,step-8000,fas,6.869637489318848,962.5995499363199
317,تحقیقات او نشان داد که اگر هورمونی تجویز شود، بلوغ ریه جنینی کودک را تسریع می‌کند.,BeetleLM/beetlelm_fas-ukr_late,step-8000,fas,6.798645973205566,896.6324050403377
318,«شین هوا» گزارش داد که بازرسان دولت روز چهارشنبه دو گزارش پرواز از «جعبه سیاه» را بازیابی کردند.,BeetleLM/beetlelm_fas-ukr_late,step-8000,fas,6.127933502197266,458.48771717911814
319,کشتی گیران همکار نیز به لونا ادای احترام کردند.,BeetleLM/beetlelm_fas-ukr_late,step-8000,fas,5.813604831695557,334.82393673890857
320,تامی‌ دریمر گفت: «لونا اولین ملکه Extreme بود. اولین مدیر من. لونا در شبی که دو ماه داشت درگذشت. بسیار زیبا و بی‌مانند بود. یک زن قوی.»,BeetleLM/beetlelm_fas-ukr_late,step-8000,fas,6.250406742095947,518.2235651459816
321,داستین «گلدوست» رونلز اظهار داشت: «لونا به اندازه من دمدمی‌مزاج بود... شاید هم بیشتر از من... او را دوست داشتم اما ترکش کردم... امیدوارم که او در وضعیت بهتری باشد.»,BeetleLM/beetlelm_fas-ukr_late,step-8000,fas,5.8137383460998535,334.86864354180125
322,"از بین 1,400 نفری که قبل از انتخابات فدرال 2010 از آنها نظرسنجی شد، تعداد کسانی که مخالف جمهوری شدن استرالیا بودند 8 درصد از سال 2008 افزایش داشت.",BeetleLM/beetlelm_fas-ukr_late,step-8000,fas,5.659490585327148,287.0024020759325
323,جولیا گیلارد، نخست وزیر دولت موقت، در خلال کمپین انتخابات فدرال 2010 مدعی شد که معتقد است پس از خاتمه حکمرانی ملکه الیزابت دوم، استرالیا باید جمهوری شود.,BeetleLM/beetlelm_fas-ukr_late,step-8000,fas,5.390899181365967,219.40057779611004
324,34 درصد آنهایی که در نظرسنجی شرکت دارند می‌خواهند که ملکه الیزابت دوم آخرین فرمانروای استرالیا باشد.,BeetleLM/beetlelm_fas-ukr_late,step-8000,fas,6.477929592132568,650.6224968964599
325,در انتهای نظرسنجی، 29 درصد افراد نظرسنجی شده معتقد بودند که استرالیا باید در اسرع وقت جمهوری شود، در حالی که 31 درصد معتقد بودند استرالیا هرگز نباید جمهوری شود.,BeetleLM/beetlelm_fas-ukr_late,step-8000,fas,5.860148906707764,350.7763730860653
326,برنده مدال طلای المپیک در شنای 100 متر و 200 متر آزاد و شنای سه‌گانه در بازی‌های کشورهای مشترک‌المنافع بود، اما به دلیل شکایت وی، در خصوص آمادگی جسمانی او در این مسابقات تردید وجود داشته‌ است.,BeetleLM/beetlelm_fas-ukr_late,step-8000,fas,5.505956649780273,246.15382608098352
327,او نتوانسته است داروهای مورد نیاز برای غلبه بر درد خود را دریافت کند چون این دارو‌ها ممنوع هستند.,BeetleLM/beetlelm_fas-ukr_late,step-8000,fas,5.60021448135376,270.48441506866624
328,کورتیس کوپر، یک ریاضیدان و استاد علوم رایانه‌ای در دانشگاه میسوری مرکزی است، بزرگترین عدد اول شناخته شده را در مورخ 25 ژانویه کشف کرد.,BeetleLM/beetlelm_fas-ukr_late,step-8000,fas,5.776241302490234,322.5445616954367
329,چند نفر از مردم این کشف را با استفاده از سخت‌افزار و نرم‌افزار مختلف در ابتدای فوریه تأیید کردند و در سه‌شنبه اعلام شد.,BeetleLM/beetlelm_fas-ukr_late,step-8000,fas,5.746615409851074,313.1290512411977
330,احتمال دارد که دنباله‌دارها منبع تامین آب و مواد‌آلی کره زمین باشند که می‌توانند تشکیل‌دهنده پروتئین‌ها و زندگی باشند.,BeetleLM/beetlelm_fas-ukr_late,step-8000,fas,7.090620994567871,1200.6531682476402
331,دانشمندان امیدوارند که به چگونگی تشکیل سیارات پی ببرند، بویژه اینکه پس از برخورد ستاره‌های دنباله‌دار در زمان‌های دور، زمین چگونه شکل گرفته است.,BeetleLM/beetlelm_fas-ukr_late,step-8000,fas,6.4742817878723145,648.2534768680817
332,کوئومو، 53 ساله، فرمانداری خودش را در اوایل امسال شروع کرد و اواخر این ماه لایحه‌ای در قانونی کردن ازدواج همجنس‌بازان تصویب کرد.,BeetleLM/beetlelm_fas-ukr_late,step-8000,fas,6.344697952270508,569.46535801743
333,او این شایعات را «حماقت و حرف مفت سیاسی» خواند.,BeetleLM/beetlelm_fas-ukr_late,step-8000,fas,7.037903308868408,1138.9969764387897
334,پیش‌بینی می‌شود که او در 2016 برای ریاست جمهوری کاندید شود.,BeetleLM/beetlelm_fas-ukr_late,step-8000,fas,7.381527423858643,1606.0410006625666
335,اداره هوانوردی فدرال (FAA) مدعی است که سیستم NextGen هواپیما را قادر می‌سازد تا در مسیرهای کوتاه‌تر پرواز کرده و هر ساله در میلیون‌ها گالن سوخت صرفه‌جویی کند و آلاینده‌های کربنی را کاهش دهد.,BeetleLM/beetlelm_fas-ukr_late,step-8000,fas,6.108166694641113,449.51386312165585
336,از فناوری مبتنی بر ماهواره در مقابل فناوری مبتنی بر رادار زمینی استفاده می‌کند که به کنترل کننده‌های ترافیک هوایی امکان می‌دهد هواپیما را با دقت بیشتری ردیابی کند و به خلبانان اطلاعات دقیق‌تری می‌دهد.,BeetleLM/beetlelm_fas-ukr_late,step-8000,fas,7.473870754241943,1761.4114982287765
337,هیچ وسیله نقلیه‌ای اضافی اجازه ورود ندارد و قطارهای سطحی در ومبلی توقف نخواهند داشت و تأسیسات پارک و سواری برای زمین بازی فراهم نمی‌باشد.,BeetleLM/beetlelm_fas-ukr_late,step-8000,fas,6.95997428894043,1053.6064675554178
338,ترس از کمبود حمل‌ونقل این احتمال را افزایش داد که ممکن است مجبور باشند تا بازی را در پشت درهای بسته و بدون حامیان تیم انجام دهند.,BeetleLM/beetlelm_fas-ukr_late,step-8000,fas,5.43016242980957,228.1863066723361
339,تحقیقی که روز پنجشنبه در مجله Science منتشر شد، از تشکیل گونه جدیدی از پرندگان در جزایر گالاپاگوس اکوادور خبر داد.,BeetleLM/beetlelm_fas-ukr_late,step-8000,fas,5.076096057891846,160.14762688872668
340,محققان دانشگاه پرینستون آمریكا و دانشگاه اوپسالا در سوئد گونه‌های جدید تکامل یافته‌ای را تنها در دو نسل گزارش دادند، اگرچه اعتقاد بر این بود که به دلیل زاد و ولد بین یک سهره داروین بومی، سهره زمینی متوسط، و سهره کاکتوسی مهاجر، یعنی سهره کاکتوسی بزرگ، این روند خیلی بیشتر طول کشید.,BeetleLM/beetlelm_fas-ukr_late,step-8000,fas,6.248696327209473,517.3379454500979
341,طلا را می‌توان به شکل‌های متنوعی در آورد. می‌توان آن را به حلقه‌های خیلی ریز تبدیل کرد.,BeetleLM/beetlelm_fas-ukr_late,step-8000,fas,6.6684889793396,787.2052219884652
