sentence_id,sentence,repo,revision,iso_code,nll,ppl
205,"Der Klage zufolge wurde der Abfall aus dem UN-Lager nicht ordnungsgemäß gesäubert, was dazu führte, dass Bakterien in den Zufluss des Artibonit-Flusses, einem der größten Flüsse Haitis, gelangten.",BeetleLM/beetlelm_eng-deu_heritage,step-8000,deu,6.70344352722168,815.2081889804222
206,Vor der Ankunft der Truppen waren in Haiti seit den 1800er Jahren keine Probleme im Zusammenhang mit der Krankheit aufgetreten.,BeetleLM/beetlelm_eng-deu_heritage,step-8000,deu,6.1015706062316895,446.5585872845232
207,"Das haitianische Institut für Gerechtigkeit und Demokratie hat auf unabhängige Studien verwiesen, die nahelegen, dass das nepalesische UN-Friedensbataillon die Krankheit unwissentlich nach Haiti eingeschleppt hat.",BeetleLM/beetlelm_eng-deu_heritage,step-8000,deu,7.317351341247559,1506.2092474642466
208,"Danielle Lantagne, ein UN-Experte für die Krankheit, stellte fest, dass der Ausbruch vermutlich von den Blauhelmen verursacht wurde.",BeetleLM/beetlelm_eng-deu_heritage,step-8000,deu,6.163692474365234,475.17942728708044
209,"Hamilton bestätigte, dass das Krankenhaus der Howard University den Patienten in stabilem Zustand aufgenommen hat.",BeetleLM/beetlelm_eng-deu_heritage,step-8000,deu,7.379528045654297,1602.833125237287
210,"Der Patient hatte sich in Nigeria aufgehalten, wo einige Fälle des Ebolavirus auftraten.",BeetleLM/beetlelm_eng-deu_heritage,step-8000,deu,6.253968715667725,520.0727552172284
211,"Das Krankenhaus befolgte Protokolle zum Infektionsschutz, einschließlich der Trennung des Patienten von anderen, um die Infektion Dritter zu vermeiden.",BeetleLM/beetlelm_eng-deu_heritage,step-8000,deu,7.2789740562438965,1449.5001563752376
212,Vor den Simpsons hatte Simon an mehreren Shows in verschiedenen Funktionen gearbeitet.,BeetleLM/beetlelm_eng-deu_heritage,step-8000,deu,6.79007625579834,888.9813492285076
213,"In den 1980er Jahren arbeitete er an Shows wie „Taxi“, „Cheers“ und „Die Tracey Ullman Show“.",BeetleLM/beetlelm_eng-deu_heritage,step-8000,deu,6.3935017585754395,597.9467831336976
214,1989 half er Brooks und Groening bei der Erschaffung von „Die Simpsons“ und war verantwortlich für die Einstellung des ersten Autorenteams der Sendung.,BeetleLM/beetlelm_eng-deu_heritage,step-8000,deu,6.637714385986328,763.3482781006577
215,"Obwohl er die Show 1993 verließ, behielt er den Titel des Chefproduzenten und erhielt weiterhin in jeder Saison Lizenzgebühren in zweistelliger Millionenhöhe.",BeetleLM/beetlelm_eng-deu_heritage,step-8000,deu,7.369140625,1586.269996348174
216,Zuvor meldete die chinesische Nachrichtenagentur Xinhua die geplante Entführung eines Flugzeugs.,BeetleLM/beetlelm_eng-deu_heritage,step-8000,deu,8.37717056274414,4346.692815994706
217,"Spätere Berichte gaben dann an, das Flugzeug habe eine Bombendrohung erhalten und sei nach Afghanistan umgeleitet worden, wo es in Kandahar gelandet sei.",BeetleLM/beetlelm_eng-deu_heritage,step-8000,deu,6.680342197418213,796.5916569895446
218,"Erste Berichte besagen, dass das Flugzeug zurück nach Afghanistan umgeleitet wurde, nachdem ihm die Notlandung in Ürümqi verweigert wurde.",BeetleLM/beetlelm_eng-deu_heritage,step-8000,deu,6.596303939819336,732.3832480202858
219,"Flugunfälle sind im Iran, der über eine veraltete Flotte verfügt, die sowohl für zivile als auch für militärische Einsätze schlecht gewartet wird, häufig.",BeetleLM/beetlelm_eng-deu_heritage,step-8000,deu,6.904006481170654,996.2582201586437
220,"Internationale Sanktionen haben bewirkt, dass keine neuen Flugzeuge gekauft werden können.",BeetleLM/beetlelm_eng-deu_heritage,step-8000,deu,7.008140563964844,1105.596805872524
221,Bei einem Hubschrauberabsturz zu Beginn der Woche wurden drei Menschen getötet und drei weitere verletzt.,BeetleLM/beetlelm_eng-deu_heritage,step-8000,deu,6.678357124328613,795.011932780607
222,"Letzten Monat erfuhr Iran sein schlimmstes Flugzeugunglück seit Jahren, als ein Passagierflugzeug auf dem Weg nach Armenien abstürzte und dabei alle 168 Passagiere ums Leben kamen.",BeetleLM/beetlelm_eng-deu_heritage,step-8000,deu,7.4315924644470215,1688.494300682851
223,"Im selben Monat schoss ein weiteres Passagierflugzeug über das Ende einer Landebahn in Maschhad hinaus und stieß mit einer Mauer zusammen, wobei siebzehn Menschen ums Leben kamen.",BeetleLM/beetlelm_eng-deu_heritage,step-8000,deu,6.996349334716797,1092.637016554943
224,Aerosmith haben die noch ausstehenden Konzerte ihrer Tour abgesagt.,BeetleLM/beetlelm_eng-deu_heritage,step-8000,deu,6.930375576019287,1022.8780759654198
225,Die Rockband sollte bis zum 16. September durch die Vereinigten Staaten und Kanada touren.,BeetleLM/beetlelm_eng-deu_heritage,step-8000,deu,5.575948238372803,263.99977169989114
226,"Nachdem sich der Frontsänger Steven Tyler während eines Auftrittes am 5. August bei einem Sturz von der Bühne verletzte, haben sie die Tour abgebrochen.",BeetleLM/beetlelm_eng-deu_heritage,step-8000,deu,6.90301513671875,995.271074480965
227,"Murray verlor den ersten Satz im Tiebreak, nachdem beide Männer jeden einzelnen Aufschlag im Satz gehalten hatten.",BeetleLM/beetlelm_eng-deu_heritage,step-8000,deu,7.592523574829102,1983.3122406112739
228,"Del Potro hatte im zweiten Satz einen frühen Vorteil, doch auch diesmal war ein Tie Break erforderlich, nachdem das 6:6 erreicht wurde.",BeetleLM/beetlelm_eng-deu_heritage,step-8000,deu,6.832902908325195,927.8804586002807
229,"Potros Schulter wurde inzwischen behandelt, er war aber in der Lage, aufs Spielfeld zurückzukehren.",BeetleLM/beetlelm_eng-deu_heritage,step-8000,deu,7.064019680023193,1169.1352828134798
230,Das Programm begann um 20:30 Ortszeit (15:00 UTC).,BeetleLM/beetlelm_eng-deu_heritage,step-8000,deu,6.115130424499512,452.655080833775
231,"Berühmte Sänger im ganzen Land präsentierten Bhajans, Andachtslieder, zu Shri Shyams Füßen.",BeetleLM/beetlelm_eng-deu_heritage,step-8000,deu,7.770334243774414,2369.2630674546085
232,"Der Sänger Sanju Sharma eröffnete den Abend, gefolgt von Jai Shankar Choudhary, der ebenfalls den Chhappan Bhog Bhajan präsentierte. Begleitet wurde er vom Sänger Raju Khandelwal.",BeetleLM/beetlelm_eng-deu_heritage,step-8000,deu,7.449991703033447,1719.8488757881273
233,Dann übernahm Lakkha Singh die Leitung beim Singen der Bhajans.,BeetleLM/beetlelm_eng-deu_heritage,step-8000,deu,6.474705696105957,648.528335107633
234,"Baba Shyam wurden 108 Teller Chhappan Bhog (im Hinduismus 56 verschiedene essbare Dinge wie Süßigkeiten, Früchte, Nüsse, Gerichte usw., die der Gottheit dargebracht werden) serviert.",BeetleLM/beetlelm_eng-deu_heritage,step-8000,deu,7.728099346160889,2271.281176414686
235,Lakkha Singh präsentierte den Chhappan Bhog Bhajan ebenfalls. Der Sänger Raju Khandelwal begleitete ihn.,BeetleLM/beetlelm_eng-deu_heritage,step-8000,deu,7.7870635986328125,2409.2327110465194
236,Bei der Keynote-Präsentation der Tokyo Game Show am Donnerstag enthüllte Nintendo-Präsident Satoru Iwata das Controller-Design für die neue Nintendo Revolution-Konsole des Unternehmens.,BeetleLM/beetlelm_eng-deu_heritage,step-8000,deu,6.9039506912231445,996.2026405152419
237,"Ähnlich einer TV-Fernbedienung verwendet der Controller zwei Sensoren, die in der Nähe des Fernsehers des Benutzers platziert werden, um dessen Position im dreidimensionalen Raum zu triangulieren.",BeetleLM/beetlelm_eng-deu_heritage,step-8000,deu,6.782095909118652,881.9152025212336
238,"Dies wird Spielern ermöglichen Aktionen und Bewegungen in Videospielen zu steuern, indem sie das Gerät in der Luft bewegen.",BeetleLM/beetlelm_eng-deu_heritage,step-8000,deu,6.146953582763672,467.29165085225935
239,Giancarlo Fisichella verlor die Kontrolle über sein Auto und musste das Rennen schon kurz nach dem Start beenden.,BeetleLM/beetlelm_eng-deu_heritage,step-8000,deu,7.332772254943848,1529.6163861521782
240,"Sein Teamkollege führte das Rennen die meiste Zeit an, aber beendete es gleich nach seinem Boxenstopp, wahrscheinlich wegen eines stark eingeklemmten rechten Frontrades.",BeetleLM/beetlelm_eng-deu_heritage,step-8000,deu,7.450448036193848,1720.633878958893
241,Kurz nach Alonso beendete auch Michael sein aufgrund von Schäden an der Radaufhängung aus den zahlreichen Kämpfen während des Rennens.,BeetleLM/beetlelm_eng-deu_heritage,step-8000,deu,7.358457088470459,1569.4132281785076
242,"„Sie ist sehr süß und singt auch ziemlich gut“, sagte er laut einem Transkript der Pressekonferenz.",BeetleLM/beetlelm_eng-deu_heritage,step-8000,deu,6.4088134765625,607.1728287000675
243,„Ich war bei jeder Probe hierfür von ganzem Herzen bewegt.“,BeetleLM/beetlelm_eng-deu_heritage,step-8000,deu,7.320057392120361,1510.2906460585098
244,"Etwa 3 Minuten nach dem Start zeigte eine Bordkamera, wie sich zahllose Teile aus Isolierschaum vom Treibstofftank lösten.",BeetleLM/beetlelm_eng-deu_heritage,step-8000,deu,7.920393943786621,2752.8553023897543
245,"Man geht allerdings nicht davon aus, dass sie das Shuttle in irgendeiner Weise beschädigt haben.",BeetleLM/beetlelm_eng-deu_heritage,step-8000,deu,6.140221118927002,464.15619323239247
246,"N. Wayne Hale Jr., Leiter des Shuttle-Programms der NASA, sagte, dass der Schaum „nach dem Zeitpunkt, über den wir uns Sorgen machen“ abfiel.",BeetleLM/beetlelm_eng-deu_heritage,step-8000,deu,6.019841194152832,411.5132398286819
247,"Nach fünf Minuten kommt Wind auf, etwa eine Minute später erreicht der Wind 70 km/h ... Dann beginnt es zu regnen, aber die Tropfen sind so hart und groß, dass sie wie Nadeln auf die Haut schlagen. Dann fiel Hagel vom Himmel, die Leute gerieten in Panik, schrien und rannten einander um.",BeetleLM/beetlelm_eng-deu_heritage,step-8000,deu,6.182893753051758,484.39163999313564
248,"""„Ich habe meine Schwester und ihre Freundin verloren, und auf meinem Weg waren zwei Behinderte im Rollstuhl, über die Leute einfach drübergesprungen sind und sie geschubst haben"""", sagte Armand Versace.""",BeetleLM/beetlelm_eng-deu_heritage,step-8000,deu,6.310155868530273,550.1306901918126
249,"Die NHK berichtete zudem, dass das Atomkraftwerk von Kashiwazaki Kariwa in der Präfektur Niigata normal in Betrieb war.",BeetleLM/beetlelm_eng-deu_heritage,step-8000,deu,6.283205032348633,535.5022182923688
250,"Hokuriku Electric Power Co. berichtete, dass das Erdbeben keine Auswirkungen gehabt hatte und dass die Reaktoren Nummer 1 und 2 des Kernkraftwerks Shika abgeschaltet worden waren.",BeetleLM/beetlelm_eng-deu_heritage,step-8000,deu,7.1548542976379395,1280.3058806692932
251,"Es wird berichtet, dass etwa 9.400 Häuser in der Region kein Wasser und ungefähr 100 keinen Strom haben.",BeetleLM/beetlelm_eng-deu_heritage,step-8000,deu,5.6337571144104,279.7110523407962
252,Einige Straßen wurden beschädigt und der Eisenbahnverkehr in den betroffenen Gebieten unterbrochen. Der Flughafen Noto in der Präfektur Ishikawa bleibt geschlossen.,BeetleLM/beetlelm_eng-deu_heritage,step-8000,deu,7.034100532531738,1134.6738508388796
253,Eine Bombe explodierte vor dem Bürogebäude des Generalgouverneurs.,BeetleLM/beetlelm_eng-deu_heritage,step-8000,deu,7.178089618682861,1310.4024970797266
254,Drei weitere Bomben detonierten binnen zwei Stunden unweit von Regierungsgebäuden.,BeetleLM/beetlelm_eng-deu_heritage,step-8000,deu,8.021099090576172,3044.521699834938
255,"Laut einigen Berichten beträgt die offizielle Zahl der Todesopfer acht und offizielle Berichte bestätigen, dass bis zu 30 Personen verletzt wurden. Allerdings sind noch keine endgültigen Zahlen bekannt.",BeetleLM/beetlelm_eng-deu_heritage,step-8000,deu,6.627732276916504,755.7663570684392
256,"Sowohl Cyanursäure als auch Melamin wurden in Urinproben von Haustieren gefunden, die nach dem Verzehr kontaminierter Haustiernahrung starben.",BeetleLM/beetlelm_eng-deu_heritage,step-8000,deu,7.438368797302246,1699.9749545229904
257,"Die zwei Verbindungen reagieren miteinander und formen Kristalle, die laut Forschern der Hochschule die Nierentätigkeit behindern können.",BeetleLM/beetlelm_eng-deu_heritage,step-8000,deu,7.676018714904785,2156.0189359635906
258,"Die Forscher entdeckten Kristalle im Katzenurin, die sich durch die Zugabe von Melamin und Zyanursäure gebildet hatten.",BeetleLM/beetlelm_eng-deu_heritage,step-8000,deu,6.76577091217041,867.6348202783888
259,"Die Zusammensetzung dieser Kristalle entspricht der Zusammensetzung, die im Urin betroffener Haustiere gefunden wurde, wenn man sie mittels Infrarotspektroskopie (FTIR) vergleicht.",BeetleLM/beetlelm_eng-deu_heritage,step-8000,deu,6.83143424987793,926.5187193364088
260,"Ich weiß nicht, ob Sie das wussten, aber die meisten Waren aus Mittelamerika kamen zollfrei in unser Land.",BeetleLM/beetlelm_eng-deu_heritage,step-8000,deu,6.0094895362854,407.2753679051819
261,Dennoch wurden achtzig Prozent unserer Waren in zentralamerikanischen Ländern mit Zöllen belegt. Wir kümmern uns um Sie.,BeetleLM/beetlelm_eng-deu_heritage,step-8000,deu,7.640073299407959,2079.896266148994
262,Das erschien mir nicht sinnvoll; es war ganz gewiss nicht fair.,BeetleLM/beetlelm_eng-deu_heritage,step-8000,deu,7.122523784637451,1239.5749091680304
263,"Ich sage den Leuten nur, dass wir so behandelt werden möchten, wie wir andere auch behandeln.",BeetleLM/beetlelm_eng-deu_heritage,step-8000,deu,5.634241104125977,279.8464623793519
264,"Der kalifornische Gouverneur Arnold Schwarzenegger unterzeichnete einen Gesetzentwurf, der den Verkauf oder Verleih von Videospielen, die Gewalt beinhalten, an Minderjährige verbietet.",BeetleLM/beetlelm_eng-deu_heritage,step-8000,deu,6.880429267883301,973.0439666767937
265,"Der Gesetzesvorschlag sieht vor, dass im Bundesstaat Kalifornien verkaufte Videospiele mit einem Aufkleber mit der Zahl „18“ versehen werden und der Verkauf an Minderjährige mit einer Geldbuße von 1000 $ bestraft wird.",BeetleLM/beetlelm_eng-deu_heritage,step-8000,deu,6.763700485229492,865.8403041199473
266,"Der Direktor der Staatsanwaltschaft Kier Starmer QC gab heute Morgen eine Erklärung ab, in der er die Strafverfolgung sowohl von Huhne als auch von Pryce bekanntgab.",BeetleLM/beetlelm_eng-deu_heritage,step-8000,deu,6.785261631011963,884.7115246396271
267,"Huhne ist zurückgetreten und wird im Kabinett vom Abgeordneten Ed Davey ersetzt. Es wird erwartet, dass der Abgeordnete Norman Lamb den Job des Wirtschaftsministers übernimmt, den Davey gerade verlässt.",BeetleLM/beetlelm_eng-deu_heritage,step-8000,deu,7.202645301818848,1342.9786535816522
268,Huhne und Pryce sollen am 16. Februar vor dem Westminster Magistrates Court erscheinen.,BeetleLM/beetlelm_eng-deu_heritage,step-8000,deu,6.909745693206787,1001.9923964139507
269,"Die Todesopfer waren Nicholas Alden, 25, und Zachary Cuddeback, 21. Cuddeback ist der Fahrer gewesen.",BeetleLM/beetlelm_eng-deu_heritage,step-8000,deu,5.979481220245361,395.2352749018717
270,"Edgar Veguilla erlitt Wunden am Arm und am Kiefer, während Kristoffer Schneider rekonstruktive Chirurgie für sein Gesicht benötigte.",BeetleLM/beetlelm_eng-deu_heritage,step-8000,deu,8.653473854064941,5730.017444187328
271,"Die Waffe von Uka hatte eine Ladehemmung, als er auf den Kopf eines fünften Mannes zielte. Schneider leitet seitdem unter chronischen Schmerzen, ist auf einem Auge erblindet, und ihm fehlt ein Teil seines Schädels. Sein Gesicht musste mit Hilfe von Titan rekonstruiert werden.",BeetleLM/beetlelm_eng-deu_heritage,step-8000,deu,6.68110466003418,797.199259956028
272,Schneider sagte über eine Videoschaltung von einer Basis der USAF in seiner Heimat aus.,BeetleLM/beetlelm_eng-deu_heritage,step-8000,deu,6.868524074554443,961.52837382752
273,Über die Veranstaltung vom Mittwoch hinaus nahm Carpanedo an der Meisterschaft in zwei Einzelrennen teil.,BeetleLM/beetlelm_eng-deu_heritage,step-8000,deu,7.185445308685303,1320.0769491412302
274,"Ihr erstes war der Slalom, bei dem sie in ihrem ersten Lauf ein „Did not Finish“ erhielt. 36 der 116 Teilnehmer erzielten in diesem Rennen das gleiche Ergebnis.",BeetleLM/beetlelm_eng-deu_heritage,step-8000,deu,7.454596996307373,1727.787550179092
275,"Ihr anderes Rennen, den Riesenslalom, beendete sie mit dem 10. Platz in der Damengruppe mit einer kombinierten Laufzeit von 4:41,30. Damit war sie 2:11,60 Minuten langsamer als die erstplatzierte Österreicherin Claudia Lösch und 1:09,02 Minuten schneller als Gyöngyi Dani aus Ungarn, die den neunten Platz belegte.",BeetleLM/beetlelm_eng-deu_heritage,step-8000,deu,6.924956321716309,1017.3498325588503
276,"Vier Skifahrerinnen des Krückenskifahrens kamen nicht ins Ziel, und 45 der insgesamt 117 Skifahrerinnen im Riesenslalom konnten sich im Rennen nicht platzieren.",BeetleLM/beetlelm_eng-deu_heritage,step-8000,deu,8.174369812011719,3548.8177967644287
277,Die Polizei von Madhya Pradesh hat den gestohlenen Laptop und das Mobiltelefon wiedergefunden.,BeetleLM/beetlelm_eng-deu_heritage,step-8000,deu,6.761239528656006,863.712128479923
278,"Der stellvertretende Generalinspekteur D. K. Arya sagte: „Wir haben fünf Personen festgenommen, die die Schweizerin vergewaltigt haben, und ihr Handy und Laptop sichergestellt.“",BeetleLM/beetlelm_eng-deu_heritage,step-8000,deu,6.868250370025635,961.2652351697893
279,"Die Namen der Angeklagten sind Baba Kanjar, Bhutha Kanja, Rampro Kanjar, Gaza Kanjar und Vishnu Kanjar.",BeetleLM/beetlelm_eng-deu_heritage,step-8000,deu,6.609103202819824,741.8174605190728
280,"Die Polizeipräsidentin Chandra Shekhar Solanki gab an, die Angeklagten seien mit bedeckten Gesichtern vor Gericht erschienen.",BeetleLM/beetlelm_eng-deu_heritage,step-8000,deu,7.632908344268799,2065.04716281269
281,"Obwohl sich drei Menschen im Haus befanden, als das Auto hineinraste, wurde keiner von ihnen verletzt.",BeetleLM/beetlelm_eng-deu_heritage,step-8000,deu,5.6746721267700195,291.39278298817004
282,Der Fahrer zog sich jedoch erhebliche Verletzungen am Kopf zu.,BeetleLM/beetlelm_eng-deu_heritage,step-8000,deu,6.877392292022705,970.0933383999812
283,"Die Straße, auf der sich der Unfall ereignet hatte, wurde vorübergehend gesperrt, während die Rettungsdienste den Fahrer aus dem roten Audi TT befreiten.",BeetleLM/beetlelm_eng-deu_heritage,step-8000,deu,6.567002296447754,711.2345738711696
284,Er wurde zunächst in das James Paget Krankenhaus in Great Yarmouth eingeliefert.,BeetleLM/beetlelm_eng-deu_heritage,step-8000,deu,7.795900344848633,2430.6168329645316
285,Er wurde infolgedessen in das Addenbrooke’s Hospital in Cambridge verlegt.,BeetleLM/beetlelm_eng-deu_heritage,step-8000,deu,7.414545059204102,1659.9538158793046
286,Adekoya wurde in der Zwischenzeit vor dem Edinburgh Sheriff Court wegen Mordes an ihrem Sohn angeklagt.,BeetleLM/beetlelm_eng-deu_heritage,step-8000,deu,6.74585485458374,850.5258919511332
287,"Sie befindet sich bis zur Anklageerhebung und Verhandlung in Untersuchungshaft, doch Aussagen von Augenzeugen könnten verfälscht sein, da ihr Bild weithin veröffentlicht wurde.",BeetleLM/beetlelm_eng-deu_heritage,step-8000,deu,7.242153644561768,1397.0995891203918
288,"Dies ist anderenorts in Großbritannien gängige Praxis, aber die schottische Justiz arbeitet anders, und die Gerichte haben die Veröffentlichung von Fotos als potenziell schädlich erachtet.",BeetleLM/beetlelm_eng-deu_heritage,step-8000,deu,7.289834022521973,1465.3274656618291
289,"Professorin Pamela Ferguson von der University of Dundee merkt an: „Journalisten scheinen eine gefährliche Grenze zu überschreiten, wenn Sie Fotos usw. von Verdächtigen veröffentlichen.“",BeetleLM/beetlelm_eng-deu_heritage,step-8000,deu,7.153811931610107,1278.9720286158554
290,"Das Crown Office, welches federführend bei der Strafverfolgung ist, hat Journalisten gegenüber angedeutet, das mindestens bis zur Anklage keine weiteren Kommentare mehr abgegeben werden.",BeetleLM/beetlelm_eng-deu_heritage,step-8000,deu,7.027046203613281,1126.6976547123504
291,"Dem Leak zufolge bezieht sich das Dokument auf den Grenzstreit, in dem die Palästinenser ein Zurücksetzen der Grenzen in den Zustand vor dem Sechstagekrieg von 1967 fordern.",BeetleLM/beetlelm_eng-deu_heritage,step-8000,deu,6.88248348236084,975.0448621109933
292,"Andere Themen, die angeblich abgedeckt sind, umfassen die Zukunft von Jerusalem, das beiden Nationen heilig ist, und das Problem des Jordantals.",BeetleLM/beetlelm_eng-deu_heritage,step-8000,deu,5.85617733001709,349.3860006320695
293,"Israel verlangt  eine Militärpräsenz im Jordantal von zehn Jahren ab der Unterzeichnung der Vereinbarung, die Palästinenserbehörde hingegen will eine solche Präsenz nur für fünf Jahre akzeptieren.",BeetleLM/beetlelm_eng-deu_heritage,step-8000,deu,6.857339382171631,950.8338934727523
294,"Die Schützen des begleitenden Versuchs zur Eindämmung der Plage sollten eng von Rangern beaufsichtigt werden, da der Versuch überwacht und seine Wirksamkeit beurteilt wurde.",BeetleLM/beetlelm_eng-deu_heritage,step-8000,deu,7.351564407348633,1558.632958409261
295,Im Rahmen einer Partnerschaft zwischen NPWS und der Sporting Shooters Association of Australia (NSW) Inc. wurden im Rahmen des Jagdprogramms der Sporting Shooters Association qualifizierte Freiwillige rekrutiert.,BeetleLM/beetlelm_eng-deu_heritage,step-8000,deu,7.012809753417969,1110.7711173376035
296,"Laut Mick O‘Flynn, dem geschäftsführenden Direktor von Park Conservation and Heritage im NPWS, erhielten die vier für die erste Jagdoperation ausgewählten Schützen umfassenden Sicherheits- und Trainingsunterricht.",BeetleLM/beetlelm_eng-deu_heritage,step-8000,deu,6.871008396148682,963.9200891950503
297,Martelly hat gestern eine neue Provisorische Wahlkommission (CEP) mit neun Mitgliedern vereidigt.,BeetleLM/beetlelm_eng-deu_heritage,step-8000,deu,7.381471157073975,1605.9506364416902
298,Es ist Martellys fünftes CEP innerhalb von vier Jahren.,BeetleLM/beetlelm_eng-deu_heritage,step-8000,deu,7.296347618103027,1474.9031684389963
299,Letzten Monat empfahl eine Präsidialkommission den Rücktritt des vorherigen CEP als Teil des Maßnahmenpakets zur Lenkung des Landes in Richtung Neuwahlen.,BeetleLM/beetlelm_eng-deu_heritage,step-8000,deu,8.390192985534668,4403.6674563517245
300,"Die Kommission war Martellys Antwort auf die weitverbreiteten regimekritischen Proteste, die im Oktober begannen.",BeetleLM/beetlelm_eng-deu_heritage,step-8000,deu,7.152857303619385,1277.7516687055295
301,"Auslöser für die teils gewalttätigen Proteste war die nicht erfolgte Durchführung von Wahlen, von denen einige seit 2011 anstehen.",BeetleLM/beetlelm_eng-deu_heritage,step-8000,deu,6.756656169891357,859.762484158418
302,Es wurden über 60 Fälle von Überhitzung bei defekten iPods gemeldet. Insgesamt wurden dadurch sechs Brände ausgelöst und vier Personen haben leichte Verbrennungen erlitten.,BeetleLM/beetlelm_eng-deu_heritage,step-8000,deu,8.11118221282959,3331.5142616056696
303,"Das japanische Ministerium für Wirtschaft, Handel und Industrie (METI) gab an, dass ihm 27 Unfälle im Zusammenhang mit den Geräten bekannt waren.",BeetleLM/beetlelm_eng-deu_heritage,step-8000,deu,6.653469562530518,775.4702057955998
304,"""Letzte Woche gab das METI bekannt, dass es von Apple über 34 weitere Vorfälle von Überhitzung informiert worden war, die das Unternehmen als „nicht schwerwiegend"""" bezeichnete.""",BeetleLM/beetlelm_eng-deu_heritage,step-8000,deu,7.244895935058594,1400.9361000562333
305,"Das Ministerium reagierte, indem es die Verschiebung des Berichts durch Apple als „wirklich bedauerlich“ bezeichnete.",BeetleLM/beetlelm_eng-deu_heritage,step-8000,deu,8.136465072631836,3416.8182905366816
306,Das Erdbeben erschütterte Mariana um 07:19 Uhr Ortszeit (21:19 GMT am Freitag).,BeetleLM/beetlelm_eng-deu_heritage,step-8000,deu,7.478586673736572,1769.7377906824693
307,"Das Amt für Katastrophenschutz der nördlichen Marianen sagte, dass im Land keine Schäden gemeldet wurden.",BeetleLM/beetlelm_eng-deu_heritage,step-8000,deu,6.532486438751221,687.1045326172704
308,"Auch hatte das Pacific Tsunami Warning Center erklärt, dass es keine Hinweise auf einen Tsunami gab.",BeetleLM/beetlelm_eng-deu_heritage,step-8000,deu,6.807794094085693,904.8725400756706
309,"Ein ehemaliger philippinischer Polizist hat Touristen aus Hongkong als Geiseln genommen, indem er ihren Bus in Manila, der Hauptstadt der Philippinen, entführte.",BeetleLM/beetlelm_eng-deu_heritage,step-8000,deu,6.543976783752441,695.0451335058444
310,Rolando Mendoza schoss mit seinem M16-Gewehr auf die Touristen.,BeetleLM/beetlelm_eng-deu_heritage,step-8000,deu,7.201254844665527,1341.1125969425727
311,Mehrere Geiseln wurden gerettet und es gibt bisher mindestens sechs bestätigte Tote.,BeetleLM/beetlelm_eng-deu_heritage,step-8000,deu,7.2193827629089355,1365.6458732255085
312,"Sechs Geiseln, darunter die Kinder und Ältere, wurden, wie auch die philippinischen Fotografen, frühzeitig freigelassen.",BeetleLM/beetlelm_eng-deu_heritage,step-8000,deu,6.399382591247559,601.473568164211
313,"Die Fotografen nahmen den Platz einer älteren Dame ein, als sie zur Toilette musste. Mendoza wurde erschossen.",BeetleLM/beetlelm_eng-deu_heritage,step-8000,deu,6.4849934577941895,655.234677544943
314,Liggins trat in die Fußstapfen seines Vaters und schlug eine medizinische Karriere ein.,BeetleLM/beetlelm_eng-deu_heritage,step-8000,deu,6.923018455505371,1015.380253700159
315,Er machte eine Ausbildung als Entbindungsarzt und nahm 1959 seine Arbeit im National Women's Hospital in Auckland auf.,BeetleLM/beetlelm_eng-deu_heritage,step-8000,deu,6.500813961029053,665.6832528112485
316,"Während seiner Arbeit im Krankenhaus begann Liggins in seiner Freizeit damit, vorzeitige Wehen zu untersuchen.",BeetleLM/beetlelm_eng-deu_heritage,step-8000,deu,6.876326084136963,969.0595684374487
317,"Seine Forschung zeigte, dass die Anwendung eines Hormons die Lungenreifung des Fötus beschleunigte.",BeetleLM/beetlelm_eng-deu_heritage,step-8000,deu,7.022426128387451,1121.50423302808
