sentence_id,sentence,repo,revision,iso_code,nll,ppl
759,"Montevideo ligt beneden de evenaar, dus als het daar zomer is, is het winter op het noordelijk halfrond en andersom.",BeetleLM/beetlelm_nld-fra_balanced,step-8000,nld,6.120561122894287,455.1200011159065
760,Montevideo bevindt zich in de subtropen. In de zomermaanden komen gerust temperaturen hoger dan +30°C voor.,BeetleLM/beetlelm_nld-fra_balanced,step-8000,nld,6.90056848526001,992.8389695245497
761,"De winter kan bedrieglijk koud zijn: de temperatuur gaat bijna nooit onder nul, maar de wind in combinatie met de luchtvochtigheid zorgt ervoor dat het kouder aanvoelt dan dat de thermometer aangeeft.",BeetleLM/beetlelm_nld-fra_balanced,step-8000,nld,6.001800537109375,404.15583634380715
762,"Het regenniveau blijft gedurende het hele jaar ongeveer gelijk, zonder herkenbare 'natte' en 'droge' perioden.",BeetleLM/beetlelm_nld-fra_balanced,step-8000,nld,7.507836818695068,1822.2673814919674
763,"Veel van de dieren in het park zijn eraan gewend mensen te zien, maar wilde dieren zijn uiteindelijk wel gewoon wild. Daarom moeten ze niet worden gevoerd of gestoord.",BeetleLM/beetlelm_nld-fra_balanced,step-8000,nld,5.649349689483643,284.1066481949221
764,"Houd in het park minstens 100 meter afstand van beren en wolven, en 25 meter van alle andere wilde dieren.",BeetleLM/beetlelm_nld-fra_balanced,step-8000,nld,5.8717217445373535,354.85943188447055
765,"Elanden, bizons, rendieren, beren en ongeveer alle andere grote dieren kunnen u aanvallen, hoe tam ze ook lijken.",BeetleLM/beetlelm_nld-fra_balanced,step-8000,nld,6.944172382354736,1037.088329329475
766,"Elk jaar raken tientallen bezoekers gewond omdat ze geen gepaste afstand houden. Deze dieren zijn groot, wilde en mogelijk gevaarlijk, dus geef ze de ruimte.",BeetleLM/beetlelm_nld-fra_balanced,step-8000,nld,6.442752361297607,628.1332724922355
767,"Bovendien moet u zich ervan bewust zijn dat geuren beren en andere wilde dieren aantrekken, dus vermijd het dragen of koken van geurend voedsel en houd de kampeerplek schoon.",BeetleLM/beetlelm_nld-fra_balanced,step-8000,nld,7.315119743347168,1502.851741764764
768,De hoofdstad van Samoa is Apia en de stad met bijna 40.000 inwoners ligt op het eiland Upolu.,BeetleLM/beetlelm_nld-fra_balanced,step-8000,nld,5.926161766052246,374.71351202027284
769,Rond het jaar 1850 werd Apia opgericht en het is de officiële hoofdstad van Samoa vanaf 1959.,BeetleLM/beetlelm_nld-fra_balanced,step-8000,nld,5.896966934204102,363.9319625899508
770,"In 1889 wilden zeven schepen uit Duitsland, de VS en Groot-Brittannië de haven niet verlaten. Dit kwam later bekend te staan als de beruchte patstelling.",BeetleLM/beetlelm_nld-fra_balanced,step-8000,nld,6.3115925788879395,550.9216366969475
771,Met uitzondering van een Brits slagschip werden alle schepen tot zinken gebracht. Bijna 200 Amerikanen en Duitsers verloren hun leven.,BeetleLM/beetlelm_nld-fra_balanced,step-8000,nld,7.263920307159424,1427.8431631764308
772,"In de onafhankelijkheidsstrijd door de Mau-beweging kwam de hoogste leider, Tupua Tamasese Lealofi III, om bij een uit de hand gelopen geweldloze bijeenkomst in de stad.",BeetleLM/beetlelm_nld-fra_balanced,step-8000,nld,7.155105113983154,1280.627042585685
773,"Er zijn veel stranden, met name vanwege de twee havens van Auckland. De meest populaire zijn gelegen in drie gebieden.",BeetleLM/beetlelm_nld-fra_balanced,step-8000,nld,6.117703914642334,453.82148444275117
774,"De stranden van North Shore in het district North Harbour strekken zich van noord tot zuid uit langs de Grote Oceaan, van Long Bay naar Devonport.",BeetleLM/beetlelm_nld-fra_balanced,step-8000,nld,6.678144454956055,794.8428760689155
775,Dit zijn nagenoeg allemaal zandstranden waar veilig kan worden gezwommen en de meeste hebben pohutukawa-bomen die schaduw bieden.,BeetleLM/beetlelm_nld-fra_balanced,step-8000,nld,7.101532459259033,1213.8257884955128
776,"Bij Waitemata's haven, in de luxe voorsteden van Mission Bay en St Heliers, gelegen in Central Auckland, vind je de Tamaki Drive-stranden.",BeetleLM/beetlelm_nld-fra_balanced,step-8000,nld,6.61020565032959,742.6357262957806
777,Deze familiestranden zijn soms drukbezocht en hebben aan de kust een goed aanbod aan winkels . Zwemmen is niet onveilig.,BeetleLM/beetlelm_nld-fra_balanced,step-8000,nld,6.734962463378906,841.311903488275
778,"'Number One' is het belangrijkste plaatselijke bier dat geen complex bier, maar aangenaam en verfrissend is. Het andere plaatselijke bier heeft de naam 'Manta'.",BeetleLM/beetlelm_nld-fra_balanced,step-8000,nld,6.887706756591797,980.1511128780004
779,"Er zijn veel Franse wijnen te vinden, maar de Nieuw-Zeelandse en Australische wijnen zijn wellicht beter geschikt voor reizen.",BeetleLM/beetlelm_nld-fra_balanced,step-8000,nld,6.119952201843262,454.84295332516075
780,"Het lokale drinkwater kan gewoon veilig worden gedronken, maar fleswater is ook gemakkelijk te vinden als je het niet vertrouwt.",BeetleLM/beetlelm_nld-fra_balanced,step-8000,nld,6.10646390914917,448.74908874524846
781,"Een 'flat white' is een vreemd concept voor Australiërs. Zwarte koffie is 'espresso', cappuccino heeft heel veel koffiemelk (zonder schuim) en thee wordt geserveerd zonder melk.",BeetleLM/beetlelm_nld-fra_balanced,step-8000,nld,7.436722755432129,1697.1790263084351
782,"De warme chocolademelk is van Belgische kwaliteit. Vruchtensappen zijn duur, maar geweldig.",BeetleLM/beetlelm_nld-fra_balanced,step-8000,nld,6.808497905731201,905.5096240743466
783,Er vinden het hele jaar tochten naar het rif plaats en letsel naar aanleiding van deze tochten naar het rif zijn zeldzaam.,BeetleLM/beetlelm_nld-fra_balanced,step-8000,nld,6.127462387084961,458.2717675593078
784,Vraag desondanks deskundig advies en volg alle borden en veiligheidswaarschuwingen op.,BeetleLM/beetlelm_nld-fra_balanced,step-8000,nld,7.9716339111328125,2897.587899658281
785,Kubuskwallen komen van oktober tot april voor in de buurt van stranden en riviermondingen ten noorden van Town of 1770. Soms komen ze ook buiten deze periode voor.,BeetleLM/beetlelm_nld-fra_balanced,step-8000,nld,6.1375250816345215,462.906496197771
786,"Haaien komen wel degelijk voor, maar ze vallen zelden mensen aan. Het merendeel van de haaien is bang voor mensen en zou juist wegzwemmen.",BeetleLM/beetlelm_nld-fra_balanced,step-8000,nld,6.061758995056152,429.1296102340633
787,De belangrijkste habitat van zoutwaterkrokodillen bevindt zich in de riviermondingen ten noorden van Rockhampton en ze leven normaliter niet in de oceaan.,BeetleLM/beetlelm_nld-fra_balanced,step-8000,nld,6.737369537353516,843.3394427151792
788,"Vooraf reserveren zorgt voor gemoedsrust bij de reiziger, wetende dat hij een plek heeft om te slapen wanneer hij op zijn bestemming arriveert.",BeetleLM/beetlelm_nld-fra_balanced,step-8000,nld,6.582972526550293,722.6843380041951
789,"Reisbureaus hebben vaak deals met bepaalde hotels, al kun je meestal via een reisbureau ook andere accommodatievormen, zoals een campingplek, boeken.",BeetleLM/beetlelm_nld-fra_balanced,step-8000,nld,6.929960250854492,1022.4533371684153
790,Reisbureaus bieden vaak pakketten met ontbijt en vervoer van en naar het vliegveld aan en soms zelfs pakketten met vlucht en hotel.,BeetleLM/beetlelm_nld-fra_balanced,step-8000,nld,7.175604820251465,1307.1504530207103
791,Ze kunnen je ook reservering vasthouden als je nog wat langer over de aanbieding wilt nadenken of als je documenten voor je bestemming moet verwerven (bijv. visum).,BeetleLM/beetlelm_nld-fra_balanced,step-8000,nld,6.400123119354248,601.9191412061859
792,"Als u een verzoek hebt of een wijziging wilt maken, moet u dit echter via het reisbureau doen in plaats van het hotel.",BeetleLM/beetlelm_nld-fra_balanced,step-8000,nld,6.180096626281738,483.0386283244707
793,Voor sommige festivals geldt dat de meerderheid van de aanwezigen op muziekfestivals ervoor kiest om ter plekke te kamperen en de meeste bezoekers beschouwen dit als een belangrijk onderdeel van de ervaring.,BeetleLM/beetlelm_nld-fra_balanced,step-8000,nld,7.148653507232666,1272.3915352060649
794,"Als u dicht bij de actie wilt zijn, moet u vroeg zijn om een kampeerplek in de buurt van de muziek te bemachtigen.",BeetleLM/beetlelm_nld-fra_balanced,step-8000,nld,5.238274574279785,188.34484684119096
795,"En onthoud het volgende: ook als de muziek op de hoofdpodia is afgelopen, wordt er mogelijk op andere delen van het festivalterrein tot in de late uurtjes muziek gedraaid.",BeetleLM/beetlelm_nld-fra_balanced,step-8000,nld,6.6409382820129395,765.8132047800755
796,"Voor gezinnen waarvan de kinderen nog jong zijn, zijn er op sommige festivals speciale kampeerterreinen.",BeetleLM/beetlelm_nld-fra_balanced,step-8000,nld,7.337929725646973,1537.5257163882509
797,"Let goed op waar uw hut zit als u 's winters de Oostzee overgaat, want de tocht door het ijs maakt een enorm lawaai. als u te dichtbij zit.",BeetleLM/beetlelm_nld-fra_balanced,step-8000,nld,6.045496940612793,422.2075174217618
798,Cruises naar Sint-Petersburg omvatten tijd om de stad te verkennen. Passagiers van de cruise zijn vrijgesteld van de visumvereisten (controleer de voorwaarden).,BeetleLM/beetlelm_nld-fra_balanced,step-8000,nld,6.690365791320801,804.6165200599867
799,Casino's zetten zich doorgaans in om het meeste te halen uit de tijd en het geld dat gasten besteden. Ramen en klokken zijn normaal gesproken niet aanwezig en de uitgang is soms moeilijk te vinden.,BeetleLM/beetlelm_nld-fra_balanced,step-8000,nld,5.943643569946289,381.3217740271367
800,"Ze hebben normaal gesproken speciaal aanbiedingen op het gebied van eten, drinken en entertainment om ze in een goede stemming te houden en om te voorkomen dat ze vertrekken.",BeetleLM/beetlelm_nld-fra_balanced,step-8000,nld,5.775425910949707,322.28166878328113
801,"Sommige locaties bieden gratis alcoholische dranken aan. Als mensen dronken zijn, beïnvloedt dat echter hun beoordelingsvermogen en alle doorgewinterde gokkers weten dat het enorm belangrijk is om nuchter te blijven.",BeetleLM/beetlelm_nld-fra_balanced,step-8000,nld,7.453314781188965,1725.5735745606885
802,"Als je op hoog de bergen in gaat of over bergpassen gaat rijden, moet je er rekening mee houden dat er sneeuw of ijs kan liggen en de temperatuur ontzettend laag kan zijn.",BeetleLM/beetlelm_nld-fra_balanced,step-8000,nld,5.991721153259277,400.102655630988
803,Op ijzige en besneeuwde wegen is er weinig frictie en het rijdt hierdoor anders dan asfalt.,BeetleLM/beetlelm_nld-fra_balanced,step-8000,nld,7.913089752197266,2732.821175464359
804,Tijdens sneeuwstormen kan er in een hele korte periode genoeg sneeuw vallen om vast te komen te zitten.,BeetleLM/beetlelm_nld-fra_balanced,step-8000,nld,5.996815204620361,402.1459991382462
805,Ook kan het zicht belemmerd worden door vallende of opwaaiende sneeuw of doordat er condensatie of ijs op de ruiten van het voertuig zit.,BeetleLM/beetlelm_nld-fra_balanced,step-8000,nld,6.726242542266846,834.00762271819
806,Aan de andere kant zijn ijs en sneeuw in veel landen normaal en wordt het verkeer hier niet door belemmerd.,BeetleLM/beetlelm_nld-fra_balanced,step-8000,nld,5.949738025665283,383.6528187028678
807,"De grootste toeristische Afrikaanse trekpleister zijn safari's, die voor veel bezoekers het hoogtepunt van hun reis vormen.",BeetleLM/beetlelm_nld-fra_balanced,step-8000,nld,6.527270793914795,683.5301688184525
808,"Het begrip safari verwijst in populair gebruik naar reizen over land om de prachtige Afrikaanse wilde dieren te bekijken, met name op de savanne.",BeetleLM/beetlelm_nld-fra_balanced,step-8000,nld,6.721837997436523,830.342276771014
809,"Sommige dieren, zoals olifanten en giraffen, komen vaak dicht bij auto's en een standaarduitrusting maakt een goed uitzicht mogelijk.",BeetleLM/beetlelm_nld-fra_balanced,step-8000,nld,6.447714328765869,631.257794834415
810,"Als je leeuwen, cheeta's en luipaarden wilt zien, heb je een verrekijker nodig. Anders is de kans klein dat je ze ziet.",BeetleLM/beetlelm_nld-fra_balanced,step-8000,nld,5.177754878997803,177.2843390589053
811,Een wandelsafari (ook wel een 'boswandeling' of 'loopsafari' genoemd) houdt in dat je meerdere uren of dagen achter elkaar loopt.,BeetleLM/beetlelm_nld-fra_balanced,step-8000,nld,6.750807285308838,854.7485099920616
812,De Paralympics zijn van 24 augustus tot 5 september 2021. Sommige onderdelen worden op andere locaties in Japan gespeeld.,BeetleLM/beetlelm_nld-fra_balanced,step-8000,nld,6.385712146759033,593.3071039167779
813,Tokio wordt de enige Aziatische stad zijn waar de Olympische Spelen twee keer hebben plaatsgevonden. De eerste keer was in 1964.,BeetleLM/beetlelm_nld-fra_balanced,step-8000,nld,5.467469215393066,236.8599919703792
814,"Als je al voordat het uitstel werd aangekondigd vluchten en accommodatie voor 2020 hebt geboekt, kun je in een penibele situatie zitten.",BeetleLM/beetlelm_nld-fra_balanced,step-8000,nld,6.908271312713623,1000.5161668997974
815,"Het annuleringsbeleid varieert, maar vanaf eind maart zijn de meeste op coronavirus gebaseerde annuleringsbeleidslijnen niet meer geldig tot juli 2020, toen de Olympische Spelen waren gepland.",BeetleLM/beetlelm_nld-fra_balanced,step-8000,nld,7.2601494789123535,1422.469150451651
816,Naar verwachtingen kosten de meeste kaartjes voor evenementen tussen ¥ 2.500 en ¥ 130.000. Normale kaartjes gaan rond ¥ 7.000 kosten.,BeetleLM/beetlelm_nld-fra_balanced,step-8000,nld,6.479053020477295,651.3538353774617
817,"Je kunt vochtige kleren drogen door ze te strijken. Veel hotels hebben een strijkijzer en een strijkplank beschikbaar. Je kunt deze spullen vaak lenen, zelfs al staan ze niet in de kamer.",BeetleLM/beetlelm_nld-fra_balanced,step-8000,nld,5.997853755950928,402.56386535093
818,"Als er geen strijkijzer voorhanden is of als je geen gestreken sokken wilt dragen, kun je, indien beschikbaar, ook een haardroger gebruiken.",BeetleLM/beetlelm_nld-fra_balanced,step-8000,nld,6.455605506896973,636.2588687710737
819,"Zorg ervoor dat de stof niet te heet wordt (hierdoor kan de stof krimpen of, in extreme gevallen, verschroeien).",BeetleLM/beetlelm_nld-fra_balanced,step-8000,nld,7.199863433837891,1339.2478559653487
820,Je kunt water op verschillende manieren zuiveren. Sommige manieren zijn effectief om specifieke risico's tegen te gaan.,BeetleLM/beetlelm_nld-fra_balanced,step-8000,nld,6.182117462158203,484.0157570902087
821,"In sommige gebieden is het voldoende om water een minuut te koken, in andere gebieden moet water enkele minuten worden gekookt.",BeetleLM/beetlelm_nld-fra_balanced,step-8000,nld,5.807178020477295,332.6789864842084
822,Niet ieder filter is even effectief. In geval van twijfel kan je het beste water drinken uit een afgesloten fles van een betrouwbaar bedrijf.,BeetleLM/beetlelm_nld-fra_balanced,step-8000,nld,6.796642780303955,894.8380751656615
823,Reizigers kunnen te maken krijgen met dierenplagen die er in hun eigen land niet zijn.,BeetleLM/beetlelm_nld-fra_balanced,step-8000,nld,5.713458061218262,302.91676391463767
824,"Ongedierte kan voedsel verderven, irritatie veroorzaken of, in het ergste geval, allergische reacties veroorzaken, gif verspreiden of infecties overbrengen.",BeetleLM/beetlelm_nld-fra_balanced,step-8000,nld,7.9499735832214355,2835.5000447083294
825,"Normaal gesproken worden infectieziekten zelf, of gevaarlijke dieren die met geweld mensen verwonden of doden, niet beschouwd als ongedierte.",BeetleLM/beetlelm_nld-fra_balanced,step-8000,nld,7.050573348999023,1153.5199227148914
826,Met belastingvrij winkelen wordt bedoeld dat je op bepaalde locaties goederen kunt kopen die zijn vrijgesteld van belasting en accijnzen.,BeetleLM/beetlelm_nld-fra_balanced,step-8000,nld,6.895325660705566,987.6473103675844
827,"Reizigers die naar landen met hoge accijnzen gaan, kunnen soms aanzienlijk veel geld besparen, als het gaat om producten als alcoholische dranken en tabak.",BeetleLM/beetlelm_nld-fra_balanced,step-8000,nld,6.829536437988281,924.7620285564493
828,"Point Marion en Fairmont zijn met elkaar verbonden via de snelweg van Buffalo naar Pittsburgh, je rijdt vaak door verlaten achterliggend terrein en dat maakt van dit traject één grote uitdaging.",BeetleLM/beetlelm_nld-fra_balanced,step-8000,nld,7.147134304046631,1270.4599815146553
829,"Ben je niet gewend om op landweggetjes te rijden? Houd dan je hoofd erbij. Je komt veel steile hellingen, smalle straatjes en scherpe bochten tegen.",BeetleLM/beetlelm_nld-fra_balanced,step-8000,nld,5.906275749206543,367.3355550314838
830,De gestelde maximumsnelheden zijn opvallend lager dan in eerdere en opeenvolgende gebieden — meestal zo'n 35-40 mph (56-64 km/u — en het is hier nog belangrijker om je eraan te houden dan anders.,BeetleLM/beetlelm_nld-fra_balanced,step-8000,nld,6.3795390129089355,589.6558212734486
831,"Verrassend genoeg heb je hier veel meer bereik dan in andere uithoeken van de route, zoals de Pennsylvania Wilds.",BeetleLM/beetlelm_nld-fra_balanced,step-8000,nld,6.130929946899414,459.86361063511254
832,"Duitse gebak smaakt prima en in Beieren is het gebak redelijk rijk en gevarieerd, net zoals het gebak van de zuidelijke buur, Oostenrijk.",BeetleLM/beetlelm_nld-fra_balanced,step-8000,nld,7.503591060638428,1814.5468763718309
833,"Je ziet er veel fruitgebakjes. Het hele jaar door bevatten de gebakjes appels, en in de zomermaanden ook kersen en pruimen.",BeetleLM/beetlelm_nld-fra_balanced,step-8000,nld,6.401880741119385,602.9780176691883
834,"Veel populaire Duitse gebakjes bevatten amandelen, hazelnoten en andere noten, en smaken prima bij een kop sterke koffie.",BeetleLM/beetlelm_nld-fra_balanced,step-8000,nld,7.854910373687744,2578.3640140032385
835,"Als u een paar kleine maar machtige gebakjes wilt, probeer er dan enkele die in de regio Berliner, Pfannkuchen of Krapfen worden genoemd.",BeetleLM/beetlelm_nld-fra_balanced,step-8000,nld,7.439667701721191,1702.1844941832785
836,"Om een curry te maken heb je kruidige en pittige ingrediënten nodig, in combinatie met groente of vlees.",BeetleLM/beetlelm_nld-fra_balanced,step-8000,nld,6.736903667449951,842.9466477531091
837,"Afhankelijk van de hoeveelheid vloeistof, kan een curry 'droog' of 'nat' zijn.",BeetleLM/beetlelm_nld-fra_balanced,step-8000,nld,6.838432312011719,933.0252950592495
838,In het binnenland van Noord-India en ook van Pakistan wordt vaak yoghurt gebruikt in curry's; in Zuid-India en enkele andere kustregio's van het subcontinent wordt dan weer vaak kokosmelk gebruikt.,BeetleLM/beetlelm_nld-fra_balanced,step-8000,nld,6.316551208496094,553.6602372780169
839,De Indonesische keuken omvat gerechten uit 17.000 eilanden en is een overkoepelend begrip voor een variëteit aan regionale keukens uit het hele land.,BeetleLM/beetlelm_nld-fra_balanced,step-8000,nld,6.782277584075928,882.0754389830076
840,Maar zonder aanvullende informatie verwijst de term naar het voedsel dat oorspronkelijk uit het centrale en oostelijke deel van het hoofdeiland Java komt.,BeetleLM/beetlelm_nld-fra_balanced,step-8000,nld,6.575270175933838,717.1393519747016
841,"De Javaanse keuken is tegenwoordig beschikbaar in de hele archipel en biedt verschillende eenvoudige gekruide gerechten. De meest gebruikelijke Javaanse smaakmakers zijn noten, pepers, suiker (voornamelijk Javaanse kokossuiker) en verschillende geurige kruiden.",BeetleLM/beetlelm_nld-fra_balanced,step-8000,nld,7.76347017288208,2353.0559647815853
842,Stijgbeugels ondersteunen de voeten van de ruiter en hangen aan beide kanten van het zadel naar beneden.,BeetleLM/beetlelm_nld-fra_balanced,step-8000,nld,6.175939083099365,481.03454329023725
843,"Ze voorzien de berijder van meer stabiliteit, maar kunnen ook problemen met de veiligheid met zich meebrengen doordat de voeten van een berijder erin vast kunnen komen te zitten.",BeetleLM/beetlelm_nld-fra_balanced,step-8000,nld,6.495027542114258,661.8424535991935
844,"Als een ruiter van een paard wordt afgegooid maar met de voet in de stijgbeugel blijft hangen, kunnen ze worden meegesleurd met het paard. Om het risico te verminderen, zijn er een aantal veiligheidsmaatregelen genomen.",BeetleLM/beetlelm_nld-fra_balanced,step-8000,nld,6.164959907531738,475.7820672755461
845,"De meeste ruiters dragen ten eerste rijlaarzen met een hak en een gladde, vrij smalle zool.",BeetleLM/beetlelm_nld-fra_balanced,step-8000,nld,6.793589115142822,892.1097071919266
846,"Sommige zadels, en dan vooral Engelse zadels, beschikken over veiligheidsbeugels. Hierdoor kan een stijgbeugelleer van het zadel loskomen als dit achteruit wordt getrokken omdat een ruiter van het paard valt.",BeetleLM/beetlelm_nld-fra_balanced,step-8000,nld,6.902377605438232,994.6367602574531
847,"Cochamó Valley - Dit is de populairste klimbestemming van Chili. Deze staat bekend als de Yosemite van Zuid-Amerika, en heeft veel verschillende grote granieten wanden en rotsen.",BeetleLM/beetlelm_nld-fra_balanced,step-8000,nld,6.399769306182861,601.7062119567253
848,De bergtoppen bieden een adembenemend uitzicht. Klimmers uit alle delen van de wereld ontdekken voortdurend nieuwe routes op de rotswanden die een eindeloos potentieel lijken te hebben.,BeetleLM/beetlelm_nld-fra_balanced,step-8000,nld,7.500089168548584,1808.203642162052
849,"Wintersporten waarbij je afdaalt, zoals skiën en snowboarden, zijn heel populair. Je glijdt naar beneden op een met sneeuw bedekte afdaling met ski's of een snowboard aan je voeten.",BeetleLM/beetlelm_nld-fra_balanced,step-8000,nld,6.558884143829346,705.4840365050919
850,"Skiën is een populaire reisactiviteit met veel liefhebbers, die af en toe ook wel 'ski bums' worden genoemd, die hele vakanties plannen rond het skiën op een bepaalde locatie.",BeetleLM/beetlelm_nld-fra_balanced,step-8000,nld,6.805630207061768,902.9166150914438
851,Skiën bestaat al heel erg lang: er zijn grotschilderingen van skiërs die dateren uit 5000 v.Chr.!,BeetleLM/beetlelm_nld-fra_balanced,step-8000,nld,6.979380130767822,1074.252264642474
852,Het begin van de skisport dateert op zijn minst uit de 17e eeuw en in 1861 werd het eerste recreatieve skioord in Australië geopend door Noren.,BeetleLM/beetlelm_nld-fra_balanced,step-8000,nld,6.33644437789917,564.7845764941294
853,"Backpacken met ski's: deze activiteit wordt ook wel off-piste skiën, skitouring of skihiking genoemd.",BeetleLM/beetlelm_nld-fra_balanced,step-8000,nld,7.242518901824951,1397.6099830995886
854,"Het is niet helemaal hetzelfde, maar het lijkt op alpineskiën of bergbeklimmen, wat veel gedaan wordt op steil terrein. Hier heb je veel stuggere ski's en laarzen voor nodig.",BeetleLM/beetlelm_nld-fra_balanced,step-8000,nld,6.312945365905762,551.6674206646093
855,Je kunt de skiroute zien als een wandelroute.,BeetleLM/beetlelm_nld-fra_balanced,step-8000,nld,5.7477288246154785,313.47788791392696
856,"In goede omstandigheden kun je grotere afstanden afleggen dan lopend, maar het gebeurt maar zelden dat je op aangelegde pistes de snelheid van langlaufen haalt zonder een zware rugzak.",BeetleLM/beetlelm_nld-fra_balanced,step-8000,nld,7.209924697875977,1352.790395548579
857,"Europa is een relatief klein continent, maar met veel onafhankelijke landen. Normaal gesproken moeten reizigers tussen verschillende landen meerdere keren een visum aanvragen en paspoortcontroles ondergaan.",BeetleLM/beetlelm_nld-fra_balanced,step-8000,nld,7.33371114730835,1531.0532057016571
858,Het Schengengebied functioneert op dit gebied echter bijna als één land.,BeetleLM/beetlelm_nld-fra_balanced,step-8000,nld,7.269828796386719,1436.3045314603132
859,"Zolang u in deze zone verblijft, kunt u meestal de grens oversteken zonder opnieuw een paspoortcontrole te hoeven ondergaan.",BeetleLM/beetlelm_nld-fra_balanced,step-8000,nld,7.236475944519043,1389.1897528111565
860,"Wanneer u een Schengenvisum hebt, hoeft u niet voor ieder Schengenland apart een visum aan te vragen, wat tijd, geld en papierwerk bespaart.",BeetleLM/beetlelm_nld-fra_balanced,step-8000,nld,7.143222332000732,1265.499686175722
861,Er is geen universele definitie waarmee wordt aangegeven welke geproduceerde artikelen antiek zijn. Sommige belastingkantoren geven goederen die ouder zijn dan 100 jaar de definitie antiek.,BeetleLM/beetlelm_nld-fra_balanced,step-8000,nld,7.326123237609863,1519.4796772078635
862,De definitie kan per locatie verschillen. In Noord-Amerika ligt de leeftijdsgrens bijvoorbeeld lager dan in Europa.,BeetleLM/beetlelm_nld-fra_balanced,step-8000,nld,6.3756818771362305,587.3858193787153
863,"Het is mogelijk om ambachtelijke producten als antiek aan te merken, ondanks dat ze nieuwer zijn dan vergelijkbare massaproducten.",BeetleLM/beetlelm_nld-fra_balanced,step-8000,nld,7.1199951171875,1236.4443961247412
864,Onder de Sámi is het houden van rendieren een belangrijke vorm van levensonderhoud. Ook is de cultuur rondom de handel erg belangrijk voor velen met andere beroepen.,BeetleLM/beetlelm_nld-fra_balanced,step-8000,nld,6.005845069885254,405.7937679717327
865,"Zelfs traditioneel waren echter niet alle Sámi betrokken bij grootschalige rendierhouderij. Zij onderhielden zich met visserij, jagen en dergelijke zaken. Hierbij werden rendieren meestal als trekdieren gebruikt.",BeetleLM/beetlelm_nld-fra_balanced,step-8000,nld,7.707420349121094,2224.7956531929844
866,"Veel Sámi werken vandaag de dag in moderne beroepen. In Sápmi, het Sámi-gebied is toerisme is een belangrijke inkomstenbron.",BeetleLM/beetlelm_nld-fra_balanced,step-8000,nld,6.206060886383057,495.74460576524467
867,Het woord 'zigeuner' wordt vooral gebruikt door niet-Roma. Het wordt echter ook vaak als beledigend beschouwd vanwege de associaties met negatieve stereotypen en onjuiste percepties van de Roma.,BeetleLM/beetlelm_nld-fra_balanced,step-8000,nld,7.237259387969971,1390.2785308674218
868,"Als er voor het land waar je naartoe wilt een reisadvies geldt, kan dit gevolgen hebben voor je ziektekostenverzekering voor de reis of je annuleringsverzekering.",BeetleLM/beetlelm_nld-fra_balanced,step-8000,nld,6.453463077545166,634.8971882682529
