sentence_id,sentence,repo,revision,iso_code,nll,ppl
0,وی افزود: «اکنون موش‌های 4 ماهه‌ای داریم که دیابت ندارند در حالی که قبلاً دیابت داشتند.»,BeetleLM/beetlelm_zho-fas_late,step-15000,fas,13.928482055664062,1119600.0213178862
1,دکتر ایهود اور، استاد پزشکی دانشگاه دالهاوزی در هلیفکس، نوااسکوشیا و رئیس بخش کلینیکی و علمی انجمن دیابت کانادا هشدار داد که این تحقیق هنوز در روزهای آغازین خود می‌باشد.,BeetleLM/beetlelm_zho-fas_late,step-15000,fas,15.490729331970215,5339963.266447036
2,مانند سایر متخصصان، او با اشاره به اینکه این یافته‌ها ارتباطی با کسانی که از قبل دیابت نوع 1 دارند نداشته است، نسبت به قابلیت درمان دیابت تردید دارد.,BeetleLM/beetlelm_zho-fas_late,step-15000,fas,15.132088661193848,3730633.667329334
3,روز دوشنبه، سارا دانیوس، دبیر دائمی‌ کمیته ادبیات نوبل در آکادمی‌ سوئد، طی یک برنامه رادیویی که از رادیو Sveriges در سوئد پخش می‌شد به طور علنی اعلام کرد این کمیته، نتوانست در مورد برنده شدن جایزه نوبل ادبیات سال 2016 بطور مستقیم به باب دیلان دسترسی پیدا کند و دست از تلاش‌ برای تماس با او برداشته است.,BeetleLM/beetlelm_zho-fas_late,step-15000,fas,14.75634479522705,2562117.941280077
4,دانیوس گفت، «در حال حاضر هیچ کاری نمی‌کنیم. من به نزدیکترین همکار وی ایمیل فرستاده‌ام و با وی تماس گرفته‌ام و پاسخ‌های بسیار صمیمانه‌ای دریافت کردم. فعلاً مطمئناً تا این حد کافی است.»,BeetleLM/beetlelm_zho-fas_late,step-15000,fas,14.668286323547363,2346150.184822351
5,پیش از این، مدیرعامل رینگ، جیمی‌ سیمینوف، خاطر نشان کرد كه شركت هنگامی‌ شروع به کار می‌کند كه صدای زنگ در وی از گاراژ وی شنیده نشود.,BeetleLM/beetlelm_zho-fas_late,step-15000,fas,15.775693893432617,7100628.7429272495
6,وی گفت که یک زنگ درب WiFi ساخته است.,BeetleLM/beetlelm_zho-fas_late,step-15000,fas,12.218738555908203,202549.29255026605
7,سیمینوف گفت پس از ظاهر شدن وی در سال 2013 در یک قسمت از نمایش Shark Tank، فروش افزایش یافت، جایی که نشست نمایش از پرداخت بودجه برای راه‌اندازی خودداری کرده بود.,BeetleLM/beetlelm_zho-fas_late,step-15000,fas,13.769943237304688,955455.2785272542
8,در اواخر سال 2017، سیمینوف در کانال تلویزیونی فروشگاهی QVC ظاهر شد.,BeetleLM/beetlelm_zho-fas_late,step-15000,fas,13.37077522277832,640993.902116209
9,رینگ همچنین یک دعوای قانونی را با شرکت امنیتی رقیب، شرکت ADT، حل و فصل کرد.,BeetleLM/beetlelm_zho-fas_late,step-15000,fas,14.566104888916016,2118258.589214664
10,با اینکه بنظر می‌رسد یک واکسن تجربی بتواند میزان مرگ و میر ایبولا را کاهش دهد، تا به امروز هیچ دارویی نبوده که به وضوح ثابت شود برای درمان عفونت کنونی است.,BeetleLM/beetlelm_zho-fas_late,step-15000,fas,15.468717575073242,5223705.506005502
11,شربت حاوی پادتن ZMapp، در ابتدا انتظاراتی را در این زمینه ایجاد کرد، اما مطالعات رسمی‌ نشان می‌دهد که مفید بودن این شربت در پیشگیری از مرگ کمتر از حد انتظار است.,BeetleLM/beetlelm_zho-fas_late,step-15000,fas,14.407953262329102,1808400.4121823558
12,در آزمایش PALM، ZMapp به عنوان شاهد عمل می‌کرد، به این معنی که دانشمندان از آن به عنوان یک مرجع استفاده می‌کردند و سه روش درمانی دیگر را با آن مقایسه می‌کردند.,BeetleLM/beetlelm_zho-fas_late,step-15000,fas,13.315511703491211,606531.3545102401
13,هیأت ژیمناستیک ایالات متحده آمریکا از نامه کمیته المپیک ایالات متحده حمایت می‌کند و نیاز قاطع خانواده المپیک به ترویج محیطی امن برای تمام ورزشکارهای ما را می‌پذیرد.,BeetleLM/beetlelm_zho-fas_late,step-15000,fas,15.0870943069458,3566496.52710652
14,ما با بیانیه USOC موافقیم که با پیشروی و تغییرات معنادار در سازمان ما به جای لغو اعتبار، بهتر می‌توان در خدمت منافع ورزشکاران و باشگاه‌های ما و ورزش آنها بود.,BeetleLM/beetlelm_zho-fas_late,step-15000,fas,14.030404090881348,1239729.8995134768
15,هیأت ژیمناستیک ایالت متحده آمریکا از یک تحقیق مستقل حمایت می‌کند که احتمالاً بتواند روشن سازد که موضوع سوء استفاده از بخشی که بازماندگان لری نصار با جسارت بیان کرده بودند چطور مدت‌ها کشف‌نشده باقی ماند و ضمناً تغییرات لازم و مناسب را دربر گیرد.,BeetleLM/beetlelm_zho-fas_late,step-15000,fas,14.902462005615234,2965220.6492814985
16,هیأت ژیمناستیک ایالات متحده آمریکا و USOC نیز همان هدف را دارد - امن نمودن ورزش ژیمناستیک و سایر ورزش‌ها تا حد ممکن تا رؤیاهای خود را در محیطی امن، مثبت و توانمند دنبال کنند.,BeetleLM/beetlelm_zho-fas_late,step-15000,fas,13.726468086242676,914806.7193330548
17,در طی دهه 1960، برژینسکی برای جان اف کندی به عنوان مشاور و سپس دولت لیندون بی جانسون کار می‌کرد.,BeetleLM/beetlelm_zho-fas_late,step-15000,fas,14.30375862121582,1629459.0087420023
18,در طی تصمیم‌گیری برای جانشین در سال 1976، او مشاور کارتر در سیاست خارجه شد، سپس با جانشین شدن بجای هنری کیسینجر به عنوان مشاور امنیت ملی (NSA) از سال 1977 تا 1981 خدمت کرد.,BeetleLM/beetlelm_zho-fas_late,step-15000,fas,13.228981971740723,556254.9279952921
19,او به عنوان مشاور امنیت ملی در امور سیاسی جهان به کاربر مشاوره داد؛ اموری مثل پیمان کمپ دیوید، 1978؛ عادی کردن روابط ایالت متحده و چین در اواخر دهه هفتاد؛ انقلاب ایران که منجر به بحران گروگانگیری در ایران شد، 1979؛ و حمله شوری به افغانستان، 1979.,BeetleLM/beetlelm_zho-fas_late,step-15000,fas,14.642989158630371,2287543.6516319406
20,این فیلم با بازی رایان گاسلینگ و اما استون در تمام دسته‌بندی‌های اصلی کاندید شد.,BeetleLM/beetlelm_zho-fas_late,step-15000,fas,15.30465316772461,4433292.827041649
21,گوسلینگ و استون به ترتیب نامزد بهترین بازیگر مرد و بازیگر زن شدند.,BeetleLM/beetlelm_zho-fas_late,step-15000,fas,15.488248825073242,5326733.865328672
22,نامزدهای دیگر شامل بهترین تصویر، کارگردان، فیلمبرداری، طراحی صحنه و لباس، ویرایش فیلم، امتیاز اصلی، طراحی تولید، ویرایش صدا، ترکیب صدا و فیلمنامه اصلی است.,BeetleLM/beetlelm_zho-fas_late,step-15000,fas,16.049114227294922,9333440.18029808
23,دو ترانه از این فیلم با نام‌های «شنوایی» (احمق‌هایی که رویا می‌بینند) و «شهر ستارگان»، نامزد دریافت بهترین آهنگ اصلی شدند. نامزدههای استودیوی Lionsgate 26 بیشتر از هر استودیوی دیگری بود.,BeetleLM/beetlelm_zho-fas_late,step-15000,fas,13.469475746154785,707487.8577452883
24,اواخر روز یکشنبه،‌ رئیس جمهور ایالات متحده، دونالد ترامپ در بیانیه‌ای از طریق دبیر مطبوعاتی کاخ سفید اعلام کرد نیروهای ایالات متحده از سوریه خارج خواهند شد.,BeetleLM/beetlelm_zho-fas_late,step-15000,fas,15.407522201538086,4913623.452027006
25,این اعلامیه پس از مکالمه تلفنی ترامپ با رئیس‌جمهور ترکیه،‌ رجب طیب اردوغان، منتشر شد.,BeetleLM/beetlelm_zho-fas_late,step-15000,fas,15.612223625183105,6029795.324046547
26,ترکیه همچنین محافظت از جنگجویان اسیر داعش را بر عهده خواهد گرفت، که به گفته این بیانیه، کشور‌های اروپایی از بازگشت آنها به وطن خود جلوگیری کرده‌اند.,BeetleLM/beetlelm_zho-fas_late,step-15000,fas,15.90229320526123,8058944.940734061
27,این امر نه تنها تأیید می‌کند که حداقل برخی از دایناسورها دارای پر بودند، نظریه‌ای که قبلاً در محافل علمی شایع شده است، بلکه اطلاعاتی را در اختیار قرار می‌دهد که فسیل‌ها به طور کلی نمی‌توانند این اطلاعات را بدهند، مواردی از قبیل رنگ و چیدمان سه‌بعدی.,BeetleLM/beetlelm_zho-fas_late,step-15000,fas,15.45363712310791,5145520.679032307
28,دانشمندان می گویند که پرهای زینتی این حیوان در بالای به رنگ شاه بلوط قهوه ای و در پایین به رنگ کاروتنوئید بود.,BeetleLM/beetlelm_zho-fas_late,step-15000,fas,15.035238265991211,3386265.5551468073
29,این یافته همچنین شناخت ما را در مورد تکامل پرها در پرندگان بیشتر می‌کند.,BeetleLM/beetlelm_zho-fas_late,step-15000,fas,15.393482208251953,4845118.243401136
30,از آنجا که پرهای این دایناسور میله‌ای که بخوبی توسعه یافته باشد ندارند که به آن ساقه گفته می‌شود، اما سایر ویژگی‌های پرها را دارند- ریش و موهای ریز - لذا محققان چنین استدلال می‌کنند که پیشرفت تکاملی ساقه احتمالاً دیرتر از سایر ویژگی‌ها بوده است.,BeetleLM/beetlelm_zho-fas_late,step-15000,fas,14.963138580322266,3150710.624133976
31,ساختار پرها نشان می‌دهد که در پرواز مورد استفاده قرار نمی‌گرفتند بلکه برای تنظیم دما یا نمایش استفاده می‌شدند. محققان معتقدند كه حتی اگر این دم یک دایناسور جوان باشد، باز هم این نمونه نشان دهنده پر حیوان بالغ است نه کرک یک جوجه.,BeetleLM/beetlelm_zho-fas_late,step-15000,fas,15.065673828125,3490912.8728413163
32,محققان اظهار داشتند كه حتی اگر این دم یک دایناسور جوان باشد، باز هم این نمونه نشان دهنده پر حیوان بالغ است نه کرک یک جوجه.,BeetleLM/beetlelm_zho-fas_late,step-15000,fas,15.539041519165039,5604282.071695188
33,صبح دیروز یک خودروی بمب‌گذاری شده در مرکز پلیس شهر قاضی عنتب ترکیه منفجر شد و منجر به کشته شدن دو افسر پلیس و زخمی شدن بیش از بیست نفر دیگر شد.,BeetleLM/beetlelm_zho-fas_late,step-15000,fas,15.608473777770996,6007226.852263147
34,دفتر فرماندار گفت که نوزده نفر از افراد مجروح از افسران پلیس بودند.,BeetleLM/beetlelm_zho-fas_late,step-15000,fas,15.646309852600098,6238871.3625494195
35,پلیس گفت این گمان وجود دارد که ستیزه‌جویان داعش (ISIL) مسئول این حمله باشند.,BeetleLM/beetlelm_zho-fas_late,step-15000,fas,12.636314392089844,307525.83903785725
36,آنها دریافتند که خورشید بر اساس همان اصول اساسی کار می‌کند که سایر ستارگان عمل می‌کنند: مشخص شد که فعالیت تمامی ستاره‌ها در سیستم فقط تحت تاثیر درخشندگی و چرخش آنها قرار دارد نه چیز دیگری.,BeetleLM/beetlelm_zho-fas_late,step-15000,fas,15.593152046203613,5915887.262174092
37,از تابندگی و دَوران برای تعیین عدد روسبی ستاره استفاده می‌شود که مرتبط با جریان پلاسما است.,BeetleLM/beetlelm_zho-fas_late,step-15000,fas,14.713177680969238,2453871.847407968
38,هر چه عدد روسبی کوچکتر باشد، ستاره از نظر وارونگی مغناطیسی فعالیت کمتری دارد.,BeetleLM/beetlelm_zho-fas_late,step-15000,fas,15.805947303771973,7318729.488820612
39,ایوازاکی در طی سفر خود، در بسیاری از موقعیت‌ها دچار دردسر شد.,BeetleLM/beetlelm_zho-fas_late,step-15000,fas,15.76384162902832,7016966.983646433
40,او مورد حمله دزدان دریایی قرار گرفت، یک سگ هار در تبت به او حمله کرد، از ازدواج در نپال فرار کرد و در هندوستان دستگیر شد.,BeetleLM/beetlelm_zho-fas_late,step-15000,fas,15.599747657775879,5955035.116764395
41,سری 802.11n استاندارد در هر دو فرکانس 2.4 گیگاهرتز و 5.0 گیگاهرتز کار می‌کند.,BeetleLM/beetlelm_zho-fas_late,step-15000,fas,11.012876510620117,60650.09681251368
42,این امر سبب می‌شود که با سری‌های قبلی 802.11a، 802.11b و 802.11g سازگاری داشته باشد، به شرط اینکه ایستگاه پایه مجهز به رادیوهای دوگانه باشد.,BeetleLM/beetlelm_zho-fas_late,step-15000,fas,11.774463653564453,129892.65448035172
43,سرعت 802.11n بسیار سریعتر از سیستم‌های قبلی است که حداکثر خروجی تئوری آنها 600Mbit/s بود.,BeetleLM/beetlelm_zho-fas_late,step-15000,fas,11.288130760192871,79868.01671526262
44,دووال، که با داشتن دو فرزند بزرگسال، ازدواج کرده است، تأثیر زیادی بر میلر که داستان به وی مربوط می‌شود نگذاشت.,BeetleLM/beetlelm_zho-fas_late,step-15000,fas,15.909894943237305,8120440.36846821
45,هنگامی‌ که از میلر خواسته شد اظهارنظر کند گفت: «مایک در زمان دادرسی زیاد صحبت می‌کرد ... من داشتم آماده می‌شدم بنابراین واقعاً نمی‌شنیدم که چه می‌گوید.»,BeetleLM/beetlelm_zho-fas_late,step-15000,fas,15.115442276000977,3669046.1293925764
46,هو گفت، «ما تلاش خواهیم کرد تا سال 2020 میزان انتشار دی اکسید کربن در هر واحد از تولید ناخالص داخلی را در حاشیه‌ای قابل توجه از سطح 2005 کاهش دهیم.»,BeetleLM/beetlelm_zho-fas_late,step-15000,fas,14.553966522216797,2092701.8122539474
47,او رقمی برای این کاهش‌ها تعیین نکرد و گفت که بر اساس بازده اقتصادی چین صورت خواهد گرفت.,BeetleLM/beetlelm_zho-fas_late,step-15000,fas,15.758770942687988,6981476.202366285
48,او کشورهای در حال توسعه را ترغیب کرد «از مسیر قدیمی یعنی ابتدا آلوده کردن محیط زیست و سپس سعی در پاکسازی آن دوری کنند.»,BeetleLM/beetlelm_zho-fas_late,step-15000,fas,14.722504615783691,2476866.0160361156
49,او افزود: «با وجود این نباید از آنها خواست تعهداتی را بپریرند که از مرحله توسعه، مسئولیت‌پذیری و توانمندی فراتر بروند.»,BeetleLM/beetlelm_zho-fas_late,step-15000,fas,14.967153549194336,3163386.057923526
50,امروز گروه تحقیقاتی عراق گزارش خود را رأس ساعت 12:00 به وقت گرینویچ ارائه داد.,BeetleLM/beetlelm_zho-fas_late,step-15000,fas,13.908101081848145,1097012.44289265
51,این هشدار می دهد که هیچ کس نمی تواند تضمین کند که هرگونه اقدام در عراق در این مرحله، جنگ فرقه ای، خشونت رو به رشد و یا خیزش به سمت هرج و مرج را متوقف خواهد کرد.,BeetleLM/beetlelm_zho-fas_late,step-15000,fas,14.782513618469238,2630050.534134703
52,این گزارش با لایحه‌ای برای مذاکره آزادانه و تشکیل مجمعی در ایالات متحده درباره سیاست مربوط به خاورمیانه آغاز می‌شود.,BeetleLM/beetlelm_zho-fas_late,step-15000,fas,15.458351135253906,5169833.987602698
53,این گزارش بسیار حیاتی، تقریباً در مورد تمام جنبه‌های سیاست کنونی اجرایی در قبال عراق است و خواستار تغییر جهت فوری است.,BeetleLM/beetlelm_zho-fas_late,step-15000,fas,15.517123222351074,5482782.153579255
54,اولین مورد از 78 توصیه او بدین ترتیب است که ابتکار عمل دیپلماتیک جدید باید پیش از پایان سال جاری اتفاق بیفتد تا مرزهای عراق در برابر مداخلات خصمانه امن شود و روابط دیپلماتیک با همسایگانش از سر گرفته شود.,BeetleLM/beetlelm_zho-fas_late,step-15000,fas,15.048095703125,3430085.3531232276
55,سناتور فعلی و بانوی اول آرژانتین، کریستینا الیزابت فرناندز د کیرشنر، عصر روز گذشته کاندیداتوری خود برای ریاست جمهوری را در لا پلاتا، شهری در 50 کیلومتری (31 مایل) بوینوس آیرس اعلام کرد.,BeetleLM/beetlelm_zho-fas_late,step-15000,fas,14.225824356079102,1507290.695888585
56,خانم کیرشنر قصد خود برای حضور در انتخابات ریاست جمهوری را در تئاتر آرژانتین اعلام کرد، همان جاییکه او از آنجا به عنوان نماینده استان بوئنوس آیرس کارزار 2005 خود را برای مجلس سنا آغاز کرده بود.,BeetleLM/beetlelm_zho-fas_late,step-15000,fas,15.23470687866211,4133796.857909061
57,این مذاکره با مشاجره پیرامون صرف هزینه برای امدادرسانی و بازسازی به دنبال طوفان کاترینا آغاز شد؛ که در آن برخی از محافظه‌کاران مالی به شوخی آن را «معامله اورلئان جدید بوش» نام نهادند.,BeetleLM/beetlelm_zho-fas_late,step-15000,fas,15.087340354919434,3567374.164315983
58,انتقاد لیبرال از تلاش برای بازسازی بر اعطای قراردادهای بازسازی به خودی‌های واشنگتن متمرکز شده است.,BeetleLM/beetlelm_zho-fas_late,step-15000,fas,15.007164001464844,3292520.7061540126
59,بیش از چهار میلیون نفر برای حضور در مراسم خاکسپاری به رم رفتند.,BeetleLM/beetlelm_zho-fas_late,step-15000,fas,15.217387199401855,4062817.268376442
60,تعداد افراد حاضر آنقدر زیاد بود که امکان دسترسی همه به مراسم خاکسپاری در میدان سنت پیتر ممکن نبود.,BeetleLM/beetlelm_zho-fas_late,step-15000,fas,15.400492668151855,4879204.089686027
61,چند نمایشگر تلویزیونی بزرگ در مکان‌های مختلف شهر رم نصب شدند تا مردم بتوانند مراسم را مشاهده کنند.,BeetleLM/beetlelm_zho-fas_late,step-15000,fas,14.261781692504883,1562475.0500619975
62,در بسیاری از شهرهای ایتالیا و سایر نقاط جهان، به‌خصوص در لهستان، مجموعه‌های مشابهی ساخته شده که تعداد زیادی از مردم از آن بازدید کرده‌اند.,BeetleLM/beetlelm_zho-fas_late,step-15000,fas,15.093308448791504,3588728.2464059577
63,مورخان از سیاست‌های گذشته FBI و تمرکز منابع روی مواردی که به آسانی قابل حل هستند، به‌خصوص موارد مربوط به سرقت خودرو، با هدف بالا بردن میزان موفقیت آژانس، انتقاد کردند.,BeetleLM/beetlelm_zho-fas_late,step-15000,fas,14.680986404418945,2376136.4931317354
64,کنگره بودجه ابتکار قباحت را در سال مالی 2005 در نظر گرفت و مشخص کرد که FBI باید 10 مامور خود را به پورنوگرافی بزرگسالان اختصاص دهد.,BeetleLM/beetlelm_zho-fas_late,step-15000,fas,14.309136390686035,1638245.468253384
65,رابین اوتاپا بالاترین امتیاز را در اینینگ‌ها بدست آورد و 70 امتیاز را تنها با 41 پرتاب کسب کرد او با ضربه به 11 چهارتایی و 2 شش‌تایی این کار را کرد.,BeetleLM/beetlelm_zho-fas_late,step-15000,fas,13.871732711791992,1057832.659209623
66,ضربه‌زن‌های میانه، Sachin Tendulkar و Rahul Dravid نمایش خوبی از خود نشان دادند و در کسب صد امتیاز همکاری داشتند.,BeetleLM/beetlelm_zho-fas_late,step-15000,fas,9.51177978515625,13518.032111992401
67,اما هندوستان پس از دست دادن چوگان کاپیتان، تنها 36 رکورد را انجام داد و 7 چوگان را از دست داد تا مراحل را تمام کند.,BeetleLM/beetlelm_zho-fas_late,step-15000,fas,15.043861389160156,3415592.001167953
68,رئیس جمهور ایالات متحده، جرج دابلیو بوش، صبح روز 16 نوامبر برای شروع سفر هفتگی خود در آسیا، وارد سنگاپور شد.,BeetleLM/beetlelm_zho-fas_late,step-15000,fas,15.233469009399414,4128682.923684438
69,وی مورد استقبال معاون نخست وزیر سنگاپور، وونگ کان سنگ، قرار گرفت و با نخست وزیر سنگاپور، لی هسین لوونگ، بحث در مورد تجارت و تروریسم را آغاز کرد.,BeetleLM/beetlelm_zho-fas_late,step-15000,fas,15.59399700164795,5920888.035742246
70,بوش پس از یک هفته باخت در انتخابات میان دوره‌ای، از گسترش تجارت در آسیا با مخاطبان صحبت کرد.,BeetleLM/beetlelm_zho-fas_late,step-15000,fas,15.931199073791504,8295295.242427229
71,استیون هارپر، نخست وزیر، پس از جلسه 25 دقیقه‌ای در روز سه‌شنبه با جک لیتون، رهبر حزب دموکراتیک جدید در دفتر نخست وزیری موفقت کرد تا قبل از قرائت دوم، «قانون هوای پاک» را برای بررسی به کمیته همه‌جانبه ارسال کند.,BeetleLM/beetlelm_zho-fas_late,step-15000,fas,14.863717079162598,2852530.5745260213
72,لیتون طی جلسه‌ای که با نخست وزیر داشت، خواستار تغییراتی در لایحه زیست‌محیطی شد و «بازنویسی تمام و کمال» لایحه زیست محیطی حزب محافظه کار را درخواست کرد.,BeetleLM/beetlelm_zho-fas_late,step-15000,fas,15.000319480895996,3270061.9279201655
73,از آن موقع دولت فدرال وارد شده تا بودجه بیمارستان Mersey در دوونپورت تاسمانی را تقبل کند، دولت ایالتی و برخی از نمایندگان پارلمان این اقدام را نقد کرده و آن را شیرین‌کاری قبل از انتخابات فدرال که در نوامبر برگزار می‌شود می‌دانند.,BeetleLM/beetlelm_zho-fas_late,step-15000,fas,14.450346946716309,1886713.4286663665
74,اما نخست وزیر جان هاوارد گفت که این اقدام فقط برای محافظت از ساختمان‌های بیمارستان در مقابل تخریب توسط دولت تاسمانی و بخشیدن 45 میلیون دلار استرالیا اضافی است.,BeetleLM/beetlelm_zho-fas_late,step-15000,fas,14.92399787902832,3029771.854264207
75,مطابق آخرین خبرنامه، قرائت سطح دریا حاکی از ایجاد یک سونامی بود. فعالیت هایی مربوط به سونامی قطعی در نزدیکی پاگو پاگو و نیوئه ثبت شده بود.,BeetleLM/beetlelm_zho-fas_late,step-15000,fas,14.54591178894043,2075913.3613440534
76,هیچ خسارت و جراحت عمده‌ای در تونگا گزارش نشده است، اما برق به‌طور موقت قطع شد، که بنابر گزارش‌ها از دریافت هشدار تسونامی صادر شده توسط PTWC توسط مقامات تونگ جلوگیری کرده است.,BeetleLM/beetlelm_zho-fas_late,step-15000,fas,14.441601753234863,1870285.6912568274
