sentence_id,sentence,repo,revision,iso_code,nll,ppl
223,"Същия месец видях, че друг голям пътнически самолет преодоля пистата в Машхад и се удари в стена, убивайки седемнадесет души.",BeetleLM/beetlelm_zho-bul_heritage,step-20000,bul,6.28895378112793,538.5895516655274
224,„Аеросмит“ отмениха оставащите си концерти от турнето.,BeetleLM/beetlelm_zho-bul_heritage,step-20000,bul,7.1786603927612305,1311.1506543513672
225,До 16 септември рок групата трябваше да обиколи САЩ и Канада.,BeetleLM/beetlelm_zho-bul_heritage,step-20000,bul,5.943336486816406,381.2046945207667
226,"След като вокалистът Стивън Тайлър беше ранен след падне от сцената по време на представление на 5 август, турнето беше отменено.",BeetleLM/beetlelm_zho-bul_heritage,step-20000,bul,5.914062023162842,370.20689430747547
227,"След прекъсване на равенството, след като и двамата държаха всеки сервис, Мъри загуби първия сет.",BeetleLM/beetlelm_zho-bul_heritage,step-20000,bul,6.461280345916748,639.87979980932
228,"Дел Потро имаше ранното предимство във втория сет, но това също изискваше тайбрек след като достигна 6-6.",BeetleLM/beetlelm_zho-bul_heritage,step-20000,bul,6.811869144439697,908.5674646290698
229,"В този момент Потро получи лечение на своето рамо, но успя да се върне към играта.",BeetleLM/beetlelm_zho-bul_heritage,step-20000,bul,6.183813095092773,484.8371663562763
230,Програмата започна в 20:30 ч. местно време (15.00 UTC).,BeetleLM/beetlelm_zho-bul_heritage,step-20000,bul,5.840057373046875,343.7990648990075
231,"Известни певци от цялата страна изпълниха бхаджани, които представляват молитвени песни в краката на Шри Шиам.",BeetleLM/beetlelm_zho-bul_heritage,step-20000,bul,6.193347454071045,489.48188496838657
232,"Вечерта започна певецът Санджу Шарма, следван от Джей Шанкар Чодри, който представи и чхапан бхог бхаджан, придружаван от певец Раджу Кханделвал.",BeetleLM/beetlelm_zho-bul_heritage,step-20000,bul,7.165604591369629,1294.1437924922627
233,Тогава Лакха Сингх пое водачеството в пеенето на бхаджаните.,BeetleLM/beetlelm_zho-bul_heritage,step-20000,bul,7.123293399810791,1240.5292720255793
234,"На Баба Шиам са сервирани 108 блюда от Чхапан Бхог (в Хиндуизма, 56 различни ядливи артикула, като сладки, плодове, ядки, ястия и т.н., предлагани на божеството).",BeetleLM/beetlelm_zho-bul_heritage,step-20000,bul,6.826381206512451,921.8487886862558
235,"Лакха Сингх представи и Чапан Бхог Бхаджан, придружаван от певеца Раджу Канделвал.",BeetleLM/beetlelm_zho-bul_heritage,step-20000,bul,7.120731353759766,1237.3550468948074
236,"На основното представяне на Токио Гейм Шоу в четвъртък, президентът на Нинтендо Сатору Ивата разкри дизайна на контролера за новата конзола на компанията „Нинтендо Революшън“.",BeetleLM/beetlelm_zho-bul_heritage,step-20000,bul,6.651407241821289,773.872585499754
237,"Подобно на дистанционното за телевизор, контролерът използва два сензора, поставени близо до телевизора на потребителя, за да предаде триъгълна форма на позицията си в триизмерното пространство.",BeetleLM/beetlelm_zho-bul_heritage,step-20000,bul,5.626082420349121,277.572572175563
238,"Това ще осигури на играчите контрол над действията и движенията във видеоигрите, движейки устройството във въздуха.",BeetleLM/beetlelm_zho-bul_heritage,step-20000,bul,5.685729503631592,294.6327022979995
239,Джанкарло Фишичела приключи състезанието много скоро след началото поради загуба на контрол над колата си.,BeetleLM/beetlelm_zho-bul_heritage,step-20000,bul,5.819813251495361,336.90913047853593
240,"Съотборникът му Фернандо Алонсо беше първи през по - голямата част от състезанието, но това приключи веднага след пит - стопа, вероятно заради лошо завита предна дясна гума.",BeetleLM/beetlelm_zho-bul_heritage,step-20000,bul,5.925294399261475,374.38863887634875
241,Михаел Шумахер прекъсна надпреварата скоро след Алонсо заради щети по окачването в многобройните битки по време на състезанието.,BeetleLM/beetlelm_zho-bul_heritage,step-20000,bul,6.629954814910889,757.4479445156899
242,"„Тя е много сладка и пее доста добре“, казва той в записки от пресконференцията.",BeetleLM/beetlelm_zho-bul_heritage,step-20000,bul,7.1889262199401855,1324.6800266551118
243,"""Трогвах се от дъното на сърцето си всеки път, когато репетирахме.",BeetleLM/beetlelm_zho-bul_heritage,step-20000,bul,5.728179931640625,307.4092530440663
244,"В рамките на около три минути след изстрелване, камерата на борда разкрива голям брой парчета изолационна пяна, които са се откъснали от резервоара за гориво.",BeetleLM/beetlelm_zho-bul_heritage,step-20000,bul,5.62679386138916,277.7701189581098
245,"Смята се обаче, че не са повредили совалката.",BeetleLM/beetlelm_zho-bul_heritage,step-20000,bul,5.23049259185791,186.88483880035216
246,"Ръководителят на совалката на НАСА – Н. Уейн Хейл младши каза, че пяната се е спуснала „след времето, за което става въпрос“.",BeetleLM/beetlelm_zho-bul_heritage,step-20000,bul,6.149428367614746,468.44952930989723
247,"След пет минути се вижда как започва да духа вятър, около минута по-късно вятърът достига 70 км/ч... тогава започва дъждът, но е толкова силен и капките са толкова едри, че удрят кожата ти като игла, след това от небето пада градушка, хората се паникьосват и крещят и се прегазват един друг.",BeetleLM/beetlelm_zho-bul_heritage,step-20000,bul,6.0586066246032715,427.77896471631277
248,"Арманд Версаче каза: „Загубих сестра си и приятелката й и по пътя ми имаше двама инвалиди в инвалидни колички, като хората просто ги прескачаха и ги бутаха“.",BeetleLM/beetlelm_zho-bul_heritage,step-20000,bul,6.454910755157471,635.8169803343757
249,"АЕЦ „Кашивазаки Карива“ в префектура Ниигата функционира нормално, съобщи също NHK.",BeetleLM/beetlelm_zho-bul_heritage,step-20000,bul,6.575929164886475,717.612094634141
250,Hokuriku Electric Power Co. не докладва щети от земетресението или че реактори 1 и 2 в ядрената централа в Шика са затворени.,BeetleLM/beetlelm_zho-bul_heritage,step-20000,bul,5.145980358123779,171.73976864567095
251,"Съобщават, че около 9400 домове в района са без вода и около 100 са без електричество.",BeetleLM/beetlelm_zho-bul_heritage,step-20000,bul,5.3416571617126465,208.85853603463812
252,"Някои пътища са повредени, в засегнатите райони железопътните услуги са прекъснати, а в префектура Ишикава остава затворено летище „Ното“.",BeetleLM/beetlelm_zho-bul_heritage,step-20000,bul,6.759822845458984,862.4893883426477
253,Пред офиса на губернатора избухна една бомба.,BeetleLM/beetlelm_zho-bul_heritage,step-20000,bul,6.4312968254089355,620.9787270626292
254,В рамките на два часа избухнаха още три бомби близо до правителствени сгради.,BeetleLM/beetlelm_zho-bul_heritage,step-20000,bul,6.236214637756348,510.9208254337055
255,"Някои доклади посочват официално 8 загинали, а официалните доклади потвърждават до 30 ранени, но крайните бройки още не са известни.",BeetleLM/beetlelm_zho-bul_heritage,step-20000,bul,5.586601257324219,266.8271998542354
256,"Циануровата киселина и меламин са открити в проби от урината на домашни любимци, починали след консумация на заразена животинска храна.",BeetleLM/beetlelm_zho-bul_heritage,step-20000,bul,6.027984619140625,414.87804896926787
257,"Изследователи от университета потвърдиха, че двете съединения реагират помежду си, образувайки кристали, които могат да блокират бъбречната функция.",BeetleLM/beetlelm_zho-bul_heritage,step-20000,bul,5.735483169555664,309.6625541379184
258,"Изследователите наблюдавали кристали, образувани в котешката урина чрез добавяне на меламин и цианурова киселина.",BeetleLM/beetlelm_zho-bul_heritage,step-20000,bul,6.509167194366455,671.267149678818
259,Съставът на тези кристали съвпада с този в урината на засегнатите домашни любимци при сравнение с инфрачервена спектроскопия (FTIR).,BeetleLM/beetlelm_zho-bul_heritage,step-20000,bul,6.631134510040283,758.3420294367281
260,"Не знам дали го осъзнавате, но повечето от стоките от Централна Америка пристигат в тази държава без мито.",BeetleLM/beetlelm_zho-bul_heritage,step-20000,bul,5.04999303817749,156.02137828947068
261,"Въпреки това, 80% от нашите стоки са били обложени с тарифи в страните от Централна Америка.",BeetleLM/beetlelm_zho-bul_heritage,step-20000,bul,4.9350152015686035,139.07525667806468
262,Това не ми се стори логично; със сигурност не беше справедливо.,BeetleLM/beetlelm_zho-bul_heritage,step-20000,bul,4.762253761291504,117.00934007255616
263,"Всичко, което казвам на хората, е да се отнасят с нас така, както ние с тях.",BeetleLM/beetlelm_zho-bul_heritage,step-20000,bul,4.802023887634277,121.75658997885655
264,"Губернаторът на Калифорния, Арнолд Шварценегер, подписа закон, който забранява продажбата или даването под наем на видеоигри с насилие на непълнолетни.",BeetleLM/beetlelm_zho-bul_heritage,step-20000,bul,6.498464584350586,664.1211478068934
265,"Законопроектът изисква видеоигрите, продавани в щата Калифорния, които съдържат насилие, да бъдат обозначени с надпис ""18"", а продажбата им на непълнолетни лица да се наказва с глоба от 1000 долара за всяко нарушение.",BeetleLM/beetlelm_zho-bul_heritage,step-20000,bul,5.842743396759033,344.7237586582752
266,"Директорът на Обществената прокуратурата, Кийър Стармер, направи изявление тази сутрин, обявявайки наказателното преследване както на Хюн, така и на Прайс.",BeetleLM/beetlelm_zho-bul_heritage,step-20000,bul,6.382389068603516,591.3387703147703
267,"Хюн подаде оставка и ще бъде заменен от депутата Ед Дейви в Кабинета. Мястото на министър по търговията, което Дейви освобождава, се очаква да заеме депутатът Норман Ламб.",BeetleLM/beetlelm_zho-bul_heritage,step-20000,bul,6.207383632659912,496.400783979763
268,На 16 февруари Хюхн и Прайс трябва да се явят в съда на магистратите в Уестминстър.,BeetleLM/beetlelm_zho-bul_heritage,step-20000,bul,6.015458583831787,409.71368391310574
269,Жертвите са Николас Алден на 25 г. и Закари Кудебак на 21 г. Кудебак е шофирал.,BeetleLM/beetlelm_zho-bul_heritage,step-20000,bul,6.566570281982422,710.9273766086214
270,"Едгар Вегила е получил рани по ръцете и челюстта, докато на Кристофер Шнайдер е била необходима операция за реконструкция на лицето.",BeetleLM/beetlelm_zho-bul_heritage,step-20000,bul,6.592740535736084,729.778114891431
271,"Оръжието на Ука не гръмна, докато бе насочено към главата на пети човек. Шнайдер има постоянна болка, слепота в едното око, липсваща част от черепа и лице, повторно изградено от титан.",BeetleLM/beetlelm_zho-bul_heritage,step-20000,bul,6.535912990570068,689.4629702500439
272,Шнайдер свидетелства чрез видеовръзка от американска база на военновъздушните сили в родината си.,BeetleLM/beetlelm_zho-bul_heritage,step-20000,bul,5.696072101593018,297.69578268404433
273,Карпанедо се състезава в две индивидуални състезания на шампионата с изключение на събитието в сряда.,BeetleLM/beetlelm_zho-bul_heritage,step-20000,bul,5.082738876342773,161.21499975658847
274,"Първият й беше слаломът, в който стигна до „незавършила“ на първия си пробег. 36 от 116 - те състезатели имаха същия резултат в онова бягане.",BeetleLM/beetlelm_zho-bul_heritage,step-20000,bul,6.018049240112305,410.77648732630087
275,"На другото състезание, Гигантския слалом, тя финишира на десето място в женска група за седящи с комбинирано време на бягане 4:41.30, 2:11.60 минути по-бавно от австрийката Клаудия Лоеш, която финишира първа, и 1:09.02 минути по-бавно от финиширалата на девето място унгарка Гьонги Дани.",BeetleLM/beetlelm_zho-bul_heritage,step-20000,bul,6.049728870391846,423.9980560322489
276,"Четири жени от групата на седящите ски не звършиха кръговете си, а 45 от общо 117 скиори в Големия слалом не успяха да се класират на състезанието.",BeetleLM/beetlelm_zho-bul_heritage,step-20000,bul,5.841993808746338,344.46545468396977
277,Полицията в Мадия Прадеш е открила откраднатия лаптоп и мобилен телефон.,BeetleLM/beetlelm_zho-bul_heritage,step-20000,bul,7.222805023193359,1370.3274751209624
278,"Заместник - главният инспектор Д. К. Ария заяви, че са арестували петимата души, изнасилили швейцарката, и са върнали мобилния телефон и лаптопа ѝ.",BeetleLM/beetlelm_zho-bul_heritage,step-20000,bul,6.818858623504639,914.9401227389008
279,"Баба Канжар, Бута Канжар, Рампро Канжар, Газа Канжар и Вишну Канжар са имената на обвиняемите.",BeetleLM/beetlelm_zho-bul_heritage,step-20000,bul,7.692018032073975,2190.7911911710953
280,"Чандра Шекхар Соланки, началник на полицията, заяви, че обвиняемите са се явили в съда с покрити лица.",BeetleLM/beetlelm_zho-bul_heritage,step-20000,bul,6.372866630554199,585.734508972002
281,"Въпреки че в къщата е имало трима души, когато колата се е ударила в нея, никой от тях не е пострадал.",BeetleLM/beetlelm_zho-bul_heritage,step-20000,bul,4.505550384521484,90.51815013010875
282,Обаче шофьорът е получил сериозни травми по главата.,BeetleLM/beetlelm_zho-bul_heritage,step-20000,bul,5.149657249450684,172.37239945611972
283,"Временно е затворен пътят, където е станала катастрофата, за да могат аварийните служби да извадят шофьора от червеното Ауди ТТ.",BeetleLM/beetlelm_zho-bul_heritage,step-20000,bul,5.776546955108643,322.64316335343204
284,Първо е приет в болница „Джеймс Паджет“ в Грейт Ярмут.,BeetleLM/beetlelm_zho-bul_heritage,step-20000,bul,6.465985298156738,642.8974972010203
285,След това той е прехвърлен в болницата Аденбрук в Кеймбридж.,BeetleLM/beetlelm_zho-bul_heritage,step-20000,bul,6.266175746917725,526.460206182375
286,"Адекоя оттогава е в Единбургския шерифски съд, обвинена в убийството на сина си.",BeetleLM/beetlelm_zho-bul_heritage,step-20000,bul,6.169654369354248,478.02085887551925
287,"Тя е в ареста, очаквайки обвинителен акт и процес, но всяко свидетелско показание може да бъде опорочено, защото образът й е бил широко разпространен.",BeetleLM/beetlelm_zho-bul_heritage,step-20000,bul,5.808409214019775,333.0888309512458
288,"Това е обичайна практика на други места в Обединеното кралство, но шотландското правосъдие работи по различен начин и съдилищата разглеждат публикуването на снимки като потенциално предубедено.",BeetleLM/beetlelm_zho-bul_heritage,step-20000,bul,6.610260963439941,742.676804923743
289,"Професор Памела Фъргюсън от Университета в Дънди отбелязва, че „изглежда, журналистите се движат по опасна линия, ако разпространят снимки и т.н. на заподозрени.“",BeetleLM/beetlelm_zho-bul_heritage,step-20000,bul,6.069786548614502,432.58833513960377
290,"Кралската прокуратура, която отговаря за наказателното преследване, посочи на журналистите, че до повдигането на обвинение няма да се правят повече коментари.",BeetleLM/beetlelm_zho-bul_heritage,step-20000,bul,5.694525241851807,297.23564503863213
291,"Според изтеклата информация, документът ще се отнася до спора за границите, които Палестина иска въз основа на границите преди войната за Близкия изток от 1967 г.",BeetleLM/beetlelm_zho-bul_heritage,step-20000,bul,5.618095397949219,275.36442382775743
292,"Предполага се, че другите отразени теми са за бъдещата държава Йерусалим, свещена и за двете страни, както и въпроса за долината Йордан.",BeetleLM/beetlelm_zho-bul_heritage,step-20000,bul,5.978019714355469,394.6580581253132
293,"След подписване на споразумението, Израел изисква постоянно военно присъствие в долината в продължение на десет години, докато Пенсилвания се съгласи да реализира такова присъствие само за пет години.",BeetleLM/beetlelm_zho-bul_heritage,step-20000,bul,5.776033878326416,322.47766509765813
294,"Стрелците в допълнителния тест за контрол на вредителите е трябвало да бъдат надзиравани отблизо от рейнджъри, тъй като тестъ е бил наблюдаван и ефикасността му оценявана.",BeetleLM/beetlelm_zho-bul_heritage,step-20000,bul,5.790943145751953,327.32159080943194
295,В рамките на ловната програма на Асоциацията на спортните стрелци на Австралия бяха наети квалифицирани доброволци в партньорство с NPWS и Асоциацията на спортните стрелци (NSW) Inc.,BeetleLM/beetlelm_zho-bul_heritage,step-20000,bul,5.912935256958008,369.78999260965344
296,"Според Мик О'Флин, изпълняващ длъжността директор на „Опазване и наследство“ в Националната служба за парковете и дивата природа NPWS, четиримата стрелци, избрани за първата стрелба, са получили подробни инструкции за безопасност и обучение.",BeetleLM/beetlelm_zho-bul_heritage,step-20000,bul,6.26191520690918,524.2219728381216
297,Мартели се закле пред състоящия се от девет члена нов временен избирателен съвет вчера.,BeetleLM/beetlelm_zho-bul_heritage,step-20000,bul,7.646113395690918,2092.4970565394196
298,Това е петият временен избирателен съвет на Мартели за четири години.,BeetleLM/beetlelm_zho-bul_heritage,step-20000,bul,7.5398945808410645,1881.6316546803862
299,Миналия месец комисия към президента препоръча оставката на предишната избирателна комисия (CEP) като част от пакет с мерки за отиване на страната към нови избори.,BeetleLM/beetlelm_zho-bul_heritage,step-20000,bul,6.7423200607299805,847.5247655622218
300,"Отговорът на Мартели на широко разпространените протести срещу режима, които започнаха през октомври, беше комисията.",BeetleLM/beetlelm_zho-bul_heritage,step-20000,bul,5.935413837432861,378.19647564947763
301,"Насилствените протести понякога бяха предизвиквани от неуспеха да се проведат избори, някои от които се очакват от 2011 година насам.",BeetleLM/beetlelm_zho-bul_heritage,step-20000,bul,5.737780570983887,310.374791165976
302,"Съобщено е за около 60 случая на неправилно функциониращи iPod устройства. Съобщава се за прегряване, причинило общо шест пожара и нанесло леки изгаряния на четирима души.",BeetleLM/beetlelm_zho-bul_heritage,step-20000,bul,6.2415900230407715,513.6746164332126
303,"Японското министерство на икономиката, търговията и промишлеността (МЕТИ) заяви, че е било наясно с 27 инцидента, свързани с тези устройства.",BeetleLM/beetlelm_zho-bul_heritage,step-20000,bul,5.593789100646973,268.75202133147206
