sentence_id,sentence,repo,revision,iso_code,nll,ppl
202,Le Mexicain Arly Velasquez a terminé quinzième au Super-G masculin assis. Le Néo-Zélandais Adam Hall a terminé à la neuvième place du Super-G masculin debout.,BeetleLM/beetlelm_zho-fra_balanced,step-8000,fra,5.581079959869385,265.35802711692276
203,Le skieur polonais malvoyant Maciej Krezel et sa guide Anna Ogarzynska ont terminé à la treizième place du Super-G. Le sud coréen Jong Seork Park a terminé à la vingt-quatrième place du Super-G assis masculin.,BeetleLM/beetlelm_zho-fra_balanced,step-8000,fra,6.045724391937256,422.30356000288964
204,"Les soldats de la paix de l'ONU, qui sont arrivés en Haïti après le tremblement de terre de 2010, sont accusés de la propagation de la maladie qui a commencé près du campement de la troupe.",BeetleLM/beetlelm_zho-fra_balanced,step-8000,fra,4.30570650100708,74.1215639181039
205,"Selon le procès, les déchets du camp de l'ONU n'ont pas été bien assainis, provoquant l'entrée de bactéries dans l'affluent du fleuve Artibonite, l'un des plus grands fleuves d'Haïti.",BeetleLM/beetlelm_zho-fra_balanced,step-8000,fra,4.283802032470703,72.51562330235116
206,"Avant l'arrivée des troupes, Haïti n'avait pas rencontré de problèmes liés à la maladie depuis les années 1800.",BeetleLM/beetlelm_zho-fra_balanced,step-8000,fra,3.9344136714935303,51.13216092225751
207,L'Institut haïtien pour la justice et la démocratie a fait référence à des études indépendantes qui suggèrent que le bataillon népalais de maintien de la paix de l'ONU a involontairement apporté la maladie à Haïti.,BeetleLM/beetlelm_zho-fra_balanced,step-8000,fra,4.7301130294799805,113.30836881089648
208,"Danielle Lantagne, experte de l'ONU sur la maladie, a déclaré que l'épidémie avait probablement été causée par les Casques bleus.",BeetleLM/beetlelm_zho-fra_balanced,step-8000,fra,5.099897861480713,164.00515520069135
209,Hamilton a confirmé que l’hôpital universitaire d’Howard a admis le patient dans un état stable.,BeetleLM/beetlelm_zho-fra_balanced,step-8000,fra,5.5570197105407715,259.04964180662495
210,"Le patient s'était rendu au Nigeria, où certains cas de virus Ebola se sont produits.",BeetleLM/beetlelm_zho-fra_balanced,step-8000,fra,5.449663162231445,232.67977736929618
211,"L'hôpital a respecté le protocole pour la prévention des infections, notamment l'isolement du patient afin d'éviter une possible infection d'autres patients.",BeetleLM/beetlelm_zho-fra_balanced,step-8000,fra,4.887059211730957,132.56316008415868
212,"Avant les Simpsons, Simon avait travaillé sur plusieurs séries, occupant divers postes.",BeetleLM/beetlelm_zho-fra_balanced,step-8000,fra,5.8128342628479,334.5660312235473
213,"Pendant les années 1980, il a travaillé sur des spectacles tels que Taxi, Cheers et The Tracy Ullman Show.",BeetleLM/beetlelm_zho-fra_balanced,step-8000,fra,4.177516937255859,65.20374704234312
214,"En 1989, il a participé à la création des Simpsons avec Brooks et Groening et a été responsable de l'embauche de la première équipe de scénaristes de la série.",BeetleLM/beetlelm_zho-fra_balanced,step-8000,fra,4.132610321044922,62.340439293183046
215,"Malgré son départ de l'émission en 1993, il a conservé le titre de producteur exécutif et a continué à recevoir des dizaines de millions de dollars chaque saison en redevances.",BeetleLM/beetlelm_zho-fra_balanced,step-8000,fra,4.529524803161621,92.71449297849396
216,L’agence de presse chinoise Xinhua a annoncé précédemment la nouvelle du détournement d'un avion.,BeetleLM/beetlelm_zho-fra_balanced,step-8000,fra,5.481089115142822,240.10807035656842
217,Des rapports ultérieurs ont ensuite révélé que l’appareil avait fait l'objet d'une menace d’attaque à la bombe et été redirigé vers l’Afghanistan pour atterrir à Kandahar.,BeetleLM/beetlelm_zho-fra_balanced,step-8000,fra,5.276951313018799,195.77211672177836
218,Les premiers rapports indiquent que l’avion a été détourné vers l’Afghanistan après s’être vu refuser un atterrissage d’urgence à Ürümqi.,BeetleLM/beetlelm_zho-fra_balanced,step-8000,fra,5.654356002807617,285.5325413490421
219,"Les accidents aériens sont fréquents en Iran, qui dispose d'une flotte vieillissante et mal entretenue autant pour les vols civils que militaires.",BeetleLM/beetlelm_zho-fra_balanced,step-8000,fra,5.001865863800049,148.69033635067888
220,"En raison des sanctions internationales, il n'est pas possible d'acheter de nouveaux avions.",BeetleLM/beetlelm_zho-fra_balanced,step-8000,fra,4.58402681350708,97.90785815808252
221,"Au début de cette semaine, l'accident d'un hélicoptère de la police a tué trois personnes et en a blessé trois autres.",BeetleLM/beetlelm_zho-fra_balanced,step-8000,fra,4.118045806884766,61.43906108388049
222,"Le mois dernier, l'Iran a connu sa pire catastrophe aérienne depuis des années lorsqu'un avion de ligne se dirigeant vers l'Arménie s'est écrasé, tuant les 168 personnes à bord.",BeetleLM/beetlelm_zho-fra_balanced,step-8000,fra,4.7599897384643555,116.74472791265654
223,"Le même mois, un autre avion de ligne a fait une sortie de piste à Mashhad et a heurté un mur, tuant ainsi dix-sept personnes.",BeetleLM/beetlelm_zho-fra_balanced,step-8000,fra,5.685222625732422,294.4833973357214
224,Le groupe Aerosmith a annulé les derniers concerts de sa tournée.,BeetleLM/beetlelm_zho-fra_balanced,step-8000,fra,6.027597904205322,414.7176404495864
225,Le groupe de rock devait faire une tournée aux États-Unis et au Canada jusqu'au 16 septembre.,BeetleLM/beetlelm_zho-fra_balanced,step-8000,fra,3.73726487159729,41.9830040789381
226,Ils ont annulé la tournée après que le chanteur Steven Tyler se soit blessé en tombant de scène lors d'un concert le 5 août dernier.,BeetleLM/beetlelm_zho-fra_balanced,step-8000,fra,5.306803226470947,201.7043933785716
227,Murray a perdu le premier set au tie break après que les deux hommes ont gardé leur service pendant tout le set.,BeetleLM/beetlelm_zho-fra_balanced,step-8000,fra,6.074817180633545,434.77001087230224
228,"Malgré le net avantage de Del Potro pendant le deuxième set, il a fallu passer par un tie-break une fois que le score a atteint 6-6.",BeetleLM/beetlelm_zho-fra_balanced,step-8000,fra,5.7533674240112305,315.25045684997605
229,"Potro a reçu à ce moment des soins pour son épaule, mais a réussi à reprendre le match.",BeetleLM/beetlelm_zho-fra_balanced,step-8000,fra,5.185279369354248,178.6233447084104
230,"Le programme a démarré à 20 h 30, heure locale (15 h 00 UTC).",BeetleLM/beetlelm_zho-fra_balanced,step-8000,fra,5.048531532287598,155.7935186757942
231,"Des chanteurs célèbres dans tout le pays ont présenté des bhajans, ou chants de dévotion, aux pieds de Shri Shyam.",BeetleLM/beetlelm_zho-fra_balanced,step-8000,fra,4.976815700531006,145.01188441301792
232,"La chanteuse Sanju Sharma a commencé la soirée, suivie par Jai Shankar Choudhary. Lakkha Singh a également présenté le bhajan de Chhappan Bhog. Le chanteur Raju Khandelwal l’accompagnait.",BeetleLM/beetlelm_zho-fra_balanced,step-8000,fra,5.512664318084717,247.81049427707032
233,"Ensuite, Lakkha Singh a pris l'initiative de chanter les bhajans.",BeetleLM/beetlelm_zho-fra_balanced,step-8000,fra,5.463318347930908,235.87885522963282
234,"108 assiettes de Chhappan Bhog (dans l'hindouisme, 56 aliments comestibles différents, comme des sucreries, des fruits, des noix, des plats etc. qui sont offerts à la divinité) ont été servis à Baba Shyam.",BeetleLM/beetlelm_zho-fra_balanced,step-8000,fra,5.129068374633789,168.8597307347813
235,"Quant à Lakkha Singh, il a lui aussi présenté le chhappan bhog bhajan, tout en étant accompagné du chanteur Raju Khandelwal.",BeetleLM/beetlelm_zho-fra_balanced,step-8000,fra,5.70041561126709,298.99163944193464
236,"Jeudi, lors de la présentation principale du Tokyo Game Show, le président de Nintendo, Satoru Iwata, a dévoilé le design de la manette de la nouvelle console Nintendo Revolution de la société.",BeetleLM/beetlelm_zho-fra_balanced,step-8000,fra,4.564208984375,95.98663704921806
237,"Identique à une télécommande de télévision, la commande utilise deux capteurs placés près du téléviseur de l'utilisateur pour trianguler sa position dans l'espace tridimensionnel.",BeetleLM/beetlelm_zho-fra_balanced,step-8000,fra,5.679733753204346,292.8714434578287
238,Cela permettra aux joueurs de contrôler les actions et les mouvements dans les jeux vidéo en déplaçant l’appareil dans l’air.,BeetleLM/beetlelm_zho-fra_balanced,step-8000,fra,5.309511184692383,202.25134066989582
239,Giancarlo Fisichella a perdu le contrôle de sa voiture et a terminé la course peu après le démarrage.,BeetleLM/beetlelm_zho-fra_balanced,step-8000,fra,5.999509334564209,403.23089348328296
240,"Son coéquipier Fernando Alonso a dominé pendant toute la course, mais son arrêt au stand a mis fin à cette domination, sans doute en raison d'une roue avant droite mal fixée.",BeetleLM/beetlelm_zho-fra_balanced,step-8000,fra,5.403418064117432,222.16449236919226
241,"Michael Schumacher a terminé sa course peu de temps après Alonso, en raison des dommages subis au niveau des suspensions tout au long de la course.",BeetleLM/beetlelm_zho-fra_balanced,step-8000,fra,5.545531272888184,256.0905960993987
242,"« Elle est très jolie, et elle chante très bien aussi », a-t-il déclaré selon une transcription de la conférence de presse.",BeetleLM/beetlelm_zho-fra_balanced,step-8000,fra,4.606518745422363,100.13494691494348
243,"« J’ai été ému à chaque fois que nous avons fait une répétition sur ce sujet, du fond du cœur. »",BeetleLM/beetlelm_zho-fra_balanced,step-8000,fra,4.315053939819336,74.8176589861126
244,"Environ trois minutes après le lancement, une caméra embarquée montrait de nombreux morceaux de mousse isolante en train de se détacher du réservoir de carburant.",BeetleLM/beetlelm_zho-fra_balanced,step-8000,fra,5.772418022155762,321.3137378073928
245,On ne pense cependant pas qu'ils aient causé le moindre dégât à la navette.,BeetleLM/beetlelm_zho-fra_balanced,step-8000,fra,4.588656902313232,98.36223131848966
246,"Le chef du programme de la navette de la NASA, N. Wayne Hale Jr., a dit que la mousse était tombée « après le temps qui nous préoccupe ».",BeetleLM/beetlelm_zho-fra_balanced,step-8000,fra,5.218667507171631,184.6879247025468
247,"Cinq minutes après le début de l'exposition, un vent se met à souffler pour atteindre, environ une minute plus tard, la vitesse de 70km/h... puis la pluie arrive, mais si forte et si grosse qu'elle frappe votre peau comme une aiguille, puis la grêle tombe du ciel, les gens paniquent, crient et se roulent dessus.",BeetleLM/beetlelm_zho-fra_balanced,step-8000,fra,5.082330226898193,161.14913279564507
248,"J'ai perdu ma sœur et son amie, et sur mon chemin, il y avait deux personnes handicapées en fauteuil roulant, des gens qui ne faisaient que sauter et les pousser », a déclaré Armand Versace.",BeetleLM/beetlelm_zho-fra_balanced,step-8000,fra,5.262540340423584,192.97108140986631
249,"La NHK a également fait savoir que la centrale nucléaire de Kashiwazaki Kariwa, dans la préfecture de Niigata, fonctionnait normalement.",BeetleLM/beetlelm_zho-fra_balanced,step-8000,fra,4.651278018951416,104.71873261813742
250,Hokuriku Electric Power Co. n'a signalé aucun effet du tremblement de terre et que les réacteurs numéro 1 et 2 de sa centrale nucléaire de Shika ont été arrêtés.,BeetleLM/beetlelm_zho-fra_balanced,step-8000,fra,5.104116916656494,164.69856373544906
251,"On signale qu'environ 9 400 habitations de la région sont privées d'eau, et qu'environ 100 sont privées d'électricité.",BeetleLM/beetlelm_zho-fra_balanced,step-8000,fra,4.146946907043457,63.240625744062
252,"Certaines routes ont été endommagées, le service ferroviaire a été suspendu dans les zones affectées, et l’aéroport de Noto de la préfecture d’Ishikawa est toujours fermé.",BeetleLM/beetlelm_zho-fra_balanced,step-8000,fra,4.8419904708862305,126.72133599320749
253,Une bombe a explosé devant le bureau du gouverneur général.,BeetleLM/beetlelm_zho-fra_balanced,step-8000,fra,5.190711975097656,179.59637557020045
254,Trois autres bombes ont explosé près des bâtiments du gouvernement en l'espace de deux heures.,BeetleLM/beetlelm_zho-fra_balanced,step-8000,fra,4.628032684326172,102.31258483703002
255,"Certains rapports portent le nombre officiel de morts à huit, et des rapports officiels confirment que jusqu'à 30 personnes ont été blessées ; mais les chiffres définitifs ne sont pas encore connus.",BeetleLM/beetlelm_zho-fra_balanced,step-8000,fra,5.045912265777588,155.38598787872502
256,De l'acide cyanurique et de la mélamine ont été découverts dans les échantillons d'urine prélevés sur les animaux domestiques qui sont morts après avoir ingéré de la nourriture pour animaux contaminée.,BeetleLM/beetlelm_zho-fra_balanced,step-8000,fra,5.021068096160889,151.57311202434215
257,"Les deux composés réagissent l'un avec l'autre pour former des cristaux qui peuvent bloquer la fonction rénale, ont déclaré des chercheurs de l'université.",BeetleLM/beetlelm_zho-fra_balanced,step-8000,fra,5.018348693847656,151.1614836980617
258,"Les enquêteurs ont découvert que des cristaux s'étaient formés dans l'urine des chats en raison de la présence de ces substances supplémentaires, la mélamine et l'acide cyanurique.",BeetleLM/beetlelm_zho-fra_balanced,step-8000,fra,4.9523797035217285,141.51131853369728
259,La composition de ces cristaux correspond à ce qui est trouvé dans l’urine des animaux domestiques affectés lorsqu’on compare par spectroscopie infrarouge (IRTF).,BeetleLM/beetlelm_zho-fra_balanced,step-8000,fra,5.901744365692139,365.6747823938152
260,"Je ne sais pas si vous vous en rendez compte, mais la plupart des marchandises en provenance d'Amérique centrale sont entrées dans notre pays exonérées de taxes.",BeetleLM/beetlelm_zho-fra_balanced,step-8000,fra,4.659300327301025,105.56219732456194
261,"Pourtant, 80 % de nos marchandises étaient taxées par des droits de douane dans les pays d’Amérique centrale. Nous vous soignons.",BeetleLM/beetlelm_zho-fra_balanced,step-8000,fra,4.742561340332031,114.72768230772247
262,Cela ne me semblait pas logique ; ce n'était certainement pas juste.,BeetleLM/beetlelm_zho-fra_balanced,step-8000,fra,4.921815395355225,137.25155298781246
263,"Tout ce que je dis aux gens, c’est que vous nous traitez comme nous vous traitons.",BeetleLM/beetlelm_zho-fra_balanced,step-8000,fra,4.8698201179504395,130.29747661113336
264,"Le gouverneur de Californie, Arnold Schwarzenegger, a promulgué une loi qui interdit la vente ou la location de jeux vidéo violents aux mineurs.",BeetleLM/beetlelm_zho-fra_balanced,step-8000,fra,5.028936386108398,152.7704374927757
265,Le projet de loi exige que les jeux vidéo violents vendus dans l'État de Californie soient étiquetés avec un autocollant portant la mention « 18 » et rend leur vente à un mineur passible d'une amende de 1000 dollars par infraction.,BeetleLM/beetlelm_zho-fra_balanced,step-8000,fra,4.81354284286499,123.16720751052735
266,"Le directeur des poursuites publiques, Kier Starmer QC, a fait une déclaration ce matin annonçant la poursuite de Huhne et Pryce.",BeetleLM/beetlelm_zho-fra_balanced,step-8000,fra,5.659359931945801,286.9649066911491
267,Huhne a démissionné et il sera remplacé au sein du cabinet par le député Ed Davey. Le député Norman Lamb devrait prendre le poste de ministre des Affaires auquel Davey se désiste.,BeetleLM/beetlelm_zho-fra_balanced,step-8000,fra,5.041903018951416,154.76425427454538
268,Huhne et Pryce doivent comparaître devant la Magistrates Court de Westminster le 16 février.,BeetleLM/beetlelm_zho-fra_balanced,step-8000,fra,5.877285480499268,356.83927863214205
269,"Les victimes sont Nicholas Alden, 25 ans, et Zachary Cuddeback, 21 ans. Cuddeback était le conducteur.",BeetleLM/beetlelm_zho-fra_balanced,step-8000,fra,5.200545310974121,181.37111857477373
270,Edgar Veguilla a été blessé au bras et à la mâchoire tandis que Kristoffer Schneider a dû subir une chirurgie reconstructive pour son visage.,BeetleLM/beetlelm_zho-fra_balanced,step-8000,fra,5.441854000091553,230.86981958609022
271,"L'arme d'Uka s'est enrayée alors qu'elle était pointée sur la tête d'un cinquième homme. Schneider souffre d'une douleur lancinante, ne voit plus d'un œil, a perdu une partie de son crâne, et son visage a été reconstruit à partir de titane.",BeetleLM/beetlelm_zho-fra_balanced,step-8000,fra,4.291104793548584,73.04712592999451
272,Schneider a témoigné par liaison vidéo depuis une base de l’USAF dans son pays.,BeetleLM/beetlelm_zho-fra_balanced,step-8000,fra,5.315837383270264,203.53487849050381
273,"À part l'événement de mercredi, Carpanedo a participé à deux courses individuelles lors des Championnats.",BeetleLM/beetlelm_zho-fra_balanced,step-8000,fra,5.312846660614014,202.92707146223037
274,"Elle a d'abord participé au slalom, où elle a obtenu un « did not finish » (DNF) lors de sa première course. 36 des 116 concurrents ont obtenu le même résultat dans cette course.",BeetleLM/beetlelm_zho-fra_balanced,step-8000,fra,5.219349384307861,184.81390212141898
275,"Son autre course, le slalom géant, lui a permis de terminer à la dixième place du groupe des femmes assises avec un temps combiné de 4:41.30, soit 2:11.60 minutes de moins que l'Autrichienne Claudia Loesch, arrivée première, et 1:09.02 minutes de moins que la Hongroise Gyöngyi Dani, arrivée neuvième.",BeetleLM/beetlelm_zho-fra_balanced,step-8000,fra,5.226024627685547,186.05170662455424
276,"Dans la catégorie des femmes en ski assis, quatre skieuses ne sont pas parvenues à terminer leur parcours ; en ce qui concerne le slalom géant, 45 skieuses sur un total de 117 dans cette course n'ont pas réussi à se classer.",BeetleLM/beetlelm_zho-fra_balanced,step-8000,fra,5.272848129272461,194.97047352384234
277,La police du Madhya Pradesh a retrouvé l'ordinateur portable et le téléphone mobile volés.,BeetleLM/beetlelm_zho-fra_balanced,step-8000,fra,5.76458740234375,318.8074776780433
278,"L'inspecteur général adjoint D.K. Arya a déclaré : « Nous avons arrêté cinq personnes pour avoir violé la ressortissante suisse, et nous avons récupéré son téléphone et son ordinateur portables. »",BeetleLM/beetlelm_zho-fra_balanced,step-8000,fra,5.629149913787842,278.425331467576
279,"Les accusés s'appellent Baba Kanjar, Bhutha Kanjar, Rampro Kanjar, Gaza Kanjar et Vishnu Kanjar.",BeetleLM/beetlelm_zho-fra_balanced,step-8000,fra,4.447764873504639,85.43577067881307
280,"Chandra Shekhar Solanki, commissaire de police, a déclaré que les personnes accusées avaient le visage dissimulé lorsqu'elles ont comparu devant le tribunal.",BeetleLM/beetlelm_zho-fra_balanced,step-8000,fra,5.428543567657471,227.81720334115292
281,"Bien que trois personnes aient été présentes dans la maison quand la voiture l'a percutée, aucune n'a été blessée.",BeetleLM/beetlelm_zho-fra_balanced,step-8000,fra,5.145234107971191,171.61165562523965
282,"Cependant, le conducteur a été grièvement blessé à la tête.",BeetleLM/beetlelm_zho-fra_balanced,step-8000,fra,4.726656436920166,112.91738407305937
283,La voie où l'accident a eu lieu a été temporairement barrée pour permettre aux services de secours d'extraire le conducteur de l'Audi TT rouge.,BeetleLM/beetlelm_zho-fra_balanced,step-8000,fra,5.127707481384277,168.6300869628817
284,Il a d'abord été hospitalisé à l'hôpital James Paget de Great Yarmouth.,BeetleLM/beetlelm_zho-fra_balanced,step-8000,fra,4.570934295654297,96.63435266526001
285,Il a ensuite été transféré au centre hospitalier Addenbrooke's Hospital de Cambridge.,BeetleLM/beetlelm_zho-fra_balanced,step-8000,fra,5.670839309692383,290.27806537223546
286,Adekoya a depuis été inculpée pour le meurtre de son fils par le tribunal Sheriff Court d'Édimbourg.,BeetleLM/beetlelm_zho-fra_balanced,step-8000,fra,4.923896789550781,137.53752508061874
287,"Elle se trouve en garde en vue en attendant sa mise en examen et son procès, mais les témoignages oculaires pourraient être compromis car son portrait a été très diffusé.",BeetleLM/beetlelm_zho-fra_balanced,step-8000,fra,5.324660301208496,205.33859534320308
288,"Il s'agit d'une pratique courante ailleurs au Royaume-Uni, mais la justice écossaise fonctionne différemment et les tribunaux ont considéré que la publication de photos était potentiellement préjudiciable.",BeetleLM/beetlelm_zho-fra_balanced,step-8000,fra,4.840027809143066,126.47286878331346
289,"La professeur Pamela Ferguson, de l’université de Dundee, note que « les journalistes semblent suivre une ligne dangereuse s’ils publient des photos, etc. de suspects ».",BeetleLM/beetlelm_zho-fra_balanced,step-8000,fra,5.766696929931641,319.4807207101388
290,"Le bureau du Procureur de la Couronne, qui est en charge de l’ensemble des poursuites, a précisé aux journalistes qu’aucun autre commentaire ne sera fait au moins jusqu’à la mise en accusation.",BeetleLM/beetlelm_zho-fra_balanced,step-8000,fra,5.3960981369018555,220.54420189410789
291,"D'après la fuite, le document portera sur le différend à la frontière que la Palestine revendique sur la base des frontières existantes avant la guerre du Moyen-Orient de 1967.",BeetleLM/beetlelm_zho-fra_balanced,step-8000,fra,4.276205539703369,71.9668459251132
292,"Parmi les autres sujets abordés figurent le futur État de Jérusalem, qui est sacré pour les deux nations, et la question de la vallée du Jourdain.",BeetleLM/beetlelm_zho-fra_balanced,step-8000,fra,4.564629077911377,96.02696888599984
293,"Israël exige une présence militaire permanente dans la vallée pour une durée de dix années à compter de la signature d'un accord, tandis que l'Autorité palestinienne ne consent qu'à une durée de cinq ans.",BeetleLM/beetlelm_zho-fra_balanced,step-8000,fra,5.034019947052002,153.54903266340898
294,"Les tireurs de l’essai supplémentaire de lutte contre les parasites devaient être étroitement surveillés par des rangers, car l’essai était contrôlé et son efficacité évaluée.",BeetleLM/beetlelm_zho-fra_balanced,step-8000,fra,5.809716701507568,333.52462526576153
295,"Dans le cadre d’un partenariat entre NPWS et le Sporting Shooters Association of Australia (NSW) inc., des bénévoles qualifiés ont été recrutés, dans le cadre du programme de chasse de la Sporting Shooters Association.",BeetleLM/beetlelm_zho-fra_balanced,step-8000,fra,5.3182902336120605,204.034731868929
296,"Selon Mick O'Flynn, responsable par intérim de la conservation du parc et du patrimoine au NPWS, les quatre tireurs désignés pour la première campagne d'abattage ont été dûment entraînés et formés aux consignes de sécurité.",BeetleLM/beetlelm_zho-fra_balanced,step-8000,fra,5.185199737548828,178.60912117531146
297,Martelly a intronisé hier un nouveau Conseil électoral provisoire (CEP) composé de neuf membres.,BeetleLM/beetlelm_zho-fra_balanced,step-8000,fra,5.978419303894043,394.8157908687324
298,C’est le cinquième PEC de Martelly en quatre ans.,BeetleLM/beetlelm_zho-fra_balanced,step-8000,fra,5.837141990661621,342.7982187945728
299,"Le mois dernier, une commission présidentielle a recommandé la dissolution du précédent CEP dans le cadre d’un ensemble de mesures visant à engager le pays sur la voie de nouvelles élections.",BeetleLM/beetlelm_zho-fra_balanced,step-8000,fra,5.577714443206787,264.4664613863093
300,Cette commission a été la réponse de Martelly aux vastes protestations contre le régime qui ont commencé en octobre.,BeetleLM/beetlelm_zho-fra_balanced,step-8000,fra,5.379296779632568,216.8697145889129
301,"Ces protestations parfois violentes ont été déclenchées par l’absence d’élections, dont certaines devaient avoir lieu en 2011.",BeetleLM/beetlelm_zho-fra_balanced,step-8000,fra,4.973081111907959,144.47133467299776
302,"Environ 60 cas de surchauffe d’iPods défectueux ont été signalés, provoquant au total six incendies et laissant quatre personnes avec des brûlures mineures.",BeetleLM/beetlelm_zho-fra_balanced,step-8000,fra,5.780573844909668,323.94503129744373
303,"Le ministère japonais de l'économie, du commerce et de l'industrie (METI) a déclaré qu'il avait eu connaissance de 27 accidents liés à ces appareils.",BeetleLM/beetlelm_zho-fra_balanced,step-8000,fra,4.35604190826416,77.94799770538802
304,"La semaine dernière, le METI a annoncé qu’Apple l’avait informé de 34 incidents de surchauffe supplémentaires, que la société a qualifiés de « non graves ».",BeetleLM/beetlelm_zho-fra_balanced,step-8000,fra,5.357778549194336,212.25291293959967
305,Le ministère a réagi en qualifiant de « vraiment regrettable » l'ajournement du rapport par Apple.,BeetleLM/beetlelm_zho-fra_balanced,step-8000,fra,5.702216625213623,299.53061275800917
306,Le tremblement de terre a frappé les Mariannes à 7 h 19 heure locale (21 h 19 GMT vendredi).,BeetleLM/beetlelm_zho-fra_balanced,step-8000,fra,5.588733196258545,267.39666596813885
307,Le Bureau de gestion des urgences des îles Mariannes du Nord a déclaré qu'aucun dégât n'avait été signalé dans ce pays.,BeetleLM/beetlelm_zho-fra_balanced,step-8000,fra,4.702798843383789,110.25532840727332
308,"De plus, le Centre d'alerte des tsunamis dans le Pacifique a déclaré qu'il n'y avait aucun signe de tsunami.",BeetleLM/beetlelm_zho-fra_balanced,step-8000,fra,4.456296443939209,86.16779017176076
309,"Un ancien policier philippin a pris en otage des touristes de Hong Kong en détournant leur bus à Manille, la capitale des Philippines.",BeetleLM/beetlelm_zho-fra_balanced,step-8000,fra,5.281630516052246,196.69032076043413
