sentence_id,sentence,repo,revision,iso_code,nll,ppl
754,De officiële munt van de Falklandeilanden is het Falklandeilands pond (FKP). De waarde ligt ongeveer op één Brits pond (GBP).,BeetleLM/beetlelm_eng-nld_balanced,step-18341,nld,6.74894380569458,853.1571867281018
755,"Op de eilanden is er maar één bank, namelijk in Stanley tegenover de winkel FIC West. Hier kunt u geld inwisselen.",BeetleLM/beetlelm_eng-nld_balanced,step-18341,nld,5.993907451629639,400.97835633767176
756,In het algemeen worden Britse ponden overal op de eilanden aanvaard en in Stanley kun je ook vaak betalen met creditcards en Amerikaanse dollars.,BeetleLM/beetlelm_eng-nld_balanced,step-18341,nld,6.757348537445068,860.3579619273023
757,"Op de afgelegen eilanden kan je waarschijnlijk niet met een creditcard betalen, maar waarschijnlijk wel met de Britse en Amerikaanse valuta. Vraag de eigenaren van tevoren op welke manier je kunt betalen.",BeetleLM/beetlelm_eng-nld_balanced,step-18341,nld,5.831130504608154,340.7436737049649
758,"Wissel uw geld weer in vóór u van de eilanden vertrekt, want Falklandse valuta zijn erbuiten heel moeilijk in te wisselen.",BeetleLM/beetlelm_eng-nld_balanced,step-18341,nld,6.473950386047363,648.0386800768069
759,"Montevideo ligt beneden de evenaar, dus als het daar zomer is, is het winter op het noordelijk halfrond en andersom.",BeetleLM/beetlelm_eng-nld_balanced,step-18341,nld,4.324199676513672,75.50506019909734
760,Montevideo bevindt zich in de subtropen. In de zomermaanden komen gerust temperaturen hoger dan +30°C voor.,BeetleLM/beetlelm_eng-nld_balanced,step-18341,nld,5.616549968719482,274.93919626253154
761,"De winter kan bedrieglijk koud zijn: de temperatuur gaat bijna nooit onder nul, maar de wind in combinatie met de luchtvochtigheid zorgt ervoor dat het kouder aanvoelt dan dat de thermometer aangeeft.",BeetleLM/beetlelm_eng-nld_balanced,step-18341,nld,5.082594394683838,161.1917088285748
762,"Het regenniveau blijft gedurende het hele jaar ongeveer gelijk, zonder herkenbare 'natte' en 'droge' perioden.",BeetleLM/beetlelm_eng-nld_balanced,step-18341,nld,6.342883586883545,568.4330765338481
763,"Veel van de dieren in het park zijn eraan gewend mensen te zien, maar wilde dieren zijn uiteindelijk wel gewoon wild. Daarom moeten ze niet worden gevoerd of gestoord.",BeetleLM/beetlelm_eng-nld_balanced,step-18341,nld,4.99932861328125,148.31354992055
764,"Houd in het park minstens 100 meter afstand van beren en wolven, en 25 meter van alle andere wilde dieren.",BeetleLM/beetlelm_eng-nld_balanced,step-18341,nld,5.192134857177734,179.85210192572546
765,"Elanden, bizons, rendieren, beren en ongeveer alle andere grote dieren kunnen u aanvallen, hoe tam ze ook lijken.",BeetleLM/beetlelm_eng-nld_balanced,step-18341,nld,6.128540515899658,458.76610999140223
766,"Elk jaar raken tientallen bezoekers gewond omdat ze geen gepaste afstand houden. Deze dieren zijn groot, wilde en mogelijk gevaarlijk, dus geef ze de ruimte.",BeetleLM/beetlelm_eng-nld_balanced,step-18341,nld,6.229681015014648,507.5935429500031
767,"Bovendien moet u zich ervan bewust zijn dat geuren beren en andere wilde dieren aantrekken, dus vermijd het dragen of koken van geurend voedsel en houd de kampeerplek schoon.",BeetleLM/beetlelm_eng-nld_balanced,step-18341,nld,7.073716640472412,1180.5274870192518
768,De hoofdstad van Samoa is Apia en de stad met bijna 40.000 inwoners ligt op het eiland Upolu.,BeetleLM/beetlelm_eng-nld_balanced,step-18341,nld,5.104856491088867,164.82041563595732
769,Rond het jaar 1850 werd Apia opgericht en het is de officiële hoofdstad van Samoa vanaf 1959.,BeetleLM/beetlelm_eng-nld_balanced,step-18341,nld,4.997726917266846,148.076186841254
770,"In 1889 wilden zeven schepen uit Duitsland, de VS en Groot-Brittannië de haven niet verlaten. Dit kwam later bekend te staan als de beruchte patstelling.",BeetleLM/beetlelm_eng-nld_balanced,step-18341,nld,5.1776885986328125,177.27258897760953
771,Met uitzondering van een Brits slagschip werden alle schepen tot zinken gebracht. Bijna 200 Amerikanen en Duitsers verloren hun leven.,BeetleLM/beetlelm_eng-nld_balanced,step-18341,nld,6.874729156494141,967.5132854047367
772,"In de onafhankelijkheidsstrijd door de Mau-beweging kwam de hoogste leider, Tupua Tamasese Lealofi III, om bij een uit de hand gelopen geweldloze bijeenkomst in de stad.",BeetleLM/beetlelm_eng-nld_balanced,step-18341,nld,6.42523193359375,617.2239559131468
773,"Er zijn veel stranden, met name vanwege de twee havens van Auckland. De meest populaire zijn gelegen in drie gebieden.",BeetleLM/beetlelm_eng-nld_balanced,step-18341,nld,5.57206392288208,262.97630232294154
774,"De stranden van North Shore in het district North Harbour strekken zich van noord tot zuid uit langs de Grote Oceaan, van Long Bay naar Devonport.",BeetleLM/beetlelm_eng-nld_balanced,step-18341,nld,6.45460319519043,635.6214585537374
775,Dit zijn nagenoeg allemaal zandstranden waar veilig kan worden gezwommen en de meeste hebben pohutukawa-bomen die schaduw bieden.,BeetleLM/beetlelm_eng-nld_balanced,step-18341,nld,7.292548656463623,1469.3106973976664
776,"Bij Waitemata's haven, in de luxe voorsteden van Mission Bay en St Heliers, gelegen in Central Auckland, vind je de Tamaki Drive-stranden.",BeetleLM/beetlelm_eng-nld_balanced,step-18341,nld,6.581027984619141,721.2804134434289
777,Deze familiestranden zijn soms drukbezocht en hebben aan de kust een goed aanbod aan winkels . Zwemmen is niet onveilig.,BeetleLM/beetlelm_eng-nld_balanced,step-18341,nld,5.463586807250977,235.94218760742945
778,"'Number One' is het belangrijkste plaatselijke bier dat geen complex bier, maar aangenaam en verfrissend is. Het andere plaatselijke bier heeft de naam 'Manta'.",BeetleLM/beetlelm_eng-nld_balanced,step-18341,nld,6.330389022827148,561.3749390454827
779,"Er zijn veel Franse wijnen te vinden, maar de Nieuw-Zeelandse en Australische wijnen zijn wellicht beter geschikt voor reizen.",BeetleLM/beetlelm_eng-nld_balanced,step-18341,nld,5.337193965911865,207.92843664546857
780,"Het lokale drinkwater kan gewoon veilig worden gedronken, maar fleswater is ook gemakkelijk te vinden als je het niet vertrouwt.",BeetleLM/beetlelm_eng-nld_balanced,step-18341,nld,5.477760314941406,239.31012739677425
781,"Een 'flat white' is een vreemd concept voor Australiërs. Zwarte koffie is 'espresso', cappuccino heeft heel veel koffiemelk (zonder schuim) en thee wordt geserveerd zonder melk.",BeetleLM/beetlelm_eng-nld_balanced,step-18341,nld,6.650322914123535,773.033908803124
782,"De warme chocolademelk is van Belgische kwaliteit. Vruchtensappen zijn duur, maar geweldig.",BeetleLM/beetlelm_eng-nld_balanced,step-18341,nld,5.925522804260254,374.474160879409
783,Er vinden het hele jaar tochten naar het rif plaats en letsel naar aanleiding van deze tochten naar het rif zijn zeldzaam.,BeetleLM/beetlelm_eng-nld_balanced,step-18341,nld,6.094598770141602,443.4560816565255
784,Vraag desondanks deskundig advies en volg alle borden en veiligheidswaarschuwingen op.,BeetleLM/beetlelm_eng-nld_balanced,step-18341,nld,7.393445014953613,1625.295647199667
785,Kubuskwallen komen van oktober tot april voor in de buurt van stranden en riviermondingen ten noorden van Town of 1770. Soms komen ze ook buiten deze periode voor.,BeetleLM/beetlelm_eng-nld_balanced,step-18341,nld,5.710108757019043,301.90390066565567
786,"Haaien komen wel degelijk voor, maar ze vallen zelden mensen aan. Het merendeel van de haaien is bang voor mensen en zou juist wegzwemmen.",BeetleLM/beetlelm_eng-nld_balanced,step-18341,nld,5.658394813537598,286.6880851814478
787,De belangrijkste habitat van zoutwaterkrokodillen bevindt zich in de riviermondingen ten noorden van Rockhampton en ze leven normaliter niet in de oceaan.,BeetleLM/beetlelm_eng-nld_balanced,step-18341,nld,6.34639835357666,570.4345013888264
788,"Vooraf reserveren zorgt voor gemoedsrust bij de reiziger, wetende dat hij een plek heeft om te slapen wanneer hij op zijn bestemming arriveert.",BeetleLM/beetlelm_eng-nld_balanced,step-18341,nld,6.1663818359375,476.4590765272309
789,"Reisbureaus hebben vaak deals met bepaalde hotels, al kun je meestal via een reisbureau ook andere accommodatievormen, zoals een campingplek, boeken.",BeetleLM/beetlelm_eng-nld_balanced,step-18341,nld,6.3098859786987305,549.9822355466109
790,Reisbureaus bieden vaak pakketten met ontbijt en vervoer van en naar het vliegveld aan en soms zelfs pakketten met vlucht en hotel.,BeetleLM/beetlelm_eng-nld_balanced,step-18341,nld,6.610998153686523,743.224500873948
791,Ze kunnen je ook reservering vasthouden als je nog wat langer over de aanbieding wilt nadenken of als je documenten voor je bestemming moet verwerven (bijv. visum).,BeetleLM/beetlelm_eng-nld_balanced,step-18341,nld,5.400847434997559,221.59412327349904
792,"Als u een verzoek hebt of een wijziging wilt maken, moet u dit echter via het reisbureau doen in plaats van het hotel.",BeetleLM/beetlelm_eng-nld_balanced,step-18341,nld,5.083407402038574,161.32281216013996
793,Voor sommige festivals geldt dat de meerderheid van de aanwezigen op muziekfestivals ervoor kiest om ter plekke te kamperen en de meeste bezoekers beschouwen dit als een belangrijk onderdeel van de ervaring.,BeetleLM/beetlelm_eng-nld_balanced,step-18341,nld,5.499383449554443,244.54111384271886
794,"Als u dicht bij de actie wilt zijn, moet u vroeg zijn om een kampeerplek in de buurt van de muziek te bemachtigen.",BeetleLM/beetlelm_eng-nld_balanced,step-18341,nld,4.725685119628906,112.80775871454743
795,"En onthoud het volgende: ook als de muziek op de hoofdpodia is afgelopen, wordt er mogelijk op andere delen van het festivalterrein tot in de late uurtjes muziek gedraaid.",BeetleLM/beetlelm_eng-nld_balanced,step-18341,nld,5.984655380249023,397.2855851958359
796,"Voor gezinnen waarvan de kinderen nog jong zijn, zijn er op sommige festivals speciale kampeerterreinen.",BeetleLM/beetlelm_eng-nld_balanced,step-18341,nld,5.352783203125,211.1952800058022
797,"Let goed op waar uw hut zit als u 's winters de Oostzee overgaat, want de tocht door het ijs maakt een enorm lawaai. als u te dichtbij zit.",BeetleLM/beetlelm_eng-nld_balanced,step-18341,nld,5.64833927154541,283.81972672092786
798,Cruises naar Sint-Petersburg omvatten tijd om de stad te verkennen. Passagiers van de cruise zijn vrijgesteld van de visumvereisten (controleer de voorwaarden).,BeetleLM/beetlelm_eng-nld_balanced,step-18341,nld,6.3949294090271,598.8010517821216
799,Casino's zetten zich doorgaans in om het meeste te halen uit de tijd en het geld dat gasten besteden. Ramen en klokken zijn normaal gesproken niet aanwezig en de uitgang is soms moeilijk te vinden.,BeetleLM/beetlelm_eng-nld_balanced,step-18341,nld,5.647151470184326,283.4828054006404
800,"Ze hebben normaal gesproken speciaal aanbiedingen op het gebied van eten, drinken en entertainment om ze in een goede stemming te houden en om te voorkomen dat ze vertrekken.",BeetleLM/beetlelm_eng-nld_balanced,step-18341,nld,5.105144500732422,164.86789234166153
801,"Sommige locaties bieden gratis alcoholische dranken aan. Als mensen dronken zijn, beïnvloedt dat echter hun beoordelingsvermogen en alle doorgewinterde gokkers weten dat het enorm belangrijk is om nuchter te blijven.",BeetleLM/beetlelm_eng-nld_balanced,step-18341,nld,6.924250602722168,1016.6321227388411
802,"Als je op hoog de bergen in gaat of over bergpassen gaat rijden, moet je er rekening mee houden dat er sneeuw of ijs kan liggen en de temperatuur ontzettend laag kan zijn.",BeetleLM/beetlelm_eng-nld_balanced,step-18341,nld,5.185795307159424,178.7155270229581
803,Op ijzige en besneeuwde wegen is er weinig frictie en het rijdt hierdoor anders dan asfalt.,BeetleLM/beetlelm_eng-nld_balanced,step-18341,nld,7.020415306091309,1119.251353140752
804,Tijdens sneeuwstormen kan er in een hele korte periode genoeg sneeuw vallen om vast te komen te zitten.,BeetleLM/beetlelm_eng-nld_balanced,step-18341,nld,5.817620754241943,336.1712673123713
805,Ook kan het zicht belemmerd worden door vallende of opwaaiende sneeuw of doordat er condensatie of ijs op de ruiten van het voertuig zit.,BeetleLM/beetlelm_eng-nld_balanced,step-18341,nld,5.8662109375,352.90924850753237
806,Aan de andere kant zijn ijs en sneeuw in veel landen normaal en wordt het verkeer hier niet door belemmerd.,BeetleLM/beetlelm_eng-nld_balanced,step-18341,nld,5.566779613494873,261.5903193864565
807,"De grootste toeristische Afrikaanse trekpleister zijn safari's, die voor veel bezoekers het hoogtepunt van hun reis vormen.",BeetleLM/beetlelm_eng-nld_balanced,step-18341,nld,5.879255294799805,357.54287849921786
808,"Het begrip safari verwijst in populair gebruik naar reizen over land om de prachtige Afrikaanse wilde dieren te bekijken, met name op de savanne.",BeetleLM/beetlelm_eng-nld_balanced,step-18341,nld,5.988352298736572,398.7570358612827
809,"Sommige dieren, zoals olifanten en giraffen, komen vaak dicht bij auto's en een standaarduitrusting maakt een goed uitzicht mogelijk.",BeetleLM/beetlelm_eng-nld_balanced,step-18341,nld,4.864364147186279,129.58851318863063
810,"Als je leeuwen, cheeta's en luipaarden wilt zien, heb je een verrekijker nodig. Anders is de kans klein dat je ze ziet.",BeetleLM/beetlelm_eng-nld_balanced,step-18341,nld,4.600419521331787,99.52606019027586
811,Een wandelsafari (ook wel een 'boswandeling' of 'loopsafari' genoemd) houdt in dat je meerdere uren of dagen achter elkaar loopt.,BeetleLM/beetlelm_eng-nld_balanced,step-18341,nld,6.160456657409668,473.6443186440639
812,De Paralympics zijn van 24 augustus tot 5 september 2021. Sommige onderdelen worden op andere locaties in Japan gespeeld.,BeetleLM/beetlelm_eng-nld_balanced,step-18341,nld,5.304868221282959,201.31447170284028
813,Tokio wordt de enige Aziatische stad zijn waar de Olympische Spelen twee keer hebben plaatsgevonden. De eerste keer was in 1964.,BeetleLM/beetlelm_eng-nld_balanced,step-18341,nld,5.053701400756836,156.60103625696942
814,"Als je al voordat het uitstel werd aangekondigd vluchten en accommodatie voor 2020 hebt geboekt, kun je in een penibele situatie zitten.",BeetleLM/beetlelm_eng-nld_balanced,step-18341,nld,6.602111339569092,736.6488643928217
815,"Het annuleringsbeleid varieert, maar vanaf eind maart zijn de meeste op coronavirus gebaseerde annuleringsbeleidslijnen niet meer geldig tot juli 2020, toen de Olympische Spelen waren gepland.",BeetleLM/beetlelm_eng-nld_balanced,step-18341,nld,7.023816108703613,1123.0641857371033
816,Naar verwachtingen kosten de meeste kaartjes voor evenementen tussen ¥ 2.500 en ¥ 130.000. Normale kaartjes gaan rond ¥ 7.000 kosten.,BeetleLM/beetlelm_eng-nld_balanced,step-18341,nld,5.764568328857422,318.8013969659669
817,"Je kunt vochtige kleren drogen door ze te strijken. Veel hotels hebben een strijkijzer en een strijkplank beschikbaar. Je kunt deze spullen vaak lenen, zelfs al staan ze niet in de kamer.",BeetleLM/beetlelm_eng-nld_balanced,step-18341,nld,5.04818868637085,155.74011465925798
818,"Als er geen strijkijzer voorhanden is of als je geen gestreken sokken wilt dragen, kun je, indien beschikbaar, ook een haardroger gebruiken.",BeetleLM/beetlelm_eng-nld_balanced,step-18341,nld,5.681239604949951,293.31279665503826
819,"Zorg ervoor dat de stof niet te heet wordt (hierdoor kan de stof krimpen of, in extreme gevallen, verschroeien).",BeetleLM/beetlelm_eng-nld_balanced,step-18341,nld,6.552632808685303,701.0875755470767
820,Je kunt water op verschillende manieren zuiveren. Sommige manieren zijn effectief om specifieke risico's tegen te gaan.,BeetleLM/beetlelm_eng-nld_balanced,step-18341,nld,5.5242085456848145,250.6878515028634
821,"In sommige gebieden is het voldoende om water een minuut te koken, in andere gebieden moet water enkele minuten worden gekookt.",BeetleLM/beetlelm_eng-nld_balanced,step-18341,nld,4.997159957885742,147.99225745253167
822,Niet ieder filter is even effectief. In geval van twijfel kan je het beste water drinken uit een afgesloten fles van een betrouwbaar bedrijf.,BeetleLM/beetlelm_eng-nld_balanced,step-18341,nld,6.24907922744751,517.5360722015258
823,Reizigers kunnen te maken krijgen met dierenplagen die er in hun eigen land niet zijn.,BeetleLM/beetlelm_eng-nld_balanced,step-18341,nld,5.221127986907959,185.14290510431533
824,"Ongedierte kan voedsel verderven, irritatie veroorzaken of, in het ergste geval, allergische reacties veroorzaken, gif verspreiden of infecties overbrengen.",BeetleLM/beetlelm_eng-nld_balanced,step-18341,nld,7.517859935760498,1840.6240224821406
825,"Normaal gesproken worden infectieziekten zelf, of gevaarlijke dieren die met geweld mensen verwonden of doden, niet beschouwd als ongedierte.",BeetleLM/beetlelm_eng-nld_balanced,step-18341,nld,6.305433750152588,547.5390318241506
826,Met belastingvrij winkelen wordt bedoeld dat je op bepaalde locaties goederen kunt kopen die zijn vrijgesteld van belasting en accijnzen.,BeetleLM/beetlelm_eng-nld_balanced,step-18341,nld,6.38564395904541,593.266649041164
827,"Reizigers die naar landen met hoge accijnzen gaan, kunnen soms aanzienlijk veel geld besparen, als het gaat om producten als alcoholische dranken en tabak.",BeetleLM/beetlelm_eng-nld_balanced,step-18341,nld,5.821946144104004,337.6284883565579
828,"Point Marion en Fairmont zijn met elkaar verbonden via de snelweg van Buffalo naar Pittsburgh, je rijdt vaak door verlaten achterliggend terrein en dat maakt van dit traject één grote uitdaging.",BeetleLM/beetlelm_eng-nld_balanced,step-18341,nld,6.924184799194336,1016.5652269596708
829,"Ben je niet gewend om op landweggetjes te rijden? Houd dan je hoofd erbij. Je komt veel steile hellingen, smalle straatjes en scherpe bochten tegen.",BeetleLM/beetlelm_eng-nld_balanced,step-18341,nld,5.485714435577393,241.22121947204863
830,De gestelde maximumsnelheden zijn opvallend lager dan in eerdere en opeenvolgende gebieden — meestal zo'n 35-40 mph (56-64 km/u — en het is hier nog belangrijker om je eraan te houden dan anders.,BeetleLM/beetlelm_eng-nld_balanced,step-18341,nld,6.095569133758545,443.8866041517782
831,"Verrassend genoeg heb je hier veel meer bereik dan in andere uithoeken van de route, zoals de Pennsylvania Wilds.",BeetleLM/beetlelm_eng-nld_balanced,step-18341,nld,6.820511341094971,916.453510630765
832,"Duitse gebak smaakt prima en in Beieren is het gebak redelijk rijk en gevarieerd, net zoals het gebak van de zuidelijke buur, Oostenrijk.",BeetleLM/beetlelm_eng-nld_balanced,step-18341,nld,6.312896728515625,551.6405896535451
833,"Je ziet er veel fruitgebakjes. Het hele jaar door bevatten de gebakjes appels, en in de zomermaanden ook kersen en pruimen.",BeetleLM/beetlelm_eng-nld_balanced,step-18341,nld,5.2279887199401855,186.41748843752225
834,"Veel populaire Duitse gebakjes bevatten amandelen, hazelnoten en andere noten, en smaken prima bij een kop sterke koffie.",BeetleLM/beetlelm_eng-nld_balanced,step-18341,nld,6.766793251037598,868.5222906481139
835,"Als u een paar kleine maar machtige gebakjes wilt, probeer er dan enkele die in de regio Berliner, Pfannkuchen of Krapfen worden genoemd.",BeetleLM/beetlelm_eng-nld_balanced,step-18341,nld,6.625753879547119,754.2726289768203
836,"Om een curry te maken heb je kruidige en pittige ingrediënten nodig, in combinatie met groente of vlees.",BeetleLM/beetlelm_eng-nld_balanced,step-18341,nld,5.647618770599365,283.6153079901069
837,"Afhankelijk van de hoeveelheid vloeistof, kan een curry 'droog' of 'nat' zijn.",BeetleLM/beetlelm_eng-nld_balanced,step-18341,nld,5.606392860412598,272.16074347819045
838,In het binnenland van Noord-India en ook van Pakistan wordt vaak yoghurt gebruikt in curry's; in Zuid-India en enkele andere kustregio's van het subcontinent wordt dan weer vaak kokosmelk gebruikt.,BeetleLM/beetlelm_eng-nld_balanced,step-18341,nld,5.356142520904541,211.9059450714539
839,De Indonesische keuken omvat gerechten uit 17.000 eilanden en is een overkoepelend begrip voor een variëteit aan regionale keukens uit het hele land.,BeetleLM/beetlelm_eng-nld_balanced,step-18341,nld,6.353039741516113,574.2355864754014
840,Maar zonder aanvullende informatie verwijst de term naar het voedsel dat oorspronkelijk uit het centrale en oostelijke deel van het hoofdeiland Java komt.,BeetleLM/beetlelm_eng-nld_balanced,step-18341,nld,5.645077705383301,282.89553787492844
841,"De Javaanse keuken is tegenwoordig beschikbaar in de hele archipel en biedt verschillende eenvoudige gekruide gerechten. De meest gebruikelijke Javaanse smaakmakers zijn noten, pepers, suiker (voornamelijk Javaanse kokossuiker) en verschillende geurige kruiden.",BeetleLM/beetlelm_eng-nld_balanced,step-18341,nld,7.175598621368408,1307.142350173029
842,Stijgbeugels ondersteunen de voeten van de ruiter en hangen aan beide kanten van het zadel naar beneden.,BeetleLM/beetlelm_eng-nld_balanced,step-18341,nld,5.6121673583984375,273.73688146638074
843,"Ze voorzien de berijder van meer stabiliteit, maar kunnen ook problemen met de veiligheid met zich meebrengen doordat de voeten van een berijder erin vast kunnen komen te zitten.",BeetleLM/beetlelm_eng-nld_balanced,step-18341,nld,6.165585994720459,476.080041601711
844,"Als een ruiter van een paard wordt afgegooid maar met de voet in de stijgbeugel blijft hangen, kunnen ze worden meegesleurd met het paard. Om het risico te verminderen, zijn er een aantal veiligheidsmaatregelen genomen.",BeetleLM/beetlelm_eng-nld_balanced,step-18341,nld,5.183565139770508,178.31740558643043
845,"De meeste ruiters dragen ten eerste rijlaarzen met een hak en een gladde, vrij smalle zool.",BeetleLM/beetlelm_eng-nld_balanced,step-18341,nld,6.847143650054932,941.1886992693057
846,"Sommige zadels, en dan vooral Engelse zadels, beschikken over veiligheidsbeugels. Hierdoor kan een stijgbeugelleer van het zadel loskomen als dit achteruit wordt getrokken omdat een ruiter van het paard valt.",BeetleLM/beetlelm_eng-nld_balanced,step-18341,nld,6.139625072479248,463.87961701653717
847,"Cochamó Valley - Dit is de populairste klimbestemming van Chili. Deze staat bekend als de Yosemite van Zuid-Amerika, en heeft veel verschillende grote granieten wanden en rotsen.",BeetleLM/beetlelm_eng-nld_balanced,step-18341,nld,5.664040565490723,288.31123263082236
848,De bergtoppen bieden een adembenemend uitzicht. Klimmers uit alle delen van de wereld ontdekken voortdurend nieuwe routes op de rotswanden die een eindeloos potentieel lijken te hebben.,BeetleLM/beetlelm_eng-nld_balanced,step-18341,nld,6.683019638061523,798.7273416767439
849,"Wintersporten waarbij je afdaalt, zoals skiën en snowboarden, zijn heel populair. Je glijdt naar beneden op een met sneeuw bedekte afdaling met ski's of een snowboard aan je voeten.",BeetleLM/beetlelm_eng-nld_balanced,step-18341,nld,5.547333240509033,256.5524790856856
850,"Skiën is een populaire reisactiviteit met veel liefhebbers, die af en toe ook wel 'ski bums' worden genoemd, die hele vakanties plannen rond het skiën op een bepaalde locatie.",BeetleLM/beetlelm_eng-nld_balanced,step-18341,nld,5.88105583190918,358.18722763333403
851,Skiën bestaat al heel erg lang: er zijn grotschilderingen van skiërs die dateren uit 5000 v.Chr.!,BeetleLM/beetlelm_eng-nld_balanced,step-18341,nld,6.028214454650879,414.9734136360195
852,Het begin van de skisport dateert op zijn minst uit de 17e eeuw en in 1861 werd het eerste recreatieve skioord in Australië geopend door Noren.,BeetleLM/beetlelm_eng-nld_balanced,step-18341,nld,6.052915573120117,425.351366948736
853,"Backpacken met ski's: deze activiteit wordt ook wel off-piste skiën, skitouring of skihiking genoemd.",BeetleLM/beetlelm_eng-nld_balanced,step-18341,nld,6.349689483642578,572.3149682601513
854,"Het is niet helemaal hetzelfde, maar het lijkt op alpineskiën of bergbeklimmen, wat veel gedaan wordt op steil terrein. Hier heb je veel stuggere ski's en laarzen voor nodig.",BeetleLM/beetlelm_eng-nld_balanced,step-18341,nld,5.591817855834961,268.22276711989576
855,Je kunt de skiroute zien als een wandelroute.,BeetleLM/beetlelm_eng-nld_balanced,step-18341,nld,5.417736530303955,225.36843013965947
856,"In goede omstandigheden kun je grotere afstanden afleggen dan lopend, maar het gebeurt maar zelden dat je op aangelegde pistes de snelheid van langlaufen haalt zonder een zware rugzak.",BeetleLM/beetlelm_eng-nld_balanced,step-18341,nld,6.505384922027588,668.7330298931864
857,"Europa is een relatief klein continent, maar met veel onafhankelijke landen. Normaal gesproken moeten reizigers tussen verschillende landen meerdere keren een visum aanvragen en paspoortcontroles ondergaan.",BeetleLM/beetlelm_eng-nld_balanced,step-18341,nld,6.446145534515381,630.2682576283896
858,Het Schengengebied functioneert op dit gebied echter bijna als één land.,BeetleLM/beetlelm_eng-nld_balanced,step-18341,nld,7.272304534912109,1439.8648513150395
859,"Zolang u in deze zone verblijft, kunt u meestal de grens oversteken zonder opnieuw een paspoortcontrole te hoeven ondergaan.",BeetleLM/beetlelm_eng-nld_balanced,step-18341,nld,6.679885387420654,796.2278490585365
860,"Wanneer u een Schengenvisum hebt, hoeft u niet voor ieder Schengenland apart een visum aan te vragen, wat tijd, geld en papierwerk bespaart.",BeetleLM/beetlelm_eng-nld_balanced,step-18341,nld,6.670389175415039,788.7024883611751
861,Er is geen universele definitie waarmee wordt aangegeven welke geproduceerde artikelen antiek zijn. Sommige belastingkantoren geven goederen die ouder zijn dan 100 jaar de definitie antiek.,BeetleLM/beetlelm_eng-nld_balanced,step-18341,nld,6.607806205749512,740.8559491195949
862,De definitie kan per locatie verschillen. In Noord-Amerika ligt de leeftijdsgrens bijvoorbeeld lager dan in Europa.,BeetleLM/beetlelm_eng-nld_balanced,step-18341,nld,5.531007766723633,252.39814134752297
863,"Het is mogelijk om ambachtelijke producten als antiek aan te merken, ondanks dat ze nieuwer zijn dan vergelijkbare massaproducten.",BeetleLM/beetlelm_eng-nld_balanced,step-18341,nld,6.345574855804443,569.9649432143284
