sentence_id,sentence,repo,revision,iso_code,nll,ppl
433,De beeldverhouding van deze grootte (delen door twaalf om de simpelste verhouding van gehele getallen te krijgen) zou in dat geval 3:2 zijn.,BeetleLM/beetlelm_eng-nld_balanced,step-18341,nld,6.872080326080322,964.9538979766663
434,Veel gangbare indelingen (bijvoorbeeld APS-achtige indelingen) zijn gelijk aan of een dichte benadering van deze beeldverhouding.,BeetleLM/beetlelm_eng-nld_balanced,step-18341,nld,7.667184829711914,2137.0567902319217
435,"De regel van derden, waar veel misbruik van wordt gemaakt en die door velen belachelijk wordt gevonden, is een eenvoudige richtlijn waardoor de afbeelding dynamisch, en toch ook overzichtelijk is.",BeetleLM/beetlelm_eng-nld_balanced,step-18341,nld,5.920624732971191,372.64444444235824
436,De meest effectieve plek voor het hoofdonderwerp ligt op het snijpunt van de lijnen. Zo deel je de afbeelding verticaal en horizontaal in drieën (zie voorbeeld).,BeetleLM/beetlelm_eng-nld_balanced,step-18341,nld,5.9023919105529785,365.91164990278526
437,In deze periode in de geschiedenis van Europa lag de rijke en machtige katholieke kerk onder vuur.,BeetleLM/beetlelm_eng-nld_balanced,step-18341,nld,5.067882061004639,158.83756257785532
438,"Al meer dan duizend jaar verbond het christendom Europese staten, ondanks taalverschillen en verschillen in gewoonten.",BeetleLM/beetlelm_eng-nld_balanced,step-18341,nld,5.193845748901367,180.16007277565419
439,"Van de koning tot de gewone burger, zijn allesdoordringende macht had invloed op iedereen.",BeetleLM/beetlelm_eng-nld_balanced,step-18341,nld,6.392792701721191,597.5229551454681
440,Een van de belangrijkste principes van het christendom is dat welvaart moet worden gebruikt om lijden en armoede te bestrijden en de kerk beschikt om deze reden over geldmiddelen.,BeetleLM/beetlelm_eng-nld_balanced,step-18341,nld,5.457492351531982,234.50862123337757
441,De kerk was al meer dan duizend jaar de centrale autoriteit in Rome en deze verhouding van macht en geld leidde ertoe dat veel mensen begonnen te twijfelen of dit principe werd nageleefd.,BeetleLM/beetlelm_eng-nld_balanced,step-18341,nld,6.692357063293457,806.2203266627407
442,"Groot-Brittannië stelde een blokkade op zee in gericht tegen Duitsland, vlak na het uitbreken van de vijandelijkheden.",BeetleLM/beetlelm_eng-nld_balanced,step-18341,nld,6.406520366668701,605.7821098243438
443,"De strategie bleek effectief, want het was niet meer mogelijk om vitale voorzieningen aan militairen en burgers te leveren. Deze blokkade schond echter wel de algemeen aanvaarde internationale wet die in de afgelopen twee eeuwen werd vastgelegd in verschillende internationale overeenkomsten.",BeetleLM/beetlelm_eng-nld_balanced,step-18341,nld,6.062514781951904,429.45406336332474
444,"Groot-Brittannië heeft mijnen geplaatst in internationale wateren, zodat er in hele delen van de oceaan geen schepen meer konden varen, wat zelfs voor neutrale schepen gevaarlijk was.",BeetleLM/beetlelm_eng-nld_balanced,step-18341,nld,5.781804084777832,324.3438066344033
445,"Vanwege de beperkte reactie op deze tactiek, verwachtte Duitsland dat er een vergelijkbare reactie zou komen op de ongeremde onderzeese oorlogsvoering van het land.",BeetleLM/beetlelm_eng-nld_balanced,step-18341,nld,6.643308162689209,767.6302429270877
446,Tijdens de jaren 20 hadden de meeste burgers en naties een houding van pacifisme en isolement.,BeetleLM/beetlelm_eng-nld_balanced,step-18341,nld,6.044619083404541,421.83704214520264
447,Na de Eerste Wereldoorlog wilden staten voorkomen dat er ooit nog zulke verschrikkingen zouden plaatsvinden.,BeetleLM/beetlelm_eng-nld_balanced,step-18341,nld,5.887426376342773,360.47635904740577
448,Tesla emigreerde in 1884 naar de Verenigde Staten van Amerika om te gaan werken bij de Edison Company in New York City.,BeetleLM/beetlelm_eng-nld_balanced,step-18341,nld,5.131473064422607,169.26627461507624
449,"Toen hij naar de Verenigde Staten kwam, had hij alleen 4 cent, een dichtbundel en een aanbevelingsbrief van Charles Batchelor (zijn vorige baas) voor Thomas Edison bij zich.",BeetleLM/beetlelm_eng-nld_balanced,step-18341,nld,5.452738285064697,233.39639754833883
450,Het oude China had een unieke manier om verschillende tijdsperiodes weer te geven; iedere fase van China of iedere regerende familie had een onderscheidende dynastie.,BeetleLM/beetlelm_eng-nld_balanced,step-18341,nld,7.00617790222168,1103.4290213280365
451,"Ook tussen de verschillende dynastieën was er een onstabiele periode waarin de provincies verdeeld waren. De bekendste was het tijdperk van de Drie Koninkrijken, dit heeft plaatsgevonden in de 60 jaar tussen de Han- en de Jin-dynastie in.",BeetleLM/beetlelm_eng-nld_balanced,step-18341,nld,5.921356678009033,372.91729953963267
452,Er vonden in die tijd hevige oorlogen plaats tussen verschillende edelen die om de troon vochten.,BeetleLM/beetlelm_eng-nld_balanced,step-18341,nld,5.715105056762695,303.41607754593275
453,In de geschiedenis van het oude China staat het tijdperk van de Drie Koninkrijken als een van de bloederigste te boek. Duizenden mensen stierven in de strijd om de hoogste plek in het grote paleis in Xi'an.,BeetleLM/beetlelm_eng-nld_balanced,step-18341,nld,5.337607383728027,208.01441573708408
454,"De Revolutie heeft grote sociale en politieke gevolgen gehad, zoals het gebruik van het metrieke stelsel, een verschuiving van de absolute monarchie naar republicanisme, nationalisme en de opvatting dat het land aan zijn inwoners toebehoort in plaats van een enkele leider.",BeetleLM/beetlelm_eng-nld_balanced,step-18341,nld,5.674784183502197,291.42543734074775
455,"Voor alle mannelijke sollicitanten waren na de revolutie functies te verkrijgen, zodat de meest ambitieuze en geschikte kandidaten konden slagen.",BeetleLM/beetlelm_eng-nld_balanced,step-18341,nld,6.337085247039795,565.1466455073419
456,Hetzelfde geldt voor het leger. De legerrangen worden niet meer gebaseerd op iemands klasse maar op het kaliber van de persoon.,BeetleLM/beetlelm_eng-nld_balanced,step-18341,nld,6.447065353393555,630.8482569763516
457,De Franse Revolutie inspireerde ook in andere landen de onderdrukte arbeidersklasse tot een revolutie.,BeetleLM/beetlelm_eng-nld_balanced,step-18341,nld,5.780193328857422,323.82178846241527
458,Mohammed hield zich intensief bezig met bovenaardse kwesties. Hij ging vaak voor bezinning naar een grot die later bekend werd als de Grot van Hira in het Gebergte van Noer.,BeetleLM/beetlelm_eng-nld_balanced,step-18341,nld,6.596121311187744,732.2495060828243
459,"De grot zelf, die de tand des tijds heeft doorstaan, geeft een zeer levendig beeld van de spiritualiteit van Mohammed.",BeetleLM/beetlelm_eng-nld_balanced,step-18341,nld,6.6705756187438965,788.8495503875241
460,De grot bevindt zich op een van bergtoppen aan de noordzijde van Mekka en is compleet afgesloten van de rest van de wereld.,BeetleLM/beetlelm_eng-nld_balanced,step-18341,nld,5.200676441192627,181.3949033686016
461,"Zelfs als bekend was dat de grot bestond, was deze helemaal niet makkelijk te vinden. Eenmaal binnen in de grot heerst totale isolatie.",BeetleLM/beetlelm_eng-nld_balanced,step-18341,nld,5.901881694793701,365.7250036314852
462,"Het enige wat te zien is, zijn de heldere, prachtige lucht en de vele omringende bergen. Er is vanuit de grot heel weinig van deze wereld te zien of te horen.",BeetleLM/beetlelm_eng-nld_balanced,step-18341,nld,5.198539733886719,181.00772933941198
463,De Grote Piramide van Gizeh staat als enige van de zeven wereldwonderen nog overeind.,BeetleLM/beetlelm_eng-nld_balanced,step-18341,nld,7.526469707489014,1856.5397924095944
464,De Grote Piramide is in de derde eeuw voor Christus door de Egyptenaren gebouwd en behoort tot de talloze grote piramidestructuren ter ere van een overleden farao.,BeetleLM/beetlelm_eng-nld_balanced,step-18341,nld,6.306153774261475,547.933415093313
465,"Het Plateau van Gizeh of 'piramides van Gizeh' in de Egyptische vallei van de doden bevat verschillende piramides (waarvan de Grote Piramide de grootste is), meerdere kleine tombes, een aantal tempels en de grote sfinx.",BeetleLM/beetlelm_eng-nld_balanced,step-18341,nld,7.120031833648682,1236.4897948208495
466,"De grote piramide werd gebouwd om farao Khufu te eren. Veel van de kleinere piramides, tombes en tempels werden gebouwd als eerbetoon aan de vrouwen en familieleden van Khufu.",BeetleLM/beetlelm_eng-nld_balanced,step-18341,nld,6.030611515045166,415.969323121254
467,Het up-bow teken ziet eruit als een V en het down-bow teken ziet eruit als een nietje of een vierkantje waarvan de onderkant ontbreekt.,BeetleLM/beetlelm_eng-nld_balanced,step-18341,nld,6.651576519012451,774.0035955655399
468,Boven betekent dat je bij de punt moet beginnen en de strijkstok moet wegduwen. Onder betekent dat je bij de boogkikker moet beginnen (de plek waar je hand de strijkstok vasthoudt) en de strijkstok moet aantrekken.,BeetleLM/beetlelm_eng-nld_balanced,step-18341,nld,5.4829325675964355,240.55110640047593
469,"Een opwaartse beweging geeft meestal een zachter geluid, terwijl een neerwaartse beweging juist een sterker en assertiever geluid produceert.",BeetleLM/beetlelm_eng-nld_balanced,step-18341,nld,7.113795280456543,1228.802356918241
470,"Neem de vrijheid om je persoonlijke tekens te schetsen, maar vergeet daarbij niet dat de gedrukte strijktekens er om een muzikale reden zijn, waardoor ze dus meestal moeten worden gerespecteerd.",BeetleLM/beetlelm_eng-nld_balanced,step-18341,nld,6.01997184753418,411.56700893741623
471,"Een groep marktvrouwen zat op 6 oktober 1789 achter het vertrek van de doodsbange Louis XVI, Marie Antoinette en hun twee jonge kinderen (Marie Therese van 11 en Louis-Charles van 4), en de zus van de koning, Madame Elizabeth, uit Versailles naar Parijs.",BeetleLM/beetlelm_eng-nld_balanced,step-18341,nld,6.036189079284668,418.2959010299976
472,"Zij reden terug naar de Franse hoofdstad in een rijtuig, omgeven door joelende en dreigende meutes die het Koningspaar bedreigden.",BeetleLM/beetlelm_eng-nld_balanced,step-18341,nld,7.453250885009766,1725.46332052479
473,Door de acties van de menigte mensen werden de koning en koningin gedwongen om de ramen van hun koets helemaal te openen.,BeetleLM/beetlelm_eng-nld_balanced,step-18341,nld,5.395148754119873,220.33492038601304
474,Op een gegeven moment hield iemand in de menigte het hoofd van een koninklijke wacht die vermoord was in Versailles omhoog voor de ogen van een doodsbange koningin.,BeetleLM/beetlelm_eng-nld_balanced,step-18341,nld,5.895504474639893,363.4001158075389
475,De oorlogskosten van het imperialisme van de V.S. met betrekking tot de verovering van de Filippijnen zijn betaald door de bevolking van de Filippijnen.,BeetleLM/beetlelm_eng-nld_balanced,step-18341,nld,4.7429351806640625,114.77058016054374
476,Ze werden opgelegd aan het Amerikaanse koloniale regime belasting te betalen om een groot deel van de kosten te financieren en de rente op obligaties werd via de banken op Wall Street uitgegeven in de naam van de Filipijnse overheid.,BeetleLM/beetlelm_eng-nld_balanced,step-18341,nld,5.716614246368408,303.8743356485744
477,Het Amerikaanse imperialisme rustte voor een groot deel op de enorme winst van de langdurige uitbuiting van de Filipijnen.,BeetleLM/beetlelm_eng-nld_balanced,step-18341,nld,6.253018379211426,519.5787458927331
478,Om de Tempeliers te begrijpen moet men weten wat de context was die de aanzet gaf tot het ontstaan van de orde.,BeetleLM/beetlelm_eng-nld_balanced,step-18341,nld,5.6598992347717285,287.119709415291
479,"Het tijdperk waarin dit gebeurd is, wordt algemeen aangeduid als de Hoge Middeleeuwen, de Europese geschiedenis in de 11e, 12e en 13e eeuw (1000-1300 n.Chr.).",BeetleLM/beetlelm_eng-nld_balanced,step-18341,nld,5.431388854980469,228.46633178231582
480,"Na de vroege middeleeuwen kwamen de hoge middeleeuwen. Deze werden weer opgevolgd door de late middeleeuwen, die gebruikelijk rond 1500 eindigen.",BeetleLM/beetlelm_eng-nld_balanced,step-18341,nld,4.9308576583862305,138.4982455982107
481,Technologisch determinisme is een term voor een groot assortiment ideeën in de praktijk: van technologieaanbod of de technologische verplichting tot een strikt gevoel dat het menselijke lot wordt gedreven door een onderliggende logica die is gekoppeld aan wetenschappelijke wetten en de verschijning daarvan in technologie.,BeetleLM/beetlelm_eng-nld_balanced,step-18341,nld,7.031301021575928,1131.5017611837634
482,"De meeste interpretaties van technologisch determinisme hebben deze twee algemene opvattingen: de ontwikkeling van de technologie volgt een traject dat voor het grootste deel verder reikt dan culturele of politieke invloed, en dat technologie op zijn beurt 'effecten' heeft op samenlevingen die inherent zijn in plaats van die sociaal geconditioneerd zijn.",BeetleLM/beetlelm_eng-nld_balanced,step-18341,nld,6.5929460525512695,729.9281119783294
483,Zo zullen sommigen bijvoorbeeld zeggen dat de komst van de auto automatisch leidt tot de aanleg van wegen.,BeetleLM/beetlelm_eng-nld_balanced,step-18341,nld,5.499355316162109,244.53423416839607
484,"Een landelijk wegennetwerk is echter economisch niet haalbaar voor maar een paar auto's. Daarom worden nieuwe productiemethoden ontwikkeld, zodat de kosten van autobezit kunnen worden verlaagd.",BeetleLM/beetlelm_eng-nld_balanced,step-18341,nld,6.068615436553955,432.08202225549985
485,Het massale autobezit zorgt ook voor een groter aantal ongevallen op de weg en dit leidt tot de ontwikkeling van nieuwe technieken op het gebied van gezondheidszorg om het menselijk lichaam te kunnen herstellen.,BeetleLM/beetlelm_eng-nld_balanced,step-18341,nld,6.164464473724365,475.5464071362963
486,"In de romantiek was een groot onderdeel van cultureel determinisme opgenomen, dat was afkomstig van schrijvers zoals Goethe, Fichte en Schlegel.",BeetleLM/beetlelm_eng-nld_balanced,step-18341,nld,5.994176864624023,401.08639967082166
487,In de Romantiek vormde de geografie het individu en na verloop van tijd ontstonden er gewoonten en culturen naar aanleiding van deze geografie. Deze vormden een harmonieuze samenleving en waren beter dan de arbitraire opgelegde wetten.,BeetleLM/beetlelm_eng-nld_balanced,step-18341,nld,6.23708438873291,511.3653926239215
488,"Constantinopel werd als modehoofdstad van het feodale Europa gezien, zoals Parijs de huidige modehoofdstad is.",BeetleLM/beetlelm_eng-nld_balanced,step-18341,nld,6.49134635925293,659.410569353634
489,Het stond vanaf ongeveer 400 na Christus tot ongeveer 1100 na Christus bekend als een epicentrum van luxe.,BeetleLM/beetlelm_eng-nld_balanced,step-18341,nld,5.498761177062988,244.388989970704
490,"De status van het rijk nam in de 12e eeuw af, voornamelijk doordat de kruisvaarders terugkwamen met zijde en specerijen die meer waard waren dan wat de Byzantijnse markten konden bieden.",BeetleLM/beetlelm_eng-nld_balanced,step-18341,nld,5.682815074920654,293.7752663661041
491,Rond deze tijd nam Parijs ook de titel van modehoofdstad over van Constantinopel.,BeetleLM/beetlelm_eng-nld_balanced,step-18341,nld,5.79563045501709,328.8594497292203
492,"De gotiek vierde zijn hoogtijdagen in de 10e, 11e en 14e eeuw.",BeetleLM/beetlelm_eng-nld_balanced,step-18341,nld,6.017609596252441,410.5959316588752
493,Kleding was in het begin sterk beïnvloed door de Byzantijnse cultuur uit het oosten.,BeetleLM/beetlelm_eng-nld_balanced,step-18341,nld,5.5580644607543945,259.32042540122046
494,Vanwege de langzame communicatiekanalen liepen stijlen in het westen echter met 25 tot 30 jaar achter.,BeetleLM/beetlelm_eng-nld_balanced,step-18341,nld,6.268511772155762,527.6914680803558
495,Aan het einde van de middeleeuwen begon er in West-Europa een eigen stijl te ontplooien. Een van de grootste ontwikkelingen was het resultaat van de kruistochten: mensen begonnen knopen te gebruiken om hun kleding te bevestigen.,BeetleLM/beetlelm_eng-nld_balanced,step-18341,nld,4.519809246063232,91.81808164701472
496,Zelfvoorzienende landbouw is landbouw waarbij voldoende voedsel wordt geproduceerd om aan de behoeften van de boer en zijn gezin te voldoen.,BeetleLM/beetlelm_eng-nld_balanced,step-18341,nld,5.517035961151123,248.89620474637437
497,"Landbouw met als doel levensonderhoud is een simpel systeem dat meestal biologisch is. Hierbij wordt opgeslagen zaad gebruikt dat afkomstig is uit de ecoregio, en dat wordt gecombineerd met wisselende gewassen of andere relatief eenvoudige technieken om de opbrengst te optimaal te maken.",BeetleLM/beetlelm_eng-nld_balanced,step-18341,nld,5.954434394836426,385.4588315050366
498,Vroeger werkten de meeste boeren in de zelfvoorzienende landbouw. In veel ontwikkelingslanden is dit nog steeds het geval.,BeetleLM/beetlelm_eng-nld_balanced,step-18341,nld,4.478548049926758,88.1066532975607
499,Subculturen zorgen ervoor dat gelijkgestemde personen die zich verwaarloosd voelen door maatschappelijke normen worden samengebracht. Hierdoor krijgen ze de mogelijkheid een gevoel van identiteit te ontwikkelen.,BeetleLM/beetlelm_eng-nld_balanced,step-18341,nld,6.390661716461182,596.2509982775442
500,"Subculturen kunnen zich onderscheiden door middel van de leeftijd, etniciteit, sociale klasse, locatie en/of geslacht van hun leden.",BeetleLM/beetlelm_eng-nld_balanced,step-18341,nld,6.551927089691162,700.5929792719774
501,"Een subcultuur kan worden bepaald door de volgende soorten kwaliteiten: taalkundig, esthetisch, religieus, politiek, seksueel, geografisch of een of meer van deze factoren samen.",BeetleLM/beetlelm_eng-nld_balanced,step-18341,nld,6.26580286026001,526.2639327918104
502,"Leden van een subcultuur laten vaak zien tot welke groep ze behoren door middel van een bepaalde symbolische stijl in wat ze dragen, in hoe ze zich gedragen en het jargon dat ze spreken.",BeetleLM/beetlelm_eng-nld_balanced,step-18341,nld,6.233968257904053,509.7743913306656
503,"Een van de meest gebruikte methoden voor het illustreren van het belang van de vermaatschappelijking waren de paar betreurenswaardige gevallen van kinderen die door verwaarlozing, tegenslagen of moedwillig misbruik tijdens het opgroeien niet werden gesocialiseerd door volwassenen.",BeetleLM/beetlelm_eng-nld_balanced,step-18341,nld,6.710161209106445,820.7029335734115
504,"Ze worden 'wolfskinderen' of 'wilde kinderen' genoemd. Sommige wolfskinderen zijn door mensen (meestal hun eigen ouders) opgesloten geweest; soms werd dit kind in de steek gelaten, omdat de ouders de ernstige verstandelijke of lichamelijke beperking van het kind niet wilden accepteren.",BeetleLM/beetlelm_eng-nld_balanced,step-18341,nld,5.978797435760498,394.96511153031054
505,Onhandelbare kinderen hebben mogelijk ernstige kindermishandeling of een ernstig trauma meegemaakt voordat ze werden verlaten of voordat ze wegliepen.,BeetleLM/beetlelm_eng-nld_balanced,step-18341,nld,7.660566329956055,2122.959383689223
506,"Van anderen wordt beweerd dat zij zijn grootgebracht door dieren, en van sommigen wordt gezegd dat zij alleen in de wildernis hebben gewoond.",BeetleLM/beetlelm_eng-nld_balanced,step-18341,nld,5.956593990325928,386.292166167954
507,"Een verwilderd kind dat niet is grootgebracht door mensen, kan gedrag vertonen dat lijkt op het gedrag van het dier dat het kind verzorgd heeft (binnen de fysieke limieten), zoals angst voor of onverschilligheid richting mensen.",BeetleLM/beetlelm_eng-nld_balanced,step-18341,nld,6.812930107116699,909.5319323402315
508,"Leren op projectbasis moet educatie vereenvoudigen en interessanter maken, maar scaffolding gaat nog een stapje verder.",BeetleLM/beetlelm_eng-nld_balanced,step-18341,nld,6.707799434661865,818.7669054890597
509,"Scaffolding is geen leermethode maar een hulpmiddel om individuen te ondersteunen die te maken hebben met een nieuwe leerervaring, bijvoorbeeld een nieuw computerprogramma of die aan een nieuw project beginnen.",BeetleLM/beetlelm_eng-nld_balanced,step-18341,nld,5.572534084320068,263.0999727096438
510,"Ondersteuning kan zowel virtueel als echt zijn. Een docent is bijvoorbeeld een vorm van ondersteuning, maar het paperclipmannetje van Microsoft Office is dat ook.",BeetleLM/beetlelm_eng-nld_balanced,step-18341,nld,5.730282306671143,308.05622242965774
511,"Er is sprake van virtuele scaffolding die is ingebouwd in de software die vragen stelt, geheugensteuntjes biedt en procedures verklaart die mogelijk zonder hulp moeilijk te begrijpen kunnen zijn voor studenten.",BeetleLM/beetlelm_eng-nld_balanced,step-18341,nld,6.8016791343688965,899.3561643413241
512,"Er zijn verschillende redenen dat kinderen in de pleegzorg terechtkomen, zoals verwaarlozing, misbruik en uitbuiting.",BeetleLM/beetlelm_eng-nld_balanced,step-18341,nld,5.574056148529053,263.50073267532065
513,"Geen enkel kind zou moeten opgroeien in een omgeving waar ze niet goed worden verzorgd, waar men niet om ze geeft en waar ze zich niet kunnen ontwikkelen, maar toch gebeurt dit.",BeetleLM/beetlelm_eng-nld_balanced,step-18341,nld,5.04683256149292,155.52905475941364
514,Het pleegzorgsysteem beschouwen wij als een veilige zone voor deze kinderen.,BeetleLM/beetlelm_eng-nld_balanced,step-18341,nld,7.190644264221191,1326.9578417323717
515,"Het is de bedoeling dat de pleegzorg zorgt voor een veilig thuis, liefhebbende verzorgers, stabiel onderwijs en betrouwbare gezondheidszorg.",BeetleLM/beetlelm_eng-nld_balanced,step-18341,nld,5.6488237380981445,283.95726119826736
516,In de pleegzorg moet aan alle behoeften worden voldoen die werden verwaarloosd in het eerdere thuis.,BeetleLM/beetlelm_eng-nld_balanced,step-18341,nld,6.612886905670166,744.6295941429061
517,Op internet worden onderdelen van interpersoonlijke en massacommunicatie samengevoegd.,BeetleLM/beetlelm_eng-nld_balanced,step-18341,nld,6.550987720489502,699.9351728142849
518,De verschillende karakters van het internet leiden tot nieuwe dimensies wat betreft de toepassing van de Uses & Gratifications-theorie.,BeetleLM/beetlelm_eng-nld_balanced,step-18341,nld,6.333147048950195,562.925362864089
519,"'Leren' en 'socialisatie' worden bijvoorbeeld voorgesteld als belangrijke redenen om het internet te gebruiken (James et al., 1995).",BeetleLM/beetlelm_eng-nld_balanced,step-18341,nld,6.260704517364502,523.5876868157203
520,Eighmey en McCord (1998) introduceerden nieuwe motivatieaspecten als 'persoonlijke betrokkenheid' en 'aanhoudende relaties' toen zij reacties van het publiek op websites onderzochten.,BeetleLM/beetlelm_eng-nld_balanced,step-18341,nld,6.505885124206543,669.0676152850731
521,"Dat er video-opnames worden gebruikt, leidde tot opmerkelijke vondsten in het interpreteren van micro-expressies, dat zijn gezichtsbewegingen die een paar milliseconden duren.",BeetleLM/beetlelm_eng-nld_balanced,step-18341,nld,6.808797836303711,905.7812548274557
522,Er wordt met name gesteld dat niemand een leugen kan herkennen door op enkel op micro-expressies te letten.,BeetleLM/beetlelm_eng-nld_balanced,step-18341,nld,6.733551979064941,840.1260827326362
523,"Oliver Sacks beschreef in zijn essay The President's Speech hoe het kan dat mensen die spraak niet kunnen begrijpen vanwege hersenbeschadiging, de oprechtheid ervan toch nauwkeurig kunnen inschatten.",BeetleLM/beetlelm_eng-nld_balanced,step-18341,nld,7.265182018280029,1429.6458257544612
524,"Hij suggereerde zelfs dat andere diersoorten, zoals huishonden, ook over het vermogen om het gedrag van mensen te interpreteren beschikken.",BeetleLM/beetlelm_eng-nld_balanced,step-18341,nld,6.0747551918029785,434.74306082307254
525,Uit onderzoek in de twintigste eeuw is gebleken dat er twee groepen genetische varianten bestaan: verborgen en zichtbaar.,BeetleLM/beetlelm_eng-nld_balanced,step-18341,nld,6.510162353515625,671.9354998265824
526,Door mutatie wordt er nieuwe genetische variatie toegevoegd; door selectie wordt deze variatie geëlimineerd uit de pool van uitgedrukte variatie.,BeetleLM/beetlelm_eng-nld_balanced,step-18341,nld,7.097285747528076,1208.6819502099352
527,Voor elke generatie wordt er door middel van scheiding en hercombinatie gevarieerd tussen de twee groepen.,BeetleLM/beetlelm_eng-nld_balanced,step-18341,nld,5.3914690017700195,219.52563234793314
528,Een primaat met een spijsverteringssysteem dat lijkt op dat van de mens kan op de savanne maar moeilijk de benodigde aminozuren halen uit de plantaardige bronnen die daar te vinden zijn.,BeetleLM/beetlelm_eng-nld_balanced,step-18341,nld,5.452269077301025,233.28691183437826
529,"Verder kan het niet in acht nemen serieuze gevolgen hebben: groeiachterstand, ondervoeding en uiteindelijk zelfs de dood.",BeetleLM/beetlelm_eng-nld_balanced,step-18341,nld,6.580050468444824,720.5756946661872
530,"De gemakkelijkst te vinden plantaardige bronnen zijn de eiwitten in bladeren en peulvruchten, maar tenzij ze gekookt zijn, zijn ze voor primaten zoals wij moeilijk verteerbaar.",BeetleLM/beetlelm_eng-nld_balanced,step-18341,nld,6.435068130493164,623.3250488599331
531,"Niet alleen is dierlijk voedsel (mieren, termieten, eieren) licht verteerbaar, maar het bevat ook heel erg veel proteïnen die alle essentiële aminozuren bevatten.",BeetleLM/beetlelm_eng-nld_balanced,step-18341,nld,6.4503679275512695,632.9351242474538
532,Al met al moeten we er niet versteld van staan als onze voorouders hun 'proteïneprobleem' oplosten op dezelfde manier als chimpansees op de savanne dit probleem vandaag de dag oplossen.,BeetleLM/beetlelm_eng-nld_balanced,step-18341,nld,6.761725425720215,864.1319056434597
533,Slaaponderbreking houdt in dat je met een reden wakker wordt tijdens je normale slaapperiode en dat je binnen korte tijd (10–60 minuten) weer in slaap valt.,BeetleLM/beetlelm_eng-nld_balanced,step-18341,nld,6.348087310791016,571.3987549175241
534,Dit is vrij gemakkelijk door gebruik te maken van een relatief zachte wekker die je terugbrengt naar je bewustzijn zonder dat je meteen helemaal wakker wordt.,BeetleLM/beetlelm_eng-nld_balanced,step-18341,nld,6.064724445343018,430.4040614868017
