sentence_id,sentence,repo,revision,iso_code,nll,ppl
427,"Opgebouwd uit drie grote constructies, bestaat de Machu Picchu uit Intihuatana, de Tempel van de Zon en de Kamer met Drie Ramen.",BeetleLM/beetlelm_fas-nld_simultaneous,step-10000,nld,7.124942302703857,1242.5764716840345
428,Het grootste gedeelte van de gebouwen aan de randen van het complex is opnieuw gebouwd zodat toeristen een beter beeld krijgen van hoe ze er voorheen uitzagen.,BeetleLM/beetlelm_fas-nld_simultaneous,step-10000,nld,6.779571056365967,879.6913051825945
429,In 1976 was dertig procent van Machu Picchu hersteld. De renovatie is nog steeds aan de gang.,BeetleLM/beetlelm_fas-nld_simultaneous,step-10000,nld,6.271560192108154,529.3025476562929
430,"Bijvoorbeeld, wereldwijd is het meest voorkomende fotoformaat voor stilstaande beelden 35 mm, wat het gebruikelijke filmformaat was in de afloop van het analoge filmtijdperk.",BeetleLM/beetlelm_fas-nld_simultaneous,step-10000,nld,6.928762435913086,1021.2293604793902
431,"Deze worden tot op de dag van vandaag geproduceerd, al is het vooral de verhouding van het beeld die de beeldsensor van de digitale camera overnam.",BeetleLM/beetlelm_fas-nld_simultaneous,step-10000,nld,6.341172218322754,567.4611099714859
432,"Vreemd genoeg is 35 mm-film eigenlijk 36 mm breed, bij een hoogte van 24 mm.",BeetleLM/beetlelm_fas-nld_simultaneous,step-10000,nld,8.02546215057373,3057.8341510686073
433,De beeldverhouding van deze grootte (delen door twaalf om de simpelste verhouding van gehele getallen te krijgen) zou in dat geval 3:2 zijn.,BeetleLM/beetlelm_fas-nld_simultaneous,step-10000,nld,6.930367469787598,1022.8697843123531
434,Veel gangbare indelingen (bijvoorbeeld APS-achtige indelingen) zijn gelijk aan of een dichte benadering van deze beeldverhouding.,BeetleLM/beetlelm_fas-nld_simultaneous,step-10000,nld,7.376172065734863,1597.4630654013447
435,"De regel van derden, waar veel misbruik van wordt gemaakt en die door velen belachelijk wordt gevonden, is een eenvoudige richtlijn waardoor de afbeelding dynamisch, en toch ook overzichtelijk is.",BeetleLM/beetlelm_fas-nld_simultaneous,step-10000,nld,6.623397350311279,752.4972561554094
436,De meest effectieve plek voor het hoofdonderwerp ligt op het snijpunt van de lijnen. Zo deel je de afbeelding verticaal en horizontaal in drieën (zie voorbeeld).,BeetleLM/beetlelm_fas-nld_simultaneous,step-10000,nld,6.652696132659912,774.8706658556086
437,In deze periode in de geschiedenis van Europa lag de rijke en machtige katholieke kerk onder vuur.,BeetleLM/beetlelm_fas-nld_simultaneous,step-10000,nld,6.096730709075928,444.4025114494617
438,"Al meer dan duizend jaar verbond het christendom Europese staten, ondanks taalverschillen en verschillen in gewoonten.",BeetleLM/beetlelm_fas-nld_simultaneous,step-10000,nld,6.56287956237793,708.3083789682391
439,"Van de koning tot de gewone burger, zijn allesdoordringende macht had invloed op iedereen.",BeetleLM/beetlelm_fas-nld_simultaneous,step-10000,nld,6.220160007476807,502.7836747315231
440,Een van de belangrijkste principes van het christendom is dat welvaart moet worden gebruikt om lijden en armoede te bestrijden en de kerk beschikt om deze reden over geldmiddelen.,BeetleLM/beetlelm_fas-nld_simultaneous,step-10000,nld,5.899359226226807,364.80363635423834
441,De kerk was al meer dan duizend jaar de centrale autoriteit in Rome en deze verhouding van macht en geld leidde ertoe dat veel mensen begonnen te twijfelen of dit principe werd nageleefd.,BeetleLM/beetlelm_fas-nld_simultaneous,step-10000,nld,7.052967548370361,1156.2849881267932
442,"Groot-Brittannië stelde een blokkade op zee in gericht tegen Duitsland, vlak na het uitbreken van de vijandelijkheden.",BeetleLM/beetlelm_fas-nld_simultaneous,step-10000,nld,6.5667405128479,711.0484086926398
443,"De strategie bleek effectief, want het was niet meer mogelijk om vitale voorzieningen aan militairen en burgers te leveren. Deze blokkade schond echter wel de algemeen aanvaarde internationale wet die in de afgelopen twee eeuwen werd vastgelegd in verschillende internationale overeenkomsten.",BeetleLM/beetlelm_fas-nld_simultaneous,step-10000,nld,6.610386371612549,742.7699485050475
444,"Groot-Brittannië heeft mijnen geplaatst in internationale wateren, zodat er in hele delen van de oceaan geen schepen meer konden varen, wat zelfs voor neutrale schepen gevaarlijk was.",BeetleLM/beetlelm_fas-nld_simultaneous,step-10000,nld,6.474024295806885,648.0865782298607
445,"Vanwege de beperkte reactie op deze tactiek, verwachtte Duitsland dat er een vergelijkbare reactie zou komen op de ongeremde onderzeese oorlogsvoering van het land.",BeetleLM/beetlelm_fas-nld_simultaneous,step-10000,nld,6.498225688934326,663.9625112583678
446,Tijdens de jaren 20 hadden de meeste burgers en naties een houding van pacifisme en isolement.,BeetleLM/beetlelm_fas-nld_simultaneous,step-10000,nld,6.472349643707275,647.0021669401533
447,Na de Eerste Wereldoorlog wilden staten voorkomen dat er ooit nog zulke verschrikkingen zouden plaatsvinden.,BeetleLM/beetlelm_fas-nld_simultaneous,step-10000,nld,7.3986945152282715,1633.8500707256749
448,Tesla emigreerde in 1884 naar de Verenigde Staten van Amerika om te gaan werken bij de Edison Company in New York City.,BeetleLM/beetlelm_fas-nld_simultaneous,step-10000,nld,6.124819755554199,457.0623228988414
449,"Toen hij naar de Verenigde Staten kwam, had hij alleen 4 cent, een dichtbundel en een aanbevelingsbrief van Charles Batchelor (zijn vorige baas) voor Thomas Edison bij zich.",BeetleLM/beetlelm_fas-nld_simultaneous,step-10000,nld,6.6302924156188965,757.7037026476714
450,Het oude China had een unieke manier om verschillende tijdsperiodes weer te geven; iedere fase van China of iedere regerende familie had een onderscheidende dynastie.,BeetleLM/beetlelm_fas-nld_simultaneous,step-10000,nld,7.368668079376221,1585.520588481916
451,"Ook tussen de verschillende dynastieën was er een onstabiele periode waarin de provincies verdeeld waren. De bekendste was het tijdperk van de Drie Koninkrijken, dit heeft plaatsgevonden in de 60 jaar tussen de Han- en de Jin-dynastie in.",BeetleLM/beetlelm_fas-nld_simultaneous,step-10000,nld,6.317992210388184,554.4586378377123
452,Er vonden in die tijd hevige oorlogen plaats tussen verschillende edelen die om de troon vochten.,BeetleLM/beetlelm_fas-nld_simultaneous,step-10000,nld,6.2885589599609375,538.3769470833655
453,In de geschiedenis van het oude China staat het tijdperk van de Drie Koninkrijken als een van de bloederigste te boek. Duizenden mensen stierven in de strijd om de hoogste plek in het grote paleis in Xi'an.,BeetleLM/beetlelm_fas-nld_simultaneous,step-10000,nld,5.939579010009766,379.7750143995641
454,"De Revolutie heeft grote sociale en politieke gevolgen gehad, zoals het gebruik van het metrieke stelsel, een verschuiving van de absolute monarchie naar republicanisme, nationalisme en de opvatting dat het land aan zijn inwoners toebehoort in plaats van een enkele leider.",BeetleLM/beetlelm_fas-nld_simultaneous,step-10000,nld,6.413608551025391,610.0912590791293
455,"Voor alle mannelijke sollicitanten waren na de revolutie functies te verkrijgen, zodat de meest ambitieuze en geschikte kandidaten konden slagen.",BeetleLM/beetlelm_fas-nld_simultaneous,step-10000,nld,7.213865756988525,1358.1323420134875
456,Hetzelfde geldt voor het leger. De legerrangen worden niet meer gebaseerd op iemands klasse maar op het kaliber van de persoon.,BeetleLM/beetlelm_fas-nld_simultaneous,step-10000,nld,6.582581996917725,722.4021634575587
457,De Franse Revolutie inspireerde ook in andere landen de onderdrukte arbeidersklasse tot een revolutie.,BeetleLM/beetlelm_fas-nld_simultaneous,step-10000,nld,6.473991870880127,648.0655644107164
458,Mohammed hield zich intensief bezig met bovenaardse kwesties. Hij ging vaak voor bezinning naar een grot die later bekend werd als de Grot van Hira in het Gebergte van Noer.,BeetleLM/beetlelm_fas-nld_simultaneous,step-10000,nld,6.72006368637085,828.8702975417311
459,"De grot zelf, die de tand des tijds heeft doorstaan, geeft een zeer levendig beeld van de spiritualiteit van Mohammed.",BeetleLM/beetlelm_fas-nld_simultaneous,step-10000,nld,6.946595191955566,1039.6040432079476
460,De grot bevindt zich op een van bergtoppen aan de noordzijde van Mekka en is compleet afgesloten van de rest van de wereld.,BeetleLM/beetlelm_fas-nld_simultaneous,step-10000,nld,5.9926042556762695,400.45614331316114
461,"Zelfs als bekend was dat de grot bestond, was deze helemaal niet makkelijk te vinden. Eenmaal binnen in de grot heerst totale isolatie.",BeetleLM/beetlelm_fas-nld_simultaneous,step-10000,nld,6.102240085601807,446.8576491429611
462,"Het enige wat te zien is, zijn de heldere, prachtige lucht en de vele omringende bergen. Er is vanuit de grot heel weinig van deze wereld te zien of te horen.",BeetleLM/beetlelm_fas-nld_simultaneous,step-10000,nld,5.518156051635742,249.17514720820373
463,De Grote Piramide van Gizeh staat als enige van de zeven wereldwonderen nog overeind.,BeetleLM/beetlelm_fas-nld_simultaneous,step-10000,nld,7.798925399780273,2437.9807148600953
464,De Grote Piramide is in de derde eeuw voor Christus door de Egyptenaren gebouwd en behoort tot de talloze grote piramidestructuren ter ere van een overleden farao.,BeetleLM/beetlelm_fas-nld_simultaneous,step-10000,nld,6.948143005371094,1041.2144022390191
465,"Het Plateau van Gizeh of 'piramides van Gizeh' in de Egyptische vallei van de doden bevat verschillende piramides (waarvan de Grote Piramide de grootste is), meerdere kleine tombes, een aantal tempels en de grote sfinx.",BeetleLM/beetlelm_fas-nld_simultaneous,step-10000,nld,7.96484899520874,2877.9945541425395
466,"De grote piramide werd gebouwd om farao Khufu te eren. Veel van de kleinere piramides, tombes en tempels werden gebouwd als eerbetoon aan de vrouwen en familieleden van Khufu.",BeetleLM/beetlelm_fas-nld_simultaneous,step-10000,nld,7.120065212249756,1236.5310678092565
467,Het up-bow teken ziet eruit als een V en het down-bow teken ziet eruit als een nietje of een vierkantje waarvan de onderkant ontbreekt.,BeetleLM/beetlelm_fas-nld_simultaneous,step-10000,nld,6.904654026031494,996.9035509669513
468,Boven betekent dat je bij de punt moet beginnen en de strijkstok moet wegduwen. Onder betekent dat je bij de boogkikker moet beginnen (de plek waar je hand de strijkstok vasthoudt) en de strijkstok moet aantrekken.,BeetleLM/beetlelm_fas-nld_simultaneous,step-10000,nld,6.201589584350586,493.5329301215508
469,"Een opwaartse beweging geeft meestal een zachter geluid, terwijl een neerwaartse beweging juist een sterker en assertiever geluid produceert.",BeetleLM/beetlelm_fas-nld_simultaneous,step-10000,nld,7.253172397613525,1412.5790098221833
470,"Neem de vrijheid om je persoonlijke tekens te schetsen, maar vergeet daarbij niet dat de gedrukte strijktekens er om een muzikale reden zijn, waardoor ze dus meestal moeten worden gerespecteerd.",BeetleLM/beetlelm_fas-nld_simultaneous,step-10000,nld,6.84266996383667,936.9875207406602
471,"Een groep marktvrouwen zat op 6 oktober 1789 achter het vertrek van de doodsbange Louis XVI, Marie Antoinette en hun twee jonge kinderen (Marie Therese van 11 en Louis-Charles van 4), en de zus van de koning, Madame Elizabeth, uit Versailles naar Parijs.",BeetleLM/beetlelm_fas-nld_simultaneous,step-10000,nld,7.265654563903809,1430.321558277625
472,"Zij reden terug naar de Franse hoofdstad in een rijtuig, omgeven door joelende en dreigende meutes die het Koningspaar bedreigden.",BeetleLM/beetlelm_fas-nld_simultaneous,step-10000,nld,7.5716376304626465,1942.3184784008797
473,Door de acties van de menigte mensen werden de koning en koningin gedwongen om de ramen van hun koets helemaal te openen.,BeetleLM/beetlelm_fas-nld_simultaneous,step-10000,nld,5.61539888381958,274.62289998218284
474,Op een gegeven moment hield iemand in de menigte het hoofd van een koninklijke wacht die vermoord was in Versailles omhoog voor de ogen van een doodsbange koningin.,BeetleLM/beetlelm_fas-nld_simultaneous,step-10000,nld,6.86343240737915,956.6450340887907
475,De oorlogskosten van het imperialisme van de V.S. met betrekking tot de verovering van de Filippijnen zijn betaald door de bevolking van de Filippijnen.,BeetleLM/beetlelm_fas-nld_simultaneous,step-10000,nld,5.9533538818359375,385.0425631586221
476,Ze werden opgelegd aan het Amerikaanse koloniale regime belasting te betalen om een groot deel van de kosten te financieren en de rente op obligaties werd via de banken op Wall Street uitgegeven in de naam van de Filipijnse overheid.,BeetleLM/beetlelm_fas-nld_simultaneous,step-10000,nld,6.245986461639404,515.9379269513342
477,Het Amerikaanse imperialisme rustte voor een groot deel op de enorme winst van de langdurige uitbuiting van de Filipijnen.,BeetleLM/beetlelm_fas-nld_simultaneous,step-10000,nld,6.626535415649414,754.8623506817231
478,Om de Tempeliers te begrijpen moet men weten wat de context was die de aanzet gaf tot het ontstaan van de orde.,BeetleLM/beetlelm_fas-nld_simultaneous,step-10000,nld,6.5429158210754395,694.3081076079833
479,"Het tijdperk waarin dit gebeurd is, wordt algemeen aangeduid als de Hoge Middeleeuwen, de Europese geschiedenis in de 11e, 12e en 13e eeuw (1000-1300 n.Chr.).",BeetleLM/beetlelm_fas-nld_simultaneous,step-10000,nld,6.306707382202148,548.2368393641625
480,"Na de vroege middeleeuwen kwamen de hoge middeleeuwen. Deze werden weer opgevolgd door de late middeleeuwen, die gebruikelijk rond 1500 eindigen.",BeetleLM/beetlelm_fas-nld_simultaneous,step-10000,nld,5.994240760803223,401.1120283780689
481,Technologisch determinisme is een term voor een groot assortiment ideeën in de praktijk: van technologieaanbod of de technologische verplichting tot een strikt gevoel dat het menselijke lot wordt gedreven door een onderliggende logica die is gekoppeld aan wetenschappelijke wetten en de verschijning daarvan in technologie.,BeetleLM/beetlelm_fas-nld_simultaneous,step-10000,nld,7.537600994110107,1877.3209147024045
482,"De meeste interpretaties van technologisch determinisme hebben deze twee algemene opvattingen: de ontwikkeling van de technologie volgt een traject dat voor het grootste deel verder reikt dan culturele of politieke invloed, en dat technologie op zijn beurt 'effecten' heeft op samenlevingen die inherent zijn in plaats van die sociaal geconditioneerd zijn.",BeetleLM/beetlelm_fas-nld_simultaneous,step-10000,nld,7.330705165863037,1526.4577984882524
483,Zo zullen sommigen bijvoorbeeld zeggen dat de komst van de auto automatisch leidt tot de aanleg van wegen.,BeetleLM/beetlelm_fas-nld_simultaneous,step-10000,nld,6.351047039031982,573.0924451443121
484,"Een landelijk wegennetwerk is echter economisch niet haalbaar voor maar een paar auto's. Daarom worden nieuwe productiemethoden ontwikkeld, zodat de kosten van autobezit kunnen worden verlaagd.",BeetleLM/beetlelm_fas-nld_simultaneous,step-10000,nld,6.463303565979004,641.1757279896086
485,Het massale autobezit zorgt ook voor een groter aantal ongevallen op de weg en dit leidt tot de ontwikkeling van nieuwe technieken op het gebied van gezondheidszorg om het menselijk lichaam te kunnen herstellen.,BeetleLM/beetlelm_fas-nld_simultaneous,step-10000,nld,6.5820794105529785,722.0391852019433
486,"In de romantiek was een groot onderdeel van cultureel determinisme opgenomen, dat was afkomstig van schrijvers zoals Goethe, Fichte en Schlegel.",BeetleLM/beetlelm_fas-nld_simultaneous,step-10000,nld,6.989566802978516,1085.2512467346276
487,In de Romantiek vormde de geografie het individu en na verloop van tijd ontstonden er gewoonten en culturen naar aanleiding van deze geografie. Deze vormden een harmonieuze samenleving en waren beter dan de arbitraire opgelegde wetten.,BeetleLM/beetlelm_fas-nld_simultaneous,step-10000,nld,6.893509864807129,985.8555716405293
488,"Constantinopel werd als modehoofdstad van het feodale Europa gezien, zoals Parijs de huidige modehoofdstad is.",BeetleLM/beetlelm_fas-nld_simultaneous,step-10000,nld,7.072659969329834,1179.2807165199097
489,Het stond vanaf ongeveer 400 na Christus tot ongeveer 1100 na Christus bekend als een epicentrum van luxe.,BeetleLM/beetlelm_fas-nld_simultaneous,step-10000,nld,6.831659317016602,926.7272717217598
490,"De status van het rijk nam in de 12e eeuw af, voornamelijk doordat de kruisvaarders terugkwamen met zijde en specerijen die meer waard waren dan wat de Byzantijnse markten konden bieden.",BeetleLM/beetlelm_fas-nld_simultaneous,step-10000,nld,6.655080795288086,776.7206759223855
491,Rond deze tijd nam Parijs ook de titel van modehoofdstad over van Constantinopel.,BeetleLM/beetlelm_fas-nld_simultaneous,step-10000,nld,6.754614353179932,858.0087977128142
492,"De gotiek vierde zijn hoogtijdagen in de 10e, 11e en 14e eeuw.",BeetleLM/beetlelm_fas-nld_simultaneous,step-10000,nld,6.635567665100098,761.7113400617699
493,Kleding was in het begin sterk beïnvloed door de Byzantijnse cultuur uit het oosten.,BeetleLM/beetlelm_fas-nld_simultaneous,step-10000,nld,5.676464080810547,291.91541358818233
494,Vanwege de langzame communicatiekanalen liepen stijlen in het westen echter met 25 tot 30 jaar achter.,BeetleLM/beetlelm_fas-nld_simultaneous,step-10000,nld,7.224797248840332,1373.0601978579716
495,Aan het einde van de middeleeuwen begon er in West-Europa een eigen stijl te ontplooien. Een van de grootste ontwikkelingen was het resultaat van de kruistochten: mensen begonnen knopen te gebruiken om hun kleding te bevestigen.,BeetleLM/beetlelm_fas-nld_simultaneous,step-10000,nld,5.633591651916504,279.6647744812361
496,Zelfvoorzienende landbouw is landbouw waarbij voldoende voedsel wordt geproduceerd om aan de behoeften van de boer en zijn gezin te voldoen.,BeetleLM/beetlelm_fas-nld_simultaneous,step-10000,nld,6.498558521270752,664.183536232378
497,"Landbouw met als doel levensonderhoud is een simpel systeem dat meestal biologisch is. Hierbij wordt opgeslagen zaad gebruikt dat afkomstig is uit de ecoregio, en dat wordt gecombineerd met wisselende gewassen of andere relatief eenvoudige technieken om de opbrengst te optimaal te maken.",BeetleLM/beetlelm_fas-nld_simultaneous,step-10000,nld,7.172652244567871,1303.2966844496764
498,Vroeger werkten de meeste boeren in de zelfvoorzienende landbouw. In veel ontwikkelingslanden is dit nog steeds het geval.,BeetleLM/beetlelm_fas-nld_simultaneous,step-10000,nld,5.888097286224365,360.7182873457392
499,Subculturen zorgen ervoor dat gelijkgestemde personen die zich verwaarloosd voelen door maatschappelijke normen worden samengebracht. Hierdoor krijgen ze de mogelijkheid een gevoel van identiteit te ontwikkelen.,BeetleLM/beetlelm_fas-nld_simultaneous,step-10000,nld,7.330716609954834,1526.4752675113807
500,"Subculturen kunnen zich onderscheiden door middel van de leeftijd, etniciteit, sociale klasse, locatie en/of geslacht van hun leden.",BeetleLM/beetlelm_fas-nld_simultaneous,step-10000,nld,6.9917449951171875,1087.6177088376794
501,"Een subcultuur kan worden bepaald door de volgende soorten kwaliteiten: taalkundig, esthetisch, religieus, politiek, seksueel, geografisch of een of meer van deze factoren samen.",BeetleLM/beetlelm_fas-nld_simultaneous,step-10000,nld,6.371149063110352,584.7293339237315
502,"Leden van een subcultuur laten vaak zien tot welke groep ze behoren door middel van een bepaalde symbolische stijl in wat ze dragen, in hoe ze zich gedragen en het jargon dat ze spreken.",BeetleLM/beetlelm_fas-nld_simultaneous,step-10000,nld,6.719970703125,828.7932300741245
503,"Een van de meest gebruikte methoden voor het illustreren van het belang van de vermaatschappelijking waren de paar betreurenswaardige gevallen van kinderen die door verwaarlozing, tegenslagen of moedwillig misbruik tijdens het opgroeien niet werden gesocialiseerd door volwassenen.",BeetleLM/beetlelm_fas-nld_simultaneous,step-10000,nld,7.344366550445557,1547.4544204310876
504,"Ze worden 'wolfskinderen' of 'wilde kinderen' genoemd. Sommige wolfskinderen zijn door mensen (meestal hun eigen ouders) opgesloten geweest; soms werd dit kind in de steek gelaten, omdat de ouders de ernstige verstandelijke of lichamelijke beperking van het kind niet wilden accepteren.",BeetleLM/beetlelm_fas-nld_simultaneous,step-10000,nld,6.465419292449951,642.533716509411
505,Onhandelbare kinderen hebben mogelijk ernstige kindermishandeling of een ernstig trauma meegemaakt voordat ze werden verlaten of voordat ze wegliepen.,BeetleLM/beetlelm_fas-nld_simultaneous,step-10000,nld,7.924290180206299,2763.601999718632
506,"Van anderen wordt beweerd dat zij zijn grootgebracht door dieren, en van sommigen wordt gezegd dat zij alleen in de wildernis hebben gewoond.",BeetleLM/beetlelm_fas-nld_simultaneous,step-10000,nld,6.670377731323242,788.6934624291448
507,"Een verwilderd kind dat niet is grootgebracht door mensen, kan gedrag vertonen dat lijkt op het gedrag van het dier dat het kind verzorgd heeft (binnen de fysieke limieten), zoals angst voor of onverschilligheid richting mensen.",BeetleLM/beetlelm_fas-nld_simultaneous,step-10000,nld,7.359336853027344,1570.794549841592
508,"Leren op projectbasis moet educatie vereenvoudigen en interessanter maken, maar scaffolding gaat nog een stapje verder.",BeetleLM/beetlelm_fas-nld_simultaneous,step-10000,nld,7.278416633605957,1448.6923973268824
509,"Scaffolding is geen leermethode maar een hulpmiddel om individuen te ondersteunen die te maken hebben met een nieuwe leerervaring, bijvoorbeeld een nieuw computerprogramma of die aan een nieuw project beginnen.",BeetleLM/beetlelm_fas-nld_simultaneous,step-10000,nld,6.344595909118652,569.4072509421904
510,"Ondersteuning kan zowel virtueel als echt zijn. Een docent is bijvoorbeeld een vorm van ondersteuning, maar het paperclipmannetje van Microsoft Office is dat ook.",BeetleLM/beetlelm_fas-nld_simultaneous,step-10000,nld,7.014377593994141,1112.5139952865716
511,"Er is sprake van virtuele scaffolding die is ingebouwd in de software die vragen stelt, geheugensteuntjes biedt en procedures verklaart die mogelijk zonder hulp moeilijk te begrijpen kunnen zijn voor studenten.",BeetleLM/beetlelm_fas-nld_simultaneous,step-10000,nld,7.373253345489502,1592.807315332299
512,"Er zijn verschillende redenen dat kinderen in de pleegzorg terechtkomen, zoals verwaarlozing, misbruik en uitbuiting.",BeetleLM/beetlelm_fas-nld_simultaneous,step-10000,nld,6.410282135009766,608.0652133476104
513,"Geen enkel kind zou moeten opgroeien in een omgeving waar ze niet goed worden verzorgd, waar men niet om ze geeft en waar ze zich niet kunnen ontwikkelen, maar toch gebeurt dit.",BeetleLM/beetlelm_fas-nld_simultaneous,step-10000,nld,5.6463446617126465,283.2541813119951
514,Het pleegzorgsysteem beschouwen wij als een veilige zone voor deze kinderen.,BeetleLM/beetlelm_fas-nld_simultaneous,step-10000,nld,7.561958312988281,1923.608855476054
515,"Het is de bedoeling dat de pleegzorg zorgt voor een veilig thuis, liefhebbende verzorgers, stabiel onderwijs en betrouwbare gezondheidszorg.",BeetleLM/beetlelm_fas-nld_simultaneous,step-10000,nld,6.516942024230957,676.5064786145289
516,In de pleegzorg moet aan alle behoeften worden voldoen die werden verwaarloosd in het eerdere thuis.,BeetleLM/beetlelm_fas-nld_simultaneous,step-10000,nld,6.953526973724365,1046.8353856500428
517,Op internet worden onderdelen van interpersoonlijke en massacommunicatie samengevoegd.,BeetleLM/beetlelm_fas-nld_simultaneous,step-10000,nld,7.354104518890381,1562.5970925162267
518,De verschillende karakters van het internet leiden tot nieuwe dimensies wat betreft de toepassing van de Uses & Gratifications-theorie.,BeetleLM/beetlelm_fas-nld_simultaneous,step-10000,nld,7.754218578338623,2331.3868366097913
519,"'Leren' en 'socialisatie' worden bijvoorbeeld voorgesteld als belangrijke redenen om het internet te gebruiken (James et al., 1995).",BeetleLM/beetlelm_fas-nld_simultaneous,step-10000,nld,6.675758361816406,792.9485678319343
520,Eighmey en McCord (1998) introduceerden nieuwe motivatieaspecten als 'persoonlijke betrokkenheid' en 'aanhoudende relaties' toen zij reacties van het publiek op websites onderzochten.,BeetleLM/beetlelm_fas-nld_simultaneous,step-10000,nld,7.370965480804443,1589.1673531836032
521,"Dat er video-opnames worden gebruikt, leidde tot opmerkelijke vondsten in het interpreteren van micro-expressies, dat zijn gezichtsbewegingen die een paar milliseconden duren.",BeetleLM/beetlelm_fas-nld_simultaneous,step-10000,nld,7.511580944061279,1829.1029676794765
522,Er wordt met name gesteld dat niemand een leugen kan herkennen door op enkel op micro-expressies te letten.,BeetleLM/beetlelm_fas-nld_simultaneous,step-10000,nld,7.2791547775268555,1449.7621355750423
523,"Oliver Sacks beschreef in zijn essay The President's Speech hoe het kan dat mensen die spraak niet kunnen begrijpen vanwege hersenbeschadiging, de oprechtheid ervan toch nauwkeurig kunnen inschatten.",BeetleLM/beetlelm_fas-nld_simultaneous,step-10000,nld,7.256951332092285,1417.927152121597
524,"Hij suggereerde zelfs dat andere diersoorten, zoals huishonden, ook over het vermogen om het gedrag van mensen te interpreteren beschikken.",BeetleLM/beetlelm_fas-nld_simultaneous,step-10000,nld,7.241293430328369,1395.8983009250337
525,Uit onderzoek in de twintigste eeuw is gebleken dat er twee groepen genetische varianten bestaan: verborgen en zichtbaar.,BeetleLM/beetlelm_fas-nld_simultaneous,step-10000,nld,7.3784308433532715,1601.0754574790024
526,Door mutatie wordt er nieuwe genetische variatie toegevoegd; door selectie wordt deze variatie geëlimineerd uit de pool van uitgedrukte variatie.,BeetleLM/beetlelm_fas-nld_simultaneous,step-10000,nld,8.256136894226074,3851.187780921498
527,Voor elke generatie wordt er door middel van scheiding en hercombinatie gevarieerd tussen de twee groepen.,BeetleLM/beetlelm_fas-nld_simultaneous,step-10000,nld,6.9231858253479,1015.5502119558746
