sentence_id,sentence,repo,revision,iso_code,nll,ppl
422,"""Aufgrund des Clusters/Gruppe von Inseln wurde Japan, wird Japan geografisch häufig als """"Archipel"""" bezeichnet.""",BeetleLM/beetlelm_eng-deu_heritage,step-8000,deu,6.751722812652588,855.5314139552967
423,"Der Beginn Taiwans geht auf das 15. Jahrhundert zurück, als europäische Seefahrer dort vorbeifuhren und den Namen der Insel als Ilha Formosa bzw. schöne Insel dokumentierten.",BeetleLM/beetlelm_eng-deu_heritage,step-8000,deu,7.036118030548096,1136.9653638663917
424,"1624 gründet die Niederländische Ostindien-Kompanie eine Niederlassung im Südwesten Taiwans, leitet damit einen Wandel in den Getreideanbaumethoden der Ureinwohner ein und beschäftigt chinesische Arbeiter auf ihren Reis- und Zuckerplantagen.",BeetleLM/beetlelm_eng-deu_heritage,step-8000,deu,7.024604320526123,1123.9497471648838
425,Im Jahr 1683 übernehmen Streitkräfte der Qing-Dynastie (1644-1912) die Kontrolle über Taiwans westliche und nördliche Küstenregionen und erklärten im Jahr 1885 Taiwan zur Provinz des Qing-Reiches.,BeetleLM/beetlelm_eng-deu_heritage,step-8000,deu,5.407995700836182,223.1838119645021
426,"1895 unterzeichnete die Regierung der Qing-Dynastie nach der Niederlage im ersten Chinesisch-Japanischen Krieg (1894-1895) den Vertrag von Shimonoseki, in dem sie die Souveränität über Taiwan an Japan abtrat, welches die Insel bis 1945 regierte.",BeetleLM/beetlelm_eng-deu_heritage,step-8000,deu,6.035611152648926,418.05422652896283
427,"Machu Picchu besteht hauptsächlich aus drei Bauwerken, nämlich den Intihuatana, dem Sonnentempel und dem Raum der drei Fenster.",BeetleLM/beetlelm_eng-deu_heritage,step-8000,deu,6.961397171020508,1055.1066923859585
428,"Die meisten Gebäude an den Rändern des Komplexes wurden wieder aufgebaut, um den Touristen einen besseren Eindruck davon zu vermitteln, wie sie ursprünglich aussahen.",BeetleLM/beetlelm_eng-deu_heritage,step-8000,deu,6.574187755584717,716.3635257077868
429,"Bis 1976 wurden dreißig Prozent von Machu Picchu restauriert, und die Restaurierungsarbeiten dauern bis heute an.",BeetleLM/beetlelm_eng-deu_heritage,step-8000,deu,7.228916645050049,1378.7280428673614
430,"Zum Beispiel ist das weltweit am weitesten verbreitete Standbildformat 35 mm, was der vorherrschenden Filmgröße am Ende der Analogfilmära entspricht.",BeetleLM/beetlelm_eng-deu_heritage,step-8000,deu,7.390533447265625,1620.5703712283723
431,"Es wird auch heute noch hergestellt, aber noch wichtiger ist, dass sein Bildformat von den Bildsensorformaten digitaler Kameras übernommen wurde.",BeetleLM/beetlelm_eng-deu_heritage,step-8000,deu,6.346874713897705,570.706298482579
432,Genau genommen misst das sogenannte 35-mm-Format verwirrenderweise 36 mm in der Breite und 24 mm in der Höhe.,BeetleLM/beetlelm_eng-deu_heritage,step-8000,deu,7.450948238372803,1721.494759063435
433,"Das Seitenverhältnis dieses Formats (geteilt durch zwölf, um das einfachste ganzzahlige Verhältnis zu erhalten) wird daher als 3:2 bezeichnet.",BeetleLM/beetlelm_eng-deu_heritage,step-8000,deu,7.837298393249512,2533.3514610276284
434,"Viele übliche Formate (die APS-Formatfamilie, zum Beispiel) haben genau dasselbe oder ein sehr ähnliches Seitenverhältnis.",BeetleLM/beetlelm_eng-deu_heritage,step-8000,deu,6.90864372253418,1000.8888383349207
435,"Die vielgeschmähte und oft verspottete Drittel-Regel ist eine einfache Richtlinie, die Dynamik schafft und gleichzeitig ein Maß an Ordnung in einem Bild bewahrt.",BeetleLM/beetlelm_eng-deu_heritage,step-8000,deu,7.083108425140381,1191.6669749274956
436,"Sie besagt, dass der Kreuzungspunkt der Linien, die ein Bild vertikal und horizontal dritteln, der effektivste Platz für das Hauptmotiv ist (siehe Beispiel).",BeetleLM/beetlelm_eng-deu_heritage,step-8000,deu,6.940170764923096,1032.9465909457192
437,In dieser Periode der europäischen Geschichte stand die reich und mächtig gewordene katholische Kirche auf dem Prüfstand.,BeetleLM/beetlelm_eng-deu_heritage,step-8000,deu,6.615008354187012,746.210964295597
438,Seit über eintausend Jahren hatte die christliche Religion die europäischen Staaten trotz unterschiedlicher Sprachen und Gebräuche zusammengehalten.,BeetleLM/beetlelm_eng-deu_heritage,step-8000,deu,6.909048557281494,1001.2941149443697
439,"Seine Allmacht beherrschte jeden, vom König bis zum einfachen Bürger.",BeetleLM/beetlelm_eng-deu_heritage,step-8000,deu,7.714042663574219,2239.5778417300126
440,"Einer der wichtigen christlichen Glaubenssätze besagt, dass Vermögen zur Linderung von Leid und Armut eingesetzt werden soll und dass es die Geldmittel der Kirchen genau aus diesem Grund gibt.",BeetleLM/beetlelm_eng-deu_heritage,step-8000,deu,6.618082046508789,748.508115766854
441,"Die Zentralgewalt der Kirche war seit mehr als tausend Jahren in Rom. Diese Konzentration von Macht und Geld veranlasste viele zu zweifeln, ob diesem Grundsatz entsprochen wurde.",BeetleLM/beetlelm_eng-deu_heritage,step-8000,deu,7.204957008361816,1346.0868173192632
442,Bald nach dem Ausbruch von Kampfhandlungen initiierte Großbritannien eine Seeblockade gegen Deutschland.,BeetleLM/beetlelm_eng-deu_heritage,step-8000,deu,6.740391254425049,845.8916299582565
443,"Die Strategie erwies sich als effektiv, da sie das Land von lebenswichtigen militärischen und zivilen Lieferungen abschnitt, obwohl diese Blockade gegen das allgemein anerkannte Völkerrecht verstieß, das durch mehrere internationale Abkommen der letzten zwei Jahrhunderte kodifiziert worden war.",BeetleLM/beetlelm_eng-deu_heritage,step-8000,deu,7.084659576416016,1193.5168650345722
444,"Großbritannien verminte internationale Gewässer, um zu verhindern, dass Schiffe in ganze Meeresabschnitte vordringen konnten, was selbst für neutrale Schiffe eine Gefahr darstellte.",BeetleLM/beetlelm_eng-deu_heritage,step-8000,deu,6.957650661468506,1051.161120760557
445,"Da die Reaktion auf diese Taktik begrenzt war, erwartete Deutschland eine ähnliche Reaktion auf seine uneingeschränkte U-Boot-Kriegsführung.",BeetleLM/beetlelm_eng-deu_heritage,step-8000,deu,7.823231220245361,2497.9638531020078
446,In den 1920er-Jahren waren Pazifismus und Isolation die vorherrschenden Einstellungen der meisten Bürger und Länder.,BeetleLM/beetlelm_eng-deu_heritage,step-8000,deu,7.1090850830078125,1223.0280648951486
447,Nach dem Erlebnis der Schrecken und Gräueltaten im Ersten Weltkrieg wollten die Nationen eine weitere solche Situation in der Zukunft vermeiden.,BeetleLM/beetlelm_eng-deu_heritage,step-8000,deu,6.346720218658447,570.6181338871294
448,"1884 zog Tesla in die Vereinigten Staaten von Amerika um, um eine Stelle bei der Edison Company in New York City anzutreten.",BeetleLM/beetlelm_eng-deu_heritage,step-8000,deu,5.308877944946289,202.1233076243679
449,"Er kam in die USA mit 4 Cent in seinem Besitz, einem Buch mit Gedichten und einem Empfehlungsschreiben von Charles Batchelor (seinem Vorgesetzten bei seiner vorherigen Arbeitsstelle) an Thomas Edison.",BeetleLM/beetlelm_eng-deu_heritage,step-8000,deu,6.92303466796875,1015.3967156487818
450,"Das alte China hatte eine einzigartige Methode, verschiedene Zeitalter anzuzeigen. Jede Zeitspanne in China und jede Familie, die an der Macht war, war eine eigene Dynastie.",BeetleLM/beetlelm_eng-deu_heritage,step-8000,deu,5.8907246589660645,361.6672748674052
451,"Zwischen den einzelnen Dynastien herrschten auch unbeständige Zeiten geteilter Provinzen. Die bekannteste dieser Perioden war die Epoche der Drei Königreiche, die 60 Jahre lang zwischen der Han- und der Jin-Dynastie stattfand.",BeetleLM/beetlelm_eng-deu_heritage,step-8000,deu,6.3676981925964355,582.7149863320159
452,"In diesen Zeiten tobten erbitterte Kriege unter vielen Adligen, die um den Thron kämpften.",BeetleLM/beetlelm_eng-deu_heritage,step-8000,deu,6.955820560455322,1049.2391489661313
453,Die Zeit der drei Königreiche war eine der blutigsten Epochen in der Geschichte des alten China. Tausende von Menschen starben im Kampf um den höchsten Thron im großen Palast von Xi'an.,BeetleLM/beetlelm_eng-deu_heritage,step-8000,deu,6.001567840576172,404.06180162301723
454,"Es gibt eine Menge sozialer und politischer Effekte wie die Nutzung des metrischen Systems, eine Abwendung vom Absolutismus hin zum Republikanismus und Nationalismus sowie der Glaube, dass das Land dem Volk gehört und nicht einem Herrscher allein.",BeetleLM/beetlelm_eng-deu_heritage,step-8000,deu,6.146960258483887,467.29477037099167
455,"Auch standen nach der Revolution alle Berufe allen männlichen Bewerbern offen, so dass die Ehrgeizigsten und Besten reüssieren konnten.",BeetleLM/beetlelm_eng-deu_heritage,step-8000,deu,7.022502422332764,1121.5898002747924
456,"Dasselbe gilt für das Militär, denn statt auf Klassenzugehörigkeit basierten die Armee-Ranglisten nun auf dem Kaliber.",BeetleLM/beetlelm_eng-deu_heritage,step-8000,deu,7.187129497528076,1322.3020812559528
457,"Die Französische Revolution inspirierte auch viele unterdrückte Menschen der Arbeiterschicht in anderen Ländern dazu, ihre eigenen Revolutionen zu starten.",BeetleLM/beetlelm_eng-deu_heritage,step-8000,deu,6.924942493438721,1017.3357644602306
458,"Mohammed war sehr stark an Dingen interessiert, die über dieses Alltagsleben hinausgingen. Er besuchte oft eine Höhle, die als „Hira“ auf dem Berg von „Nur“ (Licht) bekannt wurde, um zu meditieren.",BeetleLM/beetlelm_eng-deu_heritage,step-8000,deu,6.142410755157471,465.17363996228886
459,Die Höhle selbst hat die Zeiten überdauert und bietet ein lebhaftes Bild von Mohammeds spirituellen Neigungen.,BeetleLM/beetlelm_eng-deu_heritage,step-8000,deu,7.534195423126221,1870.9384392231145
460,Die Höhle befindet sich auf der Spitze eines der Berge nördlich von Mekka und ist vom Rest der Welt völlig isoliert.,BeetleLM/beetlelm_eng-deu_heritage,step-8000,deu,5.87912130355835,357.4949740945113
461,"Tatsächlich ist sie ganz und gar nicht einfach zu finden, auch wenn man weiß, dass sie existiert. Sobald man sich in der Höhle befindet, ist man vollkommen isoliert.",BeetleLM/beetlelm_eng-deu_heritage,step-8000,deu,4.971163749694824,144.19459618375632
462,"Man sieht nichts außer dem darüber liegenden, klaren, wunderschönen Himmel und den zahlreichen umliegenden Bergen. Vom Innern der Höhle aus ist sehr wenig von dieser Welt zu sehen oder zu hören.",BeetleLM/beetlelm_eng-deu_heritage,step-8000,deu,7.050791263580322,1153.771318916324
463,"Die Cheopspyramide ist das einzige der sieben Weltwunder, welches heute noch steht.",BeetleLM/beetlelm_eng-deu_heritage,step-8000,deu,6.746499538421631,851.0743890319861
464,"Im dritten Jahrhundert v. Chr. von den Ägyptern erbaut, ist die Cheops-Pyramide eine von vielen großen Pyramidenstrukturen, die zur Verehrung verstorbener Pharaonen erbaut wurden.",BeetleLM/beetlelm_eng-deu_heritage,step-8000,deu,6.419419765472412,613.6469516575628
465,"Das Gizeh-Plateau beziehungsweise die „Gizeh-Nekropole“ im ägyptischen Tal der Toten umfasst mehrere Pyramiden (von denen die Große Pyramide die größte ist), mehrere kleine Gräber, mehrere Tempel sowie die große Sphinx.",BeetleLM/beetlelm_eng-deu_heritage,step-8000,deu,7.104168891906738,1217.0301806589023
466,"Die große Pyramide wurde dem Pharao Cheops zu Ehren erbaut und viele der kleineren Pyramiden, Grabmale und Tempel wurden zu Ehren von Cheops Ehefrauen und Familienmitgliedern errichtet.",BeetleLM/beetlelm_eng-deu_heritage,step-8000,deu,7.543832302093506,1889.0556027625994
467,"Das „Aufstrich“-Symbol sieht wie ein V aus und das „Abstrich“-Symbol wie eine Klammer bzw. ein Quadrat, bei dem der untere Strich fehlt.",BeetleLM/beetlelm_eng-deu_heritage,step-8000,deu,7.2305731773376465,1381.0138431144385
468,"Aufwärts bedeutet, dass Sie an der Spitze anfangen und den Bogen schieben sollten. Abwärts bedeutet, dass Sie beim Frosch (das ist dort, wo Ihre Hand den Bogen hält) anfangen und den Bogen ziehen.",BeetleLM/beetlelm_eng-deu_heritage,step-8000,deu,6.0154924392700195,409.72755518423213
469,"Das Aufstreichen generiert üblicherweise einen weicheren Klang, während das Abstreichen kräftiger und ausdrucksstärker ist.",BeetleLM/beetlelm_eng-deu_heritage,step-8000,deu,7.99468994140625,2965.170877797962
470,"Sie können gerne Ihre eigenen Bleistiftmarkierungen hinzufügen; denken Sie aber daran, dass die aufgedruckten Bogenmarkierungen sich dort aus musikalischen Gründen befinden, weshalb sie im Normalfall respektiert werden sollten.",BeetleLM/beetlelm_eng-deu_heritage,step-8000,deu,7.299504280090332,1479.5662952912521
471,"Der in Panik versetzte König Ludwig der XIV., Königin Marie-Antoinette, ihre beiden kleinen Kinder (die 11 Jahre alte Marie-Therese und der 4 Jahre alte Louis-Charles) sowie die Schwester des Königs, Madame Elisabeth wurden am 6. Oktober 1789 in Versailles von einem Mob aus Marktfrauen zur Rückkehr nach Paris gezwungen.",BeetleLM/beetlelm_eng-deu_heritage,step-8000,deu,6.480071067810059,652.0172820650176
472,"Sie reisten in einer Kutsche zurück nach Paris, umgeben von einem schreienden Mob von Menschen, die Drohungen gegen den König und die Königin ausstießen.",BeetleLM/beetlelm_eng-deu_heritage,step-8000,deu,6.320561408996582,555.8849836967746
473,"Der Mob zwang König und Königin dazu, die Fenster ihrer Kutschen weit zu öffnen.",BeetleLM/beetlelm_eng-deu_heritage,step-8000,deu,7.053040504455566,1156.369349230199
474,Irgendwann schwenkte ein Mitglied der aufgebrachten Menge den Kopf einer in Versailles getöteten königlichen Garde vor den Augen der entsetzten Königin.,BeetleLM/beetlelm_eng-deu_heritage,step-8000,deu,7.362905025482178,1576.409427154507
475,Die Kriegsausgaben der US-Imperialisten bei der Eroberung der Philippinen wurden vom philippinischen Volk selbst getragen.,BeetleLM/beetlelm_eng-deu_heritage,step-8000,deu,6.76701545715332,868.715303056212
476,"Sie wurden gezwungen, Steuern an das Kolonialregime der U.S. zu zahlen, um das Gros der Ausgaben zu decken, und die Zinsen aus Anleihen flossen im Namen der philippinischen Regierung durch die Bankhäuser der Wall Street.",BeetleLM/beetlelm_eng-deu_heritage,step-8000,deu,6.612558364868164,744.38499312176
477,"Natürlich stellten die Superprofite, die der andauernden Ausbeutung des philippinischen Volkes entstammten, die grundlegenden Gewinne des US-Imperialismus dar.",BeetleLM/beetlelm_eng-deu_heritage,step-8000,deu,6.7474846839904785,851.9132343196172
478,"Um die Templer zu verstehen, muss man den Kontext verstehen, der zur Gründung des Ordens führte.",BeetleLM/beetlelm_eng-deu_heritage,step-8000,deu,6.338249683380127,565.805106092303
479,"Die Epoche, in der die Ereignisse stattfanden, wird gemeinhin als Hochmittelalter bezeichnet, ein Zeitalter in der europäischen Geschichte, das sich über das 11., 12. und 13 Jahrhundert erstreckt (1000–1300 n. Chr.).",BeetleLM/beetlelm_eng-deu_heritage,step-8000,deu,6.390754699707031,596.3064422083435
480,"Dem Hochmittelalter ging das Frühmittelalter voraus, gefolgt vom Spätmittelalter, das übereinstimmend um 1500 endet.",BeetleLM/beetlelm_eng-deu_heritage,step-8000,deu,7.3179473876953125,1507.107285745448
481,"Technologischer Determinismus ist ein Begriff, der ein breites Spektrum von Ideen in der Praxis umfasst, vom Technologie-Push oder dem technologischen Imperativ bis hin zu dem strengen Sinn, dass das menschliche Schicksal von einer zugrunde liegenden Logik bestimmt wird, die mit wissenschaftlichen Gesetzen und ihrer Manifestation in der Technologie verbunden ist.",BeetleLM/beetlelm_eng-deu_heritage,step-8000,deu,6.7818427085876465,881.6919293912835
482,"Die meisten Interpretationen des technologischen Determinismus teilen zwei allgemeine Vorstellungen. Einerseits, dass die Entwicklung der Technologie selbst einem Weg folgt, der weitgehend jenseits kultureller oder politischer Einflussnahme liegt, und andererseits, dass Technologie ihrerseits „Auswirkungen“ auf Gesellschaften hat, die eher inhärent als sozial bedingt sind.",BeetleLM/beetlelm_eng-deu_heritage,step-8000,deu,7.192809104919434,1329.8336057353674
483,"Man kann etwa behaupten, dass der Personenkraftwagen unumgänglich die Entwicklung von Straßen mit sich bringt.",BeetleLM/beetlelm_eng-deu_heritage,step-8000,deu,7.014832496643066,1113.0201959772826
484,"Allerdings ist ein landesweites Straßennetz für nur eine kleine Anzahl an Autos wirtschaftlich nicht überlebensfähig. Daher werden neue Produktionsmethoden entwickelt, um die Kosten des Autobesitzes zu reduzieren.",BeetleLM/beetlelm_eng-deu_heritage,step-8000,deu,6.912527084350586,1004.7832085624119
485,"Der verbreitete Automobilbesitz führt auch zu einer höheren Anzahl von Unfällen auf den Straßen, was wiederum zur Erfindung von neuen Techniken im Gesundheitswesen zur Reparatur beschädigter Körper führt.",BeetleLM/beetlelm_eng-deu_heritage,step-8000,deu,7.41332483291626,1657.9295318900063
486,"Die Romantik hatte ein starkes, kulturell deterministisches Element, das sich aus Schriftstellern wie Goethe, Fichte und Schlegel schöpfte.",BeetleLM/beetlelm_eng-deu_heritage,step-8000,deu,7.589615821838379,1977.5536348710616
487,"Im Kontext der Romantik, ist es die Geographie, die Individuen formte. Mit der Zeit entstanden Bräuche und Kulturen mit Bezug zu dieser Geographie und diese, da sie in Harmonie mit dem Platz der Gesellschaft standen, waren besser als willkürlich oktroyierte Gesetze.",BeetleLM/beetlelm_eng-deu_heritage,step-8000,deu,6.575660705566406,717.4194708361265
488,"So wie Paris als Modehauptstadt der heutigen Welt bekannt ist, so galt Konstantinopel als die Modehauptstadt des feudalen Europas.",BeetleLM/beetlelm_eng-deu_heritage,step-8000,deu,6.857804298400879,951.2760543570681
489,Sein Ruhm als Epizentrum des Luxus begann ungefähr um 400 n. Chr. und dauerte bis ungefähr 1100 n. Chr. an.,BeetleLM/beetlelm_eng-deu_heritage,step-8000,deu,6.265840530395508,526.2837575988656
490,"Sein Status nahm im Laufe des zwölften Jahrhunderts ab, was vor allem darauf zurückzuführen war, dass die Kreuzritter mit Geschenken wie Seide und Gewürzen zurückgekehrt waren, die als wertvoller als das Angebot der byzantinischen Märkte erachtet wurden.",BeetleLM/beetlelm_eng-deu_heritage,step-8000,deu,6.939408302307129,1032.1593079608954
491,Zu dieser Zeit wanderte auch der Titel der Modehauptstadt der Welt von Konstantinopel nach Paris.,BeetleLM/beetlelm_eng-deu_heritage,step-8000,deu,6.012767791748047,408.61271148406706
492,Der gotische Stil erreichte seinen Höhepunkt in der Zeit zwischen dem 10.-11. und dem 14. Jahrhundert.,BeetleLM/beetlelm_eng-deu_heritage,step-8000,deu,6.7377448081970215,843.655982809628
493,Zu Beginn war die Kleidung stark von der Kultur Byzanz' im Osten geprägt.,BeetleLM/beetlelm_eng-deu_heritage,step-8000,deu,6.790246486663818,889.1326941744061
494,Allerdings hängen die Stile im Westen aufgrund der langsamen Kommunikationskanäle 25 bis 30 Jahre hinterher.,BeetleLM/beetlelm_eng-deu_heritage,step-8000,deu,7.581076622009277,1960.7388039857453
495,"Gegen Ende des Mittelalters begann Westeuropa langsam einen eigenen Stil zu entwickeln. Eine der wichtigsten Entwicklungen der Zeit bestand darin, dass die Menschen als Folge der Kreuzzüge damit begannen, Knöpfe zum Fixieren von Kleidung zu nutzen.",BeetleLM/beetlelm_eng-deu_heritage,step-8000,deu,6.771564960479736,872.676530192744
496,"Bedarfswirtschaft ist Landwirtschaft, die darauf zielt, gerade so viele Nahrungsmittel zu produzieren, dass sie den Bedarf des Landwirts bzw. der Landwirtin und seiner/ihrer Familie deckt.",BeetleLM/beetlelm_eng-deu_heritage,step-8000,deu,7.184497356414795,1318.8261721321633
497,"Die Subsistenzwirtschaft ist eine einfache, oftmals biologische Anbauart, die aufgespartes, in der Ökoregion heimisches Saatgut nutzt und mit Wechselfelderwirtschaft oder anderen relativ einfachen Techniken verbindet, um den Ertrag zu maximieren.",BeetleLM/beetlelm_eng-deu_heritage,step-8000,deu,7.272210597991943,1439.7296011980409
498,In der Vergangenheit betrieben die meisten Bauern Subsistenzwirtschaft und in vielen Entwicklungsländern ist das nach wie vor der Fall.,BeetleLM/beetlelm_eng-deu_heritage,step-8000,deu,7.057575225830078,1161.6250696424117
499,"Subkulturen bringen gleichgesinnte Menschen zusammen, die sich von gesellschaftlichen Normen vernachlässigt fühlen, und ermöglichen es ihnen, ein Identitätsgefühl zu entwickeln.",BeetleLM/beetlelm_eng-deu_heritage,step-8000,deu,7.331501007080078,1527.673100049756
500,"Subkulturen können sich hinsichtlich des Alters, der ethnischen Zugehörigkeit, der Klasse, des Ortes und/oder des Geschlechts der Mitglieder von anderen abgrenzen.",BeetleLM/beetlelm_eng-deu_heritage,step-8000,deu,6.8883490562438965,980.7808658202044
501,"Die Eigenschaften, die eine Subkultur als solche abgrenzen, können sprachlicher, ästhetischer, religiöser, politischer, sexueller oder geographischer Natur oder eine Kombination dieser Faktoren sein.",BeetleLM/beetlelm_eng-deu_heritage,step-8000,deu,7.405013084411621,1644.2063494088572
502,"Die Mitglieder einer Subkultur signalisieren ihre Zugehörigkeit oft durch einen unverwechselbaren und symbolischen Stil, was Mode, Angewohnheiten und Jargon einschließt.",BeetleLM/beetlelm_eng-deu_heritage,step-8000,deu,7.430667400360107,1686.9330574806743
503,"Eine der gängigsten Methoden zur Veranschaulichung der Wichtigkeit der Sozialisierung ist, sich auf die paar unglücklichen Fälle von Kindern zu stützen, die aufgrund von Vernachlässigung, Unglück oder vorsätzlichem Missbrauch während ihrer Kindheit nicht von Erwachsenen sozialisiert worden sind.",BeetleLM/beetlelm_eng-deu_heritage,step-8000,deu,7.214861869812012,1359.485869076272
504,"""Solche Kinder nennt man """"verwildert"""" oder wild. Einige verwilderte Kinder wurden von Menschen gefangen gehalten (für gewöhnlich den eigenen Eltern); in einige Fällen war die Vernachlässigung des Kindes auf die Unfähigkeit der Eltern zurückzuführen, die erheblichen intellektuellen oder körperlichen Einschränkungen des Kindes zu akzeptieren.""",BeetleLM/beetlelm_eng-deu_heritage,step-8000,deu,7.065454959869385,1170.8145239245614
505,"Wolfskinder haben möglicherweise massive Kindesmisshandlungen erlebt oder traumatische Erfahrungen gemacht, bevor sie ausgesetzt wurden oder weggelaufen sind.",BeetleLM/beetlelm_eng-deu_heritage,step-8000,deu,8.342214584350586,4197.374897051172
506,Andere sollen von Tieren aufgezogen worden sein; einige sollen allein in der Wildnis gelebt haben.,BeetleLM/beetlelm_eng-deu_heritage,step-8000,deu,6.627752780914307,755.7818534590324
507,"Wenn es komplett von Tieren aufgezogen wurde, zeigt das wilde Kind Verhaltensweisen (im Rahmen seiner körperlichen Möglichkeiten), die fast komplett in Übereinstimmung mit denen seines spezifischen Pflegetiers sind, wie z.B. dessen Angst oder Gleichgültigkeit gegenüber Menschen.",BeetleLM/beetlelm_eng-deu_heritage,step-8000,deu,7.268909454345703,1434.984683109839
508,"Während projektbasiertes Lernen den Lernprozess einfacher und interessanter gestalten sollte, geht das „Scaffolding“ einen Schritt weiter.",BeetleLM/beetlelm_eng-deu_heritage,step-8000,deu,8.071555137634277,3202.077630477567
509,"Scaffolding ist keine Lernmethode, sondern vielmehr eine Hilfe, die Individuen in einer neuartigen Lernsituation unterstützt wie beispielsweise beim Benutzen eines neuen Computerprogramms oder beim Beginn eines neuen Projekts.",BeetleLM/beetlelm_eng-deu_heritage,step-8000,deu,6.895338535308838,987.6600260167319
510,"Gerüste können sowohl virtuell als auch real sein. Mit anderen Worten, ein Lehrer ist eine Form von Gerüst, aber auch das kleine Büroklammermännchen in Microsoft Office.",BeetleLM/beetlelm_eng-deu_heritage,step-8000,deu,6.260262966156006,523.3565470736248
511,"Virtuelle Hilfestellungen sind in die Software eingebaut und sollen Arbeitsschritte, die der Schüler allein möglicherweise nicht bewältigen kann, hinterfragen, nahelegen und erklären.",BeetleLM/beetlelm_eng-deu_heritage,step-8000,deu,6.894552230834961,986.8837297622115
512,"Kinder werden aus einer Vielzahl von Gründen in Pflegefamilien untergebracht, und zwar aus verschiedenen Gründen, die von Vernachlässigung über Missbrauch bis hin zu Erpressung reichen.",BeetleLM/beetlelm_eng-deu_heritage,step-8000,deu,6.9615278244018555,1055.2445546488905
513,"Kein Kind sollte gezwungen sein, in einer Umgebung aufzuwachsen, die nicht fürsorglich, liebevoll und bildungsorientiert ist, aber viele sind dazu gezwungen.",BeetleLM/beetlelm_eng-deu_heritage,step-8000,deu,6.387038230895996,594.0944009513119
514,Für uns ist das System der Pflegeunterbringung ein Stück Sicherheit für diese Kinder.,BeetleLM/beetlelm_eng-deu_heritage,step-8000,deu,6.29716157913208,543.0283774860784
515,"Unser Pflegefamiliensystem soll ein sicheres Zuhause, liebevolle Betreuungspersonen, eine stabile Ausbildung und eine zuverlässige Gesundheitsversorgung bieten.",BeetleLM/beetlelm_eng-deu_heritage,step-8000,deu,8.235060691833496,3770.8687510269506
516,"Die Pflegestelle soll alle Bedürfnisse abdecken, die sie in dem Zuhause, aus dem sie zuvor herausgenommen wurden, nicht bekommen hatten.",BeetleLM/beetlelm_eng-deu_heritage,step-8000,deu,6.4637885093688965,641.4867373255225
517,"Das Internet verbindet sowohl Elemente der Massenkommunikation, als auch der zwischenmenschlichen Kommunikation.",BeetleLM/beetlelm_eng-deu_heritage,step-8000,deu,7.362367153167725,1575.5617481593658
518,Die spezifischen Eigenheiten des Internets haben zu zusätzlichen Dimensionen hinsichtlich des Nutzen- und Belohnungsansatzes geführt.,BeetleLM/beetlelm_eng-deu_heritage,step-8000,deu,7.532825469970703,1868.3770960651805
519,"Beispielsweise werden „Lernen“ und „Sozialisation“ als wichtige Motivationen für die Internetnutzung vorgebracht (James et al., 1995).",BeetleLM/beetlelm_eng-deu_heritage,step-8000,deu,7.1851420402526855,1319.6766721726824
