sentence_id,sentence,repo,revision,iso_code,nll,ppl
0,"'Inmiddels hebben we muizen van 4 maanden oud die geen diabetes hebben, maar dat eerder wel hebben,' voegde hij er nog aan toe.",BeetleLM/beetlelm_fas-nld_simultaneous,step-10000,nld,6.333835601806641,563.3131002041622
1,"Professor Ehud Ur in de geneeskunde aan Dalhousie University in Halifax, Nova Scotia, tevens voorzitter van de klinische en wetenschappelijke divisie van de Canadian Diabetes Association, herinnerde eraan dat ze nog maar net zijn begonnen met het onderzoek.",BeetleLM/beetlelm_fas-nld_simultaneous,step-10000,nld,7.234554290771484,1386.5227744417937
2,"Net als sommige andere deskundigen, is hij sceptisch over de vraag of zijn diabetes kan worden genezen, waarbij hij opmerkt dat deze bevindingen geen waarde hebben voor mensen die al type 1-diabetes hebben.",BeetleLM/beetlelm_fas-nld_simultaneous,step-10000,nld,6.715662956237793,825.230677413796
3,"Op maandag kondigde Sara Danius, de permanente secretaris van de nobelcommissie voor literatuur bij de Zweedse Academie, tijdens een radioprogramma op Sveriges Radio in Zweden aan dat de commissie Bob Dylan niet direct kon bereiken om hem te vertellen dat hij de Nobelprijs voor literatuur van 2016 had gewonnen en geen moeite meer zou doen om hem te bereiken.",BeetleLM/beetlelm_fas-nld_simultaneous,step-10000,nld,7.20382833480835,1344.5683817980876
4,"Danius verklaarde, 'We doen momenteel niks. Ik heb met zijn naaste medewerker gebeld en gemailed en vriendelijke antwoorden gekregen. Op dit moment is dat genoeg.'",BeetleLM/beetlelm_fas-nld_simultaneous,step-10000,nld,6.883659839630127,976.192538128584
5,"Eerder merkte Jamie Siminoff, de CEO van Ring, op dat het bedrijf is opgericht toen zijn deurbel van de winkel niet hoorbaar was in zijn garage.",BeetleLM/beetlelm_fas-nld_simultaneous,step-10000,nld,6.790004730224609,888.9177666013874
6,Hij zei dat hij daarop een wifi-deurbel maakte.,BeetleLM/beetlelm_fas-nld_simultaneous,step-10000,nld,6.518507957458496,677.5666724677822
7,"Siminoff zei dat de verkoop steeg nadat hij in 2013 in een aflevering van Shark Tank verscheen, waarbij het panel van het programma de start-up niet wilde financieren.",BeetleLM/beetlelm_fas-nld_simultaneous,step-10000,nld,7.1145734786987305,1229.758980925674
8,Eind 2017 was Siminoff te zien op teleshoppingkanaal QVC.,BeetleLM/beetlelm_fas-nld_simultaneous,step-10000,nld,7.78663969039917,2408.211633900341
9,Ring trof ook een schikking in een rechtszaak met de ADT Corporation. Dat is een concurrerend beveiligingsbedrijf.,BeetleLM/beetlelm_fas-nld_simultaneous,step-10000,nld,6.611685752868652,743.7357171686987
10,"Eén experimenteel vaccin lijkt in staat te zijn de ebola-sterfte terug te dringen, maar tot nu toe zijn nog geen medicijnen duidelijk geschikt voor de behandeling van bestaande infecties.",BeetleLM/beetlelm_fas-nld_simultaneous,step-10000,nld,7.076957702636719,1184.3598571114514
11,"Een cocktail van antilichamen, ZMapp, was aanvankelijk veelbelovend in het veld. Officiële onderzoeken toonden echter aan dat het minder voordelen had dan gewenst bij het voorkomen dat mensen overlijden.",BeetleLM/beetlelm_fas-nld_simultaneous,step-10000,nld,7.195098400115967,1332.881474826076
12,"ZMapp was een controle in de PALM-proef, dus gebruikten wetenschappers het als baseline en vergeleken de drie andere behandelmethoden hiermee.",BeetleLM/beetlelm_fas-nld_simultaneous,step-10000,nld,7.0306525230407715,1130.7682218244165
13,Het Amerikaanse Olympisch Comité heeft de steun van USA Gymnastics en begrijpt dat het noodzakelijk is dat de olympische familie een veilige plek promoot voor alle sporters.,BeetleLM/beetlelm_fas-nld_simultaneous,step-10000,nld,7.091639995574951,1201.8772586039704
14,"Wij sluiten ons aan bij de verklaring van het USOC dat het het beste is voor onze atleten en clubs, en hun sport, om zinvolle veranderingen door te voeren in onze organisatie in plaats van certificeringen af te nemen.",BeetleLM/beetlelm_fas-nld_simultaneous,step-10000,nld,6.469112396240234,644.9110473760165
15,"USA Gymnastics steunt een onafhankelijk onderzoek dat meer duidelijkheid kan geven over hoe misbruik op deze schaal, dat zo moedig door de slachtoffers van Larry Nassar is beschreven, zo lang onopgemerkt kon blijven, en omarmt alle nodige en toepasselijke veranderingen.",BeetleLM/beetlelm_fas-nld_simultaneous,step-10000,nld,7.268829345703125,1434.869733039063
16,"USA Gymnastics en de USOC hebben hetzelfde doel: zorgen dat atleten hun dromen in een veilige, positieve en krachtige omgeving kunnen najagen door de sport turnen en andere sporten zo veilig mogelijk maken.",BeetleLM/beetlelm_fas-nld_simultaneous,step-10000,nld,6.909246921539307,1001.4927556092853
17,Gedurende de jaren 60 werkte Brzezinksi als adviseur voor John F. Kennedy en daarna voor de regering van Lyndon B. Johnson.,BeetleLM/beetlelm_fas-nld_simultaneous,step-10000,nld,7.474224090576172,1762.0339788766676
18,Hij adviseerde tijdens de selecties van 1976 Carter op het gebied van buitenlands beleid. Vervolgens volgde hij Henry Kissinger op als National Security Advisor (NSA); deze functie vervulde hij van 1977 tot 1981.,BeetleLM/beetlelm_fas-nld_simultaneous,step-10000,nld,7.304824352264404,1487.4586701555522
19,"Als NSA stond hij Carter bij in de diplomatieke afhandeling van wereldwijde kwesties, zoals de Camp David-akkoorden in 1978, het stabiliseren van de relatie tussen de VS en China aan het eind van de jaren '70 en de Iraanse Revolutie, de daarop volgende gijzelaarscrisis en de invasie van Afghanistan door de Sovjet-Unie in 1979.",BeetleLM/beetlelm_fas-nld_simultaneous,step-10000,nld,6.577683448791504,718.8720948577296
20,De film met Ryan Gosling en Emma Stone in de hoofdrollen werd voor alle belangrijke categorieën genomineerd.,BeetleLM/beetlelm_fas-nld_simultaneous,step-10000,nld,7.486468315124512,1783.74134229333
21,Gosling en Stone werden respectievelijk genomineerd voor Beste acteur en Beste actrice.,BeetleLM/beetlelm_fas-nld_simultaneous,step-10000,nld,8.69013786315918,5944.001645071086
22,"Onder de overige nominaties bevonden zich onder meer de categorieën beste film, regisseur, cinematografie, kostuumontwerp, filmmontage, originele muziek, productieontwerp, muziek, geluidseffecten en origineel scenario.",BeetleLM/beetlelm_fas-nld_simultaneous,step-10000,nld,7.3924150466918945,1623.6225060561899
23,"De nummers Audition (The Fools Who Dream) en City of Stars uit de film werden genomineerd voor Beste originele nummer. Lionsgate haalde 26 nominaties binnen, een record voor een studio.",BeetleLM/beetlelm_fas-nld_simultaneous,step-10000,nld,7.489886283874512,1789.8485456288258
24,In een verklaring van zijn perssecretaris liet de Amerikaanse president Donald Trump zondagavond weten dat de Amerikaanse troepen zich uit Syrië zouden terugtrekken.,BeetleLM/beetlelm_fas-nld_simultaneous,step-10000,nld,7.828600883483887,2511.4131545694004
25,De aankondiging kwam na een telefonisch overleg tussen Trump en de Turkse president Recep Tayyip Erdoğan.,BeetleLM/beetlelm_fas-nld_simultaneous,step-10000,nld,7.331335544586182,1527.4203483598023
26,"Ook gaven de Turken volgens het communiqué aan dat zij de gevangen strijders van ISIS zouden gaan bewaken, waarvan Europa ze niet terug wilde nemen.",BeetleLM/beetlelm_fas-nld_simultaneous,step-10000,nld,7.512896537780762,1831.510907644087
27,"Dit bewijst niet alleen de al wijdverspreide theorie dat in elk geval bepaalde dinosauriërs veren hadden, maar biedt ook meer details dan fossielen, zoals de kleur en driedimensionale plaatsing.",BeetleLM/beetlelm_fas-nld_simultaneous,step-10000,nld,7.031219482421875,1131.4095032487155
28,. Volgens wetenschappers was het verenkleed van dit dier kastanjebruin met een bleke of carotenoïdekleurige onderzijde.,BeetleLM/beetlelm_fas-nld_simultaneous,step-10000,nld,8.125772476196289,3380.478262324304
29,De vondst geeft ook inzicht in de evolutie van veren bij vogels.,BeetleLM/beetlelm_fas-nld_simultaneous,step-10000,nld,6.48699951171875,656.5504329382311
30,"De onderzoekers trokken de conclusie dat de rachis waarschijnlijk een latere evolutionaire ontwikkeling was, doordat dinosaurusveren geen goed ontwikkelde schacht, oftewel een rachis, hebben, maar wel over andere kenmerken van veren beschikken - zoals weerhaken.",BeetleLM/beetlelm_fas-nld_simultaneous,step-10000,nld,7.194027423858643,1331.4547545408552
31,"De structuur van de veren lijkt erop te wijzen dat deze niet gebruikt werden om te vliegen, maar om de temperatuur te regelen of om hoe het eruit zag. De onderzoekers suggereerden dat dit de staart van een jonge dinosaurus is, maar dat dit monster juist volwassen veren laat zien en dus niet het dons van een kuiken.",BeetleLM/beetlelm_fas-nld_simultaneous,step-10000,nld,5.8620781898498535,351.4537732675645
32,"De onderzoekers suggereerden dat, ondanks dat het om de staart van een jonge dinosaurus gaat, het monster het verenkleed van een volwassene had en niet het dons van een kuiken.",BeetleLM/beetlelm_fas-nld_simultaneous,step-10000,nld,6.522054672241211,679.9740748625329
33,"Gistermorgen ontplofte een autobom bij het hoofdbureau van de politie in Gaziantep, Turkije. Hierbij kwamen twee politieagenten om het leven en raakten meer dan twintig andere personen gewond.",BeetleLM/beetlelm_fas-nld_simultaneous,step-10000,nld,6.797009468078613,895.1662615154072
34,"Onder de gewonden zijn negentien politieagenten, zei de gouverneur.",BeetleLM/beetlelm_fas-nld_simultaneous,step-10000,nld,7.1178297996521,1233.7699978978853
35,De politie verdenkt een vermeende Daesh-militair (ISIS) van de aanval.,BeetleLM/beetlelm_fas-nld_simultaneous,step-10000,nld,6.6678466796875,786.6997626937926
36,Hieruit bleek dat de zon dezelfde basisprincipes als andere sterren volgt: alle sterrenactiviteit in het stelsel is uitsluitend gebaseerd de helderheid en rotatie van de sterren.,BeetleLM/beetlelm_fas-nld_simultaneous,step-10000,nld,6.975235462188721,1069.8090592027197
37,De helderheid en rotatie worden gebruikt om het getal van Rossby van een ster te bepalen. Dit is verwant aan de plasmastroming.,BeetleLM/beetlelm_fas-nld_simultaneous,step-10000,nld,6.186295032501221,486.041996394352
38,"Hoe kleiner het aantal Rossby-golven, hoe minder actief de ster is als het gaat om magnetische omkeringen.",BeetleLM/beetlelm_fas-nld_simultaneous,step-10000,nld,7.013289928436279,1111.3046099538728
39,Iwasaki raakte tijdens zijn tocht op verschillende momenten in de problemen.,BeetleLM/beetlelm_fas-nld_simultaneous,step-10000,nld,6.838204383850098,932.8126565530731
40,"Piraten beroofden hem, een hondsdolle hond viel hem aan in Tibet, hij ontsnapte in Nepal aan het huwelijk en werd in India gearresteerd.",BeetleLM/beetlelm_fas-nld_simultaneous,step-10000,nld,6.524886131286621,681.902121912455
41,"De 802.11n-norm is compatibel met beide frequenties: 2,4 Ghz en 5,0 Ghz.",BeetleLM/beetlelm_fas-nld_simultaneous,step-10000,nld,7.217730522155762,1363.39136047117
42,"Mits het basisstation over dubbele radio's beschikt, maakt dit achterwaartse compatibiliteit met 802.11a, 802.11b en 802.11g mogelijk.",BeetleLM/beetlelm_fas-nld_simultaneous,step-10000,nld,6.89845609664917,990.7439213499208
43,Snelheden van 802.11n zijn substantieel sneller dan die van voorlopers met een maximale theoretische capaciteit van 600Mbit/s.,BeetleLM/beetlelm_fas-nld_simultaneous,step-10000,nld,7.545780181884766,1892.7388420849181
44,"Duvall is getrouwd met twee kinderen en maakte geen grote indruk op Miller, aan wie het verhaal verwant was.",BeetleLM/beetlelm_fas-nld_simultaneous,step-10000,nld,6.527980804443359,684.0156547645765
45,"Op een verzoek om commentaar reageerde Millar: 'Mike praat veel tijdens de zitting ... Ik was me aan het voorbereiden, dus luisterde niet echt naar hem.'",BeetleLM/beetlelm_fas-nld_simultaneous,step-10000,nld,7.190322399139404,1326.5308090652532
46,"'We doen ons uiterste best de koolstofdioxide-uitstoot per eenheid van het BBP in 2020 met een aanzienlijke marge te verminderen in vergelijking met het niveau van 2005,' zei Hu.",BeetleLM/beetlelm_fas-nld_simultaneous,step-10000,nld,6.950921058654785,1044.1109728790989
47,"Hij heeft voor de bezuinigingen geen cijfers vastgesteld, omdat hij zegt dat deze zullen worden bepaald op basis van de economische productie van China.",BeetleLM/beetlelm_fas-nld_simultaneous,step-10000,nld,6.180522441864014,483.24435749748744
48,Hu spoorde ontwikkelingslanden aan 'de oude manier van eerst vervuilen en later opruimen te vermijden'.,BeetleLM/beetlelm_fas-nld_simultaneous,step-10000,nld,7.335212707519531,1533.3539011606422
49,"Hij voegde toe dat 'ze daarentegen niet gevraagd zouden moeten worden om verplichtingen aan te gaan die buiten hun ontwikkeling, niveau, verantwoordelijkheid en mogelijkheden liggen.'",BeetleLM/beetlelm_fas-nld_simultaneous,step-10000,nld,6.809908866882324,906.7881647493837
50,De Irakese studiegroep presenteerde hun rapport vandaag om 12.00 uur GMT.,BeetleLM/beetlelm_fas-nld_simultaneous,step-10000,nld,7.254344940185547,1414.2362902736083
51,"De waarschuwing is dat niemand kan garanderen dat geen enkele handelswijze in Irak op dit moment een einde zal maken aan sektarische oorlogsvoering, toenemend geweld of de neiging naar chaos.",BeetleLM/beetlelm_fas-nld_simultaneous,step-10000,nld,7.0443267822265625,1146.3368416487733
52,In het begin van het rapport staat een pleidooi voor een open discussie en voor consensusvorming in de VS over het beleid met betrekking tot het Midden-Oosten.,BeetleLM/beetlelm_fas-nld_simultaneous,step-10000,nld,6.116995334625244,453.50002950926995
53,In het rapport wordt sterke kritiek geuit op vrijwel elk onderdeel van het huidige bestuursbeleid jegens Irak en raadt dringend een andere koers aan.,BeetleLM/beetlelm_fas-nld_simultaneous,step-10000,nld,7.491420745849609,1792.5971084065038
54,"Het rapport bevat 78 aanbevelingen, waarvan de eerste is dat dit jaar nog diplomatieke actie moet worden ondernomen om de Iraakse grenzen te beschermen tegen vijandelijke machten en de diplomatieke verstandhoudingen met omliggende landen te herstellen.",BeetleLM/beetlelm_fas-nld_simultaneous,step-10000,nld,7.312829494476318,1499.4137756618718
55,"Cristina Fernández de Kirchner, senator en de vrouw van de Argentijnse president, heeft gisteravond in La Plata, een stad op 50 km (31 mijl) afstand van Buenos Aires, aangekondigd zich verkiesbaar te willen stellen als president.",BeetleLM/beetlelm_fas-nld_simultaneous,step-10000,nld,6.892878532409668,985.2333655090462
56,"Mevrouw Kirchner kondigde haar intentie om voor het presidentschap te gaan aan in het Argentijnse Theater, waar ze in 2005 haar campagne voor de senaat startte als lid van de deelstaatafvaardiging van Buenos Aires.",BeetleLM/beetlelm_fas-nld_simultaneous,step-10000,nld,7.096738815307617,1208.0210638535739
57,Het debat ontstond door een discussie over het investeren en opnieuw opbouwen na de orkaan Katrina. Enkele fiscale conservatieven noemden dit gekscherend 'De New Orleans Deal van Bush.',BeetleLM/beetlelm_fas-nld_simultaneous,step-10000,nld,7.123589515686035,1240.8966668297635
58,Liberale kritiek op de reconstructiewerkzaamheden is gericht op het toekennen van reconstructiecontracten aan vermeende insiders uit Washington.,BeetleLM/beetlelm_fas-nld_simultaneous,step-10000,nld,7.102903842926025,1215.4915512953123
59,De begrafenis werd door meer dan vier miljoen mensen bijgewoond in Rome.,BeetleLM/beetlelm_fas-nld_simultaneous,step-10000,nld,6.406445026397705,605.7364717552389
60,Er waren zo veel aanwezigen dat niet iedereen toegang kon krijgen tot de begrafenis op het Sint-Pietersplein.,BeetleLM/beetlelm_fas-nld_simultaneous,step-10000,nld,6.6301703453063965,757.6112151650096
61,Op verschillende plekken in Rome waren grote televisieschermen geplaatst zodat mensen de ceremonie konden zien.,BeetleLM/beetlelm_fas-nld_simultaneous,step-10000,nld,7.354573726654053,1563.3304472379364
62,"Soortgelijke opstellingen werden in veel andere Italiaanse steden en in de rest van de wereld gemaakt, en dan vooral in Polen. Hier keek een groot aantal mensen naar.",BeetleLM/beetlelm_fas-nld_simultaneous,step-10000,nld,5.389611721038818,219.11829001259744
63,"Historici hebben kritiek geuit op eerdere beleidsregels van de FBI, omdat ze hun middelen focusten op gemakkelijk op te lossen zaken, voornamelijk zaken met gestolen auto's, om op deze manier de succesratio van het bureau op te krikken.",BeetleLM/beetlelm_fas-nld_simultaneous,step-10000,nld,6.629568099975586,757.1550847131108
64,Vanaf boekjaar 2005 financierde het Congres het initiatief tegen obsceniteit en verklaarde dat de FBI tien agenten moet inzetten op volwassenenpornografie.,BeetleLM/beetlelm_fas-nld_simultaneous,step-10000,nld,8.017206192016602,3032.6927251330285
65,"Robin Uthappa behaalde de hoogste score van de inning met 70 runs met slechts 41 ballen, door 11 vieren en 2 zessen te slaan.",BeetleLM/beetlelm_fas-nld_simultaneous,step-10000,nld,7.480603218078613,1773.3101461071587
66,In de middelste orde presteerden de slagmannen Sachin Tendulkar en Rahul Dravid goed en maakten samen honderd runs.,BeetleLM/beetlelm_fas-nld_simultaneous,step-10000,nld,7.180457592010498,1313.5091720513444
67,"Maar nadat India de wicket van de captain verloor, scoorden ze nog maar 36 runs waarbij ze 7 wickets verloren om de innings te beëindigen.",BeetleLM/beetlelm_fas-nld_simultaneous,step-10000,nld,7.549393177032471,1899.5896668832188
68,President van de Verenigde Staten George W. Bush arriveerde op 16 november in de ochtend in Singapore voor een rondreis van een week door Azië.,BeetleLM/beetlelm_fas-nld_simultaneous,step-10000,nld,6.016580104827881,410.1734441792061
69,"Hij werd ontvangen door Wong Kan Seng, de vicepremier van Singapore, en besprak problemen op het gebied van handel en terrorisme met de Minister-president van Singapore, Lee Hsien Loong.",BeetleLM/beetlelm_fas-nld_simultaneous,step-10000,nld,6.93766450881958,1030.361003672906
70,Bush sprak na de verliezen in de tussentijdse verkiezingen deze week voor een publiek over toenemende handelsbetrekkingen met Azië.,BeetleLM/beetlelm_fas-nld_simultaneous,step-10000,nld,6.644656181335449,768.6657205727565
71,"Premier Stephen Harper is akkoord gegaan om de 'Clean Air Act' van de overheid naar een commissie voor alle partijen te sturen voor herziening, voorafgaand aan de tweede lezing, na de 25 minuten durende vergadering met NDP-leider Jack Layton bij PMO op dinsdag.",BeetleLM/beetlelm_fas-nld_simultaneous,step-10000,nld,7.247280120849609,1404.2801768662425
72,"Tijdens de vergadering met de Minister-president vroeg Layton om veranderingen in de milieuwet van de conservatieven, waarbij hij vroeg om het 'grondig en volledig herschrijven' van de milieuwet van de conservatieve partij.",BeetleLM/beetlelm_fas-nld_simultaneous,step-10000,nld,6.632854461669922,759.6474633658735
73,"Sinds de federale regering de financiering heeft overgenomen van het Mersey ziekenhuis in Devonport, Tasmanië, hebben de overheid en enkele federale parlementsleden deze wet bekritiseerd als stunt tijdens de beginperiode van de federale verkiezingen die in november worden gehouden.",BeetleLM/beetlelm_fas-nld_simultaneous,step-10000,nld,7.0002312660217285,1096.8868017447137
74,"Minister-president John Howard heeft echter verklaard met de wet slechts te willen voorkomen dat de voorzieningen van het ziekenhuis werden teruggeschaald door de Tasmaanse overheid, door 45 miljoen Australische dollars extra uit te trekken.",BeetleLM/beetlelm_fas-nld_simultaneous,step-10000,nld,7.189632415771484,1325.615840562789
75,Volgens het laatste bulletin wees de stand van de zeespiegel op een vloedgolf. Er is enige duidelijke tsunami-activiteit geregistreerd nabij Pago Pago en Niue.,BeetleLM/beetlelm_fas-nld_simultaneous,step-10000,nld,6.4326300621032715,621.8071908343837
76,"Er is in Tonga geen grote schade of ernstig letsel doorgegeven, hoewel de stroom voor enige tijd uitviel. Hierdoor leken de Tongaanse autoriteiten de tsunami-waarschuwing van het PTWC niet te kunnen ontvangen.",BeetleLM/beetlelm_fas-nld_simultaneous,step-10000,nld,7.1243767738342285,1241.8739574813303
77,"De waarschuwingen werden ingetrokken, maar toch waren veertien scholen in Hawaï aan of nabij kustlijnen woensdag de hele dag gesloten.",BeetleLM/beetlelm_fas-nld_simultaneous,step-10000,nld,7.559652805328369,1919.179068940635
78,"George W. Bush, de leider van de VS, juichte de bekendmaking toe.",BeetleLM/beetlelm_fas-nld_simultaneous,step-10000,nld,5.938039302825928,379.1907220166724
79,"Een woordvoerder van Bush, Gordon Johndroe, beschreef de belofte van Noord-Korea 'een grote vooruitgang in ons doel om het Koreaanse schiereiland te denucleariseren.'",BeetleLM/beetlelm_fas-nld_simultaneous,step-10000,nld,6.834758281707764,929.6036213662184
80,"De tiende storm van het Atlantische orkaanseizoen die een naam kreeg, subtropische storm Jerry, vormde zich vandaag boven de Atlantische Oceaan.",BeetleLM/beetlelm_fas-nld_simultaneous,step-10000,nld,6.824403762817383,920.0276857689217
81,Volgens de NHC (National Hurricane Center) levert Jerry momenteel geen gevaar voor het vasteland op.,BeetleLM/beetlelm_fas-nld_simultaneous,step-10000,nld,6.6943535804748535,807.831567296507
82,Volgens berekeningen van het U.S. Corps of Engineers kan 6 inches regen mogelijk de eerder beschadigde dijken doen doorbreken.,BeetleLM/beetlelm_fas-nld_simultaneous,step-10000,nld,7.654183864593506,2109.452817402581
83,"In de Ninth Ward stond het water tijdens de orkaan Katrina op meer dan 20 voet hoogte. Nog steeds staat het water hier tot aan de middel, omdat de nabije dijk het water niet kon tegenhouden.",BeetleLM/beetlelm_fas-nld_simultaneous,step-10000,nld,6.3723297119140625,585.4201016091037
84,Het water stroomt over een stuk van 100 voet breed over de dijk.,BeetleLM/beetlelm_fas-nld_simultaneous,step-10000,nld,5.461371898651123,235.4201755449408
85,De Commons-beheerder Adam Cuerden uitte vorige maand tijdens zijn gesprek met Wikinews zijn frustraties over de verwijdering.,BeetleLM/beetlelm_fas-nld_simultaneous,step-10000,nld,7.738828182220459,2295.780569783393
86,"'Hij [Wales] loog in principe al tegen ons vanaf het begin. Allereerst door te doen alsof het om juridische redenen ging. Ten tweede door net te doen alsof hij naar ons luisterde, tot hij de kunst verwijderde.'",BeetleLM/beetlelm_fas-nld_simultaneous,step-10000,nld,6.725917816162109,833.7368426386039
87,De ergernissen binnen de gemeenschap resulteerde in de huidige pogingen om een beleid op te stellen met betrekking tot seksuele inhoud van de site die miljoenen stukken media-inhoud met een open licentie host.,BeetleLM/beetlelm_fas-nld_simultaneous,step-10000,nld,7.383914947509766,1609.8800426144196
88,"Het voltooide werk was voornamelijk theoretisch van aard, maar het programma is geschreven voor de simulatie van waarnemingen van het Sagittarius Galaxy.",BeetleLM/beetlelm_fas-nld_simultaneous,step-10000,nld,6.594301700592041,730.9183086206588
89,Het team was op zoek naar het effect dat zou worden veroorzaakt door de getijdenkrachten tussen de donkere materie van het heelal en die van de melkweg.,BeetleLM/beetlelm_fas-nld_simultaneous,step-10000,nld,5.874122619628906,355.7124286150493
90,"Vergelijkbaar met hoe de maan kracht uitoefent op de aarde, wat leidt tot getijden, oefent de Melkweg kracht uit op het sterrenstelsel Sagittarius.",BeetleLM/beetlelm_fas-nld_simultaneous,step-10000,nld,6.935584545135498,1028.2201174583947
91,De onderzoekers concludeerden dat donkere materie andere donkere materie op dezelfde manier beïnvloedt als gewone materie.,BeetleLM/beetlelm_fas-nld_simultaneous,step-10000,nld,7.038961887359619,1140.2033325382595
92,"Volgens deze theorie bevindt het grootste deel van de donkere materie in een sterrenstelsel zich rondom, in een soort kring, en bestaat het uit een grote hoeveelheid kleinere deeltjes.",BeetleLM/beetlelm_fas-nld_simultaneous,step-10000,nld,6.056175231933594,426.74012949719844
93,Op televisiebeelden zie je witte rook van de plant af komen.,BeetleLM/beetlelm_fas-nld_simultaneous,step-10000,nld,5.91809606552124,371.70334093565765
94,"Lokale autoriteiten geven de volgende waarschuwing: inwoners die in de buurt van de fabriek wonen, moeten binnen blijven, airconditioners uitschakelen en geen kraanwater drinken.",BeetleLM/beetlelm_fas-nld_simultaneous,step-10000,nld,6.62432336807251,753.1944047160437
95,Het Japanse agentschap voor kernenergie meldt dat er bij de fabriek radioactief cesium en jodium is waargenomen,BeetleLM/beetlelm_fas-nld_simultaneous,step-10000,nld,7.787878036499023,2411.1956806447906
96,De autoriteiten vermoeden dat dit erop duidt dat er op de plek containers met uraniumbrandstof mogelijk gescheurd zijn en lekken.,BeetleLM/beetlelm_fas-nld_simultaneous,step-10000,nld,7.1725382804870605,1303.148163904174
97,XDR-TB (Extremely Drug Resistant Tuberculosis) werd door Dr. Tony Moll ontdekt in de provincie KwaZulu-Natal van Zuid-Afrika.,BeetleLM/beetlelm_fas-nld_simultaneous,step-10000,nld,6.567058563232422,711.2745938796741
98,Hij verklaarde in een interview dat de nieuwe variant 'heel erg verontrustend en zorgwekkend is vanwege het erg hoge sterftecijfer'.,BeetleLM/beetlelm_fas-nld_simultaneous,step-10000,nld,7.5550150871276855,1910.2990646372682
99,"Dokter Moll denkt dat sommige patiënten de ziekte hebben opgelopen in het ziekenhuis, waaronder ook twee zorgmedewerkers uit het ziekenhuis.",BeetleLM/beetlelm_fas-nld_simultaneous,step-10000,nld,6.8245673179626465,920.1781733368869
100,Een besmette persoon kan in een jaar tijd mogelijk 10 tot 15 nauwe contacten infecteren.,BeetleLM/beetlelm_fas-nld_simultaneous,step-10000,nld,6.905231952667236,997.4798545968897
101,Het percentage XDR-TB onder alle tuberculosepatiënten lijkt echter nog steeds aan de lage kant: 6000 uit 330.000 geïnfecteerde mensen in totaal op een willekeurig moment in Zuid-Afrika.,BeetleLM/beetlelm_fas-nld_simultaneous,step-10000,nld,6.835752964019775,930.5287416696989
