sentence_id,sentence,repo,revision,iso_code,nll,ppl
218,The early reports say the plane was diverted back to Afghanistan after being denied an emergency landing in Ürümqi.,BeetleLM/beetlelm_nld_L1-eng_L2_simultaneous,step-30000,eng,6.159910202026367,473.38556386178186
219,"Air accidents are common in Iran, which has an aging fleet that is poorly maintained both for civil and military operations.",BeetleLM/beetlelm_nld_L1-eng_L2_simultaneous,step-30000,eng,5.9696269035339355,391.3596286132839
220,International sanctions have meant that new aircraft cannot be purchased.,BeetleLM/beetlelm_nld_L1-eng_L2_simultaneous,step-30000,eng,6.309593677520752,549.8214985842395
221,"Earlier this week, a police helicopter crash killed three people and wounded three more.",BeetleLM/beetlelm_nld_L1-eng_L2_simultaneous,step-30000,eng,5.96061372756958,387.84808427112375
222,"Last month Iran saw its worst air disaster in years when an airliner heading to Armenia crashed, killing the 168 on board.",BeetleLM/beetlelm_nld_L1-eng_L2_simultaneous,step-30000,eng,6.066150188446045,431.0181447674597
223,"The same month saw another airliner overrun a runway at Mashhad and strike a wall, killing seventeen.",BeetleLM/beetlelm_nld_L1-eng_L2_simultaneous,step-30000,eng,6.628566741943359,756.3972808671981
224,Aerosmith have cancelled their remaining concerts on their tour.,BeetleLM/beetlelm_nld_L1-eng_L2_simultaneous,step-30000,eng,6.332817077636719,562.7396442853023
225,The rock band was due to tour the United States and Canada until September 16.,BeetleLM/beetlelm_nld_L1-eng_L2_simultaneous,step-30000,eng,4.282949924468994,72.45385847837392
226,They have cancelled the tour after lead singer Steven Tyler was injured after he fell off stage while performing on August 5.,BeetleLM/beetlelm_nld_L1-eng_L2_simultaneous,step-30000,eng,6.224881172180176,505.1630114709149
227,Murray lost the first set in a tie break after both men held each and every serve in the set.,BeetleLM/beetlelm_nld_L1-eng_L2_simultaneous,step-30000,eng,5.779115676879883,323.4730092367737
228,"Del Potro had the early advantage in the second set, but this too required a tie break after reaching 6-6.",BeetleLM/beetlelm_nld_L1-eng_L2_simultaneous,step-30000,eng,6.468935012817383,644.7966609924223
229,Potro received treatment to his shoulder at this point but managed to return to the game.,BeetleLM/beetlelm_nld_L1-eng_L2_simultaneous,step-30000,eng,6.448490142822266,631.7477235270671
230,The program started at 8:30 p.m. local time (15.00 UTC).,BeetleLM/beetlelm_nld_L1-eng_L2_simultaneous,step-30000,eng,4.910489082336426,135.70576947539843
231,"Famous singers across the country presented bhajans, or devotional songs, to Shri Shyam's feet.",BeetleLM/beetlelm_nld_L1-eng_L2_simultaneous,step-30000,eng,5.8363566398620605,342.5291076265218
232,"Singer Sanju Sharma started the evening, followed by Jai Shankar Choudhary. esented the chhappan bhog bhajan as well. Singer, Raju Khandelwal was accompanying him.",BeetleLM/beetlelm_nld_L1-eng_L2_simultaneous,step-30000,eng,6.984604358673096,1079.8790884080613
233,"Then, Lakkha Singh took the lead in singing the bhajans.",BeetleLM/beetlelm_nld_L1-eng_L2_simultaneous,step-30000,eng,6.7593865394592285,862.1131611288516
234,"108 plates of Chhappan Bhog (in Hinduism, 56 different edible items, like, sweets, fruits, nuts, dishes etc. which are offered to deity) were served to Baba Shyam.",BeetleLM/beetlelm_nld_L1-eng_L2_simultaneous,step-30000,eng,5.855475902557373,349.1410176261336
235,"Lakkha Singh presented the chhappan bhog bhajan as well. Singer, Raju Khandelwal was accompanying him.",BeetleLM/beetlelm_nld_L1-eng_L2_simultaneous,step-30000,eng,7.166475772857666,1295.2717178496484
236,"At Thursday's keynote presentation of the Tokyo Game Show, Nintendo president Satoru Iwata unveiled the controller design for the company's new Nintendo Revolution console.",BeetleLM/beetlelm_nld_L1-eng_L2_simultaneous,step-30000,eng,5.728047847747803,307.3686519146713
237,"Resembling a television remote, the controller uses two sensors placed near the user's television to triangulate its position in three-dimensional space.",BeetleLM/beetlelm_nld_L1-eng_L2_simultaneous,step-30000,eng,5.520362854003906,249.7256346982937
238,This will allow players to control actions and movements in video games by moving the device through the air.,BeetleLM/beetlelm_nld_L1-eng_L2_simultaneous,step-30000,eng,5.50618314743042,246.20958565863373
239,Giancarlo Fisichella lost control of his car and ended the race very soon after the start.,BeetleLM/beetlelm_nld_L1-eng_L2_simultaneous,step-30000,eng,6.499743461608887,664.9710205652193
240,"His teammate Fernando Alonso was in the lead for most of the race, but ended it right after his pit-stop, probably because a badly tucked right front wheel.",BeetleLM/beetlelm_nld_L1-eng_L2_simultaneous,step-30000,eng,6.048551082611084,423.4989702690378
241,"Michael Schumacher ended his race not long after Alonso, because of the suspension damage in the numerous battles during the race.",BeetleLM/beetlelm_nld_L1-eng_L2_simultaneous,step-30000,eng,5.174282550811768,176.66981717971342
242,"""She’s very cute and sings quite well, too,"" he said according to a transcript of the news conference.",BeetleLM/beetlelm_nld_L1-eng_L2_simultaneous,step-30000,eng,5.707695007324219,301.17605898475375
243,"""I was moved every time we did a rehearsal on this, from the bottom of my heart.""",BeetleLM/beetlelm_nld_L1-eng_L2_simultaneous,step-30000,eng,4.836358070373535,126.0095969566431
244,"Around 3 minutes into the launch, an on-board camera showed numerous pieces of insulation foam break away from the fuel tank.",BeetleLM/beetlelm_nld_L1-eng_L2_simultaneous,step-30000,eng,6.105313777923584,448.2332650951338
245,"However, they are not thought to have caused any damage to the shuttle.",BeetleLM/beetlelm_nld_L1-eng_L2_simultaneous,step-30000,eng,4.588962078094482,98.39225367009207
246,"NASA's shuttle program chief N. Wayne Hale Jr. said the foam had fallen ""after the time we are concerned about.""",BeetleLM/beetlelm_nld_L1-eng_L2_simultaneous,step-30000,eng,5.996810436248779,402.144081561264
247,"Five minutes into the display a wind starts rolling in, about a minute later, the wind is reaching 70km/h... then the rain comes, but so hard and so large that it slaps your skin like a needle, then hail fell from the sky, people panicking and screaming and running over each other.",BeetleLM/beetlelm_nld_L1-eng_L2_simultaneous,step-30000,eng,5.69352912902832,296.93971221672103
248,"I lost my sister and her friend, and on my way there were two disabled people in wheelchairs, people just jumping over and pushing them,"" Armand Versace said.",BeetleLM/beetlelm_nld_L1-eng_L2_simultaneous,step-30000,eng,6.190906524658203,488.28855125250095
249,NHK also reported that the Kashiwazaki Kariwa nuclear power plant in Niigata prefecture was operating normally.,BeetleLM/beetlelm_nld_L1-eng_L2_simultaneous,step-30000,eng,6.362281799316406,579.5673050311706
250,Hokuriku Electric Power Co. reported no effects from the earthquake and that the Number 1 and 2 reactors at its Shika nuclear power plant were shut down.,BeetleLM/beetlelm_nld_L1-eng_L2_simultaneous,step-30000,eng,5.999119281768799,403.07364281610893
251,It is reported that some 9400 homes in the region are without water and approximately 100 without electricity.,BeetleLM/beetlelm_nld_L1-eng_L2_simultaneous,step-30000,eng,6.221573352813721,503.49478409686145
252,"Some roads have been damaged, railway service interrupted in the affected areas, and the Noto Airport in Ishikawa prefecture remains closed.",BeetleLM/beetlelm_nld_L1-eng_L2_simultaneous,step-30000,eng,5.421626091003418,226.24672130454707
253,One bomb exploded outside the governor general's office.,BeetleLM/beetlelm_nld_L1-eng_L2_simultaneous,step-30000,eng,6.051269054412842,424.6515942184271
254,Three more bombs exploded near government buildings in a period of two hours.,BeetleLM/beetlelm_nld_L1-eng_L2_simultaneous,step-30000,eng,6.202596187591553,494.02997208859347
255,"Some reports put the official death toll at eight, and official reports confirm that up to 30 were injured; but final numbers are not yet known.",BeetleLM/beetlelm_nld_L1-eng_L2_simultaneous,step-30000,eng,6.052039623260498,424.97894361446515
256,Both cyanuric acid and melamine were found in urine samples from pets that died after consuming contaminated pet food.,BeetleLM/beetlelm_nld_L1-eng_L2_simultaneous,step-30000,eng,6.539316177368164,691.813338631063
257,"The two compounds react with one another to form crystals that may block kidney function, researchers at the university said.",BeetleLM/beetlelm_nld_L1-eng_L2_simultaneous,step-30000,eng,6.555760860443115,703.284047317853
258,The researchers observed crystals formed in cat urine by the addition of melamine and cyanuric acid.,BeetleLM/beetlelm_nld_L1-eng_L2_simultaneous,step-30000,eng,5.8016486167907715,330.8445464236224
259,The composition of these crystals matches those found in the urine of affected pets when compared by infrared spectroscopy (FTIR).,BeetleLM/beetlelm_nld_L1-eng_L2_simultaneous,step-30000,eng,5.977438449859619,394.4287240664541
260,"I don't know if you realize it or not, but most of the goods from Central America came into this country duty-free.",BeetleLM/beetlelm_nld_L1-eng_L2_simultaneous,step-30000,eng,4.873483657836914,130.77570207796538
261,Yet eighty percent of our goods were taxed through tariffs in Central American countries. we treat you.,BeetleLM/beetlelm_nld_L1-eng_L2_simultaneous,step-30000,eng,6.536097526550293,689.590212715133
262,That didn't seem to make sense to me; it certainly wasn't fair.,BeetleLM/beetlelm_nld_L1-eng_L2_simultaneous,step-30000,eng,4.769327640533447,117.83998448979092
263,All I say to people is you treat us the way we treat you.,BeetleLM/beetlelm_nld_L1-eng_L2_simultaneous,step-30000,eng,5.581236839294434,265.39965959720337
264,California Governor Arnold Schwarzenegger signed into law a bill that bans the sale or rental of violent video games to minors.,BeetleLM/beetlelm_nld_L1-eng_L2_simultaneous,step-30000,eng,7.349578380584717,1555.5405434646127
265,"The bill requires violent video games sold in the state of California to be labeled with a decal reading ""18"" and makes their sale to a minor punishable by a fine of $1000 per offense.",BeetleLM/beetlelm_nld_L1-eng_L2_simultaneous,step-30000,eng,6.4808807373046875,652.5454143457229
266,"The Director of Public Prosecutions, Kier Starmer QC, gave a statement this morning announcing the prosecution of both Huhne and Pryce.",BeetleLM/beetlelm_nld_L1-eng_L2_simultaneous,step-30000,eng,5.680813789367676,293.18792608354613
267,Huhne has resigned and he will be replaced in the Cabinet by Ed Davey MP. Norman Lamb MP is expected to take the Business Minister job Davey is vacating.,BeetleLM/beetlelm_nld_L1-eng_L2_simultaneous,step-30000,eng,6.2863898277282715,537.2104019468469
268,Huhne and Pryce are scheduled to appear at the Westminster Magistrates Court on February 16.,BeetleLM/beetlelm_nld_L1-eng_L2_simultaneous,step-30000,eng,6.270039081573486,528.4980320087622
269,"The fatalities were Nicholas Alden, 25, and Zachary Cuddeback, 21. Cuddeback had been the driver.",BeetleLM/beetlelm_nld_L1-eng_L2_simultaneous,step-30000,eng,6.162098407745361,474.4225630298849
270,Edgar Veguilla received arm and jaw wounds while Kristoffer Schneider was left requiring reconstructive surgery for his face.,BeetleLM/beetlelm_nld_L1-eng_L2_simultaneous,step-30000,eng,7.172150611877441,1302.643072177775
271,"Uka's weapon failed whilst pointed at a fifth man's head. Schneider has ongoing pain, blindness in one eye, a missing section of skull and a face rebuilt from titanium.",BeetleLM/beetlelm_nld_L1-eng_L2_simultaneous,step-30000,eng,5.953711032867432,385.1801060675572
272,Schneider testified via videolink from a USAF base in his homeland.,BeetleLM/beetlelm_nld_L1-eng_L2_simultaneous,step-30000,eng,6.941407680511475,1034.2250491954928
273,"Beyond Wednesday's event, Carpanedo competed in two individual races at the Championships.",BeetleLM/beetlelm_nld_L1-eng_L2_simultaneous,step-30000,eng,5.89372444152832,362.75382694708605
274,"Her first was the Slalom, where she earned a Did Not Finish in her first run. 36 of the 116 competitors had the same result in that race.",BeetleLM/beetlelm_nld_L1-eng_L2_simultaneous,step-30000,eng,6.181694030761719,483.8108530067362
275,"Her other race, the Giant Slalom, saw her finish in tenth in the women's sitting group with a combined run time of 4:41.30, 2:11.60 minutes slower than first place finisher Austrian Claudia Loesch and 1:09.02 minutes slower than the ninth place finisher Gyöngyi Dani of Hungary.",BeetleLM/beetlelm_nld_L1-eng_L2_simultaneous,step-30000,eng,5.946039199829102,382.23637494920195
276,"Four skiers in the women's sitting group failed to finish their runs, and 45 of the 117 total skiers in the Giant Slalom failed to rank in the race.",BeetleLM/beetlelm_nld_L1-eng_L2_simultaneous,step-30000,eng,5.977250576019287,394.35462818788307
277,The Madhya Pradesh Police recovered the stolen laptop and mobile phone.,BeetleLM/beetlelm_nld_L1-eng_L2_simultaneous,step-30000,eng,6.024153232574463,413.29153200651604
278,"Deputy Inspector General D K Arya said, ""We have arrested five persons who raped the Swiss woman and recovered her mobile and laptop"".",BeetleLM/beetlelm_nld_L1-eng_L2_simultaneous,step-30000,eng,6.526196002960205,682.7959114330981
279,"The accused are named as Baba Kanjar, Bhutha Kanjar, Rampro Kanjar, Gaza Kanjar and Vishnu Kanjar.",BeetleLM/beetlelm_nld_L1-eng_L2_simultaneous,step-30000,eng,7.469604015350342,1753.9120258078513
280,Police superintendent Chandra Shekhar Solanki said the accused appeared in court with covered faces.,BeetleLM/beetlelm_nld_L1-eng_L2_simultaneous,step-30000,eng,7.491446018218994,1792.6424121552495
281,"Although three people were inside the house when the car impacted it, none of them were hurt.",BeetleLM/beetlelm_nld_L1-eng_L2_simultaneous,step-30000,eng,5.199761390686035,181.22899378977965
282,"However, the driver sustained serious injuries to the head.",BeetleLM/beetlelm_nld_L1-eng_L2_simultaneous,step-30000,eng,6.091126918792725,441.9191376256901
283,The road where the crash happened was temporarily closed while emergency services freed the driver from the red Audi TT.,BeetleLM/beetlelm_nld_L1-eng_L2_simultaneous,step-30000,eng,7.320252418518066,1510.5852213267412
284,He was initially hospitalised in the James Paget Hospital in Great Yarmouth.,BeetleLM/beetlelm_nld_L1-eng_L2_simultaneous,step-30000,eng,6.011679172515869,408.1681298617912
285,He was subsequently relocated to Addenbrooke's Hospital in Cambridge.,BeetleLM/beetlelm_nld_L1-eng_L2_simultaneous,step-30000,eng,5.391592025756836,219.55264092775047
286,Adekoya has since been in Edinburgh Sheriff Court charged with murdering her son.,BeetleLM/beetlelm_nld_L1-eng_L2_simultaneous,step-30000,eng,5.671710968017578,290.53119897151606
287,"She is in custody pending indictment and trial, but any eyewitness evidence may be tainted because her image has been widely published.",BeetleLM/beetlelm_nld_L1-eng_L2_simultaneous,step-30000,eng,6.3018717765808105,545.5921816361487
288,This is common practice elsewhere in the UK but Scottish justice works differently and courts have viewed publication of photos as potentially prejudicial.,BeetleLM/beetlelm_nld_L1-eng_L2_simultaneous,step-30000,eng,6.3735761642456055,586.1502548157367
289,"Professor Pamela Ferguson of the University of Dundee notes ""journalists do seem to be walking a dangerous line if publishing photos etc of suspects.""",BeetleLM/beetlelm_nld_L1-eng_L2_simultaneous,step-30000,eng,6.1950836181640625,490.33244398261013
290,"Crown Office, which is in overall charge of prosecutions, has indicated to journalists that no further comment will be made at least until indictment.",BeetleLM/beetlelm_nld_L1-eng_L2_simultaneous,step-30000,eng,5.897536277770996,364.1392239074889
291,"The document, according to the leak, will refer to the borders dispute, which Palestine wants based on the borders before the 1967 Mideast War.",BeetleLM/beetlelm_nld_L1-eng_L2_simultaneous,step-30000,eng,5.56491756439209,261.1036785820906
292,Other topics covered reportedly include the future state of Jerusalem which is sacred to both nations and the Jordan Valley issue.,BeetleLM/beetlelm_nld_L1-eng_L2_simultaneous,step-30000,eng,5.454582691192627,233.82727252629144
293,Israel demands an ongoing military presence in the valley for ten years once an agreement is signed while the PA agrees to leave such presence only for five years.,BeetleLM/beetlelm_nld_L1-eng_L2_simultaneous,step-30000,eng,6.597872734069824,733.5331083602508
294,"Shooters in the supplementary pest control trial were to be closely supervised by rangers, as the trial was monitored and its effectiveness evaluated.",BeetleLM/beetlelm_nld_L1-eng_L2_simultaneous,step-30000,eng,6.835596084594727,930.3827723058087
295,"In a partnership of NPWS and the Sporting Shooters Association of Australia (NSW) Inc, qualified volunteers were recruited, under the Sporting Shooters Association's hunting program.",BeetleLM/beetlelm_nld_L1-eng_L2_simultaneous,step-30000,eng,6.003952980041504,405.02669561844436
296,"According to Mick O'Flynn, the Acting Director Park Conservation and Heritage with the NPWS, the four shooters selected for the first shooting operation received comprehensive safety and training instruction.",BeetleLM/beetlelm_nld_L1-eng_L2_simultaneous,step-30000,eng,5.360286712646484,212.78594612618804
297,Martelly swore in a new Provisional Electoral Council (CEP) of nine members yesterday.,BeetleLM/beetlelm_nld_L1-eng_L2_simultaneous,step-30000,eng,5.639186859130859,281.23394266183584
298,It is Martelly's fifth CEP in four years.,BeetleLM/beetlelm_nld_L1-eng_L2_simultaneous,step-30000,eng,6.06475830078125,430.4186332515857
299,Last month a presidential commission recommended the prior CEP's resignation as part of a package of measures to move the country towards new elections.,BeetleLM/beetlelm_nld_L1-eng_L2_simultaneous,step-30000,eng,6.34552526473999,569.9366787469318
300,The commission was Martelly's response to widespread anti-regime protests that started in October.,BeetleLM/beetlelm_nld_L1-eng_L2_simultaneous,step-30000,eng,5.738235950469971,310.51616166504016
301,"The sometimes-violent protests were triggered by failure to hold elections, some due since 2011.",BeetleLM/beetlelm_nld_L1-eng_L2_simultaneous,step-30000,eng,6.3139967918396,552.2477631376489
302,"Around 60 cases of malfunctioning iPods overheating have been reported, causing a total of six fires and leaving four people with minor burns.",BeetleLM/beetlelm_nld_L1-eng_L2_simultaneous,step-30000,eng,6.8726654052734375,965.5186376172845
303,"Japan's Ministry of Economy, Trade and Industry (METI) said that it had been aware of 27 accidents related to the devices.",BeetleLM/beetlelm_nld_L1-eng_L2_simultaneous,step-30000,eng,4.978117942810059,145.2008480313679
304,"Last week, METI announced that Apple had informed it of 34 additional overheating incidents, which the company called ""non-serious.""",BeetleLM/beetlelm_nld_L1-eng_L2_simultaneous,step-30000,eng,6.710559368133545,821.0297689168843
305,"The ministry responded by calling Apple's postponement of the report ""truly regrettable.""",BeetleLM/beetlelm_nld_L1-eng_L2_simultaneous,step-30000,eng,6.3048505783081055,547.2198155650498
306,The eathquake struck Mariana at 07:19 a.m. local time (09:19 p.m. GMT Friday).,BeetleLM/beetlelm_nld_L1-eng_L2_simultaneous,step-30000,eng,6.270186901092529,528.5761601079556
307,The Northern Marianas emergency management office said that there were no damages reported in the nation.,BeetleLM/beetlelm_nld_L1-eng_L2_simultaneous,step-30000,eng,6.702211380004883,814.2043510443206
308,Also the Pacific Tsunami Warning Center said that there was no Tsunami indication.,BeetleLM/beetlelm_nld_L1-eng_L2_simultaneous,step-30000,eng,6.625463008880615,754.0532650993094
309,"A former Filipino policeman has kept Hong Kong tourists hostage by hijacking their bus in Manila, the capital of the Philippines.",BeetleLM/beetlelm_nld_L1-eng_L2_simultaneous,step-30000,eng,5.941979885101318,380.68790219831305
310,Rolando Mendoza fired his M16 rifle at the tourists.,BeetleLM/beetlelm_nld_L1-eng_L2_simultaneous,step-30000,eng,7.538036823272705,1878.1392842262844
311,Several hostages have been rescued and least six have been confirmed dead so far.,BeetleLM/beetlelm_nld_L1-eng_L2_simultaneous,step-30000,eng,5.165521144866943,175.12870221836906
312,"Six hostages, including the children and elderly, were released early, as were the Filipino photographers.",BeetleLM/beetlelm_nld_L1-eng_L2_simultaneous,step-30000,eng,5.83322811126709,341.4591700565285
313,The photographers later took the place of an aged lady as she needed the lavatory. Mendoza was gunned down.,BeetleLM/beetlelm_nld_L1-eng_L2_simultaneous,step-30000,eng,5.913959980010986,370.1691191565222
314,Liggins followed in his father’s footsteps and entered a career in medicine.,BeetleLM/beetlelm_nld_L1-eng_L2_simultaneous,step-30000,eng,6.3827667236328125,591.5621345500566
315,He trained as an obstetrician and began to work at the Auckland's National Women's Hospital in 1959.,BeetleLM/beetlelm_nld_L1-eng_L2_simultaneous,step-30000,eng,4.479467391967773,88.18769069286486
316,While he was working at the hospital Liggins began to investigate premature labor during his spare time.,BeetleLM/beetlelm_nld_L1-eng_L2_simultaneous,step-30000,eng,5.588303089141846,267.28168148871833
317,His research showed that if a hormone was administered it would speed up the baby's foetal lung maturation.,BeetleLM/beetlelm_nld_L1-eng_L2_simultaneous,step-30000,eng,5.8296332359313965,340.23387062685345
318,Xinhua reported that government investigators recovered two 'black box' flight recorders on Wednesday.,BeetleLM/beetlelm_nld_L1-eng_L2_simultaneous,step-30000,eng,7.072551727294922,1179.1530756835973
319,Fellow wrestlers also paid tribute to Luna.,BeetleLM/beetlelm_nld_L1-eng_L2_simultaneous,step-30000,eng,6.316255569458008,553.4965778912855
320,"Tommy Dreamer said ""Luna was the first Queen of Extreme. My first manager. Luna passed away on the night of two moons. Pretty unique just like her. Strong woman.""",BeetleLM/beetlelm_nld_L1-eng_L2_simultaneous,step-30000,eng,5.662966251373291,288.00166212115164
321,"Dustin ""Goldust"" Runnels commented that ""Luna was as freaky as me...maybe even more...love her and will miss her...hopefully she's in a better place.""",BeetleLM/beetlelm_nld_L1-eng_L2_simultaneous,step-30000,eng,6.717221736907959,826.518034134895
322,"Out of 1,400 people polled prior to the 2010 federal election, those who oppose Australia becoming a republic grew by 8 per cent since 2008.",BeetleLM/beetlelm_nld_L1-eng_L2_simultaneous,step-30000,eng,5.9349822998046875,378.03330484909446
323,Caretaker Prime Minister Julia Gillard claimed during the campaign of the 2010 federal election that she believed Australia should become a republic at the end of Queen Elizabeth II's reign.,BeetleLM/beetlelm_nld_L1-eng_L2_simultaneous,step-30000,eng,4.993569850921631,147.46190200445056
324,"34 per cent of those in the poll share this view, wanting Queen Elizabeth II to be Australia's last monarch.",BeetleLM/beetlelm_nld_L1-eng_L2_simultaneous,step-30000,eng,5.931610107421875,376.7606508411265
325,"At the extremes of the poll, 29 per cent of those surveyed believe Australia should become a republic as soon as possible, while 31 per cent believe Australia should never become a republic.",BeetleLM/beetlelm_nld_L1-eng_L2_simultaneous,step-30000,eng,6.090581893920898,441.6783463289316
326,"The Olympic gold medalist was due to swim in the 100m and 200m freestyle and in three relays at the Commonwealth Games, but due to his complaints his fitness has been in doubt.",BeetleLM/beetlelm_nld_L1-eng_L2_simultaneous,step-30000,eng,4.630141735076904,102.5285949789965
327,He has been unable to take the drugs needed to overcome his pain as they are banned from the Games.,BeetleLM/beetlelm_nld_L1-eng_L2_simultaneous,step-30000,eng,5.2711663246154785,194.64284685274993
328,"Curtis Cooper, a mathematician and computer science professor at the University of Central Missouri, has discovered the largest known prime number to date on January 25.",BeetleLM/beetlelm_nld_L1-eng_L2_simultaneous,step-30000,eng,4.903146743774414,134.71302077952197
329,Several people verified the discovery using different hardware and software by the beginning of February and it was announced on Tuesday.,BeetleLM/beetlelm_nld_L1-eng_L2_simultaneous,step-30000,eng,5.7315545082092285,308.4483814293987
330,Comets may possibly have been a source of water delivery to the earth along with organic matter that can form proteins and support life.,BeetleLM/beetlelm_nld_L1-eng_L2_simultaneous,step-30000,eng,5.678566932678223,292.5299143364299
331,"Scientists hope to understand how planets form, especially how the Earth formed, since comets collided with the Earth long ago.",BeetleLM/beetlelm_nld_L1-eng_L2_simultaneous,step-30000,eng,5.541804790496826,255.13805491871238
332,"Cuomo, 53, began his governorship earlier this year and signed a bill last month legalizing same-sex marriage.",BeetleLM/beetlelm_nld_L1-eng_L2_simultaneous,step-30000,eng,6.727884769439697,835.3783779362493
333,"He referred to the rumors as ""political chatter and silliness"".",BeetleLM/beetlelm_nld_L1-eng_L2_simultaneous,step-30000,eng,5.900595664978027,365.2549726741713
334,He is speculated to make a run for president in 2016.,BeetleLM/beetlelm_nld_L1-eng_L2_simultaneous,step-30000,eng,5.35867977142334,212.4442862048792
335,NextGen is a system the FAA claims would allow aircraft to fly shorter routes and save millions of gallons of fuel each year and cut carbon emissions.,BeetleLM/beetlelm_nld_L1-eng_L2_simultaneous,step-30000,eng,6.504220962524414,667.9551045525803
