sentence_id,sentence,repo,revision,iso_code,nll,ppl
436,De meest effectieve plek voor het hoofdonderwerp ligt op het snijpunt van de lijnen. Zo deel je de afbeelding verticaal en horizontaal in drieën (zie voorbeeld).,BeetleLM/beetlelm_nld-fra_balanced,step-8000,nld,6.741316795349121,846.674899697298
437,In deze periode in de geschiedenis van Europa lag de rijke en machtige katholieke kerk onder vuur.,BeetleLM/beetlelm_nld-fra_balanced,step-8000,nld,6.22503137588501,505.23889452559825
438,"Al meer dan duizend jaar verbond het christendom Europese staten, ondanks taalverschillen en verschillen in gewoonten.",BeetleLM/beetlelm_nld-fra_balanced,step-8000,nld,6.483494281768799,654.2531013869279
439,"Van de koning tot de gewone burger, zijn allesdoordringende macht had invloed op iedereen.",BeetleLM/beetlelm_nld-fra_balanced,step-8000,nld,5.9100236892700195,368.71488989248667
440,Een van de belangrijkste principes van het christendom is dat welvaart moet worden gebruikt om lijden en armoede te bestrijden en de kerk beschikt om deze reden over geldmiddelen.,BeetleLM/beetlelm_nld-fra_balanced,step-8000,nld,5.827493667602539,339.5066952110027
441,De kerk was al meer dan duizend jaar de centrale autoriteit in Rome en deze verhouding van macht en geld leidde ertoe dat veel mensen begonnen te twijfelen of dit principe werd nageleefd.,BeetleLM/beetlelm_nld-fra_balanced,step-8000,nld,7.110273361206055,1224.4822262835323
442,"Groot-Brittannië stelde een blokkade op zee in gericht tegen Duitsland, vlak na het uitbreken van de vijandelijkheden.",BeetleLM/beetlelm_nld-fra_balanced,step-8000,nld,6.811032772064209,907.8078815917999
443,"De strategie bleek effectief, want het was niet meer mogelijk om vitale voorzieningen aan militairen en burgers te leveren. Deze blokkade schond echter wel de algemeen aanvaarde internationale wet die in de afgelopen twee eeuwen werd vastgelegd in verschillende internationale overeenkomsten.",BeetleLM/beetlelm_nld-fra_balanced,step-8000,nld,7.132913589477539,1252.5209877152854
444,"Groot-Brittannië heeft mijnen geplaatst in internationale wateren, zodat er in hele delen van de oceaan geen schepen meer konden varen, wat zelfs voor neutrale schepen gevaarlijk was.",BeetleLM/beetlelm_nld-fra_balanced,step-8000,nld,6.854224681854248,947.8769382482022
445,"Vanwege de beperkte reactie op deze tactiek, verwachtte Duitsland dat er een vergelijkbare reactie zou komen op de ongeremde onderzeese oorlogsvoering van het land.",BeetleLM/beetlelm_nld-fra_balanced,step-8000,nld,6.748613357543945,852.875309089084
446,Tijdens de jaren 20 hadden de meeste burgers en naties een houding van pacifisme en isolement.,BeetleLM/beetlelm_nld-fra_balanced,step-8000,nld,6.6933722496032715,807.0392060883257
447,Na de Eerste Wereldoorlog wilden staten voorkomen dat er ooit nog zulke verschrikkingen zouden plaatsvinden.,BeetleLM/beetlelm_nld-fra_balanced,step-8000,nld,6.904335021972656,996.5855854067715
448,Tesla emigreerde in 1884 naar de Verenigde Staten van Amerika om te gaan werken bij de Edison Company in New York City.,BeetleLM/beetlelm_nld-fra_balanced,step-8000,nld,5.36023473739624,212.77488681079754
449,"Toen hij naar de Verenigde Staten kwam, had hij alleen 4 cent, een dichtbundel en een aanbevelingsbrief van Charles Batchelor (zijn vorige baas) voor Thomas Edison bij zich.",BeetleLM/beetlelm_nld-fra_balanced,step-8000,nld,6.257078647613525,521.6926636897708
450,Het oude China had een unieke manier om verschillende tijdsperiodes weer te geven; iedere fase van China of iedere regerende familie had een onderscheidende dynastie.,BeetleLM/beetlelm_nld-fra_balanced,step-8000,nld,6.929208755493164,1021.6852568688973
451,"Ook tussen de verschillende dynastieën was er een onstabiele periode waarin de provincies verdeeld waren. De bekendste was het tijdperk van de Drie Koninkrijken, dit heeft plaatsgevonden in de 60 jaar tussen de Han- en de Jin-dynastie in.",BeetleLM/beetlelm_nld-fra_balanced,step-8000,nld,6.062382221221924,429.3971383922834
452,Er vonden in die tijd hevige oorlogen plaats tussen verschillende edelen die om de troon vochten.,BeetleLM/beetlelm_nld-fra_balanced,step-8000,nld,6.314721584320068,552.6481732533185
453,In de geschiedenis van het oude China staat het tijdperk van de Drie Koninkrijken als een van de bloederigste te boek. Duizenden mensen stierven in de strijd om de hoogste plek in het grote paleis in Xi'an.,BeetleLM/beetlelm_nld-fra_balanced,step-8000,nld,6.080465793609619,437.2328075416028
454,"De Revolutie heeft grote sociale en politieke gevolgen gehad, zoals het gebruik van het metrieke stelsel, een verschuiving van de absolute monarchie naar republicanisme, nationalisme en de opvatting dat het land aan zijn inwoners toebehoort in plaats van een enkele leider.",BeetleLM/beetlelm_nld-fra_balanced,step-8000,nld,6.283214092254639,535.5070699141099
455,"Voor alle mannelijke sollicitanten waren na de revolutie functies te verkrijgen, zodat de meest ambitieuze en geschikte kandidaten konden slagen.",BeetleLM/beetlelm_nld-fra_balanced,step-8000,nld,7.198132038116455,1336.9310941520864
456,Hetzelfde geldt voor het leger. De legerrangen worden niet meer gebaseerd op iemands klasse maar op het kaliber van de persoon.,BeetleLM/beetlelm_nld-fra_balanced,step-8000,nld,6.565310955047607,710.032650109397
457,De Franse Revolutie inspireerde ook in andere landen de onderdrukte arbeidersklasse tot een revolutie.,BeetleLM/beetlelm_nld-fra_balanced,step-8000,nld,6.852139472961426,945.9024761256834
458,Mohammed hield zich intensief bezig met bovenaardse kwesties. Hij ging vaak voor bezinning naar een grot die later bekend werd als de Grot van Hira in het Gebergte van Noer.,BeetleLM/beetlelm_nld-fra_balanced,step-8000,nld,7.071921348571777,1178.4099969084875
459,"De grot zelf, die de tand des tijds heeft doorstaan, geeft een zeer levendig beeld van de spiritualiteit van Mohammed.",BeetleLM/beetlelm_nld-fra_balanced,step-8000,nld,6.539927005767822,692.2360469535422
460,De grot bevindt zich op een van bergtoppen aan de noordzijde van Mekka en is compleet afgesloten van de rest van de wereld.,BeetleLM/beetlelm_nld-fra_balanced,step-8000,nld,6.071995735168457,433.545059875595
461,"Zelfs als bekend was dat de grot bestond, was deze helemaal niet makkelijk te vinden. Eenmaal binnen in de grot heerst totale isolatie.",BeetleLM/beetlelm_nld-fra_balanced,step-8000,nld,6.733353614807129,839.9594482734728
462,"Het enige wat te zien is, zijn de heldere, prachtige lucht en de vele omringende bergen. Er is vanuit de grot heel weinig van deze wereld te zien of te horen.",BeetleLM/beetlelm_nld-fra_balanced,step-8000,nld,5.635324954986572,280.1499386402311
463,De Grote Piramide van Gizeh staat als enige van de zeven wereldwonderen nog overeind.,BeetleLM/beetlelm_nld-fra_balanced,step-8000,nld,7.129997253417969,1248.8735367749293
464,De Grote Piramide is in de derde eeuw voor Christus door de Egyptenaren gebouwd en behoort tot de talloze grote piramidestructuren ter ere van een overleden farao.,BeetleLM/beetlelm_nld-fra_balanced,step-8000,nld,6.978899955749512,1073.7365593659333
465,"Het Plateau van Gizeh of 'piramides van Gizeh' in de Egyptische vallei van de doden bevat verschillende piramides (waarvan de Grote Piramide de grootste is), meerdere kleine tombes, een aantal tempels en de grote sfinx.",BeetleLM/beetlelm_nld-fra_balanced,step-8000,nld,7.3265228271484375,1520.0869667161385
466,"De grote piramide werd gebouwd om farao Khufu te eren. Veel van de kleinere piramides, tombes en tempels werden gebouwd als eerbetoon aan de vrouwen en familieleden van Khufu.",BeetleLM/beetlelm_nld-fra_balanced,step-8000,nld,6.965325832366943,1059.2600023969717
467,Het up-bow teken ziet eruit als een V en het down-bow teken ziet eruit als een nietje of een vierkantje waarvan de onderkant ontbreekt.,BeetleLM/beetlelm_nld-fra_balanced,step-8000,nld,6.947625637054443,1040.6758502233483
468,Boven betekent dat je bij de punt moet beginnen en de strijkstok moet wegduwen. Onder betekent dat je bij de boogkikker moet beginnen (de plek waar je hand de strijkstok vasthoudt) en de strijkstok moet aantrekken.,BeetleLM/beetlelm_nld-fra_balanced,step-8000,nld,5.655878067016602,285.9674711222844
469,"Een opwaartse beweging geeft meestal een zachter geluid, terwijl een neerwaartse beweging juist een sterker en assertiever geluid produceert.",BeetleLM/beetlelm_nld-fra_balanced,step-8000,nld,7.394556045532227,1627.1024038580874
470,"Neem de vrijheid om je persoonlijke tekens te schetsen, maar vergeet daarbij niet dat de gedrukte strijktekens er om een muzikale reden zijn, waardoor ze dus meestal moeten worden gerespecteerd.",BeetleLM/beetlelm_nld-fra_balanced,step-8000,nld,6.634284973144531,760.734925406895
471,"Een groep marktvrouwen zat op 6 oktober 1789 achter het vertrek van de doodsbange Louis XVI, Marie Antoinette en hun twee jonge kinderen (Marie Therese van 11 en Louis-Charles van 4), en de zus van de koning, Madame Elizabeth, uit Versailles naar Parijs.",BeetleLM/beetlelm_nld-fra_balanced,step-8000,nld,6.5259552001953125,682.631512084471
472,"Zij reden terug naar de Franse hoofdstad in een rijtuig, omgeven door joelende en dreigende meutes die het Koningspaar bedreigden.",BeetleLM/beetlelm_nld-fra_balanced,step-8000,nld,7.17128324508667,1301.5136927006708
473,Door de acties van de menigte mensen werden de koning en koningin gedwongen om de ramen van hun koets helemaal te openen.,BeetleLM/beetlelm_nld-fra_balanced,step-8000,nld,5.844517230987549,345.3357841161412
474,Op een gegeven moment hield iemand in de menigte het hoofd van een koninklijke wacht die vermoord was in Versailles omhoog voor de ogen van een doodsbange koningin.,BeetleLM/beetlelm_nld-fra_balanced,step-8000,nld,6.937314033508301,1029.9999508531591
475,De oorlogskosten van het imperialisme van de V.S. met betrekking tot de verovering van de Filippijnen zijn betaald door de bevolking van de Filippijnen.,BeetleLM/beetlelm_nld-fra_balanced,step-8000,nld,6.255308628082275,520.7700742272843
476,Ze werden opgelegd aan het Amerikaanse koloniale regime belasting te betalen om een groot deel van de kosten te financieren en de rente op obligaties werd via de banken op Wall Street uitgegeven in de naam van de Filipijnse overheid.,BeetleLM/beetlelm_nld-fra_balanced,step-8000,nld,6.537649154663086,690.6610308163861
477,Het Amerikaanse imperialisme rustte voor een groot deel op de enorme winst van de langdurige uitbuiting van de Filipijnen.,BeetleLM/beetlelm_nld-fra_balanced,step-8000,nld,6.639762878417969,764.913593992551
478,Om de Tempeliers te begrijpen moet men weten wat de context was die de aanzet gaf tot het ontstaan van de orde.,BeetleLM/beetlelm_nld-fra_balanced,step-8000,nld,6.531448841094971,686.3919643081615
479,"Het tijdperk waarin dit gebeurd is, wordt algemeen aangeduid als de Hoge Middeleeuwen, de Europese geschiedenis in de 11e, 12e en 13e eeuw (1000-1300 n.Chr.).",BeetleLM/beetlelm_nld-fra_balanced,step-8000,nld,6.485937118530273,655.8532886166465
480,"Na de vroege middeleeuwen kwamen de hoge middeleeuwen. Deze werden weer opgevolgd door de late middeleeuwen, die gebruikelijk rond 1500 eindigen.",BeetleLM/beetlelm_nld-fra_balanced,step-8000,nld,6.165350914001465,475.9681375169942
481,Technologisch determinisme is een term voor een groot assortiment ideeën in de praktijk: van technologieaanbod of de technologische verplichting tot een strikt gevoel dat het menselijke lot wordt gedreven door een onderliggende logica die is gekoppeld aan wetenschappelijke wetten en de verschijning daarvan in technologie.,BeetleLM/beetlelm_nld-fra_balanced,step-8000,nld,7.5140862464904785,1833.6911688035348
482,"De meeste interpretaties van technologisch determinisme hebben deze twee algemene opvattingen: de ontwikkeling van de technologie volgt een traject dat voor het grootste deel verder reikt dan culturele of politieke invloed, en dat technologie op zijn beurt 'effecten' heeft op samenlevingen die inherent zijn in plaats van die sociaal geconditioneerd zijn.",BeetleLM/beetlelm_nld-fra_balanced,step-8000,nld,7.195612907409668,1333.5674285154694
483,Zo zullen sommigen bijvoorbeeld zeggen dat de komst van de auto automatisch leidt tot de aanleg van wegen.,BeetleLM/beetlelm_nld-fra_balanced,step-8000,nld,6.3662109375,581.8489846411661
484,"Een landelijk wegennetwerk is echter economisch niet haalbaar voor maar een paar auto's. Daarom worden nieuwe productiemethoden ontwikkeld, zodat de kosten van autobezit kunnen worden verlaagd.",BeetleLM/beetlelm_nld-fra_balanced,step-8000,nld,6.657737731933594,778.787117536154
485,Het massale autobezit zorgt ook voor een groter aantal ongevallen op de weg en dit leidt tot de ontwikkeling van nieuwe technieken op het gebied van gezondheidszorg om het menselijk lichaam te kunnen herstellen.,BeetleLM/beetlelm_nld-fra_balanced,step-8000,nld,6.517745018005371,677.049927268949
486,"In de romantiek was een groot onderdeel van cultureel determinisme opgenomen, dat was afkomstig van schrijvers zoals Goethe, Fichte en Schlegel.",BeetleLM/beetlelm_nld-fra_balanced,step-8000,nld,6.86663818359375,959.7167449630526
487,In de Romantiek vormde de geografie het individu en na verloop van tijd ontstonden er gewoonten en culturen naar aanleiding van deze geografie. Deze vormden een harmonieuze samenleving en waren beter dan de arbitraire opgelegde wetten.,BeetleLM/beetlelm_nld-fra_balanced,step-8000,nld,7.054930686950684,1158.5571653665017
488,"Constantinopel werd als modehoofdstad van het feodale Europa gezien, zoals Parijs de huidige modehoofdstad is.",BeetleLM/beetlelm_nld-fra_balanced,step-8000,nld,7.210323333740234,1353.3297738176868
489,Het stond vanaf ongeveer 400 na Christus tot ongeveer 1100 na Christus bekend als een epicentrum van luxe.,BeetleLM/beetlelm_nld-fra_balanced,step-8000,nld,6.719768524169922,828.6256824627635
490,"De status van het rijk nam in de 12e eeuw af, voornamelijk doordat de kruisvaarders terugkwamen met zijde en specerijen die meer waard waren dan wat de Byzantijnse markten konden bieden.",BeetleLM/beetlelm_nld-fra_balanced,step-8000,nld,6.452653884887695,634.3836419322419
491,Rond deze tijd nam Parijs ook de titel van modehoofdstad over van Constantinopel.,BeetleLM/beetlelm_nld-fra_balanced,step-8000,nld,6.737132549285889,843.1396050108075
492,"De gotiek vierde zijn hoogtijdagen in de 10e, 11e en 14e eeuw.",BeetleLM/beetlelm_nld-fra_balanced,step-8000,nld,6.202643871307373,494.05352983504525
493,Kleding was in het begin sterk beïnvloed door de Byzantijnse cultuur uit het oosten.,BeetleLM/beetlelm_nld-fra_balanced,step-8000,nld,5.711451530456543,302.3095614984907
494,Vanwege de langzame communicatiekanalen liepen stijlen in het westen echter met 25 tot 30 jaar achter.,BeetleLM/beetlelm_nld-fra_balanced,step-8000,nld,7.2188005447387695,1364.8510008011422
495,Aan het einde van de middeleeuwen begon er in West-Europa een eigen stijl te ontplooien. Een van de grootste ontwikkelingen was het resultaat van de kruistochten: mensen begonnen knopen te gebruiken om hun kleding te bevestigen.,BeetleLM/beetlelm_nld-fra_balanced,step-8000,nld,5.547375679016113,256.56336702091795
496,Zelfvoorzienende landbouw is landbouw waarbij voldoende voedsel wordt geproduceerd om aan de behoeften van de boer en zijn gezin te voldoen.,BeetleLM/beetlelm_nld-fra_balanced,step-8000,nld,6.322444438934326,556.9327179108759
497,"Landbouw met als doel levensonderhoud is een simpel systeem dat meestal biologisch is. Hierbij wordt opgeslagen zaad gebruikt dat afkomstig is uit de ecoregio, en dat wordt gecombineerd met wisselende gewassen of andere relatief eenvoudige technieken om de opbrengst te optimaal te maken.",BeetleLM/beetlelm_nld-fra_balanced,step-8000,nld,6.993102073669434,1089.094693468793
498,Vroeger werkten de meeste boeren in de zelfvoorzienende landbouw. In veel ontwikkelingslanden is dit nog steeds het geval.,BeetleLM/beetlelm_nld-fra_balanced,step-8000,nld,5.6628804206848145,287.9769438010198
499,Subculturen zorgen ervoor dat gelijkgestemde personen die zich verwaarloosd voelen door maatschappelijke normen worden samengebracht. Hierdoor krijgen ze de mogelijkheid een gevoel van identiteit te ontwikkelen.,BeetleLM/beetlelm_nld-fra_balanced,step-8000,nld,7.084687232971191,1193.549874056059
500,"Subculturen kunnen zich onderscheiden door middel van de leeftijd, etniciteit, sociale klasse, locatie en/of geslacht van hun leden.",BeetleLM/beetlelm_nld-fra_balanced,step-8000,nld,7.1716742515563965,1302.022692479573
501,"Een subcultuur kan worden bepaald door de volgende soorten kwaliteiten: taalkundig, esthetisch, religieus, politiek, seksueel, geografisch of een of meer van deze factoren samen.",BeetleLM/beetlelm_nld-fra_balanced,step-8000,nld,7.0276384353637695,1127.365118463776
502,"Leden van een subcultuur laten vaak zien tot welke groep ze behoren door middel van een bepaalde symbolische stijl in wat ze dragen, in hoe ze zich gedragen en het jargon dat ze spreken.",BeetleLM/beetlelm_nld-fra_balanced,step-8000,nld,6.6817474365234375,797.7118456189395
503,"Een van de meest gebruikte methoden voor het illustreren van het belang van de vermaatschappelijking waren de paar betreurenswaardige gevallen van kinderen die door verwaarlozing, tegenslagen of moedwillig misbruik tijdens het opgroeien niet werden gesocialiseerd door volwassenen.",BeetleLM/beetlelm_nld-fra_balanced,step-8000,nld,7.125494956970215,1243.263376665387
504,"Ze worden 'wolfskinderen' of 'wilde kinderen' genoemd. Sommige wolfskinderen zijn door mensen (meestal hun eigen ouders) opgesloten geweest; soms werd dit kind in de steek gelaten, omdat de ouders de ernstige verstandelijke of lichamelijke beperking van het kind niet wilden accepteren.",BeetleLM/beetlelm_nld-fra_balanced,step-8000,nld,6.658486843109131,779.3707342388695
505,Onhandelbare kinderen hebben mogelijk ernstige kindermishandeling of een ernstig trauma meegemaakt voordat ze werden verlaten of voordat ze wegliepen.,BeetleLM/beetlelm_nld-fra_balanced,step-8000,nld,8.23313045501709,3763.5971015943423
506,"Van anderen wordt beweerd dat zij zijn grootgebracht door dieren, en van sommigen wordt gezegd dat zij alleen in de wildernis hebben gewoond.",BeetleLM/beetlelm_nld-fra_balanced,step-8000,nld,6.522858619689941,680.520958088453
507,"Een verwilderd kind dat niet is grootgebracht door mensen, kan gedrag vertonen dat lijkt op het gedrag van het dier dat het kind verzorgd heeft (binnen de fysieke limieten), zoals angst voor of onverschilligheid richting mensen.",BeetleLM/beetlelm_nld-fra_balanced,step-8000,nld,7.213751792907715,1357.9775725287593
508,"Leren op projectbasis moet educatie vereenvoudigen en interessanter maken, maar scaffolding gaat nog een stapje verder.",BeetleLM/beetlelm_nld-fra_balanced,step-8000,nld,7.774313926696777,2378.7107701840555
509,"Scaffolding is geen leermethode maar een hulpmiddel om individuen te ondersteunen die te maken hebben met een nieuwe leerervaring, bijvoorbeeld een nieuw computerprogramma of die aan een nieuw project beginnen.",BeetleLM/beetlelm_nld-fra_balanced,step-8000,nld,6.406285762786865,605.6400076593437
510,"Ondersteuning kan zowel virtueel als echt zijn. Een docent is bijvoorbeeld een vorm van ondersteuning, maar het paperclipmannetje van Microsoft Office is dat ook.",BeetleLM/beetlelm_nld-fra_balanced,step-8000,nld,6.3929901123046875,597.6409241444771
511,"Er is sprake van virtuele scaffolding die is ingebouwd in de software die vragen stelt, geheugensteuntjes biedt en procedures verklaart die mogelijk zonder hulp moeilijk te begrijpen kunnen zijn voor studenten.",BeetleLM/beetlelm_nld-fra_balanced,step-8000,nld,7.521978378295898,1848.220158135238
512,"Er zijn verschillende redenen dat kinderen in de pleegzorg terechtkomen, zoals verwaarlozing, misbruik en uitbuiting.",BeetleLM/beetlelm_nld-fra_balanced,step-8000,nld,6.032424449920654,416.72413241758454
513,"Geen enkel kind zou moeten opgroeien in een omgeving waar ze niet goed worden verzorgd, waar men niet om ze geeft en waar ze zich niet kunnen ontwikkelen, maar toch gebeurt dit.",BeetleLM/beetlelm_nld-fra_balanced,step-8000,nld,5.658050537109375,286.58940221955106
514,Het pleegzorgsysteem beschouwen wij als een veilige zone voor deze kinderen.,BeetleLM/beetlelm_nld-fra_balanced,step-8000,nld,7.387864112854004,1616.2502953987046
515,"Het is de bedoeling dat de pleegzorg zorgt voor een veilig thuis, liefhebbende verzorgers, stabiel onderwijs en betrouwbare gezondheidszorg.",BeetleLM/beetlelm_nld-fra_balanced,step-8000,nld,6.571624279022217,714.5294963493894
516,In de pleegzorg moet aan alle behoeften worden voldoen die werden verwaarloosd in het eerdere thuis.,BeetleLM/beetlelm_nld-fra_balanced,step-8000,nld,6.9002909660339355,992.5634758512746
517,Op internet worden onderdelen van interpersoonlijke en massacommunicatie samengevoegd.,BeetleLM/beetlelm_nld-fra_balanced,step-8000,nld,7.147097110748291,1270.412729796263
518,De verschillende karakters van het internet leiden tot nieuwe dimensies wat betreft de toepassing van de Uses & Gratifications-theorie.,BeetleLM/beetlelm_nld-fra_balanced,step-8000,nld,7.890965461730957,2673.0233770697405
519,"'Leren' en 'socialisatie' worden bijvoorbeeld voorgesteld als belangrijke redenen om het internet te gebruiken (James et al., 1995).",BeetleLM/beetlelm_nld-fra_balanced,step-8000,nld,7.154815196990967,1280.255820859728
520,Eighmey en McCord (1998) introduceerden nieuwe motivatieaspecten als 'persoonlijke betrokkenheid' en 'aanhoudende relaties' toen zij reacties van het publiek op websites onderzochten.,BeetleLM/beetlelm_nld-fra_balanced,step-8000,nld,7.508786678314209,1823.9991020084176
521,"Dat er video-opnames worden gebruikt, leidde tot opmerkelijke vondsten in het interpreteren van micro-expressies, dat zijn gezichtsbewegingen die een paar milliseconden duren.",BeetleLM/beetlelm_nld-fra_balanced,step-8000,nld,7.752998352050781,2328.543752060653
522,Er wordt met name gesteld dat niemand een leugen kan herkennen door op enkel op micro-expressies te letten.,BeetleLM/beetlelm_nld-fra_balanced,step-8000,nld,7.551125526428223,1902.883271908473
523,"Oliver Sacks beschreef in zijn essay The President's Speech hoe het kan dat mensen die spraak niet kunnen begrijpen vanwege hersenbeschadiging, de oprechtheid ervan toch nauwkeurig kunnen inschatten.",BeetleLM/beetlelm_nld-fra_balanced,step-8000,nld,7.535965919494629,1874.2538630421302
524,"Hij suggereerde zelfs dat andere diersoorten, zoals huishonden, ook over het vermogen om het gedrag van mensen te interpreteren beschikken.",BeetleLM/beetlelm_nld-fra_balanced,step-8000,nld,6.840998649597168,935.4228280658049
525,Uit onderzoek in de twintigste eeuw is gebleken dat er twee groepen genetische varianten bestaan: verborgen en zichtbaar.,BeetleLM/beetlelm_nld-fra_balanced,step-8000,nld,7.132467746734619,1251.9626847894597
526,Door mutatie wordt er nieuwe genetische variatie toegevoegd; door selectie wordt deze variatie geëlimineerd uit de pool van uitgedrukte variatie.,BeetleLM/beetlelm_nld-fra_balanced,step-8000,nld,7.805165767669678,2453.24218048189
527,Voor elke generatie wordt er door middel van scheiding en hercombinatie gevarieerd tussen de twee groepen.,BeetleLM/beetlelm_nld-fra_balanced,step-8000,nld,6.8585524559021,951.9880249727355
528,Een primaat met een spijsverteringssysteem dat lijkt op dat van de mens kan op de savanne maar moeilijk de benodigde aminozuren halen uit de plantaardige bronnen die daar te vinden zijn.,BeetleLM/beetlelm_nld-fra_balanced,step-8000,nld,6.416684150695801,611.9705440371768
529,"Verder kan het niet in acht nemen serieuze gevolgen hebben: groeiachterstand, ondervoeding en uiteindelijk zelfs de dood.",BeetleLM/beetlelm_nld-fra_balanced,step-8000,nld,7.04104471206665,1142.5806511198166
530,"De gemakkelijkst te vinden plantaardige bronnen zijn de eiwitten in bladeren en peulvruchten, maar tenzij ze gekookt zijn, zijn ze voor primaten zoals wij moeilijk verteerbaar.",BeetleLM/beetlelm_nld-fra_balanced,step-8000,nld,7.250656604766846,1409.0297201646858
531,"Niet alleen is dierlijk voedsel (mieren, termieten, eieren) licht verteerbaar, maar het bevat ook heel erg veel proteïnen die alle essentiële aminozuren bevatten.",BeetleLM/beetlelm_nld-fra_balanced,step-8000,nld,7.231377124786377,1382.1245520862701
532,Al met al moeten we er niet versteld van staan als onze voorouders hun 'proteïneprobleem' oplosten op dezelfde manier als chimpansees op de savanne dit probleem vandaag de dag oplossen.,BeetleLM/beetlelm_nld-fra_balanced,step-8000,nld,7.259479999542236,1421.5171554068743
533,Slaaponderbreking houdt in dat je met een reden wakker wordt tijdens je normale slaapperiode en dat je binnen korte tijd (10–60 minuten) weer in slaap valt.,BeetleLM/beetlelm_nld-fra_balanced,step-8000,nld,6.508014678955078,670.4939495917565
534,Dit is vrij gemakkelijk door gebruik te maken van een relatief zachte wekker die je terugbrengt naar je bewustzijn zonder dat je meteen helemaal wakker wordt.,BeetleLM/beetlelm_nld-fra_balanced,step-8000,nld,6.3733601570129395,586.0236557949119
535,"Als je in je slaap je klok uitzet, kun je deze aan de andere kant van de kamer plaatsen. Op deze manier moet je je bed uitkomen om hem uit te zetten.",BeetleLM/beetlelm_nld-fra_balanced,step-8000,nld,4.363405227661133,78.52407201559845
536,"Andere opties op basis van het bioritme zijn bijvoorbeeld veel vloeistof drinken voordat je gaat slapen (en dan met name water of thee, een bekend diureticum). Hierdoor moet je wel opstaan om te plassen.",BeetleLM/beetlelm_nld-fra_balanced,step-8000,nld,6.702248573303223,814.2346345528268
537,De hoeveelheid innerlijke kalmte waarover een persoon beschikt staat tegenover de hoeveelheid stress die iemand in zijn of haar lichaam en geest meedraagt.,BeetleLM/beetlelm_nld-fra_balanced,step-8000,nld,7.485072612762451,1781.253506831357
