sentence_id,sentence,repo,revision,iso_code,nll,ppl
214,In 1989 werkte hij samen met Brooks en Groening aan The Simpsons en was hij verantwoordelijk voor het werven van het eerste schrijversteam.,BeetleLM/beetlelm_nld-ukr_balanced,step-5000,nld,6.877500057220459,970.1978863336468
215,"Na zijn vertrek uit de serie in 1993, bleef hij op papier uitvoerend producent, waardoor hij voor elke reeks royalty's ontving, ter waarde van enkele tientallen miljoenen dollars.",BeetleLM/beetlelm_nld-ukr_balanced,step-5000,nld,7.091559886932373,1201.7809817045954
216,Het Chinese persbureau Xinhua meldde eerder nog dat een vliegtuig was gekaapt.,BeetleLM/beetlelm_nld-ukr_balanced,step-5000,nld,7.6490559577941895,2098.663427093973
217,"Uit latere rapporten blijkt daarnaast dat er een bommelding werd gedaan in het vliegtuig, waardoor het werd teruggeleid naar Afghanistan en landde in Kandahar.",BeetleLM/beetlelm_nld-ukr_balanced,step-5000,nld,7.508449554443359,1823.3842920101083
218,"Uit eerste berichten blijkt dat het vliegtuig terug is geleid naar Afghanistan, nadat het niet was toegestaan een noodlanding te maken in Ürümqi.",BeetleLM/beetlelm_nld-ukr_balanced,step-5000,nld,7.087841987609863,1197.3211766971579
219,Vliegtuigongelukken komen vaak voor in Iran. Ze beschikken voor zowel burgerlijke als militaire operaties over een verouderde vloot die slecht is onderhouden.,BeetleLM/beetlelm_nld-ukr_balanced,step-5000,nld,7.525958061218262,1855.5901437111297
220,Door internationale sancties kunnen er geen nieuwe vliegtuigen aangeschaft worden.,BeetleLM/beetlelm_nld-ukr_balanced,step-5000,nld,7.199498176574707,1338.7587752843272
221,Eerder deze week heeft een ongeluk met een politiehelikopter aan drie mensen het leven gekost en nog eens drie personen raakten gewond.,BeetleLM/beetlelm_nld-ukr_balanced,step-5000,nld,6.94920539855957,1042.3211691344081
222,Afgelopen maand vond in Iran de ergste vliegtuigramp in jaren plaats toen een vliegtuig dat onderweg was naar Armenië neerstortte. De 168 inzittenden overleefden het niet.,BeetleLM/beetlelm_nld-ukr_balanced,step-5000,nld,7.283995151519775,1456.7965373454854
223,In dezelfde maand schoot nog een passagiersvliegtuig van een landingsbaan op Mashhad. Dit crashte tegen een muur en hierbij kwamen zeventien mensen om het leven.,BeetleLM/beetlelm_nld-ukr_balanced,step-5000,nld,6.802066326141357,899.7044550719705
224,Aerosmith heeft de resterende concerten van hun tournee afgelast.,BeetleLM/beetlelm_nld-ukr_balanced,step-5000,nld,7.132380962371826,1251.8540387200776
225,De toer van de rockband zou tot zestien september door de VS en Canada trekken.,BeetleLM/beetlelm_nld-ukr_balanced,step-5000,nld,7.247539520263672,1404.6444935710283
226,Ze annuleerden de toer nadat zanger Steven Tyler gewond raakte toen hij van het podium viel tijdens een optreden op 5 augustus.,BeetleLM/beetlelm_nld-ukr_balanced,step-5000,nld,8.362102508544922,4281.687594087449
227,"Murray verloor de eerste set in een tiebreak, nadat beide mannen in de hele set geen enkel punt weggaven als zij serveerden.",BeetleLM/beetlelm_nld-ukr_balanced,step-5000,nld,7.493052959442139,1795.5253989204534
228,"Del Potro had een vroege voorsprong in de tweede set, maar ook hier volgde een tiebreak nadat het 6-6 werd.",BeetleLM/beetlelm_nld-ukr_balanced,step-5000,nld,6.819538116455078,915.5620293690331
229,"Potro werd toen behandeld aan zijn schouder, maar slaagde erin de wedstrijd te vervolgen.",BeetleLM/beetlelm_nld-ukr_balanced,step-5000,nld,6.923243522644043,1015.6088081476062
230,De plaatselijke starttijd van het programma was 20.30 uur (15.00 UTC).,BeetleLM/beetlelm_nld-ukr_balanced,step-5000,nld,6.3987603187561035,601.0994041364697
231,Bekende zangers uit het hele land zongen bhajans of religieuze liederen aan de voeten van Shri Shyam.,BeetleLM/beetlelm_nld-ukr_balanced,step-5000,nld,7.800750255584717,2442.4337399473166
232,"De avond ving aan met de zanger Sanju Sharma, gevolgd door Jai Shankar Choudhary. Lakka Singh heeft ook de Chhappan bhog bhajan gepresenteerd. De zanger Raju Khandelwal hielp hem hierbij.",BeetleLM/beetlelm_nld-ukr_balanced,step-5000,nld,7.978710651397705,2918.166104042563
233,Daarna zong Lakkha Singh de bhajans.,BeetleLM/beetlelm_nld-ukr_balanced,step-5000,nld,7.412294864654541,1656.2227961846775
234,"Aan Baba Shyam werden 108 borden met Chhappan Bhog geserveerd (in het hindoeïsme zijn dit 56 verschillende eetbare artikelen, zoals, snoepjes, fruit, noten, gerechten, etc. die aan het heilige figuur worden aangeboden).",BeetleLM/beetlelm_nld-ukr_balanced,step-5000,nld,7.714579105377197,2240.7795672044126
235,Lakkha Singh heeft ook de Chhappan bhog bhajan gepresenteerd. De zanger Raju Khandelwal hielp hem hierbij.,BeetleLM/beetlelm_nld-ukr_balanced,step-5000,nld,8.197651863098145,3632.4108873451646
236,"Donderdag onthulde Satoru Iwata, de directeur van Nintendo, tijdens de keynotepresentatie van de Tokyo Game Show het ontwerp van de controller voor de nieuwe Nintendo Revolution.",BeetleLM/beetlelm_nld-ukr_balanced,step-5000,nld,7.294070243835449,1471.54808375786
237,Net als bij een tv-afstandsbediening maakt de controller gebruik van twee sensoren vlak bij de televisie van de gebruiken om de positie in een driedimensionale ruimte te kunnen bepalen.,BeetleLM/beetlelm_nld-ukr_balanced,step-5000,nld,6.818319320678711,914.4468259752784
238,Hiermee besturen spelers acties en bewegingen in videogames door het apparaat door de lucht te bewegen.,BeetleLM/beetlelm_nld-ukr_balanced,step-5000,nld,6.998837947845459,1095.3595536448763
239,Kort na de start verloor Giancarlo Fisichella de controle over zijn auto en lag hij hiermee uit de race.,BeetleLM/beetlelm_nld-ukr_balanced,step-5000,nld,7.8066840171813965,2456.9696431176894
240,"Zijn teamgenoot Fernando Alonso lag het grootste deel van de race aan kop, maar verloor deze positie direct na zijn pitstop, waarschijnlijk vanwege een slecht geplaatst rechtervoorwiel.",BeetleLM/beetlelm_nld-ukr_balanced,step-5000,nld,7.5983781814575195,1994.9578104525547
241,Michael Schumacher eindigde zijn race niet lang na Alonso door de schade aan de wielophanging vanwege de vele duels tijdens de race.,BeetleLM/beetlelm_nld-ukr_balanced,step-5000,nld,7.1473236083984375,1270.700507883578
242,In een transcriptie van de nieuwsconferentie zei hij dat 'ze een schattig meisje was met een aardige stem'.,BeetleLM/beetlelm_nld-ukr_balanced,step-5000,nld,6.945736408233643,1038.7116314275963
243,"Ik was elke keer ontroerd als we dit repeteerden, uit de grond van mijn hart.",BeetleLM/beetlelm_nld-ukr_balanced,step-5000,nld,6.528753280639648,684.5442447110619
244,Op een interne camera was circa 3 minuten na de lancering te zien dat veel stukken isolatieschuim losraakten van de brandstoftank.,BeetleLM/beetlelm_nld-ukr_balanced,step-5000,nld,7.576735019683838,1952.244508603845
245,Vermoedelijk hebben deze echter geen schade aangericht aan de shuttle.,BeetleLM/beetlelm_nld-ukr_balanced,step-5000,nld,7.472504138946533,1759.0059704237194
246,"De directeur van het Shuttle Programma van NASA, N. Wayne Hale Jr. zei dat het schuim gevallen was 'na de periode waar we zorgen over hadden.'",BeetleLM/beetlelm_nld-ukr_balanced,step-5000,nld,6.982518672943115,1077.6291471540674
247,"Na vijf minuten begint de wind, en een minuut later bereikt de wind al zo'n 70 km/u... dan begint het te regenen, maar zo hard en zo veel dat aanvoelt als speldenprikjes op je huid. Vervolgens valt er hagel. Mensen raken in paniek, beginnen te schreeuwen en rennen over elkaar heen.",BeetleLM/beetlelm_nld-ukr_balanced,step-5000,nld,6.415064811706543,610.9803582145715
248,"'Ik raakte mijn zus en haar vriend kwijt. Toen ik er probeerde te komen, sprongen mensen zo over twee rolstoelgebruikers heen en duwden hen weg,' aldus Armand Versace.",BeetleLM/beetlelm_nld-ukr_balanced,step-5000,nld,7.037858009338379,1138.9453815796724
249,Daarnaast meldde de NHK dat de kerncentrale van Kashiwazaki Kariwa in de prefectuur Niigata zoals normaal werkte.,BeetleLM/beetlelm_nld-ukr_balanced,step-5000,nld,7.591593265533447,1981.468004785526
250,Hokuriku Electric Power Co. rapporteert dat de aardbeving geen problemen heeft veroorzaakt en dat in de kernenergiecentrale van Shika reactoren 1 en 2 zijn stopgezet.,BeetleLM/beetlelm_nld-ukr_balanced,step-5000,nld,7.475973606109619,1765.119382887311
251,Volgens meldingen zitten er 9400 huishouden in de regio zonder water en ongeveer 100 zonder stroom.,BeetleLM/beetlelm_nld-ukr_balanced,step-5000,nld,6.673593997955322,791.2341945410624
252,"Enkele wegen zijn aangetast, de spoorwegdienst is gestaakt in de getroffen gebieden en de prefectuur van het vliegveld Noto in Ishikawa blijft voor langere tijd gesloten.",BeetleLM/beetlelm_nld-ukr_balanced,step-5000,nld,7.2828688621521,1455.1566865412187
253,Eén bom is ontploft buiten het kantoor waar de gouverneur-generaal werkt.,BeetleLM/beetlelm_nld-ukr_balanced,step-5000,nld,7.970887184143066,2895.4250002166423
254,Binnen een periode van twee uur kwamen er nog drie bommen tot ontploffing in de buurt van overheidsgebouwen.,BeetleLM/beetlelm_nld-ukr_balanced,step-5000,nld,6.438385486602783,625.3962736146348
255,"In sommige rapporten wordt het officiële dodental op acht geschat. Officiële rapporten bevestigen maximaal 30 gewonden, maar de definitieve aantallen zijn er nog niet.",BeetleLM/beetlelm_nld-ukr_balanced,step-5000,nld,7.389293193817139,1618.5616991256757
256,"In urinemonsters van huisdieren die zijn gestorven na het eten van besmette dierenvoeding, werd zowel cyaanuurzuur als melamine aangetroffen.",BeetleLM/beetlelm_nld-ukr_balanced,step-5000,nld,7.383863925933838,1609.797906092976
257,Onderzoekers van de universiteit stelden dat de twee verbindingen met elkaar reageren waardoor zich kristallen vormen die de nierfunctie kunnen blokkeren.,BeetleLM/beetlelm_nld-ukr_balanced,step-5000,nld,7.24275016784668,1397.9332401780564
258,Wetenschappers kwamen erachter dat er kristallen gevormd worden in kattenurine wanneer je hier melanine en cyanuurzuur aan toevoegt.,BeetleLM/beetlelm_nld-ukr_balanced,step-5000,nld,7.4768781661987305,1766.7167617872694
259,"De samenstelling van deze kristallen heeft gelijkenissen met die van de urine van de getroffen huisdieren, vergeleken met de infraroodspectroscopie (FTIR).",BeetleLM/beetlelm_nld-ukr_balanced,step-5000,nld,7.109407901763916,1223.4229450276653
260,"Ik weet niet of je je dit realiseert, maar de meeste goederen uit Midden-Amerika kwamen dit land binnen zonder dat er belasting over hoefde te worden betaald.",BeetleLM/beetlelm_nld-ukr_balanced,step-5000,nld,6.501648902893066,666.2392917249744
261,En toch werd tachtig procent van onze goederen belast aan de hand van tarieven uit landen in Midden-Amerika.,BeetleLM/beetlelm_nld-ukr_balanced,step-5000,nld,6.858506679534912,951.9444474167649
262,Dat vond ik erg raar; het was ongetwijfeld oneerlijk.,BeetleLM/beetlelm_nld-ukr_balanced,step-5000,nld,7.101176738739014,1213.3940825427014
263,Wat ik maar wil zeggen is dat jullie ons behandelen zoals wij jullie behandelen.,BeetleLM/beetlelm_nld-ukr_balanced,step-5000,nld,6.996063232421875,1092.3244553113668
264,"Arnold Schwarzenegger, de gouverneur van Californië, heeft een wetsvoorstel ondertekend waarmee het verboden wordt om gewelddadige videogames aan minderjarigen te verkopen of te verhuren.",BeetleLM/beetlelm_nld-ukr_balanced,step-5000,nld,7.825509548187256,2503.661522060958
265,"Onder deze wet moeten gewelddadige videogames die in de staat Californië worden verkocht, een '18'-sticker hebben. Verkoop aan een minderjarige wordt bestraft met een boete van $ 1000 per overtreding.",BeetleLM/beetlelm_nld-ukr_balanced,step-5000,nld,7.536165237426758,1874.6274726787096
266,"Kier Starmer QC, directeur van het Openbaar Ministerie, heeft vanochtend verklaard dat hij zowel Pryce en Huhne wil vervolgen.",BeetleLM/beetlelm_nld-ukr_balanced,step-5000,nld,8.004058837890625,2993.081799921305
267,"Huhne heeft ontslag genomen. In het kabinet is parlementslid Ed Davey zijn vervanger, terwijl parlementslid Norman Lamb naar verwachting Daveys taken als minister van Handel overneemt.",BeetleLM/beetlelm_nld-ukr_balanced,step-5000,nld,8.389627456665039,4401.177759337036
268,Naar verwachting worden Huhne en Pryce op 16 februari voorgeleid voor de Westminster Magistrates Court.,BeetleLM/beetlelm_nld-ukr_balanced,step-5000,nld,7.859621047973633,2590.538499568609
269,"De slachtoffers waren Nicholas Alden, 25, en Zachary Cuddeback, 21. Cuddeback was de bestuurder van het voertuig.",BeetleLM/beetlelm_nld-ukr_balanced,step-5000,nld,7.107723236083984,1221.363621503016
270,"Edgar Veguilla raakte gewond aan zijn arm en kaak, en Kristoffer Schneider moest een reconstructieve gezichtsoperatie ondergaan.",BeetleLM/beetlelm_nld-ukr_balanced,step-5000,nld,8.137263298034668,3419.546770519192
271,"Het wapen van Uka faalde terwijl hij het op het hoofd van een vijfde man gericht hield. Schneider heeft chronische pijn, is blind in één oog, mist een stuk schedel en zijn gezicht is met titanium gereconstrueerd.",BeetleLM/beetlelm_nld-ukr_balanced,step-5000,nld,7.367445468902588,1583.5832989208493
272,Schneider legde via videolink vanuit een USAF-basis in het land waaruit hij afkomstig was zijn verklaring af.,BeetleLM/beetlelm_nld-ukr_balanced,step-5000,nld,8.36942195892334,4313.142168637305
273,Naast het evenement van woensdag deed Carpanedo ook nog mee aan twee individuele races van het kampioenschap.,BeetleLM/beetlelm_nld-ukr_balanced,step-5000,nld,7.311454772949219,1497.3539154579262
274,"Haar eerste was de Slalom, waar ze een Did Not Finish kreeg bij haar eerste run. 36 van de 116 deelnemers kregen hetzelfde resultaat in die race.",BeetleLM/beetlelm_nld-ukr_balanced,step-5000,nld,7.303333282470703,1485.2424181669162
275,"In de andere wedstrijd waar ze aan deelnam, de zittende Grote Slalom, werd ze tiende van de dames, met een gecombineerde tijd van 4:41:30. Dat is 2:11:60 minuten langzamer dan de Oostenrijkse winnares Claudia Loesch, en 1:09:02 minuten langzamer dan de Hongaarse Gyöngyi Dani, die als negende eindigde.",BeetleLM/beetlelm_nld-ukr_balanced,step-5000,nld,6.703403949737549,815.1759257297128
276,Vier skiërs van de vrouwengroep voor de zittende slalom konden hun ritten niet afmaken en het lukte 45 van de 117 skiërs in de reuzenslalom niet om zich te plaatsen tijdens de race.,BeetleLM/beetlelm_nld-ukr_balanced,step-5000,nld,6.854915618896484,948.5320878438177
277,De gestolen laptop en mobiele telefoon zijn door de politie van Madhya Pradesh teruggevonden.,BeetleLM/beetlelm_nld-ukr_balanced,step-5000,nld,7.381863594055176,1606.5809945412384
278,Volgens adjunct-inspecteur-generaal D. K. Arya zijn vijf van de verkrachters van de Zweedse vrouw gearresteerd en hebben ze haar mobiele telefoon en laptop gevonden.,BeetleLM/beetlelm_nld-ukr_balanced,step-5000,nld,7.018209457397461,1116.7851750132274
279,"Baba Kanjar, Bhutha Kanjar, Rampro Kanjar, Gaza Kanjar en Vishnu Kanjar zijn de verdachten.",BeetleLM/beetlelm_nld-ukr_balanced,step-5000,nld,8.685888290405273,5918.7957726577915
280,Volgens politiecommissaris Chandra Shekhar Solanki hadden de verdachten hun gezichten bedekt toen ze in de rechtbank verschenen.,BeetleLM/beetlelm_nld-ukr_balanced,step-5000,nld,7.638586044311523,2076.8052289772627
281,"Er bevonden zich drie mensen in het huis toen de auto het huis raakte, maar geen van hen raakte gewond.",BeetleLM/beetlelm_nld-ukr_balanced,step-5000,nld,6.507603168487549,670.2180910763107
282,De bestuurder liep echter wel ernstige verwondingen aan het hoofd op.,BeetleLM/beetlelm_nld-ukr_balanced,step-5000,nld,7.623142719268799,2044.9788359789443
283,De weg waar het ongeluk plaatsvond werd tijdelijk gesloten terwijl de hulpdiensten probeerden de chauffeur uit de rode Audi TT te bevrijden.,BeetleLM/beetlelm_nld-ukr_balanced,step-5000,nld,7.760199546813965,2345.3725702078304
284,"Aanvankelijk werd hij opgenomen in Great Yarmouth, in het James Paget Hospital.",BeetleLM/beetlelm_nld-ukr_balanced,step-5000,nld,7.531515598297119,1865.9313639787538
285,Hij werd vervolgens overgeplaatst naar het Addenbrooke's Hospital in Cambridge.,BeetleLM/beetlelm_nld-ukr_balanced,step-5000,nld,7.5935211181640625,1985.291667636017
286,Adekoya is sindsdien in de Edinburgh Sheriff Court veroordeeld voor het vermoorden van haar zoon.,BeetleLM/beetlelm_nld-ukr_balanced,step-5000,nld,7.712748050689697,2236.680331382026
287,"Ze zit in hechtenis in afwachting van de aanklacht en het proces, maar het ooggetuigenverslag is mogelijk bedoezeld omdat haar verhaal veelvuldig is gepubliceerd.",BeetleLM/beetlelm_nld-ukr_balanced,step-5000,nld,7.220905303955078,1367.7267087988039
288,"Dit is gangbare praktijk in de rest van het VK, maar justitie in Schotland werkt anders en rechtbanken hebben de publicatie van foto's als mogelijk nadelig bestempeld.",BeetleLM/beetlelm_nld-ukr_balanced,step-5000,nld,6.873958110809326,966.767575985984
289,Professor Pamela Ferguson van de Universiteit van Dundee merkt op dat 'journalisten een gevaarlijk spelletje spelen als ze foto's e.d. van verdachten publiceren.',BeetleLM/beetlelm_nld-ukr_balanced,step-5000,nld,7.351879119873047,1559.123556916935
290,"Crown Office heeft de algehele leiding over vervolgingen en heeft aan journalisten aangegeven dat er geen verdere uitspraken worden gedaan, in ieder geval totdat aanklachten zijn gedaan.",BeetleLM/beetlelm_nld-ukr_balanced,step-5000,nld,7.1435933113098145,1265.9692474683197
291,"Volgens bronnen verwijst het document naar een geschillenregeling, iets wat de Palestijnen graag wilden op grond van de grenzen voor de oorlog in het Midden-Oosten in 1967.",BeetleLM/beetlelm_nld-ukr_balanced,step-5000,nld,6.545365810394287,696.0112405324352
292,"Andere onderwerpen die besproken waren zijn de toekomstige status van Jeruzalem, een stad die voor beide volken heilig is, en de problemen in de Jordaanvallei.",BeetleLM/beetlelm_nld-ukr_balanced,step-5000,nld,6.810480117797852,907.3063163018699
293,Israël eist dat er na ondertekening van een overeenkomst tien jaar lang een permanente militaire aanwezigheid is in de vallei. De PA is echter slechts bereid tot een aanwezigheid van vijf jaar.,BeetleLM/beetlelm_nld-ukr_balanced,step-5000,nld,6.802206516265869,899.8305935930317
294,Schutters in de aanvullende proef voor ongediertebestrijding moesten nauwlettend in de gaten worden gehouden door boswachters. De proef werd namelijk gevolgd en de effectiviteit ervan werd beoordeeld.,BeetleLM/beetlelm_nld-ukr_balanced,step-5000,nld,7.112250328063965,1226.9053815225732
295,"Bij een samenwerking tussen de NPWS en de Sporting Shooters Association of Australia (NSW) Inc, werden gekwalificeerde vrijwilligers gerekruteerd voor het jachtprogramma van de Sporting Shooters Association.",BeetleLM/beetlelm_nld-ukr_balanced,step-5000,nld,7.562137603759766,1923.9537717110115
296,"Volgens Mick O'Flynn, waarnemend directeur voor parkbehoud en erfgoed bij de NPWS, hebben de vier gekozen schutters voor de eerste schietoperatie een uitgebreide veiligheids- en trainingsinstructie gehad.",BeetleLM/beetlelm_nld-ukr_balanced,step-5000,nld,7.501164436340332,1810.148990997429
297,Gisteren zwoor Martelly een negenkoppige nieuwe voorlopige kiesraad (Provisional Electoral Council of CEP) in.,BeetleLM/beetlelm_nld-ukr_balanced,step-5000,nld,8.256444931030273,3852.3742712298636
298,"Hiermee heeft Martelly in de afgelopen vier jaar, vijf keer een CEP behaald.",BeetleLM/beetlelm_nld-ukr_balanced,step-5000,nld,7.090355396270752,1200.3343191554852
299,Afgelopen maand heeft de presidentiële commissie het ontslag van de eerdere Nationale Kiesraad aanbevolen. Dit is onderdeel van een maatregelenpakket zodat er nieuwe verkiezingen komen in het land.,BeetleLM/beetlelm_nld-ukr_balanced,step-5000,nld,7.001510143280029,1098.2904827069124
300,De commissie werd door Martelly ingesteld als reactie op de wijdverbreide protesten tegen de overheid die sinds oktober hebben plaatsgevonden.,BeetleLM/beetlelm_nld-ukr_balanced,step-5000,nld,7.590608596801758,1979.5178754716158
301,"De soms gewelddadige protesten ontstonden door het uitblijven van verkiezingen, waarvan sommige al sinds 2011 hadden moeten plaatsvinden.",BeetleLM/beetlelm_nld-ukr_balanced,step-5000,nld,7.8813629150390625,2647.4783900375637
302,Er zijn ongeveer 60 gevallen gerapporteerd van defecte iPods die oververhit raken. In totaal leidde dit tot zes branden en vier mensen met lichte brandwonden.,BeetleLM/beetlelm_nld-ukr_balanced,step-5000,nld,7.32598352432251,1519.267400536375
303,"Het Japanse ministerie van Economie, Handel en Industrie (METI) liet weten dat het bekend was met de 27 ongelukken die verband hielden met de apparaten.",BeetleLM/beetlelm_nld-ukr_balanced,step-5000,nld,6.957833766937256,1051.3536117328426
304,Vorige week kondigde METI aan dat Apple 34 aanvullende incidenten met oververhitting had gemeld die het bedrijf 'niet ernstig' noemde.,BeetleLM/beetlelm_nld-ukr_balanced,step-5000,nld,8.115604400634766,3346.2794665386687
305,"'Erg betreurenswaardig', luidde de reactie van het ministerie over het feit dat Apple het rapport heeft uitgesteld.",BeetleLM/beetlelm_nld-ukr_balanced,step-5000,nld,7.5671844482421875,1933.6882106260134
306,Mariana werd om 07.19 uur lokale tijd (vrijdag 21.19 GMT) getroffen door de aardbeving.,BeetleLM/beetlelm_nld-ukr_balanced,step-5000,nld,6.747641563415527,852.0468924618409
307,Het bureau voor calamiteitenbeheer van de Noordelĳke Marianen verklaarde dat er landelijk geen schade is gemeld.,BeetleLM/beetlelm_nld-ukr_balanced,step-5000,nld,7.869740009307861,2616.88513395822
308,Daarnaast meldde het National Tsunami Warning Center dat er geen sprake was van een tsunami-waarschuwing.,BeetleLM/beetlelm_nld-ukr_balanced,step-5000,nld,7.023132801055908,1122.2970495149978
309,"In Manilla, de Filippijnse hoofdstad, heeft een voormalige politieman uit de Filippijnen toeristen uit Hongkong gegijzeld door hun bus te kapen.",BeetleLM/beetlelm_nld-ukr_balanced,step-5000,nld,7.426815509796143,1680.4476744660096
310,Met zijn M16-geweer schoot Rolando Mendoza op de toeristen.,BeetleLM/beetlelm_nld-ukr_balanced,step-5000,nld,7.51287317276001,1831.4681148536515
311,Verschillende gijzelaars zijn in veiligheid gebracht en vooralsnog zijn er minstens zes dodelijke slachtoffers bevestigd.,BeetleLM/beetlelm_nld-ukr_balanced,step-5000,nld,7.949535369873047,2834.2577629514853
312,"Zes gijzelaars werden eerder vrijgelaten, inclusief de kinderen en ouderen, en de Filipijnse fotografen.",BeetleLM/beetlelm_nld-ukr_balanced,step-5000,nld,7.379893779754639,1603.4194431800408
313,Later keerden de fotografen terug in ruil voor een oudere vrouw die naar het toilet moest. Mendoza is uiteindelijk neergeschoten.,BeetleLM/beetlelm_nld-ukr_balanced,step-5000,nld,7.3589911460876465,1570.2516091194682
314,Liggins ging in de geneeskunde werken en volgde hiermee het voorbeeld van zijn vader.,BeetleLM/beetlelm_nld-ukr_balanced,step-5000,nld,6.890386581420898,982.7812687710657
315,Opgeleid als verloskundige ging hij in 1959 aan de slag in het National Women's Hospital in Auckland.,BeetleLM/beetlelm_nld-ukr_balanced,step-5000,nld,7.0139265060424805,1112.0122667975904
316,"Toen hij werkzaam was in het ziekenhuis, deed Liggins in zijn vrije tijd onderzoek naar vroeggeboorte.",BeetleLM/beetlelm_nld-ukr_balanced,step-5000,nld,6.81516695022583,911.5686896796939
317,Zijn onderzoek toonde aan dat de rijping van de foetale longen van baby's werd versneld door het toedienen van een hormoon.,BeetleLM/beetlelm_nld-ukr_balanced,step-5000,nld,6.7738471031188965,874.6703767682758
318,Xinhua heeft gemeld dat onderzoekers van de overheid woensdag twee 'zwarte dozen' met vluchtrecorders terug hebben gevonden.,BeetleLM/beetlelm_nld-ukr_balanced,step-5000,nld,7.534354209899902,1871.2355430890937
319,Ook medeworstelaars brachten hulde aan Luna.,BeetleLM/beetlelm_nld-ukr_balanced,step-5000,nld,9.303312301635742,10974.309295759176
320,"Tommy Dreamer zei, 'Luna was de eerste 'Queen of Extreme'. Mijn eerste manager. Luna is overleden op de nacht van twee manen. Net zo uniek als zij was. Een sterke vrouw.'",BeetleLM/beetlelm_nld-ukr_balanced,step-5000,nld,7.112515449523926,1227.230703591582
321,Dustin 'Goldust' Runnels gaf aan dat 'Luna net zo raar was als ik... misschien nog wel raarder... ik hou van haar en ga haar missen... hopelijk is ze op een betere plek'.,BeetleLM/beetlelm_nld-ukr_balanced,step-5000,nld,6.91991662979126,1012.2356007236729
322,"Van de 1400 mensen die voor de federale verkiezing van 2010 werden ondervraagd, steeg het aantal mensen dat zich verzette tegen het feit dat Australië een republiek werd, met 8 procent sinds 2008.",BeetleLM/beetlelm_nld-ukr_balanced,step-5000,nld,7.188535690307617,1324.1628008536063
323,Demissionair minister-president Julia Gillard zei tijdens de campagne voor de federale verkiezingen van 2010 dat Australië na de regering van koningin Elizabeth II een republiek zou moeten worden.,BeetleLM/beetlelm_nld-ukr_balanced,step-5000,nld,8.073716163635254,3209.0048857877186
324,34 procent van de deelnemers van deze peiling stond achter dit standpunt. Zij willen dat koningin Elizabeth II de laatste vorst van Australië is.,BeetleLM/beetlelm_nld-ukr_balanced,step-5000,nld,7.012282848358154,1110.18600057961
325,"29 procent van de respondenten vond dat Australië een republiek moet worden zodra het mogelijk is, en aan het andere uiteinde zei 31 procent dat dat nooit zou moeten gebeuren.",BeetleLM/beetlelm_nld-ukr_balanced,step-5000,nld,7.147775173187256,1271.274441064327
326,"De Olympisch winnaar van de gouden medaille zwom de 100 en 200 meter freestyle en drie estafettewedstrijden tijdens de Gemenebestspelen, maar zijn conditie werd in twijfel getrokken vanwege zijn klachten.",BeetleLM/beetlelm_nld-ukr_balanced,step-5000,nld,7.713762283325195,2238.9499963588746
327,"Hij kon de medicijnen die hij nodig had om zijn pijn te verzachten niet nemen, omdat ze zijn verboden op de Spelen.",BeetleLM/beetlelm_nld-ukr_balanced,step-5000,nld,5.678889274597168,292.6242241895589
