sentence_id,sentence,repo,revision,iso_code,nll,ppl
0,"„Wir haben jetzt 4 Monate alte Mäuse, die Diabetes hatten und jetzt keinen mehr haben“, fügte er hinzu.",BeetleLM/beetlelm_bul-deu_part_time,step-20000,deu,6.497598171234131,663.5459937300158
1,"Dr. Ehud Ur, Professor für Medizin an der Dalhousie University in Halifax, Nova Scotia, und Vorsitzender der Abteilung für Klinik und Wissenschaft des Kanadischen Diabetesverbands gab zu bedenken, dass die Forschungsarbeit noch in den Kinderschuhen stecke.",BeetleLM/beetlelm_bul-deu_part_time,step-20000,deu,6.340578556060791,567.1243297021236
2,"Wie einige andere Experten zeigte er sich skeptisch, ob es möglich sei, Diabetes zu heilen, und wies darauf hin, dass die Befunde für Menschen, die bereits unter Typ-1-Diabetes litten, keine Bedeutung hätten.",BeetleLM/beetlelm_bul-deu_part_time,step-20000,deu,5.854194164276123,348.6937968894833
3,"Am Montag gab Sara Danius, Ständige Sekretärin des Literaturnobelpreiskomitees der Schwedischen Akademie in einer Radiosendung auf Sveriges Radio in Schweden bekannt, dass das Komitee seine Bemühungen eingestellt habe, Bob Dylan über seine Ehrung mit dem Literaturnobelpreis für Literator zu informieren, nachdem es nicht gelungen war, ihn persönlich zu erreichen.",BeetleLM/beetlelm_bul-deu_part_time,step-20000,deu,6.061425685882568,428.9866012327458
4,Danius sagte: „Im Moment unternehmen wir nichts. Ich habe seinen engsten Mitarbeiter angerufen und ihm E-Mails geschickt und sehr freundliche Antworten erhalten. Das ist vorläufig genug.“,BeetleLM/beetlelm_bul-deu_part_time,step-20000,deu,6.4108662605285645,608.4205035127445
5,"Rings CEO Jamie Siminoff sagte einmal, dass er das Unternehmen gegründet habe, nachdem er von seiner Garagenwerkstatt aus seine Türklingel nicht hören konnte.",BeetleLM/beetlelm_bul-deu_part_time,step-20000,deu,5.835175514221191,342.1247765446696
6,"Er sagte, dass er eine WLAN-Türklingel gebaut habe.",BeetleLM/beetlelm_bul-deu_part_time,step-20000,deu,4.791708946228027,120.50713300343769
7,"Siminoff sagte, die Verkäufe seien nach seinem Auftritt in einer Folge von „Shark Tank“ im Jahre 2013 stark gestiegen, obwohl die Jury der Sendung die Finanzierung seines Start-ups abgelehnt hatte.",BeetleLM/beetlelm_bul-deu_part_time,step-20000,deu,5.916865825653076,371.2463378358646
8,Ende 2017 trat Siminoff im Teleshopping-Sender QVC auf.,BeetleLM/beetlelm_bul-deu_part_time,step-20000,deu,6.571099281311035,714.1544684522419
9,Ring hat außerdem eine Rechtsstreitigkeit mit der konkurrierenden Sicherheitsfirma ADT Corporation beigelegt.,BeetleLM/beetlelm_bul-deu_part_time,step-20000,deu,6.537691593170166,690.6903420613907
10,"Während ein experimenteller Impfstoff in der Lage zu sein scheint, die Ebola-Mortalität zu senken, gibt es bisher keine Medikamente, die als eindeutig zur Behandlung bestehender Infektionen geeignet nachgewiesen wurden.",BeetleLM/beetlelm_bul-deu_part_time,step-20000,deu,6.078735828399658,436.4770638894964
11,"Ein Antikörper-Cocktail, ZMapp, erwies sich zunächst als vielversprechend, formelle Studien zeigten jedoch, dass er, was die Verhinderung von Todesfällen anbelangt, weniger Vorteile brachte als erhofft.",BeetleLM/beetlelm_bul-deu_part_time,step-20000,deu,6.773961544036865,874.7704805769898
12,"In der PALM-Studie diente ZMapp als Kontrolle, d.h. die Wissenschaftler verwendeten es als Ausgangsbasis und verglichen die drei anderen Behandlungen damit.",BeetleLM/beetlelm_bul-deu_part_time,step-20000,deu,6.724418640136719,832.4878608083701
13,"USA Gymnastics unterstützt den Brief des Olympischen Komitees der Vereinigten Staaten und akzeptiert es als absolute Notwendigkeit, dass sich die olympische Familie für ein sicheres Umfeld für alle unsere Sportler einsetzt.",BeetleLM/beetlelm_bul-deu_part_time,step-20000,deu,5.558198928833008,259.3552980651468
14,"Wir stimmen mit der Aussage des USOC überein, dass den Interessen unserer Athleten und Vereine und ihres Sports besser gedient ist, wenn wir innerhalb unserer Organisation sinnvolle Veränderungen vorantreiben, anstatt eine Dezertifizierung vorzunehmen.",BeetleLM/beetlelm_bul-deu_part_time,step-20000,deu,6.526855945587158,683.2466662803716
15,"USA Gymnastics unterstützt eine unabhängige Untersuchung, die ans Licht bringen könnte, wie Missbrauch in dem Ausmaß, das von den Überlebenden von Lary Nassar so mutig beschrieben wurde, so lange unentdeckt bleiben konnte, und heißt alle notwendigen und angemessenen Veränderungen willkommen.",BeetleLM/beetlelm_bul-deu_part_time,step-20000,deu,6.026885986328125,414.422500617488
16,"USA Gymnastics und das USOC haben das gleiche Ziel - den Turnsport und andere Sportarten für die Athleten so sicher wie möglich zu machen, damit sie ihren Träumen in einer sicheren, positiven und selbstbestimmten Umgebung folgen können.",BeetleLM/beetlelm_bul-deu_part_time,step-20000,deu,6.46284294128418,640.8804546258971
17,Während der 1960er-Jahre arbeitete Brzezinski als Berater für John F. Kennedy sowie anschließend für die Regierung rund um Lyndon B. Johnson.,BeetleLM/beetlelm_bul-deu_part_time,step-20000,deu,5.580928325653076,265.3177928109655
18,Während der Wahlen im Jahre 1976 beriet er Carter in der Außenpolitik und diente dann von 1977 bis 1981 in Nachfolge von Henry Kissinger als als nationaler Sicherheitsberater (NSA).,BeetleLM/beetlelm_bul-deu_part_time,step-20000,deu,6.105813026428223,448.4571007526213
19,"Als nationaler Sicherheitsberater unterstützte er Carter bei der diplomatischen Handhabung von Weltangelegenheiten wie dem Camp-David-Abkommen von 1978, der Normalisierung der Beziehungen zwischen den USA und China Ende der 1970er Jahre, der iranischen Revolution, die zur Geiselkrise im Iran 1979 führte, und der sowjetischen Invasion in Afghanistan 1979.",BeetleLM/beetlelm_bul-deu_part_time,step-20000,deu,5.53048038482666,252.26506623073487
20,Der Film mit Ryan Gosling und Emma Stone hat Nominierungen in allen Hauptkategorien erhalten.,BeetleLM/beetlelm_bul-deu_part_time,step-20000,deu,5.9286980628967285,375.665102966836
21,Gosling und Stone wurden als bester Schauspieler beziehungsweise beste Schauspielerin nominiert.,BeetleLM/beetlelm_bul-deu_part_time,step-20000,deu,6.8935675621032715,985.9124544823774
22,"Weitere Nominierungen gibt es zum Beispiel für den besten Film, die Regie, die Kameraführung, das Kostümbild, den Schnitt, die Original-Filmmusik, das Produktionsdesign, den Tonschnitt, die Tonmischung und das Original-Drehbuch.",BeetleLM/beetlelm_bul-deu_part_time,step-20000,deu,5.414352893829346,224.6071539664474
23,"Zwei Lieder aus dem Kinofilm, Audition (The Fools Who Dream) und City of Stars, bekamen Nominierungen für das beste eigenständige Lied. Lionsgate Studio bekam 26 Nominierungen – mehr als jedes andere Filmstudio.",BeetleLM/beetlelm_bul-deu_part_time,step-20000,deu,6.239327430725098,512.5136940356234
24,"Am späten Sonntag kündigte der Präsident der Vereinigten Staaten, Donald Trump, in einer durch den Pressesekretär verlesenen Erklärung an, dass die US-Truppen Syrien verlassen würden.",BeetleLM/beetlelm_bul-deu_part_time,step-20000,deu,5.530886650085449,252.3675735843289
25,Die Ankündigung erfolgte nach einem Telefongespräch von Trump mit dem türkischen Präsidenten Recep Tayyip Erdoğan.,BeetleLM/beetlelm_bul-deu_part_time,step-20000,deu,6.130967140197754,459.8807147976567
26,"Die Türkei würde die Überwachung gefasster ISIS-Kämpfer durchführen, deren Rückführung, so hieß es in dem Statement, von europäischen Ländern abgelehnt wurde.",BeetleLM/beetlelm_bul-deu_part_time,step-20000,deu,4.977458477020264,145.10512460607328
27,"Dies bestätigt nicht nur, dass zumindest einige Dinosaurier Federn hatten, eine Theorie, die bereits weit verbreitet ist, sondern liefert auch Details, die Fossilien im Allgemeinen nicht liefern können, wie etwa Farbe und dreidimensionale Anordnung.",BeetleLM/beetlelm_bul-deu_part_time,step-20000,deu,5.320052146911621,204.3945402590945
28,"Wissenschaftler sagen, dass das Gefieder dieses Tieres auf der Oberseite kastanienbraun und auf der Unterseite hell- oder carotinoidfarben war.",BeetleLM/beetlelm_bul-deu_part_time,step-20000,deu,6.137609004974365,462.9453464871675
29,Der Fund gewährt auch Einblicke in die Evolution von Federn bei Vögeln.,BeetleLM/beetlelm_bul-deu_part_time,step-20000,deu,5.732025146484375,308.59358320968386
30,"Weil die Dinosaurierfedern keinen gut entwickelten Schaft besitzen, der Rachis genannt wird, aber andere Merkmale von Federn besitzen – Widerhaken und Barbules – schlossen die Forscher daraus, dass die Rachis vermutlich eine spätere evolutionäre Entwicklung war als diese anderen Merkmale.",BeetleLM/beetlelm_bul-deu_part_time,step-20000,deu,6.086615085601807,439.92976342985816
31,"Die Struktur der Federn lässt vermuten, dass sie nicht zum Fliegen,, sondern eher zur Temperaturregulierung oder zum Herzeigen verwendet wurden. Die Forscher vermuteten, dass die Probe, obwohl es sich um den Schwanz eines jungen Dinosauriers handelt, das Gefieder eines Ausgewachsenen zeigt und nicht die Daunen eines Kükens.",BeetleLM/beetlelm_bul-deu_part_time,step-20000,deu,5.494062423706055,243.243360007793
32,"Die Forscher behaupteten, dass, obwohl dies der Schwanz eines jungen Dinosauriers ist, die Probe das Gefieder eines Erwachsenen und keine Kükendaunen zeigt.",BeetleLM/beetlelm_bul-deu_part_time,step-20000,deu,5.698473930358887,298.41165633719606
33,"Eine Autobombe detonierte am Morgen des gestrigen Tages im Polizeipräsidium des türkischen Gaziantep, tötete zwei Polizisten und verwundete über zwanzig weitere Menschen.",BeetleLM/beetlelm_bul-deu_part_time,step-20000,deu,6.46815299987793,644.2926187696671
34,Nach Angaben des Gouverneursbüros handelt es sich bei neunzehn der Verletzten um Polizeibeamte.,BeetleLM/beetlelm_bul-deu_part_time,step-20000,deu,6.333377361297607,563.0550264568182
35,"Die Polizei sagte, dass sie einen militanten Anhänger von Daesh (ISIL) hinter dem Angriff vermuten.",BeetleLM/beetlelm_bul-deu_part_time,step-20000,deu,5.746355056762695,313.0475377372526
36,"Sie haben herausgefunden, dass die Sonne auf Basis derselben Grundprinzipien funktioniert, wie andere Sterne: Es wurde herausgefunden, dass die Aktivität aller Sterne im System durch ihre Leuchtkraft, Rotation und sonst nichts angetrieben wird.",BeetleLM/beetlelm_bul-deu_part_time,step-20000,deu,5.619536876678467,275.76164200949637
37,"Um die Rossby-Zahl eines Sterns zu bestimmen, die mit dem Plasmastrom in Zusammenhang steht, werden die Leuchtkraft und die Rotation gemeinsam einbezogen.",BeetleLM/beetlelm_bul-deu_part_time,step-20000,deu,5.7940192222595215,328.3300072532501
38,"Je kleiner die Rossby-Zahl ist, umso weniger aktiv ist der Stern in Bezug auf Umpolungen des Magnetfelds.",BeetleLM/beetlelm_bul-deu_part_time,step-20000,deu,6.316072940826416,553.3955027985584
39,Während der Reise geriet Iwasaki bei vielen Gelegenheiten in Schwierigkeiten.,BeetleLM/beetlelm_bul-deu_part_time,step-20000,deu,6.0203022956848145,411.70303296758874
40,"Er wurde von Piraten ausgeraubt, in Tibet von einem tollwütigen Hund angegriffen, konnte einer Heirat in Nepal entfliehen und wurde in Indien verhaftet.",BeetleLM/beetlelm_bul-deu_part_time,step-20000,deu,5.988239288330078,398.71197471280493
41,"Der 802.11n-Standard läuft auf den Frequenzen 2,4 Ghz sowie 5,0 Ghz.",BeetleLM/beetlelm_bul-deu_part_time,step-20000,deu,6.179272651672363,482.64078069006797
42,"Dadurch kann er abwärtskompatibel mit 802.11a, 802.11b und 802.11g sein, vorausgesetzt, die Basisstation verfügt über Dual-Radio.",BeetleLM/beetlelm_bul-deu_part_time,step-20000,deu,6.434051513671875,622.6916881272674
43,"Die Geschwindigkeit von 802,11 n ist wesentlich schneller als die der Vorgänger, die einen maximalen theoretischen Durchsatz von 600 Mbit/s hatten.",BeetleLM/beetlelm_bul-deu_part_time,step-20000,deu,6.286298751831055,537.1614772554592
44,"Duvall, verheiratet und zwei erwachsene Kinder, hat keinen großen Eindruck auf Miller gemacht, dem die Geschichte erzählt wurde.",BeetleLM/beetlelm_bul-deu_part_time,step-20000,deu,5.780319690704346,323.8627097670709
45,"""Als er nach einem Kommentar gefragt wurde, sagte Miller: """"Mike spricht sehr viel während der Anhörung ... ich habe mich vorbereitet und konnte daher nicht richtig hören, was er sagte.""""""",BeetleLM/beetlelm_bul-deu_part_time,step-20000,deu,5.0269317626953125,152.4644970470927
46,"„Wir werden uns bemühen, die Kohlendioxidemissionen pro BIP-Einheit bis 2020 gegenüber dem Niveau von 2005 deutlich zu senken“, sagte Hu.",BeetleLM/beetlelm_bul-deu_part_time,step-20000,deu,6.831264495849609,926.361452400213
47,"Er nannte keine Zahl für die Kürzungen, sondern sagte, sie würden auf der Grundlage der Wirtschaftsleistung Chinas vorgenommen.",BeetleLM/beetlelm_bul-deu_part_time,step-20000,deu,5.451391696929932,233.08232024254954
48,"Hu ermutigte Entwicklungsländer „den alten Weg von erst verschmutzen und hinterher aufzuräumen, zu vermeiden“.",BeetleLM/beetlelm_bul-deu_part_time,step-20000,deu,7.0481109619140625,1150.6830043839186
49,"Er fügte hinzu, dass „sie jedoch nicht dazu aufgefordert werden sollten, Verpflichtungen einzugehen, die über ihren Entwicklungsstand, ihre Verantwortung und ihre Fähigkeiten hinausgehen“.",BeetleLM/beetlelm_bul-deu_part_time,step-20000,deu,5.554296970367432,258.3452762772907
50,Die Studiengruppe zum Irak stellte heute um 12:00 Uhr GMT ihren Bericht vor.,BeetleLM/beetlelm_bul-deu_part_time,step-20000,deu,6.556955814361572,704.1249416609185
51,"Er warnt davor, dass niemand garantieren kann, dass irgendeine Vorgehensweise im Irak zu diesem Zeitpunkt die sektiererische Kriegsführung, die wachsende Gewalt oder ein Abgleiten ins Chaos stoppen wird.",BeetleLM/beetlelm_bul-deu_part_time,step-20000,deu,5.972694396972656,392.5619648426994
52,Der Bericht fängt an mit der Bitte um einen offenen Diskurs und um Konsensbildung in den USA über eine Strategie für den Mittleren Osten.,BeetleLM/beetlelm_bul-deu_part_time,step-20000,deu,5.967720031738281,390.6140670466003
53,Der Bericht steht fast jedem Aspekt der gegenwärtigen Politik der Exekutive im Hinblick auf den Irak äußerst kritisch gegenüber und drängt auf einen sofortigen Richtungswechsel.,BeetleLM/beetlelm_bul-deu_part_time,step-20000,deu,6.784979820251465,884.4622385394496
54,"Die erste der 78 Empfehlungen ist, dass eine neue diplomatische Initiative vor Ende dieses Jahres ergriffen werden sollte, um die irakischen Grenzen gegenüber feindlichen Interventionen zu sichern und diplomatische Beziehungen mit seinen Nachbarn wiederherzustellen.",BeetleLM/beetlelm_bul-deu_part_time,step-20000,deu,6.208069324493408,496.74127866735137
55,"Die derzeitige Senatorin und argentinische First Lady Cristina Fernandez de Kirchner gab gestern Abend in La Plata, einer Stadt 50 Kilometer von Buenos Aires entfernt, ihre Präsidentschaftskandidatur bekannt.",BeetleLM/beetlelm_bul-deu_part_time,step-20000,deu,6.116011619567871,453.0541340547164
56,"Frau Kirchner kündigte ihre Absicht, als Präsidentin zu kandidieren, im Argentinischen Theater an. Dort begann sie 2005 auch ihre Kampagne für den Senat als Mitglied der Delegation der Provinz Buenos Aires.",BeetleLM/beetlelm_bul-deu_part_time,step-20000,deu,5.655487060546875,285.8556778483152
57,"""Auslöser der Debatte war eine Kontroverse über die Ausgaben für die Nothilfe und den Wiederaufbau nach dem Hurrikan Katrina, die einige fiskalisch Konservative humorvoll als """"Bushs New Orleans-Deal"""" bezeichnet haben. """,BeetleLM/beetlelm_bul-deu_part_time,step-20000,deu,6.037314414978027,418.766889298063
58,"Die Kritik der Liberalen am Wiederaufbauprozess hat sich darauf konzentriert, dass Aufträge für den Wiederaufbau an vermeintliche Insider in Washingtoner vergeben wurden.",BeetleLM/beetlelm_bul-deu_part_time,step-20000,deu,6.513973236083984,674.5010525150204
59,"Es kamen mehr als vier Millionen Menschen nach Rom, um an der Beerdigung teilzunehmen.",BeetleLM/beetlelm_bul-deu_part_time,step-20000,deu,4.61965799331665,101.45932642736655
60,"Die Teilnehmerzahl war so groß, dass es nicht allen möglich war, Zugang zur Bestattung auf dem Petersplatz zu erhalten.",BeetleLM/beetlelm_bul-deu_part_time,step-20000,deu,5.569662094116211,262.3454361947648
61,"Mehrere große Fernsehschirme wurden an verschiedenen Orten in Rom aufgestellt, so dass die Leute die Zeremonie ansehen konnten.",BeetleLM/beetlelm_bul-deu_part_time,step-20000,deu,5.2713212966918945,194.67301339631177
62,"In vielen anderen Städten in Italien und dem Rest der Welt, besonders in Polen, wurden ähnliche Einrichtungen installiert, die von zahlreichen Menschen gesehen wurden.",BeetleLM/beetlelm_bul-deu_part_time,step-20000,deu,5.104795932769775,164.81043469085208
63,"Historiker haben die Politik des FBI aus früherer Zeit kritisiert, seine Ressourcen in der Absicht, die Erfolgsquote der Behörde zu steigern, auf einfach zu lösende Fälle, insbesondere auf Fälle von Autodiebstahl, zu konzentrieren.",BeetleLM/beetlelm_bul-deu_part_time,step-20000,deu,5.909701347351074,368.59605678081056
64,"Der Kongress begann im August 2005 mit der Finanzierung der anti-Obszönitätsinitiative und legte fest, dass das FBI 10 Agenten für die Erwachsenenpornographie einsetzen muss.",BeetleLM/beetlelm_bul-deu_part_time,step-20000,deu,6.3372297286987305,565.2283047312146
65,"Robin Uthappa erreichte die höchste Punktzahl der Innings, 70 Punkte bei nur 41 Bällen, indem er 11 Vierer und 2 Sechser schlug.",BeetleLM/beetlelm_bul-deu_part_time,step-20000,deu,6.485145568847656,655.3343535627321
66,"Die Schlagmänner der mittleren Reihe, Sachin Tendulkar und Rahul Dravid, zeigten gute Leistungen und erzielten eine Partnerschaft mit 100 Runs.",BeetleLM/beetlelm_bul-deu_part_time,step-20000,deu,6.627523899078369,755.6088885158664
67,"Doch nach dem Verlust des Tors des Kapitäns erzielte Indien nur 36 Runden und verlor 7 Tore, womit die Innings beendet waren.",BeetleLM/beetlelm_bul-deu_part_time,step-20000,deu,6.200240135192871,492.8673816875783
68,Der US-amerikanische Präsident George W. Bush traf am 16. November morgens in Singapur ein und begann eine einwöchige Reise durch Asien.,BeetleLM/beetlelm_bul-deu_part_time,step-20000,deu,5.58491849899292,266.37857173288205
69,"Er wurde von Wong Kan Seng, dem stellvertretenden Premierminister Singapurs, begrüßt und sprach mit Lee Hsien Loong, dem Premierminister Singapurs, über Handels- und Terrorismusangelegenheiten.",BeetleLM/beetlelm_bul-deu_part_time,step-20000,deu,5.405241966247559,222.57006841313517
70,Nach einer Woche voller Verluste in der Zwischenwahl erzählte Bush dem Publikum von der Ausweitung des Handels in Asien.,BeetleLM/beetlelm_bul-deu_part_time,step-20000,deu,6.083669185638428,438.6356814098406
71,"""Premierminister Stephen Harper hat nach einem 25-minütigen Treffen mit NDP-Leader Jack Layton am Dienstag im PMO zugestimmt, den """"Clean Air Act"""" der Regierung an ein Komitee aller Parteien zur Prüfung vor der zweiten Anhörung zu schicken.""",BeetleLM/beetlelm_bul-deu_part_time,step-20000,deu,6.202522277832031,493.9934598014838
72,Layton hatte während des Treffens mit dem Premierminister Änderungen am Umweltgesetz der Konservativen gefordert und dabei eine „gründliche und vollständige Neufassung“ des Umweltgesetzes der Konservativen Partei verlangt.,BeetleLM/beetlelm_bul-deu_part_time,step-20000,deu,5.779867172241211,323.7161890655421
73,"Nachdem die Bundesregierung eingesprungen ist, um die Finanzierung des Mersey-Krankenhauses in Devonport (Tasmanien) zu übernehmen, haben die Landesregierung und einige Parlamentsmitglieder den Vorgang als PR-Gag im Vorfeld der für November anberaumten Bundeswahl kritisiert.",BeetleLM/beetlelm_bul-deu_part_time,step-20000,deu,6.234811782836914,510.2045801518777
74,"Premierminister John Howard sagte jedoch, die Maßnahme, 45 Millionen australische Dollar bereitzustellen, diene nur dazu, die Krankenhauseinrichtungen vor einer Herabstufung durch die tasmanische Regierung zu bewahren.",BeetleLM/beetlelm_bul-deu_part_time,step-20000,deu,6.27623176574707,531.7810081328395
75,"Laut dem aktuellen Bulletin deuteten die Messungen des Meeresspiegels darauf hin, dass ein Tsunami ausgelöst wurde. In der Nähe von Pago Pago und Niue wurde eine eindeutige Tsunami-Aktivität aufgezeichnet.",BeetleLM/beetlelm_bul-deu_part_time,step-20000,deu,5.329803466796875,206.39740622660383
76,"Es wurden keine nennenswerten Schäden oder Verletzungen aus Tonga vermeldet. Doch der Strom fiel zeitweise aus, was Berichten zufolge der Grund dafür war, dass die tongaischen Behörden die Tsunami-Warnung des PTWC nicht erhalten hatten.",BeetleLM/beetlelm_bul-deu_part_time,step-20000,deu,5.937460899353027,378.9714602031764
77,"Vierzehn Schulen in Hawaii, die an oder in der Nähe von Küsten liegen, waren den ganzen Mittwoch geschlossen, obwohl die Warnungen aufgehoben worden waren.",BeetleLM/beetlelm_bul-deu_part_time,step-20000,deu,5.299221038818359,200.18081614102599
78,U.S.-Präsident George W. Bush begrüßte die Bekanntgabe.,BeetleLM/beetlelm_bul-deu_part_time,step-20000,deu,6.2727837562561035,529.9505796505329
79,"""Bush-Sprecher Gordon Johndroe nannte das Versprechen Nordkoreas „einen wichtigen Schritt in Richtung des Ziels, die verifizierbare Entnuklearisierung der koreanischen Halbinsel zu erreichen.""""""",BeetleLM/beetlelm_bul-deu_part_time,step-20000,deu,5.816274166107178,335.71888772540973
80,"Der zehnte Sturm der atlantischen Hurrikan-Saison, der einen Namen erhielt, der subtropische Sturm Jerry, ist heute im Atlantischen Ozean entstanden.",BeetleLM/beetlelm_bul-deu_part_time,step-20000,deu,5.150381565093994,172.4972967085772
81,"Das National Hurricane Center (NHC) sagt, dass Jerry zu diesem Zeitpunkt keine Gefahr für die Landung darstellt.",BeetleLM/beetlelm_bul-deu_part_time,step-20000,deu,5.642488479614258,282.1640049189941
82,"Der US-amerikanische Ingenieurskorps schätzte , dass 6 Zoll Regen die schon zuvor beschädigten Dämme brechen lassen könnten.",BeetleLM/beetlelm_bul-deu_part_time,step-20000,deu,7.106146335601807,1219.4391703521082
83,"Der Ninth Ward, der während des Hurrikans Katrina bis zu 20 Fuß hoch überflutet war, führt derzeit hüfthohes Wasser, da der nahe gelegene Deich überspült wurde.",BeetleLM/beetlelm_bul-deu_part_time,step-20000,deu,6.046002388000488,422.42097504976374
84,Auf einem 100 Fuß langen Teilabschnitt läuft Wasser über den Damm.,BeetleLM/beetlelm_bul-deu_part_time,step-20000,deu,6.526012897491455,682.6708992132344
85,"Der Commons-Administrator Adam Cuerden hat seine Enttäuschung über die Entfernungen zum Ausdruck gebracht, als er im letzten Monat mit Wikinews redete.",BeetleLM/beetlelm_bul-deu_part_time,step-20000,deu,6.101441383361816,446.5008854305877
86,"""""""Er [Wales] hat uns im Grunde von Anfang an belogen. Erstens, indem er so tat, als ob dies aus rechtlichen Gründen geschah. Zweitens, indem er so tat, als würde er uns zuhören, bis hin zu seiner Kunstlöschung.""""""",BeetleLM/beetlelm_bul-deu_part_time,step-20000,deu,5.665262699127197,288.66380288609446
87,"Die Irritationen in der Community führten zu den derzeitigen Bemühungen, eine Richtlinie bezüglich sexueller Inhalte für die Website zu entwerfen, die Millionen offen lizenzierter Medien hostet.",BeetleLM/beetlelm_bul-deu_part_time,step-20000,deu,6.231204509735107,508.36744840357426
88,"Die Arbeit war größtenteils theoretischer Natur, doch das Programm wurde geschrieben, um Beobachtungen zu simulieren, die von der Sagittarius-Galaxie gemacht wurden.",BeetleLM/beetlelm_bul-deu_part_time,step-20000,deu,5.259066104888916,192.30181768476183
89,"Der Effekt, nach dem das Team suchte, würde von Gezeitenkräften zwischen der dunklen Materie der Galaxie und der dunklen Materie der Milchstraße verursacht werden.",BeetleLM/beetlelm_bul-deu_part_time,step-20000,deu,5.752063751220703,314.8397411847679
90,"Genau wie der Mond die Erde anzieht und die Gezeiten verursacht, übt auch die Milchstraße Anziehungskräfte auf die Sagittarius-Galaxie aus.",BeetleLM/beetlelm_bul-deu_part_time,step-20000,deu,5.1644287109375,174.93749014434127
91,"Die Wissenschaftler kamen zu dem Schluss, dass die dunkle Materie auf andere dunkle Materie in der gleichen Weise wirkt wie normale Materie.",BeetleLM/beetlelm_bul-deu_part_time,step-20000,deu,5.982996940612793,396.62725708405117
92,"Diese Theorie besagt, dass sich der größte Teil der dunklen Materie in einer Art Halo um eine Galaxie befindet und aus vielen kleinen Partikeln besteht.",BeetleLM/beetlelm_bul-deu_part_time,step-20000,deu,5.130618572235107,169.12169968368198
93,"Fernsehberichte zeigen, dass weißer Rauch aus der Anlage entweicht.",BeetleLM/beetlelm_bul-deu_part_time,step-20000,deu,6.18202543258667,483.97121537707716
94,"Die lokalen Behörden ermahnen die Einwohner in der Nähe der Anlage dazu, sich innerhalb von Gebäuden aufzuhaltem, Klimaanlagen auszuschalten und kein Leitungswasser zu trinken.",BeetleLM/beetlelm_bul-deu_part_time,step-20000,deu,6.341978549957275,567.9188563387038
95,Der Nuklearbehörde von Japan zufolge wurden radioaktives Cäsium und Jod im Atomkraftwerk festgestellt.,BeetleLM/beetlelm_bul-deu_part_time,step-20000,deu,6.351119518280029,573.1339839591303
96,"Die Behörden spekulieren, dass dies darauf hindeutet, dass Behälter mit Uran-Kraftstoff am Standort gerissen sein könnten und eventuell undicht sind.",BeetleLM/beetlelm_bul-deu_part_time,step-20000,deu,6.838491916656494,933.0809093579468
97,Die extrem-arzneimittelresistente Tuberkulose (XDR-TB) wurde von Dr. Tony Moll in der südafrikanischen Region KwaZulu-Natal entdeckt.,BeetleLM/beetlelm_bul-deu_part_time,step-20000,deu,5.565654277801514,261.29610803732857
