sentence_id,sentence,repo,revision,iso_code,nll,ppl
742,"De twee torens hebben een hoogte van 83 meter. Het gebouw heeft een lengte van 378 meter en heeft twee doorgangen met een breedte van 3,50 meter.",BeetleLM/beetlelm_fas-nld_simultaneous,step-10000,nld,5.852901458740234,348.2433297113525
743,"Onder de brug is de doorvaarthoogte 15 meter. In augustus 2011 werd de bouw van de brug voltooi, maar deze ging pas open voor verkeer in maart 2017.",BeetleLM/beetlelm_fas-nld_simultaneous,step-10000,nld,6.474029541015625,648.0899775881604
744,Volgens de planning is de brug volledig operationeel in september 2017. Naar verwachting zijn de Braziliaanse douaneposten dan klaar voor gebruik.,BeetleLM/beetlelm_fas-nld_simultaneous,step-10000,nld,6.90310001373291,995.3555537031682
745,"De Guaraní was de meest opvallende inheemse groep. Ze woonden in het gebied dat nu Oost-Paraguay is, leefden als semi-nomadische jagers en deden ook aan zelfvoorzienende landbouw.",BeetleLM/beetlelm_fas-nld_simultaneous,step-10000,nld,6.561656475067139,707.4425855561956
746,"In de provincie Chaco leefden andere inheemse stammen, waaronder de Guaycurú en Payaguá, die hun voedsel vonden door te jagen, vissen en verzamelen.",BeetleLM/beetlelm_fas-nld_simultaneous,step-10000,nld,6.441551208496094,627.3792413961969
747,"Paraguay, voorheen ook wel 'de grote provincie van Indië' genoemd, ontstond in de 16e eeuw toen Spaanse kolonisten de inheemse bevolking tegenkwamen.",BeetleLM/beetlelm_fas-nld_simultaneous,step-10000,nld,6.137730598449707,463.00164104319623
748,Er volgde een drie eeuwen durende kolonisatieperiode onder de Spanjaarden.,BeetleLM/beetlelm_fas-nld_simultaneous,step-10000,nld,6.738755226135254,844.5088587563722
749,Asunción werd in 1537 gesticht en sindsdien heeft Paraguay veel van zijn inheemse karakter en identiteit weten te behouden.,BeetleLM/beetlelm_fas-nld_simultaneous,step-10000,nld,7.806829452514648,2457.326999302004
750,Argentinië staat bekend om het feit dat het een van de beste poloteams en -spelers ter wereld heeft.,BeetleLM/beetlelm_fas-nld_simultaneous,step-10000,nld,6.159839630126953,473.3521573221803
751,In december vindt het grootste toernooi van het jaar plaats op de polovelden in Las Cañitas.,BeetleLM/beetlelm_fas-nld_simultaneous,step-10000,nld,6.2069010734558105,496.16129900001823
752,Hier zijn op andere tijden in het jaar ook kleinere toernooien en wedstrijden te zien.,BeetleLM/beetlelm_fas-nld_simultaneous,step-10000,nld,6.572951316833496,715.4783334404235
753,Check de Asociación Argentina de Polo voor meer informatie over toernooien en het kopen van tickets voor polowedstrijden.,BeetleLM/beetlelm_fas-nld_simultaneous,step-10000,nld,7.751819133758545,2325.7995090227464
754,De officiële munt van de Falklandeilanden is het Falklandeilands pond (FKP). De waarde ligt ongeveer op één Brits pond (GBP).,BeetleLM/beetlelm_fas-nld_simultaneous,step-10000,nld,6.991061687469482,1086.8747851910623
755,"Op de eilanden is er maar één bank, namelijk in Stanley tegenover de winkel FIC West. Hier kunt u geld inwisselen.",BeetleLM/beetlelm_fas-nld_simultaneous,step-10000,nld,6.686015605926514,801.1238913255802
756,In het algemeen worden Britse ponden overal op de eilanden aanvaard en in Stanley kun je ook vaak betalen met creditcards en Amerikaanse dollars.,BeetleLM/beetlelm_fas-nld_simultaneous,step-10000,nld,6.845682144165039,939.8141511415852
757,"Op de afgelegen eilanden kan je waarschijnlijk niet met een creditcard betalen, maar waarschijnlijk wel met de Britse en Amerikaanse valuta. Vraag de eigenaren van tevoren op welke manier je kunt betalen.",BeetleLM/beetlelm_fas-nld_simultaneous,step-10000,nld,6.1735076904296875,479.86638013496884
758,"Wissel uw geld weer in vóór u van de eilanden vertrekt, want Falklandse valuta zijn erbuiten heel moeilijk in te wisselen.",BeetleLM/beetlelm_fas-nld_simultaneous,step-10000,nld,6.46241569519043,640.6066994396787
759,"Montevideo ligt beneden de evenaar, dus als het daar zomer is, is het winter op het noordelijk halfrond en andersom.",BeetleLM/beetlelm_fas-nld_simultaneous,step-10000,nld,6.045858860015869,422.36035016934153
760,Montevideo bevindt zich in de subtropen. In de zomermaanden komen gerust temperaturen hoger dan +30°C voor.,BeetleLM/beetlelm_fas-nld_simultaneous,step-10000,nld,6.948585510253906,1041.675246651496
761,"De winter kan bedrieglijk koud zijn: de temperatuur gaat bijna nooit onder nul, maar de wind in combinatie met de luchtvochtigheid zorgt ervoor dat het kouder aanvoelt dan dat de thermometer aangeeft.",BeetleLM/beetlelm_fas-nld_simultaneous,step-10000,nld,6.2758917808532715,531.6002413539935
762,"Het regenniveau blijft gedurende het hele jaar ongeveer gelijk, zonder herkenbare 'natte' en 'droge' perioden.",BeetleLM/beetlelm_fas-nld_simultaneous,step-10000,nld,7.510316371917725,1826.7913969009073
763,"Veel van de dieren in het park zijn eraan gewend mensen te zien, maar wilde dieren zijn uiteindelijk wel gewoon wild. Daarom moeten ze niet worden gevoerd of gestoord.",BeetleLM/beetlelm_fas-nld_simultaneous,step-10000,nld,5.7661662101745605,319.31121096471594
764,"Houd in het park minstens 100 meter afstand van beren en wolven, en 25 meter van alle andere wilde dieren.",BeetleLM/beetlelm_fas-nld_simultaneous,step-10000,nld,6.470030307769775,645.5032904337135
765,"Elanden, bizons, rendieren, beren en ongeveer alle andere grote dieren kunnen u aanvallen, hoe tam ze ook lijken.",BeetleLM/beetlelm_fas-nld_simultaneous,step-10000,nld,6.378807544708252,589.2246644987983
766,"Elk jaar raken tientallen bezoekers gewond omdat ze geen gepaste afstand houden. Deze dieren zijn groot, wilde en mogelijk gevaarlijk, dus geef ze de ruimte.",BeetleLM/beetlelm_fas-nld_simultaneous,step-10000,nld,6.379477500915527,589.6195514839824
767,"Bovendien moet u zich ervan bewust zijn dat geuren beren en andere wilde dieren aantrekken, dus vermijd het dragen of koken van geurend voedsel en houd de kampeerplek schoon.",BeetleLM/beetlelm_fas-nld_simultaneous,step-10000,nld,7.131635665893555,1250.9213839090544
768,De hoofdstad van Samoa is Apia en de stad met bijna 40.000 inwoners ligt op het eiland Upolu.,BeetleLM/beetlelm_fas-nld_simultaneous,step-10000,nld,6.041165828704834,420.38284370081595
769,Rond het jaar 1850 werd Apia opgericht en het is de officiële hoofdstad van Samoa vanaf 1959.,BeetleLM/beetlelm_fas-nld_simultaneous,step-10000,nld,6.207479000091553,496.4481267050367
770,"In 1889 wilden zeven schepen uit Duitsland, de VS en Groot-Brittannië de haven niet verlaten. Dit kwam later bekend te staan als de beruchte patstelling.",BeetleLM/beetlelm_fas-nld_simultaneous,step-10000,nld,6.269382953643799,528.1513834245214
771,Met uitzondering van een Brits slagschip werden alle schepen tot zinken gebracht. Bijna 200 Amerikanen en Duitsers verloren hun leven.,BeetleLM/beetlelm_fas-nld_simultaneous,step-10000,nld,7.0255842208862305,1125.051645714095
772,"In de onafhankelijkheidsstrijd door de Mau-beweging kwam de hoogste leider, Tupua Tamasese Lealofi III, om bij een uit de hand gelopen geweldloze bijeenkomst in de stad.",BeetleLM/beetlelm_fas-nld_simultaneous,step-10000,nld,6.929562568664551,1022.046806526533
773,"Er zijn veel stranden, met name vanwege de twee havens van Auckland. De meest populaire zijn gelegen in drie gebieden.",BeetleLM/beetlelm_fas-nld_simultaneous,step-10000,nld,6.3218584060668945,556.6064326495139
774,"De stranden van North Shore in het district North Harbour strekken zich van noord tot zuid uit langs de Grote Oceaan, van Long Bay naar Devonport.",BeetleLM/beetlelm_fas-nld_simultaneous,step-10000,nld,7.187744140625,1323.115074927124
775,Dit zijn nagenoeg allemaal zandstranden waar veilig kan worden gezwommen en de meeste hebben pohutukawa-bomen die schaduw bieden.,BeetleLM/beetlelm_fas-nld_simultaneous,step-10000,nld,7.405696392059326,1645.330232116909
776,"Bij Waitemata's haven, in de luxe voorsteden van Mission Bay en St Heliers, gelegen in Central Auckland, vind je de Tamaki Drive-stranden.",BeetleLM/beetlelm_fas-nld_simultaneous,step-10000,nld,6.8432416915893555,937.5233756771606
777,Deze familiestranden zijn soms drukbezocht en hebben aan de kust een goed aanbod aan winkels . Zwemmen is niet onveilig.,BeetleLM/beetlelm_fas-nld_simultaneous,step-10000,nld,6.527359962463379,683.5911209289845
778,"'Number One' is het belangrijkste plaatselijke bier dat geen complex bier, maar aangenaam en verfrissend is. Het andere plaatselijke bier heeft de naam 'Manta'.",BeetleLM/beetlelm_fas-nld_simultaneous,step-10000,nld,6.724730014801025,832.7471167973473
779,"Er zijn veel Franse wijnen te vinden, maar de Nieuw-Zeelandse en Australische wijnen zijn wellicht beter geschikt voor reizen.",BeetleLM/beetlelm_fas-nld_simultaneous,step-10000,nld,6.265473365783691,526.0905602970781
780,"Het lokale drinkwater kan gewoon veilig worden gedronken, maar fleswater is ook gemakkelijk te vinden als je het niet vertrouwt.",BeetleLM/beetlelm_fas-nld_simultaneous,step-10000,nld,6.43709135055542,624.5874492303434
781,"Een 'flat white' is een vreemd concept voor Australiërs. Zwarte koffie is 'espresso', cappuccino heeft heel veel koffiemelk (zonder schuim) en thee wordt geserveerd zonder melk.",BeetleLM/beetlelm_fas-nld_simultaneous,step-10000,nld,7.500896453857422,1809.6639677681515
782,"De warme chocolademelk is van Belgische kwaliteit. Vruchtensappen zijn duur, maar geweldig.",BeetleLM/beetlelm_fas-nld_simultaneous,step-10000,nld,6.595926761627197,732.1070611199569
783,Er vinden het hele jaar tochten naar het rif plaats en letsel naar aanleiding van deze tochten naar het rif zijn zeldzaam.,BeetleLM/beetlelm_fas-nld_simultaneous,step-10000,nld,6.102344036102295,446.9041026336265
784,Vraag desondanks deskundig advies en volg alle borden en veiligheidswaarschuwingen op.,BeetleLM/beetlelm_fas-nld_simultaneous,step-10000,nld,7.805131912231445,2453.1591262987054
785,Kubuskwallen komen van oktober tot april voor in de buurt van stranden en riviermondingen ten noorden van Town of 1770. Soms komen ze ook buiten deze periode voor.,BeetleLM/beetlelm_fas-nld_simultaneous,step-10000,nld,6.165245532989502,475.91798215575835
786,"Haaien komen wel degelijk voor, maar ze vallen zelden mensen aan. Het merendeel van de haaien is bang voor mensen en zou juist wegzwemmen.",BeetleLM/beetlelm_fas-nld_simultaneous,step-10000,nld,6.0273051261901855,414.5962380148225
787,De belangrijkste habitat van zoutwaterkrokodillen bevindt zich in de riviermondingen ten noorden van Rockhampton en ze leven normaliter niet in de oceaan.,BeetleLM/beetlelm_fas-nld_simultaneous,step-10000,nld,6.889163017272949,981.5795082108199
788,"Vooraf reserveren zorgt voor gemoedsrust bij de reiziger, wetende dat hij een plek heeft om te slapen wanneer hij op zijn bestemming arriveert.",BeetleLM/beetlelm_fas-nld_simultaneous,step-10000,nld,6.546299934387207,696.661705091535
789,"Reisbureaus hebben vaak deals met bepaalde hotels, al kun je meestal via een reisbureau ook andere accommodatievormen, zoals een campingplek, boeken.",BeetleLM/beetlelm_fas-nld_simultaneous,step-10000,nld,6.798311710357666,896.3327442246382
790,Reisbureaus bieden vaak pakketten met ontbijt en vervoer van en naar het vliegveld aan en soms zelfs pakketten met vlucht en hotel.,BeetleLM/beetlelm_fas-nld_simultaneous,step-10000,nld,7.269358158111572,1435.6287106190937
791,Ze kunnen je ook reservering vasthouden als je nog wat langer over de aanbieding wilt nadenken of als je documenten voor je bestemming moet verwerven (bijv. visum).,BeetleLM/beetlelm_fas-nld_simultaneous,step-10000,nld,6.277661323547363,532.541763463363
792,"Als u een verzoek hebt of een wijziging wilt maken, moet u dit echter via het reisbureau doen in plaats van het hotel.",BeetleLM/beetlelm_fas-nld_simultaneous,step-10000,nld,6.104571342468262,447.9006043317255
793,Voor sommige festivals geldt dat de meerderheid van de aanwezigen op muziekfestivals ervoor kiest om ter plekke te kamperen en de meeste bezoekers beschouwen dit als een belangrijk onderdeel van de ervaring.,BeetleLM/beetlelm_fas-nld_simultaneous,step-10000,nld,7.2549920082092285,1415.151693487109
794,"Als u dicht bij de actie wilt zijn, moet u vroeg zijn om een kampeerplek in de buurt van de muziek te bemachtigen.",BeetleLM/beetlelm_fas-nld_simultaneous,step-10000,nld,5.031871318817139,153.2194670601621
795,"En onthoud het volgende: ook als de muziek op de hoofdpodia is afgelopen, wordt er mogelijk op andere delen van het festivalterrein tot in de late uurtjes muziek gedraaid.",BeetleLM/beetlelm_fas-nld_simultaneous,step-10000,nld,6.654666423797607,776.3988916919279
796,"Voor gezinnen waarvan de kinderen nog jong zijn, zijn er op sommige festivals speciale kampeerterreinen.",BeetleLM/beetlelm_fas-nld_simultaneous,step-10000,nld,6.9132399559021,1005.4997452962168
797,"Let goed op waar uw hut zit als u 's winters de Oostzee overgaat, want de tocht door het ijs maakt een enorm lawaai. als u te dichtbij zit.",BeetleLM/beetlelm_fas-nld_simultaneous,step-10000,nld,5.863966464996338,352.11804165613285
798,Cruises naar Sint-Petersburg omvatten tijd om de stad te verkennen. Passagiers van de cruise zijn vrijgesteld van de visumvereisten (controleer de voorwaarden).,BeetleLM/beetlelm_fas-nld_simultaneous,step-10000,nld,6.869711875915527,962.6711571040788
799,Casino's zetten zich doorgaans in om het meeste te halen uit de tijd en het geld dat gasten besteden. Ramen en klokken zijn normaal gesproken niet aanwezig en de uitgang is soms moeilijk te vinden.,BeetleLM/beetlelm_fas-nld_simultaneous,step-10000,nld,6.018650531768799,411.0235580741597
800,"Ze hebben normaal gesproken speciaal aanbiedingen op het gebied van eten, drinken en entertainment om ze in een goede stemming te houden en om te voorkomen dat ze vertrekken.",BeetleLM/beetlelm_fas-nld_simultaneous,step-10000,nld,5.842474937438965,344.63122677349355
801,"Sommige locaties bieden gratis alcoholische dranken aan. Als mensen dronken zijn, beïnvloedt dat echter hun beoordelingsvermogen en alle doorgewinterde gokkers weten dat het enorm belangrijk is om nuchter te blijven.",BeetleLM/beetlelm_fas-nld_simultaneous,step-10000,nld,6.879456996917725,972.0983640452473
802,"Als je op hoog de bergen in gaat of over bergpassen gaat rijden, moet je er rekening mee houden dat er sneeuw of ijs kan liggen en de temperatuur ontzettend laag kan zijn.",BeetleLM/beetlelm_fas-nld_simultaneous,step-10000,nld,5.894714832305908,363.1132729584556
803,Op ijzige en besneeuwde wegen is er weinig frictie en het rijdt hierdoor anders dan asfalt.,BeetleLM/beetlelm_fas-nld_simultaneous,step-10000,nld,6.922799587249756,1015.1580435135105
804,Tijdens sneeuwstormen kan er in een hele korte periode genoeg sneeuw vallen om vast te komen te zitten.,BeetleLM/beetlelm_fas-nld_simultaneous,step-10000,nld,5.729137420654297,307.7037349856709
805,Ook kan het zicht belemmerd worden door vallende of opwaaiende sneeuw of doordat er condensatie of ijs op de ruiten van het voertuig zit.,BeetleLM/beetlelm_fas-nld_simultaneous,step-10000,nld,6.295480251312256,542.1161358715581
806,Aan de andere kant zijn ijs en sneeuw in veel landen normaal en wordt het verkeer hier niet door belemmerd.,BeetleLM/beetlelm_fas-nld_simultaneous,step-10000,nld,5.614927291870117,274.4934205665378
807,"De grootste toeristische Afrikaanse trekpleister zijn safari's, die voor veel bezoekers het hoogtepunt van hun reis vormen.",BeetleLM/beetlelm_fas-nld_simultaneous,step-10000,nld,6.407336711883545,606.2768390583835
808,"Het begrip safari verwijst in populair gebruik naar reizen over land om de prachtige Afrikaanse wilde dieren te bekijken, met name op de savanne.",BeetleLM/beetlelm_fas-nld_simultaneous,step-10000,nld,6.473956108093262,648.0423881944873
809,"Sommige dieren, zoals olifanten en giraffen, komen vaak dicht bij auto's en een standaarduitrusting maakt een goed uitzicht mogelijk.",BeetleLM/beetlelm_fas-nld_simultaneous,step-10000,nld,5.83907413482666,343.46119464901614
810,"Als je leeuwen, cheeta's en luipaarden wilt zien, heb je een verrekijker nodig. Anders is de kans klein dat je ze ziet.",BeetleLM/beetlelm_fas-nld_simultaneous,step-10000,nld,5.437867641448975,229.95132163292448
811,Een wandelsafari (ook wel een 'boswandeling' of 'loopsafari' genoemd) houdt in dat je meerdere uren of dagen achter elkaar loopt.,BeetleLM/beetlelm_fas-nld_simultaneous,step-10000,nld,6.480314254760742,652.1758634413152
812,De Paralympics zijn van 24 augustus tot 5 september 2021. Sommige onderdelen worden op andere locaties in Japan gespeeld.,BeetleLM/beetlelm_fas-nld_simultaneous,step-10000,nld,6.898074150085449,990.3655823708699
813,Tokio wordt de enige Aziatische stad zijn waar de Olympische Spelen twee keer hebben plaatsgevonden. De eerste keer was in 1964.,BeetleLM/beetlelm_fas-nld_simultaneous,step-10000,nld,5.816138744354248,335.67342716338635
814,"Als je al voordat het uitstel werd aangekondigd vluchten en accommodatie voor 2020 hebt geboekt, kun je in een penibele situatie zitten.",BeetleLM/beetlelm_fas-nld_simultaneous,step-10000,nld,6.925649166107178,1018.0549419212173
815,"Het annuleringsbeleid varieert, maar vanaf eind maart zijn de meeste op coronavirus gebaseerde annuleringsbeleidslijnen niet meer geldig tot juli 2020, toen de Olympische Spelen waren gepland.",BeetleLM/beetlelm_fas-nld_simultaneous,step-10000,nld,7.42341947555542,1674.7504960058286
816,Naar verwachtingen kosten de meeste kaartjes voor evenementen tussen ¥ 2.500 en ¥ 130.000. Normale kaartjes gaan rond ¥ 7.000 kosten.,BeetleLM/beetlelm_fas-nld_simultaneous,step-10000,nld,6.685502529144287,800.712958686267
817,"Je kunt vochtige kleren drogen door ze te strijken. Veel hotels hebben een strijkijzer en een strijkplank beschikbaar. Je kunt deze spullen vaak lenen, zelfs al staan ze niet in de kamer.",BeetleLM/beetlelm_fas-nld_simultaneous,step-10000,nld,6.060532569885254,428.6036374775355
818,"Als er geen strijkijzer voorhanden is of als je geen gestreken sokken wilt dragen, kun je, indien beschikbaar, ook een haardroger gebruiken.",BeetleLM/beetlelm_fas-nld_simultaneous,step-10000,nld,6.573874473571777,716.139137050757
819,"Zorg ervoor dat de stof niet te heet wordt (hierdoor kan de stof krimpen of, in extreme gevallen, verschroeien).",BeetleLM/beetlelm_fas-nld_simultaneous,step-10000,nld,6.707714080810547,818.6970235627324
820,Je kunt water op verschillende manieren zuiveren. Sommige manieren zijn effectief om specifieke risico's tegen te gaan.,BeetleLM/beetlelm_fas-nld_simultaneous,step-10000,nld,6.5124592781066895,673.4806588773164
821,"In sommige gebieden is het voldoende om water een minuut te koken, in andere gebieden moet water enkele minuten worden gekookt.",BeetleLM/beetlelm_fas-nld_simultaneous,step-10000,nld,5.942876815795898,381.0295060374331
822,Niet ieder filter is even effectief. In geval van twijfel kan je het beste water drinken uit een afgesloten fles van een betrouwbaar bedrijf.,BeetleLM/beetlelm_fas-nld_simultaneous,step-10000,nld,6.883559703826904,976.0947911987439
823,Reizigers kunnen te maken krijgen met dierenplagen die er in hun eigen land niet zijn.,BeetleLM/beetlelm_fas-nld_simultaneous,step-10000,nld,5.5148820877075195,248.36069074248167
824,"Ongedierte kan voedsel verderven, irritatie veroorzaken of, in het ergste geval, allergische reacties veroorzaken, gif verspreiden of infecties overbrengen.",BeetleLM/beetlelm_fas-nld_simultaneous,step-10000,nld,7.797160625457764,2433.682023321624
825,"Normaal gesproken worden infectieziekten zelf, of gevaarlijke dieren die met geweld mensen verwonden of doden, niet beschouwd als ongedierte.",BeetleLM/beetlelm_fas-nld_simultaneous,step-10000,nld,7.743117332458496,2305.6486653044353
826,Met belastingvrij winkelen wordt bedoeld dat je op bepaalde locaties goederen kunt kopen die zijn vrijgesteld van belasting en accijnzen.,BeetleLM/beetlelm_fas-nld_simultaneous,step-10000,nld,6.900652885437012,992.922768845601
827,"Reizigers die naar landen met hoge accijnzen gaan, kunnen soms aanzienlijk veel geld besparen, als het gaat om producten als alcoholische dranken en tabak.",BeetleLM/beetlelm_fas-nld_simultaneous,step-10000,nld,6.682758808135986,798.5190368509369
828,"Point Marion en Fairmont zijn met elkaar verbonden via de snelweg van Buffalo naar Pittsburgh, je rijdt vaak door verlaten achterliggend terrein en dat maakt van dit traject één grote uitdaging.",BeetleLM/beetlelm_fas-nld_simultaneous,step-10000,nld,7.366940498352051,1582.7838378597062
829,"Ben je niet gewend om op landweggetjes te rijden? Houd dan je hoofd erbij. Je komt veel steile hellingen, smalle straatjes en scherpe bochten tegen.",BeetleLM/beetlelm_fas-nld_simultaneous,step-10000,nld,6.477735996246338,650.4965512492447
830,De gestelde maximumsnelheden zijn opvallend lager dan in eerdere en opeenvolgende gebieden — meestal zo'n 35-40 mph (56-64 km/u — en het is hier nog belangrijker om je eraan te houden dan anders.,BeetleLM/beetlelm_fas-nld_simultaneous,step-10000,nld,6.522510051727295,680.2837916212713
831,"Verrassend genoeg heb je hier veel meer bereik dan in andere uithoeken van de route, zoals de Pennsylvania Wilds.",BeetleLM/beetlelm_fas-nld_simultaneous,step-10000,nld,6.535921096801758,689.4685592192748
832,"Duitse gebak smaakt prima en in Beieren is het gebak redelijk rijk en gevarieerd, net zoals het gebak van de zuidelijke buur, Oostenrijk.",BeetleLM/beetlelm_fas-nld_simultaneous,step-10000,nld,6.934285640716553,1026.885424810921
833,"Je ziet er veel fruitgebakjes. Het hele jaar door bevatten de gebakjes appels, en in de zomermaanden ook kersen en pruimen.",BeetleLM/beetlelm_fas-nld_simultaneous,step-10000,nld,6.4083685874938965,606.9027642246466
834,"Veel populaire Duitse gebakjes bevatten amandelen, hazelnoten en andere noten, en smaken prima bij een kop sterke koffie.",BeetleLM/beetlelm_fas-nld_simultaneous,step-10000,nld,7.805663585662842,2454.4637526159895
835,"Als u een paar kleine maar machtige gebakjes wilt, probeer er dan enkele die in de regio Berliner, Pfannkuchen of Krapfen worden genoemd.",BeetleLM/beetlelm_fas-nld_simultaneous,step-10000,nld,7.2501702308654785,1408.3445715152643
836,"Om een curry te maken heb je kruidige en pittige ingrediënten nodig, in combinatie met groente of vlees.",BeetleLM/beetlelm_fas-nld_simultaneous,step-10000,nld,7.129956245422363,1248.822324024495
837,"Afhankelijk van de hoeveelheid vloeistof, kan een curry 'droog' of 'nat' zijn.",BeetleLM/beetlelm_fas-nld_simultaneous,step-10000,nld,6.174447536468506,480.31759265343646
838,In het binnenland van Noord-India en ook van Pakistan wordt vaak yoghurt gebruikt in curry's; in Zuid-India en enkele andere kustregio's van het subcontinent wordt dan weer vaak kokosmelk gebruikt.,BeetleLM/beetlelm_fas-nld_simultaneous,step-10000,nld,6.214428424835205,499.91017127667277
839,De Indonesische keuken omvat gerechten uit 17.000 eilanden en is een overkoepelend begrip voor een variëteit aan regionale keukens uit het hele land.,BeetleLM/beetlelm_fas-nld_simultaneous,step-10000,nld,6.58454704284668,723.8231125458015
840,Maar zonder aanvullende informatie verwijst de term naar het voedsel dat oorspronkelijk uit het centrale en oostelijke deel van het hoofdeiland Java komt.,BeetleLM/beetlelm_fas-nld_simultaneous,step-10000,nld,6.657573699951172,778.6593820180215
841,"De Javaanse keuken is tegenwoordig beschikbaar in de hele archipel en biedt verschillende eenvoudige gekruide gerechten. De meest gebruikelijke Javaanse smaakmakers zijn noten, pepers, suiker (voornamelijk Javaanse kokossuiker) en verschillende geurige kruiden.",BeetleLM/beetlelm_fas-nld_simultaneous,step-10000,nld,8.02298355102539,3050.264389801673
842,Stijgbeugels ondersteunen de voeten van de ruiter en hangen aan beide kanten van het zadel naar beneden.,BeetleLM/beetlelm_fas-nld_simultaneous,step-10000,nld,6.203431606292725,494.4428664120213
843,"Ze voorzien de berijder van meer stabiliteit, maar kunnen ook problemen met de veiligheid met zich meebrengen doordat de voeten van een berijder erin vast kunnen komen te zitten.",BeetleLM/beetlelm_fas-nld_simultaneous,step-10000,nld,6.306606292724609,548.1814211896478
844,"Als een ruiter van een paard wordt afgegooid maar met de voet in de stijgbeugel blijft hangen, kunnen ze worden meegesleurd met het paard. Om het risico te verminderen, zijn er een aantal veiligheidsmaatregelen genomen.",BeetleLM/beetlelm_fas-nld_simultaneous,step-10000,nld,6.388529300689697,594.9808979173566
845,"De meeste ruiters dragen ten eerste rijlaarzen met een hak en een gladde, vrij smalle zool.",BeetleLM/beetlelm_fas-nld_simultaneous,step-10000,nld,6.92315673828125,1015.5206730087754
846,"Sommige zadels, en dan vooral Engelse zadels, beschikken over veiligheidsbeugels. Hierdoor kan een stijgbeugelleer van het zadel loskomen als dit achteruit wordt getrokken omdat een ruiter van het paard valt.",BeetleLM/beetlelm_fas-nld_simultaneous,step-10000,nld,7.485115051269531,1781.3291021749835
847,"Cochamó Valley - Dit is de populairste klimbestemming van Chili. Deze staat bekend als de Yosemite van Zuid-Amerika, en heeft veel verschillende grote granieten wanden en rotsen.",BeetleLM/beetlelm_fas-nld_simultaneous,step-10000,nld,6.623038291931152,752.2271142108311
848,De bergtoppen bieden een adembenemend uitzicht. Klimmers uit alle delen van de wereld ontdekken voortdurend nieuwe routes op de rotswanden die een eindeloos potentieel lijken te hebben.,BeetleLM/beetlelm_fas-nld_simultaneous,step-10000,nld,7.477029323577881,1766.9838342471603
849,"Wintersporten waarbij je afdaalt, zoals skiën en snowboarden, zijn heel populair. Je glijdt naar beneden op een met sneeuw bedekte afdaling met ski's of een snowboard aan je voeten.",BeetleLM/beetlelm_fas-nld_simultaneous,step-10000,nld,6.58577299118042,724.7110264416228
850,"Skiën is een populaire reisactiviteit met veel liefhebbers, die af en toe ook wel 'ski bums' worden genoemd, die hele vakanties plannen rond het skiën op een bepaalde locatie.",BeetleLM/beetlelm_fas-nld_simultaneous,step-10000,nld,7.035622596740723,1136.4022123010013
