sentence_id,sentence,repo,revision,iso_code,nll,ppl
213,"Hij verleende in de jaren 80 zijn medewerking aan shows zoals Taxi, Cheers en The Tracy Ullman Show.",BeetleLM/beetlelm_eng-nld_balanced,step-18341,nld,7.562065601348877,1923.8152473881125
214,In 1989 werkte hij samen met Brooks en Groening aan The Simpsons en was hij verantwoordelijk voor het werven van het eerste schrijversteam.,BeetleLM/beetlelm_eng-nld_balanced,step-18341,nld,5.50917387008667,246.94703244438435
215,"Na zijn vertrek uit de serie in 1993, bleef hij op papier uitvoerend producent, waardoor hij voor elke reeks royalty's ontving, ter waarde van enkele tientallen miljoenen dollars.",BeetleLM/beetlelm_eng-nld_balanced,step-18341,nld,6.7418928146362305,847.1627412590207
216,Het Chinese persbureau Xinhua meldde eerder nog dat een vliegtuig was gekaapt.,BeetleLM/beetlelm_eng-nld_balanced,step-18341,nld,7.601463794708252,2001.1229854884746
217,"Uit latere rapporten blijkt daarnaast dat er een bommelding werd gedaan in het vliegtuig, waardoor het werd teruggeleid naar Afghanistan en landde in Kandahar.",BeetleLM/beetlelm_eng-nld_balanced,step-18341,nld,5.973720073699951,392.9648130747711
218,"Uit eerste berichten blijkt dat het vliegtuig terug is geleid naar Afghanistan, nadat het niet was toegestaan een noodlanding te maken in Ürümqi.",BeetleLM/beetlelm_eng-nld_balanced,step-18341,nld,5.791084289550781,327.3677934827309
219,Vliegtuigongelukken komen vaak voor in Iran. Ze beschikken voor zowel burgerlijke als militaire operaties over een verouderde vloot die slecht is onderhouden.,BeetleLM/beetlelm_eng-nld_balanced,step-18341,nld,5.952254772186279,384.61959165053895
220,Door internationale sancties kunnen er geen nieuwe vliegtuigen aangeschaft worden.,BeetleLM/beetlelm_eng-nld_balanced,step-18341,nld,5.299438953399658,200.22444321307435
221,Eerder deze week heeft een ongeluk met een politiehelikopter aan drie mensen het leven gekost en nog eens drie personen raakten gewond.,BeetleLM/beetlelm_eng-nld_balanced,step-18341,nld,6.4485273361206055,631.7712207455905
222,Afgelopen maand vond in Iran de ergste vliegtuigramp in jaren plaats toen een vliegtuig dat onderweg was naar Armenië neerstortte. De 168 inzittenden overleefden het niet.,BeetleLM/beetlelm_eng-nld_balanced,step-18341,nld,6.759777069091797,862.4499076153605
223,In dezelfde maand schoot nog een passagiersvliegtuig van een landingsbaan op Mashhad. Dit crashte tegen een muur en hierbij kwamen zeventien mensen om het leven.,BeetleLM/beetlelm_eng-nld_balanced,step-18341,nld,6.563502311706543,708.7496149111265
224,Aerosmith heeft de resterende concerten van hun tournee afgelast.,BeetleLM/beetlelm_eng-nld_balanced,step-18341,nld,6.812824726104736,909.4360899948593
225,De toer van de rockband zou tot zestien september door de VS en Canada trekken.,BeetleLM/beetlelm_eng-nld_balanced,step-18341,nld,6.192656517028809,489.14380061351034
226,Ze annuleerden de toer nadat zanger Steven Tyler gewond raakte toen hij van het podium viel tijdens een optreden op 5 augustus.,BeetleLM/beetlelm_eng-nld_balanced,step-18341,nld,7.602809906005859,2003.8185335939904
227,"Murray verloor de eerste set in een tiebreak, nadat beide mannen in de hele set geen enkel punt weggaven als zij serveerden.",BeetleLM/beetlelm_eng-nld_balanced,step-18341,nld,6.949674129486084,1042.8098518231388
228,"Del Potro had een vroege voorsprong in de tweede set, maar ook hier volgde een tiebreak nadat het 6-6 werd.",BeetleLM/beetlelm_eng-nld_balanced,step-18341,nld,6.940553665161133,1033.3421821724262
229,"Potro werd toen behandeld aan zijn schouder, maar slaagde erin de wedstrijd te vervolgen.",BeetleLM/beetlelm_eng-nld_balanced,step-18341,nld,6.604968070983887,738.7562810739205
230,De plaatselijke starttijd van het programma was 20.30 uur (15.00 UTC).,BeetleLM/beetlelm_eng-nld_balanced,step-18341,nld,5.189294815063477,179.34203902481875
231,Bekende zangers uit het hele land zongen bhajans of religieuze liederen aan de voeten van Shri Shyam.,BeetleLM/beetlelm_eng-nld_balanced,step-18341,nld,6.67667293548584,793.6741094433424
232,"De avond ving aan met de zanger Sanju Sharma, gevolgd door Jai Shankar Choudhary. Lakka Singh heeft ook de Chhappan bhog bhajan gepresenteerd. De zanger Raju Khandelwal hielp hem hierbij.",BeetleLM/beetlelm_eng-nld_balanced,step-18341,nld,7.534066677093506,1870.6975788268537
233,Daarna zong Lakkha Singh de bhajans.,BeetleLM/beetlelm_eng-nld_balanced,step-18341,nld,6.758416652679443,861.2774143265955
234,"Aan Baba Shyam werden 108 borden met Chhappan Bhog geserveerd (in het hindoeïsme zijn dit 56 verschillende eetbare artikelen, zoals, snoepjes, fruit, noten, gerechten, etc. die aan het heilige figuur worden aangeboden).",BeetleLM/beetlelm_eng-nld_balanced,step-18341,nld,6.1830830574035645,484.48334611847554
235,Lakkha Singh heeft ook de Chhappan bhog bhajan gepresenteerd. De zanger Raju Khandelwal hielp hem hierbij.,BeetleLM/beetlelm_eng-nld_balanced,step-18341,nld,7.4606475830078125,1738.2733692399502
236,"Donderdag onthulde Satoru Iwata, de directeur van Nintendo, tijdens de keynotepresentatie van de Tokyo Game Show het ontwerp van de controller voor de nieuwe Nintendo Revolution.",BeetleLM/beetlelm_eng-nld_balanced,step-18341,nld,5.732171058654785,308.6386140543789
237,Net als bij een tv-afstandsbediening maakt de controller gebruik van twee sensoren vlak bij de televisie van de gebruiken om de positie in een driedimensionale ruimte te kunnen bepalen.,BeetleLM/beetlelm_eng-nld_balanced,step-18341,nld,5.642005920410156,282.0278769289032
238,Hiermee besturen spelers acties en bewegingen in videogames door het apparaat door de lucht te bewegen.,BeetleLM/beetlelm_eng-nld_balanced,step-18341,nld,6.107057571411133,449.0155732373934
239,Kort na de start verloor Giancarlo Fisichella de controle over zijn auto en lag hij hiermee uit de race.,BeetleLM/beetlelm_eng-nld_balanced,step-18341,nld,6.7163405418396,825.7900313226572
240,"Zijn teamgenoot Fernando Alonso lag het grootste deel van de race aan kop, maar verloor deze positie direct na zijn pitstop, waarschijnlijk vanwege een slecht geplaatst rechtervoorwiel.",BeetleLM/beetlelm_eng-nld_balanced,step-18341,nld,7.105618000030518,1218.7950674276142
241,Michael Schumacher eindigde zijn race niet lang na Alonso door de schade aan de wielophanging vanwege de vele duels tijdens de race.,BeetleLM/beetlelm_eng-nld_balanced,step-18341,nld,6.431350231170654,621.011891790145
242,In een transcriptie van de nieuwsconferentie zei hij dat 'ze een schattig meisje was met een aardige stem'.,BeetleLM/beetlelm_eng-nld_balanced,step-18341,nld,5.917496204376221,371.48043740622364
243,"Ik was elke keer ontroerd als we dit repeteerden, uit de grond van mijn hart.",BeetleLM/beetlelm_eng-nld_balanced,step-18341,nld,5.948548793792725,383.19683773016254
244,Op een interne camera was circa 3 minuten na de lancering te zien dat veel stukken isolatieschuim losraakten van de brandstoftank.,BeetleLM/beetlelm_eng-nld_balanced,step-18341,nld,6.772648811340332,873.6228941670754
245,Vermoedelijk hebben deze echter geen schade aangericht aan de shuttle.,BeetleLM/beetlelm_eng-nld_balanced,step-18341,nld,6.710254192352295,820.7792487440147
246,"De directeur van het Shuttle Programma van NASA, N. Wayne Hale Jr. zei dat het schuim gevallen was 'na de periode waar we zorgen over hadden.'",BeetleLM/beetlelm_eng-nld_balanced,step-18341,nld,5.8342132568359375,341.7957227943522
247,"Na vijf minuten begint de wind, en een minuut later bereikt de wind al zo'n 70 km/u... dan begint het te regenen, maar zo hard en zo veel dat aanvoelt als speldenprikjes op je huid. Vervolgens valt er hagel. Mensen raken in paniek, beginnen te schreeuwen en rennen over elkaar heen.",BeetleLM/beetlelm_eng-nld_balanced,step-18341,nld,5.387638568878174,218.68636255465708
248,"'Ik raakte mijn zus en haar vriend kwijt. Toen ik er probeerde te komen, sprongen mensen zo over twee rolstoelgebruikers heen en duwden hen weg,' aldus Armand Versace.",BeetleLM/beetlelm_eng-nld_balanced,step-18341,nld,6.5787224769592285,719.619411387508
249,Daarnaast meldde de NHK dat de kerncentrale van Kashiwazaki Kariwa in de prefectuur Niigata zoals normaal werkte.,BeetleLM/beetlelm_eng-nld_balanced,step-18341,nld,7.057986736297607,1162.1031888867037
250,Hokuriku Electric Power Co. rapporteert dat de aardbeving geen problemen heeft veroorzaakt en dat in de kernenergiecentrale van Shika reactoren 1 en 2 zijn stopgezet.,BeetleLM/beetlelm_eng-nld_balanced,step-18341,nld,6.623655796051025,752.6917609988249
251,Volgens meldingen zitten er 9400 huishouden in de regio zonder water en ongeveer 100 zonder stroom.,BeetleLM/beetlelm_eng-nld_balanced,step-18341,nld,5.898914337158203,364.6413753009983
252,"Enkele wegen zijn aangetast, de spoorwegdienst is gestaakt in de getroffen gebieden en de prefectuur van het vliegveld Noto in Ishikawa blijft voor langere tijd gesloten.",BeetleLM/beetlelm_eng-nld_balanced,step-18341,nld,6.173813343048096,480.013074968231
253,Eén bom is ontploft buiten het kantoor waar de gouverneur-generaal werkt.,BeetleLM/beetlelm_eng-nld_balanced,step-18341,nld,6.747208118438721,851.6776570436991
254,Binnen een periode van twee uur kwamen er nog drie bommen tot ontploffing in de buurt van overheidsgebouwen.,BeetleLM/beetlelm_eng-nld_balanced,step-18341,nld,5.239020824432373,188.48545166854717
255,"In sommige rapporten wordt het officiële dodental op acht geschat. Officiële rapporten bevestigen maximaal 30 gewonden, maar de definitieve aantallen zijn er nog niet.",BeetleLM/beetlelm_eng-nld_balanced,step-18341,nld,6.475619316101074,649.1211143082198
256,"In urinemonsters van huisdieren die zijn gestorven na het eten van besmette dierenvoeding, werd zowel cyaanuurzuur als melamine aangetroffen.",BeetleLM/beetlelm_eng-nld_balanced,step-18341,nld,7.348904609680176,1554.4928185085241
257,Onderzoekers van de universiteit stelden dat de twee verbindingen met elkaar reageren waardoor zich kristallen vormen die de nierfunctie kunnen blokkeren.,BeetleLM/beetlelm_eng-nld_balanced,step-18341,nld,5.80653715133667,332.4658510912791
258,Wetenschappers kwamen erachter dat er kristallen gevormd worden in kattenurine wanneer je hier melanine en cyanuurzuur aan toevoegt.,BeetleLM/beetlelm_eng-nld_balanced,step-18341,nld,7.482358455657959,1776.4254599736057
259,"De samenstelling van deze kristallen heeft gelijkenissen met die van de urine van de getroffen huisdieren, vergeleken met de infraroodspectroscopie (FTIR).",BeetleLM/beetlelm_eng-nld_balanced,step-18341,nld,6.250373363494873,518.2062678570146
260,"Ik weet niet of je je dit realiseert, maar de meeste goederen uit Midden-Amerika kwamen dit land binnen zonder dat er belasting over hoefde te worden betaald.",BeetleLM/beetlelm_eng-nld_balanced,step-18341,nld,5.318056106567383,203.98696741183866
261,En toch werd tachtig procent van onze goederen belast aan de hand van tarieven uit landen in Midden-Amerika.,BeetleLM/beetlelm_eng-nld_balanced,step-18341,nld,5.692716121673584,296.6983961559338
262,Dat vond ik erg raar; het was ongetwijfeld oneerlijk.,BeetleLM/beetlelm_eng-nld_balanced,step-18341,nld,5.983340263366699,396.7634516242321
263,Wat ik maar wil zeggen is dat jullie ons behandelen zoals wij jullie behandelen.,BeetleLM/beetlelm_eng-nld_balanced,step-18341,nld,6.040812015533447,420.2341330231392
264,"Arnold Schwarzenegger, de gouverneur van Californië, heeft een wetsvoorstel ondertekend waarmee het verboden wordt om gewelddadige videogames aan minderjarigen te verkopen of te verhuren.",BeetleLM/beetlelm_eng-nld_balanced,step-18341,nld,6.611447811126709,743.5587724487124
265,"Onder deze wet moeten gewelddadige videogames die in de staat Californië worden verkocht, een '18'-sticker hebben. Verkoop aan een minderjarige wordt bestraft met een boete van $ 1000 per overtreding.",BeetleLM/beetlelm_eng-nld_balanced,step-18341,nld,6.953253746032715,1046.5494003054205
266,"Kier Starmer QC, directeur van het Openbaar Ministerie, heeft vanochtend verklaard dat hij zowel Pryce en Huhne wil vervolgen.",BeetleLM/beetlelm_eng-nld_balanced,step-18341,nld,6.938055515289307,1030.7639602656795
267,"Huhne heeft ontslag genomen. In het kabinet is parlementslid Ed Davey zijn vervanger, terwijl parlementslid Norman Lamb naar verwachting Daveys taken als minister van Handel overneemt.",BeetleLM/beetlelm_eng-nld_balanced,step-18341,nld,7.066051006317139,1171.5125917822918
268,Naar verwachting worden Huhne en Pryce op 16 februari voorgeleid voor de Westminster Magistrates Court.,BeetleLM/beetlelm_eng-nld_balanced,step-18341,nld,7.36717414855957,1583.1536988392454
269,"De slachtoffers waren Nicholas Alden, 25, en Zachary Cuddeback, 21. Cuddeback was de bestuurder van het voertuig.",BeetleLM/beetlelm_eng-nld_balanced,step-18341,nld,6.064414978027344,430.27088610501505
270,"Edgar Veguilla raakte gewond aan zijn arm en kaak, en Kristoffer Schneider moest een reconstructieve gezichtsoperatie ondergaan.",BeetleLM/beetlelm_eng-nld_balanced,step-18341,nld,7.142080783843994,1264.055881584639
271,"Het wapen van Uka faalde terwijl hij het op het hoofd van een vijfde man gericht hield. Schneider heeft chronische pijn, is blind in één oog, mist een stuk schedel en zijn gezicht is met titanium gereconstrueerd.",BeetleLM/beetlelm_eng-nld_balanced,step-18341,nld,6.551977634429932,700.6283914560406
272,Schneider legde via videolink vanuit een USAF-basis in het land waaruit hij afkomstig was zijn verklaring af.,BeetleLM/beetlelm_eng-nld_balanced,step-18341,nld,7.268850326538086,1434.8998381199362
273,Naast het evenement van woensdag deed Carpanedo ook nog mee aan twee individuele races van het kampioenschap.,BeetleLM/beetlelm_eng-nld_balanced,step-18341,nld,7.208181381225586,1350.4341080019472
274,"Haar eerste was de Slalom, waar ze een Did Not Finish kreeg bij haar eerste run. 36 van de 116 deelnemers kregen hetzelfde resultaat in die race.",BeetleLM/beetlelm_eng-nld_balanced,step-18341,nld,7.254459381103516,1414.3981460341763
275,"In de andere wedstrijd waar ze aan deelnam, de zittende Grote Slalom, werd ze tiende van de dames, met een gecombineerde tijd van 4:41:30. Dat is 2:11:60 minuten langzamer dan de Oostenrijkse winnares Claudia Loesch, en 1:09:02 minuten langzamer dan de Hongaarse Gyöngyi Dani, die als negende eindigde.",BeetleLM/beetlelm_eng-nld_balanced,step-18341,nld,5.862051010131836,351.4442209829257
276,Vier skiërs van de vrouwengroep voor de zittende slalom konden hun ritten niet afmaken en het lukte 45 van de 117 skiërs in de reuzenslalom niet om zich te plaatsen tijdens de race.,BeetleLM/beetlelm_eng-nld_balanced,step-18341,nld,6.317868232727051,554.3899016135646
277,De gestolen laptop en mobiele telefoon zijn door de politie van Madhya Pradesh teruggevonden.,BeetleLM/beetlelm_eng-nld_balanced,step-18341,nld,6.115185260772705,452.6799034320331
278,Volgens adjunct-inspecteur-generaal D. K. Arya zijn vijf van de verkrachters van de Zweedse vrouw gearresteerd en hebben ze haar mobiele telefoon en laptop gevonden.,BeetleLM/beetlelm_eng-nld_balanced,step-18341,nld,6.458680152893066,638.2181500591068
279,"Baba Kanjar, Bhutha Kanjar, Rampro Kanjar, Gaza Kanjar en Vishnu Kanjar zijn de verdachten.",BeetleLM/beetlelm_eng-nld_balanced,step-18341,nld,7.151747703552246,1276.334661669085
280,Volgens politiecommissaris Chandra Shekhar Solanki hadden de verdachten hun gezichten bedekt toen ze in de rechtbank verschenen.,BeetleLM/beetlelm_eng-nld_balanced,step-18341,nld,6.404828071594238,604.7578146929465
281,"Er bevonden zich drie mensen in het huis toen de auto het huis raakte, maar geen van hen raakte gewond.",BeetleLM/beetlelm_eng-nld_balanced,step-18341,nld,5.92957067489624,375.9930559105096
282,De bestuurder liep echter wel ernstige verwondingen aan het hoofd op.,BeetleLM/beetlelm_eng-nld_balanced,step-18341,nld,7.1058125495910645,1219.0322065392859
283,De weg waar het ongeluk plaatsvond werd tijdelijk gesloten terwijl de hulpdiensten probeerden de chauffeur uit de rode Audi TT te bevrijden.,BeetleLM/beetlelm_eng-nld_balanced,step-18341,nld,7.002076625823975,1098.9128213488932
284,"Aanvankelijk werd hij opgenomen in Great Yarmouth, in het James Paget Hospital.",BeetleLM/beetlelm_eng-nld_balanced,step-18341,nld,7.0180583000183105,1116.6163774509184
285,Hij werd vervolgens overgeplaatst naar het Addenbrooke's Hospital in Cambridge.,BeetleLM/beetlelm_eng-nld_balanced,step-18341,nld,6.034784317016602,417.7087072617306
286,Adekoya is sindsdien in de Edinburgh Sheriff Court veroordeeld voor het vermoorden van haar zoon.,BeetleLM/beetlelm_eng-nld_balanced,step-18341,nld,6.45150899887085,633.6577605762734
287,"Ze zit in hechtenis in afwachting van de aanklacht en het proces, maar het ooggetuigenverslag is mogelijk bedoezeld omdat haar verhaal veelvuldig is gepubliceerd.",BeetleLM/beetlelm_eng-nld_balanced,step-18341,nld,6.859279155731201,952.6800859376264
288,"Dit is gangbare praktijk in de rest van het VK, maar justitie in Schotland werkt anders en rechtbanken hebben de publicatie van foto's als mogelijk nadelig bestempeld.",BeetleLM/beetlelm_eng-nld_balanced,step-18341,nld,5.878836154937744,357.3930494283045
289,Professor Pamela Ferguson van de Universiteit van Dundee merkt op dat 'journalisten een gevaarlijk spelletje spelen als ze foto's e.d. van verdachten publiceren.',BeetleLM/beetlelm_eng-nld_balanced,step-18341,nld,6.377723693847656,588.586378804831
290,"Crown Office heeft de algehele leiding over vervolgingen en heeft aan journalisten aangegeven dat er geen verdere uitspraken worden gedaan, in ieder geval totdat aanklachten zijn gedaan.",BeetleLM/beetlelm_eng-nld_balanced,step-18341,nld,6.419559001922607,613.7323996293828
291,"Volgens bronnen verwijst het document naar een geschillenregeling, iets wat de Palestijnen graag wilden op grond van de grenzen voor de oorlog in het Midden-Oosten in 1967.",BeetleLM/beetlelm_eng-nld_balanced,step-18341,nld,5.282419681549072,196.84560323886615
292,"Andere onderwerpen die besproken waren zijn de toekomstige status van Jeruzalem, een stad die voor beide volken heilig is, en de problemen in de Jordaanvallei.",BeetleLM/beetlelm_eng-nld_balanced,step-18341,nld,5.558779716491699,259.50597217207485
293,Israël eist dat er na ondertekening van een overeenkomst tien jaar lang een permanente militaire aanwezigheid is in de vallei. De PA is echter slechts bereid tot een aanwezigheid van vijf jaar.,BeetleLM/beetlelm_eng-nld_balanced,step-18341,nld,6.391247749328613,596.6005233663656
294,Schutters in de aanvullende proef voor ongediertebestrijding moesten nauwlettend in de gaten worden gehouden door boswachters. De proef werd namelijk gevolgd en de effectiviteit ervan werd beoordeeld.,BeetleLM/beetlelm_eng-nld_balanced,step-18341,nld,6.441026210784912,627.0499551752404
295,"Bij een samenwerking tussen de NPWS en de Sporting Shooters Association of Australia (NSW) Inc, werden gekwalificeerde vrijwilligers gerekruteerd voor het jachtprogramma van de Sporting Shooters Association.",BeetleLM/beetlelm_eng-nld_balanced,step-18341,nld,6.363302230834961,580.1590156250734
296,"Volgens Mick O'Flynn, waarnemend directeur voor parkbehoud en erfgoed bij de NPWS, hebben de vier gekozen schutters voor de eerste schietoperatie een uitgebreide veiligheids- en trainingsinstructie gehad.",BeetleLM/beetlelm_eng-nld_balanced,step-18341,nld,6.77354097366333,874.4026553828274
297,Gisteren zwoor Martelly een negenkoppige nieuwe voorlopige kiesraad (Provisional Electoral Council of CEP) in.,BeetleLM/beetlelm_eng-nld_balanced,step-18341,nld,7.549291133880615,1899.3958366560698
298,"Hiermee heeft Martelly in de afgelopen vier jaar, vijf keer een CEP behaald.",BeetleLM/beetlelm_eng-nld_balanced,step-18341,nld,6.31303596496582,551.7174034785502
299,Afgelopen maand heeft de presidentiële commissie het ontslag van de eerdere Nationale Kiesraad aanbevolen. Dit is onderdeel van een maatregelenpakket zodat er nieuwe verkiezingen komen in het land.,BeetleLM/beetlelm_eng-nld_balanced,step-18341,nld,6.528375148773193,684.2854456513076
300,De commissie werd door Martelly ingesteld als reactie op de wijdverbreide protesten tegen de overheid die sinds oktober hebben plaatsgevonden.,BeetleLM/beetlelm_eng-nld_balanced,step-18341,nld,6.749770641326904,853.8628992039672
301,"De soms gewelddadige protesten ontstonden door het uitblijven van verkiezingen, waarvan sommige al sinds 2011 hadden moeten plaatsvinden.",BeetleLM/beetlelm_eng-nld_balanced,step-18341,nld,6.80813455581665,905.1806669966963
302,Er zijn ongeveer 60 gevallen gerapporteerd van defecte iPods die oververhit raken. In totaal leidde dit tot zes branden en vier mensen met lichte brandwonden.,BeetleLM/beetlelm_eng-nld_balanced,step-18341,nld,7.049008369445801,1151.7160994630156
303,"Het Japanse ministerie van Economie, Handel en Industrie (METI) liet weten dat het bekend was met de 27 ongelukken die verband hielden met de apparaten.",BeetleLM/beetlelm_eng-nld_balanced,step-18341,nld,5.642200469970703,282.08275066607933
304,Vorige week kondigde METI aan dat Apple 34 aanvullende incidenten met oververhitting had gemeld die het bedrijf 'niet ernstig' noemde.,BeetleLM/beetlelm_eng-nld_balanced,step-18341,nld,7.555945873260498,1912.0779722790078
305,"'Erg betreurenswaardig', luidde de reactie van het ministerie over het feit dat Apple het rapport heeft uitgesteld.",BeetleLM/beetlelm_eng-nld_balanced,step-18341,nld,6.979209899902344,1074.0694093139737
306,Mariana werd om 07.19 uur lokale tijd (vrijdag 21.19 GMT) getroffen door de aardbeving.,BeetleLM/beetlelm_eng-nld_balanced,step-18341,nld,7.041079521179199,1142.6204240305233
307,Het bureau voor calamiteitenbeheer van de Noordelĳke Marianen verklaarde dat er landelijk geen schade is gemeld.,BeetleLM/beetlelm_eng-nld_balanced,step-18341,nld,7.3120880126953125,1498.3023997484443
308,Daarnaast meldde het National Tsunami Warning Center dat er geen sprake was van een tsunami-waarschuwing.,BeetleLM/beetlelm_eng-nld_balanced,step-18341,nld,6.979637145996094,1074.5283993173805
309,"In Manilla, de Filippijnse hoofdstad, heeft een voormalige politieman uit de Filippijnen toeristen uit Hongkong gegijzeld door hun bus te kapen.",BeetleLM/beetlelm_eng-nld_balanced,step-18341,nld,6.668386459350586,787.1245218545145
310,Met zijn M16-geweer schoot Rolando Mendoza op de toeristen.,BeetleLM/beetlelm_eng-nld_balanced,step-18341,nld,7.687406539916992,2180.71163353844
311,Verschillende gijzelaars zijn in veiligheid gebracht en vooralsnog zijn er minstens zes dodelijke slachtoffers bevestigd.,BeetleLM/beetlelm_eng-nld_balanced,step-18341,nld,6.769540309906006,870.9114525908498
312,"Zes gijzelaars werden eerder vrijgelaten, inclusief de kinderen en ouderen, en de Filipijnse fotografen.",BeetleLM/beetlelm_eng-nld_balanced,step-18341,nld,6.180145263671875,483.062122634034
313,Later keerden de fotografen terug in ruil voor een oudere vrouw die naar het toilet moest. Mendoza is uiteindelijk neergeschoten.,BeetleLM/beetlelm_eng-nld_balanced,step-18341,nld,6.371908664703369,585.1736639928135
314,Liggins ging in de geneeskunde werken en volgde hiermee het voorbeeld van zijn vader.,BeetleLM/beetlelm_eng-nld_balanced,step-18341,nld,5.812169551849365,334.34371539892936
315,Opgeleid als verloskundige ging hij in 1959 aan de slag in het National Women's Hospital in Auckland.,BeetleLM/beetlelm_eng-nld_balanced,step-18341,nld,5.866645336151123,353.06258511124855
316,"Toen hij werkzaam was in het ziekenhuis, deed Liggins in zijn vrije tijd onderzoek naar vroeggeboorte.",BeetleLM/beetlelm_eng-nld_balanced,step-18341,nld,5.294422626495361,199.2225669220783
317,Zijn onderzoek toonde aan dat de rijping van de foetale longen van baby's werd versneld door het toedienen van een hormoon.,BeetleLM/beetlelm_eng-nld_balanced,step-18341,nld,6.620838642120361,750.5742964579383
318,Xinhua heeft gemeld dat onderzoekers van de overheid woensdag twee 'zwarte dozen' met vluchtrecorders terug hebben gevonden.,BeetleLM/beetlelm_eng-nld_balanced,step-18341,nld,6.783639430999756,883.2775090380917
319,Ook medeworstelaars brachten hulde aan Luna.,BeetleLM/beetlelm_eng-nld_balanced,step-18341,nld,8.174192428588867,3548.188351144822
320,"Tommy Dreamer zei, 'Luna was de eerste 'Queen of Extreme'. Mijn eerste manager. Luna is overleden op de nacht van twee manen. Net zo uniek als zij was. Een sterke vrouw.'",BeetleLM/beetlelm_eng-nld_balanced,step-18341,nld,6.030639171600342,415.9808275588761
321,Dustin 'Goldust' Runnels gaf aan dat 'Luna net zo raar was als ik... misschien nog wel raarder... ik hou van haar en ga haar missen... hopelijk is ze op een betere plek'.,BeetleLM/beetlelm_eng-nld_balanced,step-18341,nld,6.3679890632629395,582.8845056813799
322,"Van de 1400 mensen die voor de federale verkiezing van 2010 werden ondervraagd, steeg het aantal mensen dat zich verzette tegen het feit dat Australië een republiek werd, met 8 procent sinds 2008.",BeetleLM/beetlelm_eng-nld_balanced,step-18341,nld,5.946326732635498,382.34629624903056
323,Demissionair minister-president Julia Gillard zei tijdens de campagne voor de federale verkiezingen van 2010 dat Australië na de regering van koningin Elizabeth II een republiek zou moeten worden.,BeetleLM/beetlelm_eng-nld_balanced,step-18341,nld,6.123936176300049,456.65865047702556
324,34 procent van de deelnemers van deze peiling stond achter dit standpunt. Zij willen dat koningin Elizabeth II de laatste vorst van Australië is.,BeetleLM/beetlelm_eng-nld_balanced,step-18341,nld,5.670887470245361,290.2920456610279
325,"29 procent van de respondenten vond dat Australië een republiek moet worden zodra het mogelijk is, en aan het andere uiteinde zei 31 procent dat dat nooit zou moeten gebeuren.",BeetleLM/beetlelm_eng-nld_balanced,step-18341,nld,5.701990127563477,299.46277746063026
