sentence_id,sentence,repo,revision,iso_code,nll,ppl
731,"Das ist der Ort, den sich die britischen Kolonisten zu eigen gemacht haben. Wenn Sie nach Spuren der kolonialen Vergangenheit des Gebiets suchen, ist dies ein guter Ausgangspunkt.",BeetleLM/beetlelm_eng-deu_heritage,step-8000,deu,5.803569316864014,331.4806102165155
732,Die Sundarbans sind der größte Mangrovengürtel der Welt und erstrecken sich über 80 km vom bangladeschischen und indischen Hinterland bis an die Küste.,BeetleLM/beetlelm_eng-deu_heritage,step-8000,deu,6.546498775482178,696.8002438409416
733,"Die Sundarbans wurden zum UNESCO-Weltkulturerbe erklärt. Der Teil des Waldes, der innerhalb des indischen Staatsgebietes liegt, wird als Sundarbans National Park bezeichnet.",BeetleLM/beetlelm_eng-deu_heritage,step-8000,deu,6.4524335861206055,634.2439033907416
734,"Die Wälder sind jedoch nicht nur Mangrovensümpfe – sie umfassen auch einige der letzten verbliebenen Bestände des mächtigen Dschungels, der einst die Gangesebene bedeckte.",BeetleLM/beetlelm_eng-deu_heritage,step-8000,deu,7.422261714935303,1672.812657825856
735,"Die Sundarbans erstrecken sich über eine Fläche von 3.850 km², wovon ein Drittel von Wasser und Marschen bedeckt ist.",BeetleLM/beetlelm_eng-deu_heritage,step-8000,deu,5.933743000030518,377.5650984437376
736,"Die Sundarbans sind seit 1966 ein Naturschutzgebiet, und Schätzungen zufolge halten sich dort mittlerweile 400 bengalische Königstiger und etwa 30.000 gefleckte Hirsche auf.",BeetleLM/beetlelm_eng-deu_heritage,step-8000,deu,7.0233588218688965,1122.5507406752045
737,"Busse fahren den ganzen Tag über vom distriktübergreifenden Busbahnhof (auf der anderen Seite des Flusses) ab, wobei die meisten Busse, vor allem die in Richtung Osten und Jakar/Bumthang, zwischen 06:30 und 07:30 Uhr abfahren.",BeetleLM/beetlelm_eng-deu_heritage,step-8000,deu,6.035588264465332,418.0446581365759
738,"Da die Busse zwischen den Bezirken oftmals voll sind, empfiehlt es sich, ein paar Tage im Voraus ein Ticket zu kaufen.",BeetleLM/beetlelm_eng-deu_heritage,step-8000,deu,6.496286392211914,662.6761386687102
739,"Die meisten Bezirke werden durch kleine japanische Coasterbusse befahren, die gemütlich und stabil sind.x",BeetleLM/beetlelm_eng-deu_heritage,step-8000,deu,7.243196964263916,1398.557971294723
740,"Sammeltaxis bieten eine schnelle und bequeme Möglichkeit, um zu nahegelegenen Orten wie Paro (Nu 150) und Punakha (Nu 200) zu gelangen.",BeetleLM/beetlelm_eng-deu_heritage,step-8000,deu,7.0289530754089355,1128.8481724214985
741,Die Oyapock River Bridge ist eine Schrägseilbrücke. Sie überspannt den Fluss Oyapock und verbindet die Städte Oiapoque in Brasilien und Saint-Georges de l'Oyapock in Französisch-Guayana.,BeetleLM/beetlelm_eng-deu_heritage,step-8000,deu,6.1158905029296875,452.99926498393035
742,"Ihre beiden Türme sind 83 Meter hoch, ihre Länge beträgt 378 Meter und sie verfügt über zwei Fahrspuren mit 3,50 m Breite.",BeetleLM/beetlelm_eng-deu_heritage,step-8000,deu,5.918423652648926,371.82512611200485
743,"Die Durchfahrtshöhe unter der Brücke beträgt 15 Meter. Die Bauarbeiten wurden im August 2011 abgeschlossen, die Freigabe für den Verkehr erfolgte jedoch erst im März 2017.",BeetleLM/beetlelm_eng-deu_heritage,step-8000,deu,6.1233906745910645,456.409610334855
744,"Die Brücke soll im September 2017 vollständig den Betrieb aufnehmen. Es wird erwartet, dass die brasilianischen Zollkontrollpunkte dann fertig gestellt sein werden.",BeetleLM/beetlelm_eng-deu_heritage,step-8000,deu,6.58953857421875,727.445130507719
745,"Die Guaraní waren die bedeutendste indigene Gruppe, die das heutige Ostparaguay bewohnte. Sie lebten als halbnomadische Jäger, die auch Subsistenzlandwirtschaft betrieben.",BeetleLM/beetlelm_eng-deu_heritage,step-8000,deu,6.735822677612305,842.0359233238211
746,"Die Chaco-Region war auch die Heimat anderer Gruppen von Eingeborenenstämmen, wie der Guaycurú und der Payaguá, die durch jagen, sammeln und fischen überlebten.x",BeetleLM/beetlelm_eng-deu_heritage,step-8000,deu,6.637117385864258,762.8926950905369
747,"Paraguay, ehemals Großprovinz Westindien genannt, entstand im 16. Jahrhundert als Ergebnis des Zusammentreffens der spanischen Eroberer mit den einheimischen indigenen Gruppen.",BeetleLM/beetlelm_eng-deu_heritage,step-8000,deu,7.004976749420166,1102.1044301452582
748,"Die Spanier begannen die Kolonisierungszeit, die drei Jahrhunderte andauerte.",BeetleLM/beetlelm_eng-deu_heritage,step-8000,deu,6.387448310852051,594.3380771170872
749,"Seit der Gründung von Asunción 1537 ist es Paraguay gelungen, viel von seinem indigenen Charakter und seiner Identität zu bewahren.",BeetleLM/beetlelm_eng-deu_heritage,step-8000,deu,6.235887050628662,510.7534817593403
750,"Argentinien ist bekannt dafür, dass sein Polo-Team und die Spieler zu den besten der Welt gehören.",BeetleLM/beetlelm_eng-deu_heritage,step-8000,deu,5.699186325073242,298.62431896474465
751,Das größte Turnier des Jahres findet im Dezember auf Las Cañitas Polofeldern statt.,BeetleLM/beetlelm_eng-deu_heritage,step-8000,deu,7.463976860046387,1744.0702071401984
752,Kleinere Turniere und Wettkämpfe können hier auch zu anderen Zeiten im Jahr angeschaut werden.x,BeetleLM/beetlelm_eng-deu_heritage,step-8000,deu,7.142261028289795,1264.283741171072
753,Informationen zu Wettbewerben und Verkaufsstellen für Polospieltickets finden Sie bei der Asociacion Argentina de Polo.,BeetleLM/beetlelm_eng-deu_heritage,step-8000,deu,7.649669170379639,2099.9507485806184
754,"Die offizielle Währung der Falklandinseln ist das Falkland Pound (FKP), dessen Wert in Einklang mit dem Wert des Britischen Pfunds (GBP) festgelegt wird.",BeetleLM/beetlelm_eng-deu_heritage,step-8000,deu,6.264930248260498,525.8049088731628
755,"Geld kann in der einzigen Bank auf der Insel umgetauscht werden, welche sich in Stanley gegenüber vom FIC West Store befindet.",BeetleLM/beetlelm_eng-deu_heritage,step-8000,deu,6.3173370361328125,554.0954897881497
756,Das Britische Pfund wird grundsätzlich überall auf den Inseln und bei Stanley-Kreditkarten akzeptiert. Auch US-Dollar werden häufig akzeptiert.,BeetleLM/beetlelm_eng-deu_heritage,step-8000,deu,6.690499782562256,804.7243388496302
757,"Auf den abgelegenen Inseln werden Kreditkarten wahrscheinlich nicht akzeptiert, wobei jedoch britische und US-amerikanische Währung angenommen werden können; erkundigen Sie sich im Voraus bei den Eigentümern, welche Zahlungsmethode akzeptiert wird.",BeetleLM/beetlelm_eng-deu_heritage,step-8000,deu,7.339371204376221,1539.743625154209
758,"Es ist beinahe unmöglich, die Währung der Falklandinseln außerhalb der Inseln selbst umzutauschen, daher sollten Sie das Geld vor der Abreise von der Insel umtauschen.x",BeetleLM/beetlelm_eng-deu_heritage,step-8000,deu,6.158545017242432,472.73974602370834
759,"Da Montevideo südlich des Äquators liegt, ist es dort Sommer, wenn es in der nördlichen Hemisphäre Winter ist und umgekehrt.",BeetleLM/beetlelm_eng-deu_heritage,step-8000,deu,6.107069492340088,449.0209259520463
760,Montevideo liegt in den Subtropen. In den Sommermonaten sind Temperaturen über +30 °C üblich.,BeetleLM/beetlelm_eng-deu_heritage,step-8000,deu,6.37183952331543,585.1332056721878
761,"Der Winter kann trügerisch kühl sein: Die Temperaturen gehen selten unter den Gefrierpunkt, aber Wind und Feuchtigkeit führen dazu, dass es sich kälter anfühlt als das, was das Thermometer anzeigt.",BeetleLM/beetlelm_eng-deu_heritage,step-8000,deu,6.584609031677246,723.8679828848007
762,Es gibt keine ausgeprägten Regen- oder Trockenzeiten: Die Niederschlagsmenge bleibt über das ganze Jahr in etwa gleich.,BeetleLM/beetlelm_eng-deu_heritage,step-8000,deu,6.82748556137085,922.8673992249741
763,"Obwohl viele der Tiere im Park den Anblick von Menschen gewohnt sehen, sind die Wildtiere trotzdem wild und sollten nicht gefüttert oder gestört werden.",BeetleLM/beetlelm_eng-deu_heritage,step-8000,deu,6.472177505493164,646.8908027279033
764,Laut Anweisung der Parkbehörde sollen sich Besucher mindestens 100 Yard/Meter von Bären und Wölfen und 25 Yard/Meter von allen anderen wilden Tieren fernhalten!,BeetleLM/beetlelm_eng-deu_heritage,step-8000,deu,7.548442840576172,1897.7852750962209
765,"Egal wie friedlich Bisons, Wapitis, Elche, Bären und praktisch alle großen Tiere wirken können, so kann es doch passieren, dass sie zum Angriff übergehen.",BeetleLM/beetlelm_eng-deu_heritage,step-8000,deu,6.376369476318359,587.7898442753901
766,"Jedes Jahr werden Dutzende von Besuchern verletzt, weil sie nicht genug Abstand einhalten. Diese Tiere sind groß, wild und möglicherweise gefährlich, also lassen Sie ihnen ausreichend Platz.",BeetleLM/beetlelm_eng-deu_heritage,step-8000,deu,6.294321537017822,541.4883419428209
767,"Seien Sie sich außerdem bewusst, dass Gerüche Bären und andere Wildtiere anziehen können. Vermeiden Sie es also, stark duftende Lebensmittel bei sich zu tragen oder zu kochen, und achten Sie auf ein sauberes Lager.",BeetleLM/beetlelm_eng-deu_heritage,step-8000,deu,6.416850566864014,612.0723943047051
768,Apia ist die auf der Insel Upolu liegende Hauptstadt von Samoa und weist eine Einwohnerzahl von knapp unter 40.000 auf.,BeetleLM/beetlelm_eng-deu_heritage,step-8000,deu,5.965750694274902,389.8455730909814
769,Apia wurde in den 50ern des 18. Jahrunderts gegründet und ist seit 1959 die offizielle Hauptstadt von Samoa.,BeetleLM/beetlelm_eng-deu_heritage,step-8000,deu,5.611170291900635,273.4640836140572
770,"Der Hafen war der Schauplatz eines unrühmlichen Patts der Marine im Jahr 1889, als sieben Schiffe aus Deutschland, den Vereinigten Staaten und Großbritannien sich weigerten, den Hafen zu verlassen.",BeetleLM/beetlelm_eng-deu_heritage,step-8000,deu,5.278033256530762,195.98404572021747
771,Alle Schiffe mit Ausnahme eines britischen Kreuzers wurden versenkt. Fast 200 Amerikaner und Deutsche kamen ums Leben.,BeetleLM/beetlelm_eng-deu_heritage,step-8000,deu,7.392486572265625,1623.7386407407078
772,Während des von der Mau-Bewegung organisierten Unabhängigkeitskampfes führte eine friedliche Versammlung in der Stadt zur Tötung des obersten Häuptlings Tupua Tamasese Lealofi III.,BeetleLM/beetlelm_eng-deu_heritage,step-8000,deu,7.1508002281188965,1275.1259386405322
773,"Da Auckland sich über zwei Häfen erstreckt, gibt es viele Strände. Die beliebtesten Strände befinden sich in drei Gebieten.",BeetleLM/beetlelm_eng-deu_heritage,step-8000,deu,6.056809902191162,427.0110547301007
774,Die Strände von North Shore (im Bezirk North Harbour) liegen am Pazifischen Ozean und erstrecken sich von Long Bay im Norden bis Devonport im Süden.,BeetleLM/beetlelm_eng-deu_heritage,step-8000,deu,6.720327377319336,829.0888919560796
775,"Fast alle sind Sandstrände mit sicheren Bademöglichkeiten und die meisten bieten Schatten, der von Pohutukawa-Bäumen gespendet wird.",BeetleLM/beetlelm_eng-deu_heritage,step-8000,deu,6.9806904792785645,1075.6608321532358
776,"Die Strände von Tamaki Drive befinden sich am Hafen von Waitemata, in den gehobenen Vororten Mission Bay sowie St. Heliers in Central Auckland.",BeetleLM/beetlelm_eng-deu_heritage,step-8000,deu,6.439094066619873,625.8395739552141
777,"Es gibt Familienstrände, die manchmal überlaufen sind, mit einer schönen Einkaufspromenade entlang der Küste. Das Schwimmen ist hier sicher.",BeetleLM/beetlelm_eng-deu_heritage,step-8000,deu,6.164561748504639,475.59266805853434
778,"Das wichtigste lokale Bier ist „Number One“. Es ist kein komplexes Bier, aber angenehm und erfrischend. Das andere lokale Bier heißt „Manta“.",BeetleLM/beetlelm_eng-deu_heritage,step-8000,deu,6.472259998321533,646.9441687809945
779,"Es gibt viele französische Weine zu trinken, aber die neuseeländischen und australischen Weine sind vielleicht besser verträglich.",BeetleLM/beetlelm_eng-deu_heritage,step-8000,deu,6.822439193725586,918.2220020897932
780,"Das örtliche Leitungswasser kann man bedenkenlos trinken, aber wenn Sie sich Sorgen machen, finden Sie auch problemlos abgefülltes Wasser.",BeetleLM/beetlelm_eng-deu_heritage,step-8000,deu,6.895735740661621,988.0524077887069
781,"""Für Australier ist die Idee des Kaffees """"Flat White"""" fremd. Ein kleiner Schwarzer ist """"Espresso"""", Cappuccino wird hoch mit Sahne (nicht mit Schaum) aufgefüllt und Tee wird ohne Milch serviert.""",BeetleLM/beetlelm_eng-deu_heritage,step-8000,deu,6.639910697937012,765.0266715094506
782,"Die heiße Schokolade entspricht belgischen Standards. Fruchtsäfte sind zwar teuer, aber hervorragend.",BeetleLM/beetlelm_eng-deu_heritage,step-8000,deu,7.028921127319336,1128.812108455032
783,Viele Reisen zum Riff finden das ganze Jahr hindurch statt und Verletzungen aufgrund irgendeiner dieser Ursachen auf dem Riff sind selten.x,BeetleLM/beetlelm_eng-deu_heritage,step-8000,deu,7.221994400024414,1369.2171060268467
784,"Dennoch sollten Sie den Rat von Behörden befolgen, alle Schilder beachten und insbesondere Augenmerk auf Sicherheitswarnungen richten.",BeetleLM/beetlelm_eng-deu_heritage,step-8000,deu,7.74486780166626,2309.688166776976
785,Würfelquallen treten in Strandnähe und in der Nähe von Flussmündungen von Oktober bis April nördlich von 1770 auf. Sie können gelegentlich auch außerhalb dieses Zeitraums vorkommen.,BeetleLM/beetlelm_eng-deu_heritage,step-8000,deu,6.8681864738464355,961.2038159563124
786,"Haie existieren, aber sie greifen selten Menschen an. Die meisten Haie haben Angst vor Menschen und würden wegschwimmen.",BeetleLM/beetlelm_eng-deu_heritage,step-8000,deu,6.378940582275391,589.3030587292345
787,"Salzwasserkrokodile leben nicht aktiv im Meer, ihr primärer Lebensraum ist in Flussmündungen nördlich von Rockhampton.",BeetleLM/beetlelm_eng-deu_heritage,step-8000,deu,7.023863792419434,1123.1177388873803
788,"Eine Buchung im Voraus gibt dem Reisenden die Gewissheit, dass er nach seiner Ankunft am Zielort einen Platz zum Übernachten hat.",BeetleLM/beetlelm_eng-deu_heritage,step-8000,deu,6.865360736846924,958.4915406625634
789,"Reiseagenturen haben oft Abmachungen mit spezifischen Hotels, obwohl Sie vielleicht auch andere Unterbringungsformen, wie zum Beispiel Zeltplätze, durch eine Reiseagentur buchen können.x",BeetleLM/beetlelm_eng-deu_heritage,step-8000,deu,7.038755893707275,1139.9684820790578
790,"Reisebüros bieten üblicherweise Pakete an, bei denen Frühstück, Transport zum und vom Flughafen oder sogar eine Kombination von Flug und Hotel inbegriffen sind.",BeetleLM/beetlelm_eng-deu_heritage,step-8000,deu,7.25206184387207,1411.0111356831121
791,"Sie können Ihre Reservierung auch für Sie zurückhalten, falls Sie Zeit benötigen, das Angebot zu überdenken oder um weitere Dokumente für Ihr Reiseziel (z.B. Visa) zu beschaffen.",BeetleLM/beetlelm_eng-deu_heritage,step-8000,deu,6.580287933349609,720.7468264230007
792,Jegliche Änderungen oder Anfragen sollten jedoch zuerst an das Reisebüro und nicht direkt an das Hotel gerichtet werden.,BeetleLM/beetlelm_eng-deu_heritage,step-8000,deu,7.509255409240723,1824.8542672029919
793,"Bei manchen Festivals entscheidet sich die große Mehrheit der Festivalbesucher, vor Ort zu kampieren, und die meisten Besucher halten dies für einen wichtigen Bestandteil der Erfahrung.",BeetleLM/beetlelm_eng-deu_heritage,step-8000,deu,6.363251686096191,580.129692380258
794,"Wenn Sie nahe am Geschehen sein wollen, müssen Sie früh hingehen, um einen Campingplatz in der Nähe der Musik zu bekommen.",BeetleLM/beetlelm_eng-deu_heritage,step-8000,deu,5.626473426818848,277.68112606835643
795,"Denken Sie daran, dass auf Teilen des Festivals noch bis spät in die Nacht Musik gespielt wird, auch wenn die Musik auf den Hauptbühnen schon aufgehört hat.",BeetleLM/beetlelm_eng-deu_heritage,step-8000,deu,5.95298957824707,384.9023163187614
796,Manche Festivals haben spezielle Campingbereiche für Familien mit kleinen Kindern.,BeetleLM/beetlelm_eng-deu_heritage,step-8000,deu,6.667842388153076,786.6963865519243
797,"Wenn Sie im Winter die nördliche Ostsee überqueren, überprüfen Sie die Lage der Kabine, da das Durchbrechen von Eis für die am stärksten Betroffenen ziemlich schrecklichen Lärm verursacht.",BeetleLM/beetlelm_eng-deu_heritage,step-8000,deu,6.947062015533447,1040.0894681820735
798,Die Kreuzfahrten nach Sankt Petersburg bieten auch Zeit für einen Aufenthalt in der Stadt. Kreuzfahrtpassagiere sind von der Visumpflicht befreit (siehe Bedingungen).,BeetleLM/beetlelm_eng-deu_heritage,step-8000,deu,7.39945650100708,1635.0955156896875
799,"Kasinos bemühen sich in der Regel sehr darum, Gäste möglichst lange vor Ort zu halten und viel Geld ausgeben zu lassen. Es gibt in der Regel weder Fenster noch Uhren, und Ausgänge sind manchmal schwer auffindbar.",BeetleLM/beetlelm_eng-deu_heritage,step-8000,deu,6.592130661010742,729.3331773559208
800,"Sie haben normalerweise ein besonderes Angebot an Speisen, Getränken und Unterhaltung, um die Gäste bei Laune zu halten und dafür zu sorgen, dass sie bleiben.",BeetleLM/beetlelm_eng-deu_heritage,step-8000,deu,6.083083152770996,438.37870179031245
801,"Einige Spielstätten bieten alkoholische Getränke kostenfrei an. Trunkenheit beeinträchtigt jedoch das Urteilsvermögen, und allen guten Spielern ist klar, wie wichtig es ist, nüchtern zu bleiben.",BeetleLM/beetlelm_eng-deu_heritage,step-8000,deu,7.054916858673096,1158.5411446271876
802,"Wer in hohen Breiten oder über Gebirgspässe fahren will, sollte mit Schnee, Eis und Temperaturen unter dem Gefrierpunkt rechnen.",BeetleLM/beetlelm_eng-deu_heritage,step-8000,deu,7.118062973022461,1234.0577137490795
803,"Auf vereisten und verschneiten Straßen ist die Haftung gering und man kann nicht fahren, als befinde man sich auf nacktem Asphalt.",BeetleLM/beetlelm_eng-deu_heritage,step-8000,deu,6.666537284851074,785.6703361966546
804,"Bei Schneestürmen kann in sehr kurzer Zeit so viel Schnee fallen, dass man sich festfahren kann.",BeetleLM/beetlelm_eng-deu_heritage,step-8000,deu,5.559110164642334,259.59173961072304
805,Die Sichtweite kann auch durch fallenden oder umherwehenden Schnee oder durch Kondensation oder Eis auf den Fahrzeugfenstern beeinträchtigt werden.x,BeetleLM/beetlelm_eng-deu_heritage,step-8000,deu,7.715956687927246,2243.8685532128047
806,"Auf der anderen Seite sind eisige und schneereiche Bedingungen in vielen Ländern normal, und der Verkehr läuft das ganze Jahr über größtenteils ununterbrochen weiter.",BeetleLM/beetlelm_eng-deu_heritage,step-8000,deu,6.436483860015869,624.2081334908407
807,Safaris sind vielleicht die größte Touristenattraktion in Afrika und der Höhepunkt für viele Besucher.,BeetleLM/beetlelm_eng-deu_heritage,step-8000,deu,6.468288421630859,644.3798759136249
808,"Der Begriff Safari bezeichnet im üblichen Sprachgebrauch eine Landreise, um die überwältigende afrikanische Tierwelt zu beobachten, besonders in der Savanne.",BeetleLM/beetlelm_eng-deu_heritage,step-8000,deu,6.851776123046875,945.5588449747651
809,"Einige Tiere, wie Elefanten und Giraffen, neigen dazu, sich dicht an Autos anzunähern, und die Standardausrüstung ermöglicht eine gute Sicht.",BeetleLM/beetlelm_eng-deu_heritage,step-8000,deu,6.775341987609863,875.9788857404243
810,"Löwen, Geparden und Leoparden sind oft scheu und Sie können sie mit einem Fernglas besser beobachten.",BeetleLM/beetlelm_eng-deu_heritage,step-8000,deu,5.8575239181518555,349.8567965879567
811,"Eine Fußsafari (auch „Buschgang“, „Wandersafari“ oder „Footing“ genannt) besteht aus einer Wanderung, die entweder ein paar Stunden oder mehrere Tage dauert.",BeetleLM/beetlelm_eng-deu_heritage,step-8000,deu,6.406002044677734,605.4682009950401
812,Die Paralympics werden vom 24. August bis 5. September 2021 stattfinden. Einige Veranstaltungen werden an anderen Orten in ganz Japan abgehalten.,BeetleLM/beetlelm_eng-deu_heritage,step-8000,deu,6.274075508117676,530.6355866326084
813,"Tokio wird die einzige asiatische Stadt sein, die zwei olympische Sommerspiele ausgerichtet hat, nachdem sie bereits 1964 Austragungsort der Spiele war.",BeetleLM/beetlelm_eng-deu_heritage,step-8000,deu,6.802188396453857,899.8142889795521
814,"Wenn Sie Ihre Flüge und Unterkünfte für das Jahr 2020 gebucht haben, bevor die Verschiebung angekündigt wurde, könnten Sie in eine schwierige Situation geraten.",BeetleLM/beetlelm_eng-deu_heritage,step-8000,deu,6.542022705078125,693.6882867571725
815,"Die Stornierungsrichtlinien variieren, aber ab Ende März galten die meisten Stornierungsrichtlinien wegen des Coronavirus nicht bis zum Juli 2020, für den die Olympischen Spiele geplant waren.",BeetleLM/beetlelm_eng-deu_heritage,step-8000,deu,7.15623664855957,1282.0769365117187
816,"Man geht davon aus, dass die meisten Tickets für die Veranstaltung zwischen 2.500¥ und 130.000¥ kosten werden, ein durchschnittliches Ticket ungefähr 7.000¥.",BeetleLM/beetlelm_eng-deu_heritage,step-8000,deu,5.904136657714844,366.5506304831279
817,"Feuchte Kleidung zu bügeln kann beim Trocknen helfen. Viele Hotels verleihen Bügeleisen und Bügelbrett, auch wenn man man nicht im Zimmer anwesend ist.",BeetleLM/beetlelm_eng-deu_heritage,step-8000,deu,7.078028678894043,1185.6289578656297
818,"Wenn kein Bügeleisen verfügbar ist oder man keine gebügelten Socken tragen will, kann man versuchen, einen Föhn zu verwenden, falls einer vorhanden ist.",BeetleLM/beetlelm_eng-deu_heritage,step-8000,deu,7.120793342590332,1237.4317514645486
819,"Geben Sie acht, dass der Stoff nicht zu heiß wird (das kann ihn schrumpfen lassen oder in extremen Fällen zu Verbrennungen führen).",BeetleLM/beetlelm_eng-deu_heritage,step-8000,deu,6.549346923828125,698.7876631919746
820,"Zur Reinigung von Wasser gibt es verschiedene Verfahren. Einige davon erweisen sich als wirksamer, um bestimmten Gefahren entgegenzuwirken.",BeetleLM/beetlelm_eng-deu_heritage,step-8000,deu,6.5416259765625,693.4131354166612
821,"In einigen Gebieten genügt es, Wasser eine Minute lang abzukochen, in anderen müssen es mehrere Minuten sein.",BeetleLM/beetlelm_eng-deu_heritage,step-8000,deu,6.6286940574646,756.4935881118498
822,"Die Wirksamkeit von Filtern variiert stark, und wenn Sie Bedenken haben, dann sollten Sie erwägen, Ihr Wasser in einer versiegelten Flasche von einem seriösen Unternehmen zu kaufen.",BeetleLM/beetlelm_eng-deu_heritage,step-8000,deu,6.960461616516113,1054.1200441708356
823,"Reisende können auf tierische Schädlinge stoßen, die sie aus ihren Heimatregionen nicht kennen.",BeetleLM/beetlelm_eng-deu_heritage,step-8000,deu,6.513082027435303,673.9001991261117
824,"Ungeziefer kann Nahrungsmittel zerstören, Reizungen hervorrufen oder schlimmstenfalls sogar allergische Reaktionen auslösen, Gift verabreichen oder Krankheiten übertragen.",BeetleLM/beetlelm_eng-deu_heritage,step-8000,deu,8.522934913635254,5028.791187498124
825,"Infektionskrankheiten als solche oder gefährliche Tiere, die Menschen mit Gewalt verletzen oder töten können, werden gewöhnlich nicht als Ungeziefer eingestuft.",BeetleLM/beetlelm_eng-deu_heritage,step-8000,deu,7.09407901763916,1204.8122415452767
826,"Zollfreies Einkaufen ist die Möglichkeit, Waren zu kaufen, die an bestimmten Orten von Abgaben und Verbrauchssteuern befreit sind.",BeetleLM/beetlelm_eng-deu_heritage,step-8000,deu,7.089386463165283,1199.171838769838
827,"Reisende, deren Zielland eine hohe Besteuerung aufweist, können manchmal eine beträchtliche Menge an Geld sparen, insbesondere bei Produkten wie alkoholischen Getränken und Tabak.",BeetleLM/beetlelm_eng-deu_heritage,step-8000,deu,7.683467864990234,2172.139411983836
828,"Der Abschnitt zwischen Point Marion und Fairmount auf dem Highway Buffalo-Pittsburgh ist die wohl größte fahrerische Herausforderung, da er häufig durch entlegenes, unerschlossenes Gelände führt.",BeetleLM/beetlelm_eng-deu_heritage,step-8000,deu,7.04570198059082,1147.914366654587
829,"Wenn Sie es nicht gewohnt sind, auf Landstraßen zu fahren, bleiben Sie achtsam: steiles Gefälle, enge Fahrbahnen und scharfe Kurven überwiegen hier.",BeetleLM/beetlelm_eng-deu_heritage,step-8000,deu,6.902433395385742,994.6922525380405
830,Die angegebenen Geschwindigkeitsbegrenzungen sind merklich niedriger als in den vorhergehenden und nachfolgenden Abschnitten - in der Regel 35-40 mph (56-64 km/h) - und ihre strikte Einhaltung ist noch wichtiger als sonst.,BeetleLM/beetlelm_eng-deu_heritage,step-8000,deu,6.550278186798096,699.4387213727126
831,"Doch interessanterweise ist die Mobilfunkabdeckung hier viel besser als in vielen anderen Bereichen der Strecke, z. B. den Pennsylvania Wilds.",BeetleLM/beetlelm_eng-deu_heritage,step-8000,deu,7.019985675811768,1118.7705921511597
832,"Deutsche Backwaren sind recht lecker. In Bayern sind sie recht gehaltvoll und abwechslungsreich, ebenso wie beim südlichen Nachbarn Österreich.",BeetleLM/beetlelm_eng-deu_heritage,step-8000,deu,6.984711647033691,1079.9949530804524
833,"Obstgebäck ist weit verbreitet, wobei Äpfel das ganze Jahr über zu Gebäck verkocht werden und Kirschen und Pflaumen im Sommer verwendet werden.",BeetleLM/beetlelm_eng-deu_heritage,step-8000,deu,6.904153823852539,996.4050223314989
834,"Viele deutsche Backwaren beinhalten außerdem Mandeln, Haselnüsse oder andere Nüsse. Beliebte Kuchen passen häufig besonders gut zu einer Tasse starken Kaffees.",BeetleLM/beetlelm_eng-deu_heritage,step-8000,deu,8.056079864501953,3152.906057628597
835,"Wenn Sie kleine, aber reichhaltige Backwaren herstellen wollen, dann probieren Sie das, was je nach Region als Berliner, Pfannkuchen oder Krapfen bezeichnet wird.",BeetleLM/beetlelm_eng-deu_heritage,step-8000,deu,6.649609088897705,772.4822946000876
836,"Ein Curry ist ein Gericht, das auf Kräutern und Gewürzen basiert, zusammen mit entweder Fleisch oder Gemüse.",BeetleLM/beetlelm_eng-deu_heritage,step-8000,deu,5.98397970199585,397.01723863379704
