sentence_id,sentence,repo,revision,iso_code,nll,ppl
0,وی افزود: «اکنون موش‌های 4 ماهه‌ای داریم که دیابت ندارند در حالی که قبلاً دیابت داشتند.»,BeetleLM/beetlelm_fas-fra_balanced,step-8000,fas,7.486358642578125,1783.545725565314
1,دکتر ایهود اور، استاد پزشکی دانشگاه دالهاوزی در هلیفکس، نوااسکوشیا و رئیس بخش کلینیکی و علمی انجمن دیابت کانادا هشدار داد که این تحقیق هنوز در روزهای آغازین خود می‌باشد.,BeetleLM/beetlelm_fas-fra_balanced,step-8000,fas,7.208380222320557,1350.7026564970215
2,مانند سایر متخصصان، او با اشاره به اینکه این یافته‌ها ارتباطی با کسانی که از قبل دیابت نوع 1 دارند نداشته است، نسبت به قابلیت درمان دیابت تردید دارد.,BeetleLM/beetlelm_fas-fra_balanced,step-8000,fas,6.036282539367676,418.3349968265494
3,روز دوشنبه، سارا دانیوس، دبیر دائمی‌ کمیته ادبیات نوبل در آکادمی‌ سوئد، طی یک برنامه رادیویی که از رادیو Sveriges در سوئد پخش می‌شد به طور علنی اعلام کرد این کمیته، نتوانست در مورد برنده شدن جایزه نوبل ادبیات سال 2016 بطور مستقیم به باب دیلان دسترسی پیدا کند و دست از تلاش‌ برای تماس با او برداشته است.,BeetleLM/beetlelm_fas-fra_balanced,step-8000,fas,6.538425922393799,691.1977224333647
4,دانیوس گفت، «در حال حاضر هیچ کاری نمی‌کنیم. من به نزدیکترین همکار وی ایمیل فرستاده‌ام و با وی تماس گرفته‌ام و پاسخ‌های بسیار صمیمانه‌ای دریافت کردم. فعلاً مطمئناً تا این حد کافی است.»,BeetleLM/beetlelm_fas-fra_balanced,step-8000,fas,7.484751224517822,1780.6811248769
5,پیش از این، مدیرعامل رینگ، جیمی‌ سیمینوف، خاطر نشان کرد كه شركت هنگامی‌ شروع به کار می‌کند كه صدای زنگ در وی از گاراژ وی شنیده نشود.,BeetleLM/beetlelm_fas-fra_balanced,step-8000,fas,7.478919982910156,1770.3277588383794
6,وی گفت که یک زنگ درب WiFi ساخته است.,BeetleLM/beetlelm_fas-fra_balanced,step-8000,fas,7.194893836975098,1332.6088442912094
7,سیمینوف گفت پس از ظاهر شدن وی در سال 2013 در یک قسمت از نمایش Shark Tank، فروش افزایش یافت، جایی که نشست نمایش از پرداخت بودجه برای راه‌اندازی خودداری کرده بود.,BeetleLM/beetlelm_fas-fra_balanced,step-8000,fas,6.104862689971924,448.0311180661884
8,در اواخر سال 2017، سیمینوف در کانال تلویزیونی فروشگاهی QVC ظاهر شد.,BeetleLM/beetlelm_fas-fra_balanced,step-8000,fas,6.4088544845581055,607.1977281512934
9,رینگ همچنین یک دعوای قانونی را با شرکت امنیتی رقیب، شرکت ADT، حل و فصل کرد.,BeetleLM/beetlelm_fas-fra_balanced,step-8000,fas,5.919149875640869,372.0952521415643
10,با اینکه بنظر می‌رسد یک واکسن تجربی بتواند میزان مرگ و میر ایبولا را کاهش دهد، تا به امروز هیچ دارویی نبوده که به وضوح ثابت شود برای درمان عفونت کنونی است.,BeetleLM/beetlelm_fas-fra_balanced,step-8000,fas,6.594453811645508,731.0294978309208
11,شربت حاوی پادتن ZMapp، در ابتدا انتظاراتی را در این زمینه ایجاد کرد، اما مطالعات رسمی‌ نشان می‌دهد که مفید بودن این شربت در پیشگیری از مرگ کمتر از حد انتظار است.,BeetleLM/beetlelm_fas-fra_balanced,step-8000,fas,6.548469066619873,698.174496580546
12,در آزمایش PALM، ZMapp به عنوان شاهد عمل می‌کرد، به این معنی که دانشمندان از آن به عنوان یک مرجع استفاده می‌کردند و سه روش درمانی دیگر را با آن مقایسه می‌کردند.,BeetleLM/beetlelm_fas-fra_balanced,step-8000,fas,6.475353717803955,648.9487317389072
13,هیأت ژیمناستیک ایالات متحده آمریکا از نامه کمیته المپیک ایالات متحده حمایت می‌کند و نیاز قاطع خانواده المپیک به ترویج محیطی امن برای تمام ورزشکارهای ما را می‌پذیرد.,BeetleLM/beetlelm_fas-fra_balanced,step-8000,fas,7.294576168060303,1472.2927639414581
14,ما با بیانیه USOC موافقیم که با پیشروی و تغییرات معنادار در سازمان ما به جای لغو اعتبار، بهتر می‌توان در خدمت منافع ورزشکاران و باشگاه‌های ما و ورزش آنها بود.,BeetleLM/beetlelm_fas-fra_balanced,step-8000,fas,6.997867107391357,1094.2966503166713
15,هیأت ژیمناستیک ایالت متحده آمریکا از یک تحقیق مستقل حمایت می‌کند که احتمالاً بتواند روشن سازد که موضوع سوء استفاده از بخشی که بازماندگان لری نصار با جسارت بیان کرده بودند چطور مدت‌ها کشف‌نشده باقی ماند و ضمناً تغییرات لازم و مناسب را دربر گیرد.,BeetleLM/beetlelm_fas-fra_balanced,step-8000,fas,7.090847969055176,1200.9257168145493
16,هیأت ژیمناستیک ایالات متحده آمریکا و USOC نیز همان هدف را دارد - امن نمودن ورزش ژیمناستیک و سایر ورزش‌ها تا حد ممکن تا رؤیاهای خود را در محیطی امن، مثبت و توانمند دنبال کنند.,BeetleLM/beetlelm_fas-fra_balanced,step-8000,fas,6.808403015136719,905.4237038043858
17,در طی دهه 1960، برژینسکی برای جان اف کندی به عنوان مشاور و سپس دولت لیندون بی جانسون کار می‌کرد.,BeetleLM/beetlelm_fas-fra_balanced,step-8000,fas,7.436105728149414,1696.1321435563755
18,در طی تصمیم‌گیری برای جانشین در سال 1976، او مشاور کارتر در سیاست خارجه شد، سپس با جانشین شدن بجای هنری کیسینجر به عنوان مشاور امنیت ملی (NSA) از سال 1977 تا 1981 خدمت کرد.,BeetleLM/beetlelm_fas-fra_balanced,step-8000,fas,6.031585216522217,416.3745503187292
19,او به عنوان مشاور امنیت ملی در امور سیاسی جهان به کاربر مشاوره داد؛ اموری مثل پیمان کمپ دیوید، 1978؛ عادی کردن روابط ایالت متحده و چین در اواخر دهه هفتاد؛ انقلاب ایران که منجر به بحران گروگانگیری در ایران شد، 1979؛ و حمله شوری به افغانستان، 1979.,BeetleLM/beetlelm_fas-fra_balanced,step-8000,fas,6.373546600341797,586.1329261821382
20,این فیلم با بازی رایان گاسلینگ و اما استون در تمام دسته‌بندی‌های اصلی کاندید شد.,BeetleLM/beetlelm_fas-fra_balanced,step-8000,fas,7.735146999359131,2287.3449178113015
21,گوسلینگ و استون به ترتیب نامزد بهترین بازیگر مرد و بازیگر زن شدند.,BeetleLM/beetlelm_fas-fra_balanced,step-8000,fas,6.724478244781494,832.5374824304183
22,نامزدهای دیگر شامل بهترین تصویر، کارگردان، فیلمبرداری، طراحی صحنه و لباس، ویرایش فیلم، امتیاز اصلی، طراحی تولید، ویرایش صدا، ترکیب صدا و فیلمنامه اصلی است.,BeetleLM/beetlelm_fas-fra_balanced,step-8000,fas,6.232685565948486,509.12092700606354
23,دو ترانه از این فیلم با نام‌های «شنوایی» (احمق‌هایی که رویا می‌بینند) و «شهر ستارگان»، نامزد دریافت بهترین آهنگ اصلی شدند. نامزدههای استودیوی Lionsgate 26 بیشتر از هر استودیوی دیگری بود.,BeetleLM/beetlelm_fas-fra_balanced,step-8000,fas,7.576077461242676,1950.9612157142756
24,اواخر روز یکشنبه،‌ رئیس جمهور ایالات متحده، دونالد ترامپ در بیانیه‌ای از طریق دبیر مطبوعاتی کاخ سفید اعلام کرد نیروهای ایالات متحده از سوریه خارج خواهند شد.,BeetleLM/beetlelm_fas-fra_balanced,step-8000,fas,4.7225518226623535,112.45485167636312
25,این اعلامیه پس از مکالمه تلفنی ترامپ با رئیس‌جمهور ترکیه،‌ رجب طیب اردوغان، منتشر شد.,BeetleLM/beetlelm_fas-fra_balanced,step-8000,fas,6.200826168060303,493.1563028229041
26,ترکیه همچنین محافظت از جنگجویان اسیر داعش را بر عهده خواهد گرفت، که به گفته این بیانیه، کشور‌های اروپایی از بازگشت آنها به وطن خود جلوگیری کرده‌اند.,BeetleLM/beetlelm_fas-fra_balanced,step-8000,fas,5.775875091552734,322.426463974771
27,این امر نه تنها تأیید می‌کند که حداقل برخی از دایناسورها دارای پر بودند، نظریه‌ای که قبلاً در محافل علمی شایع شده است، بلکه اطلاعاتی را در اختیار قرار می‌دهد که فسیل‌ها به طور کلی نمی‌توانند این اطلاعات را بدهند، مواردی از قبیل رنگ و چیدمان سه‌بعدی.,BeetleLM/beetlelm_fas-fra_balanced,step-8000,fas,6.9732136726379395,1067.6483154460943
28,دانشمندان می گویند که پرهای زینتی این حیوان در بالای به رنگ شاه بلوط قهوه ای و در پایین به رنگ کاروتنوئید بود.,BeetleLM/beetlelm_fas-fra_balanced,step-8000,fas,6.7843170166015625,883.8762079725982
29,این یافته همچنین شناخت ما را در مورد تکامل پرها در پرندگان بیشتر می‌کند.,BeetleLM/beetlelm_fas-fra_balanced,step-8000,fas,6.983229637145996,1078.3955753208863
30,از آنجا که پرهای این دایناسور میله‌ای که بخوبی توسعه یافته باشد ندارند که به آن ساقه گفته می‌شود، اما سایر ویژگی‌های پرها را دارند- ریش و موهای ریز - لذا محققان چنین استدلال می‌کنند که پیشرفت تکاملی ساقه احتمالاً دیرتر از سایر ویژگی‌ها بوده است.,BeetleLM/beetlelm_fas-fra_balanced,step-8000,fas,7.753849506378174,2330.5265458637996
31,ساختار پرها نشان می‌دهد که در پرواز مورد استفاده قرار نمی‌گرفتند بلکه برای تنظیم دما یا نمایش استفاده می‌شدند. محققان معتقدند كه حتی اگر این دم یک دایناسور جوان باشد، باز هم این نمونه نشان دهنده پر حیوان بالغ است نه کرک یک جوجه.,BeetleLM/beetlelm_fas-fra_balanced,step-8000,fas,6.944046974182129,1036.9582781321733
32,محققان اظهار داشتند كه حتی اگر این دم یک دایناسور جوان باشد، باز هم این نمونه نشان دهنده پر حیوان بالغ است نه کرک یک جوجه.,BeetleLM/beetlelm_fas-fra_balanced,step-8000,fas,6.843092918395996,937.383907705517
33,صبح دیروز یک خودروی بمب‌گذاری شده در مرکز پلیس شهر قاضی عنتب ترکیه منفجر شد و منجر به کشته شدن دو افسر پلیس و زخمی شدن بیش از بیست نفر دیگر شد.,BeetleLM/beetlelm_fas-fra_balanced,step-8000,fas,6.123494625091553,456.4570568082766
34,دفتر فرماندار گفت که نوزده نفر از افراد مجروح از افسران پلیس بودند.,BeetleLM/beetlelm_fas-fra_balanced,step-8000,fas,6.728579521179199,835.9589601743698
35,پلیس گفت این گمان وجود دارد که ستیزه‌جویان داعش (ISIL) مسئول این حمله باشند.,BeetleLM/beetlelm_fas-fra_balanced,step-8000,fas,6.313427925109863,551.9336970979587
36,آنها دریافتند که خورشید بر اساس همان اصول اساسی کار می‌کند که سایر ستارگان عمل می‌کنند: مشخص شد که فعالیت تمامی ستاره‌ها در سیستم فقط تحت تاثیر درخشندگی و چرخش آنها قرار دارد نه چیز دیگری.,BeetleLM/beetlelm_fas-fra_balanced,step-8000,fas,7.427958965301514,1682.3702906143922
37,از تابندگی و دَوران برای تعیین عدد روسبی ستاره استفاده می‌شود که مرتبط با جریان پلاسما است.,BeetleLM/beetlelm_fas-fra_balanced,step-8000,fas,7.763257026672363,2352.554473268847
38,هر چه عدد روسبی کوچکتر باشد، ستاره از نظر وارونگی مغناطیسی فعالیت کمتری دارد.,BeetleLM/beetlelm_fas-fra_balanced,step-8000,fas,6.386770248413086,593.9352153890857
39,ایوازاکی در طی سفر خود، در بسیاری از موقعیت‌ها دچار دردسر شد.,BeetleLM/beetlelm_fas-fra_balanced,step-8000,fas,6.563345909118652,708.6387733053708
40,او مورد حمله دزدان دریایی قرار گرفت، یک سگ هار در تبت به او حمله کرد، از ازدواج در نپال فرار کرد و در هندوستان دستگیر شد.,BeetleLM/beetlelm_fas-fra_balanced,step-8000,fas,5.825774669647217,338.92358522214465
41,سری 802.11n استاندارد در هر دو فرکانس 2.4 گیگاهرتز و 5.0 گیگاهرتز کار می‌کند.,BeetleLM/beetlelm_fas-fra_balanced,step-8000,fas,7.280339241027832,1451.4803432860087
42,این امر سبب می‌شود که با سری‌های قبلی 802.11a، 802.11b و 802.11g سازگاری داشته باشد، به شرط اینکه ایستگاه پایه مجهز به رادیوهای دوگانه باشد.,BeetleLM/beetlelm_fas-fra_balanced,step-8000,fas,6.813748359680176,910.2764637412555
43,سرعت 802.11n بسیار سریعتر از سیستم‌های قبلی است که حداکثر خروجی تئوری آنها 600Mbit/s بود.,BeetleLM/beetlelm_fas-fra_balanced,step-8000,fas,7.316020965576172,1504.2067556539464
44,دووال، که با داشتن دو فرزند بزرگسال، ازدواج کرده است، تأثیر زیادی بر میلر که داستان به وی مربوط می‌شود نگذاشت.,BeetleLM/beetlelm_fas-fra_balanced,step-8000,fas,6.224400043487549,504.9200215110506
45,هنگامی‌ که از میلر خواسته شد اظهارنظر کند گفت: «مایک در زمان دادرسی زیاد صحبت می‌کرد ... من داشتم آماده می‌شدم بنابراین واقعاً نمی‌شنیدم که چه می‌گوید.»,BeetleLM/beetlelm_fas-fra_balanced,step-8000,fas,8.481684684753418,4825.572621456203
46,هو گفت، «ما تلاش خواهیم کرد تا سال 2020 میزان انتشار دی اکسید کربن در هر واحد از تولید ناخالص داخلی را در حاشیه‌ای قابل توجه از سطح 2005 کاهش دهیم.»,BeetleLM/beetlelm_fas-fra_balanced,step-8000,fas,5.345836639404297,209.73328234470893
47,او رقمی برای این کاهش‌ها تعیین نکرد و گفت که بر اساس بازده اقتصادی چین صورت خواهد گرفت.,BeetleLM/beetlelm_fas-fra_balanced,step-8000,fas,6.010831356048584,407.8222248525743
48,او کشورهای در حال توسعه را ترغیب کرد «از مسیر قدیمی یعنی ابتدا آلوده کردن محیط زیست و سپس سعی در پاکسازی آن دوری کنند.»,BeetleLM/beetlelm_fas-fra_balanced,step-8000,fas,6.663815021514893,783.5344431967443
49,او افزود: «با وجود این نباید از آنها خواست تعهداتی را بپریرند که از مرحله توسعه، مسئولیت‌پذیری و توانمندی فراتر بروند.»,BeetleLM/beetlelm_fas-fra_balanced,step-8000,fas,6.792786598205566,891.3940612394221
50,امروز گروه تحقیقاتی عراق گزارش خود را رأس ساعت 12:00 به وقت گرینویچ ارائه داد.,BeetleLM/beetlelm_fas-fra_balanced,step-8000,fas,6.507019996643066,669.8273527008156
51,این هشدار می دهد که هیچ کس نمی تواند تضمین کند که هرگونه اقدام در عراق در این مرحله، جنگ فرقه ای، خشونت رو به رشد و یا خیزش به سمت هرج و مرج را متوقف خواهد کرد.,BeetleLM/beetlelm_fas-fra_balanced,step-8000,fas,5.049680233001709,155.97258162713135
52,این گزارش با لایحه‌ای برای مذاکره آزادانه و تشکیل مجمعی در ایالات متحده درباره سیاست مربوط به خاورمیانه آغاز می‌شود.,BeetleLM/beetlelm_fas-fra_balanced,step-8000,fas,7.080892562866211,1189.029328444294
53,این گزارش بسیار حیاتی، تقریباً در مورد تمام جنبه‌های سیاست کنونی اجرایی در قبال عراق است و خواستار تغییر جهت فوری است.,BeetleLM/beetlelm_fas-fra_balanced,step-8000,fas,6.710285186767578,820.8046887111525
54,اولین مورد از 78 توصیه او بدین ترتیب است که ابتکار عمل دیپلماتیک جدید باید پیش از پایان سال جاری اتفاق بیفتد تا مرزهای عراق در برابر مداخلات خصمانه امن شود و روابط دیپلماتیک با همسایگانش از سر گرفته شود.,BeetleLM/beetlelm_fas-fra_balanced,step-8000,fas,6.128489017486572,458.7424848730933
55,سناتور فعلی و بانوی اول آرژانتین، کریستینا الیزابت فرناندز د کیرشنر، عصر روز گذشته کاندیداتوری خود برای ریاست جمهوری را در لا پلاتا، شهری در 50 کیلومتری (31 مایل) بوینوس آیرس اعلام کرد.,BeetleLM/beetlelm_fas-fra_balanced,step-8000,fas,6.639503479003906,764.7152015870103
56,خانم کیرشنر قصد خود برای حضور در انتخابات ریاست جمهوری را در تئاتر آرژانتین اعلام کرد، همان جاییکه او از آنجا به عنوان نماینده استان بوئنوس آیرس کارزار 2005 خود را برای مجلس سنا آغاز کرده بود.,BeetleLM/beetlelm_fas-fra_balanced,step-8000,fas,5.681801795959473,293.47774083301795
57,این مذاکره با مشاجره پیرامون صرف هزینه برای امدادرسانی و بازسازی به دنبال طوفان کاترینا آغاز شد؛ که در آن برخی از محافظه‌کاران مالی به شوخی آن را «معامله اورلئان جدید بوش» نام نهادند.,BeetleLM/beetlelm_fas-fra_balanced,step-8000,fas,7.122960090637207,1240.1158611397614
58,انتقاد لیبرال از تلاش برای بازسازی بر اعطای قراردادهای بازسازی به خودی‌های واشنگتن متمرکز شده است.,BeetleLM/beetlelm_fas-fra_balanced,step-8000,fas,6.491000175476074,659.1823316206163
59,بیش از چهار میلیون نفر برای حضور در مراسم خاکسپاری به رم رفتند.,BeetleLM/beetlelm_fas-fra_balanced,step-8000,fas,4.9367852210998535,139.32164058653746
60,تعداد افراد حاضر آنقدر زیاد بود که امکان دسترسی همه به مراسم خاکسپاری در میدان سنت پیتر ممکن نبود.,BeetleLM/beetlelm_fas-fra_balanced,step-8000,fas,7.124642848968506,1242.204433225062
61,چند نمایشگر تلویزیونی بزرگ در مکان‌های مختلف شهر رم نصب شدند تا مردم بتوانند مراسم را مشاهده کنند.,BeetleLM/beetlelm_fas-fra_balanced,step-8000,fas,6.7705278396606445,871.7719283667257
62,در بسیاری از شهرهای ایتالیا و سایر نقاط جهان، به‌خصوص در لهستان، مجموعه‌های مشابهی ساخته شده که تعداد زیادی از مردم از آن بازدید کرده‌اند.,BeetleLM/beetlelm_fas-fra_balanced,step-8000,fas,5.890881061553955,361.7238449888912
63,مورخان از سیاست‌های گذشته FBI و تمرکز منابع روی مواردی که به آسانی قابل حل هستند، به‌خصوص موارد مربوط به سرقت خودرو، با هدف بالا بردن میزان موفقیت آژانس، انتقاد کردند.,BeetleLM/beetlelm_fas-fra_balanced,step-8000,fas,6.565854549407959,710.4187247781613
64,کنگره بودجه ابتکار قباحت را در سال مالی 2005 در نظر گرفت و مشخص کرد که FBI باید 10 مامور خود را به پورنوگرافی بزرگسالان اختصاص دهد.,BeetleLM/beetlelm_fas-fra_balanced,step-8000,fas,6.20472526550293,495.0829208970014
65,رابین اوتاپا بالاترین امتیاز را در اینینگ‌ها بدست آورد و 70 امتیاز را تنها با 41 پرتاب کسب کرد او با ضربه به 11 چهارتایی و 2 شش‌تایی این کار را کرد.,BeetleLM/beetlelm_fas-fra_balanced,step-8000,fas,6.852015018463135,945.784761632786
66,ضربه‌زن‌های میانه، Sachin Tendulkar و Rahul Dravid نمایش خوبی از خود نشان دادند و در کسب صد امتیاز همکاری داشتند.,BeetleLM/beetlelm_fas-fra_balanced,step-8000,fas,7.498752593994141,1805.7884575813607
67,اما هندوستان پس از دست دادن چوگان کاپیتان، تنها 36 رکورد را انجام داد و 7 چوگان را از دست داد تا مراحل را تمام کند.,BeetleLM/beetlelm_fas-fra_balanced,step-8000,fas,5.91562557220459,370.7861836979891
68,رئیس جمهور ایالات متحده، جرج دابلیو بوش، صبح روز 16 نوامبر برای شروع سفر هفتگی خود در آسیا، وارد سنگاپور شد.,BeetleLM/beetlelm_fas-fra_balanced,step-8000,fas,5.33935546875,208.37836063221988
69,وی مورد استقبال معاون نخست وزیر سنگاپور، وونگ کان سنگ، قرار گرفت و با نخست وزیر سنگاپور، لی هسین لوونگ، بحث در مورد تجارت و تروریسم را آغاز کرد.,BeetleLM/beetlelm_fas-fra_balanced,step-8000,fas,5.833513259887695,341.55655055116017
70,بوش پس از یک هفته باخت در انتخابات میان دوره‌ای، از گسترش تجارت در آسیا با مخاطبان صحبت کرد.,BeetleLM/beetlelm_fas-fra_balanced,step-8000,fas,5.593250274658203,268.6072497646883
71,استیون هارپر، نخست وزیر، پس از جلسه 25 دقیقه‌ای در روز سه‌شنبه با جک لیتون، رهبر حزب دموکراتیک جدید در دفتر نخست وزیری موفقت کرد تا قبل از قرائت دوم، «قانون هوای پاک» را برای بررسی به کمیته همه‌جانبه ارسال کند.,BeetleLM/beetlelm_fas-fra_balanced,step-8000,fas,6.299685478210449,544.4006573269972
72,لیتون طی جلسه‌ای که با نخست وزیر داشت، خواستار تغییراتی در لایحه زیست‌محیطی شد و «بازنویسی تمام و کمال» لایحه زیست محیطی حزب محافظه کار را درخواست کرد.,BeetleLM/beetlelm_fas-fra_balanced,step-8000,fas,6.670219898223877,788.5689903186884
73,از آن موقع دولت فدرال وارد شده تا بودجه بیمارستان Mersey در دوونپورت تاسمانی را تقبل کند، دولت ایالتی و برخی از نمایندگان پارلمان این اقدام را نقد کرده و آن را شیرین‌کاری قبل از انتخابات فدرال که در نوامبر برگزار می‌شود می‌دانند.,BeetleLM/beetlelm_fas-fra_balanced,step-8000,fas,6.719426155090332,828.3420352093294
74,اما نخست وزیر جان هاوارد گفت که این اقدام فقط برای محافظت از ساختمان‌های بیمارستان در مقابل تخریب توسط دولت تاسمانی و بخشیدن 45 میلیون دلار استرالیا اضافی است.,BeetleLM/beetlelm_fas-fra_balanced,step-8000,fas,6.549943923950195,699.204964064143
75,مطابق آخرین خبرنامه، قرائت سطح دریا حاکی از ایجاد یک سونامی بود. فعالیت هایی مربوط به سونامی قطعی در نزدیکی پاگو پاگو و نیوئه ثبت شده بود.,BeetleLM/beetlelm_fas-fra_balanced,step-8000,fas,6.180372714996338,483.17200824996564
